timestamp,text,like_count,reply_count,author,trailer_id,sentiment_score,datetime,used_for_model,used_for_visualization
2016-12-04T03:12:04,i!!!!!!am!!!!!groooooot!!!!!!so cute!!!,0,0,개미마을,2cv2ueYnKjg,0.9765625,2016-12-04 03:12:04,True,True
2016-12-04T03:12:05,I want a mini groot sidekick,0,0,MrMadnessHero,2cv2ueYnKjg,0.0,2016-12-04 03:12:05,True,True
2016-12-04T03:12:08,i love this scene i am groot  i am groot i am groot,0,0,Waseem Lander,2cv2ueYnKjg,0.5,2016-12-04 03:12:08,True,True
2016-12-04T03:12:29,looks amazing,0,0,Viral Patangiya,2cv2ueYnKjg,0.6000000000000001,2016-12-04 03:12:29,True,True
2016-12-04T03:12:30,1:50 XD best part,0,0,PLR68,2cv2ueYnKjg,1.0,2016-12-04 03:12:30,True,True
2016-12-04T03:12:33,The end killed me omg,0,0,Anna Dirrim,2cv2ueYnKjg,-0.2,2016-12-04 03:12:33,True,True
2016-12-04T03:12:47,Looks like deadpool's got some competition,2,0,death by cat,2cv2ueYnKjg,0.0,2016-12-04 03:12:47,True,True
2016-12-04T03:13:15,Honestly this looks bad,0,0,juansebastian bosegovia,2cv2ueYnKjg,-0.04999999999999993,2016-12-04 03:13:15,True,True
2016-12-04T03:13:18,This new Rouge One trailer looks great,1,0,patar365,2cv2ueYnKjg,0.4681818181818182,2016-12-04 03:13:18,True,True
2016-12-04T03:13:23,i thought howarld duck was going to be in this movie,1,0,InfernoNarwhals,2cv2ueYnKjg,0.0,2016-12-04 03:13:23,True,True
2016-12-04T03:15:01,lol,1,0,Captain Roach 17,2cv2ueYnKjg,0.8,2016-12-04 03:15:01,True,True
2016-12-04T03:15:02,LOOOOOV GROOOOOOOT !!!,0,0,Jasmine Roy,2cv2ueYnKjg,0.0,2016-12-04 03:15:02,True,True
2016-12-04T03:15:27,OMG BABY GROOT!!!,0,0,Toníto Menjii,2cv2ueYnKjg,0.0,2016-12-04 03:15:27,True,True
2016-12-04T03:16:19,I am groot,0,0,Adrian Aceved,2cv2ueYnKjg,0.0,2016-12-04 03:16:19,True,True
2016-12-04T03:16:20,Do me! Do me next!,0,0,Ethan Bonn,2cv2ueYnKjg,0.0,2016-12-04 03:16:20,True,True
2016-12-04T03:16:30,OMG!I love baby groot!!!,0,0,HieuNguyen Van,2cv2ueYnKjg,0.9765625,2016-12-04 03:16:30,True,True
2016-12-04T03:17:09,"Progression of fan new to this:  Love Rocket, fall for Groot, and if you're like me...transition to Drax on his dialogue alone.",0,0,Tigerman1138,2cv2ueYnKjg,0.3181818181818182,2016-12-04 03:17:09,True,True
2016-12-04T03:17:35,OMG.. baby groot so cute.. I'm so gonna watch this just for baby groot <3,0,0,Dear Me,2cv2ueYnKjg,0.75,2016-12-04 03:17:35,True,True
2016-12-04T03:17:40,Baby groot it's soo cute,1,0,Shirel Calvario,2cv2ueYnKjg,0.5,2016-12-04 03:17:40,True,True
2016-12-04T03:17:43,realese date?,1,0,PLR68,2cv2ueYnKjg,0.0,2016-12-04 03:17:43,True,True
2016-12-04T03:17:54,"OMG, I have to send a link of this to everybody I know. This is gonna be so good!!",1,0,Jason Keene,2cv2ueYnKjg,1.0,2016-12-04 03:17:54,True,True
2016-12-04T03:17:58,That ending doe,0,0,LDH100,2cv2ueYnKjg,0.0,2016-12-04 03:17:58,True,True
2016-12-04T03:18:00,oml baby Groot is going to make me shit my self because I laugh to much and drax,0,0,Limon Luis,2cv2ueYnKjg,0.09999999999999999,2016-12-04 03:18:00,True,True
2016-12-04T03:18:04,"Bravo Marvel, Bravo.",0,0,Hartcore,2cv2ueYnKjg,0.0,2016-12-04 03:18:04,True,True
2016-12-04T03:19:10,take a shot for every baby groot comment you see.....,0,0,Apostle Cat,2cv2ueYnKjg,0.0,2016-12-04 03:19:10,True,True
2016-12-04T03:19:21,"If I had a choice between million dollars and baby groot, I choose baby groot",1721,47,NEON SQUID,2cv2ueYnKjg,0.0,2016-12-04 03:19:21,True,True
2016-12-04T03:19:32,Baby griot is fucking adorable. And drax unfiltered honesty is just hilarious. My eyes won't stop weeping from joy,1,0,Ethio King,2cv2ueYnKjg,0.6,2016-12-04 03:19:32,True,True
2016-12-04T03:19:36,"Omg, those eyes! Those adorable baby groot eyes! I'm dying of cuteness overload.",0,0,Lunar Rose,2cv2ueYnKjg,0.625,2016-12-04 03:19:36,True,True
2016-12-04T03:19:40,Baby Groot made this trailer,0,0,Simone S.,2cv2ueYnKjg,0.0,2016-12-04 03:19:40,True,True
2016-12-04T03:19:44,XD XD,0,0,Wilson Weng,2cv2ueYnKjg,0.0,2016-12-04 03:19:44,True,True
2016-12-04T03:19:47,I'm so glad this is still awesome,0,0,Stew F,2cv2ueYnKjg,0.75,2016-12-04 03:19:47,True,True
2016-12-04T03:19:50,baby groot going in,1,0,Grizz,2cv2ueYnKjg,0.0,2016-12-04 03:19:50,True,True
2016-12-04T03:20:18,Baby Groot is Sackboy!   Also those critters from the movie 9.  Those things are a mix of minions and Sackboy anyway!,0,0,Steve Rotters,2cv2ueYnKjg,0.0,2016-12-04 03:20:18,True,True
2016-12-04T03:20:32,that last part had me DYING!!!,329,11,Quantay Peoples,2cv2ueYnKjg,0.0,2016-12-04 03:20:32,True,True
2016-12-04T03:20:44,Looks like infinite warfare to me,0,0,Kubz Mango,2cv2ueYnKjg,0.0,2016-12-04 03:20:44,True,True
2016-12-04T03:20:58,This movie...I need to see it.,0,0,Alex Sung,2cv2ueYnKjg,0.0,2016-12-04 03:20:58,True,True
2016-12-04T03:22:14,Babby groot It's beatiful,0,0,Mía Ortigoza,2cv2ueYnKjg,0.0,2016-12-04 03:22:14,True,True
2016-12-04T03:22:38,this movie is going to be so badass!!!,0,0,Cathrine Cripps,2cv2ueYnKjg,0.0,2016-12-04 03:22:38,True,True
2016-12-04T03:22:55,"I hope there's a moment like this in the film:  Mantis: ""I can feel so much love and compassion within in you. How do you stay so positive after everything you've been through?  ...""I am Groot""",1,0,Ian McIntyre,2cv2ueYnKjg,0.36363636363636365,2016-12-04 03:22:55,True,True
2016-12-04T03:23:30,yep thats marvel... looks good n funny though,0,0,Tiki80,2cv2ueYnKjg,0.475,2016-12-04 03:23:30,True,True
2016-12-04T03:23:34,No..sexual love..!!😍😂😂😂😂😂 #LMAO,0,0,Nikhil Saini,2cv2ueYnKjg,0.6,2016-12-04 03:23:34,True,True
2016-12-04T03:24:02,aswm dude,0,0,Shourya Singh,2cv2ueYnKjg,0.0,2016-12-04 03:24:02,True,True
2016-12-04T03:24:27,"ROFL, I think I shat my pants through pure laughter watching this. This movie will be epic",0,0,Mitchell Bewick,2cv2ueYnKjg,0.37142857142857144,2016-12-04 03:24:27,True,True
2016-12-04T03:25:48,Groot is so cute,0,0,House Slides,2cv2ueYnKjg,0.5,2016-12-04 03:25:48,True,True
2016-12-04T03:26:19,this like for baby groot,0,0,NAVNEET SHARMA,2cv2ueYnKjg,0.0,2016-12-04 03:26:19,True,True
2016-12-04T03:27:37,Baby groot rage,0,0,Sir Pugsalot,2cv2ueYnKjg,0.0,2016-12-04 03:27:37,True,True
2016-12-04T03:27:57,This movie has a sequel I am Grootified now,0,0,Lord Goodra The Thiccest,2cv2ueYnKjg,0.0,2016-12-04 03:27:57,True,True
2016-12-04T03:28:11,"I've watched this trailer over and over just because of Baby Groot, too damn cute 😁",0,0,marie sia,2cv2ueYnKjg,0.5,2016-12-04 03:28:11,True,True
2016-12-04T03:28:15,kkk to vendo que vai ser bem engraçado,0,0,Efraim Mota,2cv2ueYnKjg,0.0,2016-12-04 03:28:15,True,True
2016-12-04T03:28:26,cool,0,0,MemoFT,2cv2ueYnKjg,0.35,2016-12-04 03:28:26,True,True
2016-12-04T03:28:33,That angry Baby  Groot!!! XD killed me!!,590,14,Anime Clime,2cv2ueYnKjg,-0.64453125,2016-12-04 03:28:33,True,True
2016-12-04T03:28:44,this is so gonna get you a copyright strike,0,1,Eugenio Lucio,2cv2ueYnKjg,0.0,2016-12-04 03:28:44,True,True
2016-12-04T03:28:53,drax and star lord are a legit example of every friend in the galaxy!,0,0,Isaiah Ibarra,2cv2ueYnKjg,0.0,2016-12-04 03:28:53,True,True
2016-12-04T03:28:59,come for baby Groot. stay for Drax being hilariously awkward,0,0,Gilberto Tabares,2cv2ueYnKjg,-0.6,2016-12-04 03:28:59,True,True
2016-12-04T03:29:08,Haha u must be so embarrassed fucking awesome,0,0,I'm no Longer A Scared of the dark,2cv2ueYnKjg,0.6,2016-12-04 03:29:08,True,True
2016-12-04T03:29:16,This. Is. Fucking. Hilarious.,0,0,Typical Destroyah,2cv2ueYnKjg,0.5,2016-12-04 03:29:16,True,True
2016-12-04T03:29:29,¿Iron man?,0,0,RipBoyXX s,2cv2ueYnKjg,0.0,2016-12-04 03:29:29,True,True
2016-12-04T03:29:36,"""Do me! Do me! Do me!""...lmao...Batista is a awesome Drax",2,0,workinghoustonian,2cv2ueYnKjg,1.0,2016-12-04 03:29:36,True,True
2016-12-04T03:30:52,this movie should be called Guadias of The Comedy (:,0,0,cvelizh,2cv2ueYnKjg,0.0,2016-12-04 03:30:52,True,True
2016-12-04T03:31:04,Everyone deserves at least one friend like Drax.,1,0,sleepycthulhu1,2cv2ueYnKjg,-0.3,2016-12-04 03:31:04,True,True
2016-12-04T03:31:06,Let me tell you a joke        DC,4,1,YC Y,2cv2ueYnKjg,0.0,2016-12-04 03:31:06,True,True
2016-12-04T03:31:08,baBY GROOT KILLS ME AH,0,0,Mehgen Vargas,2cv2ueYnKjg,0.0,2016-12-04 03:31:08,True,True
2016-12-04T03:31:45,Omg little tiny groot is so cute,0,0,Reynaldo Gonzalez,2cv2ueYnKjg,0.10416666666666667,2016-12-04 03:31:45,True,True
2016-12-04T03:32:01,oh my god baby groot!!!!!!!! funny ass fuckkkk,0,0,theodore hasian,2cv2ueYnKjg,0.25,2016-12-04 03:32:01,True,True
2016-12-04T03:32:07,THIS IS GONNA BE THE BEEEESSSTTT!!!!!,0,0,Tariq Mac,2cv2ueYnKjg,0.0,2016-12-04 03:32:07,True,True
2016-12-04T03:32:13,Can't wait,0,0,Lps Swag,2cv2ueYnKjg,0.0,2016-12-04 03:32:13,True,True
2016-12-04T03:33:04,it was THIS moment Rocket knew..... he got Destroied.....,1,0,SM Prime 15,2cv2ueYnKjg,0.0,2016-12-04 03:33:04,True,True
2016-12-04T03:33:14,mate that trailer was amaziinng XDXDXD baby groot is soooooo cute and drax tho XDXDXDXXD,0,0,Bleach,2cv2ueYnKjg,0.5,2016-12-04 03:33:14,True,True
2016-12-04T03:33:17,I'm groot,0,0,Heathcliff Happy,2cv2ueYnKjg,0.0,2016-12-04 03:33:17,True,True
2016-12-04T03:33:25,"OH MAH GAWD YES!!! ALL OF THIS IN MY FACE, YES!",0,0,Thomas Joseph Cullinan,2cv2ueYnKjg,0.0,2016-12-04 03:33:25,True,True
2016-12-04T03:33:48,Ohh Man!!!! Can't wait!!!!,0,0,Sukhish Puri,2cv2ueYnKjg,0.0,2016-12-04 03:33:48,True,True
2016-12-04T03:33:52,1:42 that one scene just made me want to see it......  bravo Marvel,1,0,ABD,2cv2ueYnKjg,0.0,2016-12-04 03:33:52,True,True
2016-12-04T03:34:32,The Part With Drax Was just Genius!,0,0,Salvador Carrillo,2cv2ueYnKjg,0.0,2016-12-04 03:34:32,True,True
2016-12-04T03:34:47,Jajajaja xd star lord,0,0,Masterprodvv,2cv2ueYnKjg,0.0,2016-12-04 03:34:47,True,True
2016-12-04T03:35:15,Since everything is building up to the infinity war. Am I the only one wishing for Adam Warlock? My wishful thinking would also like fox to give back the FF property so we could get Silver Surfer and Galactus. PLEASE OH PLEASE MAKE A DEAL!!!,0,0,Stock Lock,2cv2ueYnKjg,0.0,2016-12-04 03:35:15,True,True
2016-12-04T03:36:26,Nooooooooooooooooooooooooo 😂😂😂😂😂😂😂😂😂😂😂😂😂😂😂😂😂😂😂😂😂😂,0,0,R oakenshield,2cv2ueYnKjg,0.0,2016-12-04 03:36:26,True,True
2016-12-04T03:36:27,"I can't wait for this movie, but does anyone else think that they showed a little to much?",2,0,max rowe,2cv2ueYnKjg,0.0062500000000000056,2016-12-04 03:36:27,True,True
2016-12-04T03:36:40,baby groot is so cyute i cry,1,0,annabelleshania,2cv2ueYnKjg,0.0,2016-12-04 03:36:40,True,True
2016-12-04T03:36:50,thats dope i just watched the first one too,0,0,Josh Robison,2cv2ueYnKjg,0.25,2016-12-04 03:36:50,True,True
2016-12-04T03:36:54,Baby groom is so cute!😭😭😭😭,0,0,john L,2cv2ueYnKjg,0.0,2016-12-04 03:36:54,True,True
2016-12-04T03:37:03,"Novia: ""Mi amor, que haces con tu dedo encima de mi pezón""  Yo: *I am Groot!*",0,0,Marco Bernal,2cv2ueYnKjg,0.0,2016-12-04 03:37:03,True,True
2016-12-04T03:37:34,Amazing had me laughing 😂,0,0,Anderson Rivera,2cv2ueYnKjg,0.6000000000000001,2016-12-04 03:37:34,True,True
2016-12-04T03:37:55,what would be awesome is if that PEWDIEPIE was in this movie,0,6,Jessica Hauserman,2cv2ueYnKjg,1.0,2016-12-04 03:37:55,True,True
2016-12-04T03:38:58,I rewatched the final part like 20 times it's so funny,0,0,Austin McCarthy,2cv2ueYnKjg,0.125,2016-12-04 03:38:58,True,True
2016-12-04T03:40:21,Baby groot is cute.,0,0,Yang Xiong,2cv2ueYnKjg,0.5,2016-12-04 03:40:21,True,True
2016-12-04T03:40:23,me encanta groot!,0,0,oscarito68 Garcia,2cv2ueYnKjg,0.0,2016-12-04 03:40:23,True,True
2016-12-04T03:40:27,ese baby groot me mata xdxd,0,0,RDXricky,2cv2ueYnKjg,0.0,2016-12-04 03:40:27,True,True
2016-12-04T03:41:19,https://m.facebook.com/fabconceptwork/,0,0,Fab Entertainment,2cv2ueYnKjg,0.0,2016-12-04 03:41:19,True,True
2016-12-04T03:41:27,I am groot.mmmhhh. I am groot.mmhhhhh. I am groot. Noooooo!!!!!!!!!!!!,0,0,Logan Triplett Films,2cv2ueYnKjg,0.0,2016-12-04 03:41:27,True,True
2016-12-04T03:41:56,I have a feeling Drax is going to completely steal the show this time around.,3,2,RoboHood,2cv2ueYnKjg,0.1,2016-12-04 03:41:56,True,True
2016-12-04T03:42:23,Does star lord look a little bit more chubby now.,0,0,Yang Xiong,2cv2ueYnKjg,0.15625,2016-12-04 03:42:23,True,True
2016-12-04T03:42:27,I didn't know Batista can laugh and get that excited,2,0,Sang Nguyen,2cv2ueYnKjg,0.3375,2016-12-04 03:42:27,True,True
2016-12-04T03:42:36,okkk.....i gotta see this moviee NOW!,0,0,be water my amigo,2cv2ueYnKjg,0.0,2016-12-04 03:42:36,True,True
2016-12-04T03:42:51,"baby groot is the cutest thing i ever seen, maybe for entire of my life..",0,0,Bad habit,2cv2ueYnKjg,0.0,2016-12-04 03:42:51,True,True
2016-12-04T03:43:13,Baby Groot is straight savage,0,0,Crystal Escobar,2cv2ueYnKjg,0.2,2016-12-04 03:43:13,True,True
2016-12-04T03:43:19,I am groot,0,0,Josh Lawley,2cv2ueYnKjg,0.0,2016-12-04 03:43:19,True,True
2016-12-04T03:44:23,Rocket for President 2106,0,0,mickeybunts,2cv2ueYnKjg,0.0,2016-12-04 03:44:23,True,True
2016-12-04T03:44:48,The scene where Groot chases the big guy and the ending is hilarious.,0,0,Fabled Thunder,2cv2ueYnKjg,0.25,2016-12-04 03:44:48,True,True
2016-12-04T03:45:07,i love baby groot haha. also i HAve no brain,0,0,SimplySpoons,2cv2ueYnKjg,0.35,2016-12-04 03:45:07,True,True
2016-12-04T03:45:12,grut is cute,0,0,Galaxy _Life,2cv2ueYnKjg,0.5,2016-12-04 03:45:12,True,True
2016-12-04T03:45:15,"This isn't the second trailer, this is the same.",0,0,Priest of Benism,2cv2ueYnKjg,0.0,2016-12-04 03:45:15,True,True
2016-12-04T03:45:46,I'm groot !!!!!!!!!!!!!!!!!!!!!!!!!!!!!!!!!!!! ㅋㅋㅋㅋㅋㅋㅋㅋㅋㅋㅋㅋㅋㅋㅋㅋㅋㅋㅋㅋㅋㅋㅋㅋㅋㅋㅋㅋㅋㅋㅋㅋㅋㅋㅋㅋㅋㅋㅋㅋㅋㅋㅋㅋㅋㅋㅋㅋㅋㅋㅋㅋㅋㅋㅋㅋㅋㅋㅋㅋㅋㅋㅋㅋㅋㅋㅋㅋㅋ,0,0,Doh!,2cv2ueYnKjg,0.0,2016-12-04 03:45:46,True,True
2016-12-04T03:45:52,Mantis..isn't green??Why is she not green like her comicbook self??,0,0,Sammy Lane,2cv2ueYnKjg,0.1,2016-12-04 03:45:52,True,True
2016-12-04T03:46:26,groot is so cuuuuuute but i laughed myself to death at drex's reaction,0,0,Kn1feM4n66,2cv2ueYnKjg,0.7,2016-12-04 03:46:26,True,True
2016-12-04T03:46:27,I am grootttttttttttt !!!!!!!!!!,0,0,Nelly G,2cv2ueYnKjg,0.0,2016-12-04 03:46:27,True,True
2016-12-04T03:47:02,"I'm literally crying right now, anyone else? Lol",0,0,am_101,2cv2ueYnKjg,0.29523809523809524,2016-12-04 03:47:02,True,True
2016-12-04T03:47:02,Baby Groot......the only damn reason i will actually pay to watch this. He's too adorable,0,0,Amelia Potter,2cv2ueYnKjg,0.16666666666666666,2016-12-04 03:47:02,True,True
2016-12-04T03:47:46,I love this!!! baby Groot its grate thank good for Vin,0,0,Natalia Baspino,2cv2ueYnKjg,0.83828125,2016-12-04 03:47:46,True,True
2016-12-04T03:48:40,sweet,0,0,derrick Lewis,2cv2ueYnKjg,0.35,2016-12-04 03:48:40,True,True
2016-12-04T03:48:47,baby groot is the best super hero,0,0,yasha ward,2cv2ueYnKjg,0.6666666666666666,2016-12-04 03:48:47,True,True
2016-12-04T03:49:04,"Nice retro/classic pick again,Mr Gunn. Sweet’s song Fox on the Run is the name of the song used here...I just know DC is gonna fucking copy this like they did in Suicide Squad using Queen.Bastards,lol!!Haha!!Just kidding,I don't care if they do.",0,0,Sammy Lane,2cv2ueYnKjg,0.11666666666666665,2016-12-04 03:49:04,True,True
2016-12-04T03:49:35,"Another soundtrack my dad already had,ha!",1,0,Sammy Lane,2cv2ueYnKjg,0.0,2016-12-04 03:49:35,True,True
2016-12-04T03:49:43,groot looks so cute,0,0,Santiago Angel,2cv2ueYnKjg,0.5,2016-12-04 03:49:43,True,True
2016-12-04T03:50:02,what happened to adult groot??,0,2,jerardo pantaleon,2cv2ueYnKjg,0.1,2016-12-04 03:50:02,True,True
2016-12-04T03:50:03,MANTIS MANTIS MANTIS MANTIS MANTIS MANTIS MANTIS!!!!!!!!!!!!!!!!!,0,0,El Schaefer,2cv2ueYnKjg,0.0,2016-12-04 03:50:03,True,True
2016-12-04T03:50:32,1:54 XD!!!!!!!!!,0,0,Anthony_ GC,2cv2ueYnKjg,0.0,2016-12-04 03:50:32,True,True
2016-12-04T03:50:34,1:50 tho,0,0,Vivian Seemer,2cv2ueYnKjg,0.0,2016-12-04 03:50:34,True,True
2016-12-04T03:51:23,i am groot,0,0,skater wolf,2cv2ueYnKjg,0.0,2016-12-04 03:51:23,True,True
2016-12-04T03:51:37,damn it guys groot ran off with the bomb,0,0,KingMaxMike n Ike,2cv2ueYnKjg,0.0,2016-12-04 03:51:37,True,True
2016-12-04T03:51:48,I am groot  I am groot !!!  I am groot 😍😍😍,0,0,Chandresh Singh,2cv2ueYnKjg,0.0,2016-12-04 03:51:48,True,True
2016-12-04T03:52:16,just seeing baby groot makes me want to watch this! btw drax is every best friend out there or at least my best friend.,0,0,Erza Scarlett,2cv2ueYnKjg,0.5666666666666667,2016-12-04 03:52:16,True,True
2016-12-04T03:52:55,I AM GROOT~~~~~~~,0,0,Liu Jerie,2cv2ueYnKjg,0.0,2016-12-04 03:52:55,True,True
2016-12-04T03:53:26,baby groot is just too cute omg I die every time I see him,0,0,Albert Sitoe,2cv2ueYnKjg,0.5,2016-12-04 03:53:26,True,True
2016-12-04T03:54:24,A-Holes...... Just say assholes and make it PG-13 Marvel,0,0,showlegacy618,2cv2ueYnKjg,0.0,2016-12-04 03:54:24,True,True
2016-12-04T03:54:32,I am groot? I am groot. I am groot!,1,0,Dbd LOL,2cv2ueYnKjg,0.0,2016-12-04 03:54:32,True,True
2016-12-04T03:54:50,Holy Shit this looks amazing!,1,0,Maciej Russer,2cv2ueYnKjg,0.275,2016-12-04 03:54:50,True,True
2016-12-04T03:55:03,Awesome!  lolz,0,0,TinkerBoom33,2cv2ueYnKjg,1.0,2016-12-04 03:55:03,True,True
2016-12-04T03:55:11,BEST THING IVE SEEN ALL DAY,0,0,SilverSauce,2cv2ueYnKjg,1.0,2016-12-04 03:55:11,True,True
2016-12-04T03:55:12,0:24 WHEN YOU REALIZE YOU DIED FROM THE FIRST MOVIE,0,0,Gumball,2cv2ueYnKjg,0.25,2016-12-04 03:55:12,True,True
2016-12-04T03:56:15,Now makes me wonder how groot will kick ass in infinity war,0,0,Sebastian Jasinski,2cv2ueYnKjg,0.0,2016-12-04 03:56:15,True,True
2016-12-04T03:56:23,"me encanta, estoy loca por verla",0,0,Lisdeys R,2cv2ueYnKjg,0.0,2016-12-04 03:56:23,True,True
2016-12-04T03:57:17,Drax and Groot are gonna steal the spotlight every scene they'll be in. I cant wait!!!,1197,21,MN-14,2cv2ueYnKjg,0.0,2016-12-04 03:57:17,True,True
2016-12-04T03:57:28,Hahaha that Drax part at the end haha God I can't wait for this movie,0,0,The7Reaper,2cv2ueYnKjg,0.2,2016-12-04 03:57:28,True,True
2016-12-04T03:57:45,I'm only seeing this for baby Groot.,0,0,littlereyrey,2cv2ueYnKjg,0.0,2016-12-04 03:57:45,True,True
2016-12-04T03:58:11,So who's your favorite?,0,0,Gelo Real,2cv2ueYnKjg,0.5,2016-12-04 03:58:11,True,True
2016-12-04T03:58:19,wow i can't wait,0,0,Brian,2cv2ueYnKjg,0.1,2016-12-04 03:58:19,True,True
2016-12-04T03:58:22,"Baby Groot and Rocket FTW! Just something absolutely awesome about a serious, gun slinging, badass...raccoon.",0,0,Jordan Thomas,2cv2ueYnKjg,0.33333333333333337,2016-12-04 03:58:22,True,True
2016-12-04T03:58:43,Baby groot is now the most loved super hero,0,0,Amir McDowell _,2cv2ueYnKjg,0.5111111111111111,2016-12-04 03:58:43,True,True
2016-12-04T03:58:59,I am Gwoot >:3,22,3,nordic fatcheese,2cv2ueYnKjg,0.0,2016-12-04 03:58:59,True,True
2016-12-04T03:59:31,Drax and Groot best parts of this trailer  😂😂😂,0,0,Thato Moganedi,2cv2ueYnKjg,1.0,2016-12-04 03:59:31,True,True
2016-12-04T03:59:41,The baby groot thumbnail is such click bate . So who else here for baby groot.,2,0,Sophia Elizabeth Photography NYC,2cv2ueYnKjg,0.0,2016-12-04 03:59:41,True,True
2016-12-04T03:59:55,LOL DRAX,1,0,lendial,2cv2ueYnKjg,0.8,2016-12-04 03:59:55,True,True
2016-12-04T04:00:11,Groot is so cute.,0,0,altarush,2cv2ueYnKjg,0.5,2016-12-04 04:00:11,True,True
2016-12-04T04:00:16,the tree soooo cute,0,0,Ghost Summonriley,2cv2ueYnKjg,0.5,2016-12-04 04:00:16,True,True
2016-12-04T04:00:50,i need a hug,24,9,johnny blaze,2cv2ueYnKjg,0.0,2016-12-04 04:00:50,True,True
2016-12-04T04:01:51,#IamGroot,0,0,Chandan Varma,2cv2ueYnKjg,0.0,2016-12-04 04:01:51,True,True
2016-12-04T04:02:12,i think i want groot to stay a baby forever :),0,0,| The1ManArmy |,2cv2ueYnKjg,0.5,2016-12-04 04:02:12,True,True
2016-12-04T04:02:28,DC fanboys in the comments,0,0,Bleebus,2cv2ueYnKjg,0.0,2016-12-04 04:02:28,True,True
2016-12-04T04:02:43,LOOKS SOOO GOOD! BABY GROOT IS JUST AMAZING,0,0,simplytanya,2cv2ueYnKjg,0.7375,2016-12-04 04:02:43,True,True
2016-12-04T04:03:20,"So if Adult Groot dies multiple times and a portion of him is recovered and grows into Baby Groot, the team has to deal with raising him over and over. For the most part, a lot of babysitting for Rocket.",0,0,tesseract2012,2cv2ueYnKjg,0.19999999999999998,2016-12-04 04:03:20,True,True
2016-12-04T04:04:31,I LOVE BABY GROOT!!!!!!!,1,0,Esme Wayne,2cv2ueYnKjg,1.0,2016-12-04 04:04:31,True,True
2016-12-04T04:05:27,omg this is the best trailer I have ever seen. It literally shows nothing about the story but I could not stop smiling lol. That is amazing,0,0,Nicholas Fox,2cv2ueYnKjg,0.8000000000000002,2016-12-04 04:05:27,True,True
2016-12-04T04:05:38,Baby Groot just killed me (((o(*ﾟ▽ﾟ*)o)))♡,0,0,LamN YB,2cv2ueYnKjg,-0.2,2016-12-04 04:05:38,True,True
2016-12-04T04:05:46,BABY GROOT IS SO CUTE,0,0,Blair Nackley,2cv2ueYnKjg,0.5,2016-12-04 04:05:46,True,True
2016-12-04T04:05:55,baby groot is lifeee,0,0,Dhira Tjoe,2cv2ueYnKjg,0.0,2016-12-04 04:05:55,True,True
2016-12-04T04:05:56,Leave a like for baby Groot,1,0,Dragonhunter 761,2cv2ueYnKjg,0.0,2016-12-04 04:05:56,True,True
2016-12-04T04:06:12,DRAX is the best.,1,0,DemonLlama10000,2cv2ueYnKjg,1.0,2016-12-04 04:06:12,True,True
2016-12-04T04:06:39,Good,0,0,Harshawardhan Banerjee,2cv2ueYnKjg,0.7,2016-12-04 04:06:39,True,True
2016-12-04T04:06:47,groot looks so adorable,0,0,Kuri Kun 93,2cv2ueYnKjg,0.5,2016-12-04 04:06:47,True,True
2016-12-04T04:06:56,What is the title of the song ?,0,0,Daniel legaspi,2cv2ueYnKjg,0.0,2016-12-04 04:06:56,True,True
2016-12-04T04:07:05,I have gotta see this movie!!!!!!!!!!!!!!!!!!,0,0,kyle rutherford,2cv2ueYnKjg,0.0,2016-12-04 04:07:05,True,True
2016-12-04T04:07:09,WHEN HOW PLS,0,0,zeldamasterbro,2cv2ueYnKjg,0.0,2016-12-04 04:07:09,True,True
2016-12-04T04:07:29,"uh....who else wants that ""therapist alien"".......",0,0,Patrick Kent,2cv2ueYnKjg,-0.024999999999999994,2016-12-04 04:07:29,True,True
2016-12-04T04:08:10,Baby groot is you cute,0,0,Explosive Minh,2cv2ueYnKjg,0.5,2016-12-04 04:08:10,True,True
2016-12-04T04:09:03,nombre de la cancion ?,0,0,Nort Snow,2cv2ueYnKjg,0.0,2016-12-04 04:09:03,True,True
2016-12-04T04:09:09,Vin Diesel on helium 😂,0,0,Deepesh Rajani,2cv2ueYnKjg,0.0,2016-12-04 04:09:09,True,True
2016-12-04T04:09:19,this is what love looks like ladies and gentlemen,0,0,Charlie Kot,2cv2ueYnKjg,0.5,2016-12-04 04:09:19,True,True
2016-12-04T04:09:58,"Man, I am looking forward to this RIDE!!",0,0,Paul L. Brooks,2cv2ueYnKjg,0.0,2016-12-04 04:09:58,True,True
2016-12-04T04:10:01,so when is Drax gonna do a batista bomb ?,0,0,Anthony Ramirez,2cv2ueYnKjg,0.0,2016-12-04 04:10:01,True,True
2016-12-04T04:10:03,Mantis Mantis Mantis Mantis! O YA,0,0,Kenneth Jacobs,2cv2ueYnKjg,0.0,2016-12-04 04:10:03,True,True
2016-12-04T04:10:11,BABY GROOT IS THE CUTEST THING IN THE FUCKING GALXY UNIVERSE UNICORN OR WHATEVER,0,0,Chiflado,2cv2ueYnKjg,-0.6,2016-12-04 04:10:11,True,True
2016-12-04T04:10:27,Is that Shuma-Gorath?,0,3,Emiscary1,2cv2ueYnKjg,0.0,2016-12-04 04:10:27,True,True
2016-12-04T04:11:04,this was good😅,0,0,ANDY 5000,2cv2ueYnKjg,0.0,2016-12-04 04:11:04,True,True
2016-12-04T04:11:14,i was hoping that nova would be in this movie,0,0,Allen18728,2cv2ueYnKjg,0.0,2016-12-04 04:11:14,True,True
2016-12-04T04:11:27,100 tripper funny,0,0,Game Master,2cv2ueYnKjg,0.25,2016-12-04 04:11:27,True,True
2016-12-04T04:11:28,OMG 1:09-Baby Groot is such a savage,0,0,Baxter Cahill,2cv2ueYnKjg,0.0,2016-12-04 04:11:28,True,True
2016-12-04T04:11:43,i am groot,0,0,Mike R,2cv2ueYnKjg,0.0,2016-12-04 04:11:43,True,True
2016-12-04T04:11:51,Awwww.....Baby Groot,0,0,Ziggurat Television,2cv2ueYnKjg,0.0,2016-12-04 04:11:51,True,True
2016-12-04T04:11:52,1:55 we all have that one friend that acts like this,1,0,Gaming Moments,2cv2ueYnKjg,0.0,2016-12-04 04:11:52,True,True
2016-12-04T04:12:09,omg i am in love with this movie! ^),0,0,ilia maximov,2cv2ueYnKjg,0.625,2016-12-04 04:12:09,True,True
2016-12-04T04:12:32,DRAX THE BEST !!!!,0,0,Eroplane,2cv2ueYnKjg,1.0,2016-12-04 04:12:32,True,True
2016-12-04T04:12:46,Okay Drax is now one of my favorites,0,0,NintendoWolf,2cv2ueYnKjg,0.5,2016-12-04 04:12:46,True,True
2016-12-04T04:12:52,Rocket must be so proud of angry baby groot~,0,0,Rayjean Reyes,2cv2ueYnKjg,0.15000000000000002,2016-12-04 04:12:52,True,True
2016-12-04T04:13:15,groot alredy conquered world he is   best ever,0,0,호떡냉이,2cv2ueYnKjg,1.0,2016-12-04 04:13:15,True,True
2016-12-04T04:13:41,I am Groooot!,0,0,Sara Vanan,2cv2ueYnKjg,0.0,2016-12-04 04:13:41,True,True
2016-12-04T04:13:45,yaya part 2,0,0,obshchaya feshenebe'nyy L rodriguez,2cv2ueYnKjg,0.0,2016-12-04 04:13:45,True,True
2016-12-04T04:14:01,yaaaaaaaaaaaasssssssss Omgosh yes I need this,1,0,Ralph Mangan IV,2cv2ueYnKjg,0.0,2016-12-04 04:14:01,True,True
2016-12-04T04:14:15,bahaha I love this SO MUCH,0,0,Badboy DCX,2cv2ueYnKjg,0.35,2016-12-04 04:14:15,True,True
2016-12-04T04:14:24,Why does rocket think that groot is his leather weapon,0,0,Angela Chalupsky,2cv2ueYnKjg,0.0,2016-12-04 04:14:24,True,True
2016-12-04T04:16:40,"i'm groot,i'm groot i'm groot :)",1,0,Leonardie,2cv2ueYnKjg,0.5,2016-12-04 04:16:40,True,True
2016-12-04T04:17:24,Baby Groot is the best of the movie ❤,0,0,Goulaxx,2cv2ueYnKjg,1.0,2016-12-04 04:17:24,True,True
2016-12-04T04:17:32,guys wts that song in the background,2,2,Matt Ohs,2cv2ueYnKjg,0.0,2016-12-04 04:17:32,True,True
2016-12-04T04:17:55,babby groot is so cute,0,0,Ishit Mothreja,2cv2ueYnKjg,0.5,2016-12-04 04:17:55,True,True
2016-12-04T04:18:42,I always thought Baby Groot wouldn't be in the movie cause he's a tree and he would grow into his normal form in a year or so. Guess I was wrong.,0,2,Sahil Pethe,2cv2ueYnKjg,-0.175,2016-12-04 04:18:42,True,True
2016-12-04T04:18:51,"sees baby groot, clicks video and liked",0,0,Hoe Hin Fong,2cv2ueYnKjg,0.6,2016-12-04 04:18:51,True,True
2016-12-04T04:19:26,This is gonna be awesome lol,0,0,Max Tari,2cv2ueYnKjg,0.9,2016-12-04 04:19:26,True,True
