timestamp,text,like_count,reply_count,author,trailer_id,sentiment_score,datetime,used_for_model,used_for_visualization
2016-12-05T21:43:02,There's no way this won't be AMAZING. XD,0,0,Jazzy Beee,2cv2ueYnKjg,0.6000000000000001,2016-12-05 21:43:02,True,True
2016-12-05T21:46:01,1:56 from that point on i can see Drax becoming a meme,1,0,James Wilson,2cv2ueYnKjg,0.45,2016-12-05 21:46:01,True,True
2016-12-05T21:53:44,a cada trailer fica melhor,0,0,RAMON FERREIRA,2cv2ueYnKjg,0.0,2016-12-05 21:53:44,True,True
2016-12-05T21:55:10,"""This is so sexist! Wah wah wah! "", which is why this trailer rules,",0,0,RunDCM,2cv2ueYnKjg,0.0,2016-12-05 21:55:10,True,True
2016-12-05T21:56:09,is this shit made for 10 yr olds?!,0,0,Islam is a mental illness,2cv2ueYnKjg,-0.25,2016-12-05 21:56:09,True,True
2016-12-05T21:57:36,I AM GROOÒOOOOOOOOOOOOT.,1,0,charlie Long,2cv2ueYnKjg,0.0,2016-12-05 21:57:36,True,True
2016-12-05T22:08:45,"This is how a trailer is supposed to be, show scenes that make somone want to see the film.",1,0,Kevin Michaud,2cv2ueYnKjg,0.0,2016-12-05 22:08:45,True,True
2016-12-05T22:13:52,"Alright I give up, here is my money.",1,0,Chris L,2cv2ueYnKjg,0.0,2016-12-05 22:13:52,True,True
2016-12-05T22:14:55,Mantis!,0,0,Trajan,2cv2ueYnKjg,0.0,2016-12-05 22:14:55,True,True
2016-12-05T22:19:37,"The most adorable, overpower, unkillable character in Marvel Universe!!! II AM GROOOOOOOOOOOOOOOOOOOOOOOOOOOOOOTTTTTTTT!!!!!!",0,0,Michael Bakirtzis,2cv2ueYnKjg,0.75,2016-12-05 22:19:37,True,True
2016-12-05T22:24:48,baby groot and rocket  are the best,0,0,MICHELLE DEMAS,2cv2ueYnKjg,1.0,2016-12-05 22:24:48,True,True
2016-12-05T22:31:24,Groot used Vine Whip! It's super effective!,0,0,Jangobadass,2cv2ueYnKjg,0.5416666666666666,2016-12-05 22:31:24,True,True
2016-12-05T22:39:37,Song?,0,0,Phil Venti,2cv2ueYnKjg,0.0,2016-12-05 22:39:37,True,True
2016-12-05T22:43:23,Baby Groot will own this movie!,0,0,Luis Albino,2cv2ueYnKjg,0.75,2016-12-05 22:43:23,True,True
2016-12-05T22:47:54,Baby Groot and Drax are going to steal the show in this movie! Love it!,4,0,Michael McDonald,2cv2ueYnKjg,0.625,2016-12-05 22:47:54,True,True
2016-12-05T22:52:52,Omfg griot is so fucking cute 😍,0,0,Sam Jones,2cv2ueYnKjg,0.5,2016-12-05 22:52:52,True,True
2016-12-05T22:56:11,I absolutely love the ending. lol,1,0,SheldonMobeldon,2cv2ueYnKjg,0.65,2016-12-05 22:56:11,True,True
2016-12-05T23:00:21,I actually want to see Drax's deepest darkest secret,0,0,sparta139,2cv2ueYnKjg,-0.2,2016-12-05 23:00:21,True,True
2016-12-05T23:02:32,Do you need a hug?,0,0,ShuffMomo,2cv2ueYnKjg,0.0,2016-12-05 23:02:32,True,True
2016-12-05T23:09:33,"si si hablas hablas español ,  suscribete a mi canal y me suscribo al tuyo",0,0,Apolo Tops,2cv2ueYnKjg,0.0,2016-12-05 23:09:33,True,True
2016-12-05T23:12:11,omg I'm groot is soooo super cuuute I love him,1,0,Tracey Parker,2cv2ueYnKjg,0.41666666666666663,2016-12-05 23:12:11,True,True
2016-12-05T23:14:01,funny baby groot,1,0,Jose Pena,2cv2ueYnKjg,0.25,2016-12-05 23:14:01,True,True
2016-12-05T23:15:52,Its about damn time.,1,0,Joseph Guest,2cv2ueYnKjg,0.0,2016-12-05 23:15:52,True,True
2016-12-05T23:25:54,this is jokes !,0,0,ItsJustLee,2cv2ueYnKjg,0.0,2016-12-05 23:25:54,True,True
2016-12-05T23:33:02,Who's here again for Drax's laugh,1,0,Harry,2cv2ueYnKjg,0.3,2016-12-05 23:33:02,True,True
2016-12-05T23:44:33,"Drax, Rocket and Star Lord are corny as anything. Very cringy. Baby Groot redeems all of that.",1,0,Javier Ordonez,2cv2ueYnKjg,0.2,2016-12-05 23:44:33,True,True
2016-12-05T23:52:34,I think I broke the replay button,1,0,Bagel_ Art._.Stuff,2cv2ueYnKjg,0.0,2016-12-05 23:52:34,True,True
2016-12-05T23:53:22,FC groot,0,0,poykmutnb,2cv2ueYnKjg,0.0,2016-12-05 23:53:22,True,True
2016-12-05T23:56:33,I can't wait for this movie... Groot is going to literally be the best thing in this movie in my opinion.,0,0,Fan made cinema,2cv2ueYnKjg,1.0,2016-12-05 23:56:33,True,True
2016-12-05T23:57:43,Can't get enough of baby groot,2,0,frenchmakeup,2cv2ueYnKjg,0.0,2016-12-05 23:57:43,True,True
2016-12-06T00:01:00,cuando 5 de mayo?,0,0,Mica Almada,2cv2ueYnKjg,0.0,2016-12-06 00:01:00,True,True
2016-12-06T00:05:00,Baby groot is going to get all the views... I call it!!,3,0,Brian N,2cv2ueYnKjg,0.0,2016-12-06 00:05:00,True,True
2016-12-06T00:07:30,Baby Groot's a freaking savage.,1,0,TheRealMKT 135,2cv2ueYnKjg,0.0,2016-12-06 00:07:30,True,True
2016-12-06T00:12:02,XD the emotion part xDDD,0,0,Myrkr Fenrirborn,2cv2ueYnKjg,0.0,2016-12-06 00:12:02,True,True
2016-12-06T00:14:40,im so excited,0,0,Harry Capper-Duffin,2cv2ueYnKjg,0.375,2016-12-06 00:14:40,True,True
2016-12-06T00:17:59,Groom is soooooo cute,0,2,Llama Corn,2cv2ueYnKjg,0.5,2016-12-06 00:17:59,True,True
2016-12-06T00:27:18,baby groot !! 😍😍 he's freaking adorable,1,0,Sarita Riveros,2cv2ueYnKjg,0.5,2016-12-06 00:27:18,True,True
2016-12-06T00:31:06,I am soooooo groot :). Loved it.,1,0,SeamSalaBeam,2cv2ueYnKjg,0.6,2016-12-06 00:31:06,True,True
2016-12-06T00:40:45,Who else keeps watching these because I am groot is so cute,4,0,Bryan .F,2cv2ueYnKjg,0.5,2016-12-06 00:40:45,True,True
2016-12-06T00:42:48,"""I am Grooootttt!"" ""That's a really bad sign."" Looking forward to this movie!",1,0,ViraIshnia,2cv2ueYnKjg,-0.8749999999999998,2016-12-06 00:42:48,True,True
2016-12-06T00:44:33,baby groot scenes are realy funny,0,0,Luis Garcia,2cv2ueYnKjg,0.25,2016-12-06 00:44:33,True,True
2016-12-06T00:44:38,0:24 Me in math class,1,0,TIKO,2cv2ueYnKjg,0.0,2016-12-06 00:44:38,True,True
2016-12-06T00:48:18,i didn't see vol 1. yet.,0,2,Felhek Lehrian,2cv2ueYnKjg,0.0,2016-12-06 00:48:18,True,True
2016-12-06T00:58:47,Why is Groot soo small still??? Is this movie gonna take place not too long after the first one???,1,0,Chad Amaral,2cv2ueYnKjg,-0.016666666666666663,2016-12-06 00:58:47,True,True
2016-12-06T01:05:12,Is it just me or groot is cute looking and his voice is so funny.,0,0,Sex Demon,2cv2ueYnKjg,0.375,2016-12-06 01:05:12,True,True
2016-12-06T01:08:26,I WUV GROOT,0,0,Cure Hime Productions,2cv2ueYnKjg,0.0,2016-12-06 01:08:26,True,True
2016-12-06T01:08:47,Disney is gonna make *so*  much money on the schmuck demographic that's wiling to pay extra money to see baby groot,1,0,Deity Saturn,2cv2ueYnKjg,0.1,2016-12-06 01:08:47,True,True
2016-12-06T01:09:00,Movie that I AM waiting for:  -Pepe The Handsome Frog V Lenny Face,0,0,Pepe who's getting ignored,2cv2ueYnKjg,0.5,2016-12-06 01:09:00,True,True
2016-12-06T01:20:33,baby Groot is so cute,25,3,kayla Parks,2cv2ueYnKjg,0.5,2016-12-06 01:20:33,True,True
2016-12-06T01:23:57,Range ear celebrity log drinking natural lost debt.,0,0,Kaj van der Molen,2cv2ueYnKjg,0.1,2016-12-06 01:23:57,True,True
2016-12-06T01:25:17,"Probably give this a watch in 3D just for the FX, but between Baby Groot and the awkward bro-chemistry between Drax and Peter, I expect to be pretty miserable the whole time, and I'll be very surprised if I ever want to see it again.",0,0,EnvisionerWill,2cv2ueYnKjg,-0.20400000000000001,2016-12-06 01:25:17,True,True
2016-12-06T01:25:17,"I'm groot , tan bello 😊😊",0,0,yasmin velasquez,2cv2ueYnKjg,0.0,2016-12-06 01:25:17,True,True
2016-12-06T01:29:36,Baby groot tho,0,0,Julie Medrano,2cv2ueYnKjg,0.0,2016-12-06 01:29:36,True,True
2016-12-06T01:42:31,"the hardest work ever, say i am groot and win a kinda millions,",327,8,Paulo Afonso,2cv2ueYnKjg,0.8,2016-12-06 01:42:31,True,True
2016-12-06T01:49:41,Hey  people .. automatic The vid really  looks  strongny smautretirement  .,0,0,Finley Ellis,2cv2ueYnKjg,0.2,2016-12-06 01:49:41,True,True
2016-12-06T01:49:51,And that's how Vin Diesel sounds like in a blender,95,6,HELLASgate7,2cv2ueYnKjg,0.0,2016-12-06 01:49:51,True,True
2016-12-06T01:53:30,"[Drax] ""Do me, do me!"" [ant lady] ""you have sexual feelings ... for him"" [points at Starlord]",428,12,Elder Maxson,2cv2ueYnKjg,0.5,2016-12-06 01:53:30,True,True
2016-12-06T01:59:43,They have to make a movie with just baby groot! I love him! 😍😍😍,1,0,Chavez Andre,2cv2ueYnKjg,0.625,2016-12-06 01:59:43,True,True
2016-12-06T02:00:50,baby groot is cute😂😂,0,0,aleesyahalira,2cv2ueYnKjg,0.0,2016-12-06 02:00:50,True,True
2016-12-06T02:01:16,OMG LOOKS SO GOOD,1,0,Kichi uwux,2cv2ueYnKjg,0.7,2016-12-06 02:01:16,True,True
2016-12-06T02:02:39,Groot is so cuteeeeee!!!!,0,0,Malu M.,2cv2ueYnKjg,0.0,2016-12-06 02:02:39,True,True
2016-12-06T02:04:53,Do me!  Do me!   [Hil. Arious.],0,0,bigjakedog1,2cv2ueYnKjg,0.0,2016-12-06 02:04:53,True,True
2016-12-06T02:13:02,#I am groot,2,0,Antonio CC,2cv2ueYnKjg,0.0,2016-12-06 02:13:02,True,True
2016-12-06T02:20:28,does anyone know what this song js called?,1,1,Joshua Genera,2cv2ueYnKjg,0.0,2016-12-06 02:20:28,True,True
2016-12-06T02:23:11,I AM GROOT!!,0,0,Dustin Tinoco,2cv2ueYnKjg,0.0,2016-12-06 02:23:11,True,True
2016-12-06T02:28:36,I want baby Groot,0,0,Owl lover 888,2cv2ueYnKjg,0.0,2016-12-06 02:28:36,True,True
2016-12-06T02:32:23,"god this is so cringe, the quips is too much.",0,0,gam,2cv2ueYnKjg,0.2,2016-12-06 02:32:23,True,True
2016-12-06T02:35:15,Why would they run from a baby?,0,0,Yesika Narvaez,2cv2ueYnKjg,0.0,2016-12-06 02:35:15,True,True
2016-12-06T02:39:40,"I love the fact that the official name is ""Baby Groot"" I thought it was just going to be Groot but naw it's Baby Groot. Doesn't take away from the fact that the movie looks like it'll be good.",1,0,McParker,2cv2ueYnKjg,0.6,2016-12-06 02:39:40,True,True
2016-12-06T02:44:02,"Guardians of the galaxy 2 trailer 2,  What I expected: Guns, explosions, witty jokes, new villain, great plot, romance  What I got: Rocket racoon dealing with the struggles of fatherhood 10/10",6,0,Zeniph,2cv2ueYnKjg,0.3340909090909091,2016-12-06 02:44:02,True,True
2016-12-06T02:47:29,Can anyone tell me what is the title of the song in the trailer? It sounds like a damn fun song.,12,5,Timliu92,2cv2ueYnKjg,0.3,2016-12-06 02:47:29,True,True
2016-12-06T02:47:44,I am Grooooooooooooooooooooooooooottttt,0,0,Case Broadbent,2cv2ueYnKjg,0.0,2016-12-06 02:47:44,True,True
2016-12-06T02:57:29,"AWESOME. How did this manage to get over 1000 dislikes? It seems impossible. DC, I'm looking at you.",2,3,Randy Smith,2cv2ueYnKjg,0.16666666666666669,2016-12-06 02:57:29,True,True
2016-12-06T03:02:07,"Let's keep it real, the ONLY reason anyone's gonna go and watch this is because of Baby Groot =P",1,0,Guiselle Collado,2cv2ueYnKjg,0.1,2016-12-06 03:02:07,True,True
2016-12-06T03:03:38,"""Show time a-holes!"" xD That's awesome.",0,0,Magic_Zach,2cv2ueYnKjg,1.0,2016-12-06 03:03:38,True,True
2016-12-06T03:06:08,"""Sexual love..."" ""No.  No I don't."" ""For her!"" ""Nooo!""",24,1,Magic_Zach,2cv2ueYnKjg,0.640625,2016-12-06 03:06:08,True,True
2016-12-06T03:06:24,that exchange with Groot was fucking hilarious.,1,0,ryukdluffy,2cv2ueYnKjg,0.5,2016-12-06 03:06:24,True,True
2016-12-06T03:06:32,1:55 Best part of the trailer!,0,0,Magic_Zach,2cv2ueYnKjg,1.0,2016-12-06 03:06:32,True,True
2016-12-06T03:07:57,YOU MUST BE SO EMBARRASSED! AH HA! AH HA! HAHAHA! DO ME DO ME! Laughed my ass off! Best part of the trailer!,1,0,Magic_Zach,2cv2ueYnKjg,0.7291666666666666,2016-12-06 03:07:57,True,True
2016-12-06T03:08:32,Baby Groot's voice is so adorable! >.< ^.^,0,0,Magic_Zach,2cv2ueYnKjg,0.625,2016-12-06 03:08:32,True,True
2016-12-06T03:11:58,I really wish I never saw that mind reading scene. That would of been fun too see in the cinema.,1,0,Marvin Husbands,2cv2ueYnKjg,0.25,2016-12-06 03:11:58,True,True
2016-12-06T03:14:44,"I can't decide if my favorite character is either Drax, Rocket, or Groot/Baby Groot.  Which one?! >.<",0,0,Magic_Zach,2cv2ueYnKjg,0.625,2016-12-06 03:14:44,True,True
2016-12-06T03:15:18,Don't piss a Baby Groot off!,1,0,Magic_Zach,2cv2ueYnKjg,0.0,2016-12-06 03:15:18,True,True
2016-12-06T03:15:57,I...AM...GROOOOOOOOOOOOT!!,0,0,Magic_Zach,2cv2ueYnKjg,0.0,2016-12-06 03:15:57,True,True
2016-12-06T03:16:36,I am Groot!,0,0,Mako2811,2cv2ueYnKjg,0.0,2016-12-06 03:16:36,True,True
2016-12-06T03:17:04,"I have watched both (FREAKING AMAZING, AND BABY GROOT) trailers for this series...  Can all the *certain irritating peoples* just F off from the movie industry unless they're making their own movie? Please? As a female I saw NOTHING offensive in Trailer 1 or 2, and if it was Drax just being himself (AND IN CHARACTER), well damn.",0,0,Jacy Crowe,2cv2ueYnKjg,0.20285714285714285,2016-12-06 03:17:04,True,True
2016-12-06T03:18:57,"BABY GROOT is going to be the star of the movie. Him and Drax. And Gamora being awesome. Everyone being awesome, really.  I love them all, what can I say?",1,0,Jacy Crowe,2cv2ueYnKjg,0.8333333333333334,2016-12-06 03:18:57,True,True
2016-12-06T03:22:31,Groot is now officially the Cutest Marvel's Superhero.,1,0,zyane jajimin,2cv2ueYnKjg,0.0,2016-12-06 03:22:31,True,True
2016-12-06T03:24:13,can't stop rewatching  baby groots gasp!,1,0,ShowtimeKing10,2cv2ueYnKjg,0.0,2016-12-06 03:24:13,True,True
2016-12-06T03:30:17,Not to be dramatic or anything but I would die for Baby Groot,0,0,Jackie Gonzalez,2cv2ueYnKjg,-0.4333333333333333,2016-12-06 03:30:17,True,True
2016-12-06T03:30:45,Baby groot is adorable,1,0,Zekk3nN,2cv2ueYnKjg,0.5,2016-12-06 03:30:45,True,True
2016-12-06T03:56:21,Guardians > Star Wars,1,0,Sean Griffin,2cv2ueYnKjg,0.0,2016-12-06 03:56:21,True,True
2016-12-06T04:02:19,"I'm waiting for guardians galaxy , Logan , justice league, transformers 5, Xander cage , power rangers",0,0,o Obii,2cv2ueYnKjg,0.0,2016-12-06 04:02:19,True,True
2016-12-06T04:03:18,Plus Star Wars rogue one and wonderwomen,0,0,o Obii,2cv2ueYnKjg,0.0,2016-12-06 04:03:18,True,True
2016-12-06T04:03:50,And spiderman homecoming,0,0,o Obii,2cv2ueYnKjg,0.0,2016-12-06 04:03:50,True,True
2016-12-06T04:04:53,"on 1:01 it sounds like drax said ""screw u space gem""cx",2,0,Elias Enriquez,2cv2ueYnKjg,0.0,2016-12-06 04:04:53,True,True
2016-12-06T04:05:56,Baby groot is the next minions.,0,0,Daniel Moreno,2cv2ueYnKjg,0.0,2016-12-06 04:05:56,True,True
2016-12-06T04:12:36,I just can't stop coming back to this trailer omgroot he's so cute!,1,0,AstoldbyAja,2cv2ueYnKjg,0.3125,2016-12-06 04:12:36,True,True
2016-12-06T04:17:15,baby shoot is a savage and cute,0,0,Thatoneguy 05,2cv2ueYnKjg,0.5,2016-12-06 04:17:15,True,True
2016-12-06T04:22:59,Groot just become the most popular marvel character in the MCU,0,0,Doomsday ツ,2cv2ueYnKjg,0.55,2016-12-06 04:22:59,True,True
2016-12-06T04:25:33,#IAmGroot,0,0,KindaComplicated,2cv2ueYnKjg,0.0,2016-12-06 04:25:33,True,True
2016-12-06T04:30:03,"Lmao, fucking Drax.",0,0,T. Evans,2cv2ueYnKjg,0.0,2016-12-06 04:30:03,True,True
2016-12-06T04:30:54,So looking forward to seeing that movie. I for one am a massive Marvel fan. I cannot wait until 2017.,0,0,Keenan Moser,2cv2ueYnKjg,0.0,2016-12-06 04:30:54,True,True
2016-12-06T04:31:26,"Well that was lame, they could have done better.  Oh well...",0,0,Goldenbelmont,2cv2ueYnKjg,0.0,2016-12-06 04:31:26,True,True
2016-12-06T04:32:18,I am going to love this movie,0,0,The life of Noe Castelo,2cv2ueYnKjg,0.5,2016-12-06 04:32:18,True,True
2016-12-06T04:32:40,Drax was cracking up about Peter's feelings towards Gamora 😅 LOL.,0,0,Keenan Moser,2cv2ueYnKjg,0.8,2016-12-06 04:32:40,True,True
2016-12-06T04:32:55,Star Lord's face though. At that one seen where alien lady tells he has feelings for Gamora.Kawaii!,0,0,BOB Boi,2cv2ueYnKjg,-0.3125,2016-12-06 04:32:55,True,True
2016-12-06T04:33:06,drax is soo awesome dave bautista did a great job,0,0,lel ren,2cv2ueYnKjg,0.9,2016-12-06 04:33:06,True,True
2016-12-06T04:40:30,"the real trailer 0:23-0:39, 1:52-2:08",0,0,Michael Gunawan,2cv2ueYnKjg,0.2,2016-12-06 04:40:30,True,True
2016-12-06T04:44:43,I am baby groot,0,0,Weasel 137,2cv2ueYnKjg,0.0,2016-12-06 04:44:43,True,True
2016-12-06T04:48:31,Baby groot is funny I rather have him then 60.000.000 dollars,0,0,Nancy,2cv2ueYnKjg,0.25,2016-12-06 04:48:31,True,True
2016-12-06T04:49:57,I like Batista is very funny,0,0,MEGHA SHYAM,2cv2ueYnKjg,0.325,2016-12-06 04:49:57,True,True
2016-12-06T04:53:57,what is the song,0,0,wesley Cortes 72,2cv2ueYnKjg,0.0,2016-12-06 04:53:57,True,True
2016-12-06T05:16:20,what's the song in the background??,1,3,Beaner Chan,2cv2ueYnKjg,0.0,2016-12-06 05:16:20,True,True
2016-12-06T05:19:42,I have to watch an ad to watch an ad.,0,0,straightarrow372,2cv2ueYnKjg,0.0,2016-12-06 05:19:42,True,True
2016-12-06T05:21:13,batista lol,0,0,Justice Luah,2cv2ueYnKjg,0.8,2016-12-06 05:21:13,True,True
2016-12-06T05:22:19,"This looks like a really fun movie, actually",0,0,straightarrow372,2cv2ueYnKjg,0.15,2016-12-06 05:22:19,True,True
2016-12-06T05:23:31,Baby groot looks cute,0,0,Jayden Villegas,2cv2ueYnKjg,0.5,2016-12-06 05:23:31,True,True
2016-12-06T05:25:15,baby groot is the most beautiful thing/tree/human/i don´t remember what he really is that i ever seen,0,0,Elina Grizzuti,2cv2ueYnKjg,0.5166666666666667,2016-12-06 05:25:15,True,True
2016-12-06T05:25:30,"Bautista is hysterical. I loved him in the first movie, and it looks like he's still hilarious in this one.",0,0,Ian Weaver,2cv2ueYnKjg,0.11249999999999999,2016-12-06 05:25:30,True,True
2016-12-06T05:26:58,I am Poppy,0,0,prasant mishra,2cv2ueYnKjg,0.0,2016-12-06 05:26:58,True,True
2016-12-06T05:27:55,"its bad enough you are posting someone elses's videos-but PLEASE KEEP THE DAMN LINKS FROM RUNNING ON TOP OF IT., RUINING IT.  how hard is that?????",0,0,Simon Maduxx,2cv2ueYnKjg,-0.12291666666666663,2016-12-06 05:27:55,True,True
2016-12-06T05:31:43,yesh i haven't even seen the movie and I'm alread laughing uncontrolably. xD,0,0,Patrick Dees,2cv2ueYnKjg,0.0,2016-12-06 05:31:43,True,True
2016-12-06T05:38:28,This is the so far only movie next year. Which gonna be up to  the expectations.,0,0,Abhishek kaurav,2cv2ueYnKjg,0.03333333333333333,2016-12-06 05:38:28,True,True
2016-12-06T05:39:48,baby groot finally talk !,0,0,RRMK chairman of RRMK gta 5,2cv2ueYnKjg,0.0,2016-12-06 05:39:48,True,True
2016-12-06T05:42:21,baby groot hahaha,0,0,Lnardo,2cv2ueYnKjg,0.2,2016-12-06 05:42:21,True,True
2016-12-06T05:42:32,"They might as well just rename this ""Baby Groot the movie"", because let's face it. He's going to steal every scene he's in",0,0,Griffin Nunnelee,2cv2ueYnKjg,0.0,2016-12-06 05:42:32,True,True
2016-12-06T05:47:29,Who would have ever thought that Dave Batista would turn out to be a comedic genius,2,0,xxSandt21xx,2cv2ueYnKjg,0.0,2016-12-06 05:47:29,True,True
2016-12-06T05:48:28,We are rgoot,0,0,"Gilgames, King of Heroes",2cv2ueYnKjg,0.0,2016-12-06 05:48:28,True,True
2016-12-06T05:50:57,baby Groot yeeeesssssss😁😁😁😁😁,1,0,AlmightyRickard TheS'ghettiGod_01,2cv2ueYnKjg,0.0,2016-12-06 05:50:57,True,True
2016-12-06T05:52:52,Guardians of the Galaxy>Suicide Squad. IMO,1,0,Drew Garcia,2cv2ueYnKjg,0.0,2016-12-06 05:52:52,True,True
2016-12-06T06:09:43,I was very worried about Batista's acting when I saw he was cast for this role...but he is without a doubt my favorite part of these movies...he steals every scene in my opinion...,0,0,Rad Zach Review,2cv2ueYnKjg,0.2333333333333333,2016-12-06 06:09:43,True,True
2016-12-06T06:13:03,excelente,0,0,Edwin Quintero,2cv2ueYnKjg,0.0,2016-12-06 06:13:03,True,True
2016-12-06T06:23:18,"Wow, that was a terrible trailer.",0,0,Mindy Saini,2cv2ueYnKjg,-0.45,2016-12-06 06:23:18,True,True
2016-12-06T06:34:00,I love Bautista haha,0,0,Grant Lytch,2cv2ueYnKjg,0.35,2016-12-06 06:34:00,True,True
2016-12-06T06:37:38,Baby groot has to be the cutest CGI ever,4,0,Carl O,2cv2ueYnKjg,0.0,2016-12-06 06:37:38,True,True
2016-12-06T06:42:17,Song: Sweet - Fox On The Run If anyone was wondering,2,0,William M.,2cv2ueYnKjg,0.35,2016-12-06 06:42:17,True,True
2016-12-06T06:50:06,"""YOU MUST BE SO EMBARRASSED"" had me dying in laughter",0,0,Vrekoj,2cv2ueYnKjg,0.0,2016-12-06 06:50:06,True,True
2016-12-06T06:54:13,The first movie was better than Star Wars combined.,0,0,Absintholic 999,2cv2ueYnKjg,0.375,2016-12-06 06:54:13,True,True
2016-12-06T06:54:43,I love all the actors apart from da green girl,1,0,Goldstoflame 51,2cv2ueYnKjg,0.15,2016-12-06 06:54:43,True,True
2016-12-06T07:02:53,I JUST FREAKING IN LOVE WITH BABY GROOT!!!!,0,0,ibswimdude54,2cv2ueYnKjg,1.0,2016-12-06 07:02:53,True,True
2016-12-06T07:07:09,What's the song callled ?,0,0,Jonah Smith,2cv2ueYnKjg,0.0,2016-12-06 07:07:09,True,True
2016-12-06T07:14:21,is that a cellphone star lord is holding? at 0:43,0,0,Byron Crooks,2cv2ueYnKjg,0.0,2016-12-06 07:14:21,True,True
2016-12-06T07:15:49,what is the song after baby groot go with the bomb ?,0,0,Rifadh mardiansya,2cv2ueYnKjg,0.0,2016-12-06 07:15:49,True,True
2016-12-06T07:27:03,when?,0,0,VICTOR #Ét.u.d.oOUnada,2cv2ueYnKjg,0.0,2016-12-06 07:27:03,True,True
2016-12-06T07:27:56,I wonder if those 5 orbs in the very begging have something to do with the 5 infinity stones.,0,1,Josh Rostek,2cv2ueYnKjg,0.2,2016-12-06 07:27:56,True,True
2016-12-06T07:33:16,#Babygroot2017,0,0,Johnathon Nielsen,2cv2ueYnKjg,0.0,2016-12-06 07:33:16,True,True
2016-12-06T07:36:45,"Guys. When Drax yells ""screw you"" I realized. He's literal, he doesn't know sarcasm. So he's literally telling who he's yelling at to screw themselves. This is a battle cry for his dick to enter the enemy! Did ANYONE ELSE catch that?",0,0,ROOKI3LINKX,2cv2ueYnKjg,0.0,2016-12-06 07:36:45,True,True
2016-12-06T07:37:57,baby groot is cute,0,0,Aris Daniel,2cv2ueYnKjg,0.5,2016-12-06 07:37:57,True,True
2016-12-06T07:39:08,That ending moment when Drax is making fun of Starlord is hilarious. Will watch the movie 3 times just to see that over and over again.,0,0,JakRizen2,2cv2ueYnKjg,0.4,2016-12-06 07:39:08,True,True
2016-12-06T07:53:42,Wow this is cool,0,0,Humberto Rodriguez,2cv2ueYnKjg,0.22499999999999998,2016-12-06 07:53:42,True,True
2016-12-06T07:53:57,at 1:56 I was laughing my ass off,0,0,azers dam,2cv2ueYnKjg,0.0,2016-12-06 07:53:57,True,True
2016-12-06T07:56:14,But where the hell is Howard the duck???!!!,0,0,rocojackass,2cv2ueYnKjg,0.0,2016-12-06 07:56:14,True,True
2016-12-06T08:07:12,Is it just me or does anyone find the girl who told star lord about his feelings for Gamora to be really attractive? Because in my opinion that girl would be my alien girlfriend any day!,0,0,Gongmong Vang,2cv2ueYnKjg,0.24375000000000002,2016-12-06 08:07:12,True,True
2016-12-06T08:12:00,Drax is solid gold. That is all.,0,0,Xuvial,2cv2ueYnKjg,0.0,2016-12-06 08:12:00,True,True
2016-12-06T08:21:33,love groot,0,0,Pradeep .N,2cv2ueYnKjg,0.5,2016-12-06 08:21:33,True,True
2016-12-06T08:22:34,my baby groot is getting bigger !!,1,0,Ujjwal Sharma,2cv2ueYnKjg,0.0,2016-12-06 08:22:34,True,True
2016-12-06T08:22:52,and his name is John cena do da do do,0,0,aidan Welton,2cv2ueYnKjg,0.0,2016-12-06 08:22:52,True,True
2016-12-06T08:26:42,cant wait,0,0,Uros Spasic,2cv2ueYnKjg,0.0,2016-12-06 08:26:42,True,True
2016-12-06T08:28:53,You feel erection,0,0,LVrJ100,2cv2ueYnKjg,0.0,2016-12-06 08:28:53,True,True
2016-12-06T08:38:09,Bqby groot is gonna be in my wallpaper soon,0,0,xinyiiヅ,2cv2ueYnKjg,0.0,2016-12-06 08:38:09,True,True
2016-12-06T08:39:03,Was this supposed to be funny?,0,0,stewie griffin,2cv2ueYnKjg,0.25,2016-12-06 08:39:03,True,True
2016-12-06T08:46:47,I want GROOT to be in my life .... :(,0,0,Sukhjeet singh,2cv2ueYnKjg,-0.75,2016-12-06 08:46:47,True,True
2016-12-06T08:47:06,1:55 Heavy ?,0,0,Steven,2cv2ueYnKjg,-0.2,2016-12-06 08:47:06,True,True
2016-12-06T08:47:37,"I am Groot, I am Groot, I am Groot 🙌🙌",0,0,Prastyo Wibowo,2cv2ueYnKjg,0.0,2016-12-06 08:47:37,True,True
2016-12-06T08:48:00,I want to be best friends with baby groot,0,0,scarfacepatrick,2cv2ueYnKjg,1.0,2016-12-06 08:48:00,True,True
2016-12-06T08:50:03,Awesome loving it the baby Groot..........aaaooooowwwww I m groot........,0,0,ForFLyngdoh,2cv2ueYnKjg,0.8,2016-12-06 08:50:03,True,True
2016-12-06T08:55:02,baby groot was so cute,0,0,The Joker,2cv2ueYnKjg,0.5,2016-12-06 08:55:02,True,True
2016-12-06T09:09:44,I am groot! I am groot!,0,0,Kristine Capa,2cv2ueYnKjg,0.0,2016-12-06 09:09:44,True,True
2016-12-06T09:10:53,Grooooot is sooooooo swaaaaaaaaag,0,0,cash me owside how ba dat,2cv2ueYnKjg,0.0,2016-12-06 09:10:53,True,True
2016-12-06T09:12:34,The amount of Baby Groot merch marvel is gonna move this Christmas will be insane,114,6,Prince Blake,2cv2ueYnKjg,-1.0,2016-12-06 09:12:34,True,True
2016-12-06T09:15:25,Am I the only 1 who gets a Firefly/Serenity feel from this?,0,0,"Michael Prescott, Jr.",2cv2ueYnKjg,0.0,2016-12-06 09:15:25,True,True
2016-12-06T09:15:26,All of you idiots do realize that DC stands for Dark Comics right?,0,0,Reyes Vallecillo,2cv2ueYnKjg,-0.22142857142857145,2016-12-06 09:15:26,True,True
2016-12-06T09:17:09,"Guys, exercise prefer  this a lot  over   ..",0,0,Vilgot Andersson,2cv2ueYnKjg,0.0,2016-12-06 09:17:09,True,True
2016-12-06T09:17:13,GOTG Volume 2: Rocket Racoon struggles with the fatherhood of baby Groot,0,0,Hamza Bahrawi,2cv2ueYnKjg,0.0,2016-12-06 09:17:13,True,True
2016-12-06T09:29:33,I LOVE IT AND BABY GROOT,1,0,What Nah,2cv2ueYnKjg,0.5,2016-12-06 09:29:33,True,True
2016-12-06T09:36:20,"""I am groooooooooooot, that's a really bad sign""",2,0,Normz97,2cv2ueYnKjg,-0.6999999999999998,2016-12-06 09:36:20,True,True
2016-12-06T09:36:36,Im Groot,0,0,WaliD Kne,2cv2ueYnKjg,0.0,2016-12-06 09:36:36,True,True
2016-12-06T09:38:31,"This movie looks like straight dogshit, especially ""baby groot"". Fuck everyone who likes this movie! If you like this movie you probably also like Donald Chump",1,2,Romeo Bobby,2cv2ueYnKjg,-0.09999999999999999,2016-12-06 09:38:31,True,True
2016-12-06T09:39:40,Jösses... Baby Groot is so cute.,0,0,Glenn Astete-Lundmark,2cv2ueYnKjg,0.5,2016-12-06 09:39:40,True,True
2016-12-06T09:40:48,what song is in this trailer?,0,0,Liam Godinez,2cv2ueYnKjg,0.0,2016-12-06 09:40:48,True,True
2016-12-06T09:41:01,Baby groot <3 becoming my all gadget's wallpaper!!!!,0,0,Tabassum Snigdha,2cv2ueYnKjg,1.0,2016-12-06 09:41:01,True,True
2016-12-06T09:43:32,baby groot  super cute,0,0,Jass Tohra,2cv2ueYnKjg,0.41666666666666663,2016-12-06 09:43:32,True,True
2016-12-06T09:53:56,What's the answer to the universe and the cosmos of the galaxy? _I am groot_ (:,3,0,Nostalgia Guy,2cv2ueYnKjg,0.0,2016-12-06 09:53:56,True,True
