timestamp,text,like_count,reply_count,author,trailer_id,sentiment_score,datetime,used_for_model,used_for_visualization
2016-12-23T12:31:46,"This looks like its going to be awesome! I love the first one and I hope this one is as good as its predecessor. I can't wait. In fact, it seems like a lot of good movies are set to come in 2017.  Pirates of the Caribbean: Dead Men Tell No Tale Guardians of the Galaxy: Vol. 2 Resident Evil: The Final Chapter (Not very anticipated but I'm excited.) Expendables 4 (Possibly, not 100% confirmed on this movie coming in 2017)  That's just the ones I'm excited about. There's also the possibility of the remake of the Mummy being good but I'm not completely sure.",0,0,toast,2cv2ueYnKjg,0.23,2016-12-23 12:31:46,True,True
2016-12-23T15:41:23,1800 people don't have tape,0,0,irafis,2cv2ueYnKjg,0.0,2016-12-23 15:41:23,True,True
2016-12-23T18:20:42,I can't deal. Baby Groot is so cute,0,0,Tatenda,2cv2ueYnKjg,0.5,2016-12-23 18:20:42,True,True
2016-12-23T21:24:47,THIS COMES OUT ON MY BIRTHDAY OML,1,0,Aiden,2cv2ueYnKjg,0.0,2016-12-23 21:24:47,True,True
2016-12-23T23:18:53,"Looks amazing!!! ""I am groot""",1,0,sico sidd,2cv2ueYnKjg,1.0,2016-12-23 23:18:53,True,True
2016-12-24T00:31:03,I love the little groot!! Can't wait to see this :),0,0,ArtbyKailey,2cv2ueYnKjg,0.23567708333333334,2016-12-24 00:31:03,True,True
2016-12-24T02:15:46,I ammmm GROOOOT!,0,0,mad hatter,2cv2ueYnKjg,0.0,2016-12-24 02:15:46,True,True
2016-12-24T05:37:32,"i like the ratcoon guy ""NOOOO""",0,0,Stacey Finegan,2cv2ueYnKjg,0.0,2016-12-24 05:37:32,True,True
2016-12-24T09:43:42,I fucking love groot,0,0,Jr,2cv2ueYnKjg,0.5,2016-12-24 09:43:42,True,True
2016-12-24T09:57:23,My gosh the first movie was so great you can tell cuz they got the same cast this movie will be lit,3,0,YUN PEPSY,2cv2ueYnKjg,0.35000000000000003,2016-12-24 09:57:23,True,True
2016-12-24T13:14:53,This movie is garbage,0,0,Bruce Pardo,2cv2ueYnKjg,0.0,2016-12-24 13:14:53,True,True
2016-12-24T17:12:25,lil baby groot lmfao,0,0,Chris Luce,2cv2ueYnKjg,0.0,2016-12-24 17:12:25,True,True
2016-12-24T19:55:11,I already know baby groot is gonna be hilarious,24,0,king nick,2cv2ueYnKjg,0.5,2016-12-24 19:55:11,True,True
2016-12-24T22:40:03,Can't Wait!,0,0,JDog36,2cv2ueYnKjg,0.0,2016-12-24 22:40:03,True,True
2016-12-25T02:48:29,I AM GROOT!,0,0,Samuel Heil,2cv2ueYnKjg,0.0,2016-12-25 02:48:29,True,True
2016-12-25T08:00:57,This movie is going to make a bagillion freaking dollars without even trying....OK so a bigillion doesn't exist.  But it'll make a lot.,0,0,Kellic AnonymousTiger,2cv2ueYnKjg,0.0,2016-12-25 08:00:57,True,True
2016-12-25T15:23:55,"why does groot only say ""i am groot"" its hilarious but why?",1,1,RomanianPizzaGuy,2cv2ueYnKjg,0.25,2016-12-25 15:23:55,True,True
2016-12-25T16:55:02,I can't wait to watch this movie,1,0,Thediamondcreeper/DANTDC Creeper,2cv2ueYnKjg,0.0,2016-12-25 16:55:02,True,True
2016-12-25T17:43:28,Baby groot is cute and funny,1,0,Marjolein Idzes,2cv2ueYnKjg,0.375,2016-12-25 17:43:28,True,True
2016-12-25T22:34:48,I think Drax is my new favorite xD,0,0,Kokkiri Piplup,2cv2ueYnKjg,0.3181818181818182,2016-12-25 22:34:48,True,True
2016-12-25T23:22:42,q mierda es esto,0,0,Sebastian Valdez,2cv2ueYnKjg,0.0,2016-12-25 23:22:42,True,True
2016-12-25T23:31:33,No one ever has tape,0,0,a_common_weeb,2cv2ueYnKjg,0.0,2016-12-25 23:31:33,True,True
2016-12-26T00:22:39,LOLOLOL THE END PART THOUGH 😂😂😂😂😂,0,0,TriangleSeagull,2cv2ueYnKjg,0.0,2016-12-26 00:22:39,True,True
2016-12-26T00:22:40,LOLOLOL THE END PART THOUGH 😂😂😂😂😂,18,0,TriangleSeagull,2cv2ueYnKjg,0.0,2016-12-26 00:22:40,True,True
2016-12-26T01:01:43,https://soundcloud.com/user-360621727/victims-of-the-system,0,0,pjstevemusic,2cv2ueYnKjg,0.0,2016-12-26 01:01:43,True,True
2016-12-26T03:01:25,i am groot😍,0,0,MORQUEPLAY:GAMERS Y RISAS,2cv2ueYnKjg,0.0,2016-12-26 03:01:25,True,True
2016-12-26T03:59:54,Good News !!!,0,0,Heri Setiono,2cv2ueYnKjg,1.0,2016-12-26 03:59:54,True,True
2016-12-26T06:28:21,I want a Groot!,49,1,Why,2cv2ueYnKjg,0.0,2016-12-26 06:28:21,True,True
2016-12-26T08:04:37,why are there no subscribers to this channel,0,0,Deadpool,2cv2ueYnKjg,0.0,2016-12-26 08:04:37,True,True
2016-12-26T08:05:39,Отлично! Заинтриговали.,1,0,squalka,2cv2ueYnKjg,0.0,2016-12-26 08:05:39,True,True
2016-12-26T10:57:54,I have tape rocket.:),0,0,GREYSTRIPE 44,2cv2ueYnKjg,0.5,2016-12-26 10:57:54,True,True
2016-12-26T14:00:04,기대기대 ^^ 굿 I am groot 푸하하하,0,0,이희동,2cv2ueYnKjg,0.0,2016-12-26 14:00:04,True,True
2016-12-26T14:46:06,SCREW YOU SPACESHIP!!,4,0,Deacon Peters,2cv2ueYnKjg,0.0,2016-12-26 14:46:06,True,True
2016-12-26T14:52:30,oh fun,0,0,Shakita Garcia,2cv2ueYnKjg,0.3,2016-12-26 14:52:30,True,True
2016-12-26T15:03:35,1:24 when your parents give you their credit card,1,0,Chris Ochoa,2cv2ueYnKjg,0.0,2016-12-26 15:03:35,True,True
2016-12-26T15:15:30,Funniest drax moment ever??? Yeah let's go with that?,9,0,Spencer Sharpe,2cv2ueYnKjg,0.0,2016-12-26 15:15:30,True,True
2016-12-26T18:10:02,i bet rocket is gonna be even better in this one,0,0,chris stuckey,2cv2ueYnKjg,0.5,2016-12-26 18:10:02,True,True
2016-12-26T18:14:21,this is so awesome I really want to see guardians of the galaxy volume 2,4,0,Jasmine Smith,2cv2ueYnKjg,0.6,2016-12-26 18:14:21,True,True
2016-12-26T18:24:07,the baby groot is so cute!!!,4,0,Alan Dreelan,2cv2ueYnKjg,0.9765625,2016-12-26 18:24:07,True,True
2016-12-26T18:31:19,Sensitive Drax and impulsive Baby Groot. ....How long until this comes out again? [sigh] I'll just be over here...waiting sadly...,0,0,babserella2778,2cv2ueYnKjg,-0.15,2016-12-26 18:31:19,True,True
2016-12-26T21:15:26,Скукотищще.,0,0,KozichOleg,2cv2ueYnKjg,0.0,2016-12-26 21:15:26,True,True
2016-12-27T00:22:26,groot is cute this trailer is funny,0,0,Tristan Dozier,2cv2ueYnKjg,0.375,2016-12-27 00:22:26,True,True
2016-12-27T00:22:38,I want my own baby groot,1,0,The guy Who knows a guy,2cv2ueYnKjg,0.6,2016-12-27 00:22:38,True,True
2016-12-27T03:11:20,Spouse unity bench originally remote decrease disorder over.,0,0,Soan Julien,2cv2ueYnKjg,-0.1,2016-12-27 03:11:20,True,True
2016-12-27T04:26:56,They soooo better not screw up GotG Vol 2.  I am so psyched to see this in 2017. I'm predicting Alien: Covenant will bomb.  Ditto Cars 3 and PotC: Dead Men Tell No Tales.,0,2,Bill T,2cv2ueYnKjg,0.016666666666666663,2016-12-27 04:26:56,True,True
2016-12-27T04:29:11,Baby groot is so cute I wish I can hug it.,0,0,Blue Brix Productions,2cv2ueYnKjg,0.5,2016-12-27 04:29:11,True,True
2016-12-27T04:46:52,Are we thinking that the mind reader is Mantis?,0,0,Tony Piedmonte,2cv2ueYnKjg,0.0,2016-12-27 04:46:52,True,True
2016-12-27T06:01:36,The ending tho,15,0,evan jae lee,2cv2ueYnKjg,0.0,2016-12-27 06:01:36,True,True
2016-12-27T08:21:52,"Button no.1 is for LAUNCH, button no.2 is for LUNCH. When Trump assumes office I hope he knows which is which.",0,0,Jack Buena,2cv2ueYnKjg,0.0,2016-12-27 08:21:52,True,True
2016-12-27T08:32:48,i love baby groot.,0,0,Jenni J,2cv2ueYnKjg,0.5,2016-12-27 08:32:48,True,True
2016-12-27T08:55:21,Perfection.,1,0,SidNightWalker,2cv2ueYnKjg,0.0,2016-12-27 08:55:21,True,True
2016-12-27T09:06:39,1:29 can't stop laughing,0,0,Menu Hubert,2cv2ueYnKjg,0.0,2016-12-27 09:06:39,True,True
2016-12-27T11:13:19,Iscrivetevi Al mio canale e mettete like I video sono divertentissimi,0,0,Una famiglia pazza pazza,2cv2ueYnKjg,0.0,2016-12-27 11:13:19,True,True
2016-12-27T12:49:10,Should I draw baby groot for my next video?,1,3,DRAWcreate,2cv2ueYnKjg,0.0,2016-12-27 12:49:10,True,True
2016-12-27T13:27:45,ahahaah! Man! Drax's laugh killed me! TWICE!,1,0,Wise Old Man,2cv2ueYnKjg,-0.0062500000000000056,2016-12-27 13:27:45,True,True
2016-12-27T13:32:19,Looks so good,0,0,Yibo Huang,2cv2ueYnKjg,0.7,2016-12-27 13:32:19,True,True
2016-12-27T14:40:40,it's so funny  at the end when that alien reads star lords mind to gamora,1,0,Gabe Alvarez,2cv2ueYnKjg,0.0,2016-12-27 14:40:40,True,True
2016-12-27T17:14:44,massa,0,0,Carlito Argenta,2cv2ueYnKjg,0.0,2016-12-27 17:14:44,True,True
2016-12-27T17:57:27,I need to see this,0,0,Ryan Kritz,2cv2ueYnKjg,0.0,2016-12-27 17:57:27,True,True
2016-12-27T18:13:01,Like - billionare for 15 minutes. Reply - billionare for a day. Subscribe to my channel - billionare forever...,0,0,MartMart,2cv2ueYnKjg,0.0,2016-12-27 18:13:01,True,True
2016-12-27T18:27:08,I'm Groot,0,0,Yusif Bayramlı,2cv2ueYnKjg,0.0,2016-12-27 18:27:08,True,True
2016-12-27T23:54:08,This movie is going to be awesome!!!,0,0,Adam Pina,2cv2ueYnKjg,1.0,2016-12-27 23:54:08,True,True
2016-12-28T00:31:48,I AM GROOT!!!!,0,0,Baby Groot,2cv2ueYnKjg,0.0,2016-12-28 00:31:48,True,True
2016-12-28T02:02:43,Groot is so CUTE😚😚😄 even when he's mad,0,0,Tilly,2cv2ueYnKjg,-0.625,2016-12-28 02:02:43,True,True
2016-12-28T04:43:06,Will deadpool be a cameo in this? lol,1,0,Candi Soda,2cv2ueYnKjg,0.8,2016-12-28 04:43:06,True,True
2016-12-28T05:11:53,Wow,0,0,Minecraft Clasher,2cv2ueYnKjg,0.1,2016-12-28 05:11:53,True,True
2016-12-28T13:35:16,Haha... I'm gonna watch it for Baby Groot :)          - #knowledgeshowdown channel,0,0,KnowledgeShowdown,2cv2ueYnKjg,0.35,2016-12-28 13:35:16,True,True
2016-12-28T17:37:04,OMG the little baby groot,1,0,Demonshot4,2cv2ueYnKjg,-0.1875,2016-12-28 17:37:04,True,True
2016-12-28T18:05:15,Looks really fuckin stupid tbh,0,3,Cam Rhys,2cv2ueYnKjg,-0.29999999999999993,2016-12-28 18:05:15,True,True
2016-12-28T19:25:19,I love baby Groot,0,0,Love Sweets LR,2cv2ueYnKjg,0.5,2016-12-28 19:25:19,True,True
2016-12-28T21:28:36,OMG GROOOOOOOOOT!😍,0,0,Saga Lavinius,2cv2ueYnKjg,0.0,2016-12-28 21:28:36,True,True
2016-12-28T23:42:38,i am not a fan of Baby Groot. wished his adult form was shown instead.,0,0,Naija guy,2cv2ueYnKjg,0.1,2016-12-28 23:42:38,True,True
2016-12-29T09:22:29,dave batista is slowly becoming the new dwayne johnson and i am ok with that,156,3,alexiel axel,2cv2ueYnKjg,0.3621212121212121,2016-12-29 09:22:29,True,True
2016-12-29T11:03:55,baby groot is so cute. I love it,0,0,Ravi Chudasama,2cv2ueYnKjg,0.5,2016-12-29 11:03:55,True,True
2016-12-29T11:53:46,movies that we can watch right now BO2,0,0,Heather Grice,2cv2ueYnKjg,0.2857142857142857,2016-12-29 11:53:46,True,True
2016-12-29T15:00:00,I AM GROOOOOOT!,0,0,Cooper Castleberry,2cv2ueYnKjg,0.0,2016-12-29 15:00:00,True,True
2016-12-29T15:13:57,i cant wait to see this movie i love chris pratt!!!! he is so awsome i adore him at resonable level. : D,0,0,Sitka Vicha,2cv2ueYnKjg,1.0,2016-12-29 15:13:57,True,True
2016-12-29T18:35:19,"You like the gif  But... it's a repost, what'd you do?",0,0,rodeo_bs,2cv2ueYnKjg,0.0,2016-12-29 18:35:19,True,True
2016-12-29T20:37:51,this movie is amazing,0,0,dodgers doon1130,2cv2ueYnKjg,0.6000000000000001,2016-12-29 20:37:51,True,True
2016-12-29T21:06:23,"Drax wants somebody to do him, Groot is fucking adorable, Star Lord and Gamora will probably, well, you know, and Rocket will do the things Rocket normally does.  This movie should be interesting.",0,0,SlyMisterFox,2cv2ueYnKjg,0.3375,2016-12-29 21:06:23,True,True
2016-12-29T22:50:01,We are all Groot!!!,0,0,Jesse Rothbeind,2cv2ueYnKjg,0.0,2016-12-29 22:50:01,True,True
2016-12-29T23:20:38,Try it again  I am groot  I am groot I am groot  NOOOOOOOOOOO,0,0,Judge Reker,2cv2ueYnKjg,0.0,2016-12-29 23:20:38,True,True
2016-12-30T01:12:30,"sold my soul for this, it was worth it",0,0,Evelina Richter,2cv2ueYnKjg,0.3,2016-12-30 01:12:30,True,True
2016-12-30T03:36:45,Yee,0,0,nathan eberhardt,2cv2ueYnKjg,0.0,2016-12-30 03:36:45,True,True
2016-12-30T05:35:49,Song! Please!,0,0,Massimo Macri,2cv2ueYnKjg,0.0,2016-12-30 05:35:49,True,True
2016-12-30T07:26:05,Fox on the Run is one of my favorite songs!!!!!!,0,0,Joe Dubya,2cv2ueYnKjg,1.0,2016-12-30 07:26:05,True,True
2016-12-30T10:10:47,I am grooooot,0,0,Rustythebob,2cv2ueYnKjg,0.0,2016-12-30 10:10:47,True,True
2016-12-30T13:50:57,Damn it Andy...,0,0,Heruagarwaen,2cv2ueYnKjg,0.0,2016-12-30 13:50:57,True,True
2016-12-30T14:04:21,What's the name of this song,0,0,EnderEthan 14,2cv2ueYnKjg,0.0,2016-12-30 14:04:21,True,True
2016-12-30T17:06:13,awesome,0,0,Joe Welch,2cv2ueYnKjg,1.0,2016-12-30 17:06:13,True,True
2016-12-30T17:36:27,i have tape,0,0,Gaby,2cv2ueYnKjg,0.0,2016-12-30 17:36:27,True,True
2016-12-30T17:45:23,eyecaraba groot,0,0,IronMan fan 07,2cv2ueYnKjg,0.0,2016-12-30 17:45:23,True,True
2016-12-30T20:01:55,We are Groot!,1,0,Ulrik Holtskog,2cv2ueYnKjg,0.0,2016-12-30 20:01:55,True,True
2016-12-30T21:02:32,They couldn't have picked a better song for this trailer. fox on the run is a classic,0,0,Mr. J,2cv2ueYnKjg,0.3333333333333333,2016-12-30 21:02:32,True,True
2016-12-30T21:55:14,I can not wait for this movie. Baby groot is so cute.,0,0,Pablo Blanco,2cv2ueYnKjg,0.5,2016-12-30 21:55:14,True,True
2016-12-30T22:43:03,Groot😍❤️💍😘💋💞,0,0,Emily Elizabeth,2cv2ueYnKjg,0.0,2016-12-30 22:43:03,True,True
2016-12-30T23:59:42,I cant wait to see it I am groooooot,0,0,kuddy and boo,2cv2ueYnKjg,0.0,2016-12-30 23:59:42,True,True
2016-12-31T00:44:08,"her: when i touch someone i can feel ur feeling.  me: yeye ikr i love my self SO hard..  Her: i feel...  me:.... wat??  her: I FEEL SEXUAL LOVE me: IKR... wait what did u say...  her: U FEEL SEXUAL LOVE, FOR Justin Bieber!!!!!!!!  me: 😑 i Don't like aliens no more 😒",1,0,expensive girl,2cv2ueYnKjg,0.35119047619047616,2016-12-31 00:44:08,True,True
2016-12-31T03:37:44,SHE JUST REVEALED YOUR DEEPEST DARKEST SECRET! HA HA HAAA! *YOU MUST BE SO EMBARRASSED!!*,1,0,Andre Taylor,2cv2ueYnKjg,-0.9765625,2016-12-31 03:37:44,True,True
2016-12-31T05:48:45,CHECK OUT BABY GROOT DRAWING VIDEO AT DRAWCREATE! PEACE! HAPPY NEW YEAR YA'LL!,0,0,DRAWcreate,2cv2ueYnKjg,0.48522727272727273,2016-12-31 05:48:45,True,True
2016-12-31T06:40:40,Booooooooo Jenna Heap,0,0,APM,2cv2ueYnKjg,0.0,2016-12-31 06:40:40,True,True
2016-12-31T06:46:58,whats the song,0,0,Norbert Ruiz,2cv2ueYnKjg,0.0,2016-12-31 06:46:58,True,True
2016-12-31T10:50:06,is Vin Desiel still voicing Groot? haha jk! 😁,25,3,lightweightlifter 95,2cv2ueYnKjg,0.25,2016-12-31 10:50:06,True,True
2016-12-31T12:06:19,baby Groot is so cute,0,0,Lee Manaoas,2cv2ueYnKjg,0.5,2016-12-31 12:06:19,True,True
2016-12-31T15:22:23,"i love Drax so much, hes so damn adorable",1,0,Eden Jay Collins,2cv2ueYnKjg,0.39999999999999997,2016-12-31 15:22:23,True,True
2016-12-31T17:41:32,sneaky baby groot,0,0,Larry Chitwood,2cv2ueYnKjg,0.0,2016-12-31 17:41:32,True,True
2016-12-31T21:04:03,Am I the only one who found the mind-reading girl attractive?,1,0,Yi Zhang,2cv2ueYnKjg,0.4,2016-12-31 21:04:03,True,True
2016-12-31T21:51:15,"Is it just me, or is this trailer on its own better than Rogue One?",0,0,wvman2374,2cv2ueYnKjg,0.55,2016-12-31 21:51:15,True,True
2016-12-31T23:48:59,Is that Mantis?!,0,0,Erick A.,2cv2ueYnKjg,0.0,2016-12-31 23:48:59,True,True
2017-01-01T00:49:18,I AN RAVVVVEEEEENNNNNN,0,0,Raven Branwen,2cv2ueYnKjg,0.0,2017-01-01 00:49:18,True,True
2017-01-01T01:58:50,Song someone please?,0,0,Ben Schafer,2cv2ueYnKjg,0.0,2017-01-01 01:58:50,True,True
2017-01-01T04:46:34,Chris Pratt is handsome all the time,0,0,Laura Wright,2cv2ueYnKjg,0.5,2017-01-01 04:46:34,True,True
2017-01-01T05:20:02,marvels movies are awesome,0,0,Michael Robles,2cv2ueYnKjg,1.0,2017-01-01 05:20:02,True,True
2017-01-01T09:04:57,Groot don't press that button or it will destroy the whole universe.. EVEN UR ASS,0,0,Pym100 McpeMelon,2cv2ueYnKjg,0.0,2017-01-01 09:04:57,True,True
2017-01-01T17:12:45,"Pence: Don't. Push. This. Button. Because that will set off the nukes immediately, and we'll all be dead. Now repeat back what I just said.  Trump:  **points to button** China.  Pence: No! No, that's the button that would kill everyone! Try again.  Trump: China...  Pence: Mhm?  Trump: China....  Pence: Uh huh?  Trump: **points to button** China.  Pence: NO!!",385,9,DJ Warwing,2cv2ueYnKjg,-0.1,2017-01-01 17:12:45,True,True
2017-01-01T17:51:35,YUUUUUUUUUUUUUUUUUUUUUUUUUUUUU!!!!!!!!!!!!!!!!!!!!!!!!!!!!!!!!!!!!!!!!!!!!!!!!!!!!!!!!!!!!!!!!!!! HAAAAAAAAAAAAAAAAAAAAAAAAAAAAAAAAAA!!!!!!!!!!!!!!!!!!!!!!!!!!!!!!!!!!!!!!!!!!!!!!!!!!! HAHAHAHAHAHAHA!!!!!!!!!!!!!!!!!!!!!!!!!!!!!!!!!!!!!!!!!!!!!!!!!!!!!!!!!!!! YES,0,0,Krzysztof Chomentowski,2cv2ueYnKjg,0.0,2017-01-01 17:51:35,True,True
2017-01-01T18:13:19,Team Baby Groot,0,0,Marcus Worsham,2cv2ueYnKjg,0.0,2017-01-01 18:13:19,True,True
2017-01-01T18:20:48,when your best friend tells everyone who you like SHE JUST TOLD EVERYONE YOUR DEEPEST DARKEST SECRET,1,0,TheMainAsian,2cv2ueYnKjg,0.3,2017-01-01 18:20:48,True,True
2017-01-01T21:09:05,Groot is so cute,0,0,Teresa Rivera,2cv2ueYnKjg,0.5,2017-01-01 21:09:05,True,True
2017-01-01T22:15:19,I......AM....GROOOOOT!!!,1,0,Mez282,2cv2ueYnKjg,0.0,2017-01-01 22:15:19,True,True
2017-01-01T23:32:31,Little Groot is so cute I want one,0,0,Sophi AaaAaa,2cv2ueYnKjg,0.15625,2017-01-01 23:32:31,True,True
2017-01-02T01:28:14,star lord looks cool,0,0,Jerry Lewis,2cv2ueYnKjg,0.35,2017-01-02 01:28:14,True,True
2017-01-02T05:24:25,try again! I am Groot. Uh huh.  I am Groot. Yeah. I am Groot! Nooooi! 😂😂😂😂,0,0,Xtreme J,2cv2ueYnKjg,0.0,2017-01-02 05:24:25,True,True
2017-01-02T06:38:22,The people that disliked were hapless DC writers,0,0,Luke Warm,2cv2ueYnKjg,-0.4,2017-01-02 06:38:22,True,True
2017-01-02T12:35:46,Starlord represents Jesus.Groot & Rocket are two different species merged in to one. The button that Rocket says not to push is metaphorical for world war 3,0,0,Basilio Infante,2cv2ueYnKjg,0.0,2017-01-02 12:35:46,True,True
2017-01-02T15:41:16,0:50 i thought it was pewdiepie for a second XD,2,0,Connor Smith,2cv2ueYnKjg,0.0,2017-01-02 15:41:16,True,True
2017-01-02T17:13:56,who else died of laughter at the part with Baby Groot and the Death Button?😂😂,0,0,Flavia Bogdan,2cv2ueYnKjg,0.0,2017-01-02 17:13:56,True,True
2017-01-02T19:33:13,"Groot is so, so, sooooooooooooooooooooooooooooooooooooooooooo cute!",0,0,Niyah Boogie,2cv2ueYnKjg,0.625,2017-01-02 19:33:13,True,True
2017-01-02T21:02:01,They played this trailer at my showing for Rouge One. I was laughing my ass off,1,0,Alex Sanchez,2cv2ueYnKjg,0.0,2017-01-02 21:02:01,True,True
2017-01-03T00:57:48,I like to think that last part where Drax makes fun of Star Lord is not in the script and just Batista being himself.,1,0,ajshim,2cv2ueYnKjg,0.15,2017-01-03 00:57:48,True,True
2017-01-03T04:05:01,I am Groot,0,0,e m i l e e,2cv2ueYnKjg,0.0,2017-01-03 04:05:01,True,True
2017-01-03T04:06:42,showtime indeed...,0,0,Taylor,2cv2ueYnKjg,0.0,2017-01-03 04:06:42,True,True
2017-01-03T04:19:54,screaming baby groot is either the most adorable or terrifying thing I've ever seen.,0,0,Emilie Moore,2cv2ueYnKjg,0.0,2017-01-03 04:19:54,True,True
2017-01-03T05:43:04,who else is super in love and excited for Baby Groot!!!!  So cute!,0,0,syfy fangirl,2cv2ueYnKjg,0.5934651692708333,2017-01-03 05:43:04,True,True
2017-01-03T09:04:23,Does anyone know what the insect lookin' chick's name is?,0,1,RealmOfWonders,2cv2ueYnKjg,0.0,2017-01-03 09:04:23,True,True
2017-01-03T09:26:24,0:23 Baby Groot's expression and astonished groan is priceless.,0,0,Shadow Hedgehog,2cv2ueYnKjg,1.0,2017-01-03 09:26:24,True,True
2017-01-03T11:28:56,"At first I wasn't sure about baby groot. But after watching the trailer I'm like ""Yes! Yes! And triple hell yes!!!",0,0,Michael Nally,2cv2ueYnKjg,0.625,2017-01-03 11:28:56,True,True
2017-01-03T12:18:36,i need a baby groot in my life right about now,0,2,Liliana Rios-garcia,2cv2ueYnKjg,0.2857142857142857,2017-01-03 12:18:36,True,True
2017-01-03T12:54:03,"""You feel...love...""    ""Yeah, I guess I feel a general unselfish love for--.""    ""No, SEXUAL love...""    ""No, no I don't!""   ""For her!""   😂😂😂😂😂😂😂😂😂😂😂😂",183,5,Wazowski's Apprentice,2cv2ueYnKjg,0.2703125,2017-01-03 12:54:03,True,True
2017-01-03T14:43:31,I am grute,0,0,Hailey Steward,2cv2ueYnKjg,0.0,2017-01-03 14:43:31,True,True
2017-01-03T16:04:43,baby groot is so cute.. i can't wait to watch this,1,0,Bata Tibix,2cv2ueYnKjg,0.5,2017-01-03 16:04:43,True,True
2017-01-03T17:03:24,Baby Groot Lol😅,0,0,vvs 1600,2cv2ueYnKjg,0.0,2017-01-03 17:03:24,True,True
2017-01-03T19:36:09,pussyfartsFTW,0,0,XtotaLRageX,2cv2ueYnKjg,0.0,2017-01-03 19:36:09,True,True
2017-01-04T03:24:10,I liked the part we're dead was laughing and make I go fun of star lord and we're rocket didn't have tape what was yours,0,0,Ft Foxy,2cv2ueYnKjg,0.2333333333333333,2017-01-04 03:24:10,True,True
2017-01-04T03:34:51,Wow Drax is the funniest guy ever...,1,0,8baller10,2cv2ueYnKjg,0.1,2017-01-04 03:34:51,True,True
2017-01-04T05:03:57,HOW IS THIS NOT ON TRENDING,0,0,Carnovel,2cv2ueYnKjg,0.0,2017-01-04 05:03:57,True,True
2017-01-04T05:59:19,Song?,0,0,Connor Morrow,2cv2ueYnKjg,0.0,2017-01-04 05:59:19,True,True
2017-01-04T05:59:46,What's the song at that end?,0,0,Jules Korman,2cv2ueYnKjg,0.0,2017-01-04 05:59:46,True,True
2017-01-04T17:44:47,to be fair... zoe saldana is one fineeeeeeeeeee lady... sexy as hell :)  first in avatar ... oo mama yum... and here she looks even better :P blue green w.e colour :) very sexy,0,0,Hosen,2cv2ueYnKjg,0.41500000000000004,2017-01-04 17:44:47,True,True
2017-01-04T21:08:18,what happened to groot,0,0,bossy joscey,2cv2ueYnKjg,0.0,2017-01-04 21:08:18,True,True
2017-01-05T00:53:06,So cringeworthy,0,0,Brayden Miluszusky,2cv2ueYnKjg,0.0,2017-01-05 00:53:06,True,True
2017-01-05T02:37:28,I am groot. I am groot. I am groot. (points at button.),0,0,Thasneem Rizvi,2cv2ueYnKjg,0.0,2017-01-05 02:37:28,True,True
2017-01-05T02:49:28,Baby groot is so cute!!!,0,0,Portal chicken,2cv2ueYnKjg,0.9765625,2017-01-05 02:49:28,True,True
2017-01-05T03:57:15,Hahahaha I can't even!,0,0,Ava Dubbs,2cv2ueYnKjg,0.25,2017-01-05 03:57:15,True,True
2017-01-05T04:05:12,baby groot is sooo cute,0,0,thewaytodown,2cv2ueYnKjg,0.5,2017-01-05 04:05:12,True,True
2017-01-05T04:05:40,BAAAAbbbAYYYYYY GORRRROOOOOT,0,0,youtube trash,2cv2ueYnKjg,0.0,2017-01-05 04:05:40,True,True
2017-01-05T05:15:08,Song?,0,0,Andres Almonte,2cv2ueYnKjg,0.0,2017-01-05 05:15:08,True,True
2017-01-05T06:46:51,I will watch this movie just for the bits with baby groot and drax,0,0,David The Weirdest,2cv2ueYnKjg,0.0,2017-01-05 06:46:51,True,True
2017-01-05T16:25:24,baby Groot,0,0,Carter Ashby,2cv2ueYnKjg,0.0,2017-01-05 16:25:24,True,True
2017-01-05T17:52:54,Yeah!!!! Volume 2!!!!,0,0,Dill Pickled,2cv2ueYnKjg,0.0,2017-01-05 17:52:54,True,True
2017-01-05T18:05:15,I'm so excited!!! Can't wait to see it! And what's the song?,0,2,RainbowGigan,2cv2ueYnKjg,0.91552734375,2017-01-05 18:05:15,True,True
2017-01-05T20:50:38,"Drax seems to have learned some figurative language (""deepest darkest secret"")",2,1,Tigerman1138,2cv2ueYnKjg,-0.4,2017-01-05 20:50:38,True,True
2017-01-05T20:52:53,I love baby groot. I love when he talks and they change the pitch. Just makes it so funny and cute xD,0,0,AidanTheTurtle,2cv2ueYnKjg,0.4375,2017-01-05 20:52:53,True,True
2017-01-05T21:35:43,is it me baby groom is saying irn bru,0,0,ken harding,2cv2ueYnKjg,0.0,2017-01-05 21:35:43,True,True
2017-01-05T22:15:32,"Rocket is Triggerd has a atomic bomb on his back.  Drax is Screwing up for space crap.  Star Lord Needs tape.  Gamora Said nothing through this.  And I'm Typing this comment.  Baby Groot said "" I am Groot"".",0,0,Soup.,2cv2ueYnKjg,-0.4,2017-01-05 22:15:32,True,True
2017-01-05T22:57:24,I am Groot !,0,0,shi'troy James,2cv2ueYnKjg,0.0,2017-01-05 22:57:24,True,True
2017-01-06T00:04:41,"Calling it now, Groot is gonna be the best part of the movie",0,0,Sam Curry,2cv2ueYnKjg,1.0,2017-01-06 00:04:41,True,True
2017-01-06T01:31:46,As a man baby Groot is cute,0,0,Hunter Outdoor,2cv2ueYnKjg,0.5,2017-01-06 01:31:46,True,True
2017-01-06T02:41:23,at the end hahaha that scene is funny,1,0,jairo castanon,2cv2ueYnKjg,0.225,2017-01-06 02:41:23,True,True
2017-01-06T02:52:39,Im so excited,0,0,The Angry Voltorb,2cv2ueYnKjg,0.375,2017-01-06 02:52:39,True,True
2017-01-06T06:13:04,Sexual Love wtf?!,0,0,TheCyborgCast,2cv2ueYnKjg,0.125,2017-01-06 06:13:04,True,True
2017-01-06T12:15:37,the baby Groot is sooo cute,1,0,M. Faiz Pramadhana,2cv2ueYnKjg,0.5,2017-01-06 12:15:37,True,True
2017-01-06T22:35:24,my mum has a rocket fursuit and a orange thing. now she needs to make a blue one,0,0,Beanie Eagling,2cv2ueYnKjg,0.0,2017-01-06 22:35:24,True,True
2017-01-07T02:53:48,i hope they make another cassette tape,0,0,Sean Bagel,2cv2ueYnKjg,0.0,2017-01-07 02:53:48,True,True
2017-01-07T05:20:15,YESSS A 2ND ONE YESSS THIS ONE LOOKS SOOOOO FUNY TO,0,0,Squirrel,2cv2ueYnKjg,0.0,2017-01-07 05:20:15,True,True
2017-01-07T05:20:38,lol funny   Not funy,0,0,Squirrel,2cv2ueYnKjg,0.525,2017-01-07 05:20:38,True,True
2017-01-07T05:30:35,Just asking how come u have no subscribers ?,0,0,Wyatt Pittman,2cv2ueYnKjg,0.0,2017-01-07 05:30:35,True,True
2017-01-07T07:39:28,uyy keren,0,0,Glory 1805,2cv2ueYnKjg,0.0,2017-01-07 07:39:28,True,True
2017-01-07T10:21:08,*.........I have been waiting.........*,0,0,Scendles,2cv2ueYnKjg,0.0,2017-01-07 10:21:08,True,True
2017-01-07T12:14:20,I like how drax is less serious,0,0,Porkyy Tet,2cv2ueYnKjg,-0.25,2017-01-07 12:14:20,True,True
2017-01-07T13:46:05,I love this film,0,0,Sydney Tjandra,2cv2ueYnKjg,0.5,2017-01-07 13:46:05,True,True
2017-01-07T17:19:45,do me lol,0,0,Mia McInvale,2cv2ueYnKjg,0.8,2017-01-07 17:19:45,True,True
2017-01-07T17:22:11,I am Groot,0,0,Thor Odinson,2cv2ueYnKjg,0.0,2017-01-07 17:22:11,True,True
2017-01-07T17:51:29,James gunns a genious,0,0,Liam French,2cv2ueYnKjg,0.0,2017-01-07 17:51:29,True,True
2017-01-07T17:56:54,"""You must be so embarrassed!"" I love Drax xD",123,1,Michael Mahabir,2cv2ueYnKjg,0.5,2017-01-07 17:56:54,True,True
2017-01-07T19:16:26,Baby groot is so cute,0,0,AznTheBowler,2cv2ueYnKjg,0.5,2017-01-07 19:16:26,True,True
2017-01-07T21:18:51,I instantly love Baby Groot. I wonder if this is still Vin Diesel.,0,0,Greg Martin,2cv2ueYnKjg,0.5,2017-01-07 21:18:51,True,True
2017-01-08T01:22:14,Baby Groot😍😍,0,0,lindsey,2cv2ueYnKjg,0.0,2017-01-08 01:22:14,True,True
2017-01-08T01:23:25,I am GROOT!!!,0,0,Rzayev Qurban,2cv2ueYnKjg,0.0,2017-01-08 01:23:25,True,True
