timestamp,text,like_count,reply_count,author,trailer_id,sentiment_score,datetime,used_for_model,used_for_visualization
2016-12-03T22:52:29,YESSSSSSS,0,0,shiny hunter 28,2cv2ueYnKjg,0.0,2016-12-03 22:52:29,True,True
2016-12-03T22:52:51,i cant wait for the movië,13,0,Tristan 321,2cv2ueYnKjg,0.0,2016-12-03 22:52:51,True,True
2016-12-03T22:52:52,DAMN IT YOU BEAT ME!,0,0,Daniel Acevedo,2cv2ueYnKjg,0.0,2016-12-03 22:52:52,True,True
2016-12-03T22:53:03,I Am Grooooot,12,0,ILuv,2cv2ueYnKjg,0.0,2016-12-03 22:53:03,True,True
2016-12-03T22:56:51,Epic Slowclap.,7,0,scamanderous,2cv2ueYnKjg,0.1,2016-12-03 22:56:51,True,True
2016-12-03T22:57:18,YESS,0,0,weirdmonica,2cv2ueYnKjg,0.0,2016-12-03 22:57:18,True,True
2016-12-03T22:57:25,This is sick And My friend Shit When Groot  Was Screaming 😂😂😂😂😂💩,17,0,Mr Wubs killer clown gang CLOWNS,2cv2ueYnKjg,-0.4571428571428572,2016-12-03 22:57:25,True,True
2016-12-03T22:58:24,BOY WTF İS GOİNG ON WHY İS EVERYTHİNG HAPPENİN TODAY MY HEART CANT TAKE İT,130,12,Mrsmiley186,2cv2ueYnKjg,-0.5,2016-12-03 22:58:24,True,True
2016-12-03T22:58:26,Music? Sounds good,0,1,JM.,2cv2ueYnKjg,0.7,2016-12-03 22:58:26,True,True
2016-12-03T22:58:42,Music? Sounds good,0,0,JM.,2cv2ueYnKjg,0.7,2016-12-03 22:58:42,True,True
2016-12-03T22:59:17,CURSE YOU SPACE SHIT!,3,0,Jasper Dominic Abibas,2cv2ueYnKjg,-0.25,2016-12-03 22:59:17,True,True
2016-12-03T23:00:05,Baby Groot pulled a Leeeerooooooy Jenkins.,2,0,Cap Sparky,2cv2ueYnKjg,0.0,2016-12-03 23:00:05,True,True
2016-12-03T23:00:40,I AM GROOOOOOOOT,0,0,Geir Fagerland,2cv2ueYnKjg,0.0,2016-12-03 23:00:40,True,True
2016-12-03T23:01:19,God damn im early... i need to get a life and stop refreshing the youtube site every second.,1,0,Geir Fagerland,2cv2ueYnKjg,0.19999999999999998,2016-12-03 23:01:19,True,True
2016-12-03T23:01:57,a webo!!!!,0,0,monty smooth,2cv2ueYnKjg,0.0,2016-12-03 23:01:57,True,True
2016-12-03T23:03:26,hahahahah can't wait!!!!! baby groot!!!!!!!!!,0,0,Ridley Spielberg,2cv2ueYnKjg,0.0,2016-12-03 23:03:26,True,True
2016-12-03T23:03:43,yyyeeeeeeeeeay,0,0,Jakin King,2cv2ueYnKjg,0.0,2016-12-03 23:03:43,True,True
2016-12-03T23:04:41,this movie will make more than 1 billion dollar,525,35,shafik sheikh,2cv2ueYnKjg,0.5,2016-12-03 23:04:41,True,True
2016-12-03T23:04:48,Owww I member this onee i love this one...,0,0,Darth Revan,2cv2ueYnKjg,0.5,2016-12-03 23:04:48,True,True
2016-12-03T23:05:08,Groot is soooo cute....😍😍,1,0,Oreoluwa Esan,2cv2ueYnKjg,0.0,2016-12-03 23:05:08,True,True
2016-12-03T23:06:49,*Do me*,1,0,Straightoutta SWEDEN,2cv2ueYnKjg,0.0,2016-12-03 23:06:49,True,True
2016-12-03T23:07:40,A-wsome!!A-holes!!,0,0,LK,2cv2ueYnKjg,0.0,2016-12-03 23:07:40,True,True
2016-12-03T23:07:52,"DAT FEELING STARLORD, IM DYING 😂😂😂",0,0,Ridho Pradana,2cv2ueYnKjg,0.0,2016-12-03 23:07:52,True,True
2016-12-03T23:08:01,ITS SO FUNKY OMG I LOVE IT,0,0,Luke101,2cv2ueYnKjg,0.5,2016-12-03 23:08:01,True,True
2016-12-03T23:08:14,Already watched it 10 times,0,0,Fatah Hatuluwaja,2cv2ueYnKjg,0.0,2016-12-03 23:08:14,True,True
2016-12-03T23:08:56,"Trailers released for Guardians of the Galaxy Vol 2, Death Stranding, Uncharted The Lost Legacy and The Last of us part 2 within 24 hours. I CAN'T TAKE  SO MUCH AWESOMENESS!!!!!!!!!!!!!",0,0,Jordan Carpenter,2cv2ueYnKjg,0.5,2016-12-03 23:08:56,True,True
2016-12-03T23:09:04,*Pushes the button!,0,0,Choochoo 303,2cv2ueYnKjg,0.0,2016-12-03 23:09:04,True,True
2016-12-03T23:09:10,First-ish,0,0,Isaiah Whitten,2cv2ueYnKjg,0.0,2016-12-03 23:09:10,True,True
2016-12-03T23:09:23,By the emperor ... Guardians and the last of us two in one day ... The emperor has truly blessed us all,0,2,Commisar Irad,2cv2ueYnKjg,0.0,2016-12-03 23:09:23,True,True
2016-12-03T23:09:30,Baby Groot is Skull Kid,3,0,Ted Lancaster,2cv2ueYnKjg,0.0,2016-12-03 23:09:30,True,True
2016-12-03T23:09:34,GUYS HELP I AM FREAKING DYING!!! ROOOFL,0,0,CosmicWave Entertainment,2cv2ueYnKjg,0.0,2016-12-03 23:09:34,True,True
2016-12-03T23:09:38,Baby Groot kick ass.. 1:07,0,0,TheFlanker47,2cv2ueYnKjg,0.0,2016-12-03 23:09:38,True,True
2016-12-03T23:09:54,This is going to be great!,0,0,Steve Rasad,2cv2ueYnKjg,1.0,2016-12-03 23:09:54,True,True
2016-12-03T23:10:12,Who is going to be the main villain?,7,11,Jeremy Cook,2cv2ueYnKjg,0.16666666666666666,2016-12-03 23:10:12,True,True
2016-12-03T23:10:59,Groooootacular,0,0,Harrison Duran,2cv2ueYnKjg,0.0,2016-12-03 23:10:59,True,True
2016-12-03T23:11:09,this is the best!!,0,0,Matt Triplett,2cv2ueYnKjg,1.0,2016-12-03 23:11:09,True,True
2016-12-03T23:11:31,song?,0,0,Toasted Asian,2cv2ueYnKjg,0.0,2016-12-03 23:11:31,True,True
2016-12-03T23:11:52,Lol,0,0,Jaijit Sidhu,2cv2ueYnKjg,0.8,2016-12-03 23:11:52,True,True
2016-12-03T23:12:49,"""You must be so embarrassed, hahahahaha  do me do me!!"" drax a savage lol",1554,12,James Carter,2cv2ueYnKjg,0.55625,2016-12-03 23:12:49,True,True
2016-12-03T23:12:49,Fuck yes. Bring this on 😂👍🏻,0,0,Beefcake FPV,2cv2ueYnKjg,-0.4,2016-12-03 23:12:49,True,True
2016-12-03T23:13:15,LESSS GO,0,0,Wynn Hannigan,2cv2ueYnKjg,0.0,2016-12-03 23:13:15,True,True
2016-12-03T23:16:06,Mantis!!!,0,0,Holly Hummingbird,2cv2ueYnKjg,0.0,2016-12-03 23:16:06,True,True
2016-12-03T23:16:09,How can a secret be deep or dark?,0,3,I Can Live Forever,2cv2ueYnKjg,-0.18333333333333335,2016-12-03 23:16:09,True,True
2016-12-03T23:16:14,Batista is hilarious as Drax! This is going to be great! It will probably be bigger than the first Guardians of the Galaxy.,0,0,Mider-Span Man,2cv2ueYnKjg,0.46875,2016-12-03 23:16:14,True,True
2016-12-03T23:16:31,BABY GROOT WILL KILL THE MOVIE😂😱😱😱😄😄😄😄,0,0,Andrey Castro,2cv2ueYnKjg,0.0,2016-12-03 23:16:31,True,True
2016-12-03T23:16:43,Sexual love for GAMORA WHATTTT,30,3,900kd,2cv2ueYnKjg,0.5,2016-12-03 23:16:43,True,True
2016-12-03T23:17:27,The Last Of Us 2 Guardians Of The Galaxy vol. 2 What's next? A new Red Dead Redemption 2 trailer?,1,3,Matheus Soares,2cv2ueYnKjg,-0.012727272727272731,2016-12-03 23:17:27,True,True
2016-12-03T23:17:27,jjfkhgn h noucgrurtucbbfyfityuffbbbrkcyckfbgctrycr.......... I. Can't. Even. Baby Groot is so adorable!!!,1,0,Blazestorm the warrior,2cv2ueYnKjg,0.9765625,2016-12-03 23:17:27,True,True
2016-12-03T23:17:27,i also feel selfless love for zoe saldana.,0,0,aa a,2cv2ueYnKjg,0.5,2016-12-03 23:17:27,True,True
2016-12-03T23:17:46,"I am groots gonna become a meme. Example: u have finals next week a project and 2 essays to write, so absolutely do not touch the Xbox. *me with the controller in my hand* i am groot?",5,0,ThatKidWitTheAfro,2cv2ueYnKjg,-0.05,2016-12-03 23:17:46,True,True
2016-12-03T23:17:46,OMG BABY GROOT SO CUTE!,0,0,Madiz,2cv2ueYnKjg,0.625,2016-12-03 23:17:46,True,True
2016-12-03T23:17:48,Why did this trailer come out now? They should have waited till later.,0,3,John Smith,2cv2ueYnKjg,0.0,2016-12-03 23:17:48,True,True
2016-12-03T23:18:00,BAAY GROOT KICKS ASS,0,0,Josh Drake,2cv2ueYnKjg,0.0,2016-12-03 23:18:00,True,True
2016-12-03T23:18:08,Thanos at 1:46 OMG looks awesome,0,0,Araon Paul,2cv2ueYnKjg,1.0,2016-12-03 23:18:08,True,True
2016-12-03T23:18:18,Mantis! Draw is awkward on that scene.,7,1,Andrey Castro,2cv2ueYnKjg,-0.6,2016-12-03 23:18:18,True,True
2016-12-03T23:18:52,hell yea,0,0,Xzavier Rodriguez,2cv2ueYnKjg,0.0,2016-12-03 23:18:52,True,True
2016-12-03T23:18:52,AWESSSSSSSONMMMMMMMMMMMMMMMME,0,0,timstercr9,2cv2ueYnKjg,0.0,2016-12-03 23:18:52,True,True
2016-12-03T23:19:25,Looks great. Aww isn't Baby Groot cute? The little cute guy is gonna be our doom...awww,0,0,Dushine,2cv2ueYnKjg,0.3825,2016-12-03 23:19:25,True,True
2016-12-03T23:19:44,prediction: Baby Groot will be the best selling toy of the year,0,0,Cruzboy,2cv2ueYnKjg,1.0,2016-12-03 23:19:44,True,True
2016-12-03T23:20:10,Jesus christ!!!  GROOT you cute son of a bitch!!! ,525,16,LAZARUS THUNDER,2cv2ueYnKjg,0.9765625,2016-12-03 23:20:10,True,True
2016-12-03T23:20:54,cant wait for baby groot to destroy the universe,2,0,Wyatt Hoover,2cv2ueYnKjg,-0.2,2016-12-03 23:20:54,True,True
2016-12-03T23:21:28,when dose it come out?,1,1,Little Shnizen,2cv2ueYnKjg,0.0,2016-12-03 23:21:28,True,True
2016-12-03T23:21:35,this movie is gonna be great..can't wait to see it,12,0,Jeff Araujo,2cv2ueYnKjg,0.0,2016-12-03 23:21:35,True,True
2016-12-03T23:22:49,Does anyone recognize the song?,0,1,Brady Busching,2cv2ueYnKjg,0.0,2016-12-03 23:22:49,True,True
2016-12-03T23:23:03,love baby Groot ..,0,0,fiachra O'Neil,2cv2ueYnKjg,0.5,2016-12-03 23:23:03,True,True
2016-12-03T23:23:08,whats the name of that song?,0,2,Sférochodec,2cv2ueYnKjg,0.0,2016-12-03 23:23:08,True,True
2016-12-03T23:23:48,Best trailer editing that i've seen so far.... it doesn't show any story...! DON'T RUIN MORE MOVIES....with lots of trailers and clips...,1,0,82SGN,2cv2ueYnKjg,0.5416666666666666,2016-12-03 23:23:48,True,True
2016-12-03T23:25:13,Wohoooo  I start lauging at 1:56 and now i can t stop ^^  I am GROOT ( (BOOM)),4,0,Dark Sider,2cv2ueYnKjg,0.0,2016-12-03 23:25:13,True,True
2016-12-03T23:26:08,this trailer. make me want to watch the first movie. i am groot,0,3,Oliver Quirox,2cv2ueYnKjg,0.25,2016-12-03 23:26:08,True,True
2016-12-03T23:26:24,Fuck this channel and it's stupid watermark.,3,0,J,2cv2ueYnKjg,-0.6,2016-12-03 23:26:24,True,True
2016-12-03T23:26:49,Omg baby groot.,1,0,Arsenal0fgun922 Gaming,2cv2ueYnKjg,0.0,2016-12-03 23:26:49,True,True
2016-12-03T23:27:51,feels forced,0,0,MARP00N,2cv2ueYnKjg,-0.30000000000000004,2016-12-03 23:27:51,True,True
2016-12-03T23:28:11,Just 1 baby and this become a legend...,10,0,Samuel Phan,2cv2ueYnKjg,0.0,2016-12-03 23:28:11,True,True
2016-12-03T23:29:01,Baby Groot. Scary.,0,0,John Bradshaw,2cv2ueYnKjg,-0.5,2016-12-03 23:29:01,True,True
2016-12-03T23:29:51,drax laughing 😂😂,1,0,Muhamad Rifat,2cv2ueYnKjg,0.0,2016-12-03 23:29:51,True,True
2016-12-03T23:30:16,looks awsome,1,0,Joshua Solomon,2cv2ueYnKjg,0.0,2016-12-03 23:30:16,True,True
2016-12-03T23:30:26,first time you watch this trailer = hilarious ROFLMAO OMG SHIT TURN OFF THE CAPS LOCK second time you watch it = i love Groot... but why did i laughed at Drax? that's so stupid and cringe,1,0,Sarcastic Duck,2cv2ueYnKjg,0.13571428571428573,2016-12-03 23:30:26,True,True
2016-12-03T23:30:51,LIT,0,0,Josh Schlingmeier,2cv2ueYnKjg,0.0,2016-12-03 23:30:51,True,True
2016-12-03T23:30:59,I'm so exited for this movie,1,0,Parth Patel,2cv2ueYnKjg,0.0,2016-12-03 23:30:59,True,True
2016-12-03T23:31:03,I lost my shit at the end of this teaser trailer 😂😂😂,273,5,zythion,2cv2ueYnKjg,-0.2,2016-12-03 23:31:03,True,True
2016-12-03T23:31:13,so much better than the last one,2,0,Emiliano Gael Ortiz Jiménez,2cv2ueYnKjg,0.25,2016-12-03 23:31:13,True,True
2016-12-03T23:31:29,This looked funny as hell!,9,0,Jesse Fuir,2cv2ueYnKjg,0.3125,2016-12-03 23:31:29,True,True
2016-12-03T23:31:50,Someone please tell me this background song,26,4,HaydonGaming,2cv2ueYnKjg,0.0,2016-12-03 23:31:50,True,True
2016-12-03T23:32:33,"I said it the first trailer ill say it again, i wish drax was my dad",2,1,Bleezy,2cv2ueYnKjg,-0.125,2016-12-03 23:32:33,True,True
2016-12-03T23:32:40,The part at the end was so funny 😂,3,0,Skyler Montajes Galang,2cv2ueYnKjg,0.25,2016-12-03 23:32:40,True,True
2016-12-03T23:32:57,omg yes!!!!!!!!!!!!,0,0,Sarah Weese,2cv2ueYnKjg,0.0,2016-12-03 23:32:57,True,True
2016-12-03T23:33:02,"Trailer of the year😁😁😁... Drax, you savage, begone! Baby groot, you rock!",0,0,Fitness Monk,2cv2ueYnKjg,0.0,2016-12-03 23:33:02,True,True
2016-12-03T23:33:52,ha drax at the end,0,0,THAT1MEXICAN,2cv2ueYnKjg,0.0,2016-12-03 23:33:52,True,True
2016-12-03T23:33:55,YES!!!!,2,0,C Doherty,2cv2ueYnKjg,0.0,2016-12-03 23:33:55,True,True
2016-12-03T23:34:08,La Verrrrrrgaaaaa....!!!!!!!,0,0,YO SOY AFRO,2cv2ueYnKjg,0.0,2016-12-03 23:34:08,True,True
2016-12-03T23:34:12,song?,0,0,Rich Reviews,2cv2ueYnKjg,0.0,2016-12-03 23:34:12,True,True
2016-12-03T23:34:20,I hope there's no dance off in this and I hope its good.,0,0,Sahyl,2cv2ueYnKjg,0.7,2016-12-03 23:34:20,True,True
2016-12-03T23:36:16,Baby Groot is a fucking murderer!,1192,25,97Multiphantom,2cv2ueYnKjg,-0.75,2016-12-03 23:36:16,True,True
2016-12-03T23:36:19,Baby groot! ^^ 💛💛💛💛💛💛,0,0,Touki,2cv2ueYnKjg,0.0,2016-12-03 23:36:19,True,True
2016-12-03T23:36:27,the ending was the BEST!! :DD,2,0,Kārlis Grebzde,2cv2ueYnKjg,1.0,2016-12-03 23:36:27,True,True
2016-12-03T23:36:56,OMFG THIS IS GOING TO BE AMAZING,0,0,Twenty-two Pilot,2cv2ueYnKjg,0.6000000000000001,2016-12-03 23:36:56,True,True
2016-12-03T23:37:14,baby groot just so so so cute,0,0,Ricardo Andalas,2cv2ueYnKjg,0.5,2016-12-03 23:37:14,True,True
2016-12-03T23:37:27,YES ! THIS LOOKS SO AWESOME !! now where is the Spider-Man Homecoming trailer...,9,1,Farhan A. Sof,2cv2ueYnKjg,1.0,2016-12-03 23:37:27,True,True
2016-12-03T23:37:58,MOTHER OF GOD,0,0,Rolf Steensig,2cv2ueYnKjg,0.0,2016-12-03 23:37:58,True,True
2016-12-03T23:38:05,Wow,2,0,LEGO MANIAK,2cv2ueYnKjg,0.1,2016-12-03 23:38:05,True,True
2016-12-03T23:38:24,they are going to sell so much baby groot toys,0,0,Eric Pagan,2cv2ueYnKjg,0.2,2016-12-03 23:38:24,True,True
2016-12-03T23:38:42,I am Groot!,0,0,SouperMovieCritic,2cv2ueYnKjg,0.0,2016-12-03 23:38:42,True,True
2016-12-03T23:38:51,Fox on the run by Sweet,0,0,giminyjones,2cv2ueYnKjg,0.35,2016-12-03 23:38:51,True,True
2016-12-03T23:39:09,Fox on the Run is almost too apropriate,0,0,snowboarddude1030,2cv2ueYnKjg,0.0,2016-12-03 23:39:09,True,True
2016-12-03T23:39:19,FUCK YEAH !!!!,2,0,Dimitri Rageux,2cv2ueYnKjg,-0.9765625,2016-12-03 23:39:19,True,True
2016-12-03T23:39:24,baby groot omg my heart melted,0,0,angellykuh,2cv2ueYnKjg,0.0,2016-12-03 23:39:24,True,True
2016-12-03T23:39:33,nOT LIKING THE MUSIC CHOICES.,0,1,Marc,2cv2ueYnKjg,0.0,2016-12-03 23:39:33,True,True
2016-12-03T23:39:35,This looks funny and awesome at the same time,0,0,Declan Rourke,2cv2ueYnKjg,0.4166666666666667,2016-12-03 23:39:35,True,True
2016-12-03T23:39:39,I AM  Groot,0,0,Otimees Chang,2cv2ueYnKjg,0.0,2016-12-03 23:39:39,True,True
2016-12-03T23:39:55,"Drax's first reaction to hearing that Star-Lord has sexual feelings:  ""HAHAHA DO ME DO ME""",0,0,Jacob Plays Some Games,2cv2ueYnKjg,0.31666666666666665,2016-12-03 23:39:55,True,True
2016-12-03T23:40:01,LMAO must see,0,0,bestbuy1009,2cv2ueYnKjg,0.6,2016-12-03 23:40:01,True,True
2016-12-03T23:40:08,So drax is now an asshole 😂😂😂😂😂😂😂,214,11,Ebreeze,2cv2ueYnKjg,0.0,2016-12-03 23:40:08,True,True
2016-12-03T23:40:29,That laugh 1:55 lol,1,0,5302345,2cv2ueYnKjg,0.55,2016-12-03 23:40:29,True,True
2016-12-03T23:41:28,my sole yearning for this movie is baby groot! can't wait to see the little guy in action!,0,0,k2d10tode11,2cv2ueYnKjg,-0.020833333333333332,2016-12-03 23:41:28,True,True
2016-12-03T23:42:16,I love baby groot and drax😂😂😂,0,0,Guillermo Ponce,2cv2ueYnKjg,0.5,2016-12-03 23:42:16,True,True
2016-12-03T23:42:24,"Dayum **_** This trailer is amazing :""3",0,0,DamnGame,2cv2ueYnKjg,0.6000000000000001,2016-12-03 23:42:24,True,True
2016-12-03T23:42:40,I am Groooooooooooot!!!!!,0,0,MrZzReaperSS,2cv2ueYnKjg,0.0,2016-12-03 23:42:40,True,True
2016-12-03T23:43:17,baby groot he so cut I died half way through this trailer,0,0,Noisy -_-Gaming,2cv2ueYnKjg,-0.16666666666666666,2016-12-03 23:43:17,True,True
2016-12-03T23:43:23,trailer 1 looked good and different. trailer 2 looks samey in the marvel sense. excitement fading,0,0,Enan T,2cv2ueYnKjg,0.35,2016-12-03 23:43:23,True,True
2016-12-03T23:43:28,Drax is the best.,0,0,LAnimeMastEr,2cv2ueYnKjg,1.0,2016-12-03 23:43:28,True,True
2016-12-03T23:43:36,batiusta  act better than dwayne...haha,0,0,Iori Yagami,2cv2ueYnKjg,0.5,2016-12-03 23:43:36,True,True
2016-12-03T23:43:41,i'm sure that it will be an awesome movie next year...,0,0,aditia krisna,2cv2ueYnKjg,0.5,2016-12-03 23:43:41,True,True
2016-12-03T23:44:38,I'm so excited for this year :)....Baby groot is so adorable _),0,0,ShawN TyleR,2cv2ueYnKjg,0.4583333333333333,2016-12-03 23:44:38,True,True
2016-12-03T23:44:57,i love so much baby groot 😍,0,0,alejandra cervantes,2cv2ueYnKjg,0.35,2016-12-03 23:44:57,True,True
2016-12-03T23:45:20,Came here for baby groot,0,0,jagadeessh,2cv2ueYnKjg,0.0,2016-12-03 23:45:20,True,True
2016-12-03T23:45:41,Damn! Marvel is doing it again! I. JUST. CAN'T. WAIT!!!,0,0,Alain Gildas Dushime,2cv2ueYnKjg,0.0,2016-12-03 23:45:41,True,True
2016-12-03T23:45:50,What's with all the campy comic tone?,0,0,Ashton Whitaker,2cv2ueYnKjg,0.25,2016-12-03 23:45:50,True,True
2016-12-03T23:45:56,Baby groot loosk stupidly cute =D,0,0,wilmillor,2cv2ueYnKjg,0.75,2016-12-03 23:45:56,True,True
2016-12-03T23:46:03,can't wait,0,0,Mad Whisper_0,2cv2ueYnKjg,0.0,2016-12-03 23:46:03,True,True
2016-12-03T23:46:05,I am Grooooooooooooooooooooooot!!!!!!!!!!!!!!!!!!!!!!,0,0,Bilbo Swaggins,2cv2ueYnKjg,0.0,2016-12-03 23:46:05,True,True
2016-12-03T23:46:11,NewRockstars better be working on a breakdown !😃 Drax wanted a roast lol,0,0,Flicker Flocker,2cv2ueYnKjg,0.7125,2016-12-03 23:46:11,True,True
2016-12-03T23:46:17,Drax at the end...... hilarious!!!!!,0,0,Clorox Bleach,2cv2ueYnKjg,1.0,2016-12-03 23:46:17,True,True
2016-12-03T23:46:57,I can't breathe I nearly fell of my chair LOL 😂,2,0,Lord HerobrineX,2cv2ueYnKjg,0.45,2016-12-03 23:46:57,True,True
2016-12-03T23:47:12,where is main villain?,0,0,Basilius Salazar,2cv2ueYnKjg,0.16666666666666666,2016-12-03 23:47:12,True,True
2016-12-03T23:47:13,"many cgi, many jokes... finger down",0,0,Jose L. Escareno,2cv2ueYnKjg,0.2814814814814815,2016-12-03 23:47:13,True,True
2016-12-03T23:47:40,I'm baby groot,1,0,Rohit k,2cv2ueYnKjg,0.0,2016-12-03 23:47:40,True,True
2016-12-03T23:47:47,I am groot!!,0,0,Mar Vki,2cv2ueYnKjg,0.0,2016-12-03 23:47:47,True,True
2016-12-03T23:47:48,just one word: beautiful,0,0,cesar Salinas,2cv2ueYnKjg,0.85,2016-12-03 23:47:48,True,True
2016-12-03T23:47:54,Marvel is genre master!,0,0,유비가또,2cv2ueYnKjg,0.0,2016-12-03 23:47:54,True,True
2016-12-03T23:47:56,Holy shit this looks so good,0,0,eerohughes,2cv2ueYnKjg,0.24999999999999997,2016-12-03 23:47:56,True,True
2016-12-03T23:48:08,Wow fist 200 comments!,0,1,Charlie Yamamoto,2cv2ueYnKjg,0.125,2016-12-03 23:48:08,True,True
2016-12-03T23:48:09,C'mon Marvel!! control this jokes. The jokes are already very onerous,0,0,CartelmanJ,2cv2ueYnKjg,0.2,2016-12-03 23:48:09,True,True
2016-12-03T23:48:30,lol..do me do me,0,0,something to say!!!,2cv2ueYnKjg,0.0,2016-12-03 23:48:30,True,True
2016-12-03T23:48:32,HOMECOMING HOMECOMING HOMECOMING HOMECOMING SPIDERMAN:HOMECOMING DAMMIT,0,0,Chronic smoker,2cv2ueYnKjg,0.0,2016-12-03 23:48:32,True,True
2016-12-03T23:49:00,I have a mighty need of this movie!  🙌 2017 is fabulous just for this movie. Thank you.,1,0,LouLou,2cv2ueYnKjg,0.45,2016-12-03 23:49:00,True,True
2016-12-03T23:49:01,the ad for this vid was the trailer😂,0,0,Nerdy Coconut,2cv2ueYnKjg,0.0,2016-12-03 23:49:01,True,True
2016-12-03T23:49:38,IS ANYONE GOING TO TALK ABOUT THE ENDING😂😂👌,0,0,BengalSW,2cv2ueYnKjg,0.0,2016-12-03 23:49:38,True,True
2016-12-03T23:50:09,"As with everything about Guardians of the Galaxy , I say meh.",2,9,KingNazaru,2cv2ueYnKjg,0.0,2016-12-03 23:50:09,True,True
2016-12-03T23:50:35,Even I got embarrassed at last part...,0,0,Berkay Ozgen,2cv2ueYnKjg,0.0,2016-12-03 23:50:35,True,True
2016-12-03T23:50:38,....I`ve just cum in my Marvel pants,0,0,Bill Proud,2cv2ueYnKjg,0.0,2016-12-03 23:50:38,True,True
2016-12-03T23:50:43,baby groot is amazing,0,0,lol dude,2cv2ueYnKjg,0.6000000000000001,2016-12-03 23:50:43,True,True
2016-12-03T23:50:53,"""Do me Do me!!!""",0,0,Joe Goudeau,2cv2ueYnKjg,0.0,2016-12-03 23:50:53,True,True
2016-12-03T23:51:22,"Guardians of the Galaxy is my fave film of all time & I absolutely can't wait for the 2nd one, but is it just me who doesn't really know why they constantly keep trying to get Quill & Gamora together? they just don't seem right together?",0,0,Char,2cv2ueYnKjg,0.13714285714285715,2016-12-03 23:51:22,True,True
2016-12-03T23:51:32,OMG I can't wait! Baby Groot is a son of a bitch HAHAHA!,1,0,FD Lopez,2cv2ueYnKjg,0.25,2016-12-03 23:51:32,True,True
2016-12-03T23:51:35,why is fox sharing this trailer?,0,0,BadLuckCoderre,2cv2ueYnKjg,0.0,2016-12-03 23:51:35,True,True
2016-12-03T23:51:37,1st hour,0,0,Zachary Gary,2cv2ueYnKjg,0.0,2016-12-03 23:51:37,True,True
2016-12-03T23:51:42,28 saddists. not bad.,0,0,The Last Hacker,2cv2ueYnKjg,0.3499999999999999,2016-12-03 23:51:42,True,True
2016-12-03T23:51:48,that moment when the ad before the video is the trailer..... I watched it again anyways,0,0,Mark Martinez,2cv2ueYnKjg,0.0,2016-12-03 23:51:48,True,True
2016-12-03T23:51:55,What's the song ?,0,0,Scotty Cunningham,2cv2ueYnKjg,0.0,2016-12-03 23:51:55,True,True
2016-12-03T23:52:00,love it,0,0,John Lopez,2cv2ueYnKjg,0.5,2016-12-03 23:52:00,True,True
2016-12-03T23:52:03,Amazing!,0,0,Junior Rubio,2cv2ueYnKjg,0.7500000000000001,2016-12-03 23:52:03,True,True
2016-12-03T23:52:14,Does anyone have any tape?!,0,0,Fart Smucker,2cv2ueYnKjg,0.0,2016-12-03 23:52:14,True,True
2016-12-03T23:52:15,I'm  smiling so wide right now  my lip just split,5,0,veronicadredd22,2cv2ueYnKjg,0.09285714285714285,2016-12-03 23:52:15,True,True
2016-12-03T23:52:23,Reaching near cuteness overload from baby Groot.,0,0,Malcom Alexander,2cv2ueYnKjg,0.1,2016-12-03 23:52:23,True,True
2016-12-03T23:52:34,I CANT WAIT,0,0,Jewcy Customs,2cv2ueYnKjg,0.0,2016-12-03 23:52:34,True,True
2016-12-03T23:52:51,I just got a add for this movie,0,0,Adrien Mejia,2cv2ueYnKjg,0.0,2016-12-03 23:52:51,True,True
2016-12-03T23:53:11,so they're fighting cthulu,0,0,MEH I don't care,2cv2ueYnKjg,0.0,2016-12-03 23:53:11,True,True
2016-12-03T23:53:12,love the trailer .why is groot a baby,0,1,noneofyourbeeswax,2cv2ueYnKjg,0.5,2016-12-03 23:53:12,True,True
2016-12-03T23:53:13,I just watch the advertisement for this movie before this trailer played,0,0,Claude Caskey,2cv2ueYnKjg,0.0,2016-12-03 23:53:13,True,True
2016-12-03T23:53:23,I AM GROOT!!,0,0,are you ducking kidding me,2cv2ueYnKjg,0.0,2016-12-03 23:53:23,True,True
2016-12-03T23:53:35,the ad for this video was this trailer,0,0,Felipe Flores,2cv2ueYnKjg,0.0,2016-12-03 23:53:35,True,True
2016-12-03T23:53:37,"Q: Why do movies...especially Marvel movies...use rock songs from four decades ago? A: Because nobody writes anthemic songs anymore. They write songs that have guest hop-hop/rap appearances, songs you can dance to, songs used on talent shows...but make for crap trailer music.  Q: So in four decades, will they be using music from today? A: (silence...and then mad laughter...followed by urine-stained trousers.)",0,0,Perry Robitionate,2cv2ueYnKjg,-0.725,2016-12-03 23:53:37,True,True
2016-12-03T23:53:56,WHOO!!!! :),0,0,Master Kenobi,2cv2ueYnKjg,0.5,2016-12-03 23:53:56,True,True
2016-12-03T23:53:57,This looks great!!!,0,0,Jeffrey Cejmer,2cv2ueYnKjg,1.0,2016-12-03 23:53:57,True,True
2016-12-03T23:54:12,"Last of Us 2, Crash Bandicoot, Marvel vs Capcom Infinte and now this. Plz stop, too many emotions in a single day",1,0,Kiuraz,2cv2ueYnKjg,0.14285714285714288,2016-12-03 23:54:12,True,True
2016-12-03T23:54:14,I love this movie al-fucking-ready. They reversed the places of Rocket and Groot going guns blazing in the prison in the 1st movie at 1:04.   *fucking faints*,0,0,Devonte Ragin,2cv2ueYnKjg,-0.04999999999999999,2016-12-03 23:54:14,True,True
2016-12-03T23:54:28,"Now, try again. I am Groot. I am Groot. I am Groot. Noooo!  I lost it there XD. It reminded me discussion between R2-D2 with C3-PO.",0,0,petr pinc,2cv2ueYnKjg,0.0,2016-12-03 23:54:28,True,True
2016-12-03T23:54:47,Looks like baby groot gonna steal the movie again,0,0,Jorge Santiago,2cv2ueYnKjg,0.0,2016-12-03 23:54:47,True,True
2016-12-03T23:55:15,Batista is gold.,0,0,Leinarth,2cv2ueYnKjg,0.0,2016-12-03 23:55:15,True,True
2016-12-03T23:55:20,omg i just came so hard i have a pool full of sperm now.... this looks epic😱,0,0,TheRcGuy Expert,2cv2ueYnKjg,0.029166666666666646,2016-12-03 23:55:20,True,True
2016-12-03T23:55:23,"""I am groot, I am Groot, I..am Groot""!  Rocket: ""Noooooooooooooooooo""!",0,0,gocolago33,2cv2ueYnKjg,0.0,2016-12-03 23:55:23,True,True
2016-12-03T23:55:33,"YEEESSS!!! I SAW THIS UNDER 100,000 VIEWS!!!... It feels good for some reason. XD",0,0,Kathy Oppenheimer,2cv2ueYnKjg,0.7,2016-12-03 23:55:33,True,True
2016-12-03T23:55:36,"First last of us 2, then crash bandicoot remastered, then marvel vs capcom 4 and now THIS. FUCKING LOVE THIS DAY",0,0,sebastian García Huamán,2cv2ueYnKjg,0.25,2016-12-03 23:55:36,True,True
2016-12-03T23:56:23,2017 will be a fantastic year  justice league wonder woman and gotg 2 I'm excited as fuck!!!!!,1,3,Masih Golandami,2cv2ueYnKjg,-0.075,2016-12-03 23:56:23,True,True
2016-12-03T23:58:30,Lmao...#gardiansofthegalaxyvol2,0,0,boog eryang,2cv2ueYnKjg,0.0,2016-12-03 23:58:30,True,True
2016-12-03T23:58:48,GROOT IS SO CUTE AS A KILLER,0,0,S a m a n t h a M a t a,2cv2ueYnKjg,0.5,2016-12-03 23:58:48,True,True
2016-12-03T23:58:49,hahahahaha do me do me!!!!😂😂😂 I can go to sleep now,0,0,josh vela,2cv2ueYnKjg,0.2,2016-12-03 23:58:49,True,True
2016-12-03T23:59:00,Groot looks soooo cuute,0,0,Irvin Franco,2cv2ueYnKjg,0.0,2016-12-03 23:59:00,True,True
2016-12-03T23:59:00,é melhor ir ver o Pelé,0,0,lucas drop,2cv2ueYnKjg,0.0,2016-12-03 23:59:00,True,True
2016-12-03T23:59:05,OMG can't wait for this,0,0,Jon Ky,2cv2ueYnKjg,0.0,2016-12-03 23:59:05,True,True
2016-12-04T00:00:10,GoGu'ot'Ga! (Go Guardians of the Galaxy!),0,0,Benjámin Kurilla,2cv2ueYnKjg,0.0,2016-12-04 00:00:10,True,True
2016-12-04T00:00:18,oh yes its goin to be great movie.....,0,0,Eze Barrah,2cv2ueYnKjg,0.8,2016-12-04 00:00:18,True,True
2016-12-04T00:00:18,"im fucking crying, this trailer is fucking gold",0,0,Alex Santana,2cv2ueYnKjg,-0.4,2016-12-04 00:00:18,True,True
2016-12-04T00:00:20,Lol...Baby Groot...so damn cute when he's angry.,1,0,Roger Allagan,2cv2ueYnKjg,0.0,2016-12-04 00:00:20,True,True
2016-12-04T00:00:25,The fucking trailer came up on as ad.... Like I'm not kidding. what are the damn chances!,309,7,josh barton,2cv2ueYnKjg,-0.75,2016-12-04 00:00:25,True,True
