timestamp,text,like_count,reply_count,author,trailer_id,sentiment_score,datetime,used_for_model,used_for_visualization
2019-03-20T08:02:51,First view first like first comment first share,2,4,TREX OP,3NKDf71jy1I,0.25,2019-03-20 08:02:51,True,True
2019-03-20T08:03:56,📣subscribe💙me💝,2,0,BEN GAMER,3NKDf71jy1I,0.0,2019-03-20 08:03:56,True,True
2019-03-20T08:56:03,"First thoughts: awww, there’s no way they can make that lovely silly lady scary  After: shhhhheeeeeeeiiiiitttttttt",173,2,marvelsgreatestfan,3NKDf71jy1I,0.02999999999999998,2019-03-20 08:56:03,True,True
2019-03-20T11:48:40,Octavia Spencer is in Spider-man 2002 lol,9,1,Sharon Carter,3NKDf71jy1I,0.8,2019-03-20 11:48:40,True,True
2019-03-20T12:37:54,"I can't wait for this movie, it looks awesome! Although the trailer kinda gives away the twist... But still can't wait",18,6,Anton Horror,3NKDf71jy1I,1.0,2019-03-20 12:37:54,True,True
2019-03-21T16:08:33,They literally showed the whole movie,19,2,Somnath Panda,3NKDf71jy1I,0.2,2019-03-21 16:08:33,True,True
2019-03-21T17:52:16,owo,0,0,Sky Kasumi,3NKDf71jy1I,0.0,2019-03-21 17:52:16,True,True
2019-03-22T19:26:50,noice,2,0,giorgos kouthouridis,3NKDf71jy1I,0.0,2019-03-22 19:26:50,True,True
2019-03-22T21:12:02,Could someone tell me the song name?,12,2,Ákos Menyhárt,3NKDf71jy1I,0.0,2019-03-22 21:12:02,True,True
2019-03-22T21:26:15,Music?,6,0,Fruzsina Menyhárt,3NKDf71jy1I,0.0,2019-03-22 21:26:15,True,True
2019-03-23T00:54:33,Cade os brasileiros que vão estar só o deboche pra esse filme?,0,1,Mariana Rodrigues,3NKDf71jy1I,0.0,2019-03-23 00:54:33,True,True
2019-03-24T09:18:04,This woman got nothing on my MA,3,0,Matthew,3NKDf71jy1I,0.0,2019-03-24 09:18:04,True,True
2019-03-24T21:10:29,"One word... sick, mo I need more, insane, fantastic and yeah... I'll go to the cinema with MA",13,0,Genextar Media,3NKDf71jy1I,-0.2035714285714286,2019-03-24 21:10:29,True,True
2019-03-25T21:57:53,This looks really cool. Once again Blum House has got my attention.,48,0,Alexandrite Queen,3NKDf71jy1I,0.35,2019-03-25 21:57:53,True,True
2019-04-05T00:46:30,"Ladies & gentlemen, we have this generation's Citizen Kane.",11,0,Robbie Daw,3NKDf71jy1I,0.0,2019-04-05 00:46:30,True,True
2019-04-06T04:38:35,"Blumhouse, what are you doing? You’re not supposed to be good. You’re supposed to suck",0,0,PsychoSam Productions,3NKDf71jy1I,0.7,2019-04-06 04:38:35,True,True
2019-04-09T02:31:03,This movie lookalike *ORPHANAGE*,6,0,Periya samy,3NKDf71jy1I,0.0,2019-04-09 02:31:03,True,True
2019-04-11T00:57:22,This movie is telling me that ppl trust women more than men,22,1,Sovereign J,3NKDf71jy1I,0.5,2019-04-11 00:57:22,True,True
2019-04-26T11:51:07,Song at the beginning ?,5,0,Gisellee,3NKDf71jy1I,0.0,2019-04-26 11:51:07,True,True
2019-05-01T21:41:29,"From The Director Of The Girl On The Train, Get On Up and The Help and Blumhouse, The Producer Of The Purge, Halloween and Get Out   Academy Award Winner Octavia Spencer Is   MA   May 2019  #MaMovie  #Blumhouse",19,0,Movies & Logos,3NKDf71jy1I,0.0,2019-05-01 21:41:29,True,True
2019-05-05T17:54:57,can't waiiiiiiiitttttttttttttttttt!!! 😮😮😮😮,0,0,Midori Rojas,3NKDf71jy1I,0.0,2019-05-05 17:54:57,True,True
2019-05-14T20:01:01,They all die,0,0,orangekey91,3NKDf71jy1I,0.0,2019-05-14 20:01:01,True,True
2019-05-15T08:20:36,How does it feel to be on the outside looking in? Is maybe a reference to how she was treated when she was younger,6,0,Monica Ekekwe,3NKDf71jy1I,0.0,2019-05-15 08:20:36,True,True
2019-05-17T18:43:15,Mds vão faze um filme da imbuceti,11,1,Cauã otakuro,3NKDf71jy1I,0.0,2019-05-17 18:43:15,True,True
2019-05-18T19:05:22,Name Soundtrack???,3,0,Luiz Henrique Camilo,3NKDf71jy1I,0.0,2019-05-18 19:05:22,True,True
2019-05-19T16:40:43,""" MAAA THERE'S THIS WEIRD ASS CAT OUTSIDE """,0,0,Mateus Oliveira,3NKDf71jy1I,-0.25,2019-05-19 16:40:43,True,True
2019-05-21T00:26:07,"I love Octavia Spencer as an actress, I just hope she doesn't wind up being the best part of an awful movie",0,0,Rachel Knight Online,3NKDf71jy1I,0.16666666666666666,2019-05-21 00:26:07,True,True
2019-05-21T04:08:22,She got some screws loose,3,0,chris napolion,3NKDf71jy1I,-0.07692307692307693,2019-05-21 04:08:22,True,True
2019-05-23T02:09:58,The parents of the kids used to bully her in school,4,1,yoBarlito,3NKDf71jy1I,0.0,2019-05-23 02:09:58,True,True
2019-05-25T03:28:00,What does “Some People Fit Right In” means?,1,1,Peppermint Cookie,3NKDf71jy1I,0.34285714285714286,2019-05-25 03:28:00,False,True
2019-05-27T23:52:28,Can someone please tell my why I thought of Tokyo Tony when I saw this.,1,0,April Jimenez,3NKDf71jy1I,0.0,2019-05-27 23:52:28,False,True
2019-05-28T09:21:53,Thing is tho . I already know the storyline,6,1,Harry Barrett,3NKDf71jy1I,0.0,2019-05-28 09:21:53,False,True
2019-05-29T00:08:26,damn ma is it that serious 😭,13,0,lax brat,3NKDf71jy1I,-0.3333333333333333,2019-05-29 00:08:26,False,True
2019-05-29T01:05:44,Well now I don’t need to watch the movie,0,0,Xap Ete,3NKDf71jy1I,0.0,2019-05-29 01:05:44,False,True
2019-05-29T16:01:30,I'm watching this movie as we speak it's good ass f*** I can watch all movies just comes out I know how to hack I got the new Chucky movie Ma and a lot more,0,1,Tony Wagner,3NKDf71jy1I,0.4454545454545455,2019-05-29 16:01:30,False,True
2019-05-30T10:28:02,This has 'Get Out' written all over it and I was right! Same producer!,5,0,lovinliverpool,3NKDf71jy1I,0.17857142857142855,2019-05-30 10:28:02,False,True
2019-05-30T10:31:40,1:14 EW fuck!,0,0,lovinliverpool,3NKDf71jy1I,-0.5,2019-05-30 10:31:40,False,True
2019-05-31T17:37:44,"My father always told me to watch out for strangers...doesn’t matter what age, race, gender, or nationality. This movie brings me back to that life lesson lol.",8,0,bariatasudan,3NKDf71jy1I,0.4,2019-05-31 17:37:44,False,True
2019-05-31T23:56:46,"Let Me Guess Blumhouse, The Sequel Of The Movie Will Probably Be Called: ""PA"" Am I Right?...",1,0,Gumball Watterson,3NKDf71jy1I,0.2857142857142857,2019-05-31 23:56:46,False,True
2019-06-01T01:42:10,"I have never seen a video that has reached over a million views not have over a thousand likes or dislikes, or less than a hundred comments...",0,0,Joseph Agar,3NKDf71jy1I,-0.16666666666666666,2019-06-01 01:42:10,False,True
2019-06-01T19:10:21,Same movie/plot but different character.,0,0,"WOVDI-Rubies, Diamonds & Pearls",3NKDf71jy1I,0.0,2019-06-01 19:10:21,False,True
2019-06-04T13:35:00,better than Us. much better.,0,0,conny lake,3NKDf71jy1I,0.5,2019-06-04 13:35:00,False,True
2019-06-06T13:15:14,"For those old enough to remember it, does the storyline of this film seem rather similar to Stephen King’s “Carrie” (1976), starring Sissy Spacek — the scary tale of another shy, withdrawn, sensitive student who is taunted and teased by classmates?  If you enjoy “MA”, but haven’t seen “Carrie” yet, you might very well like it too.  At any rate, Octavia Spencer gives a terrific performance in “MA”, and one that I’m hoping will give her a deserved Academy Award nomination for 2019.",1,0,Rw M,3NKDf71jy1I,-0.022222222222222223,2019-06-06 13:15:14,False,True
2019-06-06T19:45:48,Creepy,0,0,Fun For Life!,3NKDf71jy1I,-0.5,2019-06-06 19:45:48,False,True
2019-06-09T06:17:54,OCTAVIA SPENCER IS ONE OF THE MOST VERSATILE ACTRESSES OF TODAY! PEROIDT,7,0,Taylor Grant,3NKDf71jy1I,0.625,2019-06-09 06:17:54,False,True
2019-06-17T11:31:02,"Safe as a single mothers womb ,Blumhouse ain't great",0,0,Loverman Smith,3NKDf71jy1I,0.40952380952380957,2019-06-17 11:31:02,False,True
2019-06-21T01:36:51,"Octavia  Spencer  ,is  definetly  scary in this movie  I am  hyped to see it,",0,0,Nicholas Mardis,3NKDf71jy1I,-0.5,2019-06-21 01:36:51,False,True
2019-06-21T23:09:58,Dora Became More Fat Than She Was Before...,1,0,Gumball Watterson,3NKDf71jy1I,0.5,2019-06-21 23:09:58,False,True
2019-06-21T23:46:39,if its blumhouse i see it,0,0,antwnhs sir,3NKDf71jy1I,0.0,2019-06-21 23:46:39,False,True
2019-08-15T21:16:12,What a song 00:01,0,0,matrixx,3NKDf71jy1I,0.0,2019-08-15 21:16:12,False,True
2019-09-12T13:51:09,Can't wait to watch it tomorrow on Friday 13th,1,0,ecuanis89,3NKDf71jy1I,0.0,2019-09-12 13:51:09,False,False
2019-10-04T22:05:24,The trailer gave it all away!!,0,0,night sorcerer,3NKDf71jy1I,0.0,2019-10-04 22:05:24,False,False
2020-02-15T09:25:42,Whats her deal!!?,0,0,EPA EPA,3NKDf71jy1I,0.0,2020-02-15 09:25:42,False,False
