timestamp,text,like_count,reply_count,author,trailer_id,sentiment_score,datetime,used_for_model,used_for_visualization
2017-07-16T03:27:42,"This trailer was an ad for a video I'd planned on watching, but I watched the entire ad without skipping then left that video to come watch this again. Gary Oldman is such an amazing actor, one of my favorites. This looks Oscar worthy! 🤞",0,0,khlcobb,4pNOCzV5jG0,0.2033333333333333,2017-07-16 03:27:42,True,True
2017-07-16T04:41:47,... and the Oscar goes to Gary Oldman,0,0,rxcjhd,4pNOCzV5jG0,0.0,2017-07-16 04:41:47,True,True
2017-07-16T05:29:48,I see Gary Oldman. I see Stephen Dillane. I see Joe Wright.         I GONNA SEE THIS MOVIE EVEN IF I DIE IN THE PROCESS,0,0,anonymous person,4pNOCzV5jG0,0.0,2017-07-16 05:29:48,True,True
2017-07-16T05:44:22,eagerly hoping Aces High would kick off after the speech,0,0,Matteo Ungaro,4pNOCzV5jG0,0.16,2017-07-16 05:44:22,True,True
2017-07-16T10:08:54,i expected the same speech in dunkirk which is historic,0,0,vijish siva,4pNOCzV5jG0,-0.03333333333333333,2017-07-16 10:08:54,True,True
2017-07-16T13:47:16,Gary Oldman is always the asshole.,0,0,Enrico Fischer,4pNOCzV5jG0,0.0,2017-07-16 13:47:16,True,True
2017-07-16T15:05:33,WTF? Is a Gary Oldman? Oh my God!,0,0,Yakerin Edzio,4pNOCzV5jG0,-0.625,2017-07-16 15:05:33,True,True
2017-07-16T15:07:52,O  S  C  A  R,0,0,Yakerin Edzio,4pNOCzV5jG0,0.0,2017-07-16 15:07:52,True,True
2017-07-16T16:25:41,I would not know there is Gary Oldman,0,0,njiangie,4pNOCzV5jG0,0.0,2017-07-16 16:25:41,True,True
2017-07-16T17:01:05,This looks like the Lincoln of Churchill films.,0,0,Peter Regan,4pNOCzV5jG0,0.0,2017-07-16 17:01:05,True,True
2017-07-16T17:15:33,Gary Oldman is one of the finest actors ever!  A true chameleon and can take on any role offered to him and make it his own.  Can't wait to see this film!!!!!!,0,0,AB Hockle,4pNOCzV5jG0,0.675,2017-07-16 17:15:33,True,True
2017-07-16T17:16:51,"That fat drunk bankrupted the British Empire, threw half of Europe to the USSR, and paved the way for the West to be the degenerate cesspool it is today.",1,1,W H I T E L I V E S M A T T E R,4pNOCzV5jG0,-0.2222222222222222,2017-07-16 17:16:51,True,True
2017-07-16T17:44:49,There  aren't to many movies that I actually spend money to see but this one and Dunkirk is a must see!,0,0,cynical ape,4pNOCzV5jG0,0.25,2017-07-16 17:44:49,True,True
2017-07-16T19:09:57,"Churchill never spoke himself on the BBC broadcast, that was a voice actor named Norman Shelly because Winston was always to shitfaced in the evening.....",1,2,Gary Fencik,4pNOCzV5jG0,0.0,2017-07-16 19:09:57,True,True
2017-07-16T20:17:29,"With Leo scratched off, Oldman, Amy Adams, and Michelle Williams are IMO the most overdue actors for an Oscar.  Hopefully Oldman won't have to wait any longer",0,0,vashthestampede11,4pNOCzV5jG0,0.5,2017-07-16 20:17:29,True,True
2017-07-16T23:47:25,Stannis Baratheon is back,0,0,Charlie Brock,4pNOCzV5jG0,0.0,2017-07-16 23:47:25,True,True
2017-07-17T00:52:23,"Y'know, people like him are pretty loose with the ""fighting & dying"" talk when they aren't the ones doing the fighting & dying ....   But ya gotta hand it to Winnie: he vowed on his life to resist Germany right down to the very last American.",0,2,Cary Groneveldt,4pNOCzV5jG0,0.05053927553927553,2017-07-17 00:52:23,True,True
2017-07-17T01:23:17,Wow....that Oscar has Gary Oldman written all over it this year,0,0,Steve Harageones,4pNOCzV5jG0,0.0,2017-07-17 01:23:17,True,True
2017-07-17T01:29:47,"And to ny lefties on here, remember, Clem Atlee was one of Churchill's greatest friends and served as a pallbearer at his funeral. Churchill and Lloyd George passed the People's Budget in 1909-10, if you're a leftist/socialist, please read about the topic",2,3,jtilghman3,4pNOCzV5jG0,1.0,2017-07-17 01:29:47,True,True
2017-07-17T01:59:28,So was this meant to capitalize on Dunkirk's heavy promotion in an Antz/Bug's Life kind of way or is it just chance?,0,0,Ben Hamilton,4pNOCzV5jG0,0.19999999999999998,2017-07-17 01:59:28,True,True
2017-07-17T06:01:20,It might not be so dark if someone hadn't turned off every light in London.,0,0,Rupert Harvey,4pNOCzV5jG0,0.125,2017-07-17 06:01:20,True,True
2017-07-17T07:35:25,And the Oscar for best makeup and hairstyling goes to ...,0,0,Maria A. Burke,4pNOCzV5jG0,1.0,2017-07-17 07:35:25,True,True
2017-07-17T10:23:48,just Wow,0,0,Ahmed Gad,4pNOCzV5jG0,0.1,2017-07-17 10:23:48,True,True
2017-07-17T12:10:30,one of the most evil men of the twentieth century.,0,0,Daniel,4pNOCzV5jG0,-0.25,2017-07-17 12:10:30,True,True
2017-07-17T14:24:19,Americans like Churchill more than the British as he bankrupted Britain which gave away the British empire and made USA the sole western superpower.,1,0,Thomas Drowry,4pNOCzV5jG0,0.1,2017-07-17 14:24:19,True,True
2017-07-17T16:07:32,1:09 It's Stannis Baratheon!,1,0,James Gravil,4pNOCzV5jG0,0.0,2017-07-17 16:07:32,True,True
2017-07-17T16:36:58,He'll be dedicating the Oscar to his life long friend and mentor John Hurt.,1,0,Alan Kevin Ramsden,4pNOCzV5jG0,-0.05,2017-07-17 16:36:58,True,True
2017-07-17T16:51:01,"Oscar winner Gary Oldman. Please, pretty please.",0,0,Alextromagnetic,4pNOCzV5jG0,0.25,2017-07-17 16:51:01,True,True
2017-07-17T17:00:14,Love the music!! And Kristin Scott Thomas!!!,0,0,CraazyLoop,4pNOCzV5jG0,1.0,2017-07-17 17:00:14,True,True
2017-07-17T19:55:19,Polish  soldiers was figth  for  you .And you  forgott about them.,0,2,Na powaznie,4pNOCzV5jG0,0.0,2017-07-17 19:55:19,True,True
2017-07-17T21:44:19,"Churchill was a vain glorious man child, Oldman's performance looks too hammy for an Oscar run.",0,0,Thomas Drowry,4pNOCzV5jG0,0.0,2017-07-17 21:44:19,True,True
2017-07-17T23:39:47,Touch harsh only isolate package thing agree,0,0,Emilia Busch,4pNOCzV5jG0,-0.1,2017-07-17 23:39:47,True,True
2017-07-17T23:44:30,How many fucking movies can they make about this guy.,0,0,Messylin,4pNOCzV5jG0,-0.04999999999999999,2017-07-17 23:44:30,True,True
2017-07-18T00:06:17,Oldman is absolutely unrecognizable there. Makeup design borders the uncanny valley now more than never.,0,0,Illya Bravo,4pNOCzV5jG0,0.35,2017-07-18 00:06:17,True,True
2017-07-18T15:04:19,And I thought it was some alien shit,0,0,Taimoor Baig,4pNOCzV5jG0,-0.225,2017-07-18 15:04:19,True,True
2017-07-18T15:38:03,"Uhhh what?, two movies",0,0,Soulblade32,4pNOCzV5jG0,0.0,2017-07-18 15:38:03,True,True
2017-07-18T16:31:14,Another colonialist tyrant celebrated. Fantastic.,3,3,Gagan Judge,4pNOCzV5jG0,0.375,2017-07-18 16:31:14,True,True
2017-07-18T16:49:16,"""Will you stop interrupting me when I'm interrupting you!"" LOL!",0,0,Hrishi Jagadees,4pNOCzV5jG0,1.0,2017-07-18 16:49:16,True,True
2017-07-18T20:00:01,Amazing,0,0,SAVU,4pNOCzV5jG0,0.6000000000000001,2017-07-18 20:00:01,True,True
2017-07-18T22:24:18,Will you stop interrupting me when I'm interrupting you?!  Tick tick tick,0,0,Joe Huang,4pNOCzV5jG0,0.0,2017-07-18 22:24:18,True,True
2017-07-19T04:38:25,Oscar/Bafta guaranteed for Oldman.,0,0,Leonhard Rotch,4pNOCzV5jG0,0.0,2017-07-19 04:38:25,True,True
2017-07-19T10:32:08,they should have cast peter dinklage as churchill,2,0,Tyrion Lannister,4pNOCzV5jG0,0.0,2017-07-19 10:32:08,True,True
2017-07-19T11:47:46,"one word ""wow""..................but still the trailer spoiled entire movie",0,0,Edwin TNT,4pNOCzV5jG0,0.05,2017-07-19 11:47:46,True,True
2017-07-19T16:35:44,I'll be so surprised if Oldman doesn't get an Oscar for this role. Even more surprised if he doesn't atleast get nominated,0,0,Carter Warren,4pNOCzV5jG0,0.2333333333333333,2017-07-19 16:35:44,True,True
2017-07-19T20:17:11,The 'feel' of this... looks excellent.  Something to look forward to this Winter.  Thank God.,0,0,Music - The Voice Of The Soul,4pNOCzV5jG0,1.0,2017-07-19 20:17:11,True,True
2017-07-20T02:16:41,Viktor Reznov would be proud!,0,0,CobaltX105,4pNOCzV5jG0,1.0,2017-07-20 02:16:41,True,True
2017-07-20T04:05:47,Was That Stannis?,0,0,salr,4pNOCzV5jG0,0.0,2017-07-20 04:05:47,True,True
2017-07-20T18:44:56,"HEYYYY, im from the future, and the Oscar go to Gary Oldman",0,0,Cận Thị TG,4pNOCzV5jG0,0.0,2017-07-20 18:44:56,True,True
2017-07-20T20:16:42,song?,0,1,J 7,4pNOCzV5jG0,0.0,2017-07-20 20:16:42,True,True
2017-07-20T20:53:56,Fucking mass murderer....!,0,0,P Nawab K,4pNOCzV5jG0,-0.75,2017-07-20 20:53:56,True,True
2017-07-21T02:06:31,"Just based on this, I'd say the makeup effects look fantastic, but voice-wise, Gleeson made a better Churchill. Oldman just sounds like Oldman wearing fat guy makeup.",0,0,nocountry4oldyoungman,4pNOCzV5jG0,0.45,2017-07-21 02:06:31,True,True
2017-07-21T02:25:55,Love how Nolan's film 'Dunkirk' is about the military and the soldier's will to survive while this film deals with the policies of war and the situation in England.,0,0,Thomas L. Chilton,4pNOCzV5jG0,0.2,2017-07-21 02:25:55,True,True
2017-07-21T10:40:18,1:26 Stannis' face when somebody shouts at him :D,0,0,Anton Alohinsson,4pNOCzV5jG0,1.0,2017-07-21 10:40:18,True,True
2017-07-21T20:13:05,This looks so good!,0,0,Cherish42,4pNOCzV5jG0,0.875,2017-07-21 20:13:05,True,True
2017-07-23T11:23:37,Crazy that he also played Sirius Black,0,0,mia,4pNOCzV5jG0,-0.3833333333333333,2017-07-23 11:23:37,True,True
2017-07-23T12:12:57,He will win the Oscar for best actor in 2018.,0,0,Anosh Charles,4pNOCzV5jG0,0.9,2017-07-23 12:12:57,True,True
2017-07-23T18:51:32,"I didn't even realize Oldman was Churchill.  Hell, I just found out that he also played Sirius Black in Harry Potter.  Goddamn he's an amazing actor",0,0,Ajay Pasricha,4pNOCzV5jG0,0.21666666666666673,2017-07-23 18:51:32,True,True
2017-07-23T19:22:10,This looks like it's gonna be great!,0,0,JesusIsTheOnlyWay,4pNOCzV5jG0,1.0,2017-07-23 19:22:10,True,True
2017-07-24T06:44:54,"really strong and compelling trailer and Gary Oldman is spectacular in this trailer... I love the line ""Stop interrupting me interrupting you!""",0,0,Fairul Azmeir,4pNOCzV5jG0,0.4895833333333333,2017-07-24 06:44:54,True,True
2017-07-24T16:31:39,This one is going to win best actor (Gary Oldman) in the next Oscars and best make up as well because i didn't recognized him at all!,0,0,María Victoria Jaunsolo,4pNOCzV5jG0,0.7,2017-07-24 16:31:39,True,True
2017-07-25T15:21:11,The sequel to Dunkirk,1,0,Nit Picker,4pNOCzV5jG0,0.0,2017-07-25 15:21:11,True,True
2017-07-26T21:48:39,"Gary Oldman did a long atonement for his previous bad boy ways. He's as good an actor as Daniel Day Lewis, this is his chance to prove that statement.",0,0,Daniel Catallo,4pNOCzV5jG0,-0.05416666666666664,2017-07-26 21:48:39,True,True
2017-07-27T04:57:14,"seems like they gave too much away in the trailer, like that powerfull speech",0,0,Kat R.,4pNOCzV5jG0,0.2,2017-07-27 04:57:14,True,True
2017-07-27T12:29:27,مقصوفة الرقبة,0,0,LAST AIR BENDER,4pNOCzV5jG0,0.0,2017-07-27 12:29:27,True,True
2017-07-27T13:03:43,From Drexl to Winston Churchill. Gary Oldman is a true acting genius. Give that man an Oscar!,2,0,uncontrollable343,4pNOCzV5jG0,0.175,2017-07-27 13:03:43,True,True
2017-08-02T04:56:15,"""WILL YOU STOP INTERRUPTING ME WHILE I AM INTERRUPTING YOU?!"" Okay, shut up and take my money. I can feel the cash loosening from my wallet already.",0,0,Booette,4pNOCzV5jG0,0.5,2017-08-02 04:56:15,True,True
2017-08-02T17:00:32,"1:42-1:44. Stannis Baratheon, the Rightful King of the Andals, the Rhoynar, and the First Men, Lord of the Seven Kingdoms, and Protector of the Realm.",0,0,Mr Jenkins,4pNOCzV5jG0,0.25,2017-08-02 17:00:32,True,True
2017-08-02T18:51:09,This looks better than the Brian Cox one. Will still see it though,0,0,Amir Rashid,4pNOCzV5jG0,0.5,2017-08-02 18:51:09,True,True
2017-08-03T01:58:23,"made me tear up a little bit, i have no clue why",0,0,colinies2,4pNOCzV5jG0,-0.1875,2017-08-03 01:58:23,True,True
2017-08-03T13:01:45,Stannis,0,0,Meni69,4pNOCzV5jG0,0.0,2017-08-03 13:01:45,True,True
2017-08-04T05:10:52,My man Gary going for the Oscar,0,0,Tariq,4pNOCzV5jG0,0.0,2017-08-04 05:10:52,True,True
2017-08-05T22:27:08,"Wow, this is Gary Oldman? Unbelievable.",0,0,canuck21,4pNOCzV5jG0,-0.075,2017-08-05 22:27:08,True,True
2017-08-07T15:21:08,"That was a really really nice video, keep it up .. can we do ""sub4sub' I will stay active on your channel if you do the so.. im also doing a ""youtube shoutout series"" you can join if your only subscribe",0,0,Master kong,4pNOCzV5jG0,0.15555555555555556,2017-08-07 15:21:08,True,True
2017-08-07T18:19:10,To watch movies like this and see what the UK has become today is just sad.,0,0,DTOM MERICA,4pNOCzV5jG0,-0.5,2017-08-07 18:19:10,True,True
2017-08-07T19:24:40,Is it a coincidence that this movie is called the same as the game,0,0,calo9000,4pNOCzV5jG0,-0.2,2017-08-07 19:24:40,True,True
2017-08-07T20:32:14,Anthony Hopkins will appear in this film.  Reprising his role as Adolf Hitler.,0,0,Jay John,4pNOCzV5jG0,0.0,2017-08-07 20:32:14,True,True
2017-08-09T14:22:02,could got someone who actually sounded abit like him. but guess dont matter much as most of it will be bullshit anyways. considering all he actually did was give a couple speachs then spent the war in a cabin why others did his job,0,0,shane macleod,4pNOCzV5jG0,0.1,2017-08-09 14:22:02,True,True
2017-08-10T03:36:22,When you realize this guy took over Air Force One when Harrison Ford was president,0,0,The How To Dude,4pNOCzV5jG0,0.0,2017-08-10 03:36:22,True,True
2017-08-12T21:01:49,a masterpiece Gary Oldman i think amazing,0,0,MegaPamanes,4pNOCzV5jG0,0.6000000000000001,2017-08-12 21:01:49,True,True
2017-08-13T01:53:45,After seeing Dunkirk I'm beyond excited for Darkest Hour,0,0,- AbbieOnJupiter -,4pNOCzV5jG0,0.375,2017-08-13 01:53:45,True,True
2017-08-15T03:56:25,"""WOULD YOU STOP INTERRUPTING ME WHILE I AM INTERRUPTING YOU?!""  Me when arguing about my fandom tbh",5,0,- AbbieOnJupiter -,4pNOCzV5jG0,0.0,2017-08-15 03:56:25,True,True
2017-08-15T12:57:09,Stannis! Stannis! Stannis!,0,0,Jon Irenicus,4pNOCzV5jG0,0.0,2017-08-15 12:57:09,True,True
2017-08-17T00:02:42,Gary Oldman really transformed for the role!,0,0,bruh u seen my phone,4pNOCzV5jG0,0.25,2017-08-17 00:02:42,True,True
2017-08-17T19:48:20,Is anyone else getting chills with the speech part in this trailer?,0,0,Dylan Samuel,4pNOCzV5jG0,0.0,2017-08-17 19:48:20,True,True
2017-08-21T22:52:50,1:50 worst reading of that speech ever?,0,0,S W,4pNOCzV5jG0,-1.0,2017-08-21 22:52:50,True,True
2017-08-22T06:30:58,"No need to see more, give the man the Oscar.",0,0,Ray Cervantes,4pNOCzV5jG0,0.5,2017-08-22 06:30:58,True,True
2017-09-02T07:00:08,The speech he gives at the end is the speech of Dunkirk.,0,0,Andre Daniels,4pNOCzV5jG0,0.0,2017-09-02 07:00:08,True,True
2017-09-02T13:40:23,Kind of hoping Gary Oldman gives the performance of his career here.,0,0,Harris Gaming,4pNOCzV5jG0,0.6,2017-09-02 13:40:23,True,True
2017-09-02T20:52:16,I love that 'Gary Oldman' has a larger font than ' Winston Churchill'.,0,0,Angry Fat Boi,4pNOCzV5jG0,0.25,2017-09-02 20:52:16,True,True
2017-09-03T21:46:07,"Gary Oldman is a terrific actor and extremely talented but sadly Brian Cox did a better job of Churchill, Churchill sadly was just poorly written.",0,3,soviet Molotov,4pNOCzV5jG0,-0.03333333333333335,2017-09-03 21:46:07,True,True
2017-09-03T22:57:13,John 3:16- For God so loved the world that He gave His only begotten Son that whosoever believed in Him shall not perish but have everlasting life. /God loves you.,0,0,Andi Rodz,4pNOCzV5jG0,0.35,2017-09-03 22:57:13,True,True
2017-09-04T14:21:28,I thought they said Gary Oldman was in this film?,0,0,Shane Roberts,4pNOCzV5jG0,0.0,2017-09-04 14:21:28,True,True
2017-09-07T21:05:00,"I'll admit that the make up is pretty good. That being said, the CG of the planes looks bad even for early PS2 game standards. It just looks like oscar bait.",0,0,Klonoa7H,4pNOCzV5jG0,-0.009999999999999986,2017-09-07 21:05:00,True,True
2017-09-10T17:37:18,"This will give him the Academy Award, 100%.",2,0,Wellington,4pNOCzV5jG0,0.0,2017-09-10 17:37:18,True,True
2017-09-12T13:21:59,*'Islam in a man is like rabies in a dog'* - Winston Churchill,0,0,Maxima Alba,4pNOCzV5jG0,0.0,2017-09-12 13:21:59,True,True
2017-09-12T13:49:57,1:53:And the best actor hopefully goes to Gary Oldman. Wow his performance is spot on.,1,0,Ian Turner,4pNOCzV5jG0,0.55,2017-09-12 13:49:57,True,True
2017-09-13T16:32:42,"2018 .. and the Oscar goes to ..  Gary Oldman for ""Darkest Hour""",3,0,Paoletta L di Liseno,4pNOCzV5jG0,0.0,2017-09-13 16:32:42,True,True
2017-09-16T22:40:00,1:50 goosebumps,0,0,Aamir Bhayat,4pNOCzV5jG0,0.0,2017-09-16 22:40:00,True,True
2017-09-16T23:54:45,Underrated actor. Can't believe he's only had ONE nomination.,101,6,SkywardPrimeGalaxy,4pNOCzV5jG0,0.0,2017-09-16 23:54:45,True,True
2017-09-17T23:49:41,Another bullshit portrayal of a white supremacist racist fat bastard genocidal maniac as a hero of a country with an embarrassing shameful colonial past.,0,0,hm14,4pNOCzV5jG0,-0.125,2017-09-17 23:49:41,True,True
2017-09-18T01:08:57,"""Nonsense, the only slippery slope...""  ""I HAVEN'T GOT TIME FOR THIS MICKEY MOUSE BULLSHIT!""",0,0,MechaChurchill,4pNOCzV5jG0,0.0,2017-09-18 01:08:57,True,True
2017-09-20T23:22:35,"""would u stop interrupting me while I'm interrupting you!""",0,0,blacmadesjb 2750,4pNOCzV5jG0,0.0,2017-09-20 23:22:35,True,True
2017-09-23T03:07:15,STAAAAAAAAAAAAAAANIIIIIIISSSSSSSSSS,0,0,Gino,4pNOCzV5jG0,0.0,2017-09-23 03:07:15,True,True
2017-09-26T22:50:00,AND THE OSCAR GOES TO.... GARY OLDMAN!,0,0,adriano daruge,4pNOCzV5jG0,0.0,2017-09-26 22:50:00,True,True
2017-09-28T01:23:50,Oscar material.,0,0,Mae Brando,4pNOCzV5jG0,0.0,2017-09-28 01:23:50,True,True
2017-09-28T19:02:36,Is that a fatsuit or did he fuck up his diet for this movie?,0,0,Droidz Hunterz,4pNOCzV5jG0,-0.4,2017-09-28 19:02:36,True,True
2017-09-28T19:07:05,I hear Gary Oldman...  I see no Gary Oldman!,0,0,The Benefits Of Inertia,4pNOCzV5jG0,0.0,2017-09-28 19:07:05,True,True
2017-09-28T19:30:15,"Churchill was a great leader for the western civilization, but it doesn't take away the fact that his actions killed more than million lives in the Indian Sub-continent. It would be a great if the movie portrays him as a leader with many flaws, and not like a saint or a messiah. No one is a messiah, all leaders have flaws, even Gandhi had many.",8,3,Prashant Singh,4pNOCzV5jG0,0.4142857142857143,2017-09-28 19:30:15,True,True
2017-09-28T21:51:05,Name of the song?,0,0,Tom Readings,4pNOCzV5jG0,0.0,2017-09-28 21:51:05,True,True
2017-09-28T22:03:39,"Casual reminder that this guy committed genocide in India, thanks.   (Source : Read a fucking book.)",0,0,Lol JK,4pNOCzV5jG0,-0.30000000000000004,2017-09-28 22:03:39,True,True
2017-09-29T10:13:14,1:45 Pause. That's really creepy.,0,0,Bananas,4pNOCzV5jG0,-0.5,2017-09-29 10:13:14,True,True
2017-09-29T17:42:20,Its Winston!!!!!!!!  wonderful Gary !!!,0,0,Jon gadsby,4pNOCzV5jG0,1.0,2017-09-29 17:42:20,True,True
2017-09-29T23:07:20,what the hell that was gary oldman ?!,0,0,khanage360,4pNOCzV5jG0,0.0,2017-09-29 23:07:20,True,True
2017-09-30T07:04:00,Without victory there can be no survival...,1,0,Nina M,4pNOCzV5jG0,0.0,2017-09-30 07:04:00,True,True
2017-09-30T20:16:20,"But hitler didn't want war with Britain... how can this movie be named ""darkest hour""?",3,6,Amalion,4pNOCzV5jG0,0.0,2017-09-30 20:16:20,True,True
2017-10-01T23:54:49,I found Oldman with a a 1000% zoom in!,0,0,handsom.chris,4pNOCzV5jG0,0.0,2017-10-01 23:54:49,True,True
2017-10-02T00:32:22,"lol fighting hitler makes you just as bad as him, try reasoned debate next time... XD XD",0,0,Dylan mannerslolley,4pNOCzV5jG0,0.0333333333333334,2017-10-02 00:32:22,True,True
2017-10-02T22:48:50,"The pep talk really is powerful. And nice makeup by the way, Gary, must’ve taken most of the film making duration",0,0,Septian Prawisuda Putra,4pNOCzV5jG0,0.4666666666666666,2017-10-02 22:48:50,True,True
2017-10-03T13:58:45,"If Gary Oldman doesn't get his fucking oscarsoon, I will flip a fucking table. I shit you not.  Everyone made such a fucking deal about Dicaprio not getting an oscar sooner, but Oldman has been deserving of one for a long ass time",0,0,MoonyOllie,4pNOCzV5jG0,-0.20714285714285713,2017-10-03 13:58:45,True,True
2017-10-05T08:06:28,"looks and sounds nothing like Churchill wtf.  I recommend people check out 'the gathering storm'.  it is set in the time preceeding ww2 and it really looks into the personal life and motivations of Churchill and its brilliant.  it shows his depression and his sense of destiny, and his family life etc",0,0,manfrombritain,4pNOCzV5jG0,0.15000000000000002,2017-10-05 08:06:28,True,True
2017-10-05T13:20:36,Wow. This is the SAME actor who played Sid Vicious some 30 years ago.   Unbelievable !  What a talent.,0,0,George Orr,4pNOCzV5jG0,-0.303125,2017-10-05 13:20:36,True,True
2017-10-07T06:11:30,My god. This looks so damn good.,0,0,Marcus Siniari,4pNOCzV5jG0,0.7,2017-10-07 06:11:30,True,True
2017-10-08T07:55:06,"Gary Oldman has never been one of my favorite actors but he looks pretty amazing in this and so does the make-up design. It looks like it would be Oscar material and I hope the underrated Kristen Scott Thomas won't be overlooked. She's only been nominated once for The English Patient and that wasn't even her best performance. She is always an excellent actress, though, and is different in all her roles, leading or supporting. What a versatile actress!",0,0,greg herried,4pNOCzV5jG0,0.40694444444444444,2017-10-08 07:55:06,True,True
2017-10-08T17:53:21,Stannis Baratheon guys,0,0,Vasiliki Mitropoulou,4pNOCzV5jG0,0.0,2017-10-08 17:53:21,True,True
2017-10-14T07:58:09,"Commissioner Gordon, Stannis Baratheon and Director Krennic team up, I didn't ask for it, but I strangely love it",0,0,Murray NewBett,4pNOCzV5jG0,0.5,2017-10-14 07:58:09,True,True
2017-10-15T12:46:59,"I wanted to see this right up until I heard the Director rabbit on about it being a ""rebuke to Trump"". I'm out now. F**** Trump and f*** Hollywood's fixation with him. WSC wasn't a saint, but he was a great wartime leader and inspiration to millions. His name should be nowhere near Donald Trump's and shame on the director for doing so. (Edited to remove profanity).",0,0,BARNSLEYTOPPER,4pNOCzV5jG0,0.39523809523809533,2017-10-15 12:46:59,True,True
2017-10-22T14:47:01,Stannis Baratheon VS Sirius Black.  I'm in.,0,0,Mohamed Sherif,4pNOCzV5jG0,-0.16666666666666666,2017-10-22 14:47:01,True,True
2017-10-24T03:37:18,Osssscaaaarsssss,0,0,"Bro, Wtf",4pNOCzV5jG0,0.0,2017-10-24 03:37:18,True,True
2017-10-25T02:04:54,"One of my favorite actors ever. BUT the truth is that Churchill was a war criminal who was as ruthless as Hitler and Stalin. Except he was one of the victors, and history was rewritten to paint him as a hero.",0,0,Cyrus White,4pNOCzV5jG0,-0.3,2017-10-25 02:04:54,True,True
2017-10-25T16:32:36,"Gary Oldman, if anyone deserves 1,2,3... Oscar then that's him.",0,0,MadLane,4pNOCzV5jG0,0.0,2017-10-25 16:32:36,True,True
2017-10-27T15:55:02,From being Beethoven to being Winston Churchill,1,0,Arthur Eustaquio,4pNOCzV5jG0,0.0,2017-10-27 15:55:02,True,True
2017-10-28T20:14:09,1:57 Veet Hair Remover those days..,1,0,Piyush Sharma,4pNOCzV5jG0,0.0,2017-10-28 20:14:09,True,True
2017-10-30T23:19:14,"It will be Gary Oldman’s year this year. It’s his to lose now. He should be a shoe-in! If there is any justice in the world, he should get his hands on that golden trophy!",0,0,Reminisce MOBA,4pNOCzV5jG0,0.375,2017-10-30 23:19:14,True,True
2017-10-31T17:04:21,"I got a goosebump when he says ""never surrender"", i am not even british.",0,0,Minionarmy,4pNOCzV5jG0,0.0,2017-10-31 17:04:21,True,True
2017-11-01T16:46:57,"Ele é tudo o que eu gostaria de ser - Churchill, não Odman, embora ele seja foda também. rs",0,0,Klebson,4pNOCzV5jG0,0.0,2017-11-01 16:46:57,True,True
2017-11-04T07:42:16,History just glorifies the winners. True face of Churchill.    http://www.independent.co.uk/news/world/world-history/winston-churchill-adolf-hitler-no-better-shashi-tharoor-indian-politician-post-colonialist-author-a7641681.html,0,0,Deepak Kumar Ch,4pNOCzV5jG0,0.35,2017-11-04 07:42:16,True,True
2017-11-06T01:25:06,THE. GREATEST. ACTOR. WHO. HAS. EVER. LIVED. PERIOD.,0,0,D Larson,4pNOCzV5jG0,1.0,2017-11-06 01:25:06,True,True
2017-11-09T12:53:54,"Gary Oldman is Sirius Black but OMG he looks sooooooo different. Like you cant even recognize him, how does one change so much in a decade?",0,0,Hamdi Ali hassan,4pNOCzV5jG0,0.011111111111111118,2017-11-09 12:53:54,True,True
2017-11-14T20:11:30,"fuck, gary will win the oscar this years, or i will cut my dick off",0,0,Ricardo,4pNOCzV5jG0,0.2,2017-11-14 20:11:30,True,True
2017-11-15T16:01:45,It's so moving to watch this and to think of my mother and her siblings surviving all of this there.,0,0,Valerie Smith,4pNOCzV5jG0,0.0,2017-11-15 16:01:45,False,True
2017-11-16T00:25:29,Who’s seeing the movie in November?,0,0,Beleck Merchant,4pNOCzV5jG0,0.0,2017-11-16 00:25:29,False,True
2017-11-16T00:49:29,"Day-Lewis already have 3. Give Oldman an Oscar already. Don't do the same thing you did with Peter O'Toole, Hollyweird.",0,0,Clara,4pNOCzV5jG0,0.0,2017-11-16 00:49:29,False,True
2017-11-16T14:16:28,The Oscars doesn't deserve Gary Oldman,0,0,darnbreath,4pNOCzV5jG0,0.0,2017-11-16 14:16:28,False,True
2017-11-17T10:53:22,Who plays Chamberlain? Because that guy's look is spot on too.,0,0,Noel Down,4pNOCzV5jG0,0.0,2017-11-17 10:53:22,False,True
2017-11-19T13:36:41,Mind Blowing!,0,0,Nicholas Pesce,4pNOCzV5jG0,0.0,2017-11-19 13:36:41,False,True
2017-11-19T15:10:26,Churchill the greatest with de Gaulle,0,0,firebirdgao,4pNOCzV5jG0,1.0,2017-11-19 15:10:26,False,True
2017-11-19T17:10:17,I see this trailer everyday working in a theatre. And I can say that speech always gives me goosebumps. I still can't believe Churchill is Gary Oldman. Definitely going to watch what I feel will be a masterpiece.,0,0,Syahmi Rosli,4pNOCzV5jG0,-0.1,2017-11-19 17:10:17,False,True
