timestamp,text,like_count,reply_count,author,trailer_id,sentiment_score,datetime,used_for_model,used_for_visualization
2017-07-13T20:45:27,PLEASE be the one that finally wins Gary Oldman that Oscar he should of got a long time ago,14,2,Bill Proud,4pNOCzV5jG0,0.125,2017-07-13 20:45:27,True,True
2017-07-13T21:01:25,THE BRITISH BULLDOG 💀,4,0,The Master,4pNOCzV5jG0,0.0,2017-07-13 21:01:25,True,True
2017-07-13T21:04:29,white people fantasies,1,2,CaptainEO420,4pNOCzV5jG0,0.0,2017-07-13 21:04:29,True,True
2017-07-13T21:13:35,"Defo gonna watch this! Oldman seems in good shape, figuratively speaking",0,0,Brokenlikefour,4pNOCzV5jG0,0.7,2017-07-13 21:13:35,True,True
2017-07-13T21:36:51,And my silly ass over here waitin on a TARDIS and some Daleks to show up.,0,0,Corey Boyd,4pNOCzV5jG0,-0.5,2017-07-13 21:36:51,True,True
2017-07-13T21:40:31,I hate how the english disguise this crime war man as a hero.,3,1,PALESTINA LIBRE,4pNOCzV5jG0,-0.4,2017-07-13 21:40:31,True,True
2017-07-13T21:56:50,"Give the Oscar to the make up department already. I'm looking at Winston Churchill, not Gary Oldman.",0,0,Joseph Dutra,4pNOCzV5jG0,0.0,2017-07-13 21:56:50,True,True
2017-07-13T22:06:58,"Welp, that's an Oscar waiting to happen.",0,0,Jeff -66,4pNOCzV5jG0,0.0,2017-07-13 22:06:58,True,True
2017-07-13T22:10:03,Daiyyym. Gary Oldman is killing it.,0,0,Pimp Lotion,4pNOCzV5jG0,0.0,2017-07-13 22:10:03,True,True
2017-07-13T22:10:13,I thought it was going to be another Russian alien invasion movie,0,0,dejaviewmaster,4pNOCzV5jG0,-0.125,2017-07-13 22:10:13,True,True
2017-07-13T22:23:48,"Churchill along with Roosevelt supported, funded, and sided with communists in ww2,  committed untold  genocides, bankrupted England, destroyed the British empire and sold out Europe and its peoples. Churchill is largely responsible for the mess Western Europe is in now.",4,4,Odi et Amo,4pNOCzV5jG0,0.0062500000000000056,2017-07-13 22:23:48,True,True
2017-07-13T22:25:01,"I smell Gary Oldman's Academy Award, If that is Dario Marianelli music, I smell his, too!",0,0,Haytham Faisal,4pNOCzV5jG0,0.0,2017-07-13 22:25:01,True,True
2017-07-13T22:26:55,*He gives some good harry potter vibes LOL*,1,0,Voltz,4pNOCzV5jG0,0.75,2017-07-13 22:26:55,True,True
2017-07-13T22:30:22,I love Joe Wright and it's nice to see him return to a more small budget film like this than Pan. Oldman has long deserved an Oscar and this looks like another exceptional performance from him. Count me in,0,0,serialkiller77,4pNOCzV5jG0,0.3277777777777778,2017-07-13 22:30:22,True,True
2017-07-13T22:44:55,when gary oldman shouts all i hear is reznov,1,0,Joelfrezi,4pNOCzV5jG0,0.0,2017-07-13 22:44:55,True,True
2017-07-13T22:53:10,Is this the prequel to Iron Sky?,0,0,TheAndredal,4pNOCzV5jG0,0.0,2017-07-13 22:53:10,True,True
2017-07-13T23:05:31,Will you stop interrupting me while im interrupting you!!!!!!!,0,0,Maximum Qontrol Media,4pNOCzV5jG0,0.0,2017-07-13 23:05:31,True,True
2017-07-13T23:29:11,Gary Oldman deserves every Oscar in the world.,0,0,Ilang Ilang,4pNOCzV5jG0,0.0,2017-07-13 23:29:11,True,True
2017-07-13T23:32:23,Holy Mother of God Oldman is great - again,0,0,John Watson,4pNOCzV5jG0,0.8,2017-07-13 23:32:23,True,True
2017-07-13T23:42:57,Churchill is one of the most beloved leaders and he's the Greatest Wartime leaders of the 20th Century!! This is why I love History!!!! God bless you Mr. Churchill 🙌🏻🇬🇧🇬🇧🇬🇧👏🏻👍🏻👊🏻,0,0,Omar Mufti,4pNOCzV5jG0,0.64,2017-07-13 23:42:57,True,True
2017-07-13T23:43:47,And the Oscar goes to Gary Oldman for the Darkest Hour! 👍🏻👏🏻👏🏻👏🏻👊🏻👊🏻🙌🏻🇬🇧🏆🏆🏆🏆🏆 - Oscars 2018,0,0,Omar Mufti,4pNOCzV5jG0,0.0,2017-07-13 23:43:47,True,True
2017-07-13T23:48:04,why is cinderella doing in this I THOUGHT SHE WAS A PRINCESS,0,0,Movies Now,4pNOCzV5jG0,0.0,2017-07-13 23:48:04,True,True
2017-07-13T23:54:19,"Love him or Hate him, still have to Respect him, We shall fight on the Beaches, we shall fight in the streets and on the hills and we shall never surrender! 👌🇬🇧👏🏻 Love his Quotes and Speeches, it's the best so far",0,0,Omar Mufti,4pNOCzV5jG0,0.22000000000000003,2017-07-13 23:54:19,True,True
2017-07-14T00:09:26,"oldman is by far one of the greatest actors that there has ever neen, cant think of a role big or small where he didn't excel.  even if he wins an Oscar for this it wont mean anything, he should have a wall dedicated to just oscars",0,0,white wolf,4pNOCzV5jG0,0.13958333333333336,2017-07-14 00:09:26,True,True
2017-07-14T00:10:11,wow! one of the Oscar nominee this year,0,0,Julieta Salazar,4pNOCzV5jG0,0.125,2017-07-14 00:10:11,True,True
2017-07-14T00:13:31,Doesn't sound like him though,0,1,Ross Hardman,4pNOCzV5jG0,0.4,2017-07-14 00:13:31,True,True
2017-07-14T00:27:12,"Wonder what Churchill would do about the current moslem invasion that threatens to destroy Western civilization.  We also have our head in the mouth of a tiger, and there is no way out short of killing the tiger which seeks to devour us.",0,0,Glenda Peterson,4pNOCzV5jG0,-0.05,2017-07-14 00:27:12,True,True
2017-07-14T01:36:16,1:24 😂😂😂,0,0,Ant,4pNOCzV5jG0,0.0,2017-07-14 01:36:16,True,True
2017-07-14T01:45:46,"So, they make a Movie about Churchill.  I bet my Life savings that they do NOT!!!!!!!!! mention the controversies; 1. He wanted to GAS PEOPLE IN INDIA!!!!!!!!! 2. That he MIGHT be a Child to the SATANIC scumbag ALISTAIR CROWLEY..  Read in on it.  I feel sorry for Gary Oldman - an AMAZING actor, for doing such an role.",2,4,pekinobo,4pNOCzV5jG0,0.03333333333333336,2017-07-14 01:45:46,True,True
2017-07-14T01:55:05,Wtf fuck another churchill movie... it's like 3rd this year... But o boy Garry Old Man is the best actor alive. He truly vanished into to character.,0,0,Ice&Fire,4pNOCzV5jG0,0.04999999999999999,2017-07-14 01:55:05,True,True
2017-07-14T02:07:16,"And so it all meant nothing. As Germany is now in charge of Europe, and the British people are mocked and made to resent their own culture and history. I was born much too late.",0,0,Lanester 101,4pNOCzV5jG0,0.125,2017-07-14 02:07:16,True,True
2017-07-14T02:43:03,I can only hear Reznov,0,0,Enrico Vavassori,4pNOCzV5jG0,0.0,2017-07-14 02:43:03,True,True
2017-07-14T02:45:34,would you stop interrupting me while I'm interrupting you.,0,0,Nimz Nizam,4pNOCzV5jG0,0.0,2017-07-14 02:45:34,True,True
2017-07-14T02:46:41,Our greatest living actor is giving a Masterclass this November.,0,0,C.C. 95,4pNOCzV5jG0,1.0,2017-07-14 02:46:41,True,True
2017-07-14T03:09:17,"I admit its an Oscar movie, but historically the British were totally  obliterated by the Germans, if it weren't for US they would have been  decimated. The world will and always need the United States of America. A  movies should be made in the Germans angle too!!",0,0,Jobs mine,4pNOCzV5jG0,0.0,2017-07-14 03:09:17,True,True
2017-07-14T03:10:26,"I love Gary Oldman BUT... is anyone else kind of nervous about this? My two cents, Im afraid this will either be absolutely awesome or it's gonna land flat on it's face. Either this might reveal that Oldman is indeed a fallible human and not the god of actors OR he will be knighted for this.  His side profile looks dead on like Churchill but when he looks at the camera, I only see Oldman with prosthetics and when he speaks, Churchill disappears almost entirely.",0,0,Dean Treloar,4pNOCzV5jG0,0.1416666666666667,2017-07-14 03:10:26,True,True
2017-07-14T04:02:37,Can someone please give him a good damn oscar?,0,0,Claudia Torres,4pNOCzV5jG0,0.7,2017-07-14 04:02:37,True,True
2017-07-14T04:09:41,Maybe they will finally give Oldman his much deserved Oscar for this,0,0,Karl Taylor,4pNOCzV5jG0,0.1,2017-07-14 04:09:41,True,True
2017-07-14T04:23:13,"please, give this man an Oscar",0,0,Jose Daniel Castro,4pNOCzV5jG0,0.0,2017-07-14 04:23:13,True,True
2017-07-14T04:39:21,Two words: Gary F'n Oldman!,0,0,GCKelloch,4pNOCzV5jG0,0.0,2017-07-14 04:39:21,True,True
2017-07-14T04:39:37,definitely an oscar for gary oldman,0,0,SYNCpro,4pNOCzV5jG0,0.0,2017-07-14 04:39:37,True,True
2017-07-14T04:50:32,oscar worthy maybe,0,0,Sadagopan Ponmani,4pNOCzV5jG0,0.3333333333333333,2017-07-14 04:50:32,True,True
2017-07-14T05:15:36,"Spoiler Alert, Russia & America saves the day at the end",0,0,NuclearNow_SolarLater,4pNOCzV5jG0,0.0,2017-07-14 05:15:36,True,True
2017-07-14T05:45:22,Someone please give that man an Oscar already,0,0,Harriet Bullock,4pNOCzV5jG0,0.0,2017-07-14 05:45:22,True,True
2017-07-14T05:49:26,Gary oldman is a boss....,0,0,john cabiling,4pNOCzV5jG0,0.0,2017-07-14 05:49:26,True,True
2017-07-14T06:12:15,Darn good trailer. This is Gary Oldman at his best. Can't wait to see this movie.,0,0,Thor Stronghammer,4pNOCzV5jG0,0.85,2017-07-14 06:12:15,True,True
2017-07-14T06:21:11,Give him.the oscar already.,0,0,HIMADRI MONDAL,4pNOCzV5jG0,0.0,2017-07-14 06:21:11,True,True
2017-07-14T07:11:34,Every time he yelled all I could hear was Reznov.,1,0,The lamb Sauce,4pNOCzV5jG0,0.0,2017-07-14 07:11:34,True,True
2017-07-14T07:12:35,kept thinking of that family guy scene where Winston Churchill calls someone a cunt,0,0,street lawyer,4pNOCzV5jG0,0.0,2017-07-14 07:12:35,True,True
2017-07-14T07:15:09,blows out the match like a fucken boss 2:16,0,0,street lawyer,4pNOCzV5jG0,0.0,2017-07-14 07:15:09,True,True
2017-07-14T07:21:26,Oh I hope this is well done. We all know what happened. Gary has to nail this character. If he does...this movie can go very far.,0,0,fish4aking,4pNOCzV5jG0,0.13,2017-07-14 07:21:26,True,True
2017-07-14T07:22:12,I'd say give him the Oscar but... alas... Andy Serkis as Ceaser tops them all.,0,0,Andres Castaño,4pNOCzV5jG0,-0.4,2017-07-14 07:22:12,True,True
2017-07-14T07:48:27,Oh my God.,0,0,joliecide,4pNOCzV5jG0,0.0,2017-07-14 07:48:27,True,True
2017-07-14T07:59:23,Director Krennic ;),0,0,Horatsio,4pNOCzV5jG0,0.25,2017-07-14 07:59:23,True,True
2017-07-14T08:06:52,*CAN U STOP INTERRUPTING ME WHILE IM INTERRUPTING U!!*,0,0,-,4pNOCzV5jG0,0.0,2017-07-14 08:06:52,True,True
2017-07-14T08:42:36,And here I thought John Lithgow was a very good Churchill,0,0,Waiting For A Century,4pNOCzV5jG0,0.9099999999999999,2017-07-14 08:42:36,True,True
2017-07-14T08:46:37,Are you SIRIUS??? That's Gary Oldman?... he looks so Old... man!,0,0,Edgar Irizarry,4pNOCzV5jG0,0.125,2017-07-14 08:46:37,True,True
2017-07-14T08:53:12,looks good! Could be his Oscar.,0,0,Benjamin Jack Kata Finau,4pNOCzV5jG0,0.875,2017-07-14 08:53:12,True,True
2017-07-14T09:54:50,I think we are going to watch a great film this year😀,0,0,مصطفى موسى فليح,4pNOCzV5jG0,0.8,2017-07-14 09:54:50,True,True
2017-07-14T10:48:55,We romanticise the 20th century too much,0,0,Nice meme,4pNOCzV5jG0,0.1,2017-07-14 10:48:55,True,True
2017-07-14T10:49:07,"Seems like it would be a good tie in with ""Dunkirk""",0,0,Danny,4pNOCzV5jG0,0.7,2017-07-14 10:49:07,True,True
2017-07-14T11:35:46,why are people even fighting over who's the better actor betwewn ddl and gary oldman... can't you just appreciate their acting skills and stop with the diva act?,0,0,Grimm Snow,4pNOCzV5jG0,0.25,2017-07-14 11:35:46,True,True
2017-07-14T11:50:09,"I never imagined that, I as a human being, owe churchill for saving the free world. One nation stood against tyranny. One man fought for every single person, living or will live, here on earth.",12,1,John Clifford Konwat,4pNOCzV5jG0,0.11623376623376624,2017-07-14 11:50:09,True,True
2017-07-14T12:02:33,whoever does the makeup is a transformational genius! I bet they could even make me look like Churchill,1,1,Hayley Turner,4pNOCzV5jG0,0.0,2017-07-14 12:02:33,True,True
2017-07-14T12:08:53,control became prime minister way to go smiley!!,0,0,g l,4pNOCzV5jG0,0.0,2017-07-14 12:08:53,True,True
2017-07-14T12:09:56,no matter how much inspirational speeches you include in this movie or high quality soundtrack you gave This bitch is nothing infront of Adolf Hitler or Josef stalin or Franklin delano Roosevelt...,1,0,Sherlock Holmes,4pNOCzV5jG0,0.33,2017-07-14 12:09:56,True,True
2017-07-14T12:17:34,Spoiler: Nazis get rekt.,0,0,Chris Johnson,4pNOCzV5jG0,0.0,2017-07-14 12:17:34,True,True
2017-07-14T12:24:01,Can't wait to see this!,0,0,Tracy Smith,4pNOCzV5jG0,0.0,2017-07-14 12:24:01,True,True
2017-07-14T12:46:12,OSCAR BAIT      But seriously it looks good,0,0,Hello There,4pNOCzV5jG0,0.18333333333333332,2017-07-14 12:46:12,True,True
2017-07-14T12:49:57,the dankest hour,2,0,BojacksBlueNutsack,4pNOCzV5jG0,0.0,2017-07-14 12:49:57,True,True
2017-07-14T13:18:08,I thought Alan Turing and his fellas were the ones who stopped Hitler!!,0,0,Abdellah Najime,4pNOCzV5jG0,0.0,2017-07-14 13:18:08,True,True
2017-07-14T13:45:58,Gary Oldman is one of the last masterful great actors of the 20th century. Completely loses himself in his roles and personifies all the qualities that an actor - an artist - should possess.,8,0,Ouranus,4pNOCzV5jG0,0.3,2017-07-14 13:45:58,True,True
2017-07-14T14:08:51,WHERE IS GARY OLDMAN 🤔 = OSCAR,1,0,El Jibarito,4pNOCzV5jG0,0.0,2017-07-14 14:08:51,True,True
2017-07-14T14:11:34,"I WANT A MOVIE ABOUT THE WAR AGAINST THE ROSTHCHILD FAMILY 🤔 OH, RIGHT THAT NEVER HAPPENED, SADLY",1,0,El Jibarito,4pNOCzV5jG0,-0.10714285714285715,2017-07-14 14:11:34,True,True
2017-07-14T14:18:14,"""WOULD YOU STOP INTERRUPTING ME WHEN IM INTERRUPTING YOU!?"" savage",0,0,First Name,4pNOCzV5jG0,0.0,2017-07-14 14:18:14,True,True
2017-07-14T14:27:17,STANNIS!,0,0,Scarecrow,4pNOCzV5jG0,0.0,2017-07-14 14:27:17,True,True
2017-07-14T14:51:19,Churchill was a great man. He was a deeply flawed man but most if not all great men are deeply flawed.,0,0,Mark Johnson,4pNOCzV5jG0,0.22000000000000003,2017-07-14 14:51:19,True,True
2017-07-14T15:04:37,I smell an Oscar awaits for Gary Oldman,5,0,Goannalizard,4pNOCzV5jG0,0.0,2017-07-14 15:04:37,True,True
2017-07-14T15:13:38,"I wonder if this movie will show the real truth about the Battle of Britain...about my Polish men who bled for britain, and at the end they were betrayed by churchill in Yalta...I bet the Poles won't be even mentioned in this movie even though without them taking part in the battle of britain the brits would speak german language by now...""albiona perfidia"" as your allies say about you, britain! We won't bleed for you once again, britain,  that's for sure...  Polish Patriot!",0,1,Smalec77,4pNOCzV5jG0,0.27499999999999997,2017-07-14 15:13:38,True,True
2017-07-14T15:21:29,"Hopefully, they will give him an Oscar this time!",0,0,justforlaughs,4pNOCzV5jG0,0.0,2017-07-14 15:21:29,True,True
2017-07-14T15:24:10,anyone else feeling quite patriotic,9,0,Isaac,4pNOCzV5jG0,0.0,2017-07-14 15:24:10,True,True
2017-07-14T15:46:44,Fucking Stannis!,0,0,Sandouras,4pNOCzV5jG0,-0.75,2017-07-14 15:46:44,True,True
2017-07-14T15:50:27,waiting for people to bitch about winston churchill on india,0,0,KILLERDOG416,4pNOCzV5jG0,0.0,2017-07-14 15:50:27,True,True
2017-07-14T16:39:25,"I hate Churchill, most overrated fuck face",0,0,j gg,4pNOCzV5jG0,-0.23333333333333336,2017-07-14 16:39:25,True,True
2017-07-14T17:18:57,I still cant believe that that's Oldman in there.,0,0,Yellow King,4pNOCzV5jG0,0.0,2017-07-14 17:18:57,True,True
2017-07-14T17:22:20,Gary Oldman will win the Oscar this time...  good luck,22,1,satyanarayana reddy,4pNOCzV5jG0,0.75,2017-07-14 17:22:20,True,True
2017-07-14T17:34:37,"Plot twist, Winston Churchill becomes the Church of England!",2,0,Mr DizzyWoo B,4pNOCzV5jG0,0.0,2017-07-14 17:34:37,True,True
2017-07-14T17:55:07,Wonder if he will be as good as Albert Finney,1,1,Nicholas Berk,4pNOCzV5jG0,0.7,2017-07-14 17:55:07,True,True
2017-07-14T18:15:23,Not all heroes were capes!!!,0,0,Yorky Gonzalez,4pNOCzV5jG0,0.0,2017-07-14 18:15:23,True,True
2017-07-14T18:35:02,"1:07 STAAAAAAAAAAAAAAAAAAAAAANIIIIIIIIIIIIS!!!!! He never died, he went into a time machine and it teleported him to 1940!",1,0,Roach,4pNOCzV5jG0,0.0,2017-07-14 18:35:02,True,True
2017-07-14T19:04:28,"From the director of Pan ........ SHIT, it's from the director of Pan",1,0,Rapper Riders,4pNOCzV5jG0,-0.2,2017-07-14 19:04:28,True,True
2017-07-14T19:22:07,"Sid Vicious , Beethoven , Lee harvey Oswald , Pontius pilate and now Winston Churchil .... Gary Oldman is GENIUS .",0,0,Salome Tsertsvadze,4pNOCzV5jG0,-1.0,2017-07-14 19:22:07,True,True
2017-07-14T19:40:59,"A perfect example of ""History is written by the victors""    Ironically that was his quote",0,0,Kalinath Katuri,4pNOCzV5jG0,1.0,2017-07-14 19:40:59,True,True
2017-07-14T19:41:47,"oscar for best actor and best Makeup, Keep this comment",745,14,Luis Hugo,4pNOCzV5jG0,1.0,2017-07-14 19:41:47,True,True
2017-07-14T19:57:58,One of the most evil war mongerers and mass murderers of all time.,1,0,Anton Veli Tajan,4pNOCzV5jG0,-0.25,2017-07-14 19:57:58,True,True
2017-07-14T20:10:10,"So... we already know where rhe Academy Award goes this year,  don't we?",0,0,agustin orero,4pNOCzV5jG0,0.0,2017-07-14 20:10:10,True,True
2017-07-14T20:30:34,hope they cover that he was a genocidal white supremacist fascist,0,0,Mumit M,4pNOCzV5jG0,0.0,2017-07-14 20:30:34,True,True
2017-07-14T20:37:15,STANNIS!!!!! WHY ARE YOU NOT SERVING AS A MILITARY COMMANDER?,0,0,polar bond,4pNOCzV5jG0,-0.1,2017-07-14 20:37:15,True,True
2017-07-14T20:59:30,"This time The Academy will not be able to ignore this outstanding actor any more. Well done, Drexl Spivey.. well done, Stansfield... very well done, Mr. Gary Oldman!",0,0,MarcAurelius Brutus,4pNOCzV5jG0,0.4375,2017-07-14 20:59:30,True,True
2017-07-14T21:08:24,"looks good according to the actors skills, and what we can see from this trailer, but what is that absolutely horrible CGI at 00:48 ?",0,0,Pop Ricsi,4pNOCzV5jG0,-0.15000000000000002,2017-07-14 21:08:24,True,True
2017-07-14T21:15:01,Nasty guy but got us through German Nazi era! so he's levelled out!!,0,0,Adam Platell,4pNOCzV5jG0,-0.5,2017-07-14 21:15:01,True,True
2017-07-14T21:36:18,Churchill was a true hero in Britain and the world 🗺 (and Gary Oldman looks like he did a great job for the film),0,0,LegendPilot Legend,4pNOCzV5jG0,0.575,2017-07-14 21:36:18,True,True
2017-07-14T22:01:08,"Churchill, Dunkirk and Darkest Hour? Christ what's with all the WW2 films this year",0,0,English Bloke,4pNOCzV5jG0,0.0,2017-07-14 22:01:08,True,True
2017-07-14T22:12:53,"That last speech in the parliament reminded me off Gary Oldmans speech as Admiral Bishop in Star Citizens ""Senate"" trailer ^^ ""For without victory there can be no survival!""",0,0,Mr. TZER,4pNOCzV5jG0,0.0,2017-07-14 22:12:53,True,True
2017-07-14T22:34:28,His speech was breathtaking he saved Britain,0,0,Shane Becker,4pNOCzV5jG0,1.0,2017-07-14 22:34:28,True,True
2017-07-14T22:49:44,will you stop interrupting me while i am interrupting you. lol Winston showing em whos boss,0,0,Rhema Ime - Albert,4pNOCzV5jG0,0.8,2017-07-14 22:49:44,True,True
2017-07-14T22:50:27,The same guy that plays a Russian badass veteran from CoD WaW plays Churchill? Yes. Yes please.,0,0,Uh oh,4pNOCzV5jG0,0.0,2017-07-14 22:50:27,True,True
2017-07-14T22:51:02,Stephen Dillane appearing in both this and The Crown makes my head hurt.,0,0,Guy Simchony,4pNOCzV5jG0,0.0,2017-07-14 22:51:02,True,True
2017-07-14T23:01:31,"This year's competition for best actor will be Oldman for Darkest Hour, DDL for Phatom Thread and Phoenix for You Were Never Really Here.",0,0,Carlos Man Mz,4pNOCzV5jG0,0.45,2017-07-14 23:01:31,True,True
2017-07-14T23:11:31,Gary Oldman is FUCKING AWESOME... Such an amazing talent...,0,0,Patrick Fox,4pNOCzV5jG0,0.5333333333333333,2017-07-14 23:11:31,True,True
2017-07-14T23:33:47,2:03 He does that speech better than Churchill did.,0,0,Maj0r Lee,4pNOCzV5jG0,0.5,2017-07-14 23:33:47,True,True
2017-07-14T23:37:29,"I mean...this doesn't look that good. Hopefully the movie is, but I'm just not sold on this.",0,0,garygonzalez10,4pNOCzV5jG0,0.7,2017-07-14 23:37:29,True,True
2017-07-14T23:52:01,What no rap music with our history based movies.,2,0,sedwar45,4pNOCzV5jG0,0.0,2017-07-14 23:52:01,True,True
2017-07-15T00:41:12,We still won that pain of a fucking war,0,0,Kenzie Brewer,4pNOCzV5jG0,-0.6,2017-07-15 00:41:12,True,True
2017-07-15T01:27:08,"Gary Oldman is such a great actor, I hope he finally wins his academy award.",0,0,noaH,4pNOCzV5jG0,0.3666666666666667,2017-07-15 01:27:08,True,True
2017-07-15T01:41:38,Oscar for Gary Oldman. Period,0,0,Kashif Yousuf,4pNOCzV5jG0,0.0,2017-07-15 01:41:38,True,True
2017-07-15T02:54:27,Boy does England need a Churchill today!,0,0,Red Wolf,4pNOCzV5jG0,0.0,2017-07-15 02:54:27,True,True
2017-07-15T03:45:16,He's going for that first Oscar.,0,0,Sebastián Abril,4pNOCzV5jG0,0.25,2017-07-15 03:45:16,True,True
2017-07-15T04:00:21,*IMPRESSIVE MAKEUP*,0,0,Ramses Amon RA,4pNOCzV5jG0,1.0,2017-07-15 04:00:21,True,True
2017-07-15T04:21:31,The weight of the world was indeed on his shoulders! And he delivered!!!,3,1,oksana price,4pNOCzV5jG0,0.0,2017-07-15 04:21:31,True,True
2017-07-15T04:23:53,I love this movie already!!!,0,0,oksana price,4pNOCzV5jG0,0.9765625,2017-07-15 04:23:53,True,True
2017-07-15T04:50:24,"So they can properly portray that Churchill wasn't perfect, but they can't make 2Pac out to be flawed on screen? Wtf man lol",1,1,Gnarwhal,4pNOCzV5jG0,0.16,2017-07-15 04:50:24,True,True
2017-07-15T04:58:48,"""Stop interrupting me while I'm interrupting you!!"" ... Nice, I need to use that once in awhile",0,0,Connor McDavid,4pNOCzV5jG0,0.6,2017-07-15 04:58:48,True,True
2017-07-15T08:15:39,The greatest actor to never win an Oscar. Hopefully this film will change that.,0,0,K Ahmed,4pNOCzV5jG0,0.3,2017-07-15 08:15:39,True,True
2017-07-15T08:16:51,CHURCHILL was an IDIOT WHO CAUSED THE DEATH OF MILLIONS OF INNOCENT PEOPLE HE IS ONE OF THE WORST PEOPLE THAT HAVE EVER LIVED,0,0,jadou88,4pNOCzV5jG0,-0.43333333333333335,2017-07-15 08:16:51,True,True
2017-07-15T09:24:28,Public inflation first not up basically excuse,0,0,Noor Goossens,4pNOCzV5jG0,0.06666666666666667,2017-07-15 09:24:28,True,True
2017-07-15T09:55:37,Oh we are in focus again :) ....Greetings from Germany,0,0,iguana,4pNOCzV5jG0,0.5,2017-07-15 09:55:37,True,True
2017-07-15T10:36:26,the english know they would have ended up like france if it weren't for their big brother usa and soviets right ? .. lol,0,1,Really Sarcastic,4pNOCzV5jG0,0.27142857142857146,2017-07-15 10:36:26,True,True
2017-07-15T11:25:29,"Everytime I hear that Churchill ""We will fight them"" speech, I keep waiting for The Trooper to start playing.",0,0,Ron Maiden,4pNOCzV5jG0,0.0,2017-07-15 11:25:29,True,True
2017-07-15T11:41:03,you guys just blow me away yr songs are just absolutely brilliant keep up all the hard work love guys x,0,0,Rebecca Hall,4pNOCzV5jG0,0.36944444444444446,2017-07-15 11:41:03,True,True
2017-07-15T11:57:39,Brilliant,0,0,Dylan Davy,4pNOCzV5jG0,0.9,2017-07-15 11:57:39,True,True
2017-07-15T13:52:34,WOW! I have goosebumps watching this. Churchill we need you now!,0,0,Tony Titcomb,4pNOCzV5jG0,0.15625,2017-07-15 13:52:34,True,True
2017-07-15T17:13:22,At some point last year I was on a break in London and walked past Downing Street. Me and my parents saw this film crew filming someone walking into no. 10 really quickly. So we asked the guy at the gate what was going on and her said it was a scene from this film about Churchill. I am so frigging excited.,0,0,Dan Zetterstrom,4pNOCzV5jG0,0.11458333333333333,2017-07-15 17:13:22,True,True
2017-07-15T17:31:38,And the winner is......Chuck Norris!!!,0,0,Sandor Levai,4pNOCzV5jG0,0.0,2017-07-15 17:31:38,True,True
2017-07-15T17:37:00,"ohh, i thought this is a new darkest hour movie... .. yknow that sci-fi movie when aliens came down  and eats all energy 😂😂",0,0,Nautilus,4pNOCzV5jG0,-0.009595959595959616,2017-07-15 17:37:00,True,True
2017-07-15T18:28:58,Anyone know the trailer music used here?,1,1,S. Raetz,4pNOCzV5jG0,0.0,2017-07-15 18:28:58,True,True
2017-07-15T19:25:29,Brexit! Free from the Eurocrat (german) Superstate.,0,0,gamevalor,4pNOCzV5jG0,0.2,2017-07-15 19:25:29,True,True
2017-07-15T22:44:40,That's Gary Oldman? WTF?,2,0,Graham Black,4pNOCzV5jG0,-0.5,2017-07-15 22:44:40,True,True
2017-07-15T22:45:45,"""Where are you now, Gary Cooper, now that we need you the most."" Before I go watch this movie and Dunkirk, I'll start the download on the newest Call of Duty video game. If it's not finished downloading when I return home, I guess I can discuss current world issues like; hacking, government funding cuts to non-military departments, treason at the highest levels of governments with unstable economy, lack of good health care and what not. I mean, what's going now with movies is lot like what happened in Hollywood before World War 2. Getting people ready war and what not.",0,0,Swift blind justice,4pNOCzV5jG0,0.19270833333333334,2017-07-15 22:45:45,True,True
2017-07-15T22:48:58,"gary oldman -  ""Give me my damn oscar!""",0,0,Demoth,4pNOCzV5jG0,0.0,2017-07-15 22:48:58,True,True
2017-07-16T01:28:12,"For all those people getting their panties in a bunch over the other movie with Churchill ...titled ""Churchill"" with Brian Cox, who is absolutely fantastic in the titular role, that movie only covers a few days before and after D-Day. This one looks to cover a little bit of the pre-war period leading in into the Blitz and Dunkirk. Lets not forget that these two movies are in addition to HBO's 2002  ""The Gathering Storm"" with Albert Finney and 2008 ""Into The Storm"" with Brendan Gleeson, both of whom are terrific in their roles. It seems that every British actor of consequence has to play Churchill in their career. Can't wait to see Garry Oldman's take....",0,2,abcun17,4pNOCzV5jG0,-0.0015625000000000014,2017-07-16 01:28:12,True,True
2017-07-16T01:33:08,144 Germans disliked this video.,0,0,Bryan Norris,4pNOCzV5jG0,-0.2,2017-07-16 01:33:08,True,True
2017-07-16T01:58:41,this movie looks incredible. lets just hope its historically accurate,0,0,P3T3R_WAFFLES,4pNOCzV5jG0,0.65,2017-07-16 01:58:41,True,True
