timestamp,text,like_count,reply_count,author,trailer_id,sentiment_score,datetime,used_for_model,used_for_visualization
2017-07-13T14:04:53,First,1,1,Jacob Brazeau,4pNOCzV5jG0,0.25,2017-07-13 14:04:53,True,True
2017-07-13T14:06:01,Hype,0,0,MovieTrailers,4pNOCzV5jG0,0.0,2017-07-13 14:06:01,True,True
2017-07-13T14:06:04,First        lol not XD,3,1,Patrik Pojsl,4pNOCzV5jG0,0.525,2017-07-13 14:06:04,True,True
2017-07-13T14:06:04,first to comment,0,0,al al,4pNOCzV5jG0,0.25,2017-07-13 14:06:04,True,True
2017-07-13T14:06:34,💗,0,0,art angel,4pNOCzV5jG0,0.0,2017-07-13 14:06:34,True,True
2017-07-13T14:06:37,FIRST COMMENT IN CAPS!!,0,0,Daven Vlack,4pNOCzV5jG0,0.390625,2017-07-13 14:06:37,True,True
2017-07-13T14:07:55,Oscar,14,0,KHD,4pNOCzV5jG0,0.0,2017-07-13 14:07:55,True,True
2017-07-13T14:08:02,Weird prequel to the alien invasion of Moscow,156,2,Shaye Sparks,4pNOCzV5jG0,-0.375,2017-07-13 14:08:02,True,True
2017-07-13T14:08:06,i think my deodorant just commited suicide beacuse it smells like ruttem bodys :(,0,0,Isak Ringkvist,4pNOCzV5jG0,-0.75,2017-07-13 14:08:06,True,True
2017-07-13T14:09:04,"*When you are searching for Gary Oldman but you forget the ""r""* |ó ͟ل͜ò|",279,4,Novadin,4pNOCzV5jG0,0.0,2017-07-13 14:09:04,True,True
2017-07-13T14:09:19,Hopefully this is better than the other Churchill movie released this year. Oldman looks fantastic.,343,5,John O'Malley,4pNOCzV5jG0,0.25833333333333336,2017-07-13 14:09:19,True,True
2017-07-13T14:09:25,Maybe this time he will get the oscar he deserves :),10,1,Olivier Troboë,4pNOCzV5jG0,0.5,2017-07-13 14:09:25,True,True
2017-07-13T14:09:33,wow fatest squad here like,0,0,sai goud,4pNOCzV5jG0,0.1,2017-07-13 14:09:33,True,True
2017-07-13T14:09:34,"Quick question, if they made a movie called, ""Finest Hour"", would is star King K Rool?",6,1,Waheed Abdullah,4pNOCzV5jG0,0.3333333333333333,2017-07-13 14:09:34,True,True
2017-07-13T14:10:29,WHY SO MANY CHURCHILL FILMS COMING OUT THIS YEAR CHEEZ,159,26,Tobias Crane,4pNOCzV5jG0,0.5,2017-07-13 14:10:29,True,True
2017-07-13T14:11:59,this and dunkirk will make a great double feature,59,1,SOWRAB VATTIPALLI,4pNOCzV5jG0,0.4,2017-07-13 14:11:59,True,True
2017-07-13T14:12:04,Can't wait for the comments of people bitching about how awful was Churchill to India. Don't let me down internet.,93,12,David Maldonado,4pNOCzV5jG0,-0.5777777777777778,2017-07-13 14:12:04,True,True
2017-07-13T14:12:41,"This is like the 3rd Winston Churchill adaptation this year, like WTF?",4,1,ParsivalTheFirst,4pNOCzV5jG0,-0.25,2017-07-13 14:12:41,True,True
2017-07-13T14:13:03,prequel to dunkirk,0,0,Isin Le sumérien,4pNOCzV5jG0,0.0,2017-07-13 14:13:03,True,True
2017-07-13T14:13:34,Looks pretty great. I'm glad they aren't making Churchill look like some saint. He had flaws just like most leaders.,684,64,Twists,4pNOCzV5jG0,0.5125,2017-07-13 14:13:34,True,True
2017-07-13T14:14:24,It seems like that guy was trying way too hard for a German accent...idk. That's just me though.,0,0,Chris Holth,4pNOCzV5jG0,-0.14583333333333334,2017-07-13 14:14:24,True,True
2017-07-13T14:15:58,Give this man an Oscar already! #GaryOldmanGOAT,45,2,Roy Zemach,4pNOCzV5jG0,0.0,2017-07-13 14:15:58,True,True
2017-07-13T14:16:34,it's Gary Oldman !!! are you kidding me  ???,0,0,Indrajit 39,4pNOCzV5jG0,0.0,2017-07-13 14:16:34,True,True
2017-07-13T14:16:38,I'm watching for Gary Oldman  commissioner gordan Sirius black Winston Churchill,124,7,Amayreka 97,4pNOCzV5jG0,-0.16666666666666666,2017-07-13 14:16:38,True,True
2017-07-13T14:16:43,You can't reason with a tiger when your head is in its mouth 👌🏼 perfect,0,0,ABM,4pNOCzV5jG0,1.0,2017-07-13 14:16:43,True,True
2017-07-13T14:16:57,I will say whatever it takes to get the top of this comments            I'm gay,1,0,The Samm’s Club,4pNOCzV5jG0,0.45833333333333337,2017-07-13 14:16:57,True,True
2017-07-13T14:17:02,See the start of this trailer with Churchill as not the choice was perfect since he wasn't perfect since he had many flaws. Gary Old man show's that perfectly. Old man is a master chameleon and hope he gets nominated for an academy award for best actor.,0,0,Raghu Seetharaman,4pNOCzV5jG0,0.6166666666666667,2017-07-13 14:17:02,True,True
2017-07-13T14:17:16,"Didnt recognise Oldman until he gave the Tiger speech, it really felt like Gary",121,1,Pontus IFALLATT,4pNOCzV5jG0,0.2,2017-07-13 14:17:16,True,True
2017-07-13T14:17:56,Tinker Tailor Soldier Spy....came then Now...Darkest Hour  Just give him the oscar which he deserved then.......,5,0,8 Ball Maniac Superstar,4pNOCzV5jG0,0.0,2017-07-13 14:17:56,True,True
2017-07-13T14:18:04,"at first I thought, 'god, another Churchill film', but it gave me shivers and now i'm excited.",1,0,ashfaq rahman,4pNOCzV5jG0,0.3125,2017-07-13 14:18:04,True,True
2017-07-13T14:19:28,HELL YES!!!!!!!,0,0,Liam Mellon,4pNOCzV5jG0,0.0,2017-07-13 14:19:28,True,True
2017-07-13T14:19:58,ugh that forced accent with speaking problems,0,1,Antti Ahola,4pNOCzV5jG0,-0.30000000000000004,2017-07-13 14:19:58,True,True
2017-07-13T14:21:07,"At first I fought: Where the hell is Gary Oldman?  Then I realized that he is Churchill, seems like he completely vanishes in this role. once again",1608,31,AB,4pNOCzV5jG0,0.175,2017-07-13 14:21:07,True,True
2017-07-13T14:21:09,"British propaganda with its worst kind ...he once said during a cholera epidemic in India that ""why has not Gandhi died yet""....he was no less than hitler it is just that history always glorifies the ones who won and demonizes the fallen ones.",4,5,united punjab,4pNOCzV5jG0,-0.08333333333333336,2017-07-13 14:21:09,True,True
2017-07-13T14:21:20,the last darkest hour movie i saw alien try to invade Russia,0,0,Tien Tran,4pNOCzV5jG0,-0.125,2017-07-13 14:21:20,True,True
2017-07-13T14:22:02,Yeah it's good and all but what did the British actually contribute in ww2 besides sending fishing boats to pick up soldiers on Dunkirk ?,0,5,T Y,4pNOCzV5jG0,0.2333333333333333,2017-07-13 14:22:02,True,True
2017-07-13T14:22:28,NO FUCKING WAY ......GARY OLDMAN JUST ONE SCENE TOOK HIS OSCAR RIGHT AWAY,0,0,دحيح الافلام,4pNOCzV5jG0,0.2928571428571428,2017-07-13 14:22:28,True,True
2017-07-13T14:24:14,one of the oscar nominee this year. gary oldman,84,3,One Of The Khalid,4pNOCzV5jG0,0.0,2017-07-13 14:24:14,True,True
2017-07-13T14:24:38,gary oldman can play almost any person and still rock it,15,0,Mubashir Abid,4pNOCzV5jG0,0.0,2017-07-13 14:24:38,True,True
2017-07-13T14:25:16,Oscar goes to Gary Oldman.,411,11,Nisma Productions,4pNOCzV5jG0,0.0,2017-07-13 14:25:16,True,True
2017-07-13T14:25:49,"Churchill was one hell of a writer. Start with The Gathering Storm. No it's not boring. Yes, this particular book is about WW2.",0,0,Autobahn Kenobi,4pNOCzV5jG0,0.3333333333333333,2017-07-13 14:25:49,True,True
2017-07-13T14:25:55,Wow. That's Gary Oldman? Damn,79,0,Himayamata,4pNOCzV5jG0,0.1,2017-07-13 14:25:55,True,True
2017-07-13T14:27:13,HAIL HYDRA,0,0,CGCentral HD,4pNOCzV5jG0,0.0,2017-07-13 14:27:13,True,True
2017-07-13T14:28:21,Gary Fatman,0,0,Châu Vĩ Hào,4pNOCzV5jG0,0.0,2017-07-13 14:28:21,True,True
2017-07-13T14:29:57,I know that guy....,0,0,Sayed islam,4pNOCzV5jG0,0.0,2017-07-13 14:29:57,True,True
2017-07-13T14:30:39,Let's hope this next Joe Wright outing is more Atonement and less Pan.,119,1,J Greg,4pNOCzV5jG0,0.11111111111111112,2017-07-13 14:30:39,True,True
2017-07-13T14:30:52,Can't wait!!! <333,0,0,Eady Elias,4pNOCzV5jG0,0.0,2017-07-13 14:30:52,True,True
2017-07-13T14:32:08,Do not interrupt the Mannis when he is interrupting you.,30,2,BritishTeaBagger,4pNOCzV5jG0,0.0,2017-07-13 14:32:08,True,True
2017-07-13T14:32:39,[First 39 seconds] Who's this guy playing Churchill? *GARY OLDMAN IS WINSTON CHURCHILL* WTF THAT'S GARY OLDMAN?,15,0,Ronan Esslemont,4pNOCzV5jG0,-0.125,2017-07-13 14:32:39,True,True
2017-07-13T14:33:01,He was a amazing public speaker,0,0,Ricky,4pNOCzV5jG0,0.30000000000000004,2017-07-13 14:33:01,True,True
2017-07-13T14:33:33,He kind of sounds like droopy dog,0,0,Andy,4pNOCzV5jG0,0.6,2017-07-13 14:33:33,True,True
2017-07-13T14:36:29,Long Awaited Oscar 4 Gary Old Man is coming,63,7,Hammad Asif,4pNOCzV5jG0,0.025,2017-07-13 14:36:29,True,True
2017-07-13T14:37:32,the oscar is coming gary oldman,0,1,hussein abdelraof,4pNOCzV5jG0,0.0,2017-07-13 14:37:32,True,True
2017-07-13T14:39:14,"looks good, Gary oldman killing it again. like always.",6,0,Jr5189,4pNOCzV5jG0,0.7,2017-07-13 14:39:14,True,True
2017-07-13T14:39:15,Holy make up!,0,0,MusgoHBA,4pNOCzV5jG0,0.0,2017-07-13 14:39:15,True,True
2017-07-13T14:39:32,Isn't there a movie already named the darkest hour,0,0,IamKynDoll,4pNOCzV5jG0,0.0,2017-07-13 14:39:32,True,True
2017-07-13T14:42:08,Did I just see Stannis in that trailer??,44,5,Michael Menesse,4pNOCzV5jG0,0.0,2017-07-13 14:42:08,True,True
2017-07-13T14:43:17,"Damn, looks great",1,0,Mark Keller,4pNOCzV5jG0,0.8,2017-07-13 14:43:17,True,True
2017-07-13T14:44:18,He wasn't their first choice?!?! Oh it's ON!....,0,0,JTP,4pNOCzV5jG0,0.48828125,2017-07-13 14:44:18,True,True
2017-07-13T14:45:10,Gary oldman you're amazing hat's off💯,0,0,David Henry,4pNOCzV5jG0,0.6000000000000001,2017-07-13 14:45:10,True,True
2017-07-13T14:46:42,omg I died of happiness😲,0,0,Slow Poke,4pNOCzV5jG0,0.0,2017-07-13 14:46:42,True,True
2017-07-13T14:49:54,Gonna skip this one. Love oldman but i dont like churchill.,5,2,Allan Alberts,4pNOCzV5jG0,0.5,2017-07-13 14:49:54,True,True
2017-07-13T14:50:48,LILY JAMES!!!!!!!,0,0,Chicken Finger,4pNOCzV5jG0,0.0,2017-07-13 14:50:48,True,True
2017-07-13T14:52:28,"dident they already have a movie called the ""darkest hour"" years ago? 😅🤔",0,0,Corey Mckee,4pNOCzV5jG0,0.0,2017-07-13 14:52:28,True,True
2017-07-13T14:55:30,Gary Oldman is a fucking chameleon. I don't think he played the same character twice.,0,0,adviel,4pNOCzV5jG0,-0.3,2017-07-13 14:55:30,True,True
2017-07-13T14:55:47,and the oscar goes to..,0,2,Marly,4pNOCzV5jG0,0.0,2017-07-13 14:55:47,True,True
2017-07-13T14:56:58,This and the Dunkirk movie at the same time? blimey,0,0,webkilla,4pNOCzV5jG0,0.0,2017-07-13 14:56:58,True,True
2017-07-13T14:58:21,Churchill- The sole reason why million died in Bengal famines and the idiot who hated India.,6,1,Roman Slays,4pNOCzV5jG0,-0.5666666666666668,2017-07-13 14:58:21,True,True
2017-07-13T14:59:16,Gary Oldman you fucking chameleon!  One of the greatest actors in my opinion.  Also nice to see Stannis the Mannis getting more roles. Very underrated in GOT.,0,0,NordicRain,4pNOCzV5jG0,0.31,2017-07-13 14:59:16,True,True
2017-07-13T14:59:36,Wasn't there already a Churchill movie this year?,0,0,fiddle,4pNOCzV5jG0,0.0,2017-07-13 14:59:36,True,True
2017-07-13T15:00:00,hope this performance will finally bring Mr Oldman his deserved Oscar,2,0,Elina H,4pNOCzV5jG0,0.0,2017-07-13 15:00:00,True,True
2017-07-13T15:01:58,Oldman proving again he can play anything. An Oscar finally?,29,5,James .Weaver,4pNOCzV5jG0,0.0,2017-07-13 15:01:58,True,True
2017-07-13T15:02:37,im crying,8,1,Soledad Casellis,4pNOCzV5jG0,-0.2,2017-07-13 15:02:37,True,True
2017-07-13T15:07:13,"Gary Oldman -- give him a fucking Oscar, you retarded Muricans.",0,0,VinniV,4pNOCzV5jG0,-0.7,2017-07-13 15:07:13,True,True
2017-07-13T15:08:24,"Gary you sound nothing like Churchill, WTF.",0,0,Carnor Jax,4pNOCzV5jG0,-0.04999999999999999,2017-07-13 15:08:24,True,True
2017-07-13T15:10:15,The best argument against democracy is a five-minute conversation with the average voter.,0,0,brass,4pNOCzV5jG0,0.425,2017-07-13 15:10:15,True,True
2017-07-13T15:11:15,"fuck Churchill, the butcher of millions Indians, Arabs and Africans, let's glorify him",0,0,Patrick Bob,4pNOCzV5jG0,-0.4,2017-07-13 15:11:15,True,True
2017-07-13T15:11:55,"""Would you stop interruptting me while I'm interrupting you"" xD",481,8,Ethan F.,4pNOCzV5jG0,0.0,2017-07-13 15:11:55,True,True
2017-07-13T15:11:59,I didn't see any Whiskey... I am dissapointed,0,0,Peter Stewart,4pNOCzV5jG0,0.0,2017-07-13 15:11:59,True,True
2017-07-13T15:12:31,Stannis Baratheon,2,0,Hill Zach,4pNOCzV5jG0,0.0,2017-07-13 15:12:31,True,True
2017-07-13T15:14:24,GARY!!!!! Deep diving Churchill. The master teaches his master class!,1,0,The Insufferable Tool,4pNOCzV5jG0,0.0,2017-07-13 15:14:24,True,True
2017-07-13T15:15:13,"Joe Wright has done 2 terrible films, The Soloist and Pan. He's also done 1 fantastic film, Hanna. Let's hope this will be on the same list as Hanna.",0,0,onesixgg,4pNOCzV5jG0,-0.19999999999999998,2017-07-13 15:15:13,True,True
2017-07-13T15:15:48,and that's what we call a nomination for #oscars,0,0,Debbie Nina Boc,4pNOCzV5jG0,0.0,2017-07-13 15:15:48,True,True
2017-07-13T15:18:33,my god this looks spectacular,0,0,philanderer,4pNOCzV5jG0,0.6,2017-07-13 15:18:33,True,True
2017-07-13T15:22:06,i can't wait to see if they portray him correctly being nakey all the time,0,0,Lau Riot,4pNOCzV5jG0,0.0,2017-07-13 15:22:06,True,True
2017-07-13T15:24:25,giver this man an oscar....its long overdue,1,3,slipdudu,4pNOCzV5jG0,-0.05,2017-07-13 15:24:25,True,True
2017-07-13T15:25:06,Spoiler: the daleks win them the war,2,0,Chaos is Coming,4pNOCzV5jG0,0.8,2017-07-13 15:25:06,True,True
2017-07-13T15:25:41,And the oscar goes to...,0,1,Sam Thomas,4pNOCzV5jG0,0.0,2017-07-13 15:25:41,True,True
2017-07-13T15:26:07,Who's the better Churchill... Brian Cox or Gary Oldman?,0,0,STAG162,4pNOCzV5jG0,0.5,2017-07-13 15:26:07,True,True
2017-07-13T15:27:19,What is the music?,2,0,Андрей Гаан,4pNOCzV5jG0,0.0,2017-07-13 15:27:19,True,True
2017-07-13T15:29:24,The film's title is more suited for a Trump  movie.,0,0,T,4pNOCzV5jG0,0.5,2017-07-13 15:29:24,True,True
2017-07-13T15:29:26,"You're going up against Dunkirk. Good luck. But this does look good, i'll give it a watch!",0,0,Kevin H,4pNOCzV5jG0,0.7875,2017-07-13 15:29:26,True,True
2017-07-13T15:30:18,This looks awesome! I love Gary Oldman and they made him look almost exactly like Churchill.. Nuts what you can do with makeup and prosthetics,2,1,Liam Wood,4pNOCzV5jG0,0.5833333333333334,2017-07-13 15:30:18,True,True
2017-07-13T15:30:55,Wow. A sequel to Dunkirk already?,0,0,Profectus,4pNOCzV5jG0,0.1,2017-07-13 15:30:55,True,True
2017-07-13T15:33:07,By the way King George in this movie is played by Ben Mendelsohn aka Director Krennic from Rogue One A Star Wars story.,2,1,merdiolu81,4pNOCzV5jG0,0.0,2017-07-13 15:33:07,True,True
2017-07-13T15:34:36,"Be careful not to choke on your aspirations, Director.",0,0,The Democratic People's Republic of Korea,4pNOCzV5jG0,-0.1,2017-07-13 15:34:36,True,True
2017-07-13T15:34:53,gary oldman!!! EVERYONE!!!!,8,0,fighters 606,4pNOCzV5jG0,0.0,2017-07-13 15:34:53,True,True
2017-07-13T15:35:15,Holy Shit that's Gary Oldman?,0,0,The Icon of Sin,4pNOCzV5jG0,-0.2,2017-07-13 15:35:15,True,True
2017-07-13T15:35:46,Great casting!,3,0,Caleb Barkocy,4pNOCzV5jG0,1.0,2017-07-13 15:35:46,True,True
2017-07-13T15:35:46,Gary Oldman does it again!,1,0,BitterladVEVO,4pNOCzV5jG0,0.0,2017-07-13 15:35:46,True,True
2017-07-13T15:38:21,"The cinematography and lighting looks incredible, but the trailer is plain bad. Filled with cliches and goofy lookin.",8,1,Holy Mackerel the Third,4pNOCzV5jG0,0.17714285714285719,2017-07-13 15:38:21,True,True
2017-07-13T15:39:40,Love Gary Oldman!!!! This looks great!,15,1,Princess Thompson,4pNOCzV5jG0,1.0,2017-07-13 15:39:40,True,True
2017-07-13T15:40:19,Wow.,0,0,Brent Perry,4pNOCzV5jG0,0.1,2017-07-13 15:40:19,True,True
2017-07-13T15:41:37,Baby Drivrr,0,0,IvanSteff,4pNOCzV5jG0,0.0,2017-07-13 15:41:37,True,True
2017-07-13T15:41:48,"The movie should be called ""The finest hour"". Today is the darkest hours. Stop white genocide!!!",1,0,Srpska Gora,4pNOCzV5jG0,0.0,2017-07-13 15:41:48,True,True
2017-07-13T15:50:31,*watch,0,0,Ay Sal,4pNOCzV5jG0,0.0,2017-07-13 15:50:31,True,True
2017-07-13T15:53:42,"Damn, wrong alien movie but still a good trailer nonetheless.",0,0,I breathe Napalm,4pNOCzV5jG0,-0.01666666666666668,2017-07-13 15:53:42,True,True
2017-07-13T15:53:43,I thought it was to do with Transformers!,0,0,Cameron180,4pNOCzV5jG0,0.0,2017-07-13 15:53:43,True,True
2017-07-13T15:59:00,"gary oldman, Joaquin phoenix.. i live for next year's award shows",5,0,ang gun,4pNOCzV5jG0,0.06818181818181818,2017-07-13 15:59:00,True,True
2017-07-13T15:59:27,is Am the only one who feels that most European movies are  become old and boring. They are still talking about the old Nazis and forgetting the new Jewish Nazis who  American and European are helping them to kill and steal the land of the  Palestinian people.,0,0,salim D,4pNOCzV5jG0,-0.01636363636363637,2017-07-13 15:59:27,True,True
2017-07-13T16:05:29,"Strange, I haven't seen any complaining Indians yet.",0,0,Qasid Bhatti,4pNOCzV5jG0,-0.05,2017-07-13 16:05:29,True,True
2017-07-13T16:08:20,Oldman finally grows old,0,0,SthaBros,4pNOCzV5jG0,0.05,2017-07-13 16:08:20,True,True
2017-07-13T16:08:32,That's Gary Oldman?! It's almost impossible to recognize him.,527,8,Movieclips Trailers,4pNOCzV5jG0,-0.6666666666666666,2017-07-13 16:08:32,True,True
2017-07-13T16:09:39,Will mers el kabir feature,0,0,Alex Little,4pNOCzV5jG0,0.0,2017-07-13 16:09:39,True,True
2017-07-13T16:12:01,"Stannis, ""the annihilation of our army...""  ...you would know about getting wiped out...",0,0,KiroHahn,4pNOCzV5jG0,0.0,2017-07-13 16:12:01,True,True
2017-07-13T16:22:24,Holy shit!!! This looks Epic. So Dunkirk looks the battle side and Darkest Hour looks at the political side of Dunkirk.,0,0,Sifiso Mpila,4pNOCzV5jG0,-0.096875,2017-07-13 16:22:24,True,True
2017-07-13T16:23:00,This is Gary Oldman's Vito corleone,0,0,I'm not Norm,4pNOCzV5jG0,0.0,2017-07-13 16:23:00,True,True
2017-07-13T16:23:24,"Brian Cox is already doing Churchill movie; so which one will be better? It doesn't really matter, because Timothy Spall already has the best Churchill performance.",0,0,PrankCaster,4pNOCzV5jG0,0.5666666666666667,2017-07-13 16:23:24,True,True
2017-07-13T16:23:28,"Oh God, not another Churdchill mo...GARY OLDMAN!?! Ticket sold!",202,1,MariaVosa,4pNOCzV5jG0,0.0,2017-07-13 16:23:28,True,True
2017-07-13T16:31:35,Exceptional make up of Gary Oldman !!!!! Hats off to the Artist.,0,0,Mayur Ladole,4pNOCzV5jG0,1.0,2017-07-13 16:31:35,True,True
2017-07-13T16:35:57,Okay... I think this movie is definitely going to be nominated for best make up and then hopefully will win it.,0,0,PotterBooksInHindi,4pNOCzV5jG0,0.575,2017-07-13 16:35:57,True,True
2017-07-13T16:36:52,Darkest? So many white people,0,0,Ultimate,4pNOCzV5jG0,0.25,2017-07-13 16:36:52,True,True
2017-07-13T16:41:28,Wow! Gary # Oscar buzz,2,0,Richard Perez,4pNOCzV5jG0,0.125,2017-07-13 16:41:28,True,True
2017-07-13T16:41:45,Oscar race is Over. Gary is coming,0,1,mehmood ahmed,4pNOCzV5jG0,0.0,2017-07-13 16:41:45,True,True
2017-07-13T16:43:47,garbage.,0,0,Nicko TV,4pNOCzV5jG0,0.0,2017-07-13 16:43:47,True,True
2017-07-13T16:46:19,YES!!! I'M SO HYPED!!!!!!!!!! THIS LOOKS AMAZING!!!,3,0,Alex,4pNOCzV5jG0,1.0,2017-07-13 16:46:19,True,True
2017-07-13T16:50:41,Gary Oldman = best actor ever,32,0,Cossacorum Terror,4pNOCzV5jG0,1.0,2017-07-13 16:50:41,True,True
2017-07-13T16:58:41,Don't mention the war for gawds sake.,0,0,Bazz le bleu,4pNOCzV5jG0,0.0,2017-07-13 16:58:41,True,True
2017-07-13T16:58:52,Which is more Impressive ?  portraying a real life figure and copying all his mannerisms and accent or taking his persona and aura just like George c Scott did as Patton?,0,0,I'm not Norm,4pNOCzV5jG0,0.5666666666666667,2017-07-13 16:58:52,True,True
2017-07-13T17:00:17,This soundtrack makes me feel like I can do anything.,0,0,Lawrence Kajura,4pNOCzV5jG0,0.0,2017-07-13 17:00:17,True,True
2017-07-13T17:00:55,Real weight?,0,0,Slider2k,4pNOCzV5jG0,0.2,2017-07-13 17:00:55,True,True
2017-07-13T17:02:29,"Oscar, don't betray this guy.",153,3,kingnish,4pNOCzV5jG0,0.0,2017-07-13 17:02:29,True,True
2017-07-13T17:07:37,"Strong movie , master piece",1,0,GSMHONDURAS Android Store,4pNOCzV5jG0,0.4333333333333333,2017-07-13 17:07:37,True,True
2017-07-13T17:10:06,"This is EPIC. How many of you didn't expect this coming, especially Gary oldman as Churchill.....?",0,1,Anand M,4pNOCzV5jG0,0.19999999999999998,2017-07-13 17:10:06,True,True
2017-07-13T17:17:23,Stannis Baratheon and Commissioner Gordon in an argument...,106,0,Buenomars,4pNOCzV5jG0,0.0,2017-07-13 17:17:23,True,True
2017-07-13T17:19:43,"It's Oscar time, baby!",0,0,Pengroves,4pNOCzV5jG0,0.0,2017-07-13 17:19:43,True,True
2017-07-13T17:27:57,"Wow, Gary's makeup made me not notice he was the main character. He better get a nom for this.",1,0,acrescool,4pNOCzV5jG0,0.25555555555555554,2017-07-13 17:27:57,True,True
2017-07-13T17:28:13,I smell oscar for gary oldman,2,0,Almohanad M,4pNOCzV5jG0,0.0,2017-07-13 17:28:13,True,True
2017-07-13T17:31:53,"Ho please fuck off!!! Churchill was a racist, narcissist mass murderer. END OF STORY.",0,0,avinash kumar,4pNOCzV5jG0,-0.78125,2017-07-13 17:31:53,True,True
2017-07-13T17:41:36,And the Oscar goes to... :),0,0,berogabber,4pNOCzV5jG0,0.5,2017-07-13 17:41:36,True,True
2017-07-13T17:44:28,"As much as I adored John Lithgow's Churchill in The Crown, Gary Oldman can do no wrong. This looks fantastic.",2,0,Yamin Thein,4pNOCzV5jG0,0.2833333333333334,2017-07-13 17:44:28,True,True
2017-07-13T17:53:15,"To prepare for this role, Gary Oldman gained 100 pounds and invaded Germany.",0,0,Jim Culver,4pNOCzV5jG0,0.0,2017-07-13 17:53:15,True,True
2017-07-13T17:53:26,"This looks good. But for amazing Churchill performance, albeit an older one, watch The Crown, season 1, to see masterful John Lithgow. He is soo good. Also, Dillane (Stannis from GoT) is playing in Crown too :)",6,0,Vedran Bileta,4pNOCzV5jG0,0.6111111111111112,2017-07-13 17:53:26,True,True
2017-07-13T17:55:00,"Next year, someone please edit this and dunkirk together to make one hell of an Epic !!!",52,5,Vaibhav Kumar,4pNOCzV5jG0,0.09765625,2017-07-13 17:55:00,True,True
2017-07-13T18:00:13,"They stole that ""will you stop interrupting me while I'm interrupting you"" from Carousel of Progress",0,0,Rebecca Bain,4pNOCzV5jG0,0.0,2017-07-13 18:00:13,True,True
2017-07-13T18:14:03,"Not that I'm doubting Gary Oldman's acting capabilities, he's an absolutely fantastic actor - but something about this seems off.",0,0,DiiGiiTAL. exe,4pNOCzV5jG0,0.2,2017-07-13 18:14:03,True,True
2017-07-13T18:14:16,If Gary doesn't win the Oscar with this movie I'm gonna sue the academy and also cry.,2,0,Vivi,4pNOCzV5jG0,0.8,2017-07-13 18:14:16,True,True
2017-07-13T18:20:43,i think gary oldman will nailed this role right here,0,0,Kendri Nawaskoro,4pNOCzV5jG0,0.2857142857142857,2017-07-13 18:20:43,True,True
2017-07-13T18:22:07,"*Fuck Churchill, closet commie bastard*.",0,0,spectrebeast,4pNOCzV5jG0,-0.4,2017-07-13 18:22:07,True,True
2017-07-13T18:28:49,The Oscar for Best Actor goes to Mr Gary Oldman,0,0,benjamin Levi Oscar Tasker,4pNOCzV5jG0,1.0,2017-07-13 18:28:49,True,True
2017-07-13T18:30:56,Looks WAY better than that other Churchill movie,0,0,Alex,4pNOCzV5jG0,0.1875,2017-07-13 18:30:56,True,True
2017-07-13T18:38:43,"Ammm, huhhh, the ending line is almost same as Squadron 42: Bishop Senate Speech ending line?",0,0,Gábor Vas,4pNOCzV5jG0,0.0,2017-07-13 18:38:43,True,True
2017-07-13T18:39:01,I wanted John Lithgow,0,0,Aryan Anand,4pNOCzV5jG0,0.0,2017-07-13 18:39:01,True,True
2017-07-13T18:40:45,Just give a Gary Oldman to Oscar already,2,0,Guilherme,4pNOCzV5jG0,0.0,2017-07-13 18:40:45,True,True
2017-07-13T18:41:18,"When Leo won an Oscar last year, Gary Oldmen became the next actor who's never won one but who should have many",1,0,ChannelLyoko,4pNOCzV5jG0,0.16666666666666666,2017-07-13 18:41:18,True,True
2017-07-13T18:47:33,And the Oscar goes to Gary Oldman. This looks like Daniel Day Lewis in Lincoln and Philip Seymour Hoffman in Capote level of transformation.,2,0,supermariofan03,4pNOCzV5jG0,0.0,2017-07-13 18:47:33,True,True
2017-07-13T18:49:44,I'm remember that haha 😂 the exception of the world war ll is rights? Lily James Plays the best?,0,0,Johana Bonilla,4pNOCzV5jG0,0.6,2017-07-13 18:49:44,True,True
2017-07-13T19:03:56,fucking gary oldman? I don't think I'd ever notice if they didn't tell me....,0,0,LE0NSKA,4pNOCzV5jG0,-0.6,2017-07-13 19:03:56,True,True
2017-07-13T19:09:27,oh boy!,0,0,Eze Eche,4pNOCzV5jG0,0.0,2017-07-13 19:09:27,True,True
2017-07-13T19:10:29,Man what's with the tidal wave of Churchill movies,1,0,AlienMidget123,4pNOCzV5jG0,0.0,2017-07-13 19:10:29,True,True
2017-07-13T19:10:33,0:50 what plane is that? I don't recognize it,0,0,Noah Brinkman,4pNOCzV5jG0,0.0,2017-07-13 19:10:33,True,True
2017-07-13T19:13:10,this movie should also show the atrocities inflicted by this person on the colonies. He was worse than hitler.,5,5,Jaypal Chudasama,4pNOCzV5jG0,-0.4,2017-07-13 19:13:10,True,True
2017-07-13T19:16:59,I can see Gary Oldman finally winning an Oscar for this.,1,0,Abdullah Mahmood [FA17-BEE-065],4pNOCzV5jG0,0.5,2017-07-13 19:16:59,True,True
2017-07-13T19:55:26,Reznov is leading Britain.,0,0,Spent Lizard,4pNOCzV5jG0,0.0,2017-07-13 19:55:26,True,True
2017-07-13T20:12:17,I'd like to see Gary Oldman finally win an Academy Award for this.,7,0,Jared Wignall,4pNOCzV5jG0,0.8,2017-07-13 20:12:17,True,True
2017-07-13T20:13:35,"I'll give them credit that they didn't  call this ""Winston"" or ""Churchill"".",1,1,Jeff T,4pNOCzV5jG0,0.0,2017-07-13 20:13:35,True,True
2017-07-13T20:15:31,You already surrendered long ago...to Rothschild.,2,0,Ordinary An,4pNOCzV5jG0,-0.05,2017-07-13 20:15:31,True,True
2017-07-13T20:22:31,The Greatest Story Never Told.,7,1,Ordinary An,4pNOCzV5jG0,1.0,2017-07-13 20:22:31,True,True
2017-07-13T20:36:45,"This stirs something very deep in me as a British Citizen, it just shows that we can produce truly GREAT leaders.",49,16,Josh Speed,4pNOCzV5jG0,0.26666666666666666,2017-07-13 20:36:45,True,True
2017-07-13T20:36:50,Love Gary oldman,0,0,TheMrFloozies,4pNOCzV5jG0,0.5,2017-07-13 20:36:50,True,True
2017-07-13T20:39:17,so there goes the Oscar for best actor ........,0,0,Honey Lindsay,4pNOCzV5jG0,1.0,2017-07-13 20:39:17,True,True
2017-07-13T20:44:43,Gary Oldman......LEGEND,0,0,Nayden,4pNOCzV5jG0,0.0,2017-07-13 20:44:43,True,True
