timestamp,text,like_count,reply_count,author,trailer_id,sentiment_score,datetime,used_for_model,used_for_visualization
2018-01-13T19:44:23,I have just seen this film. What a brilliant film it is. Gary Oldman should win a BAFTA and a OSCAR.,7,3,Julie N,4pNOCzV5jG0,0.8500000000000001,2018-01-13 19:44:23,False,True
2018-01-14T10:39:46,Fantastic film ...wonderful performance by Gary Oldman.,1,0,Mal Yates,4pNOCzV5jG0,0.4,2018-01-14 10:39:46,False,True
2018-01-14T17:32:18,Stannis,0,0,Arun Kumar L.d,4pNOCzV5jG0,0.0,2018-01-14 17:32:18,False,True
2018-01-15T00:12:05,Just got back from theater... I was really moved by this movie. It really captures the essence of those troubled times. Gary Oldman's incarnation is beyond what words can express.,12,0,Lacroix en fonte,4pNOCzV5jG0,-0.024999999999999994,2018-01-15 00:12:05,False,True
2018-01-15T09:30:00,"Movie about a drunk who refused peace offerings prior to ww2, dragged the U.K into a war that didn’t serve the people and sanctioned terror bombings(war crimes) of women and children killing from 350-650,000 innocents. Zionist puppet",2,2,Shane Ware,4pNOCzV5jG0,-0.25,2018-01-15 09:30:00,False,True
2018-01-15T12:30:37,Looks like this movie is gonna be overlooked by the awards again simply cause its about british in ww2 Like they did to dunkirk,1,0,rockzs74r,4pNOCzV5jG0,0.0,2018-01-15 12:30:37,False,True
2018-01-15T21:12:44,Looks like a way better love story than Dunkirk.,0,0,Praxographist,4pNOCzV5jG0,0.5,2018-01-15 21:12:44,False,True
2018-01-16T03:41:27,i ca't recognize Gary,0,0,Minh Tuấn Bùi,4pNOCzV5jG0,0.0,2018-01-16 03:41:27,False,True
2018-01-16T14:34:28,Before this video starts there's a 5 seconds ad about this movie.,0,0,Hamish Lam,4pNOCzV5jG0,0.0,2018-01-16 14:34:28,False,True
2018-01-17T01:18:00,"For a drama, this be a hella epic trailer.",0,0,Jfreek5050,4pNOCzV5jG0,0.1,2018-01-17 01:18:00,False,True
2018-01-17T09:18:56,I haven't seen this film yet but I keep hearing that it is a really good film,0,0,JT thorn,4pNOCzV5jG0,0.7,2018-01-17 09:18:56,False,True
2018-01-17T23:42:04,"St. Churchill, the mighty power ranger... wonderbra woman is still being missed for some sword action",0,0,kapuzinergruft,4pNOCzV5jG0,0.25,2018-01-17 23:42:04,False,True
2018-01-18T20:06:49,I saw this movie last weekend.  I was VERY impressed.  Excellent!,0,0,Douglas Green,4pNOCzV5jG0,0.6666666666666666,2018-01-18 20:06:49,False,True
2018-01-18T20:51:40,"I just back from movie! I am really shoked! That was amazing , Gary Oldman thank you for your role !",0,0,Mari Margaryan,4pNOCzV5jG0,0.3333333333333333,2018-01-18 20:51:40,False,True
2018-01-19T03:50:33,""" we shall defend our island, whatever the cost may be"" Britian really didn't want to give up did they?",0,0,Nathan David,4pNOCzV5jG0,0.2,2018-01-19 03:50:33,False,True
2018-01-19T20:51:02,That speech...goosebumps. Very much like Theoden's speech in LOTR.,0,0,Alex Brown,4pNOCzV5jG0,0.26,2018-01-19 20:51:02,False,True
2018-01-20T01:14:39,I thod Churchill was fatter,0,0,Boris,4pNOCzV5jG0,0.0,2018-01-20 01:14:39,False,True
2018-01-20T04:35:52,Winston Churchill was racist... Bengal famine.. He was responsible.,1,0,neil paleja,4pNOCzV5jG0,0.2,2018-01-20 04:35:52,False,True
2018-01-20T12:02:31,"Looks great - hopefully the film won't suffer the same god-awful, cliche'd music as the trailer.",0,0,Ray Stroud,4pNOCzV5jG0,0.4,2018-01-20 12:02:31,False,True
2018-01-21T07:50:39,"music at the end? Thanks.  edit: Position Music - Mission Zero (2WEI - ""Darkest Hour"" Trailer Music)",0,0,Κανάλι,4pNOCzV5jG0,0.2,2018-01-21 07:50:39,False,True
2018-01-21T12:06:23,"I just got back from watching it, I found it a little boring but i'm also a teenager so maybe thats why, my dad seemed to really enjoy it though.",0,0,Ishika Grace Abbott,4pNOCzV5jG0,-0.196875,2018-01-21 12:06:23,False,True
2018-01-21T18:22:12,One of the best performance I've ever seen,1,0,Phani Srinivasan G,4pNOCzV5jG0,1.0,2018-01-21 18:22:12,False,True
2018-01-21T21:46:44,"I saw this film at the cinema this afternoon in Zürich. I'm still almost speechless, amazing cinematography, creativity, make-up, lighting and acting. This is what cinema should be about. Beautiful",0,0,Mike Jones,4pNOCzV5jG0,0.4833333333333334,2018-01-21 21:46:44,False,True
2018-01-22T21:27:46,What is the name of the Queen Again?..lol,0,0,K. R.,4pNOCzV5jG0,0.0,2018-01-22 21:27:46,False,True
2018-01-22T22:15:19,The voice isn't right.,0,0,craig l,4pNOCzV5jG0,0.2857142857142857,2018-01-22 22:15:19,False,True
2018-01-23T00:09:56,Looking forward to see this...,0,0,nancy Vega,4pNOCzV5jG0,0.0,2018-01-23 00:09:56,False,True
2018-01-23T05:14:10,Eu is nazi !!!!,1,0,川普必胜,4pNOCzV5jG0,0.0,2018-01-23 05:14:10,False,True
2018-01-23T15:13:35,Oscar for the best possible manipulation of the Sir Winston Churchill saga,1,0,Asim Nabi,4pNOCzV5jG0,0.5,2018-01-23 15:13:35,False,True
2018-01-23T16:25:46,Probably the one thing that will prevent this movie from doing very well at the OSCARS is that not enough time is devoted to how the USA won the Second World War all on its own.  Apparently.,0,0,76 juno,4pNOCzV5jG0,0.17,2018-01-23 16:25:46,False,True
2018-01-23T17:21:40,Gary Oldman 👏👏👏👏👏👏👏👏,0,0,David Saad,4pNOCzV5jG0,0.0,2018-01-23 17:21:40,False,True
2018-01-23T18:55:26,Can tell its Gary oldman at 1.15.,0,0,Sam Horder,4pNOCzV5jG0,0.0,2018-01-23 18:55:26,False,True
2018-01-23T21:22:01,movies to polish the image of an imperialist scum!,0,0,3:51 AM,4pNOCzV5jG0,-0.375,2018-01-23 21:22:01,False,True
2018-01-24T00:27:17,that phrase is the most inspiring of the 20th century,1,0,Man of Culture Allanzo,4pNOCzV5jG0,0.3333333333333333,2018-01-24 00:27:17,False,True
2018-01-24T05:28:06,"YOU CANNOT REASON WITH A TIGER, WHEN YOUR HEAD IS IN IT’S MOUTH! Gary Oldman for the OSCAR WIN!!!!!",0,0,Grant Paulsen,4pNOCzV5jG0,1.0,2018-01-24 05:28:06,False,True
2018-01-24T08:46:33,"His last sentence, ""Without Victory, there can be no survival.""...Watch Bishop Senate speech from the game Squadron 42. And notice his last sentence. (Also, Gary Oldman doing the voice.)",0,0,darkjester53,4pNOCzV5jG0,-0.13333333333333333,2018-01-24 08:46:33,False,True
2018-01-24T08:47:46,JewTube,1,0,nj13 nj13,4pNOCzV5jG0,0.0,2018-01-24 08:47:46,False,True
2018-01-24T09:02:57,so it should be the churchill : li GARY OLDMAN !,0,0,Fletcher Human,4pNOCzV5jG0,0.0,2018-01-24 09:02:57,False,True
2018-01-24T10:05:12,I love Gary Oldman & he better get all the Awards for his portrayal of Winston Churchill!!!,0,0,DONNA,4pNOCzV5jG0,0.73828125,2018-01-24 10:05:12,False,True
2018-01-24T12:14:25,Amazing film! I don't think I can sleep till I watch this movie!,0,0,Santhush Fernando,4pNOCzV5jG0,0.9375000000000001,2018-01-24 12:14:25,False,True
2018-01-24T20:35:01,And the oscar goes to,0,0,SOBANGCHA,4pNOCzV5jG0,0.0,2018-01-24 20:35:01,False,True
2018-01-25T10:55:49,And the oscar goes to gary oldman...for darkest hour....👏👏👏👏,0,0,Xavier Vinod,4pNOCzV5jG0,0.0,2018-01-25 10:55:49,False,True
2018-01-26T10:44:36,"Oh no, looks like the Dark Side has won. King George VI, more like King Krennic I.",1,0,Jonnny Ren,4pNOCzV5jG0,0.175,2018-01-26 10:44:36,False,True
2018-01-27T02:38:05,And decades later.. was it worth it?,0,0,nelson lopez-toledo,4pNOCzV5jG0,0.15,2018-01-27 02:38:05,False,True
2018-01-27T09:52:13,I have admired Gary Oldman's acting since I first saw him as the villain in The Professional.,0,0,Gerald Simon,4pNOCzV5jG0,0.11666666666666665,2018-01-27 09:52:13,False,True
2018-01-27T16:01:33,Coxy!,0,0,Embittered Drunk,4pNOCzV5jG0,0.0,2018-01-27 16:01:33,False,True
2018-01-28T09:52:00,"That movie is only a pathetic propaganda story without any sense of historical reality. There was never real accurate risk that the NSDAP Germany and the Axis could conquer Britannia, because the Britannia was and is still today very easy to defend and very difficult to conquer. Besides the Royal Navy was much stronger and much powerful than the relatively weak German Kriegsmarine. Winston Churchill himself told that he was during the WWII only little worried about the German Kriegsmarine U-boat submarines. He was never worried that Germany could conquer Britannia, because it was very unrealistic and Germany had not enough naval and air force military power to seriously thereat Britannia and Adolf Hitler and all his military commanders knew it too. Hitler and the German NSDAP government wanted desperately fair peace treaty with Britannia and probably only because the WWI lost areas of the German Empire back in Europe. Hitler never wanted conquer the world and to the Soviet Union he attacked practically only because the German modern army needed desperately mush more oil than Germany was possible to get. Then the Royal Air Force was too nearly as strong as Luftwaffe and the RAF had huge military strategy advantage, because they were defending Britannia, which is a big Atlantic Ocean island near Europe. The German pilots who were shot down alive were arrested and transported to the British war prisoner camps when the British pilots who were shot down alive returned soon back to flying. Britannia is a natural sea fortress commonly as a country, very easy to defend. Winston Churchill was by the way personally a white race supremacist, who though that the human rights belong to the white race only, especially to the white British people. He wanted that the colonial power of the British Empire lasts forever and the white race British people shall rule it forever as the master race. He liked Benito Mussolini and he liked even Adolf Hitler, before he realized that the NSDAP government in Germany is simply too good and too effective to ""Make Germany Great Again"". Only few years of Adolf Hitler´s and the NSDAP´s  power in Germany made Germany again the leading economics in Europe together with Britannia. Winston Churchill only saw again rising German economic and industrial power a serous threat to the interests of Britannia, just like he saw the rising German Empire´s economic, industrial and military power a threat to Britannia before the WWI. Well, the British Empire collapsed quite soon after the WWII Pyrrhic victory and that old fool practically only helped the Stalin´s Soviet Union and the Red Army to conquer and occupy half Europe and to force it to under brutal communistic dictatorship, when Germany and the Axis allies were defending bourgeois civilized Europe against communism and communistic terror. Many people here in continental Europe remember so well what that Winston Churchill did. He was not a hero, only a bombastic nationalistic old fool and a British white race supremacist, in his own fantasy world, without sense of political realism and traditional common sense. He disliked Adolf Hitler only because they both wanted to make their countries great. There were simply two bombastic nationalistic great divas and landscape view art painters at the political theatre stage of Europe during that time, Adolf Hitler and Winston Churchill. Only real difference between them was family background. Winston Churchill did born to one of the wealthiest British aristocracy family in the most bombastic private palace in Britannia when Adolf Hitler was a son of an average lower middle class family and a real WWI Imperial German Army war hero with the 1st class and the 2th class Iron Cross military honour medals. Adolf Hitler was too one of the historical founding fathers of the European welfare state thinking together with the Chancellor Otto von Bismarck of the German Empire before him and the Prime Minister Tage Erlander of Sweden after the WWII. Hitler was a friend of the worker class people in Germany, a nationalistic socialist (social democrat), when Winston Churchill deeply disliked the British working class people and the British Labour Party. He even compared in his public radio speech the Labour Party to the NSDAP Gestapo before the parliamentary election in Britannia after Germany surrendered in Europe though millions of working class young men had just fought, wounded and died for Britannia at the WWII. Surprise, Winston Churchill and the Tory-party lost the election. Greetings from Northern Europe, Finland! :)",0,0,GBOY69GAY,4pNOCzV5jG0,0.049437069813176,2018-01-28 09:52:00,False,True
2018-01-28T20:15:45,Well done Gary,0,0,Migida de silva,4pNOCzV5jG0,0.0,2018-01-28 20:15:45,False,True
2018-01-29T21:42:09,its so good!,0,0,Scott Matthew,4pNOCzV5jG0,0.875,2018-01-29 21:42:09,False,True
2018-01-31T11:34:27,STANNIS! <3,0,0,Todor Dikovski,4pNOCzV5jG0,1.0,2018-01-31 11:34:27,False,True
2018-01-31T11:42:17,"This is so fucking sad. Why are some people still celebrating this villain (Churchill)?? He is one of those people in history who laid the groundwork for our ""multicultural"" Europe today. Look at Paris, Dublin, London, Stockholm and Germany today, totally swamped with third worlders that has taken over, thanks to todays leaders and stupid voters and yesterdays leaders like Churchill.  I don't think Hitler or any nationalsocialist leader of today if Germany have won the war would have open up Europes borders and let in millions of third worlders to take over our cities.  It's fucking sad that idiots celebrate this super-villain. These movies will be thrown to the trashcan at the latest hour, when Europeans have finally woken up. It's useless to make these movies since they will not be appriciated a few years from now anyway.",0,0,Dr Cringe,4pNOCzV5jG0,-0.2,2018-01-31 11:42:17,False,True
2018-01-31T16:50:32,"This movie was terrible. I was bored stiff. Churchill looks like an old drunkard, dithering and doubtful fool.  Many cringeworthy scenes too,",0,0,Thimble,4pNOCzV5jG0,-0.319047619047619,2018-01-31 16:50:32,False,True
2018-02-01T02:55:28,Only came for 2wei’s song,0,0,G M,4pNOCzV5jG0,0.0,2018-02-01 02:55:28,False,True
2018-02-01T14:55:16,Can someone please tell me which song is used as background score in this trailer ?,0,0,DIP PANDYA,4pNOCzV5jG0,0.0,2018-02-01 14:55:16,False,True
2018-02-02T05:05:58,Oscar in German?,0,0,Ultimate,4pNOCzV5jG0,0.0,2018-02-02 05:05:58,False,True
2018-02-02T13:18:44,this lily whateverr is pushed into every movie coming out. I just cannot bear her any more. Most often she is inappropriate and least original. Looking the same in every movie. I get it she is in someone's bed. Let him tolerate this lady. Not the viewers.,0,0,roma7734,4pNOCzV5jG0,0.215,2018-02-02 13:18:44,False,True
2018-02-03T17:53:35,My heart started beating fast when I started to analyze the cinematography. I am indeed loving it,0,0,Rein Tenshi,4pNOCzV5jG0,0.4,2018-02-03 17:53:35,False,True
2018-02-03T23:18:52,"hteo sam da odem na porn hub, ali posle ovog trejlera nemam potrebu za tim.",0,0,Bole Physique,4pNOCzV5jG0,0.0,2018-02-03 23:18:52,False,True
2018-02-04T21:05:22,"Lithgow is very much better Churchill in The Crown,but Gary is good.",0,0,Rocket,4pNOCzV5jG0,0.6,2018-02-04 21:05:22,False,True
2018-02-05T10:12:25,will germany approve of this ?,0,0,Lwando Madasi,4pNOCzV5jG0,0.0,2018-02-05 10:12:25,False,True
2018-02-05T17:55:54,"Are this 398 dislikers the haters of humanity??? Prhaps some stupid, idiotic nazis in between??!!",0,0,Marko Veselinovič,4pNOCzV5jG0,-0.8999999999999999,2018-02-05 17:55:54,False,True
2018-02-05T18:19:11,"I enjoyed this film today, Gary Oldman just gunius! Lets remember the lessons of history. DICTATORS DO NOT KNOW WORD ""ENOUGH""...Churchill had steel eggs, MAN...",0,0,Max Ukas,4pNOCzV5jG0,0.3125,2018-02-05 18:19:11,False,True
2018-02-05T20:18:16,I LOVE CHURCHILL,0,0,Pelopidas lagos,4pNOCzV5jG0,0.5,2018-02-05 20:18:16,False,True
2018-02-06T09:12:24,"Once again Gary Oldman has shown his class as an actor, faultless and superb from start to finish. Darkest Hour, his best film???",0,0,Lyndsay Mcrobbie,4pNOCzV5jG0,1.0,2018-02-06 09:12:24,False,True
2018-02-06T23:00:19,"Wow,  I thought they stopped making Muppet movies!",1,0,Natalie G,4pNOCzV5jG0,0.125,2018-02-06 23:00:19,False,True
2018-02-07T05:32:21,this movie was fucking good,0,0,Adrian Breuer,4pNOCzV5jG0,0.7,2018-02-07 05:32:21,False,True
2018-02-07T16:27:55,First hour was mediocre and difficult to understand for persons without historical knowledge but the second hour was perfect.,0,0,johannesnicolaas,4pNOCzV5jG0,0.041666666666666664,2018-02-07 16:27:55,False,True
2018-02-07T20:48:22,another freaking remake of an 10 year old HBO plot,0,0,Robert West,4pNOCzV5jG0,0.1,2018-02-07 20:48:22,False,True
2018-02-07T21:07:45,Dokle cete srati lazi o sebi kad svi znaju da ste vi finansirali naciste u to vreme a kasnije i nastavili isto sto i oni posle rata (ubijali komuniste) kao sto su komunisti ubijali predhodhodne i tako ce sledeci ubijati vas i u krug i u krug...,0,0,Night Watch,4pNOCzV5jG0,0.0,2018-02-07 21:07:45,False,True
2018-02-07T22:41:22,Nobody could have done a better job or portraying Sir Winston than Gary Oldman has done. Fine job !!!,0,0,Lorean Siller,4pNOCzV5jG0,0.6569010416666667,2018-02-07 22:41:22,False,True
2018-02-08T04:38:12,Where's gray old man...  Really he is an amazing  حقيقي انبهرررررررت...  ممثل رائع جداااااااااااا..  حسيت ان تشرشيل هو اللي بيمثل مش جراي اولد مان اللي كنت بكره من دوره في  فيل ليون ذا بروفشينال,0,0,Nancy Hamdy,4pNOCzV5jG0,0.35000000000000003,2018-02-08 04:38:12,False,True
2018-02-08T10:15:01,"Unionist propaganda movie.   Very happy to say I haven't, and don't intend to, watch this. -from Scotland",3,3,Tetsumonchi,4pNOCzV5jG0,0.45,2018-02-08 10:15:01,False,True
2018-02-08T15:11:33,good movie,0,0,Rachel Murray,4pNOCzV5jG0,0.7,2018-02-08 15:11:33,False,True
2018-02-08T15:11:52,nice movie. cute scenery 100 ok,0,0,Rachel Murray,4pNOCzV5jG0,0.5333333333333333,2018-02-08 15:11:52,False,True
2018-02-08T15:12:12,eh it alright,0,0,Rachel Murray,4pNOCzV5jG0,0.0,2018-02-08 15:12:12,False,True
2018-02-08T15:12:31,best MOVIE EVVEEERRRRRRR,0,0,Rachel Murray,4pNOCzV5jG0,1.0,2018-02-08 15:12:31,False,True
2018-02-08T15:12:50,am i still on the same account?,0,0,Rachel Murray,4pNOCzV5jG0,0.0,2018-02-08 15:12:50,False,True
2018-02-09T17:44:45,He looks like a bald snow dwarf...,0,0,Remy,4pNOCzV5jG0,0.0,2018-02-09 17:44:45,False,True
2018-02-10T07:38:44,"what a great movie , full of power and hope",0,0,ASIRM,4pNOCzV5jG0,0.575,2018-02-10 07:38:44,False,True
2018-02-12T04:33:51,"I've listened to the actual speeches, and I have one question:  Where was this 'fire and brimstone' Churchill then?  The real speeches sound nothing like this.  Am I missing something?",0,0,floydefisher,4pNOCzV5jG0,0.10000000000000002,2018-02-12 04:33:51,False,True
2018-02-12T17:00:57,Was waiting for Iron Maiden to kick in ...,0,0,Pannemat,4pNOCzV5jG0,0.0,2018-02-12 17:00:57,False,True
2018-02-12T18:39:07,OSCAR....YEAH!,0,0,Eduardo Abreu,4pNOCzV5jG0,0.0,2018-02-12 18:39:07,False,True
2018-02-13T01:40:57,"So everybody loves Oldman -- but nobody stops to ask if Churchill was really like that...(?) For a much clearer picture of Churchill, see the remarkable lecture below (""Churchill's War""). Even 5 minutes (from 1:37:00 to 1:42:00, for example) is enough to vaporize the myth of Churchill's benevolent leadership:     https://www.youtube.com/watch?v=iwFzm6rZH3o",0,0,dalexfilms,4pNOCzV5jG0,0.2875,2018-02-13 01:40:57,False,True
2018-02-13T10:53:56,"Some big dialogues, some pompous musical effect.. ad there you go make a villain a hero.. Indians will not forget his tyranny . The mastermind of the The Great Famine of Bengal.",0,0,Aniruddha Das,4pNOCzV5jG0,0.26666666666666666,2018-02-13 10:53:56,False,True
2018-02-13T20:21:44,"The speech is all wrong. Oldman overacted it. If you hear the real version it is sombre to begin with - said in a tone of quiet defiance building into a crescendo with ""never surrender"". Oldman delivered the whole thing with a loud defiance - it was completely off. Not debating him as an actor, he's great but he missed the mark in the most important part of the film for me",0,3,James Smith,4pNOCzV5jG0,0.20000000000000004,2018-02-13 20:21:44,False,True
2018-02-14T19:54:06,Gary Oldman is the Lon Chaney/Paul Muni of his time.,0,0,WilliamT1964,4pNOCzV5jG0,0.0,2018-02-14 19:54:06,False,True
2018-02-16T13:56:29,Great Movie.,0,0,marion silkroad1,4pNOCzV5jG0,0.8,2018-02-16 13:56:29,False,True
2018-02-16T15:45:10,Talk about one of the best movies,0,0,DotInside,4pNOCzV5jG0,1.0,2018-02-16 15:45:10,False,True
2018-02-16T21:49:53,"I never knew quite what to think of Gary Oldman before seeing this film. I have seen him in one or two films before and didn't take much notice. Before I went to see 'Darkest Hour' I read that Oldman gave a superb performance in this film and went along with an open mind. Believe me, his performance in this film is truly staggering; you have to see it to believe it.",0,0,paul w,4pNOCzV5jG0,0.39999999999999997,2018-02-16 21:49:53,False,True
2018-02-17T06:18:32,Absolutely Magnificent Film! If Gary Oldman doesn't win an oscar for this I honestly don't know what has happened! I'm a historian specialising In WW1 & WW2 and putting aside  churchills many follies and terrible decisions he was a hell of a leader! And one can only surmise what would have become of this proud country if  history would've played out as his competitors wished and he didn't become PM. Frightening to think of in my opinion!,0,0,jake burnside,4pNOCzV5jG0,0.27812499999999996,2018-02-17 06:18:32,False,True
2018-02-17T12:32:04,We ? Okay more like the innocent brianwashed soilders sent to fight a war so the rich and elites can profit off. Movies like this should he banned all politicians are the same and the few that were trutly good were assasinated and killed simple as that.,0,0,Mystkal Diamond,4pNOCzV5jG0,0.24166666666666664,2018-02-17 12:32:04,False,True
2018-02-17T14:34:00,omg stannis,0,0,Quinterro,4pNOCzV5jG0,0.0,2018-02-17 14:34:00,False,True
2018-02-17T17:08:43,A white supremacist.,0,0,Baby Boy,4pNOCzV5jG0,0.0,2018-02-17 17:08:43,False,True
2018-02-17T22:57:53,I watched this trailer a few months ago and didn't even realize Gary Oldman was in the movie,0,0,Hoss,4pNOCzV5jG0,-0.2,2018-02-17 22:57:53,False,True
2018-02-18T02:06:23,For Gary Oldman he looked exactly a lot like Churchill in preparing for this role in the movie Darkest Hour but 1940 was Britain's  darkest hour because of the Nazionale invasion of the low countries of Europe that led to Neville Chamberlin's resignation and gave the British a true patriot by the name of Winston Churchill.,0,0,John Huerta,4pNOCzV5jG0,0.15,2018-02-18 02:06:23,False,True
2018-02-18T02:32:40,Imagine if this was instead a Wes Anderson picture...😂,0,0,Motel Rx,4pNOCzV5jG0,0.0,2018-02-18 02:32:40,False,True
2018-02-18T06:02:00,"Finally, a movie for one of the greatest men in the history of mankind. When I was 13 years old, one of the teachers asked the class who our idols were, and I answered: Winston Churchill hahaha! None of the other children understood anything: I'm from Argentina jajajaj !!! When I was 14 years old, my subject was World War II: the teacher did not let me finish the exhibition and put me in 10. I stayed 40 minutes of class and I stayed in 1941: the invasion of the USSR ... but the guys understood, at that time, that Britain fought alone against Nazis and Italians for almost a year, until Japan attacked Pearl Harbor. Regards !!!",1,0,PasMPM,4pNOCzV5jG0,0.12576264880952384,2018-02-18 06:02:00,False,True
2018-02-18T16:44:08,"Went to see this , its a great film👍",0,0,Katie Smith,4pNOCzV5jG0,0.8,2018-02-18 16:44:08,False,True
2018-02-18T21:51:42,I want him to win so bad.,0,0,CinemaJohn,4pNOCzV5jG0,0.0500000000000001,2018-02-18 21:51:42,False,True
2018-02-19T00:43:44,Good movie worth some BAFTAs and Golden Globes for sure. Oldman should get an Oscar for make up/acting.,0,0,ronki23,4pNOCzV5jG0,0.45,2018-02-19 00:43:44,False,True
2018-02-19T20:56:17,"while  churchill and his cabient had their meeting , Harry Styles and his friend trying to escape from Dunkirk   so amazing to see the full picture of Dunkirk  evacuation  .I hope  Dunkirk and Darkest Hour  win an Oscar",0,0,Love Me,4pNOCzV5jG0,0.5833333333333334,2018-02-19 20:56:17,False,True
2018-02-20T13:49:20,Snoozeville,0,0,Tru Valu,4pNOCzV5jG0,0.0,2018-02-20 13:49:20,False,False
2018-02-22T14:26:19,439 people were reasoning with the tiger while their heads are on it's mouth.,2,1,jinroh516,4pNOCzV5jG0,0.0,2018-02-22 14:26:19,False,False
2018-02-22T20:10:18,"""Would you stop interrupting me while I am interrupting you?"" AWESOME!!!",1,0,jred726,4pNOCzV5jG0,1.0,2018-02-22 20:10:18,False,False
2018-02-23T21:56:46,Winston Churchill born of a Ashkenazi mother. Meaning any of his children may take over someone's home and property in Palestine.,0,0,DeWayne Benson,4pNOCzV5jG0,0.0,2018-02-23 21:56:46,False,False
2018-02-25T09:34:16,Gary Oldman no doubt is a great actor but for Churchill’s accent Brian Cox is the best.,0,0,Hissam Ullah,4pNOCzV5jG0,0.9,2018-02-25 09:34:16,False,False
2018-02-25T17:33:30,So bloody GOOD!!!,0,0,Lado Isla Bonita,4pNOCzV5jG0,0.09999999999999998,2018-02-25 17:33:30,False,False
2018-02-26T19:39:36,"""YOU CANNOT REASON WITH A TIGER WHEN YOUR HEAD IS IN ITS MOUTH!""",0,0,Başar Tekin,4pNOCzV5jG0,0.0,2018-02-26 19:39:36,False,False
2018-02-27T11:55:19,he deserves an oscar what a brilliant actor,0,0,non non,4pNOCzV5jG0,0.9,2018-02-27 11:55:19,False,False
2018-02-27T12:26:34,I studied British history and I'm pretty sure Gary oldman wasn't Winston Churchill 😏,0,0,corey douglas,4pNOCzV5jG0,0.25,2018-02-27 12:26:34,False,False
2018-02-27T19:01:45,Gary is indeed an Oldman.,2,0,Nameless Ghost,4pNOCzV5jG0,0.0,2018-02-27 19:01:45,False,False
