timestamp,text,like_count,reply_count,author,trailer_id,sentiment_score,datetime,used_for_model,used_for_visualization
2018-11-06T22:37:41,One of the most beautiful trailers this year,31,1,Gerard Richard,5cJ7MT1RTqs,0.675,2018-11-06 22:37:41,True,True
2018-11-06T22:38:24,Rlly want to see this but bughead it good right 💀😂,0,0,Alexxx Something,5cJ7MT1RTqs,0.4928571428571428,2018-11-06 22:38:24,True,True
2018-11-06T22:38:28,Cute..It looks like a live action version of 5 kilometers per second.,1,0,Momo Woods,5cJ7MT1RTqs,0.07878787878787878,2018-11-06 22:38:28,True,True
2018-11-06T22:43:17,BEAUTIFUL!!!!!!!!!!!!!!!,0,0,MariaFFJ,5cJ7MT1RTqs,1.0,2018-11-06 22:43:17,True,True
2018-11-06T22:44:21,NO BETTY!,2,0,Kai Foster,5cJ7MT1RTqs,0.0,2018-11-06 22:44:21,True,True
2018-11-06T22:44:33,I thought the whole “deadly disease teen romance” genre was over. I’m in a time loop,0,0,Meghan ______,5cJ7MT1RTqs,0.0,2018-11-06 22:44:33,True,True
2018-11-06T22:48:55,Where did Zach go,0,0,Symbolic,5cJ7MT1RTqs,0.0,2018-11-06 22:48:55,True,True
2018-11-06T22:50:33,It is the first Time when i dont ship Main characters because Cole should kiss only Lili:(  #Riverdale,0,0,Dominika G,5cJ7MT1RTqs,-0.08333333333333334,2018-11-06 22:50:33,True,True
2018-11-06T22:51:37,Gonna cry,0,0,valerie valerie,5cJ7MT1RTqs,0.0,2018-11-06 22:51:37,True,True
2018-11-06T22:57:03,claire winland we still miss you .....,0,0,nates studio,5cJ7MT1RTqs,0.0,2018-11-06 22:57:03,True,True
2018-11-06T22:59:17,Five feet apart cause they’re not gay,0,0,robert kasokeo,5cJ7MT1RTqs,-0.20833333333333334,2018-11-06 22:59:17,True,True
2018-11-06T23:04:00,Two bros chilling in a hot tub. Five feet apart cause they’re not gay.,2,0,Gabi-Abby G,5cJ7MT1RTqs,-0.1527777777777778,2018-11-06 23:04:00,True,True
2018-11-06T23:20:47,Can the damn movie comeout already. I keep cooking back here,58,9,Elijah Smith,5cJ7MT1RTqs,0.0,2018-11-06 23:20:47,True,True
2018-11-06T23:23:17,She kinda looks like the girl that played Mya and I'm crying,0,0,Tiffany Urbay,5cJ7MT1RTqs,-0.2,2018-11-06 23:23:17,True,True
2018-11-06T23:28:38,1:09-1:14 😘💋,0,0,Julia Skrodzka,5cJ7MT1RTqs,0.0,2018-11-06 23:28:38,True,True
2018-11-06T23:32:53,I’m happy there making a movie about it and making awareness about the illness! Hopefully it’s accurate,0,0,Mari S,5cJ7MT1RTqs,0.7000000000000001,2018-11-06 23:32:53,True,True
2018-11-06T23:33:53,I still will ship bughead. EVEN THOUGH THIS WILL BE AMAZING.,0,0,Jovey Han,5cJ7MT1RTqs,0.6000000000000001,2018-11-06 23:33:53,True,True
2018-11-06T23:37:29,Can’t wait!!,0,0,random account,5cJ7MT1RTqs,0.0,2018-11-06 23:37:29,True,True
2018-11-06T23:39:53,What's the name of this song??,0,0,Deseree Wetzel,5cJ7MT1RTqs,0.0,2018-11-06 23:39:53,True,True
2018-11-06T23:49:07,I’m not gonna lie this looks pretty good,0,0,jaimmie27,5cJ7MT1RTqs,0.475,2018-11-06 23:49:07,True,True
2018-11-06T23:53:52,I CANT WAIT TILL MARCH,0,0,Charlotte Rose,5cJ7MT1RTqs,0.0,2018-11-06 23:53:52,True,True
2018-11-07T00:03:47,why did i watch this entire trailer thinking cole sprouse was harry styles,0,0,H. Akb,5cJ7MT1RTqs,0.0,2018-11-07 00:03:47,True,True
2018-11-07T00:03:57,"The trailer got me ,I'm over here crying , so what about watching the  movie btw I really miss Claire wineland's videos.",3,0,Joyjah Brade,5cJ7MT1RTqs,0.0,2018-11-07 00:03:57,True,True
2018-11-07T00:07:57,i what to see this movie so badly this looks so good,0,0,mackienzie hoelting,5cJ7MT1RTqs,5.551115123125783e-17,2018-11-07 00:07:57,True,True
2018-11-07T00:11:45,I personally love that they decided to make a movie about cf bc it will not only inform more ppl about it’s great for those who have been through it . My brother and I have cf and am so blessed we got a lung transplant . Am SUPPER EXCITED ABOUT THIS ❗️❗️,0,0,Doris Diaz,5cJ7MT1RTqs,0.43499999999999994,2018-11-07 00:11:45,True,True
2018-11-07T00:14:27,I see my husband I click,1,0,Poplover 14,5cJ7MT1RTqs,0.0,2018-11-07 00:14:27,True,True
2018-11-07T00:14:28,two dudeeez sitting in a hospital five feet apart cause lili reinhart,0,0,Katarina Ivković,5cJ7MT1RTqs,0.0,2018-11-07 00:14:28,True,True
2018-11-07T00:17:28,Cole..?,0,0,Lily vlogs,5cJ7MT1RTqs,0.0,2018-11-07 00:17:28,True,True
2018-11-07T00:19:22,How does Lili feel about this😂😂😂😂😂😂😂,0,1,Lexi Hitt,5cJ7MT1RTqs,0.0,2018-11-07 00:19:22,True,True
2018-11-07T00:21:26,I’m sorry but I can’t stop thinking of Bughead (Riverdale) 😂,11,3,Brooke . R,5cJ7MT1RTqs,-0.5,2018-11-07 00:21:26,True,True
2018-11-07T00:22:12,"A modified the fault in our stars, BUT OH WELL, WE LOVE IT ANYWAYS",0,0,Rain Dad,5cJ7MT1RTqs,0.5,2018-11-07 00:22:12,True,True
2018-11-07T00:24:33,Omg I want to see this so badly because I love Cole Sprouse!!!!,0,0,Tess Mazerollr,5cJ7MT1RTqs,0.15000000000000008,2018-11-07 00:24:33,True,True
2018-11-07T00:27:48,This reminds me of that Grey’s anatomy episode,0,0,Christina La,5cJ7MT1RTqs,-0.05,2018-11-07 00:27:48,True,True
2018-11-07T00:30:43,I want to watch this movie so bad it looks sooo good can’t believe they are going to make us wait until spring,0,0,Lola Gonzales,5cJ7MT1RTqs,5.551115123125783e-17,2018-11-07 00:30:43,True,True
2018-11-07T00:37:13,Mateo arias and Cole sprouse !!,0,0,Diego Ortiz,5cJ7MT1RTqs,0.0,2018-11-07 00:37:13,True,True
2018-11-07T00:37:56,Yeah cuz cf patients look that good. 😂,0,0,EB,5cJ7MT1RTqs,0.7,2018-11-07 00:37:56,True,True
2018-11-07T00:41:25,I needs to see,0,0,Ana Aguilera,5cJ7MT1RTqs,0.0,2018-11-07 00:41:25,True,True
2018-11-07T00:43:32,REMIND ME TO FORGET LOVE THIS SONG!,0,0,kittyflowers OC,5cJ7MT1RTqs,0.625,2018-11-07 00:43:32,True,True
2018-11-07T00:49:43,"Whoa there buddy, he's dating someone☺.",0,0,ari asthetic,5cJ7MT1RTqs,0.0,2018-11-07 00:49:43,True,True
2018-11-07T00:49:51,i have watched this so much I LOVE IT ALREADY coles first movie and years and it’s romantic my heart is BLEEDING,1,0,diana esters,5cJ7MT1RTqs,0.25,2018-11-07 00:49:51,True,True
2018-11-07T00:50:03,I can't wait I wanna now!!!!!!!!!,0,0,Marely Zaragoza,5cJ7MT1RTqs,0.0,2018-11-07 00:50:03,True,True
2018-11-07T00:55:51,"I'm sorry but this movie does not seem interesting at all, it looks too similar to other ""i-cant-be-with-you"" teen movies",1,0,Nilah Williamson,5cJ7MT1RTqs,-0.025,2018-11-07 00:55:51,True,True
2018-11-07T00:57:42,this reminds me of red band society,0,0,elon,5cJ7MT1RTqs,0.0,2018-11-07 00:57:42,True,True
2018-11-07T00:58:43,Awww la quiero verrr ahora ...se estrena cuando me graduo :'( del colegio,0,0,milena spin,5cJ7MT1RTqs,-0.3,2018-11-07 00:58:43,True,True
2018-11-07T01:02:52,Did Maya break up with Zack and go for Cody?,0,0,EmmaGracie18,5cJ7MT1RTqs,0.0,2018-11-07 01:02:52,True,True
2018-11-07T01:09:46,The only reason I have a slight bit of interest in this movie is cause COLE,1,0,hi there,5cJ7MT1RTqs,-0.08333333333333333,2018-11-07 01:09:46,True,True
2018-11-07T01:13:34,What the song in here?.,0,0,Abby Tso,5cJ7MT1RTqs,0.0,2018-11-07 01:13:34,True,True
2018-11-07T01:14:32,"I'm waiting for the ""2 bros chilling in a hot tub"" comments to flow in",0,0,Suave Dude,5cJ7MT1RTqs,-0.125,2018-11-07 01:14:32,True,True
2018-11-07T01:18:36,Fault in our stars part 2,0,0,Eliza Nguyen,5cJ7MT1RTqs,0.0,2018-11-07 01:18:36,True,True
2018-11-07T01:24:23,cole sprouse is so hot i'm only watching this movie because of cole sprouse,0,0,Jas Min Seroka,5cJ7MT1RTqs,0.125,2018-11-07 01:24:23,True,True
2018-11-07T01:24:43,2 guys sitting in a hot tub “five feet apart” cause their not gay,0,0,R_Rindt,5cJ7MT1RTqs,0.02083333333333333,2018-11-07 01:24:43,True,True
2018-11-07T01:25:58,It’s basically The Fault In Stars but with Cole Sprouse. 💕💕,0,0,Kelby Lefsrud,5cJ7MT1RTqs,0.0,2018-11-07 01:25:58,True,True
2018-11-07T01:28:27,So we all know that the goofy friend dies right,0,0,WTliteralF,5cJ7MT1RTqs,0.39285714285714285,2018-11-07 01:28:27,True,True
2018-11-07T01:32:55,Can’t wait to see the movie,0,0,Nina Bernheim,5cJ7MT1RTqs,0.0,2018-11-07 01:32:55,True,True
2018-11-07T01:33:56,"This hits home as a CF patient as well, can’t wait to see this! The line “that cf has stolen so much from me is true” Check put my page fellow CFers! ❤️",0,0,MsAshlynn2,5cJ7MT1RTqs,0.31875,2018-11-07 01:33:56,True,True
2018-11-07T01:44:02,la voy a ver solo por cole sprouse😍😍,1,0,Bri,5cJ7MT1RTqs,0.0,2018-11-07 01:44:02,True,True
2018-11-07T01:51:29,Reminds me of Claire windland 😭,24,2,Under the Sea,5cJ7MT1RTqs,0.0,2018-11-07 01:51:29,True,True
2018-11-07T01:52:25,*warning A jughead fangirl (Aka me) has entered the server)*    OHMYFUCKINGGAWDJUHHEDMARRYMEPLRASEIBEGYOUMRRYMEREEEEEYOULOOKBETTERTHENARCHIEREEEEEEEEEE,0,0,neo,5cJ7MT1RTqs,0.0,2018-11-07 01:52:25,True,True
2018-11-07T01:57:17,"So is this Fault in our Stars crossed with the Suite life of Zak and Cody. Like, upper-middle class teens with an illness and one of them is a sprouse? no wonder the all the little girls stopped chanting at their emo-boy shrine to watch this",1,0,Sam Serrao,5cJ7MT1RTqs,-0.1875,2018-11-07 01:57:17,True,True
2018-11-07T01:59:43,I WANT TO SEEEE THIS SO BAD. THERES COLE SPROUSE. YYAAAYYY,1,0,Account Deleted,5cJ7MT1RTqs,-0.6999999999999998,2018-11-07 01:59:43,True,True
2018-11-07T02:01:14,0:48 I think it’s cute,11,0,Kelly N,5cJ7MT1RTqs,0.5,2018-11-07 02:01:14,True,True
2018-11-07T02:01:36,I love Cole at 1:12.,0,0,WhiskersNPaws,5cJ7MT1RTqs,0.5,2018-11-07 02:01:36,True,True
2018-11-07T02:10:50,I can’t wait for this,0,0,George Pig,5cJ7MT1RTqs,0.0,2018-11-07 02:10:50,True,True
2018-11-07T02:12:54,Five feet apart cuz they’re not gay,0,0,ms. chanandler bong,5cJ7MT1RTqs,-0.20833333333333334,2018-11-07 02:12:54,True,True
2018-11-07T02:14:36,"It's called 5 feet apart, cuz they're not gay",0,0,Elaine Ahn,5cJ7MT1RTqs,-0.20833333333333334,2018-11-07 02:14:36,True,True
2018-11-07T02:18:04,It's so weird to see Cole in screen with other girl than Lily,0,0,La caja de Pandora,5cJ7MT1RTqs,-0.3125,2018-11-07 02:18:04,True,True
2018-11-07T02:30:08,I only want to see this movie because of cole,0,0,Ohboy greathan,5cJ7MT1RTqs,0.0,2018-11-07 02:30:08,True,True
2018-11-07T02:38:41,WAIT WAIT WAIT THIS IS COMING OUT ON THE SAME DAY MCR BROKE UP THREE DAYS BEFORE MY BDAY???? WOWWW,0,0,Izzy Grace,5cJ7MT1RTqs,0.0,2018-11-07 02:38:41,True,True
2018-11-07T02:40:32,Who else thought that was Ellen page at first,0,0,Annabeth Chase,5cJ7MT1RTqs,0.25,2018-11-07 02:40:32,True,True
2018-11-07T02:41:29,One of my favorite songs lol,0,0,Babyfacekilla 9,5cJ7MT1RTqs,0.65,2018-11-07 02:41:29,True,True
2018-11-07T02:41:34,The song is “remind me to forget”,0,0,Scimoc,5cJ7MT1RTqs,0.0,2018-11-07 02:41:34,True,True
2018-11-07T02:43:08,Guys I think this movie means that Riverdale won’t be doing season 4,1,0,Hello Hello,5cJ7MT1RTqs,0.0,2018-11-07 02:43:08,True,True
2018-11-07T02:44:06,"1:12 that head tilt though, hot!",151,7,Kate Ellison,5cJ7MT1RTqs,0.3125,2018-11-07 02:44:06,True,True
2018-11-07T02:45:09,"I want to watch this movie soooooo badly. Cole, Riverdale now this!!! Can't wait to watch it!!!",0,0,Jocelyn Limelight,5cJ7MT1RTqs,-1.0,2018-11-07 02:45:09,True,True
2018-11-07T02:46:11,First The Hate You Give and now Five Feet Apart! I can't take anymore good movies.... Yes I can!!,0,0,Liyah Covington,5cJ7MT1RTqs,0.08333333333333333,2018-11-07 02:46:11,True,True
2018-11-07T02:54:14,I love thus movie already,0,0,Kathrine Spruse,5cJ7MT1RTqs,0.5,2018-11-07 02:54:14,True,True
2018-11-07T02:54:36,i need to watch this movie,0,0,Darelyn Solis,5cJ7MT1RTqs,0.0,2018-11-07 02:54:36,True,True
2018-11-07T02:59:31,Ahh! Omg I want to watch,0,0,jaybugg18,5cJ7MT1RTqs,0.0,2018-11-07 02:59:31,True,True
2018-11-07T02:59:35,I want to see this movie but I'm afraid I will relive the crippling anxiety that the fault in our stars gave me.,0,0,Olive Garden's Restroom,5cJ7MT1RTqs,-0.6,2018-11-07 02:59:35,True,True
2018-11-07T03:14:46,It’s COLE not dylin,0,0,Kielee Lyons,5cJ7MT1RTqs,0.0,2018-11-07 03:14:46,True,True
2018-11-07T03:22:37,"Another Fault in Our stars, hope no one dies though 😭",0,0,Kayy Ee,5cJ7MT1RTqs,0.0,2018-11-07 03:22:37,True,True
2018-11-07T03:29:31,Can’t wait!,0,0,Emily Edwards,5cJ7MT1RTqs,0.0,2018-11-07 03:29:31,True,True
2018-11-07T03:31:04,I WAANNA SEE THIS!!!,0,0,Stacy Gordon,5cJ7MT1RTqs,0.0,2018-11-07 03:31:04,True,True
2018-11-07T03:41:57,Jughead 😘😘😘😍😊😁,0,0,Ruqaiyah Lakdawala,5cJ7MT1RTqs,0.0,2018-11-07 03:41:57,True,True
2018-11-07T03:46:23,I have been watching this video about 20 times or more in a row. My hole bony gets a very exited feeling when I think about it coming out.,0,0,Matthew Joffe,5cJ7MT1RTqs,0.35,2018-11-07 03:46:23,True,True
2018-11-07T03:46:51,....cuz they're not gay....,0,0,Samir P,5cJ7MT1RTqs,-0.20833333333333334,2018-11-07 03:46:51,True,True
2018-11-07T03:51:42,"As someone with CF, I am happy to see some representation in the media. I just hope this movie doesn’t sacrifice realism for glamorizing a serious illness that limits the lifespan of the people with it to 37 years (average).",0,0,Operatic Egg,5cJ7MT1RTqs,0.10555555555555558,2018-11-07 03:51:42,True,True
2018-11-07T03:58:37,"sprousehart shippers be hoping for this: Haley Lu Richardsob: ""we should totes kiss, cuz why not lol???"" 😍 Cole Sprouse: ""Yes! Totes! Omg such good ideas!!!"" 🤪 *Lili Reinhart walks in* Lili Reinhart: ""cole ur done here lets skedaddle, tottles bois."" 😒 Cole Sprouse: ""wait i have to kiss a girl hotter than u for movie""  😋 Lili Reinhart: ""we are going to film riverdale and we get another fire emojis times three scene"" Cole Sprouse: ""like agressive fire emojis times three?"" 🤤🔥 Lili Reinhart: ""yes."" 😘 movie end",1,0,satan's rose,5cJ7MT1RTqs,0.16666666666666666,2018-11-07 03:58:37,True,True
2018-11-07T04:09:43,This has me in tears!!!! I can't wait to see this.💕💕💕 and um..... Cole sprouse!!!!!,0,0,Sarah M2020,5cJ7MT1RTqs,0.0,2018-11-07 04:09:43,True,True
2018-11-07T04:13:54,Cole I love him so much there is no words to explain,0,0,Naomi,5cJ7MT1RTqs,0.35,2018-11-07 04:13:54,True,True
2018-11-07T04:15:07,No one is mentioning the red band society? It's literally what two characters went through in that show.,0,0,Makayla Heart,5cJ7MT1RTqs,0.0,2018-11-07 04:15:07,True,True
2018-11-07T04:15:12,I just saw jughead in the thumbnail and clicked on it,0,1,Gabriela Malfoy,5cJ7MT1RTqs,0.0,2018-11-07 04:15:12,True,True
2018-11-07T04:19:16,COLE SPROUTS!!!!!!!!!😘😍😇,0,0,Bunnylover_plays,5cJ7MT1RTqs,0.0,2018-11-07 04:19:16,True,True
2018-11-07T04:21:48,It’s cute or whatever,0,0,FRUITPUNCHbb.,5cJ7MT1RTqs,0.5,2018-11-07 04:21:48,True,True
2018-11-07T04:26:28,cole fck you i love you,0,0,Clair Eco,5cJ7MT1RTqs,0.5,2018-11-07 04:26:28,True,True
2018-11-07T05:14:02,5 FIVE APART CUZ THEYRE NOT GAYYYYYYYYYY,0,0,Lola Chevok,5cJ7MT1RTqs,0.0,2018-11-07 05:14:02,True,True
2018-11-07T05:17:15,I'M so watching this💙 Cole sprose😘 Music 😍 And also Hailey 💚,0,0,Subhangi Bhadra,5cJ7MT1RTqs,0.0,2018-11-07 05:17:15,True,True
2018-11-07T05:21:04,Cole Sprouts is soooo cute X3,0,0,Glasses Voices,5cJ7MT1RTqs,0.5,2018-11-07 05:21:04,True,True
2018-11-07T05:22:54,Cole sprouse is the best,0,0,Lexy,5cJ7MT1RTqs,1.0,2018-11-07 05:22:54,True,True
2018-11-07T05:34:57,2 bros chilling in a hot tub! FIVE FEET APART cuz there not gay,0,0,John Cena,5cJ7MT1RTqs,-0.13194444444444445,2018-11-07 05:34:57,True,True
2018-11-07T05:34:57,2 bros chilling in a hot tub! FIVE FEET APART cuz there not gay,0,0,John Cena,5cJ7MT1RTqs,-0.13194444444444445,2018-11-07 05:34:57,True,True
2018-11-07T05:51:04,COLE OOFT,1,0,Georgie,5cJ7MT1RTqs,0.0,2018-11-07 05:51:04,True,True
2018-11-07T05:54:55,Cole is very talented. Looks like good movie. Will watch it.,2198,7,Patel Vidhu,5cJ7MT1RTqs,0.8049999999999999,2018-11-07 05:54:55,True,True
2018-11-07T06:07:54,If she dies and he end up watching her videos that she recorded and that’s how the movie ends I will literally sue the company and cry my eyes out😭💔,821,22,Gabs,5cJ7MT1RTqs,0.0,2018-11-07 06:07:54,True,True
2018-11-07T06:13:45,I don't want it to be another The Fault in Our Stars. I have high expectations.,13,2,Ava,5cJ7MT1RTqs,0.16,2018-11-07 06:13:45,True,True
2018-11-07T06:18:21,Omg can’t wait 😊,2,0,d_moomoo 44,5cJ7MT1RTqs,0.0,2018-11-07 06:18:21,True,True
2018-11-07T06:22:38,Five feet apart cus they’re not *gay*,1,0,Zellz,5cJ7MT1RTqs,-0.20833333333333334,2018-11-07 06:22:38,True,True
2018-11-07T06:27:44,Low key only clicked for my boi jug,5,0,Marvelmania360,5cJ7MT1RTqs,0.0,2018-11-07 06:27:44,True,True
2018-11-07T06:53:30,Is that Rico?????,1,0,Charissa Lim,5cJ7MT1RTqs,0.0,2018-11-07 06:53:30,True,True
2018-11-07T07:09:04,"This looks good, but dammit I'm going to ball my eyes out",3,0,Brandys_Reviews,5cJ7MT1RTqs,0.7,2018-11-07 07:09:04,True,True
2018-11-07T07:39:49,What ? Why do they have to be 5 feet apart if they are already sick? And if it’s contagious why are other people around them allowed to be in close proximity to them? Or what’s the premise I don’t get it,3,2,tree Animation,5cJ7MT1RTqs,-0.41964285714285715,2018-11-07 07:39:49,True,True
2018-11-07T07:39:55,Claire Wineland 😭💔,1,1,Angelina Rybakova,5cJ7MT1RTqs,0.0,2018-11-07 07:39:55,True,True
2018-11-07T07:59:33,Two peeps  Living with cf Five feet apart  Because they have to,2,0,Sigrun Fjola Atladottir,5cJ7MT1RTqs,0.0,2018-11-07 07:59:33,True,True
2018-11-07T08:00:34,"""what would i do without you"" ""you die""   lol HAHA",10,0,Juana Abastillas,5cJ7MT1RTqs,0.5,2018-11-07 08:00:34,True,True
2018-11-07T08:02:44,Cole 😭😭😭😭😻😻😻😻😻😻😻😻,2,0,Соня,5cJ7MT1RTqs,0.0,2018-11-07 08:02:44,True,True
2018-11-07T08:22:38,Cole has an adorable smile,690,9,Angel,5cJ7MT1RTqs,0.4,2018-11-07 08:22:38,True,True
2018-11-07T08:49:29,"First you ripped my heart out with ""The Fault in our Stars"" now this. I want survive. Well at least the journey was interesting.",4,0,IAW Club,5cJ7MT1RTqs,0.15,2018-11-07 08:49:29,True,True
2018-11-07T09:01:04,What’s with all the grief porn movies lately? Love him though. He has speaking eyes. Her acting needs work. Monotone delivery.,0,0,just1desi,5cJ7MT1RTqs,-0.10000000000000002,2018-11-07 09:01:04,True,True
2018-11-07T09:16:43,Reminds me Fault in our stars.,1,0,Shahid Mushtaq,5cJ7MT1RTqs,0.0,2018-11-07 09:16:43,True,True
2018-11-07T09:22:32,Can’t wait to watch this!! Cole keeps getting hotter day by day!!😏😍😍👍👍and his acting skills too,0,0,Desiyaar,5cJ7MT1RTqs,0.0,2018-11-07 09:22:32,True,True
2018-11-07T09:25:37,The smirk at 2:15 😍😍😍😍,0,0,Viomaliha,5cJ7MT1RTqs,0.0,2018-11-07 09:25:37,True,True
2018-11-07T09:32:22,Name of the music please???,0,1,Mon sil 몽실,5cJ7MT1RTqs,0.0,2018-11-07 09:32:22,True,True
2018-11-07T09:44:03,I’m going to cry like a baby 👶🏼 😢,0,0,Brooke Maureen,5cJ7MT1RTqs,0.0,2018-11-07 09:44:03,True,True
2018-11-07T09:48:25,Ben,0,0,niall's potato,5cJ7MT1RTqs,0.0,2018-11-07 09:48:25,True,True
2018-11-07T09:51:51,Oml I need to see this movieeeee,0,0,noelyne,5cJ7MT1RTqs,0.0,2018-11-07 09:51:51,True,True
2018-11-07T09:57:38,What is this song?,0,1,madison webster,5cJ7MT1RTqs,0.0,2018-11-07 09:57:38,True,True
2018-11-07T10:45:37,What's the song,0,1,Marwa Kassem,5cJ7MT1RTqs,0.0,2018-11-07 10:45:37,True,True
2018-11-07T11:14:30,It looks like the fault in our stars but with cole sprouse,0,0,Lice Castle,5cJ7MT1RTqs,0.0,2018-11-07 11:14:30,True,True
2018-11-07T11:42:32,What was the name of the song???,0,3,L. Tabornal,5cJ7MT1RTqs,0.0,2018-11-07 11:42:32,True,True
2018-11-07T11:52:26,20 years old with cystic fibrosis I was diagnosed at 6 weeks old,0,0,PokeyRanger,5cJ7MT1RTqs,0.1,2018-11-07 11:52:26,True,True
2018-11-07T11:53:20,Marry me Cole!!!!,0,0,Lost For now,5cJ7MT1RTqs,0.0,2018-11-07 11:53:20,True,True
2018-11-07T11:54:35,I’m 20 with CF and most people I tell have little to no clue what it is so I’m glad they’re making a movie on it so more people will learn about it and hopefully donate to research #curecf #6,0,0,PokeyRanger,5cJ7MT1RTqs,0.328125,2018-11-07 11:54:35,True,True
2018-11-07T12:23:03,i think this movie will make me cry😭😭,0,0,joncieeniee nabwa,5cJ7MT1RTqs,0.0,2018-11-07 12:23:03,True,True
2018-11-07T12:24:19,"when he said ""shake on it"" then tilt his head 😍💕🙃",0,0,General's wife,5cJ7MT1RTqs,0.0,2018-11-07 12:24:19,True,True
2018-11-07T12:27:28,This reminded me of Claire Wineland,0,0,Amna Wajahat,5cJ7MT1RTqs,0.0,2018-11-07 12:27:28,True,True
2018-11-07T12:34:54,Is no one going to reference Clair???,0,0,sick.,5cJ7MT1RTqs,0.0,2018-11-07 12:34:54,True,True
2018-11-07T12:44:35,I would love this if it would be lillie reinhart and Cole sprouse,0,1,A&K channel,5cJ7MT1RTqs,0.5,2018-11-07 12:44:35,True,True
2018-11-07T12:47:25,Let me guess will the Riverdale fans send the actress death threats?,17,2,I love you 3000.,5cJ7MT1RTqs,0.0,2018-11-07 12:47:25,True,True
2018-11-07T12:47:36,Reminds me of Everything Everything,0,0,Lucas Uchiha,5cJ7MT1RTqs,0.0,2018-11-07 12:47:36,True,True
2018-11-07T12:52:31,Cole Sprouse is handsome.,0,0,Mshauri Mazuri,5cJ7MT1RTqs,0.5,2018-11-07 12:52:31,True,True
2018-11-07T13:18:11,*betty has left the chat*,0,0,SOFIA X,5cJ7MT1RTqs,0.0,2018-11-07 13:18:11,True,True
2018-11-07T13:25:36,Can't wait 😆😆,0,0,Tiffany Wambui,5cJ7MT1RTqs,0.0,2018-11-07 13:25:36,True,True
2018-11-07T13:45:38,*screenshots every second of the trailer*,0,0,iki gai,5cJ7MT1RTqs,0.0,2018-11-07 13:45:38,True,True
2018-11-07T14:04:44,He looks so sexy without the stupid beenie...,0,0,Eila Nusrat,5cJ7MT1RTqs,-0.14999999999999997,2018-11-07 14:04:44,True,True
2018-11-07T14:05:28,Is it just me or would Cole make an amazing young Sirius Black?,0,0,Mykah Green,5cJ7MT1RTqs,0.1777777777777778,2018-11-07 14:05:28,True,True
2018-11-07T14:19:23,Reminds me of TFiOS!! Hazel Grace and Augustus Waters ✈️,0,0,Amyyy,5cJ7MT1RTqs,0.0,2018-11-07 14:19:23,True,True
2018-11-07T14:36:17,COLE’S FUCJKINH HAIR,0,0,Asia Turner,5cJ7MT1RTqs,0.0,2018-11-07 14:36:17,True,True
2018-11-07T14:43:30,WHAT IS THIS SONG I LOVE IT. ❤️❤️🧡🧡💛💙💛❤️❤️💜💞💞💗💖❣️💚💛❣️💖,0,0,-4kluv -,5cJ7MT1RTqs,0.5,2018-11-07 14:43:30,True,True
2018-11-07T14:57:38,Omg cole is so hot I’m sorry but he’s beautiful I’m crying,220,7,dvas,5cJ7MT1RTqs,0.09999999999999999,2018-11-07 14:57:38,True,True
2018-11-07T15:06:03,"Five feet apart, because dying is sexy!",1,0,MentalMobile,5cJ7MT1RTqs,0.625,2018-11-07 15:06:03,True,True
2018-11-07T15:22:25,OmG cole😭❤️😍😍,0,0,M S,5cJ7MT1RTqs,0.0,2018-11-07 15:22:25,True,True
2018-11-07T15:25:44,what is the title of the song?,0,0,Crystal Joy Malizon,5cJ7MT1RTqs,0.0,2018-11-07 15:25:44,True,True
2018-11-07T15:33:07,cause they're not gay,0,0,Tv IsMyBestFriend,5cJ7MT1RTqs,-0.20833333333333334,2018-11-07 15:33:07,True,True
2018-11-07T15:48:47,Someone’s gonna die,1,0,yunggoth,5cJ7MT1RTqs,0.0,2018-11-07 15:48:47,True,True
2018-11-07T15:50:41,0:50   Tokyo Ghoul?!,0,0,Andrea López M.,5cJ7MT1RTqs,0.0,2018-11-07 15:50:41,True,True
2018-11-07T15:51:29,I literally cried when I found out until March,0,0,Loreli Johnson,5cJ7MT1RTqs,0.0,2018-11-07 15:51:29,True,True
2018-11-07T16:00:48,Anyone know the name of song in 0:01?,0,0,Luiza L,5cJ7MT1RTqs,0.0,2018-11-07 16:00:48,True,True
2018-11-07T16:17:35,What is this song in the begging,0,1,Kelsey Jones,5cJ7MT1RTqs,0.0,2018-11-07 16:17:35,True,True
2018-11-07T16:32:20,"Two bros chillin in a hot tub, five feet apart cuz they have CF",0,0,milk,5cJ7MT1RTqs,0.25,2018-11-07 16:32:20,True,True
2018-11-07T16:43:27,I have a feeling that this is gonna be my new favorite movie.,0,0,Rayhane,5cJ7MT1RTqs,0.3181818181818182,2018-11-07 16:43:27,True,True
2018-11-07T16:50:26,I cant wait  to see this movie. And who know what is song?,0,1,Айзагул Саркытпаева,5cJ7MT1RTqs,0.0,2018-11-07 16:50:26,True,True
2018-11-07T17:28:43,Yessss... Cole in a new movie,0,0,Cardio 'N' Cake,5cJ7MT1RTqs,0.13636363636363635,2018-11-07 17:28:43,True,True
2018-11-07T17:30:05,I can't believe someone in the film as the character has the same name as me but I am going to watch this,0,0,AngelRages,5cJ7MT1RTqs,0.0,2018-11-07 17:30:05,True,True
2018-11-07T17:32:57,cole Is my hubby,0,0,Daaannniii,5cJ7MT1RTqs,0.0,2018-11-07 17:32:57,True,True
2018-11-07T17:43:52,im so excited omg omg omg omg,0,0,raini rodriguez,5cJ7MT1RTqs,0.375,2018-11-07 17:43:52,True,True
2018-11-07T17:48:28,The Fault  In Our Stars 2,0,0,Diana Rose,5cJ7MT1RTqs,0.0,2018-11-07 17:48:28,True,True
2018-11-07T17:48:53,Ayayayayaya,0,0,Foo Duo53,5cJ7MT1RTqs,0.0,2018-11-07 17:48:53,True,True
2018-11-07T17:49:55,Aww 😭😭😭,0,0,Kairy Veneret,5cJ7MT1RTqs,0.3,2018-11-07 17:49:55,True,True
2018-11-07T18:04:52,"Cystic Fibrosis filmmaker right here! I love this idea, but these two would be deathly ill already in real life.",0,0,Chase Productions,5cJ7MT1RTqs,0.1392857142857143,2018-11-07 18:04:52,True,True
2018-11-07T18:05:47,Cuz they’re not gay,0,0,GTACLAW,5cJ7MT1RTqs,-0.20833333333333334,2018-11-07 18:05:47,True,True
2018-11-07T18:25:33,Jughead🙌🏾,0,0,A. E.,5cJ7MT1RTqs,0.0,2018-11-07 18:25:33,True,True
2018-11-07T18:57:26,TWO BROS CHILLIN IN A HOT TOB 5 FEET APART CUZ THEYRE NOT GAAYY,0,0,1 2,5cJ7MT1RTqs,0.25,2018-11-07 18:57:26,True,True
2018-11-07T19:11:35,Is this based on a book??,0,1,Lune Daylight,5cJ7MT1RTqs,0.0,2018-11-07 19:11:35,True,True
2018-11-07T19:21:05,So much fault in our stars vibe. But cute 😚,0,0,Payal Gupta,5cJ7MT1RTqs,0.35,2018-11-07 19:21:05,True,True
2018-11-07T19:51:14,"I feel like I already know the movie. Two teenagers, both ill, fall in love and in the end one of them dies (lets hope not) but that is how it usually ends in this kind of movies",0,0,Mia,5cJ7MT1RTqs,0.0875,2018-11-07 19:51:14,True,True
2018-11-07T19:54:34,Riverdale fans pretending they are watching a random trailer. Don't think I can't see you. YES YOU THERE I GOUTCHAA,0,0,Maisoon Azzam,5cJ7MT1RTqs,-0.5,2018-11-07 19:54:34,True,True
2018-11-07T19:57:36,😍😍😍,0,0,Lynn,5cJ7MT1RTqs,0.0,2018-11-07 19:57:36,True,True
