timestamp,text,like_count,reply_count,author,trailer_id,sentiment_score,datetime,used_for_model,used_for_visualization
2018-12-31T14:13:57,I just started watching Riverdale last week. And I am here for Cole. 😂,0,0,Nash Moon,5cJ7MT1RTqs,0.0,2018-12-31 14:13:57,True,True
2018-12-31T14:31:10,So this is probably one of those teen romance movies were they don't have sex,0,0,Loren Baker,5cJ7MT1RTqs,0.0,2018-12-31 14:31:10,True,True
2018-12-31T16:50:39,Cole Sprouse😍😍😍😍,3,0,Ludmila Navarro,5cJ7MT1RTqs,0.0,2018-12-31 16:50:39,True,True
2018-12-31T17:57:06,Yall really gonna make me wait until almost APRIL to watch this??,6,0,Miley's World,5cJ7MT1RTqs,0.2,2018-12-31 17:57:06,True,True
2018-12-31T19:51:13,"JUGHEAD JONES!  oh,  it's just cole😍😍",0,0,Melissa Torres,5cJ7MT1RTqs,0.0,2018-12-31 19:51:13,True,True
2019-01-01T03:06:57,Betty has entered the chat,0,0,Maddy Quigs,5cJ7MT1RTqs,0.0,2019-01-01 03:06:57,True,True
2019-01-01T06:23:57,I like this more than the fault in ours stars. The fact that they can’t even get near each other seems so romantic.,4,0,kl28,5cJ7MT1RTqs,0.11875,2019-01-01 06:23:57,True,True
2019-01-01T07:31:25,Omg. I read the book. I loved it. Cole is hot. I need to watch this,0,0,That One Bookworm,5cJ7MT1RTqs,0.475,2019-01-01 07:31:25,True,True
2019-01-01T08:44:12,I have cf too,0,0,Mavis Nova,5cJ7MT1RTqs,0.0,2019-01-01 08:44:12,True,True
2019-01-01T14:14:27,OMG I love Cole!😍,0,0,Eliza Sprouse,5cJ7MT1RTqs,0.5,2019-01-01 14:14:27,True,True
2019-01-01T19:11:58,I smile when cole does that smile,0,0,Saoirses Life x,5cJ7MT1RTqs,0.3,2019-01-01 19:11:58,True,True
2019-01-01T19:26:28,whats the age rating,0,0,Breeze 14,5cJ7MT1RTqs,0.0,2019-01-01 19:26:28,True,True
2019-01-01T20:24:38,Only going to watch this because Cole is in it,0,0,b e n t o b o x e s,5cJ7MT1RTqs,0.0,2019-01-01 20:24:38,True,True
2019-01-01T21:54:05,Its beautiful lili gonna get mad jk 😂😭😎😇,0,0,Melody Esparza,5cJ7MT1RTqs,0.11249999999999999,2019-01-01 21:54:05,True,True
2019-01-01T21:54:59,COLE SPROUSE!!!! THIS IS GONNA BE A GOOD MOVIE,0,0,Melody Esparza,5cJ7MT1RTqs,0.7,2019-01-01 21:54:59,True,True
2019-01-02T00:15:14,OMG COLE YESSS I'M WATCHIN I CAN ALREADY TELL IT'S GONNA BE A TEAR JERKER,0,0,kyoongssuk,5cJ7MT1RTqs,0.0,2019-01-02 00:15:14,True,True
2019-01-02T00:29:09,I'm going to cry so much dude,0,0,garbage_ 9000,5cJ7MT1RTqs,0.2,2019-01-02 00:29:09,True,True
2019-01-02T00:30:47,My birthday is March 14th I know what I want for my bday,0,0,garbage_ 9000,5cJ7MT1RTqs,0.0,2019-01-02 00:30:47,True,True
2019-01-02T01:15:10,THE CHOCOLATE DONUTS,0,0,Becky N,5cJ7MT1RTqs,0.0,2019-01-02 01:15:10,True,True
2019-01-02T01:48:06,I just finished the book and I’m  really going to be sobbing during this movie😭😭,0,0,Viancalina Vega,5cJ7MT1RTqs,0.2,2019-01-02 01:48:06,True,True
2019-01-02T04:27:13,Coles head turn is the cutest thing EVER,0,0,Valerie Orellana,5cJ7MT1RTqs,0.0,2019-01-02 04:27:13,True,True
2019-01-02T06:12:47,I'm waiting for this!!!,0,0,Hwang Jess,5cJ7MT1RTqs,0.0,2019-01-02 06:12:47,True,True
2019-01-02T06:48:04,Guys just finished the movie and now MORE EXCITED AND HONESTLY CANT WAIT TO WATCH THIS BEYOND WORDS AWESOME MOVIE,0,0,Carolina Valencia,5cJ7MT1RTqs,0.61875,2019-01-02 06:48:04,True,True
2019-01-02T10:59:39,1:12 Me: * inhales * 2:02 Me: * exhales * 2:13 Me: Omg his smile. I can't- 2:15 Me: *dies*,0,0,GalaxyDragon159,5cJ7MT1RTqs,0.3,2019-01-02 10:59:39,True,True
2019-01-02T12:29:14,I’m such a crier maybe I should skip this movie...... WHO AM I KIDDING IM GONNA WHATCH IT BRING ON THE FREAKING TEARS,0,0,Audrey k,5cJ7MT1RTqs,0.0,2019-01-02 12:29:14,True,True
2019-01-02T13:20:48,2:15 he’s sooooo beautifullll,2,0,Matilde Pires,5cJ7MT1RTqs,0.0,2019-01-02 13:20:48,True,True
2019-01-02T13:27:49,Alguém  br ?,0,0,Matheus Araújo,5cJ7MT1RTqs,0.0,2019-01-02 13:27:49,True,True
2019-01-02T14:14:46,zico fyeahh,0,0,DanCholo,5cJ7MT1RTqs,0.0,2019-01-02 14:14:46,True,True
2019-01-02T15:19:02,cole sprouse looks like he doesnt shower and blames women for his problems because he’s artsy and they dont understand him,0,0,rachael scerbo,5cJ7MT1RTqs,0.0,2019-01-02 15:19:02,True,True
2019-01-02T15:24:08,"i was in hospital for a couple of days for some blood issues, and i met a kid on my floor, i learned his name was connor. i was asking him why he was in hospital. turned out he has CF. we talked all the time while i was in hospital, he got me through it. he was and is still such a great friend. we both still talk, he is one of the most funny, sweet, caring person i have met. knowing, he won’t be able to fully live his life is heartbreaking. he’s got until he is 24. it’s sad how someone you truly love, that they won’t be there for long.",0,0,Sky Saengkaew,5cJ7MT1RTqs,0.24863636363636363,2019-01-02 15:24:08,True,True
2019-01-02T15:32:57,"The aquarium shot (romeo + juliet), the shot on the ice pond (eternal sunshine)... Is this movie supposed to be borrowing from iconic romantic scenes?  I hope the film at least USES them in a clever way. if not, get your own goddam ideas!!!",0,0,Gail Hobbs,5cJ7MT1RTqs,0.2733333333333333,2019-01-02 15:32:57,True,True
2019-01-02T16:01:52,Wait if they’re not supposed to get within 6 feet why is the movie called 5 feet apart not 6 ?,0,0,Gacha Pancake,5cJ7MT1RTqs,0.0,2019-01-02 16:01:52,True,True
2019-01-02T16:22:07,"This looks amazing, but I CANNOT see Cole with anyone else BUT Lili  Still looks great tho 😂😂",0,0,Emsy,5cJ7MT1RTqs,0.7000000000000001,2019-01-02 16:22:07,True,True
2019-01-02T16:30:57,"Gusys I'm bored af, could anyone recommend some movies plss",0,0,marija lucic123,5cJ7MT1RTqs,-0.5,2019-01-02 16:30:57,True,True
2019-01-02T17:19:14,"I read the book, so excited to see this!",1,0,Ella Naphin,5cJ7MT1RTqs,0.46875,2019-01-02 17:19:14,True,True
2019-01-02T17:36:29,I love Cole Sprouse so,0,0,julla,5cJ7MT1RTqs,0.5,2019-01-02 17:36:29,True,True
2019-01-02T18:03:00,Who's only here for Cute Cole Sprouse?!?,0,0,Sun Stream19,5cJ7MT1RTqs,0.3125,2019-01-02 18:03:00,True,True
2019-01-02T18:23:25,Is this going to be like The Fault in Our Stars and when she finally gets a donor he dies or something?,0,0,Tammy Sargeant,5cJ7MT1RTqs,0.0,2019-01-02 18:23:25,True,True
2019-01-02T18:58:19,five feet apart cause they're not gay,0,0,Suraj vs. World,5cJ7MT1RTqs,-0.20833333333333334,2019-01-02 18:58:19,True,True
2019-01-02T19:13:21,My mom has CF... and she loves romantic movies haha...let’s just say we can’t wait.,0,0,Meghan Wuersig,5cJ7MT1RTqs,0.0,2019-01-02 19:13:21,True,True
2019-01-02T19:20:45,Is Bates Motel connected to this in some way??,0,0,Felipe Salas,5cJ7MT1RTqs,0.0,2019-01-02 19:20:45,True,True
2019-01-02T20:15:27,I think I'm  in love again,0,0,Sandra Garcia,5cJ7MT1RTqs,0.5,2019-01-02 20:15:27,True,True
2019-01-02T20:56:28,Cannot wait to see this film! Does anyone know the name of the song at the the very beginning?,0,0,Mel Evans,5cJ7MT1RTqs,0.2,2019-01-02 20:56:28,True,True
2019-01-02T22:38:19,How can anyone not fall for that smile,0,0,Shalaka Pradhan 2 nd,5cJ7MT1RTqs,0.3,2019-01-02 22:38:19,True,True
2019-01-02T22:44:39,JUGHEAAAAAAADD!!!!!!!!!!!,0,0,NSYk Gaming,5cJ7MT1RTqs,0.0,2019-01-02 22:44:39,True,True
2019-01-02T23:29:02,COLE IS LILIS MAN NOT THIS “girl” AHHHHHHHHHHHHHHHHHHHHHHHHHHHHHHHHHHHHHHHHHHH,0,0,Crazy Cat Fuck you,5cJ7MT1RTqs,0.0,2019-01-02 23:29:02,True,True
2019-01-03T01:02:40,Anyone else thought this was Zoey deutch?,0,0,Sabrina Bonilla,5cJ7MT1RTqs,0.0,2019-01-03 01:02:40,True,True
2019-01-03T01:50:07,cause they’re not gay,0,0,Diana G.,5cJ7MT1RTqs,-0.20833333333333334,2019-01-03 01:50:07,True,True
2019-01-03T01:51:45,Five feet apart so that lili (aka Betty) doesn't get mad       If u watch riverdale u will understand,0,0,Starbucks Girl,5cJ7MT1RTqs,-0.625,2019-01-03 01:51:45,True,True
2019-01-03T03:00:14,Is Haley coming for Lili reinharts mans,0,0,Kylynn Guajardo,5cJ7MT1RTqs,0.0,2019-01-03 03:00:14,True,True
2019-01-03T03:39:57,Uughhh can't wait for this movie,0,0,Jakayla Hardy,5cJ7MT1RTqs,0.0,2019-01-03 03:39:57,True,True
2019-01-03T03:57:06,I’m upset that Cole is in this movie  i just hope there is no kisses between them,0,0,Tiffany Gaming,5cJ7MT1RTqs,0.0,2019-01-03 03:57:06,True,True
2019-01-03T07:01:58,Cole is so cute just in this trailer omg imagine in the movie I must see it 😂also it looks really good sorry I'm fangirling😍🤣,0,0,Jazz H,5cJ7MT1RTqs,0.2333333333333333,2019-01-03 07:01:58,True,True
2019-01-03T07:10:12,IT IS NOT OK WITH COLE BEING WITH ANYONE ELSE!! ONLY BETTY/LILI!!,0,0,lil bean,5cJ7MT1RTqs,-0.1953125,2019-01-03 07:10:12,True,True
2019-01-03T07:44:44,Can't wait to see this movie  👍👀🍿🎟️📽️,22,1,Zarahy Perla,5cJ7MT1RTqs,0.0,2019-01-03 07:44:44,True,True
2019-01-03T10:03:39,TWO GUYS CHILLIN IN A HOTTUB FIVE FEET APART CAUSE THEY'RE NOT GAY,0,0,i speak baguettes,5cJ7MT1RTqs,-0.20833333333333334,2019-01-03 10:03:39,True,True
2019-01-03T14:42:01,This is so cute,0,0,Danielle Bennett,5cJ7MT1RTqs,0.5,2019-01-03 14:42:01,True,True
2019-01-03T15:16:50,OMG Cole Sprouse?i didn't even recognized him till the end dude's changed so much,0,0,Daniel Ilibman,5cJ7MT1RTqs,0.2,2019-01-03 15:16:50,True,True
2019-01-03T15:28:19,What the songs calls please?,0,0,Nasiim Mohammed,5cJ7MT1RTqs,0.0,2019-01-03 15:28:19,True,True
2019-01-03T17:25:05,Can't wait.,0,0,Ngamba Kh,5cJ7MT1RTqs,0.0,2019-01-03 17:25:05,True,True
2019-01-03T21:26:19,FIVE FEET APART CUZ THEY’RE NOT GAY,1,0,RandomShiz,5cJ7MT1RTqs,-0.20833333333333334,2019-01-03 21:26:19,True,True
2019-01-03T21:50:03,Stay away from cole! He's Lili's😡,0,0,MATTHEWS Stella,5cJ7MT1RTqs,0.0,2019-01-03 21:50:03,True,True
2019-01-03T21:51:38,I just finished the book and I absolutely loved it. Touching. Heartbreaking and heartwarming at the same time- a story of love that can never happen. A choice between love and death. I'm so excited for the movie!!,0,0,Marissa Perez,5cJ7MT1RTqs,0.4643229166666667,2019-01-03 21:51:38,True,True
2019-01-03T22:18:27,Does anyone know if this will be in theaters,0,0,Carlie,5cJ7MT1RTqs,0.0,2019-01-03 22:18:27,True,True
2019-01-03T22:22:15,omg i can't wait till it comes out!!!!!!!! I love Cole Sprouse! ugh! i cant wait 2 months.,0,0,Drew Normandin,5cJ7MT1RTqs,0.78125,2019-01-03 22:22:15,True,True
2019-01-03T22:28:17,Considering watching this because of Cole. I saw him in Riverdale and I love his acting,0,0,Duck Momma,5cJ7MT1RTqs,0.25,2019-01-03 22:28:17,True,True
2019-01-03T22:30:37,I just read the book today and I freaking loved it! I'm super pumped for this movie..even though I'm not sure how I feel about the casting of Poe.,0,0,addictedtofandoms,5cJ7MT1RTqs,0.3194444444444444,2019-01-03 22:30:37,True,True
2019-01-04T00:12:19,i see Cole Sprouse. i click on trailer. i watch trailer. i think to myself: I WANNA SEE THIS MOVIE NOWWWWWWWW,0,0,fae,5cJ7MT1RTqs,0.0,2019-01-04 00:12:19,True,True
2019-01-04T00:54:22,For everyone here like I NEED TO WATCH THIS MOVIE      READ. THE. BOOK.,0,0,Julia MaAtMaN,5cJ7MT1RTqs,0.0,2019-01-04 00:54:22,True,True
2019-01-04T02:28:31,Saw cole. MOM I WANT TO SEE THIS MOVIE,0,0,Allison McAfee,5cJ7MT1RTqs,0.0,2019-01-04 02:28:31,True,True
2019-01-04T02:35:48,im currently reading the book to this. i hope the movie is just as good omg😍,0,0,jayce,5cJ7MT1RTqs,0.35,2019-01-04 02:35:48,True,True
2019-01-04T02:38:42,what is the song tittle?,0,0,Ridha wahyuni Rakhman,5cJ7MT1RTqs,0.0,2019-01-04 02:38:42,True,True
2019-01-04T03:08:30,"Coles love interest will die , so does Rico from Hannah Montana and Coles character will get new lungs. I can already guess the ending of the movie from this trailer.",0,0,Karleigh Rock,5cJ7MT1RTqs,0.3181818181818182,2019-01-04 03:08:30,True,True
2019-01-04T05:39:51,5ft apart cause they're not gay,0,0,beeasaurous,5cJ7MT1RTqs,-0.20833333333333334,2019-01-04 05:39:51,True,True
2019-01-04T10:24:25,Five feet apart 'cause theyre not gay,0,0,pinggiran pastel,5cJ7MT1RTqs,-0.20833333333333334,2019-01-04 10:24:25,True,True
2019-01-04T10:41:28,5 FEET APART CUZ THEY'RE NOT GAYYY,0,0,dae grant,5cJ7MT1RTqs,0.0,2019-01-04 10:41:28,True,True
2019-01-04T13:04:38,If you wanna know how it ends then read the book,0,0,Alex M,5cJ7MT1RTqs,0.0,2019-01-04 13:04:38,True,True
2019-01-04T23:40:53,That face when cole says shake on it is so cute jdkkskdkekdklslsokfiekodod <333,0,0,Anya Paul,5cJ7MT1RTqs,0.5,2019-01-04 23:40:53,True,True
2019-01-05T01:50:51,Im so happy they are making a movie about this my sisters may they rest in paradise would have loved to see this movie 😭 i miss them so much.. definitely going to see this,0,0,Ya Boii Luckz,5cJ7MT1RTqs,0.5,2019-01-05 01:50:51,True,True
2019-01-05T03:48:06,I’m only watching this movie for Cole and so are you 😉😂,2,0,Carla Luciana,5cJ7MT1RTqs,0.0,2019-01-05 03:48:06,True,True
2019-01-05T09:40:56,Oh we’re going in for this one bro,0,0,Isai Calles,5cJ7MT1RTqs,0.0,2019-01-05 09:40:56,True,True
2019-01-05T13:27:39,"I hope after this movie, I won't have to explain every single person what cystic fibrosis is :) not that it bothers me, people are just not aware of it.",0,0,natalijabvelov,5cJ7MT1RTqs,0.1011904761904762,2019-01-05 13:27:39,True,True
2019-01-05T14:51:24,So does anyone die,0,0,Laraib Shams,5cJ7MT1RTqs,0.0,2019-01-05 14:51:24,True,True
2019-01-05T15:18:47,I love how jughead and betty or bughead are really cute together and when I see Cole Sprouse in a romance movie with another girl it just makes me upset😪,0,0,M Cooke,5cJ7MT1RTqs,0.5,2019-01-05 15:18:47,True,True
2019-01-05T18:18:09,Bughead/spousehart forever!,0,0,William Dickens,5cJ7MT1RTqs,0.0,2019-01-05 18:18:09,True,True
2019-01-05T21:15:13,Cole 🥰😍,0,0,bayern fan :D,5cJ7MT1RTqs,0.0,2019-01-05 21:15:13,True,True
2019-01-05T22:44:11,HOW COULD YOU DO THIS TO BETTY COOPER,0,0,Mckayla Dishon,5cJ7MT1RTqs,0.0,2019-01-05 22:44:11,True,True
2019-01-05T23:16:03,1:18 Moises Arias A.K.A Rico (from Hannah Montana),0,0,Anna Ayodele,5cJ7MT1RTqs,0.0,2019-01-05 23:16:03,True,True
2019-01-05T23:37:19,Cole! ❤️,0,0,Ally Hvis,5cJ7MT1RTqs,0.0,2019-01-05 23:37:19,True,True
2019-01-06T00:17:35,"Everyone’s talking about Cole but look at Haley, she’s so beautiful too Y’ALL",0,0,SuperTalks,5cJ7MT1RTqs,0.85,2019-01-06 00:17:35,True,True
2019-01-06T00:57:12,Did someone else noticed Kaneki's Mask at 0:53 ???,1,0,vKezyk,5cJ7MT1RTqs,0.0,2019-01-06 00:57:12,True,True
2019-01-06T03:32:45,SPOILER ALERT: Poe dies and Will leaves her because she gets new lungs. Also her sister Abby is dead.,0,0,Mackenzi Salinas,5cJ7MT1RTqs,-0.03181818181818183,2019-01-06 03:32:45,True,True
2019-01-06T03:42:06,Haley Lu is so pretty 🙈,0,0,Bach Ong,5cJ7MT1RTqs,0.25,2019-01-06 03:42:06,True,True
2019-01-06T04:14:04,"I have an epub book of ""five feet apart"" anyone who wants to download it for FREE! Just subscribe to my channel. I will upload a tutorial on how to download this book, later tonight, around 6 pm❤️",0,0,Paul pro,5cJ7MT1RTqs,0.2333333333333333,2019-01-06 04:14:04,True,True
2019-01-06T04:54:05,Not to be wierd but if i was lili I we’ll be so jealous rn for this movie,0,0,The E&B Channel,5cJ7MT1RTqs,0.0,2019-01-06 04:54:05,True,True
2019-01-06T05:12:50,JUGHEAD😆!,0,0,Scion SilverBeat,5cJ7MT1RTqs,0.0,2019-01-06 05:12:50,True,True
2019-01-06T07:48:58,"Five Feet Apart, because Haley is only Five Feet😂  I won't see this in theatres, but check it out in Redbox. Pretending to rent it for my gf, but mostly for me...😄",0,0,Gilbert Garces,5cJ7MT1RTqs,0.25,2019-01-06 07:48:58,True,True
2019-01-06T21:44:07,Can anyone tell me what song is that,0,0,Vin'Nya William,5cJ7MT1RTqs,0.0,2019-01-06 21:44:07,True,True
2019-01-06T22:06:32,I love you cole,0,0,Mckayla Dishon,5cJ7MT1RTqs,0.5,2019-01-06 22:06:32,True,True
2019-01-07T00:09:09,Yup one of them is going to die😭,0,0,ExoticButter s,5cJ7MT1RTqs,0.0,2019-01-07 00:09:09,True,True
2019-01-07T01:25:27,I wish I was the girl only because she meets Cole and they are in love,0,0,Lacey H,5cJ7MT1RTqs,0.25,2019-01-07 01:25:27,True,True
2019-01-07T04:24:00,Omg I'm so excited I can't wait to watch the movie! I've already read the book.  Cole Sprouse & Moises Arias! 😍💙,0,0,Stephanie Walters,5cJ7MT1RTqs,0.5859375,2019-01-07 04:24:00,True,True
2019-01-07T09:22:05,Cuz they’re not gay,0,0,Melinda Reed,5cJ7MT1RTqs,-0.20833333333333334,2019-01-07 09:22:05,True,True
2019-01-07T10:56:37,which song is this?,0,1,akko kagari,5cJ7MT1RTqs,0.0,2019-01-07 10:56:37,True,True
2019-01-07T11:47:52,I can't wait to watch this movie.,0,0,Alicia Ortega,5cJ7MT1RTqs,0.0,2019-01-07 11:47:52,True,True
2019-01-07T11:48:08,😍,0,0,Alicia Ortega,5cJ7MT1RTqs,0.0,2019-01-07 11:48:08,True,True
2019-01-07T16:16:49,<3 R.I.P Claire Wineland,0,0,Shelby Haney,5cJ7MT1RTqs,1.0,2019-01-07 16:16:49,True,True
2019-01-07T17:22:20,is it just me or do they really look a like,0,0,SOPHIA CAMILLE,5cJ7MT1RTqs,0.2,2019-01-07 17:22:20,True,True
2019-01-07T17:31:23,When this movie will start?,0,1,Zhanara Duishenbekova,5cJ7MT1RTqs,0.0,2019-01-07 17:31:23,True,True
2019-01-07T17:54:01,Lili and Cole forever! 🐍😍😂,2,0,Josie,5cJ7MT1RTqs,0.0,2019-01-07 17:54:01,True,True
2019-01-07T18:55:43,All of this time I thought she was Olivia Cooke,0,0,Laura Andrea Rosales,5cJ7MT1RTqs,0.0,2019-01-07 18:55:43,True,True
2019-01-07T22:20:59,Why’s no one talking about Haley!!!!!??,0,0,June Pizza,5cJ7MT1RTqs,0.0,2019-01-07 22:20:59,True,True
2019-01-07T23:49:49,Really good looks like a very good movie,0,0,Flannery,5cJ7MT1RTqs,0.8049999999999999,2019-01-07 23:49:49,True,True
2019-01-08T01:12:39,Read the book,0,0,Alessandra Lia,5cJ7MT1RTqs,0.0,2019-01-08 01:12:39,True,True
2019-01-08T02:40:04,*lili is triggered*,9,0,ChimChim BTS,5cJ7MT1RTqs,0.0,2019-01-08 02:40:04,True,True
2019-01-08T11:19:25,0:46 till 0:51 IS SO FREAKING CUTEEE I CAN’T😭😍😍🥰 but i wish she was lili😝🖤,0,0,Who da heck r u ¿,5cJ7MT1RTqs,0.0,2019-01-08 11:19:25,True,True
2019-01-08T18:59:23,"Aww, im cry, this is so cuteee😭❤️😍   I NEED TO WATCH THIS MOVIE 😍😍😍😭😭😭",0,0,Lilla,5cJ7MT1RTqs,0.3,2019-01-08 18:59:23,True,True
2019-01-08T23:33:57,Cole Sprouse?     *oh yeah*,2,0,angelina squeo,5cJ7MT1RTqs,0.0,2019-01-08 23:33:57,True,True
2019-01-09T01:32:14,2:15   That smile could light up a whole city ❤,1,0,Gachacoke,5cJ7MT1RTqs,0.3,2019-01-09 01:32:14,True,True
2019-01-09T01:37:33,So many exact quotes from the book :0,0,0,Gio uwu,5cJ7MT1RTqs,0.375,2019-01-09 01:37:33,True,True
2019-01-09T04:31:04,1:26 “Six feet apart at all times” ? It’s called five feet apart,0,0,Jun,5cJ7MT1RTqs,0.0,2019-01-09 04:31:04,True,True
2019-01-09T04:39:38,does this remind anyone of red band society?,0,0,Katie Walker,5cJ7MT1RTqs,0.0,2019-01-09 04:39:38,True,True
2019-01-09T05:52:53,I kinda wanna watch this.... now,0,0,Alex Ander,5cJ7MT1RTqs,0.0,2019-01-09 05:52:53,True,True
2019-01-09T11:45:39,Okay so I’m annoying ik this is just a movie BUT WHAT ABOUT SPROUSEHART??? HUHHH!!!!! But the movie looks nice!,0,0,No one,5cJ7MT1RTqs,0.08333333333333333,2019-01-09 11:45:39,True,True
2019-01-09T15:12:04,Waiting for this movie 😍😍😍😍😍😍😍,0,0,Sharaya's Kids Corner,5cJ7MT1RTqs,0.0,2019-01-09 15:12:04,True,True
2019-01-10T02:18:46,This looks like a really cool and inspirational movie.,0,0,Nathan Cellini,5cJ7MT1RTqs,0.425,2019-01-10 02:18:46,True,True
2019-01-10T02:40:56,"I know everyone is going like ""ohhhh the fault in our stars"" ""oooh everythin everything""....yeah they have similar main idea but I feel.like this one is gonna be sooo sooo much better",0,0,gihan fares,5cJ7MT1RTqs,0.2222222222222222,2019-01-10 02:40:56,True,True
2019-01-10T22:17:36,Two guys chilling in a hospital five feet apart or they’ll die,0,0,graceyale._ e,5cJ7MT1RTqs,-0.5,2019-01-10 22:17:36,True,True
2019-01-11T00:09:49,I can tell this is going to be a great movie but it's just a movie where 14 year old pale chicks can get horny from that Cole guy.,0,0,IsoZayy,5cJ7MT1RTqs,0.23,2019-01-11 00:09:49,True,True
2019-01-11T00:16:49,Can’t wait till this movie comes out!! My mom had CF and I’m a carrier and CF is dear to my heart.,0,0,Jazmyne,5cJ7MT1RTqs,0.0,2019-01-11 00:16:49,True,True
2019-01-11T02:52:20,"""I know you, Stella. Organizing a med cart is like foreplay."" Gotta be my favorite line from the movie and the book.",3,1,Wendellmina Gaurino,5cJ7MT1RTqs,0.5,2019-01-11 02:52:20,True,True
2019-01-11T16:43:26,The sole reason why I came is because: Five feet apart cause they’re not gay,2,0,"Excited Cat-Loving,Alien Geek",5cJ7MT1RTqs,-0.10416666666666667,2019-01-11 16:43:26,True,True
2019-01-11T20:11:17,I am not crying your crying!,0,0,Cat with Banana,5cJ7MT1RTqs,-0.075,2019-01-11 20:11:17,True,True
2019-01-12T01:08:10,Wizards On Deck with Hannah Montana AND RRRRRRRRRRRRRRRIIIIIIIIIICCCCCCCOOOOOOOOOOO,0,0,Layali Attalah,5cJ7MT1RTqs,0.0,2019-01-12 01:08:10,True,True
2019-01-12T10:37:55,"Lili will always be better with him ""cough"" ""cough"" only bughead fans will understand.",0,0,lil goth girl,5cJ7MT1RTqs,0.25,2019-01-12 10:37:55,True,True
2019-01-12T20:13:13,I'm only watching this cuz it has jughead Jones 🌈🌈💖💖,0,0,Bella Winchester,5cJ7MT1RTqs,0.0,2019-01-12 20:13:13,True,True
2019-01-12T23:27:12,I'll cry,0,0,Luka Pućo,5cJ7MT1RTqs,0.0,2019-01-12 23:27:12,True,True
2019-01-13T02:21:05,why can't this movie come out already!!!!!,0,0,Mimi Gordon,5cJ7MT1RTqs,0.0,2019-01-13 02:21:05,True,True
2019-01-13T05:30:16,cole sprouse is my father,0,0,its not lin,5cJ7MT1RTqs,0.0,2019-01-13 05:30:16,True,True
2019-01-13T05:47:30,AYEEE COLE SPROUSE FROM RIVERDALE,0,0,Clout QueenMsp Msp,5cJ7MT1RTqs,0.0,2019-01-13 05:47:30,True,True
2019-01-13T05:48:23,She is so pretty💝,0,0,Lucy Lee,5cJ7MT1RTqs,0.0,2019-01-13 05:48:23,True,True
2019-01-13T06:27:54,So it could be based on real story See this - https://youtu.be/yIUs8P1yQjM .,0,0,Sanskar Sharma 'A',5cJ7MT1RTqs,0.2,2019-01-13 06:27:54,True,True
2019-01-13T06:29:26,1:13 - Cole's expression are killing me,0,0,Sanskar Sharma 'A',5cJ7MT1RTqs,0.0,2019-01-13 06:29:26,True,True
2019-01-13T06:35:26,Not trying to not back up Haley but I’m not shocked that people backlashed at Haley because of #bughead and #sprousehart,0,0,Julia Stevens,5cJ7MT1RTqs,0.175,2019-01-13 06:35:26,True,True
2019-01-13T13:26:34,"Everyone says ""OMG COLE FROM THE SUIT LIFE ON DECK"" and im like ""OMG LITTLE BEN FROM FRIENDS"" 😂",1,0,AlwaysIense x,5cJ7MT1RTqs,-0.1875,2019-01-13 13:26:34,True,True
2019-01-13T20:01:48,do either of them die?,0,0,Mia Rose,5cJ7MT1RTqs,0.0,2019-01-13 20:01:48,True,True
2019-01-14T00:48:20,Cole sprouse.... my god I can't st ok watching this trailer....just imagine when the movie comes out....I'll scream my lungs out in the theatres,0,0,madlyclumsy ?¿?¿,5cJ7MT1RTqs,0.5,2019-01-14 00:48:20,True,True
2019-01-14T01:58:47,So cute,1,0,Amanda Snopek,5cJ7MT1RTqs,0.5,2019-01-14 01:58:47,True,True
2019-01-14T02:36:32,What is the fault in our stars?,0,0,Arden Dethridge,5cJ7MT1RTqs,0.0,2019-01-14 02:36:32,True,True
2019-01-14T05:20:09,COLE SPROUSE IS SO CUTE!!!,0,0,Indah Bayhaqi,5cJ7MT1RTqs,0.9765625,2019-01-14 05:20:09,True,True
2019-01-14T07:44:42,No one is gonna talk about Cole's Killin expression?????,0,0,Sanskar Sharma 'A',5cJ7MT1RTqs,0.0,2019-01-14 07:44:42,True,True
2019-01-14T07:47:19,I am obsessed with the trailer I don't know what's gonna happen when movie comes out.,0,0,Sanskar Sharma 'A',5cJ7MT1RTqs,-0.5,2019-01-14 07:47:19,True,True
2019-01-14T08:13:41,It's Cool that a movie is coming out about this. My husband has CF and it seems to be a topic a lot don't know about. It's cool that it is being brought up more. Well if anyone is curious on how this is the same or differs in real life my husband and I have a vlog we started. It's a lifestyle vlog centered around CF. You can find it at CF filmmaker on YouTube.,0,0,believe1 smile,5cJ7MT1RTqs,0.21666666666666665,2019-01-14 08:13:41,True,True
2019-01-14T10:54:12,1:12 2:16 That Smile!😍 I literally only want to watch this because of Cole Sprouse 😩❤️🤤🤤,0,0,Donna Hanson,5cJ7MT1RTqs,0.0,2019-01-14 10:54:12,True,True
2019-01-14T11:51:15,Cole reminds me of Claire 😭😭😭😭,0,0,Sanskar Sharma 'A',5cJ7MT1RTqs,0.0,2019-01-14 11:51:15,True,True
2019-01-14T12:54:19,Spoiler: poe dies,1,0,Laila Hammoudeh,5cJ7MT1RTqs,0.0,2019-01-14 12:54:19,True,True
2019-01-14T14:43:39,I‘ll have cf😔,0,0,Leonie,5cJ7MT1RTqs,0.0,2019-01-14 14:43:39,True,True
2019-01-14T15:44:23,Где русские?,0,0,Kira Jones,5cJ7MT1RTqs,0.0,2019-01-14 15:44:23,True,True
2019-01-14T18:02:01,Hey i cant find it in netflix ?,0,0,Fifth Color,5cJ7MT1RTqs,0.0,2019-01-14 18:02:01,True,True
2019-01-14T18:51:10,Im a simple person  i see cole i click,0,0,ExcuseMe,5cJ7MT1RTqs,0.0,2019-01-14 18:51:10,True,True
2019-01-14T19:46:24,It should be ten metres apart,0,0,M P,5cJ7MT1RTqs,0.0,2019-01-14 19:46:24,True,True
2019-01-14T20:42:02,If hè gets better by the medication and then gives his lungs to her i am gonna get mad,0,0,Benja,5cJ7MT1RTqs,-0.0625,2019-01-14 20:42:02,True,True
2019-01-14T20:54:46,JUGHEAD!!!,0,0,Learningaboutspace iscool,5cJ7MT1RTqs,0.0,2019-01-14 20:54:46,True,True
2019-01-14T22:43:42,This trailer hit me so hard when I saw it in theatres I lost my best friend to cystic fibrosis at only 16 I miss her so much! This disease sucks and I’m so sorry for anyone who has/or is going through it!   I miss and love you kayleigh! 💕,0,0,Leanzah Walsh,5cJ7MT1RTqs,0.09404761904761903,2019-01-14 22:43:42,True,True
2019-01-14T22:56:05,COLE SPROUSE !!!!!!!!😁,2,0,Cici Borris,5cJ7MT1RTqs,0.0,2019-01-14 22:56:05,True,True
2019-01-15T01:06:44,CAN'T WAIT!!!!,0,0,Spicyy Chim,5cJ7MT1RTqs,0.0,2019-01-15 01:06:44,True,True
2019-01-15T07:45:43,"For all of you wondering, this IS based on the book with the same title by Rachael Lippincott. You're welcome",12,2,Madhumitha JR,5cJ7MT1RTqs,0.4,2019-01-15 07:45:43,True,True
