timestamp,text,like_count,reply_count,author,trailer_id,sentiment_score,datetime,used_for_model,used_for_visualization
2018-11-02T16:19:27,First comment    I LOVE IT💗💗 I can’t wait to see it💗💗💗💗💗,84,2,Sam Flores,5cJ7MT1RTqs,0.375,2018-11-02 16:19:27,True,True
2018-11-02T16:20:46,Lol,0,0,X Angelina,5cJ7MT1RTqs,0.8,2018-11-02 16:20:46,True,True
2018-11-02T16:22:08,THIS LOOKS AMAZING,8,0,Elizibean YT,5cJ7MT1RTqs,0.6000000000000001,2018-11-02 16:22:08,True,True
2018-11-02T16:22:50,So excited! 💓💓,0,0,Ava C,5cJ7MT1RTqs,0.46875,2018-11-02 16:22:50,True,True
2018-11-02T16:23:09,I'm definitely gonna watch this movie and cry my heart out,1763,12,Carolin Mölders,5cJ7MT1RTqs,0.0,2018-11-02 16:23:09,True,True
2018-11-02T16:23:16,Ohh this is so Good  and CUTEEEE!!!😭😭😭💖💖💖,49,0,dharmendra nagori,5cJ7MT1RTqs,0.7,2018-11-02 16:23:16,True,True
2018-11-02T16:23:24,FINALLY!!! A TRAILER!!! I HAD BEEN DYING FOR CONTENT FROM THIS MOVIE AND THE BOOK ISN'T EVEN OUT YET TILL NOV 20TH!!! CAN'T WAIT!!!,8,1,Dear Cybelle,5cJ7MT1RTqs,0.0,2018-11-02 16:23:24,True,True
2018-11-02T16:24:08,YASSS YASSS YASSS IM SO HAPPY I WAS STILL AWAKE WHEN THIS CAME OUT,0,0,Dear Cybelle,5cJ7MT1RTqs,0.8,2018-11-02 16:24:08,True,True
2018-11-02T16:24:44,And I am so blessed the YouTube notifications popped out before I decided to sleep.,3,1,Dear Cybelle,5cJ7MT1RTqs,0.0,2018-11-02 16:24:44,True,True
2018-11-02T16:24:57,AHW LOOK AT COLE I CANT,0,0,naomi van gogh,5cJ7MT1RTqs,0.3,2018-11-02 16:24:57,True,True
2018-11-02T16:25:46,"Finally, Cole Sprouse gets in a romance movie.",3537,40,Dear Cybelle,5cJ7MT1RTqs,0.0,2018-11-02 16:25:46,True,True
2018-11-02T16:26:15,"Hey, Riverdale fans. I know you're there. 👋",4228,138,Dear Cybelle,5cJ7MT1RTqs,0.0,2018-11-02 16:26:15,True,True
2018-11-02T16:26:22,I'm so excited! I can't wait! 😍😭,0,0,Aleksandra Łoboda,5cJ7MT1RTqs,0.5859375,2018-11-02 16:26:22,True,True
2018-11-02T16:26:36,I got tears in my Diet Coke,0,0,Hollie,5cJ7MT1RTqs,0.0,2018-11-02 16:26:36,True,True
2018-11-02T16:27:30,Omg finally coleeee has something other then riverdale (like since 2014),340,0,demi louise,5cJ7MT1RTqs,-0.0625,2018-11-02 16:27:30,True,True
2018-11-02T16:27:57,"I'm simple, I see Cole Sprouse, I click",1004,18,delvcate,5cJ7MT1RTqs,0.0,2018-11-02 16:27:57,True,True
2018-11-02T16:28:41,I love you @colesprouse,0,0,Sveva Alfidi,5cJ7MT1RTqs,0.5,2018-11-02 16:28:41,True,True
2018-11-02T16:29:14,"Such a beautiful story, can't wait to see it!!! ❤❤❤",3,0,Leidis De la Rosa,5cJ7MT1RTqs,0.5,2018-11-02 16:29:14,True,True
2018-11-02T16:29:52,This will DEFIANTLY make me cry!!!!! LOVE it!!!!,1,0,Samuel Fishman,5cJ7MT1RTqs,1.0,2018-11-02 16:29:52,True,True
2018-11-02T16:29:56,JUST WATCHING THIS TRAILER MADE ME CRY!! IM DEFINITELY WATCHING THIS NEXT YEAR!!!!,400,8,Heart Byun,5cJ7MT1RTqs,0.0,2018-11-02 16:29:56,True,True
2018-11-02T16:31:38,Looks interesting,0,0,Ronstat,5cJ7MT1RTqs,0.5,2018-11-02 16:31:38,True,True
2018-11-02T16:32:28,AAAH OMG SO PROOOUUUDDD,0,0,Josefina Jorquera,5cJ7MT1RTqs,0.0,2018-11-02 16:32:28,True,True
2018-11-02T16:32:45,can't wait to see it,0,0,Josefina Jorquera,5cJ7MT1RTqs,0.0,2018-11-02 16:32:45,True,True
2018-11-02T16:33:30,Already my favorite movie,3,0,I'm me,5cJ7MT1RTqs,0.5,2018-11-02 16:33:30,True,True
2018-11-02T16:33:35,1:12 *COLE YOUR JUGHEAD IS SHOWING*,1154,16,Dear Cybelle,5cJ7MT1RTqs,0.0,2018-11-02 16:33:35,True,True
2018-11-02T16:35:30,I love you,0,0,mini jain,5cJ7MT1RTqs,0.5,2018-11-02 16:35:30,True,True
2018-11-02T16:36:01,I love you Cole Sprouse 😍😍😍😍😍😍😘,8,0,mini jain,5cJ7MT1RTqs,0.5,2018-11-02 16:36:01,True,True
2018-11-02T16:36:23,Its like stay awake agatha movie version omyyyy,0,0,Love Lawliet,5cJ7MT1RTqs,0.0,2018-11-02 16:36:23,True,True
2018-11-02T16:37:24,This is going to make me cry,29,3,renata av,5cJ7MT1RTqs,0.0,2018-11-02 16:37:24,True,True
2018-11-02T16:37:43,My heart is flUttErIng and I’m SAd,10,0,JulianFlare,5cJ7MT1RTqs,-0.5,2018-11-02 16:37:43,True,True
2018-11-02T16:38:41,this looks so good omg!!!!,0,0,isa reinders,5cJ7MT1RTqs,1.0,2018-11-02 16:38:41,True,True
2018-11-02T16:39:12,I am so excited!!!,2,0,Sunny 335,5cJ7MT1RTqs,0.732421875,2018-11-02 16:39:12,True,True
2018-11-02T16:40:24,THE BEST THING I’VE EVER SEEN! I CAN’T WAIT ANY LONGER TO SEE IT! 😭😭😭❤ LOVED!,15,1,Eingel Madrid,5cJ7MT1RTqs,0.9375,2018-11-02 16:40:24,True,True
2018-11-02T16:41:17,Looks so good ❤,0,0,Robyn P,5cJ7MT1RTqs,0.7,2018-11-02 16:41:17,True,True
2018-11-02T16:42:28,cole sprouseeeeeeeeeee I love you ❤        also hi riverdale fans,67,2,katerina mp,5cJ7MT1RTqs,0.5,2018-11-02 16:42:28,True,True
2018-11-02T16:42:55,coleeeeee,0,0,isa reinders,5cJ7MT1RTqs,0.0,2018-11-02 16:42:55,True,True
2018-11-02T16:43:39,😍😍😍😍,0,0,Mildred Reyes,5cJ7MT1RTqs,0.0,2018-11-02 16:43:39,True,True
2018-11-02T16:44:22,Is it coming out in europe? (Netherlands),0,1,naomi van gogh,5cJ7MT1RTqs,0.0,2018-11-02 16:44:22,True,True
2018-11-02T16:45:56,Omg March is my birthday it was meant to beeeee,1,0,Ashlyn Lauchman,5cJ7MT1RTqs,0.0,2018-11-02 16:45:56,True,True
2018-11-02T16:46:24,"You know it is refreshing to see something so simple and pure. Usually movies today have so much 'physical contact' that's useless. Nice to see something that's just two people falling in love, without all that.",246,9,egg noodles,5cJ7MT1RTqs,0.13303571428571428,2018-11-02 16:46:24,True,True
2018-11-02T16:48:36,TWO BROS CHILLING IN THE HUTTUB FIVE FEET APART CAUSE THEY'RE NOT GAY,1995,25,konna,5cJ7MT1RTqs,-0.3541666666666667,2018-11-02 16:48:36,True,True
2018-11-02T16:49:53,I know this one is going to be one of my favorite movies ❤️,0,0,Just Someone Else,5cJ7MT1RTqs,0.5,2018-11-02 16:49:53,True,True
2018-11-02T16:49:56,They can make Cole look as sick as possible but he’ll still be smoking hot wbdkxhsbkgwbwoxhbs,0,0,xoxo,5cJ7MT1RTqs,-0.15476190476190477,2018-11-02 16:49:56,True,True
2018-11-02T16:50:05,I swear if the end is like they decide to kiss or touch each other and then they die or something im gonna be so done,4224,89,konna,5cJ7MT1RTqs,-0.125,2018-11-02 16:50:05,True,True
2018-11-02T16:50:44,Cute❤,0,0,Mysterious Gamer,5cJ7MT1RTqs,0.0,2018-11-02 16:50:44,True,True
2018-11-02T16:51:00,"This movie looks really good, the trailer itself gave me chills. Cole looks so handsome 🧡",5,0,Roms Celi,5cJ7MT1RTqs,0.6,2018-11-02 16:51:00,True,True
2018-11-02T16:51:05,Коул красавчик,0,0,Ibrahimova Dagmara,5cJ7MT1RTqs,0.0,2018-11-02 16:51:05,True,True
2018-11-02T16:51:44,i swear if he dies in this movie im jumping off my roof(but this looks so good skfkskfkskdi),1045,16,abby benfield,5cJ7MT1RTqs,0.7,2018-11-02 16:51:44,True,True
2018-11-02T16:53:02,Kygo🔥,0,0,Jerin J,5cJ7MT1RTqs,0.0,2018-11-02 16:53:02,True,True
2018-11-02T16:53:06,I need this! Like I need air and water 😊😊,1,0,arianne vas,5cJ7MT1RTqs,0.0,2018-11-02 16:53:06,True,True
2018-11-02T16:53:45,JUSTINNNNNNNNNNNNNNNN..... THIS LOOKS AMAZING! i will def cry my eyes out....cant wait!,35,0,Alexandra Nad13iiaaa,5cJ7MT1RTqs,0.9375000000000001,2018-11-02 16:53:45,True,True
2018-11-02T16:58:07,is beautifull trailer <3,0,0,Diana Ribs,5cJ7MT1RTqs,1.0,2018-11-02 16:58:07,True,True
2018-11-02T17:00:28,😭😭😭😭❤️❤️❤️❤️,0,0,Tuğçe TEZCAN,5cJ7MT1RTqs,0.0,2018-11-02 17:00:28,True,True
2018-11-02T17:00:33,Someone can tell me what is the song in the background?,2,4,Maria M.,5cJ7MT1RTqs,0.0,2018-11-02 17:00:33,True,True
2018-11-02T17:01:59,"as someone who has cf, i groan at this trailer; but; i'm going to wait until the movie comes out.",27,11,Lesley Rowland,5cJ7MT1RTqs,0.0,2018-11-02 17:01:59,True,True
2018-11-02T17:02:40,I’m so excited for this I can’t even explain,0,0,Brooke Bailey,5cJ7MT1RTqs,0.375,2018-11-02 17:02:40,True,True
2018-11-02T17:03:22,This looks so good i-,0,0,Brooke Bailey,5cJ7MT1RTqs,0.7,2018-11-02 17:03:22,True,True
2018-11-02T17:03:44,my babes are going to break the world with this film,1,0,Brooke Bailey,5cJ7MT1RTqs,0.0,2018-11-02 17:03:44,True,True
2018-11-02T17:04:12,aaaaaaaaaaaaaaa mueroooooo ya la quieroooo veeerrrrrrrr😍😍😍😍😍😍,1,0,Nancy G,5cJ7MT1RTqs,0.0,2018-11-02 17:04:12,True,True
2018-11-02T17:04:39,Anyone knows the song? Pleaseee,0,1,Aurora Giordano,5cJ7MT1RTqs,0.0,2018-11-02 17:04:39,True,True
2018-11-02T17:06:58,Aww. This looks so cute. 😍,0,0,Bri Bey,5cJ7MT1RTqs,0.5,2018-11-02 17:06:58,True,True
2018-11-02T17:07:04,"Haley looks beautiful. Cole looks beautiful. The chemistry between them is amazing (ik both of them have partners, I love SH). I want to know more of this disease. I’m so excited",86,3,ale hurtado,5cJ7MT1RTqs,0.6124999999999999,2018-11-02 17:07:04,True,True
2018-11-02T17:08:05,Done with clichê!,0,0,Unisim,5cJ7MT1RTqs,0.0,2018-11-02 17:08:05,True,True
2018-11-02T17:10:03,I too saw The Fault in Our Stars,0,0,Andrew Franklin,5cJ7MT1RTqs,0.0,2018-11-02 17:10:03,True,True
2018-11-02T17:12:38,"I had complete faith in Justin Baldoni's talent and vision but seeing this trailer gives me chills! I cannot wait for it to come out, it looks incredible!! (and thank you for making a trailer that doesn't reveal the whole story!! )",139,4,-ihhssan-,5cJ7MT1RTqs,0.4791666666666667,2018-11-02 17:12:38,True,True
2018-11-02T17:12:52,"If you watch the show Life sentence, on netflix. The main girls name is Stella and her the doctors name is Will Grant. So the names just match up",0,0,Ana Bear,5cJ7MT1RTqs,0.16666666666666666,2018-11-02 17:12:52,True,True
2018-11-02T17:14:18,Song ???,0,0,Ana Carolina Veiga,5cJ7MT1RTqs,0.0,2018-11-02 17:14:18,True,True
2018-11-02T17:15:00,Okay what is the song’s name???,0,0,Saisha Jain,5cJ7MT1RTqs,0.5,2018-11-02 17:15:00,True,True
2018-11-02T17:15:15,"So, are they making a version of ""The Fault in Our Stars"" for each disease ?!",5,4,Claudia Ivy,5cJ7MT1RTqs,0.0,2018-11-02 17:15:15,True,True
2018-11-02T17:15:20,i watched this trailer about a thousand times now and im still thirsty for more,44,2,I'm 19 you fight meee,5cJ7MT1RTqs,0.5,2018-11-02 17:15:20,True,True
2018-11-02T17:15:36,"LOL the Fault in our Sister's Keeper, basically, so i know how it ends...",32,6,Kayla Blackmon,5cJ7MT1RTqs,0.8,2018-11-02 17:15:36,True,True
2018-11-02T17:18:37,I guess this is what happens when jughead goes to Toledo,118,2,Rachael Ortiz,5cJ7MT1RTqs,0.0,2018-11-02 17:18:37,True,True
2018-11-02T17:18:55,"BTW the song in the background is ""Remind me to Forget"" by Kygo ft. Miguel",403,14,Usha Sharma,5cJ7MT1RTqs,0.0,2018-11-02 17:18:55,True,True
2018-11-02T17:19:07,"Yup, I'm in!",0,0,HippyNinjaSimmy,5cJ7MT1RTqs,0.0,2018-11-02 17:19:07,True,True
2018-11-02T17:19:29,Omg I'm so excited 😍😍😍 cole sprouse❤️❤️❤️😍😍😍,0,0,Dahlia Zeppetella,5cJ7MT1RTqs,0.375,2018-11-02 17:19:29,True,True
2018-11-02T17:19:57,#BatesMotel vibes with Olivia Cooke 😉😉,0,0,Brandon Sly,5cJ7MT1RTqs,0.0,2018-11-02 17:19:57,True,True
2018-11-02T17:20:31,I already feel the tears,0,0,Clara Öfjäll,5cJ7MT1RTqs,0.0,2018-11-02 17:20:31,True,True
2018-11-02T17:21:03,Omg I‘m soo excited!!🥰🥰🥰,1,0,Destina Özkolay,5cJ7MT1RTqs,0.0,2018-11-02 17:21:03,True,True
2018-11-02T17:22:04,"I’ve been following this movie since they very beginning, ever since they announced the cast I just fell in love, imagine my surprise when the premiere date is March 22nd, which is also, my birthday. I’m not equipped for this.",43,4,no name !,5cJ7MT1RTqs,0.2333333333333333,2018-11-02 17:22:04,True,True
2018-11-02T17:23:25,Coleee😍,1,0,Juliana,5cJ7MT1RTqs,0.0,2018-11-02 17:23:25,True,True
2018-11-02T17:25:30,Is that RIIIIICOOOOOOOO from Hannah Montana omgg,0,0,Melly Nelly,5cJ7MT1RTqs,0.0,2018-11-02 17:25:30,True,True
2018-11-02T17:26:57,So I know that I’m gonna cry my soul out when I watch this movie but I’m excited for it <3,0,0,Aliya Joy,5cJ7MT1RTqs,0.6875,2018-11-02 17:26:57,True,True
2018-11-02T17:27:34,whats the song?,0,0,Ankita Chatterjee,5cJ7MT1RTqs,0.0,2018-11-02 17:27:34,True,True
2018-11-02T17:27:55,"what a cliche movie, love that",0,0,Maria Eduarda,5cJ7MT1RTqs,0.5,2018-11-02 17:27:55,True,True
2018-11-02T17:29:13,"I love Cole, i love Justin, i still love Claire. Amazing job, so proud of you!!! Can't wait to see it 💗 #cfsucks",2,0,Maria Victoria González Castro,5cJ7MT1RTqs,0.62,2018-11-02 17:29:13,True,True
2018-11-02T17:29:14,I‘m gonna cryyyy,0,0,Destina Özkolay,5cJ7MT1RTqs,0.0,2018-11-02 17:29:14,True,True
2018-11-02T17:29:50,Wait which idiot gives a thumb down??,0,0,Destina Özkolay,5cJ7MT1RTqs,-0.4777777777777778,2018-11-02 17:29:50,True,True
2018-11-02T17:30:13,*OMG I can't wait ❤ I'm so ready to cry my eyes out watching this movie!!! :')*,0,0,H. Gabbie,5cJ7MT1RTqs,0.390625,2018-11-02 17:30:13,True,True
2018-11-02T17:30:54,"I really really hope that this movie would not dissapoint me. Cause, Before i'm fangirling over cutest western man named Cole Sprouse, i used to imagine a movie like this which tell a story about sick ill person who fall in love and the sick one is not just the girl because its boring. But the boy. Or both of them. I do really want to watch a movie like that (and then there is The Fault in Our Stars) and now my crush play a cast in a movie with a story that i really want to watch ever. So if it's worse, i would be double dissapointed. Dissapoint for my crush having bad movie and a movie is not like what i expected. And... I'm so okay if Cole die in this movie btw. Cause that would be amazing unforgettable",2,0,Kuzon kuza,5cJ7MT1RTqs,-0.07053571428571427,2018-11-02 17:30:54,True,True
2018-11-02T17:32:27,Music?,0,0,vivivi Resner,5cJ7MT1RTqs,0.0,2018-11-02 17:32:27,True,True
2018-11-02T17:34:07,COLE❤️❤️❤️❤️❤️❤️,0,0,monna73,5cJ7MT1RTqs,0.0,2018-11-02 17:34:07,True,True
2018-11-02T17:34:52,"Can someone tell me what age this movie is (pg,12,15,18 ???)",0,0,I love food,5cJ7MT1RTqs,0.0,2018-11-02 17:34:52,True,True
2018-11-02T17:35:49,I'm already crying. ç_ç,0,0,Elena Torrini,5cJ7MT1RTqs,-0.2,2018-11-02 17:35:49,True,True
2018-11-02T17:35:50,"This movie is about my mother’s friends daughter Claire, the most motivational and inspiring girl I have ever met my she fly high and visit the places she has always wanted to go. ❤️",9,13,Hollen Reid,5cJ7MT1RTqs,0.49,2018-11-02 17:35:50,True,True
2018-11-02T17:36:38,whats the song?,0,0,Kata Kelemen,5cJ7MT1RTqs,0.0,2018-11-02 17:36:38,True,True
2018-11-02T17:40:00,Omg.. this looks so good. 🖤,0,0,Kathy Cagg,5cJ7MT1RTqs,0.7,2018-11-02 17:40:00,True,True
2018-11-02T17:40:28,"So, is this will be shown on Indonesia? I absolutely watch this",0,0,Kuzon kuza,5cJ7MT1RTqs,0.2,2018-11-02 17:40:28,True,True
2018-11-02T17:40:34,Omg Cole sprouse I can’t,0,0,Sofia Di Cesare,5cJ7MT1RTqs,0.0,2018-11-02 17:40:34,True,True
2018-11-02T17:41:28,If Cole sprouse dies I’m suing this film,0,0,Sofia Di Cesare,5cJ7MT1RTqs,0.0,2018-11-02 17:41:28,True,True
2018-11-02T17:41:44,Gonna rewatch a billion times baiiiii,0,0,Sofia Di Cesare,5cJ7MT1RTqs,0.0,2018-11-02 17:41:44,True,True
2018-11-02T17:44:05,I'm definitely gonna watch this movie!,0,0,Melanie -,5cJ7MT1RTqs,0.0,2018-11-02 17:44:05,True,True
2018-11-02T17:44:19,It gets better the millionth time,0,0,Sofia Di Cesare,5cJ7MT1RTqs,0.5,2018-11-02 17:44:19,True,True
2018-11-02T17:44:26,It's been a long time since I have been this exciting for a movie!,0,0,Melanie -,5cJ7MT1RTqs,0.1625,2018-11-02 17:44:26,True,True
2018-11-02T17:44:32,Is it going to be on Netflix for the not American people?,0,2,isley polman,5cJ7MT1RTqs,0.0,2018-11-02 17:44:32,True,True
2018-11-02T17:47:57,OMG!  I can't wait for this.,0,0,Anis Laidouci,5cJ7MT1RTqs,0.0,2018-11-02 17:47:57,True,True
2018-11-02T17:49:15,im crying already cole :'(,0,0,Suparna Saha,5cJ7MT1RTqs,-0.6,2018-11-02 17:49:15,True,True
2018-11-02T17:50:04,song? please,0,0,соня тузова,5cJ7MT1RTqs,0.0,2018-11-02 17:50:04,True,True
2018-11-02T17:50:33,WHAT IS THE SONG,0,0,Pickles Are Awesome,5cJ7MT1RTqs,0.0,2018-11-02 17:50:33,True,True
2018-11-02T17:52:10,Omggg i need to see this movieee cole😍❤️,0,0,mara pinedaflores,5cJ7MT1RTqs,0.0,2018-11-02 17:52:10,True,True
2018-11-02T17:54:38,"Yessss, goosebumps 😍😍",1,0,Smile_With ME,5cJ7MT1RTqs,0.0,2018-11-02 17:54:38,True,True
2018-11-02T17:56:44,OMFG THIS IS AMAZING. COLE AND HALEY IN A ROMANCE MOVIE,0,0,Kata,5cJ7MT1RTqs,0.6000000000000001,2018-11-02 17:56:44,True,True
2018-11-02T17:59:14,JUSTIN BALDONI IS GENIUS😍,0,0,Maya Q,5cJ7MT1RTqs,0.0,2018-11-02 17:59:14,True,True
2018-11-02T17:59:24,So excited for this,0,0,aly,5cJ7MT1RTqs,0.375,2018-11-02 17:59:24,True,True
2018-11-02T17:59:30,If u haven’t replayed this more than once then u have no soul,0,0,Oghosa Emovon,5cJ7MT1RTqs,0.5,2018-11-02 17:59:30,True,True
2018-11-02T17:59:37,1:17 ITS RICO FROM HANNAH MONTANA WTH!!!!,198,10,Clara Marie,5cJ7MT1RTqs,0.0,2018-11-02 17:59:37,True,True
2018-11-02T17:59:40,KYGO!!!!,0,0,Matt Murdock,5cJ7MT1RTqs,0.0,2018-11-02 17:59:40,True,True
2018-11-02T18:00:11,God I was wish Claire was here to see this,49,5,Blueandwhite Colors,5cJ7MT1RTqs,0.0,2018-11-02 18:00:11,True,True
2018-11-02T18:01:46,If only Claire Wineland was still here to see this. She would have loved it. R.I.P Claire. 👼🏻,474,16,IKRMESHA!,5cJ7MT1RTqs,0.35,2018-11-02 18:01:46,True,True
2018-11-02T18:01:59,I will cry this is sad lmao,0,0,nela feliksiak,5cJ7MT1RTqs,0.04999999999999999,2018-11-02 18:01:59,True,True
2018-11-02T18:04:40,What is that song ?,0,0,Grycan,5cJ7MT1RTqs,0.0,2018-11-02 18:04:40,True,True
2018-11-02T18:11:20,What's the song I need to knowww,0,0,Serendipity Evolver,5cJ7MT1RTqs,0.0,2018-11-02 18:11:20,True,True
2018-11-02T18:12:12,Cole I love you ❤❤❤,0,0,Ellie Gaudio,5cJ7MT1RTqs,0.5,2018-11-02 18:12:12,True,True
2018-11-02T18:14:08,Im already crying wow,0,0,dontblame_me trash,5cJ7MT1RTqs,-0.05,2018-11-02 18:14:08,True,True
2018-11-02T18:16:18,If he dies im suing,0,0,dontblame_me trash,5cJ7MT1RTqs,0.0,2018-11-02 18:16:18,True,True
2018-11-02T18:18:47,I know that I will cry my eyes out but I'm still very excited to watch it 😭😍,0,0,Simona Hrd,5cJ7MT1RTqs,0.48750000000000004,2018-11-02 18:18:47,True,True
2018-11-02T18:23:09,I know we were all secretly hoping to see a kiss in this trailer :3,0,0,bigmjfan1,5cJ7MT1RTqs,0.04999999999999999,2018-11-02 18:23:09,True,True
2018-11-02T18:25:35,"I'm in love..at first glance I immediately was caught..This Beautiful & Sad movie is also touching..it hits you hard. It makes you feel for the characters, it makes you feel a sense of appreciation for the life that you have and the health you have because seeing and looking at the two people in this movie who portray their characters with so much debt & heart in the most dramatic,sympathetic,and heartfelt way makes you that so much more thankful to God ..even if it's not a perfect one..But it's one that's meant to be appreciative for. Awesome!! Wonderful,inspiring story of what it's like to live as a person with this condition.Thank you Justin Baldoni for such a beautifully well put story..and thank you to the leading young lady Stella Grant & Cole Sprouse as well as the entire casting of actor and actresses that bought forth this amazingly piece of art. Thank you! Now my new no #1 teen movie..Can't wait to watch.( My older brother's d-anniversary & my nephews birthday(*Mar 22nd*)",5,0,Dawn Hope,5cJ7MT1RTqs,0.23798701298701305,2018-11-02 18:25:35,True,True
2018-11-02T18:26:20,This looks amazing. Would definitely want to watch it. Congrats to Justin Baldoni and the cast ❤️❤️,0,0,yashiWinchester,5cJ7MT1RTqs,0.30000000000000004,2018-11-02 18:26:20,True,True
2018-11-02T18:29:33,Outstanding,0,0,Hiba Iqbal,5cJ7MT1RTqs,0.5,2018-11-02 18:29:33,True,True
2018-11-02T18:29:39,I love Haley Lou Richardson!! Glad she's finally in a lead role on the big screen!!,0,0,TonyPrince,5cJ7MT1RTqs,0.3203125,2018-11-02 18:29:39,True,True
2018-11-02T18:30:58,Could be interesting to see Cole in something way different. But sounds like an interesting story too!,0,0,Rubester 1219,5cJ7MT1RTqs,0.375,2018-11-02 18:30:58,True,True
2018-11-02T18:33:55,No one is talking about how they use claire winelands story to take money from cole sprouse loving 13 year-old girls!! THIS IS DISGUSTING BYE,0,0,pozdrawiam serdecznie,5cJ7MT1RTqs,-0.03125,2018-11-02 18:33:55,True,True
2018-11-02T18:35:55,I hope this movie is pg 13,0,0,TheShark Plays,5cJ7MT1RTqs,0.0,2018-11-02 18:35:55,True,True
2018-11-02T18:37:38,0:05 fiVE FEET APART CAUSE THEY'RE NOT GAY,0,0,Ashley Ramos,5cJ7MT1RTqs,-0.20833333333333334,2018-11-02 18:37:38,True,True
2018-11-02T18:38:53,"This is kinda like the movie, the fault in our stars.",0,0,pearl,5cJ7MT1RTqs,0.0,2018-11-02 18:38:53,True,True
2018-11-02T18:40:30,It’s just 2 cute😍❤️,0,0,Romi Nissim,5cJ7MT1RTqs,0.0,2018-11-02 18:40:30,True,True
2018-11-02T18:40:52,"Finally a movie about my disease!! I’m so excited for this. I know I’ll need to bring tissues...I’m already tearing up watching this. 😂 Anyways, I’m so happy to have a movie about CF on the big screen. It will bring so much awareness. #justbreathe 💜🌹",559,25,Whits Life,5cJ7MT1RTqs,0.275,2018-11-02 18:40:52,True,True
2018-11-02T18:41:29,sooooooo TFIOS remake?,0,0,Merve,5cJ7MT1RTqs,0.0,2018-11-02 18:41:29,True,True
2018-11-02T18:44:55,God... I watch this like a million times,0,0,Kuzon kuza,5cJ7MT1RTqs,0.0,2018-11-02 18:44:55,True,True
2018-11-02T18:45:09,Reminds me of the fault in our stars,0,0,Sophia Ather,5cJ7MT1RTqs,0.0,2018-11-02 18:45:09,True,True
2018-11-02T18:48:19,Here for  Haley ❤. Yah also for Cole but mainly for Haley because she is so very talented and pretty and I wish she gets everything she deserves ❤❤,0,0,U Dasgupta,5cJ7MT1RTqs,0.44222222222222224,2018-11-02 18:48:19,True,True
2018-11-02T18:53:09,got me shaking already,0,0,Wiwid Putri,5cJ7MT1RTqs,0.0,2018-11-02 18:53:09,True,True
2018-11-02T18:56:08,He’s actually hot in this,0,0,A K,5cJ7MT1RTqs,0.25,2018-11-02 18:56:08,True,True
2018-11-02T18:56:38,Cole Sprouse is playing a sick Jughead,0,0,Official Filmilen,5cJ7MT1RTqs,-0.7142857142857143,2018-11-02 18:56:38,True,True
2018-11-02T18:59:20,This movie looks amazing,0,0,Izzy M,5cJ7MT1RTqs,0.6000000000000001,2018-11-02 18:59:20,True,True
2018-11-02T19:00:20,Exciiiiited,0,0,ursula Ramsell,5cJ7MT1RTqs,0.0,2018-11-02 19:00:20,True,True
2018-11-02T19:01:45,Ross's son looks goood,0,0,Fotini K,5cJ7MT1RTqs,0.0,2018-11-02 19:01:45,True,True
2018-11-02T19:04:18,I’m so ready for this movie ! ❤️,0,0,Victoire Baillie,5cJ7MT1RTqs,0.25,2018-11-02 19:04:18,True,True
2018-11-02T19:06:23,Lili must be so proud 💓,0,0,Reyah Zaman,5cJ7MT1RTqs,0.8,2018-11-02 19:06:23,True,True
2018-11-02T19:07:07,Looks good boiz,0,0,Hammas Ullah,5cJ7MT1RTqs,0.7,2018-11-02 19:07:07,True,True
2018-11-02T19:08:19,I hope it has a worldwide release. Cole on big screen would be soo amazing !,0,0,kanika israni,5cJ7MT1RTqs,0.37500000000000006,2018-11-02 19:08:19,True,True
2018-11-02T19:08:39,One of them wil die for sure,0,0,Lucas Joha,5cJ7MT1RTqs,0.5,2018-11-02 19:08:39,True,True
2018-11-02T19:10:01,Haley: You think that's cute? Cole: do you think that's cute?  ....,0,0,Bethany Remigio,5cJ7MT1RTqs,0.5,2018-11-02 19:10:01,True,True
2018-11-02T19:10:56,THIS LOOKS SO GOOD,0,0,Grace Longaker,5cJ7MT1RTqs,0.7,2018-11-02 19:10:56,True,True
2018-11-02T19:12:03,I'm gonna cry so damn much,0,0,Arianna •,5cJ7MT1RTqs,0.2,2018-11-02 19:12:03,True,True
2018-11-02T19:12:05,Umm okay but is no one gonna mention RICO from HANNAH MONTANA sjskskslsllwo,2,0,Roomy M.,5cJ7MT1RTqs,0.5,2018-11-02 19:12:05,True,True
2018-11-02T19:12:07,This seems like such a great movie!,0,0,Isabella Ruiz,5cJ7MT1RTqs,0.5,2018-11-02 19:12:07,True,True
2018-11-02T19:12:09,Cole  😍,0,0,Rosario Perez Galvan,5cJ7MT1RTqs,0.0,2018-11-02 19:12:09,True,True
2018-11-02T19:12:59,Cole is soooooooooooooooooooooo gorgeous. imma die,0,0,Molly Maraj,5cJ7MT1RTqs,0.7,2018-11-02 19:12:59,True,True
2018-11-02T19:16:56,Oh my god!!! I'm gonna die during the wait for it to come out!,0,0,Aet-Kadi Kald,5cJ7MT1RTqs,0.0,2018-11-02 19:16:56,True,True
2018-11-02T19:17:00,Lilli Reinhart has left the chat,26,4,Gamer Girls,5cJ7MT1RTqs,0.0,2018-11-02 19:17:00,True,True
2018-11-02T19:17:16,Inspired by Claire Wineland?,1,1,Kylie K.,5cJ7MT1RTqs,0.0,2018-11-02 19:17:16,True,True
2018-11-02T19:18:25,So good that it hurts. Proud of you Cole.,0,0,Azul Ramírez S,5cJ7MT1RTqs,0.75,2018-11-02 19:18:25,True,True
2018-11-02T19:19:15,two bros chillin in a hot tub five feet apart cause theyre not gay,135,3,Kamilė Kazernavičiūtė,5cJ7MT1RTqs,0.02083333333333333,2018-11-02 19:19:15,True,True
2018-11-02T19:20:44,Omg im littery crying,0,0,Vita Bollen,5cJ7MT1RTqs,-0.2,2018-11-02 19:20:44,True,True
2018-11-02T19:24:27,"I’m not crying,ur not crying",0,0,Ashlyn Lauchman,5cJ7MT1RTqs,0.1,2018-11-02 19:24:27,True,True
2018-11-02T19:24:45,2:15 The way Cole look at Haley !! Awwww ❤️❤️❤️,0,0,Mioara Lazar,5cJ7MT1RTqs,0.5,2018-11-02 19:24:45,True,True
2018-11-02T19:25:21,1:39 “I don’t wanna hurt you” 💔😭,4,0,Lol Lel,5cJ7MT1RTqs,0.0,2018-11-02 19:25:21,True,True
2018-11-02T19:25:48,That’s a guy from Hannah Montana 😱😱😱 Ricko is back!!,1,0,Zuza Mal,5cJ7MT1RTqs,0.0,2018-11-02 19:25:48,True,True
2018-11-02T19:26:02,heart melted,0,0,Real Life with Maliha,5cJ7MT1RTqs,0.0,2018-11-02 19:26:02,True,True
2018-11-02T19:26:10,RRRRRRRRRRRRICO from Hannah Montana!!!,0,0,Anya Marais,5cJ7MT1RTqs,0.0,2018-11-02 19:26:10,True,True
2018-11-02T19:26:57,"Riverdale fans here, definetely watching this😍",0,0,Nikki Sanchez,5cJ7MT1RTqs,0.0,2018-11-02 19:26:57,True,True
2018-11-02T19:27:36,name of song?,0,0,lerice,5cJ7MT1RTqs,0.0,2018-11-02 19:27:36,True,True
2018-11-02T19:27:47,I SWEAR this seems like the same plot to the SNL version of the fault in our stars parody 😂😂😂😂😂,123,12,TAZY,5cJ7MT1RTqs,0.0,2018-11-02 19:27:47,True,True
2018-11-02T19:27:49,oh hell yeah. this looks stunning.,0,0,Samantha May,5cJ7MT1RTqs,0.5,2018-11-02 19:27:49,True,True
