timestamp,text,like_count,reply_count,author,trailer_id,sentiment_score,datetime,used_for_model,used_for_visualization
2018-11-04T00:04:19,I'm surprised  I haven't heard about  people  sending death threats to Haley yet afraid she'll break up sprousehart,0,0,Angel Mike,5cJ7MT1RTqs,-0.25,2018-11-04 00:04:19,True,True
2018-11-04T00:08:30,Song ?,0,0,Alessandra Palma,5cJ7MT1RTqs,0.0,2018-11-04 00:08:30,True,True
2018-11-04T00:09:48,"Haven't been this excited since, well never! Ahhhhh can't wait!",0,0,Tori's ASMR Tingles,5cJ7MT1RTqs,0.5859375,2018-11-04 00:09:48,True,True
2018-11-04T00:09:55,WATCH THEM END UP DYING AND RIPPIN MY SOUL APPART CUZ COLE IS BAE😩,0,0,Soraiya Vargas,5cJ7MT1RTqs,0.0,2018-11-04 00:09:55,True,True
2018-11-04T00:11:10,Did anyone else notice the guy from Hannah Montana plays in this?,0,0,Tori's ASMR Tingles,5cJ7MT1RTqs,0.0,2018-11-04 00:11:10,True,True
2018-11-04T00:13:38,oh god their smiles are the best thing ever,0,0,Neha Narayan,5cJ7MT1RTqs,1.0,2018-11-04 00:13:38,True,True
2018-11-04T00:14:54,oh i cant wait its gonna be so good,0,0,vanessa grace,5cJ7MT1RTqs,0.7,2018-11-04 00:14:54,True,True
2018-11-04T00:17:08,This movie will be the best and it will make me cry  I have a feeling can’t wait till march,0,0,Sophia Sundin,5cJ7MT1RTqs,1.0,2018-11-04 00:17:08,True,True
2018-11-04T00:18:18,two bros chillin in a hot tub 5 feet apart because they're not gay,0,0,Regina George,5cJ7MT1RTqs,0.02083333333333333,2018-11-04 00:18:18,True,True
2018-11-04T00:23:18,So The Fault in Our Stars 2.0 Reborn?,0,0,JustJ,5cJ7MT1RTqs,0.0,2018-11-04 00:23:18,True,True
2018-11-04T00:24:01,Two bros chilling in a hot tub,0,0,Paddy Jayy,5cJ7MT1RTqs,-0.125,2018-11-04 00:24:01,True,True
2018-11-04T00:29:43,i can’t be the only person that read the title and thought ‘cause they’re not gay’,0,0,a n n a,5cJ7MT1RTqs,-0.10416666666666667,2018-11-04 00:29:43,True,True
2018-11-04T00:30:08,It looks soooo gooooodddd but soooo saddddd at the same time it’s great,0,0,Alex,5cJ7MT1RTqs,0.4,2018-11-04 00:30:08,True,True
2018-11-04T00:30:24,Ok I’m so watching this movie,0,0,Jocelyn Houwman,5cJ7MT1RTqs,0.5,2018-11-04 00:30:24,True,True
2018-11-04T00:33:05,"I know it's just nature and all, but it's still kind of weird to see how grown up Cole (and by extension, Dylan) has become. I'm interested in this movie mostly because it's not every day there's one that deals with Cystic Fibrosis, so I'm curious to see how this one turns out.",0,0,harasnicole,5cJ7MT1RTqs,0.15,2018-11-04 00:33:05,True,True
2018-11-04T00:33:58,This gives the fault in our stars feels .. I watch that movie while on my period .. gets the good cry going .. just need ice cream and chocolate and it’s the best cry ever .. just saying .,718,18,Valencia's Life,5cJ7MT1RTqs,0.85,2018-11-04 00:33:58,True,True
2018-11-04T00:34:30,"Oh cool, I love the fault in our stars,",0,0,Julius Grut,5cJ7MT1RTqs,0.425,2018-11-04 00:34:30,True,True
2018-11-04T00:35:55,It's like that Fault in our Ebola SNL skit,0,0,Clare,5cJ7MT1RTqs,0.0,2018-11-04 00:35:55,True,True
2018-11-04T00:39:27,i love the fault in our stars so i’ll obviously love this,7,0,naudia larsen,5cJ7MT1RTqs,0.5,2018-11-04 00:39:27,True,True
2018-11-04T00:47:27,I can’t believe this. It has my disease my celebrity crush (cole) and I just can’t wait to see it!!😭💞,59,9,JJ Vids,5cJ7MT1RTqs,0.0,2018-11-04 00:47:27,True,True
2018-11-04T00:49:36,"I cried watching the trailer , I just get so emotional 😭",0,0,Annie Delgado,5cJ7MT1RTqs,0.0,2018-11-04 00:49:36,True,True
2018-11-04T00:52:29,I cant stop rewatching this trailer,0,0,Drishya Regmi,5cJ7MT1RTqs,0.0,2018-11-04 00:52:29,True,True
2018-11-04T00:54:12,Hi *JUGHEAD* (Cole) you looking good,0,0,La Chula T.R,5cJ7MT1RTqs,0.7,2018-11-04 00:54:12,True,True
2018-11-04T00:55:19,so excited to see this!,0,0,Kaylee Danielle,5cJ7MT1RTqs,0.46875,2018-11-04 00:55:19,True,True
2018-11-04T00:57:29,Fault in our stars with cystic fibrosis instead of cancer 🙃,0,0,Makyia Johnson,5cJ7MT1RTqs,0.0,2018-11-04 00:57:29,True,True
2018-11-04T00:59:33,This is offensive. This is illness appropriation. This is not ok.,0,0,GrapeDrank25,5cJ7MT1RTqs,-0.25,2018-11-04 00:59:33,True,True
2018-11-04T01:02:36,"Oh god is this another movie like ,fault in our stars? I should make one of these and get crazy paid id throw in every cliche in the book hell i might even shoot old yeller and bamby at the end at the very least they should have got a hotter girl to carry the film. https://www.youtube.com/watch?v=cvgHjgNjfAg&t=553s",0,0,zerocool1ist,5cJ7MT1RTqs,-0.2966666666666667,2018-11-04 01:02:36,True,True
2018-11-04T01:03:21,reminds me of Red Band Society,0,0,Heaven Robinson,5cJ7MT1RTqs,0.0,2018-11-04 01:03:21,True,True
2018-11-04T01:05:52,she dated zack on suite life on deck and now shes with cody lmao,0,0,Lauren Asda,5cJ7MT1RTqs,0.6,2018-11-04 01:05:52,True,True
2018-11-04T01:07:00,This looks like a Suite love story.,0,0,Angel of Sarcasm,5cJ7MT1RTqs,0.5,2018-11-04 01:07:00,True,True
2018-11-04T01:10:25,Cole Sprouse 😍😍😘😘,0,0,Bruh,5cJ7MT1RTqs,0.0,2018-11-04 01:10:25,True,True
2018-11-04T01:12:16,CANT WAIT UNTIL MARCH,0,0,C,5cJ7MT1RTqs,0.0,2018-11-04 01:12:16,True,True
2018-11-04T01:14:08,*Omg I love this song. Bc it’s by Martin garrix lol.*,0,0,Tendies,5cJ7MT1RTqs,0.65,2018-11-04 01:14:08,True,True
2018-11-04T01:17:28,Two Bois chillin in a hot tub,0,0,Ashley Yang,5cJ7MT1RTqs,0.25,2018-11-04 01:17:28,True,True
2018-11-04T01:20:47,wait a second — was that rico from hannah montana ????,0,0,Mikalah Lee,5cJ7MT1RTqs,0.0,2018-11-04 01:20:47,True,True
2018-11-04T01:26:24,"Ahhh, ma Homeboy Jughead Jones! This does look pretty good, I must say...",0,0,Lem-1 with an E,5cJ7MT1RTqs,0.475,2018-11-04 01:26:24,True,True
2018-11-04T01:27:04,The actress looks identical to zoey deutch wow... plus cole and zoey acted together on the suite life on deck,0,0,golden bean,5cJ7MT1RTqs,0.1,2018-11-04 01:27:04,True,True
2018-11-04T01:31:43,*COLE SPROUSE!!!!!!!!!!*,0,0,just girly tingz,5cJ7MT1RTqs,0.0,2018-11-04 01:31:43,True,True
2018-11-04T01:35:51,"2 dudes, chillin in a hot tub, five feet apart cuz they’re not gay",0,0,Spartacus Smith,5cJ7MT1RTqs,0.02083333333333333,2018-11-04 01:35:51,True,True
2018-11-04T01:43:22,"I love it because i had daughter that has CF. She inspires me not to quit, i love my daughter and i will ask her to see it together 😃😀",0,0,Eduardo Martinez,5cJ7MT1RTqs,0.5,2018-11-04 01:43:22,True,True
2018-11-04T01:43:29,Ok good trailer but who else is mad because they like jughead and Betty better,0,0,Kalli Emerson,5cJ7MT1RTqs,0.26875,2018-11-04 01:43:29,True,True
2018-11-04T01:43:33,"""Fight for every inch"" Nice slogan",0,0,Tyler,5cJ7MT1RTqs,0.6,2018-11-04 01:43:33,True,True
2018-11-04T01:45:04,why they keep changing it is it 6 ft or 5 cuz they say both.,0,0,Caryn Kirk-Berry,5cJ7MT1RTqs,0.0,2018-11-04 01:45:04,True,True
2018-11-04T01:46:12,"The trailer of the movie played as an ad right before I watched it, so I ended up watching it twice, lol 😂. (Don't know why I needed to comment about that😑😂)",0,0,Sasha Keshari,5cJ7MT1RTqs,0.5428571428571429,2018-11-04 01:46:12,True,True
2018-11-04T01:47:22,"This is almost exactly like everything ,everything smh",0,0,Juicebox lol 79,5cJ7MT1RTqs,0.25,2018-11-04 01:47:22,True,True
2018-11-04T01:49:58,RICO!,0,0,Homer Simpson,5cJ7MT1RTqs,0.0,2018-11-04 01:49:58,True,True
2018-11-04T01:52:18,Fault in our stars much,0,0,Lola Hansen,5cJ7MT1RTqs,0.2,2018-11-04 01:52:18,True,True
2018-11-04T01:56:29,"This ( somehow) reminds me of fault in my stars,",1,0,Harley Pennington,5cJ7MT1RTqs,0.0,2018-11-04 01:56:29,True,True
2018-11-04T01:56:37,Yes a movie about cf,0,0,lil’ Ava,5cJ7MT1RTqs,0.0,2018-11-04 01:56:37,True,True
2018-11-04T01:56:38,"Was skeptical at first but uhh lowkey super excited now to see a love movie about my illness, kinda dope",1,1,Lillian Rose,5cJ7MT1RTqs,0.19166666666666665,2018-11-04 01:56:38,True,True
2018-11-04T02:00:23,Cuz they not gay,0,0,Jellied Banana,5cJ7MT1RTqs,-0.20833333333333334,2018-11-04 02:00:23,True,True
2018-11-04T02:00:37,I really like this trailer,1,0,WHY YouTube,5cJ7MT1RTqs,0.2,2018-11-04 02:00:37,True,True
2018-11-04T02:01:08,Cannot wait to see this ☺,0,0,StuckInADayDream0918,5cJ7MT1RTqs,0.0,2018-11-04 02:01:08,True,True
2018-11-04T02:03:28,I just found out Cole and Dylan Sprouse are my 4th cousins. Must be why Suite Life of Zach and Cody was my favorite show growing up lol,0,0,Lily,5cJ7MT1RTqs,0.65,2018-11-04 02:03:28,True,True
2018-11-04T02:06:12,Please tell me that cole is still with lily,1,0,Gaby Montoya,5cJ7MT1RTqs,0.0,2018-11-04 02:06:12,True,True
2018-11-04T02:08:17,Haley just look a like emilia clarke here😭,0,0,Flan,5cJ7MT1RTqs,0.0,2018-11-04 02:08:17,True,True
2018-11-04T02:12:35,5 feet apart cuz they’re not gay (rip vine)    Edit: I made this before I read the comments so I’m sorry for being unoriginal,1,0,Calista S,5cJ7MT1RTqs,-0.3027777777777778,2018-11-04 02:12:35,True,True
2018-11-04T02:19:10,"OMG< im so excited to see this. Mostly because of Cole...who am I kidding,  im only seeing this because of cole Haha. Thumbs up if you agree.",2,0,Charlotte Orchid,5cJ7MT1RTqs,0.26875,2018-11-04 02:19:10,True,True
2018-11-04T02:19:32,oooooooooooh im so excited,0,0,Hannah Golden,5cJ7MT1RTqs,0.375,2018-11-04 02:19:32,True,True
2018-11-04T02:27:23,"Sorry, but I’m always gonna ship Bughead",0,0,Peanut Butter,5cJ7MT1RTqs,-0.5,2018-11-04 02:27:23,True,True
2018-11-04T02:27:34,"I’m so excited, I want it to come out already!",1,0,coco,5cJ7MT1RTqs,0.46875,2018-11-04 02:27:34,True,True
2018-11-04T02:27:54,YESYESYESYESYESYESYESYES,0,0,Kian Owensby,5cJ7MT1RTqs,0.0,2018-11-04 02:27:54,True,True
2018-11-04T02:29:13,I rlly hope they don’t die in the end like midnight sun 😭😭,1,0,coco,5cJ7MT1RTqs,0.0,2018-11-04 02:29:13,True,True
2018-11-04T02:31:08,Bro just imagine at the end they kiss and then they die oh no😭,1,0,Dudy Martinez,5cJ7MT1RTqs,0.0,2018-11-04 02:31:08,True,True
2018-11-04T02:35:33,Holy TFIOS!,1,0,Nikki,5cJ7MT1RTqs,0.0,2018-11-04 02:35:33,True,True
2018-11-04T02:37:07,"The Fault In Our Everything, Everything Apart",0,0,"witch, please",5cJ7MT1RTqs,0.0,2018-11-04 02:37:07,True,True
2018-11-04T02:44:58,"This is cute and all, but when are y’all bringing back Red Band Society?",1,0,d. g,5cJ7MT1RTqs,0.16666666666666666,2018-11-04 02:44:58,True,True
2018-11-04T02:48:57,Who came here because of the iconic vine?,0,0,Brooklyn Williams,5cJ7MT1RTqs,0.5,2018-11-04 02:48:57,True,True
2018-11-04T02:55:33,what's the song at the very beginning,0,0,Italia Kropp,5cJ7MT1RTqs,0.2,2018-11-04 02:55:33,True,True
2018-11-04T02:56:49,What would make this better for me no offense but if Lili rienhart played the girl...,0,0,Randomly Knowledgeable,5cJ7MT1RTqs,0.5,2018-11-04 02:56:49,True,True
2018-11-04T03:00:45,Wow. Can't believe this is the the same Cody from Zach and Cody,0,0,Cherisse Tillman,5cJ7MT1RTqs,0.05,2018-11-04 03:00:45,True,True
2018-11-04T03:01:05,....cuz they are not gay...,0,0,Eduardo,5cJ7MT1RTqs,-0.20833333333333334,2018-11-04 03:01:05,True,True
2018-11-04T03:01:09,The Hospital Suite Life of Zac... or Cody,0,0,Rio Candra,5cJ7MT1RTqs,0.0,2018-11-04 03:01:09,True,True
2018-11-04T03:06:36,"My girlfriend always forces me to watch these things with her, and I always cry. Bracing myself, though it looks amazing!",0,0,Gregarious Gonzalez,5cJ7MT1RTqs,0.7500000000000001,2018-11-04 03:06:36,True,True
2018-11-04T03:07:11,What is the song called in this trailer plz respond if u know,0,0,Gïśśëłė Ärvïźò,5cJ7MT1RTqs,0.0,2018-11-04 03:07:11,True,True
2018-11-04T03:07:28,I can’t wait am dyinggg it’s soo goood 🔥❤️🔥🔥🔥🔥🔥🔥🔥🔥🔥❤️❤️❤️❤️❤️❤️❤️❤️❤️❤️😭😭🔥🔥🔥🔥🔥🔥🔥💯💯💯💯💯💯💯💯💯🔥❤️❤️❤️❤️❤️❤️❤️❤️❤️😭❤️❤️💯💯💯💯💯💯💯💯💯💯💯💯💯💯💯💯💯💯💯💯💯💯💯💯💯💯💯💯💯💯💯💯💯💯💯💯💯💯💯💯💯💯💯💯💯❤️❤️❤️❤️❤️❤️❤️🔥🔥🔥🔥🔥🔥🔥🔥🔥🔥🔥🔥🔥🔥🔥🔥❤️can’t wait yah,0,0,Cl Osman,5cJ7MT1RTqs,0.0,2018-11-04 03:07:28,True,True
2018-11-04T03:09:40,I love Cole Sprouse💞😢,2,0,Biah Grazer,5cJ7MT1RTqs,0.5,2018-11-04 03:09:40,True,True
2018-11-04T03:15:02,"I’m a simple person, I see cole, I click.",0,0,Hey It's me,5cJ7MT1RTqs,0.0,2018-11-04 03:15:02,True,True
2018-11-04T03:16:42,I WANT TO WATCH THIS MOVIE SO MUCH OMG,0,0,IrisBeauty,5cJ7MT1RTqs,0.2,2018-11-04 03:16:42,True,True
2018-11-04T03:16:59,2:08 so perfect😍😍,0,0,Feliz Piñon,5cJ7MT1RTqs,0.0,2018-11-04 03:16:59,True,True
2018-11-04T03:19:26,for Claire 💕,0,0,Amy D,5cJ7MT1RTqs,0.0,2018-11-04 03:19:26,True,True
2018-11-04T03:20:42,"oh my god it’s COLE MICHELE SPROUSE ( jughead  , Cody",1,0,LP SDOOW,5cJ7MT1RTqs,0.0,2018-11-04 03:20:42,True,True
2018-11-04T03:20:57,i dont trust the ending... look what happened in the fault in our stars 💔,0,0,Kaysthetics,5cJ7MT1RTqs,0.0,2018-11-04 03:20:57,True,True
2018-11-04T03:24:25,I wanna seen this and Cole Sprouse is kinda cute like if u agree even the slightest!,0,0,Bri_ana_ Holbrook,5cJ7MT1RTqs,0.625,2018-11-04 03:24:25,True,True
2018-11-04T03:25:34,This looks like the cutest movie ever,0,0,Spencer Ross Cozzens,5cJ7MT1RTqs,0.0,2018-11-04 03:25:34,True,True
2018-11-04T03:29:29,This is like the best movie ever I really wanna watch it,1,0,Sophie's Life,5cJ7MT1RTqs,0.6,2018-11-04 03:29:29,True,True
2018-11-04T03:36:03,-cause they’re not gay.”,0,0,Just Trash,5cJ7MT1RTqs,-0.20833333333333334,2018-11-04 03:36:03,True,True
2018-11-04T03:37:49,the fact that rico is here too ;-;,0,0,Coily Blckgrl,5cJ7MT1RTqs,0.0,2018-11-04 03:37:49,True,True
2018-11-04T03:38:07,Is CF a real disease/virus?,0,1,Christina’s Nation,5cJ7MT1RTqs,0.2,2018-11-04 03:38:07,True,True
2018-11-04T03:38:30,I WANNA WATCH THIS MOVIE RNNN,0,0,G. G,5cJ7MT1RTqs,0.0,2018-11-04 03:38:30,True,True
2018-11-04T03:39:52,What is that song called?,0,1,Tailor Heath,5cJ7MT1RTqs,0.0,2018-11-04 03:39:52,True,True
2018-11-04T03:47:17,ooh im getting ready to gross sob who’s with me?,0,1,sleepybxngtan,5cJ7MT1RTqs,0.1,2018-11-04 03:47:17,True,True
2018-11-04T03:48:36,Five seconds away from crying ❤😭,0,0,워쉬매디슨 바람,5cJ7MT1RTqs,-0.2,2018-11-04 03:48:36,True,True
2018-11-04T03:51:40,Five feet apart cuz they’re not gay,0,0,Sushmita,5cJ7MT1RTqs,-0.20833333333333334,2018-11-04 03:51:40,True,True
2018-11-04T03:52:03,I just want to watch the movie ❤❤❤❤❤😢😢😢😢😢😭,0,0,Queen Ruthie,5cJ7MT1RTqs,0.0,2018-11-04 03:52:03,True,True
2018-11-04T03:52:31,-Cuz there not gay,0,0,ZeoBlazin,5cJ7MT1RTqs,-0.20833333333333334,2018-11-04 03:52:31,True,True
2018-11-04T03:56:05,1:18 is that.... is that RICO??!!?? he looks normal!,0,0,froyo —,5cJ7MT1RTqs,0.1875,2018-11-04 03:56:05,True,True
2018-11-04T03:58:24,I CANT STOP WATCHING,0,0,Queen Ruthie,5cJ7MT1RTqs,0.0,2018-11-04 03:58:24,True,True
2018-11-04T03:58:29,im in tears literally,0,0,Kyleigh Gartin,5cJ7MT1RTqs,0.0,2018-11-04 03:58:29,True,True
2018-11-04T03:58:30,Two bros chillin’ in a hot tub FIVE FEET APART cuz they’re not gay!!,45,1,Apa Bee,5cJ7MT1RTqs,-0.037760416666666685,2018-11-04 03:58:30,True,True
2018-11-04T04:05:10,I’m not crying your crying,0,0,Samantha Lamb,5cJ7MT1RTqs,-0.05,2018-11-04 04:05:10,True,True
2018-11-04T04:06:16,I can't wait,0,0,SHANNON LABANS,5cJ7MT1RTqs,0.0,2018-11-04 04:06:16,True,True
2018-11-04T04:08:42,2:15 🤤🤤,0,0,southbabyy /,5cJ7MT1RTqs,0.0,2018-11-04 04:08:42,True,True
2018-11-04T04:22:27,"No no no no, its jughead Jones and betty cooper.. That's it",0,0,taehyung's crusty bread,5cJ7MT1RTqs,0.0,2018-11-04 04:22:27,True,True
2018-11-04T04:25:09,Cole is so hot,0,0,Saturan Rose,5cJ7MT1RTqs,0.25,2018-11-04 04:25:09,True,True
2018-11-04T04:25:29,Did i see rico 😮,0,0,Lord Touchmeee,5cJ7MT1RTqs,0.0,2018-11-04 04:25:29,True,True
2018-11-04T04:26:23,Another The fault in our stars,0,0,Ali,5cJ7MT1RTqs,0.0,2018-11-04 04:26:23,True,True
2018-11-04T04:27:57,Sprousehart fans aren't happy lol,1,0,Sacha Layt,5cJ7MT1RTqs,0.8,2018-11-04 04:27:57,True,True
2018-11-04T04:29:42,Haley: do you think that's cute Cole: do you think that's cute Me: I think your cute,1,0,Sacha Layt,5cJ7MT1RTqs,0.5,2018-11-04 04:29:42,True,True
2018-11-04T04:31:59,The main reason I'm here is because of Riverdale and Cole Sprouse ❤❤😚,0,0,Ana Sanchez,5cJ7MT1RTqs,0.16666666666666666,2018-11-04 04:31:59,True,True
2018-11-04T04:34:02,Im going to watch this because my famous crush is in this!!,0,0,MauiFriends 8and9,5cJ7MT1RTqs,0.78125,2018-11-04 04:34:02,True,True
2018-11-04T04:34:23,Five feet apart cuz they're not gay,0,0,Renée Tyler,5cJ7MT1RTqs,-0.20833333333333334,2018-11-04 04:34:23,True,True
2018-11-04T04:36:55,I DONT WANT TO WAIT 5/6 MONTHS FOR THIS I WANT IT NOWW,1,0,a.br33.y,5cJ7MT1RTqs,0.0,2018-11-04 04:36:55,True,True
2018-11-04T04:41:41,WAIT THATS RICO FROM HANNA MONTANA,0,0,Kennedie Joyce,5cJ7MT1RTqs,0.0,2018-11-04 04:41:41,True,True
2018-11-04T04:42:15,Two bros Chillin in a hot tub Five feet apart *Because they both have CF!*,0,0,Nicole,5cJ7MT1RTqs,0.3125,2018-11-04 04:42:15,True,True
2018-11-04T04:45:08,RICO MY LOVE WHAT YOU DOING HERE AHHH,1,0,Zalken,5cJ7MT1RTqs,0.5,2018-11-04 04:45:08,True,True
2018-11-04T04:46:16,Aw I love this,0,0,Lana Fan Forever,5cJ7MT1RTqs,0.5,2018-11-04 04:46:16,True,True
2018-11-04T04:49:54,"This is my 10th time watching this trailer , anyone with me ?",0,0,Fs Sha,5cJ7MT1RTqs,0.0,2018-11-04 04:49:54,True,True
2018-11-04T04:51:06,These roles fit him a 100% more than 'badass Jughead',0,0,Zeuses Coven,5cJ7MT1RTqs,0.45,2018-11-04 04:51:06,True,True
2018-11-04T04:52:26,This music is EVERYTHING,0,0,Jessica Coleman,5cJ7MT1RTqs,0.0,2018-11-04 04:52:26,True,True
2018-11-04T04:54:24,Thank god they're both attractive,1,0,Bubbleshful,5cJ7MT1RTqs,0.8,2018-11-04 04:54:24,True,True
2018-11-04T04:54:48,the fault in our stars 2,0,0,TheKingOfDale,5cJ7MT1RTqs,0.0,2018-11-04 04:54:48,True,True
2018-11-04T05:01:20,There not gay,0,0,Eeee E,5cJ7MT1RTqs,-0.20833333333333334,2018-11-04 05:01:20,True,True
2018-11-04T05:02:35,This looks so good.👌👌👌👌,0,0,Random Rose,5cJ7MT1RTqs,0.0,2018-11-04 05:02:35,True,True
2018-11-04T05:02:54,Haley Lu Richardson = Underrated actress,0,0,DanielEhrenreich,5cJ7MT1RTqs,0.0,2018-11-04 05:02:54,True,True
2018-11-04T05:07:14,IM SO EXCITED!!,0,0,Litia Vocals,5cJ7MT1RTqs,0.5859375,2018-11-04 05:07:14,True,True
2018-11-04T05:09:20,The Fault In Our Stars wannabe.,0,0,Diane Green,5cJ7MT1RTqs,0.0,2018-11-04 05:09:20,True,True
2018-11-04T05:11:19,What was the song called?,0,0,Princessgoodfaith,5cJ7MT1RTqs,0.0,2018-11-04 05:11:19,True,True
2018-11-04T05:12:26,I love Cole. XD,0,0,WhiskersNPaws,5cJ7MT1RTqs,0.5,2018-11-04 05:12:26,True,True
2018-11-04T05:12:28,*5 feet apart next to your homie it ain't gay*,0,0,炎Kuraiji,5cJ7MT1RTqs,0.20833333333333334,2018-11-04 05:12:28,True,True
2018-11-04T05:16:52,"Cole, in a movie?! I'm so stoked for this! And I can't get over how voice and how much he's grown over the years. I've seen some interviews with him since Riverdale started, so I've had bits and pieces of him now, but not acting, like this.  I want so badly to dive in and get as much Jughead!Cole as possible, but I really doubt I could do it. I love Cole, Jughead (even though he seems nothing like his comic self), and angsty broody little shits that morph into fluffballs once they've found people that love them and accepted have personally that love (which Riverdale!Jughead seems to be), but I honestly don't think I can handle sitting through the drama of Riverdale (no hate on Riverdale, I just can't handle dramas, much less melodramas, and we all know it's going to be chock full of crazy BS and misunderstandings, which I hate, plus a love triangle until Bughead happens, which I also hate) just to see those things. I doubt I'd stick aorund long enoufh to get into Jughead's character, or even see him happy as one half of Bughead and secure in his friendships. I'll probably settle for watching clips soon, since if I ever do watch the show, it'll be a while before I get around to it. Anyway, seeing Cole acting like this make me really excited, and I can't wait for it to come out. The movie seems pretty interesting and genuinely good, and Haley Lu seems really cool and awesome and I like her so far. I'm sure I'll cry during the movie, but the romance seem so good that I'll probably be willing to suffer for it anyway.   Stoked to see it!",0,0,Epic Otaku Cherry,5cJ7MT1RTqs,0.19190476190476188,2018-11-04 05:16:52,True,True
2018-11-04T05:20:22,“I don’t know what I would without you” *”you’d die”*,0,0,Elma S,5cJ7MT1RTqs,0.0,2018-11-04 05:20:22,True,True
2018-11-04T05:25:24,Five feet apart cause they’re not Gay 😂..sorry....,0,0,Blinking Twice,5cJ7MT1RTqs,-0.20833333333333334,2018-11-04 05:25:24,True,True
2018-11-04T05:31:20,Am I the only one that’s getting Everything Everything vibes? (The book/movie),0,0,Manat Hussein,5cJ7MT1RTqs,0.0,2018-11-04 05:31:20,True,True
2018-11-04T05:31:45,Haha I’m here because I had a crush on Cody back in the day....fine I still have a crush on him. Shut up,0,0,Jewels T,5cJ7MT1RTqs,0.1,2018-11-04 05:31:45,True,True
2018-11-04T05:51:52,Ok now I’m going to watch this again but 500000 times,0,0,Pugirl Ramirez,5cJ7MT1RTqs,0.5,2018-11-04 05:51:52,True,True
2018-11-04T06:07:32,omg cole.,0,0,Larriza Grace,5cJ7MT1RTqs,0.0,2018-11-04 06:07:32,True,True
2018-11-04T06:16:03,I’ve watched this trailer like a dozen times and I’m still super hyped for it.,0,0,joseph ndabu,5cJ7MT1RTqs,0.3333333333333333,2018-11-04 06:16:03,True,True
2018-11-04T06:16:12,Why do they both look so good looking,0,0,Anchika Myrtil,5cJ7MT1RTqs,0.7,2018-11-04 06:16:12,True,True
2018-11-04T06:18:13,what’s the background musiccc ????,0,0,Angel Villanueva,5cJ7MT1RTqs,0.0,2018-11-04 06:18:13,True,True
2018-11-04T06:19:41,Ricooooo,0,0,Pearl Trident,5cJ7MT1RTqs,0.0,2018-11-04 06:19:41,True,True
2018-11-04T06:25:04,"Someone Shazaam the song, much love",0,0,Chunkyy Twinkie,5cJ7MT1RTqs,0.5,2018-11-04 06:25:04,True,True
2018-11-04T06:37:52,I wish they didnt turn Claire's life into a love story,0,0,Brianna Helm,5cJ7MT1RTqs,0.5,2018-11-04 06:37:52,True,True
2018-11-04T06:40:37,I dont know if i can watch this 🙈 it reminds me of „the fault in our stars“ and that movie killed me 🙈😭,7,0,Lola Milano,5cJ7MT1RTqs,-0.2,2018-11-04 06:40:37,True,True
2018-11-04T06:43:24,What is the name of this sonnggg ... Some one please tell me .. please..,0,0,Mukhlisa Atakhodjaeva,5cJ7MT1RTqs,0.0,2018-11-04 06:43:24,True,True
2018-11-04T06:45:52,"i just watched the entire movie in the trailer. this is like TFIOS 2.0 and 15% everything, everything",0,0,Samiha Rahman,5cJ7MT1RTqs,0.0,2018-11-04 06:45:52,True,True
2018-11-04T06:47:35,I wonder how lili is reacting to this🤔🤔🤔,0,0,Eri Chan,5cJ7MT1RTqs,0.0,2018-11-04 06:47:35,True,True
2018-11-04T06:47:44,"Not usually one for romance movies, but it looks cute.",0,1,Kaitlin O'Malley,5cJ7MT1RTqs,0.3125,2018-11-04 06:47:44,True,True
2018-11-04T06:50:33,Am i the only one who thinks this is similar to Zac and Mia,0,0,Laura & Andrea,5cJ7MT1RTqs,0.0,2018-11-04 06:50:33,True,True
2018-11-04T06:57:28,"thank u for showing me the entire movie, in 2 minutes 🙂",0,0,Debbie Bezalel,5cJ7MT1RTqs,0.0,2018-11-04 06:57:28,True,True
2018-11-04T07:11:08,"What is this, the 587th movie with the same premise? Sick person, can't go out, falls in love with someone they can't get near, Do it anyways. Yea, I think so",0,0,Scott Swanson,5cJ7MT1RTqs,-0.028571428571428574,2018-11-04 07:11:08,True,True
2018-11-04T07:14:33,"2 bros chillin in a hot tub, five feet apart cause theyre not gay",0,0,okurr,5cJ7MT1RTqs,0.02083333333333333,2018-11-04 07:14:33,True,True
2018-11-04T07:16:50,This movie is soooo relatable to A Fault in Our Stars....,0,0,Kate Redfox,5cJ7MT1RTqs,0.0,2018-11-04 07:16:50,True,True
2018-11-04T07:19:36,Zack and cody days. I am now 19 years old. God damn time flies.,0,0,DarkFlameMaster,5cJ7MT1RTqs,0.1,2018-11-04 07:19:36,True,True
