timestamp,text,like_count,reply_count,author,trailer_id,sentiment_score,datetime,used_for_model,used_for_visualization
2016-06-03T00:58:23,STREAM NOW...!!!!      Teenage Mutant Ninja Turtles: Out of the Shadows 2016  #Quality Check-Now :            https://plus.google.com/+EllieSeager/posts/bTUUahA2pzx  :),2,0,Chris Asley,5Sf0ZQfcSrc,0.25,2016-06-03 00:58:23,False,True
2016-06-07T08:18:29,rocksteady had his tail out of his butt,0,0,bluecreeperboy 4,5Sf0ZQfcSrc,0.0,2016-06-07 08:18:29,False,True
2016-06-07T14:13:27,OMG the part where Mikey screams in fear of Krangs eyeball. Lol loved it.,0,0,Austin-Tyler,5Sf0ZQfcSrc,0.75,2016-06-07 14:13:27,False,True
2016-06-09T14:16:02,"Well, I guess it still beats the new ghostbusters.",0,0,Chance Ishikawa,5Sf0ZQfcSrc,0.13636363636363635,2016-06-09 14:16:02,False,True
2016-06-11T03:12:11,Mikey is the greatest!,0,0,Lane Mosser,5Sf0ZQfcSrc,1.0,2016-06-11 03:12:11,False,True
2016-06-15T01:51:16,done watch the movie in 3d,0,0,Mitchell Braden,5Sf0ZQfcSrc,0.0,2016-06-15 01:51:16,False,True
2016-06-16T22:22:29,I can't find the basketball scene... The one with deandre Jordan any help?,0,0,Zach Boersma,5Sf0ZQfcSrc,0.0,2016-06-16 22:22:29,False,True
2016-06-23T00:44:51,1:08 AYY its RoadHog,0,0,Tv Master,5Sf0ZQfcSrc,0.0,2016-06-23 00:44:51,False,True
2016-06-23T16:45:40,Leo acts like such a jerk in this one,0,1,emi,5Sf0ZQfcSrc,0.0,2016-06-23 16:45:40,False,True
2016-06-26T14:43:24,yes ♡,0,0,Angel Leitch,5Sf0ZQfcSrc,0.0,2016-06-26 14:43:24,False,True
2016-06-26T14:46:19,yes I'm going back from dropping crystaldisplay,0,0,Angel Leitch,5Sf0ZQfcSrc,0.0,2016-06-26 14:46:19,False,True
2016-06-29T06:00:47,Just speechless.....,0,0,AR's Channel,5Sf0ZQfcSrc,0.0,2016-06-29 06:00:47,False,True
2016-07-04T16:51:57,it show at the thater,0,0,superpandagirlgamer Mateo,5Sf0ZQfcSrc,0.0,2016-07-04 16:51:57,False,True
2016-07-22T21:07:04,name of the song ?,0,0,itay mizikov,5Sf0ZQfcSrc,0.0,2016-07-22 21:07:04,False,True
2016-09-01T22:13:47,Why there is no good video qualiti for tmnt ? they release it June 3 -.-,0,0,Stefan Marinac,5Sf0ZQfcSrc,-0.35,2016-09-01 22:13:47,False,False
2016-09-05T01:50:29,"I'm so hyped, wait this is four months ago what have I been missing",0,0,A Bag of Kale Chips,5Sf0ZQfcSrc,-0.2,2016-09-05 01:50:29,False,False
2016-09-12T18:37:34,Too bad this didn't come out 25 years ago.,0,0,Cranky Carrot,5Sf0ZQfcSrc,-0.6999999999999998,2016-09-12 18:37:34,False,False
2016-10-02T04:25:37,I Own The 3 Wheel Autocycle Its a Polaris slingshot,1,0,Tuffy Fluffy Fox! Wei Shen,5Sf0ZQfcSrc,0.6,2016-10-02 04:25:37,False,False
2017-12-15T19:00:44,Ya quiero la 3!!!☹️,0,0,Ivana,5Sf0ZQfcSrc,0.0,2017-12-15 19:00:44,False,False
