timestamp,text,like_count,reply_count,author,trailer_id,sentiment_score,datetime,used_for_model,used_for_visualization
2016-05-03T16:12:04,FIRST COMMENT,0,2,Dan Groves,5Sf0ZQfcSrc,0.25,2016-05-03 16:12:04,True,True
2016-05-03T16:12:19,hi,0,0,Max,5Sf0ZQfcSrc,0.0,2016-05-03 16:12:19,True,True
2016-05-03T16:12:30,This looks shit,0,0,Areeb Mansoor,5Sf0ZQfcSrc,-0.2,2016-05-03 16:12:30,True,True
2016-05-03T16:12:34,Second comment,0,0,Sa'ad Dangor,5Sf0ZQfcSrc,0.0,2016-05-03 16:12:34,True,True
2016-05-03T16:13:00,4th comment,0,0,Lakdilu Kulasinghe,5Sf0ZQfcSrc,0.0,2016-05-03 16:13:00,True,True
2016-05-03T16:13:06,still looks better than cod infinite warfare,1,3,The Sims,5Sf0ZQfcSrc,0.5,2016-05-03 16:13:06,True,True
2016-05-03T16:13:22,sub my channel,0,3,Rishab US,5Sf0ZQfcSrc,0.0,2016-05-03 16:13:22,True,True
2016-05-03T16:14:47,can't wait.The first one was awesomeee,20,6,Shahroz Rashid,5Sf0ZQfcSrc,0.25,2016-05-03 16:14:47,True,True
2016-05-03T16:14:55,I want pictures of Stephen Amell!,0,0,Dan,5Sf0ZQfcSrc,0.0,2016-05-03 16:14:55,True,True
2016-05-03T16:16:15,ว้าววววววว,0,0,ART,5Sf0ZQfcSrc,0.0,2016-05-03 16:16:15,True,True
2016-05-03T16:17:14,"Yeah yeah, just make the sextape already.",12,0,This Is Google,5Sf0ZQfcSrc,0.0,2016-05-03 16:17:14,True,True
2016-05-03T16:17:23,hopefully theres another beatbox scene haha,17,0,Additional Mathematics,5Sf0ZQfcSrc,0.2,2016-05-03 16:17:23,True,True
2016-05-03T16:17:28,"Props for sticking with ""No Sleep till Brooklyn"" with every trailer. Great song.  Looks better than the first one...far more fun.",55,8,Brett Van Boven,5Sf0ZQfcSrc,0.4699999999999999,2016-05-03 16:17:28,True,True
2016-05-03T16:17:41,Tomare Que Esse Filme Seja Tão Bom Quanto o Primeiro :),0,0,Player Maker,5Sf0ZQfcSrc,0.5,2016-05-03 16:17:41,True,True
2016-05-03T16:17:59,"For every 2 good trailers there needs to be that one ""nope/meh"" trailer :P",3,6,impactQuake,5Sf0ZQfcSrc,0.725,2016-05-03 16:17:59,True,True
2016-05-03T16:18:08,Tomare Que Esse Filme Seja Tão Bom Quanto o Primeiro :),0,3,Player Maker,5Sf0ZQfcSrc,0.5,2016-05-03 16:18:08,True,True
2016-05-03T16:18:13,"give me subscribe ,like that 16 people before you :D",0,0,TTom,5Sf0ZQfcSrc,1.0,2016-05-03 16:18:13,True,True
2016-05-03T16:18:25,I am so not going to watch this movie,0,0,Mohammad Ismail H Siddiquee,5Sf0ZQfcSrc,0.0,2016-05-03 16:18:25,True,True
2016-05-03T16:18:26,Who ask fo dis.,72,12,PictureFit,5Sf0ZQfcSrc,0.0,2016-05-03 16:18:26,True,True
2016-05-03T16:18:31,Looks sick,0,0,Gurkirtan Singh,5Sf0ZQfcSrc,-0.7142857142857143,2016-05-03 16:18:31,True,True
2016-05-03T16:18:43,you know this movie went on to be nominated for best oscar picture 2017 no joke im from the year 2018,0,0,Thanos The Mad Titan,5Sf0ZQfcSrc,1.0,2016-05-03 16:18:43,True,True
2016-05-03T16:18:50,meh......stupid premise ....cgi looks shit..objectified women ....feels like a michael bay movie .......oh wait....,13,6,TickleMahBallZ,5Sf0ZQfcSrc,0.0,2016-05-03 16:18:50,True,True
2016-05-03T16:19:00,Michael Bay is not gonna learn.,0,0,Estivel Garcia,5Sf0ZQfcSrc,0.0,2016-05-03 16:19:00,True,True
2016-05-03T16:19:29,"So it's not funny, doesn't look like it'll have good action, and the turtles still look terrifying. Yay",0,0,Wowsers Wowsers,5Sf0ZQfcSrc,-0.08125000000000002,2016-05-03 16:19:29,True,True
2016-05-03T16:19:47,va a estar buenisima la pelicula,0,0,Dahiana Velez Contreras,5Sf0ZQfcSrc,0.0,2016-05-03 16:19:47,True,True
2016-05-03T16:20:19,"Expected that they would pull an ""Underoos"" at the end.",0,2,Archie,5Sf0ZQfcSrc,-0.1,2016-05-03 16:20:19,True,True
2016-05-03T16:20:32,STOOPID!,0,1,Dragonfruit 7,5Sf0ZQfcSrc,0.0,2016-05-03 16:20:32,True,True
2016-05-03T16:22:07,Dear god no.,0,0,Antique Mickey,5Sf0ZQfcSrc,0.0,2016-05-03 16:22:07,True,True
2016-05-03T16:22:20,Looks better than the first... bring back Knoxville tho,13,1,The 2nd Best,5Sf0ZQfcSrc,0.25,2016-05-03 16:22:20,True,True
2016-05-03T16:22:36,Idk it kinda lack on explosions..,0,0,Maxime Trépanier,5Sf0ZQfcSrc,0.0,2016-05-03 16:22:36,True,True
2016-05-03T16:23:34,Tbh it's really good cgi!,45,0,Nikolas Lopes,5Sf0ZQfcSrc,0.875,2016-05-03 16:23:34,True,True
2016-05-03T16:24:28,Where is Krang!?,0,0,Chris the Chiss,5Sf0ZQfcSrc,0.0,2016-05-03 16:24:28,True,True
2016-05-03T16:24:39,reintroducing the turtles all over again? names and roles in the group? wasn't that established in the 1st movie?,1,2,Nick Bruns,5Sf0ZQfcSrc,0.0,2016-05-03 16:24:39,True,True
2016-05-03T16:24:51,this felt like anal penetration by Donald Trump...,0,0,Ishaan Singh,5Sf0ZQfcSrc,0.0,2016-05-03 16:24:51,True,True
2016-05-03T16:24:59,They never learn -_-,0,0,Ta Xi Quan,5Sf0ZQfcSrc,0.0,2016-05-03 16:24:59,True,True
2016-05-03T16:25:35,That's one way to rip off the Fast 7 skydiving scene....,0,1,DirtyD,5Sf0ZQfcSrc,0.2,2016-05-03 16:25:35,True,True
2016-05-03T16:26:42,Did not see the first one am not going to see this one.,0,0,Alpha Prime,5Sf0ZQfcSrc,0.25,2016-05-03 16:26:42,True,True
2016-05-03T16:27:38,The script looks as bad as the first one,0,0,Eckardt Stander,5Sf0ZQfcSrc,-0.22499999999999992,2016-05-03 16:27:38,True,True
2016-05-03T16:31:35,part two failed againe and u think they will learn ☺,0,0,deez nutz,5Sf0ZQfcSrc,-0.5,2016-05-03 16:31:35,True,True
2016-05-03T16:31:39,so. much. explosion.,0,0,Danang Yulianto,5Sf0ZQfcSrc,0.2,2016-05-03 16:31:39,True,True
2016-05-03T16:31:45,still ugly faces :D,0,0,MrCrouchi,5Sf0ZQfcSrc,0.15000000000000002,2016-05-03 16:31:45,True,True
2016-05-03T16:31:50,again *,0,0,deez nutz,5Sf0ZQfcSrc,0.0,2016-05-03 16:31:50,True,True
2016-05-03T16:32:21,"Please, go back in to the shadows!",0,0,Boi Retardus,5Sf0ZQfcSrc,0.0,2016-05-03 16:32:21,True,True
2016-05-03T16:34:28,its ethier bad or its meh     20% chance of it being good,0,0,MCZking,5Sf0ZQfcSrc,5.551115123125783e-17,2016-05-03 16:34:28,True,True
2016-05-03T16:34:44,"I don't care what everyone says, I hate Bay but this movie is pure awesomeness really looking forward for this because the first one was a masterpiece except Megan Fox she's just awful",0,1,Sam-i-AM,5Sf0ZQfcSrc,-0.22714285714285715,2016-05-03 16:34:44,True,True
2016-05-03T16:37:16,"The trailer seems good, but the music didn't really match the trailer.",0,0,Stevo,5Sf0ZQfcSrc,0.44999999999999996,2016-05-03 16:37:16,True,True
2016-05-03T16:37:17,This trailer really didn't show anything new,0,0,Jinx Productions,5Sf0ZQfcSrc,0.16818181818181818,2016-05-03 16:37:17,True,True
2016-05-03T16:37:36,So when are we going to get a 3rd official trailer for civil war?,4,8,Adrian Biggs,5Sf0ZQfcSrc,0.0,2016-05-03 16:37:36,True,True
2016-05-03T16:38:59,3rd trailer and I'm still not going to PAY to watch this,0,0,Youhei Sonhara,5Sf0ZQfcSrc,0.0,2016-05-03 16:38:59,True,True
2016-05-03T16:41:26,30,0,0,Matthew Mendonca,5Sf0ZQfcSrc,0.0,2016-05-03 16:41:26,True,True
2016-05-03T16:43:43,I think they can't be Teenager any more haha..,0,0,N X K,5Sf0ZQfcSrc,0.35,2016-05-03 16:43:43,True,True
2016-05-03T16:50:50,😎 🎶 No Sleep Till' Brooklyn🎶 😎,0,0,Javier Rises,5Sf0ZQfcSrc,0.0,2016-05-03 16:50:50,True,True
2016-05-03T16:50:53,I like the movie,0,0,Victor Vargas,5Sf0ZQfcSrc,0.0,2016-05-03 16:50:53,True,True
2016-05-03T16:51:37,The should have changed the song in the trailers. Is the same in everyone,0,0,Alfre Cossio,5Sf0ZQfcSrc,0.0,2016-05-03 16:51:37,True,True
2016-05-03T16:51:41,I really hope that krang plays a big part in this movie and that they don't just shoehorn him in at the end like the dinobots or the rhino from ASM2 just for the purpose of selling toys and showing cool trailer shots,7,1,Raveman2002,5Sf0ZQfcSrc,0.18333333333333335,2016-05-03 16:51:41,True,True
2016-05-03T16:54:01,Ffs Hollywood. stop shitting on my childhood with your shitty remakes.,3,2,Possessed Furby,5Sf0ZQfcSrc,0.0,2016-05-03 16:54:01,True,True
2016-05-03T16:57:07,does this one have fart jokes?,0,0,Dmytro Sy,5Sf0ZQfcSrc,0.0,2016-05-03 16:57:07,True,True
2016-05-03T16:58:05,Why does this movie look good? Especially the background in the plane seq uence,2,0,Dwayne Fernandes,5Sf0ZQfcSrc,0.35,2016-05-03 16:58:05,True,True
2016-05-03T16:58:20,"I really wish they didn't stupidify and sexualize the TMNT. Most of what they've done is acceptable, but there are the super-cringe scenes that make me want to edit this movie myself.",0,2,Dai 大,5Sf0ZQfcSrc,0.35,2016-05-03 16:58:20,True,True
2016-05-03T17:01:02,Looks way better then the first one.,8,0,Justin Romero,5Sf0ZQfcSrc,0.375,2016-05-03 17:01:02,True,True
2016-05-03T17:01:06,Actually Megan Fox can be a perfect villian for movies cause she has almost no motions on her face,17,6,Eric Giby,5Sf0ZQfcSrc,0.5,2016-05-03 17:01:06,True,True
2016-05-03T17:01:40,turtle > animalia except turtle,0,0,rbrgn ziggy,5Sf0ZQfcSrc,0.0,2016-05-03 17:01:40,True,True
2016-05-03T17:02:06,like a live action cartoon.  I like.,0,0,marvdatboi,5Sf0ZQfcSrc,0.11818181818181818,2016-05-03 17:02:06,True,True
2016-05-03T17:04:13,did anyone else see sheamus from wwe?,0,0,choke on rice with juice,5Sf0ZQfcSrc,0.0,2016-05-03 17:04:13,True,True
2016-05-03T17:09:17,Seems like just an Extended version of Trailer 2,1,0,Anthony Delorme,5Sf0ZQfcSrc,0.0,2016-05-03 17:09:17,True,True
2016-05-03T17:14:08,Terrible movie!,0,0,BolterRap,5Sf0ZQfcSrc,-1.0,2016-05-03 17:14:08,True,True
2016-05-03T17:16:25,Omg! This trailer suck! I'm just excited for the black nerd video!,0,0,Coms,5Sf0ZQfcSrc,0.08333333333333334,2016-05-03 17:16:25,True,True
2016-05-03T17:19:53,"man, this one looks like it's going to be so much more fun than the serious toned last one",19,1,Gaming Sanctum,5Sf0ZQfcSrc,0.11666666666666668,2016-05-03 17:19:53,True,True
2016-05-03T17:25:18,"rumours are true, megan fox gave donatatello a blow job to get this role.",0,0,nadz yea,5Sf0ZQfcSrc,0.35,2016-05-03 17:25:18,True,True
2016-05-03T17:36:41,Another movie of Bay sucking America's flagpole.,0,0,FieryEasy,5Sf0ZQfcSrc,0.0,2016-05-03 17:36:41,True,True
2016-05-03T17:37:41,"I could swear I'm watching the same trailer over and over, just different numbers",4,0,Matt Piette,5Sf0ZQfcSrc,0.0,2016-05-03 17:37:41,True,True
2016-05-03T17:42:21,"Didn't see the first one, but this one looks pretty good.",0,0,Palm Trees,5Sf0ZQfcSrc,0.39999999999999997,2016-05-03 17:42:21,True,True
2016-05-03T17:54:54,50% of the people watching the movie only because of Megan Fox xD Including me ^^,0,0,AhWeh,5Sf0ZQfcSrc,0.0,2016-05-03 17:54:54,True,True
2016-05-03T17:55:45,So yeah this is gonna be garbage,0,0,Alexandre Leclerc,5Sf0ZQfcSrc,0.0,2016-05-03 17:55:45,True,True
2016-05-03T17:58:20,"Good job Nuckelodeon, you're terrible at making shows and movies.",1,0,adoplusjr,5Sf0ZQfcSrc,-0.15000000000000002,2016-05-03 17:58:20,True,True
2016-05-03T18:02:57,I wanna see more Karai and Shredder,0,0,Treyanokouji4832,5Sf0ZQfcSrc,0.5,2016-05-03 18:02:57,True,True
2016-05-03T18:09:59,121 already hate this shit,0,0,Haaruun Abdulle,5Sf0ZQfcSrc,-0.5,2016-05-03 18:09:59,True,True
2016-05-03T18:15:22,"I haven't seen any of these,  but I do want to know,  when did they stop acting like surfer dudes and start acting like street gang members?",2,0,Juggie Bonebrain,5Sf0ZQfcSrc,0.0,2016-05-03 18:15:22,True,True
2016-05-03T18:32:23,Old ones was better,0,0,Morgdán,5Sf0ZQfcSrc,0.3,2016-05-03 18:32:23,True,True
2016-05-03T18:33:51,megan fox still isn't a good actress,0,0,Jeff Manqele,5Sf0ZQfcSrc,0.7,2016-05-03 18:33:51,True,True
2016-05-03T18:35:46,So this is what Oliver Queen did before being shipwrecked. Neat.,10,0,Alex Jones,5Sf0ZQfcSrc,0.0,2016-05-03 18:35:46,True,True
2016-05-03T18:49:12,Stephen Amell is in the movie? :O Dayummmmm,0,0,Neil Baria,5Sf0ZQfcSrc,0.05,2016-05-03 18:49:12,True,True
2016-05-03T18:51:12,Bull Shit.,0,0,Niklasator,5Sf0ZQfcSrc,-0.2,2016-05-03 18:51:12,True,True
2016-05-03T18:54:21,Would just watch this shit to see Stephen Amell in a movie,4,0,Chris Spada,5Sf0ZQfcSrc,-0.2,2016-05-03 18:54:21,True,True
2016-05-03T18:59:57,"Anyone that sees these trailers, whether they disliked the first movie or not, and is hating on it is NOT a Ninja Turtles fan because this looks as old school as you can get. Don't know how the movie will turn out but I have a feeling it's going to be extremely fun like the original TV show which made Ninja Turtles big, not the cult favorite graphic novels that preceded it.",0,0,Davon Hall,5Sf0ZQfcSrc,0.165625,2016-05-03 18:59:57,True,True
2016-05-03T19:17:05,Looks fun. im down,0,0,Custom Graphic Ts,5Sf0ZQfcSrc,0.0722222222222222,2016-05-03 19:17:05,True,True
2016-05-03T19:25:21,Ugh...how long are they going to keep dressing up that sunburned hag Megan Fox as an over-aged school girl? She's about as appealing as a burned out cigarette that's been passed around too much.,2,0,Adam,5Sf0ZQfcSrc,0.21666666666666667,2016-05-03 19:25:21,True,True
2016-05-03T19:30:09,Looks just as dumb and pointless as the first film.,0,0,ihateu890,5Sf0ZQfcSrc,-0.125,2016-05-03 19:30:09,True,True
2016-05-03T19:30:20,$uB to me or I eat bleach ice pop!,0,0,Dem Trivia Boyz,5Sf0ZQfcSrc,0.0,2016-05-03 19:30:20,True,True
2016-05-03T19:31:11,Hay guys I made a channel and was wondering if you guys can check it out,0,0,JTheReaper18,5Sf0ZQfcSrc,0.0,2016-05-03 19:31:11,True,True
2016-05-03T19:39:36,"First one was shitty,second one ,i ll wait for torrents.....no money for this movie at cinema...",0,0,Unbuttoned Robe,5Sf0ZQfcSrc,0.25,2016-05-03 19:39:36,True,True
2016-05-03T19:56:43,In this Transformers 8?,0,0,Andrea MKE Granata,5Sf0ZQfcSrc,0.0,2016-05-03 19:56:43,True,True
2016-05-03T20:15:53,"Man beastie boys remind me of when i was 14 and broke my ankle, i was jamming to them on my skateboard and it went south quick.",1,0,JPShadow,5Sf0ZQfcSrc,0.3333333333333333,2016-05-03 20:15:53,True,True
2016-05-03T20:32:32,Stupid Kids Complaining I Assume They Have No Idea What TMNT Is Or They Have No Idea Whom Those Villains Are...,0,1,Saeed Khan,5Sf0ZQfcSrc,-0.7999999999999999,2016-05-03 20:32:32,True,True
2016-05-03T20:44:40,Mmmm... not as fun as the other ones. They should have left well enough alone.,0,0,High Heel Knight Reviews,5Sf0ZQfcSrc,0.04375,2016-05-03 20:44:40,True,True
2016-05-03T20:44:58,"Its just a live action cartoon, which is why I think I'll love this so much, I actually enjoyed the first one and have loved TMNT for as long as I can remember",3,0,Wacky Waving Inflatable Arm Flailing Tube Man Emporium And Warehouse!,5Sf0ZQfcSrc,0.30519480519480524,2016-05-03 20:44:58,True,True
2016-05-03T20:49:20,not that woman again damn there is million of beautiful girls in america cmon not that milf again,0,0,antirlop,5Sf0ZQfcSrc,0.85,2016-05-03 20:49:20,True,True
2016-05-03T20:49:35,looks good. but please these trailer need a new song,0,0,Michael Wise,5Sf0ZQfcSrc,0.41818181818181815,2016-05-03 20:49:35,True,True
2016-05-03T20:55:32,why would megan fox do that to her face??,0,0,PamdaDev,5Sf0ZQfcSrc,0.0,2016-05-03 20:55:32,True,True
2016-05-03T21:02:27,"Said it before and I will say it again, this looks like a lot of fun.",0,0,Pyrolight,5Sf0ZQfcSrc,0.3,2016-05-03 21:02:27,True,True
2016-05-03T21:13:26,ummmmmm....that joke was offensive to those who have a mohawk :),0,0,Imani Jawando,5Sf0ZQfcSrc,0.5,2016-05-03 21:13:26,True,True
2016-05-03T21:36:55,This movie will be 60% Explosions 20% Fight Scenes 10% Plot & Dialogue   5% Product Placement   4% Humor   1% Regret paying money to see this film but did anyways because of nostalgic reasons.,23,13,Deany Beanie,5Sf0ZQfcSrc,-0.5,2016-05-03 21:36:55,True,True
2016-05-03T22:18:06,can't wait to see this in 3D on June 3rd,0,0,Stealth Ninja,5Sf0ZQfcSrc,0.0,2016-05-03 22:18:06,True,True
2016-05-03T22:29:52,I don't even care if this movie is going to be good. Going bc - that's it.,0,0,john diplan,5Sf0ZQfcSrc,0.7,2016-05-03 22:29:52,True,True
2016-05-03T22:43:38,"not even a ninja turtle fan, they look soo bad in a horrible way",0,0,ArigatoDBD,5Sf0ZQfcSrc,-0.8499999999999999,2016-05-03 22:43:38,True,True
2016-05-03T23:01:02,"with Civil War just a few days away, why release this now?  they should've probably waited for the Civil War hype to die down first cuz I, for one, don't give a shit about this movie right now",0,0,120BE12T,5Sf0ZQfcSrc,-0.003968253968253987,2016-05-03 23:01:02,True,True
2016-05-03T23:01:10,UPLOAD IT IN 21:9,0,0,Parzival219,5Sf0ZQfcSrc,0.0,2016-05-03 23:01:10,True,True
2016-05-03T23:12:43,Oh man! This movie looks great!  ...Hmmm... hope the sarcasm comes across via text.,5,4,Dyllyo,5Sf0ZQfcSrc,1.0,2016-05-03 23:12:43,True,True
2016-05-03T23:14:38,"Michael Bay all over this, will be avoiding! Looks like Transformers and that was shite as well",0,0,Appy Ammer,5Sf0ZQfcSrc,0.0,2016-05-03 23:14:38,True,True
2016-05-03T23:19:28,I thought the Beastie Boys didnt allow anybody to use their songs in commercials,0,1,crazychris4124,5Sf0ZQfcSrc,0.0,2016-05-03 23:19:28,True,True
2016-05-03T23:42:32,"Screw the haters, I think it looks great!",1,0,Godzillabrawler,5Sf0ZQfcSrc,1.0,2016-05-03 23:42:32,True,True
2016-05-03T23:54:50,So Stephen Amell AKA Arrow is doing all the voices?,0,0,Prince K-7,5Sf0ZQfcSrc,0.0,2016-05-03 23:54:50,True,True
2016-05-04T00:37:14,there was no point to this trailer,0,2,full metal horseman,5Sf0ZQfcSrc,0.0,2016-05-04 00:37:14,True,True
2016-05-04T00:46:45,Let me guess.. Another Michael Gay movie?,0,0,Nawaz Waseem,5Sf0ZQfcSrc,0.4166666666666667,2016-05-04 00:46:45,True,True
2016-05-04T01:30:46,Uggggggghhhhh.,0,1,Avery Hinks,5Sf0ZQfcSrc,0.0,2016-05-04 01:30:46,True,True
2016-05-04T01:46:51,I really hope this isn't another crapfest like the transformers movies  1st one want that bad,0,0,Gamer for Hire,5Sf0ZQfcSrc,-0.24999999999999992,2016-05-04 01:46:51,True,True
2016-05-04T03:13:31,Looks better than the first one......,0,0,Jo Ann Analupa-Gelomio,5Sf0ZQfcSrc,0.375,2016-05-04 03:13:31,True,True
2016-05-04T03:18:25,"even the CGI'd turtles look more realistic than the angelina-wannabe megax ""plastic"" fox",0,0,echolot,5Sf0ZQfcSrc,0.3333333333333333,2016-05-04 03:18:25,True,True
2016-05-04T03:42:43,it shows clips of the old trailers,0,0,Movie films!,5Sf0ZQfcSrc,0.1,2016-05-04 03:42:43,True,True
2016-05-04T04:30:52,the first movie is so so bored,0,0,Anime Epic,5Sf0ZQfcSrc,-0.125,2016-05-04 04:30:52,True,True
2016-05-04T08:23:14,شكله بيكون من افضل الافلام حاليا 🙊❤️❤️,0,0,LU 23,5Sf0ZQfcSrc,0.0,2016-05-04 08:23:14,True,True
2016-05-04T09:03:35,Will Leonardo get oscar next year?,17,4,Aakash Kalaria,5Sf0ZQfcSrc,0.0,2016-05-04 09:03:35,True,True
2016-05-04T09:29:28,Bring it on!,0,0,Matthew Taylor,5Sf0ZQfcSrc,0.0,2016-05-04 09:29:28,True,True
2016-05-04T09:45:18,Relax guys Micheal bay is just the producer.,0,2,Dhirendra Sahay,5Sf0ZQfcSrc,0.0,2016-05-04 09:45:18,True,True
2016-05-04T10:07:59,I'll watch this but not in theatres,0,0,CD Project Dank,5Sf0ZQfcSrc,0.0,2016-05-04 10:07:59,True,True
2016-05-04T11:45:38,this looks shitty like the first one but i will watch it because of nostalgic reasons,2,0,Amal abdull,5Sf0ZQfcSrc,-0.125,2016-05-04 11:45:38,True,True
2016-05-04T13:06:30,I'll give it a watch,0,0,Kenneth Satria,5Sf0ZQfcSrc,0.0,2016-05-04 13:06:30,True,True
2016-05-04T13:42:39,looks like Michael Bay is going  to give this brand the transformers treatment,5,0,SpookDogg,5Sf0ZQfcSrc,0.0,2016-05-04 13:42:39,True,True
2016-05-04T14:35:22,The cringe is real.,1,0,"I am sorbitol, Maltitol, xylitol, mannitol, Calcium",5Sf0ZQfcSrc,0.2,2016-05-04 14:35:22,True,True
2016-05-04T16:49:37,guess that means part 3 will have Triceratons,0,0,LordAaronus,5Sf0ZQfcSrc,0.0,2016-05-04 16:49:37,True,True
2016-05-04T17:50:53,Turtles meet Transformers The Movie - Directed Micheal Bay Coming Soon,0,0,Cloud VII,5Sf0ZQfcSrc,0.0,2016-05-04 17:50:53,True,True
2016-05-04T18:19:07,Shut up and take my money Michael Bay,3,2,Eduardo Grasso,5Sf0ZQfcSrc,0.0,2016-05-04 18:19:07,True,True
2016-05-04T22:07:56,"""This is how I roll. This is how you roll"" isn't the worst line ever. Here's hoping the sequel can deliver better than the first movie.",0,0,TheElMuffin,5Sf0ZQfcSrc,-0.08333333333333333,2016-05-04 22:07:56,True,True
2016-05-04T23:50:05,Michelangelo will definitely get most of the lines since he's the party dude. He's my fav Ninja Turtle.,0,1,Brooklyn Gamer 77,5Sf0ZQfcSrc,0.25,2016-05-04 23:50:05,True,True
2016-05-05T01:05:12,Why couldn't they recast April? They did it in the originals.,0,2,Tyler Tylerson,5Sf0ZQfcSrc,0.0,2016-05-05 01:05:12,True,True
2016-05-05T04:50:00,derrrrrrrrr-urp,0,0,mike maddrey,5Sf0ZQfcSrc,0.0,2016-05-05 04:50:00,True,True
2016-05-05T05:54:34,who else is exited to see Arrow(steven amell )as Casey Jones in this....,0,1,Raghuvir Gumber,5Sf0ZQfcSrc,0.0,2016-05-05 05:54:34,True,True
2016-05-05T06:03:30,This trailer was so bad and they didn't even release anything new,0,0,Entertainment,5Sf0ZQfcSrc,-0.28181818181818175,2016-05-05 06:03:30,True,True
2016-05-05T06:32:39,"Well this trailer was pointless, just rehashes and small added tidbits. Nothing new here folks.",1,0,Louis Riel,5Sf0ZQfcSrc,-0.12121212121212122,2016-05-05 06:32:39,True,True
2016-05-05T07:00:30,Megan Fox..!! 😍😍😍,0,0,Tushar Warange,5Sf0ZQfcSrc,0.0,2016-05-05 07:00:30,True,True
2016-05-05T09:08:24,Michelangelo sounds  a bit like Donald Trump there.,0,1,Ode,5Sf0ZQfcSrc,0.0,2016-05-05 09:08:24,True,True
2016-05-05T14:57:34,This looks a lot better then the first one,0,0,Andrew MacNeil,5Sf0ZQfcSrc,0.375,2016-05-05 14:57:34,True,True
2016-05-05T23:48:46,wow this movie will be another blockbuster.!!!,1,0,Daphne Jarquin,5Sf0ZQfcSrc,0.1953125,2016-05-05 23:48:46,True,True
2016-05-06T17:48:25,Shocking !!!!!!! No Stephen Amell (01:11),0,0,Nitin Wagh,5Sf0ZQfcSrc,-1.0,2016-05-06 17:48:25,True,True
2016-05-06T18:58:26,"It's going to be stupid, dumb, fun. Exactly what a movie like this should be",0,0,Danbo 22,5Sf0ZQfcSrc,-0.15624999999999994,2016-05-06 18:58:26,True,True
2016-05-07T06:59:29,This movie looks great!,0,0,SapsterFilms,5Sf0ZQfcSrc,1.0,2016-05-07 06:59:29,True,True
2016-05-07T15:54:18,I can't wait for this!,0,0,Jasim Jatoi,5Sf0ZQfcSrc,0.0,2016-05-07 15:54:18,True,True
2016-05-07T16:50:51,why the hell is the turtle sound like Donald trumpf,0,0,KINGDOM K,5Sf0ZQfcSrc,0.4,2016-05-07 16:50:51,True,True
2016-05-07T23:18:24,does anyone know the age limit or how it is called :P want to go with my nephew :P he turns may 25   8,0,1,AkaMegaMikeinator/mihemihe,5Sf0ZQfcSrc,0.75,2016-05-07 23:18:24,True,True
2016-05-08T00:49:38,tmnt tmnt tmnt heroes in a half shell turtle power,0,0,Micah AntonioGreen58,5Sf0ZQfcSrc,-0.16666666666666666,2016-05-08 00:49:38,True,True
2016-05-08T03:41:25,seems better than the last one,0,0,sanjay pallur,5Sf0ZQfcSrc,0.25,2016-05-08 03:41:25,True,True
2016-05-08T16:22:15,This is just a disgrace to the memory of Adam Yauch.,0,0,Bifter Coffinoff,5Sf0ZQfcSrc,0.0,2016-05-08 16:22:15,True,True
2016-05-08T22:02:39,"Dammit, Bay. Stop. I saw the trailer in the theater today. And please, the CGI turtles already killed it.",0,0,SwimmingSkies,5Sf0ZQfcSrc,-0.2,2016-05-08 22:02:39,True,True
2016-05-09T16:47:59,Michael bay? Definitely can't go wrong,0,0,toya FAN,5Sf0ZQfcSrc,-0.5,2016-05-09 16:47:59,True,True
2016-05-09T20:10:10,Thank gosh its produces by Michael bay,0,0,Bob,5Sf0ZQfcSrc,0.0,2016-05-09 20:10:10,True,True
2016-05-10T02:45:19,Looks good.,0,0,The Phantom Thieves of Hearts,5Sf0ZQfcSrc,0.7,2016-05-10 02:45:19,True,True
2016-05-10T03:54:18,"Free Live Sex Cam Show, Exclusive Unlimited Access:      BabeGirlsHere.BlogSpot------------------c0m",0,0,Alayna Perkins,5Sf0ZQfcSrc,0.2681818181818182,2016-05-10 03:54:18,True,True
2016-05-12T08:47:16,0:44 Mikey being Possessed by Donald Trump 😂😂😂😂😂😂😂😂,0,0,echo50gamer,5Sf0ZQfcSrc,0.0,2016-05-12 08:47:16,True,True
2016-05-13T12:02:56,I got robbed on mothers day ninja turtles help,0,0,TheReal IronDog,5Sf0ZQfcSrc,0.0,2016-05-13 12:02:56,True,True
2016-05-14T16:35:06,"This just makes me more excited to see this movie, Mikey's descriptions of him and his brothers are the best! and love the fist bump with Vern :)",0,0,Hero Lover,5Sf0ZQfcSrc,0.575,2016-05-14 16:35:06,True,True
2016-05-15T00:47:52,donnetello is the best,0,1,michael green,5Sf0ZQfcSrc,1.0,2016-05-15 00:47:52,True,True
2016-05-15T01:29:07,"how tf this get a second part, dumb people everywhere",0,1,Kappa,5Sf0ZQfcSrc,-0.1875,2016-05-15 01:29:07,True,True
2016-05-16T16:33:16,Beebop and Rocksteady save this movieeee!!!!!,0,0,Hentai Overlord,5Sf0ZQfcSrc,0.0,2016-05-16 16:33:16,True,True
2016-05-16T18:04:13,making monsters? this'll turn into kungfu panda-is if this'll continue in the next movies,0,0,Licht Silver,5Sf0ZQfcSrc,0.0,2016-05-16 18:04:13,True,True
2016-05-18T16:32:06,"Trailers 1, 2, and 3 look the same.",0,0,FewFew,5Sf0ZQfcSrc,0.0,2016-05-18 16:32:06,True,True
2016-05-19T08:48:08,Yee!! my birthdays on the 2nd and my partys on the 4th thats what ill be doing!,0,1,Chester,5Sf0ZQfcSrc,-0.3125,2016-05-19 08:48:08,True,True
2016-05-19T19:16:24,Those are some weak oneliners.,0,0,Ice Freezer,5Sf0ZQfcSrc,-0.375,2016-05-19 19:16:24,True,True
2016-05-22T11:17:23,"I guess you just can't please anyone.. actually looking forward to the movie, looks fun",1,2,NuckingFuts,5Sf0ZQfcSrc,0.15,2016-05-22 11:17:23,True,True
2016-05-22T15:28:26,be glad you TMNT geeks didn't get the Alien one,0,0,NinjaTurtlesFan89,5Sf0ZQfcSrc,0.125,2016-05-22 15:28:26,True,True
2016-05-24T13:42:11,I bet there will be a black community out there who will complain about bebop impersonnating bad stereotypes...  dont know why.... just a funny feeling,0,0,Rayne Kraven,5Sf0ZQfcSrc,-0.2055555555555555,2016-05-24 13:42:11,True,True
2016-05-31T20:00:49,I saw this yesterday so good,2,0,Georgia Henderson,5Sf0ZQfcSrc,0.7,2016-05-31 20:00:49,False,True
2016-06-01T08:33:58,awesome love them all,0,0,Danny Robak,5Sf0ZQfcSrc,0.75,2016-06-01 08:33:58,False,True
2016-06-02T10:30:08,This movie was shit lol,0,0,kiwiassasin22,5Sf0ZQfcSrc,0.30000000000000004,2016-06-02 10:30:08,False,True
2016-06-02T11:17:15,From the company that brought you the Last Airbender!,0,0,Nik Tri,5Sf0ZQfcSrc,0.0,2016-06-02 11:17:15,False,True
