timestamp,text,like_count,reply_count,author,trailer_id,sentiment_score,datetime,used_for_model,used_for_visualization
2019-04-09T23:44:05,"I finished the movie, and here’s what I think:   Pros     . Very interesting premise     . The puzzles are pretty fun     . Good suspense and mystery      . No unnecessary gore and fan services   Cons     . Characters are okay at best      . Dialogue mainly consist of shouting and yelling     . Villain motivation is pretty weak     . Weak climax and final showdown  In summary, if you love puzzle solving, mysteries, and suspenseful and thrilling atmospheres, I would definitely recommend it. However, if you’re expecting cool and interesting characters or witty dialogue, you won’t find it here. While the premise and plot is fine, don’t expecting some mind-blowing twist ending or interesting villains on par with Jigsaw from Saw...",0,0,Jinhunter Slay,6dSKUoV0SNI,0.2992063492063492,2019-04-09 23:44:05,False,False
2019-04-10T01:04:22,Final destination and saw together,0,0,MoufasaMan,6dSKUoV0SNI,0.0,2019-04-10 01:04:22,False,False
2019-04-10T04:34:35,It’s like saw,0,0,DriftorDie 00,6dSKUoV0SNI,0.0,2019-04-10 04:34:35,False,False
2019-04-10T04:36:41,This is like the saw movie.  With out Jigsaw.  We don’t who’s behind this game.,0,0,Slickhustler 02131,6dSKUoV0SNI,-0.4,2019-04-10 04:36:41,False,False
2019-04-10T05:13:11,The Cube + SAW?,0,0,Lighthalzen-SS,6dSKUoV0SNI,0.0,2019-04-10 05:13:11,False,False
2019-04-10T06:49:38,"Good movie! Spoiler: There's part 2!  Also, this is like the Belko Experiment",14,2,Abukenyo,6dSKUoV0SNI,1.0,2019-04-10 06:49:38,False,False
2019-04-10T10:09:18,"The new version of  the 1997 ""The Cube"".",0,0,wino0000006,6dSKUoV0SNI,0.13636363636363635,2019-04-10 10:09:18,False,False
2019-04-10T10:12:02,Shittest movie ever do not watch waste of time man,1,1,Dhirendra Behera,6dSKUoV0SNI,-0.2,2019-04-10 10:12:02,False,False
2019-04-10T10:12:08,I wonder what its like to watch a Original film idea?,0,0,ken shamrock,6dSKUoV0SNI,0.375,2019-04-10 10:12:08,False,False
2019-04-10T10:31:43,its worth watching it,0,0,Agan Valentić,6dSKUoV0SNI,0.3,2019-04-10 10:31:43,False,False
2019-04-10T12:14:09,I think i saw the whole movie on this trailer,0,0,Jevan Velasco,6dSKUoV0SNI,0.2,2019-04-10 12:14:09,False,False
2019-04-10T12:49:01,This reminds me of jigsaw.Its scary tho.,4,0,Tinhead TM,6dSKUoV0SNI,-0.5,2019-04-10 12:49:01,False,False
2019-04-10T13:04:08,theres an early 3DS game similar to the movie. it's called 999 yall should check it out,0,1,Allen Catapang,6dSKUoV0SNI,-0.10000000000000002,2019-04-10 13:04:08,False,False
2019-04-10T14:43:02,these movies are so so so so so so overrated,0,0,Babyface Assassin,6dSKUoV0SNI,0.0,2019-04-10 14:43:02,False,False
2019-04-10T16:07:30,Good movie,0,0,indra sugara,6dSKUoV0SNI,0.7,2019-04-10 16:07:30,False,False
2019-04-10T16:47:32,Scenes shot at my university :D,0,0,TheLazyGunner,6dSKUoV0SNI,1.0,2019-04-10 16:47:32,False,False
2019-04-10T17:05:34,This is horror?,0,0,gorky Subanović,6dSKUoV0SNI,0.0,2019-04-10 17:05:34,False,False
2019-04-10T17:48:10,Escape room 2,0,0,Limitless Kingdom,6dSKUoV0SNI,0.0,2019-04-10 17:48:10,False,False
2019-04-10T19:16:32,I watched it last night Highly recommended,0,0,Jaylen Goat,6dSKUoV0SNI,0.08,2019-04-10 19:16:32,False,False
2019-04-10T20:37:20,This movies racist...brown guy does first,0,0,VisualGamerBF,6dSKUoV0SNI,0.25,2019-04-10 20:37:20,False,False
2019-04-10T22:42:39,Zero Nine Four Five Six One Nine Four Seven Eight Six,0,0,Chalk Vlogs,6dSKUoV0SNI,0.0,2019-04-10 22:42:39,False,False
2019-04-10T23:06:11,I'm never going to an escape room...,0,0,LivinwithJennifer,6dSKUoV0SNI,0.0,2019-04-10 23:06:11,False,False
2019-04-11T03:28:07,Great movie!!! Can't wait for part 2...,0,0,sugasuga2007,6dSKUoV0SNI,1.0,2019-04-11 03:28:07,False,False
2019-04-11T04:27:10,Hey JERKOFFS ... why the hell do you insist on ruining most of the movie in these trailers?  Leave some of the scenes to our imagination or you'll ruin it by the time we rent the movie.,0,0,Brian Brewster,6dSKUoV0SNI,0.5,2019-04-11 04:27:10,False,False
2019-04-11T04:33:46,"It was good trying to be realistic until they tried to simulate her PTSD with the worst CGI fire flames I've seen in years l and it really ruined the atmosphere because they looked so fake, I just couldn't keep watching that movie.",1,0,Matt Mustang,6dSKUoV0SNI,-0.08666666666666668,2019-04-11 04:33:46,False,False
2019-04-11T04:55:12,So this is just ripoff of saw,0,0,Moon Kang June,6dSKUoV0SNI,0.0,2019-04-11 04:55:12,False,False
2019-04-11T05:31:42,Movie was awesome. Trailer gives away too much but that's nothing new.,0,0,djlowtek,6dSKUoV0SNI,0.4454545454545455,2019-04-11 05:31:42,False,False
2019-04-11T09:00:42,I love this film,0,0,제시카,6dSKUoV0SNI,0.5,2019-04-11 09:00:42,False,False
2019-04-11T09:00:55,Alwready watched it,0,0,제시카,6dSKUoV0SNI,0.0,2019-04-11 09:00:55,False,False
2019-04-11T09:41:53,For me this film is 0000%%%%,0,0,Baiarbor Nongrum,6dSKUoV0SNI,0.0,2019-04-11 09:41:53,False,False
2019-04-11T10:32:23,I already watched it on movie stars app download on play store it lets you watch unlimited movies and you don't have to pay,0,0,Cloticz_YT,6dSKUoV0SNI,0.0,2019-04-11 10:32:23,False,False
2019-04-11T11:53:51,its not a 5 star movie  but i enjoyed every scene.,2,0,manu M,6dSKUoV0SNI,0.5,2019-04-11 11:53:51,False,False
2019-04-11T13:30:03,Don’t know why this has bad reviews but this movie is quite amazing and awesome,3,0,Renz Villamor,6dSKUoV0SNI,0.3000000000000001,2019-04-11 13:30:03,False,False
2019-04-11T13:31:04,The Hollywood is out of the ideas 😂😂,0,0,Marko Mircetic,6dSKUoV0SNI,0.0,2019-04-11 13:31:04,False,False
2019-04-11T13:44:43,should i waste my tow hours with this movie or not any advice?,0,4,mohammed kamal,6dSKUoV0SNI,-0.2,2019-04-11 13:44:43,False,False
2019-04-11T15:02:12,Is it scary?,0,0,Yessenia Riverah,6dSKUoV0SNI,-0.5,2019-04-11 15:02:12,False,False
2019-04-11T16:55:40,"the trailer was very intense, about to watch the movie wish me luck",0,0,Mohammed Al Hamed,6dSKUoV0SNI,0.26,2019-04-11 16:55:40,False,False
2019-04-11T17:04:31,Asian guy die first,0,1,tony wawan,6dSKUoV0SNI,0.125,2019-04-11 17:04:31,False,False
2019-04-11T18:00:35,"movie was ok, nothing more.",0,0,jeroen van gelder,6dSKUoV0SNI,0.5,2019-04-11 18:00:35,False,False
2019-04-11T20:01:21,"interesting, but TO MANY SPOILERS. and the ones how trapt them,  watch to match saw",0,0,BlackMorgana 1230,6dSKUoV0SNI,0.5,2019-04-11 20:01:21,False,False
2019-04-11T22:06:29,Worth watching nice movie,0,0,V3n0m,6dSKUoV0SNI,0.44999999999999996,2019-04-11 22:06:29,False,False
2019-04-11T22:52:04,EXAM 2.0,0,0,Analytical Thinking,6dSKUoV0SNI,0.0,2019-04-11 22:52:04,False,False
2019-04-11T23:57:37,Sperti saw ya wkwkwk,0,0,Rafardhan Athalla,6dSKUoV0SNI,0.0,2019-04-11 23:57:37,False,False
2019-04-12T00:20:12,This movie is great. Can't wait for part 2,2,0,Denada Stafa,6dSKUoV0SNI,0.8,2019-04-12 00:20:12,False,False
2019-04-12T02:57:35,Ugly AF. Trust me.,0,0,No Sleep No Problem,6dSKUoV0SNI,-0.7,2019-04-12 02:57:35,False,False
2019-04-12T05:30:17,AWESOME MOVIE!,0,0,brenda tatum,6dSKUoV0SNI,1.0,2019-04-12 05:30:17,False,False
2019-04-12T08:15:11,Great! Cube meets Saw meets Hostel 👍,0,0,Marc Lucas,6dSKUoV0SNI,1.0,2019-04-12 08:15:11,False,False
2019-04-12T09:06:35,I think the next setting is on China.,0,1,Sungjin Tayo na lang,6dSKUoV0SNI,0.0,2019-04-12 09:06:35,False,False
2019-04-12T09:35:05,"0:46 i watched the movie and it’s 10,000 btw😂",0,0,Josh_Ritson,6dSKUoV0SNI,0.0,2019-04-12 09:35:05,False,False
2019-04-12T10:10:49,modern version of the old cube movies?? *.* i rly hope so. gooosh the cube movies good old memories but like saw they fucked up with the later movies of the franchise and the franchise died with a lot of unanswerd questions...:(,0,0,Kelvin Marumbach,6dSKUoV0SNI,-0.0357142857142857,2019-04-12 10:10:49,False,False
2019-04-12T12:12:18,"In the movie he catches the phone, in the trailer it falls next to his head... I don't know why I noticed that",0,0,Mortal Wombat,6dSKUoV0SNI,0.0,2019-04-12 12:12:18,False,False
2019-04-12T14:37:02,nahhh,0,0,Joshua Vacaro,6dSKUoV0SNI,0.0,2019-04-12 14:37:02,False,False
2019-04-12T14:57:01,"Saw, cabin in the woods and belko experiment... 3 movies in one, total madness 👍 hella dope movie",0,0,Collen Nkuna,6dSKUoV0SNI,0.0,2019-04-12 14:57:01,False,False
2019-04-12T16:20:33,i liked this movie.. not to bloody... not like SAW.. that was teriblle to watch,0,1,So Yà,6dSKUoV0SNI,-0.10000000000000003,2019-04-12 16:20:33,False,False
2019-04-12T18:51:08,I watched it on the plane.. Its really good. highly recommended. Plus can you guys suggest similar movies? I have seen SAW and Cube,0,0,Hira Riaz,6dSKUoV0SNI,0.2866666666666667,2019-04-12 18:51:08,False,False
2019-04-12T19:05:46,that was so nice movie,0,0,김분희,6dSKUoV0SNI,0.6,2019-04-12 19:05:46,False,False
2019-04-12T19:08:42,wow wht a movie wooooooooow Bhai main to aaj dekhi kya movie h aap log bhi delh lo internet pr available h,0,0,SØS令Hสrรђ,6dSKUoV0SNI,0.22222222222222224,2019-04-12 19:08:42,False,False
2019-04-12T19:36:19,You want to play a game. 😁,0,0,Jim Jams,6dSKUoV0SNI,-0.4,2019-04-12 19:36:19,False,False
2019-04-12T19:42:38,Did I watch the whole movie in the trailer?,0,0,LegendColgo,6dSKUoV0SNI,0.2,2019-04-12 19:42:38,False,False
2019-04-12T19:46:26,Engaging one...nice,0,0,Harsha,6dSKUoV0SNI,0.4,2019-04-12 19:46:26,False,False
2019-04-12T21:17:16,10/10 awesome,0,0,Dušan Osadský,6dSKUoV0SNI,1.0,2019-04-12 21:17:16,False,False
2019-04-12T21:51:23,One of the most rediculous movies I’ve seen. Don’t waste your time!,0,2,Mohammad Saabneh,6dSKUoV0SNI,0.125,2019-04-12 21:51:23,False,False
2019-04-13T00:20:46,Part 2 should be great,0,0,Chicho Charli,6dSKUoV0SNI,0.8,2019-04-13 00:20:46,False,False
2019-04-13T00:53:26,"This is exactly copied from a series from Crackle (well almost, same principles) think its called the package or something it was real good",0,0,TripleTreuViet,6dSKUoV0SNI,0.4166666666666667,2019-04-13 00:53:26,False,False
2019-04-13T01:01:34,Predition:they all survived but then killed each other off for the million bucks which was in vnd($50cdn) lol,4,1,TripleTreuViet,6dSKUoV0SNI,0.15833333333333335,2019-04-13 01:01:34,False,False
2019-04-13T06:33:09,Muy buena,0,0,Judith Pu,6dSKUoV0SNI,0.0,2019-04-13 06:33:09,False,False
2019-04-13T07:40:13,Im confused which movie ti watch at the cinemas... Pet semetary Or Escape room Or glass  😣Help meh plzzz😂,0,2,zikraxmulla,6dSKUoV0SNI,-0.4,2019-04-13 07:40:13,False,False
2019-04-13T08:54:31,10/10 ! Highly recomend it,0,0,Konstantinos Kattidis,6dSKUoV0SNI,0.16,2019-04-13 08:54:31,False,False
2019-04-13T09:31:47,This is really nice movie. Something like 2019 saw. I enjoy it.,3,0,One man army,6dSKUoV0SNI,0.5,2019-04-13 09:31:47,False,False
2019-04-13T10:26:24,the trailer literally shows everything smh,2,1,Anne Xiety,6dSKUoV0SNI,0.0,2019-04-13 10:26:24,False,False
2019-04-13T14:02:49,한국인손,0,0,헬창,6dSKUoV0SNI,0.0,2019-04-13 14:02:49,False,False
2019-04-13T14:43:01,too many spoilers for one single trailer folks,0,1,QuiqueNet,6dSKUoV0SNI,0.2142857142857143,2019-04-13 14:43:01,False,False
2019-04-13T15:29:08,Yawn!,0,0,_ Broody,6dSKUoV0SNI,0.0,2019-04-13 15:29:08,False,False
2019-04-13T17:08:30,Nice to watch it! Than a killer movie. Recommend must watch it!! Ok part 2 plsss!!!,0,0,Isther Ray,6dSKUoV0SNI,0.98828125,2019-04-13 17:08:30,False,False
2019-04-13T18:29:42,Carne de porco,0,0,franicisco pinho,6dSKUoV0SNI,0.0,2019-04-13 18:29:42,False,False
2019-04-13T21:11:12,the best escape room movie i ever see.good job .very scaring film.realy amazing well done nice actors,78,1,Mariocco Argi,6dSKUoV0SNI,0.7333333333333334,2019-04-13 21:11:12,False,False
2019-04-13T21:45:11,I recommend this movie !,0,0,Grey Joker Service,6dSKUoV0SNI,0.0,2019-04-13 21:45:11,False,False
2019-04-13T22:53:05,go watch it everyone. one of the best movies made in last couple years so far,6,0,No Name,6dSKUoV0SNI,0.3666666666666667,2019-04-13 22:53:05,False,False
2019-04-13T22:56:31,"This films great, the ratings are bullshit trust me",0,0,SloMoe Official,6dSKUoV0SNI,0.8,2019-04-13 22:56:31,False,False
2019-04-14T03:14:59,the concept of the movie is similar to EXAM(2009).... Am I the only one who thought this?,1,2,Vijay Rawat,6dSKUoV0SNI,0.0,2019-04-14 03:14:59,False,False
2019-04-14T09:24:37,"Dr, Wootaan Yu...OR SHOULD I SAY NO WAY OUT! OH yeah plus if you really dig in the trailer...you would know how many survivors or who had been killed",0,0,TheJubYT,6dSKUoV0SNI,0.16666666666666666,2019-04-14 09:24:37,False,False
2019-04-14T09:28:48,When I first saw this I litterraly thought of escape the night,0,0,diet water,6dSKUoV0SNI,0.25,2019-04-14 09:28:48,False,False
2019-04-14T14:13:02,Seems very familiar to a japanese series,0,0,SchrödingerEquation,6dSKUoV0SNI,0.24375000000000002,2019-04-14 14:13:02,False,False
2019-04-14T14:31:20,The point is you have to wait for second movie.,0,0,Ibrahim Siregar,6dSKUoV0SNI,0.0,2019-04-14 14:31:20,False,False
2019-04-14T15:21:10,so good i promise,0,0,Ishymnida Joon,6dSKUoV0SNI,0.7,2019-04-14 15:21:10,False,False
2019-04-14T16:51:55,"0:46 Pretty sure it's $10,000",1,0,Abel Cast,6dSKUoV0SNI,0.375,2019-04-14 16:51:55,False,False
2019-04-14T18:03:02,Zero escape/ Nonary games anyone..?,0,0,AngelofPaz,6dSKUoV0SNI,0.0,2019-04-14 18:03:02,False,False
2019-04-14T18:30:29,I watched this yesterday and I can assure you the black guy doesn't die first!,0,0,Mlungisi Mndebele,6dSKUoV0SNI,0.07291666666666667,2019-04-14 18:30:29,False,False
2019-04-14T18:49:42,"Cool puzzles but the plot... with the ""villain""... come on. The Cube and Saw movies had more tension and thrill. This one was just too predictable.",1,0,richardhalo,6dSKUoV0SNI,0.21666666666666665,2019-04-14 18:49:42,False,False
2019-04-14T19:09:24,"Danny is most likely the gamemaster, from his sketchy character all along including a couple of hints here in there in the movie serves as good example.",0,0,Sarkis S,6dSKUoV0SNI,0.39999999999999997,2019-04-14 19:09:24,False,False
2019-04-14T22:16:33,"""Saw"" + ""Cube"" + ""National Treasure"" = this, 9/10",3,0,Dominykas Zakrys,6dSKUoV0SNI,0.0,2019-04-14 22:16:33,False,False
2019-04-15T08:46:13,Don't watch trailer just watch movie,0,0,sidhu8110,6dSKUoV0SNI,0.0,2019-04-15 08:46:13,False,False
2019-04-15T13:18:39,A beautiful surprise was that film. Smart and non stop action. I can't wait for the sequel.,0,0,Georgios N. Telas,6dSKUoV0SNI,0.3880952380952381,2019-04-15 13:18:39,False,False
2019-04-15T15:26:56,"Thought it was kinda like saw, you know.... psychological thriller movie stuff 😏",0,0,Muhammad Auzai,6dSKUoV0SNI,0.0,2019-04-15 15:26:56,False,False
2019-04-15T15:32:07,Just watched it.  And yes it's a good movie.  Good actors and the ending was good. I'll wait for the part 2 👌,1468,29,Aubrey Sin,6dSKUoV0SNI,0.6999999999999998,2019-04-15 15:32:07,False,False
2019-04-15T18:32:35,Saw IV !,0,0,Brandon Tucker,6dSKUoV0SNI,0.0,2019-04-15 18:32:35,False,False
2019-04-15T18:59:53,I saw the movie and I just wanna say Wow I’m impressed 👌🏻❤️,6,1,Cloud2 Skym,6dSKUoV0SNI,0.55,2019-04-15 18:59:53,False,False
2019-04-15T20:13:44,"Loved it! Don't trust the critics. Style, editing, sound, tension are on point. The movie was date night candy. You got me & my popcorn ready for the sequel!!",6,0,Fred Cook,6dSKUoV0SNI,0.5291666666666667,2019-04-15 20:13:44,False,False
2019-04-15T20:52:24,"Wait, these guys make a movie about dying in an escape room and advertise the same escape rooms?  To real people...who have watched the movie?",0,0,Mademoiselle Noah,6dSKUoV0SNI,0.1,2019-04-15 20:52:24,False,False
2019-04-15T21:02:21,This kinda reminds me of the Cube series,0,0,john bayern,6dSKUoV0SNI,0.0,2019-04-15 21:02:21,False,False
2019-04-15T21:23:19,Blow my mind🔝🔝🔝,0,0,Lidija Tomic,6dSKUoV0SNI,0.0,2019-04-15 21:23:19,False,False
2019-04-15T22:09:58,Sexy part,0,0,Waqas Kashi,6dSKUoV0SNI,0.5,2019-04-15 22:09:58,False,False
2019-04-16T00:09:56,"After seen this movie, i got 6 different character of human. Hero, kind, clever, survivor, obsessed and selfish. Stop being obsessed and selfish if you don't want to die in vain ✌🏼",0,0,Muhammad Putra Arthur,6dSKUoV0SNI,-0.15416666666666667,2019-04-16 00:09:56,False,False
2019-04-16T00:52:09,The trailer is creepier than the movie itself. Warning: ZOEY IS THE SAVIOR,1,0,noeme sitoy,6dSKUoV0SNI,0.0,2019-04-16 00:52:09,False,False
2019-04-16T07:27:08,"Just finished it. Don't regret watching it at all. The scenes are really well done and kept me on the edge of my seat the whole time. If you hesitate, don't.",0,0,max,6dSKUoV0SNI,0.2,2019-04-16 07:27:08,False,False
2019-04-16T13:57:40,i think that the two girls belong together,0,0,young sage,6dSKUoV0SNI,0.0,2019-04-16 13:57:40,False,False
2019-04-16T15:01:04,Spoilers: Zoey and Ben Miller will be the only ones alive.,0,0,Celestine Valdes,6dSKUoV0SNI,0.05,2019-04-16 15:01:04,False,False
2019-04-16T15:37:32,*The guy on **2:03** and the girl on **2:11** manages to survive. The movie is so good it gives the feeling of watching horror movie. I think tonight i wont be able to sleep because of nightmares due to this movie.*,0,0,Noob player,6dSKUoV0SNI,0.35833333333333334,2019-04-16 15:37:32,False,False
2019-04-16T18:05:38,متى رح ينعرض الفلم,0,0,HAMID GEMAR حامد جيمار,6dSKUoV0SNI,0.0,2019-04-16 18:05:38,False,False
2019-04-16T18:38:38,"hi karen , I am daredevil  oh wait what ?",0,0,alaoui tarik,6dSKUoV0SNI,0.0,2019-04-16 18:38:38,False,False
2019-04-16T22:59:45,i'll back to comment after watch this,0,0,mohamed li,6dSKUoV0SNI,0.0,2019-04-16 22:59:45,False,False
2019-04-17T00:56:24,Wow nice!!!! Need to watch soon!,0,0,NightStar,6dSKUoV0SNI,0.55,2019-04-17 00:56:24,False,False
2019-04-17T08:07:34,This movie must have 2nd part,2,1,Music Park,6dSKUoV0SNI,0.0,2019-04-17 08:07:34,False,False
2019-04-17T08:29:15,*Saw mediocre version*,1,0,Complexity,6dSKUoV0SNI,-0.5,2019-04-17 08:29:15,False,False
2019-04-17T10:35:23,The deaths are depressing,1,0,Andrei Quebrado,6dSKUoV0SNI,-0.6,2019-04-17 10:35:23,False,False
2019-04-17T11:43:13,Don't trust the critics and the haters. This movie is amazing and deserves more hype than it gets,5,0,Bill Clinton,6dSKUoV0SNI,0.55,2019-04-17 11:43:13,False,False
2019-04-17T15:46:08,Super cool.😉,1,0,Dana Supergirl Rajkumar.,6dSKUoV0SNI,0.3333333333333333,2019-04-17 15:46:08,False,False
2019-04-17T18:13:51,"And the moral of this story is, 'If someone sends you an invitation with promise of $1,000,000 if you can escape a room', you're being lied to! If if sounds too good to be true, it probably is! (I'm still going to watch it thought.) (^_^)",0,0,mercury4metal,6dSKUoV0SNI,0.37916666666666665,2019-04-17 18:13:51,False,False
2019-04-17T20:27:00,CCCCCCCCUUUUUUUUUUUUUUUUUUUUUUUUBBBBBBBBBBBBEEEEEEEEEEEEEEEEEEEEEEEE !!!!!!!!!!!!!!!!!!!!!!!!!!!!!!!!!!!!!!!!!!!!!!!           /---------------------------------------------  /|                                     / |                                                           / |        / |                                                          /  |      /   |                                                        /   |    /    |                                                       /   |   /     |                                                    /     |  /      |                                                   /      |  ---------------------------------------------        |  |      |                                                    |       |   |      |                                                    |       |   |      |                                                   |       |  |      |                                                  |       |  |      |                                                  |       |  |      /------------------------------------|---/  |     /                                                |  /  |    /                                                 |      | /________________________ /,1,0,Pika So,6dSKUoV0SNI,0.0,2019-04-17 20:27:00,False,False
2019-04-17T21:03:03,"Don't read anything, don’t trust ratings  THIS MOVIE IS INSANE  STOP WHAT YOU ARE DOING AND GO WATCH IT NOOWWW YOU WILL NOT REGRET IT !!!",1,0,Alien Nene,6dSKUoV0SNI,-1.0,2019-04-17 21:03:03,False,False
2019-04-17T23:53:03,"Very good movie with perfect actors , i guess there will be escape room 2",0,0,mohamed li,6dSKUoV0SNI,0.955,2019-04-17 23:53:03,False,False
2019-04-18T00:32:50,It's so exciting and good twist ending. So much better than Saw!,1,3,Blueblack Kingdomz,6dSKUoV0SNI,0.5416666666666666,2019-04-18 00:32:50,False,False
2019-04-18T01:08:20,I’ve seen the movie and it’s no different from Jig Saw! I love Jig Saw and I think this movie is just another sequel to Saw! Really good though,0,0,Saiga Legacy,6dSKUoV0SNI,0.44166666666666665,2019-04-18 01:08:20,False,False
2019-04-18T02:36:16,this kind of reminds me of ‘As the Gods Will’,0,0,anna m.,6dSKUoV0SNI,0.6,2019-04-18 02:36:16,False,False
2019-04-18T03:48:40,Im exited to the part2 spoiling alert haha sorry,0,0,pangs pongs,6dSKUoV0SNI,-0.15,2019-04-18 03:48:40,False,False
2019-04-18T08:51:39,BRO!!!!!!!!! This new saw movie looks grea..........oh nevermind,1,1,Boopy Doopy,6dSKUoV0SNI,0.13636363636363635,2019-04-18 08:51:39,False,False
2019-04-18T08:52:58,"In my opinion, this movie is much better than Saw.",0,0,Gerald Gaviola,6dSKUoV0SNI,0.5,2019-04-18 08:52:58,False,False
2019-04-18T09:52:55,Please release the 2nd Part This year 2019,0,0,Mysterious Dreamer,6dSKUoV0SNI,0.0,2019-04-18 09:52:55,False,False
2019-04-18T13:10:09,"Fiquei animado somente com a primeira sala, depois ficou repetitivo e o final: uma surpresa clichê.",1,0,Yury Emierry,6dSKUoV0SNI,0.0,2019-04-18 13:10:09,False,False
2019-04-18T13:49:40,looks like   Saw but  perhaps less lethal?,0,0,Tybok C,6dSKUoV0SNI,-0.16666666666666666,2019-04-18 13:49:40,False,False
2019-04-18T14:26:52,Don't watch it now and do my mistake wait for part 2 then watch it,0,0,Zainab,6dSKUoV0SNI,0.0,2019-04-18 14:26:52,False,False
2019-04-18T16:32:44,Cant wait for next !,0,0,Syifa Hana,6dSKUoV0SNI,0.0,2019-04-18 16:32:44,False,False
2019-04-18T17:10:02,Its really seems they have worked hard on the movies it's really good,0,0,LAXMI SWEETS,6dSKUoV0SNI,0.20277777777777775,2019-04-18 17:10:02,False,False
2019-04-18T18:19:23,This is just saw.,0,0,I G,6dSKUoV0SNI,0.0,2019-04-18 18:19:23,False,False
2019-04-18T18:33:41,The exam reboot,0,0,Shegs Akinz,6dSKUoV0SNI,0.0,2019-04-18 18:33:41,False,False
2019-04-18T18:36:33,This movie gave me a serious anxiety attack! 😅🖤,2036,20,Ranaka Siriwardana,6dSKUoV0SNI,-0.41666666666666663,2019-04-18 18:36:33,False,False
2019-04-18T19:44:31,i just watched it its a mind blowing movie one of the best that i have ever seen waiting for the second part make it fast plz,0,0,Khalid Brown,6dSKUoV0SNI,0.39999999999999997,2019-04-18 19:44:31,False,False
2019-04-18T19:54:35,ben miller is benjamin in the walking dead season 7,0,0,Nico,6dSKUoV0SNI,-0.2,2019-04-18 19:54:35,False,False
2019-04-18T21:25:00,the black guy die first?,0,0,Sharpyku,6dSKUoV0SNI,0.04166666666666667,2019-04-18 21:25:00,False,False
2019-04-18T21:39:21,Go watch it. It's amazing.,0,0,Milos Micovic,6dSKUoV0SNI,0.6000000000000001,2019-04-18 21:39:21,False,False
2019-04-18T22:09:16,this movie is sooo good! and i think there will be a part 2....,0,0,Tanjiro Kamado,6dSKUoV0SNI,0.875,2019-04-18 22:09:16,False,False
2019-04-18T22:40:06,That was one hell of a movie .,1,0,Wick Wicked,6dSKUoV0SNI,0.0,2019-04-18 22:40:06,False,False
2019-04-18T23:11:36,highly recommended it was one of favorites movie in 2019,1,0,unlimited,6dSKUoV0SNI,0.16,2019-04-18 23:11:36,False,False
2019-04-19T00:45:25,what do you want us  why do you come  1 mil dolar so get the money who wrote this a kid  hhhhhhhhhhhhhhhhhhhhhhhhhhhhhh,0,0,somali Bilow,6dSKUoV0SNI,0.0,2019-04-19 00:45:25,False,False
2019-04-19T05:34:51,"The movie was awesome, i want to see part 2",0,0,Kayan-Ann Duncan,6dSKUoV0SNI,1.0,2019-04-19 05:34:51,False,False
2019-04-19T06:43:44,jumanji part 2....,0,0,kaushal bhandari,6dSKUoV0SNI,0.0,2019-04-19 06:43:44,False,False
2019-04-19T06:58:15,i didint expected but i liked it...very good movie 8/10 cant wait for the 2nd part...The ending is very dood as well!!!!!,0,0,kalos kariolis,6dSKUoV0SNI,0.3620703125,2019-04-19 06:58:15,False,False
2019-04-19T07:34:17,"I've already watched this, it's so good",0,0,Neonce,6dSKUoV0SNI,0.7,2019-04-19 07:34:17,False,False
2019-04-19T09:22:19,"This is a really good movie, gives you the thrill of Saw without grewsome deaths. Definitely should watch it!",0,0,Malhar Savale,6dSKUoV0SNI,0.35,2019-04-19 09:22:19,False,False
2019-04-19T10:53:01,This trailer just spoiled the 80% of the movie.FUN,0,0,Jigsaw Puzzle,6dSKUoV0SNI,0.0,2019-04-19 10:53:01,False,False
2019-04-19T10:56:09,Just by this trailer I can predict the order of death  1.The Nerd one 2.The blonde girl 3.The 30s dude 4.The drug-addict(look) guy  The final girl is the black girl.If this isn't the ending then I'll watch it.,0,0,Jigsaw Puzzle,6dSKUoV0SNI,-0.05555555555555555,2019-04-19 10:56:09,False,False
2019-04-19T11:44:39,Worst clone of SAW. Very bad actors. Waste of time!,0,1,Alex Geo,6dSKUoV0SNI,-0.7199999999999999,2019-04-19 11:44:39,False,False
2019-04-19T12:19:58,"This movie is almost similar to the ""Belko experiment"", but better.",0,0,Teekay P,6dSKUoV0SNI,0.25,2019-04-19 12:19:58,False,False
2019-04-19T12:49:18,I was waiting for jigsaw to come out on the screen,0,0,The One and Only,6dSKUoV0SNI,0.0,2019-04-19 12:49:18,False,False
2019-04-19T13:48:09,fantastic movie absolutely great,0,0,Popcorn Filmz,6dSKUoV0SNI,0.6000000000000001,2019-04-19 13:48:09,False,False
2019-04-19T14:50:33,"only 10000$ price pool? mr.beast just donates 100,000$ to random twitch streamers",0,0,BaiganGamer,6dSKUoV0SNI,-0.25,2019-04-19 14:50:33,False,False
