timestamp,text,like_count,reply_count,author,trailer_id,sentiment_score,datetime,used_for_model,used_for_visualization
2019-01-06T14:35:45,Jigsaw??,0,0,Tahsin Alam,6dSKUoV0SNI,0.0,2019-01-06 14:35:45,False,True
2019-01-06T14:38:47,"The plot is quite similar to the movie “Liar Game: The Final Stage”, a Japanese movie. Ya should watch it cuz it has a more decent ending than this, whereas “you have a gun, you win”.",0,0,Đỗ Nguyễn,6dSKUoV0SNI,0.15238095238095237,2019-01-06 14:38:47,False,True
2019-01-06T14:46:07,Not Jigsaw at all,0,0,Petran LoL,6dSKUoV0SNI,0.0,2019-01-06 14:46:07,False,True
2019-01-06T14:53:43,this is a new saw movie,0,0,jsuspect7763,6dSKUoV0SNI,0.13636363636363635,2019-01-06 14:53:43,False,True
2019-01-06T14:54:40,That is so scary! Anyone agree?,0,0,nicole ibarrs,6dSKUoV0SNI,-0.625,2019-01-06 14:54:40,False,True
2019-01-06T15:25:59,"This movie was TRAAAAAASH, interesting in the beginning but the ending was DOOODOO",0,0,Spaced Out Side,6dSKUoV0SNI,0.5,2019-01-06 15:25:59,False,True
2019-01-06T15:51:13,BEST. MOVIE. EVER.,1,0,Madi Sheila,6dSKUoV0SNI,1.0,2019-01-06 15:51:13,False,True
2019-01-06T16:41:48,Saw,0,0,유son,6dSKUoV0SNI,0.0,2019-01-06 16:41:48,False,True
2019-01-06T16:53:51,James Charles brought me here HAHAHA,0,0,Lester Estrada,6dSKUoV0SNI,0.2,2019-01-06 16:53:51,False,True
2019-01-06T16:55:30,Knew it as said it is a hit lol,0,0,Austin-Tyler,6dSKUoV0SNI,0.8,2019-01-06 16:55:30,False,True
2019-01-06T17:55:04,This was a very good movie👍,0,0,Hailey Kline,6dSKUoV0SNI,0.9099999999999999,2019-01-06 17:55:04,False,True
2019-01-06T18:00:48,I went to see it and it's really good and scary,0,0,Katypink 12,6dSKUoV0SNI,0.09999999999999998,2019-01-06 18:00:48,False,True
2019-01-06T18:07:01,This movie looks like “la habitación de Fermat” is a copy I think! But it’s still attractive to my eyes 😉👏🏼,0,0,Ana Oviedo Diaz,6dSKUoV0SNI,0.8,2019-01-06 18:07:01,False,True
2019-01-06T18:24:23,This is like hunger games mixed with jigsaw,0,0,Faith Ernestine,6dSKUoV0SNI,0.0,2019-01-06 18:24:23,False,True
2019-01-06T18:28:22,I’m sorry we already have a jigsaw,0,0,Unknown Zzz,6dSKUoV0SNI,-0.5,2019-01-06 18:28:22,False,True
2019-01-06T18:56:57,What’s the name of the song that was in the 8 ball room?,0,0,Alejandra Godoy,6dSKUoV0SNI,0.0,2019-01-06 18:56:57,False,True
2019-01-06T18:59:21,"Wait, there are real escape rooms? Like they actually made real ones? Since when?",1,1,Ron Weasley,6dSKUoV0SNI,0.13333333333333333,2019-01-06 18:59:21,False,True
2019-01-06T19:13:09,"* God bless 5 dead Polish girls who have been burnt, unable to escape the escape room in 2019 *",7,0,MyInternetVision,6dSKUoV0SNI,-0.35,2019-01-06 19:13:09,False,True
2019-01-06T19:19:33,This movie was so messed up but great,0,0,Lynxman busman,6dSKUoV0SNI,0.8,2019-01-06 19:19:33,False,True
2019-01-06T19:22:33,Who’s here because of James Charles,0,0,Kejla Kozo,6dSKUoV0SNI,0.0,2019-01-06 19:22:33,False,True
2019-01-06T20:12:02,Does nobody gonna talk about how that blond gurl looks like lili reinhart from riverdale,2,1,Hailey Diaz,6dSKUoV0SNI,0.0,2019-01-06 20:12:02,False,True
2019-01-06T20:25:54,Basically a new version of Saw 😂,0,0,JoshJay,6dSKUoV0SNI,0.13636363636363635,2019-01-06 20:25:54,False,True
2019-01-06T20:49:10,Nice ripoff of saw,1,0,im_dumb_lol,6dSKUoV0SNI,0.6,2019-01-06 20:49:10,False,True
2019-01-06T21:03:27,Saw 2.0,0,0,Taz Foreman,6dSKUoV0SNI,0.0,2019-01-06 21:03:27,False,True
2019-01-06T21:25:36,Dam that Fahrenheit 451 joke delivery was fire,0,0,K.A. Medium,6dSKUoV0SNI,0.0,2019-01-06 21:25:36,False,True
2019-01-06T21:32:00,I saw it last night it’s really good btw^ but it sets it up for a second movie all too well.,0,0,Samantha Ring,6dSKUoV0SNI,0.2333333333333333,2019-01-06 21:32:00,False,True
2019-01-06T22:16:17,basically the movie saw,0,0,Jay Park,6dSKUoV0SNI,0.0,2019-01-06 22:16:17,False,True
2019-01-06T22:24:45,"I actually wanna see this, this looks good.",0,0,Hailey Turner,6dSKUoV0SNI,0.35,2019-01-06 22:24:45,False,True
2019-01-06T22:25:36,Saw IX and Cube III,1,1,Mariana Cruz,6dSKUoV0SNI,0.0,2019-01-06 22:25:36,False,True
2019-01-06T22:31:10,Reminds me of the Saw franchise.,0,0,Grim Foxy,6dSKUoV0SNI,0.0,2019-01-06 22:31:10,False,True
2019-01-06T23:10:47,Just like the saw movies.,0,0,Courtney Brown,6dSKUoV0SNI,0.0,2019-01-06 23:10:47,False,True
2019-01-06T23:13:37,Jaw made is china,0,0,Panos_ 7gr,6dSKUoV0SNI,0.0,2019-01-06 23:13:37,False,True
2019-01-06T23:36:55,The trailer already shows who dies first.,0,1,Neo Mashego,6dSKUoV0SNI,0.25,2019-01-06 23:36:55,False,True
2019-01-06T23:37:31,Looks good,0,0,James Lincoln,6dSKUoV0SNI,0.7,2019-01-06 23:37:31,False,True
2019-01-06T23:57:43,Wow the little boxes song... throwback to apush 2018,0,0,James Liu,6dSKUoV0SNI,-0.04375,2019-01-06 23:57:43,False,True
2019-01-07T00:01:30,"Saw the movie. It was very entertaining, but not extremely satisfying like I would hope a psychological horror would be. This trailer twists some ideas, but they're very minor and forgivable.  The ending was... confusing for me, but that's usually expected with these types of films. 7/10, definitely go see.",91,6,TheBetterGamer,6dSKUoV0SNI,-0.009285714285714283,2019-01-07 00:01:30,False,True
2019-01-07T00:17:16,The little boxes song will always remind me Weeds,0,0,Wide Awake,6dSKUoV0SNI,-0.1875,2019-01-07 00:17:16,False,True
2019-01-07T00:51:03,I know a lot of people hated this but I thought it was pretty cool :),0,2,DoeShine,6dSKUoV0SNI,0.04999999999999999,2019-01-07 00:51:03,False,True
2019-01-07T01:51:36,This movie is the worde save your money its badddddd!!!!!!!!!!!!!!!!!!!!!!!!!!!,0,0,Star boy Lanez,6dSKUoV0SNI,0.0,2019-01-07 01:51:36,False,True
2019-01-07T01:57:36,Like if this is just an off brand SAW,0,0,Brayden Lauck,6dSKUoV0SNI,0.0,2019-01-07 01:57:36,False,True
2019-01-07T02:29:17,SAW ripoff? Will still watch it!,1,1,Richard WILSON,6dSKUoV0SNI,0.0,2019-01-07 02:29:17,False,True
2019-01-07T02:56:22,One of the best thrillers i ever watched in my life. And i watched a lot. Give it a chance and go watch because i want them to make a number 2!,0,0,Sabeana U,6dSKUoV0SNI,1.0,2019-01-07 02:56:22,False,True
2019-01-07T02:59:26,I saw this movie and it’s really good! I just wouldn’t classify it as a horror film cause it wasn’t scary at all just suspenseful🤗,0,0,Abby Israel,6dSKUoV0SNI,0.1875,2019-01-07 02:59:26,False,True
2019-01-07T03:11:05,I saw this movie today !!!! This is really good,0,0,Faiza Laghari,6dSKUoV0SNI,0.7,2019-01-07 03:11:05,False,True
2019-01-07T03:29:08,I already wached this movie,0,0,Nentzu_.,6dSKUoV0SNI,0.0,2019-01-07 03:29:08,False,True
2019-01-07T03:58:51,*Saw wants to know your location.*  | Accept |       | -Deny- |,1,0,Creepystone Animations,6dSKUoV0SNI,0.2,2019-01-07 03:58:51,False,True
2019-01-07T04:05:51,"They show way too fucking much, we already know how they got out of the furnace room and we also know that the dude in the crushing room died, like cmon!",0,0,Jesus Is Coming,6dSKUoV0SNI,0.35,2019-01-07 04:05:51,False,True
2019-01-07T05:26:37,"Just watched it earlier, it's really, really good. I recommend.",0,0,Leslie-Knope,6dSKUoV0SNI,0.35,2019-01-07 05:26:37,False,True
2019-01-07T05:41:22,Amazing trailer,0,0,Nemo,6dSKUoV0SNI,0.6000000000000001,2019-01-07 05:41:22,False,True
2019-01-07T06:00:31,THIS WAS SUCH A GOOD MOVIE!!😍😍,0,0,Dane Alvarez,6dSKUoV0SNI,0.35,2019-01-07 06:00:31,False,True
2019-01-07T06:07:46,i mean is this a modern version of SAW?,1,1,Josué Flanquin,6dSKUoV0SNI,-0.056249999999999994,2019-01-07 06:07:46,False,True
2019-01-07T07:20:29,Zoey hot😍😍😍,0,0,Trevon Johnson,6dSKUoV0SNI,0.0,2019-01-07 07:20:29,False,True
2019-01-07T08:40:33,This trailer is so bad because I feel I have watched the entire movie (in order!) including the two final survivors.,1,1,FJ García,6dSKUoV0SNI,-0.23333333333333328,2019-01-07 08:40:33,False,True
2019-01-07T08:58:19,"In Poland five people just died in escape room, true story",3030,77,Rain Man,6dSKUoV0SNI,0.35,2019-01-07 08:58:19,False,True
2019-01-07T10:23:10,I was so confused when they released this because of a movie that came out on netflix last week with the same name.. i saw this trailor an was like err these arent the same characters 😅 Looks good though.,0,0,Elise James,6dSKUoV0SNI,0.059999999999999984,2019-01-07 10:23:10,False,True
2019-01-07T10:44:28,"Couple of days ago, in my country, 5 teenage girls died in an escape room, so this movie isn't that unrealistic",563,17,H. P.,6dSKUoV0SNI,-0.25,2019-01-07 10:44:28,False,True
2019-01-07T11:17:34,Still coming out even though 4 girls died in an escape room the other day?,6,1,Mikah Pace,6dSKUoV0SNI,-0.125,2019-01-07 11:17:34,False,True
2019-01-07T11:44:00,Oparte na faktach.,22,1,qweqwe,6dSKUoV0SNI,0.0,2019-01-07 11:44:00,False,True
2019-01-07T13:23:42,Waiting for Escape Room 2..,0,0,Vũ Anh Khoa Nguyễn,6dSKUoV0SNI,0.0,2019-01-07 13:23:42,False,True
2019-01-07T13:26:05,1:42 I know he dead,1,0,Eric D.,6dSKUoV0SNI,-0.2,2019-01-07 13:26:05,False,True
2019-01-07T13:56:45,This is a sequel btw & the first movie is very mediocre,1,2,Malachy madden,6dSKUoV0SNI,-0.2,2019-01-07 13:56:45,False,True
2019-01-07T14:46:58,Battle royal haha,0,0,redOoo,6dSKUoV0SNI,0.2,2019-01-07 14:46:58,False,True
2019-01-07T14:56:20,"[*] 04.01.2019 Poland, Koszalin [*]",43,3,Ethanowski,6dSKUoV0SNI,0.0,2019-01-07 14:56:20,False,True
2019-01-07T15:08:28,Is this gory?,0,0,howdyday,6dSKUoV0SNI,-0.5,2019-01-07 15:08:28,False,True
2019-01-07T15:13:57,Zoey is the type of girl that you want her to die but she survive anyway,13,1,TheLegend 27,6dSKUoV0SNI,0.0,2019-01-07 15:13:57,False,True
2019-01-07T15:14:04,"I already saw this film, Its greatly balanced film, someone may be saying that its for kids, cause we were 4 fifteen year olds on this film and they even didnt give there death cams- when the characters died. This was only good for us, It wasnt exaggerated. Plus film had unexpected ending, just one word for this film- exciting.",3,0,Wicked Joe,6dSKUoV0SNI,0.23333333333333336,2019-01-07 15:14:04,False,True
2019-01-07T16:19:03,I have aleready seen the movie,0,0,Sponder 9,6dSKUoV0SNI,0.0,2019-01-07 16:19:03,False,True
2019-01-07T16:45:35,Great movie!!,0,0,MsWisdom110,6dSKUoV0SNI,1.0,2019-01-07 16:45:35,False,True
2019-01-07T17:15:32,In Poland five 15 years old girls die in Escape Room in Koszalin,6,0,panta-rhei,6dSKUoV0SNI,0.1,2019-01-07 17:15:32,False,True
2019-01-07T17:28:22,the ending of this movie is the best,0,0,Peyton Twatkins,6dSKUoV0SNI,1.0,2019-01-07 17:28:22,False,True
2019-01-07T18:37:48,This reminds me of the movies Saw and Cube.,11,0,Lorenzo Smit,6dSKUoV0SNI,0.0,2019-01-07 18:37:48,False,True
2019-01-07T19:00:12,Chilling when you know in Poland actually people dided in escape room......,43,1,Chilli Chilli,6dSKUoV0SNI,-0.25,2019-01-07 19:00:12,False,True
2019-01-07T19:11:34,Jigsaw 28,0,0,Gabriel Morgan,6dSKUoV0SNI,0.0,2019-01-07 19:11:34,False,True
2019-01-07T19:12:28,I know,0,0,DanTheMan,6dSKUoV0SNI,0.0,2019-01-07 19:12:28,False,True
2019-01-07T19:17:41,0:09 explain why that happens,1,0,Mxginnis !,6dSKUoV0SNI,0.0,2019-01-07 19:17:41,False,True
2019-01-07T20:25:00,"i saw it opening night, it wasn’t that bad it was pretty good",0,0,Makayla Donaldson,6dSKUoV0SNI,0.08333333333333337,2019-01-07 20:25:00,False,True
2019-01-07T20:35:23,After recent tragic death of 5 girls (burned alive) in Escape room in Poland this film will be blocked.,1,0,Artur Czekalski,6dSKUoV0SNI,-0.21666666666666667,2019-01-07 20:35:23,False,True
2019-01-07T20:57:14,Reminds me of saw....naah..,0,0,DaisyD.Cha,6dSKUoV0SNI,0.0,2019-01-07 20:57:14,False,True
2019-01-07T21:25:47,a lighter saw,0,0,Hisoka,6dSKUoV0SNI,0.0,2019-01-07 21:25:47,False,True
2019-01-07T22:04:09,SAW and THE CUBE,0,0,Lunlux,6dSKUoV0SNI,0.0,2019-01-07 22:04:09,False,True
2019-01-07T22:19:47,"So off the back of movies like saw they created those escape the room games, and now off the back of actual escape rooms they've made a movie like saw? Real circle of life stuff....",0,0,nerd dad,6dSKUoV0SNI,0.05,2019-01-07 22:19:47,False,True
2019-01-07T22:34:29,Saw VIII?,0,0,Ladypearldrumz,6dSKUoV0SNI,0.0,2019-01-07 22:34:29,False,True
2019-01-07T23:04:45,we need a escape room control law,1,0,agradina,6dSKUoV0SNI,0.0,2019-01-07 23:04:45,False,True
2019-01-07T23:06:11,"Just *saw* this movie, it was awesome!",3,0,Iconic,6dSKUoV0SNI,1.0,2019-01-07 23:06:11,False,True
2019-01-07T23:54:13,Cube 1997........,0,0,ewwwt,6dSKUoV0SNI,0.0,2019-01-07 23:54:13,False,True
2019-01-08T00:21:03,"Just watched this, it is amazing, 8.5/10, the ending is nutty",0,0,Mason _,6dSKUoV0SNI,0.6000000000000001,2019-01-08 00:21:03,False,True
2019-01-08T01:01:55,"i watched the movie and in the trailer they said 1 mil as prize but on their invitation it says 10 grand, and in the movie they state it as 10 grand so",0,0,halsey,6dSKUoV0SNI,0.5,2019-01-08 01:01:55,False,True
2019-01-08T01:07:38,I SAW THE MOVIE DANNY DIED AND JASON AND AMANDA IN THE MOVIE SO SAD,0,1,unknown o,6dSKUoV0SNI,-0.5,2019-01-08 01:07:38,False,True
2019-01-08T01:13:04,This movie was incredible! I was on the edge of my seat the entire time. THIS is what you call a thriller.,0,1,Blueflam18,6dSKUoV0SNI,0.5,2019-01-08 01:13:04,False,True
2019-01-08T01:32:27,So basically SAW with a twist,0,0,light,6dSKUoV0SNI,0.0,2019-01-08 01:32:27,False,True
2019-01-08T02:04:05,It’s basically Saw 2 but where the characters actually like each other,0,0,isabel_ruby,6dSKUoV0SNI,-0.0625,2019-01-08 02:04:05,False,True
2019-01-08T02:10:50,This is like the tv show person unknown,0,0,Vaginas_ Vibrators,6dSKUoV0SNI,-0.1,2019-01-08 02:10:50,False,True
2019-01-08T02:16:29,Who made that end? It was very disappointing.,0,0,J&C,6dSKUoV0SNI,-0.78,2019-01-08 02:16:29,False,True
2019-01-08T04:34:03,Its like saw,0,0,JESUS CHRIST IS LORD HE IS THE TRUTH,6dSKUoV0SNI,0.0,2019-01-08 04:34:03,False,True
2019-01-08T04:42:58,"I already watched this movie, just spanish version - Fermat's Room (La habitación de Fermat) 2007",0,0,Baxter Stockman,6dSKUoV0SNI,0.0,2019-01-08 04:42:58,False,True
2019-01-08T04:56:55,"Well we know the Indian guy dies, he falls in the ice and then isn't shown in the rest of the trailer",0,0,Texas Wan,6dSKUoV0SNI,0.0,2019-01-08 04:56:55,False,True
2019-01-08T05:26:46,*AWESOME!*,0,0,Lime Studios,6dSKUoV0SNI,1.0,2019-01-08 05:26:46,False,True
2019-01-08T06:02:08,So it is Saw but with some sci-fi,0,0,Jared,6dSKUoV0SNI,0.0,2019-01-08 06:02:08,False,True
2019-01-08T06:49:41,Movie Recommended. Reminded me of Jigsaw,0,0,ivan sanchez,6dSKUoV0SNI,0.0,2019-01-08 06:49:41,False,True
2019-01-08T07:24:49,This is just like saw 😂😂,0,0,WANEM PHOR,6dSKUoV0SNI,0.0,2019-01-08 07:24:49,False,True
2019-01-08T07:43:53,In the end credits scene there’s a voice on the intercom that says “I want to play a game.”,0,0,MrRandomTV1000,6dSKUoV0SNI,-0.4,2019-01-08 07:43:53,False,True
2019-01-08T08:37:17,I've watched this earlier. It's a mix of Cube and Saw. It's more similar to Cubes story about how they use subjects for these experiments.,0,0,TrippyLeo,6dSKUoV0SNI,0.16666666666666666,2019-01-08 08:37:17,False,True
2019-01-08T09:15:51,This movie hella good,0,0,Splash2k TV,6dSKUoV0SNI,0.7,2019-01-08 09:15:51,False,True
2019-01-08T09:18:13,Cool another version like SAW. THIS IS GONNA BE INTERESTING. I wonder if they made the movie from does app “ESCAPE ROOM” games from the AppStore.,0,0,Alex Boricua,6dSKUoV0SNI,0.425,2019-01-08 09:18:13,False,True
2019-01-08T09:35:37,Thriller movies are getting better and better each year!,0,0,Vince Jascha Orcullo,6dSKUoV0SNI,0.5625,2019-01-08 09:35:37,False,True
2019-01-08T11:17:57,Wow.  Excited.,1,0,Kelly B Kelly,6dSKUoV0SNI,0.2375,2019-01-08 11:17:57,False,True
2019-01-08T13:26:02,The cinematography of this looks fantastic,1,0,Internet Dinosaur,6dSKUoV0SNI,0.4,2019-01-08 13:26:02,False,True
2019-01-08T13:39:55,Siema Koszalin,2,1,memento mori,6dSKUoV0SNI,0.0,2019-01-08 13:39:55,False,True
2019-01-08T14:27:41,So it's basically Saw V then?,0,0,Żądny Przygód,6dSKUoV0SNI,0.0,2019-01-08 14:27:41,False,True
2019-01-08T14:32:40,*Polish people left the chat*,3,0,Perviq,6dSKUoV0SNI,0.0,2019-01-08 14:32:40,False,True
2019-01-08T15:06:14,INSIDIOUS !!!,0,0,Hugo Machado,6dSKUoV0SNI,0.0,2019-01-08 15:06:14,False,True
2019-01-08T15:27:58,ZAJEBISCIE ZE W POLSCE ODWOWALI PREMIERE PRZEZ WYPADEK W KOSZALINIE .,0,0,AurelkaBanis 3829,6dSKUoV0SNI,0.0,2019-01-08 15:27:58,False,True
2019-01-08T15:42:27,Szkoda że w Polsce nie będzie :/,2,0,fk m3 d4ddy,6dSKUoV0SNI,-0.25,2019-01-08 15:42:27,False,True
2019-01-08T16:03:09,in poland five girls died in escape room😐,2,0,Weronika Kurc,6dSKUoV0SNI,0.0,2019-01-08 16:03:09,False,True
2019-01-08T16:53:32,We have ours in Poland.  But Real  5 girls age 15 die in escape room the building test fire,1,0,Filipek486,6dSKUoV0SNI,0.2,2019-01-08 16:53:32,False,True
2019-01-08T17:34:17,Couldn't they call this something else? There was already a movie in 2017 called Escape Room. Then there was a TV movie in 2018 called No Escape Room. How fuckin original are you. Who opens random packages sent to them? I'd have returned them. I even threw away a Christmas present someone sent me because I had no idea who it was from and I didn't order anything.,0,0,ChungKingCanSuckIt,6dSKUoV0SNI,-0.041666666666666664,2019-01-08 17:34:17,False,True
2019-01-08T17:57:27,Rusty Lake,0,0,Danbi Rain,6dSKUoV0SNI,0.0,2019-01-08 17:57:27,False,True
2019-01-08T18:02:29,Sorry.No for Poland. Remember Kalisz tragedy,1,0,Kruszwil _,6dSKUoV0SNI,0.0,2019-01-08 18:02:29,False,True
2019-01-08T18:48:24,Koszalin 2019 historia prawdziwa,0,0,Jakub Cesarz Dakos,6dSKUoV0SNI,0.0,2019-01-08 18:48:24,False,True
2019-01-08T19:07:14,PG Saw,0,0,Ibrahim Ibrahim,6dSKUoV0SNI,0.0,2019-01-08 19:07:14,False,True
2019-01-08T19:11:41,Połączenie Cuba z Piłą. It's connected Cube and Jigsaw,0,0,Ernest Gal,6dSKUoV0SNI,0.0,2019-01-08 19:11:41,False,True
2019-01-08T19:21:37,"This movie is made on novel, named Fahrenheit 451 lol",0,0,Muhammad Ali,6dSKUoV0SNI,0.8,2019-01-08 19:21:37,False,True
2019-01-08T19:28:18,Koszalin pozdrawia,2,0,Ananasek Familia,6dSKUoV0SNI,0.0,2019-01-08 19:28:18,False,True
2019-01-08T21:28:22,Saw 10,0,0,Szymon Błażejewski,6dSKUoV0SNI,0.0,2019-01-08 21:28:22,False,True
2019-01-08T23:01:00,is it good?,0,0,Marie-Reine Kabis,6dSKUoV0SNI,0.7,2019-01-08 23:01:00,False,True
2019-01-09T00:12:34,So basically this is the US version of Fermat's room?,0,0,RetroDeath,6dSKUoV0SNI,0.0,2019-01-09 00:12:34,False,True
2019-01-09T00:32:23,So they took all the Netflix stars??,0,0,mrrobot22,6dSKUoV0SNI,0.0,2019-01-09 00:32:23,False,True
2019-01-09T00:33:50,I liked this movie but it would have been better if they didn't give everything away in the trailer,0,0,iYasmin,6dSKUoV0SNI,0.55,2019-01-09 00:33:50,False,True
2019-01-09T01:11:08,"There is a film on Netflix, same name, same premise.",0,0,enn bee,6dSKUoV0SNI,0.0,2019-01-09 01:11:08,False,True
2019-01-09T01:58:11,The movie wasn’t scary at all it’s false advertising 😭,0,0,Manny Rivera,6dSKUoV0SNI,-0.45000000000000007,2019-01-09 01:58:11,False,True
2019-01-09T02:41:57,"I just watched it, it's so good! It makes you tense up!",1,0,Cinnamon Kitten,6dSKUoV0SNI,0.22916666666666669,2019-01-09 02:41:57,False,True
2019-01-09T03:00:19,"This triggers APUSH srudents, apparently the song in the background of this trailer is more important than both world wars",1,0,Danny Velasquez,6dSKUoV0SNI,0.3166666666666667,2019-01-09 03:00:19,False,True
2019-01-09T04:04:36,"Wow, the movie was really captivating. I was on the edge of my seat the entire time, the breaks were so freaking small lol. But I'm not going to lie, the ending really pissed me off. 😡",102,15,Luaxon,6dSKUoV0SNI,0.22499999999999998,2019-01-09 04:04:36,False,True
2019-01-09T04:13:49,Don't worry Matthew *ahem*  i mean DareDevil saved them all,0,0,Iyam_ nandu,6dSKUoV0SNI,-0.3125,2019-01-09 04:13:49,False,True
2019-01-09T04:22:56,"Trailer: the winner gets $1 million  In the movie: the winner gets $10,000 Hmmmm 🤨🤨",0,0,Rainbow Jason,6dSKUoV0SNI,0.0,2019-01-09 04:22:56,False,True
2019-01-09T04:29:37,"Do you know The Walking Dead?   If you do, then you know Benjamin.   Ben, Benjamin. 😉",0,0,Leia Michelle,6dSKUoV0SNI,-0.2,2019-01-09 04:29:37,False,True
2019-01-09T04:44:00,I remember this song from Weeds.  Any Weeds fans ?,0,0,smooth september,6dSKUoV0SNI,0.0,2019-01-09 04:44:00,False,True
2019-01-09T05:16:41,Omg this was horrifying,0,0,ThatGirlwhoeatstakisincl,6dSKUoV0SNI,-0.9,2019-01-09 05:16:41,False,True
2019-01-09T06:12:28,This movie good as hell with a twist . Go watch now !,0,0,Bonnie,6dSKUoV0SNI,0.875,2019-01-09 06:12:28,False,True
2019-01-09T08:08:25,Loved the movie. I'm hoping for the sequel.,0,0,Marius B,6dSKUoV0SNI,0.7,2019-01-09 08:08:25,False,True
2019-01-09T09:10:08,The thing is ... They all could have survived but they weren't meant to.,0,0,hm. cb,6dSKUoV0SNI,0.0,2019-01-09 09:10:08,False,True
2019-01-09T09:40:52,SAW ALL THE WAY.......,0,0,mark serainidis,6dSKUoV0SNI,0.0,2019-01-09 09:40:52,False,True
2019-01-09T11:19:17,100 doors game in a nutshell,0,0,Jodie Jejepangan,6dSKUoV0SNI,-0.4,2019-01-09 11:19:17,False,True
2019-01-09T11:19:37,is not it like the room game series?,0,0,mustafa poyraz Çelik,6dSKUoV0SNI,-0.4,2019-01-09 11:19:37,False,True
2019-01-09T11:38:06,Reminds me of jigsaw all the personal history collected these people were stalked  BUT DIFFERENCE IS jigsaw punished bad people who made very bad dark evil choices these people were very lucky exceptions who survived tragic accidents and were part of an experiment to see who would be capable of surviving another tragedy.,0,0,mastamind487,6dSKUoV0SNI,-0.35958333333333325,2019-01-09 11:38:06,False,True
2019-01-09T12:11:38,what's the title of this backsound? sounds old and creepy,0,0,Fransyudha Abandhika,6dSKUoV0SNI,-0.2,2019-01-09 12:11:38,False,True
2019-01-09T13:34:28,So basically Saw 9,0,0,Zikri Ramadhansyah,6dSKUoV0SNI,0.0,2019-01-09 13:34:28,False,True
2019-01-09T14:13:51,Greetings from Poland. Sad,5,0,Bartyrus,6dSKUoV0SNI,-0.5,2019-01-09 14:13:51,False,True
2019-01-09T14:31:23,This film is simillar to the 1408 room :o,0,0,Kryptyda,6dSKUoV0SNI,0.05,2019-01-09 14:31:23,False,True
2019-01-09T15:34:00,Kto z Polski?,4,0,Mr. Gru,6dSKUoV0SNI,0.0,2019-01-09 15:34:00,False,True
2019-01-09T15:42:41,"News from Poland, true story. Five teen girls die in fire",8,0,Seweryn,6dSKUoV0SNI,0.175,2019-01-09 15:42:41,False,True
2019-01-09T16:30:05,This was done many many years ago. The first movie of its kind is called The exam. Boring choice for a movie Sony,0,0,IGuess So,6dSKUoV0SNI,0.17,2019-01-09 16:30:05,False,True
2019-01-09T16:59:41,"""SAW"" reloaded? Looks very good!!",0,0,steelwiz,6dSKUoV0SNI,1.0,2019-01-09 16:59:41,False,True
2019-01-09T17:50:56,This reminds me of The Cube every room is a puzzle,1,0,Ron nel,6dSKUoV0SNI,0.0,2019-01-09 17:50:56,False,True
2019-01-09T18:15:39,I REALLY want to see this!! X,0,0,Melissa Wright,6dSKUoV0SNI,0.3125,2019-01-09 18:15:39,False,True
2019-01-09T18:21:00,"1 million dollars, it’s 10,000 dollars",0,0,Aj x3,6dSKUoV0SNI,0.0,2019-01-09 18:21:00,False,True
2019-01-09T18:56:44,"This movie was SO good!!! I thought it was going to be average but it had lots of twists & shocking turns. I really enjoyed it, everyone should go see it",120,7,Adam V.,6dSKUoV0SNI,0.0875,2019-01-09 18:56:44,False,True
2019-01-09T18:58:36,At the end where it said a chance to win $5000 dollars I would still be like nope! My sister wants to do a escape room lol. But she said it’s not like this it’s just a room you have to figure out the clues but when you give up they just let you out. But I’m thinking there is security guards in the room with you,0,0,Gacha Movie Maker,6dSKUoV0SNI,0.6666666666666666,2019-01-09 18:58:36,False,True
2019-01-09T19:12:14,Hmmm...I don’t know.,0,0,RCB,6dSKUoV0SNI,0.0,2019-01-09 19:12:14,False,True
2019-01-09T19:44:45,and the budget is....?! 😱 this is no cheap,0,0,Shpanders,6dSKUoV0SNI,-0.2,2019-01-09 19:44:45,False,True
2019-01-09T19:46:39,Is this movie scary ?,0,0,No Kizzap,6dSKUoV0SNI,-0.5,2019-01-09 19:46:39,False,True
2019-01-09T20:19:35,Modern Saw,0,0,Allison Lennox,6dSKUoV0SNI,0.2,2019-01-09 20:19:35,False,True
2019-01-09T22:36:04,im going to an escape room for my birthday and my dad said “ What if it’s real?,0,0,pbj,6dSKUoV0SNI,0.2,2019-01-09 22:36:04,False,True
2019-01-09T22:36:25,The thumbnail is already fire asf👌,1,0,muertos._ tye,6dSKUoV0SNI,0.0,2019-01-09 22:36:25,False,True
2019-01-09T23:30:14,James Wann would be proud.,0,0,Jose L. Padilla Jr.,6dSKUoV0SNI,0.8,2019-01-09 23:30:14,False,True
2019-01-10T00:15:50,so is this movie like the Cube trilogy?,0,0,Bullet Tooth Tony,6dSKUoV0SNI,0.0,2019-01-10 00:15:50,False,True
2019-01-10T03:03:50,Escape Room 2017 is a lot like ER 2019,0,0,Supremo Ticketing,6dSKUoV0SNI,0.0,2019-01-10 03:03:50,False,True
2019-01-10T03:57:48,bolywood kid die first lol,0,0,SYNCpro,6dSKUoV0SNI,0.525,2019-01-10 03:57:48,False,True
2019-01-10T04:34:16,I edited this comment so the replys wont make sence😘👌🏾,438,11,Melvin,6dSKUoV0SNI,0.0,2019-01-10 04:34:16,False,True
2019-01-10T05:15:55,So I must be watching a completely different movie on kodi smh.,0,0,Lexy Mar,6dSKUoV0SNI,0.0,2019-01-10 05:15:55,False,True
2019-01-10T07:17:51,"Ive had dreams about being inside a video game like situation, but it's all real. And there are rooms around me, or sometimes inside this long hall, with deadly puzzles. In some dreams i go in them, in others i have to choose if i want to but i dont, because im terrified.  This is the kind of film, I need to watch. Loved Cube series and I guess that's where most of my dreams came from",0,0,DethronerX,6dSKUoV0SNI,0.19285714285714284,2019-01-10 07:17:51,False,True
2019-01-10T10:58:29,Rated pg 13,0,0,Wyatt 0451,6dSKUoV0SNI,0.0,2019-01-10 10:58:29,False,True
