timestamp,text,like_count,reply_count,author,trailer_id,sentiment_score,datetime,used_for_model,used_for_visualization
2018-10-24T07:45:01,Is it me or did this give the whole movie away!?,0,0,Sarah Horne,6dSKUoV0SNI,0.25,2018-10-24 07:45:01,True,True
2018-10-24T07:56:04,Reminds me the Spanish thriller Fermat's Room,0,0,Fedon Bouzbas,6dSKUoV0SNI,0.0,2018-10-24 07:56:04,True,True
2018-10-24T08:02:08,😍😍😍,0,0,Brendel Ugao-Ugao,6dSKUoV0SNI,0.0,2018-10-24 08:02:08,True,True
2018-10-24T08:27:16,This looks great I can’t wait,0,0,Xen,6dSKUoV0SNI,0.8,2018-10-24 08:27:16,True,True
2018-10-24T08:27:38,SO SAW WITH A DIFFERENT NAME,0,0,OOF 559,6dSKUoV0SNI,0.0,2018-10-24 08:27:38,True,True
2018-10-24T08:32:36,I know! They are in virtual world! Matrix...  Am I right?,0,0,Hypersomniac,6dSKUoV0SNI,0.2857142857142857,2018-10-24 08:32:36,True,True
2018-10-24T08:37:21,"I love escape room games, so I'll watch this for sure",0,0,dial,6dSKUoV0SNI,0.5,2018-10-24 08:37:21,True,True
2018-10-24T08:37:53,#Saw  MOVIE  with  #LOGICALthinking,0,0,ATmakers,6dSKUoV0SNI,0.0,2018-10-24 08:37:53,True,True
2018-10-24T08:38:39,"I wanna play a game, says Jigsaw.",0,0,xXxeroOo,6dSKUoV0SNI,-0.4,2018-10-24 08:38:39,True,True
2018-10-24T08:45:27,Like the cube.  But this is more Sherlock Holmes,0,0,u Zan,6dSKUoV0SNI,0.5,2018-10-24 08:45:27,True,True
2018-10-24T09:00:30,Pass,0,0,Brandon Ninja,6dSKUoV0SNI,0.0,2018-10-24 09:00:30,True,True
2018-10-24T09:08:28,Oooooh similar concept to a Spanish film from years ago called El Habitacion de Fermat... intriguing,0,0,StillRebeccaa,6dSKUoV0SNI,0.10000000000000002,2018-10-24 09:08:28,True,True
2018-10-24T10:22:41,So Cube+Saw+Cabin in the woods? I'm interested.,0,0,Architects XIII,6dSKUoV0SNI,0.25,2018-10-24 10:22:41,True,True
2018-10-24T10:26:19,Can't wait to see it,0,0,Taima M,6dSKUoV0SNI,0.0,2018-10-24 10:26:19,True,True
2018-10-24T11:12:28,Its my birth day can i get a like pls.,0,0,danielyn tripping,6dSKUoV0SNI,0.0,2018-10-24 11:12:28,True,True
2018-10-24T11:33:29,Sony needs to learn how to properly make a trailer without giving away chunks of the movie,0,0,Shane Anonymous,6dSKUoV0SNI,0.0,2018-10-24 11:33:29,True,True
2018-10-24T11:36:37,"This is truly coming for those who do not turn to God and to his books gospel torah and quran.... Satan is coming for you soon...soon you'll be trapped in his system and you'll have no escape....the only escape is NOW, you have to prepare your faith in God NOW, stop your sins, stop running aftert his world.....REPENT NOW",0,1,The Truth Is From God,6dSKUoV0SNI,-0.1,2018-10-24 11:36:37,True,True
2018-10-24T11:53:41,the cube with bigger space.,0,0,Michael G,6dSKUoV0SNI,0.0,2018-10-24 11:53:41,True,True
2018-10-24T12:02:55,The song reminds of Weeds! I miss this show... For the movie The end will be the death of everybody -_-,0,0,Dreamy Dreamy,6dSKUoV0SNI,0.0,2018-10-24 12:02:55,True,True
2018-10-24T12:03:52,"No Escape Room (2017) and Escape Room (2018), almost have the same name, almost same story, it's like dejavu.. But, has a little different between them, so U must see two of them to compare which better..  This situation was happened with ""Truth or Dare"" movie, have same names but different year,  2017's version and 2018's version.",0,0,Eros Josef Byrne,6dSKUoV0SNI,0.044642857142857144,2018-10-24 12:03:52,True,True
2018-10-24T12:13:39,I just see the whole movie in just 2 minutes 42 seconds they spoil the movie  I know who's gonna die and who's gonna survive from this  that's why I never watch the trailer before😡,0,0,Karanjeet Kainth,6dSKUoV0SNI,0.2,2018-10-24 12:13:39,True,True
2018-10-24T12:17:29,"Looks decent, director hasn't done anything good yet though. But it's funny that a movie with the exact same name came out last year.",0,0,Raphael Alexander,6dSKUoV0SNI,0.22777777777777777,2018-10-24 12:17:29,True,True
2018-10-24T12:19:05,Dis is magnificent *gets box goes to a room get locked dies* dats basically da movie😂,45,1,Cyrus Wayne Guerrero,6dSKUoV0SNI,1.0,2018-10-24 12:19:05,True,True
2018-10-24T12:21:54,so why the f**k they are outside of the house if they are in the ESCAPE ROOM. If they're outside then aren't they already escaped from the room? so if that room is that big in size so why it iz called room?,0,0,Karanjeet Kainth,6dSKUoV0SNI,0.0,2018-10-24 12:21:54,True,True
2018-10-24T12:38:32,this is like the third time i saw a movie called escape room.,0,0,michiel,6dSKUoV0SNI,0.0,2018-10-24 12:38:32,True,True
2018-10-24T12:54:38,Its SAW having a threesome with CUBE and CABIN IN THE WOODS but doesn't know who the baby daddy is.......lol. Looks GREAT! 👌👍 I'm buying tickets for the whole family...... 😄,0,0,D-Town 7639,6dSKUoV0SNI,0.6,2018-10-24 12:54:38,True,True
2018-10-24T13:09:45,I wonder what the song name,0,0,Ogan,6dSKUoV0SNI,0.0,2018-10-24 13:09:45,True,True
2018-10-24T13:38:59,I got a free movie screening to see this I'm watching it tonight,0,0,That_savage _khalil,6dSKUoV0SNI,0.4,2018-10-24 13:38:59,True,True
2018-10-24T14:18:27,"Saw this in an ad, surprisingly, I didn't skip it.",0,0,Mythical Kitty,6dSKUoV0SNI,0.7,2018-10-24 14:18:27,True,True
2018-10-24T15:05:01,Maybe this escape room was made by drunk Rick,0,0,CoolGuyMav,6dSKUoV0SNI,-0.5,2018-10-24 15:05:01,True,True
2018-10-24T15:34:33,Spoiler ALERT~  ... ... ... Someone gonna die,0,0,Yue Yeon,6dSKUoV0SNI,0.0,2018-10-24 15:34:33,True,True
2018-10-24T15:42:52,No way Fahrenheit 451 is mentioned after I just discovered it last week... They’re watching me 😂,0,0,CptnXClp2,6dSKUoV0SNI,0.0,2018-10-24 15:42:52,True,True
2018-10-24T16:10:08,Sooooo basically saw,0,0,Kluke 79,6dSKUoV0SNI,0.0,2018-10-24 16:10:08,True,True
2018-10-24T16:40:32,This kind of movies are already cliché,0,0,Applepie Lover,6dSKUoV0SNI,0.6,2018-10-24 16:40:32,True,True
2018-10-24T16:57:19,This looks like a good movie 🤙🏽,0,0,BrandonFoamposite,6dSKUoV0SNI,0.7,2018-10-24 16:57:19,True,True
2018-10-24T16:58:50,Jigsaw who he's cancelled,0,0,eugenio anzures,6dSKUoV0SNI,0.0,2018-10-24 16:58:50,True,True
2018-10-24T17:42:53,#MinosEscapeRooms,0,0,Josiah Ade,6dSKUoV0SNI,0.0,2018-10-24 17:42:53,True,True
2018-10-24T18:03:06,Cool,0,0,H R L,6dSKUoV0SNI,0.35,2018-10-24 18:03:06,True,True
2018-10-24T18:32:08,Saw level II !!!!,0,0,Abel Rivas,6dSKUoV0SNI,0.0,2018-10-24 18:32:08,True,True
2018-10-24T18:53:26,Im going to theaters to see this!,0,0,Marisa williams,6dSKUoV0SNI,0.0,2018-10-24 18:53:26,True,True
2018-10-24T18:56:29,JigSaw+Cube=Rubik Cube,436,8,Astray,6dSKUoV0SNI,0.0,2018-10-24 18:56:29,True,True
2018-10-24T19:02:59,😱😱😱😱👍💖💖,0,0,Lorena Torralba,6dSKUoV0SNI,0.0,2018-10-24 19:02:59,True,True
2018-10-24T19:15:47,The weeds theme song lmao,0,0,Real & Bitchy,6dSKUoV0SNI,0.6,2018-10-24 19:15:47,True,True
2018-10-24T19:47:35,"After Daredevil and True Blood, I'm up for anything with Deborah Ann Woll in it. But I know exactly how this is going to end....I think.  Either, who's ever left, is going to leave ""scared forever"" but a changed person. Or who's ever left is going to THINK they left the room but, as the move closes we, the audience, are the only ones who can see that... DUN DUN DUUUUUN,  THEY'RE STILL IN THE ROOM AND THEY DON'T EVEN REALIZE IT, *GAAAASP*. Or something like that, lol.",0,0,King 2202,6dSKUoV0SNI,0.19999999999999998,2018-10-24 19:47:35,True,True
2018-10-24T20:08:56,This movie is like Micheal Douglas the game with a twist,0,0,Miracles Follow me,6dSKUoV0SNI,-0.4,2018-10-24 20:08:56,True,True
2018-10-24T20:39:07,Fermat's Room?,0,0,Mike Okkerts,6dSKUoV0SNI,0.0,2018-10-24 20:39:07,True,True
2018-10-24T20:52:49,What the hell does Weeds have to do with it???,0,0,Vel Luxx_,6dSKUoV0SNI,0.0,2018-10-24 20:52:49,True,True
2018-10-24T21:02:49,Awe why 2019 why not now!!! This movie looks CRAZY GOOD,0,0,Ms. Ladi,6dSKUoV0SNI,0.04999999999999999,2018-10-24 21:02:49,True,True
2018-10-24T21:07:43,SAW done better..,0,0,Bob Jeffery Gunners,6dSKUoV0SNI,0.5,2018-10-24 21:07:43,True,True
2018-10-24T21:14:51,rated r i guarantee id rather play a family friendly one,0,0,StephenR3,6dSKUoV0SNI,0.375,2018-10-24 21:14:51,True,True
2018-10-24T21:59:45,"Why is it that the first time I do an escape, there is a trailer for that immediatly",1,0,Fif Gen,6dSKUoV0SNI,0.25,2018-10-24 21:59:45,True,True
2018-10-24T22:16:36,Saw who????,0,0,Benjamin Blumin,6dSKUoV0SNI,0.0,2018-10-24 22:16:36,True,True
2018-10-24T22:41:17,Looking so good,0,0,Ugly Girl,6dSKUoV0SNI,0.7,2018-10-24 22:41:17,True,True
2018-10-24T22:50:46,musics good lol,0,0,아가소피 -,6dSKUoV0SNI,0.75,2018-10-24 22:50:46,True,True
2018-10-24T22:55:55,"Looks really, really good and fun, but......... Sony.....",0,0,MavenCree,6dSKUoV0SNI,0.5,2018-10-24 22:55:55,True,True
2018-10-24T22:57:45,Saw (Clean Version),0,0,Ryanna Camarena,6dSKUoV0SNI,0.3666666666666667,2018-10-24 22:57:45,True,True
2018-10-24T23:09:33,"Wow, not a remake!",0,0,Rolwhite,6dSKUoV0SNI,0.125,2018-10-24 23:09:33,True,True
2018-10-24T23:15:24,What the game is becoming a movie? Omg no,0,0,PuppyLuvU2,6dSKUoV0SNI,0.024999999999999994,2018-10-24 23:15:24,True,True
2018-10-24T23:51:53,"Karen Page ! Just finished Daredevil’s new season, the next time I see her it better be in Punisher",0,0,Aimy Realaileean,6dSKUoV0SNI,0.21212121212121213,2018-10-24 23:51:53,True,True
2018-10-24T23:54:05,This movie was already made but this look like a better version of it,0,0,chevy noname,6dSKUoV0SNI,0.5,2018-10-24 23:54:05,True,True
2018-10-25T00:05:49,So like that one dumb movie The Cube?,0,0,viv t.,6dSKUoV0SNI,-0.375,2018-10-25 00:05:49,True,True
2018-10-25T00:13:42,Only one million boi let me add 3 more zeros.,0,0,maria salazar,6dSKUoV0SNI,0.25,2018-10-25 00:13:42,True,True
2018-10-25T00:34:54,The next horror maze is gonna be shooketh,0,0,Cyrus Wayne Guerrero,6dSKUoV0SNI,0.0,2018-10-25 00:34:54,True,True
2018-10-25T00:48:05,This is the hunger games on LSD,0,0,V L,6dSKUoV0SNI,0.0,2018-10-25 00:48:05,True,True
2018-10-25T00:48:34,Its Cube with an Extra step.. haha,0,0,Arther Doyle,6dSKUoV0SNI,0.1,2018-10-25 00:48:34,True,True
2018-10-25T00:57:13,SAW IS SHAKINGGGGGGG,0,0,lee carlo,6dSKUoV0SNI,0.0,2018-10-25 00:57:13,True,True
2018-10-25T00:59:34,This better me as good as the trailer paints it out to be,0,0,Harian,6dSKUoV0SNI,0.6,2018-10-25 00:59:34,True,True
2018-10-25T01:00:33,"Everyone in this comment section have been saying that this movie looks like SAW, Cube, and The Cabin in the Woods. It actually looks like... ummm... The Cabin in the Woods I guess?",0,0,RazorMarioGaming YT,6dSKUoV0SNI,0.0,2018-10-25 01:00:33,True,True
2018-10-25T01:04:57,Isnt this based off a creepypasta room 9 or something ?,0,0,nawls one,6dSKUoV0SNI,0.0,2018-10-25 01:04:57,True,True
2018-10-25T01:07:10,Well time to say goodbye to my birthday party,0,0,Emma White,6dSKUoV0SNI,0.0,2018-10-25 01:07:10,True,True
2018-10-25T01:09:21,Zahid hahahahaha,0,0,MxHC Music Promotions,6dSKUoV0SNI,0.2,2018-10-25 01:09:21,True,True
2018-10-25T01:17:03,"Pass. Nothing, but pointless violence with a barely there plot like most of those crappy Saw movies.",0,0,Sketchcook81,6dSKUoV0SNI,0.09999999999999999,2018-10-25 01:17:03,True,True
2018-10-25T01:26:33,This movie looks like if saw and cube had a baby,0,0,Macon Davis,6dSKUoV0SNI,0.0,2018-10-25 01:26:33,True,True
2018-10-25T01:34:56,I think I'm gonna love it !!,0,0,Dewi Ambariny,6dSKUoV0SNI,0.78125,2018-10-25 01:34:56,True,True
2018-10-25T01:40:56,So Zeros Escape anyone?,0,0,Sigma,6dSKUoV0SNI,0.0,2018-10-25 01:40:56,True,True
2018-10-25T01:59:52,why they revealed all 😥,0,0,Different Creature,6dSKUoV0SNI,0.0,2018-10-25 01:59:52,True,True
2018-10-25T02:01:55,I WANT TO WATCH THIS OML,0,0,Alycia Khor,6dSKUoV0SNI,0.0,2018-10-25 02:01:55,True,True
2018-10-25T02:11:33,The next jigsaw,0,0,Brayden K.,6dSKUoV0SNI,0.0,2018-10-25 02:11:33,True,True
2018-10-25T02:19:12,New saw!!!!???,0,0,Nate Shxyh,6dSKUoV0SNI,0.33291903409090906,2018-10-25 02:19:12,True,True
2018-10-25T02:24:55,"so basically ""the cube ""      ...(0_0)",0,0,FSK1138,6dSKUoV0SNI,0.0,2018-10-25 02:24:55,True,True
2018-10-25T02:29:21,Adirindhi...,0,0,Raj Hub,6dSKUoV0SNI,0.0,2018-10-25 02:29:21,True,True
2018-10-25T02:37:15,Did you mean Jigsaw?,0,0,Nicole,6dSKUoV0SNI,-0.3125,2018-10-25 02:37:15,True,True
2018-10-25T02:38:18,No cap but this really looks good,0,0,Nicole,6dSKUoV0SNI,0.44999999999999996,2018-10-25 02:38:18,True,True
2018-10-25T02:56:22,So its saw? But less blood?,0,0,Heronate 8,6dSKUoV0SNI,-0.16666666666666666,2018-10-25 02:56:22,True,True
2018-10-25T03:07:46,"Is the Indian kid the same dude who goes ""eating spicy goodness like a boss!"" because if so this is epic.",0,0,Mr.Pugsley Games,6dSKUoV0SNI,0.05,2018-10-25 03:07:46,True,True
2018-10-25T03:31:09,Yup I wanna watch it,0,0,PinkNinjaBunny,6dSKUoV0SNI,0.0,2018-10-25 03:31:09,True,True
2018-10-25T03:42:34,Nigahiga?,3,0,SuperWacky15,6dSKUoV0SNI,0.0,2018-10-25 03:42:34,True,True
2018-10-25T03:43:31,So its a remake of the cube? Lol,0,0,aldwin08sls,6dSKUoV0SNI,0.8,2018-10-25 03:43:31,True,True
2018-10-25T03:49:06,so this is kinda like SAW but you don't have to save other people to save your own life,0,0,reina williams-arana,6dSKUoV0SNI,0.2375,2018-10-25 03:49:06,True,True
2018-10-25T03:49:12,awesome,0,0,reina williams-arana,6dSKUoV0SNI,1.0,2018-10-25 03:49:12,True,True
2018-10-25T03:50:03,They definitely kind of gave away the reason why they were all chosen in this preview.,0,0,Eden,6dSKUoV0SNI,0.6,2018-10-25 03:50:03,True,True
2018-10-25T03:58:09,Man... I want this but not all jumpscary and murderery,0,0,Truth Is Relative,6dSKUoV0SNI,0.0,2018-10-25 03:58:09,True,True
2018-10-25T04:06:36,Exam?,0,0,the boy next door,6dSKUoV0SNI,0.0,2018-10-25 04:06:36,True,True
2018-10-25T04:13:34,Next up...the arcade,0,0,RayzePhayze,6dSKUoV0SNI,0.0,2018-10-25 04:13:34,True,True
2018-10-25T04:17:50,Whelp this is the death of this industry,0,0,lightkingz,6dSKUoV0SNI,0.0,2018-10-25 04:17:50,True,True
2018-10-25T04:19:38,Well we know who dies first,0,0,Jonathan Luna,6dSKUoV0SNI,0.25,2018-10-25 04:19:38,True,True
2018-10-25T04:26:07,Downgraded saw?,0,0,gageisok,6dSKUoV0SNI,0.0,2018-10-25 04:26:07,True,True
2018-10-25T04:27:28,"you all know a creepypasta called ""no end house"" ?",0,0,Boop The Flute,6dSKUoV0SNI,0.0,2018-10-25 04:27:28,True,True
2018-10-25T04:33:14,they literally just made this movie a year ago. screw hollywood...at least they used to wait a while for people to almost forget about a movie they already did. i mean c'mon grow an original thought! :o,0,0,Kewl Beans,6dSKUoV0SNI,-0.02343750000000001,2018-10-25 04:33:14,True,True
2018-10-25T04:36:32,"Hellreaiser, Saw, Cabin in the Woods, Cube. Can anyone else name a movie they ripped off?",0,0,John Brown,6dSKUoV0SNI,0.0,2018-10-25 04:36:32,True,True
2018-10-25T04:39:19,Signs this movie will suck: 1. Sony 2. January 3. Sony again.,0,0,John Brown,6dSKUoV0SNI,0.0,2018-10-25 04:39:19,True,True
2018-10-25T05:01:09,Chief Told Me About This..That’s Why I’m Here,0,0,ImRocket,6dSKUoV0SNI,0.0,2018-10-25 05:01:09,True,True
2018-10-25T05:03:51,"Well that spoiled most of the film, so now I don't have to see it.  I don't understand why trailers do this.",0,0,J T,6dSKUoV0SNI,0.5,2018-10-25 05:03:51,True,True
2018-10-25T05:11:44,I bet the guy with glasses die first and only 2 survives  Cause 1 surviving is being a douche and they can all survive,0,0,THE_MASTEH_GAMER,6dSKUoV0SNI,0.125,2018-10-25 05:11:44,True,True
2018-10-25T05:32:37,Why can’t you make good superhero movies besides venom and a good new magneto and Logan? Like I don’t understand,0,0,Cesar Gonzalez,6dSKUoV0SNI,0.5121212121212121,2018-10-25 05:32:37,True,True
2018-10-25T05:44:47,It's zahid from atypical and Karen Page from Daredevil!,0,0,pepito perez,6dSKUoV0SNI,0.0,2018-10-25 05:44:47,True,True
2018-10-25T05:54:34,This is just the movie Cube rip off. Boi Sony give that credit! 🍿,0,0,Tom Tom,6dSKUoV0SNI,0.0,2018-10-25 05:54:34,True,True
2018-10-25T06:26:13,I like Sony for risks they take.. remember Jumanji?,0,0,Bhavesh Jain,6dSKUoV0SNI,0.0,2018-10-25 06:26:13,True,True
2018-10-25T06:29:27,YEEEEE,0,0,narrationsbyb,6dSKUoV0SNI,0.0,2018-10-25 06:29:27,True,True
2018-10-25T06:33:44,"*Prediction for the end*  Someone is going to escape the room, only to be stuck in ANOTHER room to escape, camera gets close to that person's face....... The end.   -Escape Room 2 coming out in a year or 2. 😉",0,0,Alex Hollywood,6dSKUoV0SNI,0.0,2018-10-25 06:33:44,True,True
2018-10-25T09:22:26,Reminds me on SAW,0,0,Darko Prerad,6dSKUoV0SNI,0.0,2018-10-25 09:22:26,True,True
2018-10-25T09:28:41,"Sale Dijual Property Tanah Land, Rumah House, Apartemen, Kantor Office, Gedung Tower, Ruko, Hotel di Jakarta 08176881555 , WEB: HouseJakarta.com , JakartaMansion.com , ApartmentsJakarta.com",0,0,ridho housejakarta,6dSKUoV0SNI,0.0,2018-10-25 09:28:41,True,True
2018-10-25T09:33:17,Voluntary saw,0,0,Kirvan Pody,6dSKUoV0SNI,0.0,2018-10-25 09:33:17,True,True
2018-10-25T10:49:32,U mean Saw....,0,0,Rex Mckinnis,6dSKUoV0SNI,-0.3125,2018-10-25 10:49:32,True,True
2018-10-25T11:38:08,The escape room nextdoor to my shop is pretty butthurt this is coming out.,0,0,Phosis9,6dSKUoV0SNI,0.25,2018-10-25 11:38:08,True,True
2018-10-25T12:00:54,So basically saw but the guy used more money and time and brainpower to make the tortures,0,0,Edgar Nello,6dSKUoV0SNI,0.5,2018-10-25 12:00:54,True,True
2018-10-25T12:15:39,1:41 pretty sure he doesn't make it.,0,0,Tavionn,6dSKUoV0SNI,0.375,2018-10-25 12:15:39,True,True
2018-10-25T12:32:53,*This exactly the movie I’ve been waiting for*,3,0,Divo Galindra,6dSKUoV0SNI,0.25,2018-10-25 12:32:53,True,True
2018-10-25T13:35:14,I will watch this movie for Zahid.,0,0,Pancho Hernandez,6dSKUoV0SNI,0.0,2018-10-25 13:35:14,True,True
2018-10-25T13:36:02,Hollywood has run out of ideas man. Copying Intouchables (Upside) and now SAW.,0,1,Wex Qlp,6dSKUoV0SNI,0.0,2018-10-25 13:36:02,True,True
2018-10-25T14:08:24,Add a Saw easter egg in this movie,0,0,Beastmode Activate,6dSKUoV0SNI,0.0,2018-10-25 14:08:24,True,True
2018-10-25T14:10:51,So... Saw?,0,0,Soup Time,6dSKUoV0SNI,0.0,2018-10-25 14:10:51,True,True
2018-10-25T14:35:12,"Im watching this, no question about it.",0,0,Tc,6dSKUoV0SNI,0.0,2018-10-25 14:35:12,True,True
2018-10-25T14:54:56,Super crazy movie,0,0,akshay jain,6dSKUoV0SNI,-0.13333333333333333,2018-10-25 14:54:56,True,True
2018-10-25T15:11:09,So Saw and The Cube made a movie.... how original.,0,0,j,6dSKUoV0SNI,0.375,2018-10-25 15:11:09,True,True
2018-10-25T15:15:50,Belko experiment v2,0,0,Drug Enforcement Administration,6dSKUoV0SNI,0.0,2018-10-25 15:15:50,True,True
2018-10-25T15:51:17,is this part 2 of the escape room??,0,0,Regan wolf,6dSKUoV0SNI,0.0,2018-10-25 15:51:17,True,True
2018-10-25T16:02:45,You guys should've had the cube escape people work on this...,0,0,david 04x,6dSKUoV0SNI,0.0,2018-10-25 16:02:45,True,True
2018-10-25T16:03:14,Can’t wait this is definitely something different,0,0,roblox bloxburg,6dSKUoV0SNI,0.0,2018-10-25 16:03:14,True,True
2018-10-25T16:04:56,This awesome but they revealed too much,0,0,Emily Belkowitz,6dSKUoV0SNI,0.6,2018-10-25 16:04:56,True,True
2018-10-25T16:22:25,I am the owner of Sony (Son) and do not allow you to publish anything about the company,0,0,Elissa Sherman,6dSKUoV0SNI,0.0,2018-10-25 16:22:25,True,True
2018-10-25T16:32:33,Like a Cube ..,0,0,Cem A.,6dSKUoV0SNI,0.0,2018-10-25 16:32:33,True,True
2018-10-25T17:33:33,Reminds me of cube,0,0,Mary May Garcia,6dSKUoV0SNI,0.0,2018-10-25 17:33:33,True,True
2018-10-25T18:05:39,Ouuuuu,0,0,Travis Evans,6dSKUoV0SNI,0.0,2018-10-25 18:05:39,True,True
2018-10-25T18:08:16,*saw has left the chat*,0,0,Monica Ivette,6dSKUoV0SNI,0.0,2018-10-25 18:08:16,True,True
2018-10-25T18:19:16,only a million dollars?,0,0,Pringle Hunter,6dSKUoV0SNI,0.0,2018-10-25 18:19:16,True,True
2018-10-25T18:45:37,STRAIGHT TO NETFLIX!!!,0,0,Exxes Hauffen,6dSKUoV0SNI,0.390625,2018-10-25 18:45:37,True,True
2018-10-25T18:49:36,the guy watched too much SAW,0,0,Loïc Leung,6dSKUoV0SNI,0.2,2018-10-25 18:49:36,True,True
2018-10-25T18:56:40,Saw 2.0,0,0,Othmane,6dSKUoV0SNI,0.0,2018-10-25 18:56:40,True,True
2018-10-25T19:19:18,Omg this looks like a steroid version of the CUBE! Amazing! I love escape rooms.  Talk about pressure. Lol,0,0,Muse,6dSKUoV0SNI,0.6833333333333332,2018-10-25 19:19:18,True,True
2018-10-25T19:30:23,Thats pretty good,0,0,Pepto Juice,6dSKUoV0SNI,0.475,2018-10-25 19:30:23,True,True
2018-10-25T20:25:09,Lawrence!❤️✊🏿,0,0,Callhermsross,6dSKUoV0SNI,0.0,2018-10-25 20:25:09,True,True
2018-10-25T21:33:16,Judyyy,0,0,JosiahOwO,6dSKUoV0SNI,0.0,2018-10-25 21:33:16,True,True
2018-10-25T22:21:52,Saw?,1,0,santiago xd,6dSKUoV0SNI,0.0,2018-10-25 22:21:52,True,True
2018-10-25T22:22:29,Saw and deep web boxes have a kid this is the result XD,1,2,santiago xd,6dSKUoV0SNI,0.0,2018-10-25 22:22:29,True,True
2018-10-25T22:41:20,Doesn’t this remind you of saw/jigsaw franchise,5,0,Unknown,6dSKUoV0SNI,0.0,2018-10-25 22:41:20,True,True
2018-10-25T22:49:22,This looks really interesting,0,0,IF IT WAS,6dSKUoV0SNI,0.5,2018-10-25 22:49:22,True,True
2018-10-25T23:04:37,Would you rather part two looks amazing!!,0,0,Sofia.timbol,6dSKUoV0SNI,0.9375000000000001,2018-10-25 23:04:37,True,True
2018-10-25T23:20:41,Seen a film pretty much just like this on Netflix last year or so.,0,0,Life-Row-Toll,6dSKUoV0SNI,0.15,2018-10-25 23:20:41,True,True
2018-10-25T23:53:12,I want to see this so badly and I bet their manager put them up to this,1,0,Missy Bizzy,6dSKUoV0SNI,-0.6999999999999998,2018-10-25 23:53:12,True,True
2018-10-25T23:58:45,Escape room? More like saw 9,0,0,Cynthius,6dSKUoV0SNI,0.5,2018-10-25 23:58:45,True,True
2018-10-26T00:15:05,It's like Cube meets Saw.,0,0,Amanda,6dSKUoV0SNI,0.0,2018-10-26 00:15:05,True,True
2018-10-26T00:26:25,Only APUSH kids know,0,0,Cole Masterson,6dSKUoV0SNI,0.0,2018-10-26 00:26:25,True,True
2018-10-26T00:28:53,Original?three letters.s a w,0,0,Drowned does music,6dSKUoV0SNI,0.0,2018-10-26 00:28:53,True,True
2018-10-26T00:31:15,Pulse 2014,0,0,BrothaNBlue,6dSKUoV0SNI,0.0,2018-10-26 00:31:15,True,True
2018-10-26T00:52:09,"I love puzzles, and this looks so good.",0,0,Birdie Pitchfeather,6dSKUoV0SNI,0.6,2018-10-26 00:52:09,True,True
2018-10-26T01:04:52,good to see all my good Saw and Cube friends posting again....  HOW YA'LL BEEN!?,0,0,jds o,6dSKUoV0SNI,0.7875,2018-10-26 01:04:52,True,True
2018-10-26T01:19:36,*OH* now I REALLY wanna do an Escape Room,0,0,Profan1ty,6dSKUoV0SNI,0.2,2018-10-26 01:19:36,True,True
2018-10-26T01:49:44,I always thought they should make an escape room movie glad they did,0,0,Lilacprophecy,6dSKUoV0SNI,0.5,2018-10-26 01:49:44,True,True
2018-10-26T01:55:20,Cool another one,0,0,derpipotatoe,6dSKUoV0SNI,0.35,2018-10-26 01:55:20,True,True
2018-10-26T01:59:11,Is this the American version of cube!!!!,1,0,reli:c,6dSKUoV0SNI,0.0,2018-10-26 01:59:11,True,True
2018-10-26T01:59:18,*OMG the “ticky tacky little boxes” song at the beginning of this trailer gave me an INSTANT flashback to the 2018 APUSH exam* 😂😂😂,0,0,Cindy Liu,6dSKUoV0SNI,-0.09375,2018-10-26 01:59:18,True,True
2018-10-26T02:21:06,When I saw this I immediately thought of The Call Up,0,0,Marcella Robinson,6dSKUoV0SNI,0.0,2018-10-26 02:21:06,True,True
2018-10-26T03:42:51,I just watch a film off of Netflix which storyline was exactly the Same the only difference is that in that movie video gamers instead of Mazers... should be interesting,0,0,Anthony Brown,6dSKUoV0SNI,0.1875,2018-10-26 03:42:51,True,True
2018-10-26T05:46:01,I swear I SAW IT 2,0,0,Akkiiiking x,6dSKUoV0SNI,0.0,2018-10-26 05:46:01,True,True
2018-10-26T07:23:37,"Marketing 101...this should’ve came out at the end of October, beginning of November. Most people don’t go out much during January since the majority of the country is under some type of snow or ice! People stay home mostly. During November and December people are out and about shopping and entertaining friends and family!",0,0,Tadesko1,6dSKUoV0SNI,0.46875,2018-10-26 07:23:37,True,True
2018-10-26T07:50:25,this looks amazing tbh,3,0,Banu,6dSKUoV0SNI,0.6000000000000001,2018-10-26 07:50:25,True,True
2018-10-26T10:24:26,dang this is hot,0,0,christimduh,6dSKUoV0SNI,0.25,2018-10-26 10:24:26,True,True
2018-10-26T11:30:17,So saw,1,0,I still remember 3rd of December.,6dSKUoV0SNI,0.0,2018-10-26 11:30:17,True,True
2018-10-26T12:44:00,Is the 8-ball room A LIFE-SIZED PINBALL TABLE??????????????????,0,0,Spiel Zeug,6dSKUoV0SNI,0.0,2018-10-26 12:44:00,True,True
2018-10-26T14:56:44,OMG,0,0,emily torres,6dSKUoV0SNI,0.0,2018-10-26 14:56:44,True,True
2018-10-26T14:57:49,This looks like a secret Saw movie,0,0,Yote,6dSKUoV0SNI,-0.4,2018-10-26 14:57:49,True,True
2018-10-26T15:15:03,Looks better than the other Escape Room movie that came out last year,0,0,nangke,6dSKUoV0SNI,0.125,2018-10-26 15:15:03,True,True
2018-10-26T15:17:56,Whoohoo Jessica from True Blood!,0,0,phil murphy,6dSKUoV0SNI,0.4375,2018-10-26 15:17:56,True,True
2018-10-26T16:28:41,Great! They showed the whole movie in one trailer. Smh,0,0,Anika Q,6dSKUoV0SNI,0.6,2018-10-26 16:28:41,True,True
2018-10-26T18:24:55,Me wanting to go to an escape room? Yeah that’s cancelled sorry fellas,0,0,Sara Stark,6dSKUoV0SNI,-0.5,2018-10-26 18:24:55,True,True
2018-10-26T18:25:24,Where is The Punisher when Karen Paige needs him,0,0,Sara Stark,6dSKUoV0SNI,0.0,2018-10-26 18:25:24,True,True
2018-10-26T18:33:06,Weeds intro made me smile! 😁,0,0,Gerard Veen,6dSKUoV0SNI,0.375,2018-10-26 18:33:06,True,True
2018-10-26T18:39:19,"Saw meets Cabin In The Woods? Okay, I'm into it!",0,0,Gaaraloverr1,6dSKUoV0SNI,0.625,2018-10-26 18:39:19,True,True
2018-10-26T19:12:51,So anybody know how to solve the slider puzzle on the website yet or,0,0,Brynn Harris,6dSKUoV0SNI,0.0,2018-10-26 19:12:51,True,True
2018-10-26T19:49:35,Newer version of the cube,1,0,Ruguru K,6dSKUoV0SNI,0.0,2018-10-26 19:49:35,True,True
2018-10-26T20:41:25,The song at the beginning about the little boxes reminds me of the 2018 AP US History Exam lol,2,0,paz jjk,6dSKUoV0SNI,0.30625,2018-10-26 20:41:25,True,True
