timestamp,text,like_count,reply_count,author,trailer_id,sentiment_score,datetime,used_for_model,used_for_visualization
2018-10-19T14:01:41,Hmmm its really good,3,0,Alptuğ Özdemir,6dSKUoV0SNI,0.7,2018-10-19 14:01:41,True,True
2018-10-19T14:02:28,Hi,2,0,janatha hennayaka,6dSKUoV0SNI,0.0,2018-10-19 14:02:28,True,True
2018-10-19T14:02:33,wow!,5,0,Vaibhav Sharma,6dSKUoV0SNI,0.125,2018-10-19 14:02:33,True,True
2018-10-19T14:02:51,3rd comment,2,0,janatha hennayaka,6dSKUoV0SNI,0.0,2018-10-19 14:02:51,True,True
2018-10-19T14:03:23,Better than Escape Room from Voltage Pictures.,24,0,Arkadiusz Kucharski,6dSKUoV0SNI,0.5,2018-10-19 14:03:23,True,True
2018-10-19T14:03:39,Nice!,4,0,Ramswarup Dadhich,6dSKUoV0SNI,0.75,2018-10-19 14:03:39,True,True
2018-10-19T14:04:08,Wow,3,0,Acuan05,6dSKUoV0SNI,0.1,2018-10-19 14:04:08,True,True
2018-10-19T14:04:10,Not bad.. 😊😊,2,0,Manas Ranjan,6dSKUoV0SNI,0.3499999999999999,2018-10-19 14:04:10,True,True
2018-10-19T14:04:43,What kind of SAW movie is this??? 😲,806,21,Sanam Dutta,6dSKUoV0SNI,0.6,2018-10-19 14:04:43,True,True
2018-10-19T14:04:45,"Omg, its the girl from 'Lost in Space' Love her!",8,2,Sponge Jem,6dSKUoV0SNI,0.625,2018-10-19 14:04:45,True,True
2018-10-19T14:06:50,who is hyped for this,103,11,Art of cinema,6dSKUoV0SNI,0.0,2018-10-19 14:06:50,True,True
2018-10-19T14:07:46,G(old),0,0,Chris Canavan,6dSKUoV0SNI,0.0,2018-10-19 14:07:46,True,True
2018-10-19T14:08:03,Best triller movie ever..,1,0,Mudassir Ahamed VM,6dSKUoV0SNI,1.0,2018-10-19 14:08:03,True,True
2018-10-19T14:08:07,I've seen Room 1408 already 😁,0,0,Gerard Freeman,6dSKUoV0SNI,0.0,2018-10-19 14:08:07,True,True
2018-10-19T14:08:10,Wow 😱😱 superb trailer ❤️🔥🔥👌,2,0,PK.S Reacts,6dSKUoV0SNI,0.55,2018-10-19 14:08:10,True,True
2018-10-19T14:08:16,"Am loving this movie can't wait to watch, it reminds me of jigsaw",24,0,Shanty Hamilton,6dSKUoV0SNI,0.6,2018-10-19 14:08:16,True,True
2018-10-19T14:08:47,Nice,0,0,Fazemike 16,6dSKUoV0SNI,0.6,2018-10-19 14:08:47,True,True
2018-10-19T14:08:48,Best of the best,0,0,Girish Jangam,6dSKUoV0SNI,1.0,2018-10-19 14:08:48,True,True
2018-10-19T14:10:48,Cube 1997,0,0,ashutosh tiwari,6dSKUoV0SNI,0.0,2018-10-19 14:10:48,True,True
2018-10-19T14:11:16,Is this the unofficial Cube sequel?,368,17,The Samm’s Club,6dSKUoV0SNI,0.0,2018-10-19 14:11:16,True,True
2018-10-19T14:11:17,Oh my god abe yaar meto ase khi bhi nhi jaane wala,0,0,Kailash Mali,6dSKUoV0SNI,0.0,2018-10-19 14:11:17,True,True
2018-10-19T14:11:27,Love it,5,0,Ганнибал TM,6dSKUoV0SNI,0.5,2018-10-19 14:11:27,True,True
2018-10-19T14:11:29,this actually looks great like im suprised,1,0,Julian Schmidt,6dSKUoV0SNI,0.4,2018-10-19 14:11:29,True,True
2018-10-19T14:11:50,Saw springs to mind.,0,0,darren jones,6dSKUoV0SNI,0.0,2018-10-19 14:11:50,True,True
2018-10-19T14:12:11,Wat lag li bhai,0,0,Kailash Mali,6dSKUoV0SNI,0.0,2018-10-19 14:12:11,True,True
2018-10-19T14:12:42,Finally one will Survive.. 😈😈😈,211,1,Ganesh Kesava,6dSKUoV0SNI,0.0,2018-10-19 14:12:42,True,True
2018-10-19T14:12:57,wow...,0,0,Creative WAYEJ,6dSKUoV0SNI,0.1,2018-10-19 14:12:57,True,True
2018-10-19T14:13:24,A little interested but it showed too much.,371,15,Michael Hall,6dSKUoV0SNI,0.08750000000000001,2018-10-19 14:13:24,True,True
2018-10-19T14:13:37,It looks like they mix the SAW with the THIRTEEN GHOST.....,1,0,_____,6dSKUoV0SNI,0.0,2018-10-19 14:13:37,True,True
2018-10-19T14:14:00,"Saw 9 looks so cool. upd. Oh, thanks for the likes.",168,6,flashglotok,6dSKUoV0SNI,0.275,2018-10-19 14:14:00,True,True
2018-10-19T14:14:58,https://youtu.be/veW5bRixzqM,0,0,Gaming Situation,6dSKUoV0SNI,0.0,2018-10-19 14:14:58,True,True
2018-10-19T14:15:18,Who's remember EXAM while watching this...,108,8,Antony ELL,6dSKUoV0SNI,0.0,2018-10-19 14:15:18,True,True
2018-10-19T14:15:56,Ooh i can't wait to see this movie!,1,0,prime 1209,6dSKUoV0SNI,0.0,2018-10-19 14:15:56,True,True
2018-10-19T14:16:24,Looks fun. 😊,0,0,Gwynbleidd __,6dSKUoV0SNI,0.3,2018-10-19 14:16:24,True,True
2018-10-19T14:16:59,*SONY IS FINALLY GIVING US HOPE!*  This actually looks great! Looking forward to watch this in January!,115,9,Jean Harold Magnait,6dSKUoV0SNI,0.3333333333333333,2018-10-19 14:16:59,True,True
2018-10-19T14:18:28,This movie actually looks good,1,0,MazinR,6dSKUoV0SNI,0.35,2018-10-19 14:18:28,True,True
2018-10-19T14:19:10,Trailer is so good....😍😘🤩🤩🤩,3,0,Satpal Pandwar,6dSKUoV0SNI,0.0,2018-10-19 14:19:10,True,True
2018-10-19T14:19:15,Basically saw almost??,0,0,Albiorix,6dSKUoV0SNI,0.0,2018-10-19 14:19:15,True,True
2018-10-19T14:19:15,This remember me of saw,1,0,Pratham Prabhudesai,6dSKUoV0SNI,0.0,2018-10-19 14:19:15,True,True
2018-10-19T14:19:38,Cant fckng wait!!!,0,0,Alias Roman,6dSKUoV0SNI,0.0,2018-10-19 14:19:38,True,True
2018-10-19T14:21:20,It like Saw ripoff... Meh.,2,3,Lucas Nascimento,6dSKUoV0SNI,0.0,2018-10-19 14:21:20,True,True
2018-10-19T14:21:47,I think it's a cool movie 👍🏼,0,0,FILRock BlackRider,6dSKUoV0SNI,0.35,2018-10-19 14:21:47,True,True
2018-10-19T14:21:55,The trailer is a movie i have seen that who’s going to Die first and i even know who will be the last survivor. This kind of trailers just ruins the movie fun for me.,0,0,Tabish Khokhar,6dSKUoV0SNI,0.2,2018-10-19 14:21:55,True,True
2018-10-19T14:24:33,"Wow, this trailer was edited perfectly!",65,4,filmmakerandrew,6dSKUoV0SNI,0.55,2018-10-19 14:24:33,True,True
2018-10-19T14:24:38,I blame Ryan Higa,0,0,Trishan Fernandopulle,6dSKUoV0SNI,0.0,2018-10-19 14:24:38,True,True
2018-10-19T14:25:20,mind-blowing teaser,0,0,MD Danish,6dSKUoV0SNI,0.0,2018-10-19 14:25:20,True,True
2018-10-19T14:25:40,Cube meets Saw,0,0,peter 525,6dSKUoV0SNI,0.0,2018-10-19 14:25:40,True,True
2018-10-19T14:26:15,Suggest me movies similar to this.  NB: I watched saw series.,0,0,Fun4 You,6dSKUoV0SNI,0.0,2018-10-19 14:26:15,True,True
2018-10-19T14:26:30,"Same concept, different story",0,0,vashisht kant,6dSKUoV0SNI,0.0,2018-10-19 14:26:30,True,True
2018-10-19T14:28:01,Creepy as hell,0,0,Salim Zighe,6dSKUoV0SNI,-0.5,2018-10-19 14:28:01,True,True
2018-10-19T14:28:14,Lol,0,0,Favio gramajo,6dSKUoV0SNI,0.8,2018-10-19 14:28:14,True,True
2018-10-19T14:28:16,Is this the cube sequel?!,0,0,Edit Station,6dSKUoV0SNI,0.0,2018-10-19 14:28:16,True,True
2018-10-19T14:28:48,PriORiTy mAiL,0,0,buzzerk 720,6dSKUoV0SNI,0.0,2018-10-19 14:28:48,True,True
2018-10-19T14:29:42,Yo what if this was a cube sequel that would be sooooo sickkk,0,0,Julian Schmidt,6dSKUoV0SNI,0.0,2018-10-19 14:29:42,True,True
2018-10-19T14:30:02,Saw again,0,0,Yash Das,6dSKUoV0SNI,0.0,2018-10-19 14:30:02,True,True
2018-10-19T14:30:35,When things get too immersive,1,0,Theheroneeded Willette,6dSKUoV0SNI,0.0,2018-10-19 14:30:35,True,True
2018-10-19T14:31:05,💨,0,0,Snek,6dSKUoV0SNI,0.0,2018-10-19 14:31:05,True,True
2018-10-19T14:31:41,JigSaw was here.,0,0,Alberth,6dSKUoV0SNI,0.0,2018-10-19 14:31:41,True,True
2018-10-19T14:31:47,It's like SAW...🤔,0,0,aimin,6dSKUoV0SNI,0.0,2018-10-19 14:31:47,True,True
2018-10-19T14:32:12,Another one of these movies 🤦🏻‍♂️,2,0,The One,6dSKUoV0SNI,0.0,2018-10-19 14:32:12,True,True
2018-10-19T14:34:04,Wow simply awesome,0,0,Surendhar S,6dSKUoV0SNI,0.55,2018-10-19 14:34:04,True,True
2018-10-19T14:34:55,It is just like SAW movie,0,0,SEA MOON,6dSKUoV0SNI,0.0,2018-10-19 14:34:55,True,True
2018-10-19T14:35:16,Saw for hipster nerds. Neat. 😎,0,0,H R,6dSKUoV0SNI,0.0,2018-10-19 14:35:16,True,True
2018-10-19T14:36:30,man this looks super interesting,0,0,Debasish Soren,6dSKUoV0SNI,0.41666666666666663,2018-10-19 14:36:30,True,True
2018-10-19T14:37:22,Getting Saw flashbacks,0,0,Cobalt Ramirez,6dSKUoV0SNI,0.0,2018-10-19 14:37:22,True,True
2018-10-19T14:37:34,So this explains where Lawrence was for most of Season 3 of Insecure,0,0,Travis Houze,6dSKUoV0SNI,0.0,2018-10-19 14:37:34,True,True
2018-10-19T14:37:35,And that's why you never open strange packages kids,400,2,Oliver North,6dSKUoV0SNI,-0.025,2018-10-19 14:37:35,True,True
2018-10-19T14:38:06,Awesome,0,0,Aasir Jason,6dSKUoV0SNI,1.0,2018-10-19 14:38:06,True,True
2018-10-19T14:38:06,Now I just wanna watch Weeds,0,0,Söan M,6dSKUoV0SNI,0.0,2018-10-19 14:38:06,True,True
2018-10-19T14:38:22,Me: well this might be interesting —  *sees January release date*  Me: Uh Oh.,0,0,Travis Houze,6dSKUoV0SNI,0.5,2018-10-19 14:38:22,True,True
2018-10-19T14:38:24,This one looks cool,0,0,Raazim R J,6dSKUoV0SNI,0.35,2018-10-19 14:38:24,True,True
2018-10-19T14:38:36,"Every time I see Sony Pictures attached to any release It’s kind of automatic now to think terrible flop.  If it ain’t a James Bond instalment, you can guarantee it will be terrible",0,0,Trent Bradley,6dSKUoV0SNI,-0.4666666666666666,2018-10-19 14:38:36,True,True
2018-10-19T14:39:02,SAW 10:Back at it again Jigsaw!,4,0,Random Dude,6dSKUoV0SNI,0.0,2018-10-19 14:39:02,True,True
2018-10-19T14:40:05,I will watch this with my Grandma  🖤🖤🖤😂😂😂,1,0,Light_Lies,6dSKUoV0SNI,0.0,2018-10-19 14:40:05,True,True
2018-10-19T14:40:18,Karen Page on her spare time when she's not helping Daredevil,0,0,Savon Lofton,6dSKUoV0SNI,0.0,2018-10-19 14:40:18,True,True
2018-10-19T14:41:02,Nik Dodani? I'm in.,0,0,Bij Sumatra,6dSKUoV0SNI,0.0,2018-10-19 14:41:02,True,True
2018-10-19T14:42:53,So wheres jigsaw,0,0,Aaron Last name you cant read,6dSKUoV0SNI,0.0,2018-10-19 14:42:53,True,True
2018-10-19T14:43:39,Please release in Hindi🙏🙏🙏,0,0,Its ĆØFFÏŃ,6dSKUoV0SNI,0.0,2018-10-19 14:43:39,True,True
2018-10-19T14:45:01,mind blowing,0,0,ThaNos,6dSKUoV0SNI,0.0,2018-10-19 14:45:01,True,True
2018-10-19T14:46:46,SAW 2.0 :v,0,0,David JD,6dSKUoV0SNI,0.0,2018-10-19 14:46:46,True,True
2018-10-19T14:46:57,Cube anyone... anyone...??,0,0,Mike T West,6dSKUoV0SNI,0.0,2018-10-19 14:46:57,True,True
2018-10-19T14:47:12,"Well, from the trailer, it can tells you who will be a survivor.",0,0,rizki pinandito,6dSKUoV0SNI,0.0,2018-10-19 14:47:12,True,True
2018-10-19T14:47:15,This reminds me of IT and Truth or Dare.,10,2,Ninja Flamestone,6dSKUoV0SNI,0.0,2018-10-19 14:47:15,True,True
2018-10-19T14:48:58,I saw an Annabelle doll there?!!,0,0,HM Ashiqur Rahman Sohan,6dSKUoV0SNI,0.0,2018-10-19 14:48:58,True,True
2018-10-19T14:49:54,Multiplayer Saw,0,0,PastelNoir,6dSKUoV0SNI,0.0,2018-10-19 14:49:54,True,True
2018-10-19T14:50:50,Rusty lake 🤔😏😏,1,0,Pawan,6dSKUoV0SNI,0.0,2018-10-19 14:50:50,True,True
2018-10-19T14:51:06,Do you wanna play a game?,0,0,Priyansh,6dSKUoV0SNI,-0.4,2018-10-19 14:51:06,True,True
2018-10-19T14:55:04,"Wait wait wait HOLD UP:  A horror movie based on a slightly popular fad starring people we kinda recognize from something that's coming out the first weekend of January?    Oh Sony, how you spoil us so.",60,1,Zachary S. Marsh,6dSKUoV0SNI,0.425,2018-10-19 14:55:04,True,True
2018-10-19T14:55:07,Wow ! Way to go sony..u r slayin it with the originals.,0,0,advi sesh,6dSKUoV0SNI,0.125,2018-10-19 14:55:07,True,True
2018-10-19T14:55:24,Wow this looks good,0,0,Raja Rama,6dSKUoV0SNI,0.39999999999999997,2018-10-19 14:55:24,True,True
2018-10-19T14:55:59,Interesting .. plot,0,0,Noufal Basha,6dSKUoV0SNI,0.5,2018-10-19 14:55:59,True,True
2018-10-19T14:56:01,wow another saw,0,0,Kaio Kefla,6dSKUoV0SNI,0.1,2018-10-19 14:56:01,True,True
2018-10-19T14:56:07,There is a reason why it is coming out in January..........,0,0,Ryan Chili flakes,6dSKUoV0SNI,0.0,2018-10-19 14:56:07,True,True
2018-10-19T14:56:49,lilttle boxes on the hillside. little boxes made of ticky tacky little boxes on the hillside and they all look just the same! and   they   all  look  just  the  same!,0,0,apollyon1976,6dSKUoV0SNI,-0.09375,2018-10-19 14:56:49,True,True
2018-10-19T14:57:18,Alert Tyrone magnus.,0,0,MG16NCP,6dSKUoV0SNI,0.0,2018-10-19 14:57:18,True,True
2018-10-19T14:58:08,You all guys see *SAW* All I see is *Cabin In The Woods* .,198,14,Jean Harold Magnait,6dSKUoV0SNI,0.0,2018-10-19 14:58:08,True,True
2018-10-19T14:58:51,I have some pretty high standards. I hope the producer knows what he is doing if he thinks he can out do the saw movies.,0,0,Vlad the Impaler,6dSKUoV0SNI,0.20500000000000002,2018-10-19 14:58:51,True,True
2018-10-19T14:58:52,Please release all languages in India,0,0,Azeer shaik,6dSKUoV0SNI,0.0,2018-10-19 14:58:52,True,True
2018-10-19T14:58:55,This reminds me of The Cube series.,1,0,Claudia Ivy,6dSKUoV0SNI,0.0,2018-10-19 14:58:55,True,True
2018-10-19T14:59:10,I love this kind of story,0,0,Amaiso Nensy,6dSKUoV0SNI,0.55,2018-10-19 14:59:10,True,True
2018-10-19T14:59:38,Cabin in the woods: Saw Edition,0,0,PacMonster146,6dSKUoV0SNI,0.0,2018-10-19 14:59:38,True,True
2018-10-19T15:00:01,Okay this is such a SAW ripoff!,0,0,Michael Lon Herts,6dSKUoV0SNI,0.25,2018-10-19 15:00:01,True,True
2018-10-19T15:00:26,"I never interested in this kind of movie, but SONY change my mind.",0,0,Angga Pramudya,6dSKUoV0SNI,0.2375,2018-10-19 15:00:26,True,True
2018-10-19T15:00:36,"Saw, the PG 13 version!",91,2,MANJAKOLI1,6dSKUoV0SNI,0.0,2018-10-19 15:00:36,True,True
2018-10-19T15:00:59,¿Qué clase de Saw es esto?,0,0,Braian Meder,6dSKUoV0SNI,0.0,2018-10-19 15:00:59,True,True
2018-10-19T15:01:36,"Oh now i see what's this movie is about, its an american version of  TV SHOW go watch it guys if you haven't its an awesome movie",0,0,davisen Starlord,6dSKUoV0SNI,0.5,2018-10-19 15:01:36,True,True
2018-10-19T15:01:43,"I,m here for Karen Page!",1,0,Alianovna Romanoff,6dSKUoV0SNI,0.0,2018-10-19 15:01:43,True,True
2018-10-19T15:01:51,BGM was awesome 😍😍😍,0,0,Psycho Duken,6dSKUoV0SNI,1.0,2018-10-19 15:01:51,True,True
2018-10-19T15:02:33,So where is the part that says by the creator of saw?,0,0,DUDEmanEPIC123,6dSKUoV0SNI,0.0,2018-10-19 15:02:33,True,True
2018-10-19T15:02:48,This has a Saw plus Would You Rather feel. I like it,0,0,Kevin,6dSKUoV0SNI,0.0,2018-10-19 15:02:48,True,True
2018-10-19T15:03:54,Bring in the Devil of Hell's Kitchen for help!!!🔥,20,3,Phillip Siddiq,6dSKUoV0SNI,0.0,2018-10-19 15:03:54,True,True
2018-10-19T15:04:50,Saw IX  Coming soon to a Theater near you,2,0,PTGKChrisHD,6dSKUoV0SNI,0.1,2018-10-19 15:04:50,True,True
2018-10-19T15:05:33,So where is jigsaw ?,1,0,The Ultimate Show,6dSKUoV0SNI,0.0,2018-10-19 15:05:33,True,True
2018-10-19T15:06:12,"0:39 Deborah Ann Woll is definitely not 5'4""",0,0,Aléf,6dSKUoV0SNI,0.0,2018-10-19 15:06:12,True,True
2018-10-19T15:06:37,*_This gonna scare the bajejus outta Every one_*,1,1,Spoke Fists,6dSKUoV0SNI,0.0,2018-10-19 15:06:37,True,True
2018-10-19T15:07:27,I'm gay,0,0,Stewie,6dSKUoV0SNI,0.4166666666666667,2018-10-19 15:07:27,True,True
2018-10-19T15:07:53,Jigsaw back 😂😂😂,0,0,Rahman Mubin,6dSKUoV0SNI,0.0,2018-10-19 15:07:53,True,True
2018-10-19T15:08:02,😆,1,0,짐똥원투따리Drink,6dSKUoV0SNI,0.0,2018-10-19 15:08:02,True,True
2018-10-19T15:08:09,wow such a January movie!,0,0,Fiaz Rahman,6dSKUoV0SNI,0.05,2018-10-19 15:08:09,True,True
2018-10-19T15:08:14,SAW meets The Cube,0,0,Alucard,6dSKUoV0SNI,0.0,2018-10-19 15:08:14,True,True
2018-10-19T15:08:53,Oh my God they're ripping off SAW! Try as you will Sony you will never beat one of the greatest horror franchises in history.,0,0,Christopher Girardi,6dSKUoV0SNI,1.0,2018-10-19 15:08:53,True,True
2018-10-19T15:09:04,Puzzle,0,0,Rehbar Ali,6dSKUoV0SNI,0.0,2018-10-19 15:09:04,True,True
2018-10-19T15:09:28,Looks Revenge Policy 😂😂😂,0,0,DIVYANSH SHARMA,6dSKUoV0SNI,0.0,2018-10-19 15:09:28,True,True
2018-10-19T15:09:43,What the hell did I just saw!,0,0,Harry Morgan,6dSKUoV0SNI,0.0,2018-10-19 15:09:43,True,True
2018-10-19T15:09:55,is this going to be like the cube and have nothing explained and have the organisation get away with things.,0,0,William Mendez,6dSKUoV0SNI,0.0,2018-10-19 15:09:55,True,True
2018-10-19T15:10:28,Karen Page ?,0,0,Arpit Srivastava,6dSKUoV0SNI,0.0,2018-10-19 15:10:28,True,True
2018-10-19T15:10:30,No one SAW that coming...,0,0,Peni Parker,6dSKUoV0SNI,0.0,2018-10-19 15:10:30,True,True
2018-10-19T15:11:14,I just stopped after that heating room Gosh wtf is wrong with the studios revealing everything.  Because of the trailer now i know how they will escape first room.  DISAPPOINTED 😔,0,0,R K,6dSKUoV0SNI,-0.375,2018-10-19 15:11:14,True,True
2018-10-19T15:11:58,Looking forward to watch,0,0,Arshdeep Basra,6dSKUoV0SNI,0.0,2018-10-19 15:11:58,True,True
2018-10-19T15:12:35,Resident Evil 7 S.W.A.T.,0,0,Alejandro Escajeda Romero,6dSKUoV0SNI,-1.0,2018-10-19 15:12:35,True,True
2018-10-19T15:12:39,Cabin in the woods part 2,0,0,mark beard,6dSKUoV0SNI,0.0,2018-10-19 15:12:39,True,True
2018-10-19T15:13:38,Finally SAW 8..😍😍,0,1,Tushar Rajput,6dSKUoV0SNI,0.0,2018-10-19 15:13:38,True,True
2018-10-19T15:13:51,Back to back movie trailer is terrific for Sony pictures fans.,1,0,Saurabh 07,6dSKUoV0SNI,0.0,2018-10-19 15:13:51,True,True
2018-10-19T15:15:44,"I ""SAW"" a similar movie a few years ago.",0,0,E Leon,6dSKUoV0SNI,-0.1,2018-10-19 15:15:44,True,True
2018-10-19T15:17:23,My type of movie,1,0,faisal hasan,6dSKUoV0SNI,0.0,2018-10-19 15:17:23,True,True
2018-10-19T15:17:26,Like they got the idea from anime series but i don't know which one,0,0,Ade Omara,6dSKUoV0SNI,0.0,2018-10-19 15:17:26,True,True
2018-10-19T15:17:34,I thought I will go insane before finish watching this trailer.  This is utterly awesome.,0,0,Alex Mercer,6dSKUoV0SNI,0.0,2018-10-19 15:17:34,True,True
2018-10-19T15:17:35,It looks similar to Exam movie but with huge budget..,0,0,Robins Manher,6dSKUoV0SNI,0.20000000000000004,2018-10-19 15:17:35,True,True
2018-10-19T15:17:41,saww,0,0,noah sanez,6dSKUoV0SNI,0.0,2018-10-19 15:17:41,True,True
2018-10-19T15:17:47,Saw meets cube?,0,0,Dajion Williams,6dSKUoV0SNI,0.0,2018-10-19 15:17:47,True,True
2018-10-19T15:20:49,Saw??,0,0,abengg beng,6dSKUoV0SNI,0.0,2018-10-19 15:20:49,True,True
2018-10-19T15:21:04,What is the song,0,1,Tung Lam,6dSKUoV0SNI,0.0,2018-10-19 15:21:04,True,True
2018-10-19T15:21:14,Where is Katniss?,0,0,mutant messiah,6dSKUoV0SNI,0.0,2018-10-19 15:21:14,True,True
2018-10-19T15:21:34,saw?,0,0,Tony Stark,6dSKUoV0SNI,0.0,2018-10-19 15:21:34,True,True
2018-10-19T15:21:51,This is gonna suck,0,0,LAKSHMI NARAYANAN,6dSKUoV0SNI,0.0,2018-10-19 15:21:51,True,True
2018-10-19T15:21:57,"Let me see  1. Complex traps and rooms that are related to each person and have ironic deaths related to their past crimes or faults. 2. Being watched through video surveillance by the insane game maker.  3. The insane game maker communicating to his victims through an audio device.  4. At least one victim is killed in every room. 5. Clues are littered throughout each room to help the victims escape from set room 2 M. Night Shyamalan twists here:            1. The insane game maker will meet the lone survivor at the end of the game,  and congratulate them on having a better appreciation for life.           2. The victims willingly go into their traps by thinking it was a simple escape room.",0,0,Christopher Girardi,6dSKUoV0SNI,-0.2652777777777778,2018-10-19 15:21:57,True,True
2018-10-19T15:22:25,"Its Like the Movie Cube, With Modern Twist of Saw. Cool!",0,0,RedFox Rulez,6dSKUoV0SNI,0.31875,2018-10-19 15:22:25,True,True
2018-10-19T15:23:30,This looks good already.💕,1,0,Classic C,6dSKUoV0SNI,0.7,2018-10-19 15:23:30,True,True
2018-10-19T15:23:49,Life is dependent on puzzle so must for survival.... Really impressive....,0,0,Bhanu Singh,6dSKUoV0SNI,1.0,2018-10-19 15:23:49,True,True
2018-10-19T15:23:56,I think that is my room,0,0,guts dragonslayer,6dSKUoV0SNI,0.0,2018-10-19 15:23:56,True,True
2018-10-19T15:23:59,Cube+Saw=this movie,0,0,Sudin Joseph,6dSKUoV0SNI,0.0,2018-10-19 15:23:59,True,True
2018-10-19T15:24:19,SAW reimagined. Coming to a Netflix near you.,0,0,Rocky 5,6dSKUoV0SNI,0.1,2018-10-19 15:24:19,True,True
2018-10-19T15:24:39,Amazing concept. Plz don't be bad,0,0,Aryan Shinde,6dSKUoV0SNI,-0.04999999999999988,2018-10-19 15:24:39,True,True
2018-10-19T15:25:57,I find it hilarious that I'm watching Daredevil's new season rn and.. well you should know the rest👌,0,0,Joshua Jones,6dSKUoV0SNI,0.3181818181818182,2018-10-19 15:25:57,True,True
2018-10-19T15:26:38,el juego del miedo...con más presupuesto?,0,0,Martín Márquez,6dSKUoV0SNI,0.0,2018-10-19 15:26:38,True,True
2018-10-19T15:27:18,Looks very interesting its on my bucket list,0,0,CAYLIE BOY Player,6dSKUoV0SNI,0.65,2018-10-19 15:27:18,True,True
2018-10-19T15:28:26,It reminds me of Jigsaw,0,0,Victor Hernandez,6dSKUoV0SNI,0.0,2018-10-19 15:28:26,True,True
2018-10-19T15:29:16,thoooo this is will fun,0,0,who?,6dSKUoV0SNI,0.3,2018-10-19 15:29:16,True,True
2018-10-19T15:29:43,Thought gonna be interesting until I SAW SONY,1,3,Gjman s,6dSKUoV0SNI,0.5,2018-10-19 15:29:43,True,True
2018-10-19T15:30:01,They copied one episode from phineas and ferb. Lol.,0,0,Jarvin Ginga,6dSKUoV0SNI,0.8,2018-10-19 15:30:01,True,True
2018-10-19T15:30:15,So... SAW?  It's just SAW.,0,0,CobraChicken,6dSKUoV0SNI,0.0,2018-10-19 15:30:15,True,True
2018-10-19T15:30:16,Belko Experiment Sequel,0,0,Ultimayer,6dSKUoV0SNI,0.0,2018-10-19 15:30:16,True,True
2018-10-19T15:30:38,Happy Halloween🎃🎃🎃,0,0,Aaryan karki,6dSKUoV0SNI,0.8,2018-10-19 15:30:38,True,True
2018-10-19T15:31:57,I am shivering hard af. That's a little bit spooky.,8,1,Friend's fresh vines,6dSKUoV0SNI,-0.23958333333333334,2018-10-19 15:31:57,True,True
2018-10-19T15:32:01,Cube (2019),0,0,pickle tarts,6dSKUoV0SNI,0.0,2018-10-19 15:32:01,True,True
2018-10-19T15:32:18,They didn't play enough escape room games that's why they died,0,0,GANJAMANS GAMING,6dSKUoV0SNI,0.0,2018-10-19 15:32:18,True,True
2018-10-19T15:32:39,SAW CUBE :),1,0,Tadej Danev,6dSKUoV0SNI,0.5,2018-10-19 15:32:39,True,True
2018-10-19T15:33:48,It is similar to the movie-EXAM,0,0,ANI IS FUNNY,6dSKUoV0SNI,0.0,2018-10-19 15:33:48,True,True
2018-10-19T15:34:06,Remember guys MORE is LESS.. MORE is LESS.😌,0,0,Tushar Rajput,6dSKUoV0SNI,0.2777777777777778,2018-10-19 15:34:06,True,True
2018-10-19T15:34:09,Is this similar to 'The Game' at all? its a movie in case you don't know this is the just super similar in some parts,0,0,Tristian Ourso,6dSKUoV0SNI,-0.016666666666666677,2018-10-19 15:34:09,True,True
2018-10-19T15:34:09,"SAW rip of, the poster has jigsaw peices and it was called escape room I thought it was saw",0,1,Autism podcast.,6dSKUoV0SNI,0.0,2018-10-19 15:34:09,True,True
2018-10-19T15:34:09,More like Saw,0,0,Husam Ali,6dSKUoV0SNI,0.5,2018-10-19 15:34:09,True,True
2018-10-19T15:34:59,This feels like a Black Mirror episode,0,0,Kyla,6dSKUoV0SNI,-0.16666666666666666,2018-10-19 15:34:59,True,True
2018-10-19T15:35:16,Looks good,0,0,Raptor Royale,6dSKUoV0SNI,0.7,2018-10-19 15:35:16,True,True
2018-10-19T15:35:34,u mean SAW 9,0,0,vikas p,6dSKUoV0SNI,-0.3125,2018-10-19 15:35:34,True,True
2018-10-19T15:35:34,worst cgi fire ever,0,0,Ilias Ifantis,6dSKUoV0SNI,-1.0,2018-10-19 15:35:34,True,True
2018-10-19T15:35:45,😲😲,0,0,Doki Doki,6dSKUoV0SNI,0.0,2018-10-19 15:35:45,True,True
2018-10-19T15:35:49,better version of cabin in the woods,0,0,Abhishek Kumar,6dSKUoV0SNI,0.5,2018-10-19 15:35:49,True,True
2018-10-19T15:35:52,Oooooo. Ok. I'll watch this.,0,0,Cayleigh is Clueless,6dSKUoV0SNI,0.0,2018-10-19 15:35:52,True,True
2018-10-19T15:36:12,So unlike other movies instead of black guy in this movie the brown guy dies first?😭,1,0,Virality Factor,6dSKUoV0SNI,-0.14583333333333331,2018-10-19 15:36:12,True,True
2018-10-19T15:36:22,Title was very interesting. But the trailer failed,0,0,Agnel T Joseph,6dSKUoV0SNI,0.07500000000000001,2018-10-19 15:36:22,True,True
2018-10-19T15:38:09,I am 271th commenter..!  And 17k liker,0,0,Syed Asad,6dSKUoV0SNI,0.0,2018-10-19 15:38:09,True,True
2018-10-19T15:38:24,Wow!,1,0,Yippee,6dSKUoV0SNI,0.125,2018-10-19 15:38:24,True,True
2018-10-19T15:38:36,Tgis will b  EPIC !!,0,0,Azr Kaa,6dSKUoV0SNI,0.15625,2018-10-19 15:38:36,True,True
2018-10-19T15:38:45,I’ll be expecting Jigsaw to appear at the end or in the third movie of it,13,1,Project Monz Gaming,6dSKUoV0SNI,0.0,2018-10-19 15:38:45,True,True
2018-10-19T15:38:58,"lol ""Everyone is Dying to Play"" that's fucked up. Definitely watching this.",0,0,D. Foxx,6dSKUoV0SNI,0.0666666666666667,2018-10-19 15:38:58,True,True
2018-10-19T15:40:04,Escape,1,0,Rorschach Daws,6dSKUoV0SNI,0.0,2018-10-19 15:40:04,True,True
2018-10-19T15:40:17,Did I see a door game.,0,0,Tanmay singh,6dSKUoV0SNI,-0.4,2018-10-19 15:40:17,True,True
2018-10-19T15:41:33,This next level of the 'EXAM' movie. Hands down 👌,0,0,Delon sachith,6dSKUoV0SNI,-0.07777777777777779,2018-10-19 15:41:33,True,True
2018-10-19T15:42:39,"There is already a 2017 movie made by ""global genesis group"", is this a reboot?",0,0,Jupi-Wizi Films Animation,6dSKUoV0SNI,0.0,2018-10-19 15:42:39,True,True
2018-10-19T15:42:41,looks good but shouldn't have shown who escaped what.,0,0,Broken Teddies,6dSKUoV0SNI,0.7,2018-10-19 15:42:41,True,True
2018-10-19T15:43:30,a horror movie by sony... again?,0,0,that Josiah Burns,6dSKUoV0SNI,0.0,2018-10-19 15:43:30,True,True
2018-10-19T15:43:43,"""table no 21"" typa story i guess",0,0,Kuldeep Ramchandani,6dSKUoV0SNI,0.0,2018-10-19 15:43:43,True,True
2018-10-19T15:44:50,Brilliant topic to make a movie!!,0,0,Sardar Asif Karim Rabi,6dSKUoV0SNI,1.0,2018-10-19 15:44:50,True,True
2018-10-19T15:45:30,Nice movie release for Tamil.,1,0,Paul walker,6dSKUoV0SNI,0.6,2018-10-19 15:45:30,True,True
2018-10-19T15:46:10,"hold up, didn't a movie with the *EXACT* same concept with the *EXACT* same title come out last year? EDIT: there were *TWO* of them, dear god",953,95,超粒方,6dSKUoV0SNI,0.1,2018-10-19 15:46:10,True,True
2018-10-19T15:46:41,This movie seems abit like saw but more cool hahaha 😂😉,0,0,오세륜,6dSKUoV0SNI,0.35000000000000003,2018-10-19 15:46:41,True,True
2018-10-19T15:47:14,looks like a remake of fermats room with more budget,0,0,griftert7,6dSKUoV0SNI,0.5,2018-10-19 15:47:14,True,True
2018-10-19T15:47:28,"Oh great, what an original idea",0,0,Michael Rose,6dSKUoV0SNI,0.5875,2018-10-19 15:47:28,True,True
2018-10-19T15:47:33,Awesome,0,0,SAI AKUL VARDHAN,6dSKUoV0SNI,1.0,2018-10-19 15:47:33,True,True
2018-10-19T15:50:42,not bad,0,0,Dany-G,6dSKUoV0SNI,0.3499999999999999,2018-10-19 15:50:42,True,True
