timestamp,text,like_count,reply_count,author,trailer_id,sentiment_score,datetime,used_for_model,used_for_visualization
2017-06-19T14:58:23,If on opening weekend of this film the theater next door is showing Flatliners (1990) at the same time.... Yeah I'll go see the original. Hell I'll pay extra to view it in X-D. I'll wait for the DVD release and borrow it from someone.,0,0,NotThatGuy,a1S52y5ZVlY,0.275,2017-06-19 14:58:23,True,True
2017-06-19T16:08:31,Does anyone know what song plays at 1:40?,0,0,Beatriz Silva,a1S52y5ZVlY,0.0,2017-06-19 16:08:31,True,True
2017-06-19T16:15:09,"I've been meaning to see the original, now I'll be able to see the original and the remake, for the first time, in one year! I haven't been this excited to compare and contrast since Last House on the Left!",0,0,Tankgirl,a1S52y5ZVlY,0.2767857142857143,2017-06-19 16:15:09,True,True
2017-06-19T16:26:11,The OA!,0,0,Sudhanshu Verma,a1S52y5ZVlY,0.0,2017-06-19 16:26:11,True,True
2017-06-19T17:25:35,"The original Flatliners is one of my top favorite films of all time, so I'll have to check this out. I also love Ellen Page. Hopefully this doesn't suck.",1,0,Hawkeye Trickshot,a1S52y5ZVlY,0.46875,2017-06-19 17:25:35,True,True
2017-06-19T18:13:19,"And now kids, this is the perfect example of a really bad trailer.  It shows the plot of the second half of the movie when trailers must focus on the first hour. I would've liked to see the scary part as a surprise and not on the fucking trailer.",0,0,Juas,a1S52y5ZVlY,-0.01458333333333331,2017-06-19 18:13:19,True,True
2017-06-19T18:31:01,XD,0,0,Nate_Trades,a1S52y5ZVlY,0.0,2017-06-19 18:31:01,True,True
2017-06-19T18:41:02,Is that death grips I hear?,0,0,FuzzySquareOfDeath,a1S52y5ZVlY,0.0,2017-06-19 18:41:02,True,True
2017-06-19T18:57:41,I mean... sure. I guess. Flatliners was pretty awesome. The cast for the original was also pretty badass. 😍,0,0,SapphireJaxx GH,a1S52y5ZVlY,0.34375,2017-06-19 18:57:41,True,True
2017-06-19T20:27:47,well that escalated fast............,0,0,The Rambler,a1S52y5ZVlY,0.2,2017-06-19 20:27:47,True,True
2017-06-19T20:53:44,Im just here for the sick trailer music that gives me chills,0,0,William A,a1S52y5ZVlY,-0.7142857142857143,2017-06-19 20:53:44,True,True
2017-06-19T21:55:55,noided?,0,0,k4iser,a1S52y5ZVlY,0.0,2017-06-19 21:55:55,True,True
2017-06-19T22:20:06,wheres kevin bacon hes headed to bensenville,0,0,Indr1DC01D,a1S52y5ZVlY,0.0,2017-06-19 22:20:06,True,True
2017-06-19T22:52:36,"I have two things to say.   Number one, this looks amazing.  Number two, WHAT THE HELL DID THEY DO TO DIEGO'S HAIR?!?!?!",0,0,Noël Harris,a1S52y5ZVlY,1.0,2017-06-19 22:52:36,True,True
2017-06-19T23:14:15,Fk me ......they could have at least said it's a fricking horror?,0,0,rakks brown,a1S52y5ZVlY,-0.3,2017-06-19 23:14:15,True,True
2017-06-20T00:04:22,"Not sure how I feel about this, but I dig the background music.",0,0,Christina Raynor,a1S52y5ZVlY,-0.25,2017-06-20 00:04:22,True,True
2017-06-20T00:20:26,"God damn another shitty remake. (yes I know Keifer Sutherland is in it) His character is just a nod to the original, this is still a pointless remake. Womp womp womp.",0,0,Odie709,a1S52y5ZVlY,0.0625,2017-06-20 00:20:26,True,True
2017-06-20T00:45:30,The move looks kinda bad. I don't get it.,0,0,liltunechi4,a1S52y5ZVlY,-0.6999999999999998,2017-06-20 00:45:30,True,True
2017-06-20T01:00:25,What song is on 1:40,0,0,ShadowKing,a1S52y5ZVlY,0.0,2017-06-20 01:00:25,True,True
2017-06-20T02:07:18,Looks absolutely amazing but - just a thought - maybe too much revealed in the trailer??,0,0,Wombat,a1S52y5ZVlY,0.4,2017-06-20 02:07:18,True,True
2017-06-20T02:50:43,nofap anyone :o,0,0,xyoopridex,a1S52y5ZVlY,0.05,2017-06-20 02:50:43,True,True
2017-06-20T03:55:43,"sony marketing sucks, showed the whole movie.",0,0,bladerj,a1S52y5ZVlY,-0.04999999999999999,2017-06-20 03:55:43,True,True
2017-06-20T04:15:58,I can't wait till RiffTrax does this movie,0,0,89792131121607920 math is cool,a1S52y5ZVlY,0.0,2017-06-20 04:15:58,True,True
2017-06-20T07:24:52,What's the music?,0,0,Sleepyroseweed 🥀,a1S52y5ZVlY,0.0,2017-06-20 07:24:52,True,True
2017-06-20T09:31:33,"I don't get how people say it's a bad remake. I mean, I don't get in general why people always despise a remake of a classic. I'm guessing some or most people think they'd be cool just saying that. But just a thought. I'd watch this movie because it seems interesting like the original.",0,0,Eden E.,a1S52y5ZVlY,0.11614583333333336,2017-06-20 09:31:33,True,True
2017-06-20T09:52:56,"This is inaccurate. Shocking someone only makes their heart beat change, from irregular to regular and vice versa, but I don't think CPR would have the same dramatic effect",0,0,Maeve Doyle,a1S52y5ZVlY,-0.2866666666666667,2017-06-20 09:52:56,True,True
2017-06-20T11:20:41,first transcendence then limitless then Lucy and now this.,0,0,Shashank Singh,a1S52y5ZVlY,0.25,2017-06-20 11:20:41,True,True
2017-06-20T15:42:26,Haha shit I'm gonna watch this,0,0,Clean Living,a1S52y5ZVlY,0.0,2017-06-20 15:42:26,True,True
2017-06-20T17:11:24,i thought it was a nice sci-fi movie first..haha,0,0,Ishmam Hossain,a1S52y5ZVlY,0.6,2017-06-20 17:11:24,True,True
2017-06-20T17:24:38,OMG SO COOL,1,0,tori rocks the world,a1S52y5ZVlY,0.35,2017-06-20 17:24:38,True,True
2017-06-20T19:36:31,Senseless remake of a classic. Hollywood has no more ideas. Sinnloses Remake eines Klassikers. Hollywood hat keine Ideen mehr.,0,0,michael vrbatka,a1S52y5ZVlY,-0.04166666666666667,2017-06-20 19:36:31,True,True
2017-06-20T20:28:02,Kiersey Clemons is fine af DAMN,0,0,Will Callaway,a1S52y5ZVlY,0.4166666666666667,2017-06-20 20:28:02,True,True
2017-06-20T21:16:45,Well I was honestly interested until all the paranormal stuff began happening. Disappointed,0,0,Emmanuel Duran,a1S52y5ZVlY,-0.25,2017-06-20 21:16:45,True,True
2017-06-21T03:46:51,Hand on the window jump scare? Come on.,0,0,Mikey P,a1S52y5ZVlY,0.0,2017-06-21 03:46:51,True,True
2017-06-21T05:06:02,This is a joke isnt it.,0,0,justin odowd,a1S52y5ZVlY,0.0,2017-06-21 05:06:02,True,True
2017-06-21T06:46:28,Only good thing about  this trailer is Janes addiction going deep inside all kinds of trailer action.,0,0,Lennon Greenstreet,a1S52y5ZVlY,0.19999999999999998,2017-06-21 06:46:28,True,True
2017-06-21T13:24:56,This didn't need a remake.,0,0,MrBorderdown,a1S52y5ZVlY,0.0,2017-06-21 13:24:56,True,True
2017-06-21T18:05:32,who wants to see it only because Nina is in it?😂❤,0,0,Casuallete,a1S52y5ZVlY,0.1,2017-06-21 18:05:32,True,True
2017-06-21T18:23:55,this trailer sucks and basically gives you the whole movie,0,0,cal snow,a1S52y5ZVlY,-0.04999999999999999,2017-06-21 18:23:55,True,True
2017-06-21T20:49:22,that Background Music tho,0,0,Selma C.,a1S52y5ZVlY,0.0,2017-06-21 20:49:22,True,True
2017-06-22T02:03:25,This seems like a demented remake of the Final Destination franchise...,0,0,Sam Rikard,a1S52y5ZVlY,0.0,2017-06-22 02:03:25,True,True
2017-06-22T09:49:33,Did anyone ask for this remake?,0,0,Trevor Y,a1S52y5ZVlY,0.0,2017-06-22 09:49:33,True,True
2017-06-22T22:28:09,More 20 yr olds ruining a good concept. Probably written by one too,0,0,9enius,a1S52y5ZVlY,0.6,2017-06-22 22:28:09,True,True
2017-06-22T22:35:01,Netflix already has a movie just like this,0,0,thatbratshinji,a1S52y5ZVlY,0.0,2017-06-22 22:35:01,True,True
2017-06-23T00:23:10,When the white man tries to play God .......,0,0,MissMichelle103,a1S52y5ZVlY,-0.05,2017-06-23 00:23:10,True,True
2017-06-23T09:06:49,They've probably shown 75% of the film here.,1,0,46.56.A.,a1S52y5ZVlY,0.0,2017-06-23 09:06:49,True,True
2017-06-24T00:24:03,Watching this for Nina,0,0,Ravis,a1S52y5ZVlY,0.0,2017-06-24 00:24:03,True,True
2017-06-24T07:46:11,"I remember watching something familiar on indian tv when i was a kid,anyone remember the name???  ...indian serials were so different in those says.....does anyone remember watching Saturday suspense???",0,0,Shethinkso,a1S52y5ZVlY,0.1875,2017-06-24 07:46:11,True,True
2017-06-24T09:32:57,I see a black woman - will they make her live again?,0,0,Christian S,a1S52y5ZVlY,-0.015151515151515152,2017-06-24 09:32:57,True,True
2017-06-24T15:59:47,this looks like another shiti movie. I guess Ellen Page need the check to buy a new car or a house.👎😛😒😕😁😲,0,0,I Daniel Blake,a1S52y5ZVlY,0.13636363636363635,2017-06-24 15:59:47,True,True
2017-06-24T16:15:31,woowww you are artist ellan page,0,0,La Llorona Ben,a1S52y5ZVlY,0.0,2017-06-24 16:15:31,True,True
2017-06-25T14:11:42,lazarus effect?,0,0,Abigail Effiong,a1S52y5ZVlY,0.0,2017-06-25 14:11:42,True,True
2017-06-25T22:31:45,"This isn't a remake. It's a sequel, I just searchers and kiefer ( I probably just bombed that haha) is reprising his role as Nelson. Still, Idk how I feel about this 😂",0,0,Taj James,a1S52y5ZVlY,0.2,2017-06-25 22:31:45,True,True
2017-06-26T03:38:35,it is scary and sad and it is good movie. and I wish to watch the movie,1,0,Omega jackson,a1S52y5ZVlY,-0.10000000000000002,2017-06-26 03:38:35,True,True
2017-06-26T03:53:47,it got my favorite fan #ellen page,0,0,Omega jackson,a1S52y5ZVlY,0.5,2017-06-26 03:53:47,True,True
2017-06-26T03:59:05,watch this 2:20,0,0,Omega jackson,a1S52y5ZVlY,0.0,2017-06-26 03:59:05,True,True
2017-06-26T07:45:26,"1.they just spoiled half the movie 2.intresting idea in the beginning too bad it looks like they're just going classic boring ""horror"" in the second half of the movie",0,0,Revan Ruler,a1S52y5ZVlY,-0.31111111111111106,2017-06-26 07:45:26,True,True
2017-06-26T10:01:23,why pay a $15 movie ticket when i just watched the entire film right here.,0,0,Seth Mason,a1S52y5ZVlY,0.14285714285714285,2017-06-26 10:01:23,True,True
2017-06-27T00:23:19,I CLOSE MY EYES AND SEIZE IT I CLENCH MY FIST AND BEAT IT I LIGHT MY TORCH AND BURN IT I AM THE BEAST I WORSHIP,1,0,Jesuschrist Ass,a1S52y5ZVlY,0.4,2017-06-27 00:23:19,True,True
2017-06-27T16:39:55,Is it just me or does this film appear to have the exact same plot as Jurassic Park?,0,0,Mike Faller,a1S52y5ZVlY,0.125,2017-06-27 16:39:55,True,True
2017-06-28T05:45:29,So this is what Jodie does after Aiden is not attached to her...,0,0,idunno whour,a1S52y5ZVlY,0.0,2017-06-28 05:45:29,True,True
2017-06-28T08:58:41,God please don't let them have ruined yet another classic...... For God's sake!,0,0,Jaquiez Douglas,a1S52y5ZVlY,0.20833333333333331,2017-06-28 08:58:41,True,True
2017-06-29T17:06:19,What's the name of the last Song?,0,0,Antonia Lin,a1S52y5ZVlY,0.0,2017-06-29 17:06:19,True,True
2017-06-29T18:43:16,satanic illuminati work...very much illuminati sign...fallen angel babylon work,0,0,Béla Lukovszki,a1S52y5ZVlY,0.2,2017-06-29 18:43:16,True,True
2017-06-29T19:30:59,"Hi everyone! I've been compiling this list of my *""All-Time FAVORITE MOVIES""* for quite some time now and I wanted to share it with you, then you will always have *SUGGESTIONS FOR WHAT TO WATCH NEXT - **http://www.imdb.com/list/ls031367581/** -* they are all definitely WORTH YOUR TIME. These are all GREAT MOVIES and I hope you will have as good a time watching them as I have had. I have also added SHORT REVIEWS FOR EVERY MOVIE and if you like *SHAWSHANK REDEMPTION, FIGHT CLUB or THE DARK KNIGHT* and would like to discover more memorable movies like them, then this list is for you :)",1,0,The Sundance Kid,a1S52y5ZVlY,0.365,2017-06-29 19:30:59,True,True
2017-06-29T22:44:07,bruh can they like not,0,0,Veola Perry,a1S52y5ZVlY,0.0,2017-06-29 22:44:07,True,True
2017-06-29T23:39:07,"I love how people are acting like Remakes/Reboots are some new phenomena signalling the end of Hollywood... NEWSFLASH guys, movies have been getting remade since the very start as the technology improved. Several directors including Hitchcock remade their own films!!! And quite a few of them are revered as classics in their own right! Watch it, then judge!",3,1,Cinematic Curtain,a1S52y5ZVlY,0.29808802308802307,2017-06-29 23:39:07,True,True
2017-06-30T05:06:33,👸😍😘 ellen page  😙😍💜,0,0,Wolfy,a1S52y5ZVlY,0.0,2017-06-30 05:06:33,True,True
2017-06-30T07:48:10,What the heck,1,0,Parminder Singh,a1S52y5ZVlY,0.0,2017-06-30 07:48:10,True,True
2017-06-30T16:52:41,"omgomgggg lol I waited for that plot, that kind of movie, everything!! I found it!",3,0,ASOT Forever,a1S52y5ZVlY,0.9,2017-06-30 16:52:41,True,True
2017-06-30T18:53:14,The original had amazingly stylish cinematography by Jan De Bont ... this looks like a SyFy TV show.  lol,0,0,honjok,a1S52y5ZVlY,0.5583333333333333,2017-06-30 18:53:14,True,True
2017-06-30T23:27:46,I think the right way to describe this movie is like they've seen death and now it's hunting them.. eh?,0,0,Merciless Mystic Mac,a1S52y5ZVlY,0.2857142857142857,2017-06-30 23:27:46,True,True
2017-07-01T01:39:19,"He come to me with money in his hand, he offered me, I didn't ask him. I wasn't knocking someone's door down, I was running from that.",0,0,Eric Kimball,a1S52y5ZVlY,-0.15555555555555559,2017-07-01 01:39:19,True,True
2017-07-01T18:13:07,"This, like Point Break and many others, did not need a remake. What's next? Speed? Tremors? Dark City? Darkman?",4,0,MyKittyPercy,a1S52y5ZVlY,0.11666666666666665,2017-07-01 18:13:07,True,True
2017-07-02T00:58:32,I am the beast I worship!,1,0,SuckaFish,a1S52y5ZVlY,0.0,2017-07-02 00:58:32,True,True
2017-07-02T08:02:09,what a shame,0,0,Walfang Free Co.,a1S52y5ZVlY,0.0,2017-07-02 08:02:09,True,True
2017-07-02T08:40:19,Yooooooooooo,0,0,YoungbloodedXP,a1S52y5ZVlY,0.0,2017-07-02 08:40:19,True,True
2017-07-02T09:08:21,JODIE YOUR NOT READY TO GO TO THE BEYOND YET,0,0,Kiwi_ Dont_fly,a1S52y5ZVlY,-0.1,2017-07-02 09:08:21,True,True
2017-07-02T13:59:42,I really wanna see this,0,0,Kyle rutherford,a1S52y5ZVlY,0.2,2017-07-02 13:59:42,True,True
2017-07-02T16:48:02,BEWAAAAAARE GOD IS WATCHING WATCHING WATCHING,0,0,The Cinematologist,a1S52y5ZVlY,0.0,2017-07-02 16:48:02,True,True
2017-07-03T03:51:49,what's the creepy song in the background,1,0,Carlos Castillo,a1S52y5ZVlY,-0.5,2017-07-03 03:51:49,True,True
2017-07-03T15:07:06,Elena!!!!,0,0,123,a1S52y5ZVlY,0.0,2017-07-03 15:07:06,True,True
2017-07-05T06:40:24,I'm so excited for this it looks so good! And I can't wait to see Nina Dobrev star in it!,1,0,Sophia Campagna,a1S52y5ZVlY,0.6875,2017-07-05 06:40:24,True,True
2017-07-05T23:31:38,Gee...it's everything but the ending on this trailer. IMDB's Synopsis will provide that. Save me $. LOL.,0,0,Bo Ayya,a1S52y5ZVlY,0.8,2017-07-05 23:31:38,True,True
2017-07-06T00:46:34,Ellen Page acting as a straight character is cringy!!,0,0,Rim Maâlaoui,a1S52y5ZVlY,0.15625,2017-07-06 00:46:34,True,True
2017-07-07T02:13:12,"""Something is happening to us"",  Yeah it's called brain damage from stopping your heart for 7 minutes.",1082,4,C North,a1S52y5ZVlY,0.0,2017-07-07 02:13:12,True,True
2017-07-08T03:08:46,Elena returns! :D yes!,0,0,Lajla Raske,a1S52y5ZVlY,1.0,2017-07-08 03:08:46,True,True
2017-07-08T04:22:12,Another remake......,0,0,Quarrel,a1S52y5ZVlY,0.0,2017-07-08 04:22:12,True,True
2017-07-08T21:33:37,"Guys, creepy music is  ""Soto Mundo"" by 2 Bit Pie",1,0,Alina Red,a1S52y5ZVlY,-0.5,2017-07-08 21:33:37,True,True
2017-07-09T22:18:33,Anyone else hear of this because of a movie theatre survey,0,0,Bludbud,a1S52y5ZVlY,0.0,2017-07-09 22:18:33,True,True
2017-07-10T17:27:06,"Little bit of ""The OA"" in there!!",0,0,Neha Tandon,a1S52y5ZVlY,-0.29296875,2017-07-10 17:27:06,True,True
2017-07-11T05:09:22,y'all no the background theme used in this trailer?plz,0,0,ye lin htet,a1S52y5ZVlY,0.0,2017-07-11 05:09:22,True,True
2017-07-11T18:05:22,"Just in case anyone is confused - this is *not* a remake.  It's a sequel.    http://www.cbr.com/new-flatliners-is-actually-a-sequel-kiefer-sutherland-reveals/  The original was great, really looking forward to seeing this!",0,0,Sean Maguire,a1S52y5ZVlY,0.25625,2017-07-11 18:05:22,True,True
2017-07-12T01:31:52,same with The OA so cheap,0,0,Bahadır BİLİR,a1S52y5ZVlY,0.2,2017-07-12 01:31:52,True,True
2017-07-12T17:11:41,Man so this better be good as the original,0,0,Alloutmel CA,a1S52y5ZVlY,0.525,2017-07-12 17:11:41,True,True
2017-07-13T05:41:01,She has been working for that dumb look and monotone voice to adjust to autotune. Tight!,0,0,That Guy,a1S52y5ZVlY,-0.29910714285714285,2017-07-13 05:41:01,True,True
2017-07-13T15:31:54,"This looks WAY TOO polished in my opinion. The original is very dark and foreboding visually. It lends to the atmosphere and makes you uncomfortable, waiting for the bad things to happen. I'll be shocked if this is good.",0,0,MovieJunkie ForLife,a1S52y5ZVlY,-0.14571428571428569,2017-07-13 15:31:54,True,True
2017-07-13T20:20:21,Spoiler Alert : Jack Bauer comes back at the end and kill all these kids.,0,0,KwangHoon Han,a1S52y5ZVlY,0.0,2017-07-13 20:20:21,True,True
2017-07-15T15:55:57,It's no different from the original. They missed an opportunity.,0,0,Lauro Andrea,a1S52y5ZVlY,0.1875,2017-07-15 15:55:57,True,True
2017-07-15T17:45:52,I finished watching James Norton's great performance in 'War & Peace' which makes me doubly excited now for this upcoming flick.,0,0,Benioff1,a1S52y5ZVlY,0.5875,2017-07-15 17:45:52,True,True
2017-07-15T21:57:03,Only movie I'm looking forward to watch for 2017. There have not been any good movies this year besides Split. It better not disappoint.,15,2,SuperSunshine90210,a1S52y5ZVlY,0.39999999999999997,2017-07-15 21:57:03,True,True
2017-07-16T06:11:35,Elenas going off bridges againnnnn🙄😂❤️,1,0,Laura Arthur,a1S52y5ZVlY,0.0,2017-07-16 06:11:35,True,True
2017-07-16T12:58:57,"The original was brilliantly underrated, with an awesome cast, e.g Kevin Bacon... This one is the complete opposite... The only reason I will watch this remake when It's out to own is because of Nina.",0,0,Dale,a1S52y5ZVlY,0.425,2017-07-16 12:58:57,True,True
2017-07-16T17:21:04,I saw the first film in high school.  Can't believe it was that long ago.... wow.  It was an intriguing notion when it came out and it was pretty interesting.  I think visual effects could really expand the concept to a large degree.,0,0,AB Hockle,a1S52y5ZVlY,0.19242857142857145,2017-07-16 17:21:04,True,True
2017-07-17T04:21:45,really? why?,0,0,Greg Fuller,a1S52y5ZVlY,0.2,2017-07-17 04:21:45,True,True
2017-07-17T04:33:10,"Welcome to the Age of Post Atheism, and Post Islam. Welcome, to the New Age of Ra!",0,0,Yatukih001,a1S52y5ZVlY,0.5901515151515152,2017-07-17 04:33:10,True,True
2017-07-18T19:23:56,this some how reminds me of her video game beyond two souls ,0,0,qxeen _ kam,a1S52y5ZVlY,-0.4,2017-07-18 19:23:56,True,True
2017-07-20T05:35:25,Ellen Page!,0,0,Marcello Ursic,a1S52y5ZVlY,0.0,2017-07-20 05:35:25,True,True
2017-07-20T23:34:50,Not gonna lie. Kind of want to try this at home.,115,12,Savanna Fair,a1S52y5ZVlY,0.6,2017-07-20 23:34:50,True,True
2017-07-21T19:40:46,"Without his English accent, James Norton loses his sex appeal.",0,0,D. Black,a1S52y5ZVlY,-0.15,2017-07-21 19:40:46,True,True
2017-07-22T15:47:00,Sony... The creators of bad films and even worse remakes.,11,0,A M,a1S52y5ZVlY,-0.5499999999999999,2017-07-22 15:47:00,True,True
2017-07-22T18:50:45,Is that Jodie from Beyond two souls?,3,0,blackham7,a1S52y5ZVlY,0.0,2017-07-22 18:50:45,True,True
2017-07-23T05:26:18,Niqqua is that death grips,0,0,Dog Named Dinkey,a1S52y5ZVlY,0.0,2017-07-23 05:26:18,True,True
2017-07-23T08:14:18,I see dead people.. another one?,0,0,Şehir Gezgini,a1S52y5ZVlY,-0.2,2017-07-23 08:14:18,True,True
2017-07-25T20:18:09,The circle must be broken!,0,0,EDUIdre,a1S52y5ZVlY,-0.5,2017-07-25 20:18:09,True,True
2017-07-26T10:00:47,*Atheist* *ppl*,1,0,Drew Labao,a1S52y5ZVlY,0.0,2017-07-26 10:00:47,True,True
2017-07-26T13:41:15,"Wow... compared to the original, this remake looks like garbage.",0,1,cegorach,a1S52y5ZVlY,0.2375,2017-07-26 13:41:15,True,True
2017-07-26T18:30:27,I came here because of moe sargi,5,0,Armando Infante,a1S52y5ZVlY,0.0,2017-07-26 18:30:27,True,True
2017-07-26T20:11:38,7/10,0,0,Erik T,a1S52y5ZVlY,0.0,2017-07-26 20:11:38,True,True
2017-07-26T20:46:06,Those peeps gotta stay off them weird drugs,0,0,It's Gaming time,a1S52y5ZVlY,-0.5,2017-07-26 20:46:06,True,True
2017-07-27T02:09:37,I want to try the experiment for a couple of days.,0,0,kiki lei,a1S52y5ZVlY,0.0,2017-07-27 02:09:37,True,True
2017-07-27T21:11:06,Beyond: Two Souls Movie would be better.,43,0,Kristian Nikolla,a1S52y5ZVlY,0.5,2017-07-27 21:11:06,True,True
2017-07-27T21:57:18,ELLEN PAGE!,0,0,Dylan Largey,a1S52y5ZVlY,0.0,2017-07-27 21:57:18,True,True
2017-07-28T00:21:20,"Who is saying this is a sequel? This is a reboot. But reboots can sometimes be cool, this one looks cool. Love the Jane's Addiction opening song.",0,0,T Gaglione,a1S52y5ZVlY,0.39999999999999997,2017-07-28 00:21:20,True,True
2017-07-28T07:59:57,the music here is on point,0,0,Thomas hardy,a1S52y5ZVlY,0.0,2017-07-28 07:59:57,True,True
2017-07-28T18:10:13,So the only thing that hollywood can make now are endless superhero movies and crap remakes of good moves?,0,1,Harry,a1S52y5ZVlY,-0.05625000000000002,2017-07-28 18:10:13,True,True
2017-07-28T21:19:55,a movie about DMT trips?,0,0,"NotMe,",a1S52y5ZVlY,0.0,2017-07-28 21:19:55,True,True
2017-07-28T23:12:09,Omg can they come up with no new ideas?!!!!,0,1,Joseph Bosarge,a1S52y5ZVlY,-0.16645951704545453,2017-07-28 23:12:09,True,True
2017-07-29T02:47:41,"The music sounds like ""Where is the morphine, where is the morphine"" 😂",160,7,Dayraven Scream Crack,a1S52y5ZVlY,0.0,2017-07-29 02:47:41,True,True
2017-07-29T11:57:53,This honestly reminds me of Haps experiments in the OA,6,0,ghostapologist,a1S52y5ZVlY,0.6,2017-07-29 11:57:53,True,True
2017-07-29T17:57:17,Ok pretty sure after 5 minutes they are Brian dead,0,0,Steve L,a1S52y5ZVlY,0.2625,2017-07-29 17:57:17,True,True
2017-07-30T08:23:06,It looks good I am gonna watch the whole movie,6,1,floraloutlet,a1S52y5ZVlY,0.44999999999999996,2017-07-30 08:23:06,True,True
2017-07-31T01:37:20,This looks so much better than the first one!,6,0,Goo Goo,a1S52y5ZVlY,0.40625,2017-07-31 01:37:20,True,True
2017-07-31T17:06:17,I didn't think this was scary....till she said stop my heart then I Starred Shaking,0,0,Seriously ?!,a1S52y5ZVlY,0.0,2017-07-31 17:06:17,True,True
2017-08-01T20:59:16,Looks like the hunger games made her suicidal,0,0,FalloutSurvior,a1S52y5ZVlY,0.0,2017-08-01 20:59:16,True,True
2017-08-05T09:02:03,what's the music's name wich is like opera,0,0,BEGÜM EVREN,a1S52y5ZVlY,0.0,2017-08-05 09:02:03,True,True
2017-08-05T19:31:16,Can someone tell me the song at 1:40?,0,0,Crystal Flower,a1S52y5ZVlY,0.0,2017-08-05 19:31:16,True,True
2017-08-06T00:31:45,I LIGHT MY TORCH AND BURN IT,1,0,xXaltowolfXxmp3,a1S52y5ZVlY,0.4,2017-08-06 00:31:45,True,True
2017-08-06T00:46:42,They turned a psychological thriller into Final Destination 6.,0,0,Ken MacMillan,a1S52y5ZVlY,0.0,2017-08-06 00:46:42,True,True
2017-08-06T06:34:55,bewaaaaaaaaaaaaaaaaaaaaaaaaaaaare,0,0,zero705,a1S52y5ZVlY,0.0,2017-08-06 06:34:55,True,True
2017-08-06T23:38:18,ellen and nina are the worst,0,0,Wanker Reviews,a1S52y5ZVlY,-1.0,2017-08-06 23:38:18,True,True
2017-08-07T00:00:42,Isn't that the girl from Beyond Two Souls?? Who else know her from that game?,4,1,Jayjay p.,a1S52y5ZVlY,-0.4,2017-08-07 00:00:42,True,True
2017-08-07T08:46:29,Netflix OA??. Am I wrong..,0,0,David J McIntyre,a1S52y5ZVlY,-0.5,2017-08-07 08:46:29,True,True
2017-08-07T17:08:03,This isn't a remake but a sequel since keifer Sutherland is reprising is hole for this movie,0,0,K Say,a1S52y5ZVlY,0.0,2017-08-07 17:08:03,True,True
2017-08-07T17:18:17,Why are they remaking this? The original was really really good.,0,0,Ryan Taylor,a1S52y5ZVlY,0.5375,2017-08-07 17:18:17,True,True
2017-08-08T04:32:23,"I saw this trailer in theaters a few weeks ago. The trailer looks like it literally gives away the entire movie. Thanks for saving me some money, I guess.",0,0,RustySporks,a1S52y5ZVlY,0.0,2017-08-08 04:32:23,True,True
2017-08-08T19:26:54,Pretty disappointed when I didn't hear Death Grips come in after that opening guitar line.,0,0,Arrested Effort,a1S52y5ZVlY,-0.25,2017-08-08 19:26:54,True,True
2017-08-08T19:52:01,Song?,0,0,Fast_hands_Dan,a1S52y5ZVlY,0.0,2017-08-08 19:52:01,True,True
2017-08-09T05:20:41,death grips is that you,0,0,gabby martin,a1S52y5ZVlY,0.0,2017-08-09 05:20:41,True,True
2017-08-09T12:19:10,i actually enjoyed this trailer more than i usually enjoy trailers,0,0,Reatleat Mcpagani,a1S52y5ZVlY,0.4666666666666666,2017-08-09 12:19:10,True,True
2017-08-09T21:51:59,Lame!,0,0,Salty Cracker,a1S52y5ZVlY,-0.625,2017-08-09 21:51:59,True,True
2017-08-10T03:03:59,Stop putting Ellen page in movies. I'd rather watch Julia Roberts in the original,0,0,Maxwell Schultz,a1S52y5ZVlY,0.375,2017-08-10 03:03:59,True,True
2017-08-12T02:43:27,Doesn't the plot kinda seem impossible? I mean this all seems like a 50/50 chance. Correct me if I'm wrong but isn't there a pretty low chance of bringing someone back after stopping their heart? So wouldn't the experiment already be flawed? Feel free to correct me if I'm wrong.,0,1,Gabby Abbott,a1S52y5ZVlY,-0.20324074074074072,2017-08-12 02:43:27,True,True
2017-08-12T03:02:25,"close my eyes and seize it, clench my fist and beat it.",0,0,TheSmashBro98,a1S52y5ZVlY,0.0,2017-08-12 03:02:25,True,True
2017-08-12T04:58:13,"Looks like Elena Gilbert had an awful experience in med school cuz she's once again talking to dead people, is dying and coming back to life and possibly involved in another bridge accident.",0,0,Araceli Kiwrna,a1S52y5ZVlY,-0.3,2017-08-12 04:58:13,True,True
2017-08-12T11:27:36,Türkler kendini göstersin bakim😹👋,1,0,Elvina Prostchud,a1S52y5ZVlY,0.0,2017-08-12 11:27:36,True,True
2017-08-12T21:54:51,European Flatliners,0,0,Angel Velazquez,a1S52y5ZVlY,0.0,2017-08-12 21:54:51,True,True
2017-08-13T02:27:56,Creepiest trailer music ever lol,0,0,Justin Duggan,a1S52y5ZVlY,0.8,2017-08-13 02:27:56,True,True
2017-08-13T08:10:00,whats the name of the song,0,0,Vreal80,a1S52y5ZVlY,0.0,2017-08-13 08:10:00,True,True
2017-08-13T17:53:11,Another bad remade movie.,0,0,Rolo Mendoza,a1S52y5ZVlY,-0.6999999999999998,2017-08-13 17:53:11,True,True
