timestamp,text,like_count,reply_count,author,trailer_id,sentiment_score,datetime,used_for_model,used_for_visualization
2017-09-28T07:03:43,Cancer asf,0,0,psykho,a1S52y5ZVlY,0.0,2017-09-28 07:03:43,False,True
2017-09-28T07:48:29,i watched it today and it’s actually so good,0,1,jorja,a1S52y5ZVlY,0.7,2017-09-28 07:48:29,False,True
2017-09-28T13:44:27,This is actually a really good movie I recommend seeing it,0,0,Stathaki,a1S52y5ZVlY,0.7,2017-09-28 13:44:27,False,True
2017-09-28T14:26:39,nice movie... Coming back from death can OPEN your 3rd eye thats what happened to them... and they cheated death many times that why its hunting them...,1,0,MCii,a1S52y5ZVlY,0.22000000000000003,2017-09-28 14:26:39,False,True
2017-09-28T20:19:14,IM WATCHING THIS TOMORROW,0,1,Joanie Roberti,a1S52y5ZVlY,0.0,2017-09-28 20:19:14,False,True
2017-09-28T23:08:28,That got dark and twisty so fast...,0,0,Christina Le,a1S52y5ZVlY,0.02500000000000001,2017-09-28 23:08:28,False,True
2017-09-29T00:15:34,So this is about experiencing  death for a minute and come back?,0,0,Paul Msilanga,a1S52y5ZVlY,0.0,2017-09-29 00:15:34,False,True
2017-09-29T08:41:40,Can someone help me? What's the song she plays on the piano?,1,2,Carmine Gambardella,a1S52y5ZVlY,0.0,2017-09-29 08:41:40,False,True
2017-09-29T15:17:46,"""Today is a good day to die""",267,3,Gabor Jablonkai,a1S52y5ZVlY,0.7,2017-09-29 15:17:46,False,True
2017-09-29T16:28:35,"Looks bad, don't want to see it",0,0,LaWanda Herminstyne,a1S52y5ZVlY,-0.6999999999999998,2017-09-29 16:28:35,False,True
2017-09-29T20:43:19,This movie has a lower Rotten Tomatoes score than the Emoji Movie,0,0,MegaSoulHero,a1S52y5ZVlY,0.0,2017-09-29 20:43:19,False,True
2017-09-29T22:45:33,What’s the name of the original movie?,0,2,Karl W.,a1S52y5ZVlY,0.375,2017-09-29 22:45:33,False,True
2017-09-30T04:04:23,"Just watched it, very spooky😱",1,0,Vegetable_Shredder,a1S52y5ZVlY,0.2,2017-09-30 04:04:23,False,True
2017-09-30T04:34:41,I had a flatliners ad before this video...,0,0,Mariah Ángel,a1S52y5ZVlY,0.0,2017-09-30 04:34:41,False,True
2017-09-30T06:33:52,I LOVED this movie ❤️🖤❤️🖤,6,0,Tamika Ruiz,a1S52y5ZVlY,0.7,2017-09-30 06:33:52,False,True
2017-09-30T12:22:04,pi papap pi paap pipapap pi pap!,0,0,Holy Cow,a1S52y5ZVlY,0.0,2017-09-30 12:22:04,False,True
2017-09-30T15:25:40,this movie looks good so far!!,0,0,Ricky Moran Jr,a1S52y5ZVlY,0.428125,2017-09-30 15:25:40,False,True
2017-09-30T17:47:21,That soundtrack though!!,0,0,Alezey574,a1S52y5ZVlY,0.0,2017-09-30 17:47:21,False,True
2017-09-30T18:48:40,Is this worth watching?,0,1,Tuana Keles,a1S52y5ZVlY,0.3,2017-09-30 18:48:40,False,True
2017-09-30T20:30:12,the plot seem dry but hey børns is in the soundtrack!,0,0,Sofia Clements,a1S52y5ZVlY,-0.08333333333333331,2017-09-30 20:30:12,False,True
2017-09-30T23:47:44,Best movie 2017,1,0,Amber Ealey,a1S52y5ZVlY,1.0,2017-09-30 23:47:44,False,True
2017-10-01T01:15:08,I will watch  in hour,0,0,che ra,a1S52y5ZVlY,0.0,2017-10-01 01:15:08,False,True
2017-10-01T01:35:10,Looks boring,0,0,Suga G,a1S52y5ZVlY,-1.0,2017-10-01 01:35:10,False,True
2017-10-01T04:54:02,loved this movie,0,0,Afreen Shaik,a1S52y5ZVlY,0.7,2017-10-01 04:54:02,False,True
2017-10-01T05:05:35,"Everyone hated on this movie but it was really entertaining, I watched it about 3 hours ago, the acting was good. Can’t compare it to the original since I have yet to watch it, but I still enjoyed this movie.",1,0,Klay,a1S52y5ZVlY,0.1958333333333333,2017-10-01 05:05:35,False,True
2017-10-01T05:41:20,00:22 Something producers should have said after reading the script.,1,1,Arjun Krishnamurthy,a1S52y5ZVlY,0.0,2017-10-01 05:41:20,False,True
2017-10-01T06:02:03,"Just came back from this. Even though most remakes don't do it for me, this was highly enjoyable.",0,0,Atmospheres Project,a1S52y5ZVlY,0.3333333333333333,2017-10-01 06:02:03,False,True
2017-10-01T06:12:31,NINA!!!!!😍😍,0,0,Joanne Ysunza,a1S52y5ZVlY,0.0,2017-10-01 06:12:31,False,True
2017-10-01T08:13:50,Courtney (Ellen Page) dies soooo 🤷🏼‍♀️,0,0,Bianca Maldonado,a1S52y5ZVlY,0.0,2017-10-01 08:13:50,False,True
2017-10-01T10:19:39,than I realized it's a remake,1,0,Meraxes Rex,a1S52y5ZVlY,0.0,2017-10-01 10:19:39,False,True
2017-10-01T10:23:45,Just finished watching it and really enjoyed it. Give it a chance!,1,0,Suzie,a1S52y5ZVlY,0.625,2017-10-01 10:23:45,False,True
2017-10-01T11:17:39,"The trailer only looks interesting, the actual movie was shitty",4,1,Star cat,a1S52y5ZVlY,0.16666666666666666,2017-10-01 11:17:39,False,True
2017-10-01T13:30:14,"I watched this movie today and I like it, good movie but the creepy bits are pretty creepy but I enjoyed it!",2,0,M_D_165,a1S52y5ZVlY,0.11499999999999999,2017-10-01 13:30:14,False,True
2017-10-01T13:43:43,"""Hey doctor who looks 16, I need you to actually kill me like for real ok? Like go against your Hippocratic oath and just not only harm me but literally kill me ok? Like just do that for a bit, I mean come on you can revive me an all, it's not like I'll lose brain cells and risk being a vegetable for the rest of my life, come on."" *thinks about actually murdering someone* ""aight""",0,0,Alexis Simms,a1S52y5ZVlY,0.15625,2017-10-01 13:43:43,False,True
2017-10-01T14:30:50,wort movie i’ve ever seen maybe,0,0,maya h,a1S52y5ZVlY,0.0,2017-10-01 14:30:50,False,True
2017-10-01T15:09:41,"Why would you want to pay good money to see a remake of what is already a cinema classic. The original film starred Kiefer Sutherland, Julia Roberts, William Baldwin, Oliver Platt, and Kevin Bacon. If you want to see a Flateliners film, see the original.",1,0,Michael Ryan,a1S52y5ZVlY,0.4041666666666667,2017-10-01 15:09:41,False,True
2017-10-01T15:58:56,I loved this movie!! Better then the original !! 💞💞💞💞💞,8,0,FRANCISCO ANZALDO,a1S52y5ZVlY,0.6953125,2017-10-01 15:58:56,False,True
2017-10-01T17:19:08,SPOILER ALERT!           Courtney dies.,0,0,Jokerinho,a1S52y5ZVlY,0.0,2017-10-01 17:19:08,False,True
2017-10-01T20:31:40,So is this a horror movie ? Or something?,0,1,Declan Olivetti,a1S52y5ZVlY,0.0,2017-10-01 20:31:40,False,True
2017-10-01T22:23:43,Dont waste your time with this bs it was fuckin trash,0,0,DatØneGirl_,a1S52y5ZVlY,-0.2,2017-10-01 22:23:43,False,True
2017-10-01T22:47:05,You monitse trailers??,0,0,Global Triathlon Network,a1S52y5ZVlY,0.0,2017-10-01 22:47:05,False,True
2017-10-02T03:01:35,The Lazarus effect part 2??,0,0,Sania Lorene,a1S52y5ZVlY,0.0,2017-10-02 03:01:35,False,True
2017-10-02T05:47:39,"i mean, it was kinda bad😂 but, i now have a joke with my mother about ""what would Ray do?""",0,0,samantha sherman,a1S52y5ZVlY,-0.3125,2017-10-02 05:47:39,False,True
2017-10-02T23:23:37,"Just came back from the movie, it was really amazing!",181,5,Gaming With Gabe,a1S52y5ZVlY,0.37500000000000006,2017-10-02 23:23:37,False,True
2017-10-03T00:38:42,It looked quite poor and shitty ..,0,0,Morty Rod,a1S52y5ZVlY,-0.4,2017-10-03 00:38:42,False,True
2017-10-03T01:57:42,Saw this today... Loved it !,3,0,Stephanie Northup,a1S52y5ZVlY,0.875,2017-10-03 01:57:42,False,True
2017-10-03T11:53:29,Final destination 1 all over again,0,0,Shoumaf,a1S52y5ZVlY,0.0,2017-10-03 11:53:29,False,True
2017-10-03T20:50:56,2:18 so are we just gonna ignore the fact that  Nina dying off a bridge moment doesn't exist here? #tvdrefernece,1,0,Hanan I,a1S52y5ZVlY,0.0,2017-10-03 20:50:56,False,True
2017-10-03T23:42:09,Came here after Dizzy Wright's Flatline release. Fire asf,1,0,Vehzx,a1S52y5ZVlY,0.0,2017-10-03 23:42:09,False,True
2017-10-04T01:30:16,I already saw it was cool,0,0,Juanita Rubio,a1S52y5ZVlY,0.35,2017-10-04 01:30:16,False,True
2017-10-04T02:36:02,how many times does nina drive off bridges? maybe she should get a better car..,0,0,miramirapumpkineater,a1S52y5ZVlY,0.5,2017-10-04 02:36:02,False,True
2017-10-04T06:55:48,*Le sees flatliners* *Le click* *Le sees ghosts*    *Le runs for the cinemas*,0,0,Levitating Eternity,a1S52y5ZVlY,0.0,2017-10-04 06:55:48,False,True
2017-10-04T21:34:18,I came here bcuz of Dizzy Wright,0,0,Mr. Paulino,a1S52y5ZVlY,0.0,2017-10-04 21:34:18,False,True
2017-10-05T07:08:28,Dizzy wrights song brang me,0,0,Pablo Escabar,a1S52y5ZVlY,0.0,2017-10-05 07:08:28,False,True
2017-10-05T17:13:41,Kiersey Clemons 😍😍😍😍,0,0,Dirty Am3rika,a1S52y5ZVlY,0.0,2017-10-05 17:13:41,False,True
2017-10-05T20:25:46,I went see this yesterday and it was pretty good,0,0,DECKERSTAR STAN,a1S52y5ZVlY,0.475,2017-10-05 20:25:46,False,True
2017-10-06T08:41:57,"I'm 17, going on my first ever date tomorrow and were gonna see this. so excited",8,4,Cajeluzy,a1S52y5ZVlY,0.3125,2017-10-06 08:41:57,False,True
2017-10-06T09:01:57,I thought it is sci fi,0,0,Jaycel Butastas,a1S52y5ZVlY,0.0,2017-10-06 09:01:57,False,True
2017-10-06T22:36:11,Whats the name of the piano song in the movie???????,0,0,Khaled Hany,a1S52y5ZVlY,0.0,2017-10-06 22:36:11,False,True
2017-10-06T23:00:47,Don't waste your money mine aswell watch my little pony instead.,1,0,babybirdie,a1S52y5ZVlY,-0.19375,2017-10-06 23:00:47,False,True
2017-10-07T04:21:10,"I just watched this movie in the theatres. I wasn’t expecting much, but actually it was very great ! I loved it, and I was hooked. There are quite a few pop ups, but they’re at the places you don’t expect ! I didn’t even know the movie was this scary lmao. I definitely suggest you guys to give it a chance.",0,0,sel ;-;,a1S52y5ZVlY,0.21875,2017-10-07 04:21:10,False,True
2017-10-07T16:59:14,Whoever says this movies bad is lying cause it’s one of the best I’ve seen go watch it there’s honestly nothing bad about it.,0,0,Ndnd Shv,a1S52y5ZVlY,0.05000000000000007,2017-10-07 16:59:14,False,True
2017-10-07T18:25:17,Honestly looked like one of the dumbest movies of 2017....so logically flawed it's ridiculous.,0,0,Alex Gonzalez,a1S52y5ZVlY,-0.07777777777777778,2017-10-07 18:25:17,False,True
2017-10-07T21:49:21,saw it years ago.............,0,0,compaq63,a1S52y5ZVlY,0.0,2017-10-07 21:49:21,False,True
2017-10-07T22:49:54,Pretty much the whole movie in the trailer,0,0,Ethans Exotics,a1S52y5ZVlY,0.21666666666666667,2017-10-07 22:49:54,False,True
2017-10-08T02:55:41,Hmmm.....interesting,0,0,Nick Rupp,a1S52y5ZVlY,0.0,2017-10-08 02:55:41,False,True
2017-10-08T11:39:43,Ohhhh this is a remake I loved the og so I'm actually excited for this it looks good,1,1,BYUN BAEK,a1S52y5ZVlY,0.5916666666666667,2017-10-08 11:39:43,False,True
2017-10-08T11:55:26,All the American chit chat spoilt it,0,0,Hew Jarsol,a1S52y5ZVlY,0.0,2017-10-08 11:55:26,False,True
2017-10-08T17:50:52,this was one of the best movies i have ever seen!!!,0,0,Emma Corbett,a1S52y5ZVlY,1.0,2017-10-08 17:50:52,False,True
2017-10-08T23:03:38,Is this possible to do in real life? In any case the movie gave me a serious case of the creeps! This seems like it is not based on fiction but reality.,0,0,Praveen Sriram,a1S52y5ZVlY,-0.0722222222222222,2017-10-08 23:03:38,False,True
2017-10-08T23:07:42,Guys I'm about to watch it today. Please tell me if it's good or bad if you had watched it.,0,1,Sabaiba ikari,a1S52y5ZVlY,5.551115123125783e-17,2017-10-08 23:07:42,False,True
2017-10-09T03:44:09,"It was a very amazing movie, would 100% watch it again",0,0,Kai,a1S52y5ZVlY,0.7800000000000001,2017-10-09 03:44:09,False,True
2017-10-09T11:09:21,I liked it. Perfect cast hands down.,3,0,Tay Trïbecā,a1S52y5ZVlY,0.48148148148148145,2017-10-09 11:09:21,False,True
2017-10-09T13:06:10,Dizzy Wright brought me here,0,0,Wade Wilson,a1S52y5ZVlY,0.0,2017-10-09 13:06:10,False,True
2017-10-09T14:12:52,Use Aiden!!!,0,0,dremase6233,a1S52y5ZVlY,0.0,2017-10-09 14:12:52,False,True
2017-10-09T15:40:27,I think this is a story on reddit r/nosleep,0,0,Kah Dizon,a1S52y5ZVlY,0.0,2017-10-09 15:40:27,False,True
2017-10-10T00:23:51,Ha he ha hah he ha ah ha haa hee!,0,0,Ryan Stokes,a1S52y5ZVlY,0.0,2017-10-10 00:23:51,False,True
2017-10-10T00:25:34,Just came back from watching it. AMAZING MOVIE.,1,0,Mayank Verma,a1S52y5ZVlY,0.30000000000000004,2017-10-10 00:25:34,False,True
2017-10-10T13:16:32,Great movie.. too bad it only lasted for 2:28mins,0,0,Asad A K,a1S52y5ZVlY,0.0333333333333334,2017-10-10 13:16:32,False,True
2017-10-10T15:05:01,looks like a fun movie,0,0,SpaceMaker,a1S52y5ZVlY,0.3,2017-10-10 15:05:01,False,True
2017-10-12T14:09:03,This is remake of Flatteners 1990,0,0,Greatness 90s,a1S52y5ZVlY,0.0,2017-10-12 14:09:03,False,True
2017-10-13T01:48:23,"When they die and came to life, Death follows them.",0,0,SSageE Mohmentum,a1S52y5ZVlY,0.0,2017-10-13 01:48:23,False,True
2017-10-13T02:56:44,"WARNING SPOILER ALERT: This trailer is very misleading. At 1:04 When they start saying ""3 mins, wait last time you did 2 mins? What can I say we're competitive"", none of that was mentioned in the film when I saw it. In the film, the members flat-lined ONLY once for 1 minute and soon after that that's when they started having these horrific hallucinations and visions. None of them went back to flat-line more than once for longer periods of time (with the exception of one member who had to flat-line again towards the end to seek forgiveness for committing manslaughter.) Bit disappointing how misleading this was but it was a good film to say the least.",0,0,Francesca Gorman,a1S52y5ZVlY,-0.05555555555555555,2017-10-13 02:56:44,False,True
2017-10-13T04:41:24,Not better than the original,0,0,AnGEL GARCIA,a1S52y5ZVlY,0.0625,2017-10-13 04:41:24,False,True
2017-10-13T11:51:34,"Does Ellen Page really have a thing for the after life? Because you have this and beyond two souls, just saying.",0,0,Orchestra Gamer,a1S52y5ZVlY,0.2,2017-10-13 11:51:34,False,True
2017-10-14T08:17:31,Trailer makes me want to pay to NOT watch this movie.,0,0,Oneiros,a1S52y5ZVlY,0.0,2017-10-14 08:17:31,False,True
2017-10-15T14:15:05,*they are nice cristians realizing they are living in a satanic reality.. why does that remind my of something?*,0,0,Name Last Name,a1S52y5ZVlY,0.6,2017-10-15 14:15:05,False,True
2017-10-15T16:58:13,Jodie O.o??,0,0,ฟงหวิ๋น,a1S52y5ZVlY,0.05,2017-10-15 16:58:13,False,True
2017-10-16T16:22:00,"This movie only got 4% on rotten tomatoes. I've never seen that low of a rating, ever. I really wanted to see it before, but now I'm not sure.",0,0,Mochi Niccals,a1S52y5ZVlY,-0.012499999999999997,2017-10-16 16:22:00,False,True
2017-10-17T21:54:45,"Such a cool idea! Instead of writing new stories, Hollywood should just remake older movies. If those are successful, they could start making sequels or, better yet, prequels. A bunch of studio execs are probably kicking themselves for not thinking of this themselves. I just wish I'd thought of this years ago...",1,0,princeoftidds,a1S52y5ZVlY,0.3317550505050505,2017-10-17 21:54:45,False,True
2017-10-17T22:23:50,The poster isn't good,0,0,Luis Bjerre,a1S52y5ZVlY,0.7,2017-10-17 22:23:50,False,True
2017-10-18T09:46:54,Nice story,0,0,Hugogamer709,a1S52y5ZVlY,0.6,2017-10-18 09:46:54,False,True
2017-10-18T18:03:43,That girl looks like the girl from beyond two souls,0,0,Brennen,a1S52y5ZVlY,0.0,2017-10-18 18:03:43,False,True
2017-10-18T18:15:41,Sračka.,0,0,Kanedup666,a1S52y5ZVlY,0.0,2017-10-18 18:15:41,False,True
2017-10-18T22:40:35,Literally exactly like the Lazarus effect movie smh,0,0,Sarah Haban,a1S52y5ZVlY,0.25,2017-10-18 22:40:35,False,True
2017-10-19T10:12:11,just watch Enjoyed!!!!,0,0,Syahril Amir,a1S52y5ZVlY,1.0,2017-10-19 10:12:11,False,True
2017-10-19T14:34:14,Hollywoods was too lazy too make new moviesn so here they are making old movie again. slow clap ..,0,0,CJ Capinding,a1S52y5ZVlY,-0.07840909090909093,2017-10-19 14:34:14,False,True
2017-10-19T17:07:52,Miss you so much Jodie XD,0,0,Forrest Gump,a1S52y5ZVlY,0.2,2017-10-19 17:07:52,False,True
2017-10-19T17:11:40,Have you seen Aiden ?,0,0,Forrest Gump,a1S52y5ZVlY,0.0,2017-10-19 17:11:40,False,True
2017-10-20T18:42:05,Waste of time,0,0,xander kuruza,a1S52y5ZVlY,-0.2,2017-10-20 18:42:05,False,True
2017-10-22T14:35:54,"Pause at 0:42, Look at bottom left corner…",14,13,Jake Dietz,a1S52y5ZVlY,0.0,2017-10-22 14:35:54,False,True
2017-10-22T16:38:31,Lazarus Effect den sonra iyi gider :D,0,0,Yasin Sil,a1S52y5ZVlY,1.0,2017-10-22 16:38:31,False,True
2017-10-22T18:00:55,Moral of the story: don't die.,3,0,Nic Mey,a1S52y5ZVlY,0.0,2017-10-22 18:00:55,False,True
2017-10-24T02:46:21,Using the actress from inception and making what seems to be another version of that same movie.. People are obviously going to connect and compare. uhmm,0,0,Avi8or,a1S52y5ZVlY,0.0,2017-10-24 02:46:21,False,True
2017-10-24T06:26:05,JANE'S ADDICTION!,0,0,el buen perro,a1S52y5ZVlY,0.0,2017-10-24 06:26:05,False,True
2017-10-24T11:21:04,very good movie,1,0,ปากน้ำเค็ม,a1S52y5ZVlY,0.9099999999999999,2017-10-24 11:21:04,False,True
2017-10-24T13:40:47,As good as emoji,0,0,RoadSamurai,a1S52y5ZVlY,0.7,2017-10-24 13:40:47,False,True
2017-10-24T17:43:58,"Well, in real life, Dr Sam Parnia has now proved that consciousness does continue after being clinically dead.  They have recorded activity of mind/consciousness after brain death.  I know consciousness continues. This movie though is grusome.",0,0,sunny sim,a1S52y5ZVlY,0.0,2017-10-24 17:43:58,False,True
2017-10-24T23:59:04,Moral of it all is dont prank death himself,0,0,#### boss123,a1S52y5ZVlY,0.0,2017-10-24 23:59:04,False,True
2017-10-25T15:33:14,who watched movie i want to know name of song at the end,0,0,suni w,a1S52y5ZVlY,0.0,2017-10-25 15:33:14,False,True
2017-10-26T17:26:53,oh no but they chose .Ellen from junooo.heard the first line and ...,0,0,Happy Michie Worriah,a1S52y5ZVlY,0.25,2017-10-26 17:26:53,False,True
2017-10-27T19:21:13,I never root for the main characters in a horror movie. Too many unwise main characters.,0,0,DM Animation,a1S52y5ZVlY,0.27777777777777773,2017-10-27 19:21:13,False,True
2017-10-28T15:49:09,Ellen can use aiden to protect her,0,0,Ryan Damario,a1S52y5ZVlY,0.0,2017-10-28 15:49:09,False,True
2017-10-30T20:41:04,*First I was pretty interested. All those mind opening scenes an- BOOM ITS A HORROR MOVIE!*,0,0,Kim Jong Un Donkigong,a1S52y5ZVlY,0.2708333333333333,2017-10-30 20:41:04,False,True
2017-11-01T05:54:51,Ellena is still falling of Wickery Bridge 😭😭😭 Some things never change,0,0,Nancy Mwakapenda,a1S52y5ZVlY,0.0,2017-11-01 05:54:51,False,True
2017-11-01T08:55:46,WOAW....!!!!!,0,0,M Prio kuncoro,a1S52y5ZVlY,0.0,2017-11-01 08:55:46,False,True
2017-11-03T07:06:15,just die already Sony,0,0,Niklaus Steffanmullen,a1S52y5ZVlY,0.0,2017-11-03 07:06:15,False,True
2017-11-05T00:02:01,is this a horror movie,0,0,Oofen,a1S52y5ZVlY,0.0,2017-11-05 00:02:01,False,True
2017-11-05T06:35:44,I thought this is the most stupid film. Because they want to die.,0,0,King,a1S52y5ZVlY,-0.14999999999999997,2017-11-05 06:35:44,False,True
2017-11-05T19:46:34,i dont know why i thought it said 'flatearthers',2,0,Nicole.,a1S52y5ZVlY,0.0,2017-11-05 19:46:34,False,True
2017-11-06T02:13:11,this movie sucks,0,0,Quinton K,a1S52y5ZVlY,-0.3,2017-11-06 02:13:11,False,True
2017-11-07T14:00:16,The original with keifer sutherland and Julia Roberts is good.,9,1,Connie Bixby,a1S52y5ZVlY,0.5375,2017-11-07 14:00:16,False,True
2017-11-07T14:13:10,Amazing movie I'm watching it right now,0,0,Flower Power,a1S52y5ZVlY,0.4428571428571429,2017-11-07 14:13:10,False,True
2017-11-08T11:03:29,getting the beyond two souls vibes lol,0,0,Fresh Buzz,a1S52y5ZVlY,0.8,2017-11-08 11:03:29,False,True
2017-11-08T23:42:12,I had watch it.. but i am disappointed,0,0,Sarah Jessica,a1S52y5ZVlY,-0.75,2017-11-08 23:42:12,False,True
2017-11-09T08:56:48,Way to spoil the whole film,0,0,Anna,a1S52y5ZVlY,0.2,2017-11-09 08:56:48,False,True
2017-11-10T00:35:02,It wasn't bad. Just too much sex scenes.,0,0,FlixCreEightR,a1S52y5ZVlY,-0.24999999999999992,2017-11-10 00:35:02,False,True
2017-11-11T15:34:48,Didn’t anyone notice if ur a Nina Dobrev fan they used for vampire diaries the car over the bridge into the water,0,0,Wild Things,a1S52y5ZVlY,0.0,2017-11-11 15:34:48,False,True
2017-11-12T07:36:34,if only there's no ghost i will rate this movie 5/10 since there is a ghost i rate it 1/10,0,0,Franberts,a1S52y5ZVlY,0.0,2017-11-12 07:36:34,False,True
2017-11-12T13:58:02,lemme make a joke      NV4,0,0,Tama_te,a1S52y5ZVlY,0.0,2017-11-12 13:58:02,False,True
2017-11-12T22:03:26,"""THE DOOR"" yeah that's it as always -_- duh!",2,0,BlacK DusK,a1S52y5ZVlY,-0.375,2017-11-12 22:03:26,False,True
2017-11-13T12:28:57,beyond two souls! and inception!,0,0,I Feel Terrible,a1S52y5ZVlY,0.0,2017-11-13 12:28:57,False,True
2017-11-15T03:30:06,the only thing i didnt like about this movie is that only one person died and it was the main actor.,0,0,MR421NOW,a1S52y5ZVlY,0.05555555555555555,2017-11-15 03:30:06,False,True
2017-11-15T19:21:37,5% on Rotten Tomatoes. I'm soooo NOT watching this. Bye,0,0,Laura,a1S52y5ZVlY,0.0,2017-11-15 19:21:37,False,True
2017-11-15T19:22:01,It looks pretentious...,0,0,Laura,a1S52y5ZVlY,-0.3,2017-11-15 19:22:01,False,True
2017-11-15T19:22:48,It has a good plot but a bad development,0,0,Laura,a1S52y5ZVlY,5.551115123125783e-17,2017-11-15 19:22:48,False,True
2017-11-15T19:23:13,"What is the limit of comments on a YouTube video? Who can answer to me, please?",0,0,Laura,a1S52y5ZVlY,0.0,2017-11-15 19:23:13,False,True
2017-11-15T19:24:23,"I love science fiction movies and pretty girls, too",0,0,Laura,a1S52y5ZVlY,0.375,2017-11-15 19:24:23,False,True
2017-11-15T19:25:53,Is this movie good or not? Who watched it already? What do you think Guys??,0,1,Laura,a1S52y5ZVlY,0.7,2017-11-15 19:25:53,False,True
2017-11-15T19:29:20,Original version is better (1990 Julia Roberts),0,1,Laura,a1S52y5ZVlY,0.4375,2017-11-15 19:29:20,False,True
2017-11-16T19:55:09,So... It's like Final Destination?,0,0,Odin,a1S52y5ZVlY,0.0,2017-11-16 19:55:09,False,True
2017-11-20T12:27:47,Expected great things but ended with disappointment,0,0,Anupriya Chandrasekaran,a1S52y5ZVlY,0.03333333333333336,2017-11-20 12:27:47,False,True
2017-11-21T10:24:19,"I was the only person in my theater watching this, it was garbage...",0,0,Skarekrow1592,a1S52y5ZVlY,0.0,2017-11-21 10:24:19,False,True
2017-11-21T21:09:39,I wish this had been a remake of The Thanatonautes by Bernard Werber,0,0,WhitestWaters,a1S52y5ZVlY,0.0,2017-11-21 21:09:39,False,True
2017-11-24T19:27:37,I just saw the movie in theaters today and I really liked every minute of it ! Lots of jump scares tho,0,0,M K,a1S52y5ZVlY,0.75,2017-11-24 19:27:37,False,True
2017-11-25T23:42:20,This looks scary af how do people say this looks bad? It's so scary in fact I don't even wanna watch it.,1,0,Laura Sanchez,a1S52y5ZVlY,-0.5666666666666665,2017-11-25 23:42:20,False,True
2017-11-29T14:49:54,Bellissimo💗,0,0,Sabrina Mosca,a1S52y5ZVlY,0.0,2017-11-29 14:49:54,False,True
2017-12-02T13:52:11,And AGAIN someone is pulled away at the end of the trailer !,1,0,Donnie Brasco,a1S52y5ZVlY,0.0,2017-12-02 13:52:11,False,True
2017-12-02T23:09:38,Remake of the Lazarus Effect?,0,0,skin the whore,a1S52y5ZVlY,0.0,2017-12-02 23:09:38,False,True
2017-12-07T18:49:20,i'm watching this just for nina  love u nina like if you feel the same,1,1,Bhupinder Singh,a1S52y5ZVlY,0.25,2017-12-07 18:49:20,False,True
2017-12-11T13:38:23,What’s the piece she played in the piano for those who has watched the movie ?,0,0,Just Me,a1S52y5ZVlY,0.0,2017-12-11 13:38:23,False,True
2017-12-11T20:07:19,хорошо фильма,0,0,Nisha Nosacheva,a1S52y5ZVlY,0.0,2017-12-11 20:07:19,False,True
2017-12-12T19:12:04,Looks like DMT....,0,0,Viktor Nilsson,a1S52y5ZVlY,0.0,2017-12-12 19:12:04,False,True
2017-12-13T21:27:14,"Just about to watch now , I hope it's as good as the first . 😂",0,0,Redz 71,a1S52y5ZVlY,0.475,2017-12-13 21:27:14,False,True
2017-12-14T03:09:29,Here I  _come_  *The Pirate Bay* !! =],1,0,Voltz,a1S52y5ZVlY,0.5,2017-12-14 03:09:29,False,True
2017-12-14T07:21:37,Wouldn’t it be easier if they just drank bleach,0,0,Dash,a1S52y5ZVlY,0.0,2017-12-14 07:21:37,False,True
2017-12-14T17:28:48,just finished watching this movie,0,1,official wasecorner,a1S52y5ZVlY,0.0,2017-12-14 17:28:48,False,True
2017-12-15T00:43:48,Very decent movie with great point.,0,0,MsNick991,a1S52y5ZVlY,0.5083333333333333,2017-12-15 00:43:48,False,True
2017-12-15T02:44:36,Boring!,0,0,Kakashi BnL,a1S52y5ZVlY,-1.0,2017-12-15 02:44:36,False,True
2017-12-15T12:12:31,Here because of Elena  ooopppssss sorry NINA DOBREV,0,0,Ally Brooke FanBoy,a1S52y5ZVlY,-0.5,2017-12-15 12:12:31,False,True
2017-12-15T14:49:26,I love it!,0,0,FollowtheKarma,a1S52y5ZVlY,0.625,2017-12-15 14:49:26,False,True
2017-12-15T18:21:46,hasnt this bullshite been done before,0,0,maddog hound,a1S52y5ZVlY,0.0,2017-12-15 18:21:46,False,True
2017-12-16T00:43:06,"Don't waste your time , it's crap CRAP CRAP ...",0,0,civreiwey,a1S52y5ZVlY,-0.65,2017-12-16 00:43:06,False,True
2017-12-16T11:56:42,DMT,0,0,robspunk,a1S52y5ZVlY,0.0,2017-12-16 11:56:42,False,True
2017-12-16T12:32:07,Reminds me of The OA,0,0,Nat Thebrave,a1S52y5ZVlY,0.0,2017-12-16 12:32:07,False,True
2017-12-17T18:47:56,any vampire diaries fans here ?,0,1,hanan Hasnaoui,a1S52y5ZVlY,0.0,2017-12-17 18:47:56,False,True
2017-12-18T00:25:13,Bro did nina went over the bridge 💀 what's up with her and bridges,0,0,cam daniel,a1S52y5ZVlY,0.0,2017-12-18 00:25:13,False,True
2017-12-19T11:43:06,Was actually a good movie,0,0,Asher keanu jones,a1S52y5ZVlY,0.7,2017-12-19 11:43:06,False,True
2017-12-19T23:59:31,i wanted to watch it until the music changed at 1:20,0,0,talkingshadow,a1S52y5ZVlY,0.0,2017-12-19 23:59:31,False,True
2017-12-20T02:48:54,What's that music playing at 1:40? It sounds so eerie.,0,0,Christian Joffre,a1S52y5ZVlY,-0.5,2017-12-20 02:48:54,False,True
2017-12-20T21:39:09,Don mess with God maan😇😇😇,1,0,Tuğçe Doğa,a1S52y5ZVlY,-0.175,2017-12-20 21:39:09,False,True
2017-12-21T03:11:08,"You experiment with things, you become the experiment!🎈🎈🎈",0,0,Bruh Man from the 5th flo'!,a1S52y5ZVlY,0.0,2017-12-21 03:11:08,False,True
2017-12-22T20:10:27,Is That Death grips,0,0,Rory Sweeney,a1S52y5ZVlY,0.0,2017-12-22 20:10:27,False,True
