timestamp,text,like_count,reply_count,author,trailer_id,sentiment_score,datetime,used_for_model,used_for_visualization
2017-06-13T13:00:27,First,1,1,aiman sulaiman,a1S52y5ZVlY,0.25,2017-06-13 13:00:27,True,True
2017-06-13T13:02:31,not first,2,0,Unknown Player,a1S52y5ZVlY,-0.125,2017-06-13 13:02:31,True,True
2017-06-13T13:02:55,i click because Beyond Two Souls,2,1,Sophia P.,a1S52y5ZVlY,0.0,2017-06-13 13:02:55,True,True
2017-06-13T13:02:56,first,0,0,Ben Qativi,a1S52y5ZVlY,0.25,2017-06-13 13:02:56,True,True
2017-06-13T13:03:07,What an original idea for a movie. :/,615,27,gimmejr,a1S52y5ZVlY,0.0625,2017-06-13 13:03:07,True,True
2017-06-13T13:03:41,This looks so interesting,0,0,Amelia Jorn,a1S52y5ZVlY,0.5,2017-06-13 13:03:41,True,True
2017-06-13T13:03:41,damn first,0,0,BluppyFlupp CV,a1S52y5ZVlY,0.25,2017-06-13 13:03:41,True,True
2017-06-13T13:04:01,"I see Ellen Page, I click.",537,11,FXCKINGSTYLIK,a1S52y5ZVlY,0.0,2017-06-13 13:04:01,True,True
2017-06-13T13:04:07,is a remake of the original flatliners,1,2,guyver 36,a1S52y5ZVlY,0.375,2017-06-13 13:04:07,True,True
2017-06-13T13:04:36,nope,4,0,Hedonophobia,a1S52y5ZVlY,0.0,2017-06-13 13:04:36,True,True
2017-06-13T13:05:31,I am so excited for this!!!!!,0,0,Kalista,a1S52y5ZVlY,1.0,2017-06-13 13:05:31,True,True
2017-06-13T13:05:46,not not first,0,0,Nikos Bentis,a1S52y5ZVlY,-0.125,2017-06-13 13:05:46,True,True
2017-06-13T13:05:46,remakes...  hollywood is dead,116,24,DM Kaydon's Kastle,a1S52y5ZVlY,-0.2,2017-06-13 13:05:46,True,True
2017-06-13T13:06:00,Yay!!! Ellen Paige is my #1 favorite actress and she looks awesome in this one!!!,38,0,Cristian Cervantes,a1S52y5ZVlY,0.75,2017-06-13 13:06:00,True,True
2017-06-13T13:06:05,Meh. The horror monster stuff ruined it for me.,66,2,Heistmnky,a1S52y5ZVlY,0.0,2017-06-13 13:06:05,True,True
2017-06-13T13:06:12,Might as well show us the ending,511,6,Tom Hyde,a1S52y5ZVlY,0.0,2017-06-13 13:06:12,True,True
2017-06-13T13:06:24,Final destination,2,1,Suraj Pawar,a1S52y5ZVlY,0.0,2017-06-13 13:06:24,True,True
2017-06-13T13:06:43,They acutully fuckin remade it,0,0,The FilmAddict,a1S52y5ZVlY,0.0,2017-06-13 13:06:43,True,True
2017-06-13T13:06:50,Looks interesting!,0,0,Alice Madness,a1S52y5ZVlY,0.625,2017-06-13 13:06:50,True,True
2017-06-13T13:06:53,doesn't look too bad,4,0,Sarah_Marie_K,a1S52y5ZVlY,-0.6999999999999998,2017-06-13 13:06:53,True,True
2017-06-13T13:07:02,bad remake,104,6,AsturManiac,a1S52y5ZVlY,-0.6999999999999998,2017-06-13 13:07:02,True,True
2017-06-13T13:07:14,"Nice trailer, now I don't have to watch the movie",0,0,Soyal7,a1S52y5ZVlY,0.6,2017-06-13 13:07:14,True,True
2017-06-13T13:07:17,Cheating the death then able to see Ghosts... I will go die completely.,0,0,Miti Laha,a1S52y5ZVlY,0.3,2017-06-13 13:07:17,True,True
2017-06-13T13:07:53,Unfortunately not original,54,2,j c,a1S52y5ZVlY,-0.1875,2017-06-13 13:07:53,True,True
2017-06-13T13:08:09,People love complaining about the trailer spoiling the movie lol,3,0,Twelve K,a1S52y5ZVlY,0.65,2017-06-13 13:08:09,True,True
2017-06-13T13:08:23,When was the last time Ellen page was in a film. And this looks original or is this based of anything??,11,5,Matthew McKenna,a1S52y5ZVlY,0.1875,2017-06-13 13:08:23,True,True
2017-06-13T13:08:24,Why remake this?,189,21,marc07112,a1S52y5ZVlY,0.0,2017-06-13 13:08:24,True,True
2017-06-13T13:08:38,"Horrer sarcasm com huge drink kiss sound climax ,,,hollymood movie🔘",2,0,Raj Reddy,a1S52y5ZVlY,0.4,2017-06-13 13:08:38,True,True
2017-06-13T13:08:49,god damn it! Stop revealing the plot in trailers!,432,22,HoverCat,a1S52y5ZVlY,0.0,2017-06-13 13:08:49,True,True
2017-06-13T13:08:52,catch this trailer in 28 seconds!!!!!! please give me a like!,0,0,Kendri Nawaskoro,a1S52y5ZVlY,0.0,2017-06-13 13:08:52,True,True
2017-06-13T13:09:29,beyond two soul ??????,502,15,vitchakorn tunlaphut,a1S52y5ZVlY,0.0,2017-06-13 13:09:29,True,True
2017-06-13T13:09:53,"Part of the appeal of the original is how stellar the cast was, this is the exact opposite.",194,11,Danny Brown,a1S52y5ZVlY,0.21875,2017-06-13 13:09:53,True,True
2017-06-13T13:10:41,Stop remaking great movies and ruining them....,10,10,Caneile,a1S52y5ZVlY,0.8,2017-06-13 13:10:41,True,True
2017-06-13T13:10:48,if there's anything ive learned from 2011's footloose is to never reboot a kevin bacon movie,31,5,TheSroolik,a1S52y5ZVlY,0.0,2017-06-13 13:10:48,True,True
2017-06-13T13:10:49,Only cause ellen page is in it,529,15,Sarah,a1S52y5ZVlY,0.0,2017-06-13 13:10:49,True,True
2017-06-13T13:11:31,"I always knew the original Flatliners was an under appreciated film that did not reach its full potential and it was due for a remake. But instead of another 'The Fly' remake where they could have taken this idea to its full potential, they just decided to make another 10s cash grab horror shlock. What a waste.",608,29,gutz1981,a1S52y5ZVlY,0.19444444444444448,2017-06-13 13:11:31,True,True
2017-06-13T13:11:35,that got dark quickly,279,0,Ethan Pogi,a1S52y5ZVlY,0.09166666666666666,2017-06-13 13:11:35,True,True
2017-06-13T13:11:45,"1:38 you can this ""jumpscare"" coming from an Astronomical Unit. Typical young adults experiment then fall in trouble movie.",0,0,Shark Team,a1S52y5ZVlY,-0.08888888888888889,2017-06-13 13:11:45,True,True
2017-06-13T13:11:52,Jane's Addiction - Up The Beach. Someone is bound to ask...,0,0,Ian Nopper,a1S52y5ZVlY,0.0,2017-06-13 13:11:52,True,True
2017-06-13T13:11:57,Ellen Page!!!,19,0,Hussein Nur,a1S52y5ZVlY,0.0,2017-06-13 13:11:57,True,True
2017-06-13T13:12:07,dull,0,0,Ajt17c,a1S52y5ZVlY,-0.2916666666666667,2017-06-13 13:12:07,True,True
2017-06-13T13:13:22,Sounds like the music was starting to chant BILLY MAHONEY BILLY MAHONEY BILLY MAHONEY. I wonder if theyre gonna keep him in this remake,27,1,Zen Brown,a1S52y5ZVlY,0.0,2017-06-13 13:13:22,True,True
2017-06-13T13:14:19,"interesting,  but I think I've seen the whole movie tho...  ugh why does origanl movies always spoil everything",0,2,stephen moran,a1S52y5ZVlY,0.35,2017-06-13 13:14:19,True,True
2017-06-13T13:14:52,I'm Buddhist so I believe that it takes a while for your soul to leave your body. You're not really dead until you are cold and then your soul has left. If you can be brought back then that's not really dying to me. You can't see what happens after death because your soul doesn't leave right away.,39,50,Joe Williams,a1S52y5ZVlY,-0.05238095238095238,2017-06-13 13:14:52,True,True
2017-06-13T13:14:53,Redbox worthy   the first one is a classic.. kefir and Julia can't be touched,4,3,Bethany Summer,a1S52y5ZVlY,0.24999999999999997,2017-06-13 13:14:53,True,True
2017-06-13T13:15:04,"So, Elena goes off a bridge ... again How original 😏",1906,48,Maeve Noor,a1S52y5ZVlY,0.375,2017-06-13 13:15:04,True,True
2017-06-13T13:15:53,It was alright until the horror bit. ugh.,0,0,Caleb Corlett,a1S52y5ZVlY,0.0,2017-06-13 13:15:53,True,True
2017-06-13T13:16:28,death grips?,0,0,Dursly,a1S52y5ZVlY,0.0,2017-06-13 13:16:28,True,True
2017-06-13T13:16:36,I never seen a movie trailer switch tones this many times,0,0,solodolomomo,a1S52y5ZVlY,0.5,2017-06-13 13:16:36,True,True
2017-06-13T13:16:48,BEWAAAAARREEEEEEEE,0,0,Lemaire,a1S52y5ZVlY,0.0,2017-06-13 13:16:48,True,True
2017-06-13T13:18:20,it started really interesting but then it got weird.,0,0,Liz End,a1S52y5ZVlY,0.0,2017-06-13 13:18:20,True,True
2017-06-13T13:19:04,awwwww.... just weirdly stolen tune from death grips....,0,0,Dursly,a1S52y5ZVlY,-0.5,2017-06-13 13:19:04,True,True
2017-06-13T13:19:06,THIS IS NOT ANOTHER UNORIGINAL REMAKE OR REBOOT BY HOLLYWOOD. THIS IS SUPPOSED TO BE A SEQUEL. Thank you.,0,0,Jim B.,a1S52y5ZVlY,-0.2,2017-06-13 13:19:06,True,True
2017-06-13T13:19:10,Another remake... wtf hwood? No imagination. Pass.,0,1,xskip,a1S52y5ZVlY,-0.5,2017-06-13 13:19:10,True,True
2017-06-13T13:20:38,meh it's been done already.,0,0,Marshall K Johnson,a1S52y5ZVlY,0.0,2017-06-13 13:20:38,True,True
2017-06-13T13:21:28,but why male models?,0,0,Herbert46 Lovecraft,a1S52y5ZVlY,0.0,2017-06-13 13:21:28,True,True
2017-06-13T13:22:08,They should call this OAhhhshit,0,0,Spatiality,a1S52y5ZVlY,0.0,2017-06-13 13:22:08,True,True
2017-06-13T13:22:33,"No thanks, I'd rather just watch the original again.",0,0,Lucy Diamond,a1S52y5ZVlY,0.1375,2017-06-13 13:22:33,True,True
2017-06-13T13:22:51,At first it look great because it was about science and it look more grounded and interesting with these people getting these abilities  but then it turned into a generic horror movie,181,8,MaskdJohn,a1S52y5ZVlY,0.41,2017-06-13 13:22:51,True,True
2017-06-13T13:24:07,Where's Kevin Bacon?,9,0,AA1891,a1S52y5ZVlY,0.0,2017-06-13 13:24:07,True,True
2017-06-13T13:24:47,"Spoiler Alert!      At the end, she wakes up after being dead for eight minutes and whispers: Aiden?",84,9,Ser Twice the Thrice,a1S52y5ZVlY,-0.2,2017-06-13 13:24:47,True,True
2017-06-13T13:24:56,want to see it mostly bc the actors in this movie,0,0,Martha Danielle,a1S52y5ZVlY,0.5,2017-06-13 13:24:56,True,True
2017-06-13T13:25:47,"Its not a remake apparently, mainly because Kiefer Sutherland is coming back in the same role he played in the original. But this cast looks good, the tension is there and does anybody really get pissed off that they remade or made another chapter of a movie from the mid 1980's that nobody really watches anymore ?",39,6,Movie Screen Knows,a1S52y5ZVlY,0.20520833333333333,2017-06-13 13:25:47,True,True
2017-06-13T13:26:10,Ellen Page? Slap-Stick humor? Remake? Nooooooope!,0,0,VisceralVenom,a1S52y5ZVlY,0.0,2017-06-13 13:26:10,True,True
2017-06-13T13:28:19,"For a second there I thought she was Ellie from The Last of Us, damn.",0,0,A wam cup of your mom's ass liquid,a1S52y5ZVlY,0.0,2017-06-13 13:28:19,True,True
2017-06-13T13:28:32,The OA?,0,0,Ayrton Sy,a1S52y5ZVlY,0.0,2017-06-13 13:28:32,True,True
2017-06-13T13:29:19,If you want to see a good version of this movie watch the original.,10,3,H4WK69,a1S52y5ZVlY,0.5375,2017-06-13 13:29:19,True,True
2017-06-13T13:29:30,"Instead of turning it into a sci-fi they made it horror whatta drop, shame",0,0,Yesuhey,a1S52y5ZVlY,0.0,2017-06-13 13:29:30,True,True
2017-06-13T13:31:29,"so original, waaaoaooo",0,0,Kicstarv,a1S52y5ZVlY,0.375,2017-06-13 13:31:29,True,True
2017-06-13T13:31:37,"i know this wont be a good movie, but it has ellen page so what the hell..",0,0,xutek08,a1S52y5ZVlY,0.7,2017-06-13 13:31:37,True,True
2017-06-13T13:32:12,that escalated quickly from sci-fi to horror not expect that,0,0,Rajha,a1S52y5ZVlY,0.3333333333333333,2017-06-13 13:32:12,True,True
2017-06-13T13:33:13,it is said that this movie is not a remake. is a sequel,0,0,MDZA 1988,a1S52y5ZVlY,0.0,2017-06-13 13:33:13,True,True
2017-06-13T13:34:59,"this looks so unnecessary. but nina and tessa fine AF, so it's a yes",0,0,echolot,a1S52y5ZVlY,0.008333333333333331,2017-06-13 13:34:59,True,True
2017-06-13T13:35:24,ive not even seen the original but this looks like trash.  why does this movie exist...,0,0,VideoCop,a1S52y5ZVlY,0.375,2017-06-13 13:35:24,True,True
2017-06-13T13:35:39,Nina 😍,0,0,Sachidananda Swain,a1S52y5ZVlY,0.0,2017-06-13 13:35:39,True,True
2017-06-13T13:36:16,nothing compares to the original!,0,0,Wild Warrior Bill,a1S52y5ZVlY,0.46875,2017-06-13 13:36:16,True,True
2017-06-13T13:36:38,Omg,0,0,Sıla Meraklı,a1S52y5ZVlY,0.0,2017-06-13 13:36:38,True,True
2017-06-13T13:39:33,looks good,0,0,SunSon29,a1S52y5ZVlY,0.7,2017-06-13 13:39:33,True,True
2017-06-13T13:39:41,"It's a SEQUEL not a remake people. And don't complain about the ""lack of originality in Hollywood"" when original movies constantly bomb at the box office. Talk with your money, not your irrelevant YouTube comments",0,0,Chris Robinson,a1S52y5ZVlY,-0.041666666666666664,2017-06-13 13:39:41,True,True
2017-06-13T13:41:02,isn't this a remake of movie with Kiefer Sutherland?,0,0,Kryztof Abner,a1S52y5ZVlY,0.0,2017-06-13 13:41:02,True,True
2017-06-13T13:41:43,The discovery...,0,0,Peder Holthe,a1S52y5ZVlY,0.0,2017-06-13 13:41:43,True,True
2017-06-13T13:42:24,"Flatliners D.O.A. should be it's name,lol",0,0,Mark Allan,a1S52y5ZVlY,0.0,2017-06-13 13:42:24,True,True
2017-06-13T13:42:51,Is it she in beyond two souls?,0,0,Syechan Azka,a1S52y5ZVlY,0.0,2017-06-13 13:42:51,True,True
2017-06-13T13:43:32,"For a second, I thought this was a B.O.B Documentary.",0,0,BlackStarTelevision,a1S52y5ZVlY,0.0,2017-06-13 13:43:32,True,True
2017-06-13T13:44:35,They have ruined the original film🙄,0,0,June Sholaja,a1S52y5ZVlY,0.375,2017-06-13 13:44:35,True,True
2017-06-13T13:45:27,I'm interested. I mean it's not in any way original but it looks kinda solid.  I'm ashamed to say Limitless is one of my favourite guilty pleasures and I can see shades of that in here. Could be fun.,0,0,Jim Johns,a1S52y5ZVlY,0.01875,2017-06-13 13:45:27,True,True
2017-06-13T13:45:57,you either go to heaven or hell foh,0,0,Toshio †,a1S52y5ZVlY,0.0,2017-06-13 13:45:57,True,True
2017-06-13T13:46:36,Is this a remake or a sequel? Isn't Kiefer in this?,0,0,Dustin Martin,a1S52y5ZVlY,0.0,2017-06-13 13:46:36,True,True
2017-06-13T13:46:38,Reviving with a defibrillator.....,0,0,Max,a1S52y5ZVlY,0.0,2017-06-13 13:46:38,True,True
2017-06-13T13:48:22,Ok so This is meant for teens.,1,0,Shoeb Khan,a1S52y5ZVlY,0.5,2017-06-13 13:48:22,True,True
2017-06-13T13:48:32,Fake ‼️‼️,0,0,R-Mon Solace,a1S52y5ZVlY,-0.5,2017-06-13 13:48:32,True,True
2017-06-13T13:49:06,Originality is dead in the movies. Dead.,0,0,Craig Murray,a1S52y5ZVlY,-0.2,2017-06-13 13:49:06,True,True
2017-06-13T13:49:25,pure energy,0,0,Tramain Bacchus,a1S52y5ZVlY,0.21428571428571427,2017-06-13 13:49:25,True,True
2017-06-13T13:49:26,"i like the concept, unoriginal but still compelling. If only the trailer did not give away too much I would've considered placing this in my priority movies list.",0,0,Grimm Snow,a1S52y5ZVlY,0.075,2017-06-13 13:49:26,True,True
2017-06-13T13:49:59,Cant tell if its a Horror movie or not,0,0,SpencerFilms,a1S52y5ZVlY,0.0,2017-06-13 13:49:59,True,True
2017-06-13T13:52:43,Clicked because i saw demi lovato,0,0,QuickBeat,a1S52y5ZVlY,0.0,2017-06-13 13:52:43,True,True
2017-06-13T13:53:10,I thought this was supposed to be a sequel?,0,0,Kevin Miller,a1S52y5ZVlY,0.0,2017-06-13 13:53:10,True,True
2017-06-13T13:55:59,god dammit eli,0,0,UniDraGuine,a1S52y5ZVlY,0.0,2017-06-13 13:55:59,True,True
2017-06-13T13:56:14,The original scared the crap outta me,0,0,John Pappadia,a1S52y5ZVlY,-0.21250000000000002,2017-06-13 13:56:14,True,True
2017-06-13T13:56:43,ellen page,0,0,Tehidiotboys,a1S52y5ZVlY,0.0,2017-06-13 13:56:43,True,True
2017-06-13T13:57:11,At least I love Jane's Addiction,0,0,Jen LuvsHorror,a1S52y5ZVlY,0.1,2017-06-13 13:57:11,True,True
2017-06-13T13:57:12,Nina Dobrev really likes to die in her movies and tv shows.,0,0,Ivana Bogojevic,a1S52y5ZVlY,0.2,2017-06-13 13:57:12,True,True
2017-06-13T14:01:24,flat earthers,1,0,Lineage2Ertheia,a1S52y5ZVlY,-0.025,2017-06-13 14:01:24,True,True
2017-06-13T14:01:37,"Mre recuerda es a Julia Roberts, y otros !",0,0,Ávila_Extremo,a1S52y5ZVlY,0.0,2017-06-13 14:01:37,True,True
2017-06-13T14:02:49,Rule number one of medical experiments. Don't mess with death because death will come hit you in the face,0,0,Multifanprotectoroftheidols,a1S52y5ZVlY,-0.0875,2017-06-13 14:02:49,True,True
2017-06-13T14:02:52,Yeah some shots after the ci bust,0,0,Telefono Airis,a1S52y5ZVlY,0.0,2017-06-13 14:02:52,True,True
2017-06-13T14:03:24,No Kevin Bacon!? No thanks!,0,0,Michael Arsenault,a1S52y5ZVlY,-0.125,2017-06-13 14:03:24,True,True
2017-06-13T14:04:56,Im just waiting for at least one idiot to try this in real life!,0,0,Platon MP,a1S52y5ZVlY,-0.2833333333333334,2017-06-13 14:04:56,True,True
2017-06-13T14:07:20,cant touch the original but looks good,0,0,white wolf,a1S52y5ZVlY,0.5375,2017-06-13 14:07:20,True,True
2017-06-13T14:10:25,Lazarus Effect? Guys?,0,0,SAMMY. GAMING,a1S52y5ZVlY,0.0,2017-06-13 14:10:25,True,True
2017-06-13T14:11:10,Ok Yeah! And you got Ellen and Nina!!!!,0,0,Morgan London,a1S52y5ZVlY,1.0,2017-06-13 14:11:10,True,True
2017-06-13T14:11:21,I like that song,0,0,King Merck,a1S52y5ZVlY,0.0,2017-06-13 14:11:21,True,True
2017-06-13T14:12:52,i liek the 1990 movie but another remake?,0,0,Jean Pierre vargas alvarez,a1S52y5ZVlY,0.0,2017-06-13 14:12:52,True,True
2017-06-13T14:15:35,"oh look, SONY remaking another classic movie. Ghostbusters, and now Flatliners. How long til they wreck Goonies or Gremlins?",0,0,Grey GooTheory,a1S52y5ZVlY,0.05833333333333333,2017-06-13 14:15:35,True,True
2017-06-13T14:15:44,guys we've not even seen the film yet don't judge it and hate on it until you've seen it,0,0,Ben Porter,a1S52y5ZVlY,-0.8,2017-06-13 14:15:44,True,True
2017-06-13T14:15:48,I enjoyed the original. Can't wait to see this one.,0,0,Spooky Boo's Scary Story Time,a1S52y5ZVlY,0.4375,2017-06-13 14:15:48,True,True
2017-06-13T14:15:59,"September, because January was already full of bad movies",0,0,Jay30k,a1S52y5ZVlY,-0.17499999999999993,2017-06-13 14:15:59,True,True
2017-06-13T14:17:20,That is what happens when you play God,0,1,Cpt. Tester,a1S52y5ZVlY,0.0,2017-06-13 14:17:20,True,True
2017-06-13T14:19:22,after we die.....we die,0,0,Di Sky,a1S52y5ZVlY,0.0,2017-06-13 14:19:22,True,True
2017-06-13T14:19:27,Could be good. Could be terrible. Betting on the former.,0,0,Espalorp,a1S52y5ZVlY,-0.10000000000000002,2017-06-13 14:19:27,True,True
2017-06-13T14:19:38,Am I the only one who doesn't like Nina Dobrev's acting ?  😕,0,0,Theos Doron,a1S52y5ZVlY,0.0,2017-06-13 14:19:38,True,True
2017-06-13T14:20:04,What's the one with Keifer Sutherland in it?,0,0,Robokid309,a1S52y5ZVlY,0.0,2017-06-13 14:20:04,True,True
2017-06-13T14:20:23,For a second I thought this was going to be another christian movie...,0,0,Chris,a1S52y5ZVlY,0.0,2017-06-13 14:20:23,True,True
2017-06-13T14:21:59,Final Destination repackaged!!!,0,0,Daniel Duedu,a1S52y5ZVlY,0.0,2017-06-13 14:21:59,True,True
2017-06-13T14:22:44,looks like its not well put together,0,0,ObesePuppies,a1S52y5ZVlY,0.0,2017-06-13 14:22:44,True,True
2017-06-13T14:24:16,"more like ""flat chests""",0,0,ObesePuppies,a1S52y5ZVlY,0.2375,2017-06-13 14:24:16,True,True
2017-06-13T14:24:41,Isn't this a reamake from the 80's???... but is not the same... I will wacht it just to see Diego Freaking LUna...,4,3,LABORATORIO LABCLIZA,a1S52y5ZVlY,0.0,2017-06-13 14:24:41,True,True
2017-06-13T14:25:00,Id prefer Beyond Two Souls movie,2,0,Zed,a1S52y5ZVlY,0.0,2017-06-13 14:25:00,True,True
2017-06-13T14:25:35,"what is the actually singing in the background? All I hear is "" waiting for coffee"" over and over again..",0,0,raggis95,a1S52y5ZVlY,0.0,2017-06-13 14:25:35,True,True
2017-06-13T14:26:20,"No, thanks",0,0,Bruno Ferreira,a1S52y5ZVlY,-0.1,2017-06-13 14:26:20,True,True
2017-06-13T14:26:35,"It's a sequel, not a remake or reboot.",20,4,InvisibleMan95,a1S52y5ZVlY,0.0,2017-06-13 14:26:35,True,True
2017-06-13T14:26:37,You had a really cool premise before you added the horror aspect #dissapointed,0,0,Charlie Frankpitt,a1S52y5ZVlY,0.35,2017-06-13 14:26:37,True,True
2017-06-13T14:26:37,"Reminds me one of my favourite book called ""les Thanatonautes"" by Bernard Werber, it... REALLY is the same idea, I don't know the original movie tbh, but I wonder of my book was an inspiration...",0,0,Kratezia,a1S52y5ZVlY,0.19166666666666665,2017-06-13 14:26:37,True,True
2017-06-13T14:26:47,This looks really stupid. I laughed so hard at how horrible this movie looks,0,0,J.D. Cantu,a1S52y5ZVlY,-0.34791666666666665,2017-06-13 14:26:47,True,True
2017-06-13T14:27:01,OMG JAMES NORTON IS IN THIS MOVIE AND I'M GONNA DIED!!!!! 😍😍😍🙈,0,0,Marina López,a1S52y5ZVlY,0.0,2017-06-13 14:27:01,True,True
2017-06-13T14:28:02,"James Norton deserves more exposure in Hollywood. He's been hitting it out of the park in plenty of UK drama shows like Happy Valley, Grantchester, War & Peace etc.",0,0,sugreev2001,a1S52y5ZVlY,0.65,2017-06-13 14:28:02,True,True
2017-06-13T14:28:17,"had to stop the trailer halfway, so it didn't show me the whole movie",0,0,Bill Cline,a1S52y5ZVlY,0.2,2017-06-13 14:28:17,True,True
2017-06-13T14:28:28,Discount Inception.,0,0,Eder Lopez,a1S52y5ZVlY,0.0,2017-06-13 14:28:28,True,True
2017-06-13T14:28:30,ANOTHER remake?,0,0,xoMUSICismyESCAPEox,a1S52y5ZVlY,0.0,2017-06-13 14:28:30,True,True
2017-06-13T14:29:26,This looks so good,3,1,D Harms,a1S52y5ZVlY,0.7,2017-06-13 14:29:26,True,True
2017-06-13T14:30:23,FlatChested.....,4,1,Mr. Mysterio,a1S52y5ZVlY,0.0,2017-06-13 14:30:23,True,True
2017-06-13T14:30:23,nina,0,0,mahdi edit,a1S52y5ZVlY,0.0,2017-06-13 14:30:23,True,True
2017-06-13T14:30:33,Was going ok until the cliche scene at the end where a girl is dragged through a floor...,0,0,Mauro De Simone,a1S52y5ZVlY,0.5,2017-06-13 14:30:33,True,True
2017-06-13T14:30:38,"I get not remaking iconic classics that were good the first time around but Flatliners isn't one of them. It was a decent movie that I don't mind being remade because today's SFX can really benefit the plot, not to mention the story issues the first one had.",0,0,Cherry Darling,a1S52y5ZVlY,0.3444444444444444,2017-06-13 14:30:38,True,True
2017-06-13T14:30:46,"If you're in the medical field, this looks even more terrible.... sigh",0,2,MoldyBread333,a1S52y5ZVlY,-0.16666666666666666,2017-06-13 14:30:46,True,True
2017-06-13T14:31:42,"Oh no, is that Wooden McAccent from Rogue One? Crap....",0,0,Chris Hutchins,a1S52y5ZVlY,-0.4,2017-06-13 14:31:42,True,True
2017-06-13T14:32:14,Brought to you by the good people of Sony.,0,0,TehMorrizonz,a1S52y5ZVlY,0.7,2017-06-13 14:32:14,True,True
2017-06-13T14:35:52,dont play with death lesson learned,0,0,Madison,a1S52y5ZVlY,0.0,2017-06-13 14:35:52,True,True
2017-06-13T14:36:52,This is literally the netflix movie The Discovery.,0,0,Jocelyn McBride,a1S52y5ZVlY,0.0,2017-06-13 14:36:52,True,True
2017-06-13T14:37:27,"I wouldve liked it to lean on more religious themes of afterlife rather than this ""energy"" crap, thats more interesting IMO. Angel of death shouldve popped up and taken those fools souls for good XD",0,0,Mohamed Adam,a1S52y5ZVlY,0.2857142857142857,2017-06-13 14:37:27,True,True
2017-06-13T14:41:00,It's a sequel and check the writer for this movie he has made some really good movies. You never know if it's a good movie just by the trailer. We can have an amazing trailer and then the movie sucks.,0,0,Sebas Lopez V,a1S52y5ZVlY,0.425,2017-06-13 14:41:00,True,True
2017-06-13T14:41:06,demonic.,0,0,xWatchmen4YeshuaHaMashiachx,a1S52y5ZVlY,0.0,2017-06-13 14:41:06,True,True
2017-06-13T14:41:16,ok let's be honest this looks interesting,0,0,John M,a1S52y5ZVlY,0.5333333333333333,2017-06-13 14:41:16,True,True
2017-06-13T14:41:22,Beyond Two Souls: The after years,0,0,leonthesleepy,a1S52y5ZVlY,0.0,2017-06-13 14:41:22,True,True
2017-06-13T14:41:26,Hollywood couldn't come up with an original idea if they had to gun to their head lol,0,0,anthony cheesman,a1S52y5ZVlY,0.5875,2017-06-13 14:41:26,True,True
2017-06-13T14:42:48,I'm going to reserve my judgement until after seeing the movie.,0,0,Professional Keyboard Warrior,a1S52y5ZVlY,0.0,2017-06-13 14:42:48,True,True
2017-06-13T14:43:50,T R A S H,0,0,Edward Pollei,a1S52y5ZVlY,0.0,2017-06-13 14:43:50,True,True
2017-06-13T14:44:01,piece of crap,0,0,Happy singh,a1S52y5ZVlY,-0.8,2017-06-13 14:44:01,True,True
2017-06-13T14:44:33,Hollywood please leave the 90s and 80s movies alone ok this movie looks good but come with new ideas and i have heard they gonna remake scarface I hope that's not true,0,0,The Laughzone,a1S52y5ZVlY,0.2903409090909091,2017-06-13 14:44:33,True,True
2017-06-13T14:44:57,I m sure no ones gono see this movie in theater,0,0,Happy singh,a1S52y5ZVlY,0.5,2017-06-13 14:44:57,True,True
2017-06-13T14:45:19,"Don't let this distract you from the fact that in 1972, a crack commando unit was sent to prison by a military court for a crime they didn't commit. These men promptly escaped from a maximum-security stockade to the Los Angeles underground. Today, still wanted by the government, they survive as soldiers of fortune. If you have a problem, if no one else can help and if you can find them, maybe, you can hire... the A-Team",0,0,Caleb Scott,a1S52y5ZVlY,-0.1,2017-06-13 14:45:19,True,True
2017-06-13T14:46:58,okey,1,0,Peter Griffin,a1S52y5ZVlY,0.0,2017-06-13 14:46:58,True,True
2017-06-13T14:47:05,"Nina Dobrev, yep i'm watching it",0,0,murry001,a1S52y5ZVlY,0.0,2017-06-13 14:47:05,True,True
2017-06-13T14:47:18,two things to comment: 1. I hate the characters just from the trailer and woud like for them to die so that's a fail. 2. I am glad this kind of movies are made so that stupid people will off themselves trying this bullshit,0,0,sebastep,a1S52y5ZVlY,-0.2,2017-06-13 14:47:18,True,True
2017-06-13T14:47:46,I'm not a horror movie guy but this trailer lured me in. I thought it was pure sci-fi and the twist caught me by surprise. I'll watch this.,0,0,Ike U,a1S52y5ZVlY,0.21428571428571427,2017-06-13 14:47:46,True,True
2017-06-13T14:48:23,is this a reboot or a sequel? I actually might see this if they didn't just shove a bunch of jump scares in it.,0,0,W Trillson,a1S52y5ZVlY,0.0,2017-06-13 14:48:23,True,True
2017-06-13T14:49:36,This is more like a sequel to the one that came out in the 90s with Keifer Sutherland.,0,0,Unkown Cool Looking Robot,a1S52y5ZVlY,0.5,2017-06-13 14:49:36,True,True
2017-06-13T14:51:49,i'm here for captain andor cassian,4,0,Bias Cahaya,a1S52y5ZVlY,0.0,2017-06-13 14:51:49,True,True
2017-06-13T14:52:00,vou ver pelo Diego beijos,1,0,Beatriz Galieta,a1S52y5ZVlY,0.0,2017-06-13 14:52:00,True,True
2017-06-13T14:52:19,Reminds me of Vicious - the excellent V.E Schwab novel...,0,0,Alex Huddleston,a1S52y5ZVlY,0.0,2017-06-13 14:52:19,True,True
2017-06-13T14:52:34,"I'm seeing this for 3 reasons: Ellen Page, Nina Dobrev, and Kiersey Clemmons",0,0,ReverseDarr19 J'onn Merlyn,a1S52y5ZVlY,0.0,2017-06-13 14:52:34,True,True
2017-06-13T14:53:50,"Why did they had to remake this, WHY!?",0,0,Aaack Aardvark,a1S52y5ZVlY,0.0,2017-06-13 14:53:50,True,True
2017-06-13T14:54:07,And we add another movie to the list of movies that needed no remake.,0,0,gezafekete,a1S52y5ZVlY,0.0,2017-06-13 14:54:07,True,True
