timestamp,text,like_count,reply_count,author,trailer_id,sentiment_score,datetime,used_for_model,used_for_visualization
2017-06-13T19:28:52,the grim reaper is coming for all ya'.,0,0,James,a1S52y5ZVlY,-1.0,2017-06-13 19:28:52,True,True
2017-06-13T19:30:02,meh,0,0,ZXxsniperMsrXx,a1S52y5ZVlY,0.0,2017-06-13 19:30:02,True,True
2017-06-13T19:43:15,kitty has become xavier,0,0,Rock Universe,a1S52y5ZVlY,0.0,2017-06-13 19:43:15,True,True
2017-06-13T19:43:52,Nina Dobrev😍,0,0,Tamara Vasilijevic,a1S52y5ZVlY,0.0,2017-06-13 19:43:52,True,True
2017-06-13T19:47:06,So this is a followup to the original. Well at least it might help in making the original more popular I always felt it was underrated.,0,0,dannytheman1313,a1S52y5ZVlY,0.30999999999999994,2017-06-13 19:47:06,True,True
2017-06-13T19:48:35,this is just great elena car going off a bridge again the same way it happened on the vampire diaries,0,0,WWE 2K Women’s Division,a1S52y5ZVlY,0.4,2017-06-13 19:48:35,True,True
2017-06-13T19:52:58,I remember this movie back when it was called Flatliners. Im from the old school. Your not fooling me hollywood.,5,0,Christrulesall2,a1S52y5ZVlY,0.05,2017-06-13 19:52:58,True,True
2017-06-13T19:54:39,Horribly great,0,0,AJB LovE,a1S52y5ZVlY,0.8,2017-06-13 19:54:39,True,True
2017-06-13T19:56:28,Looks great! The original was fantastic. Maybe too early for a re-do? Still... I'll see it.,0,0,Jonny Bartsch,a1S52y5ZVlY,0.46875,2017-06-13 19:56:28,True,True
2017-06-13T19:59:50,Woww. Another remake. Thanks Hollywood. :/,0,0,TWICKS,a1S52y5ZVlY,-0.024999999999999994,2017-06-13 19:59:50,True,True
2017-06-13T19:59:50,i love u nina,0,0,Harry Chand,a1S52y5ZVlY,0.5,2017-06-13 19:59:50,True,True
2017-06-13T20:04:12,"it's actually a better idea to remake bad movies instead of good movies. not a GOOD idea, but a better one.",0,0,beatniece,a1S52y5ZVlY,0.13000000000000003,2017-06-13 20:04:12,True,True
2017-06-13T20:11:39,1:33 that car looks like its straight out of photoshop :D,5,0,AtmosFear Crew,a1S52y5ZVlY,0.6,2017-06-13 20:11:39,True,True
2017-06-13T20:14:30,"they should try this on the kardasian family, but after u hook em up, leave the machine off...",0,0,DavonNathanael,a1S52y5ZVlY,0.0,2017-06-13 20:14:30,True,True
2017-06-13T20:17:43,"aka Deadception, looks interesting",0,0,Robert Adames,a1S52y5ZVlY,0.5,2017-06-13 20:17:43,True,True
2017-06-13T20:25:57,"Hey I have an idea, let's remake another movie",0,0,Matt Gengler,a1S52y5ZVlY,0.0,2017-06-13 20:25:57,True,True
2017-06-13T20:32:41,Ellen Page movies suck,0,0,Violet Rain,a1S52y5ZVlY,0.0,2017-06-13 20:32:41,True,True
2017-06-13T20:34:22,Does Hollywood have a damn original movie for us anymore? Where's the freakin creativity gone?? Just rip off every old movie and make it worse!,0,0,Violet Rain,a1S52y5ZVlY,-0.00833333333333334,2017-06-13 20:34:22,True,True
2017-06-13T20:36:06,DEATH GRIPS!!,0,0,asdfghjkl9260,a1S52y5ZVlY,0.0,2017-06-13 20:36:06,True,True
2017-06-13T20:38:32,See what happens when you play with death,0,0,SMP2390,a1S52y5ZVlY,0.0,2017-06-13 20:38:32,True,True
2017-06-13T20:38:33,Another remake whyyyyyyyy!!!!,0,0,ALL IN ONE,a1S52y5ZVlY,0.0,2017-06-13 20:38:33,True,True
2017-06-13T20:40:37,COOOOOOOOOOOOOOOL,0,0,Iso Aqua,a1S52y5ZVlY,0.0,2017-06-13 20:40:37,True,True
2017-06-13T20:43:35,Song at 1:40 is: 2 Bit Pie - Soto Mundo,4,0,Mikkel Vindum,a1S52y5ZVlY,0.0,2017-06-13 20:43:35,True,True
2017-06-13T20:52:59,This movie reminds me of Conner's guitar tech from Popstar Never Stop Never Stopping,0,0,balloonslayer,a1S52y5ZVlY,0.0,2017-06-13 20:52:59,True,True
2017-06-13T20:53:03,Saw the original. It was good. Not so sure about this. Have to see it. I like so far the car scene with the hand.,0,0,Kelly,a1S52y5ZVlY,0.41875,2017-06-13 20:53:03,True,True
2017-06-13T20:58:38,this is the discovery...,0,0,Potion Seller,a1S52y5ZVlY,0.0,2017-06-13 20:58:38,True,True
2017-06-13T21:09:20,"Hey, why Hollywood didn't make a reboot for Total Recall remake still? It's been 5 friggin' years already... Maybe Robocop too?",0,0,Selim Kuriş,a1S52y5ZVlY,0.0,2017-06-13 21:09:20,True,True
2017-06-13T21:12:50,"Sony, Another reboot??? COME ON!!!! Enough with Ghostbusters 2016",0,0,CarlitosAPC,a1S52y5ZVlY,0.0,2017-06-13 21:12:50,True,True
2017-06-13T21:15:57,Dr Elena Salvatore,0,0,Chocolate Lover,a1S52y5ZVlY,0.0,2017-06-13 21:15:57,True,True
2017-06-13T21:17:21,well it at least gets 20 pts for using one of janes addictions greats in the intro,0,0,jncojeanz,a1S52y5ZVlY,-0.3,2017-06-13 21:17:21,True,True
2017-06-13T21:29:27,This is definitely my cup of tea.,0,0,Superman Steve,a1S52y5ZVlY,0.0,2017-06-13 21:29:27,True,True
2017-06-13T21:40:02,remake fail!,0,0,Der Red,a1S52y5ZVlY,-0.625,2017-06-13 21:40:02,True,True
2017-06-13T21:42:26,Wow! me gusta la idea de esta película.,0,0,Jose Garcia,a1S52y5ZVlY,0.125,2017-06-13 21:42:26,True,True
2017-06-13T21:47:21,did i just see all the movie?,0,0,Gio,a1S52y5ZVlY,0.0,2017-06-13 21:47:21,True,True
2017-06-13T21:50:37,it looks like its gonna be a good remake.,0,0,Adam Olaso,a1S52y5ZVlY,0.7,2017-06-13 21:50:37,True,True
2017-06-13T21:52:29,"If there is a Heaven, then I always sort of assumed that it had a bureaucratic process for this sort of thing, you know? Like there's a process for just when your heart has stopped and when you're really dead.",0,0,Carly Crays,a1S52y5ZVlY,-0.2,2017-06-13 21:52:29,True,True
2017-06-13T21:58:20,Chances of me surviving this if I tried,0,0,Yurp,a1S52y5ZVlY,0.0,2017-06-13 21:58:20,True,True
2017-06-13T21:59:58,"100% on board until the unnecessary jump scares. Like, it's creepy enough to have strange stuff happen after coming back from the dead a bunch of times. Use that creepiness filmmakers, build natural tension, enough with the jump scares.",0,0,Rick Veloz,a1S52y5ZVlY,-0.13125,2017-06-13 21:59:58,True,True
2017-06-13T22:03:59,so if you stop your heart then restart it ghosts will haunt you? ok,0,0,Jacob S,a1S52y5ZVlY,0.5,2017-06-13 22:03:59,True,True
2017-06-13T22:14:49,"It kinda looks good, has a great cast Ellen, Diego, its a good horror show, so yeah I will give it a chance, at least its not Power Rangers or Ghosbusters",1,0,Aaron Mijail Herrera Castro,a1S52y5ZVlY,0.47500000000000003,2017-06-13 22:14:49,True,True
2017-06-13T22:16:13,"Thats not a remake, its a sequel. Sunderland is returning as Nelson",0,0,Krasen Belev,a1S52y5ZVlY,0.0,2017-06-13 22:16:13,True,True
2017-06-13T22:18:44,The Lazarus Effect...with Ellen Page.,0,0,Jairo Mera,a1S52y5ZVlY,0.0,2017-06-13 22:18:44,True,True
2017-06-13T22:19:38,"the weirdest movie I've ever seen, but I got interested to watch it.",0,0,Jos -Al,a1S52y5ZVlY,0.25,2017-06-13 22:19:38,True,True
2017-06-13T22:22:10,No.,0,0,Don The Movie Reviewer,a1S52y5ZVlY,0.0,2017-06-13 22:22:10,True,True
2017-06-13T22:26:33,This is some forgettable garbage,0,0,Jophus Oglethorpe,a1S52y5ZVlY,-0.5,2017-06-13 22:26:33,True,True
2017-06-13T22:42:52,Wow Nina dobrev has really bad luck with bridges above water 😂,0,0,booB3AR,a1S52y5ZVlY,-0.19999999999999996,2017-06-13 22:42:52,True,True
2017-06-13T22:48:39,looks trash...,0,0,Kamina Magog,a1S52y5ZVlY,0.0,2017-06-13 22:48:39,True,True
2017-06-13T22:49:25,"Can I run these movie trailers on my channel ""sblack3001'? More exposure for you.",0,0,"Dr. Sylvia Black, PhD",a1S52y5ZVlY,0.5,2017-06-13 22:49:25,True,True
2017-06-13T22:58:32,Who wants to watch a remake with a lesbian in it? I do not!,0,0,John Lincoln Hawk,a1S52y5ZVlY,0.25,2017-06-13 22:58:32,True,True
2017-06-13T23:05:15,looks good can't wait,0,0,Josh Shardlow,a1S52y5ZVlY,0.7,2017-06-13 23:05:15,True,True
2017-06-13T23:06:50,The oa,0,0,Yousef,a1S52y5ZVlY,0.0,2017-06-13 23:06:50,True,True
2017-06-13T23:36:00,not a remake,0,0,Andrea 217,a1S52y5ZVlY,0.0,2017-06-13 23:36:00,True,True
2017-06-13T23:40:37,i would tap Ellen even she size cup A,0,0,Super Konek,a1S52y5ZVlY,0.0,2017-06-13 23:40:37,True,True
2017-06-13T23:46:03,Oh look..........Another Hollywood remake,0,0,excelerater,a1S52y5ZVlY,0.0,2017-06-13 23:46:03,True,True
2017-06-13T23:47:06,it looked pretty cool. until it became another haunting movie.,0,0,Lyle Tito,a1S52y5ZVlY,0.3,2017-06-13 23:47:06,True,True
2017-06-13T23:54:41,Another movie ruined by its own trailer,0,0,FirstTime ISawJupiter,a1S52y5ZVlY,0.6,2017-06-13 23:54:41,True,True
2017-06-14T00:00:50,Well I'm excited for this!!,1,0,Lily201186,a1S52y5ZVlY,0.5859375,2017-06-14 00:00:50,True,True
2017-06-14T00:11:21,This is the OA all over again! Netflix it and see,0,0,SuperSheamarie,a1S52y5ZVlY,0.0,2017-06-14 00:11:21,True,True
2017-06-14T00:16:24,One can only dream for an original idea,0,0,UrbanExplorer1000,a1S52y5ZVlY,0.1875,2017-06-14 00:16:24,True,True
2017-06-14T00:35:25,Beyond: Two Souls Final Destination,13,0,Counterpoint Gaming,a1S52y5ZVlY,0.0,2017-06-14 00:35:25,True,True
2017-06-14T00:38:01,"👍🙄 This must be that new DLC for beyond two souls, Starring that amazing Canadian actress named​ Ellen page everyone's been talking about..., I must play this ASAP 👍😋..., Looks great by the way lol 👏😱...",9,0,Dominant Raw1ne,a1S52y5ZVlY,0.5840909090909092,2017-06-14 00:38:01,True,True
2017-06-14T00:39:11,Never saw the original so might watch this.,0,0,Allan Alberts,a1S52y5ZVlY,0.375,2017-06-14 00:39:11,True,True
2017-06-14T00:41:39,Junk Remake!,0,0,Evil Droid,a1S52y5ZVlY,0.0,2017-06-14 00:41:39,True,True
2017-06-14T00:42:52,the original looked better.,0,0,NichoTBE,a1S52y5ZVlY,0.4375,2017-06-14 00:42:52,True,True
2017-06-14T00:47:13,If Kiefer Sutherland's not in this it won't even be worth it,0,0,Chloe Champion,a1S52y5ZVlY,0.3,2017-06-14 00:47:13,True,True
2017-06-14T00:50:55,no,0,0,SephTube,a1S52y5ZVlY,0.0,2017-06-14 00:50:55,True,True
2017-06-14T01:02:00,ey cassian,0,0,DanceLikeUmaThurman,a1S52y5ZVlY,0.0,2017-06-14 01:02:00,True,True
2017-06-14T01:07:00,You get what anyone gets... you get a lifetime                                  -Death,0,0,SCP-1715,a1S52y5ZVlY,0.0,2017-06-14 01:07:00,True,True
2017-06-14T01:08:13,don't play with death meh,0,0,zafri suzastri,a1S52y5ZVlY,0.0,2017-06-14 01:08:13,True,True
2017-06-14T01:15:21,This looks similar to the Lazareth affect :-l,0,0,PrincessSarah090288,a1S52y5ZVlY,0.0,2017-06-14 01:15:21,True,True
2017-06-14T01:21:52,"0:00 to 0:13 if I got an invitation like that, I'd accept too. =)",0,0,STAG162,a1S52y5ZVlY,0.5,2017-06-14 01:21:52,True,True
2017-06-14T01:22:58,looks like a cheap straight to video movie,0,0,K-CADE,a1S52y5ZVlY,0.30000000000000004,2017-06-14 01:22:58,True,True
2017-06-14T01:24:31,The Lazarus Project + Final Destination = Flatliners.....very original Hollywood,0,0,TheDynamicContinuity,a1S52y5ZVlY,0.1875,2017-06-14 01:24:31,True,True
2017-06-14T01:31:27,its a remake,0,0,scott4767,a1S52y5ZVlY,0.0,2017-06-14 01:31:27,True,True
2017-06-14T01:42:56,Death grips!?!?          BEWAAAAAAAAAAAAAAARE!!!,0,0,Sharky McShark,a1S52y5ZVlY,0.0,2017-06-14 01:42:56,True,True
2017-06-14T01:48:31,Anyone the know the name of the song at 0:57? Thanks.,0,0,ihateu890,a1S52y5ZVlY,0.2,2017-06-14 01:48:31,True,True
2017-06-14T02:02:59,Now that's what I call a new idea .....FINALLY,0,0,Slowpoke x_x,a1S52y5ZVlY,0.13636363636363635,2017-06-14 02:02:59,True,True
2017-06-14T02:14:07,i'm literally only here for diego luna,9,0,februarysongawake,a1S52y5ZVlY,0.0,2017-06-14 02:14:07,True,True
2017-06-14T02:20:24,this is a mix between The OA and the Lazarus Efect,0,0,ingemar mercado moya,a1S52y5ZVlY,0.0,2017-06-14 02:20:24,True,True
2017-06-14T02:37:39,Looks pre rad.. I in (not that rad but yes why not),0,0,Paprika Harris,a1S52y5ZVlY,0.0,2017-06-14 02:37:39,True,True
2017-06-14T02:41:05,ok at first it was really cool. and then it was Chronical and Then it was final destination.,0,0,Gabe Martin,a1S52y5ZVlY,0.275,2017-06-14 02:41:05,True,True
2017-06-14T02:45:52,I hope I'm not the only one that's actually looking forward to this...,0,0,Tessa Pitts,a1S52y5ZVlY,0.0,2017-06-14 02:45:52,True,True
2017-06-14T02:48:29,So no strange dance moves?,0,0,THE GOOD CONTENT,a1S52y5ZVlY,0.025,2017-06-14 02:48:29,True,True
2017-06-14T02:48:31,The Flatline Destination.,0,0,Organon,a1S52y5ZVlY,0.0,2017-06-14 02:48:31,True,True
2017-06-14T02:49:33,ellen page is in it... must watch,0,0,94Rr94,a1S52y5ZVlY,0.0,2017-06-14 02:49:33,True,True
2017-06-14T02:49:50,This would be better if everyone's Bacon number was 1.,0,0,Organon,a1S52y5ZVlY,0.5,2017-06-14 02:49:50,True,True
2017-06-14T02:49:52,"This trailer showed up in my suggestions after watching the trailer of Aftermath. I guess the relationship they both have is ""trailers that show the entire movie"".",0,0,THE GOOD CONTENT,a1S52y5ZVlY,0.0,2017-06-14 02:49:52,True,True
2017-06-14T02:55:01,Final destination?,0,0,Ashley Ramirez,a1S52y5ZVlY,0.0,2017-06-14 02:55:01,True,True
2017-06-14T03:09:50,UUUGGGHHH............,0,0,Amédée Boulette,a1S52y5ZVlY,0.0,2017-06-14 03:09:50,True,True
2017-06-14T03:29:36,# looks like a waste of time an money,0,0,Deep South Tasmania Digger.,a1S52y5ZVlY,-0.2,2017-06-14 03:29:36,True,True
2017-06-14T03:39:05,They left out the Asian.,0,0,George Sarah,a1S52y5ZVlY,0.0,2017-06-14 03:39:05,True,True
2017-06-14T03:42:20,*JUNO + INCEPTION + INSIDIOUS*,0,0,Ramses Amon RA,a1S52y5ZVlY,0.0,2017-06-14 03:42:20,True,True
2017-06-14T03:47:47,The moral of the story: Do not mess with Grim Reaper!,813,11,TheSorrowLand,a1S52y5ZVlY,-0.30416666666666664,2017-06-14 03:47:47,True,True
2017-06-14T03:48:50,Well that escalated quickly.....,99,0,fatboyRAY24,a1S52y5ZVlY,0.3333333333333333,2017-06-14 03:48:50,True,True
2017-06-14T03:49:59,Love the music anybody know where to get it,0,1,David Flores,a1S52y5ZVlY,0.5,2017-06-14 03:49:59,True,True
2017-06-14T03:51:51,Did the beginning remind anyone of Beware by Death Grips?,2,0,Neil Malakar,a1S52y5ZVlY,0.0,2017-06-14 03:51:51,True,True
2017-06-14T03:52:28,Ellen Page was dead for so long she came back straight,0,0,Nate The Great,a1S52y5ZVlY,-0.012499999999999997,2017-06-14 03:52:28,True,True
2017-06-14T04:05:31,Will have to see how it compares to the original-- kinda hard to beat Kiefer Sutherland,0,0,Dana Weeks,a1S52y5ZVlY,0.04166666666666666,2017-06-14 04:05:31,True,True
2017-06-14T04:17:36,I CLOSE MY EYES AND SEIZE IT. I CLENCH MY FISTS AND BEAT IT. I LIGHT MY TORCH AND BURN IT,0,0,Frecuencia Molotov,a1S52y5ZVlY,0.4,2017-06-14 04:17:36,True,True
2017-06-14T04:18:28,I too like to kill myself and hope everything works out.,0,0,Jinx,a1S52y5ZVlY,0.0,2017-06-14 04:18:28,True,True
2017-06-14T04:26:09,"Ok another good movie that should not have been remade... I died for real and can tell you what happens, that is if you can find me on FB.",0,0,BigWater59,a1S52y5ZVlY,0.4666666666666666,2017-06-14 04:26:09,True,True
2017-06-14T04:29:24,"I have had 2 near fatal heart failures both with PEs, and both times dead for over an hour before revived. I can tell you whats there. Or not there... 😸",0,0,Bernice Panders,a1S52y5ZVlY,-0.05,2017-06-14 04:29:24,True,True
2017-06-14T04:33:45,She finally looks like an adult,0,0,ArtofLunatik,a1S52y5ZVlY,0.05,2017-06-14 04:33:45,True,True
2017-06-14T04:43:06,too much on that trailer,0,0,john diplan,a1S52y5ZVlY,0.2,2017-06-14 04:43:06,True,True
2017-06-14T04:50:14,They're remaking this?!,0,0,Lioness006,a1S52y5ZVlY,0.0,2017-06-14 04:50:14,True,True
2017-06-14T05:00:02,So Discovery !,0,0,Pramod Bhatt,a1S52y5ZVlY,0.0,2017-06-14 05:00:02,True,True
2017-06-14T05:08:38,where is David Bacon?,0,0,Venom Wolf,a1S52y5ZVlY,0.0,2017-06-14 05:08:38,True,True
2017-06-14T05:34:42,i thought it was gonn be like OA but then it became final destination lol XD,0,0,Kris2Chan,a1S52y5ZVlY,0.4,2017-06-14 05:34:42,True,True
2017-06-14T05:39:53,"Like too big to fail banks, american hollywood id scared to inveting money into new ideas, directors, scripts. much rather reuse reuse rehash same old shit. ffs. they they wonder hmm why arent people coming to our movies :/",0,0,LordAugastus,a1S52y5ZVlY,-0.05636363636363636,2017-06-14 05:39:53,True,True
2017-06-14T06:18:30,"I am sure I watched this movie in the 1980s! This looks good but it isn't new, I feel like just watching the old one, I remember it was pretty good too.",0,0,Michael Gerrard,a1S52y5ZVlY,0.41856060606060613,2017-06-14 06:18:30,True,True
2017-06-14T07:03:16,Shows too much,0,0,tamimerkaz,a1S52y5ZVlY,0.2,2017-06-14 07:03:16,True,True
2017-06-14T07:09:14,Come on Hollywood! Your running out of ideas..........another remake.,0,0,andgate2000,a1S52y5ZVlY,0.0,2017-06-14 07:09:14,True,True
2017-06-14T07:14:16,es la actris de beyond two souls???,0,0,Adrian Flores,a1S52y5ZVlY,0.0,2017-06-14 07:14:16,True,True
2017-06-14T07:17:30,Yeesh,0,0,Campbell Malcolm,a1S52y5ZVlY,0.0,2017-06-14 07:17:30,True,True
2017-06-14T07:35:54,wasn't this a joke movie in popstar never stop never stopping?,0,0,Jester Godfield,a1S52y5ZVlY,0.0,2017-06-14 07:35:54,True,True
2017-06-14T08:35:18,am I the only one who thinks this looks pretty good?,0,0,mat lohn,a1S52y5ZVlY,0.31666666666666665,2017-06-14 08:35:18,True,True
2017-06-14T08:35:51,Y'all wrong. It's the lazious effect remake!!!,0,1,bobgoboom 5,a1S52y5ZVlY,-0.9765625,2017-06-14 08:35:51,True,True
2017-06-14T08:43:44,Dream sequences the movie...,0,0,The Floating Prince,a1S52y5ZVlY,0.0,2017-06-14 08:43:44,True,True
2017-06-14T08:49:22,Ellie?,0,0,MOCi,a1S52y5ZVlY,0.0,2017-06-14 08:49:22,True,True
2017-06-14T09:04:43,"I mean, the remake doesn't look THAT bad. I'll watch it only bc Nina and Ellen",0,0,xaria,a1S52y5ZVlY,-0.3374999999999999,2017-06-14 09:04:43,True,True
2017-06-14T09:12:31,At the beginning I hear Death Grips,2,0,VeanZann,a1S52y5ZVlY,0.0,2017-06-14 09:12:31,True,True
2017-06-14T09:22:27,Meh..,0,0,V Sen,a1S52y5ZVlY,0.0,2017-06-14 09:22:27,True,True
2017-06-14T09:29:21,this is not remake but sequel n Kiefer Sutherland is also there in the movie.,0,0,V Sen,a1S52y5ZVlY,0.0,2017-06-14 09:29:21,True,True
2017-06-14T09:41:00,Like I said earlier. I've seem the original flatliners and compared to this it looks much better. Don't get me wrong I love a good reboot and even the actors playing in it. But I don't find this very promising at all.,0,0,Sonja Evans,a1S52y5ZVlY,0.2621428571428571,2017-06-14 09:41:00,True,True
2017-06-14T09:50:22,Subliminal population control  Also the death scene from Brainstorm with Christopher Walkins that was intense,0,0,Jacob David Cunningham,a1S52y5ZVlY,0.2,2017-06-14 09:50:22,True,True
2017-06-14T10:12:11,it's a good day to die!,0,0,Fakhrusy Syakirin,a1S52y5ZVlY,0.875,2017-06-14 10:12:11,True,True
2017-06-14T10:34:38,this looks like bare shite,0,0,chiemeka osuagwu,a1S52y5ZVlY,0.05,2017-06-14 10:34:38,True,True
2017-06-14T10:42:28,becuz i literally wasnt gonna like this trailer..seeing the side effects to what they did actually makes it worth watching..dnt think u can play with death n not be a ripple effect..karma is a bitch..n he does collect,0,0,Ashley Bean,a1S52y5ZVlY,0.15,2017-06-14 10:42:28,True,True
2017-06-14T11:12:37,Wow. That actually looks pretty good....,0,0,actanner,a1S52y5ZVlY,0.26249999999999996,2017-06-14 11:12:37,True,True
2017-06-14T11:16:17,because that's how the human heart works,0,0,misc,a1S52y5ZVlY,0.0,2017-06-14 11:16:17,True,True
2017-06-14T11:27:32,the Oa???,0,0,Jackson Lock,a1S52y5ZVlY,0.0,2017-06-14 11:27:32,True,True
2017-06-14T11:34:44,"Wow, Sony doing another remake, didn't they learn from Ghostbusters?",0,0,Marcos Cintron,a1S52y5ZVlY,0.1,2017-06-14 11:34:44,True,True
2017-06-14T11:43:41,yes,0,0,Nikki Foster,a1S52y5ZVlY,0.0,2017-06-14 11:43:41,True,True
2017-06-14T12:01:52,I'm watching for Nina who is with me ???,0,0,John Abrakhaimov,a1S52y5ZVlY,0.0,2017-06-14 12:01:52,True,True
2017-06-14T12:38:06,Any tvd fans triggered by the part with the car going over the bridge?,0,0,Uyanda motsoahae,a1S52y5ZVlY,0.0,2017-06-14 12:38:06,True,True
2017-06-14T12:50:53,Nice!,0,0,Gabriel Incognito,a1S52y5ZVlY,0.75,2017-06-14 12:50:53,True,True
2017-06-14T13:13:40,"when you flatline, you suffer brain damage, you get dumber not smarter, you don't gain abilities, you lose some.",1,1,he11b1ade,a1S52y5ZVlY,0.0,2017-06-14 13:13:40,True,True
2017-06-14T13:41:32,Ninaaaaa❤️ and this movie looks so good,0,0,• Shay •,a1S52y5ZVlY,0.7,2017-06-14 13:41:32,True,True
2017-06-14T14:20:54,is this a sci-fi movie or horror movie,0,0,I'M QADIR JAILANI,a1S52y5ZVlY,0.0,2017-06-14 14:20:54,True,True
2017-06-14T14:24:27,I'm not sure if that's Nina or Victoria,0,0,Pen L,a1S52y5ZVlY,-0.25,2017-06-14 14:24:27,True,True
2017-06-14T14:34:40,this movie looks insane !,0,0,jérémy,a1S52y5ZVlY,-1.0,2017-06-14 14:34:40,True,True
2017-06-14T14:42:32,This is satanic NWO predictive programming,3,0,Antisocialist,a1S52y5ZVlY,0.0,2017-06-14 14:42:32,True,True
2017-06-14T15:04:33,Yeah. New generation crap. At least the original had more relatable characters.,0,0,TheNinjaMarmot,a1S52y5ZVlY,-0.017727272727272723,2017-06-14 15:04:33,True,True
2017-06-14T15:19:49,no kevin bacon?????? this monsters,0,0,Alejandro Frade,a1S52y5ZVlY,0.0,2017-06-14 15:19:49,True,True
2017-06-14T15:25:42,"The original rocked, really no reason to make this wanna be pile of crap! This don't even look as creepy as the original -_-",0,0,xSMOKExEMxALLx,a1S52y5ZVlY,-0.17,2017-06-14 15:25:42,True,True
2017-06-14T15:37:06,it actually seems pretty decent for a remake...I never really expect much out of them this one seems decent !,0,0,eqbobyboucher,a1S52y5ZVlY,0.1208333333333333,2017-06-14 15:37:06,True,True
2017-06-14T15:44:21,"Sooo...it's just Final Destination, but worse somehow?",0,0,javachef828,a1S52y5ZVlY,-0.2,2017-06-14 15:44:21,True,True
2017-06-14T15:44:34,only cause nina dobrev is in it,0,0,FRAN,a1S52y5ZVlY,0.0,2017-06-14 15:44:34,True,True
2017-06-14T16:03:59,Final destination on steriods,0,0,shreyas vispute,a1S52y5ZVlY,0.0,2017-06-14 16:03:59,True,True
2017-06-14T16:16:06,The original flatliners was never really a good film to begin with. Just look at its rotten tomatoes score,0,0,che guevara,a1S52y5ZVlY,0.012500000000000011,2017-06-14 16:16:06,True,True
2017-06-14T16:21:02,Me heche un pedo muy sabroso,0,0,Javier Mendoza,a1S52y5ZVlY,0.0,2017-06-14 16:21:02,True,True
2017-06-14T16:38:04,How much you want to bet that the ending will reveal that everything was in Ellen pages head when she was dead.,0,0,Gorllomi xo,a1S52y5ZVlY,0.0,2017-06-14 16:38:04,True,True
2017-06-14T16:46:13,check how trump birthday was celebrated in India . http://thinkasm.com/trump-turning-71-hindu-sena-celebrates-in-india-while-america-protests/,0,0,Abhishek Singh,a1S52y5ZVlY,0.35,2017-06-14 16:46:13,True,True
2017-06-14T18:15:06,"1:44 ""Something is coming for us!""  ... brain damage, probably.",384,2,Radio Baked,a1S52y5ZVlY,0.0,2017-06-14 18:15:06,True,True
2017-06-14T18:22:37,"They tried but its too simple of a concept to stretch. And, yeah, it got disinteresting after a minute.",0,0,John Kimmel,a1S52y5ZVlY,0.0,2017-06-14 18:22:37,True,True
2017-06-14T19:19:42,I was interested then I saw Nina Dobrev..,0,0,KON,a1S52y5ZVlY,0.25,2017-06-14 19:19:42,True,True
2017-06-14T19:33:24,They gave the entire movie away in the trailer.,0,0,Chad Drake,a1S52y5ZVlY,0.0,2017-06-14 19:33:24,True,True
2017-06-14T19:42:33,i came here for Death Grips,70,6,FlashRave,a1S52y5ZVlY,0.0,2017-06-14 19:42:33,True,True
2017-06-14T20:05:39,but it would be such a great movie if they would not overf#ck the supernatural part and would keep it mildly scientific,0,0,deFenestrate!,a1S52y5ZVlY,0.325,2017-06-14 20:05:39,True,True
2017-06-14T20:09:20,this is a bad remake of the Kieffer Sutherland movie .,2,0,cfbcfbcfbcfb99,a1S52y5ZVlY,-0.6999999999999998,2017-06-14 20:09:20,True,True
2017-06-14T20:26:32,What a waste of a great premise,0,0,Guillaume Keyes,a1S52y5ZVlY,0.30000000000000004,2017-06-14 20:26:32,True,True
2017-06-14T20:54:20,"Again, ty for ENTIRE movie as a trailer.",0,0,Mechronastamuth,a1S52y5ZVlY,0.0,2017-06-14 20:54:20,True,True
2017-06-14T21:04:55,Final Destination but renamed right idek,0,0,METH CommendElm,a1S52y5ZVlY,0.14285714285714285,2017-06-14 21:04:55,True,True
2017-06-14T21:22:13,For f**k sake! Another remake!,0,0,Radkon Psygami,a1S52y5ZVlY,0.0,2017-06-14 21:22:13,True,True
2017-06-14T21:34:56,"Yeah, it kinda was your fault.",0,0,Shipwright,a1S52y5ZVlY,0.0,2017-06-14 21:34:56,True,True
2017-06-14T21:38:59,I thought she was too busy raising that cholula baby 😂😂,0,0,Tiny Danzig Adventures,a1S52y5ZVlY,0.1,2017-06-14 21:38:59,True,True
2017-06-14T21:56:16,"To everyone moaning that it's a remake, it isn't. Kiefer Sutherland has confirmed it's a sequel as he is reprising his role as Nelson.",0,0,Michaelmac,a1S52y5ZVlY,0.4,2017-06-14 21:56:16,True,True
2017-06-14T22:39:06,In the 80's kids were dumb but not dumb enough to copy cat the movie. After this movie comes out some kids will try it and die. And the makers of this movie know this but still make the movie.,0,0,News Redial,a1S52y5ZVlY,-0.0625,2017-06-14 22:39:06,True,True
2017-06-14T22:40:16,Man this movie is already debunked even before it was released in real life you can't bring people back from the dead by sending electricity through their body,0,0,Jose The Thinket,a1S52y5ZVlY,0.0,2017-06-14 22:40:16,True,True
2017-06-14T22:41:16,Didn't they already make this movie? How about something original?,0,0,ikungfuyou2,a1S52y5ZVlY,0.375,2017-06-14 22:41:16,True,True
2017-06-14T22:47:36,Elena is going back in time to meet Damon,0,0,captain america,a1S52y5ZVlY,0.0,2017-06-14 22:47:36,True,True
2017-06-14T23:21:42,I don't know.,0,0,Vincent Black,a1S52y5ZVlY,0.0,2017-06-14 23:21:42,True,True
2017-06-14T23:29:11,hollywood what a waste of money.,0,0,cfbcfbcfbcfb99,a1S52y5ZVlY,-0.2,2017-06-14 23:29:11,True,True
2017-06-14T23:32:07,"I've never seen the original movie, but this looks dumb. Is the original good?",0,0,MB 0610,a1S52y5ZVlY,0.26875,2017-06-14 23:32:07,True,True
2017-06-14T23:48:01,This is going to be bad...very bad...I think I'll stick to the original..,0,0,thatawkwardgamer,a1S52y5ZVlY,0.375,2017-06-14 23:48:01,True,True
2017-06-15T00:05:00,Liked it until they added the unnecessary horror bullshit in,0,0,SouthernFuzz,a1S52y5ZVlY,0.09999999999999998,2017-06-15 00:05:00,True,True
