timestamp,text,like_count,reply_count,author,trailer_id,sentiment_score,datetime,used_for_model,used_for_visualization
2017-04-19T17:16:54,i love this game...🐻🐻🐾,0,0,Andjela Radovic,a6gHj0bHmg8,0.5,2017-04-19 17:16:54,False,False
2017-07-12T04:10:50,La canción del final como se llama creo que es de Rihanna,0,0,TuCara MeSuena,a6gHj0bHmg8,0.0,2017-07-12 04:10:50,False,False
2017-08-07T06:40:53,What’s the piano song at the starting of the trailer???,0,0,Panagioti Stouras,a6gHj0bHmg8,0.0,2017-08-07 06:40:53,False,False
2017-08-11T23:51:39,Omg I love that song,0,0,akamaatsu,a6gHj0bHmg8,0.5,2017-08-11 23:51:39,False,False
2017-09-02T13:13:53,IT'S 2017. I MISS THE OLD DISNEY,41,3,Broken TeaCup,a6gHj0bHmg8,0.1,2017-09-02 13:13:53,False,False
2017-11-17T22:30:34,i found it on this site full  https://goo.gl/K7RL9w,0,0,مغربي و أفتخر,a6gHj0bHmg8,0.35,2017-11-17 22:30:34,False,False
2017-12-10T17:58:19,to late now I can't see it 😢😢😭😭,0,0,Alexis Playz Roblox,a6gHj0bHmg8,-0.3,2017-12-10 17:58:19,False,False
2017-12-16T15:23:32,This song brings tears to my eyes,0,0,rissii,a6gHj0bHmg8,0.0,2017-12-16 15:23:32,False,False
2018-01-13T23:04:43,this is my favorite of all Disney trails,0,0,James Kelly,a6gHj0bHmg8,0.5,2018-01-13 23:04:43,False,False
2018-02-13T02:59:20,"It makes me cry to watch this, it reminds me of good old 2013",1,0,Espy_Kinz,a6gHj0bHmg8,0.39999999999999997,2018-02-13 02:59:20,False,False
2018-02-13T14:03:17,THANK YOU SO MUCH FOR BEAUTIFUL VIDEOS. PLEASURE.,1,0,SHAROKH JOUDI,a6gHj0bHmg8,0.525,2018-02-13 14:03:17,False,False
2018-02-28T07:25:04,"love the movie. when I hear the hear the songs, think of the movie or songs, I want to cry. The movie is so awwwweome and so emotional 😀😁😂😍😍😘😘😍😘😻😻😻😽😽😽❤❤❤💙💙💙💚💚💚💛💛💛💜💜💜💓💓💓💕💕💕💖💖💖💗💗💗💘💘💘💝💝💝💞💞💞💟💟💟",0,0,Jason Ramirez,a6gHj0bHmg8,0.25,2018-02-28 07:25:04,False,False
2018-03-25T14:46:56,I love grizzly bears,0,0,William A Alfaro,a6gHj0bHmg8,0.5,2018-03-25 14:46:56,False,False
2018-04-25T02:50:27,"Damn, Brother Bear Live Action is incredible",65,1,Gold and Tails,a6gHj0bHmg8,0.37878787878787884,2018-04-25 02:50:27,False,False
2018-05-23T23:41:40,I watched this movie with my cousins less than a year ago and it’s bringing back the nostalgia. Especially the song. Home,0,0,Daftpanther11,a6gHj0bHmg8,-0.05555555555555555,2018-05-23 23:41:40,False,False
2018-05-30T06:57:04,Bears  2014 türkçe full izle  http://www.netteilkfilmizle.com/film-izle/bears-full-izle,0,0,Film Fragmanları,a6gHj0bHmg8,0.35,2018-05-30 06:57:04,False,False
2018-09-07T13:57:33,Now i know my passion....... this is what i am passoinate....... i would love to dedicate my life to save this wonderful creatures .......,0,0,Amit Singh,a6gHj0bHmg8,0.75,2018-09-07 13:57:33,False,False
2018-09-30T14:36:51,"I was thinking about Bear In The Big Blue House when I saw this Oh well, Welcome To The Blue House",0,0,Super Mario Logan Fan,a6gHj0bHmg8,0.2,2018-09-30 14:36:51,False,False
2018-11-03T22:44:27,I remember this,0,0,XxLuna MoonxX,a6gHj0bHmg8,0.0,2018-11-03 22:44:27,False,False
2019-02-23T02:59:05,I love bears. 🐻🐻🐻🐻🐻🐻 I went to see that miove. 🐻🐻🐻🐻🐻🐼🐻🐻🐼🐻🐻🐼🐼🐼🐻🐼🐼🐻🐻🐻🐼🐼🐼,0,0,Isabella Milo,a6gHj0bHmg8,0.5,2019-02-23 02:59:05,False,False
2019-02-23T03:00:35,I wish I got to see bears in my backyard. 🐻🐻🐻🐻🐻🐻🐼🐼🐼🐼🐼🐻🐻🐻🐻🐻🐻🐻🐼🐼🐼🐼🐼🐼🐼🐼🐻🐻🐻🐻🐻🐻🐻🐼🐼🐼🐼🐼🐼🐻🐻🐻🐻🐻🐻🐻,0,0,Isabella Milo,a6gHj0bHmg8,0.0,2019-02-23 03:00:35,False,False
2019-03-16T20:27:07,Me encanta esta película  De Disney ozos me pone triste la película saquenlo en mayo 28 quiero verlo en 2019,0,0,Alexis Varela chan,a6gHj0bHmg8,0.0,2019-03-16 20:27:07,False,False
2019-04-09T23:12:46,Home is my fav song😍,0,0,Mya Hobbs Wunsche,a6gHj0bHmg8,0.0,2019-04-09 23:12:46,False,False
2019-04-14T21:05:03,I love this movie,0,0,Toxic Falcon,a6gHj0bHmg8,0.5,2019-04-14 21:05:03,False,False
2019-04-19T04:15:41,I remember seeing this trailer as a kid and being so excited to see the movie 5 years later for some odd reason I decide to look back on this trailer only to find out it opened on theaters the same day I decided to look back on this trailer. Just 5 years ago though. But wow. This movie I was so excited to see.,0,0,Lauren,a6gHj0bHmg8,0.07592592592592592,2019-04-19 04:15:41,False,False
2019-04-19T14:21:30,"In My Imagination, Sky Was Captured",0,0,Ida Immelman,a6gHj0bHmg8,0.0,2019-04-19 14:21:30,False,False
2019-05-22T13:09:46,I guess Disney never heard of Timothy Treadwell....,0,0,Our Private Account,a6gHj0bHmg8,0.0,2019-05-22 13:09:46,False,False
2019-05-25T11:51:06,2019? Never watched this bfore until this day and searched it up on YouTube. . Highly recommneded,1,0,Eivan Andres,a6gHj0bHmg8,0.16,2019-05-25 11:51:06,False,False
2019-06-02T19:46:25,2019 😩❤️,0,0,Andrea Castaneda,a6gHj0bHmg8,0.0,2019-06-02 19:46:25,False,False
2019-06-05T18:36:40,I almost cried I LOOOooOoVed this movie I watched it.,0,0,Abbie I eat babi,a6gHj0bHmg8,0.0,2019-06-05 18:36:40,False,False
2019-06-11T00:29:39,Nostalgia,1,0,Chris S,a6gHj0bHmg8,0.0,2019-06-11 00:29:39,False,False
2019-06-19T07:51:05,I’m watching this from 2019,0,0,DIZZYWARLOCK _YT,a6gHj0bHmg8,0.0,2019-06-19 07:51:05,False,False
2019-06-27T06:49:30,I remember watching this when i was in 2nd grade,2,0,Chez Burbger,a6gHj0bHmg8,0.0,2019-06-27 06:49:30,False,False
2019-07-18T06:20:12,"This movie made me cry every time I watched it, I remember watching this when I was 9 and  every time home came on I would just tear up and this movie was amazing",6,0,SUPERMANJGG,a6gHj0bHmg8,0.6000000000000001,2019-07-18 06:20:12,False,False
2019-08-06T07:03:47,Only ogs remember field trips,0,0,Toby,a6gHj0bHmg8,0.0,2019-08-06 07:03:47,False,False
2019-08-06T18:35:57,bruh this hits different,1,0,Ashleigh Vickery,a6gHj0bHmg8,0.0,2019-08-06 18:35:57,False,False
2019-08-17T07:57:44,Love it.,0,0,Chantae Thomas,a6gHj0bHmg8,0.5,2019-08-17 07:57:44,False,False
2019-08-22T20:06:26,Taken from Frozen 2014 DVD,1,0,David Robert O'Connor 2018,a6gHj0bHmg8,0.0,2019-08-22 20:06:26,False,False
2019-08-28T05:13:37,"Love this movie till this day, so many memories too 😩🥺",1,0,ZXLOCITY,a6gHj0bHmg8,0.5,2019-08-28 05:13:37,False,False
2019-09-01T19:07:02,It’s 2019 and every time I hear this song I still think of this commercial,8,1,Rachael Michelle,a6gHj0bHmg8,0.0,2019-09-01 19:07:02,False,False
2019-12-15T04:09:17,Taken from Frozen DVD.,0,0,CJ AwesomeKiddo,a6gHj0bHmg8,0.0,2019-12-15 04:09:17,False,False
2020-01-16T00:14:18,This brings me backkkkk,0,0,Chloe Sullivan,a6gHj0bHmg8,0.0,2020-01-16 00:14:18,False,False
2020-01-20T08:40:47,I love this movie love it!!!,0,0,Petra poe,a6gHj0bHmg8,0.73828125,2020-01-20 08:40:47,False,False
2020-01-22T09:32:35,I love The PEACE! I LUV the nAtUrE,0,0,Shannon AusT,a6gHj0bHmg8,0.625,2020-01-22 09:32:35,False,False
2020-01-24T01:13:34,This movie just came to my mind out of no where. Good times..,3,0,Gorgee123,a6gHj0bHmg8,0.7,2020-01-24 01:13:34,False,False
2020-02-03T08:54:28,love this movie! her son was hard headed lol it made me mad!,0,0,chasity copelajd,a6gHj0bHmg8,0.08802083333333333,2020-02-03 08:54:28,False,False
2020-03-01T22:14:25,Its 2020....Man I miss my childhooooooood!😭,3,0,CreepyAphsta,a6gHj0bHmg8,0.0,2020-03-01 22:14:25,False,False
2020-03-05T16:47:37,😂👏,0,0,Василь Гетцко,a6gHj0bHmg8,0.0,2020-03-05 16:47:37,False,False
2020-04-04T19:16:40,I saw this movie 3 times in theaters but never seen the copy for it DVD but its honestly cute watching this other then monkey kingdom,0,0,avatar 37,a6gHj0bHmg8,0.10833333333333334,2020-04-04 19:16:40,False,False
2020-04-08T05:13:28,Lol why is it in every Disney Nature the dad is never present,0,0,tj johnson,a6gHj0bHmg8,0.4,2020-04-08 05:13:28,False,False
2020-04-17T07:28:17,I loved bears!,0,0,Ellie Vaughn,a6gHj0bHmg8,0.875,2020-04-17 07:28:17,False,False
2020-05-23T11:02:17,"lmfao i wanted to learn about bears for my science and i came along this wtf is this is this an actual movie or not,what even is disney nature.",0,0,Lillian Krzciuk,a6gHj0bHmg8,-0.25,2020-05-23 11:02:17,False,False
2020-06-13T08:29:38,It’s so majestic,0,0,James Stoner,a6gHj0bHmg8,0.0,2020-06-13 08:29:38,False,False
2020-06-13T08:31:47,The sad thing when I went camping they had a movie theater and they showed this movie but the sad part was they had to kill all the bears so there was no bear attacks,0,0,James Stoner,a6gHj0bHmg8,-0.5,2020-06-13 08:31:47,False,False
