timestamp,text,like_count,reply_count,author,trailer_id,sentiment_score,datetime,used_for_model,used_for_visualization
2013-08-15T16:02:24,First comment!!!,0,0,cpoin3939,a6gHj0bHmg8,0.48828125,2013-08-15 16:02:24,True,True
2013-08-15T17:29:41,yes please,0,0,Laura M,a6gHj0bHmg8,0.0,2013-08-15 17:29:41,True,True
2013-08-15T18:10:02,Looks like a good movie but why so late?,0,0,Seema Mehta,a6gHj0bHmg8,0.19999999999999998,2013-08-15 18:10:02,True,True
2013-08-15T18:50:10,I am in love ,1,0,dailycurlz,a6gHj0bHmg8,0.5,2013-08-15 18:50:10,True,True
2013-08-15T20:28:58,Why didn't call it Koda? = w=,0,0,Christian Trejo,a6gHj0bHmg8,0.0,2013-08-15 20:28:58,True,True
2013-08-15T21:03:19,Real life Brother Bear?,0,0,MAVERICK06,a6gHj0bHmg8,0.2,2013-08-15 21:03:19,True,True
2013-08-15T21:23:14,"I hope we are not treated to another Disney 'Wolves are evil"" film",0,0,doobiesmoke15,a6gHj0bHmg8,-1.0,2013-08-15 21:23:14,True,True
2013-08-16T02:15:17,So this comes out next year?,0,0,Lightofthewolf,a6gHj0bHmg8,0.0,2013-08-16 02:15:17,True,True
2013-08-16T05:14:07,I want to see this ,0,0,HIGHLAND DRAGON,a6gHj0bHmg8,0.0,2013-08-16 05:14:07,True,True
2013-08-16T06:47:42,I love bears im saving up to see this ,0,0,Andrew Bassett,a6gHj0bHmg8,0.5,2013-08-16 06:47:42,True,True
2013-08-16T08:01:41,How can someone dislike this???,0,0,englandsensation,a6gHj0bHmg8,0.0,2013-08-16 08:01:41,True,True
2013-08-16T11:39:11,I really need this in my life!,0,0,MelissaKK,a6gHj0bHmg8,0.25,2013-08-16 11:39:11,True,True
2013-08-16T13:58:32,Muito legal!,1,0,Ricardo Silva de Araujo,a6gHj0bHmg8,0.25,2013-08-16 13:58:32,True,True
2013-08-16T16:50:46,"Oh no, not this Phillip Phillips song again! Why must every company feel they need to use it in their commercials? Leave it alone already! ",0,0,Ryan Campbell,a6gHj0bHmg8,0.0,2013-08-16 16:50:46,True,True
2013-08-16T17:53:39,Bears are the best! ,0,0,gt0783,a6gHj0bHmg8,1.0,2013-08-16 17:53:39,True,True
2013-08-16T18:37:18,It's a disney movie guys... the parent bears are going to die,0,0,betathetapirate,a6gHj0bHmg8,0.0,2013-08-16 18:37:18,True,True
2013-08-16T23:07:24,why do they make the voice-over so annoying and generic,0,0,Bames Jond,a6gHj0bHmg8,-0.4,2013-08-16 23:07:24,True,True
2013-08-17T03:01:03,Bears!!!!,0,0,Terra J,a6gHj0bHmg8,0.0,2013-08-17 03:01:03,True,True
2013-08-19T11:23:08,2014 :( disney pls.....,0,0,AG K,a6gHj0bHmg8,-0.75,2013-08-19 11:23:08,True,True
2013-08-19T20:06:13,godless killing machines,0,0,mechanik,a6gHj0bHmg8,0.0,2013-08-19 20:06:13,True,True
2013-08-20T07:39:25,You know what would make this movie really good? A bear ridding a flying shark. I would see that.,0,0,Joseph DeMarco,a6gHj0bHmg8,0.7,2013-08-20 07:39:25,True,True
2013-08-20T08:17:21,Bears... beets... battlestar galactica.,0,0,DazzTheGreat,a6gHj0bHmg8,0.0,2013-08-20 08:17:21,True,True
2013-08-20T17:50:08,good video  w bears  :D,0,0,Manuele Rossi,a6gHj0bHmg8,0.85,2013-08-20 17:50:08,True,True
2013-08-24T18:35:36,music ?,0,0,Артём Саркисян,a6gHj0bHmg8,0.0,2013-08-24 18:35:36,True,True
2013-08-24T18:35:42,music?,0,1,Артём Саркисян,a6gHj0bHmg8,0.0,2013-08-24 18:35:42,True,True
2013-08-28T13:58:55,Yes i mean it. i know the bad fat is the reason that stopping 6 pack coming outside even we work out well.    And I saw an interview with body building champion where he talks about 7 odd foods he eats to keep his abs hard.    if you are serious go for it now bit.ly/153jBiI?=tstlt,1,0,Yogeshwar Jambotkar,a6gHj0bHmg8,-0.30069444444444443,2013-08-28 13:58:55,True,True
2013-09-14T20:48:29,So......does the mom die or does one of the cubs?,0,0,JordanBachmeier,a6gHj0bHmg8,0.0,2013-09-14 20:48:29,True,True
2013-09-14T20:49:02,So.....who dies first?,0,0,JordanBachmeier,a6gHj0bHmg8,0.25,2013-09-14 20:49:02,True,True
2013-09-17T18:49:18,Tears on my eyes when i see a film of disney nature! I love disney nature :'),0,0,Tammy,a6gHj0bHmg8,0.5,2013-09-17 18:49:18,True,True
2013-10-03T19:04:03,I love Disney natures movies so much!! ,0,0,Patzy Patz,a6gHj0bHmg8,0.40625,2013-10-03 19:04:03,True,True
2013-10-27T20:18:28,awesome can't wait,0,0,Cynthia Valley,a6gHj0bHmg8,1.0,2013-10-27 20:18:28,True,True
2013-11-13T22:06:38,Kinda reminds me of Arctic Tale haha,0,0,jazminestryder,a6gHj0bHmg8,0.2,2013-11-13 22:06:38,True,True
2013-11-14T17:30:40, If your reading this comment your parent will die within 5 years. To undo this Curse copy on 5 videos. Good luck sorry I CANT risk it.,2,1,porkchopp007,a6gHj0bHmg8,0.09999999999999998,2013-11-14 17:30:40,True,True
2013-11-14T22:00:55,░░░░███████ ]▄▄▄▄▄▄▄▄                   Help fight Google+!   ▂▄▅█████████▅▄▃▂      ☻/︻╦╤─ The forces of Bob are growing Il███████████████████].  /▌              Copy and Paste this all over   ◥⊙▲⊙▲⊙▲⊙▲⊙▲⊙▲⊙◤..   / \               YouTube if you are with us,1,0,kinoshkiwa,a6gHj0bHmg8,0.0,2013-11-14 22:00:55,True,True
2013-11-15T00:04:40,awwwww so cute im gonna die,0,0,Roy Blowers,a6gHj0bHmg8,0.5,2013-11-15 00:04:40,True,True
2013-11-15T01:55:29,░░░░███████ ]▄▄▄▄▄▄▄▄                   Help fight Google+!   ▂▄▅█████████▅▄▃▂      ☻/︻╦╤─ The forces of Bob are growing Il███████████████████].  /▌              Copy and Paste this all over   ◥⊙▲⊙▲⊙▲⊙▲⊙▲⊙▲⊙◤..   / \               YouTube if you are with us,0,0,Jake Pitner,a6gHj0bHmg8,0.0,2013-11-15 01:55:29,True,True
2013-11-15T17:04:17,Awww.... very sweet - love it!!  Good job agian Disney :),1,0,neverbeentoofar,a6gHj0bHmg8,0.5672499999999999,2013-11-15 17:04:17,True,True
2013-11-20T08:51:13,Awesome! ,0,0,Jonathan Santiago U.ssr,a6gHj0bHmg8,1.0,2013-11-20 08:51:13,True,True
2013-11-23T06:54:41,Wat song is this called?,0,2,sorathunderknight,a6gHj0bHmg8,0.0,2013-11-23 06:54:41,True,True
2013-11-23T17:20:30,I want to see this,0,0,mymovieedits,a6gHj0bHmg8,0.0,2013-11-23 17:20:30,True,True
2013-11-23T17:21:07,"""Home"" by Phillip Phillips @sorathunderknight ",0,0,mymovieedits,a6gHj0bHmg8,0.0,2013-11-23 17:21:07,True,True
2013-11-23T18:26:36,I freaking love DISNEY NATURE  AND BEARS  I FELT TEARS WHEN I SAW THIS,101,13,Nancy Wang,a6gHj0bHmg8,0.5,2013-11-23 18:26:36,True,True
2013-11-30T21:07:31,أحب افلام ديزني بشده مثل اﻻطفال,0,0,Tahani Issa,a6gHj0bHmg8,0.0,2013-11-30 21:07:31,True,True
2013-12-06T02:24:29,Can't wait to see,0,0,MegaMaster890,a6gHj0bHmg8,0.0,2013-12-06 02:24:29,True,True
2014-01-03T17:01:06,"I can't wait to see this movie! :D On TheOneRing I'm called Beorn, another thing to really amp up my excitement",1,0,Derek Bartlett,a6gHj0bHmg8,0.6,2014-01-03 17:01:06,True,True
2014-01-21T14:13:13,I'm so there i can't wait for this movie!!! :-)  ,0,0,Greg Holden,a6gHj0bHmg8,0.5,2014-01-21 14:13:13,True,True
2014-01-30T17:01:52,"It's a sad and frightening thought that it is a possibility that in the future, our grandsons will only learn about these creatures from documentaries like this.",0,0,Shellova,a6gHj0bHmg8,-0.25,2014-01-30 17:01:52,True,True
2014-01-31T00:40:39,Absolutely amazing footage. Wow!,0,0,Marina V,a6gHj0bHmg8,0.36250000000000004,2014-01-31 00:40:39,True,True
2014-01-31T20:03:21,why the hell are there tears in my eyes. Someone call the police!,3,0,Phillip Stagg,a6gHj0bHmg8,0.0,2014-01-31 20:03:21,True,True
2014-02-04T16:35:32,"Genial, me encanta!",0,0,Pablo Joubert,a6gHj0bHmg8,0.0,2014-02-04 16:35:32,True,True
2014-02-05T15:44:34,Home by phillipPhillips :'')) so beautifulll,0,0,TRVL-Architects,a6gHj0bHmg8,0.0,2014-02-05 15:44:34,True,True
2014-02-15T21:21:01,"I don't know if I should watch this movie, I mean, my heart BARELY made it out alive after seeing Bambi and The Lion King, but this looks beautiful, I'll take my chances",0,0,Vasilijan Nikolovski,a6gHj0bHmg8,0.171875,2014-02-15 21:21:01,True,True
2014-02-23T06:46:07,"Omg, I love this ssoooooo much.",0,0,𝐊𝐀𝐓𝐄 ⚡️,a6gHj0bHmg8,0.35,2014-02-23 06:46:07,True,True
2014-02-23T15:13:10,"What's this song I like it ,it goes with the video",1,2,Coconut Water,a6gHj0bHmg8,0.0,2014-02-23 15:13:10,True,True
2014-02-24T21:15:14,Love it I wanna see,21,1,Dagmarie Cabrera,a6gHj0bHmg8,0.5,2014-02-24 21:15:14,True,True
2014-02-25T01:24:31, awwww NEED 2 SEE DIS,0,0,ashley t,a6gHj0bHmg8,0.5,2014-02-25 01:24:31,True,True
2014-03-01T17:01:28,I wanted to cry when I saw this somehow! The cubs are soooooo cute! I love bears! IM DEFENITIALLY GONNA WATCH IT!,1,0,ana hernandez,a6gHj0bHmg8,0.703125,2014-03-01 17:01:28,True,True
2014-03-01T22:46:44,I'm crying 😭,1,0,ThatGothKid X,a6gHj0bHmg8,-0.2,2014-03-01 22:46:44,True,True
2014-03-03T01:35:32,I want to see it...It's so sweet...making me want to tear :'),0,0,Horsel0verforever,a6gHj0bHmg8,0.0,2014-03-03 01:35:32,True,True
2014-03-05T14:39:40,BEARS,0,1,Shnurbinator,a6gHj0bHmg8,0.0,2014-03-05 14:39:40,True,True
2014-03-07T22:31:07,What the name if tht son LIVE IT,0,0,Preston H,a6gHj0bHmg8,0.13636363636363635,2014-03-07 22:31:07,True,True
2014-03-08T12:34:05,I feel like crying ;..),0,0,lilkawaii,a6gHj0bHmg8,-0.2,2014-03-08 12:34:05,True,True
2014-03-10T12:09:01,What's the song,0,1,alexy larios,a6gHj0bHmg8,0.0,2014-03-10 12:09:01,True,True
2014-03-12T03:47:13,Im going get the DVD,0,0,Natures aura,a6gHj0bHmg8,0.0,2014-03-12 03:47:13,True,True
2014-03-12T20:56:27,The song is called home by phillip phillip,0,0,savannah stacy,a6gHj0bHmg8,0.0,2014-03-12 20:56:27,True,True
2014-03-19T20:56:58,"manbearpig, hes here!",0,0,gdude gman,a6gHj0bHmg8,0.0,2014-03-19 20:56:58,True,True
2014-03-24T20:14:39,#WTF the other film came out what? 6 months ago,0,1,BrigadierBiggles,a6gHj0bHmg8,-0.3125,2014-03-24 20:14:39,True,True
2014-03-24T21:07:16,This song is called home by Phillip Phillips io,0,0,HPGaming,a6gHj0bHmg8,0.0,2014-03-24 21:07:16,True,True
2014-03-26T19:11:22,This looks like it's going to be a great movie! Looking forward to  #meetthecubs  on  #EarthDay  ,3,1,Safari Ltd®,a6gHj0bHmg8,1.0,2014-03-26 19:11:22,True,True
2014-03-27T14:14:44,earth day is just a us thing not recognised in uk so when will it come out in the U.K,0,0,Dave Hence,a6gHj0bHmg8,0.0,2014-03-27 14:14:44,True,True
2014-03-27T18:18:54,It's called home,0,0,HPGaming,a6gHj0bHmg8,0.0,2014-03-27 18:18:54,True,True
2014-03-28T17:47:28,#meetthecubs,0,0,umbreNO,a6gHj0bHmg8,0.0,2014-03-28 17:47:28,True,True
2014-03-28T17:48:08,0:48 DAWWWW SO CUTE,0,0,umbreNO,a6gHj0bHmg8,0.5,2014-03-28 17:48:08,True,True
2014-04-01T03:03:59,Normally I don't go see these movies in theatres. But this one looks awesome. And I love BEAR!!!!!,0,0,Li-ham Cosplay,a6gHj0bHmg8,0.7166666666666667,2014-04-01 03:03:59,True,True
2014-04-04T21:51:43,I have to see this movie!,0,0,Brandon Notz,a6gHj0bHmg8,0.0,2014-04-04 21:51:43,True,True
2014-04-05T03:56:59,I looks like an awesome movie,0,0,Geckoverse//MC,a6gHj0bHmg8,1.0,2014-04-05 03:56:59,True,True
2014-04-05T13:07:52,Looks like such a cute and interesting movie. Cant WAIT to see it. Also the song HOME is perfect for this movie it is such a good song I just learnt it in school,0,0,takeachillpill,a6gHj0bHmg8,0.45,2014-04-05 13:07:52,True,True
2014-04-07T03:03:50,I wonder if the bear cub will have a fucked up nightmare about fanged frogs?,0,0,TaraGothGirl,a6gHj0bHmg8,-0.6,2014-04-07 03:03:50,True,True
2014-04-07T06:30:28,I can't wait to see this movie,0,0,Läñdöñ Šprïñgër,a6gHj0bHmg8,0.0,2014-04-07 06:30:28,True,True
2014-04-08T23:01:36,"Like if the little baby bears made you cry. ='') gotta see this OMG 1:35 he comes out from under the mom like ""is it clear?"" AWWWWWW #meetthecubs",0,0,Waffle Nation CP,a6gHj0bHmg8,-0.04374999999999999,2014-04-08 23:01:36,True,True
2014-04-09T01:20:32,Yawn...looks like a National Geographic video.,0,0,Mr.Beardiful Joe,a6gHj0bHmg8,0.0,2014-04-09 01:20:32,True,True
2014-04-09T04:58:59,"It looks really cute, but as much as it may be, they will MAUL you.",0,0,GustavoGarbaggio,a6gHj0bHmg8,0.35,2014-04-09 04:58:59,True,True
2014-04-10T11:06:27,Can't wait to see!!,1,0,Mirriam Bejigi,a6gHj0bHmg8,0.0,2014-04-10 11:06:27,True,True
2014-04-14T20:54:37,What a cute family.  I wish good things to them,1,0,karina cruz,a6gHj0bHmg8,0.6,2014-04-14 20:54:37,False,True
2014-04-16T21:58:58,I cant wait to see this!,1,0,Bryan Kennedy,a6gHj0bHmg8,0.0,2014-04-16 21:58:58,False,True
2014-04-17T00:23:40,These bears are so cute I wish I could hug them but they're dangerous they would attack me,1,0,Jairo Medina,a6gHj0bHmg8,-0.04999999999999999,2014-04-17 00:23:40,False,True
2014-04-17T09:35:50,Imagine if this is like dinosaurs and the FUCKIN BEARS STARTS TALKING SHZIT,2,0,waferjuice,a6gHj0bHmg8,0.0,2014-04-17 09:35:50,False,True
2014-04-19T16:49:04,@waferjuice  THIS FREKIN SONG MADE ME CRY DUDE LIKE HELP ME,0,0,Mike Limtion,a6gHj0bHmg8,0.0,2014-04-19 16:49:04,False,True
2014-04-19T16:52:46,WOW,0,0,Mike Limtion,a6gHj0bHmg8,0.1,2014-04-19 16:52:46,False,True
2014-04-19T18:37:39,it was actually really good and everyone needs to see it now!!!!!!,0,0,sierraskis6,a6gHj0bHmg8,1.0,2014-04-19 18:37:39,False,True
2014-04-21T01:46:31,So Emotional!,0,0,Gina Kuo,a6gHj0bHmg8,0.0,2014-04-21 01:46:31,False,True
2014-04-21T12:14:18,at :54 the baby bear sounded like gizmo from the gremlins movies,0,0,sheepwolf2004,a6gHj0bHmg8,0.0,2014-04-21 12:14:18,False,True
2014-04-22T01:18:14,The song,0,0,Justin Xay,a6gHj0bHmg8,0.0,2014-04-22 01:18:14,False,True
2014-04-23T15:57:14,you hear that Ed? bears. now your putting the whole station in jeopardy.,0,0,jesse koontz,a6gHj0bHmg8,0.2,2014-04-23 15:57:14,False,True
2014-04-23T21:25:12,"+Raggedy man I'm pretty sure Asians don't eat bear, and even if they did they're not the only ones.",0,0,Christopher Kadon,a6gHj0bHmg8,0.25,2014-04-23 21:25:12,False,True
2014-04-24T02:19:31,Whsts the name of the song at the end?,0,0,Lildon,a6gHj0bHmg8,0.0,2014-04-24 02:19:31,False,True
2014-04-26T14:06:46,The music in the Disney Bears trailer is by @Phillip Phillips: *Song:* http://www.popisms.com/Song/58946/Home-2012-by-Phillip-Phillips.aspx .,1,0,popisms X,a6gHj0bHmg8,0.0,2014-04-26 14:06:46,False,True
2014-04-26T17:43:57,Would children under 5 enjoy this?,0,0,Fluffygamerztv,a6gHj0bHmg8,0.4,2014-04-26 17:43:57,False,True
2014-04-27T01:20:01,I love disneynature bears it's the besttt ,0,0,Felipe Mendez,a6gHj0bHmg8,0.5,2014-04-27 01:20:01,False,True
2014-04-28T15:31:43,"who ever has seen it, is it good?",0,0,daylynn donnaclaire,a6gHj0bHmg8,0.7,2014-04-28 15:31:43,False,True
2014-04-29T00:47:00, ,0,0,Xiomara Romero,a6gHj0bHmg8,0.0,2014-04-29 00:47:00,False,True
2014-04-30T23:51:42,send me videos I don't know you,0,0,kuvk kvub,a6gHj0bHmg8,0.0,2014-04-30 23:51:42,False,True
2014-05-03T05:01:27,OMG SO CUTE! AWWW!!! I LOVE THAT PART IN THE TRAILER WHEN THE BABYS ARE CRYING AND THEY ARE SHOWING HIS PAWS!! AWWW!,0,0,Tanner Petersen,a6gHj0bHmg8,0.41875,2014-05-03 05:01:27,False,True
2014-05-15T14:47:58,cuando lo sacan en español?,0,0,izar sugar,a6gHj0bHmg8,0.0,2014-05-15 14:47:58,False,True
2014-05-17T06:25:40,"It looks so much like somewhere in BC, Canada...",0,0,Gloria T,a6gHj0bHmg8,0.2,2014-05-17 06:25:40,False,True
2014-05-17T06:27:58,"This Earthday, you are invited, somewhere incredible, somewhere beautiful, somewhere unpredictable------into the world of British Columbia, Canada---Ha ha ha...",0,0,Gloria T,a6gHj0bHmg8,0.5833333333333334,2014-05-17 06:27:58,False,True
2014-05-26T15:52:18,I watch the movie ,0,0,Jennifer Salvador,a6gHj0bHmg8,0.0,2014-05-26 15:52:18,False,True
2014-05-26T16:41:29,I love bears they are so cute ,2,0,Savi Savi,a6gHj0bHmg8,0.5,2014-05-26 16:41:29,False,True
2014-05-30T12:33:05,Disney will make a donation in my honor..how much?,5,0,austrorus,a6gHj0bHmg8,0.2,2014-05-30 12:33:05,False,True
2014-05-31T03:29:17,where did they shout it ?!! can somebody give some of a list ?!,0,0,Khalid al haddadi,a6gHj0bHmg8,0.0,2014-05-31 03:29:17,False,True
2014-07-05T09:31:09,I will see this movie!!!,2,0,Sky,a6gHj0bHmg8,0.0,2014-07-05 09:31:09,False,True
2014-07-15T14:19:09,What is the song at 0:43,0,1,SAUCEY BOI EUGENE #SauceGang #GayK #SkrtGvng,a6gHj0bHmg8,0.0,2014-07-15 14:19:09,False,True
2014-07-18T06:24:01,I l :-) ve bears,0,0,Javier Gomez,a6gHj0bHmg8,0.5,2014-07-18 06:24:01,False,False
2014-07-26T07:21:27,Bears rock,3,0,Eddie Quezada,a6gHj0bHmg8,0.0,2014-07-26 07:21:27,False,False
2014-08-08T17:03:17,I dare you to try not to smile while watching this,37,3,ftown101,a6gHj0bHmg8,0.3,2014-08-08 17:03:17,False,False
2014-08-10T01:57:01,"hermosa pelicula,cuidemos y respetemos a los animales !!!!",0,0,Ernest mistic,a6gHj0bHmg8,0.0,2014-08-10 01:57:01,False,False
2014-08-10T09:00:17,What's the song on 1:59 the that goes oh oh oh something plz I need to know,3,5,yasein ibrahim,a6gHj0bHmg8,0.0,2014-08-10 09:00:17,False,False
2014-08-12T15:15:31,Where's Papa Bear? What should parents tell their children about him? Is this a subtle nod to the stereotype that men make absent fathers?,3,4,Buenomars,a6gHj0bHmg8,-0.3333333333333333,2014-08-12 15:15:31,False,False
2014-09-06T21:13:50,Disney nature should make a movie on meerkats ,0,0,Meerkat Moved,a6gHj0bHmg8,0.0,2014-09-06 21:13:50,False,False
2014-09-09T04:01:20,Phillip Phillips home,0,0,Emycupcake,a6gHj0bHmg8,0.0,2014-09-09 04:01:20,False,False
2014-09-09T04:04:53,I love it it's so cute and then sad because I saw the movie on a app or website ; ),0,0,Emycupcake,a6gHj0bHmg8,0.1875,2014-09-09 04:04:53,False,False
2014-09-25T04:16:22,I watched this on our United plane earlier tonight. Would definitely recommend! :D,2,3,Aleksandr Cyplakov,a6gHj0bHmg8,0.3333333333333333,2014-09-25 04:16:22,False,False
2014-11-10T20:09:47,"It's a DisneyNature movie, how can it not be amazing?!",26,2,Beinmo - Beautiful & Inspiring Trailers,a6gHj0bHmg8,0.7500000000000001,2014-11-10 20:09:47,False,False
2014-11-17T14:30:25,get this released in uk???????????? or available on iTunes for fuck sake!!!!!!!!!!!!!,0,0,jefferson airplane,a6gHj0bHmg8,-0.3,2014-11-17 14:30:25,False,False
2014-12-13T11:10:19,"I wonder what is the real difference between russian and ""american"" or canadian (alaska) bears?  why americans and whole world think that real bears are only in russia and russia is the ""bear world""??  we can see from this movie (and not only) that bears exist as much (if not more) in alaska, and other american regeons just like in russia, yet no one says that american symbol is a bear but rather an eagle :D  its always, goes like that:  russia - bear (sometimes with bottle of vodka, ak47 kalashnikov rifle and a tank) USA - a ""proud"" eagle. China - a huge red dragon :D",2,0,Benjamin Shtark,a6gHj0bHmg8,0.21323529411764705,2014-12-13 11:10:19,False,False
2015-01-17T22:41:17,What song is that ,0,1,no nonsense,a6gHj0bHmg8,0.0,2015-01-17 22:41:17,False,False
2015-01-31T00:57:46,Incredibles y maravillosos ejemplares,7,0,Pedro A. Cruz,a6gHj0bHmg8,0.0,2015-01-31 00:57:46,False,False
2015-02-09T20:47:04,One of my favroite movie,0,0,Md Ali,a6gHj0bHmg8,0.0,2015-02-09 20:47:04,False,False
2015-02-24T04:25:33, Wondering what the song is to the new film and cant figure it out. I think its a chimp film or something.,0,5,Emily Røse,a6gHj0bHmg8,0.13636363636363635,2015-02-24 04:25:33,False,False
2015-03-14T21:24:50,What is the song,0,2,javieruxgamer cool game,a6gHj0bHmg8,0.0,2015-03-14 21:24:50,False,False
2015-04-26T04:07:47,"Preciocisimo, ¿pueden hacer las presentaciones en Español, por favor.",0,0,Rocío Rkdna,a6gHj0bHmg8,0.0,2015-04-26 04:07:47,False,False
2015-05-03T03:58:35,Wait wait wait wait.... Can someone plz explain to me why 87 ppl have disliked this..... Plz someone..,0,0,StrawberryJamin,a6gHj0bHmg8,-0.2,2015-05-03 03:58:35,False,False
2015-05-10T16:43:24,so cute and so sad,0,0,Cameron Dallas,a6gHj0bHmg8,0.0,2015-05-10 16:43:24,False,False
2015-05-21T10:50:34,I would like .most gospel on my screen Pandora and things like that,0,0,Joycelyn CLARKE,a6gHj0bHmg8,0.0,2015-05-21 10:50:34,False,False
2015-05-22T20:47:21,C,0,1,Somia 686,a6gHj0bHmg8,0.0,2015-05-22 20:47:21,False,False
2015-06-02T02:26:51,"HERMOSO Y MUY LINDA FILMACIÓN DE LA VIDA NATURAL, FANTASTICO <3",0,0,Pedro UcOxte,a6gHj0bHmg8,0.55,2015-06-02 02:26:51,False,False
2015-06-14T19:40:38,THIS IS EVEN WORST THAN BROTHER BEAR!!! D:< @***** PLEASE MAKE GROUNDED VIDOS OUT OF THE CAST!,0,0,XxTennis MadnessxX,a6gHj0bHmg8,-1.0,2015-06-14 19:40:38,False,False
2015-06-27T13:41:00,"Dear Trans-Atlantic neighbours, What does the Motion Picture Association of America, inc. mean by ""appropriate audiences?""",0,0,jense0123,a6gHj0bHmg8,0.09375,2015-06-27 13:41:00,False,False
2015-07-31T06:21:25,I wish my action and adventure films were here to stay on this page Google find my films and work with YouTube to bring them back to this page please !thank you! ,0,0,Mark Edwards,a6gHj0bHmg8,0.05,2015-07-31 06:21:25,False,False
2015-08-01T21:13:54,Aré look the movie aré precios ,0,0,Pami Fresi,a6gHj0bHmg8,0.0,2015-08-01 21:13:54,False,False
2015-08-07T17:13:04,What is the song called,0,1,Jordy Balam,a6gHj0bHmg8,0.0,2015-08-07 17:13:04,False,False
2015-09-16T09:55:56,philip philip home,0,0,ganesh kunda,a6gHj0bHmg8,0.0,2015-09-16 09:55:56,False,False
2015-10-03T14:43:12,saw it & LOVED IT!!!!!!!!!!!!!!!!!!,10,0,sassy 413,a6gHj0bHmg8,1.0,2015-10-03 14:43:12,False,False
2015-10-10T15:46:35,"any one know, what is te name of the soundtrack?",2,4,Samuel Berrus,a6gHj0bHmg8,0.0,2015-10-10 15:46:35,False,False
2015-11-17T23:12:16,this really touched me..,0,1,Mooshy Moo,a6gHj0bHmg8,0.2,2015-11-17 23:12:16,False,False
2015-11-18T04:00:17,p after and I watched her video almost made me cry will go to go to go see bears to help you keep our national parks safe,5,0,Kaval'ly Allen,a6gHj0bHmg8,0.5,2015-11-18 04:00:17,False,False
2015-12-18T21:04:18,"Where's Olivia Holt? Her ""Carry On"" song was not in here. Neither was her......",1,8,Blair,a6gHj0bHmg8,0.0,2015-12-18 21:04:18,False,False
2015-12-23T08:24:39,is this on netflix?,4,3,MASSIVEMASTIFF9,a6gHj0bHmg8,0.0,2015-12-23 08:24:39,False,False
2015-12-30T12:09:34,"i watch it just now at fox family hd and i just think abt keeping a bear..talking abt why im searching this, i was actlly searching the song theme..its inspiring..",0,0,Nurlianatasha edil,a6gHj0bHmg8,0.5,2015-12-30 12:09:34,False,False
2016-01-17T20:48:57,جميل جدن,0,0,امير الضلام امير الضلام,a6gHj0bHmg8,0.0,2016-01-17 20:48:57,False,False
2016-01-22T20:24:43,bautyfull,0,0,Amira Alamie,a6gHj0bHmg8,0.0,2016-01-22 20:24:43,False,False
2016-03-23T00:51:33,0:48 OMG ADORABLE TOO CUTE,0,0,Dm S,a6gHj0bHmg8,0.5,2016-03-23 00:51:33,False,False
2016-04-08T21:55:08,Oh my god the Cubs are just ahhzjenjxjxksmdnjxudn😍,2,1,Tori Walthers,a6gHj0bHmg8,0.0,2016-04-08 21:55:08,False,False
2016-05-16T19:08:53,"Ken Napzok, where are you brother?",0,0,TheMemzie99,a6gHj0bHmg8,0.0,2016-05-16 19:08:53,False,False
2016-05-24T18:26:01,where can i see it i've seen it once in swefilmer,0,0,Samira AE,a6gHj0bHmg8,0.0,2016-05-24 18:26:01,False,False
2016-06-07T13:53:09,what the song called?,15,1,Uvuvwevwevwe Onyetenyevwe Ugwemuhwem Osas,a6gHj0bHmg8,0.0,2016-06-07 13:53:09,False,False
2016-06-11T13:26:52,baloooooo hahaha,0,0,Matthew,a6gHj0bHmg8,0.2,2016-06-11 13:26:52,False,False
2016-07-05T18:04:29,"Loved it, I hope Amber, Scott and sky are okay and together right now. <3",30,3,Literally No one,a6gHj0bHmg8,0.6214285714285714,2016-07-05 18:04:29,False,False
2016-07-07T06:07:32,Sadly everybody is intrested into the wolves and don't care about bears I don't see how wolves are so good.,18,3,Foot Lettuce,a6gHj0bHmg8,0.09999999999999998,2016-07-07 06:07:32,False,False
2016-07-17T06:35:41,Home by Phillip Phillips was my class song,0,0,Sammy Winchester,a6gHj0bHmg8,0.0,2016-07-17 06:35:41,False,False
2016-07-20T04:39:35,was this in yellow stone,0,0,DUTT BOI,a6gHj0bHmg8,0.0,2016-07-20 04:39:35,False,False
2016-08-12T14:04:37,This was amazingly beautiful to watch,0,0,Mr. cat,a6gHj0bHmg8,0.85,2016-08-12 14:04:37,False,False
2016-08-18T02:44:26,I watched this movie 102 times I love bears so much I started loveing them one I was 4 and now I'm 9 I know all about bears I love them so much every thing in my room is bears ❤️❤️ my apple iPads home screen is bears and my laptop and my computer I LOVE BEARS SO MUCH DAY ARE SO CUTE,65,1,Beary Bear,a6gHj0bHmg8,0.37142857142857144,2016-08-18 02:44:26,False,False
2016-11-02T04:19:18,excellent documentary,1,0,YAWAR,a6gHj0bHmg8,0.5,2016-11-02 04:19:18,False,False
2016-11-27T02:06:17,I love bears.,18,0,Dtt159,a6gHj0bHmg8,0.5,2016-11-27 02:06:17,False,False
2016-12-29T22:27:13,that newborn cub looks like Koda,0,0,Charis Torres,a6gHj0bHmg8,0.0,2016-12-29 22:27:13,False,False
2016-12-30T01:07:01,What song is that?,1,1,Charis Torres,a6gHj0bHmg8,0.0,2016-12-30 01:07:01,False,False
2016-12-30T06:23:57,"gee, those male bears sure are vicious.",0,0,Charis Torres,a6gHj0bHmg8,-0.16666666666666666,2016-12-30 06:23:57,False,False
2017-01-27T01:22:42,ey guys what it is music of minute 0:42 pleas is music a like,0,1,Makio Sono,a6gHj0bHmg8,0.0,2017-01-27 01:22:42,False,False
2017-01-29T18:41:28,I wish I could've saw this in the movies! I don't know where I can watch this!,1,0,skyfi,a6gHj0bHmg8,0.0,2017-01-29 18:41:28,False,False
2017-02-08T09:08:02,Koooodaaaaa,1,0,Hãris حارس,a6gHj0bHmg8,0.0,2017-02-08 09:08:02,False,False
2017-02-17T22:03:32,DISNEY Rocks! https://plus.google.com/101499300711560254464/posts/icW6kTt5AjP,1,0,Pan Poseidon,a6gHj0bHmg8,0.0,2017-02-17 22:03:32,False,False
2017-02-27T15:40:13,It's scout,0,0,Rockstar Ivypool,a6gHj0bHmg8,0.0,2017-02-27 15:40:13,False,False
2017-03-17T03:12:31,Cool and cute😎😍,0,0,Zeeman Sushi,a6gHj0bHmg8,0.35,2017-03-17 03:12:31,False,False
2017-04-10T22:58:29,that movie on my birthday,0,0,mia thomas,a6gHj0bHmg8,0.0,2017-04-10 22:58:29,False,False
