timestamp,text,like_count,reply_count,author,trailer_id,sentiment_score,datetime,used_for_model,used_for_visualization
2015-09-19T21:56:32,Whitey killed the teen age prostitute.  I wonder when FBI  Connelly wife MARY was confronted bye WHITEY in her home since she had a cold and would not join them etc.  Was that the same as the death of the teen age prostitute since MARY in the bible was a prostitute?   so mary kick out the fbi agent from his home?,0,0,Gold586,CE3e3hGF2jc,-0.16,2015-09-19 21:56:32,False,True
2015-09-19T21:58:49,whitey was exposed to LSD experiments in prison 11 year of it!  he called it Rest and relaxation?  We know this is BOSTON based movie  and Harvard etc where professor TIM Oleary promoted LSD use and experimentation!!!!   are they connected?,0,0,Gold586,CE3e3hGF2jc,0.0,2015-09-19 21:58:49,False,True
2015-09-20T03:52:24,"I saw this movie today,  best movie of the year. Highly recommended it , i smell oscar",0,0,Chefboyarbriii,CE3e3hGF2jc,0.58,2015-09-20 03:52:24,False,True
2015-09-20T04:14:59,Just saw this movie 7 hours ago.     Spoiler . . . . . .  The Busing sequence at 1:33 didn't make the final cut?,0,0,Airjet2582,CE3e3hGF2jc,0.0,2015-09-20 04:14:59,False,True
2015-09-20T05:33:09,Such an excellent crime drama film. Johnny Depp played the role very well. This film deserves an Oscar.,0,0,Roberto Diego,CE3e3hGF2jc,0.39999999999999997,2015-09-20 05:33:09,False,True
2015-09-20T06:15:53,this movie let me down big time half of these scenes weren't even in the movie was super short,0,0,Who??????,CE3e3hGF2jc,0.0022222222222222144,2015-09-20 06:15:53,False,True
2015-09-20T06:15:56,this movie let me down big time half of these scenes weren't even in the movie was super short,0,4,Who??????,CE3e3hGF2jc,0.0022222222222222144,2015-09-20 06:15:56,False,True
2015-09-20T08:44:22,"For those whose wondering, tried the family secret  and its awesome",0,0,Ken Chen,CE3e3hGF2jc,0.3,2015-09-20 08:44:22,False,True
2015-09-20T10:48:48,"I just saw this one last night. If you're serious about the art of film and stuff, listen to this review if you're thinking about seeing it and obviously this is just my opinion, but here goes anyway. This movie isn't very good. The cast is stacked throughout with male actors who give solid performances but I doubt anyone didn't expect that. For how intimidating and violent the film is advertised, the movie actually has a rather monotone mood throughout. This leads into the key and most crucial aspect of this films downfall to me which is that there is no main character in the film to tie yourself too. For it being portrayed as all about whitey bulger, the film actually isn't centralized around any one character. It's no ones story and without that in a film, there's little to deliver other than facts. Rotten tomatoes gave it a 78. Trust me when I say that I strongly believe the cast has to do with that success. Personally I'd have put it at about a 68, myself and no higher.",0,0,korlu01,CE3e3hGF2jc,0.02574561403508771,2015-09-20 10:48:48,False,True
2015-09-20T13:26:57,"just saw this movie, not good as expected. it's more like a documentary but depp was really good in it. still OK movie I would say",0,0,AmarNathan,CE3e3hGF2jc,0.20833333333333334,2015-09-20 13:26:57,False,True
2015-09-20T15:50:11,"Jesus, he looks like a completely different person.",1,0,Marco Meme,CE3e3hGF2jc,0.0,2015-09-20 15:50:11,False,True
2015-09-20T17:17:30,Johnny Depp the face like a zombie,0,0,Edy Subhan,CE3e3hGF2jc,0.0,2015-09-20 17:17:30,False,True
2015-09-20T20:46:16,"Apparently the real Whitey Bulger slammed this film as Hollywood cashing in and will not be seeing it. Yes I am aware he's serving a life sentence. And the people close to him called it pure fiction, not to be taken as what actually occurred except for the murders of course.",0,0,Sound Studio,CE3e3hGF2jc,0.14285714285714285,2015-09-20 20:46:16,False,True
2015-09-20T23:28:36,"man this movie sucked, i was so excited for it but damn it was boring",0,4,Ricky Dhami,CE3e3hGF2jc,-0.3125,2015-09-20 23:28:36,False,True
2015-09-20T23:34:42,Johnny Depp + Benedict Cumberbatch That's enough for me,1,0,Mee soO,CE3e3hGF2jc,0.0,2015-09-20 23:34:42,False,True
2015-09-20T23:35:21,Great movie. Great performance.,0,0,BujuCotto,CE3e3hGF2jc,0.8,2015-09-20 23:35:21,False,True
2015-09-21T02:28:36,"I went to see it and they cut many scenes from this trailer wich i found very annoying. This movie us awesome, but i am now looking for the extended edition blu-ray.",0,0,Emelyne,CE3e3hGF2jc,0.16666666666666666,2015-09-21 02:28:36,False,True
2015-09-21T03:49:13,Just watched this I was wondering throughout the movie if Depp's character from 2001 supplied the drugs to his character in 2015.,0,0,OrbitOnceAround,CE3e3hGF2jc,0.0,2015-09-21 03:49:13,False,True
2015-09-21T04:18:25,Just watched this movie. Johnny Depp delivered a outstanding performance. For about half way through the movie I didn't even realize it was him playing Bulger. Oscar worthy performance and a good movie,17,0,Derek Kudjer,CE3e3hGF2jc,0.3416666666666667,2015-09-21 04:18:25,False,True
2015-09-21T06:54:18,"the cop pulling over scene and the dinner scene is most memorable scenes i've watched recently , great dialogs",0,0,Abhijeet P,CE3e3hGF2jc,0.6,2015-09-21 06:54:18,False,True
2015-09-21T07:44:48,goodfellas,0,0,Rayhanantha Rasya,CE3e3hGF2jc,0.0,2015-09-21 07:44:48,False,True
2015-09-21T08:12:11,Man. Please stay away from Burton films. This short clip was amazing.,0,0,Member Berry,CE3e3hGF2jc,0.30000000000000004,2015-09-21 08:12:11,False,True
2015-09-21T09:23:20,Still have no idea what the movies about.,0,0,Leo Kang,CE3e3hGF2jc,0.0,2015-09-21 09:23:20,False,True
2015-09-21T09:38:19,"what a shit movie, Johnny Depp is the wrong character to play that role.",1,7,Sassy Sasquatch,CE3e3hGF2jc,-0.35,2015-09-21 09:38:19,False,True
2015-09-21T10:22:52,noone cares about benedict cucumberbatch,0,0,Gamesgamer1337,CE3e3hGF2jc,0.0,2015-09-21 10:22:52,False,True
2015-09-21T16:10:02,this movie is perfect !,0,0,Rock Lim,CE3e3hGF2jc,1.0,2015-09-21 16:10:02,False,True
2015-09-21T18:56:09,I got goosebumps from this,11,0,BossDollar260,CE3e3hGF2jc,0.0,2015-09-21 18:56:09,False,True
2015-09-21T19:42:05,Damn... I'd NEVER want to be that close to such a dangerous person xD!,0,0,Nikki S.,CE3e3hGF2jc,-0.375,2015-09-21 19:42:05,False,True
2015-09-21T20:20:03,Rocking!!!,0,0,Ashmita Chakraborty,CE3e3hGF2jc,0.0,2015-09-21 20:20:03,False,True
2015-09-21T22:21:10,I really am not a Depp fan (since the Jumpstreet days) but I love me some gangsta flicks so...I will be checking this out!,0,0,Breana T,CE3e3hGF2jc,0.2625,2015-09-21 22:21:10,False,True
2015-09-22T00:19:45,Bendthatdick Cuminbitch,0,0,SmexerP,CE3e3hGF2jc,0.0,2015-09-22 00:19:45,False,True
2015-09-22T02:03:41,Can't wait to watch this. That voice and those eyes draws you in so easily!,10,0,Fributes,CE3e3hGF2jc,0.5416666666666667,2015-09-22 02:03:41,False,True
2015-09-22T05:19:37,Johnny depp should win some oscars for this movie ! This movie was amazing . This movie needs to win something,2,0,Gilbert Espino,CE3e3hGF2jc,0.8000000000000002,2015-09-22 05:19:37,False,True
2015-09-22T08:04:40,"johnny depp kinda reminds me of Ray Liotta in the movie ``good fellas""..",0,0,Let's have fun With yohan,CE3e3hGF2jc,0.7,2015-09-22 08:04:40,False,True
2015-09-22T08:06:18,"Damn, Johnny Depp is playing a monster!",16,1,Roy_Thousand,CE3e3hGF2jc,0.0,2015-09-22 08:06:18,False,True
2015-09-22T21:24:01,JUST SAYIN.......deservers J.DEPP an acadamy award.....JUST SAYIN!!!,0,0,mugen,CE3e3hGF2jc,0.0,2015-09-22 21:24:01,False,True
2015-09-23T01:15:46,"this is the worst movie I've seen in a while. that sucks because I love gangster movies and the cast of this movie.  all of the trailers for this movie make it look so much better than it actually is. It's obviously the directors fault because the cast is great, the story is great...the movie itself was horrible.",0,0,Lee Kyle,CE3e3hGF2jc,-0.07142857142857142,2015-09-23 01:15:46,False,True
2015-09-23T01:59:20,My mom saw this movie without me :(,1,0,J M4Y,CE3e3hGF2jc,-0.75,2015-09-23 01:59:20,False,True
2015-09-23T04:23:51,"I love me some Johnny depp, he is so fine",0,0,Stacie Jones,CE3e3hGF2jc,0.45833333333333337,2015-09-23 04:23:51,False,True
2015-09-23T09:12:05,wow Depp amazing I am going to see this movie very clever trailer.,0,0,Eddie Campion,CE3e3hGF2jc,0.3055555555555556,2015-09-23 09:12:05,False,True
2015-09-23T09:56:53,this movie is really good,0,0,Richard,CE3e3hGF2jc,0.7,2015-09-23 09:56:53,False,True
2015-09-23T13:05:36,Looks like GTA,0,0,Kei Zhang,CE3e3hGF2jc,0.0,2015-09-23 13:05:36,False,True
2015-09-23T15:08:39,Those fake looking eyes were way too distracting throughout the movie.,0,0,Victor Engel,CE3e3hGF2jc,-0.5,2015-09-23 15:08:39,False,True
2015-09-23T15:22:56,Officially saw this on Saturday. It was PHENOMENAL!! Depp nailed it. Definitely buying it when it comes out on Blu Ray.,2,2,Dirty Water,CE3e3hGF2jc,0.390625,2015-09-23 15:22:56,False,True
2015-09-23T18:03:46,"I got goosebumps right when he said the first ""No...""",44,0,yELo_HQ,CE3e3hGF2jc,0.26785714285714285,2015-09-23 18:03:46,False,True
2015-09-23T21:14:54,god that was tense lol,0,0,TopFlightSecurity415,CE3e3hGF2jc,0.23333333333333336,2015-09-23 21:14:54,False,True
2015-09-24T01:27:46,Johnny Depp is such a great actor...! I must watch this Movie...! The make up...the teeth...! Is that Johnny Depp...!,0,0,Steven Goutzioulis,CE3e3hGF2jc,0.5,2015-09-24 01:27:46,False,True
2015-09-24T02:32:59,Did not know the Irish mob were as bad as the Italian mob..,0,0,ClarksonsinUSA,CE3e3hGF2jc,-0.23333333333333328,2015-09-24 02:32:59,False,True
2015-09-24T04:26:39,"I felt let down by this movie, like it had superb acting all around, but the actual movie itself wasn't as thrilling or interesting as this trailer.",0,0,EthnicThunder,CE3e3hGF2jc,0.2657407407407408,2015-09-24 04:26:39,False,True
2015-09-24T13:53:13,"This looks awesome, count me in :p saw the trailer while watching legend which is a brilliant film!",0,0,Lloyd Hart,CE3e3hGF2jc,0.9166666666666666,2015-09-24 13:53:13,False,True
2015-09-24T14:57:40,"Garbage movie so boring, killing own friends, called gangster movie",0,2,Cheliy LIne,CE3e3hGF2jc,-0.2,2015-09-24 14:57:40,False,True
2015-09-24T15:19:42,Wow this is gonna be good! I love Johnny Depp so much!,0,0,MT N.,CE3e3hGF2jc,0.43125,2015-09-24 15:19:42,False,True
2015-09-24T15:45:40,this oscar gonna be Johnny Depp vs leonardo dicaprio,3,0,jonty shady,CE3e3hGF2jc,0.0,2015-09-24 15:45:40,False,True
2015-09-24T16:20:40,i loved loved loved loved this movie every minute every second of it . amazing movie  depp  finally oscars han !,0,0,Chronic Cinephile,CE3e3hGF2jc,0.4857142857142857,2015-09-24 16:20:40,False,True
2015-09-24T20:32:48,Depp kind of looks like old-man Johnny Knoxville...,0,0,Viva Frei,CE3e3hGF2jc,0.6,2015-09-24 20:32:48,False,True
2015-09-25T01:39:49,Look at his face...,0,0,ninuxy,CE3e3hGF2jc,0.0,2015-09-25 01:39:49,False,True
2015-09-25T04:30:08,"If I was blindfolded and told to listen to the video I would never guess that its Johnny Depp, ever.",6,0,TheLaughIndustry,CE3e3hGF2jc,0.0,2015-09-25 04:30:08,False,True
2015-09-25T06:57:15,Jesse Plemons (AKA: Todd) from Breaking Bad is in the opening scene.,0,0,Josh,CE3e3hGF2jc,-0.6999999999999998,2015-09-25 06:57:15,False,True
2015-09-25T11:19:00,"Those blue contacts look really bad. They look so fake it's hard to stop thinking about it.Is that the best they could get? Anyway the movie looks great, so I'll get over it.",0,0,Bob Toddlah,CE3e3hGF2jc,0.05138888888888893,2015-09-25 11:19:00,False,True
2015-09-25T13:17:49,Captain Bald Sparrow,0,0,Rodrigo Ventura,CE3e3hGF2jc,0.0,2015-09-25 13:17:49,False,True
2015-09-25T20:37:09,I have seen Black Mass today OMG what a classic movie johnny is the best actor in the world love him.  Oscar is on the way mate best of luck,1,0,Abdul Khan,CE3e3hGF2jc,0.5,2015-09-25 20:37:09,False,True
2015-09-25T21:10:42,Saw the film. Lasted an hour-ish. Horrible beyond reason. The writing is painful. There  are episodes of Dragnet that kick more ass. An embarrassment for all concerned. The opposite of a Scorcese gangster picture.,0,0,Baby Irene,CE3e3hGF2jc,-0.3,2015-09-25 21:10:42,False,True
2015-09-25T22:37:00,I sure hope they make this into a tv series!,0,0,Annette Rome,CE3e3hGF2jc,0.625,2015-09-25 22:37:00,False,True
2015-09-26T04:02:07,Now This Looks AWESOME!,0,0,Hip Hop Junkie,CE3e3hGF2jc,1.0,2015-09-26 04:02:07,False,True
2015-09-26T04:23:45,Me scared hold me.,0,0,GAMERSTEVIEJ,CE3e3hGF2jc,0.0,2015-09-26 04:23:45,False,True
2015-09-26T05:08:20,LoL the look on that dudes face that look of i done fucked up!! Best trailer ever.,0,0,Steve Moruri,CE3e3hGF2jc,0.28750000000000003,2015-09-26 05:08:20,False,True
2015-09-26T11:44:39,His laugh at the dinner table is the same laugh as Linda Blair-demon in the Exorcist.,0,0,Mitzi73,CE3e3hGF2jc,0.19999999999999998,2015-09-26 11:44:39,False,True
2015-09-26T15:16:30,honestly.............  this guy is scarier than the joker in the suicide squad XD,0,0,rama dika,CE3e3hGF2jc,0.6,2015-09-26 15:16:30,False,True
2015-09-26T18:12:04,"Johnny Depp looks like that dad from ""that 70's show"".",3,0,zumoku_ANBU,CE3e3hGF2jc,0.0,2015-09-26 18:12:04,False,True
2015-09-26T20:05:42,His creepiest role since Sweeney Todd,0,0,Hiram Rivera,CE3e3hGF2jc,0.0,2015-09-26 20:05:42,False,True
2015-09-26T20:37:12,I'm telling ya Johnny Depp is seriously one of the all time best actors. You know how hard that must be. And we all think actors get payed big bucks and everything. But people like Johnny Depp really nail it!  They sit and watch footage of the character there going to play all there mannerisms and the way they talk. He'll play in Pirates of the Caribbean for kids and then do a part like this. That's awesome!:-),0,0,JC B,CE3e3hGF2jc,0.30357142857142855,2015-09-26 20:37:12,False,True
2015-09-26T20:50:26,"Whitey never got caught because they couldn't bust him in till a certain time. He was helping them for years. He lived in California and they never caught him? Plus his brother was big into  politics. I forget what he was a select man or something?  But every summer he would have a huge clam boil down the cape F.B.I. State Police everyone one would be there even Whitey. We have laws but they only apply to people like us the bend em and break them all the time when ever they want. The U.S. is a scary place the C.I.A. do some shady shit! I was born and raised in Boston and still live here. When I was little there would be a bunch of us raising hell.  Picking money out if the parking meters for money to get candy and whitey would come in and buy us all a bunch of candy sodas what ever we wanted. We thought he was the greatest, he did do a lot of good things. But he did bad to I guess. The people he murdered weren't people just off the st. they were people that were in the game and new the price that would have to be paid. Just no one knew he was ratting????",0,0,JC B,CE3e3hGF2jc,0.009597162097162104,2015-09-26 20:50:26,False,True
2015-09-27T01:41:44,Whoa I wouldn't have even known this was Johnny depp,0,0,ALSwellkept,CE3e3hGF2jc,0.0,2015-09-27 01:41:44,False,True
2015-09-27T05:59:41,Good movie -- but I thought the movie was about something completely different when I was watching the trailer (I thought Depp's character Whitey Bulger was actually a hit guy for hire).,0,0,SevenFoot Pelican,CE3e3hGF2jc,0.2333333333333333,2015-09-27 05:59:41,False,True
2015-09-27T12:43:37,"Johnny Depp portrays the vulgar violent ruthless alpha male gangster real well. His acting was incredibly real -- stellar performance. His laughter is exactly like mine except I tried not to laugh so often and hide it, not show that real side of me. Anyway, the scenes shows mostly his vulgar side, such as in the bedroom of his best friend. He doesn't even knock on the door and politely ask. Instead, he acts like he was king of that house and turns the locked door knob several times. When she opens the door, she sees him and tries to wedge the door in between them. He stops her from doing that. He enters into her private bedroom without permission and starts a mini conversation with her. He caresses the side of her face and he massages her throat. She, of course, didn't think highly of his massage. She felt more like he was going to choke and strangle her and feared him. He loved it! You can tell right there and then he was summing her up. As he leaves, he turns around, smiles, and looks at her, expressing his envious at what a catch his best friend has --- the ideal trophy wife who won't retaliate against him(as like his current woman).",0,0,Chris John P. Black,CE3e3hGF2jc,0.13523809523809524,2015-09-27 12:43:37,False,True
2015-09-27T13:58:37,The best badass performance since Denzel Washingtons training day,6,5,abredell,CE3e3hGF2jc,1.0,2015-09-27 13:58:37,False,True
2015-09-27T22:55:48,reminded me of the joker when he laughed,1,0,King Drake,CE3e3hGF2jc,0.7,2015-09-27 22:55:48,False,True
2015-09-28T04:33:49,"This trailer is among the best trailers I've ever seen, it's so atmospheric and well-constructed.",3,0,Weeded Materials Productions,CE3e3hGF2jc,0.5,2015-09-28 04:33:49,False,True
2015-09-28T04:58:40,This reminds me of the dinner scene from good fellas!,0,0,I Am Apollo,CE3e3hGF2jc,0.875,2015-09-28 04:58:40,False,True
2015-09-28T05:15:56,What did you marinate this steak in? because its outa this world your killin me with...oh  no no its a family secret oh  come on you gota tell the me the whats the secret? come on! you could do it come on? haha come on! that is one of the best god damn steaks I ever had in my life mhmm ever! whats the whats the family secret recipe? its groun its ground garlic and a little bit of soy that's it? yeah that's it that's it I thought it was a family secret? aha  its a recipe! no! no! you said to me this is a family secret and you gave it up to me boom just like that you spill the secret family recipe today maybe you spill alittle something about me tomorrow! hmm? look im I was just sayen! you were just sayen? just sayen gets people sent awayjust sayen got me a 9 year stretch in Alcatraz you understand? so just sayen could get you buried real quick ahahahahahahalook at his face hahahaa,0,0,I Am Apollo,CE3e3hGF2jc,-0.154375,2015-09-28 05:15:56,False,True
2015-09-28T07:23:00,"just sayen got me a 9 year stretch in Alcatraz you understand?so just sayen, could get you buried real quick.",15,0,I Am Apollo,CE3e3hGF2jc,0.5,2015-09-28 07:23:00,False,True
2015-09-28T07:32:03,"basically, don't snitch!",0,0,I Am Apollo,CE3e3hGF2jc,0.0,2015-09-28 07:32:03,False,True
2015-09-28T07:32:20,keep your mouth shut...,0,0,I Am Apollo,CE3e3hGF2jc,0.0,2015-09-28 07:32:20,False,True
2015-09-28T08:05:22,Depp ruthless exploitation provides a congenial face.,0,0,Track Tour,CE3e3hGF2jc,-1.0,2015-09-28 08:05:22,False,True
2015-09-28T16:51:25,I liked the movie a lot but I am disappointed they let the FBI off the hook. The FBI in Boston was much more corrupt than the movies gives the impression,1,3,starbuck4774,CE3e3hGF2jc,-0.037500000000000006,2015-09-28 16:51:25,False,True
2015-09-28T17:28:18,I hope they make another movie that focuses more on the FBI corruption. But Johnny Depp was so good as Bulger it would be weird to see someone else play him,0,0,starbuck4774,CE3e3hGF2jc,0.2333333333333333,2015-09-28 17:28:18,False,True
2015-09-29T13:29:24,It's about time Dep did something other than a pirates movie!!!,0,0,radiogeek89,CE3e3hGF2jc,-0.244140625,2015-09-29 13:29:24,False,True
2015-09-29T17:44:22,I can see the Oscar in Johnny's hands,0,0,Cvet Tresnje,CE3e3hGF2jc,0.0,2015-09-29 17:44:22,False,True
2015-09-30T00:28:31,"I saw this movie in a sneak preview, and must say it is very dissapointing. The story isn't that good and very boring. Only funny thing is, to see  jonny depp as a gangster.That's all you got from this movie.",0,0,GyomotoKazanari,CE3e3hGF2jc,0.02999999999999998,2015-09-30 00:28:31,False,True
2015-09-30T12:08:00,exited,0,0,tobey i,CE3e3hGF2jc,0.0,2015-09-30 12:08:00,False,True
2015-09-30T12:18:48,Johnny is terrifying in this. Oh my god.,0,0,卌l-/ 5 seconds of Twenty one Pilots,CE3e3hGF2jc,-1.0,2015-09-30 12:18:48,False,True
2015-09-30T18:04:28,"Want to hear two film critics and a Johnny Depp scholar dish on this movie? ""Menace like we've never seen before.""   https://soundcloud.com/bereelguys/the-crimes-of-johnny-depp-episode-17",0,0,Be Reel Podcast,CE3e3hGF2jc,0.0,2015-09-30 18:04:28,False,True
2015-10-01T04:13:13,"See, this is why Johnny Depp is my favorite actor.",1,0,quick! hidethepickles,CE3e3hGF2jc,0.5,2015-10-01 04:13:13,False,True
2015-10-01T04:56:39,he could use half a teaspoon of baking soda mixed with one or two drops of lemon juice to whiten his teeth.,0,0,Elizabeth,CE3e3hGF2jc,-0.08333333333333333,2015-10-01 04:56:39,False,True
2015-10-01T12:50:13,JUST SAYIN,1,0,Meena Bist,CE3e3hGF2jc,0.0,2015-10-01 12:50:13,False,True
2015-10-01T13:27:31,the real Whitey was FINALLY arrested in 2011 when the dude was 81... like he really cared if he caught or not anymore lmao,0,0,superdbag75,CE3e3hGF2jc,0.25,2015-10-01 13:27:31,False,True
2015-10-01T18:28:32,He sounds russian...shocking accent.,0,1,telephonic,CE3e3hGF2jc,0.0,2015-10-01 18:28:32,False,True
2015-10-01T23:16:00,"this guy is amazing, can't wait to see this movie",0,0,Ryan Styles,CE3e3hGF2jc,0.6000000000000001,2015-10-01 23:16:00,False,True
2015-10-02T04:52:14,Johnny Depp also portrayed me.,0,0,Mr. Piccolo,CE3e3hGF2jc,0.0,2015-10-02 04:52:14,False,True
2015-10-02T12:43:00,A masterpiece by Johnny depp,8,0,Baheen Qadri,CE3e3hGF2jc,0.0,2015-10-02 12:43:00,False,True
2015-10-02T18:29:37,the best part of this movie was when my brother farted,0,0,Mason Shirts,CE3e3hGF2jc,1.0,2015-10-02 18:29:37,False,True
2015-10-02T18:49:15,Does anyone know why I can't view this video on YouTube using my mom's Kindle? All I'm getting is a black frame...,0,0,barbara chumparty plummer smith,CE3e3hGF2jc,-0.16666666666666666,2015-10-02 18:49:15,False,True
2015-10-02T20:12:29,"just came back from cinema and this movie was horrible, i wasted my time, the fun part is when me and my friend played snakes and ladders on my phone during it",0,0,Monster -,CE3e3hGF2jc,-0.22499999999999998,2015-10-02 20:12:29,False,True
2015-10-02T20:59:25,johnny Depp will win oscars the scarface like donnie brasco,0,0,tim bardtke,CE3e3hGF2jc,0.8,2015-10-02 20:59:25,False,True
2015-10-02T22:25:06,Great story ?,0,0,tim bardtke,CE3e3hGF2jc,0.8,2015-10-02 22:25:06,False,True
2015-10-03T01:47:01,Johnny boy is back,0,0,John M.C.,CE3e3hGF2jc,0.0,2015-10-03 01:47:01,False,True
2015-10-03T12:52:27,"two of my favorite actors in one film (depp & cumberbatch), of course I'll watch it!!! 😍😍😍😍😍😍😍",0,0,Soraya Hasna .Fadhilah,CE3e3hGF2jc,0.9765625,2015-10-03 12:52:27,False,True
2015-10-03T14:21:56,i'm probably 20 mins in so far and really love this movie.,0,0,Tiffany Magreehan,CE3e3hGF2jc,0.3,2015-10-03 14:21:56,False,True
2015-10-03T17:40:05,loved the movie,0,0,something nothing,CE3e3hGF2jc,0.7,2015-10-03 17:40:05,False,True
2015-10-03T21:21:13,i think he should have a go at playing the joker he would be good at that role,0,0,Lynnette Alexander,CE3e3hGF2jc,0.7,2015-10-03 21:21:13,False,True
2015-10-03T23:47:01,"He's Back, but i gotta say that gives me chills !",0,0,Heisenberg,CE3e3hGF2jc,0.0,2015-10-03 23:47:01,False,True
2015-10-04T00:52:46,movie was amazing,0,0,Ramen Slut,CE3e3hGF2jc,0.6000000000000001,2015-10-04 00:52:46,False,True
2015-10-04T01:19:22,"FBI Director, J. Edgar Hoover, had seen evidence implicating Bulger associate, Vincente Flemmi in the murder of Teddy Deegan.  However, Bulger associate/FBI informant Joe Barboza, gave false witness against my  big buddy and housemate, Peter Limone.  When two FBI agents came to our house to arrest Peter, I grabbed one leg of each agent and yelled: ""You can't arrest Peter!  He's My Friend!  Run, Peter!"" The two agents beat me black and blue for several minutes until Peter emerged from his attic room and announced: ""It's over kid.  Why are you such a jerk!  Goodbye!"" Peter is now godfather of the Patriarchas. I relate his tale and many others such as the beat-down of pedo priests in my book: ""How I Got Beat-Up by the FBI When I Was Four Years Old"" Dee Hill",0,0,Dennis Hill,CE3e3hGF2jc,-0.010392992424242426,2015-10-04 01:19:22,False,True
2015-10-04T01:53:26,This movie was pure garbage,0,0,HJ Cobb,CE3e3hGF2jc,0.21428571428571427,2015-10-04 01:53:26,False,True
2015-10-04T03:30:22,Next Joker,0,0,Sugar Glider,CE3e3hGF2jc,0.0,2015-10-04 03:30:22,False,True
2015-10-04T04:56:40,will never understand why scum like this get movies made out them.,0,0,7orqu3,CE3e3hGF2jc,-0.3,2015-10-04 04:56:40,False,True
2015-10-04T05:18:57,"Dear Johnny...  Thank you for being picky for a role - It's been a while... I'm a 'fan' in the loosest sense of the word,  and it's a treat to see you 'acting' in a solid role instead of 'trying' to fit into something.  Thumbs up, man. PS. Let's grab a coffee sometime here on Vancouver Island. lol",0,0,GoldiRock Records,CE3e3hGF2jc,0.30000000000000004,2015-10-04 05:18:57,False,True
2015-10-04T11:00:09,Yet another great performance by Johnny Depp. To be honest I feel the entire cast did a great job. Damn good movie.,0,0,RedPill BlackPill Knowledge,CE3e3hGF2jc,0.5800000000000001,2015-10-04 11:00:09,False,True
2015-10-04T11:18:22,"Just watched the whole movie, average at best, if you have to pay to see it, don't, keep your money and wait for it to be on TV.",0,0,Mission Multi Media,CE3e3hGF2jc,0.35000000000000003,2015-10-04 11:18:22,False,True
