timestamp,text,like_count,reply_count,author,trailer_id,sentiment_score,datetime,used_for_model,used_for_visualization
2015-05-20T00:53:01,With a performance like this I could easily see Johnny Depp playing the joker ,0,0,Robert Moore,CE3e3hGF2jc,0.43333333333333335,2015-05-20 00:53:01,True,True
2015-05-20T16:14:14,Am I the only one that thinks Depp is seriously overacting here?,1,0,Matt Jones,CE3e3hGF2jc,-0.16666666666666666,2015-05-20 16:14:14,True,True
2015-05-20T17:14:00,"the last good movie johnny depp made was donnie brasco. and that was almost 20 years ago , i never heard of this director or whatever but this looks like shit already.",0,0,druha10304,CE3e3hGF2jc,0.16666666666666666,2015-05-20 17:14:00,True,True
2015-05-20T21:50:58,Jonny depp would be the best joker ever ,0,0,Saddam Thrasher,CE3e3hGF2jc,1.0,2015-05-20 21:50:58,True,True
2015-05-20T23:09:58,Jack Sparrow - Funny...even though he has a sword Sweeny Todd - Yeah he might kill you....but...you shouldn't have a) pissed him off or b) walk in his barber shop in the first place Dillinger - Cool Mobster This guy in Black Mass - I need a new pair of pants.....,1,0,RandomMindz,CE3e3hGF2jc,0.14242424242424243,2015-05-20 23:09:58,True,True
2015-05-21T02:11:45,Just saying could get you buried real quick........ Can't wait for this movie! ,0,0,J. Eulogy,CE3e3hGF2jc,0.625,2015-05-21 02:11:45,True,True
2015-05-21T05:55:00,..Wait....wait...and then he makes another movie with Tim Burton! and we all scream: WHY???!!,0,0,Octavio Lopez,CE3e3hGF2jc,0.0,2015-05-21 05:55:00,True,True
2015-05-21T07:17:41,"Holy shit, Johnny Depp actually scares me now. Second time watching it because it gives me chills.",3,0,Burner2K0,CE3e3hGF2jc,-0.06666666666666667,2015-05-21 07:17:41,True,True
2015-05-21T15:32:49,"this is gonna be johnny depp best movie, I think bulger would approve.",0,0,itwillbeme1,CE3e3hGF2jc,1.0,2015-05-21 15:32:49,True,True
2015-05-22T00:21:51,pure devil laugh,1,0,nafiul aziz,CE3e3hGF2jc,0.2571428571428571,2015-05-22 00:21:51,True,True
2015-05-22T01:17:19,"Johnny Depp did some other films in the crime genre besides Black Mass, Donnie Brasco and Public Enemies.",1,0,Abunidal Paredes,CE3e3hGF2jc,-0.09722222222222221,2015-05-22 01:17:19,True,True
2015-05-22T07:15:41,Damn that was scarry o_O,0,0,DerHalbeEuro,CE3e3hGF2jc,0.05,2015-05-22 07:15:41,True,True
2015-05-22T08:26:05,He looks like a vampire . ,0,0,Scott Klingensmith,CE3e3hGF2jc,0.0,2015-05-22 08:26:05,True,True
2015-05-22T19:44:41,the joker reincarnated,0,0,Joseph Mack,CE3e3hGF2jc,0.0,2015-05-22 19:44:41,True,True
2015-05-22T20:46:17,OMG I watch it every day,0,0,NOA,CE3e3hGF2jc,0.0,2015-05-22 20:46:17,True,True
2015-05-22T21:50:05,finally johnny Depp is back with  serious roles unlike those stupid fairy tales he has been playing in recently,0,0,Beast Mode,CE3e3hGF2jc,-0.22666666666666666,2015-05-22 21:50:05,True,True
2015-05-23T01:30:26,That moment when they play the trailer as an ad when I wanted to watch the trailer kden.,0,0,DEFxRECON,CE3e3hGF2jc,0.0,2015-05-23 01:30:26,True,True
2015-05-23T02:01:52,A Johnny Depp that's not directed by Tim Burton??? is this real life???,1,0,Luis V Cabrera,CE3e3hGF2jc,0.2,2015-05-23 02:01:52,True,True
2015-05-23T02:09:44,"If you like this watch the ""legend"" trailer...this is a must see by the way ",0,0,Terry Odom,CE3e3hGF2jc,0.0,2015-05-23 02:09:44,True,True
2015-05-23T02:31:52,Damn Johnny!!,0,0,DawgzofWar,CE3e3hGF2jc,0.0,2015-05-23 02:31:52,True,True
2015-05-23T02:53:14,Still less of a dick than Gordon Ramsey,0,0,Simon MacCorkindale,CE3e3hGF2jc,-0.16666666666666666,2015-05-23 02:53:14,True,True
2015-05-23T02:58:46,"Benedict Cumberbatch and Johnny Depp!?!?!? I am so excited, it looks like it is going to be real good.",1,0,Vanna,CE3e3hGF2jc,0.6875,2015-05-23 02:58:46,True,True
2015-05-23T03:22:44,Blue eyes don't do well with Johnny ,1,0,The Crystal Pencil,CE3e3hGF2jc,0.0,2015-05-23 03:22:44,True,True
2015-05-23T07:34:25,0:48 how does he know he wasn't lying?? maybe he was lying about the family secret. just sayin.,106,25,Peter Sen Gupta,CE3e3hGF2jc,-0.4,2015-05-23 07:34:25,True,True
2015-05-23T07:58:26,"Its sad to know that people know Depp only by pirates of the Caribbean and other goofy comic roles where as the real Depp its at Donnie Brasco, Ed Wood, Fear and Loathing in Las Vegas ,Whats eating Gilber Grape ,Blow,  Dead man and nightmare in the elm street. Bunch of kids dont even watch his earlier masterpieces make him the best actor",1,0,Roan Dhakal,CE3e3hGF2jc,0.125,2015-05-23 07:58:26,True,True
2015-05-23T09:28:43,"in real life if you heard that ""NO"".....you would shit your pants",3,0,Edgar Gonzalez,CE3e3hGF2jc,0.0,2015-05-23 09:28:43,True,True
2015-05-23T12:44:04,"this is gonna be a great movie, I think bulger would approve.",0,0,marie lloyd,CE3e3hGF2jc,0.8,2015-05-23 12:44:04,True,True
2015-05-23T13:59:38,"So, Johnny Depp devoured the souls of Christopher Walken and Ray Liotta... Neat.",1,0,kikielfriki,CE3e3hGF2jc,0.0,2015-05-23 13:59:38,True,True
2015-05-23T15:11:43,First Class Acting... Award winner...,0,0,Adel Ghithan,CE3e3hGF2jc,0.125,2015-05-23 15:11:43,True,True
2015-05-23T15:23:00,EVERYBODY CHECK OUT THE SECOND TRAILER NOW O_O SHIT GETS REAL!!!!!,1,0,Vegeta Solo,CE3e3hGF2jc,0.115087890625,2015-05-23 15:23:00,True,True
2015-05-23T16:44:24,"A more dour version of ""Am I funny like a clown? Do I amuse you?"" speech from Joe Pesci in Goodfellas.",1,0,FlyingOverTr0ut,CE3e3hGF2jc,0.375,2015-05-23 16:44:24,True,True
2015-05-23T17:27:15,This is crazy... Johny deep ..just amazing,0,0,rohan radhakrishnan,CE3e3hGF2jc,3.700743415417188e-17,2015-05-23 17:27:15,True,True
2015-05-23T18:25:04,I can see an Oscar.,0,0,Amr Hesham,CE3e3hGF2jc,0.0,2015-05-23 18:25:04,True,True
2015-05-23T18:40:26,"When I see this trailer, I do not see Johnny Depp I see Whitey Bulger the exact same way I saw Ray Charles instead of Jamie Foxx",1,0,DawgzofWar,CE3e3hGF2jc,0.125,2015-05-23 18:40:26,True,True
2015-05-23T18:50:45,Kakav booog jedva cekam da dođe u hr kina,0,0,Wadu Heek,CE3e3hGF2jc,0.0,2015-05-23 18:50:45,True,True
2015-05-23T19:18:10,OMG! His laugh. O.o,0,0,JESSIE E.G.,CE3e3hGF2jc,0.175,2015-05-23 19:18:10,True,True
2015-05-23T19:42:11,Tommy DeVito meets Anton Chigurh.,1,0,CultureOfCritique,CE3e3hGF2jc,0.0,2015-05-23 19:42:11,True,True
2015-05-23T19:42:48,"I only came to see a new trailer for a movie than Benedict Cumberbatch is in, but, this actually looks amazing. So much talent in one movie. Can't wait. ",1,0,Kimberly Wise,CE3e3hGF2jc,0.1872727272727273,2015-05-23 19:42:48,True,True
2015-05-23T20:28:52,well that escalated quickly,1,0,SmallDick StoleYourGirl,CE3e3hGF2jc,0.3333333333333333,2015-05-23 20:28:52,True,True
2015-05-23T20:39:53,"Damn, this is gonna be one of those legendary scenes of manipulation in crime movies...",0,0,ign0rantz,CE3e3hGF2jc,1.0,2015-05-23 20:39:53,True,True
2015-05-23T21:17:38,"While everyone is here for Johnny Depp, I'm here for Benedict Cumberbatch. ",0,0,blondiegal397,CE3e3hGF2jc,0.0,2015-05-23 21:17:38,True,True
2015-05-24T00:11:35,can you see the Oscar nominations? I can,0,0,Ness,CE3e3hGF2jc,0.0,2015-05-24 00:11:35,True,True
2015-05-24T02:25:41,Bout damn Time... I've been waiting for Johnny to come back..,0,0,r. Cali,CE3e3hGF2jc,0.0,2015-05-24 02:25:41,True,True
2015-05-24T05:56:34,Johnny Depp finally found a way to merge his love of white powdery make up and movies that may not totally suck.,5,0,WeWatchedAMovie,CE3e3hGF2jc,0.125,2015-05-24 05:56:34,True,True
2015-05-24T06:04:04,282 People gave up the family secret.,2,0,carrastealth,CE3e3hGF2jc,-0.4,2015-05-24 06:04:04,True,True
2015-05-24T06:16:18,Such a badass ,0,0,kadiesha Belgrave,CE3e3hGF2jc,0.0,2015-05-24 06:16:18,True,True
2015-05-24T07:49:29,"Que Benedict Cumberbatch at 01:34 in 3,2,1.... BOOM! Worth it!!! ",0,0,Yamin Thein,CE3e3hGF2jc,0.5859375,2015-05-24 07:49:29,True,True
2015-05-24T08:40:49,He's is a great actor jux this teaser scared me I can't wait for the movie ,0,0,AstroCrawler,CE3e3hGF2jc,0.8,2015-05-24 08:40:49,True,True
2015-05-24T08:54:01,Lime lite so true I always said American culture embraces drinking smoking hanging out all day on some street corner or bar breaking the law committing crime all day.... So long as its outlaws/cowboys/white people  But as soon as minorities took over that shit its as if almost we started it the way we get the blame.. Smh society is shit and so is its perception... About the movie though looks awesome like a movie needed for this era plus Johnny Depp so fits this roll I'm over the corky dorky depp he is much more than that... PS I was raised in the streets so I unlike society understand the similarities  of individuals in the street.... White black brown no matter,0,0,C Perez,CE3e3hGF2jc,0.137037037037037,2015-05-24 08:54:01,True,True
2015-05-24T12:23:51,This movie looks interesting. ,0,0,KEEP CALM,CE3e3hGF2jc,0.5,2015-05-24 12:23:51,True,True
2015-05-24T13:11:57,Thumbs up if this amazing trailer gave u chills.....,0,0,GAAND DEGA,CE3e3hGF2jc,0.6000000000000001,2015-05-24 13:11:57,True,True
2015-05-24T14:21:24,Woah. That was amazing. Brilliant acting!,0,0,Andreia Liang,CE3e3hGF2jc,0.5,2015-05-24 14:21:24,True,True
2015-05-24T16:42:04,Wow is this finally gonna be a Johnny Depp movie that I don't DREAD watching !!?!?!?!,1,0,Michael Silve,CE3e3hGF2jc,0.05,2015-05-24 16:42:04,True,True
2015-05-24T18:34:31,This is some good shit!!,0,0,Marek Dabrowski,CE3e3hGF2jc,0.19374999999999998,2015-05-24 18:34:31,True,True
2015-05-24T20:30:45,best actor for gangster movies 🔫🔫 ,0,0,affrin ali,CE3e3hGF2jc,1.0,2015-05-24 20:30:45,True,True
2015-05-25T04:16:55,The return of the Public Enemy,0,0,1m2a3t4t5,CE3e3hGF2jc,0.0,2015-05-25 04:16:55,True,True
2015-05-25T04:34:33,This is Oscar worthy and redemption for Johnny Depp,0,0,SuperScottii,CE3e3hGF2jc,0.3333333333333333,2015-05-25 04:34:33,True,True
2015-05-25T12:19:55,Lame ass trailer for a long awaited film. WTF?,0,0,Marc Barber,CE3e3hGF2jc,-0.35000000000000003,2015-05-25 12:19:55,True,True
2015-05-25T12:25:51,every since i saw donnie brasco ive always thought johnny depps style suits gangsters,0,0,AS,CE3e3hGF2jc,0.0,2015-05-25 12:25:51,True,True
2015-05-25T12:54:09,This is for the people who judging too soon that Johnny Depp carrier is fading away after playing Mortdecai,0,0,Dinda,CE3e3hGF2jc,0.0,2015-05-25 12:54:09,True,True
2015-05-25T13:15:42,I just hope it has more than 3 hours. the dialogue! only this scene is awsome,0,0,nucky 313,CE3e3hGF2jc,0.3125,2015-05-25 13:15:42,True,True
2015-05-25T14:03:21,"The last good Jonny deep movie I saw was blow,, hope this is as good",0,0,Gadgetbig,CE3e3hGF2jc,0.35,2015-05-25 14:03:21,True,True
2015-05-25T15:30:22,And no release dare ,0,1,justin fortney,CE3e3hGF2jc,0.0,2015-05-25 15:30:22,True,True
2015-05-25T16:28:53,"Now this is what a movie trailer should look like!  Doesn't spoil the movie, give up the story, or offend our ears with that same damn Inception horn thing that every trailer has done since.  Bravo!",0,0,Jonathan Beals,CE3e3hGF2jc,0.0,2015-05-25 16:28:53,True,True
2015-05-25T17:54:19,"I'm actually really excited for this movie. Johnny Depp is a fantastic dramatic actor, and it'll be nice seeing him playing something that's not a rehash of Jack Sparrow",0,0,Timothy Choi,CE3e3hGF2jc,0.19333333333333333,2015-05-25 17:54:19,True,True
2015-05-25T19:41:25,"Jesus, I never thought I'd be scared of Johnny 'Ooo I've got scissors for hands' Depp",0,0,hughtubecube,CE3e3hGF2jc,0.0,2015-05-25 19:41:25,True,True
2015-05-25T20:07:24,Johnny Depp is about to redeem himself for The Lone Ranger. I can't wait to see this movie.,1,0,Mr. Porter,CE3e3hGF2jc,0.0,2015-05-25 20:07:24,True,True
2015-05-26T02:36:31,"Why does Whitey Bulger look like a vampire? I will most likely watch this movie. But it might just be your average run of the mill gangster pic. Kind of like how The Iceman (2013) was, just saying.",1,0,John,CE3e3hGF2jc,0.2375,2015-05-26 02:36:31,True,True
2015-05-26T03:02:35,That´s a Joe Pesci tribute from Goodfellas... a nice one but...,0,0,Tinta Selecta,CE3e3hGF2jc,0.6,2015-05-26 03:02:35,True,True
2015-05-26T03:37:34,"And then, pants were shat.",0,0,Scourgewolf,CE3e3hGF2jc,0.0,2015-05-26 03:37:34,True,True
2015-05-26T06:11:04,"""Its a recipe""... ""No...... No""  Whoa - I got the chills from that scene.",2,0,Albert Saldana,CE3e3hGF2jc,0.0,2015-05-26 06:11:04,True,True
2015-05-26T07:58:27,Freaky looking eyes he's got.,0,0,MovieManiac33,CE3e3hGF2jc,0.0,2015-05-26 07:58:27,True,True
2015-05-26T08:03:09,And the OSCAR goes to Johnny Depp,2,0,Ajay Poriya,CE3e3hGF2jc,0.0,2015-05-26 08:03:09,True,True
2015-05-26T09:31:55,Ha ha hahahahahah look at his face!!,0,0,GmJunky87,CE3e3hGF2jc,0.0,2015-05-26 09:31:55,True,True
2015-05-26T09:49:33,The last time i felt like this was when Heath Ledger played joker. I'm watching this.,1,0,Prakash Applasamy,CE3e3hGF2jc,0.0,2015-05-26 09:49:33,True,True
2015-05-26T10:09:44,Loved departed can't wait to see this 🔫🔫🔫,0,0,marcus jones,CE3e3hGF2jc,0.7,2015-05-26 10:09:44,True,True
2015-05-26T10:09:52,OSCARS or RAZZIES !!!! nothing in between!!,1,0,Adi chalke,CE3e3hGF2jc,0.0,2015-05-26 10:09:52,True,True
2015-05-26T11:30:22,"Damn, hardly recognised Depp. Looks pretty good. And great seeing Joel Edgerton finally starting to make headway in Hollywood. Another Aussie doing well.",1,0,drumdust,CE3e3hGF2jc,0.29166666666666663,2015-05-26 11:30:22,True,True
2015-05-26T15:41:11,Well At Least He Looks More Like *WHITEY BULGER* Than He Did As *JOE PISTONE* In *DONNIE BRASCO* ... (Lol) He Looked Like a *MALE CALVIN KLEIN MODEL* In DONNIE BRASCO .. He Was GREAT ACTING WISE But I Always Like THE ACTOR Portraying a REAL PERSON In a *TRUE STORY* To At Least Some What Look Like THE PERSON They Are Portraying .. ,0,0,BONNEE MCGEE,CE3e3hGF2jc,0.275,2015-05-26 15:41:11,True,True
2015-05-26T15:50:55,~ *FUN FACT* ~ ... THE DICK FACE Known As *DANA WHITE* ... Got RAN OUT of *BOSTON* By .. *WHITEY* And His CREW ... DANA Was Teaching *BOXERCISE CLASSES* In An AREA RUNNED By *BULGER* And They Came to THE GYM And Said DANA Had to PAY Pretty Much His MONTLY SALARY to Them aka *EXTORTION* So DANA Bounced to *LAS VEGAS* .. Seen His WEALTHY HIGH SCHOOL BUDDY At a WEDDING And Convinced Him to BUY *THE UFC* And Let His *DUMB ASS* Be *THE PRESIDENT*,0,0,BONNEE MCGEE,CE3e3hGF2jc,0.14785714285714285,2015-05-26 15:50:55,True,True
2015-05-26T22:38:16,This actually looks really good.,0,0,RIP Schnepp The King of Sweaties,CE3e3hGF2jc,0.35,2015-05-26 22:38:16,True,True
2015-05-27T00:19:34,Glad that Johnny Depp was able to save enough money to buy his freedom back from Tim Burton and is finally taking on roles worthy of his talents.,0,0,b RAD,CE3e3hGF2jc,0.2222222222222222,2015-05-27 00:19:34,True,True
2015-05-27T02:03:45,At least this is pretty much guaranteed to beat his last movie Mortdecai  ,0,0,soccerlova88,CE3e3hGF2jc,0.037500000000000006,2015-05-27 02:03:45,True,True
2015-05-27T02:23:33,"Despite the fact that some folks are in denial (including the folks that are denying it just to be a troll), this scene is VERY similar in many respects to Pesci's scene in Goodfellas... the pacing, the fact that there are other people sitting with them and they are gathered around a dining table... that said, this trailer hit me like a ton of bricks and I am looking forward to seeing it.",0,0,radiobox,CE3e3hGF2jc,0.125,2015-05-27 02:23:33,True,True
2015-05-27T03:07:54,Oscar for Depp. Amazing actor and he will win,0,0,Matthew Gauthier,CE3e3hGF2jc,0.7000000000000001,2015-05-27 03:07:54,True,True
2015-05-27T03:18:50,"Few weird facts about Whitey that may or may not make its way into the movie: he  forced his way into buying his liquor store base by threatening the owners toddler with a gun. A few years later a ticket was sold in said store that was a multi million dollar winner in the MA state lottery,  just so happens that whitey and friends were the winners,.....legend has it they took it off who knows who,  ...and then the original owner of the liquor store who raved about how he waited years to testify turns up dead a day before his testimony, which was recently before whiteys trial.",1,1,Jim M,CE3e3hGF2jc,-0.20277777777777778,2015-05-27 03:18:50,True,True
2015-05-27T06:01:00,We need a good modern gangster film. Gangster squad was a joke! ,0,0,Poopie pants,CE3e3hGF2jc,0.475,2015-05-27 06:01:00,True,True
2015-05-27T07:34:47,Oscar! Oscar! Oscar! OOOOscar!,0,0,Chocochata,CE3e3hGF2jc,0.0,2015-05-27 07:34:47,True,True
2015-05-27T10:49:51,Hope the movie lives up to this trailer! The best I have ever seen...... powerful and raw !!!,0,0,dhimannitdgp,CE3e3hGF2jc,0.2830929487179487,2015-05-27 10:49:51,True,True
2015-05-27T13:52:59,It sound like he will get the golden prize this time,0,0,Mohammed awad alkarim,CE3e3hGF2jc,0.35,2015-05-27 13:52:59,True,True
2015-05-27T16:17:54,And the Oscar goes to...,0,0,Matthew Micsa,CE3e3hGF2jc,0.0,2015-05-27 16:17:54,True,True
2015-05-27T19:57:32,john depp should've been picked to play the joker. after seeing this trailer I'm sold,0,0,Danny Dmgz,CE3e3hGF2jc,0.0,2015-05-27 19:57:32,True,True
2015-05-27T20:12:12,"I think all of Johnny Depp's mob movies have been great. Donnie Brasco, Blow, Public Enemies, and now this! Can't wait! He's been one of my favorite actors since Pirates of the Caribbean.",0,0,Dylan Downs,CE3e3hGF2jc,0.43333333333333335,2015-05-27 20:12:12,True,True
2015-05-27T21:11:22,Looks seriously badass another Mob/Gangster Boston type movie,0,0,TheDieHardWWEAddict,CE3e3hGF2jc,-0.3333333333333333,2015-05-27 21:11:22,True,True
2015-05-28T00:10:04,Wow movies violet,0,0,Dykeboy66 6,CE3e3hGF2jc,0.1,2015-05-28 00:10:04,True,True
2015-05-28T00:47:50,Johnny Depp trying to do a jack nicholson trying to do a goodfellas?,0,0,gatts13,CE3e3hGF2jc,0.0,2015-05-28 00:47:50,True,True
2015-05-28T04:12:34,Depp always awesome. But why cumberbatch has to be the good guy? ,0,0,dyah hanifati,CE3e3hGF2jc,0.85,2015-05-28 04:12:34,True,True
2015-05-28T07:48:27,Definitily i will going to see this .. Cant wait .. :D,0,0,Freak Mind,CE3e3hGF2jc,1.0,2015-05-28 07:48:27,True,True
2015-05-28T09:59:41,Johnny Depp is a true artist. What an amazing actor!,0,0,flosssyy,CE3e3hGF2jc,0.55,2015-05-28 09:59:41,True,True
2015-05-28T17:40:41,"God dam I love Johnny Depp, he is such an awesome actor for this movie! I can't wait",0,0,Michael FOster,CE3e3hGF2jc,0.5,2015-05-28 17:40:41,True,True
2015-05-28T21:24:49,Johnny Depp used the Whitey Bulger that Jack Nicholas perfected in The Departed. Watch that again and compare it to Jack. Beautiful (yet unoriginal). ,3,9,Jarrod Stewart,CE3e3hGF2jc,0.32499999999999996,2015-05-28 21:24:49,True,True
2015-05-29T02:30:40,Like that evil laugh.,0,0,Sang SB,CE3e3hGF2jc,-0.35,2015-05-29 02:30:40,True,True
2015-05-29T07:40:08,شيء كبير ياعمري 😴👏. ,0,0,. Rui,CE3e3hGF2jc,0.0,2015-05-29 07:40:08,True,True
2015-05-29T17:59:01,God I cant wait for this!,0,0,Taylor H,CE3e3hGF2jc,0.0,2015-05-29 17:59:01,True,True
2015-05-29T18:24:04,yes,0,0,sof,CE3e3hGF2jc,0.0,2015-05-29 18:24:04,True,True
2015-05-30T07:15:57,I haven't had goosebumps watching someone act since heath ledger joker that was awesome depp,0,0,d c,CE3e3hGF2jc,1.0,2015-05-30 07:15:57,True,True
2015-05-30T08:52:05,oh shit johnny depp isnt playing jack sparrow,0,0,Gabriel Hugh-Kong,CE3e3hGF2jc,-0.2,2015-05-30 08:52:05,True,True
2015-05-30T11:30:25,So hyped for this!!,0,0,Callum Jones,CE3e3hGF2jc,0.0,2015-05-30 11:30:25,True,True
2015-05-31T03:28:13,Give it up for....... JOHNNY DEPP!!!!,0,0,Adrian Martinez,CE3e3hGF2jc,0.0,2015-05-31 03:28:13,True,True
2015-05-31T04:20:11,Those eyes...,0,0,arkayen666123,CE3e3hGF2jc,0.0,2015-05-31 04:20:11,True,True
2015-05-31T13:13:32,"thank the Lord, Depp is back into the real world, and not doing any more Tim Burton Goth shows",0,0,sanamo86,CE3e3hGF2jc,0.2333333333333333,2015-05-31 13:13:32,True,True
2015-05-31T18:51:41,You knew he fucked up once he gave Whitey the family recipe!,0,0,Joel Tejeda,CE3e3hGF2jc,-0.75,2015-05-31 18:51:41,True,True
2015-06-01T00:43:34,"Oh wow,, I was just wondering what it would be like to see Depp play a role as more of a dark antagonist. This can't come out soon enough",0,0,Tea Time,CE3e3hGF2jc,0.11249999999999999,2015-06-01 00:43:34,True,True
2015-06-01T02:05:29,"Whew! The mood escalated quickly...gave me chills. Damn, Johnny Depp looks absolutely terrifying in this. Possible career resurrection? An Oscar maybe?",0,0,1Ksheffi,CE3e3hGF2jc,-0.5,2015-06-01 02:05:29,True,True
2015-06-01T02:41:26,I am dying to see this! ,0,0,MaRee Johnson,CE3e3hGF2jc,0.0,2015-06-01 02:41:26,True,True
2015-06-01T04:38:20,OMG!!! This looks unreal...Depp looks brilliant!!!,0,0,CockpumpVideo,CE3e3hGF2jc,1.0,2015-06-01 04:38:20,True,True
2015-06-01T07:53:06,Wow what a great scene....depp actin looks oscar worthy. This is gonna be epic. Gangsta movie yes yes yes yes yes yes,0,0,Bryan Pena,CE3e3hGF2jc,0.33333333333333337,2015-06-01 07:53:06,True,True
2015-06-01T15:42:33,That laugh.....,0,0,Tom Pen,CE3e3hGF2jc,0.3,2015-06-01 15:42:33,True,True
2015-06-01T19:10:26,that dude shouldda never given away da secret family recipe...:/,2,0,sorrowsuperstar10,CE3e3hGF2jc,-0.4,2015-06-01 19:10:26,True,True
2015-06-01T23:17:06,"Damn @ 1:07, there are two rat bastards in his crew",0,0,xcmk,CE3e3hGF2jc,0.0,2015-06-01 23:17:06,True,True
2015-06-02T00:31:48,depp is a sic kunt,1,0,meatandbeer,CE3e3hGF2jc,0.0,2015-06-02 00:31:48,True,True
2015-06-02T05:53:06,"Holy shit , Depp as Whitey had me shook ... got me really scared and intimidated on what he was gonna do there!!! Can't wait 617 Mass!!!",1,0,AdamPaul222,CE3e3hGF2jc,0.2814697265625,2015-06-02 05:53:06,True,True
2015-06-02T15:26:40,It's been a while since I've wanted to see a movie so bad. I'm sure Johnny will do it justice. ^_^,1,0,Isabelle Windom,CE3e3hGF2jc,-0.09999999999999992,2015-06-02 15:26:40,True,True
2015-06-02T20:05:59,"This could be one of Depp's very best performances and characters.. Up there with Scissorhands, Sparrow et al.. No wait.. This COULD be his very best! ",0,0,Lon A,CE3e3hGF2jc,1.0,2015-06-02 20:05:59,True,True
2015-06-02T21:52:21,Has to be Johnny's Oscar win! Fogeddabouded!,0,0,Chazz Piazza,CE3e3hGF2jc,1.0,2015-06-02 21:52:21,True,True
2015-06-02T23:46:07,Wow he looks just like whitey it's scary! ! You must have grown up around Boston area to know about him,1,0,Ralph D,CE3e3hGF2jc,-0.340625,2015-06-02 23:46:07,True,True
2015-06-03T07:24:50,"Ground garlic and a little soy, eh??",5,1,mcitrw,CE3e3hGF2jc,-0.1875,2015-06-03 07:24:50,True,True
2015-06-03T13:17:54,i need this movie in my life. Now.,0,0,Laura,CE3e3hGF2jc,0.0,2015-06-03 13:17:54,True,True
2015-06-03T13:50:45,Johnny is straight channeling Christopher Walken with that head bob and eye twitch.,1,0,Evan Font,CE3e3hGF2jc,0.2,2015-06-03 13:50:45,True,True
2015-06-03T16:53:53,"i work in the shop where oscar trophies are made, shit they just carved johnny depp on one of those!!!!",3,0,piyush sharma,CE3e3hGF2jc,-0.48828125,2015-06-03 16:53:53,True,True
2015-06-03T18:26:17,Johnny Depp is back! Just the acting in this dinner scene is oscar worthy. This might be as good as Joe Pesci in Goodfellas.,0,0,Robert Peršak,CE3e3hGF2jc,0.2583333333333333,2015-06-03 18:26:17,True,True
2015-06-03T20:14:32,That laugh!  Johnny depp would've been a great joker,1,0,Ryan Alex,CE3e3hGF2jc,0.5875,2015-06-03 20:14:32,True,True
2015-06-03T20:16:23,Whats the song in the background?,0,0,Cameron .Turnbull,CE3e3hGF2jc,0.0,2015-06-03 20:16:23,True,True
2015-06-04T00:47:02,"""Maybe you spill a little somethin about me tamarah"" if ever you can win an Oscar for a trailer, it'd be this movie. I pray to the movie gods that this is an all time great film. We need one. Haven't had a good ""gangster"" movie in 25 years since Goodfellas. Or 20 since Casino. ",0,0,DJ Standing Elk,CE3e3hGF2jc,0.528125,2015-06-04 00:47:02,True,True
2015-06-04T07:14:14,increasing the view count by watching this everyday.,0,0,Agilan S Manickam,CE3e3hGF2jc,-0.2,2015-06-04 07:14:14,True,True
2015-06-04T10:06:23,johnny depp is one of the greatset actors of all time,1,0,Hades 511,CE3e3hGF2jc,0.0,2015-06-04 10:06:23,True,True
2015-06-05T05:28:56,I can't stop rewatchin this trailer it's so epic...and this scene is an instant classic. I wanna see this movie so bad,0,0,SuperSomebody101,CE3e3hGF2jc,-0.17777777777777773,2015-06-05 05:28:56,True,True
2015-06-07T06:21:48,Depp's had a few shitty movies recently but I gotta admit this looks pretty gritty (I actually really wanna see this),1,0,TheLaughingCritic,CE3e3hGF2jc,0.05,2015-06-07 06:21:48,True,True
2015-06-07T10:37:12,Holy crap this movie looks like a master peice. A Johnny depp redeemer,1,0,Callum Berriman,CE3e3hGF2jc,-0.8,2015-06-07 10:37:12,True,True
2015-06-07T13:33:30,"I'm with everyone else. I've never been a huge fan of Depp's, aside from his Sparrow role, but I think it's because most of his roles have been overactive and silly. This just looks like a win for him. And for us. Random thought, but I also dig the blue contacts.",1,0,Rane A.,CE3e3hGF2jc,0.1166666666666667,2015-06-07 13:33:30,True,True
2015-06-07T18:04:08,OOMMGGGG!!!! I looove hiiim sooo muuuuuuuch😭😭😭😭😍😍😍😍😍😍😍😍😍😍😍😍😍😍😍😍😍😍💋💋💋💋💃💃💋,0,0,Kookiie T.O.P,CE3e3hGF2jc,0.0,2015-06-07 18:04:08,True,True
2015-06-07T23:41:26,This looks good.   Johnny Depp finally doing some quality film,1,0,Jay Chung,CE3e3hGF2jc,0.35,2015-06-07 23:41:26,True,True
2015-06-08T02:22:44,Johnny Depp is the most versatile actor on the planet,0,0,1HeavyHitr,CE3e3hGF2jc,0.5,2015-06-08 02:22:44,True,True
2015-06-08T13:49:07,Jack Nicholson would kill this role!,0,3,Eric Pinto,CE3e3hGF2jc,0.0,2015-06-08 13:49:07,True,True
2015-06-09T05:41:40,"This reminds me of the goodfella's scene when he was like ""Your a funny guy""",1,0,AngelLove890,CE3e3hGF2jc,0.25,2015-06-09 05:41:40,True,True
