timestamp,text,like_count,reply_count,author,trailer_id,sentiment_score,datetime,used_for_model,used_for_visualization
2015-04-23T20:11:56,I think I'm first,2,3,Aryan Brar,CE3e3hGF2jc,0.25,2015-04-23 20:11:56,True,True
2015-04-23T20:14:36,2nd,0,0,S J,CE3e3hGF2jc,0.0,2015-04-23 20:14:36,True,True
2015-04-23T20:15:29,"Johnny Depp has made some TERRIBLE movies in the past decade. But this trailer is INCREDIBLE. I'm calling it now, this is his comeback movie. ",171,10,Saint Nicholas,CE3e3hGF2jc,-0.11666666666666665,2015-04-23 20:15:29,True,True
2015-04-23T20:16:36,Beautiful,0,0,isaac becerra,CE3e3hGF2jc,0.85,2015-04-23 20:16:36,True,True
2015-04-23T20:16:36,whatever,0,0,Aoo Wolves,CE3e3hGF2jc,0.0,2015-04-23 20:16:36,True,True
2015-04-23T20:17:54,He looks really creepy,4,0,Daenerys Targaryen,CE3e3hGF2jc,-0.5,2015-04-23 20:17:54,True,True
2015-04-23T20:18:11,Hopefully Depp can redeem himself with this one,17,0,Biringvad,CE3e3hGF2jc,0.0,2015-04-23 20:18:11,True,True
2015-04-23T20:19:23,"holy shit, Depp looks like hes actually trying",8,0,saxon bush,CE3e3hGF2jc,-0.1,2015-04-23 20:19:23,True,True
2015-04-23T20:19:55,"this genuinely interests me, I'm looking forward to seeing this",0,0,A Wild Nathan,CE3e3hGF2jc,0.4,2015-04-23 20:19:55,True,True
2015-04-23T20:20:20,Ok number2,0,0,Ata Panyasith,CE3e3hGF2jc,0.5,2015-04-23 20:20:20,True,True
2015-04-23T20:20:55,"Yo, this is a must watch for me... Johnny Deep and Benedict Cumberland starring as well.",0,0,TheBigAppleNYC,CE3e3hGF2jc,0.0,2015-04-23 20:20:55,True,True
2015-04-23T20:21:05,Looks like Johnny Depp could be back in top form.  This movie looks awesome!,2,0,LetReasonPrevail1,CE3e3hGF2jc,0.5,2015-04-23 20:21:05,True,True
2015-04-23T20:22:36,Oh my god it's finally happened.  I can't believe it.  I am FIRST.  It's finally my time.  I can't believe it.  I would like to thank my mom for always believing in me and for giving me strength when I needed it the most.,0,0,Mad Media,CE3e3hGF2jc,0.1875,2015-04-23 20:22:36,True,True
2015-04-23T20:23:49,The acting looks good.,1,0,TG Holy,CE3e3hGF2jc,0.35,2015-04-23 20:23:49,True,True
2015-04-23T20:25:16,Finally he's not playing jack sparrow,1,0,DarthIRGri,CE3e3hGF2jc,0.0,2015-04-23 20:25:16,True,True
2015-04-23T20:28:06,Donnie Brasco 2,0,0,Rig,CE3e3hGF2jc,0.0,2015-04-23 20:28:06,True,True
2015-04-23T20:28:55,"Finally, he has traded his old accent for a brand new one... And it looks promising.",2,0,Vlad of Wallachia,CE3e3hGF2jc,0.1090909090909091,2015-04-23 20:28:55,True,True
2015-04-23T20:28:56,doing the stanky leg,0,0,STXANTIYOU,CE3e3hGF2jc,0.0,2015-04-23 20:28:56,True,True
2015-04-23T20:29:49,Should have hire Bill Burr to play Whitey Bulgar. Johnny can't do the Boston accent.,0,0,Joshua Weitzman,CE3e3hGF2jc,0.0,2015-04-23 20:29:49,True,True
2015-04-23T20:32:28,Benedict is only like 1 second in the trailer,2,0,Jonathan,CE3e3hGF2jc,0.0,2015-04-23 20:32:28,True,True
2015-04-23T20:33:00,"What a brilliant cast, hopefully depp will show people he actually has diversity and can play a variety of characters. ",10,3,Mert Gurgur,CE3e3hGF2jc,0.45,2015-04-23 20:33:00,True,True
2015-04-23T20:34:49,I just wet myself that was scary,0,0,Pat Gil,CE3e3hGF2jc,-0.3,2015-04-23 20:34:49,True,True
2015-04-23T20:34:59,This is how trailer should be done,1,0,Robert Alfonso,CE3e3hGF2jc,0.0,2015-04-23 20:34:59,True,True
2015-04-23T20:36:16,Is Johnny Depp doing an impression of Jack Nicholson?,2,0,MariaVosa,CE3e3hGF2jc,0.0,2015-04-23 20:36:16,True,True
2015-04-23T20:36:32,"There was a time when I would watch it just for Depp, now he's a show me actor.  Blow was his last good flick, hopefully this will be a come back.",1,1,shmaveyea,CE3e3hGF2jc,0.2333333333333333,2015-04-23 20:36:32,True,True
2015-04-23T20:37:02,"""My recipe's funny? Funny how?""",4,0,Estoric,CE3e3hGF2jc,0.25,2015-04-23 20:37:02,True,True
2015-04-23T20:37:09,Great trailer! Johnny's finally back to the good kind of weird.,0,0,Jake Thompson,CE3e3hGF2jc,0.36,2015-04-23 20:37:09,True,True
2015-04-23T20:37:20,Wow. This movie looks intense....,0,0,Casey Crumpton,CE3e3hGF2jc,0.15000000000000002,2015-04-23 20:37:20,True,True
2015-04-23T20:37:28,This trailer was actually chilling... ,3,0,Matthew C,CE3e3hGF2jc,-0.5,2015-04-23 20:37:28,True,True
2015-04-23T20:37:32,Is anyone else getting a Christopher Walking vibe from Deep performance here? lol especially at 0:16  Still this trailer gave me the creep creeps with deeps performance & this clever way they did the typical mob movie sense. Ima have to check this one out.,0,0,irondrumwork09,CE3e3hGF2jc,0.16,2015-04-23 20:37:32,True,True
2015-04-23T20:37:36,Can't Johnny Depp just get a normal role ,0,0,Josh Sinclair,CE3e3hGF2jc,0.15,2015-04-23 20:37:36,True,True
2015-04-23T20:37:49,Great.  Now I have to Kevin bacon a whole new set of people that probably already could be Kevin Bacon'd in the first place.,0,0,YoVillianess,CE3e3hGF2jc,0.34659090909090906,2015-04-23 20:37:49,True,True
2015-04-23T20:38:07,Looks ok johnny depp actually acting in this one should be good,0,0,Samir Davis,CE3e3hGF2jc,0.39999999999999997,2015-04-23 20:38:07,True,True
2015-04-23T20:38:11,"This looks great, can't wait!!",0,0,Mikel Carter,CE3e3hGF2jc,1.0,2015-04-23 20:38:11,True,True
2015-04-23T20:38:43,This got intense real quick ,0,0,SpaceCowboy,CE3e3hGF2jc,0.35,2015-04-23 20:38:43,True,True
2015-04-23T20:40:12,Holy shit did Depp remember how to act!?!?!?!,0,0,Tyler F.,CE3e3hGF2jc,-0.48828125,2015-04-23 20:40:12,True,True
2015-04-23T20:40:41,"Wut, Cucumber & Deep in a movie together? that's rad!",1,0,n Denisse,CE3e3hGF2jc,0.0,2015-04-23 20:40:41,True,True
2015-04-23T20:42:32,I really didn't recognize him. Woah.,0,0,Lude Crestfallen,CE3e3hGF2jc,0.2,2015-04-23 20:42:32,True,True
2015-04-23T20:42:55,Oscars 2016 Best Actor nod coming up for Mr.Depp,14,0,TheJROCKNROLLA,CE3e3hGF2jc,1.0,2015-04-23 20:42:55,True,True
2015-04-23T20:44:24,Johnny's voice in this 😱😍😍😍😍 and some facial expressions looks like Tom Hanson again ,0,0,Winter Barnes,CE3e3hGF2jc,0.0,2015-04-23 20:44:24,True,True
2015-04-23T20:44:32,About damn time Depp got involved in a good movie that makes the best use of his acting skills! ,16,0,DualGrey,CE3e3hGF2jc,0.5666666666666667,2015-04-23 20:44:32,True,True
2015-04-23T20:45:19,"This looks good, but Depp reminds me of Gary Oldman's Dracula. Let's hope he gives a good performance.",0,0,Franco Warnholtz García,CE3e3hGF2jc,0.7,2015-04-23 20:45:19,True,True
2015-04-23T20:45:26,JOHNNY DEPP'S COME BACK PLEASE ,0,0,Sammy Palmer,CE3e3hGF2jc,0.0,2015-04-23 20:45:26,True,True
2015-04-23T20:46:31,okay i can die happy now.. jonny depp and cumberbatch in same movie.. my dream come true.,0,0,Vd3r,CE3e3hGF2jc,0.4125,2015-04-23 20:46:31,True,True
2015-04-23T20:46:46,goodfellas joke ripoff!,0,0,ImpNot123,CE3e3hGF2jc,0.0,2015-04-23 20:46:46,True,True
2015-04-23T20:48:06,looks like he has a little bit of christopher walken,2,0,keen,CE3e3hGF2jc,-0.1875,2015-04-23 20:48:06,True,True
2015-04-23T20:48:27,This is how you make a trailer.,0,0,NomadA1,CE3e3hGF2jc,0.0,2015-04-23 20:48:27,True,True
2015-04-23T20:48:51,Now thats a movie,3,0,Reef Mulkey,CE3e3hGF2jc,0.0,2015-04-23 20:48:51,True,True
2015-04-23T20:50:39,Yeah Johnny Depp! Always wanted him to do more of these roles. He owns it every time!,2,0,Xavier Taylor,CE3e3hGF2jc,0.625,2015-04-23 20:50:39,True,True
2015-04-23T20:51:06,"Film looks great, but Johnny depp looks bad in this, the makeup for his baldness just looks strange",4,7,RoronoaZoroSensei,CE3e3hGF2jc,0.016666666666666732,2015-04-23 20:51:06,True,True
2015-04-23T20:51:35,"Holy crap! I thought it was Ray Liotta, but nope.",0,0,Andrés Rincón,CE3e3hGF2jc,-1.0,2015-04-23 20:51:35,True,True
2015-04-23T20:53:08,"Johnny Depp reminding us that he is bigger than Transcendence and Mortdecai. Watching this, the suspension of disbelief is almost absolute. I Cri Evri Tiem QQ",1,0,Stephen N,CE3e3hGF2jc,0.1,2015-04-23 20:53:08,True,True
2015-04-23T20:53:49,This scene is like a straight copy from goodfellas,158,38,reid hawkins,CE3e3hGF2jc,0.2,2015-04-23 20:53:49,True,True
2015-04-23T20:53:52,Johnny Depp looks stone cold in this! Just sayin...,4,0,Mistah J.,CE3e3hGF2jc,-0.75,2015-04-23 20:53:52,True,True
2015-04-23T20:54:03,he's my step grand father cause he dated my grand mother for 30 years,0,0,LiLSTAN0922,CE3e3hGF2jc,0.5,2015-04-23 20:54:03,True,True
2015-04-23T20:54:28,WTF i was waiting for cumberbatch to speak,0,0,Usaid Khan,CE3e3hGF2jc,-0.5,2015-04-23 20:54:28,True,True
2015-04-23T20:56:13,"This reminded me of the ""Funny How?"" Scene from Goodfellas! This movie looks really good! Hoping for a Johnny Depp comeback!",0,0,emil Stenstad Selen,CE3e3hGF2jc,0.65625,2015-04-23 20:56:13,True,True
2015-04-23T20:56:37,"OMFG a good looking movie! WITH my best actors in the world depp, edgerton and cumberbatch!!!!! HOLY SHIT depp is unrecognisable i actually got intimidated by the guy! espicially with those grey/blue lenses he looks frikin awesome omg such a good cast i cant wait!!!!",0,0,crazy coconut,CE3e3hGF2jc,0.525,2015-04-23 20:56:37,True,True
2015-04-23T20:57:05,"Now this looks awesome, so glad to see that Johnny Depp can still choose to do good movies.",1,0,HeikkiP,CE3e3hGF2jc,0.7333333333333334,2015-04-23 20:57:05,True,True
2015-04-23T20:57:35,GREAT TRAILER!!,0,0,Farmer Joe,CE3e3hGF2jc,1.0,2015-04-23 20:57:35,True,True
2015-04-23T20:58:34,I smell an Oscar ,3,0,Roman T,CE3e3hGF2jc,0.0,2015-04-23 20:58:34,True,True
2015-04-23T20:58:44,"So Johnny Depp in Jack Nickolson's voice from Departed, is Ray Liotta in Joe Pesci's character from the Goodfellas?",0,0,Dimitris,CE3e3hGF2jc,0.0,2015-04-23 20:58:44,True,True
2015-04-23T20:59:00,"Johnny Depp isn't a bad actor at all, he just needs to start picking better movies, and this is going to be one of them.",0,0,Marley Fernandez,CE3e3hGF2jc,-0.09999999999999992,2015-04-23 20:59:00,True,True
2015-04-23T20:59:12,You think I'm funny? Do I make you laugh?,0,0,MCPrimetime,CE3e3hGF2jc,0.275,2015-04-23 20:59:12,True,True
2015-04-23T20:59:33,Johnny is the best!!!,0,0,David Mayhem,CE3e3hGF2jc,1.0,2015-04-23 20:59:33,True,True
2015-04-23T20:59:46,Wow looks really good,0,0,sergio diaz,CE3e3hGF2jc,0.39999999999999997,2015-04-23 20:59:46,True,True
2015-04-23T21:01:32,"THE INTENSITY IN THOSE EYES AND THAT SPEECH.they way he totally flipped the mood. GUYS TRUST ME THIS IS Going to be one hell of a movie. FOR GET jack sparrow ,Alice in wonderland, That singing movie where he was a wolf .  THIS IS ON A TOTAL DIFFERENT LEVEL . I know I'm emphasising with the capital letters but I swear. I have no clue who this deadly gangster is during the time of the hippies.  But here I am scared shitless for that big mouth undercover cop. Dear Lord of movies thank you",0,0,Nigel V,CE3e3hGF2jc,-0.04,2015-04-23 21:01:32,True,True
2015-04-23T21:01:39,HE NEEDS AN OSCAR ALREADY! I'M sick of ppl talking shit. He is one of the most if not THEE most diverse actor ever.,2,0,Clexaholic911,CE3e3hGF2jc,0.021428571428571408,2015-04-23 21:01:39,True,True
2015-04-23T21:01:49,"This looks so good,I really likey the lookie of it,good shit",0,0,BORAHAE,CE3e3hGF2jc,0.0,2015-04-23 21:01:49,True,True
2015-04-23T21:03:06,Now this is how a trailer is supposed to be made.,0,0,Sahil Ghosh,CE3e3hGF2jc,0.0,2015-04-23 21:03:06,True,True
2015-04-23T21:03:13,I have faith in this movie.. mainly because of Benedict Cumberbatch.,43,8,Kumar Media,CE3e3hGF2jc,0.16666666666666666,2015-04-23 21:03:13,True,True
2015-04-23T21:04:15,Boston's on the cinematic map :P !,0,0,Bruce Wayne,CE3e3hGF2jc,0.46875,2015-04-23 21:04:15,True,True
2015-04-23T21:04:15,Johnny ? :O,0,0,RuiD,CE3e3hGF2jc,0.05,2015-04-23 21:04:15,True,True
2015-04-23T21:05:07,Oscar for Depp ! ,0,0,Squad Awakens,CE3e3hGF2jc,0.0,2015-04-23 21:05:07,True,True
2015-04-23T21:06:21,"I doubt it will be as good as Donnie Brasco, but still looks damn entertaining!",0,0,Bennison,CE3e3hGF2jc,0.6625,2015-04-23 21:06:21,True,True
2015-04-23T21:06:26,I smell a comeback,0,0,gabrieldelossantos3,CE3e3hGF2jc,0.0,2015-04-23 21:06:26,True,True
2015-04-23T21:07:48,"Just wow. This is going to be a good movie plus Johnny Depp is unrecognizable, creepy as hell and looks alot like Jack Nicholson and the trailer give me goosebumps. Can't wait to see it.",0,0,Nick Kurtz,CE3e3hGF2jc,0.09999999999999998,2015-04-23 21:07:48,True,True
2015-04-23T21:09:31,That cast is amazing. This will surely be on my radar.,0,0,XiBallisticsiX,CE3e3hGF2jc,0.55,2015-04-23 21:09:31,True,True
2015-04-23T21:09:56,He deserves an Oscar JUST from that trailer. He gives off an Anthony Hopkins vibe from Silence of the Lambs! I LOVE IT. Can't wait for this movie.,0,0,Minx Chan,CE3e3hGF2jc,0.5,2015-04-23 21:09:56,True,True
2015-04-23T21:10:07,hey its camberlyn bumper patch and that pirate guy!,0,0,captainadamantium,CE3e3hGF2jc,0.0,2015-04-23 21:10:07,True,True
2015-04-23T21:13:05,Really well thought through clever trailer.  ,0,0,Yugen's Atlas,CE3e3hGF2jc,0.18333333333333335,2015-04-23 21:13:05,True,True
2015-04-23T21:15:48,"my oh my, finally - depp in a serious 'non-depp' role",0,0,3317alibaba,CE3e3hGF2jc,-0.16666666666666666,2015-04-23 21:15:48,True,True
2015-04-23T21:17:47,Bad makeup.. even cumberbatch has strage makeup.. why?   ,0,0,Mshellosweetie2881,CE3e3hGF2jc,-0.6999999999999998,2015-04-23 21:17:47,True,True
2015-04-23T21:18:02,"Finally Depp delivers, I've been waiting for this for over ten years now",0,0,Simon,CE3e3hGF2jc,0.0,2015-04-23 21:18:02,True,True
2015-04-23T21:18:22,"I'm actually pretty excited for this movie. I think Johnny Depp is a good actor, he might have done some shit in the past few years, but this movie might get him back on track. Let's hope.",3,0,Jay Vaters,CE3e3hGF2jc,0.09642857142857143,2015-04-23 21:18:22,True,True
2015-04-23T21:20:08,Love gangster movies and johnny depp actually looks good in this movie. Also I don't know it was intentional but I like the scary joke depps character played in this trailer reminds me of goodfellas,0,0,Adam,CE3e3hGF2jc,0.175,2015-04-23 21:20:08,True,True
2015-04-23T21:20:14,This one looks good :o!,1,0,rugalck,CE3e3hGF2jc,0.38125,2015-04-23 21:20:14,True,True
2015-04-23T21:20:48,"finally a role that is not cliche or an archetype from Johnny Dep, been way too long. PLAY real people dude!",0,0,Crimsonphilosophy,CE3e3hGF2jc,0.06666666666666667,2015-04-23 21:20:48,True,True
2015-04-23T21:21:48,a real human bean and a real hero,0,0,Anton An,CE3e3hGF2jc,0.1,2015-04-23 21:21:48,True,True
2015-04-23T21:22:21,"Yeah I noticed the Goodfellas link. Let's just hope the film is better than the trailer. I'm not expecting Donnie Brasco, but I'll keep an open mind.",0,0,Steven Stafford,CE3e3hGF2jc,0.25,2015-04-23 21:22:21,True,True
2015-04-23T21:22:57,just saiyan kill´d frieza,4,0,Jagger Django,CE3e3hGF2jc,0.0,2015-04-23 21:22:57,True,True
2015-04-23T21:24:58,Just give him the oscar already,0,0,1tmac4life,CE3e3hGF2jc,0.0,2015-04-23 21:24:58,True,True
2015-04-23T21:26:07,"Finally a decent looking Depp film! Such a great actor wasting so much on Tim Burton. Shit man, what's the last good thing he did, Blow?",0,0,Antonio Gonzalez,CE3e3hGF2jc,0.24404761904761904,2015-04-23 21:26:07,True,True
2015-04-23T21:27:19,"Yup. Looks like the Deppster might redeem himself, here (even though the steak scene's a bit Joe Pesci in Goodfellas).",0,0,Tokiofritz,CE3e3hGF2jc,0.0,2015-04-23 21:27:19,True,True
2015-04-23T21:28:07,Why is Johnny Depp playing Ray Liotta in this film!?,3,2,Victoria's Channel,CE3e3hGF2jc,0.0,2015-04-23 21:28:07,True,True
2015-04-23T21:28:11,"Even if Johnny Depp wasn't in this(huge fan), I'd still see it.",0,0,xjxxxx,CE3e3hGF2jc,0.0,2015-04-23 21:28:11,True,True
2015-04-23T21:28:26,WoWWWW the OLD Johnny Depp is Back !!,0,0,Mszzzzzzzzzzzzzzz,CE3e3hGF2jc,0.05,2015-04-23 21:28:26,True,True
2015-04-23T21:29:33,Donnie Brasco at his full potential!,2,0,Vader...You Seek Vader!,CE3e3hGF2jc,0.175,2015-04-23 21:29:33,True,True
2015-04-23T21:30:52,Reminds me of donnie Brasco alot!,1,0,Jon snow,CE3e3hGF2jc,0.0,2015-04-23 21:30:52,True,True
2015-04-23T21:31:46,Johnny Depp.............back again,0,0,mem gad,CE3e3hGF2jc,0.0,2015-04-23 21:31:46,True,True
2015-04-23T21:33:36,meth damon is in this?,26,6,Ngéntot McKontolssen,CE3e3hGF2jc,0.0,2015-04-23 21:33:36,True,True
2015-04-23T21:35:31,"Holy shit, it actually looks like Depp, for the first time in probably years, is doing something really serious and it looks brilliant.",0,0,ChefMatt Reviews,CE3e3hGF2jc,0.12333333333333334,2015-04-23 21:35:31,True,True
2015-04-23T21:35:39,Just sayin' tho,0,0,me Gustav,CE3e3hGF2jc,0.0,2015-04-23 21:35:39,True,True
2015-04-23T21:36:34,Wow.,0,0,Crystal Ward,CE3e3hGF2jc,0.1,2015-04-23 21:36:34,True,True
2015-04-23T21:37:37,Hopefully in the next trailer there's more Cumberbatch...,3,0,JellyLovesFaith,CE3e3hGF2jc,0.25,2015-04-23 21:37:37,True,True
2015-04-23T21:38:11,I'm funny how?,0,1,Daskaar,CE3e3hGF2jc,0.25,2015-04-23 21:38:11,True,True
2015-04-23T21:39:36,"Jesus, Depp looks menacing as shit. Can't wait!",0,0,Daskaar,CE3e3hGF2jc,-0.625,2015-04-23 21:39:36,True,True
2015-04-23T21:40:59,I smell an Oscar Nomination in Johnny Depp's near future,3,0,Kevin Doherty,CE3e3hGF2jc,0.05,2015-04-23 21:40:59,True,True
2015-04-23T21:41:20,And the best actor Oscar 2016 goes to ..........Johnny Depp.,1,0,Lara Q,CE3e3hGF2jc,1.0,2015-04-23 21:41:20,True,True
2015-04-23T21:42:12,It does look like a scene from Goodfellas. And this movie does look good.,0,0,MsUsagi513,CE3e3hGF2jc,0.7,2015-04-23 21:42:12,True,True
2015-04-23T21:42:48,"Never heard of this movie, but the poster on iTunes made me want to see the trailer. And what a trailer it was. Damn. Looks very promising.",0,0,Guythreep Brushwood,CE3e3hGF2jc,0.26,2015-04-23 21:42:48,True,True
2015-04-23T21:43:17,i bet he shoots him right after.,0,1,jaime rojas,CE3e3hGF2jc,0.2857142857142857,2015-04-23 21:43:17,True,True
2015-04-23T21:44:10,Holy crap! Is that really you Johnny? This looks amazing!,0,0,Amy H.,CE3e3hGF2jc,-0.016666666666666646,2015-04-23 21:44:10,True,True
2015-04-23T21:46:24,"Just realising it's not like Goodfellas. Joe Pesci's scene was purely a joke to scare the guy in the bar. With Depp, he's making a genuine threat to get a message across to steak guy, then laughing at his reaction.",3,0,Tokiofritz,CE3e3hGF2jc,0.30714285714285716,2015-04-23 21:46:24,True,True
2015-04-23T21:46:33,"Wow, this may be the first time where I'm actually afraid of Johnny Depp. He looks damn intimidating in this.",0,0,Mr. GMAN's Channel,CE3e3hGF2jc,-0.08333333333333333,2015-04-23 21:46:33,True,True
2015-04-23T21:46:59,what cant this guy play. if he got his head around it he'd probably be able to pull off Obama. and i'm only half joking lol,3,0,Rob J,CE3e3hGF2jc,0.2833333333333333,2015-04-23 21:46:59,True,True
2015-04-23T21:47:24,Wait were was Johnny  depp,0,0,Heero Abdulai,CE3e3hGF2jc,0.0,2015-04-23 21:47:24,True,True
2015-04-23T21:47:37,Can't wait,0,0,Sean John,CE3e3hGF2jc,0.0,2015-04-23 21:47:37,True,True
2015-04-23T21:48:12,Who the gangster that he's portraying?,0,0,abcjaffar,CE3e3hGF2jc,0.0,2015-04-23 21:48:12,True,True
2015-04-23T21:48:24,Wow! Looks  good!  He did well! ,0,0,Meredith Twomey,CE3e3hGF2jc,0.5625,2015-04-23 21:48:24,True,True
2015-04-23T21:49:41,those eyes.. just sayin,1,0,pixel forge,CE3e3hGF2jc,0.0,2015-04-23 21:49:41,True,True
2015-04-23T21:50:09,Johnny depp secretly auditioning for joker at the end.,183,5,Ray,CE3e3hGF2jc,-0.4,2015-04-23 21:50:09,True,True
2015-04-23T21:50:20,am i totally twisted for still being attracted to him in this? dont answer that i already know lol,0,0,Hey CutiePie,CE3e3hGF2jc,0.15000000000000002,2015-04-23 21:50:20,True,True
2015-04-23T21:53:19,It's not like people hate on Depp because he's a bad actor. We are just sick and tired of his weird tim Burton type character he plays in every film. When he does serious work he's an incredible actor. Hopefully he will go back to doing that ,0,0,KW Entertainment,CE3e3hGF2jc,-0.318452380952381,2015-04-23 21:53:19,True,True
2015-04-23T21:53:51,Welcome back Donny Jepp. We all missed you very much.   #Makeroomtheactingninjaisback,0,0,Myk McGrane,CE3e3hGF2jc,0.35333333333333333,2015-04-23 21:53:51,True,True
2015-04-23T21:56:27,Just saying....?,0,0,Ja'Baree 413,CE3e3hGF2jc,0.0,2015-04-23 21:56:27,True,True
2015-04-23T21:58:33,Depps laugh at the end of this trailer reminds me so much of Vincent prices laugh at the end of the thriller music video.,0,0,thomas chapman,CE3e3hGF2jc,0.26666666666666666,2015-04-23 21:58:33,True,True
2015-04-23T21:59:30,"WOAH, best Ive seen Johnny Depp!",0,0,Dame International,CE3e3hGF2jc,1.0,2015-04-23 21:59:30,True,True
2015-04-23T21:59:35,Who's it based on?,0,3,Carlos Guerrero,CE3e3hGF2jc,0.0,2015-04-23 21:59:35,True,True
2015-04-23T22:01:22,"I just did a paper on Whitey Bulger , now one of my favorite actors is playing him.  So happy right now! :)))",1,0,Zakiya,CE3e3hGF2jc,0.5392857142857143,2015-04-23 22:01:22,True,True
2015-04-23T22:01:36,That looks like a CGI Johnny Depp.  This looks horrible.,0,0,JonO387,CE3e3hGF2jc,-1.0,2015-04-23 22:01:36,True,True
2015-04-23T22:03:08,Make up effects does not match his voice at all. ,0,0,Greeling Avarice,CE3e3hGF2jc,0.0,2015-04-23 22:03:08,True,True
2015-04-23T22:05:00,Sherlock  meets jack ,0,0,Krissy Connors,CE3e3hGF2jc,0.0,2015-04-23 22:05:00,True,True
2015-04-23T22:05:32,"So THIS was why Benedict Cumberbatch was spotted with Dakota Johnson last year! They're both starring in Black Mass. Huh. Mystery solved. Would've wanted to hear Benedict's Boston accent from this trailer though. Oh well. Still a damn good trailer. Hopefully the film itself will be just as good, if not better.",1,0,N D,CE3e3hGF2jc,0.19666666666666668,2015-04-23 22:05:32,True,True
2015-04-23T22:06:03,PLEASE TELL ME JESSE PLEMONS IS PLAYING A SOCIOPATH WORKING FOR BULGER,0,0,Sam Kay,CE3e3hGF2jc,0.0,2015-04-23 22:06:03,True,True
2015-04-23T22:06:10,I'm scared of Johnny Depp now.,0,0,StoryTeller,CE3e3hGF2jc,0.0,2015-04-23 22:06:10,True,True
2015-04-23T22:06:33,"This what Im talking about Depp!! Fucc all that goofy Mortdecai, Lone Ranger shit. These are the type of roles we love you in",803,43,Apollo B.,CE3e3hGF2jc,0.26666666666666666,2015-04-23 22:06:33,True,True
2015-04-23T22:09:11,"Jesus, that was some intense stuff right there, movie looks great!",0,0,GamingFanForever,CE3e3hGF2jc,0.49523809523809526,2015-04-23 22:09:11,True,True
2015-04-23T22:09:47,Wow... just saying...,0,0,Leonardo Mello,CE3e3hGF2jc,0.1,2015-04-23 22:09:47,True,True
2015-04-23T22:10:50,The academy goes to....,0,0,thomas mbuya,CE3e3hGF2jc,0.0,2015-04-23 22:10:50,True,True
2015-04-23T22:11:10,"he look like jack nicholson in this Character  ,am i right ?",0,0,baeed aldar,CE3e3hGF2jc,0.2857142857142857,2015-04-23 22:11:10,True,True
2015-04-23T22:12:42,"Johnny Depp is back. No seriously, as an actor. He's back. I know! I can't believe it either! Thought we lost him...",0,0,Chris Walker-Thomson,CE3e3hGF2jc,0.05555555555555555,2015-04-23 22:12:42,True,True
2015-04-23T22:13:49,Jonny depp should make more movies like this,0,0,Gadgetbig,CE3e3hGF2jc,0.5,2015-04-23 22:13:49,True,True
2015-04-23T22:13:59,looks awesome but if johnny depp is going to completely obliterate the boston accent like he did in this trailer im not sure how good the acting will really be. I mean come on. that wasnt impressive especially for johnny depp,0,0,Matt,CE3e3hGF2jc,0.2796875,2015-04-23 22:13:59,True,True
2015-04-23T22:14:02,I really hope this film shows that Johnny Depp has his mojo back. I miss the days where he made good movies,0,0,Britany Anderson,CE3e3hGF2jc,0.3,2015-04-23 22:14:02,True,True
2015-04-23T22:15:49,"Johnny Depp reminded me a little of jack Nicholson in the Departed, bringing that legendary acting intensity.",0,0,floyd watt,CE3e3hGF2jc,0.2708333333333333,2015-04-23 22:15:49,True,True
2015-04-23T22:15:57,Johny Depp is back!,31,0,Andres Velez,CE3e3hGF2jc,0.0,2015-04-23 22:15:57,True,True
2015-04-23T22:16:05,Finally Depp picked a good script.,0,0,khaada1,CE3e3hGF2jc,0.35,2015-04-23 22:16:05,True,True
2015-04-23T22:16:51,And the oscar goes to...Johnny Depp,0,0,John Doe,CE3e3hGF2jc,0.0,2015-04-23 22:16:51,True,True
2015-04-23T22:16:53,Now this looks promising,0,0,Wildfox,CE3e3hGF2jc,0.2,2015-04-23 22:16:53,True,True
2015-04-23T22:19:43,Good one after long time,0,0,Abrar Hassan,CE3e3hGF2jc,0.32499999999999996,2015-04-23 22:19:43,True,True
2015-04-23T22:25:39,Johnny Depp just went Dracula. ,0,0,Batman,CE3e3hGF2jc,0.0,2015-04-23 22:25:39,True,True
2015-04-23T22:28:03,"Did anyone notice that Johnny has blue eye-contacts? He looks pretty terrifying, I like it. Indeed, it might be his first decent film in some time. Although I had a great time that night watching ""Mortdecai"", it's not as much fun as ""Kingsman"" but was nice and funny - perfect for family evening. Johnny was like Salvador Dali :D",0,0,Aleksandra Nowicka,CE3e3hGF2jc,0.3287878787878788,2015-04-23 22:28:03,True,True
2015-04-23T22:28:32,0:16 Ok I might be very wrong but I bet anything he based his performance on Christopher Walken! And not the make-up so much but the way he speaks (again now that I think about it he looks like him too). The movie looks great. About time..,1,0,Dimitris Politis,CE3e3hGF2jc,0.171875,2015-04-23 22:28:32,True,True
2015-04-23T22:31:52,"Holy crap, Johnny Depp is 'acting' again?  When did this happen?",2,0,Brian Simerl,CE3e3hGF2jc,-0.4,2015-04-23 22:31:52,True,True
2015-04-23T22:32:18,"Jesus, Depp looks like Dracula in this film. Looks very promising though, very dark and powerful.",0,0,Joel Svensgård,CE3e3hGF2jc,0.12166666666666666,2015-04-23 22:32:18,True,True
2015-04-23T22:32:52,The acting of johnny Depp and the make up of him is very great this is one of my fav trailer of 2015,0,0,ra- gas,CE3e3hGF2jc,0.5,2015-04-23 22:32:52,True,True
2015-04-23T22:34:08,"I didn't see Helena Bonham Carter anywhere. Holy shit, awesome.",0,0,Chance Adams,CE3e3hGF2jc,0.4,2015-04-23 22:34:08,True,True
