timestamp,text,like_count,reply_count,author,trailer_id,sentiment_score,datetime,used_for_model,used_for_visualization
2015-04-25T09:01:41,Please let this movie be good. I'm DYING for a good gangster movie!!!,0,0,ben k,CE3e3hGF2jc,0.85,2015-04-25 09:01:41,True,True
2015-04-25T09:05:14,Depp looking like a young Anthony Hopkins from Hannibal,0,0,spencer ryton,CE3e3hGF2jc,0.1,2015-04-25 09:05:14,True,True
2015-04-25T09:10:34,Now THAT is an evil laughter.,0,0,Arun Iyer,CE3e3hGF2jc,-1.0,2015-04-25 09:10:34,True,True
2015-04-25T09:40:31,Was that Adam Scott? ,0,0,Amy Skye,CE3e3hGF2jc,0.0,2015-04-25 09:40:31,True,True
2015-04-25T10:19:45,Heeere's Johnny!,0,0,Bareno,CE3e3hGF2jc,0.0,2015-04-25 10:19:45,True,True
2015-04-25T10:27:52,I'm here for Adam Scott.,0,0,Alex D,CE3e3hGF2jc,0.0,2015-04-25 10:27:52,True,True
2015-04-25T10:28:21,cant wait to see this it looks great.,0,0,arran watts,CE3e3hGF2jc,0.8,2015-04-25 10:28:21,True,True
2015-04-25T10:29:22,Where is Dakota Johnson..wanna see her part so badly,0,0,bananapie,CE3e3hGF2jc,-0.6999999999999998,2015-04-25 10:29:22,True,True
2015-04-25T10:55:48,It's about time Depp does something without ten shades of white makeup on his face.,0,0,JediforJesus,CE3e3hGF2jc,0.0,2015-04-25 10:55:48,True,True
2015-04-25T11:37:08,I saw Ben Wyatt!,0,0,Dylan Johnson,CE3e3hGF2jc,0.0,2015-04-25 11:37:08,True,True
2015-04-25T11:41:09,awwww yeaaaaahhh finally Depp is coming back with the good stuff again,0,0,Toby Kral,CE3e3hGF2jc,0.3,2015-04-25 11:41:09,True,True
2015-04-25T11:47:32,"The make-up is incredible. Johnny belongs in subtle recreations, he does better finding a character within himself than finding one within a costume. Jack Sparrow removed of course.",0,0,The Hero,CE3e3hGF2jc,0.35555555555555557,2015-04-25 11:47:32,True,True
2015-04-25T12:06:06,Do I amuse you ?,0,0,sawvufan,CE3e3hGF2jc,0.0,2015-04-25 12:06:06,True,True
2015-04-25T12:06:45,Did Johny Depp finally start getting rid of all that Jack Sparrow things?,0,0,олег иванов,CE3e3hGF2jc,0.0,2015-04-25 12:06:45,True,True
2015-04-25T12:18:23,Tell me demon....where is Johnny? He's in here.....with us.,1,0,Skyler Clayton,CE3e3hGF2jc,0.0,2015-04-25 12:18:23,True,True
2015-04-25T12:21:16,we want johnny depp as a joker,0,0,mourchid mohssin,CE3e3hGF2jc,0.0,2015-04-25 12:21:16,True,True
2015-04-25T12:38:24,I can't stop watching this trailer OmG Johnny Depp is magnificent!! ,2,0,nesreen galal,CE3e3hGF2jc,1.0,2015-04-25 12:38:24,True,True
2015-04-25T12:39:42,"oscar nomination for sure. this character makes me feel uncomfortable like daniel day-lewis' character in ""there will be blood"".",1,0,butternuttt,CE3e3hGF2jc,0.0,2015-04-25 12:39:42,True,True
2015-04-25T12:42:12,"movie looks good, just sayin....",1,0,Erick,CE3e3hGF2jc,0.7,2015-04-25 12:42:12,True,True
2015-04-25T12:43:25,BAM!,0,0,Matt G,CE3e3hGF2jc,0.0,2015-04-25 12:43:25,True,True
2015-04-25T12:45:00,He's back!! It seems like Disney was holding him back!,0,0,The83rdTrombonist,CE3e3hGF2jc,0.0,2015-04-25 12:45:00,True,True
2015-04-25T12:48:15,this looks great!,0,0,GashByThaHour,CE3e3hGF2jc,1.0,2015-04-25 12:48:15,True,True
2015-04-25T12:49:07,Johnny Depp always does good as a gangster.,0,0,AiR on PC,CE3e3hGF2jc,0.7,2015-04-25 12:49:07,True,True
2015-04-25T13:00:49,"yes! doing what he does best. seriously, he hasn't made a decent movie since probably that dillinger one. depp does well in gangster films.",0,0,R JP,CE3e3hGF2jc,0.2777777777777778,2015-04-25 13:00:49,True,True
2015-04-25T13:11:36,"This looks silly, it doesn't work, it's just distracting because veryone knows behind this makeup it's Johnny. Why not choose an actor that fits this charcater. By the look of it they could have chosen Chstopher Walken. No need of makeup",0,0,Jin Kazama,CE3e3hGF2jc,-0.45,2015-04-25 13:11:36,True,True
2015-04-25T13:12:59,Was hyped for this...then Benedict Cumberbatch's face popped up. Such an overrated actor who can't manage a serious role. He was absolutely awful in imitation game.    ,0,0,I hate Matt Lieberman,CE3e3hGF2jc,-0.37333333333333335,2015-04-25 13:12:59,True,True
2015-04-25T13:13:45,That's what I'm taking about Depp. Great trailer,0,0,SAM . O A,CE3e3hGF2jc,0.8,2015-04-25 13:13:45,True,True
2015-04-25T13:31:52,Super Super Super Super... So Waiting,0,0,Abhishek Mathur,CE3e3hGF2jc,0.3333333333333333,2015-04-25 13:31:52,True,True
2015-04-25T13:47:30,and the Oscar goes to ....,0,0,GeniusMuggle,CE3e3hGF2jc,0.0,2015-04-25 13:47:30,True,True
2015-04-25T13:49:31,from all the comments I've read .. people are really in love with Johnny and they ( me included ) want to see him always in good movies !!,0,0,Hi Daßer,CE3e3hGF2jc,0.75,2015-04-25 13:49:31,True,True
2015-04-25T13:51:49,nice!!  #BlackMass,1,0,Satyajit Mukherjee,CE3e3hGF2jc,0.9375,2015-04-25 13:51:49,True,True
2015-04-25T13:58:06,and its not directed by tim burton yay!,0,0,uhuih hojhk,CE3e3hGF2jc,0.0,2015-04-25 13:58:06,True,True
2015-04-25T14:05:48,That looks good but where's Johnny Depp? .. oh wait :P,0,0,ΕJK94,CE3e3hGF2jc,0.725,2015-04-25 14:05:48,True,True
2015-04-25T14:30:20,Can't wait to go see this 👌,0,0,Karrina Johnston,CE3e3hGF2jc,0.0,2015-04-25 14:30:20,True,True
2015-04-25T14:37:21,His voice and acting is SOO similar to Guy Pearce's performance in Lawless. So awesome!,0,0,Phenomenal Rides,CE3e3hGF2jc,0.3333333333333333,2015-04-25 14:37:21,True,True
2015-04-25T14:44:28,Johnny Depp .. he could be THE JOKER...,0,0,Andres Chang,CE3e3hGF2jc,0.0,2015-04-25 14:44:28,True,True
2015-04-25T14:53:04,"Watching it from the long shot i could swear it was Michael Ironside, not Johnny Depp.",0,0,Shilohpreston,CE3e3hGF2jc,-0.05,2015-04-25 14:53:04,True,True
2015-04-25T15:05:07,This cooking show looks very intense.,3161,40,Sammy Paul,CE3e3hGF2jc,0.26,2015-04-25 15:05:07,True,True
2015-04-25T15:15:36,He looks like and acts like a weird mixture of Jack Nicholson and Tommy Wiseau XD And Ray Liotta lol,0,0,gongal,CE3e3hGF2jc,0.15000000000000002,2015-04-25 15:15:36,True,True
2015-04-25T15:23:51,"This gave me chills, just sayin'. Lol",0,0,Hannah Huston,CE3e3hGF2jc,0.8,2015-04-25 15:23:51,True,True
2015-04-25T15:29:10,"Oooeeer looks good, strange seeing him with blue eyes, they are naturally brown ",0,0,Berserk Broadcasting,CE3e3hGF2jc,0.18749999999999997,2015-04-25 15:29:10,True,True
2015-04-25T15:29:56,'Black'edicht Cumber'mass',0,0,Halfdan The Crusader,CE3e3hGF2jc,-0.16666666666666666,2015-04-25 15:29:56,True,True
2015-04-25T15:46:59,"The thumbnail was so misleading, I was hoping for another 'Fear and Loathing' and Raoul Duke became even more badass.",0,0,JustEatThePie,CE3e3hGF2jc,0.5,2015-04-25 15:46:59,True,True
2015-04-25T16:01:46,I'm looking forward to Corey Stall as well.,0,0,James Hicks,CE3e3hGF2jc,0.0,2015-04-25 16:01:46,True,True
2015-04-25T16:05:42,Adam Scott AND Benedict Cumberbatch??? Heck yea!!!,0,0,EHodges,CE3e3hGF2jc,0.0,2015-04-25 16:05:42,True,True
2015-04-25T16:07:19,This already looks like a masterpiece...  One that will be up there with the greats like Good fellas  Godfather  Untouchables  Sopranos (even though it's a series)  Depp may have stumbled on his greatest role to date.,0,0,AbsoluteXXIV,CE3e3hGF2jc,0.85,2015-04-25 16:07:19,True,True
2015-04-25T16:09:05,"Um. Yeah. Yes. Yes. I'll see this. Yes. For those of you who didn't know, the guy he's playing is who Nicholson's Costello in the departed is based off of",0,0,korlu01,CE3e3hGF2jc,0.0,2015-04-25 16:09:05,True,True
2015-04-25T16:28:26,<3,0,0,The Cumberbitch,CE3e3hGF2jc,1.0,2015-04-25 16:28:26,True,True
2015-04-25T16:32:54,Damn it went from 0 to 100 real quick.,0,0,Alijamaru,CE3e3hGF2jc,0.5,2015-04-25 16:32:54,True,True
2015-04-25T16:33:21,"To be honest, I skipped this trailer because I saw Depp's name when it first came out. I finally saw it and it looks pretty good. I hope it's good because his movies have been crap for years ",0,0,SuperCharged,CE3e3hGF2jc,0.24285714285714285,2015-04-25 16:33:21,True,True
2015-04-25T16:36:59,He puts this manic face on Whitey I would've never imagined. I used to be obsessed with Whitey Bulger and the stories out of south Boston.   I hope this is good.,0,0,Eric Antoine,CE3e3hGF2jc,0.09999999999999998,2015-04-25 16:36:59,True,True
2015-04-25T16:43:53,lol Look at everyone predicting this will be Depp's Oscar. We haven't even seen the movie yet people!,0,0,A.J. DeLeo,CE3e3hGF2jc,1.0,2015-04-25 16:43:53,True,True
2015-04-25T16:46:50,He's finally doing good movies again,0,0,unholychunk,CE3e3hGF2jc,0.35,2015-04-25 16:46:50,True,True
2015-04-25T16:52:07,Thumbs up if Depp is gonna get his 4th Oscar nomination! ;),2,0,Sach Harshan,CE3e3hGF2jc,0.25,2015-04-25 16:52:07,True,True
2015-04-25T17:19:48,Really really looking forward to this one I do like Johnny depp when he does serious films and I do smell of an Oscar for him for this one.,0,0,Fugly Muppet,CE3e3hGF2jc,-0.06666666666666665,2015-04-25 17:19:48,True,True
2015-04-25T17:35:45,"He should answer ""but you are one of my family now""",0,0,zpupul,CE3e3hGF2jc,0.0,2015-04-25 17:35:45,True,True
2015-04-25T17:35:57,"Finally a change of role for Johnny Depp ! Frankly his ""Jack Sparrow""' characters were funny but getting a bit repetitive. The film looks good !",0,0,Marine,CE3e3hGF2jc,0.21875,2015-04-25 17:35:57,True,True
2015-04-25T17:40:03,Sad j Depp plating a child molesting rat,0,0,franco 4,CE3e3hGF2jc,-0.5,2015-04-25 17:40:03,True,True
2015-04-25T17:40:36,whatever johnny does it is good,0,0,SuperRipper1234,CE3e3hGF2jc,0.7,2015-04-25 17:40:36,True,True
2015-04-25T17:44:10,"oh my god, OH MY GOD !! this is a killer trailer. can't wait !",0,0,prathap pilli,CE3e3hGF2jc,0.0,2015-04-25 17:44:10,True,True
2015-04-25T17:56:25,Thought it said 'Black Mesa' :(,0,0,Matthew Dudman,CE3e3hGF2jc,-0.4583333333333333,2015-04-25 17:56:25,True,True
2015-04-25T17:56:31,Oh that villainous laugh !! Love that Johnny . . . Oscars beg him !,0,0,Surendran Selvaraj,CE3e3hGF2jc,0.546875,2015-04-25 17:56:31,True,True
2015-04-25T18:00:57,Jeez never been this tense over a trailer,0,0,kretuna,CE3e3hGF2jc,-0.3333333333333333,2015-04-25 18:00:57,True,True
2015-04-25T18:04:01,Браво Джонни!!!,0,0,Vlad V,CE3e3hGF2jc,0.0,2015-04-25 18:04:01,True,True
2015-04-25T18:10:02,it's like the joker and scarface in one character!,3,0,YAZEED Z,CE3e3hGF2jc,0.0,2015-04-25 18:10:02,True,True
2015-04-25T18:10:06,Depp does creepy better than I invisioned,0,0,Sean Cook,CE3e3hGF2jc,0.0,2015-04-25 18:10:06,True,True
2015-04-25T18:12:47,"BLACK MASS-OFFICIAL trailer 2015 Book by- Dick Lehr and Gerard O'Neill, Screen Play by- Mark Mallouk and Jez Butterworth, Produced by- John Lester. p.g.a. Brian Oliver p.g.a. Scott Cooper, Patrick McCormick, Tyler Thompson, Directed by Scott Cooper. Exports the life of organixed crime, the true life account of the notorious, Mobster/Wise guy~ Whitey Bulger, Played by_ Johnny Depp, played with conviction a stone cold killer with charm. Johnny Depps delivery is epically terrifying in this role. A true Master Character Actor, Proving once again to lead in his craft. ~ Michelle A LaFrance",0,0,Michelle A Whitewolf LaFrance,CE3e3hGF2jc,-0.2133333333333333,2015-04-25 18:12:47,True,True
2015-04-25T18:20:01,"There's a lot to forget about Johnny Depp and the latest he's had to offer, but now he's back with the class Black Mass and on track to win and Oscar  BOOOOOOOOOOOOOOM!",0,0,Return to the sun,CE3e3hGF2jc,0.33333333333333337,2015-04-25 18:20:01,True,True
2015-04-25T18:27:51,The trailer alone needs to get an oscar. I'm so curious about the story and the trailer left me wanting to go see the movie. Excellent editing and sound.,0,0,Abdisalam Aato,CE3e3hGF2jc,0.325,2015-04-25 18:27:51,True,True
2015-04-25T18:29:31,Is it just me or did his eyes turn black after he started laughing?,0,0,MacKeeper Review,CE3e3hGF2jc,-0.16666666666666666,2015-04-25 18:29:31,True,True
2015-04-25T18:34:52,Omg! What an actor! ,0,0,Nick Mate 10 pro,CE3e3hGF2jc,0.0,2015-04-25 18:34:52,True,True
2015-04-25T18:39:33,Oh I can't hear anything over my throbbing erection.,0,0,Lil Pakistani,CE3e3hGF2jc,0.0,2015-04-25 18:39:33,True,True
2015-04-25T18:45:34,Johnny Depp is an amazing actor!,1,0,DSPsNUMBER1fan,CE3e3hGF2jc,0.7500000000000001,2015-04-25 18:45:34,True,True
2015-04-25T18:49:01,Oscar?,0,0,José Miguel Gómez Bojorges,CE3e3hGF2jc,0.0,2015-04-25 18:49:01,True,True
2015-04-25T18:51:05,"Cant wait to see this! Bad thing, they should have used Howie Carr's book as a plot and time line for events. The Brothers Bulger. That would ahve made it 100% better.",0,1,sitnger73,CE3e3hGF2jc,-0.09999999999999992,2015-04-25 18:51:05,True,True
2015-04-25T18:51:20,Daaaaaaaaaaaaaaamn!  Can't wait!,0,0,Marc Browning,CE3e3hGF2jc,0.0,2015-04-25 18:51:20,True,True
2015-04-25T18:54:07,"Scarey, Ship! :P Very Interesting from this trailer! :D",0,0,Andrew Milton,CE3e3hGF2jc,0.484375,2015-04-25 18:54:07,True,True
2015-04-25T18:58:25,"The light blue eyes are too strong for him, could've toned them down to medium blue or maybe green.",0,0,Anna Sigurdsson,CE3e3hGF2jc,0.07962962962962962,2015-04-25 18:58:25,True,True
2015-04-25T18:59:32,2.11 minutes of super-menacing performance by #jhonnydepp. I am waiting for this!,0,0,Vijay Murugan Sivakumar,CE3e3hGF2jc,0.0,2015-04-25 18:59:32,True,True
2015-04-25T19:13:41,I gotta see this (:,0,0,devan moran,CE3e3hGF2jc,0.0,2015-04-25 19:13:41,True,True
2015-04-25T19:16:37,"Holy, I was just talking with someone about how Depp's career has been tumbling, I believe this could be his comeback role! And, he looks a lot like Ray Liota :P",0,0,Tony Lednev,CE3e3hGF2jc,0.75,2015-04-25 19:16:37,True,True
2015-04-25T19:18:11,Hell yea this takes me back to J. Depp in Donnie Brasco...finally something where he isnt dressed up in a weird costume or playing a crazy character...,0,0,Gabriel Queiroga,CE3e3hGF2jc,-0.3666666666666667,2015-04-25 19:18:11,True,True
2015-04-25T19:21:39,Please respond if you didn't like it. I am curious to know what part of this perfect acting you disliked? Or is it just because of Depp ,0,0,2The1Magnificent,CE3e3hGF2jc,0.175,2015-04-25 19:21:39,True,True
2015-04-25T19:31:58,"Trying to pull a Pesci funny how on us, Johnny? Come, now.",0,0,oberstul,CE3e3hGF2jc,0.25,2015-04-25 19:31:58,True,True
2015-04-25T19:35:27,All I hear is Boston George. I don't have a problem with that.,0,0,Chrisp-tea,CE3e3hGF2jc,0.0,2015-04-25 19:35:27,True,True
2015-04-25T19:41:48,I really hope this movie is gonna be as good as the trailer. welcome back johnny,0,0,IraKov,CE3e3hGF2jc,0.425,2015-04-25 19:41:48,True,True
2015-04-25T19:41:52,"He looks like Aaron Paul when he says ""just sayin?"", creepy Johnny Depp, I like it though",0,0,Paulius Šlikas,CE3e3hGF2jc,-0.5,2015-04-25 19:41:52,True,True
2015-04-25T19:52:49,"Its Johnny's recipe, we've waited for a long time now.",0,0,sanket rane,CE3e3hGF2jc,-0.05,2015-04-25 19:52:49,True,True
2015-04-25T19:53:23,This trailer is serious lol,0,0,OriginalNoseBleed,CE3e3hGF2jc,0.23333333333333336,2015-04-25 19:53:23,True,True
2015-04-25T19:53:32,To be fare that's actually a really good way to marinade your steaks.,1,0,David I,CE3e3hGF2jc,0.7,2015-04-25 19:53:32,True,True
2015-04-25T19:59:21,"JAMES ""WHITEY"" BULGER LOOKS LIKE DEPP IS PLAYING THE SAME PERSON THAT JACK NICHOLSON WAS BASED OFF OF IN THE DEPARTED",0,0,Michael Price,CE3e3hGF2jc,0.0,2015-04-25 19:59:21,True,True
2015-04-25T19:59:30,He goes to war over a garlic and a few grams of soy?,0,0,Matt Damon,CE3e3hGF2jc,-0.2,2015-04-25 19:59:30,True,True
2015-04-25T20:03:46,johnny depp is one of the best actors ...danmm the mood change after the family secret part,0,0,Leon Asap,CE3e3hGF2jc,0.3,2015-04-25 20:03:46,True,True
2015-04-25T20:06:20,"Johnny Depp, Benedict Cumberbatch and Adam Scott in one movie. I know this movie isn't trying to appeal to all the fangirls out there but this cast doesn't hurt.",1,0,Whitney Kleinmann,CE3e3hGF2jc,0.0,2015-04-25 20:06:20,True,True
2015-04-25T20:06:45,Welcome back Jonny! These are the movies and roles we have been waiting to see again!,1,0,cheapseats12,CE3e3hGF2jc,0.4,2015-04-25 20:06:45,True,True
2015-04-25T20:07:54,Anyone know the name of the song in the beggining?,1,3,Edgars Feldmanis,CE3e3hGF2jc,0.0,2015-04-25 20:07:54,True,True
2015-04-25T20:12:37,Johnny Depp's crazy new hat: male pattern baldness. ,2,0,Wesley Shark,CE3e3hGF2jc,-0.15454545454545454,2015-04-25 20:12:37,True,True
2015-04-25T20:27:27,"Academy Award performance, and this is just the trailer !!",0,0,dbef0666,CE3e3hGF2jc,0.0,2015-04-25 20:27:27,True,True
2015-04-25T20:43:00,best trailer ever,2,0,KLEENKUFF MUZIQ,CE3e3hGF2jc,1.0,2015-04-25 20:43:00,True,True
2015-04-25T20:54:12,"oh this looks awesome! what a great trailer, i'm pumped",1,0,Jasmin Laufeyson,CE3e3hGF2jc,0.9,2015-04-25 20:54:12,True,True
2015-04-25T20:59:05,"Please, SAVE NEPAL. I beg of you everyone. Please.  http://www.youcaring.com/emergency-fundraiser/help-renisu-fund-earthquake-2015-nepal/343665  If you cannot donate, share! It will help a lot. Thank you very much.",2,0,Nidesha Rai,CE3e3hGF2jc,0.26,2015-04-25 20:59:05,True,True
2015-04-25T21:04:29,Fifth time watching!,1,0,xjxxxx,CE3e3hGF2jc,0.0,2015-04-25 21:04:29,True,True
2015-04-25T21:10:29,Looks like an episode of 'Come Dine With Me' that got out of hand...,1,0,Bronze-Age Boats,CE3e3hGF2jc,0.0,2015-04-25 21:10:29,True,True
2015-04-25T21:17:01,Well... I guess we know what happened to Gilbert Grape now.,1,0,ORIGAMI BEAVER,CE3e3hGF2jc,0.0,2015-04-25 21:17:01,True,True
2015-04-25T21:21:07,Johnny fricking depp is amazing,0,0,shan c,CE3e3hGF2jc,0.6000000000000001,2015-04-25 21:21:07,True,True
2015-04-25T21:28:27,Johnny Depp looks like a demon at 1:16,0,0,Alvin Elmore,CE3e3hGF2jc,0.0,2015-04-25 21:28:27,True,True
2015-04-25T21:30:28,"Wow.  Welcome back, The Real Johnny Depp.  Where the hell have you been?",0,0,James,CE3e3hGF2jc,0.275,2015-04-25 21:30:28,True,True
2015-04-25T21:31:59,"I really hope that the Steak scene isn't the only great scene in the movie and they just put it in to make the movie look better than it is. Still though, trailer made the movie look great, I just don't want to get my hopes up if the trailer over-hypes the movie for me.",0,0,Godzilla52,CE3e3hGF2jc,0.45999999999999996,2015-04-25 21:31:59,True,True
2015-04-25T21:32:44,"This trailer, taken of and by itself, is a great Short Film, called, Black Mass.  It is about this angel who comes to evaluate a candidate for the priesthood.  And it becomes readily apparent that this guy needs to seek another family, and not one that is connected to organized crime. For he who cannot keep a secret, should really be preaching the Gospel. ""Behold, the Truth.""  ...... (Now in real life, a psychiatrist would declare him psychotic, and unfit to stand trial.  ""No, you idiot.  That was not an angel, but a criminal mastermind assassin.  And you are now officially not fit to stand trial as a witness against him.  I imagine that is what you wanted all along."" BUT, this is a movie, so the angel angle makes way more sense - is more dramatic, don't you think?) ...... The Confession Ritual - that only works if the person who comes to give confession actually feels like he has done something wrong, has something to feel guilty about.  ""I was just saying...""  ""it's just a recipe, right?"".... No. ... Good to know, so that one might not get, .. stoned. ..... Umm, so as long as it is consensual, it is still not OK, huh?  That makes sense. But now, they who feel no guilt, why would they go to confession? And so, I think the whole confession ritual is problematic. Gluttony, is very very bad.  But who believes this? See, Deuteronomy 20:21-22, kjv. ..... And so there are, I think, many Catholic congregations, where people feel good about themselves, and cannot think of what they ought to be confessing about, since they know not the Law (of Moses).  ""Brother, have you tithed, .. this week?""  Sure, Cesar may call it racketeering... but really, ... it's for a good cause, right?",0,0,rowdy yeats,CE3e3hGF2jc,0.03907834101382488,2015-04-25 21:32:44,True,True
2015-04-25T21:53:08,"If reviews are positive, I'll be heading to the cinema with this one. I was interested in Transcendence, but the bad word-of-mouth deterred me form seeing it. Don't disappoint me, Depp!",0,0,Patrick Laceholder,CE3e3hGF2jc,-0.13257575757575749,2015-04-25 21:53:08,True,True
2015-04-25T21:55:22,"Well it's about f'n time Johnny Depp gets a serious role again.  He pulls the Mob act better than other roles he's had *cough* ""Mortdecai"" *cough*",0,0,Wilton Vivas,CE3e3hGF2jc,0.013888888888888895,2015-04-25 21:55:22,True,True
2015-04-25T21:55:59,JOHNNY,1,0,"valeria ,",CE3e3hGF2jc,0.0,2015-04-25 21:55:59,True,True
2015-04-25T22:09:13,Screaming🙀😱🙀😱,0,0,Kaled Hani,CE3e3hGF2jc,0.0,2015-04-25 22:09:13,True,True
2015-04-25T22:10:34,Don't Bring Me Down - The Animals,0,0,sanket rane,CE3e3hGF2jc,-0.15555555555555559,2015-04-25 22:10:34,True,True
2015-04-25T22:12:13,isso e JOHNNY DEPP  ATUANDO..........,0,0,Rodney Matheus,CE3e3hGF2jc,0.0,2015-04-25 22:12:13,True,True
2015-04-25T22:16:15,Looks cool... just sayin'.,0,0,Mortified Penguin,CE3e3hGF2jc,0.35,2015-04-25 22:16:15,True,True
2015-04-25T22:24:14,Just saying.,0,0,Scourgewolf,CE3e3hGF2jc,0.0,2015-04-25 22:24:14,True,True
2015-04-25T22:33:26,Wow.,0,0,Miranda N,CE3e3hGF2jc,0.1,2015-04-25 22:33:26,True,True
2015-04-25T22:48:28,Major respect for this man's ability as an actor. I mean seriously there is 0% Johnny Depp in that character!,0,0,Savvy Savages,CE3e3hGF2jc,-0.2222222222222222,2015-04-25 22:48:28,True,True
2015-04-25T22:55:10,That laugh at the end... damn Johnny would've made an epic Joker,0,0,JB0523,CE3e3hGF2jc,0.2,2015-04-25 22:55:10,True,True
2015-04-25T22:56:07,i love johnny depp and kevin bacon,0,0,tim bardtke,CE3e3hGF2jc,0.5,2015-04-25 22:56:07,True,True
2015-04-25T23:05:38,Check out my music video :),0,0,Lisa UKGirl,CE3e3hGF2jc,0.5,2015-04-25 23:05:38,True,True
2015-04-25T23:27:47,Damn this is gonna be good,0,0,Vcon8XD,CE3e3hGF2jc,0.7,2015-04-25 23:27:47,True,True
2015-04-25T23:40:11,I've gotta watch this!!,0,0,Buchyraaa,CE3e3hGF2jc,0.0,2015-04-25 23:40:11,True,True
2015-04-25T23:43:50,Favorite trailer so far this year ,0,0,emmanuel saldana,CE3e3hGF2jc,0.3,2015-04-25 23:43:50,True,True
2015-04-25T23:53:26,"The second ""No""...wow, that was terrifying.",0,0,ViSoupNazi,CE3e3hGF2jc,-0.5,2015-04-25 23:53:26,True,True
2015-04-25T23:53:47,The Great Johnny Depp has finnally return!,0,0,Valey,CE3e3hGF2jc,1.0,2015-04-25 23:53:47,True,True
2015-04-26T00:22:48,"Just because of that laugh, we can realize he was a good one to portray Joker in the next DC movie franchise.",0,0,Hugo Alan Moore Galarza,CE3e3hGF2jc,0.3333333333333333,2015-04-26 00:22:48,True,True
2015-04-26T00:25:44,Very good trailer.,0,0,Brandon Martinez,CE3e3hGF2jc,0.9099999999999999,2015-04-26 00:25:44,True,True
2015-04-26T00:25:51,So I hope this is good at last!!! Johnny hasn't been in a decent movie since maybe public enemies in 2009!!!,1,2,C. Pod,CE3e3hGF2jc,0.21666666666666665,2015-04-26 00:25:51,True,True
2015-04-26T00:28:28,This is so exciting! Can Johnny Depp finally break away from those stupid ass overacted roles?!,633,45,Yvaia,CE3e3hGF2jc,-0.2083333333333333,2015-04-26 00:28:28,True,True
2015-04-26T00:32:49,eurgh I hate Depp as an actor.,0,0,prime adonis,CE3e3hGF2jc,-0.8,2015-04-26 00:32:49,True,True
2015-04-26T00:34:08,That's one hell of a scary performance. Not sure if he's going to kill you or what's going to set Whitey off. Depp is clearly putting in a fantastic performance on this film. When was the last time he's been this terrifying? Edward Scissorhands? Nah! Sweeney Todd? Try again. Willy Wonka? Maybe. Whitey Bulger? HOLY SHIT!,0,0,Razorik,CE3e3hGF2jc,-0.21428571428571427,2015-04-26 00:34:08,True,True
2015-04-26T01:09:57,just saying......... GIVE HIM AN OSCAR!!!,0,0,Natasa Maliaga,CE3e3hGF2jc,0.0,2015-04-26 01:09:57,True,True
2015-04-26T01:29:55,Donnie Brasco 2?,0,0,mugenXZY2012,CE3e3hGF2jc,0.0,2015-04-26 01:29:55,True,True
2015-04-26T01:37:37,I can't wait.,0,0,Rick C,CE3e3hGF2jc,0.0,2015-04-26 01:37:37,True,True
2015-04-26T01:46:15,"Now that's what I'm talking about, welcome back Depp",0,0,WillyM79,CE3e3hGF2jc,0.4,2015-04-26 01:46:15,True,True
2015-04-26T01:52:28,"1:06 Oh hey, it's Raul Duke!   Man, I'm excited for this, it looks to be one of Depp's finest performances if the film lives up to it's trailer.",0,0,Hassaan Mirza,CE3e3hGF2jc,0.375,2015-04-26 01:52:28,True,True
2015-04-26T01:53:27,It's giving me creeps. I'm so going to watch this.,0,0,No Doubt in Us Family,CE3e3hGF2jc,0.0,2015-04-26 01:53:27,True,True
2015-04-26T01:57:54,Goosebumps. i cant wait.,0,0,Biff Buttsniff,CE3e3hGF2jc,0.0,2015-04-26 01:57:54,True,True
2015-04-26T01:58:29,this smells to Oscar,0,0,Dario Bonifaz,CE3e3hGF2jc,0.0,2015-04-26 01:58:29,True,True
2015-04-26T02:01:47,"i cant believe people are comparing this with the ""funny how"" scene in Goodfellas. worst strikeout ever. Goofellas would have crapped themselves at Whiteys table.",0,0,Biff Buttsniff,CE3e3hGF2jc,-0.375,2015-04-26 02:01:47,True,True
2015-04-26T02:10:24,Yeah man!! That voice was creepy as hell!,0,0,Paul Forshtay,CE3e3hGF2jc,-0.625,2015-04-26 02:10:24,True,True
2015-04-26T02:19:20,Is he doing a Christopher Walken impression?,0,0,JakeandElwoodBlues,CE3e3hGF2jc,0.0,2015-04-26 02:19:20,True,True
2015-04-26T02:21:02,Cool,0,0,Ryan Riddy,CE3e3hGF2jc,0.35,2015-04-26 02:21:02,True,True
2015-04-26T02:31:38,Just SAIYAN!,0,0,Warrington Feaslefeet,CE3e3hGF2jc,0.0,2015-04-26 02:31:38,True,True
2015-04-26T02:34:22,sooo good!,0,0,Yevgeny Panchenko,CE3e3hGF2jc,0.875,2015-04-26 02:34:22,True,True
2015-04-26T02:51:00,Note to self: Don't tell Johnny Depp any recipes,0,0,dhskinny3,CE3e3hGF2jc,0.0,2015-04-26 02:51:00,True,True
2015-04-26T03:12:05,When is Hollywood going to finally realize nobody cares about Johnny Depp?  He looks silly in that awful skull cap and eyebrows.,0,0,schlagdog,CE3e3hGF2jc,-0.5,2015-04-26 03:12:05,True,True
