timestamp,text,like_count,reply_count,author,trailer_id,sentiment_score,datetime,used_for_model,used_for_visualization
2016-07-15T00:07:34,fst,0,0,zozo mimi,G9-VHtJvPNs,0.0,2016-07-15 00:07:34,True,True
2016-07-15T00:08:04,yay another madea movie!,0,0,Shanice Trejo,G9-VHtJvPNs,0.0,2016-07-15 00:08:04,True,True
2016-07-15T00:08:15,5th like,0,0,dwaghawa,G9-VHtJvPNs,0.0,2016-07-15 00:08:15,True,True
2016-07-15T00:08:18,first dislike,6,4,David Zico,G9-VHtJvPNs,0.25,2016-07-15 00:08:18,True,True
2016-07-15T00:08:28,WHERE MY BRUH BRUHS AT?!,384,58,DayyViddTheKid,G9-VHtJvPNs,0.0,2016-07-15 00:08:28,True,True
2016-07-15T00:08:56,Yooo my bruh bruh big now!,3,0,Usama,G9-VHtJvPNs,0.0,2016-07-15 00:08:56,True,True
2016-07-15T00:08:58,My boy fousey,2,0,Mace Syre,G9-VHtJvPNs,0.0,2016-07-15 00:08:58,True,True
2016-07-15T00:09:02,How is this still happening?,23,13,Sara Owliaie,G9-VHtJvPNs,0.0,2016-07-15 00:09:02,True,True
2016-07-15T00:09:26,"""I'll pay you."" ""Alright, I'll be right over.""  Basically my friend",0,0,SnowyThePyroBear Inc.,G9-VHtJvPNs,0.2857142857142857,2016-07-15 00:09:26,True,True
2016-07-15T00:09:36,First one,0,0,Annabella V,G9-VHtJvPNs,0.25,2016-07-15 00:09:36,True,True
2016-07-15T00:10:11,WHY DO THEY KEEP MAKING THESE MOVIES??,2,2,Garrick Groover,G9-VHtJvPNs,0.0,2016-07-15 00:10:11,True,True
2016-07-15T00:10:41,i'm black so i gotta watch this,1,0,Misunderstood Swami,G9-VHtJvPNs,-0.16666666666666666,2016-07-15 00:10:41,True,True
2016-07-15T00:10:44,fouseytube sucks ass,145,26,Tyson Wins,G9-VHtJvPNs,-0.3,2016-07-15 00:10:44,True,True
2016-07-15T00:10:47,Any BRUHBRUHS here??? :D,2,0,Mamudi Saad,G9-VHtJvPNs,1.0,2016-07-15 00:10:47,True,True
2016-07-15T00:11:25,DOF FAMILY WHERE YOU ATTT!!!!,4,0,DarkMiner,G9-VHtJvPNs,0.0,2016-07-15 00:11:25,True,True
2016-07-15T00:11:30,Gwan Fousey!! So proud bruh!!,0,0,Lewis Messam,G9-VHtJvPNs,1.0,2016-07-15 00:11:30,True,True
2016-07-15T00:11:52,Why?,1,0,Look At The Movies,G9-VHtJvPNs,0.0,2016-07-15 00:11:52,True,True
2016-07-15T00:12:07,no white people. hell yeah,0,0,MBT Records,G9-VHtJvPNs,0.0,2016-07-15 00:12:07,True,True
2016-07-15T00:12:11,this look pretty cool tbh,0,0,Shisha CEO,G9-VHtJvPNs,0.3,2016-07-15 00:12:11,True,True
2016-07-15T00:12:26,when will it ever stop﻿,37,9,Nate914,G9-VHtJvPNs,0.0,2016-07-15 00:12:26,True,True
2016-07-15T00:12:29,I feel stupid now that i laughed so much and so hard from this.,1,0,Winston Solomon,G9-VHtJvPNs,-0.04791666666666666,2016-07-15 00:12:29,True,True
2016-07-15T00:12:34,10th,0,0,Ali Shamman,G9-VHtJvPNs,0.0,2016-07-15 00:12:34,True,True
2016-07-15T00:12:34,FOUSEY lookin good in this movie,0,0,Wafflez,G9-VHtJvPNs,0.7,2016-07-15 00:12:34,True,True
2016-07-15T00:12:36,"Huh. I guess we've finally reached the ""Earnest Scared Stupid"" phase of the franchise.",5,0,dragontamer63,G9-VHtJvPNs,-0.39999999999999997,2016-07-15 00:12:36,True,True
2016-07-15T00:13:07,Oh mah lurrrrd!!,0,0,jice,G9-VHtJvPNs,0.0,2016-07-15 00:13:07,True,True
2016-07-15T00:13:11,Who else watching it to find fousey tube? Lol bruh bruhs!!!,1,0,Lua Lua,G9-VHtJvPNs,1.0,2016-07-15 00:13:11,True,True
2016-07-15T00:13:15,Omg that was horrible,79,14,Mark Isom,G9-VHtJvPNs,-1.0,2016-07-15 00:13:15,True,True
2016-07-15T00:13:31,Diamond White,0,0,Sheana Herraz,G9-VHtJvPNs,0.0,2016-07-15 00:13:31,True,True
2016-07-15T00:13:40,This looks like Fousey pre 90 day work out... Any bruh bruhs agree?,1,0,adam Ispahany,G9-VHtJvPNs,0.0,2016-07-15 00:13:40,True,True
2016-07-15T00:14:17,wait fouseytube is in this movie lol,0,0,Oli,G9-VHtJvPNs,0.8,2016-07-15 00:14:17,True,True
2016-07-15T00:14:40,My man Fousey,0,0,Ashley Prince,G9-VHtJvPNs,0.0,2016-07-15 00:14:40,True,True
2016-07-15T00:14:52,OMG FOUSEY!!!!!,0,0,Kimiko-jade,G9-VHtJvPNs,0.0,2016-07-15 00:14:52,True,True
2016-07-15T00:14:52,I thought we were done with these movies,0,0,I Comment Weird Things,G9-VHtJvPNs,0.0,2016-07-15 00:14:52,True,True
2016-07-15T00:15:00,next movie: madea goes to space,145,21,everything salty,G9-VHtJvPNs,0.0,2016-07-15 00:15:00,True,True
2016-07-15T00:15:02,Where the bruh bruhhhhhh at?,0,0,Anthony Scheina,G9-VHtJvPNs,0.0,2016-07-15 00:15:02,True,True
2016-07-15T00:15:14,Well done fousey so proud of you x,1,0,aisha Moolla,G9-VHtJvPNs,0.8,2016-07-15 00:15:14,True,True
2016-07-15T00:15:21,OMG Madea adopt me please!!!!,0,0,NotGuilty,G9-VHtJvPNs,0.0,2016-07-15 00:15:21,True,True
2016-07-15T00:15:23,0:22-0:25 IS WHERE THE BRUH BRUH ATTT. GIVE ME EM LIKESSS CMON,0,0,DarkMiner,G9-VHtJvPNs,0.0,2016-07-15 00:15:23,True,True
2016-07-15T00:15:28,A Lot of famous youtubers in this movie.,0,0,Angel M. Villalona,G9-VHtJvPNs,0.5,2016-07-15 00:15:28,True,True
2016-07-15T00:15:57,Fouseytube!!!!!!,0,0,Kevin Gislon,G9-VHtJvPNs,0.0,2016-07-15 00:15:57,True,True
2016-07-15T00:16:01,Yay finally #DOFFAMILY,1,0,beatsbyheart,G9-VHtJvPNs,0.0,2016-07-15 00:16:01,True,True
2016-07-15T00:16:08,If yousef is in it you know its gonna be even worse than it needed to be,0,0,Jacob M.,G9-VHtJvPNs,-0.4,2016-07-15 00:16:08,True,True
2016-07-15T00:16:14,fouseytube yess😊,0,0,Kid with. A broken heart.,G9-VHtJvPNs,0.0,2016-07-15 00:16:14,True,True
2016-07-15T00:16:17,""" white people... """,0,0,Salman Alshabbo,G9-VHtJvPNs,0.0,2016-07-15 00:16:17,True,True
2016-07-15T00:16:28,BRUH BRUH FAMILY,0,0,Sonam Sherpa,G9-VHtJvPNs,0.0,2016-07-15 00:16:28,True,True
2016-07-15T00:16:28,Fousey,0,0,AB Productions,G9-VHtJvPNs,0.0,2016-07-15 00:16:28,True,True
2016-07-15T00:16:31,here cuz,0,0,Theexdopexking,G9-VHtJvPNs,0.0,2016-07-15 00:16:31,True,True
2016-07-15T00:16:43,Get it Fousey!!!!!!!! You the MVP!!,0,0,Avinash Carl,G9-VHtJvPNs,0.0,2016-07-15 00:16:43,True,True
2016-07-15T00:16:57,dof,1,0,Franck Lambard,G9-VHtJvPNs,0.0,2016-07-15 00:16:57,True,True
2016-07-15T00:17:23,Who keeps giving this asshole money?,0,3,cory_i,G9-VHtJvPNs,0.0,2016-07-15 00:17:23,True,True
2016-07-15T00:17:32,"YESSSSS FOUSEYYYYY, ANY BRUH BRUHS HERE???",183,29,TheBeforeParty,G9-VHtJvPNs,0.0,2016-07-15 00:17:32,True,True
2016-07-15T00:17:46,Oh shit foussy tube!,0,0,Michael Vixaysack,G9-VHtJvPNs,-0.25,2016-07-15 00:17:46,True,True
2016-07-15T00:18:02,"""Treyykkaaa Treetttaa""  -Madea-",0,0,Eder Lopez,G9-VHtJvPNs,0.0,2016-07-15 00:18:02,True,True
2016-07-15T00:18:10,why!!???,0,0,Another dude,G9-VHtJvPNs,0.0,2016-07-15 00:18:10,True,True
2016-07-15T00:18:19,Yay Kian and Jc!!!!,0,0,Hannah Jo,G9-VHtJvPNs,0.0,2016-07-15 00:18:19,True,True
2016-07-15T00:18:30,FOUSEY,0,0,Seisho Ari,G9-VHtJvPNs,0.0,2016-07-15 00:18:30,True,True
2016-07-15T00:19:17,FOUSEYTUBE!!! Where my bruh bruhs?,44,12,ShOrT Afrikan,G9-VHtJvPNs,0.0,2016-07-15 00:19:17,True,True
2016-07-15T00:19:49,WTF is Liza doing here?!?!!,0,0,kiara d,G9-VHtJvPNs,-0.9765625,2016-07-15 00:19:49,True,True
2016-07-15T00:20:10,Ayee bruh bruh,0,0,Osmar Quezada,G9-VHtJvPNs,0.0,2016-07-15 00:20:10,True,True
2016-07-15T00:20:32,Kian and jc are in it yesss!!!! 👍👏,0,0,Wendy Menendez,G9-VHtJvPNs,0.0,2016-07-15 00:20:32,True,True
2016-07-15T00:20:48,Please stop.,0,0,Jack Bonser,G9-VHtJvPNs,0.0,2016-07-15 00:20:48,True,True
2016-07-15T00:20:49,Fousey looking like he just slid into Tyler Perry's DM,3,0,Panda eX,G9-VHtJvPNs,0.0,2016-07-15 00:20:49,True,True
2016-07-15T00:20:54,"lmao, that was funny",0,0,Fanboys Love To Cry like Girls,G9-VHtJvPNs,0.425,2016-07-15 00:20:54,True,True
2016-07-15T00:21:19,I can't take YouTubers serious in a movie 😂😂 but for sure gonna watch this when it comes out,389,21,Abel Delgado,G9-VHtJvPNs,0.08333333333333334,2016-07-15 00:21:19,True,True
2016-07-15T00:21:35,fousey!!!,0,0,Anon,G9-VHtJvPNs,0.0,2016-07-15 00:21:35,True,True
2016-07-15T00:21:52,WTF I didn't know that fousetube is in a movie ! 😂,15,3,Q,G9-VHtJvPNs,-0.625,2016-07-15 00:21:52,True,True
2016-07-15T00:21:52,"For the love of God, WHY'",0,0,Myles Donaldson,G9-VHtJvPNs,0.5,2016-07-15 00:21:52,True,True
2016-07-15T00:22:08,"Oh lord, This shit look like it's gonna be straight up funny as hell Lol.",0,0,The Rated Rockstar™ Official Channel,G9-VHtJvPNs,0.2625,2016-07-15 00:22:08,True,True
2016-07-15T00:23:57,i bet fousey only got one line lol,0,0,brian sachuo,G9-VHtJvPNs,0.4,2016-07-15 00:23:57,True,True
2016-07-15T00:24:08,Yousef,0,0,Suvithan,G9-VHtJvPNs,0.0,2016-07-15 00:24:08,True,True
2016-07-15T00:24:16,WHY!? Who keeps green lighting these Madea films!?????,0,0,Caffeinated Nation,G9-VHtJvPNs,-0.25,2016-07-15 00:24:16,True,True
2016-07-15T00:24:23,Bruhhhhh bruhhhhh,0,0,Suvithan,G9-VHtJvPNs,0.0,2016-07-15 00:24:23,True,True
2016-07-15T00:24:34,no,0,0,Crimson Red Vermillion,G9-VHtJvPNs,0.0,2016-07-15 00:24:34,True,True
2016-07-15T00:24:35,really....,0,0,salsa2good,G9-VHtJvPNs,0.2,2016-07-15 00:24:35,True,True
2016-07-15T00:25:41,BRUH BRUH HERE,1,0,Khalil Smith,G9-VHtJvPNs,0.0,2016-07-15 00:25:41,True,True
2016-07-15T00:26:13,Ah yeah my dude Yousef AKA FouseyTube AKA Young Simbah,0,0,Alex Burleson,G9-VHtJvPNs,0.1,2016-07-15 00:26:13,True,True
2016-07-15T00:27:01,Fouseytube is in it??? Wow... I wonder if they payed him 30$,40,8,Edgar Irizarry,G9-VHtJvPNs,0.1,2016-07-15 00:27:01,True,True
2016-07-15T00:27:15,Why is there a lot of youtubers/viners in this movie?,0,0,Casiana King,G9-VHtJvPNs,0.0,2016-07-15 00:27:15,True,True
2016-07-15T00:27:30,yooooooo Fousey! !!!!!!!!!,0,0,Yosh sparkles,G9-VHtJvPNs,0.0,2016-07-15 00:27:30,True,True
2016-07-15T00:27:43,Cool,0,0,HAPPY DREAMER,G9-VHtJvPNs,0.35,2016-07-15 00:27:43,True,True
2016-07-15T00:27:59,BRO I SEE SO MANY PEOPLE I KNOW IN THIS MOVIE,0,0,nina o,G9-VHtJvPNs,0.5,2016-07-15 00:27:59,True,True
2016-07-15T00:28:33,stop giving Tyler Perry money,1,0,tsnoop19,G9-VHtJvPNs,0.0,2016-07-15 00:28:33,True,True
2016-07-15T00:28:34,Whoa fousey tube what ? !,0,0,Anthony Rozario,G9-VHtJvPNs,0.0,2016-07-15 00:28:34,True,True
2016-07-15T00:28:40,Lizzzzzza,0,0,Kim Possible,G9-VHtJvPNs,0.0,2016-07-15 00:28:40,True,True
2016-07-15T00:28:54,wtf tyler perry you went from gone girl to this,0,0,Wesley Tomsky,G9-VHtJvPNs,-0.5,2016-07-15 00:28:54,True,True
2016-07-15T00:29:39,Ayyyyy Yousef done made us proooooud,0,0,Billy H,G9-VHtJvPNs,0.0,2016-07-15 00:29:39,True,True
2016-07-15T00:30:38,I wanna see this lol,0,0,Sunethra,G9-VHtJvPNs,0.8,2016-07-15 00:30:38,True,True
2016-07-15T00:31:01,Omg Bruh bruh so proud of you😍,0,0,DarinSam k,G9-VHtJvPNs,0.8,2016-07-15 00:31:01,True,True
2016-07-15T00:31:14,Fouseytube fake asf,0,0,Lucky,G9-VHtJvPNs,-0.5,2016-07-15 00:31:14,True,True
2016-07-15T00:31:17,when you see fousey 👌,0,0,hani khan,G9-VHtJvPNs,0.0,2016-07-15 00:31:17,True,True
2016-07-15T00:31:23,I am definitely going to see this!,1,0,Ashley Crocker,G9-VHtJvPNs,0.0,2016-07-15 00:31:23,True,True
2016-07-15T00:31:49,Only two minutes long and I still died,0,0,Lily Woodrow,G9-VHtJvPNs,-0.025,2016-07-15 00:31:49,True,True
2016-07-15T00:32:30,"FouseyTube is a actor, huh?... Just let that sink in...",2,5,Pierce Smith,G9-VHtJvPNs,0.0,2016-07-15 00:32:30,True,True
2016-07-15T00:32:46,yoooo all the bruh bruh's our man made it,0,0,Rayler AG,G9-VHtJvPNs,0.0,2016-07-15 00:32:46,True,True
2016-07-15T00:33:11,no no no no this isn't happening,0,3,Tony Nola,G9-VHtJvPNs,0.0,2016-07-15 00:33:11,True,True
2016-07-15T00:33:17,Fouseytube! We made it!!,0,0,Alvin Buyinza,G9-VHtJvPNs,0.0,2016-07-15 00:33:17,True,True
2016-07-15T00:33:45,It's Sage from Girl Meets World!,0,0,Nameless,G9-VHtJvPNs,0.0,2016-07-15 00:33:45,True,True
2016-07-15T00:34:30,Bradley martyn is also in the movie,0,0,Mustafa shoaib,G9-VHtJvPNs,0.0,2016-07-15 00:34:30,True,True
2016-07-15T00:34:42,FOUSEYTUUUUUUBEEE!!!!,0,0,hamod aha,G9-VHtJvPNs,0.0,2016-07-15 00:34:42,True,True
2016-07-15T00:34:59,"I actually thought this movie would be ok, but when i saw fousey i had to stop the video",2,0,Vincent Kompany the king,G9-VHtJvPNs,0.25,2016-07-15 00:34:59,True,True
2016-07-15T00:35:23,survival time:  madea out runs them all thy call her name to wait for them but we all know she ain't stopping lol,0,0,Monique Blakes,G9-VHtJvPNs,0.8,2016-07-15 00:35:23,True,True
2016-07-15T00:35:42,Kian and JC 👀 and Yousef,0,0,BSVEVO1,G9-VHtJvPNs,0.0,2016-07-15 00:35:42,True,True
2016-07-15T00:36:11,this gone be good can't  wait too watch it lol,0,0,Breasia Nix,G9-VHtJvPNs,0.75,2016-07-15 00:36:11,True,True
2016-07-15T00:36:32,MY BOY FOUSEY DID IT !!! You can't deny that,1,0,Safa,G9-VHtJvPNs,0.0,2016-07-15 00:36:32,True,True
2016-07-15T00:36:52,Even Lexi panterra is in the movie,0,0,Corey Casciano,G9-VHtJvPNs,0.0,2016-07-15 00:36:52,True,True
2016-07-15T00:37:12,"KIAN AND JC !!!!! OMFG        Jc: ""Show us your boobs""",0,0,r,G9-VHtJvPNs,0.0,2016-07-15 00:37:12,True,True
2016-07-15T00:37:14,Yousef sounds sooo different!!!,0,0,beatsbyheart,G9-VHtJvPNs,0.0,2016-07-15 00:37:14,True,True
2016-07-15T00:38:18,i dont even want to see the trailer....i just came to read the comment section....,0,0,J-Jeaze,G9-VHtJvPNs,0.0,2016-07-15 00:38:18,True,True
2016-07-15T00:38:22,Sky Williams Movie,0,0,Adrian Dionisio,G9-VHtJvPNs,0.0,2016-07-15 00:38:22,True,True
2016-07-15T00:39:23,HOW???? How are these still a thing?!,0,0,Avery Hinks,G9-VHtJvPNs,0.0,2016-07-15 00:39:23,True,True
2016-07-15T00:40:00,was liking it so far..until youtubers & instagrammers are in this movie..,1,0,echocity,G9-VHtJvPNs,0.0,2016-07-15 00:40:00,True,True
2016-07-15T00:40:01,The viner Lizzzzza is in it... she made it. Sort of.,0,0,DraYzey,G9-VHtJvPNs,0.0,2016-07-15 00:40:01,True,True
2016-07-15T00:40:14,OMGG YOUSEF!!!!😃😃,0,0,FudggeYeah,G9-VHtJvPNs,0.0,2016-07-15 00:40:14,True,True
2016-07-15T00:40:44,Everyone in the comments are like omg Fousey and I'm like yo Kian and Jc get it 👌😂,155,22,Kat Urango,G9-VHtJvPNs,0.0,2016-07-15 00:40:44,True,True
2016-07-15T00:40:53,Ok I'm boycotting this movie cause of fousey,0,1,Rickey Strickland,G9-VHtJvPNs,0.5,2016-07-15 00:40:53,True,True
2016-07-15T00:40:56,oooohh...! Bruhhh!!!!,0,0,stu dio,G9-VHtJvPNs,0.0,2016-07-15 00:40:56,True,True
2016-07-15T00:41:18,LMAO IM HOLLERING LMAOOOO,0,0,Kashief Y,G9-VHtJvPNs,0.6,2016-07-15 00:41:18,True,True
2016-07-15T00:41:25,lol fousey faked his whole life just to get to a Madea movie he made it.,167,23,Super D D Super,G9-VHtJvPNs,0.5,2016-07-15 00:41:25,True,True
2016-07-15T00:41:45,"""You see white people?"" had me dead 😂😂",1,0,PANCAKE PAPI,G9-VHtJvPNs,-0.1,2016-07-15 00:41:45,True,True
2016-07-15T00:42:44,KIAN AND JC 😭,0,0,Destiny Stewart,G9-VHtJvPNs,0.0,2016-07-15 00:42:44,True,True
2016-07-15T00:43:01,I was excited until I saw Fousey in it!!!!,0,0,virgen virgen,G9-VHtJvPNs,0.91552734375,2016-07-15 00:43:01,True,True
2016-07-15T00:43:34,"Tyler perry on to something, it's not even about plot with movies these days. Get someone in a movie that has a huge following and people come regardless. Trailer featured popular youtubers and viners. Looool",0,0,DraYzey,G9-VHtJvPNs,0.3333333333333333,2016-07-15 00:43:34,True,True
2016-07-15T00:43:37,Kian & JC YASSSSSSSSSSS so glad they got a part in this movie even if it's a small part.,0,0,Kala Lee,G9-VHtJvPNs,0.125,2016-07-15 00:43:37,True,True
2016-07-15T00:43:38,DOF FAM,0,0,De Mexican,G9-VHtJvPNs,0.0,2016-07-15 00:43:38,True,True
2016-07-15T00:43:40,"I read the title as, ""Boo (the negative one)! A Madea Halloween"" for whatever reason.",0,0,Anthony Cristante,G9-VHtJvPNs,-0.375,2016-07-15 00:43:40,True,True
2016-07-15T00:44:49,the reason why fouseytube has decent acting in this trailer is cause he's always acting in his fake pranks,0,0,r,G9-VHtJvPNs,-0.08333333333333334,2016-07-15 00:44:49,True,True
2016-07-15T00:45:19,Tyler Perry is to blame for why the Oscars are so white.,127,10,ryan4261,G9-VHtJvPNs,0.0,2016-07-15 00:45:19,True,True
2016-07-15T00:46:24,FOUESY!!!,0,0,Aran hiwa,G9-VHtJvPNs,0.0,2016-07-15 00:46:24,True,True
2016-07-15T00:47:35,"Baaaahahahahaha!!! ""Help me, Jesus! Help me, Jesus! Heeeelp me, Jeeesus!!!"" I've got to see this, haha! xD",0,0,Christopher Russell,G9-VHtJvPNs,0.25,2016-07-15 00:47:35,True,True
2016-07-15T00:47:43,What the hell did I just watch,0,0,toofy ahmad,G9-VHtJvPNs,0.0,2016-07-15 00:47:43,True,True
2016-07-15T00:48:07,"If you don't complain about how many superman movies or batman movies there are, you can't complain about how many Madea movies there is.",1,0,rileyreginald,G9-VHtJvPNs,0.5,2016-07-15 00:48:07,True,True
2016-07-15T00:48:09,bruh bruh squaaaaaad!!!,0,0,Just Hamzy,G9-VHtJvPNs,0.0,2016-07-15 00:48:09,True,True
2016-07-15T00:49:24,I hope this movie sucks,0,0,Meme Capital,G9-VHtJvPNs,-0.3,2016-07-15 00:49:24,True,True
2016-07-15T00:50:26,Ugh why is fouseytube fake ass doing in this movie. Ugh,0,1,TRISTAN LOFTIN CHANNEL,G9-VHtJvPNs,-0.5,2016-07-15 00:50:26,True,True
2016-07-15T00:51:19,"Tyler Perry, on behalf of all people who have a brain.. Stop.. Please. Thank you.",0,0,Jordan Sparte,G9-VHtJvPNs,0.0,2016-07-15 00:51:19,True,True
2016-07-15T00:51:48,Fousey??!,0,0,Derrek Thibodeaux,G9-VHtJvPNs,0.0,2016-07-15 00:51:48,True,True
2016-07-15T00:51:49,yo its jimmy tatro,0,0,Dylan Yang,G9-VHtJvPNs,0.0,2016-07-15 00:51:49,True,True
2016-07-15T00:53:27,bruh bruhhh,0,0,JoseXavielJX,G9-VHtJvPNs,0.0,2016-07-15 00:53:27,True,True
2016-07-15T00:53:29,Was this a prank too?,92,8,Alex Bravo,G9-VHtJvPNs,0.0,2016-07-15 00:53:29,True,True
2016-07-15T00:53:44,do people actually like these,24,12,Nornfang,G9-VHtJvPNs,0.0,2016-07-15 00:53:44,True,True
2016-07-15T00:54:19,Was that Raven Symone???,1,0,Janae Lovely,G9-VHtJvPNs,0.0,2016-07-15 00:54:19,True,True
2016-07-15T00:55:18,fousey and diamond white,0,0,eric louis,G9-VHtJvPNs,0.0,2016-07-15 00:55:18,True,True
2016-07-15T00:56:05,jesus they are running out of titles for these movies,0,0,It'sAlexForShort,G9-VHtJvPNs,0.0,2016-07-15 00:56:05,True,True
2016-07-15T00:56:55,KIAN & JC,0,0,micayla,G9-VHtJvPNs,0.0,2016-07-15 00:56:55,True,True
2016-07-15T00:57:22,and we complain why we don't win any Oscars 😒 smh,1,0,Cassius Jackson,G9-VHtJvPNs,0.8,2016-07-15 00:57:22,True,True
2016-07-15T00:58:47,suddenly i love life,0,0,JARMAK,G9-VHtJvPNs,0.5,2016-07-15 00:58:47,True,True
2016-07-15T00:59:17,ahaahahahahahahahaahah,0,0,Jaquon Harvey,G9-VHtJvPNs,0.0,2016-07-15 00:59:17,True,True
2016-07-15T01:01:09,lmao im so going to be watching this movie .,2,0,Siobhan Berry,G9-VHtJvPNs,0.6,2016-07-15 01:01:09,True,True
2016-07-15T01:02:30,Fousy tube,0,0,Jode Nunez,G9-VHtJvPNs,0.0,2016-07-15 01:02:30,True,True
2016-07-15T01:02:35,"literally...the WORST. shout out to Jimmy, though.",0,0,Soiled Cinder,G9-VHtJvPNs,-1.0,2016-07-15 01:02:35,True,True
2016-07-15T01:03:12,"FouseyTUBE got me here, this movie gon be maaaad guuuud!",1,0,Faisal Rashed,G9-VHtJvPNs,0.0,2016-07-15 01:03:12,True,True
2016-07-15T01:03:41,Everytime a madea movie comes out its makes me smile cause I just wanna see how far they will go,1,0,LordZilla,G9-VHtJvPNs,0.2,2016-07-15 01:03:41,True,True
2016-07-15T01:04:20,Where my real BRUH BRUHS AT ?!!!!!!!!!,3,0,GAINZ !,G9-VHtJvPNs,1.0,2016-07-15 01:04:20,True,True
2016-07-15T01:04:29,Token stop giving him money!,0,0,Neal,G9-VHtJvPNs,0.0,2016-07-15 01:04:29,True,True
2016-07-15T01:04:38,not this shit again. cost 50 million to make. it will gross 200 million. then they will make another one :(,0,0,Mike Adams,G9-VHtJvPNs,-0.31666666666666665,2016-07-15 01:04:38,True,True
2016-07-15T01:05:13,Fousey👌🏼👌🏼👌🏼👌🏼👌🏼,0,0,Joe Smith,G9-VHtJvPNs,0.0,2016-07-15 01:05:13,True,True
2016-07-15T01:05:22,brad and broefessor 👍💪,1,0,Amar Zukanovic,G9-VHtJvPNs,0.0,2016-07-15 01:05:22,True,True
2016-07-15T01:05:29,FOUSEYTUBEEEEE,0,0,Jahaira's Lyfe,G9-VHtJvPNs,0.0,2016-07-15 01:05:29,True,True
2016-07-15T01:05:53,Blessing 🐼,0,0,Pedro Castro,G9-VHtJvPNs,0.0,2016-07-15 01:05:53,True,True
2016-07-15T01:06:16,Kian & Jc :D :D,0,0,Rosita Santos,G9-VHtJvPNs,1.0,2016-07-15 01:06:16,True,True
2016-07-15T01:06:21,FOUSEYYYYY,2,0,KANUGA,G9-VHtJvPNs,0.0,2016-07-15 01:06:21,True,True
2016-07-15T01:06:27,This is gonna be awesome!!!!,0,0,TMNT FAN,G9-VHtJvPNs,1.0,2016-07-15 01:06:27,True,True
2016-07-15T01:06:36,"Comments Section Overview:  90% ""OMG Fousey"" comments   5% People saying it's going to be bad  2% People saying it might be good  1% Racist jokes about the black community enjoying Tyler Perry movies   1% People complaining about how many Fousey comments there are",89,18,Enoch Hart,G9-VHtJvPNs,0.16666666666666669,2016-07-15 01:06:36,True,True
2016-07-15T01:06:50,uuugh... looks like a shitty B movie with B actors. Nope. dunno who finds this humour funny but myeah.,0,0,konkelkent,G9-VHtJvPNs,0.25,2016-07-15 01:06:50,True,True
2016-07-15T01:07:40,it's lit,0,0,217BLASTA,G9-VHtJvPNs,0.0,2016-07-15 01:07:40,True,True
2016-07-15T01:08:21,lol can't wait to see this,0,0,Abby Richards,G9-VHtJvPNs,0.8,2016-07-15 01:08:21,True,True
2016-07-15T01:08:30,I slammed to this trailer,0,0,Jordan,G9-VHtJvPNs,0.0,2016-07-15 01:08:30,True,True
2016-07-15T01:08:43,Madea ft. shitty youtubers,0,0,Alak,G9-VHtJvPNs,0.0,2016-07-15 01:08:43,True,True
2016-07-15T01:08:44,Looks like shit,0,0,Derek Jacob,G9-VHtJvPNs,-0.2,2016-07-15 01:08:44,True,True
2016-07-15T01:09:33,Fouseytubeeeeeee,0,0,Abdullah,G9-VHtJvPNs,0.0,2016-07-15 01:09:33,True,True
2016-07-15T01:09:34,I'm about ready to kms,0,0,JetJenkins,G9-VHtJvPNs,0.2,2016-07-15 01:09:34,True,True
2016-07-15T01:10:06,Wait so does this mean everyone dies in the end because everyone is black ?! LOL!,9,8,929shooter,G9-VHtJvPNs,0.15972222222222224,2016-07-15 01:10:06,True,True
2016-07-15T01:10:21,who keeps watching these movies!,0,0,bicklenack,G9-VHtJvPNs,0.0,2016-07-15 01:10:21,True,True
2016-07-15T01:10:58,EVERYONE TALKING ABOUT FOUSEY YEAH SURE BUT WHAT ABOUT KIAN AND JC IM CRYING WTF,0,0,yasmeen,G9-VHtJvPNs,-0.06666666666666667,2016-07-15 01:10:58,True,True
2016-07-15T01:12:40,why did they add another old ass lady,0,0,David Cash,G9-VHtJvPNs,0.1,2016-07-15 01:12:40,True,True
2016-07-15T01:12:56,who seen fousey?,84,18,Nnamdi Anunobi,G9-VHtJvPNs,0.0,2016-07-15 01:12:56,True,True
2016-07-15T01:13:19,I like Fousey but this looks terrible...,0,0,Aditya Nagaraj,G9-VHtJvPNs,-1.0,2016-07-15 01:13:19,True,True
2016-07-15T01:13:21,FOUSEY!!!,2,0,Erin Alisse,G9-VHtJvPNs,0.0,2016-07-15 01:13:21,True,True
2016-07-15T01:14:01,This would fit perfectly in the Tropic Thunder trailers. Does look good nonetheless,0,0,L.A. Prodigy,G9-VHtJvPNs,0.6999999999999998,2016-07-15 01:14:01,True,True
2016-07-15T01:14:03,Hell yeah I'm seeing this😂😂😂😂,0,0,bruhhh Lolololol,G9-VHtJvPNs,0.0,2016-07-15 01:14:03,True,True
2016-07-15T01:14:17,"""help me jesus"" is what everyone watching this said",0,0,Sheh B,G9-VHtJvPNs,0.0,2016-07-15 01:14:17,True,True
2016-07-15T01:14:27,"""Excuse me uhhhh may i rake yo leaveess""",0,0,Sock Head,G9-VHtJvPNs,-0.05,2016-07-15 01:14:27,True,True
2016-07-15T01:16:25,YOUSEF YOUSEF YOUSEF YOUSEF,1,0,TDowgson Gaming,G9-VHtJvPNs,0.0,2016-07-15 01:16:25,True,True
2016-07-15T01:18:19,this will probably be the most realistic reactions to these types scenarios ever,0,0,PolkovnikCole,G9-VHtJvPNs,0.3333333333333333,2016-07-15 01:18:19,True,True
2016-07-15T01:19:08,fousey and lizzza! 😁😁😁,0,0,Emma Kettlehone,G9-VHtJvPNs,0.0,2016-07-15 01:19:08,True,True
2016-07-15T01:19:28,fousey! 💪💪💪👌,0,0,Life of JC,G9-VHtJvPNs,0.0,2016-07-15 01:19:28,True,True
2016-07-15T01:19:49,LIZZZZZZZA,0,0,Christian Murphy,G9-VHtJvPNs,0.0,2016-07-15 01:19:49,True,True
2016-07-15T01:20:01,"Madea, tyga, fouseytube all ina movie thats how you know its trash",0,0,xReece2010,G9-VHtJvPNs,0.0,2016-07-15 01:20:01,True,True
2016-07-15T01:20:35,Fousytube?!,0,0,lilmexican 1213,G9-VHtJvPNs,0.0,2016-07-15 01:20:35,True,True
2016-07-15T01:21:16,G O D  C A N T  S A V E  U S  N O W,0,0,Rico Mortis,G9-VHtJvPNs,0.0,2016-07-15 01:21:16,True,True
2016-07-15T01:23:15,OML I can't wait for this movie 😂😂,1,0,Kayla M,G9-VHtJvPNs,0.0,2016-07-15 01:23:15,True,True
2016-07-15T01:23:37,Fousey really?,0,0,A G,G9-VHtJvPNs,0.2,2016-07-15 01:23:37,True,True
2016-07-15T01:23:57,ooo yeah lexy panterra is in the house,0,0,Regina Queen,G9-VHtJvPNs,0.0,2016-07-15 01:23:57,True,True
2016-07-15T01:24:03,bring bruh,0,0,guta badri,G9-VHtJvPNs,0.0,2016-07-15 01:24:03,True,True
2016-07-15T01:24:29,JC and Kian are in this?,0,0,Sk Rates,G9-VHtJvPNs,0.0,2016-07-15 01:24:29,True,True
2016-07-15T01:24:57,Damn Bruh Bruh!!!!,2,0,Big Mac-11,G9-VHtJvPNs,0.0,2016-07-15 01:24:57,True,True
2016-07-15T01:26:02,I cant wait😂😂,0,0,Kealohi Victorine,G9-VHtJvPNs,0.0,2016-07-15 01:26:02,True,True
2016-07-15T01:26:11,Where are the BRUHBRUHS at????🙃,2,0,Jonathan Leon,G9-VHtJvPNs,0.0,2016-07-15 01:26:11,True,True
2016-07-15T01:27:11,Really fousey? This was the movie he kept talking about in his vlogs?,0,0,Hall Network,G9-VHtJvPNs,0.2,2016-07-15 01:27:11,True,True
2016-07-15T01:27:29,I see a lot of laughs bit I don't see the heart felt part. that's the only way my mom will let me see this,0,0,MoFi,G9-VHtJvPNs,0.0,2016-07-15 01:27:29,True,True
2016-07-15T01:27:39,WHERE THE BRUH BRUHS ATTTTT??!?!? LOVE YOU YOUSEF!! BIG INSPIRATION TO ME,0,0,The Tubian,G9-VHtJvPNs,0.390625,2016-07-15 01:27:39,True,True
2016-07-15T01:28:20,"Looks like garbage, just like every other Tyler perry movie",0,0,Jake Bledsoe,G9-VHtJvPNs,-0.125,2016-07-15 01:28:20,True,True
2016-07-15T01:29:08,Press like if you are a bruh bruh #fouseytube,4,0,SPICY,G9-VHtJvPNs,0.0,2016-07-15 01:29:08,True,True
2016-07-15T01:31:06,BRUH BRUH TAKEOVER!,1,0,DdotM16,G9-VHtJvPNs,0.0,2016-07-15 01:31:06,True,True
2016-07-15T01:32:15,"Mommy, please make the bad man stop.",0,0,rurutu M,G9-VHtJvPNs,-0.6999999999999998,2016-07-15 01:32:15,True,True
2016-07-15T01:32:37,FOUSEY!!!!!!!!!!!!!!,0,0,Maverick36,G9-VHtJvPNs,0.0,2016-07-15 01:32:37,True,True
2016-07-15T01:32:39,FOUSEY!!!,0,0,JTS,G9-VHtJvPNs,0.0,2016-07-15 01:32:39,True,True
2016-07-15T01:33:11,Damn. Tyler running out of ideas. Probably filmed this in 2 weeks. Lackluster. I might go see just for fun tho,7,10,Tony Turner,G9-VHtJvPNs,0.3,2016-07-15 01:33:11,True,True
2016-07-15T01:33:22,Fousey 💜,0,0,LMN-Trx !,G9-VHtJvPNs,0.0,2016-07-15 01:33:22,True,True
2016-07-15T01:35:07,I laughed when I saw Tyga.,0,0,Terrance Porter,G9-VHtJvPNs,0.7,2016-07-15 01:35:07,True,True
