timestamp,text,like_count,reply_count,author,trailer_id,sentiment_score,datetime,used_for_model,used_for_visualization
2016-07-15T05:50:39,Fouseytube got me here,0,0,nemo biri,G9-VHtJvPNs,0.0,2016-07-15 05:50:39,True,True
2016-07-15T05:52:10,most people are like Fouseyy and I am like Lizzzaaa,0,0,Kcenya Chr,G9-VHtJvPNs,0.5,2016-07-15 05:52:10,True,True
2016-07-15T05:53:11,I see fousytube a famous youtuber,0,0,James J.,G9-VHtJvPNs,0.5,2016-07-15 05:53:11,True,True
2016-07-15T05:53:16,the movie just got even less anticipated seeing fousey in the trailer...,0,0,AJ Thelwell,G9-VHtJvPNs,-0.16666666666666666,2016-07-15 05:53:16,True,True
2016-07-15T05:53:46,OMG I SAW KIAN AND Jc IM CRYING I CANT WAIT AHHHHHH SO EXCITED,0,0,Tootie,G9-VHtJvPNs,0.0875,2016-07-15 05:53:46,True,True
2016-07-15T05:54:34,Lol closer to what people who do in real life,0,0,Entertainment,G9-VHtJvPNs,0.5,2016-07-15 05:54:34,True,True
2016-07-15T05:55:15,0:23 FousyTube,0,0,German Shepherd,G9-VHtJvPNs,0.0,2016-07-15 05:55:15,True,True
2016-07-15T05:57:29,Mrs hati : MADEA !!!!! MADEA : what the hell wrong with u  helll no help me Jesus help me Jesus  LOL 😂😂😂😂😂😂,0,1,Emerald girl,G9-VHtJvPNs,0.15000000000000002,2016-07-15 05:57:29,True,True
2016-07-15T05:58:12,I love this,0,0,Jean cliff,G9-VHtJvPNs,0.5,2016-07-15 05:58:12,True,True
2016-07-15T05:58:55,DID I SEE KIAN LAWLEY BECAUSE YES,0,0,Adriana Rocale,G9-VHtJvPNs,0.0,2016-07-15 05:58:55,True,True
2016-07-15T05:59:23,"Wait, what's Tyga doing at that party? They looked over 16",0,0,Pittsburgh Mike,G9-VHtJvPNs,0.0,2016-07-15 05:59:23,True,True
2016-07-15T05:59:59,I CANT WAIT,0,0,Ljay,G9-VHtJvPNs,0.0,2016-07-15 05:59:59,True,True
2016-07-15T06:06:39,There Tyler goes again mixing to genres that don't go together but make a very entertaining thing to watch!,0,0,foals compass,G9-VHtJvPNs,0.8125,2016-07-15 06:06:39,True,True
2016-07-15T06:07:29,"the ""monster"" will end up being Tyler Perry's fatherly character or Joe. Razzies are waiting...",0,0,KjfromOC,G9-VHtJvPNs,0.0,2016-07-15 06:07:29,True,True
2016-07-15T06:07:55,Why ain't no one commenting about the fact that Bradley Martin is starring in the movie?... What's the matter with yall!😭💪🏼,0,0,Samer Qaraman,G9-VHtJvPNs,0.0,2016-07-15 06:07:55,True,True
2016-07-15T06:15:18,lizza my love,0,0,Ruxandra,G9-VHtJvPNs,0.5,2016-07-15 06:15:18,True,True
2016-07-15T06:15:39,LIZZA!!!,0,0,Bobbie Herbin,G9-VHtJvPNs,0.0,2016-07-15 06:15:39,True,True
2016-07-15T06:15:43,OMG CAN'T WAIT,0,0,LuckyBawdy,G9-VHtJvPNs,0.0,2016-07-15 06:15:43,True,True
2016-07-15T06:17:27,lol or comment for fousytube,0,0,curious 7,G9-VHtJvPNs,0.8,2016-07-15 06:17:27,True,True
2016-07-15T06:19:52,My boy Fouseytube  been waiting for the trailer now for the movie,0,0,Faizan Channel,G9-VHtJvPNs,0.0,2016-07-15 06:19:52,True,True
2016-07-15T06:26:13,not again,0,0,supaavtr700,G9-VHtJvPNs,0.0,2016-07-15 06:26:13,True,True
2016-07-15T06:27:44,fusy,0,0,Marc Talks Tech,G9-VHtJvPNs,0.0,2016-07-15 06:27:44,True,True
2016-07-15T06:28:14,so far away ahhhhhhhhhhhhh :(,1,0,JNineyy,G9-VHtJvPNs,-0.325,2016-07-15 06:28:14,True,True
2016-07-15T06:29:08,JC and loan are in the movie,0,0,Carnell Flowers,G9-VHtJvPNs,0.0,2016-07-15 06:29:08,True,True
2016-07-15T06:29:18,JC and loan are in the movie,0,0,Carnell Flowers,G9-VHtJvPNs,0.0,2016-07-15 06:29:18,True,True
2016-07-15T06:30:45,yes another one with bella and kian!! also im v proud of jc,0,0,Zuceyne Mecos,G9-VHtJvPNs,0.8,2016-07-15 06:30:45,True,True
2016-07-15T06:31:56,Lexy panterra and lizzak are in this movie,0,0,RamenKing,G9-VHtJvPNs,0.0,2016-07-15 06:31:56,True,True
2016-07-15T06:32:53,fouseytube?,0,0,Ram Jaber,G9-VHtJvPNs,0.0,2016-07-15 06:32:53,True,True
2016-07-15T06:33:24,KIAN AND JC MY BABIES,0,0,Life As Larissa,G9-VHtJvPNs,0.0,2016-07-15 06:33:24,True,True
2016-07-15T06:34:53,im definitely watching this. Madea movies is the only worth watching movie i can watch with my family xD,0,0,aly,G9-VHtJvPNs,0.09999999999999999,2016-07-15 06:34:53,True,True
2016-07-15T06:35:53,Best funny movie of the year 😂😂😂,0,0,Mirna Morales,G9-VHtJvPNs,0.625,2016-07-15 06:35:53,True,True
2016-07-15T06:37:23,it loooks litt,0,0,rudoff smd,G9-VHtJvPNs,0.0,2016-07-15 06:37:23,True,True
2016-07-15T06:38:43,FOUSEEEEYYYYY!!!!!!!,37,9,Emilia Carr,G9-VHtJvPNs,0.0,2016-07-15 06:38:43,True,True
2016-07-15T06:41:49,Fousey sucks 😂,0,0,Antonio Martinez,G9-VHtJvPNs,-0.3,2016-07-15 06:41:49,True,True
2016-07-15T06:42:03,"here,s your girl liiiyza comin at ya",0,0,mohmad Abdallah,G9-VHtJvPNs,0.0,2016-07-15 06:42:03,True,True
2016-07-15T06:42:16,fussy tube...,0,0,Yellow Temperance,G9-VHtJvPNs,0.0,2016-07-15 06:42:16,True,True
2016-07-15T06:42:55,Saw 8 Confirmed!!,0,0,Johnny,G9-VHtJvPNs,0.625,2016-07-15 06:42:55,True,True
2016-07-15T06:44:17,"fousey, bro science, bradley, that big hot guy(known), and life according to jimmy. GODDAMN",0,0,drake ahmed,G9-VHtJvPNs,0.125,2016-07-15 06:44:17,True,True
2016-07-15T06:44:35,I was waiting for another Madea movie for forever,0,0,Kainoa,G9-VHtJvPNs,0.0,2016-07-15 06:44:35,True,True
2016-07-15T06:48:45,who came here from FouseyTUBE,0,0,adLer,G9-VHtJvPNs,0.0,2016-07-15 06:48:45,True,True
2016-07-15T06:49:17,madea and hatty left bamm in the last scene,0,0,Preacherman TV,G9-VHtJvPNs,0.0,2016-07-15 06:49:17,True,True
2016-07-15T06:49:22,"""Alls my life I had to fight"" isn't that a verse from Kendrick Lamar?",0,0,3 incher,G9-VHtJvPNs,0.0,2016-07-15 06:49:22,True,True
2016-07-15T06:51:02,who else noticed lizza,0,0,Jose G,G9-VHtJvPNs,0.0,2016-07-15 06:51:02,True,True
2016-07-15T06:51:57,FOUSEYYYYYYYYYYYYYYYYYYYYYYYYY,0,0,Sarah Osman,G9-VHtJvPNs,0.0,2016-07-15 06:51:57,True,True
2016-07-15T06:53:03,i saw like so many you tubers like kian and jc,0,0,Chizara Opene,G9-VHtJvPNs,0.5,2016-07-15 06:53:03,True,True
2016-07-15T06:53:37,Come on Tyler...you are BETTER than this!,1,0,Sokka2Me,G9-VHtJvPNs,0.625,2016-07-15 06:53:37,True,True
2016-07-15T06:56:40,And here I thought we were  finally free from these movies.,0,0,Morphic c,G9-VHtJvPNs,0.4,2016-07-15 06:56:40,True,True
2016-07-15T06:57:08,fouseytube,0,0,russian boiii,G9-VHtJvPNs,0.0,2016-07-15 06:57:08,True,True
2016-07-15T06:57:22,This just might be the funniest Madea movie EVER!!!,0,0,Jaryd Weyer,G9-VHtJvPNs,0.0,2016-07-15 06:57:22,True,True
2016-07-15T06:59:45,Damn much money this movie is going to make is going to be scary! 😂 better chip in guys!,0,0,Xenonic2,G9-VHtJvPNs,0.06666666666666667,2016-07-15 06:59:45,True,True
2016-07-15T07:00:10,lol what's with all the viners and youtubers in this movie? ppl in hollywood takin them seriously now or is that just tyler perry trying to be trendy,0,0,android 18 stan,G9-VHtJvPNs,0.35555555555555557,2016-07-15 07:00:10,True,True
2016-07-15T07:02:05,Fousey tube yayyyyyyy👍👍👍😀😀😀😄😄😄,0,0,BeastieGam3r,G9-VHtJvPNs,0.0,2016-07-15 07:02:05,True,True
2016-07-15T07:02:46,lol I love it,0,0,Ally James,G9-VHtJvPNs,0.65,2016-07-15 07:02:46,True,True
2016-07-15T07:04:32,Another crap comedy,0,0,Shitzel,G9-VHtJvPNs,-0.8,2016-07-15 07:04:32,True,True
2016-07-15T07:06:38,this actually seems like the only madea movie I will ever watch but probably won't pay for,0,0,mrniceguy00987,G9-VHtJvPNs,0.0,2016-07-15 07:06:38,True,True
2016-07-15T07:09:24,ITS TIME TO STOP,0,0,DJFaNaTiiC,G9-VHtJvPNs,0.0,2016-07-15 07:09:24,True,True
2016-07-15T07:14:19,Who came here from fousey??,0,0,Zahi Dia,G9-VHtJvPNs,0.0,2016-07-15 07:14:19,True,True
2016-07-15T07:15:14,i can see white people,0,0,Juwan Storey,G9-VHtJvPNs,0.0,2016-07-15 07:15:14,True,True
2016-07-15T07:15:20,Omg jc is in this 😂😁,0,0,stickymicky16,G9-VHtJvPNs,0.0,2016-07-15 07:15:20,True,True
2016-07-15T07:16:08,Yousef,0,0,Itolo Peter Bokalo,G9-VHtJvPNs,0.0,2016-07-15 07:16:08,True,True
2016-07-15T07:16:12,this looks like shit and fousytube doesn't help,0,0,Alex G,G9-VHtJvPNs,-0.2,2016-07-15 07:16:12,True,True
2016-07-15T07:16:39,😂😂😂 how many YouTubers he got in this movie,0,0,mercpool 001,G9-VHtJvPNs,0.5,2016-07-15 07:16:39,True,True
2016-07-15T07:18:57,........and pass!,0,0,Will B,G9-VHtJvPNs,0.0,2016-07-15 07:18:57,True,True
2016-07-15T07:23:46,lizzza is coming out on it yesssssss,0,0,lilstiggy2,G9-VHtJvPNs,0.0,2016-07-15 07:23:46,True,True
2016-07-15T07:28:46,omg! I just fell outta my chair! lmao,0,0,pyro Poulson,G9-VHtJvPNs,0.6,2016-07-15 07:28:46,True,True
2016-07-15T07:29:11,OMG LIZZZZZZZAAAAAAAA AND BELLA THRONE AND FOUSEY TUBE WTH,0,0,lana x beauty,G9-VHtJvPNs,0.0,2016-07-15 07:29:11,True,True
2016-07-15T07:29:28,Who else here for fousey,0,0,SAUCY,G9-VHtJvPNs,0.0,2016-07-15 07:29:28,True,True
2016-07-15T07:31:12,"I don't care if it's garbge, I'm gonna see it",0,0,PartyDude,G9-VHtJvPNs,0.0,2016-07-15 07:31:12,True,True
2016-07-15T07:39:03,This looks like those Eddie Murphy movies. And those were shit,0,0,Sandouras,G9-VHtJvPNs,-0.2,2016-07-15 07:39:03,True,True
2016-07-15T07:39:05,FOUSEYTUBE,0,0,th3KkK,G9-VHtJvPNs,0.0,2016-07-15 07:39:05,True,True
2016-07-15T07:39:30,"This has the potential to lead to something great, or at the very least interesting. Madea really does find zombies in the movie (stick with me here) and the movie ends with the world being infected, society falling. A twist ending that normal view goers wouldn't suspect. The next movie takes place in a post apocalyptic world, Madea still alive but aged and damaged by the end of the world, most of her family died give or take one or two members. The twist at the end of this movie gives the movie controversy and it goes into the news, giving the film makers a motivation to use higher production for the next movie.",0,0,TheTopHatter,G9-VHtJvPNs,0.16749999999999998,2016-07-15 07:39:30,True,True
2016-07-15T07:39:46,OMY GOD FOUSY AND LIZZA'S THERE!!!!!!,0,0,ree,G9-VHtJvPNs,0.0,2016-07-15 07:39:46,True,True
2016-07-15T07:41:08,still going to see it even if it is garbage 💯💯💯,0,0,world peace2,G9-VHtJvPNs,0.0,2016-07-15 07:41:08,True,True
2016-07-15T07:41:39,Fouseytube made a mistake by taking a toll in this movie. I mean he deserves better than a pg13 Halloween movie. Who agrees,2,3,IISummy B,G9-VHtJvPNs,0.09375,2016-07-15 07:41:39,True,True
2016-07-15T07:41:47,wait a minute... is that the same girl from sing it?????!!¿,0,0,Red Truth,G9-VHtJvPNs,0.0,2016-07-15 07:41:47,True,True
2016-07-15T07:41:53,fousey,0,0,Joby O'brien,G9-VHtJvPNs,0.0,2016-07-15 07:41:53,True,True
2016-07-15T07:42:23,and tyga was there 1:51,0,0,Joby O'brien,G9-VHtJvPNs,0.0,2016-07-15 07:42:23,True,True
2016-07-15T07:44:13,Fouseytube!!!!!,0,0,JayDee Crdstry,G9-VHtJvPNs,0.0,2016-07-15 07:44:13,True,True
2016-07-15T07:44:31,our bruh bruh made it  cuz the grind don't stop👊💪💪,0,0,Miruna Maria,G9-VHtJvPNs,0.0,2016-07-15 07:44:31,True,True
2016-07-15T07:45:02,Fousey tube,0,0,Goose,G9-VHtJvPNs,0.0,2016-07-15 07:45:02,True,True
2016-07-15T07:47:17,that last part tho I can't stop laughing 😂😂😂,0,0,Tyreece Porter,G9-VHtJvPNs,0.0,2016-07-15 07:47:17,True,True
2016-07-15T07:51:06,Fousey I seen you,0,0,nick ftw,G9-VHtJvPNs,0.0,2016-07-15 07:51:06,True,True
2016-07-15T07:53:05,0:25 isn't that guy Insta famous?,0,0,Danny Vingot,G9-VHtJvPNs,0.5,2016-07-15 07:53:05,True,True
2016-07-15T08:00:29,Fousey/Kian And Jc,0,0,Devin Lee,G9-VHtJvPNs,0.0,2016-07-15 08:00:29,True,True
2016-07-15T08:04:19,You see fousey like once. We need another trailer👌🏼,0,0,A Man,G9-VHtJvPNs,0.0,2016-07-15 08:04:19,True,True
2016-07-15T08:04:44,fousey wow,0,0,BALOCHI GAMER,G9-VHtJvPNs,0.1,2016-07-15 08:04:44,True,True
2016-07-15T08:06:49,FouseyTube? Movie is gonna be fake.,0,0,Diadlo,G9-VHtJvPNs,-0.5,2016-07-15 08:06:49,True,True
2016-07-15T08:08:30,Movie seems crap,0,0,Kareem Khazal,G9-VHtJvPNs,-0.8,2016-07-15 08:08:30,True,True
2016-07-15T08:08:40,"fouseyTUBE, lizzza,",0,0,NateSoNasty 2x,G9-VHtJvPNs,0.0,2016-07-15 08:08:40,True,True
2016-07-15T08:09:48,FOUSEY!!!,0,0,Renaldo Pandaleke,G9-VHtJvPNs,0.0,2016-07-15 08:09:48,True,True
2016-07-15T08:16:06,"i sense lot of ""DRAMA""",0,0,A Nara,G9-VHtJvPNs,0.0,2016-07-15 08:16:06,True,True
2016-07-15T08:17:48,"Lmaooo, this movie gone be so trash but I still gotta see this shit.",0,0,Zgamer7,G9-VHtJvPNs,-0.2,2016-07-15 08:17:48,True,True
2016-07-15T08:20:14,I CANTTTTT!!!! MADEA is seriously my most FAVOURITE movie franchise ever!!!! always super funny and made me ease my stress.. this upcoming one looks too funny too!!,0,0,Christopher Keroro,G9-VHtJvPNs,0.4934895833333333,2016-07-15 08:20:14,True,True
2016-07-15T08:22:41,Still better then the new ghostbusters,0,0,H Junior,G9-VHtJvPNs,0.3181818181818182,2016-07-15 08:22:41,True,True
2016-07-15T08:22:48,lame,0,0,Marshall K Johnson,G9-VHtJvPNs,-0.5,2016-07-15 08:22:48,True,True
2016-07-15T08:24:03,I lov3 it,0,0,Ivony Muka,G9-VHtJvPNs,0.0,2016-07-15 08:24:03,True,True
2016-07-15T08:26:52,OUR  BRUH BRUH MADE IT😊😊😊😊😊😊😊😆😆😆😆😆😆😃😃😃😃😃😃,0,0,Sara Khaireddin,G9-VHtJvPNs,0.0,2016-07-15 08:26:52,True,True
2016-07-15T08:33:24,DOF,0,0,Katelyn Gallagher,G9-VHtJvPNs,0.0,2016-07-15 08:33:24,True,True
2016-07-15T08:35:18,cant wait,0,0,nazz nin,G9-VHtJvPNs,0.0,2016-07-15 08:35:18,True,True
2016-07-15T08:37:45,Who came here to see fousey?,0,0,NootNoot De PineAppoe,G9-VHtJvPNs,0.0,2016-07-15 08:37:45,True,True
2016-07-15T08:38:21,LIZZAAAAAA,0,0,Fatma Ahmed,G9-VHtJvPNs,0.0,2016-07-15 08:38:21,True,True
2016-07-15T08:39:50,FOUSEY TUBE OMG,0,0,TWISTED teepi1,G9-VHtJvPNs,0.0,2016-07-15 08:39:50,True,True
2016-07-15T08:42:43,Y'all need to understand the purpose of this movie. It's all about madea. It ain't about just the youtubers,0,0,ThatGirl808,G9-VHtJvPNs,0.0,2016-07-15 08:42:43,True,True
2016-07-15T08:46:30,Dislike because FouseyTube is in t.,0,0,Chubs,G9-VHtJvPNs,0.0,2016-07-15 08:46:30,True,True
2016-07-15T08:46:30,OMG LIZZZA AND FOUSEY WHAT,0,0,Christelle,G9-VHtJvPNs,0.0,2016-07-15 08:46:30,True,True
2016-07-15T08:52:16,OMG WHO ELSE SAW LIZA!!!!!,0,0,Adrians,G9-VHtJvPNs,0.0,2016-07-15 08:52:16,True,True
2016-07-15T08:54:51,why does tyler perry still do this,0,0,Usainball,G9-VHtJvPNs,0.0,2016-07-15 08:54:51,True,True
2016-07-15T08:56:32,Lizzzzaaaaa !!,0,0,aseri,G9-VHtJvPNs,0.0,2016-07-15 08:56:32,True,True
2016-07-15T08:58:14,Yeah! l love Tyler Perry's Madea,0,0,Renald Music,G9-VHtJvPNs,0.5,2016-07-15 08:58:14,True,True
2016-07-15T09:00:46,Oh shit Fousey Tube XD,0,0,Madness,G9-VHtJvPNs,-0.2,2016-07-15 09:00:46,True,True
2016-07-15T09:05:18,this looks like shit tbh...,0,0,DeniBoo,G9-VHtJvPNs,-0.2,2016-07-15 09:05:18,True,True
2016-07-15T09:06:00,BRUH BRUH WHERE U AT?,0,0,Karre zaz,G9-VHtJvPNs,0.0,2016-07-15 09:06:00,True,True
2016-07-15T09:06:53,The teaser made me excited  This didn't,0,0,Ali With The Hookup,G9-VHtJvPNs,0.375,2016-07-15 09:06:53,True,True
2016-07-15T09:11:11,im not surprised to see tyga at a high school dance party always hanging with the kids,140,11,Darren Antonio,G9-VHtJvPNs,0.055,2016-07-15 09:11:11,True,True
2016-07-15T09:12:51,omg! yes! Tyler Perry is the best !,0,0,Me'Brian Williams,G9-VHtJvPNs,1.0,2016-07-15 09:12:51,True,True
2016-07-15T09:23:32,Or bruh bruh made it,0,0,Zack Franco,G9-VHtJvPNs,0.0,2016-07-15 09:23:32,True,True
2016-07-15T09:24:35,fouseeeey,0,0,Noura Mehairbi,G9-VHtJvPNs,0.0,2016-07-15 09:24:35,True,True
2016-07-15T09:25:08,Fousey! Hell yeah,0,0,Nikolas Lopes,G9-VHtJvPNs,0.0,2016-07-15 09:25:08,True,True
2016-07-15T09:26:55,Our bruh bruh made it,0,0,Alexander Rydell-Wehlenfeld,G9-VHtJvPNs,0.0,2016-07-15 09:26:55,True,True
2016-07-15T09:33:28,what is wrong with this man,1,0,Steven M,G9-VHtJvPNs,-0.5,2016-07-15 09:33:28,True,True
2016-07-15T09:36:47,@fouseytube love the movie hahaha,0,0,Daniel Tillz,G9-VHtJvPNs,0.35,2016-07-15 09:36:47,True,True
2016-07-15T09:44:51,0:23 bruh is that fousey? o.O,0,0,Laurentiu Stavarache,G9-VHtJvPNs,0.05,2016-07-15 09:44:51,True,True
2016-07-15T09:45:24,our  bruh bruh did it!!!!!! because dat stooopppppp!!!!!! bbbbboooooooyyyyyyy!!!!!!,0,0,shakeeltv,G9-VHtJvPNs,0.0,2016-07-15 09:45:24,True,True
2016-07-15T09:47:42,who saw lizza? i did hahaha.,0,0,shakeeltv,G9-VHtJvPNs,0.2,2016-07-15 09:47:42,True,True
2016-07-15T09:48:20,"HELL YEAH YOUSEF ILY MY BOY GOOD SHIT G, KEEP IT UP",0,0,AntSkrt,G9-VHtJvPNs,0.24999999999999997,2016-07-15 09:48:20,True,True
2016-07-15T09:50:52,that's my bruh bruh❤❤❤❤❤❤❤,0,0,Abdullah Hamany,G9-VHtJvPNs,0.0,2016-07-15 09:50:52,True,True
2016-07-15T09:52:02,Any Bruh Bruhs here???,0,0,MotoExtremeTV,G9-VHtJvPNs,0.0,2016-07-15 09:52:02,True,True
2016-07-15T09:53:37,Bruh #DOF,0,0,Faizan Khan,G9-VHtJvPNs,0.0,2016-07-15 09:53:37,True,True
2016-07-15T09:56:14,boooo,0,0,Kenny Smith,G9-VHtJvPNs,0.0,2016-07-15 09:56:14,True,True
2016-07-15T09:56:17,"This movie looks so bad, Marlon Wayans should be in it...!",0,0,Dennis Littau,G9-VHtJvPNs,-0.8749999999999998,2016-07-15 09:56:17,True,True
2016-07-15T09:56:18,OMG WHEN I SAW KIAN AND JC,0,0,Sofia Sonja,G9-VHtJvPNs,0.0,2016-07-15 09:56:18,True,True
2016-07-15T10:02:58,BRADLEY MARTIN LOL NICE,0,0,kevin bryan,G9-VHtJvPNs,0.7,2016-07-15 10:02:58,True,True
2016-07-15T10:05:55,I can't wait to see it and have a good time and laugh for get about my problems after all. its comedy😂😂😂😂😂😂😂😂,0,0,Sanjauna Gonzales,G9-VHtJvPNs,0.5,2016-07-15 10:05:55,True,True
2016-07-15T10:06:17,2:16 that zombie flip.,2,1,CammieLime,G9-VHtJvPNs,0.0,2016-07-15 10:06:17,True,True
2016-07-15T10:06:33,not watching,0,0,Zsmo0th,G9-VHtJvPNs,0.0,2016-07-15 10:06:33,True,True
2016-07-15T10:06:58,Finally!!! I was wondering when Tyler Perry would make another Madea movie!!,1,0,Harold Thompson,G9-VHtJvPNs,0.0,2016-07-15 10:06:58,True,True
2016-07-15T10:08:32,BMFIT😎,0,0,James Contreras,G9-VHtJvPNs,0.0,2016-07-15 10:08:32,True,True
2016-07-15T10:10:25,Bruh fouseytube part even ain't that long and he is getting proper hyped,0,0,swace,G9-VHtJvPNs,-0.025,2016-07-15 10:10:25,True,True
2016-07-15T10:13:47,"Why fouseytube tho  he can't act ,so many talented actor in LA yet u choice fouseytube fuckin YouTube",0,0,swace,G9-VHtJvPNs,0.6,2016-07-15 10:13:47,True,True
2016-07-15T10:18:09,lmao I hate scary movies so if this comes out around october this will be the only movie Halloween related I will watch lmao,0,0,sebastian salamanca,G9-VHtJvPNs,-0.01666666666666668,2016-07-15 10:18:09,True,True
2016-07-15T10:18:58,Bruh Bruh FOUSEY made it!!!! congrats to FOUSEY/Yousef 👏👏👏👏👍👍👍,1,0,SouthSideNigga,G9-VHtJvPNs,0.0,2016-07-15 10:18:58,True,True
2016-07-15T10:27:15,#MakeYoutubeGreatAgain,0,0,Ultimate Storm,G9-VHtJvPNs,0.0,2016-07-15 10:27:15,True,True
2016-07-15T10:27:30,lizza,0,0,Moon Face,G9-VHtJvPNs,0.0,2016-07-15 10:27:30,True,True
2016-07-15T10:27:57,0:24!! Lmao Bruh Bruh,0,0,Ultimate Storm,G9-VHtJvPNs,0.6,2016-07-15 10:27:57,True,True
2016-07-15T10:28:47,omg it's fousey tube,0,0,David Vargas,G9-VHtJvPNs,0.0,2016-07-15 10:28:47,True,True
2016-07-15T10:32:51,BOO indeed.,0,0,Damjan Plamenac,G9-VHtJvPNs,0.0,2016-07-15 10:32:51,True,True
2016-07-15T10:32:56,YOOOOO THAT'S FOUSEYTUBE!!!!!!,0,0,Shane Fuller,G9-VHtJvPNs,0.0,2016-07-15 10:32:56,True,True
2016-07-15T10:37:15,Who came here for FOUSEY,0,0,DJ LoccVex,G9-VHtJvPNs,0.0,2016-07-15 10:37:15,True,True
2016-07-15T10:38:11,Smart move. Having a bunch of youtubers and social media 'stars' that will sell the movie to their followers.,0,0,187cosa,G9-VHtJvPNs,0.1238095238095238,2016-07-15 10:38:11,True,True
2016-07-15T10:39:07,Haven't you done enough ?,0,0,cool ass corncob,G9-VHtJvPNs,0.0,2016-07-15 10:39:07,True,True
2016-07-15T10:40:22,Youtubers in a movie automatically makes it trashy,0,0,g,G9-VHtJvPNs,0.0,2016-07-15 10:40:22,True,True
2016-07-15T10:42:51,HAHAHA BLACK GUY DRESSED AS A FAT OLD LADY SO FUNNY!!! HAHAHAHAHHA,0,0,g,G9-VHtJvPNs,0.15540364583333333,2016-07-15 10:42:51,True,True
2016-07-15T10:43:14,wtf happened to movies man,0,0,Chris Alba,G9-VHtJvPNs,-0.5,2016-07-15 10:43:14,True,True
2016-07-15T10:46:29,y'all talking bout fousey how bout Lizza?,1,0,Senay Negasi,G9-VHtJvPNs,0.0,2016-07-15 10:46:29,True,True
2016-07-15T10:53:21,my bruh bruh is becoming a movie star 🌟,0,0,zac scurles,G9-VHtJvPNs,0.45,2016-07-15 10:53:21,True,True
2016-07-15T10:58:40,this is Brutal,0,0,600firefly1,G9-VHtJvPNs,-0.875,2016-07-15 10:58:40,True,True
2016-07-15T11:06:15,lizza,0,0,Ibrittney xx,G9-VHtJvPNs,0.0,2016-07-15 11:06:15,True,True
2016-07-15T11:12:30,Liza Koshy,0,0,kirara,G9-VHtJvPNs,0.0,2016-07-15 11:12:30,True,True
2016-07-15T11:12:52,Who came here from fousy,0,0,areeba qazi,G9-VHtJvPNs,0.0,2016-07-15 11:12:52,True,True
2016-07-15T11:14:17,Thought that this was gonna be a funny movie but then I saw fouseytube,0,0,Chang Changy,G9-VHtJvPNs,0.25,2016-07-15 11:14:17,True,True
2016-07-15T11:16:52,I cannot wait for this movie 😂😂😂,0,0,Ciara_monksxx,G9-VHtJvPNs,0.0,2016-07-15 11:16:52,True,True
2016-07-15T11:17:13,looks like a funny movie,0,0,Ginters Ķelps,G9-VHtJvPNs,0.25,2016-07-15 11:17:13,True,True
2016-07-15T11:17:38,Omg kian and jc aaaaaaaa can't wait for his,0,0,Ciara_monksxx,G9-VHtJvPNs,0.0,2016-07-15 11:17:38,True,True
2016-07-15T11:18:58,I can believe a youtuber is going to be here,0,0,Iryna Mak,G9-VHtJvPNs,0.0,2016-07-15 11:18:58,True,True
2016-07-15T11:21:39,"OMG Liza, Fousey and Brock O'hurn. This movie is full of famous people from social media and YouTube.😃",0,0,danielle,G9-VHtJvPNs,0.29444444444444445,2016-07-15 11:21:39,True,True
2016-07-15T11:25:14,Stop,0,0,Mutale Malama,G9-VHtJvPNs,0.0,2016-07-15 11:25:14,True,True
2016-07-15T11:25:29,Liza!,0,0,Talia Enoch,G9-VHtJvPNs,0.0,2016-07-15 11:25:29,True,True
2016-07-15T11:25:37,fake pranks now fake movies lol just kidding true burhburh hereee!! agree?? :D lol XD,0,0,DavidsNoMotoVlogg,G9-VHtJvPNs,0.35781250000000003,2016-07-15 11:25:37,True,True
2016-07-15T11:26:04,bruhhhhh this looks so bad,0,0,pvva,G9-VHtJvPNs,-0.6999999999999998,2016-07-15 11:26:04,True,True
2016-07-15T11:30:46,smh at the zombie doing a damn flip at the end.stupid movie.,0,0,Diego Brown,G9-VHtJvPNs,0.0,2016-07-15 11:30:46,True,True
2016-07-15T11:30:57,Lizza,0,0,Singer-dance Dance/sing123,G9-VHtJvPNs,0.0,2016-07-15 11:30:57,True,True
2016-07-15T11:32:08,Ayy Fousey!!,0,0,Kalie Edwards,G9-VHtJvPNs,0.0,2016-07-15 11:32:08,True,True
2016-07-15T11:34:16,yeS Kian and jc,0,0,Olivia Jelich,G9-VHtJvPNs,0.0,2016-07-15 11:34:16,True,True
2016-07-15T11:40:00,LIZA KOSHY AND FOUSEY  LOOOOOOOOOOOOOOOL,0,0,FirdawsyJR,G9-VHtJvPNs,0.0,2016-07-15 11:40:00,True,True
2016-07-15T11:40:43,Who are the other YTs other than Fousey?,0,0,Irfan Danial,G9-VHtJvPNs,-0.125,2016-07-15 11:40:43,True,True
2016-07-15T11:42:14,WOOW hahaha i can't wait to see it !!,0,0,Rania. B,G9-VHtJvPNs,0.3125,2016-07-15 11:42:14,True,True
2016-07-15T11:42:33,ITS LIT,0,0,Jason2x,G9-VHtJvPNs,0.0,2016-07-15 11:42:33,True,True
2016-07-15T11:43:06,Fouseytube <3,0,0,WavyxJulissa,G9-VHtJvPNs,1.0,2016-07-15 11:43:06,True,True
2016-07-15T11:43:30,For once Tyler perry I might see this,0,0,LTG,G9-VHtJvPNs,0.0,2016-07-15 11:43:30,True,True
2016-07-15T11:50:27,I even saw brock (the man the girls like cause of his man bun) lol get outtaaaa here,0,0,Natasha De'Sirae,G9-VHtJvPNs,0.8,2016-07-15 11:50:27,True,True
2016-07-15T11:55:50,Only watching for Kian and Jc,0,0,Joshifer Everlark,G9-VHtJvPNs,0.0,2016-07-15 11:55:50,True,True
2016-07-15T11:57:11,Fousey is such a shit actor lmao,0,0,N.A.,G9-VHtJvPNs,0.13333333333333333,2016-07-15 11:57:11,True,True
2016-07-15T11:59:12,LIZZZAAAAAA,0,0,Anisya D,G9-VHtJvPNs,0.0,2016-07-15 11:59:12,True,True
2016-07-15T12:02:27,Name of the girl twerking?? It looks familiar.,0,3,"Berlin, Deutschland",G9-VHtJvPNs,0.375,2016-07-15 12:02:27,True,True
2016-07-15T12:07:55,fousy,0,0,Ulises Horta,G9-VHtJvPNs,0.0,2016-07-15 12:07:55,True,True
2016-07-15T12:13:22,lol😂😂😂,0,0,Aaliyah Lowe,G9-VHtJvPNs,0.0,2016-07-15 12:13:22,True,True
2016-07-15T12:13:57,Fousey if you see this smile,0,0,Squishy Squishy,G9-VHtJvPNs,0.3,2016-07-15 12:13:57,True,True
2016-07-15T12:14:18,1:51 Tyga?,0,0,ntsika novoyi,G9-VHtJvPNs,0.0,2016-07-15 12:14:18,True,True
2016-07-15T12:20:41,Tyler Perry setting back black people another 100 years. Absolute garage ... Definitely gonna watch it tho,0,0,Brendan Pramjee,G9-VHtJvPNs,0.008333333333333338,2016-07-15 12:20:41,True,True
2016-07-15T12:21:27,im gonna see this for Fousey. I bet next up is Madea in space,0,0,Wrath Lifts,G9-VHtJvPNs,0.0,2016-07-15 12:21:27,True,True
2016-07-15T12:30:06,where the bruh bruhs at ??,0,0,P2020,G9-VHtJvPNs,0.0,2016-07-15 12:30:06,True,True
2016-07-15T12:31:17,BRUH BRUHHSS!!,0,0,Samurai Rain,G9-VHtJvPNs,0.0,2016-07-15 12:31:17,True,True
2016-07-15T12:31:22,kian and JC 👌,0,0,Alicia Zerf,G9-VHtJvPNs,0.0,2016-07-15 12:31:22,True,True
2016-07-15T12:31:22,"I thought Tyler perry was going in a good direction he made that movie with Ben affleck, really good movie,then he makes this... Bruh",0,0,Jeremy Borrero,G9-VHtJvPNs,0.7,2016-07-15 12:31:22,True,True
2016-07-15T12:32:17,was that Liza?,0,0,Sal Jr,G9-VHtJvPNs,0.0,2016-07-15 12:32:17,True,True
2016-07-15T12:35:24,MY bruh lookin Guuuud,0,0,Oudi Ahmed,G9-VHtJvPNs,0.0,2016-07-15 12:35:24,True,True
2016-07-15T12:38:29,Lizza !!!,24,1,Come again for big phudge,G9-VHtJvPNs,0.0,2016-07-15 12:38:29,True,True
2016-07-15T12:38:42,lIZZZAA???,0,0,MyGonLily,G9-VHtJvPNs,0.0,2016-07-15 12:38:42,True,True
2016-07-15T12:38:58,Fousey is not the main character ???????,0,0,Advicez Aj,G9-VHtJvPNs,0.16666666666666666,2016-07-15 12:38:58,True,True
2016-07-15T12:45:19,was the Diamond White,0,0,Shi Labray,G9-VHtJvPNs,0.0,2016-07-15 12:45:19,True,True
2016-07-15T12:47:36,FOUSEYYYYYYYYYYYY,0,0,t800,G9-VHtJvPNs,0.0,2016-07-15 12:47:36,True,True
2016-07-15T12:50:58,This comment section is going to be filled with who came from Lizzza and who came from fousey,0,0,Jayden Geathers,G9-VHtJvPNs,0.4,2016-07-15 12:50:58,True,True
2016-07-15T12:52:07,Mousey loooooooooking  fresh reply if you are a bruh bruh,0,0,Gabriel Costa,G9-VHtJvPNs,0.3,2016-07-15 12:52:07,True,True
2016-07-15T12:58:28,IT'S TIME TO STOP!,0,0,PlayStatiowned,G9-VHtJvPNs,0.0,2016-07-15 12:58:28,True,True
