timestamp,text,like_count,reply_count,author,trailer_id,sentiment_score,datetime,used_for_model,used_for_visualization
2016-07-16T13:49:25,WOW!!! can wait to see  when Tyler Perry releases Medea goes to the Moon! -_______-,0,0,darryl onacloud,G9-VHtJvPNs,0.244140625,2016-07-16 13:49:25,True,True
2016-07-16T14:25:37,what month is it,0,0,kevin pehlivan,G9-VHtJvPNs,0.0,2016-07-16 14:25:37,True,True
2016-07-16T14:25:45,Whyyyy. I thought we were done with these 😭😭,0,0,M Olivier,G9-VHtJvPNs,0.0,2016-07-16 14:25:45,True,True
2016-07-16T14:31:20,pfff,0,0,Houssam Nekkaa,G9-VHtJvPNs,0.0,2016-07-16 14:31:20,True,True
2016-07-16T14:46:27,"eddie murphy did all this why this guy want to be in a dress "" i wanna be i wannna be like",0,0,Robert Brass,G9-VHtJvPNs,0.0,2016-07-16 14:46:27,True,True
2016-07-16T15:23:57,"OMG! KIAN, JC, AND LIZZA OMFGG OMGG I WANNA WATCH THIS ALREADY",0,0,cherubcinemas,G9-VHtJvPNs,0.0,2016-07-16 15:23:57,True,True
2016-07-16T17:17:11,1:17 that's so racist if white people say that oh man !!!,0,0,YTU,G9-VHtJvPNs,0.0,2016-07-16 17:17:11,True,True
2016-07-16T17:24:41,bradley martyn😌,0,0,nando 1337,G9-VHtJvPNs,0.0,2016-07-16 17:24:41,True,True
2016-07-16T17:41:03,I saա lizzza,0,0,Nicaylia Edwards,G9-VHtJvPNs,0.0,2016-07-16 17:41:03,True,True
2016-07-16T18:02:05,OMG i can't wait i love madea and plus they got my girls bella thorne and is than lizza that youtuber,0,0,Linda James,G9-VHtJvPNs,0.5,2016-07-16 18:02:05,True,True
2016-07-16T18:05:15,wait was Madea actually calling on Jesus!! Dwl,0,0,Krissy J-Hall,G9-VHtJvPNs,0.0,2016-07-16 18:05:15,True,True
2016-07-16T18:07:29,"Omg Lizza in this movie too, oh I'm so going to see this",0,0,Derek Sumner,G9-VHtJvPNs,0.0,2016-07-16 18:07:29,True,True
2016-07-16T18:09:56,Yes yes yes Halleluja,0,0,roberto Jorge solis conzales,G9-VHtJvPNs,0.0,2016-07-16 18:09:56,True,True
2016-07-16T18:09:59,Tyler Perry. You were in Gone Girl. Why do you still make this shit.,1,0,Jack Moore,G9-VHtJvPNs,-0.2,2016-07-16 18:09:59,True,True
2016-07-16T18:18:12,aye FousyTube and Kian Lawley,0,0,Morgan Peebles,G9-VHtJvPNs,0.0,2016-07-16 18:18:12,True,True
2016-07-16T18:21:11,Lol I thought this was a legit horror movie 😂😂,0,0,semarieyah,G9-VHtJvPNs,0.8,2016-07-16 18:21:11,True,True
2016-07-16T18:22:01,the old madea movies are the only good ones wtf is this shite,0,0,Micheal Style,G9-VHtJvPNs,0.07499999999999998,2016-07-16 18:22:01,True,True
2016-07-16T18:29:21,I don't even know what to think of this.....,0,0,Sabriya Parves,G9-VHtJvPNs,0.0,2016-07-16 18:29:21,True,True
2016-07-16T18:57:35,Some people in these comments need to understand that Tyler perry isn't trying to get an Oscar for these performances. He just trying to make people laugh even though it might be corny it's just to make people have a laugh it's not like he trying to win best picture for it. Most of the Tyler Perry movies are supposed comedies but they also have a message that personally to me hits home. I personally enjoy his movies to be honest.,0,0,abcabcabc3100,G9-VHtJvPNs,0.4875,2016-07-16 18:57:35,True,True
2016-07-16T19:14:51,FOUSEY'S IN THIS!!!!! Oh yeh definitely seeing,0,0,Josh Watson,G9-VHtJvPNs,0.0,2016-07-16 19:14:51,True,True
2016-07-16T19:55:09,These movies use to be good and now they just suck,0,5,Damarius Ingram,G9-VHtJvPNs,0.7,2016-07-16 19:55:09,True,True
2016-07-16T20:07:23,GET ALL THESE VINERS AND YOUTUBERS OUT THERE MESSING IT UP,0,0,Faith Solorio,G9-VHtJvPNs,0.0,2016-07-16 20:07:23,True,True
2016-07-16T20:07:59,this movie is gonna be awesome,0,0,Fernando Mikell,G9-VHtJvPNs,1.0,2016-07-16 20:07:59,True,True
2016-07-16T20:25:36,"Can't wait,real funny",0,0,Queen Mongoyo,G9-VHtJvPNs,0.25,2016-07-16 20:25:36,True,True
2016-07-16T20:38:16,2:21 lol,0,0,Honey in the Wild,G9-VHtJvPNs,0.8,2016-07-16 20:38:16,True,True
2016-07-16T20:43:22,this movie trailer just instantly made me a racist.,1,0,DoctorBahnausSee,G9-VHtJvPNs,0.0,2016-07-16 20:43:22,True,True
2016-07-16T20:49:07,Where my bruh bruhs at??! 🔥👌🏼,0,0,Katya Tappan,G9-VHtJvPNs,0.0,2016-07-16 20:49:07,True,True
2016-07-16T20:50:35,😂😂😂😂😂😂,0,0,im a weirdo,G9-VHtJvPNs,0.0,2016-07-16 20:50:35,True,True
2016-07-16T21:01:59,I love Tyler and support him whole heartedly but I don't think I am playing movie theater prices to see this.,0,0,Stayce Blackston,G9-VHtJvPNs,0.35,2016-07-16 21:01:59,True,True
2016-07-16T21:13:38,omg this gonna be hilarious man 😂,0,0,Princess Monnie,G9-VHtJvPNs,0.5,2016-07-16 21:13:38,True,True
2016-07-16T21:25:53,"Omg!!! I thought this was going to be so stupid, but it looks hella funny",0,0,Quentin Bell,G9-VHtJvPNs,-0.27499999999999997,2016-07-16 21:25:53,True,True
2016-07-16T21:27:03,Alright!,0,0,Blake Johnson,G9-VHtJvPNs,0.0,2016-07-16 21:27:03,True,True
2016-07-16T21:46:08,here for liza,0,0,Fatema begum,G9-VHtJvPNs,0.0,2016-07-16 21:46:08,True,True
2016-07-16T21:47:36,Who else here was waiting on this just because lizza was going to be on here,0,0,sy lovesyou,G9-VHtJvPNs,0.0,2016-07-16 21:47:36,True,True
2016-07-16T21:52:30,Oh My Lawd bro that was just too funny,0,0,sy lovesyou,G9-VHtJvPNs,0.25,2016-07-16 21:52:30,True,True
2016-07-16T22:16:02,I died watching  this can't wait till it comes out,0,0,CiAnna Gales,G9-VHtJvPNs,0.0,2016-07-16 22:16:02,True,True
2016-07-16T22:43:42,Cannot wait to see it..but it just seems like I saw the whole movie in just those minutes...,0,0,NBA101NFL4HER,G9-VHtJvPNs,0.2,2016-07-16 22:43:42,True,True
2016-07-16T23:11:22,LIZZA!!!!  CAN U HEAR ME SCREAM!?!?,0,0,Gerard Maurice,G9-VHtJvPNs,0.0,2016-07-16 23:11:22,True,True
2016-07-16T23:14:56,yassss belle thorne in it,0,0,Jordan O’Bannon,G9-VHtJvPNs,0.0,2016-07-16 23:14:56,True,True
2016-07-16T23:19:13,I am done I had tears in my eyes 😂😂😂,0,0,Sadie Caldwell,G9-VHtJvPNs,0.0,2016-07-16 23:19:13,True,True
2016-07-17T00:15:05,Madea is crazy but funny at the same time,0,0,Tyrelle Frazier,G9-VHtJvPNs,-0.11666666666666665,2016-07-17 00:15:05,True,True
2016-07-17T00:21:32,"""What's the worse that could happen? She turns to prostitution, drugs? How you think I met your mama?"" Classic 😂😂😂",0,0,Precious Williams,G9-VHtJvPNs,-0.11666666666666668,2016-07-17 00:21:32,True,True
2016-07-17T00:24:08,Tyler Perry to the rescue!,0,0,MeDiAAiDeM,G9-VHtJvPNs,0.0,2016-07-17 00:24:08,True,True
2016-07-17T00:27:20,DOF fam love ❤❤,0,0,Mariam Harb,G9-VHtJvPNs,0.5,2016-07-17 00:27:20,True,True
2016-07-17T00:28:42,yay kian and jc,0,0,khi monet,G9-VHtJvPNs,0.0,2016-07-17 00:28:42,True,True
2016-07-17T01:04:33,This is going to be funny! omg Kian and Jc is in it,0,0,Joylind J,G9-VHtJvPNs,0.3125,2016-07-17 01:04:33,True,True
2016-07-17T01:11:16,I can't wait to see this,0,0,Ross Young,G9-VHtJvPNs,0.0,2016-07-17 01:11:16,True,True
2016-07-17T01:21:40,I saw fouseytube in the movie,0,0,Toughawesome45 Rblx,G9-VHtJvPNs,0.0,2016-07-17 01:21:40,True,True
2016-07-17T01:27:53,Who's here because if Fousey,0,0,mohammed sohail,G9-VHtJvPNs,0.0,2016-07-17 01:27:53,True,True
2016-07-17T01:27:55,Damnnnnnnnnn Madea ! Back at it again with the good ass movies !,0,0,Jason,G9-VHtJvPNs,0.4375,2016-07-17 01:27:55,True,True
2016-07-17T01:41:05,"1. This is as secular as it gets, so I'm glad he's no longer pretending to be a Christian  and preaching ""Christian values"" 2. I'm still waiting for Madea in Space and Madea saves Christmas!",0,0,2theOmega,G9-VHtJvPNs,0.16666666666666666,2016-07-17 01:41:05,True,True
2016-07-17T01:55:39,she need some CHOCOLATE MILK!!!!!,0,0,Jaden Reyna,G9-VHtJvPNs,0.0,2016-07-17 01:55:39,True,True
2016-07-17T01:58:15,anit no body see madea floatinh,0,0,Daja,G9-VHtJvPNs,0.0,2016-07-17 01:58:15,True,True
2016-07-17T02:39:14,like this funny ass hell,0,0,anna guerrier,G9-VHtJvPNs,0.25,2016-07-17 02:39:14,True,True
2016-07-17T02:49:56,Came here to see fouseytube's part but I blinked and missed it.,7,0,HTC Sellout,G9-VHtJvPNs,0.0,2016-07-17 02:49:56,True,True
2016-07-17T03:09:13,That look hilarious and official!!😂,0,0,JuicyClrox,G9-VHtJvPNs,0.5,2016-07-17 03:09:13,True,True
2016-07-17T03:11:51,YAAAAAS!! Another Madea filmxD,0,0,Ava Topeto,G9-VHtJvPNs,0.0,2016-07-17 03:11:51,True,True
2016-07-17T03:18:55,THIS LOOKS HILARIOUS!!!! And Fousey's in it too..👊😍😍,2,0,Mercy Williams,G9-VHtJvPNs,1.0,2016-07-17 03:18:55,True,True
2016-07-17T04:09:13,I bet fousey in this movie just to prank Madea lol,0,0,Credell Blanch,G9-VHtJvPNs,0.8,2016-07-17 04:09:13,True,True
2016-07-17T04:22:27,I almost died watching this,0,0,Rodriguez Dominique,G9-VHtJvPNs,0.0,2016-07-17 04:22:27,True,True
2016-07-17T04:26:24,so...who's fousey?,0,3,Kiara Davis,G9-VHtJvPNs,0.0,2016-07-17 04:26:24,True,True
2016-07-17T04:29:25,😂😂😂😂ill look for dat,0,0,Maria Mtsmy,G9-VHtJvPNs,0.0,2016-07-17 04:29:25,True,True
2016-07-17T04:31:57,is that lizza,0,0,Audrey M,G9-VHtJvPNs,0.0,2016-07-17 04:31:57,True,True
2016-07-17T04:47:41,what fousey in it !!!!!!! WTF omg,0,0,ambria brown,G9-VHtJvPNs,-0.5,2016-07-17 04:47:41,True,True
2016-07-17T04:53:11,Why would the monsters even try to go after Madea do they want to die again😜😜😜😜😜😜😜😜👻👻👻👻👻👻🎃🎃🎃🎃🎃🎃,4,6,May Flower,G9-VHtJvPNs,0.0,2016-07-17 04:53:11,True,True
2016-07-17T05:38:18,anyone watch Madea? 😃,0,0,R. T. A. 2000,G9-VHtJvPNs,0.0,2016-07-17 05:38:18,True,True
2016-07-17T05:43:18,Wow they have fouseytube,0,0,Tony 2005,G9-VHtJvPNs,0.1,2016-07-17 05:43:18,True,True
2016-07-17T05:46:58,😂😂😂😂😂i'm Died,0,0,Slayin layah,G9-VHtJvPNs,0.0,2016-07-17 05:46:58,True,True
2016-07-17T06:31:57,"When I found out kian and jc was in this movie I was like ""COMPLETED""   Then I saw belle throne I was like ""Oh hell naaaaaaahhhhhhhh",1,0,GÄBBŸ,G9-VHtJvPNs,0.0,2016-07-17 06:31:57,True,True
2016-07-17T06:38:01,I think it's awesome that they have you tubers in this,0,0,Nani,G9-VHtJvPNs,1.0,2016-07-17 06:38:01,True,True
2016-07-17T07:18:38,I've always enjoyed Tyler Perry's films or whatever it's called but why are all these youtubers and vines on here. i mean don't get me wrong I'm proud of them or whatever but I already get enough of that on youtube. oh well,0,0,Evelyn Sanchez,G9-VHtJvPNs,0.0975,2016-07-17 07:18:38,True,True
2016-07-17T07:35:38,big up for Bradley Martyn and Dom,0,0,Goku Ultra,G9-VHtJvPNs,0.0,2016-07-17 07:35:38,True,True
2016-07-17T08:12:31,Liza is in this!!! :),0,0,Holly Heart,G9-VHtJvPNs,0.5,2016-07-17 08:12:31,True,True
2016-07-17T08:28:02,Still better than that Ghostbusters movie.,0,0,HashedBite,G9-VHtJvPNs,0.5,2016-07-17 08:28:02,True,True
2016-07-17T08:32:52,godamn 180 movies n hes still kickin,0,0,Drift,G9-VHtJvPNs,0.0,2016-07-17 08:32:52,True,True
2016-07-17T08:50:02,Fousey tube deserves to be in a shit movie xD,0,0,Jay,G9-VHtJvPNs,-0.2,2016-07-17 08:50:02,True,True
2016-07-17T10:23:16,Pizza and fousey,0,0,AQ,G9-VHtJvPNs,0.0,2016-07-17 10:23:16,True,True
2016-07-17T11:33:44,"If it has a YouTuber in it, you know your wasting time and money on the movie. seriously, this is a pile of crap.",0,0,who knows,G9-VHtJvPNs,-0.5666666666666667,2016-07-17 11:33:44,True,True
2016-07-17T11:34:00,Lizzzzzzzzzzzzzzzzzzzzaaaaaaaaa 😜,0,0,jaja binks,G9-VHtJvPNs,0.0,2016-07-17 11:34:00,True,True
2016-07-17T11:45:15,KnJ,0,0,Erika Ferne,G9-VHtJvPNs,0.0,2016-07-17 11:45:15,True,True
2016-07-17T12:48:56,Kian and jc😇😇😇I CANT WAIT 🤗🤗,0,0,Mariam Saad,G9-VHtJvPNs,0.0,2016-07-17 12:48:56,True,True
2016-07-17T12:57:23,All this movie needs to make it better is the Dolan twins 😂😂,0,0,Mariam Saad,G9-VHtJvPNs,0.5,2016-07-17 12:57:23,True,True
2016-07-17T14:48:57,Creative movie title...,0,0,Fatma Fairooz,G9-VHtJvPNs,0.5,2016-07-17 14:48:57,True,True
2016-07-17T14:51:48,TYGA!!😍,0,0,Realityshow Realness,G9-VHtJvPNs,0.0,2016-07-17 14:51:48,True,True
2016-07-17T15:04:43,Fousey!!!,0,0,Sirvir Dhaliwal,G9-VHtJvPNs,0.0,2016-07-17 15:04:43,True,True
2016-07-17T15:45:03,hell /yes/ this is going to be awesome...,2,0,Vi Fontane,G9-VHtJvPNs,1.0,2016-07-17 15:45:03,True,True
2016-07-17T15:48:14,literally only gonna watch because of brock o' hurn,0,0,Lena Kyony,G9-VHtJvPNs,0.0,2016-07-17 15:48:14,True,True
2016-07-17T16:42:02,I love madea movies!!! So excited to see this one.,0,0,Rose Kahn,G9-VHtJvPNs,0.67578125,2016-07-17 16:42:02,True,True
2016-07-17T17:32:47,I don't care what you heifer say I love the Madea movies do your thing Tyler Perry,0,0,telina yates,G9-VHtJvPNs,0.5,2016-07-17 17:32:47,True,True
2016-07-17T18:03:18,BOX BOY ENT:,0,0,Nate Ford,G9-VHtJvPNs,0.0,2016-07-17 18:03:18,True,True
2016-07-17T19:29:54,"looks like another b rated movie, prob gonna get some good sales bc of fouseytube but the trailer looks like a rip off of so many movies",0,0,Jonathan Leiwakabessy,G9-VHtJvPNs,0.6,2016-07-17 19:29:54,True,True
2016-07-17T19:44:32,Came to see Bradley Martin,0,0,Benny S,G9-VHtJvPNs,0.0,2016-07-17 19:44:32,True,True
2016-07-17T21:52:35,"nope nope nope, don't need another one of these",0,0,Robert Leiper,G9-VHtJvPNs,0.0,2016-07-17 21:52:35,True,True
2016-07-17T22:39:17,I love madea so so much she's beautiful & strong lady even police can not handle her,0,0,tesfaye yared,G9-VHtJvPNs,0.4958333333333333,2016-07-17 22:39:17,True,True
2016-07-18T00:59:07,FOUSEY!!!!,0,0,Cpt. Basic,G9-VHtJvPNs,0.0,2016-07-18 00:59:07,True,True
2016-07-18T01:36:24,This Finna be funny 😂😂😂,0,0,Tywan Mays,G9-VHtJvPNs,0.25,2016-07-18 01:36:24,True,True
2016-07-18T01:55:39,Take the YouTubeers and Viners out of this movie and I might watch it,0,0,MariamWasHere,G9-VHtJvPNs,0.0,2016-07-18 01:55:39,True,True
2016-07-18T02:46:19,fouseytube is gonna be in this movie nope...,0,0,adam lanza,G9-VHtJvPNs,0.0,2016-07-18 02:46:19,True,True
2016-07-18T04:05:53,this is going to be funny,0,0,mckenzie 101,G9-VHtJvPNs,0.25,2016-07-18 04:05:53,True,True
2016-07-18T04:25:39,"Liza, Yousef, Kian, Jc, Bella, Madea...THIS MOVIE IS GONNA BE SICK!!!😱😱😂😂",0,0,merciful karma,G9-VHtJvPNs,0.0,2016-07-18 04:25:39,True,True
2016-07-18T05:43:48,who was here for fousey tube?,0,0,Harry Jordan,G9-VHtJvPNs,0.0,2016-07-18 05:43:48,True,True
2016-07-18T05:54:59,Anyone else see tyga 😂,0,0,Kostas Kouskousakis,G9-VHtJvPNs,0.0,2016-07-18 05:54:59,True,True
2016-07-18T06:25:21,This is bad even for a Tyler perry movie,0,0,goldnstatechild,G9-VHtJvPNs,-0.6999999999999998,2016-07-18 06:25:21,True,True
2016-07-18T07:24:23,LOL!,0,0,ishermanjr,G9-VHtJvPNs,1.0,2016-07-18 07:24:23,True,True
2016-07-18T07:44:52,Most Reboots and sequels are never good. But I hope this will be cause they could've just jammed all the funny parts in this trailer,0,0,Kevin Torres,G9-VHtJvPNs,0.07500000000000001,2016-07-18 07:44:52,True,True
2016-07-18T08:50:53,can't wait for Jeremy Jahns destroy this movie and crush it into pieces,0,0,Kreuzer 00,G9-VHtJvPNs,-0.2,2016-07-18 08:50:53,True,True
2016-07-18T09:07:23,poop,0,0,Michael Björk,G9-VHtJvPNs,0.0,2016-07-18 09:07:23,True,True
2016-07-18T10:09:22,LIZZZZZZA❣❣❣,0,0,Ferdos Ahmed,G9-VHtJvPNs,0.0,2016-07-18 10:09:22,True,True
2016-07-18T11:39:47,GUYS LEXY twerkout is in it!!!! I'm definitely gonna watch this,0,0,This doesn't exist,G9-VHtJvPNs,0.0,2016-07-18 11:39:47,True,True
2016-07-18T13:05:01,JC and kian 😁😁,0,0,Corey Anderson,G9-VHtJvPNs,0.0,2016-07-18 13:05:01,True,True
2016-07-18T14:35:31,YESSSSS FOUSEY IS IN IT!! WOW 😎😉😂,0,0,Janiea Marshall,G9-VHtJvPNs,0.1,2016-07-18 14:35:31,True,True
2016-07-18T14:45:01,hhahahahahhahaaha,0,0,Maame Efya Tenkorang,G9-VHtJvPNs,0.0,2016-07-18 14:45:01,True,True
2016-07-18T14:51:08,who in the hell is fousey?????????? . I've  always liked Tyler Perry and his movies &plays so I'm probably  going to see this one .,0,0,M R,G9-VHtJvPNs,0.6,2016-07-18 14:51:08,True,True
2016-07-18T14:58:29,You can tell how low budget this is just from the trailer. It will flop😴,0,0,Robert,G9-VHtJvPNs,0.0,2016-07-18 14:58:29,True,True
2016-07-18T15:01:36,next movie: madea bombs isis,0,0,Khadra Jamaa,G9-VHtJvPNs,0.0,2016-07-18 15:01:36,True,True
2016-07-18T15:02:35,madea and white grandchildren,0,0,Khadra Jamaa,G9-VHtJvPNs,0.0,2016-07-18 15:02:35,True,True
2016-07-18T15:02:49,so no one else noticed Liza,0,0,J. Anthony,G9-VHtJvPNs,0.0,2016-07-18 15:02:49,True,True
2016-07-18T15:13:42,boy oh boy,0,0,Emma Smith,G9-VHtJvPNs,0.0,2016-07-18 15:13:42,True,True
2016-07-18T15:18:37,bored,0,0,Emma Smith,G9-VHtJvPNs,-0.5,2016-07-18 15:18:37,True,True
2016-07-18T15:25:02,will be watching only for kian and jc 😂,16,3,jessie,G9-VHtJvPNs,0.0,2016-07-18 15:25:02,True,True
2016-07-18T15:35:33,i wanna see that,0,0,Weirdly UniqueBih,G9-VHtJvPNs,0.0,2016-07-18 15:35:33,True,True
2016-07-18T16:43:14,I can't wait !!!!,0,0,LaTyria Wyatt,G9-VHtJvPNs,0.0,2016-07-18 16:43:14,True,True
2016-07-18T16:56:20,(lady doll22) now this is funnie can't wait to see this😂😂😂😂😂😂,0,0,Latricia Poole,G9-VHtJvPNs,0.0,2016-07-18 16:56:20,True,True
2016-07-18T17:09:53,"my boy bradley up in that movie, i gotta see this",0,0,Aaron Gamboa,G9-VHtJvPNs,0.0,2016-07-18 17:09:53,True,True
2016-07-18T17:10:22,and fousey,0,0,Aaron Gamboa,G9-VHtJvPNs,0.0,2016-07-18 17:10:22,True,True
2016-07-18T17:22:50,FOUSEYTUBE,0,0,Milan Driessche,G9-VHtJvPNs,0.0,2016-07-18 17:22:50,True,True
2016-07-18T17:55:57,HELP ME JESUS,0,0,Vũ Bảo Lân,G9-VHtJvPNs,0.0,2016-07-18 17:55:57,True,True
2016-07-18T18:06:55,Tyler Perry movies: my #1 guilty pleasure. 😸,0,0,latina_fangirl,G9-VHtJvPNs,-0.5,2016-07-18 18:06:55,True,True
2016-07-18T18:24:35,was that fousey tube,0,0,Sam,G9-VHtJvPNs,0.0,2016-07-18 18:24:35,True,True
2016-07-18T18:53:41,lol so funny,0,0,Good Boy,G9-VHtJvPNs,0.525,2016-07-18 18:53:41,True,True
2016-07-18T18:58:02,This guy is STILL doing these...? Good god.,0,0,Kershmey Baker,G9-VHtJvPNs,0.7,2016-07-18 18:58:02,True,True
2016-07-18T19:30:29,this looks like shit,0,0,joejohnstone,G9-VHtJvPNs,-0.2,2016-07-18 19:30:29,True,True
2016-07-18T20:58:20,can't wait!! i loves me some madea.,0,0,Blackskye211,G9-VHtJvPNs,0.0,2016-07-18 20:58:20,True,True
2016-07-18T21:03:58,Who are all he Youtubers in this movie?,0,0,Akond27,G9-VHtJvPNs,0.0,2016-07-18 21:03:58,True,True
2016-07-18T21:15:57,YAAASSSSSSS!!!!!! I'm definitely  watching this!! IM SO EXCITEDDDD,0,0,Kayla fuller,G9-VHtJvPNs,0.0,2016-07-18 21:15:57,True,True
2016-07-18T22:50:41,it's a good look,0,0,Paul Thomas,G9-VHtJvPNs,0.7,2016-07-18 22:50:41,True,True
2016-07-18T22:54:26,Lol at the end part,0,0,Johnathan Mitchell,G9-VHtJvPNs,0.8,2016-07-18 22:54:26,True,True
2016-07-18T23:00:42,omg is that brok he is so hott @0:26,0,0,Gemini Land,G9-VHtJvPNs,0.0,2016-07-18 23:00:42,True,True
2016-07-18T23:06:09,liza from liza koshy is in here,0,0,Miesha Swanigan,G9-VHtJvPNs,0.0,2016-07-18 23:06:09,True,True
2016-07-18T23:06:16,Lizza!,0,0,Sam's Jams,G9-VHtJvPNs,0.0,2016-07-18 23:06:16,True,True
2016-07-19T01:14:37,That's Bella Thorne 😍😱,0,0,AKF,G9-VHtJvPNs,0.0,2016-07-19 01:14:37,True,True
2016-07-19T02:03:02,Ayyy Liza,0,0,Daniella Michelle,G9-VHtJvPNs,0.0,2016-07-19 02:03:02,True,True
2016-07-19T02:15:09,I wanna see it,0,0,Farra H.,G9-VHtJvPNs,0.0,2016-07-19 02:15:09,True,True
2016-07-19T02:31:43,"""you see white people""😂😂😂",0,0,Keyra V,G9-VHtJvPNs,0.0,2016-07-19 02:31:43,True,True
2016-07-19T02:36:17,Omg kian Lawley BAE 😭😭😍😍😍😍😍😍😍,26,2,Ayye Nik,G9-VHtJvPNs,0.0,2016-07-19 02:36:17,True,True
2016-07-19T04:09:40,didnt know the biggest douche was gonna be in this movie and be the prankster mastermind controlling the ghost.    *theres even cameras bro*,0,0,dioV,G9-VHtJvPNs,0.0,2016-07-19 04:09:40,True,True
2016-07-19T04:10:02,that gone be so good!!!! got to see,0,0,Dante kay,G9-VHtJvPNs,1.0,2016-07-19 04:10:02,True,True
2016-07-19T04:34:31,I think I just found myself a new guilty pleasure movie,0,0,Leo Esponda Alfano,G9-VHtJvPNs,-0.18181818181818182,2016-07-19 04:34:31,True,True
2016-07-19T05:13:55,😂bro i cant wait!,0,0,Dope- C,G9-VHtJvPNs,0.0,2016-07-19 05:13:55,True,True
2016-07-19T05:17:36,"Oh you've gotta be kidding me with this! They took Madea and put her into a Scary Movie, that's just wrong on so many levels.",0,3,Rush Maverick,G9-VHtJvPNs,-0.16666666666666666,2016-07-19 05:17:36,True,True
2016-07-19T06:04:22,brock o hurn is the only reason ill watch this,0,0,nelson jacinto,G9-VHtJvPNs,-0.25,2016-07-19 06:04:22,True,True
2016-07-19T06:04:48,This looks awesome! I can't wait to see it.,0,0,John Wolf,G9-VHtJvPNs,1.0,2016-07-19 06:04:48,True,True
2016-07-19T06:29:10,Fouseeeeeeeyyyyyyyyyy🤗🤗,0,0,Jody Maier,G9-VHtJvPNs,0.0,2016-07-19 06:29:10,True,True
2016-07-19T07:50:26,Am I the only one who came here from fosey tube lol,17,1,BanMe,G9-VHtJvPNs,0.4,2016-07-19 07:50:26,True,True
2016-07-19T08:42:43,AYE IS YA BOY FOUSEY,0,0,Aurxz EightPercent,G9-VHtJvPNs,0.0,2016-07-19 08:42:43,True,True
2016-07-19T09:09:58,LIZA?!?!?!? Or pizza (the world may never know),0,0,Giraffe,G9-VHtJvPNs,0.0,2016-07-19 09:09:58,True,True
2016-07-19T10:44:19,Omg 23sec isn't the third girl on musical.ly??!!,0,0,Luzann Kitiona,G9-VHtJvPNs,0.0,2016-07-19 10:44:19,True,True
2016-07-19T11:05:56,Why is Tiffany the token black girl in her group of friends? Lol.,10,5,lvrm dxm,G9-VHtJvPNs,0.3166666666666667,2016-07-19 11:05:56,True,True
2016-07-19T14:53:15,LIZAAAAAAAAAAAA!!!!!!!!!!!!!!!!!!!!!!!!!!!!!!!!!!!!!!!!!!!!!!!!!!!!!!!,0,0,Chris Aster,G9-VHtJvPNs,0.0,2016-07-19 14:53:15,True,True
2016-07-19T15:27:20,It was so funny😂 and @lizzakoshy in it. I cant wait to see ot😂😂😊😊✌❤😭,0,0,TOP livesagamergirlz,G9-VHtJvPNs,0.0,2016-07-19 15:27:20,True,True
2016-07-19T20:04:25,Wow great,0,0,The Awesome Cousins,G9-VHtJvPNs,0.45,2016-07-19 20:04:25,True,True
2016-07-19T20:19:46,I SEEN LIZA AND I SEEN JC & KIAN!!!!!!,0,0,fluffy,G9-VHtJvPNs,0.0,2016-07-19 20:19:46,True,True
2016-07-19T21:30:01,Brock my babe is in this,0,0,Jo Stevens,G9-VHtJvPNs,0.0,2016-07-19 21:30:01,True,True
2016-07-19T22:38:58,This is going be funny,1,0,biohazard 780,G9-VHtJvPNs,0.25,2016-07-19 22:38:58,True,True
2016-07-19T22:58:57,lol a must see,0,0,Jessica Jackson,G9-VHtJvPNs,0.8,2016-07-19 22:58:57,True,True
2016-07-19T23:22:27,Lol I want to see this,4,0,TLove T,G9-VHtJvPNs,0.8,2016-07-19 23:22:27,True,True
2016-07-19T23:32:31,Madea gets pregnant madea assassinates donald trump madea buys her first pair of jordans madea goes to sleep madea wakes up madea goes to space madea goes farther out of space madea see jesus madea clips her toenails madea meets fast & furious madea black lives matter,0,0,Supreme KayJay!,G9-VHtJvPNs,0.15416666666666665,2016-07-19 23:32:31,True,True
2016-07-19T23:45:31,Wait so this is real...whhhyyyyyyyy,0,0,Gregory Nelson,G9-VHtJvPNs,0.0,2016-07-19 23:45:31,True,True
2016-07-20T01:30:04,😭😭😭😂😂😂😂😂😂😂😂😂😂😂😂😂😂 I swear i could never watch anything that give me even the slightest chills  buh this i have to see  Madea is back at it again 😂😂😂,0,0,Sarah Adeyemi,G9-VHtJvPNs,0.0,2016-07-20 01:30:04,True,True
2016-07-20T02:00:37,so funny. 😄. 😁. 😀,0,0,Sam Lyles,G9-VHtJvPNs,0.25,2016-07-20 02:00:37,True,True
2016-07-20T02:49:51,lizza is in it 👐👐👐,0,0,Jordan Reyes,G9-VHtJvPNs,0.0,2016-07-20 02:49:51,True,True
2016-07-20T03:17:00,Lizzie!!!,0,0,Estefany Hernandez,G9-VHtJvPNs,0.0,2016-07-20 03:17:00,True,True
2016-07-20T03:46:32,"""You see white people!"" OMFG Lol",0,0,ASAP SULLY,G9-VHtJvPNs,0.4,2016-07-20 03:46:32,True,True
2016-07-20T03:57:37,major lol,0,0,This channel,G9-VHtJvPNs,0.43125,2016-07-20 03:57:37,True,True
2016-07-20T04:05:47,Got to go see this man omg,0,1,Keisha Brown,G9-VHtJvPNs,0.0,2016-07-20 04:05:47,True,True
2016-07-20T04:05:56,fouseytube ruined the movie,0,0,Filia,G9-VHtJvPNs,0.0,2016-07-20 04:05:56,True,True
2016-07-20T04:10:39,everyone freaking out over fousey while im freaking out over Jc and Kian :P,0,0,Kyla Thornton,G9-VHtJvPNs,0.75,2016-07-20 04:10:39,True,True
2016-07-20T04:42:44,I'm gonna have so much fun trolling my friends into thinking I can't wait to see this. LOL,0,0,disarraygun,G9-VHtJvPNs,0.55,2016-07-20 04:42:44,True,True
2016-07-20T05:01:08,I'm only watching this for Mario Rodriguez 😍,0,0,KC,G9-VHtJvPNs,0.0,2016-07-20 05:01:08,True,True
2016-07-20T05:14:22,Can't wait until October!! definitely gonna go see this!,0,0,D Mason,G9-VHtJvPNs,0.0,2016-07-20 05:14:22,True,True
2016-07-20T06:17:24,😂😂😂,0,0,TheOfficialGabrielBarnes,G9-VHtJvPNs,0.0,2016-07-20 06:17:24,True,True
2016-07-20T07:13:41,l love Tyler Perry,0,0,Primrose Primrose,G9-VHtJvPNs,0.5,2016-07-20 07:13:41,True,True
2016-07-20T07:32:43,just what we need...another madea movie😒,0,0,Sammie,G9-VHtJvPNs,0.0,2016-07-20 07:32:43,True,True
2016-07-20T10:19:04,Looks like Halloween Norbit,2,2,Gemma Fearne,G9-VHtJvPNs,0.0,2016-07-20 10:19:04,True,True
2016-07-20T10:24:07,sad to see how fousey did all this drama just to promote his movie,0,0,Aaron DCosta,G9-VHtJvPNs,-0.5,2016-07-20 10:24:07,True,True
2016-07-20T12:14:21,A Man in a Dress is a Woman in Distress!  LOL,0,0,Ron Haskell--ELE of AIR,G9-VHtJvPNs,0.8,2016-07-20 12:14:21,True,True
2016-07-20T15:11:45,im going to go watch this,0,0,James Jones,G9-VHtJvPNs,0.0,2016-07-20 15:11:45,True,True
2016-07-20T15:21:33,"Is the ""tupac of youtube"" seriously in this? That was sarcasm for those who didn't pick that up.",0,0,theSkel,G9-VHtJvPNs,-0.3333333333333333,2016-07-20 15:21:33,True,True
2016-07-20T16:15:09,@2:16 That mf doing flips lol,0,0,Jessika,G9-VHtJvPNs,0.8,2016-07-20 16:15:09,True,True
2016-07-20T17:27:34,lol,0,0,Joseph GONZO,G9-VHtJvPNs,0.8,2016-07-20 17:27:34,True,True
2016-07-20T20:31:27,i have to see this movie is funny as hell i can't stop laughing 😂😂,0,0,James Mincey,G9-VHtJvPNs,0.25,2016-07-20 20:31:27,True,True
2016-07-20T21:11:19,That's Diamond k white : from the xfactor 2012,0,0,Keeping up with Evey,G9-VHtJvPNs,0.0,2016-07-20 21:11:19,True,True
2016-07-20T21:17:52,now that madea is going 2 be funny 2 go 👀,0,0,Joanna Edwards,G9-VHtJvPNs,0.25,2016-07-20 21:17:52,True,True
2016-07-20T21:29:58,only here cuz of lizza,0,0,Lichi Chung,G9-VHtJvPNs,0.0,2016-07-20 21:29:58,True,True
