timestamp,text,like_count,reply_count,author,trailer_id,sentiment_score,datetime,used_for_model,used_for_visualization
2016-08-20T14:24:14,can't wait till it comes out,0,0,Simone Silent,G9-VHtJvPNs,0.0,2016-08-20 14:24:14,True,True
2016-08-21T12:26:04,another stupid madea movie😣,0,0,Elle be 4real,G9-VHtJvPNs,-0.7999999999999999,2016-08-21 12:26:04,True,True
2016-08-21T18:17:08,lol i cant wait too 👀 this i me some madea 😹😹😹😹😹😹😹😹😺😻🙀😽😏😹😹😹😹😹😹😹😹,0,0,Ribea Watson,G9-VHtJvPNs,0.8,2016-08-21 18:17:08,True,True
2016-08-21T21:05:20,Madea is hot...,0,0,Tete Burns,G9-VHtJvPNs,0.25,2016-08-21 21:05:20,True,True
2016-08-22T01:28:45,MY BABIES OMF THE MAIN REASON I WANNA SEE THIS IS BECAUSE OF KIAN AND JC,0,0,_juliarenae_,G9-VHtJvPNs,0.16666666666666666,2016-08-22 01:28:45,True,True
2016-08-22T02:13:20,Kian and Jc!!!!,0,0,Ani Castañeda,G9-VHtJvPNs,0.0,2016-08-22 02:13:20,True,True
2016-08-22T05:30:56,MADEA IS BACK!!!,0,0,Isaiah Daniel,G9-VHtJvPNs,0.0,2016-08-22 05:30:56,True,True
2016-08-22T07:01:36,lex twerkout wtf ???,0,0,DeeGoodLife,G9-VHtJvPNs,-0.5,2016-08-22 07:01:36,True,True
2016-08-22T21:07:47,The should make one about April fools,0,0,Blue Ivy,G9-VHtJvPNs,0.0,2016-08-22 21:07:47,True,True
2016-08-22T22:44:45,Bunch of old ladies running away from ghost. yup!!!,0,0,DeShaun Montez,G9-VHtJvPNs,0.1953125,2016-08-22 22:44:45,True,True
2016-08-22T23:03:13,😂😂😂😂😂😂😂😂😂,0,0,Marisol Melendez,G9-VHtJvPNs,0.0,2016-08-22 23:03:13,True,True
2016-08-22T23:18:59,OH MY GOD LIZA KOSHY!!!!!!!! 💓💗💗,0,0,gabriela,G9-VHtJvPNs,0.0,2016-08-22 23:18:59,True,True
2016-08-22T23:54:32,"Next ""Media runs for president""",8,0,KatyDelMar,G9-VHtJvPNs,0.0,2016-08-22 23:54:32,True,True
2016-08-23T01:01:19,Love the flipping zombie👍🏻,0,0,Brianna Wrubel,G9-VHtJvPNs,0.5,2016-08-23 01:01:19,True,True
2016-08-23T03:58:24,hAHAHAHAHA I SOOOOO WANNA SEE THIS!,0,0,Xipe Totec,G9-VHtJvPNs,0.25,2016-08-23 03:58:24,True,True
2016-08-23T04:32:45,"If a group of zombies are chasing you like WWZ kind, flipping and running about, you better call on Jesus",0,0,Daniel Ragin,G9-VHtJvPNs,0.55,2016-08-23 04:32:45,True,True
2016-08-23T13:18:30,Madea is a dead horse that Perry keeps beating. Diary of a Mad Black Woman and Madea's Family Reunion were great but after that.......yeah.,0,0,Sedd,G9-VHtJvPNs,-0.047916666666666635,2016-08-23 13:18:30,True,True
2016-08-23T18:33:11,youtubers aren't actors 😒🙄🙄,2,0,alexa d,G9-VHtJvPNs,0.0,2016-08-23 18:33:11,True,True
2016-08-24T00:00:06,I'm excited I saw many of these movies,0,0,Blainton Rau,G9-VHtJvPNs,0.4375,2016-08-24 00:00:06,True,True
2016-08-24T19:36:01,Did anybody else see the zombie doing flips while it was chasing them😭💀,0,0,Danielle White,G9-VHtJvPNs,0.0,2016-08-24 19:36:01,True,True
2016-08-24T22:22:00,"""Token, stop giving Tyler Perry money or he won't go away!""",0,0,Matt Thornton,G9-VHtJvPNs,0.0,2016-08-24 22:22:00,True,True
2016-08-25T14:20:49,I've seen all of them,0,0,captainoverload bro,G9-VHtJvPNs,0.0,2016-08-25 14:20:49,True,True
2016-08-25T18:51:28,Help me Jesus help me Jesus help me Jesus 😂,0,0,yoshie8706,G9-VHtJvPNs,0.0,2016-08-25 18:51:28,True,True
2016-08-26T15:53:35,LIZZZZZZAAAAAAAAAA,0,0,Kacey,G9-VHtJvPNs,0.0,2016-08-26 15:53:35,True,True
2016-08-26T20:24:26,"""I used to get dollar bills for that"" 😂",3,0,Mercedes Mcdowell,G9-VHtJvPNs,0.0,2016-08-26 20:24:26,True,True
2016-08-26T20:24:28,"""I used to get dollar bills for that"" 😂",3,0,Mercedes Mcdowell,G9-VHtJvPNs,0.0,2016-08-26 20:24:28,True,True
2016-08-27T17:18:20,man im gonna go see this as soon as it comes out,0,0,k,G9-VHtJvPNs,0.0,2016-08-27 17:18:20,True,True
2016-08-27T19:51:46,Lizza is in this movie! 😍😍😍 +lizzza,0,0,samantha gaitan,G9-VHtJvPNs,0.0,2016-08-27 19:51:46,True,True
2016-08-27T20:01:10,Kian and jc and fousey and tyga.,0,0,Masochistic_Lele,G9-VHtJvPNs,0.0,2016-08-27 20:01:10,True,True
2016-08-28T06:01:34,oh lort...,0,0,Cristina wood,G9-VHtJvPNs,0.0,2016-08-28 06:01:34,True,True
2016-08-28T13:01:35,1:45 that's scarier than anything Halloween could create,0,0,Damon Grimes,G9-VHtJvPNs,0.0,2016-08-28 13:01:35,True,True
2016-08-29T01:14:55,Don't understand why this guy always in a dress dammmmm,0,0,Maxius Glacious,G9-VHtJvPNs,0.0,2016-08-29 01:14:55,True,True
2016-08-29T16:17:00,Madea movies give me life!,0,0,Jessica,G9-VHtJvPNs,0.0,2016-08-29 16:17:00,True,True
2016-08-29T20:56:45,I kind of want to see this it really funny. It reminds me of he original came up with madea in first place,0,0,Ann Defratie,G9-VHtJvPNs,0.36875,2016-08-29 20:56:45,True,True
2016-08-29T22:06:19,I can't freaking wait!!!,0,0,Ace 007,G9-VHtJvPNs,0.0,2016-08-29 22:06:19,True,True
2016-08-30T03:27:32,"<3 <3 :24 Brock O'burn, fucken dream man <3 <3",0,0,Amelia Vazquez,G9-VHtJvPNs,1.0,2016-08-30 03:27:32,True,True
2016-08-30T11:30:57,Lizzza:3<3,0,0,Sabina,G9-VHtJvPNs,0.0,2016-08-30 11:30:57,True,True
2016-08-30T17:39:10,Madea isn't funny anymore please stop making madea movies,0,0,Bri C,G9-VHtJvPNs,0.25,2016-08-30 17:39:10,True,True
2016-08-31T07:03:24,2:01-2:04 wth 😂,0,0,Hello All,G9-VHtJvPNs,0.0,2016-08-31 07:03:24,True,True
2016-08-31T09:57:45,Liza Koshy yessss,0,0,Z & A VLOGS,G9-VHtJvPNs,0.0,2016-08-31 09:57:45,True,True
2016-08-31T20:04:34,Where's Dom/Broscience in this,0,0,Casey O'Rourke,G9-VHtJvPNs,0.0,2016-08-31 20:04:34,True,True
2016-08-31T22:06:36,Liza is in this movie,0,0,Nicole Lee,G9-VHtJvPNs,0.0,2016-08-31 22:06:36,True,True
2016-08-31T22:27:24,Will it be playing at the strawberry hill theater ciniplex ,0,0,Sarah Williams,G9-VHtJvPNs,0.0,2016-08-31 22:27:24,True,True
2016-09-01T02:32:14,I WAS LIKE OML WHEN I SAW FOUSEY,0,0,XenX,G9-VHtJvPNs,0.0,2016-09-01 02:32:14,True,True
2016-09-01T22:15:35,She never gets old😹😹😻,0,0,Keila Washington,G9-VHtJvPNs,0.0,2016-09-01 22:15:35,True,True
2016-09-02T05:09:37,so good the best,0,0,Explore_Visulaize,G9-VHtJvPNs,0.85,2016-09-02 05:09:37,True,True
2016-09-03T02:26:16,Y'all can leave with the hate for Madea movies. If it's not funny to you then why are you here? Bye.,91,5,Desii O,G9-VHtJvPNs,-0.4625,2016-09-03 02:26:16,True,True
2016-09-03T05:52:32,LMAOOOFF I can't wait to see this movie,0,0,Muahh Goldd,G9-VHtJvPNs,0.0,2016-09-03 05:52:32,True,True
2016-09-03T14:27:34,i can't wait to see this :),0,0,V L.,G9-VHtJvPNs,0.5,2016-09-03 14:27:34,True,True
2016-09-05T03:21:14,"Lol this movie looks ridiculous, I bet you the teens just pulled a prank on all of them.",0,0,Brittany Richardson,G9-VHtJvPNs,0.23333333333333336,2016-09-05 03:21:14,True,True
2016-09-06T01:01:52,"Lots of Fouseytube fans, not enough Bradley Martyn Fans, where's the squad at?",0,0,Giojitsu,G9-VHtJvPNs,0.0,2016-09-06 01:01:52,True,True
2016-09-06T01:18:11,I CAME FOR BRADLEY MARTYN #SQUAD,0,0,Future Stein,G9-VHtJvPNs,0.0,2016-09-06 01:18:11,True,True
2016-09-06T02:25:38,"Aye, my boy Bradley Martyn in this lmao. SQUAD!!",0,0,Jose Botello,G9-VHtJvPNs,0.9375,2016-09-06 02:25:38,True,True
2016-09-06T02:38:21,"Oh Wendy Williams is doing Halloween movies now. Good for her. But that crybaby from YouTube, not a good look",0,0,Vio-lent Davis,G9-VHtJvPNs,0.175,2016-09-06 02:38:21,True,True
2016-09-06T22:51:13,two words : bradley martyn,0,0,Abdul Azeez Al Ansari,G9-VHtJvPNs,0.0,2016-09-06 22:51:13,True,True
2016-09-07T15:38:05,must see lol,0,0,resa Kyle,G9-VHtJvPNs,0.8,2016-09-07 15:38:05,True,True
2016-09-07T15:47:09,copying Eddie Murphy :))))))),0,0,garymolnar,G9-VHtJvPNs,0.5,2016-09-07 15:47:09,True,True
2016-09-07T20:07:42,YOU GO LIZA KOSHY!!!.,42,2,tvfan3009,G9-VHtJvPNs,0.0,2016-09-07 20:07:42,True,True
2016-09-07T20:12:24,Anyone else see Liza Koshy?,91,8,Luke Eckstein,G9-VHtJvPNs,0.0,2016-09-07 20:12:24,True,True
2016-09-07T20:33:02,OMG so funny😂😂😂😂,0,0,Foley and Soutas Fangurl,G9-VHtJvPNs,0.0,2016-09-07 20:33:02,True,True
2016-09-08T00:28:41,"I don't understand all you A holes got something negative too say, do watch the movie then, damn but I'm almost certain it will not put a dent in his pockets.",0,0,Stacy Washington,G9-VHtJvPNs,-0.04285714285714286,2016-09-08 00:28:41,True,True
2016-09-08T01:46:01,"I'm putting this movie atop my wish list to watch, lol BUT SERIOUSLY!!!",0,0,niasha beckles,G9-VHtJvPNs,0.07447916666666676,2016-09-08 01:46:01,True,True
2016-09-08T01:54:53,omg its fousey,0,0,christopher holley,G9-VHtJvPNs,0.0,2016-09-08 01:54:53,True,True
2016-09-08T05:08:56,DIsliked it purely because FooseyTubes lame ass is in it.,1,0,BASSic - Bass Boosted Music,G9-VHtJvPNs,-0.1619047619047619,2016-09-08 05:08:56,True,True
2016-09-08T17:46:34,"""You see white people 😨? Lmao",0,0,Davie,G9-VHtJvPNs,0.3,2016-09-08 17:46:34,True,True
2016-09-08T18:58:34,i laughed but i will pass. my fave was madeas family reunion. felt like he put energy into it. after that not so much. he'll continue to do just great financially w/o my support here.,0,0,dee rasta,G9-VHtJvPNs,0.425,2016-09-08 18:58:34,True,True
2016-09-09T03:00:16,lol nice,0,0,ann Brown,G9-VHtJvPNs,0.7,2016-09-09 03:00:16,True,True
2016-09-09T08:52:27,Fouseytube is the reason why I would watch this movie... Hell yeah!,0,0,Ahmed Al Harthi,G9-VHtJvPNs,0.0,2016-09-09 08:52:27,True,True
2016-09-10T16:49:00,whats the age rating for the movie,0,0,ROUTHLESS,G9-VHtJvPNs,0.0,2016-09-10 16:49:00,True,True
2016-09-10T17:53:19,Who came to this from fouseytubes video,0,0,Droid Alpha 61,G9-VHtJvPNs,0.0,2016-09-10 17:53:19,True,True
2016-09-10T18:03:22,Didn't Tyler Perry say would stop being Madea because he wanted to be known for other projects?,0,0,J.R. M,G9-VHtJvPNs,-0.125,2016-09-10 18:03:22,True,True
2016-09-10T21:42:35,lol!!,0,0,ANG3L LOV,G9-VHtJvPNs,1.0,2016-09-10 21:42:35,True,True
2016-09-10T23:03:02,I'm laughing way too hard @ this.,1,0,gluten free bleach,G9-VHtJvPNs,-0.2916666666666667,2016-09-10 23:03:02,True,True
2016-09-11T00:54:38,u got knocked the he'll out,0,0,Jordan Carter,G9-VHtJvPNs,0.0,2016-09-11 00:54:38,True,True
2016-09-11T09:22:23,LIZZZZZAAAA KOSHY ,1,0,Amanda Capstick,G9-VHtJvPNs,0.0,2016-09-11 09:22:23,True,True
2016-09-11T23:01:39,"I was about to say""'Tyler Perry you need to stop""until I watched this trailer. I have got to watch this movie",0,0,Sylvia Gitau,G9-VHtJvPNs,0.0,2016-09-11 23:01:39,True,True
2016-09-12T00:23:33,Liza!!!!!!,0,0,iwannabeaninja12,G9-VHtJvPNs,0.0,2016-09-12 00:23:33,True,True
2016-09-12T00:56:04,I really want to watch this  movie,0,0,St Man,G9-VHtJvPNs,0.2,2016-09-12 00:56:04,True,True
2016-09-12T16:06:16,Did anyone see the guy at the end do a flip,0,0,Lexico & El Oso Blanco,G9-VHtJvPNs,0.0,2016-09-12 16:06:16,True,True
2016-09-12T20:08:08,WHO???WHO??? (leafy fans understand),0,0,Tony Stank,G9-VHtJvPNs,0.0,2016-09-12 20:08:08,True,True
2016-09-13T00:34:49,this is so funny I lost my voice after watching this,0,0,Rossmeity b,G9-VHtJvPNs,0.25,2016-09-13 00:34:49,True,True
2016-09-13T03:26:48,OML I came here cuz I saw that Liza was in dis and I'm for sure going to watch dis 👑💖😂,1,0,Miché Gordon,G9-VHtJvPNs,0.5,2016-09-13 03:26:48,True,True
2016-09-13T16:28:33,who just came here bc of Liza XD I did,0,0,Ayla K,G9-VHtJvPNs,0.0,2016-09-13 16:28:33,True,True
2016-09-14T02:03:12,I spot Kian & Jc !!,1,0,Addy C,G9-VHtJvPNs,0.0,2016-09-14 02:03:12,True,True
2016-09-14T02:11:24,Is it rated R,0,0,Julio Cabello,G9-VHtJvPNs,0.0,2016-09-14 02:11:24,True,True
2016-09-14T07:59:50,America's famous Drag Queen! LMAO the trailer shows the whole movie already!,0,0,Leon Brooks,G9-VHtJvPNs,0.30625,2016-09-14 07:59:50,True,True
2016-09-14T23:42:30,CAN NOT WAIT TO SEE THIS!!!!I LOVEEEEEEEE TYLER PERRY!!!,0,0,MZ NETT,G9-VHtJvPNs,0.0,2016-09-14 23:42:30,True,True
2016-09-15T08:09:53,only here for kian and jc :),0,0,NeaChiX,G9-VHtJvPNs,0.25,2016-09-15 08:09:53,True,True
2016-09-16T00:45:40,Omg liza,0,0,tori Jefferson,G9-VHtJvPNs,0.0,2016-09-16 00:45:40,True,True
2016-09-16T03:46:49,I love his movies,0,0,Katy Sims,G9-VHtJvPNs,0.5,2016-09-16 03:46:49,True,True
2016-09-16T03:48:05,I can't wait to see this,0,0,Katy Sims,G9-VHtJvPNs,0.0,2016-09-16 03:48:05,True,True
2016-09-16T09:58:47,"T.P: Hello madea i'm traveling i was wondering if you can come and keep an eye on Teffiney. Madea: ah, uhm this Halloween i don't know T.P: i will pay you Madea: I'm on my way. hahahahahaha",0,0,Oliver Queen,G9-VHtJvPNs,0.0,2016-09-16 09:58:47,True,True
2016-09-16T15:37:25,U see white ppls😂😂😂😂😂😁😀😅😀😂,0,0,Earnestine Davis,G9-VHtJvPNs,0.0,2016-09-16 15:37:25,True,True
2016-09-17T17:20:53,Fousey in the movey? IM DONE,0,0,rikelbis1,G9-VHtJvPNs,0.0,2016-09-17 17:20:53,True,True
2016-09-17T22:50:55,izzy,0,0,Xcorvo 23,G9-VHtJvPNs,0.0,2016-09-17 22:50:55,True,True
2016-09-18T14:54:43,omg liza koshy in this movie its gonna be awesome,0,0,soupa,G9-VHtJvPNs,1.0,2016-09-18 14:54:43,True,True
2016-09-18T18:01:18,I NEED TO WATCH THIS,0,0,Karla Rivera,G9-VHtJvPNs,0.0,2016-09-18 18:01:18,True,True
2016-09-18T20:42:37,lmao,0,0,SABO,G9-VHtJvPNs,0.6,2016-09-18 20:42:37,True,True
2016-09-18T21:30:37,Omg I'm gonna watch this when I comes out YASS,0,0,Nerdy Owl,G9-VHtJvPNs,0.0,2016-09-18 21:30:37,True,True
2016-09-18T22:45:37,this looks great!!,0,0,Michele Addison,G9-VHtJvPNs,1.0,2016-09-18 22:45:37,True,True
2016-09-19T02:40:46,"I am gonna watch this, I mean Liza is in it, and i am going to start going by liza because my name is Elizabeth!",0,0,Elizabeth Daly,G9-VHtJvPNs,-0.390625,2016-09-19 02:40:46,True,True
2016-09-19T02:55:41,Who only cane for Liza?,0,0,Aquatail s,G9-VHtJvPNs,0.0,2016-09-19 02:55:41,True,True
2016-09-19T03:40:47,oommmgggg lls,0,0,Indigo Gregory,G9-VHtJvPNs,0.0,2016-09-19 03:40:47,True,True
2016-09-19T06:44:23,Did I just see Diamond White?,0,0,Axle Wavey,G9-VHtJvPNs,0.0,2016-09-19 06:44:23,True,True
2016-09-19T17:47:24,"Lizza, Bella Thorne and Fousey!",0,0,bethany chubb,G9-VHtJvPNs,0.0,2016-09-19 17:47:24,True,True
2016-09-19T20:45:05,I can't wait to see this. It looks like madea is in trouble with the white people lol.,0,0,Barbara Lee,G9-VHtJvPNs,0.20000000000000004,2016-09-19 20:45:05,True,True
2016-09-19T22:59:57,i catched liza koshy in there,0,0,luhbabii endii,G9-VHtJvPNs,0.0,2016-09-19 22:59:57,True,True
2016-09-20T01:00:20,same LIZZA KOSHY IN DIS MOVIE WATCHER HER CHANNLE -Lizza Koshy,0,0,Madelline Noodles,G9-VHtJvPNs,0.0,2016-09-20 01:00:20,True,True
2016-09-20T03:15:47,"i love the part at the end where shes like help me jesus, help me jesus, help me jesus",0,0,Jturner_191501,G9-VHtJvPNs,0.5,2016-09-20 03:15:47,True,True
2016-09-20T14:25:00,Who else came here because of Liza?,134,7,veronica angela,G9-VHtJvPNs,0.0,2016-09-20 14:25:00,True,True
2016-09-21T00:13:52,I'm going to die of laughter someone call nine-one-one,0,0,Sakura Uchiha,G9-VHtJvPNs,0.0,2016-09-21 00:13:52,True,True
2016-09-21T01:26:12,DIAMOND WHITE????!!!!!!!,0,0,Lemonade lemon,G9-VHtJvPNs,0.0,2016-09-21 01:26:12,True,True
2016-09-21T02:54:14,Just saw jc cable and kian lawley.....omg,0,0,Jocelyn Zhu,G9-VHtJvPNs,0.0,2016-09-21 02:54:14,True,True
2016-09-21T16:23:20,where are all the boos at here,0,0,i am an unstable kale,G9-VHtJvPNs,0.0,2016-09-21 16:23:20,True,True
2016-09-22T03:05:57,This shit Is funny as he'll can't wait for to come out,1,0,keep clam,G9-VHtJvPNs,0.024999999999999994,2016-09-22 03:05:57,True,True
2016-09-22T10:00:34,is it strange and weird that i have never seen a movie with madea in it,0,0,Josue' Mbenga,G9-VHtJvPNs,-0.275,2016-09-22 10:00:34,True,True
2016-09-22T10:35:55,Only watching this cause it seems funny and Liza is in it so duh.,2,0,- aa,G9-VHtJvPNs,-0.016666666666666663,2016-09-22 10:35:55,True,True
2016-09-22T12:41:04,I . HAVE. TO. SEE. THIS!!,0,0,junnick Wilde,G9-VHtJvPNs,0.0,2016-09-22 12:41:04,True,True
2016-09-22T12:59:58,No one even noticed Bradley Martyn!,0,0,Endless Viperr,G9-VHtJvPNs,0.0,2016-09-22 12:59:58,True,True
2016-09-22T16:36:11,"OMG Lizza is at the movie, need to watch it😍😍😍😍😍",2,0,Angi Ade,G9-VHtJvPNs,0.0,2016-09-22 16:36:11,True,True
2016-09-22T17:16:03,Lizza Fousy Tyler,0,0,Sam Septiceye,G9-VHtJvPNs,0.0,2016-09-22 17:16:03,True,True
2016-09-23T00:49:10,OMG LIZA KOSHY!!!!!!!!!,1,0,Evelyn Doria,G9-VHtJvPNs,0.0,2016-09-23 00:49:10,True,True
2016-09-23T03:37:30,LIIIIZZZZAAAAAAA,0,0,Maria Sultana,G9-VHtJvPNs,0.0,2016-09-23 03:37:30,True,True
2016-09-23T11:55:22,who is here for Liza?,0,0,Erika Marzulli,G9-VHtJvPNs,0.0,2016-09-23 11:55:22,True,True
2016-09-23T16:40:21,Fousy wat chu doin in dis movie?,0,0,WyattC 101,G9-VHtJvPNs,0.0,2016-09-23 16:40:21,True,True
2016-09-23T17:09:39,afcmian.movie,0,0,GHSTR4BT THE GAMER,G9-VHtJvPNs,0.0,2016-09-23 17:09:39,True,True
2016-09-23T17:46:32,LIZZZZZZZZA! YES!!!,0,0,Futaba,G9-VHtJvPNs,0.0,2016-09-23 17:46:32,True,True
2016-09-23T20:22:02,Kian And Jc💖💖,0,0,Evina,G9-VHtJvPNs,0.0,2016-09-23 20:22:02,True,True
2016-09-23T21:19:01,Hope Madea will celebrate Easter....,0,0,Green Monsoon,G9-VHtJvPNs,0.0,2016-09-23 21:19:01,True,True
2016-09-24T00:39:36,0:21 OMG LIZZZZZAAAAA,2,0,Sabinne Charles,G9-VHtJvPNs,0.0,2016-09-24 00:39:36,True,True
2016-09-24T01:40:00,LIZA ❤️❤️❤️,0,0,Drink Bleach,G9-VHtJvPNs,0.0,2016-09-24 01:40:00,True,True
2016-09-24T02:17:21,Everyone's talking bout fousy.... But is no one gonna talk about LIZZZA????!!!,233,10,Natalie Bink,G9-VHtJvPNs,0.0,2016-09-24 02:17:21,True,True
2016-09-24T03:44:45,this movie is gonna be hilarious,0,0,Kim Kennedy,G9-VHtJvPNs,0.5,2016-09-24 03:44:45,True,True
2016-09-24T08:49:20,Everyone here is talking about fouseytube while I'm here wanting to see the movie just because off Liza,2,0,Iman Hussaini,G9-VHtJvPNs,0.0,2016-09-24 08:49:20,True,True
2016-09-24T12:37:26,LIZZZA KOSHY!!! IN DA (HAUNTED) HOUSE!!!,0,0,Jof Regidor,G9-VHtJvPNs,0.0,2016-09-24 12:37:26,True,True
2016-09-24T14:11:40,omg Liza,0,0,blahhh,G9-VHtJvPNs,0.0,2016-09-24 14:11:40,True,True
2016-09-24T19:41:35,funny as he'll,0,0,F A L L E N,G9-VHtJvPNs,0.25,2016-09-24 19:41:35,True,True
2016-09-24T19:50:35,Wooooooow lizza is here🤘🏼🤘🏼🤘🏼,0,0,Majo Murguia,G9-VHtJvPNs,0.0,2016-09-24 19:50:35,True,True
2016-09-25T02:45:42,Looks great! Def gonna go see!,0,0,The Bagging and Boarding Bad Boy,G9-VHtJvPNs,1.0,2016-09-25 02:45:42,True,True
2016-09-25T04:47:11,LIZAAAAAAA🙌🙌🙌,0,0,Draia .v,G9-VHtJvPNs,0.0,2016-09-25 04:47:11,True,True
2016-09-25T06:10:20,im gonna whatch this movie because lizzza is in it and will be soooooooooooooo funny hell yea,0,0,Little Greec Brown Girl,G9-VHtJvPNs,0.25,2016-09-25 06:10:20,True,True
2016-09-25T15:41:02,"I might actually see this, the trailer looks funny!",0,0,Yuki Productions,G9-VHtJvPNs,0.15625,2016-09-25 15:41:02,True,True
2016-09-25T15:58:40,I'm just here cuz of liza...❤️,0,0,Simone Riha,G9-VHtJvPNs,0.0,2016-09-25 15:58:40,True,True
2016-09-25T16:55:16,LIZZAAAAAA,0,0,The Mysties,G9-VHtJvPNs,0.0,2016-09-25 16:55:16,True,True
2016-09-25T18:31:33,I'm soo ready to watch this😂😂😂,0,0,Natasha Williams,G9-VHtJvPNs,0.2,2016-09-25 18:31:33,True,True
2016-09-25T19:25:05,everyone's talking about Fousey what about kian and jc and liza? ?,0,0,kiseize,G9-VHtJvPNs,0.0,2016-09-25 19:25:05,True,True
2016-09-25T23:24:42,0:22 LIZZA,0,0,ivy,G9-VHtJvPNs,0.0,2016-09-25 23:24:42,True,True
2016-09-26T00:33:40,Lizza koshy is in this movie wow,4,1,Angelica Gomez,G9-VHtJvPNs,0.1,2016-09-26 00:33:40,True,True
2016-09-26T02:34:22,Who saw Liza Koshy and clickbater,0,0,jaeminstoes,G9-VHtJvPNs,0.0,2016-09-26 02:34:22,True,True
2016-09-26T20:39:11,Everyone is talking about fousey but   I SEE LIZA,1,0,Sophia Bryant,G9-VHtJvPNs,0.0,2016-09-26 20:39:11,True,True
2016-09-27T11:50:39,"Yall be like ""OMG FOUSEY""... GURLS WHERE´S LIZAAA´S SWQUAD AT!?",0,0,It's HoenestlyMe,G9-VHtJvPNs,0.0,2016-09-27 11:50:39,True,True
2016-09-27T14:00:12,Lizzzzzzaaaa Koshyyyy!!!!!!!! <3,0,0,Celeste Ghelfi,G9-VHtJvPNs,1.0,2016-09-27 14:00:12,True,True
2016-09-27T21:18:09,U tf Tyga ugly ass in da movie nobody dnt want him there tf  lol,0,0,Jasmine Alexander,G9-VHtJvPNs,0.050000000000000044,2016-09-27 21:18:09,True,True
2016-09-28T03:37:33,Fousey!!!!!,0,0,CRYSTAL CORONADO,G9-VHtJvPNs,0.0,2016-09-28 03:37:33,True,True
2016-09-28T11:35:43,anyone here bc lizzza?,0,0,laura,G9-VHtJvPNs,0.0,2016-09-28 11:35:43,True,True
2016-09-28T20:18:07,"what is ""fousey"" that everybody is saying?",0,3,Angel,G9-VHtJvPNs,0.0,2016-09-28 20:18:07,True,True
2016-09-28T21:36:28,I am SOOOOOO looking for this to come out! Love me some Madea!!!,0,0,Ieishdragyn,G9-VHtJvPNs,0.9765625,2016-09-28 21:36:28,True,True
2016-09-28T21:44:08,Omg. I can't stop laughing! I know it's going to be hilarious!,0,0,Melanie Smith,G9-VHtJvPNs,0.625,2016-09-28 21:44:08,True,True
2016-09-28T22:16:32,who saw kian and that other dude,0,0,Ariana Pinkerton,G9-VHtJvPNs,-0.125,2016-09-28 22:16:32,True,True
2016-09-29T03:56:41,"""Let sum jump up out dis damn box!"" 😂😂💀",0,0,Marcelino Morin,G9-VHtJvPNs,0.0,2016-09-29 03:56:41,True,True
2016-09-29T03:59:41,"""I used to get dolla bills for deez! "" 😢💀",0,0,Marcelino Morin,G9-VHtJvPNs,0.0,2016-09-29 03:59:41,True,True
2016-09-29T11:25:01,"2 things: 1. LIZZZZZZZA!!!!!!!! 2. Ive always wanted to see a ""scary movie"" where black/african american stereotypes are the leads!",0,0,Jazi Kittycat,G9-VHtJvPNs,-0.25,2016-09-29 11:25:01,True,True
2016-09-29T12:55:45,Here bc Liza Koshy's here,0,0,fairytale psycho,G9-VHtJvPNs,0.0,2016-09-29 12:55:45,True,True
2016-09-29T15:48:40,"everyone be here like: OMG FOUSEY , im here ike who is that? ok but like OMG LIZZZA!!!!!!",0,0,wiki B,G9-VHtJvPNs,1.0,2016-09-29 15:48:40,True,True
2016-09-29T21:47:49,HE GOT FOUSEYTUBE IN THE MOVIE 🙌🏽🙌🏽🙌🏽🙌🏽,0,0,JBSoDope87,G9-VHtJvPNs,0.0,2016-09-29 21:47:49,True,True
2016-09-29T23:26:02,Finally black ppl in a Halloween movie 😂😂😂,0,0,Gorgeous Gab,G9-VHtJvPNs,-0.16666666666666666,2016-09-29 23:26:02,True,True
2016-09-30T03:38:29,FOUSEYYY,0,0,Makenzie xox,G9-VHtJvPNs,0.0,2016-09-30 03:38:29,True,True
2016-09-30T06:15:41,I usually love tyler movies but this looks wack af,1,0,Screw Dreams,G9-VHtJvPNs,0.5,2016-09-30 06:15:41,True,True
2016-09-30T18:30:27,Oh I'm so fuckin watching this lmfao 😂😂,0,0,TanyaMariie,G9-VHtJvPNs,0.0,2016-09-30 18:30:27,True,True
2016-09-30T23:10:35,OMG LIZA KOSHEY IS IN IT!!!!!!!!,0,0,AngieCat25 Ferrer,G9-VHtJvPNs,0.0,2016-09-30 23:10:35,True,True
2016-10-01T01:09:18,This seems so cheap,0,0,The ZombieMan,G9-VHtJvPNs,0.4,2016-10-01 01:09:18,True,True
2016-10-01T11:46:56,Lizzza😍😍😍😍😍😍😍😍😍😍,0,0,madi o,G9-VHtJvPNs,0.0,2016-10-01 11:46:56,True,True
2016-10-01T13:21:33,Lizzzaaa,0,0,Isabella Serafia,G9-VHtJvPNs,0.0,2016-10-01 13:21:33,True,True
2016-10-01T13:54:25,LIZZZZZZZZZZZZZAAAAAAAAA,0,0,diana arava,G9-VHtJvPNs,0.0,2016-10-01 13:54:25,True,True
2016-10-01T14:31:21,who seen lizza?♡♡♡♡,1,0,Hall's of Hamad,G9-VHtJvPNs,0.0,2016-10-01 14:31:21,True,True
2016-10-01T17:13:37,Those other 2 ladies are running away from those zombies awfully slowly.,0,0,Dexshurun1988,G9-VHtJvPNs,-0.21250000000000002,2016-10-01 17:13:37,True,True
2016-10-01T19:16:19,"""I used yo get dollar bills for this"" Hash Ash haha shah",0,0,Slayz Seby,G9-VHtJvPNs,0.2,2016-10-01 19:16:19,True,True
2016-10-01T19:52:52,i saw liza!!!,0,0,Maria Guzman,G9-VHtJvPNs,0.0,2016-10-01 19:52:52,True,True
2016-10-01T21:06:04,😂😂😂 I want to see this movie so bad hilarious,0,0,2017 is lit,G9-VHtJvPNs,-0.09999999999999992,2016-10-01 21:06:04,True,True
2016-10-01T22:14:34,Lol LIZA,0,0,Lily.da.dancer TabaresC,G9-VHtJvPNs,0.8,2016-10-01 22:14:34,True,True
2016-10-01T23:11:28,Jesus Christ Will he ever get out of that dress. Its an abomination,0,0,elohim660,G9-VHtJvPNs,0.0,2016-10-01 23:11:28,True,True
2016-10-02T00:02:13,"love Tyler perry so great, funny movies",0,0,gennie jefferson,G9-VHtJvPNs,0.5166666666666667,2016-10-02 00:02:13,True,True
2016-10-02T00:34:05,OMG i can't my baby Lizzza is in here. I'm so watching this when it comes out.,0,0,Janiah Lindsey,G9-VHtJvPNs,0.0,2016-10-02 00:34:05,True,True
2016-10-02T01:18:53,Love it ain't no ghost gonna survive Madea:))))),1,0,The Darci 13,G9-VHtJvPNs,0.5,2016-10-02 01:18:53,True,True
2016-10-02T01:30:23,I haven't seen a comment about Jimmy Tatro yet! Anyone else notice him?,0,0,simpleman3256,G9-VHtJvPNs,0.0,2016-10-02 01:30:23,True,True
2016-10-02T15:21:38,was that lizza,0,0,Harper Phoenix,G9-VHtJvPNs,0.0,2016-10-02 15:21:38,True,True
2016-10-02T16:07:45,I'm over here like LIZZZA!!!!!!!!!,0,0,Aye Ninaa,G9-VHtJvPNs,0.0,2016-10-02 16:07:45,True,True
2016-10-02T16:33:26,LIZZZZZZZZZZZZZZZZZZZZZZZZZZZZZZZAAAAAAAAAAAAAAAAAAAAA,0,0,Skyla Vandiver,G9-VHtJvPNs,0.0,2016-10-02 16:33:26,True,True
2016-10-02T18:46:01,"I was gonna watch it until I saw FouseyTube was in it. That's too bad, I bet it was gonna be a great movie.",2,0,Hayes,G9-VHtJvPNs,0.0500000000000001,2016-10-02 18:46:01,True,True
2016-10-02T19:23:07,"So, basically.. A Haunted House? Right? sheesh..",0,0,Eternaldarkness3166,G9-VHtJvPNs,0.2857142857142857,2016-10-02 19:23:07,True,True
2016-10-02T19:31:52,"""Help me Jesus! Help me Jesus."" 😂😂😂😂",216,4,shevonnie salmon,G9-VHtJvPNs,0.0,2016-10-02 19:31:52,True,True
2016-10-02T21:01:18,I literally just watched the Shane Dawson conspiracy theory on this lol,0,0,Ziona,G9-VHtJvPNs,0.8,2016-10-02 21:01:18,True,True
2016-10-03T14:42:16,Both Tyler Perry and Madea are frightening in real life as they are on screen.,0,0,Josh Berman,G9-VHtJvPNs,-0.15,2016-10-03 14:42:16,True,True
2016-10-03T20:15:12,Came here Bc of Kian and Jc,5,0,BYE Heurbfhr,G9-VHtJvPNs,0.0,2016-10-03 20:15:12,True,True
2016-10-04T01:29:56,You know I don't like Halloween. I will pay you  I'm on my way 💕😂😂,0,0,Kaiddy Yalartai,G9-VHtJvPNs,0.0,2016-10-04 01:29:56,True,True
2016-10-04T01:33:42,OMG! LIZZZA FROM MUSICAL.LY IS IN IT!!! 😲😲😲,3,3,HarleyGone Psyco,G9-VHtJvPNs,0.0,2016-10-04 01:33:42,True,True
2016-10-04T17:53:33,who's Liza again?,0,0,hr8kp Creative Shovel,G9-VHtJvPNs,0.0,2016-10-04 17:53:33,True,True
