timestamp,text,like_count,reply_count,author,trailer_id,sentiment_score,datetime,used_for_model,used_for_visualization
2017-05-26T13:59:24,Not so good (FUNNY) as the Teaser Trailer,0,0,Akila Supun,IpKmt4MpctM,0.475,2017-05-26 13:59:24,True,True
2017-05-26T14:07:23,This is going to be good.,80,5,Y E.,IpKmt4MpctM,0.7,2017-05-26 14:07:23,True,True
2017-05-26T14:12:54,I am sooo...gonna watch this movie! Looks so motherfucking awesome and badass!!!,15,0,ThePeacebro11,IpKmt4MpctM,1.0,2017-05-26 14:12:54,True,True
2017-05-26T14:27:09,why aren't you playing as deadpool,4,1,Swan Arima,IpKmt4MpctM,0.0,2017-05-26 14:27:09,True,True
2017-05-26T14:40:52,That Nun Scene tho!!! 😂😂😂🤣🤣😭,76,0,j michelle,IpKmt4MpctM,0.0,2017-05-26 14:40:52,True,True
2017-05-26T14:43:13,😂😱,0,0,Viv1*,IpKmt4MpctM,0.0,2017-05-26 14:43:13,True,True
2017-05-26T14:46:16,"samuel l. jackson turns the word ""motherfucker"" to gold",216,16,coach,IpKmt4MpctM,0.0,2017-05-26 14:46:16,True,True
2017-05-26T14:47:32,I want to watch this motherf**king movie right motherf**king now!,51,3,Farabe Islam,IpKmt4MpctM,0.3571428571428571,2017-05-26 14:47:32,True,True
2017-05-26T14:51:23,take my money this looks fucking great xD,17,0,BiggBadWolf _96,IpKmt4MpctM,0.8,2017-05-26 14:51:23,True,True
2017-05-26T15:04:29,LMFAO. I know how that is  🐺🚬 👔👐       😂 👖🔥🔥. 👕💨🔥🔥🐗🐗🐗,0,0,AholeBiker,IpKmt4MpctM,0.0,2017-05-26 15:04:29,True,True
2017-05-26T15:15:41,Deadpool got his face back! Team up with Nick Fury? Whaaa?,66,2,Vendetta Gaming,IpKmt4MpctM,0.0,2017-05-26 15:15:41,True,True
2017-05-26T15:21:10,I'm laughing 😂 my ass off this will be gold 👏💚👄👀👂🎬,2,0,Shennel Jacob,IpKmt4MpctM,0.0,2017-05-26 15:21:10,True,True
2017-05-26T16:10:36,"""When things get hard, bring protection"" Ayyyy I see what you did there",54,0,Chris Lewis,IpKmt4MpctM,-0.2916666666666667,2017-05-26 16:10:36,True,True
2017-05-26T16:25:28,"Everything about this is amazing! The first trailer was better, but this one has in no way diminished my desire to see the movie.",32,0,Cheese4G,IpKmt4MpctM,0.5,2017-05-26 16:25:28,True,True
2017-05-26T16:29:40,Why is Ryan Reynolds soo sexy??,10,1,Anastasia M,IpKmt4MpctM,0.5,2017-05-26 16:29:40,True,True
2017-05-26T17:26:18,This seems fun as hell! Cant wait!,0,0,Augusto Porto,IpKmt4MpctM,0.46875,2017-05-26 17:26:18,True,True
2017-05-26T17:56:02,Samuel Jackson is the king,12,0,GODZILLAfan,IpKmt4MpctM,0.0,2017-05-26 17:56:02,True,True
2017-05-26T19:46:04,Deadpool and Nick Fury in the same movie?,58,5,Duc Hoang,IpKmt4MpctM,0.0,2017-05-26 19:46:04,True,True
2017-05-26T20:26:55,This is gonna be lit,0,0,Nia Bellamy,IpKmt4MpctM,0.0,2017-05-26 20:26:55,True,True
2017-05-26T20:33:53,they didn't show all the jokes in the trailer! take note zoolander,0,0,Wazilian Films,IpKmt4MpctM,0.0,2017-05-26 20:33:53,True,True
2017-05-26T21:54:37,Deadpool (I mean Ryan Reynolds) + Samuel L. Jackson.... My dream come true!,153,11,Beautiful GURU,IpKmt4MpctM,0.0625,2017-05-26 21:54:37,True,True
2017-05-27T00:19:51,"Hello, Commissioner!",5,0,Gary Oldman Web,IpKmt4MpctM,0.0,2017-05-27 00:19:51,True,True
2017-05-27T02:47:11,SEEING! THIS! MOTHERF**KING! MOVIE!,7,0,Bobby Pilster,IpKmt4MpctM,0.0,2017-05-27 02:47:11,True,True
2017-05-27T03:03:49,I hope they keep making buddy movies like The Nice Guys,0,0,Craig Cooper,IpKmt4MpctM,0.6,2017-05-27 03:03:49,True,True
2017-05-27T08:43:45,1:45  they took some..huge artistic liberties with Amsterdam's roadway system.,60,2,Thedutchjelle,IpKmt4MpctM,0.3333333333333333,2017-05-27 08:43:45,True,True
2017-05-27T09:21:00,Salma hayek is in it too? The hottest 50 yr old walkin the planet !,49,2,nash4life,IpKmt4MpctM,0.125,2017-05-27 09:21:00,True,True
2017-05-27T12:06:24,BEVILO TUTTO! DRINK IT ALL!,1,0,THEfailer993,IpKmt4MpctM,0.0,2017-05-27 12:06:24,True,True
2017-05-27T17:30:45,"BRUH, this looks fantastic. Can't wait.",0,0,JAV3 DLC,IpKmt4MpctM,0.4,2017-05-27 17:30:45,True,True
2017-05-27T17:34:07,Much better than the previous trailer. I actually am looking forward to seeing this now.,0,0,Lazy Movie Nerd,IpKmt4MpctM,0.11111111111111112,2017-05-27 17:34:07,True,True
2017-05-27T22:38:23,Oh fuck the hell. . . *yessss*  . . .,0,0,Barricade,IpKmt4MpctM,-0.4,2017-05-27 22:38:23,True,True
2017-05-28T01:15:52,why did you claim about my video,0,0,Antonio Navarro,IpKmt4MpctM,0.0,2017-05-28 01:15:52,True,True
2017-05-28T12:19:04,He's literally Deadpool in every movie now.,0,0,xEyonu,IpKmt4MpctM,0.0,2017-05-28 12:19:04,True,True
2017-05-28T14:28:59,so young Deadpool meets Nick Fury before SHIELD?,0,0,Josh Ghosh,IpKmt4MpctM,0.1,2017-05-28 14:28:59,True,True
2017-05-28T20:03:13,"Elektra, Deadpool, Nick Fury & Commissioner Gordon in the same movie.",46,1,Chris,IpKmt4MpctM,0.0,2017-05-28 20:03:13,True,True
2017-05-28T21:48:14,He's still Deadpool. I'm pretty sure Deadpool has possessed him,0,0,Caz Butcher,IpKmt4MpctM,0.375,2017-05-28 21:48:14,True,True
2017-05-29T01:02:38,1:18 omg sammuel,8,0,Angel Hernandez,IpKmt4MpctM,0.0,2017-05-29 01:02:38,True,True
2017-05-29T03:07:28,lol thay smashed a car into the canals making this movie totaly highlaurious.,0,0,Merlijn Marcus,IpKmt4MpctM,0.8,2017-05-29 03:07:28,True,True
2017-05-29T04:43:25,i'm so frickin pumped for this movie,0,0,John Beckman,IpKmt4MpctM,0.0,2017-05-29 04:43:25,True,True
2017-05-29T07:13:04,1:36 Suck it Francis,0,0,iona2225,IpKmt4MpctM,0.0,2017-05-29 07:13:04,True,True
2017-05-29T07:54:00,Why didn't they use the cast and budget of this film to make a one off dead pool/nick fury buddy film would have made more money?,0,0,pinfold1000,IpKmt4MpctM,0.15,2017-05-29 07:54:00,True,True
2017-05-29T08:44:41,is that the guy that played mace windu?,0,0,Drew Brees The Great,IpKmt4MpctM,0.0,2017-05-29 08:44:41,True,True
2017-05-29T10:50:36,perfect dueo,0,0,Aurora Uplinks,IpKmt4MpctM,1.0,2017-05-29 10:50:36,True,True
2017-05-29T13:27:14,0:31,0,0,Abhishek Tarafdar,IpKmt4MpctM,0.0,2017-05-29 13:27:14,True,True
2017-05-29T13:37:45,Chip from Dick and that armless dude from Deep Blue Sea?  Can't wait!,0,0,Angel Pygs,IpKmt4MpctM,0.0,2017-05-29 13:37:45,True,True
2017-05-29T14:05:55,"The joke goes Deadpool, Nick Fury and Elektra walk into a bar.....",0,0,Exclusive Music,IpKmt4MpctM,0.0,2017-05-29 14:05:55,True,True
2017-05-29T15:15:13,bwahaha!,1,0,Michael Baker,IpKmt4MpctM,0.0,2017-05-29 15:15:13,True,True
2017-05-29T15:33:56,Looking forward to this but not as much as deadpool 2,0,0,Hamer51,IpKmt4MpctM,0.2,2017-05-29 15:33:56,True,True
2017-05-29T16:42:55,From the vaults of marvel comes the legendary story about when pre deadpool wade wilson and pre shield Nick fury decided to have a buddy cop adventure to kill a tyrannical  commisioner gordon!,66,2,Phoenixesper1,IpKmt4MpctM,1.0,2017-05-29 16:42:55,True,True
2017-05-29T18:52:27,1:21 I could watch that on a 24 hour loop.  :D,52,2,MUDSWAT,IpKmt4MpctM,1.0,2017-05-29 18:52:27,True,True
2017-05-29T22:14:38,you gonna be a little bitch about it 😂,0,0,FADEDGHOST,IpKmt4MpctM,-0.1875,2017-05-29 22:14:38,True,True
2017-05-30T00:04:05,Milkin the Deadpool tit while suckin the Transporter tit.  Gotta love them hoolywood jews......,0,0,AusDenBergen,IpKmt4MpctM,0.5,2017-05-30 00:04:05,True,True
2017-05-30T01:45:16,Looks pretty good.  I think this movie will turn out to be a good one.,0,0,K White,IpKmt4MpctM,0.5499999999999999,2017-05-30 01:45:16,True,True
2017-06-02T08:29:19,Wade Wilson & Dr. Rice from Logan at 0:07.,0,0,Swastik,IpKmt4MpctM,0.0,2017-06-02 08:29:19,True,True
2017-06-06T18:04:19,Did Ryan Reynolds try to knee strike the gun of SLJ hand. Is that an actual move,0,0,James Ward,IpKmt4MpctM,0.0,2017-06-06 18:04:19,True,True
2017-06-08T20:55:57,dat look good!,0,0,Casually Filthy,IpKmt4MpctM,0.875,2017-06-08 20:55:57,True,True
2017-06-12T16:19:12,Does anyone remember that video that went around Facebook for a while that showed a jeep knock a car into a canal as a speedboat went past? I think it must have been the filming for the speedboat scene in this film,0,1,Sir Digby Chicken Caesar,IpKmt4MpctM,-0.25,2017-06-12 16:19:12,True,True
2017-06-19T14:33:01,"How can you all not go crazy about Salma Hayek saying ""You lost my husband?"" part???!!! She trademarked that line!!!",0,0,Nicholas Lai,IpKmt4MpctM,-1.0,2017-06-19 14:33:01,True,True
2017-06-26T12:42:23,What's the song from 44 seconds and on,1,0,Jonloco24,IpKmt4MpctM,0.0,2017-06-26 12:42:23,True,True
2017-06-30T22:43:42,All I see is Deadpool being Asked by Nick Fury to Join the Avengers,4,0,Robbie Clarke,IpKmt4MpctM,0.0,2017-06-30 22:43:42,True,True
2017-07-04T18:07:47,At the beginning of the trailer Deadpool is contracted to protect Xander Riece And now for the rest of the movie he has to protect Nick fury,24,0,Arachnid Comics,IpKmt4MpctM,0.0,2017-07-04 18:07:47,True,True
2017-07-04T21:27:47,What's the background song someone plz help,1,1,Elias W.,IpKmt4MpctM,0.0,2017-07-04 21:27:47,True,True
2017-07-09T00:39:32,siiii samuel l jason,0,0,José Daniel Arroyave,IpKmt4MpctM,0.0,2017-07-09 00:39:32,True,True
2017-07-12T11:41:46,nope still deadpool,0,0,cocoanouk,IpKmt4MpctM,0.0,2017-07-12 11:41:46,True,True
2017-07-13T12:06:52,All I see is Nick Fury trying to get Deadpool to join the Avengers.,0,1,Tyler Laird,IpKmt4MpctM,0.0,2017-07-13 12:06:52,True,True
2017-07-15T22:20:09,Gary oldman doing russian accent again,0,0,Main's Main,IpKmt4MpctM,0.0,2017-07-15 22:20:09,True,True
2017-07-17T04:39:28,Where the Hellboy rise of blood queen red band tralier,0,0,Susan Fishel,IpKmt4MpctM,0.0,2017-07-17 04:39:28,True,True
2017-07-21T15:28:45,hope it releases in India.. plz @lionsgate,0,0,Pallav Das,IpKmt4MpctM,0.0,2017-07-21 15:28:45,True,True
2017-07-24T23:41:39,unfortunately I can only see  Sam Jackson singing the I can't breeve song😕 Another Obummer anti police fool 😐,0,0,POF 415,IpKmt4MpctM,-0.25,2017-07-24 23:41:39,True,True
2017-08-03T04:29:08,this looks like a steaming pile o shit and it's gonna be hilarious,0,0,David Peterle,IpKmt4MpctM,0.15,2017-08-03 04:29:08,True,True
2017-08-04T15:13:59,Deadpool and Nick Fury trapped in an alternate​ reality.,0,0,Bard OCharm,IpKmt4MpctM,-0.2,2017-08-04 15:13:59,True,True
2017-08-05T14:32:07,Samuel is mace windu from star wars,0,0,Night wolf,IpKmt4MpctM,0.0,2017-08-05 14:32:07,True,True
2017-08-06T18:10:10,highly cat shelf actor lemon swallow venture criminal corner,0,0,Madelon Vroom,IpKmt4MpctM,-0.12000000000000001,2017-08-06 18:10:10,True,True
2017-08-08T21:59:47,Dead Fury and NickPool,0,0,Justin Melecio,IpKmt4MpctM,-0.2,2017-08-08 21:59:47,True,True
2017-08-10T03:08:29,"I saw an early screening of this tonight, it was so funny!!!",0,0,Workers Krunch,IpKmt4MpctM,0.294140625,2017-08-10 03:08:29,True,True
2017-08-10T04:09:00,Absolutely loved the movie! Thanks Lionsgate for the opportunity to watch this amazing film free at the screening. I will definitely pay to watch it again😊,0,0,chicainocente18,IpKmt4MpctM,0.41500000000000004,2017-08-10 04:09:00,True,True
2017-08-10T20:10:28,Of course Samuel still says motherfucker,0,0,stix xx,IpKmt4MpctM,0.0,2017-08-10 20:10:28,True,True
2017-08-11T14:19:02,"Saw the prescreening of this movie and it is very good. Action, comedy, and lots of muthaeffers! Sam and Ryan have good comedic Chemistry in this movie.",0,0,J.D.,IpKmt4MpctM,0.5783333333333333,2017-08-11 14:19:02,False,True
2017-08-12T21:00:54,4:20,0,0,GhettoDemon,IpKmt4MpctM,0.0,2017-08-12 21:00:54,False,True
2017-08-14T04:31:11,Deadpool I mean this white guy and Samuel I'll do any movie Jackson... terrible.,0,0,brokenupbeat,IpKmt4MpctM,-0.4375,2017-08-14 04:31:11,False,True
2017-08-14T22:55:09,"Is a movie of Deadpool, Nick Fury,Elecktra and Jim Gordon.",0,0,Robin Arath,IpKmt4MpctM,0.0,2017-08-14 22:55:09,False,True
2017-08-16T19:42:47,Song from 1:20 ?,0,0,Gardar Sigurgeirsson,IpKmt4MpctM,0.0,2017-08-16 19:42:47,False,True
2017-08-18T03:37:28,Gary Oldman as Eeevil Foreigner.,0,0,PurushaDesa,IpKmt4MpctM,0.0,2017-08-18 03:37:28,False,True
2017-08-19T06:36:17,"Its some good shit, I recommend you to watch this. It will be 200% worth it.",0,0,fu ta,IpKmt4MpctM,0.26666666666666666,2017-08-19 06:36:17,False,True
2017-08-22T11:05:42,Deadpool is Nick Fury's bodyguard!!,0,0,KhaiDougie Tomlinson,IpKmt4MpctM,0.0,2017-08-22 11:05:42,False,True
2017-08-22T16:06:13,Deadpool. Nick fury. Elektra. What else needs to be said??,0,0,mike saechao,IpKmt4MpctM,0.0,2017-08-22 16:06:13,False,True
2017-08-23T19:08:34,"Hi there, can some one told me the song Kincaid sing when the tooking out the bullet from his leg while talking phone with sonia is ???",0,0,cao dat,IpKmt4MpctM,0.0,2017-08-23 19:08:34,False,True
2017-08-24T20:30:05,"Just watched it today, this movie is a mother fucking gold, but if u did't like deadpool u won't like this one either",0,0,hussain Al-Sadah,IpKmt4MpctM,-0.6,2017-08-24 20:30:05,False,True
2017-08-25T08:52:51,Seen it yesterday. It was a good motherfucken movie.,0,0,Truth Seeker 312,IpKmt4MpctM,0.7,2017-08-25 08:52:51,False,True
2017-08-25T11:39:15,Why has Hitman a bodyguard at first place ?,0,0,Batzorig Ulziibat,IpKmt4MpctM,0.25,2017-08-25 11:39:15,False,True
2017-08-30T21:33:13,Look my channel pls,0,0,SAD• EDIT,IpKmt4MpctM,0.0,2017-08-30 21:33:13,False,True
2017-08-31T12:58:13,https://youtu.be/ZGivKMWCyWM,0,0,M. JUNAID,IpKmt4MpctM,0.0,2017-08-31 12:58:13,False,True
2017-09-01T03:39:00,28.,0,0,Ilyas Wong,IpKmt4MpctM,0.0,2017-09-01 03:39:00,False,True
2017-09-01T03:43:45,What the fuck.,0,0,Ilyas Wong,IpKmt4MpctM,-0.4,2017-09-01 03:43:45,False,True
2017-09-01T03:44:24,Will be a little bitch about it.,0,0,Ilyas Wong,IpKmt4MpctM,-0.1875,2017-09-01 03:44:24,False,True
2017-09-01T06:40:51,Bitch! You're supposed to say 2 & 3.,0,0,Ilyas Wong,IpKmt4MpctM,0.0,2017-09-01 06:40:51,False,True
2017-09-01T13:21:36,What the fuck.,0,0,Ilyas Wong,IpKmt4MpctM,-0.4,2017-09-01 13:21:36,False,True
2017-09-02T00:11:21,"А что, давайте возьмемся за старое. Русские дураки, ничего нет, всех убить. Американцы молодцы всех победили.  Кока-колой или iphon-ом возьмете? Да не, нам просто пожрать.",0,0,iolloi123,IpKmt4MpctM,0.0,2017-09-02 00:11:21,False,True
2017-09-03T06:50:05,Deadpool and elektra,0,0,hadid wicaksono,IpKmt4MpctM,0.0,2017-09-03 06:50:05,False,True
2017-09-05T16:06:28,✹ *THE HITMAN'S BODYGUARD FULL MOVIE* ► sites.google.com/view/the-hitmans-bodyguard-hd-movie ✹ *WIND RIVER 2017 FULL MOVIE* ► sites.google.com/view/wind-river-2017-full-movie-hd ✹ *SHOT CALLER FULL MOVIE* ► sites.google.com/view/shot-caller-full-movie,0,0,Lorena Herrera,IpKmt4MpctM,0.3499999999999999,2017-09-05 16:06:28,False,True
2017-09-08T19:16:31,Love it,0,0,svebo13,IpKmt4MpctM,0.5,2017-09-08 19:16:31,False,True
2017-09-08T23:44:21,Good movie,0,0,Nakosi Webb,IpKmt4MpctM,0.7,2017-09-08 23:44:21,False,True
2017-09-09T22:14:10,What is Belarus in Bosnia? Directors and screenwriters are addicts? A movie for idiots.,1,0,integrationsft,IpKmt4MpctM,-0.8,2017-09-09 22:14:10,False,True
2017-09-10T11:50:34,"Was really looking forward to this one and it turned out so mediocre and bland that it felt like a huge waste of time. The problem is that you have two very charismatic, colorful guys and somehow they don't have anything decent to work with because of poor story and really generic plus uninteresting dialogue. What makes these guys especially Jackson great in some movies is that he is given cool character to work with . You can't just give him couple of motherfucker lines and expect it to be good. Other thing is that it is tonally conflicting, oversaturated and unnecessary long with story arc they could completely eliminate and the movie would gain points. It is never exciting as it wants to be or funny as it think it is. In the end very dissatisfying and forgettable film.",0,1,M Family,IpKmt4MpctM,0.07934782608695654,2017-09-10 11:50:34,False,True
2017-09-15T13:18:45,где русская озвучка? или хотя бы субтитры,0,0,Рома Музыка,IpKmt4MpctM,0.0,2017-09-15 13:18:45,False,True
2017-09-15T15:56:25,full movie : http://123link.top/3tdu,0,0,movie star,IpKmt4MpctM,0.35,2017-09-15 15:56:25,False,True
2017-09-24T00:43:23,Why the fuck do all Dutch people suddenly speak English to eachother in this movie?,1,0,Twig,IpKmt4MpctM,-0.13333333333333333,2017-09-24 00:43:23,False,True
2017-09-27T23:01:20,Damn chuuuul,0,0,Handoko Hendriawan,IpKmt4MpctM,0.0,2017-09-27 23:01:20,False,True
2017-09-28T16:16:40,FULL MOVİE WATCH : https://vidoza.net/ajke5ppht52r.html,0,0,Jose Clayton,IpKmt4MpctM,0.35,2017-09-28 16:16:40,False,True
2017-10-07T20:40:41,"i already watch it now god this,is very good movie this is amazing❤❤❤",1,0,Ann Cagunot,IpKmt4MpctM,0.9099999999999999,2017-10-07 20:40:41,False,True
2017-10-22T00:04:27,Sequel : The Bodyguard's Hitman,1,0,D1N0 ALG,IpKmt4MpctM,0.0,2017-10-22 00:04:27,False,True
2017-10-23T19:05:41,I saw this movie! It was awesome!😊,0,0,The Crusader,IpKmt4MpctM,0.0,2017-10-23 19:05:41,False,True
2017-10-30T23:25:38,Great cast,0,0,Emerson Crowe,IpKmt4MpctM,0.8,2017-10-30 23:25:38,False,True
2017-11-23T04:58:34,A MOTHERFUCKING MOVIE!,0,0,Act Of Vengeance,IpKmt4MpctM,0.0,2017-11-23 04:58:34,False,False
2017-11-25T07:49:14,"That soundtrack in the background not only matched my hype for the movie, but it made me feel like I was about to fight against thousands of men.",0,0,An Author,IpKmt4MpctM,0.0,2017-11-25 07:49:14,False,False
2017-11-29T00:41:37,You gonna be a little bitch about it.,0,0,Ilyas Wong,IpKmt4MpctM,-0.1875,2017-11-29 00:41:37,False,False
2017-11-29T21:44:18,😆😆😆😆😆😆😆😎😎,1,0,Travis Garbutt,IpKmt4MpctM,0.0,2017-11-29 21:44:18,False,False
2017-12-07T18:36:39,Deadpool is Nick Fury's bodyguard.,0,0,Kevin B. Saunders,IpKmt4MpctM,0.0,2017-12-07 18:36:39,False,False
2017-12-17T13:25:37,*M O T H E R F U C K E R*,0,0,ChrisMcKing,IpKmt4MpctM,0.0,2017-12-17 13:25:37,False,False
2017-12-27T09:56:31,"Ahhh, Nick Fury and Wade Wilson? Ohhh yeah!!!",0,0,Ryuk Death God,IpKmt4MpctM,0.0,2017-12-27 09:56:31,False,False
2018-01-16T16:27:10,"como la clásica de muchas películas influidas por la corrupción en hollywood. de los impune empresas en paraísos fiscales del proyecto tavistock y mk ultra de manipulación mental social de la gente. rusia se le conoce por ser los más malos en política un historia negra mientras que inglaterra etc eeuu son lo mas buenos cuando en la historia real que lo quieren tergiversar es al revez la cia esta corrupta l nsa también son ""monstruos genocidas"". en la película no esta mala pero esta corrupta cambien todo lo que dicen rusia por la mafia en la cia nada más.",0,0,cony.!! pls animes,IpKmt4MpctM,0.044444444444444446,2018-01-16 16:27:10,False,False
2018-02-09T15:40:29,DEADPOOL!!!!!!!!!!!!!!!,0,0,I like girls,IpKmt4MpctM,0.0,2018-02-09 15:40:29,False,False
2018-02-11T01:23:19,If anybody wants to see the full movie. Go to m4ufree.com,0,0,Laurore Wood,IpKmt4MpctM,0.275,2018-02-11 01:23:19,False,False
2018-02-11T21:51:35,This movie was a masterpiece!,8,0,goat,IpKmt4MpctM,0.0,2018-02-11 21:51:35,False,False
2018-09-13T21:06:34,"Almost finished the movie. What a horrible waste of time. And i like deadpool. No surprises whatsoever, no funny jokes, nothing.",0,0,Rob Rob,IpKmt4MpctM,-0.44166666666666665,2018-09-13 21:06:34,False,False
2018-10-01T16:29:59,I like the movies amazing film in terms of action or comedy ...,0,0,Mohamed AL mahfood,IpKmt4MpctM,0.35000000000000003,2018-10-01 16:29:59,False,False
2018-10-12T05:11:37,Malik,0,0,Sulemaan Choudhary,IpKmt4MpctM,0.0,2018-10-12 05:11:37,False,False
2019-01-19T11:39:06,Lmao,0,0,SoLiD CyPhEr,IpKmt4MpctM,0.6,2019-01-19 11:39:06,False,False
2019-02-20T22:09:37,the name of this music 0:42,0,0,lego sonicraft,IpKmt4MpctM,0.0,2019-02-20 22:09:37,False,False
2019-04-28T03:10:41,_⛅10AM Apr 28 2019~_,1,0,Elvis Van,IpKmt4MpctM,0.0,2019-04-28 03:10:41,False,False
2019-05-21T15:51:37,Best movie but not HD enough Even at 1080p u can see some lights blurred  What the fuck   And is this a Netflix or Lionsgate movie?,0,0,Gaetan Shxz,IpKmt4MpctM,0.19999999999999998,2019-05-21 15:51:37,False,False
2019-06-08T21:00:09,It funny they didn't weight word f#ck but in the trailer the say it every 5 second.,0,0,Mehdi Al-Momen,IpKmt4MpctM,0.125,2019-06-08 21:00:09,False,False
2019-07-01T20:09:36,This guy singlehandedly ruined the word *motherkilling soap killer!*,0,0,Tara Horwitz,IpKmt4MpctM,0.0,2019-07-01 20:09:36,False,False
2019-09-10T11:47:20,Don't spread the video where there are woman whose aurat are not closed,0,0,Yahya Apri,IpKmt4MpctM,0.05,2019-09-10 11:47:20,False,False
2019-09-15T01:55:36,"Have recently added this to my top 10 movies.  Specifically,  top 10 worst fucking movies I've ever seen.",0,0,Aristotle,IpKmt4MpctM,-0.12,2019-09-15 01:55:36,False,False
2019-09-30T16:22:46,Official Motherfucking Trailer,0,0,10.000 Subscribers without a Video Challenge,IpKmt4MpctM,0.0,2019-09-30 16:22:46,False,False
2019-11-25T19:04:53,YES! WEVE NEVER BEEN SEE THE HITMANS BODYGUARD BEFORE!,0,0,smashed spade,IpKmt4MpctM,0.0,2019-11-25 19:04:53,False,False
2019-11-25T19:05:16,YES BUT YOU CAN SEE IT ITS MAD BY LIONSGATE,0,0,smashed spade,IpKmt4MpctM,-0.625,2019-11-25 19:05:16,False,False
2019-11-25T19:06:04,IM FULL OF JOY!,0,0,smashed spade,IpKmt4MpctM,0.675,2019-11-25 19:06:04,False,False
2019-11-25T19:06:34,MmmMy Voice Of my HANDS!,0,0,smashed spade,IpKmt4MpctM,0.0,2019-11-25 19:06:34,False,False
2019-11-25T19:06:56,I'm Turning into a girl as TIFFANY!,0,0,smashed spade,IpKmt4MpctM,0.0,2019-11-25 19:06:56,False,False
2020-02-15T13:03:28,this is really awsome movie,0,0,Asif jan,IpKmt4MpctM,0.2,2020-02-15 13:03:28,False,False
2020-02-19T01:55:41,"when you type in Samuel L. Jackson + Ryan Reynolds on a calculator, it says ""Syntax Error, Too Much Hype""",1,0,Mete Ozman,IpKmt4MpctM,0.2,2020-02-19 01:55:41,False,False
2020-02-27T21:14:56,🔥🔥🔥🔥   Wow. This movie is very twisted.   0:37 🧡💜    👇👇👇👇👇💜,0,0,Corbin Singleton,IpKmt4MpctM,-0.275,2020-02-27 21:14:56,False,False
2020-02-29T02:05:36,#YADIG,0,0,Bosssolid Lacostranostra,IpKmt4MpctM,0.0,2020-02-29 02:05:36,False,False
2020-03-27T00:01:21,I need a full movie how Will we get it,0,0,godwin ileni,IpKmt4MpctM,0.35,2020-03-27 00:01:21,False,False
2020-03-27T09:17:21,"I cant get enough of this movie seen it a thousand times,and it still gets me laughing my ass off🤣🤣🤣😂😂..",0,0,Dee Love,IpKmt4MpctM,0.0,2020-03-27 09:17:21,False,False
2020-05-22T15:23:28,nick fury tried to recruit deadpool,0,0,Andryan Rinaldhi,IpKmt4MpctM,0.0,2020-05-22 15:23:28,False,False
2020-05-29T07:50:43,samuel L. jackson is the best person say Motherfucker!!😂,0,0,Ashim Gorkhali,IpKmt4MpctM,1.0,2020-05-29 07:50:43,False,False
