timestamp,text,like_count,reply_count,author,trailer_id,sentiment_score,datetime,used_for_model,used_for_visualization
2016-09-12T05:56:45,nice,0,0,Ivette Centeno,isQ5Ycie73U,0.6,2016-09-12 05:56:45,True,True
2016-09-12T07:06:04,This just looks terrible.,0,0,Nick Pali,isQ5Ycie73U,-1.0,2016-09-12 07:06:04,True,True
2016-09-12T07:49:54,"Don't mind me, just fishing for Oscars here.",0,0,Robert Gomes,isQ5Ycie73U,0.0,2016-09-12 07:49:54,True,True
2016-09-12T08:53:36,"Now the real question is, do we get to see a movie about this Howard Character? or just another movie of Will Smith playing Will Smith",0,0,Ben Walker,isQ5Ycie73U,0.2,2016-09-12 08:53:36,True,True
2016-09-12T09:07:58,He will win his Oscar for this,0,0,The You Tuba,isQ5Ycie73U,0.8,2016-09-12 09:07:58,True,True
2016-09-12T10:21:22,I wrote a letter to children and Misha appeared.,0,0,LopezLand,isQ5Ycie73U,0.0,2016-09-12 10:21:22,True,True
2016-09-12T11:24:40,looks like a very moving and heartfelt story.......sounds great,0,0,Victor M,isQ5Ycie73U,0.3333333333333333,2016-09-12 11:24:40,True,True
2016-09-12T11:54:04,Deadshot,0,0,LUCILLE IS THIRSTY,isQ5Ycie73U,0.0,2016-09-12 11:54:04,True,True
2016-09-12T12:04:11,First came the SELF HELP BOOKS Now SELF HELP FILMS tomorrow?,0,0,Renato Sousa,isQ5Ycie73U,0.25,2016-09-12 12:04:11,True,True
2016-09-12T12:31:01,that's an amazing cast,0,0,Anton Rabovila,isQ5Ycie73U,0.6000000000000001,2016-09-12 12:31:01,True,True
2016-09-12T12:31:59,Oscar!!!!!!!!!,0,0,Gold Lenz,isQ5Ycie73U,0.0,2016-09-12 12:31:59,True,True
2016-09-12T12:57:45,Not all that impressed with Will Smith anymore.,7,9,riteasrain,isQ5Ycie73U,1.0,2016-09-12 12:57:45,True,True
2016-09-12T13:02:16,"this looks amazing, i'm also happy cus they're using two steps from hell music!",0,0,tristaphobia1,isQ5Ycie73U,0.8,2016-09-12 13:02:16,True,True
2016-09-12T14:03:47,"Clearly I'm not here to connect... I don't long for love, don't really care much for more time, and honestly don't fear death.  Can't really go around making these blanket statements when most people are nowhere near it... Just saying.",4,10,FreeFlamingInfinite,isQ5Ycie73U,0.27,2016-09-12 14:03:47,True,True
2016-09-12T15:17:13,Oscar bait,0,0,Meitei Luwang,isQ5Ycie73U,0.0,2016-09-12 15:17:13,True,True
2016-09-12T15:17:40,Is this before Deadshot joins Suicide Squad?,387,7,bibbyshibby,isQ5Ycie73U,0.0,2016-09-12 15:17:40,True,True
2016-09-12T15:19:49,"Will Smith, you are a liar, I have no will to watch this",16,7,Thomas Paul,isQ5Ycie73U,0.0,2016-09-12 15:19:49,True,True
2016-09-12T15:30:54,Oscar Winner in the making,0,0,Kamilion51,isQ5Ycie73U,0.0,2016-09-12 15:30:54,True,True
2016-09-12T15:38:59,OMG YAY MORE HACKNEYED HOLLYWOOD HORSESHIT OMG OMG CAN'T WAIT!!!!,6,0,Commander Keen,isQ5Ycie73U,1.0,2016-09-12 15:38:59,True,True
2016-09-12T15:47:59,"OMG ! trailer is just brilliant. Absolute fuckin awesome. And Will Smith you're surely going to be nominate for The Oscar or maybe going to win it. can't wat to watch ""The Collateral Beauty""",1,0,Walter Fcuking White,isQ5Ycie73U,0.68,2016-09-12 15:47:59,True,True
2016-09-12T16:00:11,Deadshot x Hulk x Luis (Ant-Man) =D,0,0,Fidel Ramadhan,isQ5Ycie73U,1.0,2016-09-12 16:00:11,True,True
2016-09-12T16:49:13,i think will smith is really a good actor,0,0,xxxzzz zzzx,isQ5Ycie73U,0.7,2016-09-12 16:49:13,True,True
2016-09-12T16:59:47,Am I the only one who thinks Will Smith has become super corny?,27,3,RizzyWow,isQ5Ycie73U,0.16666666666666666,2016-09-12 16:59:47,True,True
2016-09-12T17:01:16,Golden cast,0,0,Christian John,isQ5Ycie73U,0.3,2016-09-12 17:01:16,True,True
2016-09-12T17:22:14,"Movie looks like garbage just like will smiths acting career for the past decade of being MIA and no one wanting him in there films LOL.  Will Smith should just jiggy his way out of movies or just stick to making sequels from his dead career like Men in black 24, Bad boys 66, Wild wild west part 15 & uh....I robot LOL. Those sure are classics lololol.    Will smith just go away and get another job other then a actor cuz that ship has sank maybe as a janitor at a local high school LOL",0,0,artcast25,isQ5Ycie73U,0.1298809523809524,2016-09-12 17:22:14,True,True
2016-09-12T17:48:04,Oscar bait.,0,0,Lee Alsworth,isQ5Ycie73U,0.0,2016-09-12 17:48:04,True,True
2016-09-12T17:55:48,nice,0,0,Victor Victor,isQ5Ycie73U,0.6,2016-09-12 17:55:48,True,True
2016-09-12T17:56:34,"I have lost a child going on 3 years in November. I felt such a connection to this movie. Life is a precious gift, i have had to learn to accept things and to go on without my son, but the love he gave me and the memories have helped make me who i'am today.",1,0,Jenny Rios,isQ5Ycie73U,0.3333333333333333,2016-09-12 17:56:34,True,True
2016-09-12T17:58:51,Hilarious.,0,0,Aigracier,isQ5Ycie73U,0.5,2016-09-12 17:58:51,True,True
2016-09-12T19:05:23,Hey  mate .. Omfg drop I prefer # it   taxpayer  :‑D,0,0,Sam Jonsson,isQ5Ycie73U,0.0,2016-09-12 19:05:23,True,True
2016-09-12T19:13:08,"Looks good but most likely will not do well here in the US. To many females, minorities, and not enough explosions.",0,0,Deep Elements,isQ5Ycie73U,0.33999999999999997,2016-09-12 19:13:08,True,True
2016-09-12T19:36:55,cool concept.,0,0,abhiman gowda,isQ5Ycie73U,0.35,2016-09-12 19:36:55,True,True
2016-09-12T20:43:14,"Uh oh, another whimsical, soft music Will Smith movie where he's a ""deep"" black man, which automatically means if he's not nominated for an Oscar it's racism......again.",0,0,adam ropp,isQ5Ycie73U,-0.14166666666666666,2016-09-12 20:43:14,True,True
2016-09-12T20:50:57,intresting movie,0,0,F T,isQ5Ycie73U,0.0,2016-09-12 20:50:57,True,True
2016-09-12T21:06:15,you can see how talented will smith is just by watching a movie trailer.,0,0,La Nani,isQ5Ycie73U,0.7,2016-09-12 21:06:15,True,True
2016-09-12T21:31:25,Looks like a bunch of melodramatic bullshit.,0,0,Barstool Blues,isQ5Ycie73U,0.0,2016-09-12 21:31:25,True,True
2016-09-12T22:02:09,Well... that's gonna suck balls,0,0,Lars Nielsen,isQ5Ycie73U,0.0,2016-09-12 22:02:09,True,True
2016-09-12T23:39:02,Or maybe will smith is time...,0,0,ERA77074,isQ5Ycie73U,0.0,2016-09-12 23:39:02,True,True
2016-09-12T23:58:19,love me some Jacob latimore!!,0,0,Nessa Nessa,isQ5Ycie73U,0.78125,2016-09-12 23:58:19,True,True
2016-09-13T00:04:13,Come on Will Smith not again. We get your sad movies,0,0,matt g,isQ5Ycie73U,-0.5,2016-09-13 00:04:13,True,True
2016-09-13T00:17:09,why is Eddie murphy looking younger than will smith,0,0,MontellGuyVlogs,isQ5Ycie73U,0.0,2016-09-13 00:17:09,True,True
2016-09-13T00:25:18,is this the sequel to after eat=rth?,0,0,mxvideogamemaster,isQ5Ycie73U,0.0,2016-09-13 00:25:18,True,True
2016-09-13T01:44:33,Idk how anyone can say it's poorly written from simply seeing a film's trailer?,0,0,Kate Zaccagnini,isQ5Ycie73U,-0.2,2016-09-13 01:44:33,True,True
2016-09-13T04:18:28,This looks stupid good.,0,0,Chase M,isQ5Ycie73U,-0.04999999999999999,2016-09-13 04:18:28,True,True
2016-09-13T04:30:05,Jada is already planning on boycotting the Oscars in. 2017,0,0,Vince Tookenay,isQ5Ycie73U,0.0,2016-09-13 04:30:05,True,True
2016-09-13T04:39:51,TWO STEPS FROM HELL! WOOOO!,0,0,doddy hidayat,isQ5Ycie73U,0.0,2016-09-13 04:39:51,True,True
2016-09-13T04:45:04,When the ad before the trailer is the actual trailer 😪 come on YT.,0,0,Bria Diamond,isQ5Ycie73U,0.0,2016-09-13 04:45:04,True,True
2016-09-13T06:12:40,"Will Smith has forgot where he came from....I will never give that self centered, in educated, super spoiled man 10 cents to see his films",0,0,Newz Flash,isQ5Ycie73U,0.3333333333333333,2016-09-13 06:12:40,True,True
2016-09-13T06:20:25,Im getting a Scrooge vibe from this. 3 entities sent to fix a broken man.,4,1,Dean Murphy,isQ5Ycie73U,-0.4,2016-09-13 06:20:25,True,True
2016-09-13T06:23:11,This trailer gave me chills so bad and nearly made me cry looks like a good movie,0,0,Hani Z,isQ5Ycie73U,0.03333333333333336,2016-09-13 06:23:11,True,True
2016-09-13T06:55:57,Along juice replacement graduate,0,0,Matthew Ward,isQ5Ycie73U,0.0,2016-09-13 06:55:57,True,True
2016-09-13T07:34:12,When you go watch a trailer for a movie and the add you get is the movie. xD,7,3,Abraham Diaz,isQ5Ycie73U,0.0,2016-09-13 07:34:12,True,True
2016-09-13T09:46:12,love is having Such British accent....,0,0,Rohit Tamaskar,isQ5Ycie73U,0.16666666666666666,2016-09-13 09:46:12,True,True
2016-09-13T09:46:49,cat i like  it strogqly temperature  =D,0,0,Noah Hudson,isQ5Ycie73U,1.0,2016-09-13 09:46:49,True,True
2016-09-13T10:58:44,"""hahhh""",0,0,Rowan W,isQ5Ycie73U,0.0,2016-09-13 10:58:44,True,True
2016-09-13T12:07:11,pure schlock,0,0,chaosinorderrr,isQ5Ycie73U,0.21428571428571427,2016-09-13 12:07:11,True,True
2016-09-13T14:25:44,Norton 1 - Smith 0 Like if you agree !,1,0,Dan x,isQ5Ycie73U,0.0,2016-09-13 14:25:44,True,True
2016-09-13T16:59:22,"Another, love conquers all. Just enough with the feel good bull shit. Will Smith, step out of your comfort zone.",0,0,_Maidez_,isQ5Ycie73U,0.25,2016-09-13 16:59:22,True,True
2016-09-13T17:15:31,"Congratulations Thomas Bergersen for having your absolutely beautiful song in this trailer! For anyone who wants to know, it's called Remember Me :)",1,0,The Sky Is A Blessing In Disguise,isQ5Ycie73U,0.5666666666666667,2016-09-13 17:15:31,True,True
2016-09-13T17:29:41,awesome..!!!,0,0,Vidit Dhanalakota,isQ5Ycie73U,1.0,2016-09-13 17:29:41,True,True
2016-09-13T18:10:40,"how i'm gon pay these bills man,",0,0,Lavanya Sivagnanam,isQ5Ycie73U,0.0,2016-09-13 18:10:40,True,True
2016-09-13T18:19:19,"I'm not crying, my eyes are just sweating.",0,0,Nduati Kuria,isQ5Ycie73U,0.1,2016-09-13 18:19:19,True,True
2016-09-13T23:34:51,I think this will be a good movie it relates to those who hate life,0,0,stevewonder1212,isQ5Ycie73U,-0.050000000000000044,2016-09-13 23:34:51,True,True
2016-09-13T23:53:29,Gonna write a letter to harambe,1163,15,One Thousand Midgets,isQ5Ycie73U,0.0,2016-09-13 23:53:29,True,True
2016-09-14T01:31:46,"Plot seems pretty cool and original, but missing one thing... Jesus. Don't flood the comments now",5,9,Davon Taylor,isQ5Ycie73U,0.19374999999999998,2016-09-14 01:31:46,True,True
2016-09-14T01:50:30,good trailer.. didnt give to much away. :),0,0,Bewildering Truth Seeker,isQ5Ycie73U,0.4666666666666666,2016-09-14 01:50:30,True,True
2016-09-14T01:56:41,where margo?,0,0,Cole Bailey,isQ5Ycie73U,0.0,2016-09-14 01:56:41,True,True
2016-09-14T02:10:23,"50/50 either Oscar bait, sappy bullshit or an absolutely amazing movie. There's a lot of talent in this.",13,3,Owen McCauley,isQ5Ycie73U,0.6000000000000001,2016-09-14 02:10:23,True,True
2016-09-14T02:30:31,Will smith better win an oscar,0,0,The CuStudent,isQ5Ycie73U,0.65,2016-09-14 02:30:31,True,True
2016-09-14T02:59:01,Can Will Smith make a big draw movie anymore?? This guy used to be a big draw now he's taking any role and fading into C list status.,0,0,Bobby,isQ5Ycie73U,0.0,2016-09-14 02:59:01,True,True
2016-09-14T03:00:36,So Time is a young black man? No wonder everybody kills Time.,1,0,Matt Britzius,isQ5Ycie73U,-0.033333333333333326,2016-09-14 03:00:36,True,True
2016-09-14T03:14:52,"Nice try Willy, maybe next year.",0,0,MDub,isQ5Ycie73U,0.3,2016-09-14 03:14:52,True,True
2016-09-14T03:49:44,too many great actors for this to be bad,0,0,Julyana Batista,isQ5Ycie73U,0.20000000000000007,2016-09-14 03:49:44,True,True
2016-09-14T04:02:29,You wouldn't make independence day 2 but you would make this bore fest? What happened to you Will Smith?,0,0,Hwhaler97,isQ5Ycie73U,0.0,2016-09-14 04:02:29,True,True
2016-09-14T04:40:53,We're some kind of suicide squad???? ( ͡° ͜ʖ ͡°),3,0,The Dopest,isQ5Ycie73U,0.6,2016-09-14 04:40:53,True,True
2016-09-14T04:53:20,This movie is oscarbating,0,0,T Spoon,isQ5Ycie73U,0.0,2016-09-14 04:53:20,True,True
2016-09-14T05:44:18,"For some reason i am getting ""A Christmas Carol"" vibes from this...",0,0,Lionheart,isQ5Ycie73U,0.0,2016-09-14 05:44:18,True,True
2016-09-14T06:33:10,This looks interesting.  Finally the Will Smith we all want to see in movies.,0,0,KN Byam,isQ5Ycie73U,0.25,2016-09-14 06:33:10,True,True
2016-09-14T07:31:24,I like how love got British accent,0,0,Xmixer,isQ5Ycie73U,0.25,2016-09-14 07:31:24,True,True
2016-09-14T08:31:08,i am soo watching this when it comes out....!!!1,1,0,VJ Klips,isQ5Ycie73U,0.0,2016-09-14 08:31:08,True,True
2016-09-14T09:00:03,Diversity Rocks,0,0,UltimateBattleRap,isQ5Ycie73U,0.0,2016-09-14 09:00:03,True,True
2016-09-14T09:16:11,"If u liked that trailer music, look up Thomas Bergenson ""Remember Me"" beautiful no",0,0,Philip Alzate,isQ5Ycie73U,0.725,2016-09-14 09:16:11,True,True
2016-09-14T10:50:30,And then he wakes up in his cell to the sound of Bohemian Rhapsody.,0,0,Jadandlud,isQ5Ycie73U,0.4,2016-09-14 10:50:30,True,True
2016-09-14T10:57:02,im crying just by watching the trailer,1,0,Hacker Week,isQ5Ycie73U,-0.2,2016-09-14 10:57:02,True,True
2016-09-14T11:41:47,wrg,0,0,Zes,isQ5Ycie73U,0.0,2016-09-14 11:41:47,True,True
2016-09-14T11:42:49,"I'm a simple Will Smith fan. Will Smith makes a new movie, I'm bound to watch that movie sooner or later. Let's see what this one has to offer.",98,10,Nessie Jr,isQ5Ycie73U,0.04545454545454545,2016-09-14 11:42:49,True,True
2016-09-14T12:06:06,Real life inside out(accept its a movie),0,0,Bradley Jackson,isQ5Ycie73U,0.2,2016-09-14 12:06:06,True,True
2016-09-14T12:12:44,I WANT TO SEE THIS,0,0,zana brisk,isQ5Ycie73U,0.0,2016-09-14 12:12:44,True,True
2016-09-14T12:17:45,"Looks good.  annnnd, thank goodness he's the only Smith in it.",0,0,S Lanche,isQ5Ycie73U,0.35,2016-09-14 12:17:45,True,True
2016-09-14T12:34:50,what is the name of the background Music?,0,0,Jeevraj Bhojwani,isQ5Ycie73U,0.0,2016-09-14 12:34:50,True,True
2016-09-14T12:36:04,Will Smith used to be a comedian,0,0,Omar Arif,isQ5Ycie73U,0.0,2016-09-14 12:36:04,True,True
2016-09-14T12:36:43,"Wow, another fantasy film for black people about imaginary nice black people!  Nice to take a break from all the BLM bullshit!",1,2,マコト,isQ5Ycie73U,0.215,2016-09-14 12:36:43,True,True
2016-09-14T13:08:50,OMG..... CHILLS ALL OVER !! CAN'T WAIT .. I WOULD HUG WILL SMITH AND THANK HIM IF HE WAS HERE !!!,0,0,Aravinth S,isQ5Ycie73U,0.0,2016-09-14 13:08:50,True,True
2016-09-14T13:20:21,Kinda looks like a knockoff of christmas carol... Oh well,0,0,Telecan,isQ5Ycie73U,0.0,2016-09-14 13:20:21,True,True
2016-09-14T13:28:05,Can't wait,0,0,woroud Al-Ohaly,isQ5Ycie73U,0.0,2016-09-14 13:28:05,True,True
2016-09-14T14:38:13,"I think this movie will be so damn good! I already have tears without knowing, really have a beautiful message in that movie that we have to appreciate life. Just cant wait to watch this",1,0,Bethari Larasati,isQ5Ycie73U,0.6416666666666666,2016-09-14 14:38:13,True,True
2016-09-14T14:49:38,time and death yes. love is optional.,0,0,Jj Sands,isQ5Ycie73U,0.5,2016-09-14 14:49:38,True,True
2016-09-14T15:56:30,"I don't want Collateral Beauty, give me hancock 2",1,3,Cheeky Bastard,isQ5Ycie73U,0.0,2016-09-14 15:56:30,True,True
2016-09-14T16:07:34,I like this,0,0,MR Tech and Stuff,isQ5Ycie73U,0.0,2016-09-14 16:07:34,True,True
2016-09-14T16:07:58,This is going to be deep.,0,0,MR Tech and Stuff,isQ5Ycie73U,0.0,2016-09-14 16:07:58,True,True
2016-09-14T16:31:23,Man. I see all the good comments below. And my only thought is: Thomas Bergersen tends to have that effect on people. xD,1,0,Audio Arcturia,isQ5Ycie73U,0.35,2016-09-14 16:31:23,True,True
2016-09-14T16:36:34,"The music screams ""FEEL SOMETHING!"" but the trailer still failed to move me.",3,0,Venser,isQ5Ycie73U,-0.5,2016-09-14 16:36:34,True,True
2016-09-14T16:54:29,1:00 Nope i'm not having any of this shit. LOL,0,0,JusticeTuna,isQ5Ycie73U,0.30000000000000004,2016-09-14 16:54:29,True,True
2016-09-14T16:59:30,فلم جميل جدا,0,0,ibrahim pompa,isQ5Ycie73U,0.0,2016-09-14 16:59:30,True,True
2016-09-14T17:12:07,This story got sumthing special elements ! waiting fr it ! 😊 👌,0,0,Shin BeatX,isQ5Ycie73U,0.5580357142857143,2016-09-14 17:12:07,True,True
2016-09-14T17:49:50,It seems like a modern day Scrooge,1,0,MrGreg Detroit,isQ5Ycie73U,0.2,2016-09-14 17:49:50,True,True
2016-09-14T18:52:46,OMG I want to see!!,1,0,Savannah K.,isQ5Ycie73U,0.0,2016-09-14 18:52:46,True,True
2016-09-14T19:05:53,Seems like bullshit to me,0,0,akamouse100,isQ5Ycie73U,0.0,2016-09-14 19:05:53,True,True
2016-09-14T19:08:01,this looks real good. looks like a well rounded story.,67,1,B.L.W.,isQ5Ycie73U,1.0,2016-09-14 19:08:01,True,True
2016-09-14T19:17:53,I see Will trying for that Oscar,0,0,Barbara Williams,isQ5Ycie73U,0.0,2016-09-14 19:17:53,True,True
2016-09-14T19:33:32,Not a fan of a homophobe like will smith. Will skip movie.,0,0,Ash A,isQ5Ycie73U,0.0,2016-09-14 19:33:32,True,True
2016-09-14T20:07:22,This made me tear up but then I needed to shit so I had to man up,9,0,JumpingJellyMan,isQ5Ycie73U,-0.2,2016-09-14 20:07:22,True,True
2016-09-14T20:10:07,this is going to be a really good movie as an omage to classic tales of learning.  But it would have been awesome if it explored the philosophy of these thng.,0,0,Angel Pygs,isQ5Ycie73U,0.6222222222222222,2016-09-14 20:10:07,True,True
2016-09-14T20:36:57,WTF do you gave to watch a F-ing commercial to watch an F-ing commercial?,0,0,Hay Seed,isQ5Ycie73U,-0.16666666666666666,2016-09-14 20:36:57,True,True
2016-09-14T20:52:18,Think I might go see this one!,1,0,SashaPJ79,isQ5Ycie73U,0.0,2016-09-14 20:52:18,True,True
2016-09-14T21:16:00,Looks really good.,0,0,Domonique Kyle,isQ5Ycie73U,0.7,2016-09-14 21:16:00,True,True
2016-09-14T21:17:12,This is the perfect trailer. My butt is already in the seat so please don't give anymore information about the story. Don't ruin it,0,0,crimson ph34r,isQ5Ycie73U,1.0,2016-09-14 21:17:12,True,True
2016-09-14T21:20:34,"Looks like a plot ripped and slightly edited from the Christian book: ""The Shack""",0,0,Chikiriwak,isQ5Ycie73U,-0.08333333333333333,2016-09-14 21:20:34,True,True
2016-09-14T21:28:18,"I like the idea of like, Death, Time, and Love personified but why did they have to make this the cheesiest looking thing ever? Like you only needed like have this trailer. Like why do we need Kate Winslet or Edward Norton, they both seem useless so far. What the hell.",0,0,rebecca,isQ5Ycie73U,-0.06000000000000001,2016-09-14 21:28:18,True,True
2016-09-14T22:13:44,"trailer doesn't look good but we'll wait n c, u never know",0,0,UV0023,isQ5Ycie73U,0.7,2016-09-14 22:13:44,True,True
2016-09-14T22:21:20,"One word, ""Brilliant."" Just hope the movie is just as good because its a movie I'd love to watch with my girlfriend on Christmas.",0,0,Jimmy L,isQ5Ycie73U,0.7000000000000001,2016-09-14 22:21:20,True,True
2016-09-14T22:27:58,Is this a sequel to Collateral Damage?,0,0,rolie25,isQ5Ycie73U,0.0,2016-09-14 22:27:58,True,True
2016-09-14T22:32:29,Prince of bel air,0,0,mrhersheys,isQ5Ycie73U,0.0,2016-09-14 22:32:29,True,True
2016-09-14T23:43:32,"Another movie to add to the ""Nope"" pile.",0,0,Seal of Approval,isQ5Ycie73U,0.0,2016-09-14 23:43:32,True,True
2016-09-15T00:07:59,Two people from Pirates of the Caribbean? Awesomeness!,2,3,The Brave Introvert,isQ5Ycie73U,0.0,2016-09-15 00:07:59,True,True
2016-09-15T00:17:17,"Will smith retourn whit kate wislet,edward norton and helen mirren",0,0,LeVrai Cinéman,isQ5Ycie73U,0.0,2016-09-15 00:17:17,True,True
2016-09-15T00:27:34,this actually looks really good.,0,0,jordan riggs,isQ5Ycie73U,0.35,2016-09-15 00:27:34,True,True
2016-09-15T00:34:11,Put it on mute and sing the fresh prince of bell air song .its the best:),0,0,Larry bobson Butternubs,isQ5Ycie73U,0.6,2016-09-15 00:34:11,True,True
2016-09-15T00:59:03,I love supporting Will Smith might go to see it!,0,0,BigSauce gizmo,isQ5Ycie73U,0.40625,2016-09-15 00:59:03,True,True
2016-09-15T01:01:28,Will Smith there must be a role that I can play in a few movie with you that would be the greatest thing happened in my whole life,0,0,Antonette Miller,isQ5Ycie73U,0.3333333333333333,2016-09-15 01:01:28,True,True
2016-09-15T01:47:53,Shiamalan music ,0,0,L,isQ5Ycie73U,0.0,2016-09-15 01:47:53,True,True
2016-09-15T02:05:22,Will Smith movies getting worse day by day,0,0,Chill Study Music,isQ5Ycie73U,-0.4,2016-09-15 02:05:22,True,True
2016-09-15T02:14:19,damn this looks pretentious. willy trying a bit too hard for that oscar.,0,0,LexiconPunk,isQ5Ycie73U,-0.29583333333333334,2016-09-15 02:14:19,True,True
2016-09-15T02:19:32,0_o,0,0,SoCalFreelance,isQ5Ycie73U,0.0,2016-09-15 02:19:32,True,True
2016-09-15T02:31:05,Hancock 1:27?,0,0,McLovinBoi,isQ5Ycie73U,0.0,2016-09-15 02:31:05,True,True
2016-09-15T02:34:18,wait wait wait where is death or is he in the dark corner,0,0,nathan Zapatier,isQ5Ycie73U,-0.15,2016-09-15 02:34:18,True,True
2016-09-15T03:25:19,"Modern retelling of ""A Christmas Carol""?",0,0,benarcher45,isQ5Ycie73U,0.2,2016-09-15 03:25:19,True,True
2016-09-15T03:53:40,"""Will Smith movie…"" ?!?! I love him, but all the other actors in it… I mean… come on! They deserve to be in the title, damn that casting tho 😳😍",0,0,Alexandra Perreault,isQ5Ycie73U,0.171875,2016-09-15 03:53:40,True,True
2016-09-15T05:34:13,"WOW,,,",0,0,Prashant,isQ5Ycie73U,0.1,2016-09-15 05:34:13,True,True
2016-09-15T05:47:03,a post 2000's movie in 2016 hahaha,0,0,Alexis Pemberton Smith,isQ5Ycie73U,0.2,2016-09-15 05:47:03,True,True
2016-09-15T09:58:48,i like will Smith a great actor,0,0,Karen Bensinger,isQ5Ycie73U,0.8,2016-09-15 09:58:48,True,True
2016-09-15T10:00:59,i want to find love again,0,0,Karen Bensinger,isQ5Ycie73U,0.5,2016-09-15 10:00:59,True,True
2016-09-15T11:04:13,"Yep, a addictive hallmark movie",0,0,Gryffin Slater,isQ5Ycie73U,0.0,2016-09-15 11:04:13,True,True
2016-09-15T11:53:09,"they mustve said: okay lets get this guy an oscar now, its time...",0,0,Dudeldani,isQ5Ycie73U,0.5,2016-09-15 11:53:09,True,True
2016-09-15T11:53:33,I am death I am time I am love Me. I am Mr Blobby! Fear me mortal!,0,0,Colonel .Cuddles,isQ5Ycie73U,0.78125,2016-09-15 11:53:33,True,True
2016-09-15T12:04:56,20 seconds in I'm in love with this movie.,0,0,Megh Balika,isQ5Ycie73U,0.5,2016-09-15 12:04:56,True,True
2016-09-15T12:29:05,soccer central disappointed jaw southwest.,0,0,Evan Webb,isQ5Ycie73U,-0.375,2016-09-15 12:29:05,True,True
2016-09-15T13:06:29,meet joe black person,0,0,vcwchen,isQ5Ycie73U,-0.16666666666666666,2016-09-15 13:06:29,True,True
2016-09-15T13:39:56,An oscar worthy performance I'm sure! :P,0,0,Wynand Becker,isQ5Ycie73U,0.5694444444444444,2016-09-15 13:39:56,True,True
2016-09-15T13:59:45,"Won't watch anything that Will Smith is in. He's an egotistical, piece of trash!",0,0,Nelson Quinnell,isQ5Ycie73U,0.0,2016-09-15 13:59:45,True,True
2016-09-15T14:07:24,"Wait, so Will-Smith does age? Damn this must be a very well editted movie.",0,0,iammmmblack,isQ5Ycie73U,0.2,2016-09-15 14:07:24,True,True
2016-09-15T16:38:06,"Can't wait for this! Looks inspiring.... not to mention seeing my two fav actors, Will and Ed, working together.",2,0,Jailee Jones,isQ5Ycie73U,0.5,2016-09-15 16:38:06,True,True
2016-09-15T16:42:57,Jacob latimore❤,0,0,Naisiae Mainka,isQ5Ycie73U,0.0,2016-09-15 16:42:57,True,True
2016-09-15T17:24:33,Doesn't look to bad. But he needs to go back to what he does best. Comedy/Action.,0,0,Steven Langenfeld,isQ5Ycie73U,0.10000000000000005,2016-09-15 17:24:33,True,True
2016-09-15T18:24:06,mite b kool.  i'm ok w/these inspirational watchamajiggies,0,0,Tulip Dew,isQ5Ycie73U,0.5,2016-09-15 18:24:06,True,True
2016-09-15T18:58:21,Will smith olan her film güzeldir,0,0,ARDA Oyunda,isQ5Ycie73U,0.0,2016-09-15 18:58:21,True,True
2016-09-15T19:15:03,ayy new update on YouTube mobile app let's you like comments 😃👐,0,0,Raphael Khan,isQ5Ycie73U,0.13636363636363635,2016-09-15 19:15:03,True,True
2016-09-15T19:32:41,DDDDDEEEEEEPPPPPPPP,0,0,Adan Aladdin,isQ5Ycie73U,0.0,2016-09-15 19:32:41,True,True
2016-09-15T19:56:23,Is this A Christmas Carol reboot?,0,0,Hansuke,isQ5Ycie73U,0.0,2016-09-15 19:56:23,True,True
2016-09-15T21:03:13,a christmas carol again really,0,0,Ben Brown,isQ5Ycie73U,0.2,2016-09-15 21:03:13,True,True
2016-09-15T21:33:33,"I need to make 20,000 more accounts to thumbs down this shit show.",0,0,Kevin L,isQ5Ycie73U,0.04814814814814814,2016-09-15 21:33:33,True,True
2016-09-15T22:33:51,Oooh.. the Academy Award's Christmas ad!,0,0,Alia Ris,isQ5Ycie73U,0.0,2016-09-15 22:33:51,True,True
2016-09-15T23:29:10,"Ohh, a Spike Lee movie.",0,0,Joel R.,isQ5Ycie73U,0.0,2016-09-15 23:29:10,True,True
2016-09-16T00:25:44,😮😃,0,0,Elizabeth,isQ5Ycie73U,0.0,2016-09-16 00:25:44,True,True
2016-09-16T00:40:11,Is this a book?,0,0,N. J. Saroff,isQ5Ycie73U,0.0,2016-09-16 00:40:11,True,True
2016-09-16T00:51:00,HAVESH5 YO,2,0,d[^_^]b,isQ5Ycie73U,0.0,2016-09-16 00:51:00,True,True
2016-09-16T01:01:50,"Rewrite ""A christmas carol"" and then rebrand it as a movie. Yeah nice work hollywood.",0,0,Waverley,isQ5Ycie73U,0.6,2016-09-16 01:01:50,True,True
2016-09-16T01:19:03,"I know this question is going to be asked....but where is the other who aren't just caucasian. Great story, still wish for variety in culture.",0,0,Mika Kurogami,isQ5Ycie73U,0.3375,2016-09-16 01:19:03,True,True
2016-09-16T01:33:52,I'm getting a slight Scrooge vibe...,0,0,Klopp's Teeth,isQ5Ycie73U,-0.16666666666666666,2016-09-16 01:33:52,True,True
2016-09-16T02:22:37,I have no idea what this is about.,0,0,canuck21,isQ5Ycie73U,0.0,2016-09-16 02:22:37,True,True
2016-09-16T03:03:08,"The background music from 0:25-0:49 sounds familiar to something from the The Danish Girl soundtrack. Hopefully it isn't and that it's just for promo but I don't know. Love the music anyways, maybe I'm just crazy~",0,0,Andrea Wat,isQ5Ycie73U,0.09166666666666667,2016-09-16 03:03:08,True,True
2016-09-16T03:15:03,I really want to see this movie!!!!!😂,0,0,Hopeful Dawne Hale,isQ5Ycie73U,0.2,2016-09-16 03:15:03,True,True
2016-09-16T05:15:03,This might be the film that saves my life...,0,0,King_Svveat,isQ5Ycie73U,0.0,2016-09-16 05:15:03,True,True
2016-09-16T05:45:30,WHY DID NO ONE TELL ME KEIRA KNIGHTLEY IS GONNA BE IN A NEW MOVIE COMING OUT IN 4 MONTHS,0,0,silenabeauregard1,isQ5Ycie73U,0.13636363636363635,2016-09-16 05:45:30,True,True
