timestamp,text,like_count,reply_count,author,trailer_id,sentiment_score,datetime,used_for_model,used_for_visualization
2016-09-07T13:24:00,like,0,0,Saud Shaikh,isQ5Ycie73U,0.0,2016-09-07 13:24:00,True,True
2016-09-07T13:24:06,first,1,0,mudakful,isQ5Ycie73U,0.25,2016-09-07 13:24:06,True,True
2016-09-07T13:24:11,cool😎😎😎😎,0,0,mexican dog,isQ5Ycie73U,0.0,2016-09-07 13:24:11,True,True
2016-09-07T13:24:20,⊂_ヽ 　 ＼＼ 　　 ＼( ͡° ͜ʖ ͡°) 　　 　⌒ヽ 　　　/ 　 へ＼ 　　 /　　/　＼＼ 　　 ﾚ　ノ　　 ヽ_つ 　　/　/ 　 /　/| 　(　(ヽ 　|　|、＼ 　| 丿 ＼ ⌒) 　| |　　) / `ノ )　　Lﾉ (_／,3,0,Bolt the Superdog,isQ5Ycie73U,0.0,2016-09-07 13:24:20,True,True
2016-09-07T13:24:23,looks shit,0,0,Raunaq Chandak,isQ5Ycie73U,-0.2,2016-09-07 13:24:23,True,True
2016-09-07T13:24:29,before 1 million,0,0,SAIIAN,isQ5Ycie73U,0.0,2016-09-07 13:24:29,True,True
2016-09-07T13:24:38,second,0,0,Angelin,isQ5Ycie73U,0.0,2016-09-07 13:24:38,True,True
2016-09-07T13:24:39,first first,0,0,PotMaster,isQ5Ycie73U,0.25,2016-09-07 13:24:39,True,True
2016-09-07T13:24:48,first comment + first disliker,0,0,akrama irshad,isQ5Ycie73U,0.25,2016-09-07 13:24:48,True,True
2016-09-07T13:24:55,will smith!!,0,0,cinematicz don,isQ5Ycie73U,0.0,2016-09-07 13:24:55,True,True
2016-09-07T13:24:58,primeiro,0,0,Airton soares,isQ5Ycie73U,0.0,2016-09-07 13:24:58,True,True
2016-09-07T13:24:58,👍👌👍👍👍👍👍👍👍,0,0,ELEMDOR,isQ5Ycie73U,0.0,2016-09-07 13:24:58,True,True
2016-09-07T13:25:09,Honestly no matter how fucked up his kids are or how social media shoes Will Smith his acting is some of the best.,1,0,Perfectly Balanced,isQ5Ycie73U,0.026666666666666682,2016-09-07 13:25:09,True,True
2016-09-07T13:25:15,first,1,0,Hero Man,isQ5Ycie73U,0.25,2016-09-07 13:25:15,True,True
2016-09-07T13:25:24,firs t  sa tga,0,0,Humble,isQ5Ycie73U,0.0,2016-09-07 13:25:24,True,True
2016-09-07T13:25:39,"So, that's it, hun...? We some kinda ""beauty"" squad?",0,0,Miss X,isQ5Ycie73U,0.0,2016-09-07 13:25:39,True,True
2016-09-07T13:25:47,Can't wait!!!!!,0,0,Husain Hubail,isQ5Ycie73U,0.0,2016-09-07 13:25:47,True,True
2016-09-07T13:25:50,Will Smith is a Over Rated Actor.... He is a fine example of Bad Acting...,8,25,IJ SAY,isQ5Ycie73U,-0.09444444444444439,2016-09-07 13:25:50,True,True
2016-09-07T13:26:12,Third,0,0,Mahad uthman Uthman,isQ5Ycie73U,0.0,2016-09-07 13:26:12,True,True
2016-09-07T13:26:13,Early,0,0,Rscc,isQ5Ycie73U,0.1,2016-09-07 13:26:13,True,True
2016-09-07T13:26:17,yup,0,0,Gordon Li,isQ5Ycie73U,0.0,2016-09-07 13:26:17,True,True
2016-09-07T13:26:20,stupid,0,0,Joseph Gonzales,isQ5Ycie73U,-0.7999999999999999,2016-09-07 13:26:20,True,True
2016-09-07T13:26:34,"mixed feelings right now, I dont even know whats going on here",0,0,Kwanangombe,isQ5Ycie73U,0.14285714285714285,2016-09-07 13:26:34,True,True
2016-09-07T13:26:44,Looks awesome!,0,0,Chris Eaf,isQ5Ycie73U,1.0,2016-09-07 13:26:44,True,True
2016-09-07T13:26:45,will smith i like you..but u old now find some other hobby,2,8,Hammad Pervez,isQ5Ycie73U,-0.012499999999999997,2016-09-07 13:26:45,True,True
2016-09-07T13:27:14,Looks good.,0,0,Smokey Stoner,isQ5Ycie73U,0.7,2016-09-07 13:27:14,True,True
2016-09-07T13:27:23,"That's right that's right, Kiera Knightley is love.",145,10,Shark Team,isQ5Ycie73U,0.35714285714285715,2016-09-07 13:27:23,True,True
2016-09-07T13:28:03,Hey my man is back.,0,0,Ahmed Alshamsi,isQ5Ycie73U,0.0,2016-09-07 13:28:03,True,True
2016-09-07T13:28:05,What an amazing cast,0,1,Ben Maguire,isQ5Ycie73U,0.6000000000000001,2016-09-07 13:28:05,True,True
2016-09-07T13:28:18,good movie👍,0,0,negative Causing,isQ5Ycie73U,0.7,2016-09-07 13:28:18,True,True
2016-09-07T13:28:18,So this is Inside out for adults.,375,18,Shoeb Khan,isQ5Ycie73U,0.0,2016-09-07 13:28:18,True,True
2016-09-07T13:28:25,"Reply to this comment, or you'll get a spider in your butt.",0,0,Uncreative username,isQ5Ycie73U,0.0,2016-09-07 13:28:25,True,True
2016-09-07T13:28:33,SO GOOOD !,0,0,Humble,isQ5Ycie73U,0.0,2016-09-07 13:28:33,True,True
2016-09-07T13:28:34,for some reason this reminded me of 'i am legend',0,0,Toobey,isQ5Ycie73U,0.0,2016-09-07 13:28:34,True,True
2016-09-07T13:28:37,Oh look another movie where Will Smith plays Will Smith.,0,0,hadoukient,isQ5Ycie73U,0.0,2016-09-07 13:28:37,True,True
2016-09-07T13:28:38,made for oscar movie,0,0,Husain Ad9,isQ5Ycie73U,0.0,2016-09-07 13:28:38,True,True
2016-09-07T13:28:38,"It seems a little too much for me. It was fine until ""Death"" and ""Love"" appeared. Could become very cheesy very quickly.",1,0,JamesB00n,isQ5Ycie73U,0.11875000000000001,2016-09-07 13:28:38,True,True
2016-09-07T13:28:41,please give Will Smith an Oscar for this!,1,0,Akshat Jain,isQ5Ycie73U,0.0,2016-09-07 13:28:41,True,True
2016-09-07T13:28:46,damn that looks good,0,0,alexgator23,isQ5Ycie73U,0.7,2016-09-07 13:28:46,True,True
2016-09-07T13:28:52,thank you...  finally something different to see,0,0,Raghuvir Gumber,isQ5Ycie73U,0.0,2016-09-07 13:28:52,True,True
2016-09-07T13:28:58,This movie feels emotional,0,0,LTG,isQ5Ycie73U,0.0,2016-09-07 13:28:58,True,True
2016-09-07T13:29:01,"It seems interesting, but I won't watch it.",12,0,Ali Alsaba,isQ5Ycie73U,0.5,2016-09-07 13:29:01,True,True
2016-09-07T13:29:06,If i write a letter to god he better be Morgan Freeman,1047,29,HB33,isQ5Ycie73U,0.5,2016-09-07 13:29:06,True,True
2016-09-07T13:29:11,Will Smith might finally get an Oscar!,71,19,CutToBlackFilm,isQ5Ycie73U,0.0,2016-09-07 13:29:11,True,True
2016-09-07T13:29:21,Hi there,0,0,Caroline,isQ5Ycie73U,0.0,2016-09-07 13:29:21,True,True
2016-09-07T13:29:31,This looks emotionally good i just hope it doesn't have a sad or bad twist,0,0,renji90998,isQ5Ycie73U,-0.16666666666666663,2016-09-07 13:29:31,True,True
2016-09-07T13:29:32,first 100 viewer,0,0,Snider J,isQ5Ycie73U,0.25,2016-09-07 13:29:32,True,True
2016-09-07T13:29:36,It's been awhile since i've looked forward to a Will Smith starred movie. An original idea we do not tend to see.,3,0,Sheaslife,isQ5Ycie73U,0.375,2016-09-07 13:29:36,True,True
2016-09-07T13:29:46,He still is and wil always be one of the best actors we will ever have the privileges of seeing (Will is the best!),4,0,kemGkem,isQ5Ycie73U,1.0,2016-09-07 13:29:46,True,True
2016-09-07T13:30:02,"Amazing cast, even though I feel Will Smith is a miscast for this movie.",38,25,Mario Habijanec,isQ5Ycie73U,0.6000000000000001,2016-09-07 13:30:02,True,True
2016-09-07T13:30:13,💖⌛️☠,0,0,renji90998,isQ5Ycie73U,0.0,2016-09-07 13:30:13,True,True
2016-09-07T13:30:28,I am all in on this.,0,0,Paul Turner,isQ5Ycie73U,0.0,2016-09-07 13:30:28,True,True
2016-09-07T13:30:29,Of course they make the old lady Death.,0,0,Boss Ross,isQ5Ycie73U,0.1,2016-09-07 13:30:29,True,True
2016-09-07T13:30:34,"well, christmas movies!",0,0,A EL,isQ5Ycie73U,0.0,2016-09-07 13:30:34,True,True
2016-09-07T13:30:42,At first I was really uncertain but around 0:58 I got sold on the sort of movie I'd never usually see.,0,0,Mark Samenfink,isQ5Ycie73U,0.19166666666666665,2016-09-07 13:30:42,True,True
2016-09-07T13:30:54,meh,0,0,kelvis hoffer,isQ5Ycie73U,0.0,2016-09-07 13:30:54,True,True
2016-09-07T13:31:24,"Also, Rosebud is a slay.",0,0,Boss Ross,isQ5Ycie73U,0.0,2016-09-07 13:31:24,True,True
2016-09-07T13:31:29,7 pounds meets inside out?,186,8,Hamdan Andalousiy,isQ5Ycie73U,0.0,2016-09-07 13:31:29,True,True
2016-09-07T13:31:30,will smith will finally get the oscar he deserves,0,0,Mohannad Abdellatif,isQ5Ycie73U,0.0,2016-09-07 13:31:30,True,True
2016-09-07T13:31:38,Hitch 2: Collateral Beauty,7,0,CutToBlackFilm,isQ5Ycie73U,0.0,2016-09-07 13:31:38,True,True
2016-09-07T13:33:02,get the tissue box,0,0,TUKMAK,isQ5Ycie73U,0.0,2016-09-07 13:33:02,True,True
2016-09-07T13:33:29,This seems dumb,0,0,habbogigi,isQ5Ycie73U,-0.375,2016-09-07 13:33:29,True,True
2016-09-07T13:33:32,Another will smith movie ?!??,1,2,xJay90x,isQ5Ycie73U,0.0,2016-09-07 13:33:32,True,True
2016-09-07T13:33:41,Live action Inside out?,0,0,Top Gun52,isQ5Ycie73U,0.11818181818181818,2016-09-07 13:33:41,True,True
2016-09-07T13:34:36,I love already.,0,0,Mark,isQ5Ycie73U,0.5,2016-09-07 13:34:36,True,True
2016-09-07T13:34:44,Will I go see this movie? --> 1:01,0,0,EuGenius,isQ5Ycie73U,0.0,2016-09-07 13:34:44,True,True
2016-09-07T13:35:22,A 2 minute teaser trailer?😒,0,0,ImBrysor,isQ5Ycie73U,0.0,2016-09-07 13:35:22,True,True
2016-09-07T13:35:22,"The thing that sucks about last year's big Oscar's scandal was diversity is that when Will Smith finally does win an Oscar everyone will think it's to appease the masses and not because he's a superior actor. Because quality of acting is subjective, that issue is going hang over minority success.",0,0,Chad Richards,isQ5Ycie73U,0.1875,2016-09-07 13:35:22,True,True
2016-09-07T13:35:23,"im sorry, but all i can see is ""I am Legend"" and deadshot..",0,0,Doup Ils,isQ5Ycie73U,-0.5,2016-09-07 13:35:23,True,True
2016-09-07T13:35:33,Will Smith is a great action star but I just can't take him seriously in a role like this,0,0,Lennie Godber,isQ5Ycie73U,0.18888888888888888,2016-09-07 13:35:33,True,True
2016-09-07T13:35:44,Give him an Oscar already,0,0,Ryenge Gaming,isQ5Ycie73U,0.0,2016-09-07 13:35:44,True,True
2016-09-07T13:36:06,"Did someone say "" OSCAR BAIT !!!!""",0,0,Akhil Sindher,isQ5Ycie73U,0.0,2016-09-07 13:36:06,True,True
2016-09-07T13:36:19,I like it how this video get more views than the official trailer from Warner brothers.         not saying that this is not the official trailer.,0,0,Mushroom Lau,isQ5Ycie73U,0.5,2016-09-07 13:36:19,True,True
2016-09-07T13:36:56,"""When she called me daddy"" lmao",0,0,Administrator,isQ5Ycie73U,0.6,2016-09-07 13:36:56,True,True
2016-09-07T13:37:11,"i will watch this film,i loved it so much. thanks",0,0,Bayarsaukhan Zoljargal,isQ5Ycie73U,0.44999999999999996,2016-09-07 13:37:11,True,True
2016-09-07T13:38:02,"What if, just imagine, what if.        Shrek played love in this movie. Will Smith talked to an animated Shrek for 2 hours about love.",0,0,605jik,isQ5Ycie73U,0.5,2016-09-07 13:38:02,True,True
2016-09-07T13:38:32,Probably a tear jerker,0,0,aHairyWhiteGuy,isQ5Ycie73U,0.0,2016-09-07 13:38:32,True,True
2016-09-07T13:38:41,Deadshot: After Arkham Asylum,0,0,Hagoromo Ōtsutsuki,isQ5Ycie73U,0.0,2016-09-07 13:38:41,True,True
2016-09-07T13:39:03,End credits    *Will Smith suddenly wears deadshots outfit and start shoot shit up.,51,6,Mushroom Lau,isQ5Ycie73U,-0.1,2016-09-07 13:39:03,True,True
2016-09-07T13:39:13,This guy is old,0,0,Gregory mthemba,isQ5Ycie73U,0.1,2016-09-07 13:39:13,True,True
2016-09-07T13:39:30,What?! No Jaden?!,0,0,Satvik Soni,isQ5Ycie73U,0.0,2016-09-07 13:39:30,True,True
2016-09-07T13:39:33,If the teaser is 2 mins long the actual trailer may be the whole movie.,0,0,Jonatas Nogueira,isQ5Ycie73U,0.05000000000000001,2016-09-07 13:39:33,True,True
2016-09-07T13:39:42,Teaser trailer????,0,0,You G0t Th1s,isQ5Ycie73U,0.0,2016-09-07 13:39:42,True,True
2016-09-07T13:39:44,"So either this is the Christmas Carol or his friends hired actors to play love, death and time.",1,0,Kevin Coogan,isQ5Ycie73U,0.5,2016-09-07 13:39:44,True,True
2016-09-07T13:40:01,This looks like a lifetime movie with REALLY good actors.,18,0,charley15z,isQ5Ycie73U,0.7,2016-09-07 13:40:01,True,True
2016-09-07T13:40:08,"Finally, the Deadshot solo movie we've been waiting for",0,0,Aaron Vitug,isQ5Ycie73U,0.0,2016-09-07 13:40:08,True,True
2016-09-07T13:40:26,How did they get so many big-time actors signed up for this schmaltzy bullshit? I bet it does really well in America and bombs to shit everywhere else.,0,0,Vee Macks,isQ5Ycie73U,0.16666666666666666,2016-09-07 13:40:26,True,True
2016-09-07T13:41:03,this looks amazing,0,0,Shyam Parakkal,isQ5Ycie73U,0.6000000000000001,2016-09-07 13:41:03,True,True
2016-09-07T13:41:17,"some one made a Will Smith movie without aliens, Comic Books, Margot Robbie, one of his kids or a fake African accent? How was this possible?",37,11,chriskoob,isQ5Ycie73U,-0.0625,2016-09-07 13:41:17,True,True
2016-09-07T13:41:25,deadshot got insane after so much action!!,0,0,gart 97,isQ5Ycie73U,-0.421875,2016-09-07 13:41:25,True,True
2016-09-07T13:42:10,😵⌚💕,0,0,cj pe,isQ5Ycie73U,0.0,2016-09-07 13:42:10,True,True
2016-09-07T13:42:13,Holy Feels!,0,0,Kwai Brown,isQ5Ycie73U,0.0,2016-09-07 13:42:13,True,True
2016-09-07T13:42:16,The cast is stunning! And this movie looks wonderful. Looking forward to it.,0,0,Giuliano,isQ5Ycie73U,0.8125,2016-09-07 13:42:16,True,True
2016-09-07T13:42:35,YUUUUUUUUUUUUUUUUH !!!!!!! More than a movie,0,0,T M,isQ5Ycie73U,0.5,2016-09-07 13:42:35,True,True
2016-09-07T13:42:37,Seven Pounds prequel.,0,0,Winduct,isQ5Ycie73U,0.0,2016-09-07 13:42:37,True,True
2016-09-07T13:42:43,with the given cast ensemble its gonna be hit,0,0,Sports ki baat,isQ5Ycie73U,0.0,2016-09-07 13:42:43,True,True
2016-09-07T13:42:54,Still waiting for Wild Wild West 2,0,0,FireBomberBassist,isQ5Ycie73U,0.1,2016-09-07 13:42:54,True,True
2016-09-07T13:43:18,Hollywood sure loves to make sappy movies focused on maincharacters with autistic traits.  Gotta hit the feels to tap that Oscar-booty if you know what I mean.,0,0,Heil Jewbacca,isQ5Ycie73U,-0.00416666666666667,2016-09-07 13:43:18,True,True
2016-09-07T13:43:26,Another awesomely bad name for a movie,0,0,Woke AF,isQ5Ycie73U,-0.6999999999999998,2016-09-07 13:43:26,True,True
2016-09-07T13:43:42,"Will Smith won't win an Oscar for this,  Harambe will.",200,16,OPtimist VG,isQ5Ycie73U,0.8,2016-09-07 13:43:42,True,True
2016-09-07T13:43:52,whoa chills...i've got to see this!,0,0,It's_ tru,isQ5Ycie73U,0.0,2016-09-07 13:43:52,True,True
2016-09-07T13:44:01,How does a cast this good wind up in a movie this cheesy and on-the-nose?,0,0,Christian Hagen,isQ5Ycie73U,0.09999999999999998,2016-09-07 13:44:01,True,True
2016-09-07T13:44:15,"this movie is so beautiful ,I'm nearly to tears watching this",0,0,Kearra Parrish,isQ5Ycie73U,0.475,2016-09-07 13:44:15,True,True
2016-09-07T13:44:20,deadshot?!,0,0,Treelon Musk,isQ5Ycie73U,0.0,2016-09-07 13:44:20,True,True
2016-09-07T13:45:13,Screw Will Smith,0,0,Goat Liberator,isQ5Ycie73U,0.0,2016-09-07 13:45:13,True,True
2016-09-07T13:45:41,Oscar worthy movie,1,3,followtheflow2,isQ5Ycie73U,0.3333333333333333,2016-09-07 13:45:41,True,True
2016-09-07T13:45:47,"So that's it, huh? We're some kind of suicide squad?",0,0,DJBananaCrazy,isQ5Ycie73U,0.6,2016-09-07 13:45:47,True,True
2016-09-07T13:46:37,راح انتظر عرض الفيلم ثانية ثانية  ويل سميث من افضل الممثلين واتمنى ينال حقه هو وكل الممثلين الملونيين إن شاء الله يترشح للأوسكار 2017,0,0,آل باتشينو,isQ5Ycie73U,0.0,2016-09-07 13:46:37,True,True
2016-09-07T13:46:44,Will is my fav actor... but Please stick to ACTION MOVIES..,0,0,Captain Noah,isQ5Ycie73U,0.1,2016-09-07 13:46:44,True,True
2016-09-07T13:46:51,Boring,0,0,mrfit92,isQ5Ycie73U,-1.0,2016-09-07 13:46:51,True,True
2016-09-07T13:47:18,I guess we get to move on from Leo oscar memes to Smith oscar memes.,0,0,Vass Gergely,isQ5Ycie73U,0.0,2016-09-07 13:47:18,True,True
2016-09-07T13:48:18,anybody else notice the score in this trailer is from The Danish Girl?,0,0,Classics Productions,isQ5Ycie73U,0.0,2016-09-07 13:48:18,True,True
2016-09-07T13:48:25,No...we do not fear death..... Only evil persons fear death...,0,0,Aeon 1111,isQ5Ycie73U,-0.5,2016-09-07 13:48:25,True,True
2016-09-07T13:48:32,these commments lmfao,0,0,Damaris Thomas,isQ5Ycie73U,0.0,2016-09-07 13:48:32,True,True
2016-09-07T13:49:58,When an Oscar movie is trying so hard it forgets to be good and gets no nominations,0,0,Justin Jaeger,isQ5Ycie73U,0.20416666666666664,2016-09-07 13:49:58,True,True
2016-09-07T13:50:57,This would have been better with out will smith,0,0,selick,isQ5Ycie73U,0.5,2016-09-07 13:50:57,True,True
2016-09-07T13:51:47,This looks good,0,0,Darioriga,isQ5Ycie73U,0.7,2016-09-07 13:51:47,True,True
2016-09-07T13:52:19,"I'm calling it, Death, Time and Love are actors hired by his friends.",0,0,Tad Load,isQ5Ycie73U,0.5,2016-09-07 13:52:19,True,True
2016-09-07T13:52:28,It is that time everyone.,0,0,Zach Couch,isQ5Ycie73U,0.0,2016-09-07 13:52:28,True,True
2016-09-07T13:52:55,"this might turn out to be really cheesy real quick but from this trailer i really liked it, it has an innocence to it xD and come one look at this cast wow",0,0,Arabella8069,isQ5Ycie73U,0.175,2016-09-07 13:52:55,True,True
2016-09-07T13:52:57,This is like that movie with Don Cheadle and Adam Sandler,0,0,Brian Baer,isQ5Ycie73U,0.0,2016-09-07 13:52:57,True,True
2016-09-07T13:53:10,I so badly want to see Will Smith get an Oscar ☺,0,0,Connor Rodney,isQ5Ycie73U,-0.6999999999999998,2016-09-07 13:53:10,True,True
2016-09-07T13:53:52,I wanna write a letter to harambe,445,11,gustinex,isQ5Ycie73U,0.0,2016-09-07 13:53:52,True,True
2016-09-07T13:53:54,Might be good. at least it has Will Smith and Edward Norton.,0,0,RumbleHD,isQ5Ycie73U,0.19999999999999998,2016-09-07 13:53:54,True,True
2016-09-07T13:54:09,I dönt know. I'm not sure about this,0,0,Hunting Don,isQ5Ycie73U,-0.25,2016-09-07 13:54:09,True,True
2016-09-07T13:54:39,Apparently Will Smith really wants an Oscar.,0,0,Anton Tati,isQ5Ycie73U,0.125,2016-09-07 13:54:39,True,True
2016-09-07T13:55:28,I totally switched off when Helen Mirren come on,0,0,Anton,isQ5Ycie73U,0.0,2016-09-07 13:55:28,True,True
2016-09-07T13:55:54,Wow Fantastic. I'm gonna cry bra,0,0,John Constantine,isQ5Ycie73U,0.25,2016-09-07 13:55:54,True,True
2016-09-07T13:56:34,Smith going for the Oscar,0,0,Harry Jackson,isQ5Ycie73U,0.0,2016-09-07 13:56:34,True,True
2016-09-07T13:58:10,"""I WANT AN OSCAR THIS TIME!!!"" Will Smith",0,0,NinjaGizmo,isQ5Ycie73U,0.0,2016-09-07 13:58:10,True,True
2016-09-07T13:58:24,Oscar Bait: The Sappening,0,0,Chris Duffey,isQ5Ycie73U,0.0,2016-09-07 13:58:24,True,True
2016-09-07T13:58:24,"Hollywood trying so hard to write something meaningful and the best they can come up with is to take a nice guy, shattered by tragedy, combined with Scrooges ghosts of christmas, and Edward Norton. -_-   I'd rather watch Kim Jon Un's ""Modesty of a God""",0,0,Matthew,isQ5Ycie73U,0.4520833333333333,2016-09-07 13:58:24,True,True
2016-09-07T14:00:19,It kinda lost it mojo when they became people,0,0,Yassen,isQ5Ycie73U,0.0,2016-09-07 14:00:19,True,True
2016-09-07T14:00:28,scrooge?,1,0,Charl E,isQ5Ycie73U,0.0,2016-09-07 14:00:28,True,True
2016-09-07T14:01:49,dafuq /,0,0,Mahmudur Limon,isQ5Ycie73U,0.0,2016-09-07 14:01:49,True,True
2016-09-07T14:01:53,Seems over the top,0,0,mohamed abukar,isQ5Ycie73U,0.5,2016-09-07 14:01:53,True,True
2016-09-07T14:01:58,Where did Keira's lips go!?,0,0,@KreativeMente,isQ5Ycie73U,0.0,2016-09-07 14:01:58,True,True
2016-09-07T14:02:01,Ekko? what are you doing here?!,0,0,Viety,isQ5Ycie73U,0.0,2016-09-07 14:02:01,True,True
2016-09-07T14:02:14,Director of spotlight Will Smith Edward Norton Kate winslet Oscar confirmed.,0,0,judge,isQ5Ycie73U,0.4,2016-09-07 14:02:14,True,True
2016-09-07T14:02:51,Wow that touched my soul......now I have to watch the Max Steel trailer to balance it out.,0,0,Arun,isQ5Ycie73U,0.1,2016-09-07 14:02:51,True,True
2016-09-07T14:02:51,"With such an awesome cast, such an amazing plot and such a beautiful trailer+ost, this movie better be good. This and Rogue One are what I'm waiting for now this December.",2,0,Sushant Thapaliya,isQ5Ycie73U,0.45625000000000004,2016-09-07 14:02:51,True,True
2016-09-07T14:03:06,"Good Movie, Shit name",0,0,TeaSniffers,isQ5Ycie73U,0.24999999999999997,2016-09-07 14:03:06,True,True
2016-09-07T14:03:20,"Michael peña will be the only funny thing in this movie, I guarantee it",0,0,AlexLun,isQ5Ycie73U,0.125,2016-09-07 14:03:20,True,True
2016-09-07T14:03:26,This looks so good,0,0,Ted Carine,isQ5Ycie73U,0.7,2016-09-07 14:03:26,True,True
2016-09-07T14:03:40,the story of deadshot,0,0,Nopeiamawesome,isQ5Ycie73U,0.0,2016-09-07 14:03:40,True,True
2016-09-07T14:03:42,"They're 3 things that connect every human. Food, Marvel's movies, and sex",0,0,farasapt,isQ5Ycie73U,0.0,2016-09-07 14:03:42,True,True
2016-09-07T14:03:46,Yep. No doubt I'll be seeing this. Need a good uplifting film every so often.,0,0,Brett Van Boven,isQ5Ycie73U,0.7,2016-09-07 14:03:46,True,True
2016-09-07T14:04:06,My god I love the cast,0,0,NadiaKon,isQ5Ycie73U,0.5,2016-09-07 14:04:06,True,True
2016-09-07T14:05:03,"""This December...""  all that matters is,    Rogue One!",0,0,Eder Lopez,isQ5Ycie73U,0.0,2016-09-07 14:05:03,True,True
2016-09-07T14:06:17,lol,0,0,salsa2good,isQ5Ycie73U,0.8,2016-09-07 14:06:17,True,True
2016-09-07T14:06:27,"Imma cry when I watch this, I'm sure of it",73,0,Blue,isQ5Ycie73U,0.5,2016-09-07 14:06:27,True,True
2016-09-07T14:06:30,"Suicide Squad Origins: Deadshot - with the other Hulk, Luis from Antman, Queen elizabeth, the chick from the bond movies, pirate elizabeth swan and Rose Dawson 😂😂",0,0,Agustin Herrera,isQ5Ycie73U,0.2375,2016-09-07 14:06:30,True,True
2016-09-07T14:06:52,"Normally i dont like this kind of movies, but this one... I will go to see it. IDK why.",2,0,Aaack Aardvark,isQ5Ycie73U,0.375,2016-09-07 14:06:52,True,True
2016-09-07T14:07:05,HOLY CAST!!,0,0,Fiddle Head Media House,isQ5Ycie73U,0.0,2016-09-07 14:07:05,True,True
2016-09-07T14:08:10,will smith. i hate you. a family of arrogance and nepotism. he hasnt made a good movie in 15 years,0,0,Colin Weiss,isQ5Ycie73U,-0.050000000000000044,2016-09-07 14:08:10,True,True
2016-09-07T14:08:24,What a cast..,0,0,kkkkk,isQ5Ycie73U,0.0,2016-09-07 14:08:24,True,True
2016-09-07T14:08:59,is this one of those chrisitan movies that i never watch or care about or why i am commenting on this trailer oh why what is that big giant monster behind me oh no why  i keep rambling on about a movie that ohh oh h now the monster giving me a bj oh oh aaaaaaahhhhhh ....,0,0,Damn_Robotz_2,isQ5Ycie73U,-0.13333333333333333,2016-09-07 14:08:59,True,True
2016-09-07T14:09:33,Please Give an Oscar to will this time.... and give Kate her 8th Oscar Nomination <3,2,0,Kateamby winslet,isQ5Ycie73U,1.0,2016-09-07 14:09:33,True,True
2016-09-07T14:11:04,Just give Will Smith A Oscar for his excellent work over the years. DO IT NOW.,0,0,Alex Xander,isQ5Ycie73U,1.0,2016-09-07 14:11:04,True,True
2016-09-07T14:11:13,New york  advertising budget and you cast will smith really ?,0,0,Socomnick,isQ5Ycie73U,0.16818181818181818,2016-09-07 14:11:13,True,True
2016-09-07T14:11:40,great concept but totally wasted. looks like an Oscar bait movie.,0,0,Sohel Islam,isQ5Ycie73U,0.30000000000000004,2016-09-07 14:11:40,True,True
2016-09-07T14:12:22,well that looks shit,0,0,Rory Sweeney,isQ5Ycie73U,-0.2,2016-09-07 14:12:22,True,True
2016-09-07T14:13:07,Honestly this look pretentious and shit.,112,36,Adrian Flo,isQ5Ycie73U,0.033333333333333326,2016-09-07 14:13:07,True,True
2016-09-07T14:13:19,I'll wait til it's on netflix,1,0,Annalisa Blake,isQ5Ycie73U,0.0,2016-09-07 14:13:19,True,True
2016-09-07T14:13:33,Interesting... we'll see.,0,0,59254356,isQ5Ycie73U,0.5,2016-09-07 14:13:33,True,True
2016-09-07T14:14:07,Big Willie!,0,0,Christian Fox,isQ5Ycie73U,0.0,2016-09-07 14:14:07,True,True
2016-09-07T14:15:10,"Will Smith is a good actor, although these type of movies seem to cliche and shit lol",0,0,xStePzx,isQ5Ycie73U,0.43333333333333335,2016-09-07 14:15:10,True,True
2016-09-07T14:17:07,I'm crying already :'(,0,0,Human,isQ5Ycie73U,-0.6,2016-09-07 14:17:07,True,True
2016-09-07T14:17:27,I rather see a Hancock 2 than this.,0,0,SlowMotion,isQ5Ycie73U,0.0,2016-09-07 14:17:27,True,True
2016-09-07T14:17:38,I'm confused,0,0,Quinn Lightfoot,isQ5Ycie73U,-0.4,2016-09-07 14:17:38,True,True
2016-09-07T14:17:42,live action inside out?,0,0,Nd Video,isQ5Ycie73U,0.11818181818181818,2016-09-07 14:17:42,True,True
2016-09-07T14:17:56,That score... 👍,0,0,Nkululeko Spellman,isQ5Ycie73U,0.0,2016-09-07 14:17:56,True,True
2016-09-07T14:18:07,3xDope...,0,0,U.C.ME!! Visuals MG,isQ5Ycie73U,0.0,2016-09-07 14:18:07,True,True
2016-09-07T14:18:13,music trailer plz anyone ?,0,0,احا كماعة,isQ5Ycie73U,0.0,2016-09-07 14:18:13,True,True
2016-09-07T14:18:14,They made an academy award sandwich with the actors,0,0,Patsy Ketsy,isQ5Ycie73U,0.0,2016-09-07 14:18:14,True,True
2016-09-07T14:18:29,Just give an Oscar to Will Smith already.,0,0,Yusuf Patheria,isQ5Ycie73U,0.0,2016-09-07 14:18:29,True,True
2016-09-07T14:18:30,Hey look there's a new movie on youtube theater.. you don't have to pay anything.. just watch the trailer and you'll get it...,0,0,Owais Siddqui,isQ5Ycie73U,0.13636363636363635,2016-09-07 14:18:30,True,True
2016-09-07T14:19:46,I dont understand why much hate towards Will Smith  Is it bcoz he acted in DC movie or you dont understand what good acting really is??  Cmon Guys Will Smith will be one of the best actors in this world ;),0,0,Nikhil Krishnan,isQ5Ycie73U,0.22499999999999998,2016-09-07 14:19:46,True,True
2016-09-07T14:20:22,KATE WINSLET IS THERE WHAT ELSE YOU NEED <3,0,0,Kateamby winslet,isQ5Ycie73U,1.0,2016-09-07 14:20:22,True,True
2016-09-07T14:20:35,This has to be a awesome movie it has to,0,0,applepearhero,isQ5Ycie73U,1.0,2016-09-07 14:20:35,True,True
2016-09-07T14:20:38,Hopefully Will Smith funally wins an Oscar he's overdue,0,0,Tony Lawliet,isQ5Ycie73U,0.3,2016-09-07 14:20:38,True,True
2016-09-07T14:20:59,they should have cast will smith smh,0,0,space ghost,isQ5Ycie73U,0.0,2016-09-07 14:20:59,True,True
2016-09-07T14:21:55,finally the Oscar for will smith,0,0,Kostas Pantazis,isQ5Ycie73U,0.0,2016-09-07 14:21:55,True,True
2016-09-07T14:22:20,ZzzZzzZZzz another snorefest about feelings When did Will Smith stop being cool and became such a Wuzz? I guess after Hancock.,0,0,Grim Bonkers,isQ5Ycie73U,0.175,2016-09-07 14:22:20,True,True
2016-09-07T14:23:38,emotions,0,0,Kamal Hossain,isQ5Ycie73U,0.0,2016-09-07 14:23:38,True,True
2016-09-07T14:24:38,This film will be the disappointment of the year.,0,0,suren,isQ5Ycie73U,-0.6,2016-09-07 14:24:38,True,True
2016-09-07T14:25:14,Lol I didn't even need to skip the ad,1,0,Clarence Escuella,isQ5Ycie73U,0.8,2016-09-07 14:25:14,True,True
