timestamp,text,like_count,reply_count,author,trailer_id,sentiment_score,datetime,used_for_model,used_for_visualization
2016-09-08T04:15:35,"So time is a black kid, and death is an old white lady. Makes sense.       P.S. Who is Will Smith? After last years Oscar snafu where he whined that he wasn't nominated... I can't take this guy seriously.  Ed Norton is still cool though.",0,0,Roger Wayne,isQ5Ycie73U,-0.008333333333333331,2016-09-08 04:15:35,True,True
2016-09-08T04:22:56,Reign Over Will.,0,0,TFA Daryl,isQ5Ycie73U,0.0,2016-09-08 04:22:56,True,True
2016-09-08T04:27:19,It's Oscar time for Will Smith!,0,0,Truthwarrior,isQ5Ycie73U,0.0,2016-09-08 04:27:19,True,True
2016-09-08T04:29:54,stole the music from MASS Effect3!!!!!!!!!!,0,0,Mako,isQ5Ycie73U,0.0,2016-09-08 04:29:54,True,True
2016-09-08T04:40:06,Damn. This looks deep af,0,0,Zeus,isQ5Ycie73U,0.0,2016-09-08 04:40:06,True,True
2016-09-08T04:41:27,I wrote a letter to bullshit and Donald Trump appeared.,825,25,M Azzopardi,isQ5Ycie73U,0.0,2016-09-08 04:41:27,True,True
2016-09-08T04:41:48,Jacob Latimore in this lol im a fan of him he is a good actor btw,0,0,MiltoENT,isQ5Ycie73U,0.75,2016-09-08 04:41:48,True,True
2016-09-08T05:01:59,Looks pretty good,0,0,christen oninku,isQ5Ycie73U,0.475,2016-09-08 05:01:59,True,True
2016-09-08T05:03:19,"Looks like ""Let's surround Will Smith as many Oscar winners/nominees as we can and perhaps he might actually WIN one!""  Lol.. Looks like a romantic dramedy, but it's will smith so I'm in. Although i still have yet to see Seven Pounds",0,0,Nd Dymium,isQ5Ycie73U,0.575,2016-09-08 05:03:19,True,True
2016-09-08T05:17:05,ASS GAS!!!!!,0,0,Thatman Q,isQ5Ycie73U,0.0,2016-09-08 05:17:05,True,True
2016-09-08T05:22:02,call Bill Murray..what a rip off,0,0,HarryLopez82,isQ5Ycie73U,0.0,2016-09-08 05:22:02,True,True
2016-09-08T05:22:54,"Hulk , Deadshot and Antman's best friend......ultimate comic crossover",0,0,Ishwar Bulbule,isQ5Ycie73U,0.625,2016-09-08 05:22:54,True,True
2016-09-08T05:30:53,this looks breathtaking,0,0,Johanna Weiss,isQ5Ycie73U,1.0,2016-09-08 05:30:53,True,True
2016-09-08T05:31:52,omg..this trailer made me cry,0,0,Ahmed Hyper,isQ5Ycie73U,0.0,2016-09-08 05:31:52,True,True
2016-09-08T05:34:50,"how does love betray him (not the person playing the role, the meaning itself?",0,0,mussatorre,isQ5Ycie73U,0.5,2016-09-08 05:34:50,True,True
2016-09-08T05:35:16,Great cast but maybe too much star power,0,0,The ManDragon,isQ5Ycie73U,0.5,2016-09-08 05:35:16,True,True
2016-09-08T05:42:51,"Oh, snap, this looks good.",0,0,Caffeinated Nation,isQ5Ycie73U,0.7,2016-09-08 05:42:51,True,True
2016-09-08T05:58:48,I literally got goosebumps while watching this. This is OSCAR material.,0,0,Anfal Arshad,isQ5Ycie73U,0.0,2016-09-08 05:58:48,True,True
2016-09-08T06:01:08,So what is it about? At least his shitty kids are not in it.,0,0,doger riders,isQ5Ycie73U,-0.3,2016-09-08 06:01:08,True,True
2016-09-08T06:04:55,Movies gonna go over half the populations head,0,0,Subject50Studios,isQ5Ycie73U,-0.16666666666666666,2016-09-08 06:04:55,True,True
2016-09-08T06:09:35,kinda reminds me of crash just a little,0,0,Quentin Coberley,isQ5Ycie73U,-0.1875,2016-09-08 06:09:35,True,True
2016-09-08T06:11:36,this movie is going to win a oscer,0,0,Jason Wells,isQ5Ycie73U,0.8,2016-09-08 06:11:36,True,True
2016-09-08T06:17:42,"Plot Twist: Love, Death, and Time are people hired by his friends to help him cope.",0,0,Danen3,isQ5Ycie73U,0.5,2016-09-08 06:17:42,True,True
2016-09-08T06:21:22,Another Oscar bait movie,0,0,ding a dong,isQ5Ycie73U,0.0,2016-09-08 06:21:22,True,True
2016-09-08T06:24:36,uhmmm ok!,0,0,Furtalance_x,isQ5Ycie73U,0.625,2016-09-08 06:24:36,True,True
2016-09-08T06:38:12,It seems will smith looks little older now,0,0,Shisir Koirala,isQ5Ycie73U,-0.010416666666666671,2016-09-08 06:38:12,True,True
2016-09-08T06:49:25,Does anyone know what the name of the music is,0,0,Aurora Hill,isQ5Ycie73U,0.0,2016-09-08 06:49:25,True,True
2016-09-08T06:49:45,"10 bucks says that they're trying to help by pretending to be love, death, and time.",1,0,VioletIsBulletproof,isQ5Ycie73U,0.5,2016-09-08 06:49:45,True,True
2016-09-08T06:56:12,"The movie looks great, but that trailer really sucked haha in terms of it being incredibly over-dramatic, but I definitely want to see the movie.",0,0,Cole Silver,isQ5Ycie73U,0.42000000000000004,2016-09-08 06:56:12,True,True
2016-09-08T07:05:07,so a sappy modern Christmas Carol rip off...?,0,0,Gareth Vers,isQ5Ycie73U,0.2,2016-09-08 07:05:07,True,True
2016-09-08T07:07:25,wow didnt know will smith had haters like that lol,0,0,Mobius,isQ5Ycie73U,0.45,2016-09-08 07:07:25,True,True
2016-09-08T07:11:52,keira's underbite is annoying,0,0,kk P,isQ5Ycie73U,-0.8,2016-09-08 07:11:52,True,True
2016-09-08T07:23:48,"It's funny when they add that ""Academy Award Nominee"" in front of the first three names, and then suddenly there is just Michael Pena and other cast members, like they don't need introduction and proof that they are serious actors.",0,0,NicKeLas,isQ5Ycie73U,0.008333333333333337,2016-09-08 07:23:48,True,True
2016-09-08T07:30:26,"Man, this cast!!!!!",0,0,Gabo Proust,isQ5Ycie73U,0.0,2016-09-08 07:30:26,True,True
2016-09-08T07:32:18,The moment you realise that advert you are watching before the trailer... is actually the trailer itself.,0,0,J Roscoe,isQ5Ycie73U,0.0,2016-09-08 07:32:18,True,True
2016-09-08T07:46:08,*I wont survive if i die.*,0,0,Ada Horror,isQ5Ycie73U,0.0,2016-09-08 07:46:08,True,True
2016-09-08T07:56:41,This could be so great but odds are it will be awful.,0,0,Otakuako842002,isQ5Ycie73U,-0.09999999999999998,2016-09-08 07:56:41,True,True
2016-09-08T08:06:44,love the concept,0,0,hellaBayAr3a,isQ5Ycie73U,0.5,2016-09-08 08:06:44,True,True
2016-09-08T08:33:55,The Collateral Booty riiiiiiht?:D:D:D,0,0,Sorin B,isQ5Ycie73U,0.0,2016-09-08 08:33:55,True,True
2016-09-08T08:55:08,"MR SMITH, YOU DID IT AGAIN. YOU'RE  A VERY IMPRESSIVE ACTOR, ONE OF A KIND NO ONE CAN BRING MAGIC TO THE CAMERA MAYBE IT IS YOUR PERSONALITY, BUT IT'S AMAZING I CAN'T WAIT TO SEE BAD BOYS 3",0,0,Joseph Villa,isQ5Ycie73U,0.4000000000000001,2016-09-08 08:55:08,True,True
2016-09-08T09:15:25,You'd have to have a heart of stone to see this & not laugh.,0,0,DArin Hendershot,isQ5Ycie73U,-0.15,2016-09-08 09:15:25,True,True
2016-09-08T09:15:56,YES WILL SMITH IN ANOTHER MOVIE!!!!!!!!!!!,0,0,Jezza437,isQ5Ycie73U,0.0,2016-09-08 09:15:56,True,True
2016-09-08T09:28:32,حلو دا،  بس ميجيبش اوسكار برضو,0,0,Ahmed Dalatony,isQ5Ycie73U,0.0,2016-09-08 09:28:32,True,True
2016-09-08T09:32:26,"On the one hand it's a Will Smith movie.  On the other hand, there hasn't been a movie made like this in a long long time.",0,0,Rube Hayseed,isQ5Ycie73U,-0.075,2016-09-08 09:32:26,True,True
2016-09-08T09:35:45,2 of 3 sure I'm not scared of death it happens its natural sure depending on the situation I could be scared at that moment but I'll accept it if I know it's my time or unless I see a way out,0,0,ZzMR_STRETCHzZ,isQ5Ycie73U,0.3666666666666667,2016-09-08 09:35:45,True,True
2016-09-08T09:35:45,2 of 3 sure I'm not scared of death it happens its natural sure depending on the situation I could be scared at that moment but I'll accept it if I know it's my time or unless I see a way out,0,0,ZzMR_STRETCHzZ,isQ5Ycie73U,0.3666666666666667,2016-09-08 09:35:45,True,True
2016-09-08T09:44:53,so these consepts come to visit him. end of story,0,0,Umut Birey,isQ5Ycie73U,0.0,2016-09-08 09:44:53,True,True
2016-09-08T09:46:58,I truly have no have no doubt there's anyone better than u Sir Will Smith🙌🙌,0,0,Burzin Pestonji,isQ5Ycie73U,0.5,2016-09-08 09:46:58,True,True
2016-09-08T09:49:15,one-look-will returns,0,0,TheRoterdackel,isQ5Ycie73U,0.0,2016-09-08 09:49:15,True,True
2016-09-08T09:55:43,"I want to know who's the mind behind the story of this movie, ... very ideal. :D",0,0,Edmond Buenviaje,isQ5Ycie73U,0.5333333333333333,2016-09-08 09:55:43,True,True
2016-09-08T10:06:33,What is this a modern retelling of the Christmas carol? I also feel like this trailer just showed us everything like what all trailers do.,0,0,Acedia Ira,isQ5Ycie73U,0.2,2016-09-08 10:06:33,True,True
2016-09-08T10:16:15,"Will Smith Talks to Love, Time, and Death in 'Collateral Beauty' Trailer | Moviefone.com http://www.moviefone.com/2016/09/07/ollateral-beauty-trailer-will-smith/ [From ZTE mobile browser]",0,0,love di choreo,isQ5Ycie73U,0.5,2016-09-08 10:16:15,True,True
2016-09-08T10:19:49,"the trailer got me goosebumps, can't wait for the movie",0,0,JACQUES BETUKUMESU,isQ5Ycie73U,0.0,2016-09-08 10:19:49,True,True
2016-09-08T10:27:08,Deadshot vs The Incredible Hulk featuring Ant-Man friend.,0,0,Diadlo,isQ5Ycie73U,0.9,2016-09-08 10:27:08,True,True
2016-09-08T10:38:59,I wonder if anyone would write a letter to sex,0,0,BigChris2777,isQ5Ycie73U,0.0,2016-09-08 10:38:59,True,True
2016-09-08T10:49:24,😰,0,0,Dan O,isQ5Ycie73U,0.0,2016-09-08 10:49:24,True,True
2016-09-08T10:56:19,Nice spin on the story of scrooge and the three ghosts,0,0,Dominique Jacques,isQ5Ycie73U,0.6,2016-09-08 10:56:19,True,True
2016-09-08T11:00:14,looks boring,0,0,Ratso Rizzo,isQ5Ycie73U,-1.0,2016-09-08 11:00:14,True,True
2016-09-08T11:01:34,"Okay, im interested. Will watch this one.",0,0,Ad N,isQ5Ycie73U,0.375,2016-09-08 11:01:34,True,True
2016-09-08T11:04:17,the best casting ever!!,0,0,Nurafizah Mohamed,isQ5Ycie73U,1.0,2016-09-08 11:04:17,True,True
2016-09-08T11:06:31,"My friend once wrote a letter to ""love"" in return ""friendzone"" sprit payed him a visit...😂",0,0,gagan babu,isQ5Ycie73U,0.5,2016-09-08 11:06:31,True,True
2016-09-08T11:16:33,I'm going to watch this for sure....,0,0,Pushpraj Singh,isQ5Ycie73U,0.5,2016-09-08 11:16:33,True,True
2016-09-08T11:28:02,Ebenezer... Oh wait...,0,0,The Hal,isQ5Ycie73U,0.0,2016-09-08 11:28:02,True,True
2016-09-08T11:28:04,The advertisement for Collateral Beauty was a trailer for Collateral Beauty..,0,0,Sam,isQ5Ycie73U,0.0,2016-09-08 11:28:04,True,True
2016-09-08T11:29:11,The music is trying too hard,0,0,Richard Hawkins,isQ5Ycie73U,-0.2916666666666667,2016-09-08 11:29:11,True,True
2016-09-08T11:30:08,Cough *Oscar bait* Cough,0,0,Liam Genosko,isQ5Ycie73U,0.0,2016-09-08 11:30:08,True,True
2016-09-08T11:32:55,"K, why not.",0,0,Here We Go!,isQ5Ycie73U,0.0,2016-09-08 11:32:55,True,True
2016-09-08T11:37:16,This Christmas gonna be beautiful.. ;D,0,0,Ali Yunus,isQ5Ycie73U,0.55,2016-09-08 11:37:16,True,True
2016-09-08T11:42:52,this was believable until the 'writing letter's' part. who even writes letters these days??,0,0,Jon Jonstone,isQ5Ycie73U,0.5,2016-09-08 11:42:52,True,True
2016-09-08T11:44:34,Dicks out for Harambe!,0,0,Mohammad Yunus Mohd Zaki,isQ5Ycie73U,0.0,2016-09-08 11:44:34,True,True
2016-09-08T11:45:03,The Oscar goes to the entire cast.,0,0,wildevil,isQ5Ycie73U,0.0,2016-09-08 11:45:03,True,True
2016-09-08T11:48:13,"they need to change the way they make trailers, I'm probably gonna watch this movie because I'm a fan of a good number of the actors/actresses in it, but trailers like this and the music just seem semi corny and very formulated to me. idk, they gotta make trailers feel new again and special to see. don't show us cheesy "" I gave up on you"" one liners while the violins prepares for climax",0,0,S.M.,isQ5Ycie73U,0.17870129870129867,2016-09-08 11:48:13,True,True
2016-09-08T11:51:01,"A Will Smith movie where he continues to kiss his son like a pedafile...  oh wait, not yet.",0,0,Thelonius Balthasar,isQ5Ycie73U,0.0,2016-09-08 11:51:01,True,True
2016-09-08T11:52:45,Great concept..,0,0,Tilak R,isQ5Ycie73U,0.8,2016-09-08 11:52:45,True,True
2016-09-08T11:53:52,allan loeb never got over 64% in rotten tomatoes....,0,0,GAMBANJUJJJ,isQ5Ycie73U,0.0,2016-09-08 11:53:52,True,True
2016-09-08T12:06:40,This is what I call a good casT!,0,0,Sabba Sarishvili,isQ5Ycie73U,0.875,2016-09-08 12:06:40,True,True
2016-09-08T12:11:33,love it already,0,0,Jiji Hn,isQ5Ycie73U,0.5,2016-09-08 12:11:33,True,True
2016-09-08T12:13:08,as usual unrealistic shit.h with Mr. will smit.h,0,0,Lee,isQ5Ycie73U,-0.375,2016-09-08 12:13:08,True,True
2016-09-08T12:18:06,Looks fine but Keira is Love? better take an actor who can act,0,0,TheSuetemorp,isQ5Ycie73U,0.47222222222222227,2016-09-08 12:18:06,True,True
2016-09-08T12:19:55,Holy crap....this actually looks good.  Getting a Stranger than Fiction vibe from the way the plot sounds.,0,0,SathDavidSD,isQ5Ycie73U,0.35,2016-09-08 12:19:55,True,True
2016-09-08T12:22:01,Mr Church??,0,0,Stark Hazy,isQ5Ycie73U,0.0,2016-09-08 12:22:01,True,True
2016-09-08T12:27:41,I cried watching this. I'm in a horrible time in my life right now,0,0,Artemis,isQ5Ycie73U,-0.35714285714285715,2016-09-08 12:27:41,True,True
2016-09-08T12:47:10,this must be the worst concept for a movie ever,0,0,Roberthenryii,isQ5Ycie73U,-1.0,2016-09-08 12:47:10,True,True
2016-09-08T12:49:42,"I think it's really fitting that the black guy is time because when you think about it, black people are always doing time.",0,0,Ponstory Games,isQ5Ycie73U,0.05555555555555557,2016-09-08 12:49:42,True,True
2016-09-08T12:55:11,Used to laugh at Will Smith's movies now I just weep damnit. He's an excellent actor.,0,0,maisa chaves,isQ5Ycie73U,0.65,2016-09-08 12:55:11,True,True
2016-09-08T12:59:27,my favourite movies of will smith's are 7 pounds and pursuit of happiness and this is going to be,0,0,purushottam mishra,isQ5Ycie73U,0.7,2016-09-08 12:59:27,True,True
2016-09-08T13:16:34,What if there is a plot twist wherein all of these people he's met were actually just actors hired by his friends to cheer him up? That would be interesting,0,0,Sean Bresnan,isQ5Ycie73U,0.25,2016-09-08 13:16:34,True,True
2016-09-08T13:19:17,Pretentious,0,0,DhDeadMan,isQ5Ycie73U,-0.3,2016-09-08 13:19:17,True,True
2016-09-08T13:21:09,seems like 'inside out' concept.....,0,0,Rudro bhattacharyya,isQ5Ycie73U,0.0,2016-09-08 13:21:09,True,True
2016-09-08T13:32:41,Keira knightley 😍😍😍❤️❤️❤️,1,0,Von Perez,isQ5Ycie73U,0.0,2016-09-08 13:32:41,True,True
2016-09-08T13:35:49,Must be a movie with a lesson and not just for fun.,0,0,Onyinye Agbah,isQ5Ycie73U,0.3,2016-09-08 13:35:49,True,True
2016-09-08T13:40:46,looks positive,0,0,GODs PARTICLE,isQ5Ycie73U,0.22727272727272727,2016-09-08 13:40:46,True,True
2016-09-08T13:47:26,Does anyone know where this music is from or if it's originally written for the trailer by Mychael Danna?,0,0,Aaron Silmon De Monerri,isQ5Ycie73U,0.375,2016-09-08 13:47:26,True,True
2016-09-08T13:48:59,racist will smith,0,0,Ricky Tran,isQ5Ycie73U,0.0,2016-09-08 13:48:59,True,True
2016-09-08T13:50:53,I don't think they have enough famous actors in this. Disliked.,0,0,Harry Walter,isQ5Ycie73U,0.09999999999999999,2016-09-08 13:50:53,True,True
2016-09-08T13:59:03,Will smith has lost his charm,0,0,crimson gate32,isQ5Ycie73U,0.0,2016-09-08 13:59:03,True,True
2016-09-08T14:00:37,turns out it would be good movie...,0,0,manoj kumar,isQ5Ycie73U,0.7,2016-09-08 14:00:37,True,True
2016-09-08T14:04:30,"Amazing trailer !! It has triggered many questions in my mind, definitely going to the theater to find answers to them.. + the cast is heavy and awesome specially the two gorgeous ladies, Kate and Keira .. !!",1,0,deepak sahni,isQ5Ycie73U,0.5135204081632653,2016-09-08 14:04:30,True,True
2016-09-08T14:09:13,"Am I the only one who fears that they are going to make so much grounded in reality,that in the end we are going to find out that Will Smith's friends just found some actors to help him and that those are not actually Death,Time and Love?",0,0,EgwOTheos013,isQ5Ycie73U,0.175,2016-09-08 14:09:13,True,True
2016-09-08T14:09:34,Good grief...,0,0,Swoddy,isQ5Ycie73U,-0.050000000000000044,2016-09-08 14:09:34,True,True
2016-09-08T14:16:57,Looks like Big Willie is going for his 4th attempt at winning an Oscar.... Wonder when everyone will get behind him like they did for Leo?,0,0,Grant Snell,isQ5Ycie73U,0.033333333333333326,2016-09-08 14:16:57,True,True
2016-09-08T14:25:34,Damn. even the trailor made me cry. since having kids ive became a softy.death is certain but i always feel their isnt enough time to love the way you would like because you hav to work all day and night to provide :(,0,0,Marcus Lynch,isQ5Ycie73U,-0.008928571428571425,2016-09-08 14:25:34,True,True
2016-09-08T14:26:32,he can do this but not another iRobot wtf ....,0,0,getmoney,isQ5Ycie73U,-0.5,2016-09-08 14:26:32,True,True
2016-09-08T14:27:13,they made a sequel to Concussion already!?,0,0,The Tekksetter,isQ5Ycie73U,0.0,2016-09-08 14:27:13,True,True
2016-09-08T14:34:03,*Way too preachy*,1,0,crymebeast,isQ5Ycie73U,-0.2,2016-09-08 14:34:03,True,True
2016-09-08T14:47:03,'Seven Pounds' in an alternate universe...,0,0,delivrex,isQ5Ycie73U,0.0,2016-09-08 14:47:03,True,True
2016-09-08T14:57:37,They have a very interesting concept. I'm looking forward to seeing this.,0,0,Astrohalcyon,isQ5Ycie73U,0.65,2016-09-08 14:57:37,True,True
2016-09-08T15:03:12,I feel like this will be a better movie than this tralier.,0,0,Ruben Quiros,isQ5Ycie73U,0.5,2016-09-08 15:03:12,True,True
2016-09-08T15:03:35,This movie looks really good but the release for December is a bad idea like release the same month as Star Wars ? Because that's a great idea,0,0,Luke Fearnley,isQ5Ycie73U,0.20000000000000004,2016-09-08 15:03:35,True,True
2016-09-08T15:09:36,what a profound and a wonderful movie ! i cant wait for this one . i want to write a letter to death too .,0,0,Eva Alam,isQ5Ycie73U,0.5416666666666666,2016-09-08 15:09:36,True,True
2016-09-08T15:10:06,oh my god... the cast... so awesome actors,0,0,ANNIE DUTTA,isQ5Ycie73U,1.0,2016-09-08 15:10:06,True,True
2016-09-08T15:13:58,Edward Norton should write a letter to Tyler Durden to help Will Smith.,0,0,Aintgotshit,isQ5Ycie73U,0.0,2016-09-08 15:13:58,True,True
2016-09-08T15:16:02,Fresh Prince of the Oscars,0,0,marinejcksn1,isQ5Ycie73U,0.3,2016-09-08 15:16:02,True,True
2016-09-08T15:43:55,"So many good actors, but such a silly, tired premise. Will Smith really wants an Oscar. Jada will be pissed again when he doesn't win for this one.",0,0,saltycrunch,isQ5Ycie73U,0.18571428571428572,2016-09-08 15:43:55,True,True
2016-09-08T16:02:53,il genere di film che piace a me!,0,0,Alessia Trinca,isQ5Ycie73U,0.0,2016-09-08 16:02:53,True,True
2016-09-08T16:05:46,I had that was the trailer as the one I'm watching now.,0,1,Albert Einstein,isQ5Ycie73U,0.0,2016-09-08 16:05:46,True,True
2016-09-08T16:08:42,Will Smith reminds me of The Fresh Prince of Bell Air.,0,0,Owen Oss,isQ5Ycie73U,0.3,2016-09-08 16:08:42,True,True
2016-09-08T16:28:06,beautiful   collateral beauty,0,0,Himanshu Ranjan,isQ5Ycie73U,0.85,2016-09-08 16:28:06,True,True
2016-09-08T16:55:13,Good one!,0,0,Ahmed Abdien,isQ5Ycie73U,0.875,2016-09-08 16:55:13,True,True
2016-09-08T17:09:06,This movie will make everyone cry...I'm crying right now watching the trailer...ijs,0,0,Royalstl Royal,isQ5Ycie73U,0.042857142857142844,2016-09-08 17:09:06,True,True
2016-09-08T17:10:40,This looks like the dumbest shit ever put to film. I love it.,0,0,Public Execution,isQ5Ycie73U,0.15,2016-09-08 17:10:40,True,True
2016-09-08T17:12:31,movie is loaded with talent,0,0,Jeff Araujo,isQ5Ycie73U,0.0,2016-09-08 17:12:31,True,True
2016-09-08T17:31:05,Actually Will Smith is the alter ego of Edward Norton.,0,0,mrinal kalamdani,isQ5Ycie73U,0.0,2016-09-08 17:31:05,True,True
2016-09-08T17:31:22,Daminos make you a so smart huh.,0,0,DoublexKeyz,isQ5Ycie73U,0.21428571428571427,2016-09-08 17:31:22,True,True
2016-09-08T17:32:09,"Another Award winning movie............Oscar Nominee , may be winner for best story and best Performance. This is not a Prediction.........This is a Spoiler Alert..............",0,0,Pramesh Iyer,isQ5Ycie73U,0.8333333333333334,2016-09-08 17:32:09,True,True
2016-09-08T17:49:52,this is going to be good ;D,0,0,Ajinkya Bobade,isQ5Ycie73U,0.475,2016-09-08 17:49:52,True,True
2016-09-08T17:52:08,what a star cast. what a subject. can't wait for this movie.,0,0,Arun Singh,isQ5Ycie73U,-0.16666666666666666,2016-09-08 17:52:08,True,True
2016-09-08T17:53:29,man! the budget!how much is it to get such an acting superstars in it!,0,0,Arkham Assassin,isQ5Ycie73U,0.06666666666666667,2016-09-08 17:53:29,True,True
2016-09-08T17:55:46,WTF is going on?,0,0,Ayan Chakraborty,isQ5Ycie73U,-0.5,2016-09-08 17:55:46,True,True
2016-09-08T17:57:38,I cried and its only the trailer,0,0,Ash Ketchum,isQ5Ycie73U,0.0,2016-09-08 17:57:38,True,True
2016-09-08T18:00:20,my advert before the video started was this trailer lol,0,0,Ryan Pratley,isQ5Ycie73U,0.8,2016-09-08 18:00:20,True,True
2016-09-08T18:02:13,This will either be super good or super melodramatic,0,0,NinjaSpartan316,isQ5Ycie73U,0.4555555555555555,2016-09-08 18:02:13,True,True
2016-09-08T18:05:18,this looks so interesting will see for sure,0,0,Britany Anderson,isQ5Ycie73U,0.5,2016-09-08 18:05:18,True,True
2016-09-08T18:17:01,Inspired by Christmas Carol & Inside out. Looks interesting,0,0,Wallace Rigby,isQ5Ycie73U,0.5,2016-09-08 18:17:01,True,True
2016-09-08T18:39:50,Everything was good until Keira Knightley.,1,0,Ivan Barrera,isQ5Ycie73U,0.7,2016-09-08 18:39:50,True,True
2016-09-08T18:40:13,THE SMITHS STRIKE AGAIN WITH A CRAP MOVIE,0,0,joe snork,isQ5Ycie73U,-0.8,2016-09-08 18:40:13,True,True
2016-09-08T18:52:15,"ok ok ok, Where's Bad Boys 3 already :D",0,0,omegasend,isQ5Ycie73U,0.36000000000000004,2016-09-08 18:52:15,True,True
2016-09-08T18:54:48,NO! Will Smith must do funny roles! DISLIKE,0,0,Ozolz,isQ5Ycie73U,0.3125,2016-09-08 18:54:48,True,True
2016-09-08T19:02:19,damn this movie looks sick,0,0,Daniel Hernandez,isQ5Ycie73U,-0.7142857142857143,2016-09-08 19:02:19,True,True
2016-09-08T19:02:48,Elyse Willems Kiera Knightley impression,0,0,Seany_12,isQ5Ycie73U,0.0,2016-09-08 19:02:48,True,True
2016-09-08T19:11:59,I think I just cried,0,0,London. Marcus.,isQ5Ycie73U,0.0,2016-09-08 19:11:59,True,True
2016-09-08T19:12:34,"i wrote leter to love life,i never get answer",0,0,JOVAN Flex4,isQ5Ycie73U,0.5,2016-09-08 19:12:34,True,True
2016-09-08T19:15:45,looks amazing,0,0,100K,isQ5Ycie73U,0.6000000000000001,2016-09-08 19:15:45,True,True
2016-09-08T19:18:37,I got the feels...but then the NOPE at 1:01 got me laughing so hard,0,0,Bayi,isQ5Ycie73U,-0.2916666666666667,2016-09-08 19:18:37,True,True
2016-09-08T19:25:24,The discription ruined the movie,0,0,Its Lit,isQ5Ycie73U,0.0,2016-09-08 19:25:24,True,True
2016-09-08T19:35:28,cant wait for this movie,0,0,Jonas Castillo,isQ5Ycie73U,0.0,2016-09-08 19:35:28,True,True
2016-09-08T19:40:10,What a dumb title.,0,0,Dd Bb,isQ5Ycie73U,-0.375,2016-09-08 19:40:10,True,True
2016-09-08T19:43:10,Deadshot need to suck this shit up and take it like a man. Better stop all that complaining and crying and yelling. You know what happened to Slipknot.......,0,0,Loomy Narty,isQ5Ycie73U,0.033333333333333326,2016-09-08 19:43:10,True,True
2016-09-08T19:44:19,I started paying attention when Keira Knightley got on screen,0,0,Movie Anatomy,isQ5Ycie73U,0.0,2016-09-08 19:44:19,True,True
2016-09-08T19:55:03,I didn't understand head or tail about this movie,0,0,Unstable Mind,isQ5Ycie73U,0.0,2016-09-08 19:55:03,True,True
2016-09-08T19:58:10,I'm afraid to watch the whole trailer..  I don't wanna see the whole movie in 2 minutes.,1,0,FREE1UP,isQ5Ycie73U,-0.06666666666666665,2016-09-08 19:58:10,True,True
2016-09-08T19:58:32,its funny when i see people judging movies based on trailers,0,0,Arpan Vinayak,isQ5Ycie73U,0.25,2016-09-08 19:58:32,True,True
2016-09-08T19:59:24,"This is deep, I like it, But where is margot ? he should just do movies w her lol",0,0,Stay Fit,isQ5Ycie73U,0.4,2016-09-08 19:59:24,True,True
2016-09-08T20:01:21,after deadshot escaped from prison with joker annd harley he found out his daughter has been murdered by bane so he does not take the path of revenge instad tries to settle in as a good guy who faked his death and made a new identity.spoiler alert:at the end of this movie he finds out a metahuman named the killer frost is on loose so he teams up with the suicide suad again,0,0,Time Traveler Alphonso Vin Dino,isQ5Ycie73U,0.16486013986013986,2016-09-08 20:01:21,True,True
2016-09-08T20:04:56,Do Hilary Clinton's emails count?,0,0,Rob DeBiaso,isQ5Ycie73U,0.0,2016-09-08 20:04:56,True,True
2016-09-08T20:30:25,Dics out to harambe,0,0,James Lass,isQ5Ycie73U,0.0,2016-09-08 20:30:25,True,True
2016-09-08T20:31:28,Eh. Oscar bait.,0,0,State Line,isQ5Ycie73U,0.0,2016-09-08 20:31:28,True,True
2016-09-08T20:35:15,academy winner.. and academy winner.. and academy winner..,0,0,1 2,isQ5Ycie73U,0.0,2016-09-08 20:35:15,True,True
2016-09-08T20:37:56,So death is an above midage white woman and time is a young black dude? How much do you bet that a young-midage white guy (who's fitting the sterotype) is neither love nor birth nor life nor anything positive?,0,0,Christian Hoffmann,isQ5Ycie73U,0.1511784511784512,2016-09-08 20:37:56,True,True
2016-09-08T20:43:18,My boy Will never stops with amazing work along side these other award winning actors. This will be phenomenal! Give some likes guys!!!! And Subscribe!,0,0,IIYousufII,isQ5Ycie73U,0.49375,2016-09-08 20:43:18,True,True
2016-09-08T20:44:49,Great. I love these movies. Just shut your brain down and cuddle with your wife. Try to remember two key scenes. Tell her afterwards that scene A was really heartwarming and scene B was sooooo romantic. If she has at least some smarts she will look right through your charade but reward you for the faked effort anyways. And next time you will pick a movie you both could stand.,0,0,Christian Hoffmann,isQ5Ycie73U,0.1477954144620811,2016-09-08 20:44:49,True,True
2016-09-08T20:51:51,"So this is ""A Christmas Caroll"" on crack.",0,0,SomeKid FromPG,isQ5Ycie73U,0.0,2016-09-08 20:51:51,True,True
2016-09-08T20:57:05,Roll Credits,0,0,Francois Lemieux,isQ5Ycie73U,0.0,2016-09-08 20:57:05,True,True
2016-09-08T20:58:43,This is beautiful. Completely and utterly beautiful.,0,0,Velvet Sky,isQ5Ycie73U,0.6,2016-09-08 20:58:43,True,True
