timestamp,text,like_count,reply_count,author,trailer_id,sentiment_score,datetime,used_for_model,used_for_visualization
2016-12-16T21:42:33,"I heard on the radio today that after 1 day of this movie being out its already number 3 on the ""Worst Movie List of 2016"" .. it looks really good to me though!!",1,0,Ciana Maria,isQ5Ycie73U,0.0,2016-12-16 21:42:33,False,True
2016-12-16T21:45:31,*Sorry to disappoint you but the movie is not how the trailer pitched it to be*,2,0,Dre Deda,isQ5Ycie73U,-0.5,2016-12-16 21:45:31,False,True
2016-12-16T21:52:22,Me and my wife going to see it tonight. I hope its good she picked it.,2,0,Lamar Prosperous Perry7,isQ5Ycie73U,0.7,2016-12-16 21:52:22,False,True
2016-12-16T22:32:32,"hey, Iam going to see this movie, is it this bad?😩",0,0,Fofe Fofe,isQ5Ycie73U,0.0,2016-12-16 22:32:32,False,True
2016-12-16T22:51:34,"""Did you lose a child"" *Will remembers Jaden Smith's career*",215,4,Boone,isQ5Ycie73U,0.0,2016-12-16 22:51:34,False,True
2016-12-16T22:52:04,Seen it. They say the name of the title SIX times during the movie. It was terrible.,0,0,Brooklyn Tortellini,isQ5Ycie73U,-1.0,2016-12-16 22:52:04,False,True
2016-12-16T23:19:21,anyone know the soundtrack playing on this trailer? :),0,0,Rence C.,isQ5Ycie73U,0.5,2016-12-16 23:19:21,False,True
2016-12-17T01:23:01,watchmojo should add this to another  misleading trailers list,0,0,syfycomicbookvhsman,isQ5Ycie73U,0.0,2016-12-17 01:23:01,False,True
2016-12-17T02:14:02,"Just saw the movie it's amazing, but too much drama most of the audience were crying!!",4,0,Fofe Fofe,isQ5Ycie73U,0.246875,2016-12-17 02:14:02,False,True
2016-12-17T02:16:48,and will smith he will win his first oscar for this rule for sure!,0,1,Fofe Fofe,isQ5Ycie73U,0.5583333333333333,2016-12-17 02:16:48,False,True
2016-12-17T02:25:47,I just watched the movie and I loved. Excellent work all around. Top five favorite movie.,1,0,S. Riley,isQ5Ycie73U,0.675,2016-12-17 02:25:47,False,True
2016-12-17T02:26:24,I LOVE IT!!!,1,0,S. Riley,isQ5Ycie73U,0.9765625,2016-12-17 02:26:24,False,True
2016-12-17T03:32:05,oscar baite will smith hot garbage,0,0,Rodolfo Passos dos Santos,isQ5Ycie73U,0.25,2016-12-17 03:32:05,False,True
2016-12-17T04:07:28,Oscar for him in this movie,3,0,Train Wreck,isQ5Ycie73U,0.0,2016-12-17 04:07:28,False,True
2016-12-17T04:45:58,Probably would have been a great movie if this was the plot.,140,9,Blood'N'Bacon - Peter Johannes,isQ5Ycie73U,0.8,2016-12-17 04:45:58,False,True
2016-12-17T06:57:31,"Hi all i saw the movie yesterday and it's really amazing and touch me deep inside. I just have 2 question for people who saw it ...1-why death at the end took the money from Jacob . 2-will jacob (the one with glass ) will die or no as death told him in the end ... see you big papi , will death let him survive ??",0,0,basset ferchichi,isQ5Ycie73U,0.20000000000000004,2016-12-17 06:57:31,False,True
2016-12-17T07:13:13,whos ready for the razzies,0,0,The Crazy Movie Lover,isQ5Ycie73U,0.2,2016-12-17 07:13:13,False,True
2016-12-17T10:21:18,This is an AWESOME movie. Critics are trying to sabotage...,0,0,Chelly Bark,isQ5Ycie73U,1.0,2016-12-17 10:21:18,False,True
2016-12-17T10:23:09,"While he gets answers from non-existent things, I can't even get a text back",89,1,Mariam Omar,isQ5Ycie73U,0.0,2016-12-17 10:23:09,False,True
2016-12-17T11:43:29,Seen it and I loved it! This movie made me cry😢,6,0,Piano Puangthong,isQ5Ycie73U,0.875,2016-12-17 11:43:29,False,True
2016-12-17T11:48:28,"Will Smith has sold his soul to Illuminati, he doesn't believe in God anymore, he tried to teach people believe in Cosmos or Universe instead like they are the new Gods, instead believing in the Creator he choose to believe in the creations, they want you think upside down, that's the mission of Illuminati, erase God and make new Gods by themselves",2,4,Mochammad Escorta Bayu Samodera,isQ5Ycie73U,0.03905723905723904,2016-12-17 11:48:28,False,True
2016-12-17T14:38:36,Sorry this movie looks so cute and sad,0,0,Castiel Winchester,isQ5Ycie73U,-0.16666666666666666,2016-12-17 14:38:36,False,True
2016-12-17T14:43:22,"Wow, this looks great! Such a touching story. I think I'll see it",5,1,SwabbleSocks,isQ5Ycie73U,0.4,2016-12-17 14:43:22,False,True
2016-12-17T16:22:08,"Seen this movie last night. Although the trailer does mislead you, the movie still comes out with such a beautiful message.",0,0,Life For rent,isQ5Ycie73U,0.2833333333333333,2016-12-17 16:22:08,False,True
2016-12-17T16:56:04,"This movie is fantastic. Ignore the critics and actually watch it for yourself. The trailer isn't misleading at all- in fact, it's almost a spoiler :)",3,0,Bailey R,isQ5Ycie73U,0.3,2016-12-17 16:56:04,False,True
2016-12-17T16:58:57,The hardest Try Not to Cringe Challenge I've ever done,4,0,Jon E Depth,isQ5Ycie73U,0.0,2016-12-17 16:58:57,False,True
2016-12-17T18:16:41,Kiera Knightley is the poor man's natalie Portman,2,0,Jonathan Calderon,isQ5Ycie73U,-0.4,2016-12-17 18:16:41,False,True
2016-12-17T18:34:13,"If you're ugly and can't afford to fix that, nobody wants to connect with you these days, unfortunately.",0,1,Mang,isQ5Ycie73U,-0.3333333333333333,2016-12-17 18:34:13,False,True
2016-12-17T19:41:25,This is the most profoundd movie everrrrr !!!! kindly don't miss it. Loved the movie to bits.,4,0,Jai Chenna,isQ5Ycie73U,0.7666666666666666,2016-12-17 19:41:25,False,True
2016-12-17T19:55:26,"I came here from the beautiful Hevesh5 who made these domino structures. Please check her channel out and subscribe, she's almost at 1,000,000 subscribers!",0,0,Susan Smith,isQ5Ycie73U,1.0,2016-12-17 19:55:26,False,True
2016-12-17T20:30:22,clearly a lot of people didn't understand the movie,64,5,Jennifer Ortiz,isQ5Ycie73U,0.10000000000000002,2016-12-17 20:30:22,False,True
2016-12-17T20:48:26,This is important for everyone to know:  THIS TRAILER IS COMPLETELY UNREPRESENTATIVE OF THE ACTUAL MOVIE. The things that are shown in this trailer are blatant lies compared to what the actual movie is about.,56,15,TheBrianJ,isQ5Ycie73U,0.0,2016-12-17 20:48:26,False,True
2016-12-17T20:57:51,Anyone else notice the first song was Oskar's Monologue from Extremely Loud and Incredibly Close?,1,0,K Laur,isQ5Ycie73U,0.4166666666666667,2016-12-17 20:57:51,False,True
2016-12-17T21:13:23,Will Smith movies always makes me cry,1,0,Chicley Holmes,isQ5Ycie73U,0.0,2016-12-17 21:13:23,False,True
2016-12-17T22:59:43,this movie looks great. it seems like it teaches you to value life.,1,0,Paradox Project,isQ5Ycie73U,0.8,2016-12-17 22:59:43,False,True
2016-12-17T23:52:57,Yawn,0,0,Two rookies in a van jan,isQ5Ycie73U,0.0,2016-12-17 23:52:57,False,True
2016-12-18T01:02:37,"I loved it, I FRICKING loved it!!!! Watch it for yourself and ignore the critics. I almost didn't watch it myself but since I lost the vote 2-1 between my friends and I,  I did and it was amazing!",44,4,Dacia Petrie,isQ5Ycie73U,0.8166666666666668,2016-12-18 01:02:37,False,True
2016-12-18T01:30:52,I highly recommend this movie,1,0,Michael Schriner,isQ5Ycie73U,0.16,2016-12-18 01:30:52,False,True
2016-12-18T04:18:11,m gonna watch this movie today... love from India 😘,0,1,Sonal Agrawal,isQ5Ycie73U,0.5,2016-12-18 04:18:11,False,True
2016-12-18T04:49:44,My favourite domino artist did the art for this video. Check out Hevesh5 to see her!,0,0,Lauren Bingham,isQ5Ycie73U,0.0,2016-12-18 04:49:44,False,True
2016-12-18T06:17:34,"Don't listen to the bad reviews, this movie is amazing. Why on earth do ppl complain about the ""betrayal"" that happened. Aren't we all humans imperfect? His friends have clearly good reasons why they did what they did, their lives and jobs were on the line. Though the personifications didn't come to life as shown in the trailer. The characters have good intentions and the words spoken are authentic and meaningful regardless to ""whom"" those words might come from. I understand if ppl feel manipulated because of the misleading trailer. But artistic wise, this wasn't a bad one.",1,0,Zachary Series,isQ5Ycie73U,0.2925925925925927,2016-12-18 06:17:34,False,True
2016-12-18T08:20:49,"Will & Jada/family/The whole Smith family extended and friends<3, we are keeping you all lifted in prayer<3.   Sending lots of love and hugs<3.",0,1,gwenee tiki Bradley,isQ5Ycie73U,0.35,2016-12-18 08:20:49,False,True
2016-12-18T13:38:27,"This show gets 2 stars from Ebert. You should read his review.  Spot on.   I watched this trailer and thought the movie would be pathetic.  According to most if not all critics, it is.  Make a trailer look really good and it's bait but I saw the worm.",2,1,Basha R,isQ5Ycie73U,0.06666666666666665,2016-12-18 13:38:27,False,True
2016-12-18T14:56:24,13% on Rotten Tomatoes. WTF????,1,0,Ecco TV 2,isQ5Ycie73U,-0.5,2016-12-18 14:56:24,False,True
2016-12-18T17:49:10,The trailer is a LIE!,49,7,Zackariah,isQ5Ycie73U,0.0,2016-12-18 17:49:10,False,True
2016-12-18T19:12:26,"I have a feeling a movie like this would have been a box office hit in 2005, but in 2016 it will flop.",1,0,teyzman,isQ5Ycie73U,0.0,2016-12-18 19:12:26,False,True
2016-12-18T20:04:58,Love will Smith but after last years embarrassing display crying over the Oscars the movie did not deserve one I will not see another movie at the theaters.,2,0,Gay Family Values,isQ5Ycie73U,0.09999999999999999,2016-12-18 20:04:58,False,True
2016-12-18T22:15:52,lol I played the video and the ad was this video,8,1,Mac-Bryce Neba,isQ5Ycie73U,0.8,2016-12-18 22:15:52,False,True
2016-12-19T00:30:51,M. Knight Shayamalan already did this one.,0,0,Stephen Abbott,isQ5Ycie73U,0.0,2016-12-19 00:30:51,False,True
2016-12-19T02:13:29,This might have been the first time I've ever fallen asleep during a trailer.,0,0,Darth Cynos,isQ5Ycie73U,0.25,2016-12-19 02:13:29,False,True
2016-12-19T02:21:41,what a pretentious piece of shit movie,0,0,nyc Jones,isQ5Ycie73U,-0.25,2016-12-19 02:21:41,False,True
2016-12-19T04:25:52,just watched this in theaters today and it was amazing,1,0,lulu k,isQ5Ycie73U,0.6000000000000001,2016-12-19 04:25:52,False,True
2016-12-19T05:17:57,Zzzzzzzzzzzzzzzzzz....,1,0,kaykay1kc,isQ5Ycie73U,0.0,2016-12-19 05:17:57,False,True
2016-12-19T06:06:17,"This movie was beautiful. I wish people would fricken stop taking everything from it and destroying it. Death, love, and time came to not only will smiths character, but to the others as well and only them. Sorry that you people don't understand that. Why don't you guys enjoy a movie rather then focus on the negatives, or purposely trying to find something wrong with it.",0,0,Lexus Eich,isQ5Ycie73U,0.06874999999999998,2016-12-19 06:06:17,False,True
2016-12-19T06:34:22,utter shite,1,0,angry guy from Boston you skinny motherfucker,isQ5Ycie73U,0.0,2016-12-19 06:34:22,False,True
2016-12-19T07:23:26,academy awards winners will gonna bring few more academy awards.Very Good trailer,2,0,In vIdEo GaMeS,isQ5Ycie73U,0.3333333333333333,2016-12-19 07:23:26,False,True
2016-12-19T14:54:11,"I WATCHED THIS AWESOME MOVIE ,  Mr Will Smith couldn't be better, he is amazing this movie open your eyes to love, Time and dead! best cast actresses from Titanic, Pirates of The Caribbean, American werewolf in London Actress And Incredible Actor William Smith from I legend, Will Should be President of The USA😍👍!!!",0,0,Maritza Diaz,isQ5Ycie73U,0.4833333333333333,2016-12-19 14:54:11,False,True
2016-12-19T15:13:21,Just read an article talking about how this movie had the worst opening ever in Will Smith career. still wanna watch it.,2,0,Ahmed360,isQ5Ycie73U,-1.0,2016-12-19 15:13:21,False,True
2016-12-19T23:01:53,I saw this movie with my young daughter and it moved me.I can not imagine life with out her .Cherish your  children.Happy Holidays!!!,1,0,Paul Irvin,isQ5Ycie73U,0.1953125,2016-12-19 23:01:53,False,True
2016-12-20T00:08:45,"Despite of what other people say. This movie is wonderful. It does not have any sections where there is sex or violence. Now in days, many movies director believe that every movie needs to have these things to make it good. Many movies have sections like these where it has nothing to do with the plot. It is a movie about true love for a child. Loved it and would definitely see this movie. Let's prove to everyone that a movie doesn't have to have sex or violence to be good!",0,0,Raquel Aguilar,isQ5Ycie73U,0.5,2016-12-20 00:08:45,False,True
2016-12-20T01:09:53,"Haven't seen it, yet I feel the emptiness of Jesus Christ.",0,0,F & M,isQ5Ycie73U,0.0,2016-12-20 01:09:53,False,True
2016-12-20T03:39:51,"Idk man, I know it's gotten bad reviews... but it looks good.",3,2,renewer,isQ5Ycie73U,5.551115123125783e-17,2016-12-20 03:39:51,False,True
2016-12-20T04:20:46,"love. time. birth. New construct...same movie...5/5 stars. What God gives you to do is your 'holy assignment'... parenting, family, profession, etc.",0,0,Dr. Edwconr,isQ5Ycie73U,0.3181818181818182,2016-12-20 04:20:46,False,True
2016-12-20T04:25:52,Apparently this is the most misleading trailers I have seen!,1,0,you wish,isQ5Ycie73U,0.3375,2016-12-20 04:25:52,False,True
2016-12-20T09:48:24,"i think it is the best movie for will and i saw it,it was really good.",1,0,nayef mohammed,isQ5Ycie73U,0.85,2016-12-20 09:48:24,False,True
2016-12-20T11:32:59,What are we some kind of... collateral beauty?,1,0,AlexzanderVL,isQ5Ycie73U,0.6,2016-12-20 11:32:59,False,True
2016-12-20T11:34:10,who is here after OneRepublic - Let's Hurt Tonight ?,3,0,Abid Khan,isQ5Ycie73U,0.0,2016-12-20 11:34:10,False,True
2016-12-20T16:54:15,"Hi, if you get a moment please watch my piano version and tutorial, and sub, thanks a lot :D",0,0,Dario D'aversa,isQ5Ycie73U,0.6,2016-12-20 16:54:15,False,True
2016-12-20T20:53:59,"just seeing this film , don't waste your time , very bad movie",0,0,Mero Ali,isQ5Ycie73U,-0.5549999999999999,2016-12-20 20:53:59,False,True
2016-12-20T21:22:27,Can't wait for Xander Cage to return  . . . . . . . . . . and then go away.,0,0,awesumlewy,isQ5Ycie73U,0.0,2016-12-20 21:22:27,False,True
2016-12-21T00:15:25,This got rated 5.9 out of 10...,0,0,Susan P,isQ5Ycie73U,0.0,2016-12-21 00:15:25,False,True
2016-12-21T00:27:29,"this looks so damn good, but those review scores...",0,0,Matt Dawson,isQ5Ycie73U,0.7,2016-12-21 00:27:29,False,True
2016-12-21T00:50:21,I'm watching this movie with my whole 11th grade class room! Our English teacher dope!!,0,0,Al- A,isQ5Ycie73U,0.125,2016-12-21 00:50:21,False,True
2016-12-21T03:04:02,this movie's  plot got nothing to do with the trailer. it's actually a bad movie. the trailer lies.,0,0,Vena B,isQ5Ycie73U,-0.6999999999999998,2016-12-21 03:04:02,False,True
2016-12-21T08:33:00,9/10,0,0,Aziz Alkhaleel,isQ5Ycie73U,0.0,2016-12-21 08:33:00,False,True
2016-12-21T09:22:34,Awful film but i enjoyed the New York shots...,1,0,G G,isQ5Ycie73U,-0.12121212121212122,2016-12-21 09:22:34,False,True
2016-12-21T11:17:57,I knew I'd heard that music somewhere before. :D In an awesome SFM animation. :) It's such a peaceful and yet powerful piece. <3,0,0,Ashura,isQ5Ycie73U,0.5785714285714285,2016-12-21 11:17:57,False,True
2016-12-21T11:42:19,nice hevesh 5 is in this,0,0,RobloxNerd,isQ5Ycie73U,0.6,2016-12-21 11:42:19,False,True
2016-12-21T15:37:07,Utter rubbish.... What is the world coming to that people spend money creating this tosh?,0,0,Andy Robertson,isQ5Ycie73U,0.0,2016-12-21 15:37:07,False,True
2016-12-21T18:45:01,who else was moved watching this I was nearly in tears : '(,9,0,iona407,isQ5Ycie73U,-0.45,2016-12-21 18:45:01,False,True
2016-12-21T19:53:56,I wanna watch it so bad,0,0,blue 6,isQ5Ycie73U,-0.6999999999999998,2016-12-21 19:53:56,False,True
2016-12-21T21:58:53,"I watched this film and the trailer doesn't do it justice. It's a holiday movie about life but it's not as sad/inspirational as the trailer makes it seem. I actually really liked what the movie was as opposed to the trailer because the trailer seems sappy but the movie wasn't that sappy. Also anyone who tells you that this trailer lied, didn't watch the movie all the way to the end.",1,0,Gillyweeds Thirtyfour,isQ5Ycie73U,0.6,2016-12-21 21:58:53,False,True
2016-12-21T22:10:02,EXTRA SYRUP WITH THAT CORNY SYRUP SHIT.,2,1,Louis Davies,isQ5Ycie73U,-0.1,2016-12-21 22:10:02,False,True
2016-12-21T22:40:54,"Typical Hollywood sentimental shite. Consists of the same empty stars and actors acting the same empty plot and story.  That trailer was so wet, cringe worthy. No wonder it's got shit reviews, it looks like pure shit.",1,0,KarlJC1411,isQ5Ycie73U,-0.04742063492063492,2016-12-21 22:40:54,False,True
2016-12-22T06:29:14,"Collateral Beauty (True Beauty)  There is collateral beauty everywhere, the beauty is in where you find it.  Rare is a time that you find yourself, fractured from some event.  Unable to regain, the peace you had before.  Everything in your life seemingly, getting harder to handle anymore.  But if you stop, just for one moment in time.  Everything you see is still okay, and you are truly fine.  All is not really lost, you just had to find your way back.  Unbeknownst to you, God was picking up the slack.  There was never, time to fear.  You should have known, God was always here.  ~ Serena A Hibbard",96,5,Serena H,isQ5Ycie73U,0.10833333333333332,2016-12-22 06:29:14,False,True
2016-12-22T08:17:47,It's bizarre how this film has been beaten to death by the critics but that reviews by ' real people' have given it 5 stars.,0,0,TheReturnoftheNative,isQ5Ycie73U,0.30000000000000004,2016-12-22 08:17:47,False,True
2016-12-22T15:42:33,3/10,0,0,Ahmed Al-Obaidi,isQ5Ycie73U,0.0,2016-12-22 15:42:33,False,True
2016-12-22T16:11:47,The movie ruined the whole trailer for me.,5,0,cc22ful,isQ5Ycie73U,0.2,2016-12-22 16:11:47,False,True
2016-12-22T18:08:35,"I have just known who is Will Smith in this movie. I wish he was there in the theater, just to stand up and raise the hat for this man.",0,0,Ahmed Lasheen,isQ5Ycie73U,0.0,2016-12-22 18:08:35,False,True
2016-12-22T21:57:40,If only the movie was what the trailers depicted it as. This trailer and the movie itself are two completely different things. Completely disappointed.,0,0,Beefjerky007,isQ5Ycie73U,-0.25,2016-12-22 21:57:40,False,True
2016-12-22T23:14:33,Just saw this at Wildhorse; I will see it again. Profound messages.,1,0,June Mohrland,isQ5Ycie73U,0.08333333333333333,2016-12-22 23:14:33,False,True
2016-12-23T00:07:19,NO WAY THIS SONG IS REMEMBRANCE HOLY SHIIIIIIII- IFHWIHJIJDSK,0,0,Flexibo,isQ5Ycie73U,0.0,2016-12-23 00:07:19,False,True
2016-12-23T00:37:03,Guys watch this blogger! copy an paste this -----> f7yub vlogs<----- great youtuber!,0,0,Abdul Motin,isQ5Ycie73U,1.0,2016-12-23 00:37:03,False,True
2016-12-23T00:46:00,Am I the only one who felt like this is like pursuit of happiness?,1,0,Emily Nordstrom,isQ5Ycie73U,0.35,2016-12-23 00:46:00,False,True
2016-12-23T02:21:37,hella corny,0,0,nbeope,isQ5Ycie73U,0.0,2016-12-23 02:21:37,False,True
2016-12-23T04:53:56,I only am here for babygirl's dominoes.,0,0,NinoishGamer,isQ5Ycie73U,0.0,2016-12-23 04:53:56,False,True
2016-12-23T15:42:11,this trailer is soooo epic!,0,0,Kristína,isQ5Ycie73U,0.125,2016-12-23 15:42:11,False,True
2016-12-23T15:59:59,naomi harris (calypso/tia dalma) and keira knightley (Elizabeth swann)  reunite!!,0,0,Lotta,isQ5Ycie73U,0.0,2016-12-23 15:59:59,False,True
2016-12-23T16:00:13,naomi harris (calypso/tia dalma) and keira knightley (Elizabeth swann)  reunite!!,1,0,Lotta,isQ5Ycie73U,0.0,2016-12-23 16:00:13,False,True
2016-12-23T18:04:01,"all these white people complaining about will and his movies as if their movie criticism even affects anyone. his movies are great but white ppl always think they know everything. they just like to watch the same old shit and same old storyline. boring af. will smith is snd will always be a great actor with great movies. at the end of the day...he still making bank off the ""shitty"" movie u just watched.",1,1,Adoredbyothers,isQ5Ycie73U,0.12727272727272726,2016-12-23 18:04:01,False,True
2016-12-24T00:20:51,Looks gay,0,0,kozmobillions,isQ5Ycie73U,0.4166666666666667,2016-12-24 00:20:51,False,True
2016-12-24T02:52:11,"I just came back from seeing this movie and when I tell you, this is one of those movies you have to ""pay attention"" to, and will get messed up in the end and you will, even if it's inside, you will tear up without question... so prepare.  This is one of the best movies I've seen in awhile and honestly, I wish it was a bit longer but I'm glad for it existing at all. This movie will definitely make you reflect.  How in the hell did the critics pan this film is beyond me... I dont think they watch the same films as the audiences do.",3,1,PromotingTheBeat,isQ5Ycie73U,0.35000000000000003,2016-12-24 02:52:11,False,True
2016-12-24T07:01:06,"see the collateral beauty. death is fact, time is a gift and love is everything...... loved the story of this movie .",1,0,Angel Knight,isQ5Ycie73U,0.6,2016-12-24 07:01:06,False,True
2016-12-24T09:47:45,"I saw this movie.  it was sad, touching and very good.  I am glad I saw it.   I wasn't crazy about kate winslet in this role, but her american accent was good.",1,0,anastasia46,isQ5Ycie73U,0.2157142857142857,2016-12-24 09:47:45,False,True
2016-12-24T13:47:59,wow!!!!!!!!!! I WANT TO WATCH THIS!!!!,0,3,The Flash,isQ5Ycie73U,1.0,2016-12-24 13:47:59,False,True
2016-12-24T16:02:43,The best move i ever watched ❤️❤️❤️,0,0,zDxer,isQ5Ycie73U,1.0,2016-12-24 16:02:43,False,True
2016-12-24T18:46:47,This a great movie go in with an open heart critics to stupid see a what a good movie is people who thought the trailers lied did you not see the ending with so much trash in movies this is a feel good movie,1,0,sisko,isQ5Ycie73U,0.26666666666666666,2016-12-24 18:46:47,False,True
2016-12-24T18:46:56,one of the best movies ever ☺,1,0,Markellapapd. Dimitropoulou,isQ5Ycie73U,1.0,2016-12-24 18:46:56,False,True
2016-12-24T23:11:33,Profoundly Unprofound.  Will Smith looks bored with life.,0,0,Nick Donnelly,isQ5Ycie73U,-0.20833333333333334,2016-12-24 23:11:33,False,True
2016-12-25T00:53:50,I wrote a letter to Greed and he ended up robbing me.,1,0,The Lone E,isQ5Ycie73U,0.0,2016-12-25 00:53:50,False,True
2016-12-25T01:10:20,Beautiful beautiful movie. I don't give a toot what the critics say. It was life affirming and good. Damn the critics.,0,0,O. R.F.,isQ5Ycie73U,0.7999999999999999,2016-12-25 01:10:20,False,True
2016-12-25T06:19:26,This movie made me cry like a baby,0,0,Laura,isQ5Ycie73U,0.0,2016-12-25 06:19:26,False,True
2016-12-25T09:37:43,"Oh thats it, huh.. we the beauties. some kinda  collateral beauty?",0,1,Epsar,isQ5Ycie73U,0.0,2016-12-25 09:37:43,False,True
2016-12-25T11:20:35,The one lady who was telling the three people about Will writing letters I remembered her in a instant. She was in Bushwhacked.,0,0,PCPopple,isQ5Ycie73U,0.0,2016-12-25 11:20:35,False,True
2016-12-25T13:31:55,i rather watch assassins creed,0,3,Rocket Power,isQ5Ycie73U,0.0,2016-12-25 13:31:55,False,True
2016-12-25T13:53:38,got a feeling is gonna make some peeps cry,0,10,James -,isQ5Ycie73U,0.0,2016-12-25 13:53:38,False,True
2016-12-25T15:31:37,This should be called collateral deez.,0,0,2enchant,isQ5Ycie73U,0.0,2016-12-25 15:31:37,False,True
2016-12-25T18:11:51,"This movie is far better than the Rotten Tomatoes rating and random critics want you to believe.  Is there some hidden agenda to try to aggressively discredit everything Will Smith does the last few years, even if it's not bad? Seems that way. I'd give this movie a solid C+, the acting was excellent, the script could have been stronger",3,0,Randy Bodek,isQ5Ycie73U,0.10833333333333332,2016-12-25 18:11:51,False,True
2016-12-25T19:48:40,time is ekko TriHard,0,0,Grosserstream,isQ5Ycie73U,0.0,2016-12-25 19:48:40,False,True
2016-12-25T21:08:38,booooring,0,0,Nina D,isQ5Ycie73U,0.0,2016-12-25 21:08:38,False,True
2016-12-26T05:37:57,"Great movie, one of the best of 2016 by far.",0,0,bounceenergydrink,isQ5Ycie73U,0.6333333333333334,2016-12-26 05:37:57,False,True
2016-12-26T06:37:02,it's really good movie,0,0,Ruby Sanchez,isQ5Ycie73U,0.7,2016-12-26 06:37:02,False,True
2016-12-26T07:47:47,Stop making this shit. Please.,0,0,finbar21,isQ5Ycie73U,-0.2,2016-12-26 07:47:47,False,True
2016-12-26T10:13:09,does it recommended ?,0,0,Jim Carrey,isQ5Ycie73U,0.0,2016-12-26 10:13:09,False,True
2016-12-26T11:55:38,this is just beautiful ❤ I want to watch the movie now,1,0,Honey Haldaria,isQ5Ycie73U,0.85,2016-12-26 11:55:38,False,True
2016-12-26T13:56:42,i smell An Oscar Nomination...;-),4,1,Simon Muraya,isQ5Ycie73U,0.25,2016-12-26 13:56:42,False,True
2016-12-26T19:35:41,I went to see the film this afternoon and thought it was terrible. my grand niece could write a script Stephen Harvey,0,0,Stephen Harvey,isQ5Ycie73U,-0.25,2016-12-26 19:35:41,False,True
2016-12-27T04:26:09,"I WATCHED THIS MOVIE AND: the trailer only shows like 10% of what the film is actually about. It goes way deeper than the trailer, and honestly it was pretty good. It has a good twist at the end too! I'd totally recommend it. Totally worth 12 dollars. The trailer just makes it look whack. But it's actually pretty good. I promise. Watch it!!",2,3,Kelly Bundy,isQ5Ycie73U,0.39749999999999996,2016-12-27 04:26:09,False,True
2016-12-27T05:52:00,Fresh Prince steppin up his game,0,0,Ric00,isQ5Ycie73U,-0.05000000000000002,2016-12-27 05:52:00,False,True
2016-12-27T18:27:06,This looks like the kind of movie that the only part you want to watch is the last 20 min. of the movie the rest is just BS filler.,0,0,Chris A,isQ5Ycie73U,0.19999999999999998,2016-12-27 18:27:06,False,True
2016-12-27T19:59:24,will smith desperately trying to make people forget suicide squad lul,4,0,Opamigaaa,isQ5Ycie73U,-0.6,2016-12-27 19:59:24,False,True
2016-12-27T20:27:53,is this gonna give the same feeling as pursuit of happiness ?,0,0,Mando Gucci,isQ5Ycie73U,0.35,2016-12-27 20:27:53,False,True
2016-12-27T21:36:58,THIS MOVIE WAS AWESOME!!! so BEAUTIFUL!  will smith is the best at doing movies like this and in all might be a little slow but the way it all turns out is so worth the watch!,0,0,megan eastin,isQ5Ycie73U,0.48125,2016-12-27 21:36:58,False,True
