timestamp,text,like_count,reply_count,author,trailer_id,sentiment_score,datetime,used_for_model,used_for_visualization
2016-05-27T10:19:03,"""Its too big""  ""That's what she said""",1,0,8Samby,j9zwMQN_Yig,0.0,2016-05-27 10:19:03,True,True
2016-05-28T08:46:36,Whats the name of the band that is singing this version of the song 'Knocking on heavens door'?,0,0,Laura McClintock,j9zwMQN_Yig,0.0,2016-05-28 08:46:36,True,True
2016-05-29T16:58:52,This looks great.,1,0,Brian Rodriguez,j9zwMQN_Yig,0.8,2016-05-29 16:58:52,True,True
2016-05-29T23:31:24,The Place Beyond The Pines meets No Country for Old Men meets The Town,0,0,Bryan L,j9zwMQN_Yig,0.1,2016-05-29 23:31:24,True,True
2016-05-30T09:12:03,Before he called him brother I was thinking them were homosexuals!,2,0,Stoney McMechan,j9zwMQN_Yig,0.0,2016-05-30 09:12:03,True,True
2016-05-30T14:58:46,"If the Dude's in it, I'll watch it.",0,0,Unknown Source,j9zwMQN_Yig,0.0,2016-05-30 14:58:46,True,True
2016-06-02T22:44:59,"This trailer looks fantastic, but the ""that's what she said"" always ruins it for me.",0,1,flmvdvsrg,j9zwMQN_Yig,0.125,2016-06-02 22:44:59,True,True
2016-06-05T07:56:58,Ben Foster. Definitely an underrated actor.,0,0,Bryan Pentecostes,j9zwMQN_Yig,0.0,2016-06-05 07:56:58,True,True
2016-06-07T07:34:34,cool !,0,0,Van F Nguyen,j9zwMQN_Yig,0.4375,2016-06-07 07:34:34,True,True
2016-06-10T22:53:19,As someone who hasn't been impressed with Chris Pine outside of Star Trek...he looks real good here!,0,0,JD Winty,j9zwMQN_Yig,0.6666666666666666,2016-06-10 22:53:19,True,True
2016-06-11T11:04:19,nice movie,0,0,Mohd Ali,j9zwMQN_Yig,0.6,2016-06-11 11:04:19,True,True
2016-06-13T10:03:51,"Im down to watch any movie with Ben Foster, Chris Pine and especially Jeff Bridges.",0,0,M R,j9zwMQN_Yig,-0.07777777777777779,2016-06-13 10:03:51,True,True
2016-06-14T04:33:33,"With no pseudo feminist super chicks, I will watch this movie.",1,0,fald2000,j9zwMQN_Yig,0.3333333333333333,2016-06-14 04:33:33,True,True
2016-06-22T20:39:54,"Chris Pine, from star trek commander to a southern man robbing banks",5,1,Dao Yang,j9zwMQN_Yig,0.0,2016-06-22 20:39:54,True,True
2016-06-25T23:57:18,666k views,0,0,Almighty Mc Bean,j9zwMQN_Yig,0.0,2016-06-25 23:57:18,True,True
2016-06-30T16:25:52,don't show the entire movie!!!!,0,0,Guns and Butter,j9zwMQN_Yig,0.0,2016-06-30 16:25:52,True,True
2016-07-08T01:17:38,"Chris Pine does play a robber in this movie, but he has actually stolen my heart.",0,0,gxfan039,j9zwMQN_Yig,0.0,2016-07-08 01:17:38,True,True
2016-08-04T04:55:55,Captain Kirk: The Bank Robber,0,0,Sapphire Sky824,j9zwMQN_Yig,0.0,2016-08-04 04:55:55,True,True
2016-08-08T02:21:07,ben foster is a great actor. time is now for bigger parts before he gets too old,1,1,Tim Z,j9zwMQN_Yig,0.3,2016-08-08 02:21:07,False,True
2016-08-10T07:07:15,"Just saw this tonight, 10th of August.  A fine, fine film.  Everybody nails it.",12,1,John G. Hill,j9zwMQN_Yig,0.4166666666666667,2016-08-10 07:07:15,False,True
2016-08-17T02:28:50,"Place beyond the pines? regardless, looks great.",0,0,Amelie,j9zwMQN_Yig,0.8,2016-08-17 02:28:50,False,True
2016-08-27T02:43:55,"Best movie I've seen all year, I highly recommend it.",20,0,joanna sanders,j9zwMQN_Yig,0.58,2016-08-27 02:43:55,False,True
2016-09-01T06:14:06,This movie was so F'in good.,1,0,Greg Menso,j9zwMQN_Yig,0.7,2016-09-01 06:14:06,False,True
2016-09-01T17:55:01,Such a good movie!! The trailer doesn't do it justice.,0,0,Troy L,j9zwMQN_Yig,0.5,2016-09-01 17:55:01,False,True
2016-09-02T02:35:54,"Sicario sucked balls, but the director was probably more responsible for that mistake.",0,4,Pineapple29,j9zwMQN_Yig,0.35,2016-09-02 02:35:54,False,True
2016-09-19T01:30:10,This movie was FANTASTIC.,4,0,Hazmark,j9zwMQN_Yig,0.4,2016-09-19 01:30:10,False,True
2016-09-21T12:36:48,Where can i find the link to download this movie?,0,0,Montja Given,j9zwMQN_Yig,0.0,2016-09-21 12:36:48,False,True
2016-10-22T03:08:18,Good not great film.  Bridges peaked w/ Starman.  Though he is actually acting in this one.,1,0,Baby Irene,j9zwMQN_Yig,0.09999999999999998,2016-10-22 03:08:18,False,True
2016-11-13T21:24:50,This and captain fantastic are the two best movies of 2016 so far hands down,1,0,Tyler Durden,j9zwMQN_Yig,0.3361111111111111,2016-11-13 21:24:50,False,False
2016-11-15T01:10:36,"it was pretty good. nice to see a hollywood movie without an overt political angle. there's big banks, lots of guns and racism but you're left to think of it what you will.",1,0,David Coulter,j9zwMQN_Yig,0.2583333333333333,2016-11-15 01:10:36,False,False
2016-11-16T12:47:54,Good film I must say Chris Pine did better in this than his latest Star Trek.,2,0,Steve Thiara,j9zwMQN_Yig,0.5666666666666667,2016-11-16 12:47:54,False,False
2016-11-17T23:47:51,i love Texas.,0,0,لا اله الا الله,j9zwMQN_Yig,0.5,2016-11-17 23:47:51,False,False
2016-12-04T03:00:12,This movie was awesome!   You won't be disappointed,2,0,eric beletz,j9zwMQN_Yig,0.125,2016-12-04 03:00:12,False,False
2016-12-11T16:25:37,Foster is such a good actor,1,0,ceegsterr9669,j9zwMQN_Yig,0.35,2016-12-11 16:25:37,False,False
2016-12-13T15:03:11,"The specially written music by Nick Cave and Warren Ellis, and set an atmospheric tone.",0,0,Track Tour,j9zwMQN_Yig,0.17857142857142858,2016-12-13 15:03:11,False,False
2016-12-22T10:08:16,did this go to theaters ppl,1,0,Bob Mills,j9zwMQN_Yig,0.0,2016-12-22 10:08:16,False,False
2016-12-24T04:48:17,Seen this movie last night and thought it was great. So many cool scenes.,0,0,7Ghoste,j9zwMQN_Yig,0.4125,2016-12-24 04:48:17,False,False
2016-12-30T07:16:45,Great movie. I recommend it for sure. 7/10,0,0,thegatesofsleep,j9zwMQN_Yig,0.65,2016-12-30 07:16:45,False,False
2017-02-16T17:06:58,Never been a Chris Pine fan but this may be his defining role,0,0,Tom !,j9zwMQN_Yig,0.0,2017-02-16 17:06:58,False,False
2017-02-24T20:23:05,Anybody know what the song in this is?,0,0,Bryony Pearson,j9zwMQN_Yig,0.0,2017-02-24 20:23:05,False,False
2017-02-24T20:23:32,Anybody know what the song in this is?,0,0,Bryony Pearson,j9zwMQN_Yig,0.0,2017-02-24 20:23:32,False,False
2017-02-26T19:52:31,Lesson of this movie: don't try to rob a bank in Texas at the busiest time of day. Those concealed carry Texas boys will get you every time.,0,0,RSmith6948 Smith,j9zwMQN_Yig,0.0,2017-02-26 19:52:31,False,False
2017-03-03T06:45:42,One of the best movies of 2016. What a disappointment to see that it left empty-handed at the Academy Awards.,2,0,cance7984,j9zwMQN_Yig,0.13333333333333333,2017-03-03 06:45:42,False,False
2017-03-10T16:38:01,Jeff Bridges's voice is like shit.,0,0,matt 1910b,j9zwMQN_Yig,-0.2,2017-03-10 16:38:01,False,False
2017-03-24T00:04:33,knock havens n door,0,0,operação games,j9zwMQN_Yig,0.0,2017-03-24 00:04:33,False,False
2017-03-27T21:28:40,Fasten your seat belts  yuur in fer a hell of a ride !  this movie is magnificent  phenomenal  genius  every aspect in of it  from the stupid hick sound track to the unpopular actors  directing  production  Bridges and the unpopular star of the movie were exxxcellent  Bridges has a reason  the young actor has just been under rated because of his good looks  but he's a top notch now!  craft/art...skill,0,0,Achote671,j9zwMQN_Yig,0.36071428571428577,2017-03-27 21:28:40,False,False
2017-04-01T13:45:10,Just purchased this on BLU-Ray + DVD + Digital Copy HD I haven't seen the movie yet..,0,0,G Lanphear,j9zwMQN_Yig,0.0,2017-04-01 13:45:10,False,False
2017-04-05T18:13:12,Trailer reveals way to much of the movie but its a fantastic movie nonetheless.,0,0,Yoshi278,j9zwMQN_Yig,0.30000000000000004,2017-04-05 18:13:12,False,False
2017-04-14T18:01:04,"""It's too big.""  ""That's what she said.""",0,0,Toe Nail,j9zwMQN_Yig,0.0,2017-04-14 18:01:04,False,False
2017-05-12T06:03:31,Anybody wanna hit up the t-bone café later? I hear they have some wicked corn on the cob,0,0,Kyle Firth,j9zwMQN_Yig,0.0,2017-05-12 06:03:31,False,False
2017-05-26T15:43:56,"Pine has way too much facial hair. nevertheless (or because of it ?!?), he received raving reviews for this role.",0,0,mysterychemistry,j9zwMQN_Yig,0.0,2017-05-26 15:43:56,False,False
2017-06-04T18:43:13,Hell of a good movie,0,0,D_Rock,j9zwMQN_Yig,0.7,2017-06-04 18:43:13,False,False
2017-06-29T17:54:05,This movie was crazy good. You enjoy it like a nice drink you take one sip at a time.,0,0,Sorel366,j9zwMQN_Yig,0.275,2017-06-29 17:54:05,False,False
2017-06-29T18:00:24,"The film is Texan to the core, some will love this, others will miss the subtle references to the local culture",0,0,Sorel366,j9zwMQN_Yig,0.05555555555555556,2017-06-29 18:00:24,False,False
2017-07-04T20:16:52,Highkey want to see this,0,0,C K,j9zwMQN_Yig,0.0,2017-07-04 20:16:52,False,False
2017-07-05T17:24:59,"youtube recommends me to watch a perfect boomerang throw but doesn't show me what I really need, this movie looks sick!! Going to watch now",0,0,Ali Blablabla,j9zwMQN_Yig,0.06666666666666665,2017-07-05 17:24:59,False,False
2017-07-09T21:32:20,Best Movie of the Year....Chris Pine's eyes......OMG.,1,0,Susan Werner,j9zwMQN_Yig,1.0,2017-07-09 21:32:20,False,False
2017-07-11T09:49:14,Ben Foster carries every movie he is in.,0,0,Josh Schwarzbauer,j9zwMQN_Yig,0.0,2017-07-11 09:49:14,False,False
2017-07-15T23:47:38,This is the best movie I've seen this year (2017)  SEE IT !,0,0,ptmslp,j9zwMQN_Yig,1.0,2017-07-15 23:47:38,False,False
2017-12-14T19:29:30,Chris pine and Ben foster nailed it,0,0,Shikhar Bhardwaj,j9zwMQN_Yig,0.0,2017-12-14 19:29:30,False,False
2018-01-20T12:38:53,Ben Foster is easily one of the most underrated actors of our time,0,0,Francisco Betancourt,j9zwMQN_Yig,0.4666666666666667,2018-01-20 12:38:53,False,False
2018-01-26T17:46:57,Really good movie with great acting..,0,0,Abhishek Nar,j9zwMQN_Yig,0.5,2018-01-26 17:46:57,False,False
2018-03-06T08:11:45,Is it as good as Sicario and River Wind?,0,0,stasistheone Shylov,j9zwMQN_Yig,0.7,2018-03-06 08:11:45,False,False
2018-03-23T03:32:39,In my opinion this movie was cool nothing more...,0,0,Steve2025,j9zwMQN_Yig,0.425,2018-03-23 03:32:39,False,False
2018-03-24T04:03:03,Awesome freakin movie!!!,0,0,Jason Hood,j9zwMQN_Yig,1.0,2018-03-24 04:03:03,False,False
2018-05-04T17:25:19,Amazing movie. And my first actress crush in 20 years. Katy mixon.. oh man she is cute,0,0,Erling Hansen,j9zwMQN_Yig,0.45,2018-05-04 17:25:19,False,False
2018-05-10T20:46:07,"wow, this has been on my list for a few months now...finally watched it and wasnt let down...might be one of the best ending scenes ive ever seen in a movie, and i would consider myself quite well versed in cinema both modern and classic. i highly recommend this film.",0,0,Ary M,j9zwMQN_Yig,0.23777777777777778,2018-05-10 20:46:07,False,False
2018-07-24T13:48:24,زۆر خۆش بوو,0,1,iammustaf a,j9zwMQN_Yig,0.0,2018-07-24 13:48:24,False,False
2018-08-31T19:12:55,underrated and excellent film for the underrated and excellent Jeff Bridges,0,0,K Nazir Ingram,j9zwMQN_Yig,1.0,2018-08-31 19:12:55,False,False
2018-11-07T00:02:36,One of the best movies ive seen in a very long time,0,0,Isaiah Harvin,j9zwMQN_Yig,0.4675,2018-11-07 00:02:36,False,False
2018-11-13T21:36:36,"""No Country For Young Men?""",0,0,Milky Way Galaxy,j9zwMQN_Yig,0.1,2018-11-13 21:36:36,False,False
2018-11-14T02:12:14,Great film.  5stars!😎😎😎😎😎,0,0,Wild Bill,j9zwMQN_Yig,0.8,2018-11-14 02:12:14,False,False
2018-11-24T17:31:58,This movie is just like No Country For Old Men except I wasn't greatly disappointed at the end. This is a great movie.,0,0,phil chickenfingers,j9zwMQN_Yig,0.05000000000000001,2018-11-24 17:31:58,False,False
2019-07-25T06:35:38,"This is a brilliant film. Jeff Bridges is his usual awesome self, Ben Foster is awesome, but the guy who shines here is Chris Pine. This is his best performance out of a Star Trek movie.",0,0,Diablo-X- Machina,j9zwMQN_Yig,0.73,2019-07-25 06:35:38,False,False
2020-03-28T13:20:17,"I just came here to say the scene w the guy in the challenger was a bit unbelievable... guy pulls up to pump, sees another guy w shades on, assumes he’s staring at him, pulls out gun in less than a minute, then gets beat to a bloody pulp... I liked the movie but that scene was so unrealistic lol",0,0,Andre Dre,j9zwMQN_Yig,-0.05277777777777778,2020-03-28 13:20:17,False,False
2020-04-22T09:59:52,Yall gonna steal my gun too?,0,0,Lillogambino,j9zwMQN_Yig,0.0,2020-04-22 09:59:52,False,False
2020-05-10T19:15:34,The trailer sucks all the excitement out of the movie,0,0,Abhishek Poojary,j9zwMQN_Yig,-0.3,2020-05-10 19:15:34,False,False
