timestamp,text,like_count,reply_count,author,trailer_id,sentiment_score,datetime,used_for_model,used_for_visualization
2016-05-12T18:24:19,first,0,0,Lee Pearce,j9zwMQN_Yig,0.25,2016-05-12 18:24:19,True,True
2016-05-12T18:24:31,first lol,0,0,Jose Martin,j9zwMQN_Yig,0.525,2016-05-12 18:24:31,True,True
2016-05-12T18:24:49,great,0,0,Tushar Verma,j9zwMQN_Yig,0.8,2016-05-12 18:24:49,True,True
2016-05-12T18:26:09,4th,0,0,OhioFriedChicken,j9zwMQN_Yig,0.0,2016-05-12 18:26:09,True,True
2016-05-12T18:26:27,Oo i m early,0,0,Vaddi Ugavanth,j9zwMQN_Yig,0.1,2016-05-12 18:26:27,True,True
2016-05-12T18:27:47,redHeads,0,0,BUDDY,j9zwMQN_Yig,0.0,2016-05-12 18:27:47,True,True
2016-05-12T18:27:56,very good actors looks good,48,0,Tysonescobar Marioescobar,j9zwMQN_Yig,0.8049999999999999,2016-05-12 18:27:56,True,True
2016-05-12T18:29:00,Man.. that looks awesome,31,0,Ricardo Teixeira,j9zwMQN_Yig,1.0,2016-05-12 18:29:00,True,True
2016-05-12T18:29:18,Please don't make this,0,0,This Is Google,j9zwMQN_Yig,0.0,2016-05-12 18:29:18,True,True
2016-05-12T18:29:46,el guero,0,0,opopop opo,j9zwMQN_Yig,0.0,2016-05-12 18:29:46,True,True
2016-05-12T18:29:48,now this is a remake of point break!!,2,0,Alejandro Frade,j9zwMQN_Yig,0.0,2016-05-12 18:29:48,True,True
2016-05-12T18:30:47,"don't know how to feel about this,  couple cheesy lines in trailer :/    but has good actors behind its name so probably going to have to check it out.",0,0,Steven Folden,j9zwMQN_Yig,-0.11250000000000002,2016-05-12 18:30:47,True,True
2016-05-12T18:30:53,That's unfortunate how much weight ben foster has put on.,0,0,I am The Hammer,j9zwMQN_Yig,-0.15,2016-05-12 18:30:53,True,True
2016-05-12T18:33:56,Point break without the stunts and action -_-,0,0,xSMOKExEMxALLx,j9zwMQN_Yig,0.1,2016-05-12 18:33:56,True,True
2016-05-12T18:36:30,From the writer of Sicario. Say no more I'm in.,127,3,Hamza Joozer,j9zwMQN_Yig,-0.25,2016-05-12 18:36:30,True,True
2016-05-12T18:37:31,Would definitely watch it.,2,0,ppp shr,j9zwMQN_Yig,0.0,2016-05-12 18:37:31,True,True
2016-05-12T18:37:53,Is he that the doctor from K-Pax?,1,1,ppp shr,j9zwMQN_Yig,0.0,2016-05-12 18:37:53,True,True
2016-05-12T18:38:21,"What's the name of the ""Knocking on heavens door"" cover used in this trailer?",4,8,Nick McDuck,j9zwMQN_Yig,0.0,2016-05-12 18:38:21,True,True
2016-05-12T18:51:07,that's gonna be awesome,0,0,stalker of mike,j9zwMQN_Yig,1.0,2016-05-12 18:51:07,True,True
2016-05-12T18:54:19,Ben Foster is such an under rated actor. He is fantastic.,235,13,SharDaly,j9zwMQN_Yig,0.2,2016-05-12 18:54:19,True,True
2016-05-12T18:58:33,Really a that's what she said joke?..... . . . . . . Niceeeee,1,0,MisterVen,j9zwMQN_Yig,0.2,2016-05-12 18:58:33,True,True
2016-05-12T19:01:17,"everyone one's looking at the assassins creed trailer, but to me this looks really good and underrated!",87,5,ECH0ChAOs,j9zwMQN_Yig,0.875,2016-05-12 19:01:17,True,True
2016-05-12T19:04:13,Ben Foster= Good Movie,0,0,musixjunkie4,j9zwMQN_Yig,0.7,2016-05-12 19:04:13,True,True
2016-05-12T19:19:31,Jeff Bridges is using his Rooster Cogburn voice and that's not a bad thing.,6,0,KMC,j9zwMQN_Yig,0.3499999999999999,2016-05-12 19:19:31,True,True
2016-05-12T19:20:46,i foxxs with it,0,0,SpaceDaddy Cereal,j9zwMQN_Yig,0.0,2016-05-12 19:20:46,True,True
2016-05-12T19:21:02,Ben fosters a pimp,0,0,Dankalicious402,j9zwMQN_Yig,0.0,2016-05-12 19:21:02,True,True
2016-05-12T19:23:08,"Jeff Bridges speaks like this in True Grit, Seventh Son, and em RIPD.",0,1,mad mak,j9zwMQN_Yig,0.35,2016-05-12 19:23:08,True,True
2016-05-12T19:25:05,hay that's the guy from lucifer. nice. i liked him.,6,0,DoctorBahnausSee,j9zwMQN_Yig,0.6,2016-05-12 19:25:05,True,True
2016-05-12T19:30:26,So is having a shit cover version in a trailer the new BWARRP?,0,1,Content Aware Phil,j9zwMQN_Yig,-0.03181818181818183,2016-05-12 19:30:26,True,True
2016-05-12T19:39:56,That looks really good,0,0,ZCMZombieCustomMaps,j9zwMQN_Yig,0.7,2016-05-12 19:39:56,True,True
2016-05-12T19:45:17,Ben Foster is one of the most underrated actors out there,64,4,MightyManotaur22,j9zwMQN_Yig,0.5,2016-05-12 19:45:17,True,True
2016-05-12T19:47:21,who is doing cover of Knocking on heavens door ??,11,3,nobrainerneeded,j9zwMQN_Yig,0.0,2016-05-12 19:47:21,True,True
2016-05-12T19:49:50,"I see Chris Pine on thumbnail, I click",11,2,Bilal,j9zwMQN_Yig,0.0,2016-05-12 19:49:50,True,True
2016-05-12T19:50:45,"Don't know about the movie, but damn... that was a cool trailer.",1,0,Tad Load,j9zwMQN_Yig,0.35,2016-05-12 19:50:45,True,True
2016-05-12T20:12:35,damn that was unexpected,0,0,Matthew Domingue,j9zwMQN_Yig,0.1,2016-05-12 20:12:35,True,True
2016-05-12T20:34:37,GJ steal the title of David Duchovny's first album^^ and then dont play his great songs in the movie :(,2,0,EL Mojito,j9zwMQN_Yig,0.10000000000000002,2016-05-12 20:34:37,True,True
2016-05-12T20:57:02,damn,0,0,3317alibaba,j9zwMQN_Yig,0.0,2016-05-12 20:57:02,True,True
2016-05-12T20:57:56,Writer of Sicario with that cast???  This could be special!,3,0,Reed,j9zwMQN_Yig,0.44642857142857145,2016-05-12 20:57:56,True,True
2016-05-12T21:09:38,He looks so much like Chris Hemsworth!,0,1,Titis *,j9zwMQN_Yig,0.25,2016-05-12 21:09:38,True,True
2016-05-12T21:22:38,Knock knock knockin on heavens doooor,0,0,NA.1,j9zwMQN_Yig,0.0,2016-05-12 21:22:38,True,True
2016-05-12T21:28:02,That's what she said joke. Ha! Will always remind me of The Office.,10,0,Pauleta_mtr,j9zwMQN_Yig,0.0,2016-05-12 21:28:02,True,True
2016-05-12T21:30:11,Trailer music?,0,0,IllusiveCookie,j9zwMQN_Yig,0.0,2016-05-12 21:30:11,True,True
2016-05-12T21:36:54,"Knock Knock Knocking on Heavens Doooooor! Okay, its stuck in my head.   Not that I argue about it.",10,2,LastKnownMeal,j9zwMQN_Yig,0.5,2016-05-12 21:36:54,True,True
2016-05-12T21:49:55,I'll see Jeff Bridges in ANYTHING!!!!!,0,0,Corey,j9zwMQN_Yig,0.0,2016-05-12 21:49:55,True,True
2016-05-12T22:03:05,"Looks definitely, but somehow im not convinced",0,2,mystery_man,j9zwMQN_Yig,0.0,2016-05-12 22:03:05,True,True
2016-05-12T22:11:02,Bank robbery movies are soo underrated. This looks like it will be awesome.,1,0,sdafasdfasdfsda,j9zwMQN_Yig,1.0,2016-05-12 22:11:02,True,True
2016-05-12T22:35:42,"""We're stealing the banks money not your money"" = a relentlessly cliche line since 'Heat' circled, underlined, and highlighted on every bank heist movie screenplay with a tag ""must include for green light""",9,3,SlyRy,j9zwMQN_Yig,0.1,2016-05-12 22:35:42,True,True
2016-05-12T22:43:41,20 bucks I say Ben Foster dies in this movie,132,9,DraYzey,j9zwMQN_Yig,0.0,2016-05-12 22:43:41,True,True
2016-05-12T22:44:32,"Most likely one of them is going to die, if not both. Just seems to be that kind of a movie. :/",8,0,caps,j9zwMQN_Yig,0.21250000000000002,2016-05-12 22:44:32,True,True
2016-05-12T22:58:18,oh please Jeff Bridges stop with the stupid voices,0,0,Dennis Fairman,j9zwMQN_Yig,-0.7999999999999999,2016-05-12 22:58:18,True,True
2016-05-12T23:06:36,What's with the singing in trailers these days.. It's ruining trailers,0,0,SLAYA 275,j9zwMQN_Yig,0.0,2016-05-12 23:06:36,True,True
2016-05-12T23:20:41,"Sortof interested  Then ""from the writer of sicario"" Can't wait to see this movie",45,0,Official Bacon Puffs,j9zwMQN_Yig,0.25,2016-05-12 23:20:41,True,True
2016-05-12T23:24:46,Pine and Foster look great.  But Jeff Bridges sucked me out of it every time he showed up.  It made me think of RIPD.,0,1,Avocado,j9zwMQN_Yig,0.8,2016-05-12 23:24:46,True,True
2016-05-12T23:31:26,"Gil Birmingham, haven't seen him in a long time.",0,0,Nani Sunami,j9zwMQN_Yig,-0.05,2016-05-12 23:31:26,True,True
2016-05-12T23:33:03,"Last movie Chris Pine played a guy from Boston, now he's playing a Texan.  I'm betting his next movie he's Canadian. :P",1,0,jliller,j9zwMQN_Yig,0.25,2016-05-12 23:33:03,True,True
2016-05-12T23:41:26,Oh man! Shall I be sympathetic for the criminals?! This is like a modern day Robinhood it's so clever. I have never been put in this position before!!! Definitely going to win some awards.,0,0,Dan Campanella,j9zwMQN_Yig,0.39010416666666664,2016-05-12 23:41:26,True,True
2016-05-12T23:51:16,Feels like a western in the 21st century ,0,0,Harry Paul,j9zwMQN_Yig,0.0,2016-05-12 23:51:16,True,True
2016-05-12T23:52:18,"Feeling a slight ""No country for old men"" vibe here.",0,0,AndyArastos,j9zwMQN_Yig,-0.033333333333333326,2016-05-12 23:52:18,True,True
2016-05-12T23:53:45,Boy this looks intense.,18,0,Eugene Grewing,j9zwMQN_Yig,0.2,2016-05-12 23:53:45,True,True
2016-05-12T23:56:57,"From the witer of Sicario, say no more.",0,0,Xqu63z,j9zwMQN_Yig,-0.25,2016-05-12 23:56:57,True,True
2016-05-13T00:30:30,KEN HOTATE!,2,0,Harrison Moon,j9zwMQN_Yig,0.0,2016-05-13 00:30:30,True,True
2016-05-13T00:43:39,WTF is with all da mustaches?! Only a few is clean shaven!!,0,0,Spsuperstar,j9zwMQN_Yig,-0.0630208333333333,2016-05-13 00:43:39,True,True
2016-05-13T01:17:32,Looks good,0,0,usa eagle,j9zwMQN_Yig,0.7,2016-05-13 01:17:32,True,True
2016-05-13T01:49:12,What do you think ladies of Chris Pine with a moustache? Movie looks great by the way,5,2,MrThomasWalker,j9zwMQN_Yig,0.8,2016-05-13 01:49:12,True,True
2016-05-13T01:54:34,This guy ben kingsley is one heck of an actor,0,0,Kirkliz evangelista,j9zwMQN_Yig,0.0,2016-05-13 01:54:34,True,True
2016-05-13T02:02:23,song?,0,2,Nate K,j9zwMQN_Yig,0.0,2016-05-13 02:02:23,True,True
2016-05-13T02:18:13,"""Writer of 'Sicario'""  Yup, I'm sold.",33,0,Joel Svensgård,j9zwMQN_Yig,0.0,2016-05-13 02:18:13,True,True
2016-05-13T02:44:47,00:17 michael scott would be so proud,0,0,echolot,j9zwMQN_Yig,0.8,2016-05-13 02:44:47,True,True
2016-05-13T02:47:40,Please let the pigs lose in this one.,0,0,chakadoo,j9zwMQN_Yig,0.0,2016-05-13 02:47:40,True,True
2016-05-13T02:51:58,see a longer version on smashTrailers,0,0,smashTrailers site,j9zwMQN_Yig,0.0,2016-05-13 02:51:58,True,True
2016-05-13T02:54:13,When will Jeff Bridges quit playing the same character in different movies?,2,3,abc64pan,j9zwMQN_Yig,0.0,2016-05-13 02:54:13,True,True
2016-05-13T02:54:35,I've got a good idea on how it's going to end but I'm still gonna watch it.,0,0,Caffeinated Nation,j9zwMQN_Yig,0.7,2016-05-13 02:54:35,True,True
2016-05-13T03:16:46,"The splicing together of ""the bank loan"" at the beginning of the trailer is horrible",0,0,Mr.Alexander,j9zwMQN_Yig,-1.0,2016-05-13 03:16:46,True,True
2016-05-13T03:36:19,Ben Foster in anything. Interested.,2,0,KuzuRanger,j9zwMQN_Yig,0.25,2016-05-13 03:36:19,True,True
2016-05-13T03:44:42,Kind of reminds me of a modern Butch Cassidy and the Sundance Kid kinda movie,3,1,SpinTic,j9zwMQN_Yig,0.4,2016-05-13 03:44:42,True,True
2016-05-13T03:46:14,cause u asked Lil brother. dats some real sht,11,0,Mr. Hall,j9zwMQN_Yig,0.2,2016-05-13 03:46:14,True,True
2016-05-13T04:29:23,"you had me ""writer of Sicario""",276,14,Colin Weiss,j9zwMQN_Yig,0.0,2016-05-13 04:29:23,True,True
2016-05-13T04:37:58,"Looks like a great film, and definitely an awesome trailer! Trailer guy, take notes!!",0,0,Guillaume Keyes,j9zwMQN_Yig,0.9,2016-05-13 04:37:58,True,True
2016-05-13T05:30:06,Writer of Sicario? Oh okay... Make sure u lead with that next time.,0,0,Hail Hydra,j9zwMQN_Yig,0.3333333333333333,2016-05-13 05:30:06,True,True
2016-05-13T06:22:48,"Honey, I live in Alberta. We have handled the hell and high water. #Overit",0,0,Alle DeMelo,j9zwMQN_Yig,0.1481818181818182,2016-05-13 06:22:48,True,True
2016-05-13T06:35:39,These two guys are perfect,0,0,Nick Bowen,j9zwMQN_Yig,1.0,2016-05-13 06:35:39,True,True
2016-05-13T06:42:01,Ben Foster has got to be one of the most unknown actor to the causal movie goer.,5,3,Me,j9zwMQN_Yig,0.2,2016-05-13 06:42:01,True,True
2016-05-13T07:17:25,"the thing with bank robberies movie is they eventually get caught, man... where is the fun in that.",0,1,Ijaz Ali,j9zwMQN_Yig,0.3,2016-05-13 07:17:25,True,True
2016-05-13T07:18:18,"Loved Sicario, will definitely love this movie!",0,0,Warren Kent,j9zwMQN_Yig,0.6625,2016-05-13 07:18:18,True,True
2016-05-13T08:01:57,"0:23 ""Hell or High Water"" *DING. Roll Credits.",3,0,Ecca Zhang,j9zwMQN_Yig,0.16,2016-05-13 08:01:57,True,True
2016-05-13T08:57:33,Looks like its worth a watch,0,0,Tdis01,j9zwMQN_Yig,0.3,2016-05-13 08:57:33,True,True
2016-05-13T09:08:18,Looks really good!,0,0,yoco90,j9zwMQN_Yig,0.875,2016-05-13 09:08:18,True,True
2016-05-13T09:10:10,gotta admire Hollywood's persistence to make you believe Chiris Pine is a superstar,9,8,Bruce Lee,j9zwMQN_Yig,0.0,2016-05-13 09:10:10,True,True
2016-05-13T09:21:17,Lots of good trailers coming out recently! let's hope the movies deliver as well! :),0,0,goodial,j9zwMQN_Yig,0.39999999999999997,2016-05-13 09:21:17,True,True
2016-05-13T10:10:18,Ben Foster sure transitioned well from Disney.,12,2,Xion I,j9zwMQN_Yig,0.5,2016-05-13 10:10:18,True,True
2016-05-13T10:25:40,"why in hell would u waste the title ""Hell or High water"" on this movie...save it for a pirate movie about Blackbeard or some shit",0,1,Menacexp,j9zwMQN_Yig,-0.08,2016-05-13 10:25:40,True,True
2016-05-13T10:33:41,damn this looks good!!,0,0,TheMICRKR,j9zwMQN_Yig,1.0,2016-05-13 10:33:41,True,True
2016-05-13T11:10:12,"Chris Pine ha? I could swear I'm seeing Colin Farrel. And the tone of this trailer. Fu*k, ""True detective - season 3"". But I do like it.",0,0,Ivan Samardžić,j9zwMQN_Yig,0.35,2016-05-13 11:10:12,True,True
2016-05-13T11:36:15,1:33 song name please,0,1,Aleksandar Brankosson,j9zwMQN_Yig,0.0,2016-05-13 11:36:15,True,True
2016-05-13T11:41:33,Holy crap that's Ben Foster? My image of him is still that suave Charlie Prince in 3:10 to Yuma.,0,0,tickub,j9zwMQN_Yig,-0.8,2016-05-13 11:41:33,True,True
2016-05-13T12:02:07,IGN 5/10 too much high water,0,0,boris maric,j9zwMQN_Yig,0.16,2016-05-13 12:02:07,True,True
2016-05-13T12:11:21,The cast..... Whoa 😮👏👏,0,0,biro24,j9zwMQN_Yig,0.0,2016-05-13 12:11:21,True,True
2016-05-13T12:53:46,The bank door was padlocked before they entered....,0,0,Lord Shane C,j9zwMQN_Yig,0.0,2016-05-13 12:53:46,True,True
2016-05-13T15:27:31,GIVE BEN FOSTER AN OSCAR TODAY !!!!!!!!!,0,0,José Garza,j9zwMQN_Yig,0.0,2016-05-13 15:27:31,True,True
2016-05-13T16:46:44,Chris Pine with scruff and long hair looks a bit like Colin Farrell.,0,0,C Peterson,j9zwMQN_Yig,-0.05,2016-05-13 16:46:44,True,True
2016-05-13T16:59:45,the name of the singer that does the cover is blakwall. just in case you want to know.,0,0,TRINIPIMP1,j9zwMQN_Yig,0.0,2016-05-13 16:59:45,True,True
2016-05-13T17:10:42,"Does anyone know who did this ""knockin' on heaven's door"" cover?",0,0,Nicholas van Huyssteen,j9zwMQN_Yig,0.0,2016-05-13 17:10:42,True,True
2016-05-13T17:21:25,I watched this trailer twice. We can all agree that is saying a lot for a movie trailer these days.,0,0,Loren Vidal,j9zwMQN_Yig,0.0,2016-05-13 17:21:25,True,True
2016-05-13T17:34:51,"Seriously. all white men, what's new.",0,0,Devon Geary,j9zwMQN_Yig,-0.06565656565656565,2016-05-13 17:34:51,True,True
2016-05-13T17:56:29,This looks lika a hell of a good movie!,0,0,GrandAlf,j9zwMQN_Yig,0.875,2016-05-13 17:56:29,True,True
2016-05-13T18:14:47,Ben Foster is the man!,0,0,aszewc91306,j9zwMQN_Yig,0.0,2016-05-13 18:14:47,True,True
2016-05-13T18:48:14,"Texas, f*ck yeah.",5,0,MrKernkraft4000,j9zwMQN_Yig,0.0,2016-05-13 18:48:14,True,True
2016-05-13T18:56:42,Looks good,0,0,Gamer Clips,j9zwMQN_Yig,0.7,2016-05-13 18:56:42,True,True
2016-05-13T21:30:16,"but not the same director,damn it!",0,0,Daniel Oana,j9zwMQN_Yig,0.0,2016-05-13 21:30:16,True,True
2016-05-13T21:56:50,Jeff Bridges and you put these two guys name on the trailer??? whats wrong? and even one of them doesn't look like Ben foster,0,0,Prashant Gupta,j9zwMQN_Yig,-0.5,2016-05-13 21:56:50,True,True
2016-05-13T22:29:40,So is Jeff Bridges not allowed to play anything other then an old grizzled lawman or is that just a conscious choice he makes?,40,6,Lord Dirt,j9zwMQN_Yig,0.025000000000000005,2016-05-13 22:29:40,True,True
2016-05-13T23:46:50,Who sang this version of Knockin' On Heaven's Door used towards the end of this trailer?  It's not GnR or Selig.,0,0,Sunny,j9zwMQN_Yig,0.0,2016-05-13 23:46:50,True,True
2016-05-14T03:41:42,Looks like a hit movie. I'd see it.,0,0,Kimberly Thibodeaux,j9zwMQN_Yig,0.0,2016-05-14 03:41:42,True,True
2016-05-14T03:45:30,Chris Pine and Ben Foster 2 very underrated actors.,98,3,The Maverick,j9zwMQN_Yig,0.2,2016-05-14 03:45:30,True,True
2016-05-14T05:10:17,one other most compelling trailers ive ever scene,0,0,Emilio,j9zwMQN_Yig,0.225,2016-05-14 05:10:17,True,True
2016-05-14T10:22:52,Song name: Blackwall - Knocking on Heavens Door,18,1,floisz,j9zwMQN_Yig,0.0,2016-05-14 10:22:52,True,True
2016-05-14T12:16:07,"after just having re-watched Heat, think Im ready for this one",0,0,JIMINIE PABO ARMY,j9zwMQN_Yig,0.2,2016-05-14 12:16:07,True,True
2016-05-14T15:45:47,Chris pine looks just like a young Raylan Givens....Prequel?,0,0,InstaLockin Loki,j9zwMQN_Yig,0.1,2016-05-14 15:45:47,True,True
2016-05-15T03:21:34,"Chris Pine AND Ben Foster, both in Finest Hours together. This is gonna be a great movie!!",0,0,Aerrowflex,j9zwMQN_Yig,1.0,2016-05-15 03:21:34,True,True
2016-05-15T06:30:49,omg am i looking at chris pine dude ur awesome,0,0,chinthadasaidilip,j9zwMQN_Yig,1.0,2016-05-15 06:30:49,True,True
2016-05-15T10:20:38,Looks like the modern version of Jesse James.,0,0,Serenity113,j9zwMQN_Yig,0.2,2016-05-15 10:20:38,True,True
2016-05-15T11:21:59,"hill billy, shotguns, beer, no respect for women, invade others, rob banks, beer, burger, beeer, cocain, crack, gambling, beer, guns, murica yee hawwwwwwwwwwwwww",0,0,Muhammad Aamir,j9zwMQN_Yig,0.0,2016-05-15 11:21:59,True,True
2016-05-15T15:11:21,Looks  good!!!,0,0,Max Maximus,j9zwMQN_Yig,1.0,2016-05-15 15:11:21,True,True
2016-05-15T18:19:45,ben foster killin again.. such a boss,0,0,Daniel Martin,j9zwMQN_Yig,0.0,2016-05-15 18:19:45,True,True
2016-05-15T18:34:33,2:03 anyone know what version of Knockin on heavens door this is?,6,1,Damingo54,j9zwMQN_Yig,0.0,2016-05-15 18:34:33,True,True
2016-05-15T20:36:32,"SEEMS NOWADAYS I AINT GOT TIME TO WATCH ALL THE NEW MOVIE TRAILERS, LET ALONE THE MOVIES IN FULL ,WTF",4,0,Allan Tippett,j9zwMQN_Yig,-0.0045454545454545565,2016-05-15 20:36:32,True,True
2016-05-15T20:52:43,Hell or High Watah.,0,0,Imbokeri,j9zwMQN_Yig,0.16,2016-05-15 20:52:43,True,True
2016-05-15T21:22:07,"Jeff Bridges and Ben foster, I mean even if its. just killer spiders or something",5,0,L C,j9zwMQN_Yig,-0.3125,2016-05-15 21:22:07,True,True
2016-05-15T21:56:20,reading the comments with the jeff bridge voice,0,0,sharmarke abdulkadir,j9zwMQN_Yig,0.0,2016-05-15 21:56:20,True,True
2016-05-15T22:36:56,Once again...the trailer shows TOO MUCH!! From what it shows the remaining story I can piece  together. Unfortunate as i WOULD have PAID to see anything with Ben Foster in it.,0,0,1 Bad Jesus,j9zwMQN_Yig,-0.09375,2016-05-15 22:36:56,True,True
2016-05-15T23:45:39,Knockin on heavens door by blakwall,4,0,antonio garcia,j9zwMQN_Yig,0.0,2016-05-15 23:45:39,True,True
2016-05-16T00:06:09,I bet the whole premise of robbing the bank to save the mother's house is a lie by one of the brothers. So piss on my fists.,0,0,SethMcFartlane,j9zwMQN_Yig,0.2,2016-05-16 00:06:09,True,True
2016-05-16T01:18:17,Ben Foster Whaaaaw,0,0,Calis 10leafs,j9zwMQN_Yig,0.0,2016-05-16 01:18:17,True,True
2016-05-16T02:55:44,HOOOOOOOLY SHIIIIIIIIIIT!!!!!!! THEY ACTUALLY MADE A MICHAEL AND TREVOR MOVIE IN THEIR GOOD OLD LUNDENDORF DAYS!!!!!!! XD,0,0,Jacob Cervantes,j9zwMQN_Yig,0.39227905273437497,2016-05-16 02:55:44,True,True
2016-05-16T04:54:34,Chris Pine has very distinctive/piercing eyes. He wouldn't last long in a police lineup,66,1,Dane Potmo,j9zwMQN_Yig,0.05000000000000001,2016-05-16 04:54:34,True,True
2016-05-16T09:55:13,Wow that was a short movie,0,0,Fanzo,j9zwMQN_Yig,0.05,2016-05-16 09:55:13,True,True
2016-05-16T11:22:39,Chris Pine❤❤❤,0,0,fi mo,j9zwMQN_Yig,0.0,2016-05-16 11:22:39,True,True
2016-05-16T14:58:15,i love the original song but this cover sounds pretty good,0,0,Salman Airlangga,j9zwMQN_Yig,0.45625,2016-05-16 14:58:15,True,True
2016-05-16T19:06:09,bruh chris looks soo old xDD,0,0,niks,j9zwMQN_Yig,0.1,2016-05-16 19:06:09,True,True
2016-05-16T19:24:49,Ben Foster is coming to be a great Actor.,2,0,José Films,j9zwMQN_Yig,0.8,2016-05-16 19:24:49,True,True
2016-05-16T21:35:35,looks good!,0,0,Sergio Branco,j9zwMQN_Yig,0.875,2016-05-16 21:35:35,True,True
2016-05-16T22:04:02,I like the song 🎶👍🏼,0,0,Haylin AS,j9zwMQN_Yig,0.0,2016-05-16 22:04:02,True,True
2016-05-16T22:06:02,"Pine : It's a big bang  Foster : ""whistling""  Pine : It's too big  Foster : that's what she said",1,0,I’m blue Da be dee da be da,j9zwMQN_Yig,0.0,2016-05-16 22:06:02,True,True
2016-05-17T00:22:33,Trailer song anyone? I'm sure it's a cover..,0,0,JAROLOCO HD,j9zwMQN_Yig,0.5,2016-05-17 00:22:33,True,True
2016-05-17T00:35:24,"""Because you asked little brother"" such a cool line.",0,0,Waverley,j9zwMQN_Yig,0.05416666666666666,2016-05-17 00:35:24,True,True
2016-05-17T03:15:19,نیست,0,1,Parviz Qolinejad,j9zwMQN_Yig,0.0,2016-05-17 03:15:19,True,True
2016-05-17T05:52:00,You had me at Ben Foster,0,0,korlu01,j9zwMQN_Yig,0.0,2016-05-17 05:52:00,True,True
2016-05-17T14:13:56,an actual movie with a good story and actors!!not a bunch of cgi and c list actors!!!,0,0,chris,j9zwMQN_Yig,0.5,2016-05-17 14:13:56,True,True
2016-05-17T15:04:00,"it's like a country western version of Heat, but that ain't a bad thing",5,0,popeye697,j9zwMQN_Yig,-0.3499999999999999,2016-05-17 15:04:00,True,True
2016-05-17T15:38:59,.,0,0,lorena argemil,j9zwMQN_Yig,0.0,2016-05-17 15:38:59,True,True
2016-05-17T20:46:21,"i got the richard gere movie: ""miles from home"". more a feeling than storyline . maybe its the locations and the attitude of the robbers another thing is : jeff bridges comes like a robert duvall in this movie.  of course this is a different and more modern flick. i am interested in it!",0,0,Media Gorilla,j9zwMQN_Yig,0.3025,2016-05-17 20:46:21,True,True
2016-05-17T22:35:22,The beginning audio cut is horrendous!!,0,0,Jonny Cofta,j9zwMQN_Yig,0.0,2016-05-17 22:35:22,True,True
2016-05-18T00:48:20,This movie had me at the mention of Ben Foster. I wish he would get more recognition the his acting abilities.,4,0,lyn's life,j9zwMQN_Yig,0.25,2016-05-18 00:48:20,True,True
2016-05-18T04:16:24,"Yeah, I'm gonna need subtitles for this one...",0,0,Kenneth Bergan,j9zwMQN_Yig,0.0,2016-05-18 04:16:24,True,True
2016-05-18T09:21:22,Interested.,0,0,Tone Desh,j9zwMQN_Yig,0.25,2016-05-18 09:21:22,True,True
2016-05-18T18:49:46,can't wait,0,0,Krystin Grant,j9zwMQN_Yig,0.0,2016-05-18 18:49:46,True,True
2016-05-18T20:14:35,"Knocking on heaven's door remix sounds good , loved Dylan and loved the reggae remix , this song is so good that when remixed by talented artists it sounds great!",2,0,boxertest,j9zwMQN_Yig,0.75,2016-05-18 20:14:35,True,True
2016-05-18T20:28:48,Superb! Bridges is KING!,0,0,nama chakraborthy,j9zwMQN_Yig,1.0,2016-05-18 20:28:48,True,True
2016-05-18T20:34:27,Call of Juarez anyone?,0,0,ponchomkr,j9zwMQN_Yig,0.0,2016-05-18 20:34:27,True,True
2016-05-19T00:37:50,Is the actor at 0:21 one of the neo-Nazis from Breaking Bad?,0,0,driesm81607,j9zwMQN_Yig,-0.6999999999999998,2016-05-19 00:37:50,True,True
2016-05-19T01:02:37,this looks good,0,0,Tony Montana,j9zwMQN_Yig,0.7,2016-05-19 01:02:37,True,True
2016-05-19T18:22:04,Jeff Bridges seems like he's doing Rooster Cogburn in ever movie,2,1,Sean Houlker,j9zwMQN_Yig,0.0,2016-05-19 18:22:04,True,True
2016-05-20T09:06:26,theres hope yet with movies like this....,0,0,Stank Eye,j9zwMQN_Yig,0.0,2016-05-20 09:06:26,True,True
2016-05-20T09:32:17,Chris Pine needs to go back to playing skinheads,2,0,rowsdower,j9zwMQN_Yig,0.0,2016-05-20 09:32:17,True,True
2016-05-20T16:36:09,"I like anything with Ben Foster, he's such an unrated actor imo",15,1,Hot Donkey,j9zwMQN_Yig,0.0,2016-05-20 16:36:09,True,True
2016-05-21T10:24:31,Great movie.  Wow.  I'm going to see it.,0,0,Tony Nero,j9zwMQN_Yig,0.45,2016-05-21 10:24:31,True,True
2016-05-21T12:47:55,No Country for Old Men + The Town,7,4,Julsmul,j9zwMQN_Yig,0.1,2016-05-21 12:47:55,True,True
2016-05-21T14:28:39,NICE,0,0,Chef Lambo,j9zwMQN_Yig,0.6,2016-05-21 14:28:39,True,True
2016-05-22T00:50:36,These guys went to rob banks from the18th century where there were no windows or bullet proof shields ??,0,0,gera wiz,j9zwMQN_Yig,0.0,2016-05-22 00:50:36,True,True
2016-05-22T00:59:13,Hell yeah!!!!!!!,0,0,Cory Picotte,j9zwMQN_Yig,0.0,2016-05-22 00:59:13,True,True
2016-05-22T17:12:46,def seeing this,0,0,Brian Palmer,j9zwMQN_Yig,0.0,2016-05-22 17:12:46,True,True
2016-05-23T01:21:45,"I thought it stars by burnely fc midfielder ""joey baton"" lol :P 'Chris Pine'",0,0,Waran Mohanathasan,j9zwMQN_Yig,0.775,2016-05-23 01:21:45,True,True
2016-05-23T18:05:29,"Something hypnotic about this trailer. And ""Knockin on Heaven's Door"" with that ending is a beaut.",3,1,Vinnie Moran,j9zwMQN_Yig,0.0,2016-05-23 18:05:29,True,True
2016-05-24T14:00:21,I needed some Ben Foster in my life,0,0,N Perez,j9zwMQN_Yig,0.0,2016-05-24 14:00:21,True,True
2016-05-24T20:37:02,Dang! Best trailer I've seen in a while.,0,0,LaRay82,j9zwMQN_Yig,1.0,2016-05-24 20:37:02,True,True
2016-05-25T10:43:36,You want a little bit of advice? Get to the chopper,0,0,Dennis Stewart,j9zwMQN_Yig,-0.1875,2016-05-25 10:43:36,True,True
2016-05-25T13:14:11,Looking good OvO,0,0,Krow,j9zwMQN_Yig,0.7,2016-05-25 13:14:11,True,True
2016-05-25T14:16:41,"Ben Foster is on of the finest actors of Hollywood, he should be given more roles he is very capable performing on the highest levels, he is natural. I love all his work great actor",0,0,bluejeans_Canada,j9zwMQN_Yig,0.43200000000000005,2016-05-25 14:16:41,True,True
2016-05-25T14:41:27,looks good,0,0,Paul N,j9zwMQN_Yig,0.7,2016-05-25 14:41:27,True,True
2016-05-26T03:18:12,welcome back Ben Foster.. I thought I lost u after the hostage thing.,0,0,Aj Venix,j9zwMQN_Yig,0.4,2016-05-26 03:18:12,True,True
2016-05-26T13:40:46,Am i the only one who thought it was collin farrel in true detective 2 ?,0,0,hadifridge,j9zwMQN_Yig,0.175,2016-05-26 13:40:46,True,True
