timestamp,text,like_count,reply_count,author,trailer_id,sentiment_score,datetime,used_for_model,used_for_visualization
2016-02-24T20:40:55,"But, there is one they fear. In their tongue he is Keanu, THE KITTEN! NYAH!",0,0,RandomQuestion,K9zy27apgI8,0.0,2016-02-24 20:40:55,True,True
2016-02-28T21:36:07,cutie kitty : ),0,0,Stella Diamonds,K9zy27apgI8,0.5,2016-02-28 21:36:07,True,True
2016-03-01T07:18:03,i would have just got another cat,0,0,David Moralez,K9zy27apgI8,0.0,2016-03-01 07:18:03,True,True
2016-03-02T19:20:12,HA!,0,0,TheRebelLion96,K9zy27apgI8,0.0,2016-03-02 19:20:12,True,True
2016-03-06T20:48:59,"I love key and peele but to be honest this movie looks like crap, I didn't even think it was funny",0,0,Benzedrine,K9zy27apgI8,0.11000000000000001,2016-03-06 20:48:59,True,True
2016-03-06T21:13:25,Wow,0,0,NOM,K9zy27apgI8,0.1,2016-03-06 21:13:25,True,True
2016-03-07T17:40:44,holy shit this looks AWFUL,0,0,Anthony Torres,K9zy27apgI8,-0.6,2016-03-07 17:40:44,True,True
2016-03-08T00:36:24,Anyone else noticed the in n out cup at :24?,2,1,GOATphen Curry,K9zy27apgI8,0.0,2016-03-08 00:36:24,True,True
2016-03-08T14:17:27,Sounds like a spoof for John Wick! And it looks awesome :D,10,0,SamRockX,K9zy27apgI8,0.625,2016-03-08 14:17:27,True,True
2016-03-08T20:26:51,AtupC,0,0,TheDeltaWolf,K9zy27apgI8,0.0,2016-03-08 20:26:51,True,True
2016-03-08T21:32:20,Give that cat an award!!,0,0,ZoeTheZurtle,K9zy27apgI8,0.0,2016-03-08 21:32:20,True,True
2016-03-11T03:58:55,I got one word to say to this sofunnyhadtorewatchitfifteentimesandreplaytheendingtwentytimessoawsometenoutoften.,0,0,Redlightningwolf,K9zy27apgI8,0.0,2016-03-11 03:58:55,True,True
2016-03-11T03:59:09,I got one word to say to this sofunnyhadtorewatchitfifteentimesandreplaytheendingtwentytimessoawsometenoutoften.,0,0,Redlightningwolf,K9zy27apgI8,0.0,2016-03-11 03:59:09,True,True
2016-03-11T23:20:12,KEANU!!!!!!!!!!!!!!!!!!!!!!!!!!!!!!!!!!!!!!!!!!!!!!!!!!!,0,0,Junjun,K9zy27apgI8,0.0,2016-03-11 23:20:12,True,True
2016-03-12T04:40:36,looks good,0,0,Toja Pramatis,K9zy27apgI8,0.7,2016-03-12 04:40:36,True,True
2016-03-12T11:06:48,looks absolute shite,0,1,cameron smith,K9zy27apgI8,0.2,2016-03-12 11:06:48,True,True
2016-03-12T12:53:34,KITTEH......,0,0,Green Synchronize,K9zy27apgI8,0.0,2016-03-12 12:53:34,True,True
2016-03-12T14:34:36,id watch the shit out of this,0,0,Connor Beckman,K9zy27apgI8,-0.2,2016-03-12 14:34:36,True,True
2016-03-13T21:17:14,finally they as the main on the same movie...,2,0,amex jinn,K9zy27apgI8,0.05555555555555555,2016-03-13 21:17:14,True,True
2016-03-14T22:39:38,im actually so ready for this,0,0,Chianti Moorman,K9zy27apgI8,0.2,2016-03-14 22:39:38,True,True
2016-03-15T10:40:54,"HI Worner Bros Pictures, i love your channel TV & Online, I Wait continue Tom And Jerry Show 2014 2 Seasone wait. Thanks ^_^",0,0,Command Galactic,K9zy27apgI8,0.35,2016-03-15 10:40:54,True,True
2016-03-16T14:54:37,At least there's finally something different like most movies are always about a person being the bad guy and there trying to save the person from being held hostage by the bad guy,0,0,Leon Riveira,K9zy27apgI8,-0.19999999999999996,2016-03-16 14:54:37,True,True
2016-03-16T15:48:08,💵💵💵💵 Take my money. ..NOW!!!,1,0,eroupopper,K9zy27apgI8,0.0,2016-03-16 15:48:08,True,True
2016-03-17T10:04:27,My NAMES SHARKTANK!!!!!!!!!!,0,0,JJ Peach,K9zy27apgI8,0.0,2016-03-17 10:04:27,True,True
2016-03-17T22:03:53,haha love it when they do comedy with both their racial ethnicity.,0,0,Sushi,K9zy27apgI8,0.35,2016-03-17 22:03:53,True,True
2016-03-19T01:08:48,"this is like "" dude where my car """,0,0,WavyBenz,K9zy27apgI8,0.0,2016-03-19 01:08:48,True,True
2016-03-19T11:07:26,There isn't a black man alive that would risk his life over a cat.,6,5,Ytremz,K9zy27apgI8,-0.033333333333333326,2016-03-19 11:07:26,True,True
2016-03-19T11:33:00,Love how this has better like:dislike ratio than the Ghostbusters (2016) trailer.,0,0,Aiden LF,K9zy27apgI8,0.5,2016-03-19 11:33:00,True,True
2016-03-19T12:31:23,Gonna see this.,0,0,pajewa,K9zy27apgI8,0.0,2016-03-19 12:31:23,True,True
2016-03-21T21:33:14,i love cute cays and my name is keanu like IM SO GONNA WATCH THIS MOVIE :D,0,1,Keanu,K9zy27apgI8,0.6666666666666666,2016-03-21 21:33:14,True,True
2016-03-23T06:20:33,This cat deserves a fucking Oscar!,0,0,Mariah Mendoza,K9zy27apgI8,-0.75,2016-03-23 06:20:33,True,True
2016-03-23T21:37:47,Keanu reeves loses pet and they lose a pet called Keanu lol,1,0,Bee's Knees,K9zy27apgI8,0.25,2016-03-23 21:37:47,True,True
2016-03-24T04:00:33,Gnarly,0,0,Dominique Beverly,K9zy27apgI8,0.0,2016-03-24 04:00:33,True,True
2016-03-24T14:42:55,I thought it was about the Keanu!,0,0,Amit Singh,K9zy27apgI8,0.0,2016-03-24 14:42:55,True,True
2016-03-24T17:13:20,"""Me?  Appendix!  BLEAAUUUGGHHHH!!! They took it out of my body!""",1,1,Fisal Aman,K9zy27apgI8,0.0,2016-03-24 17:13:20,True,True
2016-03-24T17:17:53,MY NAME IS SHARK TANK .... AWGHHHHH😭,0,0,Mrarturochava,K9zy27apgI8,0.0,2016-03-24 17:17:53,True,True
2016-03-24T19:44:17,ha ha ha what the hell 😂,0,0,J,K9zy27apgI8,0.0,2016-03-24 19:44:17,True,True
2016-03-24T21:09:20,#johnwick   nobody kills peele cat,0,0,NonsensicalVids,K9zy27apgI8,0.0,2016-03-24 21:09:20,True,True
2016-03-25T02:40:36,lol 😂,0,0,willie holmes,K9zy27apgI8,0.8,2016-03-25 02:40:36,True,True
2016-03-25T03:33:17,Sharktank,0,0,Slater OGK,K9zy27apgI8,0.0,2016-03-25 03:33:17,True,True
2016-03-25T21:08:11,those comedy central seasons paid offf lol,0,0,jama655,K9zy27apgI8,0.4,2016-03-25 21:08:11,True,True
2016-03-27T17:20:25,"I mean this is obviously a parody of John Wick, hence the cat's name Keanu aka Keanu Reeves. I love Key & Peel <3",8,1,Rodolfo Suarez,K9zy27apgI8,0.2375,2016-03-27 17:20:25,True,True
2016-03-27T21:34:28,proof that cats are the best entertainment ever......and i just happen to be allergic to them FML,13,0,Oh Boy Skaw,K9zy27apgI8,1.0,2016-03-27 21:34:28,True,True
2016-03-28T17:03:31,+Big Cheese The Rock a fire explosion in this!,1,0,Zach Mondano,K9zy27apgI8,0.0,2016-03-28 17:03:31,True,True
2016-03-29T12:34:22,Finally people understand that loving kittens is better then neglecting pets and being an asshole. This is why I love key and Peele,0,0,alexander T,K9zy27apgI8,0.32,2016-03-29 12:34:22,True,True
2016-03-29T16:13:15,Money in the bank!,0,0,Jimaro Morales,K9zy27apgI8,0.0,2016-03-29 16:13:15,True,True
2016-03-29T18:49:17,"at first i thought this was a john wick spoof(hence the name) sketch from key and peele, now i wanna see this really bad",0,0,Vadim Kazakov,K9zy27apgI8,-0.14999999999999994,2016-03-29 18:49:17,True,True
2016-03-29T20:37:52,This is not a movie. this is a sketch.,0,0,HybridFlu,K9zy27apgI8,0.0,2016-03-29 20:37:52,True,True
2016-03-30T01:25:54,"I can't believe the cat is a better actor that Keanu Reeves.  No, I can believe it.",2,0,greyeyed123,K9zy27apgI8,0.5,2016-03-30 01:25:54,True,True
2016-03-30T05:08:00,clearly a parody of John Wick,1,0,DJSonicWaves,K9zy27apgI8,0.10000000000000002,2016-03-30 05:08:00,True,True
2016-03-31T02:30:33,This movie will be awesome.,0,0,The Dream,K9zy27apgI8,1.0,2016-03-31 02:30:33,True,True
2016-03-31T02:31:31,MY NAME IS SHARKTANK!,0,0,The Dream,K9zy27apgI8,0.0,2016-03-31 02:31:31,True,True
2016-04-01T09:53:33,This looks like kind of a weird movie lol,0,0,Pickering144,K9zy27apgI8,0.3,2016-04-01 09:53:33,True,True
2016-04-06T01:01:01,Why a cat not a human probably to be funny the movie,0,0,Hugo Arizmendi,K9zy27apgI8,0.125,2016-04-06 01:01:01,True,True
2016-04-06T03:25:42,1+ hour key and peele sketch.  worth it,0,0,Sampad Banerjee,K9zy27apgI8,0.15,2016-04-06 03:25:42,True,True
2016-04-06T04:51:22,I am going to see this just to see that cat with his do rag on! Never laughed so hard in my life!,5,0,Beatrice Harris,K9zy27apgI8,-0.3572916666666667,2016-04-06 04:51:22,True,True
2016-04-07T11:08:35,Keanu reeves is a cat?!,0,0,Luke R,K9zy27apgI8,0.0,2016-04-07 11:08:35,True,True
2016-04-07T14:28:47,Plz guys just a cat and Hollywood said ye thia might work,0,0,sniper hits,K9zy27apgI8,0.0,2016-04-07 14:28:47,True,True
2016-04-08T18:15:19,"Whats that ""freedom"" song called?",0,1,PH_Metal,K9zy27apgI8,0.0,2016-04-08 18:15:19,True,True
2016-04-09T08:37:20,KEY AND PEELE!!,0,0,Aleksa Tadic,K9zy27apgI8,0.0,2016-04-09 08:37:20,True,True
2016-04-09T14:29:51,Lol. Imma watch this,0,0,Paul Des,K9zy27apgI8,0.8,2016-04-09 14:29:51,True,True
2016-04-09T19:37:28,Im liking this cuz im prettys sure thts the guy who played eazy-e,0,0,Nick Bermeo,K9zy27apgI8,0.5,2016-04-09 19:37:28,True,True
2016-04-09T21:57:01,Can't see it rated R:((,0,0,Andrew Creel,K9zy27apgI8,-0.75,2016-04-09 21:57:01,True,True
2016-04-19T02:22:03,if anything happens to the cat i'm gonna hurt somebody,36,0,th2k,K9zy27apgI8,0.0,2016-04-19 02:22:03,True,True
2016-04-19T10:22:03,"I heard that WB was in financial trouble , I like what I've seen of K/P , so I'll go pay to see this.",2,0,Dan Ratte,K9zy27apgI8,-0.1,2016-04-19 10:22:03,True,True
2016-04-21T02:30:24,i'm in!!!!!!,0,0,august comeon,K9zy27apgI8,0.0,2016-04-21 02:30:24,True,True
2016-04-21T05:55:30,That's my name,0,0,Keanu John,K9zy27apgI8,0.0,2016-04-21 05:55:30,True,True
2016-04-22T02:24:31,I think this can do well.,0,0,A Buck,K9zy27apgI8,0.0,2016-04-22 02:24:31,False,True
2016-04-23T21:46:39,"Oh, yah! Can't go wrong about a Gangsta cat? Too cute!",0,0,Dianna Davis,K9zy27apgI8,0.0625,2016-04-23 21:46:39,False,True
2016-04-23T23:51:57,i wonder how long casting took to find the cutest cat in the world,44,2,Cocoaben,K9zy27apgI8,-0.05,2016-04-23 23:51:57,False,True
2016-04-24T18:51:41,I'm so gonna watch this movie,1,0,beastypie99,K9zy27apgI8,0.0,2016-04-24 18:51:41,False,True
2016-04-25T21:58:20,THIS IS GOING TO BE THE SHIT!!!!!  LMAO 😁,4,0,Eddie O,K9zy27apgI8,-0.005175781250000011,2016-04-25 21:58:20,False,True
2016-04-26T04:07:42,all i have to say is...that poor cat.  just no.,2,0,Miss D,K9zy27apgI8,-0.4,2016-04-26 04:07:42,False,True
2016-04-27T00:47:22,This looks funny! :),0,0,McCain Jay,K9zy27apgI8,0.40625,2016-04-27 00:47:22,False,True
2016-04-27T04:31:42,What is this rated ? Pg 13 or,0,1,Martin 1,K9zy27apgI8,0.0,2016-04-27 04:31:42,False,True
2016-04-28T05:20:20,I'm there!,0,0,Energy Guru,K9zy27apgI8,0.0,2016-04-28 05:20:20,False,True
2016-04-28T13:48:31,This is fucking stupid,0,0,ShadowDragon23,K9zy27apgI8,-0.7999999999999999,2016-04-28 13:48:31,False,True
2016-04-28T16:23:15,cats rule!,7,0,ozzy Osborn,K9zy27apgI8,0.0,2016-04-28 16:23:15,False,True
2016-04-28T21:47:26,what... in the name of fuck is this,2,0,Johan,K9zy27apgI8,-0.4,2016-04-28 21:47:26,False,True
2016-04-29T07:47:36,Yassssss Bitch!,0,0,Chris Mowry,K9zy27apgI8,0.0,2016-04-29 07:47:36,False,True
2016-04-29T15:18:19,FUCK THIS FUCKING MOVIE!!!,2,0,ShadowDragon23,K9zy27apgI8,-0.7,2016-04-29 15:18:19,False,True
2016-04-29T21:54:20,this movie isnt in my country😢😢,0,0,Jondroid 17,K9zy27apgI8,0.0,2016-04-29 21:54:20,False,True
2016-05-05T15:07:30,This movie sucked big time!,0,0,B Anderson,K9zy27apgI8,0.0,2016-05-05 15:07:30,False,True
2016-05-07T03:25:36,This movie is pretty funny. Definitely a must watch.,0,0,JSJ 86,K9zy27apgI8,0.16666666666666666,2016-05-07 03:25:36,False,True
2016-05-08T19:50:40,Two guys and a CAT AMAZING,0,0,Mark Lawrence,K9zy27apgI8,0.6000000000000001,2016-05-08 19:50:40,False,True
2016-05-09T02:54:40,going to see this tomorrow😂👍,0,0,VANS OFF THE WALL,K9zy27apgI8,0.0,2016-05-09 02:54:40,False,True
2016-05-11T12:20:55,*KEANU:* 2016 #full movie available now in HD version _STREAM NOW:_ https://plus.google.com/+DominicDenise/posts/AmX4VQnci1H,1,0,Varida Varda,K9zy27apgI8,0.375,2016-05-11 12:20:55,False,True
2016-05-27T17:19:00,looks funny but wanna see it just for the George Michael music in it :),19,2,missisfreddiemercury,K9zy27apgI8,0.375,2016-05-27 17:19:00,False,True
2016-05-29T04:36:18,yah man john wick haha,0,0,Mark Andrew Zurbano,K9zy27apgI8,0.2,2016-05-29 04:36:18,False,True
2016-05-29T16:32:07,"6 minutes in, read Keanu Reeves makes a vocal cameo :D, love this movie",5,0,Iron Lungs,K9zy27apgI8,0.75,2016-05-29 16:32:07,False,True
2016-06-01T10:54:48,this movie looks epic im seeing it,0,0,Jade,K9zy27apgI8,0.1,2016-06-01 10:54:48,False,True
2016-06-02T19:00:33,"Racist atheists, opening scene is a massacre in a church filled with drugs  I pity America, I honestly pray for you, because when gods hand comes down it will crush your fucked up nation for the cesspool of shit you breed",0,1,3 Diesel,K9zy27apgI8,-0.009259259259259254,2016-06-02 19:00:33,False,True
2016-06-07T11:34:21,Love This Movir,1,0,Manik Urk,K9zy27apgI8,0.5,2016-06-07 11:34:21,False,True
2016-06-10T14:09:38,Keanu Is so cute,6,0,BigOofer 420,K9zy27apgI8,0.5,2016-06-10 14:09:38,False,True
2016-06-13T00:44:57,oh my god keanu 🐱 turns in to 😎 thug life                        keanu 👏👏                                     ~~,1,0,Kali Rueda,K9zy27apgI8,0.0,2016-06-13 00:44:57,False,True
2016-06-13T17:50:03,This is going to be soo EPIC!,0,0,Punk3rify,K9zy27apgI8,0.125,2016-06-13 17:50:03,False,True
2016-06-16T11:53:22,"Can't wait to see it.  Bringing our four cats, too.",0,0,Happybidr,K9zy27apgI8,0.0,2016-06-16 11:53:22,False,True
2016-06-20T23:23:28,"If your heart doesn't totally melt at 0:13, it's because you don't have one.  And hopefully it went better for these two in this film than it did in Fargo (season one).",0,0,David Gee,K9zy27apgI8,0.25,2016-06-20 23:23:28,False,True
2016-06-21T01:29:56,It should have DMX in this movie,1,1,Leopard of Fear,K9zy27apgI8,0.0,2016-06-21 01:29:56,False,True
2016-06-25T07:45:37,Now they should bring the show back.,0,0,Michael Garcia,K9zy27apgI8,0.0,2016-06-25 07:45:37,False,True
2016-07-08T23:21:36,are these todays movies sorry but this film looks fucking shit the humour as well looks garbage just like every other film nowadays,0,1,Ni1784,K9zy27apgI8,-0.27499999999999997,2016-07-08 23:21:36,False,True
2016-07-09T00:34:06,Hollywood Just ran out of Ideas,0,0,Matt Vlog,K9zy27apgI8,0.0,2016-07-09 00:34:06,False,True
2016-07-09T16:48:36,Im gonna see this cause method man and the little cat,0,0,leo,K9zy27apgI8,-0.1875,2016-07-09 16:48:36,False,True
2016-07-10T00:53:18,this is how black on black crime starts don't let Anna faris tear us apart........john wick the boogeyman inspired keanu....**spoiler alert** keanu reeve and method man....hilarious,0,0,VALMER LYNN,K9zy27apgI8,-0.16666666666666666,2016-07-10 00:53:18,False,True
2016-07-10T00:59:13,key and peele show the world the deference between a AFRICAN AMERICAN.......AND A NIGGA...If this offends you watch the movie then you'll understand.,0,0,VALMER LYNN,K9zy27apgI8,0.0,2016-07-10 00:59:13,False,True
2016-07-18T09:06:42,"saw the movie, damn funny ! :P",0,0,ZX6 RS,K9zy27apgI8,0.53125,2016-07-18 09:06:42,False,True
2016-07-25T14:46:15,I think that might be the dumbest screenplay ever. 2 guys fighting gang over a cat.,0,1,Marcin P,K9zy27apgI8,0.0,2016-07-25 14:46:15,False,True
2016-07-25T21:20:35,"Shit, id do same for my cat :))",0,0,Corey Mabbitt,K9zy27apgI8,0.09999999999999999,2016-07-25 21:20:35,False,True
2016-07-31T17:05:31,"""Wazzap motherfuckers"" LMAO",0,0,Mugetsu,K9zy27apgI8,0.6,2016-07-31 17:05:31,False,False
2016-08-05T03:53:39,I think it was funny,0,0,Dreia,K9zy27apgI8,0.25,2016-08-05 03:53:39,False,False
2016-08-07T16:21:24,you must watch rly funny,0,0,LeLM,K9zy27apgI8,0.25,2016-08-07 16:21:24,False,False
2016-08-08T02:35:51,I am soooooooooooooooooooooooooooooooo watching  this 😂,0,0,Tailed Beasts27,K9zy27apgI8,0.0,2016-08-08 02:35:51,False,False
2016-08-08T14:59:49,do they have any of these trailers in caption? this looks hilarious!,0,0,Cindy,K9zy27apgI8,0.625,2016-08-08 14:59:49,False,False
2016-08-09T19:07:46,Still better than Ghostbusters 2016,0,0,axe beard,K9zy27apgI8,0.5,2016-08-09 19:07:46,False,False
2016-08-10T14:08:45,Well I'll give it a chance,0,0,Ni1784,K9zy27apgI8,0.0,2016-08-10 14:08:45,False,False
2016-08-12T22:49:49,a movie about a pussy ...ON A CHAINWAAAAX,1,0,Khalid Alamin,K9zy27apgI8,0.0,2016-08-12 22:49:49,False,False
2016-08-20T20:56:09,"You had me at ""kitten dressed as a gangster""",23,0,James Gibson,K9zy27apgI8,0.0,2016-08-20 20:56:09,False,False
2016-08-23T04:34:03,"""Where's Jay-quellin at? No Jay-quellin here?"" ""Uh, do you mean Jacqueline?"" (Throws down clipboard)  ""Okay, so that's how it's gonna be. Y'all wanna play. Okay, then. I got my eye on you Jay-quellin.""",53,5,Heavyn Taliaferro-McClintock,K9zy27apgI8,0.1329861111111111,2016-08-23 04:34:03,False,False
2016-08-23T05:44:21,"fucking crap movie, totally disappointed, had a beer and blunt ready to watch it and laugh ass off,,,,and just plain not funny, top worst movies ever.",1,0,YoungGun-RickyAnzley,K9zy27apgI8,-0.23616071428571428,2016-08-23 05:44:21,False,False
2016-08-27T11:46:00,"i watched this, it was good",4,0,Luca HAMBLETON,K9zy27apgI8,0.7,2016-08-27 11:46:00,False,False
2016-08-29T09:51:05,keanu reeves !,0,0,Bernard Paton,K9zy27apgI8,0.0,2016-08-29 09:51:05,False,False
2016-09-13T05:47:33,This movie bombed at the box office. You should never try to change an association. Immediately you put yourself at a disadvantage. Everyone associates keanu with keanu reeves,0,0,Cake Dog,K9zy27apgI8,0.0,2016-09-13 05:47:33,False,False
2016-09-25T21:04:16,Wait Keanu is that Cat?,1,0,Flairelle,K9zy27apgI8,0.0,2016-09-25 21:04:16,False,False
2016-09-26T03:51:47,needs more cat,0,0,Egalitarian Ethos,K9zy27apgI8,0.5,2016-09-26 03:51:47,False,False
2016-10-02T06:25:37,I just watched this movie.  it was bad that it was good.  I couldn't stop laughing,5,1,Chiamaka Igwe,K9zy27apgI8,5.551115123125783e-17,2016-10-02 06:25:37,False,False
2016-10-12T17:45:16,1:10 music ???,0,0,Ash AMV's,K9zy27apgI8,0.0,2016-10-12 17:45:16,False,False
2016-11-11T16:59:04,Ha ha ha ha ha ha ha ha ha ha ha ha.,0,0,jazzy777,K9zy27apgI8,0.0,2016-11-11 16:59:04,False,False
2016-11-19T16:10:17,Who is here for RAE?,1,0,Skullkrane Entertainment,K9zy27apgI8,0.0,2016-11-19 16:10:17,False,False
2017-01-06T06:11:55,"""This my jam!""",0,0,K+,K9zy27apgI8,0.0,2017-01-06 06:11:55,False,False
2017-01-06T18:34:58,Very good movie!,0,0,Blink Sone,K9zy27apgI8,1.0,2017-01-06 18:34:58,False,False
2017-01-25T22:46:11,my name is keanu,0,0,Super Fire 64 Kid,K9zy27apgI8,0.0,2017-01-25 22:46:11,False,False
2017-01-31T03:30:35,cat and george michael,0,0,kalex888,K9zy27apgI8,0.0,2017-01-31 03:30:35,False,False
2017-03-06T03:53:27,This movie is awesome  mustttt watch you guys,0,0,Nappy. goddess,K9zy27apgI8,1.0,2017-03-06 03:53:27,False,False
2017-06-04T20:22:58,"my nwa roots tell me to say ""the nigga in the car is the caracter  EAZY-E """,0,0,felix,K9zy27apgI8,0.0,2017-06-04 20:22:58,False,False
2017-06-24T01:10:42,0:12,0,0,okay is wonderful,K9zy27apgI8,0.0,2017-06-24 01:10:42,False,False
2017-06-24T03:57:01,"Best film ever! Haha! Nah but seriously, this was sooo decent! I didn't know who Key and Peele were before this film and their genius plus cute kitten was just awesome! Lol!",0,0,BB Entertainment,K9zy27apgI8,0.453125,2017-06-24 03:57:01,False,False
2017-07-03T12:25:46,i feel so sad that they used my name for a kitten,1,0,IROAM Z,K9zy27apgI8,-0.5,2017-07-03 12:25:46,False,False
2017-07-26T14:51:44,glad to know there arent any racist comment here,1,0,Anime& Games,K9zy27apgI8,0.5,2017-07-26 14:51:44,False,False
2017-08-07T00:31:20,Hilarious!,0,0,neo polaris,K9zy27apgI8,0.625,2017-08-07 00:31:20,False,False
2017-08-16T14:45:26,Who else saw the rockafire explosion?,0,0,Someguy Studios,K9zy27apgI8,0.0,2017-08-16 14:45:26,False,False
2017-08-18T23:13:34,ooo keanuuuu <3,1,0,memoli,K9zy27apgI8,1.0,2017-08-18 23:13:34,False,False
2017-08-19T13:10:48,Keanu is an adorable little kitty. I'm a gut who loves cats and dogs.,0,0,MANIACAL METAL-HEAD,K9zy27apgI8,0.15625,2017-08-19 13:10:48,False,False
2017-09-27T19:44:35,All Of This For a Kitten :D,0,0,Bando Baby,K9zy27apgI8,1.0,2017-09-27 19:44:35,False,False
2017-12-30T23:11:53,i hatched this the other day annddd BITCH SHOOK!,1,0,anjolena,K9zy27apgI8,-0.15625,2017-12-30 23:11:53,False,False
2018-01-22T10:51:29,THIS looks aiiiight. John Wick.....= nah.,0,0,Kagirion,K9zy27apgI8,0.0,2018-01-22 10:51:29,False,False
2018-02-04T15:15:38,Meoooow,1,0,Dimitrios Desmos,K9zy27apgI8,0.0,2018-02-04 15:15:38,False,False
2018-02-27T04:30:47,Adorei filme muito bom ação e comédia o melhor de dois mundos.,0,0,Pirata Produção,K9zy27apgI8,0.0,2018-02-27 04:30:47,False,False
2018-03-01T18:34:03,This movie should be called Nigga Where's My Cat?,1,0,Sérgio Moura,K9zy27apgI8,0.0,2018-03-01 18:34:03,False,False
2018-03-16T17:30:53,Shark Tank = Lavar Ball,0,0,Russell Victory,K9zy27apgI8,0.0,2018-03-16 17:30:53,False,False
2018-03-18T15:42:03,This is the 3rd best movie I’ve ever watched in my life,1,1,awyeaah17,K9zy27apgI8,0.5,2018-03-18 15:42:03,False,False
2018-03-20T20:53:08,super funny movie...love it!,1,0,Donna L. Carl Kuchinski,K9zy27apgI8,0.32291666666666663,2018-03-20 20:53:08,False,False
2018-04-17T01:25:13,My name is Keanu Irving. Same name I got,2,0,God of halo600 Half of 185,K9zy27apgI8,0.0,2018-04-17 01:25:13,False,False
2018-07-01T01:32:25,Yo me llamo Keanu!!!!,0,0,Keanu Trejo,K9zy27apgI8,0.0,2018-07-01 01:32:25,False,False
2018-07-01T01:33:28,My name is Keanu!!!!,0,0,Keanu Trejo,K9zy27apgI8,0.0,2018-07-01 01:33:28,False,False
2018-07-16T18:25:04,i freaking love thid movie,0,0,charlie walsh,K9zy27apgI8,0.5,2018-07-16 18:25:04,False,False
2018-11-02T07:24:33,"1:26 the cat is cute while running :"")",10,0,X3mdain,K9zy27apgI8,0.5,2018-11-02 07:24:33,False,False
2018-11-23T21:24:11,Is this really going to be a movie?,0,0,Monica Tovar,K9zy27apgI8,0.2,2018-11-23 21:24:11,False,False
2019-01-06T00:52:22,👨‍💻Seen a kitty & some dudes with guns          A comedy watch this l8tr 👉🍿          💃                👍,1,0,Mark Arnott,K9zy27apgI8,0.0,2019-01-06 00:52:22,False,False
2019-02-09T16:54:50,John wich with key and peele,0,0,CiGame,K9zy27apgI8,0.0,2019-02-09 16:54:50,False,False
2019-03-05T04:42:11,"that bald actor has not changed 1 bit. I'm glad to see him in a funny  movie. If have a moment YouTube"" madtv gay gangsters.""",0,0,Emphasis213,K9zy27apgI8,0.3888888888888889,2019-03-05 04:42:11,False,False
2019-03-13T16:39:57,Loved this movie...,0,0,Mercenary Mike,K9zy27apgI8,0.7,2019-03-13 16:39:57,False,False
2019-03-25T11:31:54,"Ok, so nowadays, trailer=whole movie",0,0,Benuryu,K9zy27apgI8,0.5,2019-03-25 11:31:54,False,False
2019-03-25T18:58:23,This was me when I rescued my kitty Chutle,0,0,Erin Gillen,K9zy27apgI8,0.0,2019-03-25 18:58:23,False,False
2019-04-01T23:19:44,SHE LOOKS LIKE MY KITTY,0,0,belle,K9zy27apgI8,0.0,2019-04-01 23:19:44,False,False
2019-04-01T23:22:32,I LOVE THIS HAHAHHA,0,0,belle,K9zy27apgI8,0.5,2019-04-01 23:22:32,False,False
2019-05-01T13:00:50,I'm sold only because of the cute af kitten.,0,0,AquaticChaos,K9zy27apgI8,0.25,2019-05-01 13:00:50,False,False
2019-05-18T01:55:56,ghetto cat,1,0,1ctf playz,K9zy27apgI8,0.0,2019-05-18 01:55:56,False,False
2019-05-18T18:06:01,So Keanu Reeves plays the cat?,3,0,Tuner Impala,K9zy27apgI8,0.0,2019-05-18 18:06:01,False,False
2019-06-04T08:09:47,Hi Reeves,0,0,limited,K9zy27apgI8,0.0,2019-06-04 08:09:47,False,False
2019-06-06T03:35:58,The Title Name KEANU Is About Keanu Reeves. Lol,0,0,Ariel Malsi Real,K9zy27apgI8,0.8,2019-06-06 03:35:58,False,False
2019-06-06T03:40:55,Kitten Please! Deja Vu.,0,0,Ariel Malsi Real,K9zy27apgI8,0.0,2019-06-06 03:40:55,False,False
2019-06-12T06:28:30,"After watching this movie, I think Peele got inspired from this to make US.",0,0,Boy Boy,K9zy27apgI8,0.0,2019-06-12 06:28:30,False,False
2019-06-18T01:48:10,Racist against white people,0,0,EROCK OFFICIAL MUZIC,K9zy27apgI8,0.0,2019-06-18 01:48:10,False,False
2019-06-21T12:10:55,The title was a waste of our lord's holy name.,1,0,Walt Zamalis,K9zy27apgI8,-0.2,2019-06-21 12:10:55,False,False
2019-08-04T03:06:16,"""Story line or nothing matters, cause we got the word Keanuu in the title, people will FLOCK to it, waiting for Reeves, but it won't happen."" ""AWR YEAH GREAT IDEA!"" Said no one.",0,0,renamix,K9zy27apgI8,1.0,2019-08-04 03:06:16,False,False
2019-08-04T03:10:41,"HAH movie line about a famous actor getting revenge over a pet. Seriously, if you don't click dislike, your clearly promoting this sorta shit.",0,0,renamix,K9zy27apgI8,0.016666666666666677,2019-08-04 03:10:41,False,False
2019-08-23T22:25:53,just seen this and its far better than the trailer.....  on netflix,0,0,Starlings Planet TV,K9zy27apgI8,0.3,2019-08-23 22:25:53,False,False
2019-09-07T02:42:33,GEORGE MICHAEL,0,0,ᄌᄒᄌ,K9zy27apgI8,0.0,2019-09-07 02:42:33,False,False
2019-10-10T18:47:12,This is John Wick but with a cat,1,0,Tuba Naaz,K9zy27apgI8,0.0,2019-10-10 18:47:12,False,False
2019-10-14T18:25:09,Statistical fact: Your a guy in the 2010s who doesn’t street talk but talks normal and everyone thinks your gay.,0,0,Cesar Gallardo II,K9zy27apgI8,0.2833333333333333,2019-10-14 18:25:09,False,False
2019-11-08T23:18:47,The mef.,0,0,D-Beat & Techno,K9zy27apgI8,0.0,2019-11-08 23:18:47,False,False
2020-01-09T15:07:37,How am I just now noticing the Rock-afire Explosion cameo. It's 2020. Also never watched the movie. :(,0,0,Just George,K9zy27apgI8,-0.75,2020-01-09 15:07:37,False,False
2020-01-18T02:53:29,Hilarious movie!,0,0,John Lincoln Hawk,K9zy27apgI8,0.625,2020-01-18 02:53:29,False,False
2020-02-19T23:07:09,1:38 pause and you will see the rock afire explosion and 2:07 you can see wolf man and billy bob and 2nd gen fatz,0,0,Mxgo,K9zy27apgI8,0.0,2020-02-19 23:07:09,False,False
2020-04-08T00:13:40,i never knew this movie existed until now last year i adopted a boy kitten and my brothers and i named him keanu this was a coincidence.,0,0,nuhaa naleer,K9zy27apgI8,0.0,2020-04-08 00:13:40,False,False
2020-05-02T22:20:13,One of the best movies ever! LOVE IT!,1,0,Loco18,K9zy27apgI8,0.8125,2020-05-02 22:20:13,False,False
2020-05-17T13:14:40,This is amaballs,0,0,Vijay Sharma,K9zy27apgI8,0.0,2020-05-17 13:14:40,False,False
