timestamp,text,like_count,reply_count,author,trailer_id,sentiment_score,datetime,used_for_model,used_for_visualization
2016-02-08T04:34:35,I came here to be early.,0,0,SP- gaming,K9zy27apgI8,0.1,2016-02-08 04:34:35,True,True
2016-02-08T04:34:36,2nd,0,0,Fabian Ortiz,K9zy27apgI8,0.0,2016-02-08 04:34:36,True,True
2016-02-08T04:35:13,it's HERE,0,0,Capt. Shiloh,K9zy27apgI8,0.0,2016-02-08 04:35:13,True,True
2016-02-08T04:35:22,first,0,0,Level Z,K9zy27apgI8,0.25,2016-02-08 04:35:22,True,True
2016-02-08T04:35:43,Second,0,0,Umer Wasti,K9zy27apgI8,0.0,2016-02-08 04:35:43,True,True
2016-02-08T04:35:52,Yo,0,0,Jacob,K9zy27apgI8,0.0,2016-02-08 04:35:52,True,True
2016-02-08T04:35:58,2 coment,0,0,Thanos Diaz,K9zy27apgI8,0.0,2016-02-08 04:35:58,True,True
2016-02-08T04:36:13,3rd,0,0,Is this a Bonfire?,K9zy27apgI8,0.0,2016-02-08 04:36:13,True,True
2016-02-08T04:36:31,first,0,0,Austin Frey,K9zy27apgI8,0.25,2016-02-08 04:36:31,True,True
2016-02-08T04:36:33,Keanu Reeves?,15,1,Maycon Douglas,K9zy27apgI8,0.0,2016-02-08 04:36:33,True,True
2016-02-08T04:36:34,3rd,0,0,DeeJD,K9zy27apgI8,0.0,2016-02-08 04:36:34,True,True
2016-02-08T04:36:39,First comment.,0,0,LALANTHA WIJERATHNE,K9zy27apgI8,0.25,2016-02-08 04:36:39,True,True
2016-02-08T04:36:40,4th,0,0,XxNue,K9zy27apgI8,0.0,2016-02-08 04:36:40,True,True
2016-02-08T04:37:00,fuck U first Comment,0,0,Paolo Melendez,K9zy27apgI8,-0.07500000000000001,2016-02-08 04:37:00,True,True
2016-02-08T04:37:05,5nd,0,0,Harsh Tiwari,K9zy27apgI8,0.0,2016-02-08 04:37:05,True,True
2016-02-08T04:37:11,Hi,0,0,TheGamer,K9zy27apgI8,0.0,2016-02-08 04:37:11,True,True
2016-02-08T04:37:16,a 2 hour long key and peele sketch?  worth it,565,6,Mc Lovin,K9zy27apgI8,0.08333333333333333,2016-02-08 04:37:16,True,True
2016-02-08T04:37:30,Can't wait this to come to theaters.,0,0,LALANTHA WIJERATHNE,K9zy27apgI8,0.0,2016-02-08 04:37:30,True,True
2016-02-08T04:37:31,the next john wick2.0,1,0,Capt. Shiloh,K9zy27apgI8,0.0,2016-02-08 04:37:31,True,True
2016-02-08T04:37:32,clicked for key and peele,0,0,Dayton Rumbold,K9zy27apgI8,0.0,2016-02-08 04:37:32,True,True
2016-02-08T04:37:34,Yay,0,0,TrollingK1ngMaster,K9zy27apgI8,0.0,2016-02-08 04:37:34,True,True
2016-02-08T04:37:35,First,0,0,Javier Gutierrez,K9zy27apgI8,0.25,2016-02-08 04:37:35,True,True
2016-02-08T04:37:37,its like a parody for John wick,0,0,Bryan Zamora,K9zy27apgI8,0.0,2016-02-08 04:37:37,True,True
2016-02-08T04:37:52,It's agent blueberry :D,0,0,Poizun Heizu,K9zy27apgI8,1.0,2016-02-08 04:37:52,True,True
2016-02-08T04:38:11,I need to watch this movie 😂😂😂,5,0,Alexander Gonzalez,K9zy27apgI8,0.0,2016-02-08 04:38:11,True,True
2016-02-08T04:38:14,noice,0,0,Miguelangel Ramirez,K9zy27apgI8,0.0,2016-02-08 04:38:14,True,True
2016-02-08T04:39:10,BvS  trailer!!!!!!!!!!!!!!,0,0,Anfernee Lawrence,K9zy27apgI8,0.0,2016-02-08 04:39:10,True,True
2016-02-08T04:39:37,"If you combine stupidity, fun, jizz, funny people and a cat.... You get this! This is gonna be awesome",0,0,Juan Perdigon,K9zy27apgI8,0.253125,2016-02-08 04:39:37,True,True
2016-02-08T04:40:01,Mixed feelings about this one ...,0,0,Alfred Naupoto,K9zy27apgI8,0.0,2016-02-08 04:40:01,True,True
2016-02-08T04:40:01,Perfect,0,0,Karume Salim,K9zy27apgI8,1.0,2016-02-08 04:40:01,True,True
2016-02-08T04:40:07,keanu = key + an + u (peele),84,5,upermans,K9zy27apgI8,0.0,2016-02-08 04:40:07,True,True
2016-02-08T04:40:19,All that to get a cat. Still gonna watch it tho looks like it's gonna be funnny af,0,0,Jada Early,K9zy27apgI8,0.0,2016-02-08 04:40:19,True,True
2016-02-08T04:40:21,Australia says hey,0,0,SeeThroughScreen,K9zy27apgI8,0.0,2016-02-08 04:40:21,True,True
2016-02-08T04:42:10,they going to save a cat name Keanu.,0,0,Bandwagon for Pelicans.,K9zy27apgI8,0.0,2016-02-08 04:42:10,True,True
2016-02-08T04:42:25,ha.  the bong is missing,0,0,INK,K9zy27apgI8,-0.2,2016-02-08 04:42:25,True,True
2016-02-08T04:42:55,but i know i aint the oly one dat noticed,0,0,INK,K9zy27apgI8,0.0,2016-02-08 04:42:55,True,True
2016-02-08T04:42:57,00:25 yes that is the cuttest cat,0,0,Gissel V,K9zy27apgI8,0.0,2016-02-08 04:42:57,True,True
2016-02-08T04:44:43,oh.    pg,0,0,INK,K9zy27apgI8,0.0,2016-02-08 04:44:43,True,True
2016-02-08T04:45:36,a movie over a cat...unbelievable,283,16,Darling Mesa,K9zy27apgI8,0.0,2016-02-08 04:45:36,True,True
2016-02-08T04:46:10,They killed their cat! Now the only thing left is revenge!,0,0,LazärheaD,K9zy27apgI8,-0.08333333333333333,2016-02-08 04:46:10,True,True
2016-02-08T04:47:45,this is based off the pet that was killed from the movie John wick.,0,0,ihurricane7,K9zy27apgI8,-0.2,2016-02-08 04:47:45,True,True
2016-02-08T04:48:21,Reeves,0,0,Lucas Rangel,K9zy27apgI8,0.0,2016-02-08 04:48:21,True,True
2016-02-08T04:48:37,genius,0,0,Jonah Morris,K9zy27apgI8,0.0,2016-02-08 04:48:37,True,True
2016-02-08T04:51:59,"Keanu, the movie that is basically a super long Key & Peele skit... I'm not complaining!!!",2,0,Matthew K.,K9zy27apgI8,0.09444444444444444,2016-02-08 04:51:59,True,True
2016-02-08T04:52:32,"""This my shit right here... FREEDOMMMMMM""",1,0,Matthew K.,K9zy27apgI8,0.042857142857142844,2016-02-08 04:52:32,True,True
2016-02-08T04:53:15,This kinda sounds like John Wick,314,12,Damien Khan,K9zy27apgI8,0.0,2016-02-08 04:53:15,True,True
2016-02-08T04:55:04,if Keanu dies I'll never support. Key and Peele,20,0,Cyrus565,K9zy27apgI8,0.0,2016-02-08 04:55:04,True,True
2016-02-08T04:55:48,It's like they turned the show into a movie!! 😝😄,1,0,Matthew Mendez,K9zy27apgI8,0.0,2016-02-08 04:55:48,True,True
2016-02-08T05:06:54,good,0,0,Cauezin do 085,K9zy27apgI8,0.7,2016-02-08 05:06:54,True,True
2016-02-08T05:11:37,Lol,0,0,Carlos Guevara,K9zy27apgI8,0.8,2016-02-08 05:11:37,True,True
2016-02-08T05:14:29,Lmfao this is quality,8,0,Valkyrie 887,K9zy27apgI8,0.0,2016-02-08 05:14:29,True,True
2016-02-08T05:16:09,That was bound to happen sooner or later,0,0,Awake At Night,K9zy27apgI8,0.0,2016-02-08 05:16:09,True,True
2016-02-08T05:17:49,This is it. This is what my life was meant for. My destiny is to watch this.,6,0,Rachel Xue,K9zy27apgI8,0.0,2016-02-08 05:17:49,True,True
2016-02-08T05:20:33,"Keanu dies, everyone... :'(",0,0,Betto Meira,K9zy27apgI8,-1.0,2016-02-08 05:20:33,True,True
2016-02-08T05:22:25,danny brown,0,0,Asa Perez,K9zy27apgI8,0.0,2016-02-08 05:22:25,True,True
2016-02-08T05:33:42,👀👀,0,0,Luiiza Liima,K9zy27apgI8,0.0,2016-02-08 05:33:42,True,True
2016-02-08T05:51:55,If I lost my cat to these guys I would've just gotten another pet... a better pet... a dog,0,0,Ash,K9zy27apgI8,0.5,2016-02-08 05:51:55,True,True
2016-02-08T05:54:14,many cat movies this year,0,0,Bao Pico,K9zy27apgI8,0.5,2016-02-08 05:54:14,True,True
2016-02-08T06:16:00,Sharktank bruh lmaoo,0,0,Thugga,K9zy27apgI8,0.0,2016-02-08 06:16:00,True,True
2016-02-08T06:30:49,look dope x),0,0,TheDoXiZ,K9zy27apgI8,0.0,2016-02-08 06:30:49,True,True
2016-02-08T06:33:29,The screen time for Keanu the cat: max of 15 mins,17,0,Allen John,K9zy27apgI8,0.0,2016-02-08 06:33:29,True,True
2016-02-08T06:44:52,its just a kitten lol,0,0,Preston Rhodes,K9zy27apgI8,0.8,2016-02-08 06:44:52,True,True
2016-02-08T06:49:32,"hahahahahahah, fucking hilarious!!",0,0,jamarajonas,K9zy27apgI8,0.78125,2016-02-08 06:49:32,True,True
2016-02-08T06:51:09,Ending; Keanu Reeves wakes up.,129,0,A Cat,K9zy27apgI8,0.0,2016-02-08 06:51:09,True,True
2016-02-08T06:54:59,THANK YOU FOR MAKEING A KEY AND PEELE MOVIE,0,0,Junk foodwizard,K9zy27apgI8,0.0,2016-02-08 06:54:59,True,True
2016-02-08T07:13:57,This movie is everything like their skits something weird to something crazy something out of control so that you can't handle some wild dumb shit that will make perfect sense in the end or just be nonsense just like Hollywood😅😆😂,0,0,FatmanDD1,K9zy27apgI8,-0.09583333333333333,2016-02-08 07:13:57,True,True
2016-02-08T07:28:37,Keanu = Illuminati,0,0,Igor Borges,K9zy27apgI8,0.0,2016-02-08 07:28:37,True,True
2016-02-08T07:29:10,can't wait for this movie,0,0,Waffle_AR15,K9zy27apgI8,0.0,2016-02-08 07:29:10,True,True
2016-02-08T07:47:03,Ахуенный!!!!!!!!))),0,0,OCTAVETM,K9zy27apgI8,0.0,2016-02-08 07:47:03,True,True
2016-02-08T07:47:17,action bro flick...NICE!,0,0,Les Ed,K9zy27apgI8,0.125,2016-02-08 07:47:17,True,True
2016-02-08T08:09:28,"They thought what's better than selling a cat, to make a movie on a cat 😂😂😂",0,0,Skills,K9zy27apgI8,0.5,2016-02-08 08:09:28,True,True
2016-02-08T08:21:15,There use to be a bong on the table in last trailer but it aight here in this one. Anyone notice?,0,0,kin.1997,K9zy27apgI8,0.0,2016-02-08 08:21:15,True,True
2016-02-08T08:28:26,A movie about a cute ass cat? I'm in.,470,9,Thulsa Doom,K9zy27apgI8,0.5,2016-02-08 08:28:26,True,True
2016-02-08T08:50:07,I have waited so long for this. yus yusss,0,0,Maida Lemu,K9zy27apgI8,-0.05,2016-02-08 08:50:07,True,True
2016-02-08T09:21:55,Fucking beautiful,0,0,Joel Durrington,K9zy27apgI8,0.85,2016-02-08 09:21:55,True,True
2016-02-08T09:37:29,Luv it 🐈🐈🐈🐈🐈,0,0,Ann Sparks,K9zy27apgI8,0.0,2016-02-08 09:37:29,True,True
2016-02-08T10:31:17,im going to name my kid keanu,44,11,Ill Sketch IlI,K9zy27apgI8,0.0,2016-02-08 10:31:17,True,True
2016-02-08T11:30:30,Appendix !! They take it out of you body :o Hahaha KEANU ♥,0,0,Elle McFierceson,K9zy27apgI8,0.4166666666666667,2016-02-08 11:30:30,True,True
2016-02-08T11:36:01,Hmmm rocketjump ....,0,0,Salty Speghetti,K9zy27apgI8,0.0,2016-02-08 11:36:01,True,True
2016-02-08T11:40:40,"Comes out on my birthday, AWESOME!!!! 😍😍",11,9,Ainsley Carter,K9zy27apgI8,1.0,2016-02-08 11:40:40,True,True
2016-02-08T12:18:03,uhhhhh love these guys but NO,0,0,Hooper,K9zy27apgI8,0.5,2016-02-08 12:18:03,True,True
2016-02-08T12:46:15,Gonna be a very interesting movie 😂,0,0,raijin,K9zy27apgI8,0.65,2016-02-08 12:46:15,True,True
2016-02-08T13:00:43,#CATLIVESMATTER,275,2,Vladimir Putin,K9zy27apgI8,0.0,2016-02-08 13:00:43,True,True
2016-02-08T13:53:30,Five nights at Freddy's,0,0,Rosman,K9zy27apgI8,0.0,2016-02-08 13:53:30,True,True
2016-02-08T14:41:27,this movie is going to be amazing lol,0,0,Coushatta Person,K9zy27apgI8,0.7000000000000001,2016-02-08 14:41:27,True,True
2016-02-08T15:06:53,Lmfao only they can make a movie about a cat and it be awesome I'll watch it. I loved them both since mad tv.,0,0,Marlene Alsina,K9zy27apgI8,0.26875,2016-02-08 15:06:53,True,True
2016-02-08T15:37:46,I don't care if the movie sucks I'm still gonna watch it. they need everyone in it though. this feels like it could have Seth Rogan in it or some shit,0,0,ZenBOODA,K9zy27apgI8,-0.25,2016-02-08 15:37:46,True,True
2016-02-08T15:56:56,wtf,0,0,MrProspec,K9zy27apgI8,-0.5,2016-02-08 15:56:56,True,True
2016-02-08T16:02:03,kitty kat,0,1,Deadpool,K9zy27apgI8,0.0,2016-02-08 16:02:03,True,True
2016-02-08T16:03:10,I hope it'll be on the cinemas in my country :(,0,0,Elif tekin,K9zy27apgI8,-0.75,2016-02-08 16:03:10,True,True
2016-02-08T16:39:33,lol they've worked hard I give them props.Definitely watching this shit...high too.,0,0,Sean Ra,K9zy27apgI8,0.25416666666666665,2016-02-08 16:39:33,True,True
2016-02-08T17:13:06,doing the most for pussy,0,0,HighUp !,K9zy27apgI8,0.5,2016-02-08 17:13:06,True,True
2016-02-08T17:31:31,Straight to selected theaters,0,0,Pikachu #FuckingTheseWhiteGirls #BOOTYBUTTCHEEKS,K9zy27apgI8,0.2,2016-02-08 17:31:31,True,True
2016-02-08T17:58:29,"Key and Peele just spoofed John Wick LMAO, ....where do I get tickets :-)",3,0,boxertest,K9zy27apgI8,0.3666666666666667,2016-02-08 17:58:29,True,True
2016-02-08T18:17:11,eazy e is also in the movie hahahah,0,0,Thijs Pagie,K9zy27apgI8,0.0,2016-02-08 18:17:11,True,True
2016-02-08T18:54:54,Who came with this ideas for movies?,0,0,Roach DoggJR,K9zy27apgI8,0.0,2016-02-08 18:54:54,True,True
2016-02-08T19:01:08,did anyone else notice jason michel from straight outta compton tha guy that played eazy,0,0,BC Goat,K9zy27apgI8,0.2,2016-02-08 19:01:08,True,True
2016-02-08T20:14:52,"I know what the Warner Bros did. Thy are using the same formula people use in You Tube. Add a cat, and people will buy it.",0,0,Roach DoggJR,K9zy27apgI8,0.0,2016-02-08 20:14:52,True,True
2016-02-08T21:03:36,aka key and peele: the movie,0,0,SpookLuc,K9zy27apgI8,0.0,2016-02-08 21:03:36,True,True
2016-02-08T21:16:15,Ok ya I like it,0,0,G-String,K9zy27apgI8,0.5,2016-02-08 21:16:15,True,True
2016-02-08T21:31:22,Fuck this Stupidass movie,0,0,Evil Pain,K9zy27apgI8,-0.4,2016-02-08 21:31:22,True,True
2016-02-08T22:08:31,"Friend sent me this in a link and I honestly thought it was a joke trailer till the end when it showed the date of release and everything, hahahah I can't wait",43,2,Callymash,K9zy27apgI8,0.6,2016-02-08 22:08:31,True,True
2016-02-09T00:31:02,1:14 M-E-T-H-O-D Man,0,0,Baron Ungern,K9zy27apgI8,0.0,2016-02-09 00:31:02,True,True
2016-02-09T03:15:39,"key & peele the type of dudes to base a movie on a cat, literally lol!",0,0,Alana Kathereenxo,K9zy27apgI8,0.06666666666666665,2016-02-09 03:15:39,True,True
2016-02-09T03:58:04,Am I the only one who noticed the old Rock-A-Fire Explosion animatronics at 2:05?,0,0,Bella C,K9zy27apgI8,0.05,2016-02-09 03:58:04,True,True
2016-02-09T05:00:13,Yes and more yes,0,0,Macealynn,K9zy27apgI8,0.5,2016-02-09 05:00:13,True,True
2016-02-09T05:17:57,hey dat my name,0,0,Keyahnoo,K9zy27apgI8,0.0,2016-02-09 05:17:57,True,True
2016-02-09T05:23:12,You're damn straight I'm gonna see this shit.,0,0,9 Starr,K9zy27apgI8,0.0,2016-02-09 05:23:12,True,True
2016-02-09T05:24:12,iiiim Tec-Tonic.,0,0,9 Starr,K9zy27apgI8,0.0,2016-02-09 05:24:12,True,True
2016-02-09T05:58:48,give the guys nerf guns and take out the swearing and this would be a Pg movie,0,0,Vegan._.turtle,K9zy27apgI8,0.0,2016-02-09 05:58:48,True,True
2016-02-09T06:02:12,John Wick?,0,0,Foolish Pupil,K9zy27apgI8,0.0,2016-02-09 06:02:12,True,True
2016-02-09T06:26:16,I am in love with the movie already!!The kitty is by the best actor!!,1,0,Frankie H.,K9zy27apgI8,0.75,2016-02-09 06:26:16,True,True
2016-02-09T08:30:18,"That Danny Brown poster at 0:10 got me thinking..is the actor for Keanu Siren, Danny's kitten??",0,0,Michael Arredondo,K9zy27apgI8,0.0,2016-02-09 08:30:18,True,True
2016-02-09T10:04:56,Is this real? I mean they are funny but is this really real? like going to be in theaters real..,5,3,B Martin,K9zy27apgI8,0.045312500000000006,2016-02-09 10:04:56,True,True
2016-02-09T12:14:16,It's gonna be rated r huh,0,0,Darkchaosx70 Leader of dark clan,K9zy27apgI8,0.0,2016-02-09 12:14:16,True,True
2016-02-09T13:07:06,This shit is going to be awesome!,0,0,Marc encore,K9zy27apgI8,0.4,2016-02-09 13:07:06,True,True
2016-02-09T13:19:32,Sold! I'm in!,0,0,Ice48,K9zy27apgI8,0.0,2016-02-09 13:19:32,True,True
2016-02-09T14:12:54,keanu reminds me of my kitten,0,0,No u,K9zy27apgI8,0.0,2016-02-09 14:12:54,True,True
2016-02-09T14:15:27,I'm really hoping this movie doesn't feel like a Key & Peele sketch that goes on for too long.,0,0,Christian Cline,K9zy27apgI8,0.05000000000000001,2016-02-09 14:15:27,True,True
2016-02-09T15:08:06,I wanna seee it for the cat as well XD,0,0,prettyboy Ian,K9zy27apgI8,0.0,2016-02-09 15:08:06,True,True
2016-02-09T15:45:24,Is this real? Is this a real thing or are they just fucking with us? Please be real,0,0,PurifiedMadness,K9zy27apgI8,1.3877787807814457e-17,2016-02-09 15:45:24,True,True
2016-02-09T15:49:58,whats the beat called starting at 0:40 ?,0,0,Sani,K9zy27apgI8,0.0,2016-02-09 15:49:58,True,True
2016-02-09T15:50:37,and its more clear at 1:10,0,0,Sani,K9zy27apgI8,0.3,2016-02-09 15:50:37,True,True
2016-02-09T16:28:44,Danny Brown Poster in the Back at :10,2,0,likenem,K9zy27apgI8,0.0,2016-02-09 16:28:44,True,True
2016-02-09T16:56:58,Dang just watched the whole movie,0,0,jaafar kassim,K9zy27apgI8,0.2,2016-02-09 16:56:58,True,True
2016-02-09T17:25:01,Why do I get the impression Michael Bay had something to do with this?,0,0,Unit X6-88,K9zy27apgI8,0.0,2016-02-09 17:25:01,True,True
2016-02-09T17:28:43,"Is that cat going to start talking halfway through the movie to say something like... ""I know Cat-Fu""? Cause that's the kind of vibe I'm getting from this.",88,7,FrozenFoxy,K9zy27apgI8,0.6,2016-02-09 17:28:43,True,True
2016-02-09T18:10:30,YESSSSSSSSSS I love!!! C:,0,0,Safa Faridi,K9zy27apgI8,0.9765625,2016-02-09 18:10:30,True,True
2016-02-09T18:26:08,I watch   this  trailer  zellion  times   lol,0,0,Kenza,K9zy27apgI8,0.8,2016-02-09 18:26:08,True,True
2016-02-09T18:46:18,This is real,0,0,Alex Denny,K9zy27apgI8,0.2,2016-02-09 18:46:18,True,True
2016-02-09T18:49:38,aw the cat looked so cute as a gangster!,0,0,Totally _Galaxy,K9zy27apgI8,0.625,2016-02-09 18:49:38,True,True
2016-02-09T20:31:41,So excited I'm crying. And also I tend to cry when I see kittens. I see no problem here.,0,0,Marisa Loves Disney,K9zy27apgI8,0.0875,2016-02-09 20:31:41,True,True
2016-02-09T21:34:55,You could just call this movie  Taken:4,0,0,Hoodie: A1,K9zy27apgI8,0.0,2016-02-09 21:34:55,True,True
2016-02-10T00:08:51,"NOISE, happy to see these guys in a movie together",0,0,Jaden Murphy,K9zy27apgI8,0.8,2016-02-10 00:08:51,True,True
2016-02-10T02:18:38,I will now accurately predict this movie:  1/4 cute kitten and cute kitten accessories   1/8 Jordan tries to outdo Keegan at something and Keegan gets mad  1/8 extreme plot-twistingly weird shit  1/2 truly funny jokes  I will still absolutely see it.,0,0,Rachael Brinegar,K9zy27apgI8,0.030000000000000006,2016-02-10 02:18:38,True,True
2016-02-10T05:33:42,Martin Luther King and Gaaaaaaaaaannnnnnnnnndddddddhhhhhiiiii,0,0,Junior Patton,K9zy27apgI8,0.0,2016-02-10 05:33:42,True,True
2016-02-10T09:21:23,All of that just for a kitty cat LOL,0,0,Ike Reedy,K9zy27apgI8,0.8,2016-02-10 09:21:23,True,True
2016-02-10T10:39:49,The start of the trailer annoyed me when the cup fell and then in the next shot it is still on the table...but after I watched the rest of it I don't even care any more. I'm in!,0,0,Jai N-L,K9zy27apgI8,0.075,2016-02-10 10:39:49,True,True
2016-02-10T13:10:48,i feel bad for all these dumb ass children that have to grow up w this corny watered down trash. key and peele are lame and corny af,1,0,Robby1424 ok,K9zy27apgI8,-0.3461111111111111,2016-02-10 13:10:48,True,True
2016-02-10T15:37:04,"I rushed as soon as i could. More,  like 25 movies.",0,0,The Rickest Rick,K9zy27apgI8,0.5,2016-02-10 15:37:04,True,True
2016-02-10T17:59:12,key and peele movie. gotta get high to this thing... nooice nooice nooice,0,0,Prathyush Putuparambil,K9zy27apgI8,0.08,2016-02-10 17:59:12,True,True
2016-02-10T19:54:42,there screwed,0,0,carmen montes,K9zy27apgI8,0.0,2016-02-10 19:54:42,True,True
2016-02-10T22:32:00,"F*** whatever it is I was going to watch before this commercial, I want to watch this right here!",1,0,Vicki T,K9zy27apgI8,0.17857142857142855,2016-02-10 22:32:00,True,True
2016-02-11T04:50:06,"Only you guys could make an awesome movie out of such a stupid premise, can't wait to watch it.",0,0,Here and Genderqueer.,K9zy27apgI8,0.05000000000000002,2016-02-11 04:50:06,True,True
2016-02-11T08:23:38,well that escalated quickly,0,0,Soapy Foten,K9zy27apgI8,0.3333333333333333,2016-02-11 08:23:38,True,True
2016-02-11T10:19:36,it's gone be a fun birthday,1,0,Prince Vegeta,K9zy27apgI8,0.3,2016-02-11 10:19:36,True,True
2016-02-11T13:47:12,👍,0,0,May Sivokhin,K9zy27apgI8,0.0,2016-02-11 13:47:12,True,True
2016-02-11T14:17:07,Ghandi and MartinLKJ,1,0,Zghal Mohammed Amine,K9zy27apgI8,0.0,2016-02-11 14:17:07,True,True
2016-02-11T16:10:27,hey someone already leaked the BvS Final Trailer!!! you should upload it fast!,0,0,AntonDaDon,K9zy27apgI8,0.125,2016-02-11 16:10:27,True,True
2016-02-11T16:31:08,Underrated,0,0,Kitkiat,K9zy27apgI8,0.0,2016-02-11 16:31:08,True,True
2016-02-11T17:02:50,My cat is cuter. :T,0,0,L7vanmatre,K9zy27apgI8,0.0,2016-02-11 17:02:50,True,True
2016-02-11T17:08:01,The greatest CAT movie ever!!!,0,0,PongZ,K9zy27apgI8,1.0,2016-02-11 17:08:01,True,True
2016-02-11T17:52:33,Action....Cats....Hate....Warr....Cats...Awesome :O,0,0,AX AXIS Gaming,K9zy27apgI8,0.05,2016-02-11 17:52:33,True,True
2016-02-11T17:53:07,wait... this is a real movie?? I thought that was just like a skit they did once!!!! THAT'S AWESOME!!!!,0,0,Paul Perrizo,K9zy27apgI8,0.744140625,2016-02-11 17:53:07,True,True
2016-02-11T19:32:56,"lol thought this wasn't for real when i saw this a while back, but i guesse it is.",0,0,CallistoO,K9zy27apgI8,0.3333333333333333,2016-02-11 19:32:56,True,True
2016-02-11T20:04:43,lmfao I would watch dis,0,0,Kaori Cuban,K9zy27apgI8,0.0,2016-02-11 20:04:43,True,True
2016-02-11T20:55:26,"I thought this would be dumb, but I'm surprised. It looks hilarious AND it's an original idea, as most movies nowadays are sequels, remakes, or book-to-movie adaptations. I'll be looking forward to this.",0,0,TheNOPEland,K9zy27apgI8,0.22000000000000003,2016-02-11 20:55:26,True,True
2016-02-11T21:10:07,hiliarous,0,0,only257,K9zy27apgI8,0.0,2016-02-11 21:10:07,True,True
2016-02-11T21:33:43,are they seriouse is this seriouse like whyy??,0,0,Donica,K9zy27apgI8,0.0,2016-02-11 21:33:43,True,True
2016-02-11T23:26:06,This looks great.,0,0,Rhett Having a Vietnam Flashback,K9zy27apgI8,0.8,2016-02-11 23:26:06,True,True
2016-02-12T00:18:32,"I never usually like comedy movies (I love COMEDY, but most mainstream comedy films aren't my sense of humor), but Key and Peele in an overdramatic rescue mission about saving an adorable kitten named Keanu?! I am SO READY!",20,0,Wawagirl17,K9zy27apgI8,0.3333333333333333,2016-02-12 00:18:32,True,True
2016-02-12T03:01:42,a reference of john wick. John wick=Keanu Reeves,1,0,Farid Muzaffar,K9zy27apgI8,0.0,2016-02-12 03:01:42,True,True
2016-02-12T03:47:14,It would be fuckin priceless if Keanu Reaves appear as John Wick in this movie LOL,0,0,RookieN08,K9zy27apgI8,0.9,2016-02-12 03:47:14,True,True
2016-02-12T05:51:15,I honestly thought this was a movie about Keaun Reeves,101,1,aergdr,K9zy27apgI8,0.6,2016-02-12 05:51:15,True,True
2016-02-12T07:28:59,go key and peele!,0,0,iRapplexD,K9zy27apgI8,0.0,2016-02-12 07:28:59,True,True
2016-02-12T08:09:11,I like key&peele. .. this shit seems wack as fuck. ,0,0,Raf the thinker,K9zy27apgI8,-0.30000000000000004,2016-02-12 08:09:11,True,True
2016-02-13T00:23:57,got to see this movie looks good can't wait,0,0,Timothy M. Mbewe,K9zy27apgI8,0.7,2016-02-13 00:23:57,True,True
2016-02-13T02:04:24,Looks HILARIOUS,0,0,Andrew Gossett,K9zy27apgI8,0.5,2016-02-13 02:04:24,True,True
2016-02-13T06:40:52,Is this  a real movie?,1,5,Stephanie Garcia,K9zy27apgI8,0.2,2016-02-13 06:40:52,True,True
2016-02-13T12:50:54,This movie is either going to be the funniest of the year or stupidest... But I'm so seeing it.,46,4,Andrew John Bennett,K9zy27apgI8,0.0,2016-02-13 12:50:54,True,True
2016-02-13T13:57:54,"Staff, has a site called gokano you accumulate points and can get prizes such as an iPhone 6 , those interested have that link an adm which has 2k and give to get the iPhone , the link is http://gokano.com/ref/LzZIwqqrY97x",0,0,marcos costa,K9zy27apgI8,0.125,2016-02-13 13:57:54,True,True
2016-02-13T14:35:13,Little catzennn! I'm soo watching this.,0,0,HeathLedgerina,K9zy27apgI8,-0.234375,2016-02-13 14:35:13,True,True
2016-02-13T14:38:35,anybody notice the danny brown poster at 0:10 ?,0,0,gtofan4536kyric,K9zy27apgI8,0.0,2016-02-13 14:38:35,True,True
2016-02-13T18:37:53,this is literally John Wick with a cat.,3,0,TheeMindofBlocks,K9zy27apgI8,0.0,2016-02-13 18:37:53,True,True
2016-02-13T18:58:54,1:14 AHAHAHA,1,0,jarjarlove22,K9zy27apgI8,0.0,2016-02-13 18:58:54,True,True
2016-02-13T21:54:27,Love the strip club sign. HPV baby.,0,0,7474jd,K9zy27apgI8,0.5,2016-02-13 21:54:27,True,True
2016-02-13T21:58:35,I'm there!,0,0,J.,K9zy27apgI8,0.0,2016-02-13 21:58:35,True,True
2016-02-13T23:15:57,"Key and Peele, this is the kind of movie you come up with?  A ""I lost my pet"" kind of movie?  Really?",1,2,Nate Lintz,K9zy27apgI8,0.35,2016-02-13 23:15:57,True,True
2016-02-14T00:06:03,This looks friggen hilarious,0,0,Meskarune,K9zy27apgI8,0.5,2016-02-14 00:06:03,True,True
2016-02-14T00:52:52,I don't know how they made me laugh at this but I might have to see it.,0,0,MrGrownman455,K9zy27apgI8,0.3,2016-02-14 00:52:52,True,True
2016-02-14T05:35:09,about dam time for a key and peel movie:),0,0,shawn force,K9zy27apgI8,0.25,2016-02-14 05:35:09,True,True
2016-02-14T12:15:39,"If this really is a reference to John Wick, then does this mean the cat is going to die at some point in the movie?",1,0,Paul Lee,K9zy27apgI8,-0.056249999999999994,2016-02-14 12:15:39,True,True
2016-02-15T09:55:24,lmfao,0,0,Jesse the Lawless,K9zy27apgI8,0.0,2016-02-15 09:55:24,True,True
2016-02-15T12:38:08,"For some odd reason, I feel like the the cute cat is gonna die.  Hope that is not gonna happen.",0,0,Mahmoud Qabazard,K9zy27apgI8,0.16666666666666669,2016-02-15 12:38:08,True,True
2016-02-15T22:16:33,"At the end of the red band trailer, he says ""this my jam"" and in the general trailer, he says ""this my shit"". Are we being trolled?",0,0,Wutwut1n1,K9zy27apgI8,-0.049999999999999996,2016-02-15 22:16:33,True,True
2016-02-16T23:12:36,Hi,0,0,PLNetworkCA,K9zy27apgI8,0.0,2016-02-16 23:12:36,True,True
2016-02-17T11:39:41,ill wait for this to come on tbs,0,0,Mitzel plik,K9zy27apgI8,-0.5,2016-02-17 11:39:41,True,True
2016-02-17T17:12:14,marvel has dead pools gay ass......Ryan Renolds.......so DC needs to make a Death Stroke movie serious and cut throat....played by ..Gerard Butler...from 300.....plz make it.....plz DC make a comeback......Deadpool is gay....and i hated it....ill never watch it again.,0,2,King David Sama,K9zy27apgI8,-0.25416666666666665,2016-02-17 17:12:14,True,True
2016-02-19T02:53:04,Hilarious!,0,0,THEBOXINGSAMURAI KTP,K9zy27apgI8,0.625,2016-02-19 02:53:04,True,True
2016-02-19T10:29:34,Bitch don't sell my tickets I'm watching this shit XD,0,0,E,K9zy27apgI8,-0.2,2016-02-19 10:29:34,True,True
2016-02-19T19:40:44,From the visionary minds of Keanu & Reeves,0,0,OfficialDjSyko,K9zy27apgI8,0.0,2016-02-19 19:40:44,True,True
2016-02-20T04:32:26,i laugh hard when he shows the cat.,0,0,Ja Ja,K9zy27apgI8,0.004166666666666652,2016-02-20 04:32:26,True,True
