timestamp,text,like_count,reply_count,author,trailer_id,sentiment_score,datetime,used_for_model,used_for_visualization
2018-03-08T17:12:22,let me be the first to say. darn this movie to heck!,3,0,Noah Nogueras,ogpTTHLprFs,0.3125,2018-03-08 17:12:22,True,True
2018-03-08T17:20:33,I need to see this😝😝,41,22,P. V.,ogpTTHLprFs,0.0,2018-03-08 17:20:33,True,True
2018-03-08T18:26:30,will they ever stop making these animals that talk movies lol,306,22,Camalex98,ogpTTHLprFs,0.8,2018-03-08 18:26:30,True,True
2018-03-08T18:45:16,I thought it said Snow Dogs.,16,2,Gape Newell,ogpTTHLprFs,0.0,2018-03-08 18:45:16,True,True
2018-03-08T19:31:46,looks like cats and dogs but without sci fi gadgets or evil cats. (And why does the dog from 1:07 dab?),135,8,Homie Mantis,ogpTTHLprFs,-1.0,2018-03-08 19:31:46,True,True
2018-03-08T20:26:31,and the most idiotic movie award goes to...,223,17,gabi *,ogpTTHLprFs,-0.08333333333333331,2018-03-08 20:26:31,True,True
2018-03-08T22:19:42,"is it just hot i here, or is it you? XD",0,2,Snowshower's Show,ogpTTHLprFs,0.25,2018-03-08 22:19:42,True,True
2018-03-08T22:20:07,Such a pretty rottie,4,0,Kris Robertson,ogpTTHLprFs,0.125,2018-03-08 22:20:07,True,True
2018-03-08T22:28:50,This looks basically like Poochinski but worse.,4,0,Niko,ogpTTHLprFs,-0.4,2018-03-08 22:28:50,True,True
2018-03-08T22:34:52,I want to see this SOO BAD!!,0,1,Shiba Boss,ogpTTHLprFs,-1.0,2018-03-08 22:34:52,True,True
2018-03-09T00:08:30,song at 0:34???,0,3,Robert's Gaming,ogpTTHLprFs,0.0,2018-03-09 00:08:30,True,True
2018-03-09T02:27:48,they needa stop with these mf talking dog movies,11,1,Karenbc,ogpTTHLprFs,0.0,2018-03-09 02:27:48,True,True
2018-03-09T03:15:45,Hell yes Props to The Rottweiler I have one and they are amazing !!!,12,1,Chemtrails and Ufo,ogpTTHLprFs,1.0,2018-03-09 03:15:45,True,True
2018-03-09T03:41:17,Papatemado  este vídeo te quiero mucho,0,0,Fernanda Rodriguez,ogpTTHLprFs,0.0,2018-03-09 03:41:17,True,True
2018-03-09T04:49:10,Soooooo it's Miss Congeniality but with dogs?,0,0,A Random Star Trek Nerd,ogpTTHLprFs,0.0,2018-03-09 04:49:10,True,True
2018-03-09T04:52:31,Talking animal movies are so 2008 😬,139,21,Jaden H,ogpTTHLprFs,0.0,2018-03-09 04:52:31,True,True
2018-03-09T04:57:29,Omar Chaparro aparece en la película... Un motivo más para no ver está mierda de película,0,0,Alexander Alup Chalup,ogpTTHLprFs,0.0,2018-03-09 04:57:29,True,True
2018-03-09T05:18:21,1:13 me when I see someone with a cross bow in fortnight,39,10,SirNexothe13th,ogpTTHLprFs,0.0,2018-03-09 05:18:21,True,True
2018-03-09T07:13:58,I love all kind of animals and little ones too like baby kittens,4,0,Amber Thomason,ogpTTHLprFs,0.3041666666666667,2018-03-09 07:13:58,True,True
2018-03-09T08:18:20,n.n.o.. WE SURVIVED THESE MOVIES. WE SURVIVED THESE MOVIES!!!!,97,8,thegamer9302,ogpTTHLprFs,0.0,2018-03-09 08:18:20,True,True
2018-03-09T12:30:32,This looks so stupid,8,0,thomas bregoli,ogpTTHLprFs,-0.7999999999999999,2018-03-09 12:30:32,True,True
2018-03-09T12:38:52,Lol,0,0,Addie-Marie Thompson,ogpTTHLprFs,0.8,2018-03-09 12:38:52,True,True
2018-03-09T13:19:42,This looks so stupid,1,0,Poppysaurus Rex,ogpTTHLprFs,-0.7999999999999999,2018-03-09 13:19:42,True,True
2018-03-09T13:50:16,everyone who worked professionally on this movie needs to simply kill themselves.,14,21,dings215,ogpTTHLprFs,0.05,2018-03-09 13:50:16,True,True
2018-03-09T14:34:47,When it's May I'm watching this I look so good like this now we cooking with gas it said,3,0,Allison Brannon,ogpTTHLprFs,0.7,2018-03-09 14:34:47,True,True
2018-03-09T14:41:41,"This movie looks terrible. Take a page out of a Dogs Purpose... don’t have the animals talk, just narrate their voices.",7,1,Joshua Tyndall,ogpTTHLprFs,-1.0,2018-03-09 14:41:41,True,True
2018-03-09T14:43:09,This is like a sterotypical satire trailer,7,1,Dave Tyler,ogpTTHLprFs,0.0,2018-03-09 14:43:09,True,True
2018-03-09T16:55:41,Вообще улёт )))!!!!!!! Люблю фильмы с собаками очень !! Шикарный трейлер!!! И там ещё мой Венюша Мопсёнок!!!!👍👍👍👍👍👍👍👍👍👍👍👍👍👍,0,0,Маргарита Макарова,ogpTTHLprFs,0.0,2018-03-09 16:55:41,True,True
2018-03-09T18:23:19,Y.....por donde salio omar.....limpiando mesas o barriendo....?,0,0,Rafael Vallesito,ogpTTHLprFs,0.0,2018-03-09 18:23:19,True,True
2018-03-09T20:31:42,FUUNNNYYYYYYYYY,0,0,jake,ogpTTHLprFs,0.0,2018-03-09 20:31:42,True,True
2018-03-09T20:57:57,I need to see this very bad.,0,1,Gaby Foox,ogpTTHLprFs,-0.9099999999999998,2018-03-09 20:57:57,True,True
2018-03-09T20:58:53,"Me: Who the hell would make this!? Narrator: ""From the director of Beverly Hills Chihuwawa, The Smurfs, and Scooby-Doo..."" Me: Right, okay. *loads gun.*",779,33,VTAnimation,ogpTTHLprFs,0.39285714285714285,2018-03-09 20:58:53,True,True
2018-03-09T22:46:03,*The early 2000's called...*,762,17,brackonstudios,ogpTTHLprFs,0.1,2018-03-09 22:46:03,True,True
2018-03-09T23:12:45,Cool i love dogs 🐶,2,0,Beignet wolf :3,ogpTTHLprFs,0.425,2018-03-09 23:12:45,True,True
2018-03-09T23:17:42,Ja ja ajavja sus sbsusdbfofxmbg,0,0,Manola Perez,ogpTTHLprFs,0.0,2018-03-09 23:17:42,True,True
2018-03-09T23:22:44,Dabing dogs are life.............🐕🐩,0,0,debbie Bauermeister,ogpTTHLprFs,0.0,2018-03-09 23:22:44,True,True
2018-03-09T23:54:55,What in the actual fuck am I seeing right now!?!?,6,0,Sir BuffDrinksalot,ogpTTHLprFs,0.015476190476190458,2018-03-09 23:54:55,True,True
2018-03-10T00:02:23,THE VAMPS,6,0,I N,ogpTTHLprFs,0.0,2018-03-10 00:02:23,True,True
2018-03-10T00:23:19,What’s the opening song?,0,1,Black Necko,ogpTTHLprFs,0.0,2018-03-10 00:23:19,True,True
2018-03-10T01:35:47,The creators of Scooby-Doo made this so like yeah imma watch it,0,1,Username,ogpTTHLprFs,0.0,2018-03-10 01:35:47,True,True
2018-03-10T02:05:16,Rottweiler  forever  The Real  all round dog,6,0,miami flow,ogpTTHLprFs,0.0,2018-03-10 02:05:16,True,True
2018-03-10T02:30:58,?everyone one seems to hate talking animal movies so much but theyre  like one of my favorite things their adorable and weird and silly and like come on its dogs how can you not love dog movies,29,18,VioletPhantom,ogpTTHLprFs,-0.12142857142857144,2018-03-10 02:30:58,True,True
2018-03-10T03:08:09,heyy the vamps song is in the beginning :)))),9,0,marisa bws,ogpTTHLprFs,0.5,2018-03-10 03:08:09,True,True
2018-03-10T03:51:58,1:07 //can you not//,235,15,purplebug,ogpTTHLprFs,0.0,2018-03-10 03:51:58,True,True
2018-03-10T04:22:22,1:07 did that dog really just dab?,1,4,Eric Parazak,ogpTTHLprFs,0.2,2018-03-10 04:22:22,True,True
2018-03-10T04:34:07,Wait what?,0,1,Cheese Cheese,ogpTTHLprFs,0.0,2018-03-10 04:34:07,True,True
2018-03-10T06:52:54,I'm happy to see a Rottweiler as a good guy! Even if the effects and everything are silly.,64,11,Ishidalover,ogpTTHLprFs,0.39166666666666666,2018-03-10 06:52:54,True,True
2018-03-10T07:25:33,Stario tipical talking animal movie,5,2,pip pip,ogpTTHLprFs,0.0,2018-03-10 07:25:33,True,True
2018-03-10T17:23:16,"This could've been alright. But it's gone full ""80's/90's zany talking animal 'comedy', complete with trailer voice guy like it's now ok to just throw that shit back in there"".  Will Arnett and Stanley Tucci can't save this. Notice the rest of the cast are a bunch of ""used to be popping"" actors or celebrities. Shaq is always cool.",0,0,ineedmyhat,ogpTTHLprFs,0.18333333333333335,2018-03-10 17:23:16,True,True
2018-03-10T18:41:53,DAT DAB 1:07,8,4,Ava Morgan,ogpTTHLprFs,0.0,2018-03-10 18:41:53,True,True
2018-03-10T20:06:04,This might be the worst thing ever,1,1,kai crenshaw,ogpTTHLprFs,-1.0,2018-03-10 20:06:04,True,True
2018-03-10T20:28:39,this is painful to watch,19,1,Chee se,ogpTTHLprFs,-0.7,2018-03-10 20:28:39,True,True
2018-03-10T21:16:39,XD,0,0,Ghost Xenomorph,ogpTTHLprFs,0.0,2018-03-10 21:16:39,True,True
2018-03-10T22:13:32,"Haha!  This is a good joke, like anyone would be idiotic enough to fall for something by Raja Gosnel after his other bomb movies",4,1,Cheriable,ogpTTHLprFs,0.03166666666666666,2018-03-10 22:13:32,True,True
2018-03-10T23:25:59,Can you change the date that this comes out? I like going to see movies for my birthday I don't even want this as an option,5,0,Blue Parade,ogpTTHLprFs,0.0,2018-03-10 23:25:59,True,True
2018-03-11T00:08:23,1:07 the dog dabs,0,0,Daryel Pruitt,ogpTTHLprFs,0.0,2018-03-11 00:08:23,True,True
2018-03-11T04:10:58,Emeri like you kiss    lu Lucas Lucas,0,0,Pat Jacobs,ogpTTHLprFs,0.0,2018-03-11 04:10:58,True,True
2018-03-11T06:13:00,ugghmy sister had the misfortune of seeing this trailer today in the theaterDouble Toasted called A Wrinkle in Time the worst movie of the year....they need to look at this!,0,0,J,ogpTTHLprFs,-1.0,2018-03-11 06:13:00,True,True
2018-03-11T16:25:33,"I'm not a fan of these types of movies, but uh.. I think you could've done more with the animation. It just looks so unnatural and... Lazy. Don't mean to sound rude but I've seen some good animated talking animals and this this isn't gonna be one of them",59,6,Doukz,ogpTTHLprFs,0.12291666666666667,2018-03-11 16:25:33,True,True
2018-03-11T16:31:07,0:06 isn't that Luke from Gilmore girls?,0,0,ElegantEevee,ogpTTHLprFs,0.0,2018-03-11 16:31:07,True,True
2018-03-11T16:40:08,1:07 Calling all Dab Police! This is not a drill,53,14,EnderPlays Sandbox and more!,ogpTTHLprFs,0.0,2018-03-11 16:40:08,True,True
2018-03-11T18:04:12,I'm so confused on why everyone judges the movie before they even see it. I mean come on it's clearly a movie for kids but seriously never judge a movie by it's trailer.,8,5,Lil Breezy,ogpTTHLprFs,-0.11145833333333335,2018-03-11 18:04:12,True,True
2018-03-11T18:15:14,"Wow, waiting to watch show dogs. 🐕",2,0,Lucia Lima,ogpTTHLprFs,0.1,2018-03-11 18:15:14,True,True
2018-03-11T20:01:02,"LE PREGUNTE A MI PERRO COMO AMANECI HOY Y ME DIJO GUAW,GUAW. JJJJJJAAAJJJAJA. NO TENGO PERRO QUE ME LADRE.. POPIS=CACHORROS.",0,0,Jorge Vergara,ogpTTHLprFs,0.0,2018-03-11 20:01:02,True,True
2018-03-11T20:01:51,Y ME DIJERON QUE NI YO MISMO ME PODIA MANTENER.,0,0,Jorge Vergara,ogpTTHLprFs,0.0,2018-03-11 20:01:51,True,True
2018-03-11T21:58:16,I thought it said snow dogs,0,0,Pigeon Gurl,ogpTTHLprFs,0.0,2018-03-11 21:58:16,True,True
2018-03-11T23:43:46,I have a rottwiler,1,0,Millonario Virtuales,ogpTTHLprFs,0.0,2018-03-11 23:43:46,True,True
2018-03-12T01:09:05,Rotties ❤️❤️,3,0,Nicole Recinos,ogpTTHLprFs,0.0,2018-03-12 01:09:05,True,True
2018-03-12T01:19:32,D A B,0,0,Javier Hinojosa,ogpTTHLprFs,0.0,2018-03-12 01:19:32,True,True
2018-03-12T04:04:33,"I'd only want to watch for the panda, what kind of CGI is this though? It looks like a early 2000's movie. It's near the same level as Cats Vs Dogs from 2001.",0,0,Anthony A,ogpTTHLprFs,0.15999999999999998,2018-03-12 04:04:33,True,True
2018-03-12T13:25:46,Rottweiler!!!,0,0,Khayra The Turtle,ogpTTHLprFs,0.0,2018-03-12 13:25:46,True,True
2018-03-12T13:55:39,God dang raja gosnell,2,0,Sean Harrison,ogpTTHLprFs,0.0,2018-03-12 13:55:39,True,True
2018-03-12T16:57:00,MUST SEE MOVIE NOW then again I haven't even seen star wars the last Jedi I'm stupid,1,0,Emily Kennedy,ogpTTHLprFs,-0.39999999999999997,2018-03-12 16:57:00,True,True
2018-03-12T20:54:54,Let him like hip-hop wtf :/,148,5,Sharja Jihan,ogpTTHLprFs,-0.375,2018-03-12 20:54:54,True,True
2018-03-12T23:26:42,I need to see this 👍👍,0,1,Nova_wolf,ogpTTHLprFs,0.0,2018-03-12 23:26:42,True,True
2018-03-13T12:25:04,1:07 please don't do that. the dab is illegal in all countries,197,17,Cxnidaee,ogpTTHLprFs,-0.5,2018-03-13 12:25:04,True,True
2018-03-13T13:48:48,1:06 did That dog just dab,23,12,HyperFazeHQ,ogpTTHLprFs,0.0,2018-03-13 13:48:48,True,True
2018-03-13T15:05:23,"really? ""What kind of dog likes Hip-Hop?"", that's their opening joke? It doesn't even make sense. 😒😒",9,1,mr. Wldasoldmysoul4pussyasateen,ogpTTHLprFs,0.4,2018-03-13 15:05:23,True,True
2018-03-13T17:09:53,Hope you get sued,0,0,Kyle Skurka,ogpTTHLprFs,0.0,2018-03-13 17:09:53,True,True
2018-03-13T17:10:11,OMG I SAW BEVERLY HILLS CHIHUAHUA,0,0,Starry eyed Strix,ogpTTHLprFs,0.0,2018-03-13 17:10:11,True,True
2018-03-13T18:52:03,Trailer on my channel Subscribe,0,0,Today Movie Trailers 2.0,ogpTTHLprFs,0.0,2018-03-13 18:52:03,True,True
2018-03-13T21:52:43,1:07 did we need this?,137,4,Alexis Walker,ogpTTHLprFs,0.0,2018-03-13 21:52:43,True,True
2018-03-13T23:31:10,Is it just me or does the same narrator guy talk for like every movie trailer ever made? Lol xD,0,0,madison,ogpTTHLprFs,0.4,2018-03-13 23:31:10,True,True
2018-03-14T00:31:51,Great a another Emoji movie.,37,6,Movie Connoisseur,ogpTTHLprFs,0.8,2018-03-14 00:31:51,True,True
2018-03-14T02:46:13,I wanna see that movie when it comes out.,3,0,Catherine Cantine,ogpTTHLprFs,0.0,2018-03-14 02:46:13,True,True
2018-03-14T10:21:53,0:41 what's the song in the background? shazam can't seem to figure it out.,0,0,katzyhamiltoe,ogpTTHLprFs,0.0,2018-03-14 10:21:53,True,True
2018-03-14T20:13:45,Did that dog just freaking dab,0,0,Kenzington,ogpTTHLprFs,0.0,2018-03-14 20:13:45,True,True
2018-03-16T15:38:17,"""Bought to you by the people who have complete and utter contempt for Humanity.""",12,0,Moopheus,ogpTTHLprFs,0.05,2018-03-16 15:38:17,True,True
2018-03-18T14:11:39,Well this is gonna suck,303,17,Harrison Ring,ogpTTHLprFs,0.0,2018-03-18 14:11:39,True,True
2018-03-19T17:25:20,interested,2,0,L3murL0rd,ogpTTHLprFs,0.25,2018-03-19 17:25:20,True,True
2018-03-20T07:40:43,Show me the way out of this timeline,16,0,Cat TheKitten,ogpTTHLprFs,0.0,2018-03-20 07:40:43,True,True
2018-03-20T10:37:50,https://youtu.be/63hUXEswg_w,0,0,dial coyote,ogpTTHLprFs,0.0,2018-03-20 10:37:50,True,True
2018-03-20T13:53:59,Momma Ru!!!!,0,0,Donna Strickland,ogpTTHLprFs,0.0,2018-03-20 13:53:59,True,True
2018-03-23T08:51:58,I was excited for movies in 2018... Was.,9,2,Keyblade Malachi,ogpTTHLprFs,0.375,2018-03-23 08:51:58,True,True
2018-03-24T05:07:12,1:07 oh god,5,2,theo smith,ogpTTHLprFs,0.0,2018-03-24 05:07:12,True,True
2018-03-24T05:43:34,1:06 when u find out u can double pump with the heavy shotgun in fornite,0,2,Cloudy,ogpTTHLprFs,-0.1,2018-03-24 05:43:34,True,True
2018-03-24T16:02:48,The CGI...,1,0,Santacruiser,ogpTTHLprFs,0.0,2018-03-24 16:02:48,True,True
2018-03-24T18:01:49,Did that dog just dab? Fucking skin me alive and throw me into the depths of hell.,0,0,Erick Val,ogpTTHLprFs,-0.25,2018-03-24 18:01:49,True,True
2018-03-24T20:32:24,I know I did not just hear RuPaul,0,0,Juan Pascual,ogpTTHLprFs,0.0,2018-03-24 20:32:24,True,True
2018-03-24T21:51:44,"I like dogs, but why they force these dogs to make bad movies like these?",10,2,Samuel Chin Orozco,ogpTTHLprFs,-0.6999999999999998,2018-03-24 21:51:44,True,True
2018-03-24T22:24:51,This is the plot of Miss Congeniality with a dabing dog,6,1,Kelpie,ogpTTHLprFs,0.0,2018-03-24 22:24:51,True,True
2018-03-25T00:31:14,"so, can he understand the dog?",0,0,walkin dude,ogpTTHLprFs,0.0,2018-03-25 00:31:14,True,True
2018-03-25T01:56:13,"It's ok to make total dogshit movies, kids will sit through them!",0,1,Lu Tello,ogpTTHLprFs,0.25,2018-03-25 01:56:13,True,True
2018-03-25T04:31:54,excellent movie,1,0,Comedy Movie Trailers,ogpTTHLprFs,1.0,2018-03-25 04:31:54,True,True
2018-03-25T08:01:48,"Every time one of these inane ""animals with computer mouths"" movies gets made I convince myself that it's the last one, because surely humanity has outgrown this kind of tripe.  And every time, I give the film industry too much credit. This genre should have gone extinct decades ago.",19,1,Joe England,ogpTTHLprFs,0.18,2018-03-25 08:01:48,True,True
2018-03-25T17:52:36,This looks like one of those fake trailers before Tropic Thunder,240,2,Andrew Kuder,ogpTTHLprFs,-0.5,2018-03-25 17:52:36,True,True
2018-03-25T22:08:51,That tiger joke was pretty funny,0,0,Bobby Sharpe,ogpTTHLprFs,0.25,2018-03-25 22:08:51,True,True
2018-03-25T22:39:05,May 18 is my birthday,0,2,Gaby Ponce,ogpTTHLprFs,0.0,2018-03-25 22:39:05,True,True
2018-03-26T23:12:22,This looks like a big pile of Emoji Movie Patrick Stewart,9,0,The Doorman 2022,ogpTTHLprFs,0.0,2018-03-26 23:12:22,True,True
2018-03-27T02:16:00,Is that a human centipede reference,0,0,Apple Bees,ogpTTHLprFs,0.0,2018-03-27 02:16:00,True,True
2018-03-27T03:20:53,I'm gonna see this movie when it comes out I like movies that have talking dogs and this movie is being Directed by Raja,1,0,Pikachu Doo,ogpTTHLprFs,0.0,2018-03-27 03:20:53,True,True
2018-03-27T10:00:52,Luda go get that check boy. Money is money.,1,0,Mrstobastoba,ogpTTHLprFs,0.0,2018-03-27 10:00:52,True,True
2018-03-27T17:58:45,He dab,0,0,Eris López,ogpTTHLprFs,0.0,2018-03-27 17:58:45,True,True
2018-03-31T21:32:02,OH shit. There's a pug in it. I have to watch it.,0,0,Kristanni20X6,ogpTTHLprFs,-0.2,2018-03-31 21:32:02,True,True
2018-04-01T14:35:30,"I just came here to say I saw this trailer before Isle of Dogs, just because the other film has dogs in the title doesn't mean that people going to see a Wes Anderson film would want to watch this pile of steaming shit.",0,0,Josh Lewis,ogpTTHLprFs,-0.2125,2018-04-01 14:35:30,True,True
2018-04-01T20:58:16,WTF is this?!,0,0,Iron Leaf,ogpTTHLprFs,-0.625,2018-04-01 20:58:16,True,True
2018-04-01T21:02:40,And the Razzie Award goes to...,8,0,TR-CAP,ogpTTHLprFs,0.0,2018-04-01 21:02:40,True,True
2018-04-01T21:03:27,2:03 my favourite part of this trailer,0,0,Leonardo Aristokrat,ogpTTHLprFs,0.0,2018-04-01 21:03:27,True,True
2018-04-01T21:34:23,This looks beyond awful 🤢,66,30,Aron Rudner-Stokell,ogpTTHLprFs,-1.0,2018-04-01 21:34:23,True,True
2018-04-01T21:45:27,"Looks dumb, stupid, uncreative, unfunny, and an insult to kids of all ages.",0,0,Danny in SoCal,ogpTTHLprFs,-0.5874999999999999,2018-04-01 21:45:27,True,True
2018-04-01T22:52:04,"Wow, 2005 called, they want their shitty movie back",0,0,Noah Martin,ogpTTHLprFs,0.05,2018-04-01 22:52:04,True,True
2018-04-01T23:36:54,This looks like it's going to suck,5,0,Morbid collector,ogpTTHLprFs,0.0,2018-04-01 23:36:54,True,True
2018-04-02T00:16:06,"Raja Gosnell, please stop making movies",14,1,Mitch Cooper,ogpTTHLprFs,0.0,2018-04-02 00:16:06,True,True
2018-04-02T01:36:17,"The movie is this year's Nine Lives, I'm calling it",35,3,Javier Jimenez,ogpTTHLprFs,0.0,2018-04-02 01:36:17,True,True
2018-04-02T02:43:03,you know what..whatever  i think the trailer looks cute..def for kids so if it makes the kids happy why not,69,21,livjunkie,ogpTTHLprFs,0.8,2018-04-02 02:43:03,True,True
2018-04-02T06:07:07,Chris Stuckmann bought me here and his dog Zeev so yeah this movie is going to suck.,4,0,22martinez1,ogpTTHLprFs,0.0,2018-04-02 06:07:07,True,True
2018-04-02T06:22:19,At 1:12 you can see the actual dogs mouth closed over the shitty CGI.,0,0,Marshall MacDonald,ogpTTHLprFs,-0.05,2018-04-02 06:22:19,True,True
2018-04-02T07:33:33,Its aint easy being white Its aint easy being brown,6,0,someone 1,ogpTTHLprFs,0.2888888888888889,2018-04-02 07:33:33,True,True
2018-04-02T07:53:19,These type of movies should be branded as a form of animal cruelty.,0,0,Mortician's Flame,ogpTTHLprFs,0.0,2018-04-02 07:53:19,True,True
2018-04-02T08:04:11,"Anyone gonna say ""Chris Stuckmann brought me here"" ?",5,0,Giang Quang Vinh,ogpTTHLprFs,0.0,2018-04-02 08:04:11,True,True
2018-04-02T12:45:16,"1:07 seriously, dabbing dog?",1,0,Dzic Ikhlasul,ogpTTHLprFs,-0.3333333333333333,2018-04-02 12:45:16,True,True
2018-04-02T15:34:26,"Wow , this is definitely Avengers Infinity War Level.",9,4,Alejandro,ogpTTHLprFs,0.05,2018-04-02 15:34:26,True,True
2018-04-02T15:37:41,It's 2018 and dogs still dab? 1:07,6,1,Alejandro,ogpTTHLprFs,0.0,2018-04-02 15:37:41,True,True
2018-04-02T18:40:39,Oof,0,0,John Ewing,ogpTTHLprFs,0.0,2018-04-02 18:40:39,True,True
2018-04-02T22:35:05,This looks like absolute shite. Chris Stuckmann's dog was so right about this!,2,0,WH250398,ogpTTHLprFs,0.2785714285714286,2018-04-02 22:35:05,True,True
2018-04-03T07:09:35,Paddington >>>>>>>>>>>>>>>>>>>>>>>>>>>>>>>>>>>>>>>>>>>>>>>>>>>>>>>>>>>>>>>> >>>>>>>>>>>>>>>>>>>>>>>>>>> >>>>>>>>>>>>>>>>>>>>>>> >>>>>>>>>>>>>>>>>>>>>>>>>>>>>>>>> >>>>>>>>>>>>>>>>>>>>>>>>>>>>>>>>>>>>>>>>>>>>> >>>>>>>>>>>>>>>>>>>>>>>>>>>>>>>>>>>>>>>>>>>>>>>>>>>>>>>>>>>>>>>> Show Dogs,2,1,Matthew Mertens,ogpTTHLprFs,0.0,2018-04-03 07:09:35,True,True
2018-04-03T22:49:16,People in this comment haven't even watched this movie yet and are already judging it... Wtf like 🤦🏻🤷🏻,0,1,wiktoria,ogpTTHLprFs,-0.5,2018-04-03 22:49:16,True,True
2018-04-04T03:34:05,I forgot that Raja Gosnell even existed for awhile...,2,0,Mr_Beta Cat,ogpTTHLprFs,0.0,2018-04-04 03:34:05,True,True
2018-04-05T16:39:52,Obvious excuse for family Entertainment is obvious.      That was what I thought when I saw this preview before Ready Player One.,5,0,MCU/DCEUComedian EDCP,ogpTTHLprFs,0.037500000000000006,2018-04-05 16:39:52,True,True
2018-04-06T00:55:50,He went to film school for this..,4,0,Jimba,ogpTTHLprFs,0.0,2018-04-06 00:55:50,True,True
2018-04-07T13:58:31,might just watch for natasha lyonne,0,0,Niyah Callister,ogpTTHLprFs,0.0,2018-04-07 13:58:31,True,True
2018-04-07T15:25:38,Big change in scenes for Natasha woah. I love her.,0,0,Anon Xo,ogpTTHLprFs,0.25,2018-04-07 15:25:38,True,True
2018-04-08T13:43:51,Stop,0,0,PixieMiata,ogpTTHLprFs,0.0,2018-04-08 13:43:51,True,True
2018-04-08T14:42:14,This needs more dislikes.   And this movie will officialy kill the dab,3,0,Kane Aquino,ogpTTHLprFs,0.5,2018-04-08 14:42:14,True,True
2018-04-12T04:50:26,"All of you that comment about this movie could go to freaking hell! I kind of like movies like this because it makes me laugh. All you care about a stupid movies with action and exedra. Go jump off a bridge or something. Better yet, stick up your middle finger sit on it and rotate for all I care!",1,0,Zowie97,ogpTTHLprFs,0.11666666666666665,2018-04-12 04:50:26,True,True
2018-04-12T07:24:24,"Damn, oscar season is coming early this year.",11,0,Black flag Films,ogpTTHLprFs,0.1,2018-04-12 07:24:24,True,True
2018-04-12T12:21:16,I thought the 2000s ended ages ago  Edit: YES I UNDERSTAND I WORDED IT WRONG. Can you please stop telling me that? By the 2000s ending I meant the type of movies they made during 2000-2009 or 10 etc. Felt like I could of worded it better lmao. But yeah you can ignore this comment now P:,27,13,hottygal1,ogpTTHLprFs,0.19999999999999998,2018-04-12 12:21:16,True,True
2018-04-15T23:01:27,"i love how the trailer says ""from the director of beverly hills chihuahua, the smurfs and scooby-doo"" as if those movies are award winning masterpieces",49,4,nocctea,ogpTTHLprFs,0.5,2018-04-15 23:01:27,True,True
2018-04-16T00:42:15,this comes out on my birthday...............,0,1,PotatoIsiah,ogpTTHLprFs,0.0,2018-04-16 00:42:15,True,True
2018-04-16T09:14:43,“It’s attempting to jump on a bandwagon so late that the band has completed three sellout world tours and sold their wagon to a scrap dealer.” - Ben “Yahtzee” Croshaw,3,0,Jayden Leonard,ogpTTHLprFs,-0.3,2018-04-16 09:14:43,True,True
2018-04-16T21:39:17,You can already tell that this movie is gonna be bad.,17,4,TheLosersaccount,ogpTTHLprFs,-0.6999999999999998,2018-04-16 21:39:17,True,True
2018-04-17T07:03:14,"*Yeah... earn THAT paycheck, Ludacris!!*",1,0,Fun Āsian Kobē 🐀 10MinutesOrMore,ogpTTHLprFs,0.0,2018-04-17 07:03:14,True,True
2018-04-17T07:03:57,"*Yeah 🐶 earn THAT paycheck, Ludacris!!*",1,0,Fun Āsian Kobē 🐀 10MinutesOrMore,ogpTTHLprFs,0.0,2018-04-17 07:03:57,True,True
2018-04-17T11:50:48,These guys make the same exact movie every time. I can’t really get upset at it anymore because it all feels numb.,4,0,John Brett,ogpTTHLprFs,-0.03749999999999999,2018-04-17 11:50:48,True,True
2018-04-17T13:23:18,"""Beverly hills chihuahua""? This is going to be pure gold",0,0,Ava Huth,ogpTTHLprFs,0.21428571428571427,2018-04-17 13:23:18,True,True
2018-04-17T18:55:08,I actually want to see this 🐶😯😀,1,3,GalaxyStar,ogpTTHLprFs,0.0,2018-04-17 18:55:08,True,True
2018-04-17T22:04:03,I am interested (please don't hate me),0,0,Tammer Vital,ogpTTHLprFs,-0.275,2018-04-17 22:04:03,True,True
2018-04-18T02:41:44,They played this trailer when I went to see isle of dogs. I want someone fired,21,4,Blake McCollough,ogpTTHLprFs,0.0,2018-04-18 02:41:44,True,True
2018-04-19T21:57:48,"So it's a remake of ""Miss Congeniality""?",0,0,Adam Jones,ogpTTHLprFs,0.0,2018-04-19 21:57:48,True,True
2018-04-20T03:53:31,Will Arnett must have owed someone a favor. A big fat throbbing favor.,0,0,daughterofolaf,ogpTTHLprFs,0.0,2018-04-20 03:53:31,True,True
2018-04-20T04:11:36,Cgi looks 10/10,0,0,Ava Huth,ogpTTHLprFs,0.0,2018-04-20 04:11:36,True,True
2018-04-20T14:22:26,Doggy doggy what now?,1,0,David Levy,ogpTTHLprFs,0.0,2018-04-20 14:22:26,True,True
2018-04-21T12:34:43,my birthday is in may 18 I will get to watch on my birthday x),0,1,Heidi Infante,ogpTTHLprFs,0.0,2018-04-21 12:34:43,True,True
2018-04-22T13:41:01,No thanks.,0,0,Sarah Barker,ogpTTHLprFs,-0.1,2018-04-22 13:41:01,True,True
2018-04-23T00:24:20,Is Will Arnet hard up for money?,0,0,kman20,ogpTTHLprFs,-0.2916666666666667,2018-04-23 00:24:20,True,True
2018-04-25T00:14:29,Has science gone too far?,4,0,Neddlemouse,ogpTTHLprFs,0.1,2018-04-25 00:14:29,True,True
2018-04-25T05:03:17,wHat tHe fEck tHe tiCkets iS eXpensive,0,0,Yoonminion Yoonseoked,ogpTTHLprFs,-0.5,2018-04-25 05:03:17,True,True
2018-04-25T16:53:32,Omg this looks like complete and utter garbage lol,4,0,sjtyree,ogpTTHLprFs,0.3,2018-04-25 16:53:32,True,True
2018-04-25T20:27:17,CRINGEY AND PAINFUL,1,0,Josepheter99,ogpTTHLprFs,-0.7,2018-04-25 20:27:17,True,True
2018-04-26T00:02:46,Scooby-Doo and the live action smurfs are bad. ( I haven't seen the chihuahua one ) But I think this film will do well. Maybe around 3/5 at least.,0,0,VetorthePlagueWerewolf,ogpTTHLprFs,-0.19090909090909086,2018-04-26 00:02:46,True,True
2018-04-26T08:41:17,I knew I heard Rupaul <3,0,0,Kenny,ogpTTHLprFs,1.0,2018-04-26 08:41:17,True,True
