timestamp,text,like_count,reply_count,author,trailer_id,sentiment_score,datetime,used_for_model,used_for_visualization
2018-05-21T16:03:10,"Be careful, this movie spreads the message of ""its okay to touch private parts"". I just read a review about it. Please don't let your kids watch this.",4,0,Billy Purcell,ogpTTHLprFs,0.13333333333333333,2018-05-21 16:03:10,False,True
2018-05-21T16:27:02,I'm here for the wrong reason my sister said that one of the songs you play all the time is in this trailer (Shades On - The Vamps) and I'm here,0,0,Cáit Ní Chadhain,ogpTTHLprFs,-0.5,2018-05-21 16:27:02,False,True
2018-05-21T17:03:31,This movie should be banned. The obvious common aspects of a child molester grooming tactics with Max having to deal with his private parts being inspected is outrageous!,3,0,John Dozier,ogpTTHLprFs,-0.325,2018-05-21 17:03:31,False,True
2018-05-21T19:11:45,"I read an article about this movie, can any one confirm..  They say that in the finals he has to ""let the judges touch his private parts"" and that Will Arnettprepares him by touching him there to get used to it.  That alone makes me not want to see it. The whole scenario of it sounds bad.",1,0,Jenn Conlon,ogpTTHLprFs,2.7755575615628914e-17,2018-05-21 19:11:45,False,True
2018-05-21T20:38:12,"Directors from Beverly Hills chihuahuas, scooby doo, and the smurfs! This is going to be Good",0,0,Percy Perjector,ogpTTHLprFs,0.7,2018-05-21 20:38:12,False,True
2018-05-21T21:06:20,Pedofilia manipulation in this movie toward the end. Don't bring your kids to see this!,1,0,Michelle G.,ogpTTHLprFs,0.0,2018-05-21 21:06:20,False,True
2018-05-21T21:20:31,This girl said this was very disturbing and not to bring kids,0,0,Karlee !,ogpTTHLprFs,-0.65,2018-05-21 21:20:31,False,True
2018-05-21T22:17:55,Why? Just why?,0,0,jinxiejae,ogpTTHLprFs,0.0,2018-05-21 22:17:55,False,True
2018-05-21T23:02:05,Since when does a movie trailer not show a rating?,0,0,Ken Livingston,ogpTTHLprFs,0.0,2018-05-21 23:02:05,False,True
2018-05-22T04:02:12,IS THIS CANCER THIS IS CANCER....,2,0,gooryon,ogpTTHLprFs,0.0,2018-05-22 04:02:12,False,True
2018-05-22T06:45:38,Won't be as good as Love On A Leash.,0,0,Audrey Albritton,ogpTTHLprFs,0.6,2018-05-22 06:45:38,False,True
2018-05-22T09:08:57,I cringed at this trailer... Looks horrible  That CGI dosent make it any better either,3,0,Louis H Evans,ogpTTHLprFs,-0.25,2018-05-22 09:08:57,False,True
2018-05-22T13:01:27,"Rupaul "" Sashay away""",0,0,Tori Rose,ogpTTHLprFs,0.0,2018-05-22 13:01:27,False,True
2018-05-22T13:59:54,"THIS MOVIE IMPLIES IT'S OK TO TOUCH PRIVATE PARTS! THIS IS NOT SOMETHING TO SUPPORT.... THE MAIN CHARACTER IS TOLD TO GO TO HIS HAPPY PLACE OR ""ZEN PLACE"" WHILE HE IS BEING TOUCHED ON HIS PRIVATE?????????? WTH?",2,0,blessingbutler,ogpTTHLprFs,0.29333333333333333,2018-05-22 13:59:54,False,True
2018-05-22T16:39:24,DO NOT LET YOUR CHILDREN SEE THIS MOVIE,1,0,BrItBrAtzzZZ,ogpTTHLprFs,0.0,2018-05-22 16:39:24,False,True
2018-05-22T23:47:11,I saw the whole movie on my field trip in my school,1,1,KD Fam,ogpTTHLprFs,0.2,2018-05-22 23:47:11,False,True
2018-05-23T03:53:28,It may be be childlike mind or what not but I kinda wanna see this 😂😂,0,0,Sammy X,ogpTTHLprFs,0.0,2018-05-23 03:53:28,False,True
2018-05-23T13:48:36,Movies has sexual undertones and I just don't understand why stuff like that has to be in a movie for children.,0,0,Dawn Simental,ogpTTHLprFs,0.5,2018-05-23 13:48:36,False,True
2018-05-23T13:52:08,"Movie portrays that Sexual abuse is ok. They put a joke on it to make it acceptable.  Absolutely Disgusting.  Is this what Hollywood think is ok in this day and age, heck in any age? The actors ought to be ashamed. Not surprised though.",0,1,Dawn Simental,ogpTTHLprFs,0.09,2018-05-23 13:52:08,False,True
2018-05-23T19:34:31,Don't let your children watch it. It endorses grooming and sexual abuse.,0,0,Tritonewt,ogpTTHLprFs,0.5,2018-05-23 19:34:31,False,True
2018-05-24T02:05:48,This is why kids shoot up schools,5,1,Chris Reyes,ogpTTHLprFs,0.0,2018-05-24 02:05:48,False,True
2018-05-24T02:32:06,WHO AGREED TO THIS?!,0,0,Alexia Barrera,ogpTTHLprFs,0.0,2018-05-24 02:32:06,False,True
2018-05-24T03:07:42,This movie features inappropriate sexual touching. DO NOT TAKE YOUR CHILDREN TO SEE THIS MOVIE.,1,3,Jeremy Main,ogpTTHLprFs,0.5,2018-05-24 03:07:42,False,True
2018-05-24T06:13:29,Apparently there's some pedophilia undertones in this movie.,1,0,Austin Ruzicka,ogpTTHLprFs,0.05,2018-05-24 06:13:29,False,True
2018-05-24T17:34:12,"Una película que sirve de apología para la pederastia y agenda descontructivista de los dueños de las corporaciones, a expensas de los niños y la sociedad toda",0,0,Sergio Vásquez,ogpTTHLprFs,0.0,2018-05-24 17:34:12,False,True
2018-05-24T17:53:23,I won't show this to my son  - wtf is this????? I regret watching the trailer,0,0,Toto Miranda,ogpTTHLprFs,-0.5,2018-05-24 17:53:23,False,True
2018-05-24T18:07:12,This movie has already been exposed for having pedophile and beastiality  messages. But what else is new in Hollywood  ?,2,0,cr87129,ogpTTHLprFs,0.13636363636363635,2018-05-24 18:07:12,False,True
2018-05-24T21:45:42,This is why I don't go to the theatres anymore.,0,0,Fried Vegetables,ogpTTHLprFs,0.0,2018-05-24 21:45:42,False,True
2018-05-24T23:21:03,This is bad,1,0,Mario is Here,ogpTTHLprFs,-0.6999999999999998,2018-05-24 23:21:03,False,True
2018-05-24T23:40:30,"""Family Comedy"" used to normalize Hollywood style family values.  Disgusting show.",1,0,Chris shoop,ogpTTHLprFs,-1.0,2018-05-24 23:40:30,False,True
2018-05-25T02:49:39,Innapropiate movie do not take your kids!!!Max has to solve a case and hid stranger partner “the judge”Has to touch his pirvate parts! Sorry for my bad grammar,0,0,Jorge Arechiga,ogpTTHLprFs,-0.5999999999999999,2018-05-25 02:49:39,False,True
2018-05-25T04:55:33,Terrible movie for sooo many reasons,0,0,DuskLavenderhart,ogpTTHLprFs,-0.25,2018-05-25 04:55:33,False,True
2018-05-25T05:06:26,I have to see this to support my womans Natasha Lyonne,0,0,Nicky Nichols,ogpTTHLprFs,0.0,2018-05-25 05:06:26,False,True
2018-05-25T16:27:36,I thought this was a spin off to cats and dogs,0,0,Omega Lean,ogpTTHLprFs,0.0,2018-05-25 16:27:36,False,True
2018-05-25T16:41:59,i have seen this!,0,0,Shing Shong,ogpTTHLprFs,0.0,2018-05-25 16:41:59,False,True
2018-05-25T20:46:32,"Perverted movie, teach children that is good that your private parts be touched by anyone..",0,0,Eliusalmo1,ogpTTHLprFs,0.35,2018-05-25 20:46:32,False,True
2018-05-26T12:33:03,This is basically Beverly Hills Chihuahua 2 meets Cats & Dogs 2. With a pinch of Marmaduke.,0,0,BigBadMightyena,ogpTTHLprFs,0.0,2018-05-26 12:33:03,False,True
2018-05-26T13:21:09,"Now that you got caught promoting pedophilia and are forced to edit out your disgusting message, I hope your movie still bombs.",1,0,A Hammer,ogpTTHLprFs,-0.65,2018-05-26 13:21:09,False,True
2018-05-26T17:43:33,"I think it's just plain stupidity that parents think the movie is promoting sexual touching at the check up scene .When you don't take it out of contexts it's showing what vets have to do. it is NOT saying anyone can touch you there , just stay calm about it . But if a scene like that is taken as pedophilic , then any movie where a man /woman are getting checked up like that should be removed because it could be considered rape",0,0,demon king,ogpTTHLprFs,0.09714285714285716,2018-05-26 17:43:33,False,True
2018-05-27T06:39:44,Seeing this as soon as I can,0,0,Dylan Mcgarr,ogpTTHLprFs,0.0,2018-05-27 06:39:44,False,True
2018-05-27T12:10:04,SHAQUILLE OMFG I LOVE HIM!!! AND DOGS!!!,0,0,Poo Craver,ogpTTHLprFs,1.0,2018-05-27 12:10:04,False,True
2018-05-27T14:00:29,I am going to see that movie today,0,0,Matthew Jakubowski,ogpTTHLprFs,0.0,2018-05-27 14:00:29,False,True
2018-05-27T18:45:09,The writers of this script must be barking mad.,0,0,eltanin awry,ogpTTHLprFs,-0.625,2018-05-27 18:45:09,False,True
2018-05-28T03:54:03,rottweiler star... you got us there!!,0,0,lisa owen,ogpTTHLprFs,0.0,2018-05-28 03:54:03,False,True
2018-05-28T18:17:08,Thid seems like it sucks and im about to see it because of my litle brothers,0,0,ViruX !¡,ogpTTHLprFs,-0.3,2018-05-28 18:17:08,False,True
2018-05-28T21:45:42,I can see why BoJack fired Princess Carolyn....,2,0,Mairead Malesco,ogpTTHLprFs,0.0,2018-05-28 21:45:42,False,True
2018-05-28T22:43:05,I saw it at the movies,0,2,Angela Gonzalez,ogpTTHLprFs,0.0,2018-05-28 22:43:05,False,True
2018-05-29T09:07:18,That looks terrible,0,1,MsTyroneshoelaces,ogpTTHLprFs,-1.0,2018-05-29 09:07:18,False,True
2018-05-30T01:18:20,Not another talking animal movie.,1,0,A Thought Crime,ogpTTHLprFs,0.0,2018-05-30 01:18:20,False,True
2018-05-30T03:46:29,Why,0,0,Maj Fire,ogpTTHLprFs,0.0,2018-05-30 03:46:29,False,True
2018-05-30T08:49:07,I just like the fact that a Rottweiler is the main character and actually a good guy,0,0,Melissa Stead,ogpTTHLprFs,0.4333333333333333,2018-05-30 08:49:07,False,True
2018-05-30T21:25:08,Literally the worst movie I’ve ever seen.,0,0,Diet Coke,ogpTTHLprFs,-1.0,2018-05-30 21:25:08,False,True
2018-05-30T21:56:09,This movie should be illegal,0,0,Electric Pixels,ogpTTHLprFs,-0.5,2018-05-30 21:56:09,False,True
2018-05-31T08:06:04,Why did Google say that Rupaul starred in this?,0,0,Lena Barlow,ogpTTHLprFs,0.0,2018-05-31 08:06:04,False,True
2018-05-31T17:56:52,wow,0,0,wkrzysiek69,ogpTTHLprFs,0.1,2018-05-31 17:56:52,False,True
2018-05-31T20:07:05,тут кто нибудь по русский говорит?,0,0,Дарья Марченко,ogpTTHLprFs,0.0,2018-05-31 20:07:05,False,True
2018-06-01T00:27:52,I know ya probably not going to go to this movie but I havnt have a field trip at my school in a couple of years and yet I was excited until I see the title and looked this movie up  God help me,0,0,Lattice 90,ogpTTHLprFs,0.375,2018-06-01 00:27:52,False,True
2018-06-01T02:24:04,"NOT SUITABLE FOR KIDS, danger. Some scene looks like a cospiration to make the new generation get the wrong idea about why we need body protect education when we were kid. The movie production background maybe have p**of*l profile.",0,0,Kim Review,ogpTTHLprFs,-0.2128787878787879,2018-06-01 02:24:04,False,True
2018-06-01T17:18:42,I smell a new Nostalgia Critic review!!!,0,0,drummer4life39,ogpTTHLprFs,0.26633522727272724,2018-06-01 17:18:42,False,True
2018-06-01T22:36:49,viva las vegas,0,0,Shadow Assassin,ogpTTHLprFs,0.0,2018-06-01 22:36:49,False,True
2018-06-01T23:12:03,best movie out here,0,0,Brisa Acosta,ogpTTHLprFs,1.0,2018-06-01 23:12:03,False,True
2018-06-02T02:21:49,I watched this movie and really enjoyed it. Then I come to the trailer to see so much hate and the dislike to like ratio. Why do people judge movies so fast. This was so funny and really good.,0,0,Talia,ogpTTHLprFs,0.16999999999999998,2018-06-02 02:21:49,False,True
2018-06-02T22:54:14,We're  going  to the theater in the last day of school. The school chose this. And I'm in 7th grade.,0,0,Windows XP,ogpTTHLprFs,0.0,2018-06-02 22:54:14,False,True
2018-06-04T18:50:56,How does this not have more dislikes,1,0,Fawful117 Chortles,ogpTTHLprFs,0.5,2018-06-04 18:50:56,False,True
2018-06-04T23:29:01,how did they get the funds for the production of this...movie?,0,0,Jay Zhou,ogpTTHLprFs,0.0,2018-06-04 23:29:01,False,True
2018-06-06T20:09:57,Mom: do you want to see this movie        Me: yesn’t,0,0,Daynise Hopkins,ogpTTHLprFs,0.0,2018-06-06 20:09:57,False,True
2018-06-07T05:54:04,Why You gUys HATE IT?,0,0,bangelbangelwhereareyou,ogpTTHLprFs,-0.8,2018-06-07 05:54:04,False,True
2018-06-07T19:21:43,it was really nice I enjoy watching the movie lots of laughs I don't knew who are the actor's but it was good and a little surprised in the movie I give it a 6/10,0,0,Jose Garcia,ogpTTHLprFs,0.3225,2018-06-07 19:21:43,False,True
2018-06-07T19:58:24,No not G.O.B,0,0,Maddie. French_,ogpTTHLprFs,0.0,2018-06-07 19:58:24,False,True
2018-06-08T00:58:52,Just saw it and...it was good and there was a Beverly Hills chihuahua cameo,0,0,Spring Trap,ogpTTHLprFs,0.7,2018-06-08 00:58:52,False,True
2018-06-08T05:18:35,This looks funny hey and don't be replying me hate comments  How can you not love animals it looks cute,0,0,Thicc nimbus 69,ogpTTHLprFs,-0.07500000000000001,2018-06-08 05:18:35,False,True
2018-06-08T20:25:45,So funny,0,0,chloe Stephens,ogpTTHLprFs,0.25,2018-06-08 20:25:45,False,True
2018-06-09T02:35:52,This is just tacky....😒👎,0,0,Chandler 1515,ogpTTHLprFs,0.0,2018-06-09 02:35:52,False,True
2018-06-09T12:34:47,im going to watch it today on my cousin's birthday. wish me luck,0,1,jonnyloaf,ogpTTHLprFs,0.0,2018-06-09 12:34:47,False,True
2018-06-10T11:22:15,I know this is going to suck but i'm gonna watch it for Bojack.,0,0,Dead Pool,ogpTTHLprFs,0.0,2018-06-10 11:22:15,False,True
2018-06-11T14:03:09,Good movie.,0,0,TK YT,ogpTTHLprFs,0.7,2018-06-11 14:03:09,False,True
2018-06-12T17:01:31,"If anyone saw this movie, just letting you know my birthday is on April 19th. Only people who watched this movie will understand what I have to go through :D.",1,0,CoopShowz,ogpTTHLprFs,0.0,2018-06-12 17:01:31,False,True
2018-06-13T22:39:21,Scooby Doo was actually decent,0,0,NEG Toxic3Dcats,ogpTTHLprFs,0.16666666666666666,2018-06-13 22:39:21,False,True
2018-06-14T15:57:34,why is there a rpdr refferance kids wont get that,0,0,Ava Tobin,ogpTTHLprFs,0.0,2018-06-14 15:57:34,False,True
2018-06-14T16:19:40,What is that song on ending of full movie?,1,0,Ketlin,ogpTTHLprFs,0.35,2018-06-14 16:19:40,False,True
2018-06-15T07:34:01,cái này tôi coi ở rạp chiếu phim ở VINCOM rồi,0,0,Hien dao thi,ogpTTHLprFs,0.0,2018-06-15 07:34:01,False,True
2018-06-16T19:46:06,Omg my fav film is Beverly hills chihuahua,0,0,Charlotte TCL,ogpTTHLprFs,0.0,2018-06-16 19:46:06,False,True
2018-06-17T19:07:49,"why do live-action talking animal movies have to rely on shitty cgi? just do what homeward bound did, and put dialogue over the dogs movement and stuff!",0,0,Cadje Bushey,ogpTTHLprFs,0.0,2018-06-17 19:07:49,False,True
2018-06-18T14:42:40,the sad part is that this pure cancer is going to make money,0,0,mumintrollable,ogpTTHLprFs,-0.14285714285714285,2018-06-18 14:42:40,False,True
2018-06-26T07:42:42,100% made by a pedophile,0,0,Emmanuel,ogpTTHLprFs,0.0,2018-06-26 07:42:42,False,True
2018-07-04T07:33:22,"Avoid at all cost, unless you have a desire for any of your remaining live brain cells - to commit suicide.",0,0,Evol Bob,ogpTTHLprFs,0.13636363636363635,2018-07-04 07:33:22,False,True
2018-07-05T11:44:42,I don’t get it at all. The story is very confusing. It’s some about a panda. I DON’T F**KING KNOW.,0,0,Infinite pilot 2002,ogpTTHLprFs,-0.39,2018-07-05 11:44:42,False,True
2018-07-05T18:36:59,Baaaaaaad,0,0,Emmanuel Emma,ogpTTHLprFs,0.0,2018-07-05 18:36:59,False,True
2018-07-05T19:00:00,the vamps my boysssss singing yay,2,0,Lily,ogpTTHLprFs,0.0,2018-07-05 19:00:00,False,True
2018-07-07T02:11:02,Those fake trailers from Tropic Thunder look more real than this trash.,0,0,TotalbleShip01 Cizz,ogpTTHLprFs,0.06666666666666667,2018-07-07 02:11:02,False,True
2018-07-08T21:03:12,No... no...... no.............,0,0,Robert Bosch,ogpTTHLprFs,0.0,2018-07-08 21:03:12,False,True
2018-07-09T00:31:32,this gave me nightmares      and not good ones (oh yes i have those),0,0,smolxphan,ogpTTHLprFs,-0.35,2018-07-09 00:31:32,False,True
2018-07-12T03:52:19,Rupaul!!!!!!!!!,0,0,Xavier Sedillo,ogpTTHLprFs,0.0,2018-07-12 03:52:19,False,True
2018-07-13T01:36:18,It's for little kids not 12 years or over Id say (I think 10 year olds may enjoy it),0,0,Pammy M H,ogpTTHLprFs,0.10625000000000001,2018-07-13 01:36:18,False,True
2018-07-16T16:45:11,When is this bec I want to watch it eight away lol,0,0,Storm Paw,ogpTTHLprFs,0.8,2018-07-16 16:45:11,False,True
2018-07-17T05:57:24,Its actually really good!,0,0,Rhea,ogpTTHLprFs,0.875,2018-07-17 05:57:24,False,True
2018-07-18T13:06:55,YES,0,0,Valeria Solorzano,ogpTTHLprFs,0.0,2018-07-18 13:06:55,False,True
2018-07-21T13:47:35,I don't actually think it's that bad. I quite like it. So please STOP THE HATE. (But it does remind me of the movies they made in the 2000's),0,0,Miguel Rodriguez,ogpTTHLprFs,-0.5,2018-07-21 13:47:35,False,True
2018-07-22T20:01:27,why the f**k they said k9,0,0,Sandesh Thakur,ogpTTHLprFs,0.0,2018-07-22 20:01:27,False,True
2018-07-26T12:59:11,I don’t have a problem with you liking the movie am find with that. BUT don’t say we are not allowed to hate this movie. Because it shows us you are disrespecting our opinions. Ok. If you like the movie I will respect your opinion but please respect my and everybody else’s.,0,0,Infinite pilot 2002,ogpTTHLprFs,-0.8,2018-07-26 12:59:11,False,True
2018-07-27T23:57:33,😧...Just when I thought it couldn't get worse......,0,0,Melody Bankz,ogpTTHLprFs,-0.4,2018-07-27 23:57:33,False,True
2018-08-03T13:17:35,"The only thing I like about this movie is that 1. RuPaul literally just said ""sashay away"" and I'm going to sob. And 2. D o g s.",0,0,Panini,ogpTTHLprFs,0.0,2018-08-03 13:17:35,False,True
2018-08-05T06:22:54,"Seriously, every dog's name is Max?",0,0,Willy Espinoza,ogpTTHLprFs,-0.3333333333333333,2018-08-05 06:22:54,False,True
2018-08-05T20:18:10,"Well y’all pray for me?I’m fix to get fucked up off liquor and pills and hope i make it thru because today I’m taking my 5 and 10 year old girls to see this,I didn’t even know this movie exist",0,0,3rdcoastbornand Raise,ogpTTHLprFs,-0.25,2018-08-05 20:18:10,False,True
2018-08-07T17:43:14,"f*** it, I'm turning my adult mode off!",0,0,Ichi Capeta,ogpTTHLprFs,0.125,2018-08-07 17:43:14,False,True
2018-08-09T07:50:48,The only reason I would watch it is cause I heard mama ru voices in this god danm movie so u know he’s the only reason this movie is gonna be at least a bit good,0,0,Vinney !,ogpTTHLprFs,0.09999999999999999,2018-08-09 07:50:48,False,True
2018-08-11T19:43:47,"is this the next garfield lol the good old days, but no need for  this in 2018",0,0,george hesling,ogpTTHLprFs,0.4,2018-08-11 19:43:47,False,True
2018-08-12T04:43:53,"Watch this.... with the very disturbing part where the judges touched his “part” it was nasty. The movie wasn’t that bad, but very predictable",0,0,Wolfspirit 58,ogpTTHLprFs,-0.6524999999999999,2018-08-12 04:43:53,False,True
2018-08-12T20:20:01,Is this still in theaters,0,0,Yeetus. mp6,ogpTTHLprFs,0.0,2018-08-12 20:20:01,False,True
2018-08-13T09:16:01,this movie was actually really good but I also liked beverly hills SOOO LMAOO,0,0,wonder chu,ogpTTHLprFs,0.6499999999999999,2018-08-13 09:16:01,False,True
2018-08-14T01:46:26,Lmao idk why I’m gonna watch this,0,0,Erew C,ogpTTHLprFs,0.6,2018-08-14 01:46:26,False,True
2018-08-16T20:15:12,1:07 *OOF* !!,0,0,Bart Tak,ogpTTHLprFs,0.0,2018-08-16 20:15:12,False,False
2018-08-17T04:13:54,Family entertainment? Really? Did you let the homofascists inject their agenda into it? Can  you be trusted?,0,0,David Williams,ogpTTHLprFs,0.2,2018-08-17 04:13:54,False,False
2018-08-19T21:27:26,The only one question I have after watching this trailer is how on Earth heavens is Raja Gosnell still able to be making movies,1,0,Manuel David Rendon Acevedo,ogpTTHLprFs,0.25,2018-08-19 21:27:26,False,False
2018-08-20T08:21:36,This movie was good and hilarious I hope they make a 2nd one,0,0,marley363,ogpTTHLprFs,0.39999999999999997,2018-08-20 08:21:36,False,False
2018-08-22T23:28:26,"Gotta love dogs.  Dickheads & douchbags, gtfo",0,0,DJ Lizzy B,ogpTTHLprFs,0.5,2018-08-22 23:28:26,False,False
2018-08-25T02:41:34,It's a cute movie!!,0,0,Gingi's Chic Boutique,ogpTTHLprFs,0.78125,2018-08-25 02:41:34,False,False
2018-08-25T22:17:10,"I just watched this today and to be honest with you, I found the baby panda cute and I love the little runway btw that Las Vegas looks cool XD never been there.",0,0,coconut_ice,ogpTTHLprFs,0.35250000000000004,2018-08-25 22:17:10,False,False
2018-08-26T04:12:24,Cute🤪😜🐶🐯🐹🐕🐕,0,0,Binni Yinni,ogpTTHLprFs,0.0,2018-08-26 04:12:24,False,False
2018-08-26T07:04:07,Pretty good movie ... Very funny,1,0,Robert Wheeler,ogpTTHLprFs,0.425,2018-08-26 07:04:07,False,False
2018-08-26T19:15:28,PEDOFILIAAAAAAAAAAAAAAAAAA!!!!!!!!!,0,0,Skady Snowqueen,ogpTTHLprFs,0.0,2018-08-26 19:15:28,False,False
2018-08-31T03:08:39,"Ok, let me make this thing one clear. Who ever saw ""The emoji movie"". Who would rather watch that then this crap? ME!",0,0,Aiden Hargraves,ogpTTHLprFs,-0.13333333333333333,2018-08-31 03:08:39,False,False
2018-09-01T13:19:00,this is a perfectly good movie,0,0,we are cool,ogpTTHLprFs,0.7,2018-09-01 13:19:00,False,False
2018-09-16T17:21:32,It looks so bad it might be good.,0,0,Coolbread Rye,ogpTTHLprFs,5.551115123125783e-17,2018-09-16 17:21:32,False,False
2018-09-21T14:19:56,Cool,0,0,Xx WolfyxX,ogpTTHLprFs,0.35,2018-09-21 14:19:56,False,False
2018-09-23T02:07:30,Am I the only person in the world who liked this movie?,0,0,Cats of Fleece,ogpTTHLprFs,0.3,2018-09-23 02:07:30,False,False
2018-10-10T20:47:08,"ugh, u know ur no longer a movie star when ur headlining an anthropomorphic any-animal! Sad to see u go, Arnett",0,0,braveheartbob,ogpTTHLprFs,-0.5,2018-10-10 20:47:08,False,False
2018-10-12T22:20:34,And this is why a rather watch Disney live action adaptation than this abomination. (Paddington Bear is the only good non Disney remake adaptation I like),1,0,GWRTankEngine 64,ogpTTHLprFs,0.23409090909090907,2018-10-12 22:20:34,False,False
2018-10-15T13:24:17,Dogs don't talk.,0,0,Gary W-l-o-t,ogpTTHLprFs,0.0,2018-10-15 13:24:17,False,False
2018-10-19T19:37:54,Ι came to click on Not like ! 😛,0,0,Vaio San,ogpTTHLprFs,0.0,2018-10-19 19:37:54,False,False
2018-10-23T01:30:56,Will Arnett should really just dedicate his time to Bojack Horseman for now.,0,0,Tara Lucent,ogpTTHLprFs,0.2,2018-10-23 01:30:56,False,False
2018-10-25T21:10:27,Sony is claiming videos reviewing this dung of a movie,1,0,Rando Parson,ogpTTHLprFs,0.0,2018-10-25 21:10:27,False,False
2018-10-26T08:27:31,i really liked it minimum 5 stars thumbs up from me👍really cute and sweet :) like a nice summer :),0,0,Lilyz37,ogpTTHLprFs,0.5083333333333334,2018-10-26 08:27:31,False,False
2018-10-26T08:27:58,so cute,0,0,Lilyz37,ogpTTHLprFs,0.5,2018-10-26 08:27:58,False,False
2018-11-14T11:19:59,"NO, KATE MICUCCHI AND RUPAUL?!? JUST WHY?!?!",0,0,Nereseas,ogpTTHLprFs,0.0,2018-11-14 11:19:59,False,False
2018-11-16T13:11:41,"I watched this movie yesterday, I LOVED IT!  if you ACTUALLY watched the movie, then you would hear Chloe from Beverly Hills Chiuwawa say that nobody makes talking dogs movies anymore.  FACTS! stop hating on this movie. Who cares if you hate it, this movie is for kids, not adults. So stop.",0,0,PintoBean,ogpTTHLprFs,0.024999999999999984,2018-11-16 13:11:41,False,False
2018-11-17T18:10:59,So innocent it looked....,0,0,Joseph Ingham,ogpTTHLprFs,0.5,2018-11-17 18:10:59,False,False
2018-12-04T06:27:50,The rottweiler in this movie is actually my rottweiler's uncle. I think he was a brother to my dog's father (Fritz).,0,0,Samaya Allen,ogpTTHLprFs,0.0,2018-12-04 06:27:50,False,False
2018-12-05T13:43:24,Is that realised in India???,0,0,Sagar Pawar,ogpTTHLprFs,0.0,2018-12-05 13:43:24,False,False
2018-12-09T03:53:48,I've met the tri colour collie before:) she's so sweet,0,0,BNR Studios,ogpTTHLprFs,0.425,2018-12-09 03:53:48,False,False
2018-12-28T16:03:19,What the hell is this what is this movie from 1998 no this is from 2018 show dogs no reason to exist no what so ever this movie honestly kind of felt do you need from the moment the director was an ounce and of course when the premises talking animals in live-action you have to know if it's destined for failure. And it's cringe as hell!!!!!!!💩💩💩💩💩💩💩💩💩💩💩💩💩,0,0,Chad Special productions,ogpTTHLprFs,0.14166666666666664,2018-12-28 16:03:19,False,False
2018-12-30T21:51:05,Honestly this is worse than the emoji movie,0,0,Official Boss Baby YouTube Channel,ogpTTHLprFs,0.09999999999999998,2018-12-30 21:51:05,False,False
2019-01-26T20:45:34,My mum almost wanted to see this instead of Incredibles 2...,2,0,Hobnob Bob,ogpTTHLprFs,0.0,2019-01-26 20:45:34,False,False
2019-02-15T03:24:53,"When you don't vaccinate your kids and they reach adulthood, these types of movies are made.",1,0,Mama Duck,ogpTTHLprFs,0.0,2019-02-15 03:24:53,False,False
2019-03-17T05:50:40,Is it ok that I like this movie?,0,0,Caitlin the Eevee fan,ogpTTHLprFs,0.5,2019-03-17 05:50:40,False,False
2019-06-03T21:39:19,I’m so baffled this movie even exists in 2018 like I thought this movie was made in like 2003,2,0,Luke Kelley Media,ogpTTHLprFs,0.0,2019-06-03 21:39:19,False,False
2019-07-12T19:39:34,Cute,0,0,Tiffani Linde,ogpTTHLprFs,0.5,2019-07-12 19:39:34,False,False
2019-08-21T20:00:36,my dog's uncle was the rottweiler. i remember being so excited about it too.,1,0,Samaya Allen,ogpTTHLprFs,0.375,2019-08-21 20:00:36,False,False
2019-08-22T01:32:56,0:33 BOM BOM BOM,0,0,Manic More Est. 2003,ogpTTHLprFs,0.0,2019-08-22 01:32:56,False,False
2019-08-29T00:13:53,I like Scooby-Doo,1,0,Baliey Davis,ogpTTHLprFs,0.0,2019-08-29 00:13:53,False,False
2019-09-25T22:55:35,1:10  Me: OH LORDY,1,0,SnowflakePheonix,ogpTTHLprFs,0.0,2019-09-25 22:55:35,False,False
