timestamp,text,like_count,reply_count,author,trailer_id,sentiment_score,datetime,used_for_model,used_for_visualization
2018-04-27T20:07:07,"Is Shaq trying to top his previous movies for awful?  Saw this trailer before Avengers: Infinity Wars, made me wish I was a bit late to the movie as I felt ill after watching it.   For the record when making a trailer,  reading off a list of movies the director hopefully would rather forget about is not going to make people want to see this movie.  That said the number of people laughing when the Rottweiler farted in the bath makes me feel slightly more depressed by the human race.",9,0,Hdofu Fox,ogpTTHLprFs,-0.13809523809523808,2018-04-27 20:07:07,True,True
2018-04-27T23:53:17,I wanna go see this,0,2,Quita Lachelle,ogpTTHLprFs,0.0,2018-04-27 23:53:17,True,True
2018-04-28T22:48:19,Trash.,2,0,KlearChristal,ogpTTHLprFs,0.0,2018-04-28 22:48:19,True,True
2018-04-29T02:00:30,"There is no way this movie was made in 2018, this has to be a joke",133,7,paladin productions,ogpTTHLprFs,0.0,2018-04-29 02:00:30,True,True
2018-04-29T02:01:15,I just looked at the trailer cause I saw there was a rottie in there(loves rotties) but honestly this movie looks like it’s gonna suck so bad (like most animals talking movies).,0,0,Harvey Studt,ogpTTHLprFs,0.1333333333333334,2018-04-29 02:01:15,True,True
2018-04-29T02:06:48,yes officer this movie right here,0,0,sad confetti,ogpTTHLprFs,0.2857142857142857,2018-04-29 02:06:48,True,True
2018-04-29T03:48:38,Y'all loving peter rabbit but hating this huh? This is for kids not for teenagers.. Get it together commenters,0,0,William Smith,ogpTTHLprFs,0.6,2018-04-29 03:48:38,True,True
2018-04-29T04:25:17,I was about to be in this show I was  Auditioning,1,0,hannahpeach 2008,ogpTTHLprFs,0.0,2018-04-29 04:25:17,True,True
2018-04-29T13:22:46,This should be a great movie! Can't wait to see it.,0,1,Jasmine Murphy,ogpTTHLprFs,1.0,2018-04-29 13:22:46,True,True
2018-04-29T14:21:32,is rupaul in this because it said ''Sashay Away'' she says that in drag race,0,0,Karma,ogpTTHLprFs,-0.1,2018-04-29 14:21:32,True,True
2018-04-29T14:24:56,and yall is some rude people if you don't like the show dogs than why are you watching the trailer how about you keep your thoughts to yourself,0,0,Karma,ogpTTHLprFs,-0.3,2018-04-29 14:24:56,True,True
2018-04-29T15:03:37,"If ya'll gonna hate, then you can go watch ur frkin Dora the explorer like I. DONT. FRICKIN. CARE!!!!",0,1,danabear,ogpTTHLprFs,-1.0,2018-04-29 15:03:37,True,True
2018-04-29T21:54:41,"i thought we left beverly hills chihuaha, g force, cats vs dogs type movies in the 2000s",32,1,Your real dad #Finessemykidsfor18years,ogpTTHLprFs,0.0,2018-04-29 21:54:41,True,True
2018-04-29T23:46:14,"Am I the only one excited to see this? It looks cute! Personally, I am a big fan of these kinds of animals movies, I'm also a huge fan of the Scooby Doo movies!",0,0,cuteness200,ogpTTHLprFs,0.3,2018-04-29 23:46:14,True,True
2018-04-30T02:08:57,This is gonna come out 2 days after my b-day and also on my teachers b-day!  Edit: why are ppl putting hate on this movie and other ones that have talking animals?! I loved Beverly Hills Chihuahuas!,0,0,Lîbbÿ Malone,ogpTTHLprFs,-0.027083333333333348,2018-04-30 02:08:57,True,True
2018-04-30T23:16:52,Everyone mass dislike this,0,0,Velvet heart plays,ogpTTHLprFs,0.0,2018-04-30 23:16:52,True,True
2018-04-30T23:17:09,This trailer basically sums up our society.,0,0,Anthony Gonzalez,ogpTTHLprFs,0.0,2018-04-30 23:17:09,True,True
2018-05-01T00:35:37,I legitimately thought this was a fake trailer like the ones in the beginning of Tropic Thunder.,0,0,The Montreal Surprise,ogpTTHLprFs,-0.5,2018-05-01 00:35:37,True,True
2018-05-01T04:41:13,I wanna see this,1,0,DakotaGaming,ogpTTHLprFs,0.0,2018-05-01 04:41:13,True,True
2018-05-01T08:36:11,this looks like a f*cking parody,0,0,Thomas The Ninja Artist,ogpTTHLprFs,-0.6,2018-05-01 08:36:11,True,True
2018-05-01T14:44:08,Seriously whoever wrote this script should donate their brains to science right now as they obviously don’t use them,0,0,Hdofu Fox,ogpTTHLprFs,-0.015873015873015872,2018-05-01 14:44:08,True,True
2018-05-01T21:19:01,"I would much rather watch the whole airbud series then this trailer again. At least Airbud is decent, this is... sad, pathetic, cringy, terrible.",0,0,Ebony Clouds,ogpTTHLprFs,-0.3190476190476191,2018-05-01 21:19:01,True,True
2018-05-01T22:48:11,Everybody else is saying they don’t like it but I am loving this,1,0,glossyxkay,ogpTTHLprFs,0.6,2018-05-01 22:48:11,True,True
2018-05-02T02:16:07,…still better than the Emoji Movie.,2,0,AZ Studios,ogpTTHLprFs,0.5,2018-05-02 02:16:07,True,True
2018-05-02T03:52:12,I want to die,1,0,Uncle Jim stick his peepee in Me,ogpTTHLprFs,0.0,2018-05-02 03:52:12,True,True
2018-05-02T14:33:46,"I swear the amount of young kids in the comment section defending this movie, must defiantly be brainwashed",0,0,Buzzy Trombone,ogpTTHLprFs,0.1,2018-05-02 14:33:46,True,True
2018-05-02T21:57:30,I need to watch this,0,0,Ender,ogpTTHLprFs,0.0,2018-05-02 21:57:30,True,True
2018-05-02T23:59:04,This is sin,1,0,Bella Stillwell,ogpTTHLprFs,0.0,2018-05-02 23:59:04,True,True
2018-05-02T23:59:36,Like the sin that creates heLL,0,0,Bella Stillwell,ogpTTHLprFs,0.0,2018-05-02 23:59:36,True,True
2018-05-02T23:59:59,Just what we need another stupid movie about talking dogs,0,0,Garcia 123,ogpTTHLprFs,-0.7999999999999999,2018-05-02 23:59:59,True,True
2018-05-03T00:01:07,Am I living in 2008 again? Or what?,3,0,ً,ogpTTHLprFs,0.0,2018-05-03 00:01:07,True,True
2018-05-03T00:37:25,i have low hopes for this movie,0,0,The Jurassic Warewolf,ogpTTHLprFs,0.0,2018-05-03 00:37:25,True,True
2018-05-03T00:41:36,I have a rottwiler 🐕,0,0,Millonario Virtuales,ogpTTHLprFs,0.0,2018-05-03 00:41:36,True,True
2018-05-03T01:08:45,no one cares,0,0,Hookshot YT,ogpTTHLprFs,0.0,2018-05-03 01:08:45,True,True
2018-05-03T02:15:44,omg this comes out on the day before my bday! gg. gg.,0,0,「Cherry」,ogpTTHLprFs,0.0,2018-05-03 02:15:44,True,True
2018-05-03T03:26:34,"I'm not watching this cause 1, it's not even funny and 2, THE DABS!!!",0,2,Drummachine,ogpTTHLprFs,0.48828125,2018-05-03 03:26:34,True,True
2018-05-03T05:43:37,G,0,0,Venkata Laxmi,ogpTTHLprFs,0.0,2018-05-03 05:43:37,True,True
2018-05-03T22:23:46,This comes out on my birthday ;-;,0,0,alyssa,ogpTTHLprFs,0.0,2018-05-03 22:23:46,True,True
2018-05-04T00:11:11,Jake Paulers on top,0,0,Natalia Cossentino,ogpTTHLprFs,0.5,2018-05-04 00:11:11,True,True
2018-05-04T03:26:40,This looks worst than Marmaduke,4,0,Master MoJo,ogpTTHLprFs,-1.0,2018-05-04 03:26:40,True,True
2018-05-04T04:27:40,"This trailer made me consider Sherlock Gnomes, Teen Titans Go: To The Movies, Robin Hood, and Uncle Drew to not be to worst movie of the year",6,0,M.T.S The Shark,ogpTTHLprFs,-0.5,2018-05-04 04:27:40,True,True
2018-05-04T04:40:02,"I'm calling it, this movie will open with 300 million dollars, suck it Marvel",0,0,M.T.S The Shark,ogpTTHLprFs,0.0,2018-05-04 04:40:02,True,True
2018-05-04T04:41:02,"I thought that Deadpool 2 or Solo were the most exiting films of May 2018, but screw those movie",5,2,M.T.S The Shark,ogpTTHLprFs,0.5,2018-05-04 04:41:02,True,True
2018-05-04T04:43:11,"Raja Gosnell, stop existing",5,7,M.T.S The Shark,ogpTTHLprFs,0.0,2018-05-04 04:43:11,True,True
2018-05-04T05:10:03,May 18!!!! That my birthday!!!!!,2,1,ᴋᴏᴄʜᴏᴜ sʜɪɴᴏʙᴜ,ogpTTHLprFs,0.0,2018-05-04 05:10:03,True,True
2018-05-04T20:58:55,This reeks of 2000s straight to dvd movies...,2,0,Clickbait37,ogpTTHLprFs,0.2,2018-05-04 20:58:55,True,True
2018-05-04T21:00:11,Why is this a thing...,0,0,Clickbait37,ogpTTHLprFs,0.0,2018-05-04 21:00:11,True,True
2018-05-05T01:41:25,I love this Iove dogs!!!!!!!,0,0,Milo The leopard gecko & Friends,ogpTTHLprFs,1.0,2018-05-05 01:41:25,True,True
2018-05-05T08:34:23,"Ludacris looking for future movie contracts after Fast & Furious series is done...SMH, but not like this.",0,0,Hector A. Caballero,ogpTTHLprFs,0.1,2018-05-05 08:34:23,True,True
2018-05-05T12:27:19,DAB POLICE!!!,0,0,Yoshi King,ogpTTHLprFs,0.0,2018-05-05 12:27:19,True,True
2018-05-05T15:25:04,Oh gee I'm definitely not wasting my money on this garbage I'd rather die,1,0,Mr. Maybe,ogpTTHLprFs,0.0,2018-05-05 15:25:04,True,True
2018-05-05T17:18:58,It looked ok until the dab,1,0,Kuebiko,ogpTTHLprFs,0.5,2018-05-05 17:18:58,True,True
2018-05-05T21:26:59,the panda is cute,1,0,Jorge Lopez,ogpTTHLprFs,0.5,2018-05-05 21:26:59,True,True
2018-05-06T02:24:06,Cool,1,0,Jazzy Playz,ogpTTHLprFs,0.35,2018-05-06 02:24:06,True,True
2018-05-06T03:56:15,I AM GOING TO WATCH THIS MOVIE FOR MY FIELD TRIP FOR THE END OF THE SCHOOL YEAR,0,1,Valeria Mauricio,ogpTTHLprFs,0.0,2018-05-06 03:56:15,True,True
2018-05-06T18:02:50,show dogs and snow dogs wow!!!,0,0,Loki.and.Chance.agility dog,ogpTTHLprFs,0.1953125,2018-05-06 18:02:50,True,True
2018-05-06T23:00:59,This trailer made me laugh so hard I have tears coming down my face,0,0,Josh Taylor,ogpTTHLprFs,-0.049074074074074096,2018-05-06 23:00:59,True,True
2018-05-07T00:42:05,It was a flop when it first came out in 2002. It will flop now.,0,1,Mojado,ogpTTHLprFs,0.25,2018-05-07 00:42:05,True,True
2018-05-07T02:19:32,"Will arnett needs a paycheck,: the movie",0,0,Penguin Fred,ogpTTHLprFs,0.0,2018-05-07 02:19:32,True,True
2018-05-07T03:01:50,"Ahhhhh I wanted to love this but it looks so bad! Check out ""Chicken People"" instead. It's a documentary about people who breed and show purebred chickens. Its flipping hilarious... and totally true",0,0,Esther Faludi,ogpTTHLprFs,-0.020833333333333297,2018-05-07 03:01:50,True,True
2018-05-07T21:10:07,"At first for our end of year field trip, we were gonna watch Solo, a Star Wars Film. Then, they changed it because of beliefs. stupid right??? Then, we were able to watch Avengers Infinity War. Everyone was exited! They got the forms all ready. But, one teacher saw it and said it was “too violent, and lots of swearing.” And then parents complained. So now our teacher made an announcement we were watching Show Dogs. Never heard of it, so I looked up the trailer. It looks kind of funny, but anyways, thanks stupid parents. JUST PUT YOUR KIDS IN A CHURCH  SCHOOL THEN!!!!!!",1,0,ItzPolar,ogpTTHLprFs,-0.04448051948051948,2018-05-07 21:10:07,True,True
2018-05-07T21:27:04,"oh Will, you are breaking my heart :'(",2,0,extenebrislux,ogpTTHLprFs,-1.0,2018-05-07 21:27:04,True,True
2018-05-07T21:46:01,"It's like the Emoji Movie mixed with Cats & Dogs, and the two Scooby-Doo movies. This movie is really going to be bad. I just know it. It would be better off coming out on DVD instead of having a theatrical release.",2,1,GJYYNGII,ogpTTHLprFs,3.3306690738754695e-17,2018-05-07 21:46:01,True,True
2018-05-08T00:44:41,I thought we evolved from movies like these :/,0,0,OverLord Of Kek,ogpTTHLprFs,-0.25,2018-05-08 00:44:41,True,True
2018-05-08T04:22:00,Rupaul is that you,0,0,Danyelle Ealey,ogpTTHLprFs,0.0,2018-05-08 04:22:00,True,True
2018-05-08T06:15:45,Can’t wait 😍❤️,0,0,GRIMM_SIMMER,ogpTTHLprFs,0.0,2018-05-08 06:15:45,True,True
2018-05-08T06:42:26,Please be the spiritual successor to Nine Lives.,0,0,Scott Martinez,ogpTTHLprFs,0.0,2018-05-08 06:42:26,True,True
2018-05-08T12:35:41,Why would they make a movie with Dabs???,1,0,giovanni larrayoz,ogpTTHLprFs,0.0,2018-05-08 12:35:41,True,True
2018-05-08T14:31:37,"It's just not the same, nobody makes good movies anymore.",2,0,Love is the most powerful force in the Universe,ogpTTHLprFs,0.35,2018-05-08 14:31:37,True,True
2018-05-08T23:19:00,Saw this on tv and it looked so bad i had to see other peoples opinions of it,0,0,Fum,ogpTTHLprFs,-0.4124999999999999,2018-05-08 23:19:00,True,True
2018-05-09T00:16:32,Cinematic gold,0,0,jimmy pawlowski,ogpTTHLprFs,0.0,2018-05-09 00:16:32,True,True
2018-05-09T00:43:05,I can't wait to see the movie,0,0,gd esoph,ogpTTHLprFs,0.0,2018-05-09 00:43:05,True,True
2018-05-09T01:03:56,"This looks like trash.... *picks up phone, whispering* Hello, uh, Fandango? Yeah I'd like to purchase one ticket to Show Dogs, I have some reward points from the 50 shades trilogy tickets...",0,0,JM FILMS,ogpTTHLprFs,0.0,2018-05-09 01:03:56,True,True
2018-05-09T04:22:43,My god...,1,0,Glasra,ogpTTHLprFs,0.0,2018-05-09 04:22:43,True,True
2018-05-09T14:02:59,*god left*,5,0,- King -,ogpTTHLprFs,0.0,2018-05-09 14:02:59,True,True
2018-05-09T20:23:05,Bro win,0,0,Liz Carbonell,ogpTTHLprFs,0.8,2018-05-09 20:23:05,True,True
2018-05-10T01:44:46,"When Show Dogs releases two days after Deadpool 2:   Mr Deadpool, I don't feel so good...",15,0,warc9,ogpTTHLprFs,0.7,2018-05-10 01:44:46,True,True
2018-05-10T03:40:41,I don't think I've ever felt this embarrassed to see a movie trailer like this in theaters 😰,0,0,TrueBlueProductions,ogpTTHLprFs,0.0,2018-05-10 03:40:41,True,True
2018-05-10T14:45:17,hahhahaha,0,0,Vex The dog,ogpTTHLprFs,0.0,2018-05-10 14:45:17,True,True
2018-05-10T15:04:47,I thought we stopped making trash movies like these in 2012,4,0,Keagan Farrell,ogpTTHLprFs,0.0,2018-05-10 15:04:47,True,True
2018-05-10T19:34:44,I can see Chris Stuckmann burning his ticket to this. And giving it an F.,2,0,Reagan DeFriece,ogpTTHLprFs,0.0,2018-05-10 19:34:44,True,True
2018-05-11T03:55:45,I have cancer now,3,0,br000000000000oooooooooo,ogpTTHLprFs,0.0,2018-05-11 03:55:45,False,True
2018-05-11T05:15:45,People think this is gonna be awful I think it looks amazing oh wait people think the smurfs is a bad movie well now I get why there dumb,0,0,awsome dude cool man,ogpTTHLprFs,-0.3687499999999999,2018-05-11 05:15:45,False,True
2018-05-11T16:48:26,You should have stayed away after Smurfs Raja,1,0,UltraEpicLeader100 2.0,ogpTTHLprFs,0.0,2018-05-11 16:48:26,False,True
2018-05-11T17:12:16,Isn't this one of those stupid fake parody trailers before Tropic Thunder? Please tell me it is,1,0,TR-CAP,ogpTTHLprFs,-0.6499999999999999,2018-05-11 17:12:16,False,True
2018-05-11T21:02:38,I love the RotWiler ❤️❤️❤️❤️,0,0,**Im Wolfy**,ogpTTHLprFs,0.5,2018-05-11 21:02:38,False,True
2018-05-12T12:21:44,Hey! MY BIRTHDAY IS MAY 18 !!!,0,0,Samira Khusniddinov,ogpTTHLprFs,0.0,2018-05-12 12:21:44,False,True
2018-05-12T17:00:18,This looks terrible,2,0,Lillie Saga,ogpTTHLprFs,-1.0,2018-05-12 17:00:18,False,True
2018-05-12T17:04:19,"This looks ok , ah noooooooooooo!",1,0,Lil_Puff,ogpTTHLprFs,0.625,2018-05-12 17:04:19,False,True
2018-05-13T00:25:28,Hehehe this is awesome i cnat wait to watch ir,1,0,Ailz Gaming,ogpTTHLprFs,1.0,2018-05-13 00:25:28,False,True
2018-05-13T17:49:10,Well I'm done here (ノಠ益ಠ)ノ彡┻━┻,0,0,Smitten Werbenjagermanjensen,ogpTTHLprFs,0.0,2018-05-13 17:49:10,False,True
2018-05-13T23:22:19,This is terrible,0,0,Joshua Gonzalez,ogpTTHLprFs,-1.0,2018-05-13 23:22:19,False,True
2018-05-14T04:25:42,*God has left the game chat*,1,2,Your mom sucks booty hole 123,ogpTTHLprFs,-0.2,2018-05-14 04:25:42,False,True
2018-05-14T13:21:52,"I really don't wanna see another talking animal movie, but... that was Rupaul.... shante I stay :(",0,0,Richie,ogpTTHLprFs,-0.275,2018-05-14 13:21:52,False,True
2018-05-14T21:34:55,"The dab and bikini wax joke was so cringey, pls stop and get some help.",2,0,Rayxz,ogpTTHLprFs,0.0,2018-05-14 21:34:55,False,True
2018-05-14T22:59:05,It makes me mad that people in this comment box are hating on the people that want to go and see the movie. Just because you hate something doesn't mean that everybody else should.,2,1,Alejandro González aka Minty the Lamb Wolf,ogpTTHLprFs,-0.5791666666666667,2018-05-14 22:59:05,False,True
2018-05-15T01:47:15,What is that song called,0,0,Nancy Zamorano,ogpTTHLprFs,0.0,2018-05-15 01:47:15,False,True
2018-05-15T04:02:28,Why was RuPaul’s name not shown alongside everyone else’s?,1,0,orbital151,ogpTTHLprFs,0.0,2018-05-15 04:02:28,False,True
2018-05-15T14:53:39,I hope this film lives up to the hype!,0,0,Eddie The Enjoyer,ogpTTHLprFs,0.0,2018-05-15 14:53:39,False,True
2018-05-15T18:01:02,Yes very good 10/10,0,0,This Exist,ogpTTHLprFs,0.9099999999999999,2018-05-15 18:01:02,False,True
2018-05-15T20:36:10,"You know, there’s a reason animation companies like Disney, Dreamworks, and Pixar have lasted this long. Because they actually respect children and adults alike, and don’t insert pop culture references that’ll be dated in less than a year. Show Dogs will be a forgotten film, simply left to rot in bargain bins because hopefully no one will remember its existence. I plead for parents to instead take their children to see the Incredibles next month, and I guarantee both age groups will have a far better experience. Or, if you prefer a better pet movie thats out this month, Isle of Dogs is the greater choice.",2,2,Luckyrabbit 1927,ogpTTHLprFs,0.1537037037037037,2018-05-15 20:36:10,False,True
2018-05-15T22:39:33,Deadpool.  Kill it,2,0,DJ Wolf Movie Reviews,ogpTTHLprFs,0.0,2018-05-15 22:39:33,False,True
2018-05-16T01:02:49,This is going to be the worst movie ever,0,0,Kenny The Wolf,ogpTTHLprFs,-1.0,2018-05-16 01:02:49,False,True
2018-05-16T03:00:04,Am I the only one that wants to watch this movie ironically?,0,0,Screwball Protagonist,ogpTTHLprFs,0.1,2018-05-16 03:00:04,False,True
2018-05-16T04:39:40,Only going to watch this because a Rottweiler is the finally/rarely being portrayed as a good boy💕,0,0,Jenesi García,ogpTTHLprFs,0.35,2018-05-16 04:39:40,False,True
2018-05-16T04:44:14,These people only did the cringy dab scene for money,2,7,josy Pass,ogpTTHLprFs,0.0,2018-05-16 04:44:14,False,True
2018-05-16T18:24:05,Me: *I hate dogs* Watches Trailer Me: *I still hate dogs*,1,0,Black Cat 1598,ogpTTHLprFs,-0.8,2018-05-16 18:24:05,False,True
2018-05-16T18:27:45,IHE is in for a real treat.,2,0,terrible trends,ogpTTHLprFs,0.2,2018-05-16 18:27:45,False,True
2018-05-16T18:49:37,Youwill6th,0,0,Quesha Smith,ogpTTHLprFs,0.0,2018-05-16 18:49:37,False,True
2018-05-16T20:13:55,I smell a Razzie!,1,0,Carly Quinn,ogpTTHLprFs,0.0,2018-05-16 20:13:55,False,True
2018-05-17T00:08:44,Guys It’s Just A Movie Don’t Make Fun Of It,0,0,Moon Vibez,ogpTTHLprFs,0.3,2018-05-17 00:08:44,False,True
2018-05-17T00:58:49,2003 wants its movie back.,5,0,Farhan Marco,ogpTTHLprFs,0.1,2018-05-17 00:58:49,False,True
2018-05-17T01:27:56,love show dog😂😂😚😚😙,0,0,Phillip Hampton,ogpTTHLprFs,0.5,2018-05-17 01:27:56,False,True
2018-05-17T01:35:25,I like cats fck u,0,0,David Flores,ogpTTHLprFs,0.0,2018-05-17 01:35:25,False,True
2018-05-17T03:05:09,I am losing faith in humanity and animals too,1,0,YallGotZingZonged,ogpTTHLprFs,0.0,2018-05-17 03:05:09,False,True
2018-05-17T04:44:36,Trailers still use the voice over guys,0,0,Craig Jones,ogpTTHLprFs,0.0,2018-05-17 04:44:36,False,True
2018-05-17T04:55:57,...........why,5,0,Killerwhale 6011,ogpTTHLprFs,0.0,2018-05-17 04:55:57,False,True
2018-05-17T13:39:44,I want to see this,0,0,Peggy Smyth,ogpTTHLprFs,0.0,2018-05-17 13:39:44,False,True
2018-05-17T21:00:33,Straight to DVD,0,0,DreamWeaver85,ogpTTHLprFs,0.2,2018-05-17 21:00:33,False,True
2018-05-17T23:23:08,When we went to see Avengers Infinity War I couldn't believe that about 35 people lined up to see this...,0,0,Anything Film Fan,ogpTTHLprFs,0.0,2018-05-17 23:23:08,False,True
2018-05-18T00:43:03,Yaaaassss MaMa Rupaul,0,0,Larsen Fierce,ogpTTHLprFs,0.0,2018-05-18 00:43:03,False,True
2018-05-18T01:43:25,Ready.....Set......Terrible,0,0,Dick Johnson,ogpTTHLprFs,0.0,2018-05-18 01:43:25,False,True
2018-05-18T02:41:14,Didn’t these kind of movies die off like 15 years ago?,0,0,Jack Javko,ogpTTHLprFs,0.6,2018-05-18 02:41:14,False,True
2018-05-18T03:23:32,Se miran bien mierdas los. CGI,0,0,Manuel Sandoval,ogpTTHLprFs,0.0,2018-05-18 03:23:32,False,True
2018-05-18T04:12:45,RuPaul why did you think this was a good idea?,0,0,Leto,ogpTTHLprFs,0.7,2018-05-18 04:12:45,False,True
2018-05-18T05:19:49,I'm going to see it and I think it will be good for a laugh and quality family time with my daughter...so I guess I will be different than most of you others with your negative comments....,0,0,Terry Hudgens,ogpTTHLprFs,0.24,2018-05-18 05:19:49,False,True
2018-05-18T10:20:03,Por fin un papel que encaja Perfecto para Omar de animal.,0,0,Libra Ochoa,ogpTTHLprFs,0.0,2018-05-18 10:20:03,False,True
2018-05-18T11:15:09,RUPAUL,0,0,audrey çooch,ogpTTHLprFs,0.0,2018-05-18 11:15:09,False,True
2018-05-18T11:43:34,What's up Dog😂It looks great!!!🐶,0,0,Pamela Maloy,ogpTTHLprFs,0.0,2018-05-18 11:43:34,False,True
2018-05-18T12:07:47,every one is haters,0,0,Yung Doughboy,ogpTTHLprFs,0.0,2018-05-18 12:07:47,False,True
2018-05-18T16:13:04,CANCER! (I think I'm a cat person now),0,0,Cody Boklap,ogpTTHLprFs,0.0,2018-05-18 16:13:04,False,True
2018-05-18T16:17:00,is it sad that I showed this crap to my brother and he thought it was a joke,0,0,Cody Boklap,ogpTTHLprFs,-0.65,2018-05-18 16:17:00,False,True
2018-05-18T19:32:15,Omg lmfao,0,0,Millies Cattailes,ogpTTHLprFs,0.0,2018-05-18 19:32:15,False,True
2018-05-18T20:32:04,Was this film made twenty years ago and only recently found in a dumpster? Because it should have been left there.,0,0,SuperDevolution,ogpTTHLprFs,0.0,2018-05-18 20:32:04,False,True
2018-05-18T20:53:58,This is like 15 years late to the party.,0,0,Melralis,ogpTTHLprFs,-0.3,2018-05-18 20:53:58,False,True
2018-05-18T22:23:19,Today I'm watching show dogs i'm excited for show dogs on may18,0,1,The Adventures hippo and freddy Game on,ogpTTHLprFs,0.375,2018-05-18 22:23:19,False,True
2018-05-19T03:25:44,"If the creators commented on their vids, I would criticize them so much for the dab.",0,0,josy Pass,ogpTTHLprFs,0.2,2018-05-19 03:25:44,False,True
2018-05-19T05:25:57,the fluffy has failed me,0,0,Skewy,ogpTTHLprFs,-0.35,2018-05-19 05:25:57,False,True
2018-05-19T06:29:24,Ru? RU IS THAT U??? 😂thats awesome thats she's in there,0,0,Rubee_thedutchiewicker TFF,ogpTTHLprFs,1.0,2018-05-19 06:29:24,False,True
2018-05-19T08:25:02,Tequila and Benetti reboot?!,0,0,Johnny Burnes,ogpTTHLprFs,0.0,2018-05-19 08:25:02,False,True
2018-05-19T12:39:54,Wow fart jokes and a dab this move is going to be horrible,0,0,DudDud ___,ogpTTHLprFs,-0.45,2018-05-19 12:39:54,False,True
2018-05-19T13:04:52,This is living cancer. Please kill it.,0,0,mcrjellyfish,ogpTTHLprFs,0.0,2018-05-19 13:04:52,False,True
2018-05-19T14:33:44,Why does cats and dogs look better then this?,0,0,Wayne Hays,ogpTTHLprFs,0.5,2018-05-19 14:33:44,False,True
2018-05-19T14:48:33,"WILL ARNETT WHAT ARE YOU DOING? FIRST THE NUT JOB, NOW THIS? STOP MAKING POOR DECISIONS BOJACK!",0,0,natalie,ogpTTHLprFs,-0.125,2018-05-19 14:48:33,False,True
2018-05-19T15:36:46,:O,0,0,FireFlamehing,ogpTTHLprFs,0.05,2018-05-19 15:36:46,False,True
2018-05-19T16:49:55,I’m just here for the comments. And they did not disappoint. 😂,0,0,Berlin Ballroom,ogpTTHLprFs,0.0,2018-05-19 16:49:55,False,True
2018-05-19T16:57:06,It's funny how all the dogs lowered their tails at once,0,0,Chris Hansche,ogpTTHLprFs,0.25,2018-05-19 16:57:06,False,True
2018-05-19T17:59:27,I don’t like this because imagine how the animals are treated and what the have to put on the for the movie to make it look like they’re talking  Btw I love animals and if you go to the universal theme park and watch animal actors ( this is from a first hand account and this is my opinion and observations ) they look really tiered and I feel bad for them also I know this is very long and plz don’t sue me this is my opinion not facts and this was written by a 12yo commenting this on a Saturday so leave your opinions in the reply section,2,1,SlowlyLosingMySanity O-o,ogpTTHLprFs,0.03083333333333335,2018-05-19 17:59:27,False,True
2018-05-19T19:45:46,I wanna go see this!’   So I can laugh at how bad it is!,1,0,ThatOneGuy59,ogpTTHLprFs,-0.28749999999999987,2018-05-19 19:45:46,False,True
2018-05-19T20:50:00,Seeing the movie tomorrow,0,0,Joey Channel TV,ogpTTHLprFs,0.0,2018-05-19 20:50:00,False,True
2018-05-19T22:22:23,K,0,0,Ronnie Dennis,ogpTTHLprFs,0.0,2018-05-19 22:22:23,False,True
2018-05-19T23:56:19,I heart Rottweilers ❤️❤️,0,0,Sofiya Eaton,ogpTTHLprFs,0.0,2018-05-19 23:56:19,False,True
2018-05-20T00:38:12,Love. It,0,0,Samorrow Girard,ogpTTHLprFs,0.5,2018-05-20 00:38:12,False,True
2018-05-20T04:14:25,NOOOOOOOO NO NO NO NOOOOO,0,0,SnackerMCracker2,ogpTTHLprFs,0.0,2018-05-20 04:14:25,False,True
2018-05-20T07:11:09,"This is just atrotious. Kids at my school love emojis,while I’m the only one who hates them. Now,this is going to be the next Emoji Movie.",0,1,Ya Boi Nick,ogpTTHLprFs,0.16666666666666666,2018-05-20 07:11:09,False,True
2018-05-20T10:52:44,I saw this move yerstday it was good,0,0,John Pearson,ogpTTHLprFs,0.7,2018-05-20 10:52:44,False,True
2018-05-20T18:20:03,love  it,0,0,Joey Channel TV,ogpTTHLprFs,0.5,2018-05-20 18:20:03,False,True
2018-05-20T19:33:17,*Ze Toylate Wautea* that’s what it sounded like to me😂😂,0,0,• Jane Ives •,ogpTTHLprFs,0.0,2018-05-20 19:33:17,False,True
2018-05-21T01:15:19,*watches this* WHERE THE HELL IS MY FLAMETHROWER,1,0,Sam,ogpTTHLprFs,0.0,2018-05-21 01:15:19,False,True
2018-05-21T01:29:16,"This will be the next emoji movie, I'm calling it rn",0,0,BeserkUGS Sunbro,ogpTTHLprFs,0.0,2018-05-21 01:29:16,False,True
2018-05-21T02:42:15,I don’t see anything wrong with this movie..you guys are just judging the movie from it’s trailer. Really uncool.,0,0,Rachel Tweeten,ogpTTHLprFs,-0.15,2018-05-21 02:42:15,False,True
2018-05-21T03:18:31,Can't wait to see this,0,0,Emily Kennedy,ogpTTHLprFs,0.0,2018-05-21 03:18:31,False,True
2018-05-21T03:56:02,RUPAUL,0,0,Kye Kyedashian,ogpTTHLprFs,0.0,2018-05-21 03:56:02,False,True
2018-05-21T04:14:10,I actually saw the movie today and was very impressed. I had the same thought as most of you. But you can't judge a book by its cover. It just showed clips that were childish but had way more to show during the movie.,2,2,Atalia Lee,ogpTTHLprFs,0.3,2018-05-21 04:14:10,False,True
2018-05-21T09:46:18,Do I hate myself enough to watch this ?,0,0,Cole vs The World,ogpTTHLprFs,-0.4,2018-05-21 09:46:18,False,True
