timestamp,text,like_count,reply_count,author,trailer_id,sentiment_score,datetime,used_for_model,used_for_visualization
2016-04-21T23:00:34,Splended,0,0,Nebo,v71ce1Dqqns,0.0,2016-04-21 23:00:34,True,True
2016-04-21T23:06:50,This is where it started for me  this is where it ends,0,0,Mr. Aquarius,v71ce1Dqqns,0.0,2016-04-21 23:06:50,True,True
2016-04-21T23:08:08,When will the movie of Bourne and Cross together come out? Btw this looks awesome,0,0,Ty Fire,v71ce1Dqqns,0.5,2016-04-21 23:08:08,True,True
2016-04-21T23:10:47,"i made the new breed of bond movies, i was the one who inspired action sequences of thousands of movies across the globe... leave me alone and don't mess with me..Bourne",0,0,arunv44,v71ce1Dqqns,0.020454545454545458,2016-04-21 23:10:47,True,True
2016-04-21T23:24:02,"Wow, even I felt that punch. He dropped that guy quicker than my like on this video!",5,0,100 jt,v71ce1Dqqns,0.125,2016-04-21 23:24:02,True,True
2016-04-21T23:29:01,"Why do they keep giving these movies to Paul Greengrass?!  Now all the action scenes will be shaky-cam, jump-cut messes.",0,0,Mayhemm007,v71ce1Dqqns,0.1,2016-04-21 23:29:01,True,True
2016-04-21T23:32:54,We all know how it's going to end..   BWEEEE BWEEEE,0,0,JamCheesy,v71ce1Dqqns,0.0,2016-04-21 23:32:54,True,True
2016-04-21T23:36:12,My name's Bourne. Jason Bourne,0,0,Israel Aguasanta,v71ce1Dqqns,0.0,2016-04-21 23:36:12,True,True
2016-04-21T23:53:17,Leonardo dicaprio  brother,0,0,Nyctosa,v71ce1Dqqns,0.0,2016-04-21 23:53:17,True,True
2016-04-21T23:55:53,What is name movie theme song,0,0,محمد الهروبي,v71ce1Dqqns,0.0,2016-04-21 23:55:53,True,True
2016-04-21T23:59:38,I would stand in line for this.,0,0,BadSource,v71ce1Dqqns,0.0,2016-04-21 23:59:38,True,True
2016-04-22T00:00:35,one punch KO saitama vs matt,0,0,Ibnu Muttaqin,v71ce1Dqqns,0.0,2016-04-22 00:00:35,True,True
2016-04-22T00:01:21,I just realized that Bucky from Captain America is basically the Jason Bourne of Marvel.,0,1,Flash_Drive,v71ce1Dqqns,0.0,2016-04-22 00:01:21,True,True
2016-04-22T00:09:14,And see this is why you don't leave a guy on Mars you know it changes a guy into doing things....,0,0,JSB360,v71ce1Dqqns,0.0,2016-04-22 00:09:14,True,True
2016-04-22T00:12:26,I hope they didn't just show all of the BEST PARTS!!,0,0,Mark R. Dotson,v71ce1Dqqns,1.0,2016-04-22 00:12:26,True,True
2016-04-22T00:13:43,"Wow, just like the anime, ""One Punch Damon"". I think that's what it's called...",0,0,Jesse C,v71ce1Dqqns,0.1,2016-04-22 00:13:43,True,True
2016-04-22T00:19:09,Filipino martial Arts :),0,0,Isfer Monte,v71ce1Dqqns,0.25,2016-04-22 00:19:09,True,True
2016-04-22T00:24:42,I hope Jeremy Renner makes a cameo to link the films together.,0,0,Lee,v71ce1Dqqns,0.0,2016-04-22 00:24:42,True,True
2016-04-22T00:25:19,"Wish I could fight like Jason Bourne, POW PAW DHISOOM and all my enemies fell apart.",1,3,azam rami,v71ce1Dqqns,0.0,2016-04-22 00:25:19,True,True
2016-04-22T00:42:37,I love this.......and I love before 3 movies.........I waiting for this👍👍👍👍,0,0,Kassapa Bandara,v71ce1Dqqns,0.5,2016-04-22 00:42:37,True,True
2016-04-22T00:45:26,Alicia Vikander is so god-damn beautiful; OMG...,0,0,samus1421,v71ce1Dqqns,0.85,2016-04-22 00:45:26,True,True
2016-04-22T00:50:40,Alicia Vikander? I'll watch it.,0,0,Anne A.B.,v71ce1Dqqns,0.0,2016-04-22 00:50:40,True,True
2016-04-22T00:58:53,Mythbusters anyone? (Truck wedge),0,0,Justin Dyck,v71ce1Dqqns,0.0,2016-04-22 00:58:53,True,True
2016-04-22T01:18:01,Cool trailer and all but why did they show the scene with him punching the guy in the face twice?,0,0,even1313,v71ce1Dqqns,0.35,2016-04-22 01:18:01,True,True
2016-04-22T01:42:52,"Why does every Jason Bourne film seem like the same plot reused again and again? I enjoyed the first one enough, I just wish they would do something different that made them stand out more from each other.",0,0,Lilacsbloom,v71ce1Dqqns,0.16071428571428573,2016-04-22 01:42:52,True,True
2016-04-22T01:46:17,I'm back !,0,0,joaquinR1stargate,v71ce1Dqqns,0.0,2016-04-22 01:46:17,True,True
2016-04-22T02:17:25,Jason Bourne: Wolverine,0,0,Fruischian,v71ce1Dqqns,0.0,2016-04-22 02:17:25,True,True
2016-04-22T02:22:39,And Thanks to Damon's Comeback in Bourne Series ! The Legacy just a Spin-off already..,0,0,Naufal Muhammad Haiqal,v71ce1Dqqns,0.25,2016-04-22 02:22:39,True,True
2016-04-22T02:50:37,Being Solo,0,0,Ahmad Zaki Khairul Anuar,v71ce1Dqqns,0.0,2016-04-22 02:50:37,True,True
2016-04-22T02:52:38,"0:43 ""Could be worst than Snowden"", lol don't say that, the movie gonna be good.",0,0,aaaaaaaaaaaa808,v71ce1Dqqns,0.16666666666666666,2016-04-22 02:52:38,True,True
2016-04-22T03:02:38,"When he said 32 kills, I immediately realized that he is the carry in the team.",0,0,Shloeb,v71ce1Dqqns,0.0,2016-04-22 03:02:38,True,True
2016-04-22T03:18:36,Looks boring.,0,0,The Dapper Lynx,v71ce1Dqqns,-1.0,2016-04-22 03:18:36,True,True
2016-04-22T03:31:51,"Hell yes, Alicia Vikander",6,1,Wacky Weasel,v71ce1Dqqns,0.0,2016-04-22 03:31:51,True,True
2016-04-22T04:08:32,Por Dios otra vez lo mismo?,0,0,Carlos Castañeda Rivera,v71ce1Dqqns,0.0,2016-04-22 04:08:32,True,True
2016-04-22T04:18:44,This movie was bourne out of necessity for the fans of this franchise! Can't wait for it!,0,0,GameFaceClive,v71ce1Dqqns,0.0,2016-04-22 04:18:44,True,True
2016-04-22T04:26:52,"Jason comes back now and more dicks are coming after him, but this time he actually remembers stuff",0,0,combustinghandshakes,v71ce1Dqqns,0.16666666666666666,2016-04-22 04:26:52,True,True
2016-04-22T04:34:25,i miss the Bourne Ultimatum theme...,0,0,Diego Moyano,v71ce1Dqqns,0.0,2016-04-22 04:34:25,True,True
2016-04-22T04:44:58,I have been waiting for this movie since 2004. Thank God it's back.,6,0,NOT DOOMED,v71ce1Dqqns,0.0,2016-04-22 04:44:58,True,True
2016-04-22T05:18:03,"Finally, Julia Stiles gets more of a role! You know she's practically the only one besides Matt Damon who's in all of them? Excepting Legacy",0,0,LM22102,v71ce1Dqqns,0.20833333333333334,2016-04-22 05:18:03,True,True
2016-04-22T05:29:39,"Thats funny i got the ad which was the trailer then saw the trailer..... hmmm ""The Matrix""...",0,0,Phil,v71ce1Dqqns,0.25,2016-04-22 05:29:39,True,True
2016-04-22T05:41:11,Potatoes Scrolls V: Watney Mars Bourne,0,0,Peter Parakeet,v71ce1Dqqns,0.0,2016-04-22 05:41:11,True,True
2016-04-22T05:57:24,I 'd be damned..,0,0,AVINAV AARYAA,v71ce1Dqqns,0.0,2016-04-22 05:57:24,True,True
2016-04-22T06:06:03,"Did Bourne hit the same guy twice...and that guy didn't see that coming the second time, lol.",1,0,Steve Govea,v71ce1Dqqns,0.26666666666666666,2016-04-22 06:06:03,True,True
2016-04-22T06:14:31,that homie Vincent Cassel is in it ?! nice !,0,0,g lenk,v71ce1Dqqns,0.75,2016-04-22 06:14:31,True,True
2016-04-22T06:23:33,Shiiiit can't wait ;) looks like a same shit but i'll like it anyway. Can't wait to see T.L.J as antagonist,0,0,Raijin Damiano,v71ce1Dqqns,0.016666666666666663,2016-04-22 06:23:33,True,True
2016-04-22T06:32:51,Who saw the Civil War ad before this trailer?,0,0,Sy A,v71ce1Dqqns,0.0,2016-04-22 06:32:51,True,True
2016-04-22T06:36:26,"Matt Damon,  oh yea\",0,0,Sandra Pasanen,v71ce1Dqqns,0.0,2016-04-22 06:36:26,True,True
2016-04-22T06:52:07,"Жду...Хотя видно что уже постарел ""Борн"" :(",0,0,Дмитрий Стёпочкин,v71ce1Dqqns,-0.75,2016-04-22 06:52:07,True,True
2016-04-22T07:16:19,"Matt Damon!!!!!! Matt Damon, Matt Damon........💩👈",0,0,erik nydam,v71ce1Dqqns,0.0,2016-04-22 07:16:19,True,True
2016-04-22T07:23:51,"I can only think of one thing : Jason ""Saitama"" Bourne, one punch man",0,0,Quang Minh,v71ce1Dqqns,0.0,2016-04-22 07:23:51,True,True
2016-04-22T08:05:28,O boy. It's Jason Bourne. Hell begins now :D,0,0,Deeps N,v71ce1Dqqns,1.0,2016-04-22 08:05:28,True,True
2016-04-22T09:14:52,Bourne series - He doesn't know anything and everyone is chasing him. Jason Bourne - He knows everything and everyone is chasing him.,4,0,Yatharth sharma,v71ce1Dqqns,0.0,2016-04-22 09:14:52,True,True
2016-04-22T09:56:39,"Poor black guy, Bourne punched him out twice. x_x",0,0,K41 105,v71ce1Dqqns,-0.2833333333333333,2016-04-22 09:56:39,True,True
2016-04-22T11:01:31,a armour truck can do ninja please 😒,0,0,pmc pmc,v71ce1Dqqns,0.0,2016-04-22 11:01:31,True,True
2016-04-22T11:05:44,OH COME ON!....Crashing a car into a casino?? is this really Jason Bourne? Shit looks like some cheap imitation of mission impossible! Well done hollywood idiots for destroying the trademark strictly hardcore fist-fight style of the series!,4,1,hmmm,v71ce1Dqqns,-0.23095238095238096,2016-04-22 11:05:44,True,True
2016-04-22T12:00:31,paul greengrass you beauty,0,0,Aamir Shah,v71ce1Dqqns,0.0,2016-04-22 12:00:31,True,True
2016-04-22T12:33:23,I have goosebumps right now,0,0,Nikhil Singh,v71ce1Dqqns,0.2857142857142857,2016-04-22 12:33:23,True,True
2016-04-22T12:34:03,"0:45 why would they have a folder named ""Black ops""?",0,0,Rami Escalante,v71ce1Dqqns,-0.16666666666666666,2016-04-22 12:34:03,True,True
2016-04-22T12:43:31,yeah!!!!,0,0,Rabin Lama,v71ce1Dqqns,0.0,2016-04-22 12:43:31,True,True
2016-04-22T12:53:08,finally the real jason bourne is  back,0,0,mynard,v71ce1Dqqns,0.06666666666666667,2016-04-22 12:53:08,True,True
2016-04-22T13:20:10,What is he doing in Greece.? o.O,0,0,Ska Lee,v71ce1Dqqns,0.05,2016-04-22 13:20:10,True,True
2016-04-22T13:26:57,"Damascus, Athens, Vegas... nice",2,0,Greg Sparrow,v71ce1Dqqns,0.6,2016-04-22 13:26:57,True,True
2016-04-22T13:53:02,YES!!!,0,0,HighPlainsDrifter,v71ce1Dqqns,0.0,2016-04-22 13:53:02,True,True
2016-04-22T13:55:26,"That KO is so good, that they showed it twice.",0,0,Krillemy P,v71ce1Dqqns,0.7,2016-04-22 13:55:26,True,True
2016-04-22T14:03:40,"1:39 is it me or is he clearly passed the cable, then it cuts to him catching it?",0,0,TheNathan1287,v71ce1Dqqns,0.35,2016-04-22 14:03:40,True,True
2016-04-22T14:25:13,Dayuuummmm!!!!,0,0,DILLIP MOHANTY,v71ce1Dqqns,0.0,2016-04-22 14:25:13,True,True
2016-04-22T15:14:26,"Was I the only person that thought when he said ""Tell me"" he was going to say ""do you bleed"" afterwards.",1,1,Sy A,v71ce1Dqqns,0.0,2016-04-22 15:14:26,True,True
2016-04-22T15:42:38,Braavo!!!!,0,0,Prashant Singh,v71ce1Dqqns,0.0,2016-04-22 15:42:38,True,True
2016-04-22T15:46:37,escaped from Mars and now he has returned....,0,0,Abadahayy,v71ce1Dqqns,0.0,2016-04-22 15:46:37,True,True
2016-04-22T16:36:28,Can't wait to see another FMA fight scene,0,0,Bert Without Ernie,v71ce1Dqqns,0.0,2016-04-22 16:36:28,True,True
2016-04-22T16:49:32,"""Bourne have you ever heard of the other soldier ... RAMBO""",1,0,Ricky,v71ce1Dqqns,-0.125,2016-04-22 16:49:32,True,True
2016-04-22T16:56:40,Now that's a punch,0,0,Chanaka Weerasinghe,v71ce1Dqqns,0.0,2016-04-22 16:56:40,True,True
2016-04-22T17:00:56,I don't care if it is good or bad.. it looks Badass and Jason Bourne is back,1,0,root8ble,v71ce1Dqqns,3.700743415417188e-17,2016-04-22 17:00:56,True,True
2016-04-22T17:05:23,1:29 remind me bucky in civil war trailer.,0,0,Ashok Rao,v71ce1Dqqns,0.0,2016-04-22 17:05:23,True,True
2016-04-22T17:36:06,The Bourne Fugitive,0,0,E Johnson,v71ce1Dqqns,0.0,2016-04-22 17:36:06,True,True
2016-04-22T17:58:13,always best,0,0,Nghia Vũ,v71ce1Dqqns,1.0,2016-04-22 17:58:13,True,True
2016-04-22T18:04:33,"He can't remember a thing, no potato crop lesson",0,0,Mus Ardhianto,v71ce1Dqqns,0.0,2016-04-22 18:04:33,True,True
2016-04-22T21:19:43,"""Then what am I?"" ""My dear, it's so obvious. You ARE JOHN CENA!!!!!!!!!!!!!!!""",6,0,Isley Jean-Pierre,v71ce1Dqqns,0.0,2016-04-22 21:19:43,True,True
2016-04-22T21:24:37,AWESOME,0,0,nama chakraborthy,v71ce1Dqqns,1.0,2016-04-22 21:24:37,True,True
2016-04-22T21:26:14,tommy lee jones looks old as hell,0,0,Sanjib Thakuria,v71ce1Dqqns,0.1,2016-04-22 21:26:14,True,True
2016-04-22T21:27:18,omg omg.. waiting you jason,0,0,Revina Rosandi,v71ce1Dqqns,0.0,2016-04-22 21:27:18,True,True
2016-04-22T21:54:00,"""I'm not gonna do another Bourne sequel unless the money is good... script!, I mean, the script is good, yeah, that's what I mean.""",1,0,Kuddos Feher,v71ce1Dqqns,0.2375,2016-04-22 21:54:00,True,True
2016-04-22T22:12:54,Man this looks good.,0,0,Josh,v71ce1Dqqns,0.7,2016-04-22 22:12:54,True,True
2016-04-22T22:15:14,Jason Bourne> James Bond> Ethan Hunt,4,0,Alex Townsend,v71ce1Dqqns,0.0,2016-04-22 22:15:14,True,True
2016-04-22T23:28:52,apparently going to be a fail.  the trilogy was perfect. those producers just couldn't resist the seduction of money,0,0,Touchetee,v71ce1Dqqns,0.18333333333333335,2016-04-22 23:28:52,True,True
2016-04-22T23:34:54,"He's seen things, he knows things, what if he's not coming for us , what if it's...     Jimmy kimmel",0,0,Allo Es Me Sam,v71ce1Dqqns,0.0,2016-04-22 23:34:54,True,True
2016-04-22T23:45:57,I go,0,0,FM Fábrica de Mods,v71ce1Dqqns,0.0,2016-04-22 23:45:57,True,True
2016-04-22T23:48:05,I am so seeing this movie!,0,0,Hilary Benoit,v71ce1Dqqns,0.0,2016-04-22 23:48:05,True,True
2016-04-23T00:12:00,"Never thought id say it, but Renners ""Aaron Cross"" was way better than Bourne.",0,5,Lullaby,v71ce1Dqqns,0.25,2016-04-23 00:12:00,True,True
2016-04-23T00:59:02,"when Bourne says ""tell me""..",0,0,wall lauWei,v71ce1Dqqns,0.0,2016-04-23 00:59:02,True,True
2016-04-23T01:11:27,Ha ha ha,0,0,jaime Racey,v71ce1Dqqns,0.0,2016-04-23 01:11:27,True,True
2016-04-23T01:56:20,What happened to his potatoes back in Mars? I am sure he has not forgotten about them.,0,0,DAVID DARLING,v71ce1Dqqns,0.25,2016-04-23 01:56:20,True,True
2016-04-23T01:57:28,never mind he just killed innocent people in those cars.,0,0,Murky,v71ce1Dqqns,0.15,2016-04-23 01:57:28,True,True
2016-04-23T02:12:00,I like Jimmy Kimmel Live's version.,0,0,E P Ramos,v71ce1Dqqns,0.13636363636363635,2016-04-23 02:12:00,True,True
2016-04-23T03:45:11,Call them superhero movies gotta go there so overrated it's Jason Bourne time!,0,0,Mike Harris,v71ce1Dqqns,0.0,2016-04-23 03:45:11,True,True
2016-04-23T03:53:03,hell yeah!!!!,0,0,Carla Souza,v71ce1Dqqns,0.0,2016-04-23 03:53:03,True,True
2016-04-23T04:33:33,Gun shots and punches synchronized with music!!! Yeahhhhhh!!!,0,0,Deep Tech Underground,v71ce1Dqqns,0.0,2016-04-23 04:33:33,True,True
2016-04-23T05:12:34,"Oh, yeah...",0,0,Qingkun SU,v71ce1Dqqns,0.0,2016-04-23 05:12:34,True,True
2016-04-23T05:48:02,"Looks awesome, but story wise you wouldn't think there is more to be explored by the life of Jason Bourne. Maybe link him together to Aaron Cross (Jeremy Renner). Ultimatum pretty much closed the gap and cut ties, even left and open ending to let us decide if he had died or not. Now they are going to have to repeat that process all over again.",0,0,Kyle V.,v71ce1Dqqns,0.29375,2016-04-23 05:48:02,True,True
2016-04-23T08:31:02,WELCOME BACK BITCHES,0,0,Ambassador of Corruption,v71ce1Dqqns,0.4,2016-04-23 08:31:02,True,True
2016-04-23T08:47:40,Whats with thoose 9gag jokes in comments?,0,0,Memsandr Memtoshek,v71ce1Dqqns,0.0,2016-04-23 08:47:40,True,True
2016-04-23T10:03:39,Idon't care if it's any good or bad I'm just going watch this movie. coz Matt is back.,0,0,mr. anything,v71ce1Dqqns,3.700743415417188e-17,2016-04-23 10:03:39,True,True
2016-04-23T10:19:15,i waiting this film very much,0,0,Content 4You,v71ce1Dqqns,0.26,2016-04-23 10:19:15,True,True
2016-04-23T10:39:10,and i thought they had squeezed every bit of story from the series.  what next  Jason's dog ?,0,0,Rohan,v71ce1Dqqns,0.0,2016-04-23 10:39:10,True,True
2016-04-23T10:54:48,Absolutely Fantastic. Eagerly awaiting its release .,0,0,Keyumars Irani,v71ce1Dqqns,0.4,2016-04-23 10:54:48,True,True
2016-04-23T12:17:49,Just had an advert which was the trailer to this 😂,0,0,Alex Townsend,v71ce1Dqqns,0.0,2016-04-23 12:17:49,True,True
2016-04-23T13:53:51,"What happened to Jeremy Renner, is his storyline dead?",1,1,DaLeadBull,v71ce1Dqqns,-0.2,2016-04-23 13:53:51,True,True
2016-04-23T15:19:03,and oscar goes toooooo ...,0,0,YAKUP AKTAS,v71ce1Dqqns,0.0,2016-04-23 15:19:03,True,True
2016-04-23T15:50:00,This film is better than Specter 007,6,1,Agent 47,v71ce1Dqqns,0.5,2016-04-23 15:50:00,True,True
2016-04-23T15:55:23,The same director with his shaky camera work....terrible.,0,0,sammy bore,v71ce1Dqqns,-0.16666666666666666,2016-04-23 15:55:23,True,True
2016-04-23T16:02:23,so basically the exact same plot as Bourne Ultimatum,0,1,IloveBaklava,v71ce1Dqqns,0.125,2016-04-23 16:02:23,True,True
2016-04-23T16:19:52,"""Jason Bourne it's Jesus Christ.""",0,0,MarcusAurelius,v71ce1Dqqns,0.0,2016-04-23 16:19:52,True,True
2016-04-23T16:21:21,He has a 32 KD.,0,0,MarcusAurelius,v71ce1Dqqns,0.0,2016-04-23 16:21:21,True,True
2016-04-23T16:22:39,Who'd win Jason Bourne or Aaron cross? Whos better overall,0,1,Lost Under the Sky,v71ce1Dqqns,0.325,2016-04-23 16:22:39,True,True
2016-04-23T16:45:21,Looks like a music video for a trailer song.,0,0,Marcus B,v71ce1Dqqns,0.0,2016-04-23 16:45:21,True,True
2016-04-23T17:13:03,No poop potatoes?,1,0,Sam Lim,v71ce1Dqqns,0.0,2016-04-23 17:13:03,True,True
2016-04-23T17:24:35,earlier fighting scene is the new thing in the series,0,0,Yudha Bagaskara,v71ce1Dqqns,0.06818181818181818,2016-04-23 17:24:35,True,True
2016-04-23T18:04:34,YES YES YES !!!!!!!! YEAH !!!! He is back ! :D,0,0,Leckraj Sharma Teeluckdharry,v71ce1Dqqns,0.5,2016-04-23 18:04:34,True,True
2016-04-23T18:05:03,Alicia Vikander <3,0,0,kozumplikivan,v71ce1Dqqns,1.0,2016-04-23 18:05:03,True,True
2016-04-23T18:18:05,The movie would be better with Renner.,0,0,Vinh Nguyen,v71ce1Dqqns,0.5,2016-04-23 18:18:05,True,True
2016-04-23T18:39:19,my fav jason!!!,0,0,Infipark.com,v71ce1Dqqns,0.0,2016-04-23 18:39:19,True,True
2016-04-23T19:07:55,The Bourne movies were the best! This is just as awesome!,0,0,Alex Ox.,v71ce1Dqqns,1.0,2016-04-23 19:07:55,True,True
2016-04-23T19:07:59,bad ass,0,0,Pai meetei,v71ce1Dqqns,-0.6999999999999998,2016-04-23 19:07:59,True,True
2016-04-23T19:12:02,Where is Moby's  soundtrack ?,0,0,glucapir,v71ce1Dqqns,0.0,2016-04-23 19:12:02,True,True
2016-04-23T19:12:16,Omfg I just watched a 2 min advert just before watching this trailer 😂,0,0,Coolvas,v71ce1Dqqns,0.0,2016-04-23 19:12:16,True,True
2016-04-23T19:19:08,Finally..,0,0,Sajo D,v71ce1Dqqns,0.0,2016-04-23 19:19:08,True,True
2016-04-23T19:21:25,just watch someone make a controversial racial remark about the fight scene. 🤓waiting! ........,0,0,Martin Hernandez,v71ce1Dqqns,0.6875,2016-04-23 19:21:25,True,True
2016-04-23T20:48:13,For a split second I thought it was going to be that Rick Ashley video...,35,5,M.T.G,v71ce1Dqqns,0.0,2016-04-23 20:48:13,True,True
2016-04-23T20:53:40,lo mejor,0,0,RAMON R CANARIO R,v71ce1Dqqns,0.0,2016-04-23 20:53:40,True,True
2016-04-23T21:20:43,coolest fighter in movies is back,0,0,Like On,v71ce1Dqqns,0.0,2016-04-23 21:20:43,True,True
2016-04-23T23:09:41,Обязательно будем смотреть.,0,0,Юлия Алаева,v71ce1Dqqns,0.0,2016-04-23 23:09:41,True,True
2016-04-23T23:55:11,I just got a Jason Bourne trailer ad while trying to watch a Jason Bourne trailer,0,0,Tony Truong,v71ce1Dqqns,0.0,2016-04-23 23:55:11,True,True
2016-04-24T00:14:24,coming in july .......................wow.thee best ever sequel of holly wood.,0,0,Lakshmikanth R LAKSHMIKANTH,v71ce1Dqqns,1.0,2016-04-24 00:14:24,True,True
2016-04-24T00:18:20,great,0,0,Oleksandr Shchybun,v71ce1Dqqns,0.8,2016-04-24 00:18:20,True,True
2016-04-24T00:29:18,maaaaaaaaat daaaamon,1,1,John Neumonic,v71ce1Dqqns,0.0,2016-04-24 00:29:18,True,True
2016-04-24T02:37:57,Stupid Matt Damon made another stupid movie. - Jimmy Kimmel,0,0,Yukai Wang,v71ce1Dqqns,-0.7999999999999999,2016-04-24 02:37:57,True,True
2016-04-24T02:41:00,Another stupid Matt Damon movie.,0,0,Chin Chin,v71ce1Dqqns,-0.7999999999999999,2016-04-24 02:41:00,True,True
2016-04-24T03:05:38,"Bourne was the movie makes me love to watch Matt Damon in a film... and for the most importantly, it directed by Paul Greengrass! im excited!",0,0,Bozhestvo Smerti,v71ce1Dqqns,0.4921875,2016-04-24 03:05:38,True,True
2016-04-24T03:30:39,So happy they brought julia stiles character back in. She's awesome. Hope she learned to kick ass in all that time hiding.,1,0,Artemicion Kupo,v71ce1Dqqns,0.6,2016-04-24 03:30:39,True,True
2016-04-24T04:38:20,https://play.google.com/store/apps/details?id=com.app.app6c1c28c2cca9 social life. best google app puts facebok youtube twiitter instagram and other apps in one. now got space for pics,0,0,harvey G,v71ce1Dqqns,0.3027777777777778,2016-04-24 04:38:20,True,True
2016-04-24T04:43:05,Why are they advertising Jason Bourne when  m trying to watch the trailer for Jason  Bourne????,0,0,Hiro Okamura,v71ce1Dqqns,0.0,2016-04-24 04:43:05,True,True
2016-04-24T05:05:52,Where's Kevin Hart?,0,0,Hanvin Gavnah,v71ce1Dqqns,0.0,2016-04-24 05:05:52,True,True
2016-04-24T05:10:50,This movie is gonna be so badass by the time it hits theaters this summer of 2016.,0,0,William Hu,v71ce1Dqqns,0.0,2016-04-24 05:10:50,True,True
2016-04-24T06:24:53,I'm Waiting..,0,0,Varghese Mathew,v71ce1Dqqns,0.0,2016-04-24 06:24:53,True,True
2016-04-24T06:35:04,Did you see that 2.04,0,0,irahulzi,v71ce1Dqqns,0.0,2016-04-24 06:35:04,True,True
2016-04-24T06:56:39,hurray ! Welcome back,0,0,sumit,v71ce1Dqqns,0.4,2016-04-24 06:56:39,True,True
2016-04-24T07:23:56,comeback,0,0,Pankaj kumar Rana,v71ce1Dqqns,0.0,2016-04-24 07:23:56,True,True
2016-04-24T09:18:44,looking forwards to another quality action flick,4,0,xnx,v71ce1Dqqns,0.1,2016-04-24 09:18:44,True,True
2016-04-24T09:28:16,i'm always hoping there' s some romance between jason and niki,2,0,Peaceful Panda,v71ce1Dqqns,0.0,2016-04-24 09:28:16,True,True
2016-04-24T09:31:51,It Should Be Called Jason Rebourne,0,0,GrittyGamer,v71ce1Dqqns,0.0,2016-04-24 09:31:51,True,True
2016-04-24T09:32:32,talk about beating a franchise to death,0,0,Carlito Brigante,v71ce1Dqqns,0.0,2016-04-24 09:32:32,True,True
2016-04-24T10:12:58,Suck it Kimmel,0,0,Nat42027,v71ce1Dqqns,0.0,2016-04-24 10:12:58,True,True
2016-04-24T10:41:59,shut up and take my money,0,0,Sunday Seance,v71ce1Dqqns,0.0,2016-04-24 10:41:59,True,True
2016-04-24T11:12:58,worse than snowden? pffft,0,0,holi6709,v71ce1Dqqns,-0.4,2016-04-24 11:12:58,True,True
2016-04-24T12:28:33,yes yes yes another Jason Bourne movie yeaeee,0,0,Abhishek Jindal,v71ce1Dqqns,0.0,2016-04-24 12:28:33,True,True
2016-04-24T12:48:12,I can't wait...,0,0,Larry 306,v71ce1Dqqns,0.0,2016-04-24 12:48:12,True,True
2016-04-24T12:54:58,not again....,0,0,Ewa Sliwowska,v71ce1Dqqns,0.0,2016-04-24 12:54:58,True,True
2016-04-24T12:59:55,damm they should have included Jeremy renner too..,0,0,Srinivas Rajkumar,v71ce1Dqqns,0.0,2016-04-24 12:59:55,True,True
2016-04-24T13:43:39,There better be a fight scene to rival that biro from the first one!,0,0,Matty Plant,v71ce1Dqqns,0.40625,2016-04-24 13:43:39,True,True
2016-04-24T14:08:31,one punch man,0,0,killswitch johnson,v71ce1Dqqns,0.0,2016-04-24 14:08:31,True,True
2016-04-24T14:10:48,i have a giant penis.,0,0,boganus699,v71ce1Dqqns,0.0,2016-04-24 14:10:48,True,True
2016-04-24T14:22:06,let me hear a hell yeah,0,0,The Dominican Way,v71ce1Dqqns,0.0,2016-04-24 14:22:06,True,True
2016-04-24T15:01:42,Jesus Christ thats jason bourne.,5,0,Akash Jain,v71ce1Dqqns,0.0,2016-04-24 15:01:42,True,True
2016-04-24T15:09:15,0:50 everyone who saw this trailer,0,0,wwedeadman100,v71ce1Dqqns,0.0,2016-04-24 15:09:15,True,True
2016-04-24T15:35:15,Damn!!!!!!!,0,0,Smith Alan,v71ce1Dqqns,0.0,2016-04-24 15:35:15,True,True
2016-04-24T16:00:40,that prius ad was more unrealistic than any movie I've ever seen,0,0,Eric,v71ce1Dqqns,0.0,2016-04-24 16:00:40,True,True
2016-04-24T16:05:22,looking forward to this film.,0,0,Ajay Sharma,v71ce1Dqqns,0.0,2016-04-24 16:05:22,True,True
2016-04-24T16:20:38,"You know his name - it's ""Mark Wahlberg"". He always gets lost and Murica spends lots of money to find him :3",0,0,Abhijeet Kundu,v71ce1Dqqns,0.5,2016-04-24 16:20:38,True,True
2016-04-24T17:19:24,Remembering everything doesn't really mean you know everything and those few words from a lady bring a mass destruction - hell yaa,0,0,Bryce Loski,v71ce1Dqqns,-0.25625,2016-04-24 17:19:24,True,True
2016-04-24T17:49:26,just awesome,0,0,PRASHANT NAPHADE,v71ce1Dqqns,1.0,2016-04-24 17:49:26,True,True
2016-04-24T17:55:31,Private Ryan?,0,0,Kenny S,v71ce1Dqqns,0.0,2016-04-24 17:55:31,True,True
2016-04-24T18:34:12,jaim ca,0,0,ibrahima Ndiaye,v71ce1Dqqns,0.0,2016-04-24 18:34:12,True,True
2016-04-24T18:43:05,Exllent movie.......whene of my best movies.,0,0,tom bishob,v71ce1Dqqns,1.0,2016-04-24 18:43:05,True,True
2016-04-24T18:51:27,"wow trailer, waiting for the movie, especially car chase scene.",0,0,Nikhil Eswar,v71ce1Dqqns,0.05,2016-04-24 18:51:27,True,True
2016-04-24T19:05:03,So they got Damon & Greengrass back PLUS Alicia Vikander.. This might as well become my favorite franchise,3,1,Vincent Knight,v71ce1Dqqns,0.25,2016-04-24 19:05:03,True,True
2016-04-24T19:15:24,"Ronda Rousey is that you...??? Seriously tho, whose that chic I see her in a lotta movies since ufc defeat",0,0,Daniel Mwangi,v71ce1Dqqns,-0.3333333333333333,2016-04-24 19:15:24,True,True
2016-04-24T19:17:22,Jason Bourne! Super duper secret operative who never makes *any* effort to hide his face or change his appearance.... ever...,0,0,Terncote,v71ce1Dqqns,-0.033333333333333354,2016-04-24 19:17:22,True,True
2016-04-24T20:04:50,"This is the film of the summer, the one film I have been looking forward to all year.",0,0,Ronan Conlon,v71ce1Dqqns,0.0,2016-04-24 20:04:50,True,True
2016-04-24T21:10:09,"0:45 They have a folder named ""BLACK OPS"" ahahahaha seriously?",0,0,boze pomagaj,v71ce1Dqqns,-0.25,2016-04-24 21:10:09,True,True
2016-04-24T21:36:23,welcome back matt damon...........i know you're jason boune and .........we need to talk,0,0,shubham deshratna,v71ce1Dqqns,0.4,2016-04-24 21:36:23,True,True
2016-04-24T21:56:45,My grandfather would have loved this shit.  RIP Grandpa.  We'll always have Blade Runner.,0,0,dkerris,v71ce1Dqqns,0.24999999999999997,2016-04-24 21:56:45,True,True
2016-04-24T22:30:43,Please no shaky-cam fight scenes this time!,0,0,jliller,v71ce1Dqqns,0.0,2016-04-24 22:30:43,True,True
