timestamp,text,like_count,reply_count,author,trailer_id,sentiment_score,datetime,used_for_model,used_for_visualization
2016-07-15T14:54:58,"Aguardo ansiosamente à estréia! Um dos melhores filmes de ação, suspense....",0,0,Antoni Paiva,v71ce1Dqqns,0.0,2016-07-15 14:54:58,True,True
2016-07-16T01:24:17,"With the SELLOUT political views of Matt Damon supporting the most grotesque politician in US history, CROOKED HILLARY CLINTON, I will BOYCOTT all his film and work, along with the work of all his friends who even dare to do the same, and I INVITE EVERYONE TO DO THE SAME as Matt Damon is a total SELLOUT.",0,0,Renaud Be,v71ce1Dqqns,0.024999999999999994,2016-07-16 01:24:17,True,True
2016-07-16T17:09:14,i loved this movies.. Bourne series!,1,0,Ramdhan Pinto,v71ce1Dqqns,0.875,2016-07-16 17:09:14,True,True
2016-07-17T05:35:12,Wuh? 0:49... OH.,0,0,It's Me,v71ce1Dqqns,0.0,2016-07-17 05:35:12,True,True
2016-07-17T13:27:12,"I can`t wait for this one,seems to be huge as we expect it,and yeah Jason Bourne is definitely better,than James Bond.Keep it up guys and make some more episodes!!!!!",1,0,Gabor Balog,v71ce1Dqqns,0.46666666666666673,2016-07-17 13:27:12,True,True
2016-07-17T14:28:13,Tommy lee Jones playing bad guy or what?,0,0,Ethan Hunt,v71ce1Dqqns,-0.6999999999999998,2016-07-17 14:28:13,True,True
2016-07-17T18:44:34,underrated,2,0,ahmad Zain,v71ce1Dqqns,0.0,2016-07-17 18:44:34,True,True
2016-07-17T19:28:56,Another liberal who loves to glorify violence while calling for government to take my guns.  Ill be sure to steal this piece of shit.,0,0,manny fraker,v71ce1Dqqns,-0.06666666666666667,2016-07-17 19:28:56,True,True
2016-07-17T19:43:45,"Hollywood actors, they want to take our guns away as they make millions on carrying guns.. Not watching anymore of his movies...",0,0,737tech,v71ce1Dqqns,0.0,2016-07-17 19:43:45,True,True
2016-07-18T00:50:11,"Lord have mercy, that left hook...",1,0,RebornFromIsolation,v71ce1Dqqns,0.0,2016-07-18 00:50:11,True,True
2016-07-18T02:44:02,"que la estrenen ya , fanatica soy la espero",0,0,patricia dalbano,v71ce1Dqqns,0.0,2016-07-18 02:44:02,True,True
2016-07-18T15:59:39,"i love that movie,  in  august  starts the new   Jason Bourne   i cant  wait  do se  the new  Bourne Movie  :)",2,0,Mr. Hawkins,v71ce1Dqqns,0.3181818181818182,2016-07-18 15:59:39,True,True
2016-07-18T16:06:04,Pause at 0:45,0,0,Alienade,v71ce1Dqqns,0.0,2016-07-18 16:06:04,True,True
2016-07-18T16:18:33,What embarassing house appliance will Bourne kick somebody's ass with this time?,0,0,Fruischian,v71ce1Dqqns,0.0,2016-07-18 16:18:33,True,True
2016-07-18T17:41:27,YAYYYYYYY Been waiting for this!,2,0,Mystearicia,v71ce1Dqqns,0.0,2016-07-18 17:41:27,True,True
2016-07-18T18:29:36,They should've left him on mars...,1,0,Anton Canlapan,v71ce1Dqqns,0.0,2016-07-18 18:29:36,True,True
2016-07-18T18:57:30,The 'This hack's even worsen than Snowden' line is a nice touch.,1,0,JeroxB,v71ce1Dqqns,0.6,2016-07-18 18:57:30,True,True
2016-07-18T19:51:46,ONE PUUUUUUUUUUUUUUUUUUUUNCH!!!!,11,0,SeizeTheMeans,v71ce1Dqqns,0.0,2016-07-18 19:51:46,True,True
2016-07-19T02:05:15,meh,0,0,greentea,v71ce1Dqqns,0.0,2016-07-19 02:05:15,True,True
2016-07-19T08:55:42,i love this movie n Matt Damon,6,0,Isabelle Rose,v71ce1Dqqns,0.5,2016-07-19 08:55:42,True,True
2016-07-19T16:03:12,"If they maintain the background music, I'm gonna watch it...",1,0,fingercrack,v71ce1Dqqns,0.0,2016-07-19 16:03:12,True,True
2016-07-19T17:22:03,"Get some rest Tommy, you look…… Old",4,0,Bruce Wayne,v71ce1Dqqns,0.1,2016-07-19 17:22:03,True,True
2016-07-20T08:00:52,"Paul Greengrass, Matt Damon, Alicia Vikander... can't wait! huge bourne fan!  ""my name is Jason Bourne.""",0,0,MYELbe,v71ce1Dqqns,0.5000000000000001,2016-07-20 08:00:52,True,True
2016-07-20T08:46:13,"He wasn't dead, he was just stranded alone on Mars for 461 Sols",15,2,Josh,v71ce1Dqqns,-0.2,2016-07-20 08:46:13,True,True
2016-07-20T16:16:59,Jack Reacher v Jason Bourne,0,0,Majin13David,v71ce1Dqqns,0.0,2016-07-20 16:16:59,True,True
2016-07-20T16:55:43,cant wait to watch this,0,0,MrMogadoga,v71ce1Dqqns,0.0,2016-07-20 16:55:43,True,True
2016-07-21T04:27:41,y Pámela Landing?,0,0,Dario Sánchez,v71ce1Dqqns,0.0,2016-07-21 04:27:41,True,True
2016-07-21T13:18:59,It played the trailer of the movie before watching this for an ad,0,0,SorinoScreens,v71ce1Dqqns,0.0,2016-07-21 13:18:59,True,True
2016-07-21T15:59:22,Trailer looks promising. I don't think we probably never see mib: 4. Oh Tommy why do you get this old.,0,0,Shyam Krishnan,v71ce1Dqqns,0.15000000000000002,2016-07-21 15:59:22,True,True
2016-07-21T20:50:42,"At 50 secs: ""Jesus Chris that's Jason Bourne."" 😎 What where you expecting : Justin Beaver 🙋!",0,0,Karim Sumar,v71ce1Dqqns,0.0,2016-07-21 20:50:42,True,True
2016-07-21T21:11:04,dey have black ops 1,0,0,lklkl llnln,v71ce1Dqqns,-0.16666666666666666,2016-07-21 21:11:04,True,True
2016-07-22T12:07:36,"""Could be worse than Snowden""  What ? Isn't he the good guy",0,0,archangel1996j,v71ce1Dqqns,0.14999999999999997,2016-07-22 12:07:36,False,True
2016-07-22T19:13:10,ITS GONA BE LIT !!,0,0,Anthony Lopez,v71ce1Dqqns,0.0,2016-07-22 19:13:10,False,True
2016-07-22T22:53:33,cant wait to see it,0,0,WoW MAN 669,v71ce1Dqqns,0.0,2016-07-22 22:53:33,False,True
2016-07-23T03:33:30,I really hope this movie will satisfied me after watching other stupid hero beats other super hero or some gangters hero beats one groupies hero which is I have to say. its all was kind of boring movie and really kind of disappointing. can't wait to watch this movie.,0,0,Faradilla Agustina,v71ce1Dqqns,-0.04166666666666667,2016-07-23 03:33:30,False,True
2016-07-23T07:58:07,Why didn't Matt play in the Bourne Legacy????,0,0,Jacob Lorenz,v71ce1Dqqns,0.0,2016-07-23 07:58:07,False,True
2016-07-23T07:58:08,Why didn't Matt play in the Bourne Legacy????,0,0,Jacob Lorenz,v71ce1Dqqns,0.0,2016-07-23 07:58:08,False,True
2016-07-23T07:58:09,Why didn't Matt play in the Bourne Legacy????,0,0,Jacob Lorenz,v71ce1Dqqns,0.0,2016-07-23 07:58:09,False,True
2016-07-23T10:09:10,its like uncharted 4,0,0,Creamy Sans,v71ce1Dqqns,0.0,2016-07-23 10:09:10,False,True
2016-07-23T10:58:49,"He hit a person of colour? NOT very PC, Damon!",0,0,frere jacques,v71ce1Dqqns,-0.125,2016-07-23 10:58:49,False,True
2016-07-23T17:41:15,what if Jason and Salt meet,0,0,metalester,v71ce1Dqqns,0.0,2016-07-23 17:41:15,False,True
2016-07-23T18:10:26,OMG cant wait to see this!!!!,0,0,Metalllians86,v71ce1Dqqns,0.0,2016-07-23 18:10:26,False,True
2016-07-23T18:43:29,"Solely through the Jason Bourne series i've become a die hard Matt Damon fan having so much respect for his acting skills! No one can play Jason Bourne but him/like him. I'm excited for this one for Matt is back in the game, tho most of the time sequels are not as good as their prequels but i keep my hopes up!",1,0,Synesthesia Z,v71ce1Dqqns,0.15729166666666666,2016-07-23 18:43:29,False,True
2016-07-24T03:30:12,Please tell me im not the only one hearing a part of Dio's time stop sound effect at 2:02,0,0,Battletoads,v71ce1Dqqns,0.2,2016-07-24 03:30:12,False,True
2016-07-24T04:13:44,thank god matt is david again,0,0,Aleksandar Slayer,v71ce1Dqqns,0.0,2016-07-24 04:13:44,False,True
2016-07-24T05:33:15,I think he might be coming for Jeremy Renner for ruining his movie lol.,32,0,comsci2491,v71ce1Dqqns,0.8,2016-07-24 05:33:15,False,True
2016-07-24T15:30:55,Jason reborne..? Out of cash?,0,0,Ex terminator,v71ce1Dqqns,0.0,2016-07-24 15:30:55,False,True
2016-07-24T16:58:17,"Yawn, just another rehash.  Also this installment has guns in it?  Hypocritical if you ask me given Matt Damon's gun ban stance and anti-police  rhetoric.",0,0,Rick James,v71ce1Dqqns,-0.05,2016-07-24 16:58:17,False,True
2016-07-24T17:13:48,will Jason Bourne and Nicky will get into relationship?,0,0,Surya prakash,v71ce1Dqqns,0.0,2016-07-24 17:13:48,False,True
2016-07-24T18:29:20,Tragam para o Brasil por favor,0,0,Biahhy Silva,v71ce1Dqqns,0.0,2016-07-24 18:29:20,False,True
2016-07-24T19:18:29,Matt Damon for president,1,0,Alston Trbula,v71ce1Dqqns,0.0,2016-07-24 19:18:29,False,True
2016-07-25T00:02:49,I love Jason Bouner for Matt Damon.,1,0,Josi Sincera,v71ce1Dqqns,0.5,2016-07-25 00:02:49,False,True
2016-07-25T00:04:25,He looks like Christian WWE,0,0,M. Ainur Rizqi,v71ce1Dqqns,0.0,2016-07-25 00:04:25,False,True
2016-07-25T05:34:16,"1:24 ""He's Seen Things, He Knows Things. What If He's Not Coming For Us, What If It's Something else?"" Tommy Lee Jones: ""I Don't Care!""",53,3,EmanS117,v71ce1Dqqns,0.0,2016-07-25 05:34:16,False,True
2016-07-25T05:58:17,what is all left is to watch ben affleck goes to fight matt damon,0,0,Adoh Doha,v71ce1Dqqns,0.0,2016-07-25 05:58:17,False,True
2016-07-25T07:54:56,I'd rather get hit by Mike Tyson,183,12,Erick Santos,v71ce1Dqqns,0.0,2016-07-25 07:54:56,False,True
2016-07-25T09:15:28,"""Chesus christ its Jason Bourne"" love that :D",4,0,AjdinForPresident,v71ce1Dqqns,0.75,2016-07-25 09:15:28,False,True
2016-07-25T15:34:50,No one is gonna replace Marie but Nicky and Bourne would be a dope combo .. Can't wait .. Jason Bourne is back !!,0,0,island boy,v71ce1Dqqns,0.0,2016-07-25 15:34:50,False,True
2016-07-25T15:51:00,all the bourne with matt damon are really good except for the last one i was disappointed the movie was 👎,0,0,Jhloo7,v71ce1Dqqns,-0.01666666666666668,2016-07-25 15:51:00,False,True
2016-07-25T19:06:49,"Matt Damon'un seriye dönmesi güzel,ama Pamela (Pam) Landy nin olmaması büyük kayıp.Şu nicky parsons dan da kurtulamadık bir türlü😁",0,0,Muharrem Donmez,v71ce1Dqqns,0.0,2016-07-25 19:06:49,False,True
2016-07-25T22:47:59,LOOKS  PERFECT.............,0,0,NICK,v71ce1Dqqns,1.0,2016-07-25 22:47:59,False,True
2016-07-25T23:57:17,I... AM... POTATO!,0,0,Ail'enduril,v71ce1Dqqns,0.0,2016-07-25 23:57:17,False,True
2016-07-26T01:13:59,"I feel sorry for all the muscle he's brought, just to let Jason Bourne show how he rules by one-punching him. Tragic.",0,0,Masayuki Hashimoto,v71ce1Dqqns,-0.625,2016-07-26 01:13:59,False,True
2016-07-26T01:23:47,He and Max Payne would be a perfect duo (the duo of two misery badass men),1,0,bui nhat,v71ce1Dqqns,1.0,2016-07-26 01:23:47,False,True
2016-07-26T05:14:16,"People got so used to trailers that tell them everything in the plot that when they don't get it, they become afraid there is no story to the plot?   C'mon...",0,0,theSUBVERSIVE,v71ce1Dqqns,-0.6,2016-07-26 05:14:16,False,True
2016-07-26T06:35:19,ghost is appear again....,0,0,Iin Indonesia,v71ce1Dqqns,0.0,2016-07-26 06:35:19,False,True
2016-07-26T15:10:39,Ffs Lumen,0,0,big mac,v71ce1Dqqns,0.0,2016-07-26 15:10:39,False,True
2016-07-26T17:58:28,I'm so glad Paul Greengrass is directing again! He was the best in my opinion,0,0,Josh Haller Films,v71ce1Dqqns,0.8125,2016-07-26 17:58:28,False,True
2016-07-26T18:49:31,Crazy to see Matt Damon with gray hair,0,0,jacksonbear1,v71ce1Dqqns,-0.6,2016-07-26 18:49:31,False,True
2016-07-26T20:21:36,Shit Hollywood Zionist Propaganda machine/,0,0,celtic celtic,v71ce1Dqqns,-0.15000000000000002,2016-07-26 20:21:36,False,True
2016-07-26T22:11:54,I refuse to watch this movie because in real life he wants guns to be taken off the USA so in respect to his heart felt feelings I don't want to watch him holding a gun and shooting people,0,0,Michael Walker,v71ce1Dqqns,0.2,2016-07-26 22:11:54,False,True
2016-07-26T22:40:14,The funny part is that Mr. Damon is so anti-gun (he wishes the U.S. would implement a gun ban similar to the one Australia implemented in the 1990s) that he continues to make these movies that promote the idea of using weapons (gun violence) to defend himself and solve the problem the protagonist is facing. I have an idea for Mr. Damon's next movie: Jason Bourne--up against some terrible government agency trying to kill him--logs on to petitions.whitehouse.gov and asks his fellow countrymen  to log on and sign a petition to stop the government agency from trying to kill him. Great movie idea. . . . No way I'm going to go watch any movie this hypocrite's character uses any kind of gun.,1,0,hkssupratt,v71ce1Dqqns,0.10833333333333334,2016-07-26 22:40:14,False,True
2016-07-26T23:37:46,0:36 ......do you bleed?,0,0,Anal AA,v71ce1Dqqns,0.0,2016-07-26 23:37:46,False,True
2016-07-27T01:01:34,Wow!,0,0,Joel Montero,v71ce1Dqqns,0.125,2016-07-27 01:01:34,False,True
2016-07-27T06:58:16,Don't like Bourne movies at all. The movies could've been much better with the story lines.,0,0,roticle,v71ce1Dqqns,0.5,2016-07-27 06:58:16,False,True
2016-07-27T07:33:57,wait... am I watching the whole movie already   sigh,0,0,Lisa Dee,v71ce1Dqqns,0.2,2016-07-27 07:33:57,False,True
2016-07-27T09:48:21,i have to know about that LIE!!!!,1,1,Wistofox,v71ce1Dqqns,0.0,2016-07-27 09:48:21,False,True
2016-07-27T13:01:27,"I'm going to see it this afternoon, can't wait! :)",0,0,Budderedupbro,v71ce1Dqqns,0.5,2016-07-27 13:01:27,False,True
2016-07-27T13:02:24,1:09 there's a man that looks like becky,0,0,sangpelarian,v71ce1Dqqns,0.0,2016-07-27 13:02:24,False,True
2016-07-27T16:16:52,Who else agrees that they should do Jason Bourne vs James Bond,0,0,Kingorc 69,v71ce1Dqqns,0.0,2016-07-27 16:16:52,False,True
2016-07-27T16:41:02,Better then agent 007,0,0,ariko daniel,v71ce1Dqqns,0.5,2016-07-27 16:41:02,False,True
2016-07-27T17:40:23,what the diffence this movie and m.i ??,0,0,Hartina Haziq,v71ce1Dqqns,0.0,2016-07-27 17:40:23,False,True
2016-07-27T17:44:30,that one hiter quitter in the beginning dayum.,0,0,Akey Ob,v71ce1Dqqns,0.0,2016-07-27 17:44:30,False,True
2016-07-28T01:42:03,i click on the thumbnail for the video and the advertisement that i see before the video is none other than an advert for the the new Jason Bourne film.,0,0,Alex Douglas,v71ce1Dqqns,0.005681818181818177,2016-07-28 01:42:03,False,True
2016-07-28T03:32:53,I found *JASON BOURNE* movie 2016 on https://twitter.com/ReniHinata/status/756389387546431488,0,0,Athasia Caweth,v71ce1Dqqns,0.0,2016-07-28 03:32:53,False,True
2016-07-28T08:33:12,I watched the movie last night.. it makes me vomit because of the jumpy  and shaky  camera works...really..,0,0,Syed Fasal,v71ce1Dqqns,-0.16666666666666666,2016-07-28 08:33:12,False,True
2016-07-28T10:31:14,Just saw this now movie is long there parts that you could fall as sleep Julia stiles got killed spoiler alert! Stories not that deep project ironhand now (upgraded threadstone)believe me it's not the best Bourne movie the content is really not that deep,0,0,Pedion Gomez,v71ce1Dqqns,0.09999999999999999,2016-07-28 10:31:14,False,True
2016-07-28T11:55:54,how is that  a 12a,0,0,PeppersPlatinum,v71ce1Dqqns,0.0,2016-07-28 11:55:54,False,True
2016-07-28T12:57:56,"I hope they make this movie the same way the old movies were. Good quality action, but not excessive. It should focus on a well thought out plot. And of course, awesome soundtracks.",0,0,mslollo00,v71ce1Dqqns,0.33749999999999997,2016-07-28 12:57:56,False,True
2016-07-28T13:11:28,"just watched it today, it was AWESOME!!",0,0,Bane,v71ce1Dqqns,1.0,2016-07-28 13:11:28,False,True
2016-07-28T14:14:54,MUST WATCH NOW,0,0,BamItsEric,v71ce1Dqqns,0.0,2016-07-28 14:14:54,False,True
2016-07-28T17:06:54,awaited.,0,0,Ramneek Singh,v71ce1Dqqns,0.0,2016-07-28 17:06:54,False,True
2016-07-28T17:23:27,So this is a remake?,0,0,Wimo Tapia,v71ce1Dqqns,0.0,2016-07-28 17:23:27,False,True
2016-07-28T18:29:23,What a pastel,0,0,Atheist,v71ce1Dqqns,0.0,2016-07-28 18:29:23,False,True
2016-07-28T20:47:59,Gave film,0,0,Paul Streutjens,v71ce1Dqqns,0.0,2016-07-28 20:47:59,False,True
2016-07-28T22:13:49,that guy just got 1 tapped,0,0,Michael Akinlade,v71ce1Dqqns,0.0,2016-07-28 22:13:49,False,True
2016-07-28T22:25:19,Hes's back babyyyy,0,0,Qais H,v71ce1Dqqns,0.0,2016-07-28 22:25:19,False,True
2016-07-28T22:29:41,People lost their mind saying this is the best one.,0,0,ledepi34,v71ce1Dqqns,1.0,2016-07-28 22:29:41,False,True
2016-07-28T23:14:26,"""Could be worse then Snowden..."" LOL, this'll be an interesting movie :P",0,0,Paul Pyro,v71ce1Dqqns,0.4125,2016-07-28 23:14:26,False,True
2016-07-28T23:36:02,Its shaky cam all over again. But gonna watch it anyway!,0,0,MastaSephi,v71ce1Dqqns,-0.41666666666666663,2016-07-28 23:36:02,False,True
2016-07-29T01:46:33,"Yes, he is back Bourne ,jason bourne ready to be thrilled 🤘🏻🤘🏻",0,0,Roman Parajuli,v71ce1Dqqns,0.26666666666666666,2016-07-29 01:46:33,False,True
2016-07-29T12:03:43,mates the have greek flagsh ? or i dont see well xd,0,0,exile juNIOR,v71ce1Dqqns,0.0,2016-07-29 12:03:43,False,True
2016-07-29T12:52:23,"As a huge fan of the Bourne movies, this looks good and I will certainly see it.  Too bad Damon has to put his political bullshit out there.  So, Matt Damon, in protest.. I will be pirating your shit and watching it for FREE.  I refuse to give you my money.",0,0,Tyler B,v71ce1Dqqns,0.11632653061224493,2016-07-29 12:52:23,False,True
2016-07-29T13:56:51,my favorite movie series ever after harry potter,0,0,Da Vi Ma,v71ce1Dqqns,0.5,2016-07-29 13:56:51,False,True
2016-07-29T14:00:31,omg Alicia Vikander !!!! i lovee her !!!,0,0,Da Vi Ma,v71ce1Dqqns,0.0,2016-07-29 14:00:31,False,True
2016-07-29T14:22:22,"Everytme i see this girl, i am reminded of '10 things i hate about you' and in turn Heath Ledger and in turn his performance as the Joker in Batman. :(",0,0,Avik Bara,v71ce1Dqqns,-0.775,2016-07-29 14:22:22,False,True
2016-07-29T15:40:41,wow...another times on kodak motion picture film!!! :) amazing,0,0,Riccardo Pascucci,v71ce1Dqqns,0.55,2016-07-29 15:40:41,False,True
2016-07-29T16:22:02,love this movie...my fav,0,0,hd chatha,v71ce1Dqqns,0.5,2016-07-29 16:22:02,False,True
2016-07-29T17:15:36,strongmen,0,0,mundo,v71ce1Dqqns,0.0,2016-07-29 17:15:36,False,True
2016-07-29T18:23:52,Iam sitting in cinema right now watching this lol its gonna start in 5 mins,1,0,iakak 8HDkakak,v71ce1Dqqns,0.5428571428571429,2016-07-29 18:23:52,False,True
2016-07-29T19:25:30,"to the hell with everything, jason bourne is back!!",0,0,Rimus Ibra,v71ce1Dqqns,0.0,2016-07-29 19:25:30,False,True
2016-07-29T21:47:57,"Ok everyone, I went to go see it and though it met my expectations for action it failed in the area of plot. It did not have enough storyline substance. Still worth going to see...",1,0,InHisImage&Likeness,v71ce1Dqqns,0.07999999999999999,2016-07-29 21:47:57,False,True
2016-07-29T22:57:52,"just watched the movie, the trailer is a better movie",71,8,leadspot,v71ce1Dqqns,0.5,2016-07-29 22:57:52,False,True
2016-07-30T00:45:15,saw this movie. really good movie,0,0,TheNobleMen,v71ce1Dqqns,0.7,2016-07-30 00:45:15,False,True
2016-07-30T03:03:15,Necesito ver esta pelicula,0,0,Daniela Montserrat Arévalo Alvarenga,v71ce1Dqqns,0.0,2016-07-30 03:03:15,False,True
2016-07-30T03:24:32,Did anyone else ironically get a Jason Bourne Ad while watching this. I did.,0,0,Iss Jeylan,v71ce1Dqqns,0.0,2016-07-30 03:24:32,False,True
2016-07-30T06:51:24,The Bourne Redundancy,1,0,Shannon,v71ce1Dqqns,0.0,2016-07-30 06:51:24,False,True
2016-07-30T15:49:08,"l watched  today it was  perfect excellent and  superb,  all actors was super  l  like to congratulate  directors  it was super",3,4,Sehfa Sanlioglu,v71ce1Dqqns,0.7333333333333334,2016-07-30 15:49:08,False,True
2016-07-30T16:58:20,0:02 one punch man,83,3,Paulo Vinicio,v71ce1Dqqns,0.0,2016-07-30 16:58:20,False,True
2016-07-30T18:06:41,This movie looks like it's gonna be deep asf,0,0,Kiron Foster,v71ce1Dqqns,0.0,2016-07-30 18:06:41,False,True
2016-07-30T19:04:56,just watched it. It was sooooo good,0,0,allyssa,v71ce1Dqqns,0.7,2016-07-30 19:04:56,False,True
2016-07-30T21:28:21,People who can't handle shaky CAM don't watch Jason Bourne. I watched today and this is one of the worst shaking cam ever seen. This time Paul Greengrass got too far.. I had to vomat later cuz of the headache.,0,2,Kadibou Chawang,v71ce1Dqqns,-0.3083333333333333,2016-07-30 21:28:21,False,True
2016-07-30T23:19:25,OMG! Just watched the movie today and I totally recommend it! Great Movie.,17,2,Alex Nelson,v71ce1Dqqns,0.4,2016-07-30 23:19:25,False,True
2016-07-31T01:33:41,"SUCKED,SUCKED,SUCKED save your money.",0,0,D Lee,v71ce1Dqqns,0.0,2016-07-31 01:33:41,False,True
2016-07-31T08:04:59,lol ]i might watch it tonight,0,0,Victor Lazkani,v71ce1Dqqns,0.8,2016-07-31 08:04:59,False,True
2016-07-31T08:20:38,IM JUST LOOKING FOR SAM J IN THIS MOVIE TOO,0,0,rafizkk,v71ce1Dqqns,0.0,2016-07-31 08:20:38,False,True
2016-07-31T09:57:31,"Watched the film, walked out after boredom. They spend 20minutes driving down the same allys in the same town that could of been a  5minute scene. had to leave because i was so damn bored",0,0,Strength RD,v71ce1Dqqns,-0.1638888888888889,2016-07-31 09:57:31,False,True
2016-07-31T12:56:47,thought this episode thing was over.....dont even remember where it left off cause i thought that was it.,0,0,Annoying JA Reviews,v71ce1Dqqns,0.0,2016-07-31 12:56:47,False,True
2016-07-31T14:00:33,Does anybody know what that hoodie Christian Dassault is wearing is called?,0,0,xXxSwictxXx,v71ce1Dqqns,0.0,2016-07-31 14:00:33,False,True
2016-07-31T14:18:07,"The new Bourne was good, but the plot/screenplay was not quite up to the previous movies. Definitely worth seeing, but I was a little disappointed.",0,0,Scott C,v71ce1Dqqns,0.00536616161616162,2016-07-31 14:18:07,False,True
2016-07-31T14:44:23,Finally matt daemon in borne series is back in action :D can't wait paul greengrass is back too.,0,0,Fahad Mubeen,v71ce1Dqqns,0.22000000000000003,2016-07-31 14:44:23,False,True
2016-07-31T15:15:50,"Matt Damon is the same person that has said publicly on more than one occasion that all guns should be confiscated from the American public. Just like in Australia. Yet he makes movies like this. What a hypocrite, he won't get a dime from me.",1,15,Dana H,v71ce1Dqqns,0.125,2016-07-31 15:15:50,False,True
2016-07-31T17:02:09,This movie was actually awesome,1,0,Akeel Aslam,v71ce1Dqqns,1.0,2016-07-31 17:02:09,False,True
2016-07-31T18:18:05,It's boring as hell... Pure Jew-Wood anti internet privacy propaganda movie...  don't waste your time.,0,0,SkuStyle,v71ce1Dqqns,-0.2714285714285714,2016-07-31 18:18:05,False,True
2016-07-31T18:27:56,superb movies,0,0,Joney Francis,v71ce1Dqqns,1.0,2016-07-31 18:27:56,False,True
2016-07-31T19:44:04,Matt daemon isnt in jason bourne 4 But in Jason bourne 1-3 and he is now in 5? Wtf he skipped 1 Movie,0,8,Yeah,v71ce1Dqqns,-0.5,2016-07-31 19:44:04,False,True
2016-07-31T20:47:29,"This movie was a let down it had no character development I mean Matt Damon had like 2 lines and the plot is all over the place like I didn't hate it but it was just ""meh"" there wasn't enough ""wow that was so clever"" moments like in the 2nd and 3rd movies and the music playing at the end is usually really satisfying but this time it wasn't :(",0,0,Mun craft,v71ce1Dqqns,-0.12513888888888888,2016-07-31 20:47:29,False,True
2016-07-31T23:56:14,volvio mi Jeison burnie 👏👏👏👏ya lo extrañaba 😙,0,0,Erica Lamas,v71ce1Dqqns,0.0,2016-07-31 23:56:14,False,True
2016-08-01T01:23:46,"i watched it yesterday, it was goood, thank you.",0,0,Raisya Kai,v71ce1Dqqns,0.0,2016-08-01 01:23:46,False,True
2016-08-01T03:19:16,Going to see this tomorrow.,0,0,drippy_luke15,v71ce1Dqqns,0.0,2016-08-01 03:19:16,False,True
2016-08-01T05:14:53,Justice for Nicky Parsons :(,8,0,Lexie Marin,v71ce1Dqqns,-0.75,2016-08-01 05:14:53,False,True
2016-08-01T05:36:45,I watched it today and it's amazing if you haven't seen it then get up run to your car and jump out of the car sprint into the godamn theater throw money At the cashier but don't forget to get popcorn your gonna need it and jump Into your seat and watch it NOW!!!!!!,0,0,retardomorph,v71ce1Dqqns,1.0,2016-08-01 05:36:45,False,True
2016-08-01T07:10:36,who jason bounce in real life,0,0,Nanda Winarto,v71ce1Dqqns,0.2,2016-08-01 07:10:36,False,True
2016-08-01T07:57:02,well guys this movie is 1:53 minutes and in the last 13 min they get to fight a boring 1.  is All Bla Bla... its lack of Action put it in the worst movie ever... the Worst jason Bourne... they brought matt damon back for this???,1,0,Luisa Inmaculada,v71ce1Dqqns,-0.48333333333333334,2016-08-01 07:57:02,False,True
2016-08-01T08:20:14,Jason Bourne joined the M.I.B thats why he lost his memories,0,0,MV Velmonte,v71ce1Dqqns,0.0,2016-08-01 08:20:14,False,True
2016-08-01T08:27:45,i knew he would be back..like always!,2,0,blife90,v71ce1Dqqns,0.0,2016-08-01 08:27:45,False,True
2016-08-01T14:42:20,I would stand in line for this.,2,1,J,v71ce1Dqqns,0.0,2016-08-01 14:42:20,False,True
2016-08-01T18:31:11,"To everyone who's seen the movie already, what are your opinions on it? Is it good?",2,10,Stealth Moose,v71ce1Dqqns,0.7,2016-08-01 18:31:11,False,True
2016-08-01T19:28:13,BEST MOVIE OF THE YEAR!!!!!!,0,0,Julius Caesar,v71ce1Dqqns,1.0,2016-08-01 19:28:13,False,True
2016-08-01T19:55:02,Movie was not as good as the trailer :-(,34,8,Dilated Beholder,v71ce1Dqqns,-0.025000000000000022,2016-08-01 19:55:02,False,True
2016-08-02T00:57:55,Thank you for another movie of jason bourne gentlemans!!!!,0,0,Eduardo Martinez,v71ce1Dqqns,0.0,2016-08-02 00:57:55,False,True
2016-08-02T07:15:48,"@0:50 that retarded exposition fairy who says ""Jesus that's Jason Bourne"" is my new favorite character he makes me laugh at stupidity every time.  I wish they would make a movie just about that idiot saying Jesus it's blank.",0,0,grkpektis,v71ce1Dqqns,-0.18051948051948052,2016-08-02 07:15:48,False,True
2016-08-02T10:09:04,good movie but not amazing. i think jeremy Renner & damon must collaborate for next bourne,0,0,Zack Kcaz,v71ce1Dqqns,0.1333333333333333,2016-08-02 10:09:04,False,True
2016-08-02T10:30:38,"Well, I better like when Jason Bourne drive with old school cars like in previous movies! It would save the enjoyable style - classic with cleverness!  But here we go - trying to put as much new stuff as can! That is already boring!",0,0,Didzis Kalnietis,v71ce1Dqqns,0.038636363636363615,2016-08-02 10:30:38,False,True
2016-08-02T17:00:28,Im watch that part thousand times 'Jesus christ thats jason bourne,0,0,Don Sean,v71ce1Dqqns,0.0,2016-08-02 17:00:28,False,True
