timestamp,text,like_count,reply_count,author,trailer_id,sentiment_score,datetime,used_for_model,used_for_visualization
2016-05-17T03:30:35,"I refused to watch the one after the Ultimatum.  This one, oh yeah!",0,0,Y Tang,v71ce1Dqqns,0.0,2016-05-17 03:30:35,True,True
2016-05-17T03:42:26,between Jason and Brian(taken) who would win???,1,2,Michael Mana,v71ce1Dqqns,0.8,2016-05-17 03:42:26,True,True
2016-05-17T05:03:02,Wow. Bourne is back,65,5,debendra gurung,v71ce1Dqqns,0.05,2016-05-17 05:03:02,True,True
2016-05-17T05:40:44,Yeah he is back Jason Bourne,2,0,Naman Sharma,v71ce1Dqqns,0.0,2016-05-17 05:40:44,True,True
2016-05-17T05:43:00,"""You know his name"" ""Matt Damon!""",57,4,unifieddynasty,v71ce1Dqqns,0.0,2016-05-17 05:43:00,True,True
2016-05-17T08:55:09,omg!!! ive been waiting for you!!!!,0,0,jose allan miguel gonzales,v71ce1Dqqns,0.0,2016-05-17 08:55:09,True,True
2016-05-17T14:46:39,sam fisher story aint it,0,0,lou lou,v71ce1Dqqns,0.0,2016-05-17 14:46:39,True,True
2016-05-17T16:35:00,Jason Bourne Legacy kinda ruined the momentum tho. Feels like this movie is a make-up following the last movie tht didnt get a lot of gud reviews. Still love Jeremy tho.,0,0,horny puppy,v71ce1Dqqns,0.16666666666666666,2016-05-17 16:35:00,True,True
2016-05-17T16:48:24,They don't seem to realize that we don't want our Bourne to be a comic book hero or a Transformer - so sad,4,0,JamesJoyce12,v71ce1Dqqns,-0.125,2016-05-17 16:48:24,True,True
2016-05-17T17:12:36,that punch was disgusting ... I'm acc hyped for this af,0,0,Clorox Bleach,v71ce1Dqqns,-1.0,2016-05-17 17:12:36,True,True
2016-05-17T18:10:06,Matt Damon is the only TRUE genious to play in these bourne movies! I'm so glad it's coming out and that KO in the beginning was just sick!,23,0,Netherwing,v71ce1Dqqns,0.011160714285714274,2016-05-17 18:10:06,True,True
2016-05-17T18:35:13,GOD ALMIGHTY please let Julia Stile´s character survive so they can get their freak on!  They deserve to end up together! :D,13,1,Richie Daniel,v71ce1Dqqns,1.0,2016-05-17 18:35:13,True,True
2016-05-17T20:38:18,Waiting!,0,0,R G,v71ce1Dqqns,0.0,2016-05-17 20:38:18,True,True
2016-05-17T21:20:02,Bourne v Bond v Hunt.,0,0,Itsari21,v71ce1Dqqns,0.0,2016-05-17 21:20:02,True,True
2016-05-17T22:12:00,"""From director Paul Greengrass"" I'M IN",2,0,Clothilde,v71ce1Dqqns,0.0,2016-05-17 22:12:00,True,True
2016-05-17T22:48:34,the action looks shakier than the other bourne films,0,0,Immortan Joe,v71ce1Dqqns,-0.012499999999999997,2016-05-17 22:48:34,True,True
2016-05-18T00:42:10,i like the one with hawkeye better,0,0,benny,v71ce1Dqqns,0.5,2016-05-18 00:42:10,True,True
2016-05-18T02:01:07,I am SO gonna se this!,0,0,CellaN,v71ce1Dqqns,0.0,2016-05-18 02:01:07,True,True
2016-05-18T03:08:09,YUSSS,0,0,MWMANIAC129,v71ce1Dqqns,0.0,2016-05-18 03:08:09,True,True
2016-05-18T08:15:00,May watch....,0,0,kkkino.net,v71ce1Dqqns,0.0,2016-05-18 08:15:00,True,True
2016-05-18T10:43:58,"""Jesus Christ, it's Jason Bourne"" ""Why would he come back now?"" ""Because Aaron Cross ruined the franchise""",170,4,He He,v71ce1Dqqns,0.0,2016-05-18 10:43:58,True,True
2016-05-18T11:23:31,"I hope Moby Extreme Ways is still the soundtrack tune, Bond is ace, but a different tune everytime, every movie, boring. Bring on new Bourne!",0,0,Mark Quilliam,v71ce1Dqqns,-0.23863636363636365,2016-05-18 11:23:31,True,True
2016-05-18T12:05:31,Berlin Foot Chase,0,0,Pikmin Puck,v71ce1Dqqns,0.0,2016-05-18 12:05:31,True,True
2016-05-18T16:39:25,Ya mean...we can't even SUBSCRIBE?,0,0,The FirstBourne,v71ce1Dqqns,0.0,2016-05-18 16:39:25,True,True
2016-05-18T18:18:43,vincent cassel vs matt damon! awesome!,5,0,lill tindemann,v71ce1Dqqns,1.0,2016-05-18 18:18:43,True,True
2016-05-18T20:44:20,Too much shaky cam bro. Get a tripod bro.,0,0,Tony S. Zhou,v71ce1Dqqns,-0.3333333333333333,2016-05-18 20:44:20,True,True
2016-05-18T20:46:19,"Why'd they edit out ""David Webb"" in that clip from the 3rd film?",0,0,leelad,v71ce1Dqqns,0.0,2016-05-18 20:46:19,True,True
2016-05-18T23:45:42,matt damon is getting on in years im not so sure this one is going to work,1,2,Taco Jesus,v71ce1Dqqns,0.5,2016-05-18 23:45:42,True,True
2016-05-18T23:49:56,Matt Damon is a has been and a snotty jerk. This trailer is not news.,0,0,Rob L,v71ce1Dqqns,0.0,2016-05-18 23:49:56,True,True
2016-05-19T00:44:59,film sangar,0,0,Dedik&Devy Cilbo,v71ce1Dqqns,0.0,2016-05-19 00:44:59,True,True
2016-05-19T01:31:09,Literally the best,0,0,Nurbol Bekbossinov,v71ce1Dqqns,1.0,2016-05-19 01:31:09,True,True
2016-05-19T03:39:52,love movies? check out @cinephilecommunity on Instagram.😊,0,0,That Girl Cheree,v71ce1Dqqns,0.5,2016-05-19 03:39:52,True,True
2016-05-19T03:51:59,Extreme ways are back again,0,0,Lukong,v71ce1Dqqns,-0.0625,2016-05-19 03:51:59,True,True
2016-05-19T04:24:02,show,0,0,trailer Filmes,v71ce1Dqqns,0.0,2016-05-19 04:24:02,True,True
2016-05-19T05:28:09,super heroes fear!! cause jason bourne is here..,0,0,akash dev,v71ce1Dqqns,0.5208333333333333,2016-05-19 05:28:09,True,True
2016-05-19T07:16:53,build i really please   this very much !use  !,1,0,Quinten de Wees,v71ce1Dqqns,0.303125,2016-05-19 07:16:53,True,True
2016-05-19T08:11:08,"He got older after coming back from Mars, contradicting the theory or relativity!",32,0,GodBlessYou2008,v71ce1Dqqns,0.08333333333333333,2016-05-19 08:11:08,True,True
2016-05-19T08:59:01,omfg decide actually sounds cotlview  =‑d,1,0,Vincent Dekker,v71ce1Dqqns,0.0,2016-05-19 08:59:01,True,True
2016-05-19T10:59:32,Matt Damon should keep making movies 'til he's 100 and Alicia Vikander is bae. That is all...,1,0,ashleyf131,v71ce1Dqqns,0.0,2016-05-19 10:59:32,True,True
2016-05-19T12:16:31,Pals nature The vid truly sounds deeply  outlasdismmother  8‑D,1,0,Jan de Groot,v71ce1Dqqns,0.0,2016-05-19 12:16:31,True,True
2016-05-19T14:27:57,This is true Jason Bourne!Love Matt Damon!,2,0,yun she,v71ce1Dqqns,0.4375,2016-05-19 14:27:57,True,True
2016-05-19T15:51:39,"Awesome! Looks great. Going to see it. But, don't fu*king put the best part of the trailer in a trailer for the trailer!!! WTF it spoiled the whole trailer!! Ugh!! anyway, Jason Bourne is the sh*t!! :)",1,0,D.B. Keosababian,v71ce1Dqqns,0.5938232421874999,2016-05-19 15:51:39,True,True
2016-05-19T16:47:04,What a good trailer. :),0,0,Fat-Bastard Gaming,v71ce1Dqqns,0.6,2016-05-19 16:47:04,True,True
2016-05-19T20:11:25,Smart,0,0,noor alnoor,v71ce1Dqqns,0.21428571428571427,2016-05-19 20:11:25,True,True
2016-05-19T20:52:59,for a long time I was expecting for that Simply amazing,0,0,Luy,v71ce1Dqqns,0.275,2016-05-19 20:52:59,True,True
2016-05-19T22:01:18,Maaatt Daaaamon vs Beeeen Afleeeeck! One has suppressed memories the other is an accountant with turrets! Caaaaaal the psychologist pleeease!,0,0,Von Savoy,v71ce1Dqqns,-0.1953125,2016-05-19 22:01:18,True,True
2016-05-20T03:21:27,Jesus Christ its Jason bourne.,0,0,The Dinkstar,v71ce1Dqqns,0.0,2016-05-20 03:21:27,True,True
2016-05-20T04:34:51,Enough of Jason Bourne already,0,0,Sridhar Yadav,v71ce1Dqqns,0.0,2016-05-20 04:34:51,True,True
2016-05-20T07:00:23,I absolutely cannot wait!!!,0,6,Wenfred Hooper,v71ce1Dqqns,0.390625,2016-05-20 07:00:23,True,True
2016-05-20T08:57:18,him and is best bud been just said bro lets hit the gym and get ripped lml,0,0,Justin Johnson,v71ce1Dqqns,1.0,2016-05-20 08:57:18,True,True
2016-05-20T09:02:59,Aside from action scenes feels little cheap like TV series.,1,0,Epsilon,v71ce1Dqqns,0.10416666666666667,2016-05-20 09:02:59,True,True
2016-05-20T09:10:35,"""You are not Jason Bourne, you are Mark Watney and you flew to the Mars""",2,0,Hoang Dao,v71ce1Dqqns,0.0,2016-05-20 09:10:35,True,True
2016-05-20T11:06:32,All Jason Bourne movies are a must see!!,1,0,tonybebek,v71ce1Dqqns,0.0,2016-05-20 11:06:32,True,True
2016-05-20T15:05:27,#datPUNCH,0,0,Adrian Ursache,v71ce1Dqqns,0.0,2016-05-20 15:05:27,True,True
2016-05-20T19:14:35,"Bourne, Jason Bourne.",1,0,Dina Elmaraghy,v71ce1Dqqns,0.0,2016-05-20 19:14:35,True,True
2016-05-20T19:23:31,Can't wait :D,0,2,IamMilan Petrovic,v71ce1Dqqns,1.0,2016-05-20 19:23:31,True,True
2016-05-20T19:39:41,No Pamela Landy...no joy.,0,0,Ossy TK,v71ce1Dqqns,0.8,2016-05-20 19:39:41,True,True
2016-05-20T19:50:19,00:45 Opening COD Black Ops game folder.,355,5,Project-6,v71ce1Dqqns,-0.2833333333333333,2016-05-20 19:50:19,True,True
2016-05-21T00:14:02,They should had made the main actor MARK WALBERT,0,2,Zakaria Elmi,v71ce1Dqqns,0.16666666666666666,2016-05-21 00:14:02,True,True
2016-05-21T00:59:23,I hope this one does do an overdoes of Shaky-Cam like all the other ones.,0,0,Double AAron,v71ce1Dqqns,-0.125,2016-05-21 00:59:23,True,True
2016-05-21T01:23:59,"Geez, Damon got buff. What is it these days, that every single actor now apparently needs a decathlete's physique?",1,0,TheForgottenKing22,v71ce1Dqqns,-0.010714285714285711,2016-05-21 01:23:59,True,True
2016-05-21T03:18:46,cool i always liked that blonde,0,0,TheUnP0ssible,v71ce1Dqqns,0.31666666666666665,2016-05-21 03:18:46,True,True
2016-05-21T03:53:00,he get tired of lost in the  space,0,0,SS CygnusX,v71ce1Dqqns,-0.4,2016-05-21 03:53:00,True,True
2016-05-21T04:26:50,orginal borne returns,0,0,hamza ali,v71ce1Dqqns,0.0,2016-05-21 04:26:50,True,True
2016-05-21T05:17:34,thats the guy who played  the protagonist in Quantum Break,6,2,Kenshi Oman,v71ce1Dqqns,0.0,2016-05-21 05:17:34,True,True
2016-05-21T05:30:26,TLJ's face looks like it got caught in the spin cycle!,0,0,Jeff Porcaro Groove,v71ce1Dqqns,0.0,2016-05-21 05:30:26,True,True
2016-05-21T05:59:16,I loved everything about the trilogy.....from the soundtracks to the fight scenes......everything. Can't wait for this one. That spinoff one was dreadful,322,14,What Zit Tooya,v71ce1Dqqns,-0.15000000000000002,2016-05-21 05:59:16,True,True
2016-05-21T12:07:52,I'm so happy!!!,0,0,Hamza Naser,v71ce1Dqqns,1.0,2016-05-21 12:07:52,True,True
2016-05-21T13:41:42,Box office GOLD!,0,0,bulltastik,v71ce1Dqqns,0.0,2016-05-21 13:41:42,True,True
2016-05-21T17:28:57,im so waiting for july now!!,0,0,Paras Chawla,v71ce1Dqqns,0.0,2016-05-21 17:28:57,True,True
2016-05-21T21:53:51,Ocean's 14: Linus' Revenge,0,0,Incel,v71ce1Dqqns,0.0,2016-05-21 21:53:51,True,True
2016-05-22T01:06:55,Looks the same as the first 12 movies.,17,10,Joshua James,v71ce1Dqqns,0.125,2016-05-22 01:06:55,True,True
2016-05-22T03:07:35,"This looks awful, In the past I wanted another movie in this franchise but now I change my mind.",0,0,Rhaine Hook,v71ce1Dqqns,-0.625,2016-05-22 03:07:35,True,True
2016-05-22T04:22:33,Yay!!,0,0,Michele Hudson,v71ce1Dqqns,0.0,2016-05-22 04:22:33,True,True
2016-05-22T04:51:55,can't W8 2 C it. But i think they screw up. hope not...,0,0,Sam Deane,v71ce1Dqqns,0.0,2016-05-22 04:51:55,True,True
2016-05-22T06:05:06,1:47  - Poor chair! Looks awesome as hell,0,0,Mister SatisfieD 満足,v71ce1Dqqns,0.25,2016-05-22 06:05:06,True,True
2016-05-22T06:49:39,No Pam? :(,0,0,CheerX9087,v71ce1Dqqns,-0.75,2016-05-22 06:49:39,True,True
2016-05-22T09:00:29,omg 10/10 stars...imdb top 50...rotten tomatoes 99%(not 100 because you know...) :p,0,0,Prashant Gupta,v71ce1Dqqns,0.625,2016-05-22 09:00:29,True,True
2016-05-22T09:51:14,Julia Stiles is back!!! <3,0,0,Gogeta Ashame,v71ce1Dqqns,0.5,2016-05-22 09:51:14,True,True
2016-05-22T11:35:11,My apologies to Matt Damon; we ran out of time,2,0,tonyatthebeach,v71ce1Dqqns,0.0,2016-05-22 11:35:11,True,True
2016-05-22T12:26:14,am i the only want who expects that Nicky and Jason had feelings to each other before he was amnesia?,4,8,riri21kim,v71ce1Dqqns,-0.0625,2016-05-22 12:26:14,True,True
2016-05-22T12:38:04,m(__)m,0,0,Yuki Tsukabayashi,v71ce1Dqqns,0.0,2016-05-22 12:38:04,True,True
2016-05-22T17:06:59,I just hope it is as good as the first three.,0,0,David Roberts,v71ce1Dqqns,0.475,2016-05-22 17:06:59,True,True
2016-05-22T18:23:03,now thats lovie,0,0,mega Hicham,v71ce1Dqqns,0.0,2016-05-22 18:23:03,True,True
2016-05-22T19:07:32,No one gains and loses weight like Matt Damon.,0,0,Askia Jones,v71ce1Dqqns,-0.3,2016-05-22 19:07:32,True,True
2016-05-22T20:52:46,All I noticed about this movie was black ops,0,0,Fatherkamp Picks,v71ce1Dqqns,-0.16666666666666666,2016-05-22 20:52:46,True,True
2016-05-23T07:37:55,Please don't suck! Please don't suck! Please don't suck!,0,0,Pontus Ekholm,v71ce1Dqqns,0.0,2016-05-23 07:37:55,True,True
2016-05-23T08:29:05,I heard a rumour that Matt Damon met a fan in real life in the streets who begged him to make another Jason Bourne movie and that made him realise that he should make another one. So if that IS true we have that fan to thank. Then again Matt did say he loved playing Jason Bourne and it's a role he'd like to keep playing.,106,17,csgrambauer,v71ce1Dqqns,0.4166666666666667,2016-05-23 08:29:05,True,True
2016-05-23T09:29:43,"Why movie like this gets people? It's full of cut scenes that makes action sequence bad, shaky cams and unrealistic CGI with burst BGM.  Hollywood kept throwing that.",0,0,drekson23,v71ce1Dqqns,-0.21666666666666665,2016-05-23 09:29:43,True,True
2016-05-23T11:47:32,THEY SHOULD HAVE SHOWN THIS DURING THE SUPERBOWL!!  The crappy little clip they showed made me think it was not going to be any good.,0,0,Elias Arce,v71ce1Dqqns,0.25625,2016-05-23 11:47:32,True,True
2016-05-23T12:07:12,"This gon be bigger than Capt America and Zootopia   alright, maybe bigger than BvM. I cant wait!",0,0,markus albano,v71ce1Dqqns,0.0,2016-05-23 12:07:12,True,True
2016-05-23T13:47:22,MAT DAYMON,1,0,Onli Eena Belize,v71ce1Dqqns,0.0,2016-05-23 13:47:22,True,True
2016-05-23T14:24:44,whats agent K doing there..?,0,0,Awlia Fadhli,v71ce1Dqqns,0.0,2016-05-23 14:24:44,True,True
2016-05-23T23:46:44,"Looks like another typical action movie. Wish it would be like other 3 parts,  spy game nad stuff.",0,0,Radosław Szwec,v71ce1Dqqns,-0.14791666666666667,2016-05-23 23:46:44,True,True
2016-05-24T03:50:36,Jason Rambo? O.o,0,0,magdahmhara,v71ce1Dqqns,0.05,2016-05-24 03:50:36,True,True
2016-05-24T06:15:22,Hell yeeeees! jason bourne with Matt Damon.I'm waiting for this,1,0,Tomi B,v71ce1Dqqns,0.0,2016-05-24 06:15:22,True,True
2016-05-24T12:25:01,BOURNE IS BACK,0,0,Justin Gilligan,v71ce1Dqqns,0.0,2016-05-24 12:25:01,True,True
2016-05-24T12:27:13,I'm telling ya Bourne is going back to vegas to get Terry Benedict,0,0,Justin Gilligan,v71ce1Dqqns,0.0,2016-05-24 12:27:13,True,True
2016-05-24T15:23:17,"it's gonna be hard to top outcome agent 5 especially knowing that Larx the beta-2 stem program is up and running,... consider yourself informed",0,0,peter robins,v71ce1Dqqns,0.06944444444444443,2016-05-24 15:23:17,True,True
2016-05-24T17:01:19,"yep, I came a little",0,0,snoop jek,v71ce1Dqqns,-0.1875,2016-05-24 17:01:19,True,True
2016-05-24T19:17:03,I can't decide.   The Fugitive: Bourne  U.S Marshals 3: Bourne  Bourne: Marshals,0,0,Atom Man,v71ce1Dqqns,0.0,2016-05-24 19:17:03,True,True
2016-05-24T21:54:12,Καλώς τον μας τον Ιάσονα,0,0,Trollguy222,v71ce1Dqqns,0.0,2016-05-24 21:54:12,True,True
2016-05-24T23:03:51,Alicia vikander gives me chills!,0,0,Tracy Peerboom,v71ce1Dqqns,0.0,2016-05-24 23:03:51,True,True
2016-05-25T01:28:57,THIS TRAILER GIVE ME GOOSEBUMPS MAN...CANT WAIT,0,0,jassi paul,v71ce1Dqqns,0.0,2016-05-25 01:28:57,True,True
2016-05-25T01:36:18,"So much stealing from Rambo.  The entire ""find peace"" speech is a rip off of a flashback from John Rambo.",0,0,716ram,v71ce1Dqqns,0.1,2016-05-25 01:36:18,True,True
2016-05-25T04:04:21,"""...worse than Snowden""  -Stopped watching.  Maybe you should stop doing shady shit so your own citizens don't want to expose you",1,0,spider_slayer_69,v71ce1Dqqns,0.04999999999999999,2016-05-25 04:04:21,True,True
2016-05-25T09:42:56,OMFG!!! YESSSSS <33333333333333,0,0,sara f,v71ce1Dqqns,0.0,2016-05-25 09:42:56,True,True
2016-05-25T11:41:49,Bourne looks like Nathan Drake from uncharted,0,1,Μάρκος Κουτάλας,v71ce1Dqqns,0.0,2016-05-25 11:41:49,True,True
2016-05-25T11:51:21,Pilipino,0,0,Teacher Rose,v71ce1Dqqns,0.0,2016-05-25 11:51:21,True,True
2016-05-25T13:30:38,yayyy,0,0,Everett Eisner,v71ce1Dqqns,0.0,2016-05-25 13:30:38,True,True
2016-05-25T15:20:56,what's the story of this ? anyone,0,3,BlacK DusK,v71ce1Dqqns,0.0,2016-05-25 15:20:56,True,True
2016-05-25T15:36:21,"Why does it says Matt Damon & Alicia Vikander in the titel, when the blonde is Julia Stiles?",11,7,Dexterous,v71ce1Dqqns,0.0,2016-05-25 15:36:21,True,True
2016-05-25T18:54:19,"He was always better than bond... But im afraid to say, none of em are good now.",0,0,Ali Esfahanian,v71ce1Dqqns,0.19999999999999998,2016-05-25 18:54:19,True,True
2016-05-25T21:14:11,awesum,0,0,Infamous Yash Show,v71ce1Dqqns,0.0,2016-05-25 21:14:11,True,True
2016-05-26T02:21:02,"""When what you love gets taken from you.. You wanna know the truth. I'm sorry""",1,0,Fingerbd MoTM Capaldi,v71ce1Dqqns,0.0,2016-05-26 02:21:02,True,True
2016-05-26T03:01:26,badass astronaut and botanist,0,0,MassDynamic,v71ce1Dqqns,0.0,2016-05-26 03:01:26,True,True
2016-05-26T03:02:42,Sooo... It is exactly like every other Jason Bourne movie they've made. Except this time he's not looking for himself because he has amnesia. It is totally different. (*cough cough) He is looking for himself because he doesn't have the whole story.,1,0,shoshanna weinstein,v71ce1Dqqns,0.08125,2016-05-26 03:02:42,True,True
2016-05-26T03:19:47,Finally!!!!!!!!!!! The wait is over. Welcome back #JasonBourne. We missed u.,0,0,iTek Cameroon,v71ce1Dqqns,0.26666666666666666,2016-05-26 03:19:47,True,True
2016-05-26T04:35:31,what if Jimmy Kimmel was behind all this!!!????,0,0,C J,v71ce1Dqqns,-0.78125,2016-05-26 04:35:31,True,True
2016-05-26T06:27:18,Yeah baby.,0,0,Yoga Cholandha,v71ce1Dqqns,0.0,2016-05-26 06:27:18,True,True
2016-05-26T19:19:37,So thats what a diet on mars does to you huh? :/,0,0,Dwayne De Vera,v71ce1Dqqns,-0.25,2016-05-26 19:19:37,True,True
2016-05-26T19:43:19,I will see this movie.  I am a Bourne fan.  Loved the trilogy!!!  Can't wait!!!,0,0,jmatt4life,v71ce1Dqqns,1.0,2016-05-26 19:43:19,True,True
2016-05-26T23:23:13,Cool.,0,0,FireFistAce90,v71ce1Dqqns,0.35,2016-05-26 23:23:13,True,True
2016-05-27T01:54:41,Life hack: shit your pants in the theater. Everyone will leave and you'll have a snack for later.,1,0,Aumakua76,v71ce1Dqqns,-0.1,2016-05-27 01:54:41,True,True
2016-05-27T05:03:28,SUBSCRIBE TO MY CHANNEL.,0,0,Dj Hypnotize,v71ce1Dqqns,0.0,2016-05-27 05:03:28,True,True
2016-05-27T05:07:21,#thatisrealbourne,0,0,YHK YOSHAAA,v71ce1Dqqns,0.0,2016-05-27 05:07:21,True,True
2016-05-27T05:11:33,James bond vs Jason Bourne make it happen universal studios,0,0,Lairie LEGENDARY,v71ce1Dqqns,0.0,2016-05-27 05:11:33,True,True
2016-05-27T05:12:09,"See, this is what happens when you leave a man on Mars",0,0,D MAN,v71ce1Dqqns,0.0,2016-05-27 05:12:09,True,True
2016-05-27T05:52:42,wow man so good .....,1,0,Kenjamin S Tennyson,v71ce1Dqqns,0.39999999999999997,2016-05-27 05:52:42,True,True
2016-05-27T07:47:44,"we used to train  together, Matt Damon and  I, back then when he was in INDIA.",0,0,YouTube Friends,v71ce1Dqqns,0.0,2016-05-27 07:47:44,True,True
2016-05-27T07:49:35,"Oh lol, I thought 0:06 was the end of the trailer xD",133,0,Luke,v71ce1Dqqns,0.8,2016-05-27 07:49:35,True,True
2016-05-27T16:18:59,i saw the supermecy and ultimatum just today....now i  can't for this one,3,3,Dipender Kumar,v71ce1Dqqns,0.0,2016-05-27 16:18:59,True,True
2016-05-27T20:02:40,Damn,0,0,Promik Majumder,v71ce1Dqqns,0.0,2016-05-27 20:02:40,True,True
2016-05-27T23:44:38,I'm excited to new movie of him!,0,0,Carlenna Benner,v71ce1Dqqns,0.2727272727272727,2016-05-27 23:44:38,True,True
2016-05-28T02:05:15,I wonder what literary item Jason Bourne will beat a man up with in THIS movie... The Bourne Identity: ink pen The Bourne Supremacy: magazine The Bourne Ultimatum: book Jason Bourne: Number 2 pencil?,0,0,OnyxFire,v71ce1Dqqns,0.1,2016-05-28 02:05:15,True,True
2016-05-28T05:08:40,google.com/+ginofilmshdfortmyers,0,0,Leonardo Jovani Vazquez,v71ce1Dqqns,0.0,2016-05-28 05:08:40,True,True
2016-05-28T05:13:45,I remember watching trailer in the 90s on VCD. It was about a murder done in the desert and forgetting to finish the job. I forgot what the name of the movie was. So I don't know whether the movie came on VCD. I am sure it is taken from a novel. Does any one know the name of this movie?,0,0,mihinduep,v71ce1Dqqns,0.5,2016-05-28 05:13:45,True,True
2016-05-28T05:16:49,I remember watching a trailer on VCD in the 90s. It was about a serial killer who couldn't be caught until the guy investigating started to think like the serial killer after all the years he's been investigating this case. Then the serial killer was caught. Does anyone know the name of this movie? I am sure it is taken from a novel.,0,0,mihinduep,v71ce1Dqqns,0.5,2016-05-28 05:16:49,True,True
2016-05-28T12:55:02,where is noah vossen?,1,0,EDMlover,v71ce1Dqqns,0.0,2016-05-28 12:55:02,True,True
2016-05-28T13:09:16,Can't believe the first film came out in 2002. Seeing a young Matt D.on the screen and now at 45 he looks great,95,1,odalis gonzalez,v71ce1Dqqns,0.3833333333333333,2016-05-28 13:09:16,True,True
2016-05-28T22:26:57,Me gusta esta saga xq de acción real no es tanta fantasía,0,0,alexo An. carvajal Nj,v71ce1Dqqns,0.2,2016-05-28 22:26:57,True,True
2016-05-28T23:19:37,"just as he knocks out that heavy meatbag in the desert, i'm thinking, i wana watch this flick...",0,0,garry sexton,v71ce1Dqqns,-0.2,2016-05-28 23:19:37,True,True
2016-05-29T09:13:16,let's hope there's not going to be too much shaky camera,7,0,Zeugl Cockatrice,v71ce1Dqqns,-0.3333333333333333,2016-05-29 09:13:16,True,True
2016-05-29T10:11:26,Here is what the plot should have been........JB is hired by the same agency he fought all these years to hunt and track down another loose cannon like he was.,0,0,JRNexGen,v71ce1Dqqns,-0.0774928774928775,2016-05-29 10:11:26,True,True
2016-05-29T13:01:38,Jason Bourne meets the fugitive.,0,0,Issie wizzie,v71ce1Dqqns,0.0,2016-05-29 13:01:38,True,True
2016-05-29T13:17:00,"Bourne after coming from Mars, he´s pissed off for all the time he was left behind...  Some people have to pay for that...",4,1,Agustin Cesar,v71ce1Dqqns,-0.2,2016-05-29 13:17:00,True,True
2016-05-29T15:09:23,Jason bourne is Bruce Wayne's sensei,0,0,Otori Shingen,v71ce1Dqqns,0.0,2016-05-29 15:09:23,True,True
2016-05-29T16:00:35,"Matt Damon is now old, ladies and gentlemen.",0,0,tracks wod,v71ce1Dqqns,0.1,2016-05-29 16:00:35,True,True
2016-05-29T18:08:40,00:45 = Jason Bourne: Tell me.. Me: Do you bleed?,3,1,Zeshpee,v71ce1Dqqns,0.0,2016-05-29 18:08:40,True,True
2016-05-29T20:02:56,Jason Bourne mean James Bond.,1,1,sammy ham,v71ce1Dqqns,-0.3125,2016-05-29 20:02:56,True,True
2016-05-29T21:18:38,Jason Bourn is one of the favourites movies of my dad... (:,0,0,Hadjar benaida,v71ce1Dqqns,0.0,2016-05-29 21:18:38,True,True
2016-05-29T21:59:59,How many times are they going to come after this guy?,0,0,Jalen,v71ce1Dqqns,0.5,2016-05-29 21:59:59,True,True
2016-05-30T02:13:50,oh SHIT that looks so good!,0,0,bookaddict209,v71ce1Dqqns,0.3375,2016-05-30 02:13:50,True,True
2016-05-30T03:49:28,Can't wait,0,0,Cat Lala,v71ce1Dqqns,0.0,2016-05-30 03:49:28,True,True
2016-05-30T04:46:46,Me vine.,0,0,Jhon González,v71ce1Dqqns,0.0,2016-05-30 04:46:46,True,True
2016-05-30T07:12:52,Alicia Vikander!,0,0,Fakhri Ghiffari,v71ce1Dqqns,0.0,2016-05-30 07:12:52,True,True
2016-05-30T08:13:18,"Good or Bad i'm still seeing this in theaters!  (And before you studio executives get all excited thinking, were rich, just remember i can afford to see this becuase i didn't see 10+ crap movies you made prior)",2,0,Merchant Ivory,v71ce1Dqqns,-0.03749999999999998,2016-05-30 08:13:18,True,True
2016-05-30T09:31:10,God he looks like he just came back from Mars....,0,0,Narbacular Drop,v71ce1Dqqns,0.0,2016-05-30 09:31:10,True,True
2016-05-30T11:06:54,??What's the name of this movie,0,0,Darren Ali,v71ce1Dqqns,0.0,2016-05-30 11:06:54,True,True
2016-05-30T11:16:05,Will Hunting breaking bad,0,0,Hassan,v71ce1Dqqns,-0.6999999999999998,2016-05-30 11:16:05,True,True
2016-05-30T15:52:08,tak sabar menunggu filmnya....,0,0,tri yadi,v71ce1Dqqns,0.0,2016-05-30 15:52:08,True,True
2016-05-30T16:21:31,Before Avenger . .  Before Hawk Eyes . .  There was . . .  BOURNE . .,0,0,Abdul Majied,v71ce1Dqqns,0.0,2016-05-30 16:21:31,True,True
2016-05-30T16:55:20,Thank God.  Let's just pretend The Bourne Legacy never happened.,4,1,Nightowl358,v71ce1Dqqns,0.0,2016-05-30 16:55:20,True,True
2016-05-30T17:40:53,How often have we seen that one big punch knocking the opponent (who has really no role in the movie) out.,0,0,Moh B,v71ce1Dqqns,-0.05,2016-05-30 17:40:53,True,True
2016-05-31T02:36:23,"Did that even make sense? More jumping and flying dudes, please!",0,0,Stephen Reynolds,v71ce1Dqqns,0.625,2016-05-31 02:36:23,True,True
2016-05-31T03:20:14,I... am... DISCOUNT BATMAN!,0,0,Douglas Fulmer,v71ce1Dqqns,0.0,2016-05-31 03:20:14,True,True
2016-05-31T04:59:01,another one?,0,0,Echad,v71ce1Dqqns,0.0,2016-05-31 04:59:01,True,True
2016-05-31T07:19:41,i know This Matt on this film can be amazing....  Jason Bourne... love u so much,1,0,albertus joshua,v71ce1Dqqns,0.43333333333333335,2016-05-31 07:19:41,True,True
2016-05-31T14:15:15,can't wait..,0,0,Tiffani Pufee,v71ce1Dqqns,0.0,2016-05-31 14:15:15,True,True
2016-05-31T15:40:29,"I didn't think Matt Damon's baby face could ever look old, but I was wrong! Happens to the best of us... Julia Styles looks good though!",0,0,theR0nin,v71ce1Dqqns,0.3375,2016-05-31 15:40:29,True,True
2016-05-31T16:08:06,Matt is getting older... it's finally happening! I wondered when he was going to age...,0,0,Chane Kotze,v71ce1Dqqns,0.08333333333333333,2016-05-31 16:08:06,True,True
2016-05-31T18:55:25,"I don't have anything nice to say, so I guess I'll just say 'Piss Weasels'.",0,0,wayne morris,v71ce1Dqqns,0.6,2016-05-31 18:55:25,True,True
2016-05-31T20:27:38,WTF Does the camera man have MS? ,0,0,A Johnson,v71ce1Dqqns,-0.5,2016-05-31 20:27:38,True,True
2016-05-31T22:33:39,"""Remembering everything doesn't mean you know everything!"" Oh, yeah? Sounds like a good place to start! ;-)",5,0,Timeship,v71ce1Dqqns,0.24479166666666666,2016-05-31 22:33:39,True,True
