timestamp,text,like_count,reply_count,author,trailer_id,sentiment_score,datetime,used_for_model,used_for_visualization
2016-04-21T04:33:27,First,1,0,Movie Trailers,v71ce1Dqqns,0.25,2016-04-21 04:33:27,True,True
2016-04-21T04:33:30,Ahh,0,0,Brudda,v71ce1Dqqns,0.0,2016-04-21 04:33:30,True,True
2016-04-21T04:34:02,Cool,0,0,Declan Sullivan,v71ce1Dqqns,0.35,2016-04-21 04:34:02,True,True
2016-04-21T04:34:06,Damn I wanted to be,0,0,Jordan Stewart,v71ce1Dqqns,0.0,2016-04-21 04:34:06,True,True
2016-04-21T04:34:09,Alicia Vikander is an actress to look out for in the future. Don't sleep on her she's so amazing,0,3,Invidious TV,v71ce1Dqqns,0.30000000000000004,2016-04-21 04:34:09,True,True
2016-04-21T04:34:34,"SHOULD HAVE BEEN CALLED REBOURNE, GET IT?!?!?",546,33,Matt Prazak,v71ce1Dqqns,0.0,2016-04-21 04:34:34,True,True
2016-04-21T04:34:37,third bitches and its a movies clip so suck it,0,0,Christian G,v71ce1Dqqns,0.0,2016-04-21 04:34:37,True,True
2016-04-21T04:34:59,Damn im early  let me think of something PANCAKES,0,0,Jack,v71ce1Dqqns,0.1,2016-04-21 04:34:59,True,True
2016-04-21T04:35:05,8th,0,0,Mr. R,v71ce1Dqqns,0.0,2016-04-21 04:35:05,True,True
2016-04-21T04:35:32,Can help but say Matt Damon like they did in the South Park movie,0,0,Jeddypoo,v71ce1Dqqns,0.0,2016-04-21 04:35:32,True,True
2016-04-21T04:35:54,Sometimes I wonder is they should've just stopped at 3... but idk this looks so good... I'm conflicted,0,1,Invidious TV,v71ce1Dqqns,0.7,2016-04-21 04:35:54,True,True
2016-04-21T04:36:22,Sign me up!!! I'm there day 1!!!!,0,0,dimitris bright,v71ce1Dqqns,0.0,2016-04-21 04:36:22,True,True
2016-04-21T04:36:48,The best ever made so far,0,0,Sorin Strat,v71ce1Dqqns,0.55,2016-04-21 04:36:48,True,True
2016-04-21T04:36:52,beautiful,0,0,Hanson Ma,v71ce1Dqqns,0.85,2016-04-21 04:36:52,True,True
2016-04-21T04:37:04,Does this movie have anything to do with the bourne identity?,0,1,DaviL,v71ce1Dqqns,0.0,2016-04-21 04:37:04,True,True
2016-04-21T04:37:15,ok... really milking that fight club scene.,0,0,King Roosta,v71ce1Dqqns,0.35,2016-04-21 04:37:15,True,True
2016-04-21T04:37:16,yayy,0,0,Hatif Basharyar,v71ce1Dqqns,0.0,2016-04-21 04:37:16,True,True
2016-04-21T04:37:34,Movie looks really good 👌,0,0,Brandon X Dinero,v71ce1Dqqns,0.7,2016-04-21 04:37:34,True,True
2016-04-21T04:37:42,I wonder if Pamela Landy shows up again,0,0,Greg D.,v71ce1Dqqns,0.0,2016-04-21 04:37:42,True,True
2016-04-21T04:37:45,"That pointless Snowden name drop, though.",36,4,Jizzle Doops,v71ce1Dqqns,-0.25,2016-04-21 04:37:45,True,True
2016-04-21T04:37:46,MATT DAMON,0,0,Puff der Zauberdrache,v71ce1Dqqns,0.0,2016-04-21 04:37:46,True,True
2016-04-21T04:38:06,Pretty excited,0,0,Alex Altringer,v71ce1Dqqns,0.3125,2016-04-21 04:38:06,True,True
2016-04-21T04:38:21,What a fuckin trailer damn!!! Im sold!!,0,0,CG M,v71ce1Dqqns,0.0,2016-04-21 04:38:21,True,True
2016-04-21T04:38:31,"Wow, shows way too much for a first trailer.",0,0,efreak15,v71ce1Dqqns,0.18333333333333335,2016-04-21 04:38:31,True,True
2016-04-21T04:38:34,can't wait for this summer bournes gonna be good,1,0,Egg Plays,v71ce1Dqqns,0.7,2016-04-21 04:38:34,True,True
2016-04-21T04:38:34,........,0,0,Raphael Alexander,v71ce1Dqqns,0.0,2016-04-21 04:38:34,True,True
2016-04-21T04:38:49,hola👋,0,0,ulises mercer,v71ce1Dqqns,0.0,2016-04-21 04:38:49,True,True
2016-04-21T04:39:20,"For anyone who likes Bourne this is probably gonna be nothing like the first two films,  but more an explosive action film (aka lacking the realism, thrills, and twists of Identity and Supremacy).",2,9,AG64,v71ce1Dqqns,0.2833333333333333,2016-04-21 04:39:20,True,True
2016-04-21T04:39:27,I'm more excited to see what will Jimmy Kimmel do to burn Matt Damon in his film,63,1,Erwilson De Jesus,v71ce1Dqqns,0.4375,2016-04-21 04:39:27,True,True
2016-04-21T04:39:44,00:35 Do you bleed?,0,0,Harris Sharif,v71ce1Dqqns,0.0,2016-04-21 04:39:44,True,True
2016-04-21T04:39:51,This looks like a reboot...I pass,1,5,KILLAWATTS 804,v71ce1Dqqns,0.0,2016-04-21 04:39:51,True,True
2016-04-21T04:39:56,Jason Bourne would kick James Bond's ass.,29,9,GnarbySZN🐍,v71ce1Dqqns,0.0,2016-04-21 04:39:56,True,True
2016-04-21T04:40:20,the only movie where Matt Damon doesn't need to be saved,0,2,professor weedington,v71ce1Dqqns,0.0,2016-04-21 04:40:20,True,True
2016-04-21T04:41:05,This trailer looks good. So can we all just forget Legacy ever happened. I don't even consider that film to be part of the franchise.,365,47,Luvie1980,v71ce1Dqqns,0.7,2016-04-21 04:41:05,True,True
2016-04-21T04:41:07,it took 3 sneak peeks to get here REALLY?,0,0,ixnkz,v71ce1Dqqns,0.2,2016-04-21 04:41:07,True,True
2016-04-21T04:41:17,Oh Frick yeah I don't care if its any good or bad I'm excited.,173,4,Apollyonn,v71ce1Dqqns,0.12500000000000003,2016-04-21 04:41:17,True,True
2016-04-21T04:41:23,Awesome....Waiting for it in big screens☺,0,0,Trivikram Kavuri,v71ce1Dqqns,0.0,2016-04-21 04:41:23,True,True
2016-04-21T04:41:34,Is it just me or is it always the same thing.. !?!?,0,0,kevinNFL50,v71ce1Dqqns,0.0,2016-04-21 04:41:34,True,True
2016-04-21T04:41:37,"About time, finally.",0,0,Omega 3,v71ce1Dqqns,0.0,2016-04-21 04:41:37,True,True
2016-04-21T04:42:34,Looks pretty awesome tho,0,0,Harris Sharif,v71ce1Dqqns,0.625,2016-04-21 04:42:34,True,True
2016-04-21T04:42:37,He's back bitches!!,0,0,Justin,v71ce1Dqqns,0.0,2016-04-21 04:42:37,True,True
2016-04-21T04:42:50,Should have been called The Bourne Revolution. Or maybe that should be the sequel to this.,0,0,BloodRedRain72,v71ce1Dqqns,0.0,2016-04-21 04:42:50,True,True
2016-04-21T04:42:59,that epic raiders of the lost ark punch though!!!,3,0,cr0nosphere,v71ce1Dqqns,0.1953125,2016-04-21 04:42:59,True,True
2016-04-21T04:43:32,0:50 Roll Credits,1,0,Daniel Attrell,v71ce1Dqqns,0.0,2016-04-21 04:43:32,True,True
2016-04-21T04:43:41,It was Kimmel....its always been Kimmel,0,0,Oh!,v71ce1Dqqns,0.0,2016-04-21 04:43:41,True,True
2016-04-21T04:44:07,That was legit,0,0,Rockerdude17,v71ce1Dqqns,0.0,2016-04-21 04:44:07,True,True
2016-04-21T04:44:13,"Hi , Guillermo, you got a movie to shoot......",0,0,Happy Birthday,v71ce1Dqqns,0.0,2016-04-21 04:44:13,True,True
2016-04-21T04:44:40,Matt fuckin Damon,0,0,Alltilt,v71ce1Dqqns,0.0,2016-04-21 04:44:40,True,True
2016-04-21T04:45:40,So... does anybody feel that this trailer spoils the movie?,0,2,Yoshi,v71ce1Dqqns,0.0,2016-04-21 04:45:40,True,True
2016-04-21T04:45:43,😍😘❤❤❤❤❤❤,0,0,Q_W8K,v71ce1Dqqns,0.0,2016-04-21 04:45:43,True,True
2016-04-21T04:46:18,the black kid lost all kindz of weight...,0,0,Shihang Su,v71ce1Dqqns,-0.16666666666666666,2016-04-21 04:46:18,True,True
2016-04-21T04:46:20,Remembering everything doesnt mean you know everything... Tell me...do you bleed? LOL,0,0,TheManBehindTheScene,v71ce1Dqqns,0.24375000000000002,2016-04-21 04:46:20,True,True
2016-04-21T04:46:21,This looks pretty damn good. I'm definately gonna see it.,0,0,Aaron Siewert,v71ce1Dqqns,0.475,2016-04-21 04:46:21,True,True
2016-04-21T04:47:10,jason bourne meets jhon wick,0,0,Artur Delgad,v71ce1Dqqns,0.0,2016-04-21 04:47:10,True,True
2016-04-21T04:47:41,:D Can't wait to watch this in theaters hope they ease up on the shaky cam this time cause that is getting played out but glad Matt Damon is back as badass Bourne and shit ^_^,0,0,Tony Lawliet,v71ce1Dqqns,0.19333333333333336,2016-04-21 04:47:41,True,True
2016-04-21T04:48:03,yes yes I can't wait,0,0,serialkiller77,v71ce1Dqqns,0.0,2016-04-21 04:48:03,True,True
2016-04-21T04:48:13,and now we wait for jeremy jahns to talk about it,0,0,Taylor Eide,v71ce1Dqqns,0.0,2016-04-21 04:48:13,True,True
2016-04-21T04:48:27,Damn !!! Why summer?? Why not now?!,0,0,Alaeddin Dhahri,v71ce1Dqqns,0.0,2016-04-21 04:48:27,True,True
2016-04-21T04:48:55,Yes. Excellent! Definitely my favourite action series next to the first Matrix movie. Matt Damon is so good in this role. They have had some amazing guests in this series and now we have Alicia Vikander. Awesome. Looking forward to how this all unfolds.,8,0,Nostalgic_Chaos,v71ce1Dqqns,0.45625,2016-04-21 04:48:55,True,True
2016-04-21T04:50:28,Alicia. Vikander. Liked.,1,0,John Bonini,v71ce1Dqqns,0.6,2016-04-21 04:50:28,True,True
2016-04-21T04:51:14,"Jason Bourne: ""Tell Me.................Do you bleed?""",8,1,Dylan G.,v71ce1Dqqns,0.0,2016-04-21 04:51:14,True,True
2016-04-21T04:52:24,damn...looks awesome. hopefully James bond can look to Bourne for more inspiration...,0,0,Anatole Navarro,v71ce1Dqqns,0.75,2016-04-21 04:52:24,True,True
2016-04-21T04:52:47,That was some fakeass punch,0,0,Calvin Wu,v71ce1Dqqns,0.0,2016-04-21 04:52:47,True,True
2016-04-21T04:54:20,"Well, I've found my summer movie to get psyched over...",0,0,L.D. Johnson,v71ce1Dqqns,0.0,2016-04-21 04:54:20,True,True
2016-04-21T04:54:57,por fin!,0,0,Gianmarco Benites,v71ce1Dqqns,0.0,2016-04-21 04:54:57,True,True
2016-04-21T04:56:08,So glad to be alive right now honestly.,0,0,Teeboy,v71ce1Dqqns,0.37142857142857144,2016-04-21 04:56:08,True,True
2016-04-21T04:56:17,I hope there is no shaky cams,3,4,Dylan G.,v71ce1Dqqns,0.16666666666666666,2016-04-21 04:56:17,True,True
2016-04-21T04:56:35,This looks tight,0,0,Simon Crowley,v71ce1Dqqns,-0.17857142857142858,2016-04-21 04:56:35,True,True
2016-04-21T04:56:57,JESUS CHRIST IT'S LESTER GRIMES,0,0,sahalanimation,v71ce1Dqqns,0.0,2016-04-21 04:56:57,True,True
2016-04-21T04:59:22,love it! will be on my watch see for the summer!,0,0,Hilbert Sandifer,v71ce1Dqqns,0.78125,2016-04-21 04:59:22,True,True
2016-04-21T04:59:55,2:15 One Punch Matt,26,1,Jovic Beltran,v71ce1Dqqns,0.0,2016-04-21 04:59:55,True,True
2016-04-21T05:01:18,Yeahhhhhhhhhhhhhhhhhh,0,0,ZahedyR,v71ce1Dqqns,0.0,2016-04-21 05:01:18,True,True
2016-04-21T05:02:27,looking kinda old there matt,0,0,Dawson Birchall,v71ce1Dqqns,0.1,2016-04-21 05:02:27,True,True
2016-04-21T05:02:36,SO PUMPED,0,0,Ian Higgins,v71ce1Dqqns,0.0,2016-04-21 05:02:36,True,True
2016-04-21T05:03:39,Why watch? Because Alicia,0,0,Crazy 88,v71ce1Dqqns,0.0,2016-04-21 05:03:39,True,True
2016-04-21T05:04:30,Is renner's character in it? I hope so.,3,4,Realmadridman24,v71ce1Dqqns,0.0,2016-04-21 05:04:30,True,True
2016-04-21T05:04:42,bout damn time,0,0,marvdatboi,v71ce1Dqqns,0.0,2016-04-21 05:04:42,True,True
2016-04-21T05:04:47,2 times,0,0,Derrick Nichols,v71ce1Dqqns,0.0,2016-04-21 05:04:47,True,True
2016-04-21T05:04:49,Matt Damon plays his role so well,0,0,Tailor,v71ce1Dqqns,0.0,2016-04-21 05:04:49,True,True
2016-04-21T05:05:15,"Lmao. ""Could be worse than Snowden""",2,0,HonestHedgehog Life,v71ce1Dqqns,0.09999999999999998,2016-04-21 05:05:15,True,True
2016-04-21T05:05:21,Jason Bourne should meet mission impossible,0,6,Oliver2Morrow,v71ce1Dqqns,-0.6666666666666666,2016-04-21 05:05:21,True,True
2016-04-21T05:07:25,Not the same director. Don't you just hate films from different directors e.g 300 sin city. I feel like this film is trying to be bigger than what it is. We love Bourne because he kicks ass in a sought of realistic gritty King of way using his brain as his best weapon. This trailer doesn't give me that vibe,0,0,Ebun321,v71ce1Dqqns,0.10833333333333332,2016-04-21 05:07:25,True,True
2016-04-21T05:11:15,Matt Damon Is The Jason Bourne!!,0,0,Epyonwings,v71ce1Dqqns,0.0,2016-04-21 05:11:15,True,True
2016-04-21T05:12:11,'Jesus Christ! It's Jason Bourne' that line is awesome,0,0,Raymond Benito,v71ce1Dqqns,1.0,2016-04-21 05:12:11,True,True
2016-04-21T05:13:14,This story didn't need another one,0,1,bmaster461603,v71ce1Dqqns,0.0,2016-04-21 05:13:14,True,True
2016-04-21T05:13:29,I'm I the only one who would like to see Jeremy Renner in this film as well... Bourne Legacy wasn't all that good but it was compelling enough to make me want a sequel,0,5,Ratmaster4000,v71ce1Dqqns,0.25,2016-04-21 05:13:29,True,True
2016-04-21T05:14:07,Well that was a great movie.,0,1,Micah Turner,v71ce1Dqqns,0.8,2016-04-21 05:14:07,True,True
2016-04-21T05:14:41,this will be SICK!!,0,0,B. Chandler,v71ce1Dqqns,-1.0,2016-04-21 05:14:41,True,True
2016-04-21T05:15:40,bout time,0,0,z string,v71ce1Dqqns,0.0,2016-04-21 05:15:40,True,True
2016-04-21T05:17:38,Wait didn't they make this movie already with hawk eye,0,1,Heero Abdulai,v71ce1Dqqns,0.0,2016-04-21 05:17:38,True,True
2016-04-21T05:18:25,"that Alicia vikander lady sure is pretty, but she talks like shakira sings. a phlegmy goat.",0,0,Jr5189,v71ce1Dqqns,0.375,2016-04-21 05:18:25,True,True
2016-04-21T05:19:48,Oh good God... Welcome back boys! We missed you!,0,0,YouBurp297,v71ce1Dqqns,0.5,2016-04-21 05:19:48,True,True
2016-04-21T05:21:06,he still dont know the truth....,0,0,ehaze,v71ce1Dqqns,0.0,2016-04-21 05:21:06,True,True
2016-04-21T05:21:18,"when he said ""I volunteer because of a lie"" 😨 chills damnn Bourne it's the best action movies",0,0,Felax Zamora,v71ce1Dqqns,0.55,2016-04-21 05:21:18,True,True
2016-04-21T05:21:31,Oh shit they brought back Tommy Lee Jones.. it can only mean one thing..  _Matt Damon & Tommy Lee Jones star in.._ (Honest Trailers Voice)  *The Bourne Fugitive*,16,4,Nostalgia Guy,v71ce1Dqqns,0.017500000000000005,2016-04-21 05:21:31,True,True
2016-04-21T05:24:24,I can't remember what happened in the other films........wait am I Jason Bourne????,1228,25,Will B,v71ce1Dqqns,-0.125,2016-04-21 05:24:24,True,True
2016-04-21T05:27:16,cant wait people,2,0,Captain Carter,v71ce1Dqqns,0.0,2016-04-21 05:27:16,True,True
2016-04-21T05:28:57,that's why we save matt damon from mars,1,0,Jaya Prima,v71ce1Dqqns,0.0,2016-04-21 05:28:57,True,True
2016-04-21T05:30:54,"Is this an ""One Punch Man"" movie??",0,1,Marcelo Sichonany,v71ce1Dqqns,0.0,2016-04-21 05:30:54,True,True
2016-04-21T05:37:01,I date black girls because I don't wanna meet fathers,0,0,Entertainment,v71ce1Dqqns,-0.16666666666666666,2016-04-21 05:37:01,True,True
2016-04-21T05:38:07,Matt Damon look REALLY uninterested to be in this movie.,0,0,Big G Man,v71ce1Dqqns,0.2,2016-04-21 05:38:07,True,True
2016-04-21T05:40:01,can wait to see this movie!!😂,0,0,MoniiVannii Betancourtt,v71ce1Dqqns,0.0,2016-04-21 05:40:01,True,True
2016-04-21T05:40:11,Matt does still have it! Am i the only one who is excited for this movie?,0,0,Danny Stonn,v71ce1Dqqns,0.1875,2016-04-21 05:40:11,True,True
2016-04-21T05:40:32,"Yey, shaky cam.",0,0,TheFikri136,v71ce1Dqqns,-0.3333333333333333,2016-04-21 05:40:32,True,True
2016-04-21T05:40:48,Looks boring compared to the originals.,0,0,D M,v71ce1Dqqns,-1.0,2016-04-21 05:40:48,True,True
2016-04-21T05:41:27,Whoa.. start of another franchise....,0,0,Anurag Anand,v71ce1Dqqns,0.0,2016-04-21 05:41:27,True,True
2016-04-21T05:44:13,"Why can't it be named ""The Bourne Fugitive""? Great trailer",0,0,MrAwsomeness45,v71ce1Dqqns,0.8,2016-04-21 05:44:13,True,True
2016-04-21T05:46:54,"""What a Mary Sue!""  --Max Landis",0,0,Jaws,v71ce1Dqqns,0.0,2016-04-21 05:46:54,True,True
2016-04-21T05:48:25,wow looks awesome!,0,0,Stephen Baker,v71ce1Dqqns,0.55,2016-04-21 05:48:25,True,True
2016-04-21T05:48:29,Mah Dude,0,0,Simo Saarinen,v71ce1Dqqns,0.0,2016-04-21 05:48:29,True,True
2016-04-21T05:53:54,"Jason Bourne is basically a faceless man who became no one, then given an other identity. Treadstone was basically the House of Black and White.",0,0,Albert Esteva,v71ce1Dqqns,-0.09722222222222221,2016-04-21 05:53:54,True,True
2016-04-21T05:55:25,Sweet!  Bring it on.  Always enjoyed the Bourne series. :),0,0,bowwing333,v71ce1Dqqns,0.4791666666666667,2016-04-21 05:55:25,True,True
2016-04-21T05:56:55,"just the moment it was going to Be serious, they where playing call of duty Black ops",0,0,Rick Neefjes,v71ce1Dqqns,-0.25,2016-04-21 05:56:55,True,True
2016-04-21T05:56:55,"I don't like how Bourne is portrayed to be this super human that's has no flaws at all. In the previous movies, particularly in Ultimatum Bourne was occasionally presented being vulnerable. This was what caught the audience. He wasn't far from an ordinary person. Now it seems like he's just undefeatable.",0,2,100jokes,v71ce1Dqqns,-0.03958333333333333,2016-04-21 05:56:55,True,True
2016-04-21T05:57:07,"""I think in terms of another one, the story of this guy's search for his identity is over, because he's got all the answers, so there's no way we can trot out the same character, and so much of what makes him interesting is that internal struggle that was happening for him, am I a good guy, am I a bad guy, what is the secret behind my identity, what am I blocking out, why am I remembering these disturbing images? So all of that internal propulsive mechanism that drives the character is not there, so if there was to be another one then it would have to be a complete reconfiguration, you know, where do you go from there?""  -Matt Damon",1,0,HD,v71ce1Dqqns,-0.045454545454545456,2016-04-21 05:57:07,True,True
2016-04-21T05:57:47,Jimmy Kimmel gonna be all over this like a fly round shit,0,0,Old channel Gaming,v71ce1Dqqns,0.13333333333333336,2016-04-21 05:57:47,True,True
2016-04-21T05:58:07,Bourne rulz!,0,0,djcocko1,v71ce1Dqqns,0.0,2016-04-21 05:58:07,True,True
2016-04-21T05:58:16,"god, this is so beautiful",0,0,Karla Oliveira,v71ce1Dqqns,0.85,2016-04-21 05:58:16,True,True
2016-04-21T05:58:25,0:52 alfredo from elementary..!!  :),0,0,Gurdhian Singh,v71ce1Dqqns,0.484375,2016-04-21 05:58:25,True,True
2016-04-21T05:59:14,yesss mattdamon,0,0,Mama Rambo,v71ce1Dqqns,0.0,2016-04-21 05:59:14,True,True
2016-04-21T06:02:45,DO NOT RUIN ONE OF THE BEST TRILOGIES,0,1,Nathan Rowalnd,v71ce1Dqqns,1.0,2016-04-21 06:02:45,True,True
2016-04-21T06:03:06,Jason Bourne Black ops 1,0,0,Jackvader LionHeart,v71ce1Dqqns,-0.16666666666666666,2016-04-21 06:03:06,True,True
2016-04-21T06:05:26,"I thought the female lead, was Ronda Rousey :-)",0,0,Kiran kisku,v71ce1Dqqns,0.25,2016-04-21 06:05:26,True,True
2016-04-21T06:07:55,GIVE US A DATE!,0,0,Guami Bear,v71ce1Dqqns,0.0,2016-04-21 06:07:55,True,True
2016-04-21T06:09:11,1:50 Tommy Lee Jones straight up sounded like Ben Affleck's Batman,0,0,HeyMrAlvaro,v71ce1Dqqns,0.2,2016-04-21 06:09:11,True,True
2016-04-21T06:12:11,he got JACKED!!!,0,0,Matthew Alexander,v71ce1Dqqns,0.0,2016-04-21 06:12:11,True,True
2016-04-21T06:13:05,It's about time Bourne goes to Vegas!,0,0,clunkmess,v71ce1Dqqns,0.0,2016-04-21 06:13:05,True,True
2016-04-21T06:14:14,"""Jesus Christ it's Jason Bourne, the other one """,0,0,factura5,v71ce1Dqqns,-0.125,2016-04-21 06:14:14,True,True
2016-04-21T06:15:24,Omg American James bond ... That sucks,0,5,Harley Phillips,v71ce1Dqqns,-0.15,2016-04-21 06:15:24,True,True
2016-04-21T06:16:45,man I was an extra for this movie. definitely the greatest experience ever....Matt Damon is such a nice guy. really love these movies,1,0,Joe Ker,v71ce1Dqqns,0.35000000000000003,2016-04-21 06:16:45,True,True
2016-04-21T06:17:13,"elbow scene, epic",0,0,nadz yea,v71ce1Dqqns,0.1,2016-04-21 06:17:13,True,True
2016-04-21T06:19:00,"I don't know, it feels like I've seen it all before. It feels like they're not bringing anything new to the table...",0,0,Ingo Miguel,v71ce1Dqqns,0.13636363636363635,2016-04-21 06:19:00,True,True
2016-04-21T06:19:22,Thank you for bringing matt damon back!,0,0,Kevin,v71ce1Dqqns,0.0,2016-04-21 06:19:22,True,True
2016-04-21T06:22:06,"Yeah, government absolutely would have a folder on a computer that says ""Black Ops"". Sure.",0,0,2904RX,v71ce1Dqqns,0.17777777777777778,2016-04-21 06:22:06,True,True
2016-04-21T06:23:06,"Matt damon awesome as always, but now they should come over bourne series, so many sequels leads to degrading quality.",0,4,gaurav mishra,v71ce1Dqqns,0.75,2016-04-21 06:23:06,True,True
2016-04-21T06:24:33,Should've been called The Bourne Impact!! That KO was SUPERB,0,0,VideoZonePro,v71ce1Dqqns,1.0,2016-04-21 06:24:33,True,True
2016-04-21T06:26:00,"""Why would he come back"" shows Director Paul Greengrass title LMAOOOOOOO its funny cause Matt said he wouldn't come back unless Greengrass directed",2,0,Dre5ds,v71ce1Dqqns,0.08333333333333333,2016-04-21 06:26:00,True,True
2016-04-21T06:26:04,aaaaahhhhhhb shiiiitttttt,0,0,The Master Baetor,v71ce1Dqqns,0.0,2016-04-21 06:26:04,True,True
2016-04-21T06:27:44,I hope Universal release it in IMAX. Looks intense and no more shaky cam!,0,0,Elbert Reyner,v71ce1Dqqns,-0.11666666666666665,2016-04-21 06:27:44,True,True
2016-04-21T06:28:48,and this is Matt Damon at his best.,0,0,Tonmoy Dev Sharma,v71ce1Dqqns,1.0,2016-04-21 06:28:48,True,True
2016-04-21T06:30:02,Alicia Vikander voice is sexy af,0,0,HarryLopez82,v71ce1Dqqns,0.5,2016-04-21 06:30:02,True,True
2016-04-21T06:30:20,Anyone else glad to see Matt Damon back?,0,0,Joshua Kapusinski,v71ce1Dqqns,0.25,2016-04-21 06:30:20,True,True
2016-04-21T06:30:23,Glad Greengrass is back on this.,0,0,Max Marx,v71ce1Dqqns,0.25,2016-04-21 06:30:23,True,True
2016-04-21T06:30:54,i just thought of theme song to come in this trailer,0,0,Aaron George,v71ce1Dqqns,0.0,2016-04-21 06:30:54,True,True
2016-04-21T06:36:31,"Geez, he does not look like he aged a bit.",0,0,robynnescanvas,v71ce1Dqqns,-0.1,2016-04-21 06:36:31,True,True
2016-04-21T06:37:17,Julia Stiles ain't looking too good.,1,0,ARW,v71ce1Dqqns,0.7,2016-04-21 06:37:17,True,True
2016-04-21T06:37:27,ONE PUUUNNCCCHH,6,0,Shark Team,v71ce1Dqqns,0.0,2016-04-21 06:37:27,True,True
2016-04-21T06:37:28,This tails off from which bourne movie?,0,1,Anton Canlapan,v71ce1Dqqns,0.0,2016-04-21 06:37:28,True,True
2016-04-21T06:40:54,YES YES YES!!! BOURNE IS BACK!!! WHOOOOOO!!!,0,0,Jordan Gehl,v71ce1Dqqns,0.0,2016-04-21 06:40:54,True,True
2016-04-21T06:45:08,DAMN DAMON BACK IT AGAIN WITH THE OSCARS LOL ...I KNOW OSCARS ENDED,0,0,UMR Savage,v71ce1Dqqns,0.4,2016-04-21 06:45:08,True,True
2016-04-21T06:45:18,I've paused this trailer at the start as I'm not watching it because I've seen and heard way to much 😂 it's so hard not to watch. But does it spoil the plot? Does it have shaky cam?,0,6,Joseph Cox,v71ce1Dqqns,-0.3125,2016-04-21 06:45:18,True,True
2016-04-21T06:46:12,omg omg! finally is here!!! :) :) :),0,0,A. Shemtexx,v71ce1Dqqns,0.375,2016-04-21 06:46:12,True,True
2016-04-21T06:46:35,Alright I am Bourne again!,0,0,Tonn Donaldo,v71ce1Dqqns,0.0,2016-04-21 06:46:35,True,True
2016-04-21T06:48:26,"Who needs superheroes, when we got our very own superspy Jason Bourne?",12,0,jumbovs,v71ce1Dqqns,0.78,2016-04-21 06:48:26,True,True
2016-04-21T06:50:30,Bourne is back! Yeeah!,0,0,Knightsudd's Cave,v71ce1Dqqns,0.0,2016-04-21 06:50:30,True,True
2016-04-21T06:50:33,Love me a Bourne movie,0,0,Farmer Joe,v71ce1Dqqns,0.5,2016-04-21 06:50:33,True,True
2016-04-21T06:52:00,"when he said "" tell me"". I was thinking "" tell me...do you bleed? xD",0,1,d '__',v71ce1Dqqns,0.0,2016-04-21 06:52:00,True,True
2016-04-21T06:52:19,"Matt Damon vs Difficult Circumstances with his Genius Intellect Yet Again, Part 9",156,7,Bruce Lee,v71ce1Dqqns,-0.5,2016-04-21 06:52:19,True,True
2016-04-21T06:59:06,_Note to Self:_ Do not piss off Matt Damon.,4,1,fidorover,v71ce1Dqqns,0.0,2016-04-21 06:59:06,True,True
2016-04-21T06:59:06,One Punch Matt,0,0,Hussain Abbas,v71ce1Dqqns,0.0,2016-04-21 06:59:06,True,True
2016-04-21T06:59:15,what age certificate is this,0,0,Robin Regan,v71ce1Dqqns,0.0,2016-04-21 06:59:15,True,True
2016-04-21T07:01:11,This is my childhood hero.,2,0,J Stone,v71ce1Dqqns,0.0,2016-04-21 07:01:11,True,True
2016-04-21T07:03:02,"Twist "" You are not Jason Bourne, you are Ethan Hunt.""",469,14,Ebreeze84,v71ce1Dqqns,0.0,2016-04-21 07:03:02,True,True
2016-04-21T07:04:57,Why?,0,0,Sober Сossack,v71ce1Dqqns,0.0,2016-04-21 07:04:57,True,True
2016-04-21T07:05:15,"""why did he come back now?"" exactly :D",0,0,Erhan Yaşbey,v71ce1Dqqns,0.4166666666666667,2016-04-21 07:05:15,True,True
2016-04-21T07:05:41,all the people who unliked this video are idiots.,0,2,Saihaj,v71ce1Dqqns,-0.8,2016-04-21 07:05:41,True,True
2016-04-21T07:06:51,Oceans eleven meets Jason BourneTowards the end of this trailer This is going to be a good film,0,0,Andy Dub90,v71ce1Dqqns,0.7,2016-04-21 07:06:51,True,True
2016-04-21T07:08:16,Cool trailer but I'm afraid it just gave away all the best moments.,0,0,waste of time,v71ce1Dqqns,0.25,2016-04-21 07:08:16,True,True
2016-04-21T07:09:03,So like... What exactly........ Is his name?,0,0,ItzHuddy,v71ce1Dqqns,0.25,2016-04-21 07:09:03,True,True
2016-04-21T07:09:17,First BvS and now the new Bourne movie. Man I'm all up for this!,4,0,A.J Thomas,v71ce1Dqqns,0.2102272727272727,2016-04-21 07:09:17,True,True
2016-04-21T07:09:22,I think in the beginning of da film he is In a prison in mexico escapes then illegally makes his way back into the States then goes after da CIA all over again no?,0,0,Andy Dub90,v71ce1Dqqns,-0.25,2016-04-21 07:09:22,True,True
2016-04-21T07:11:06,this movie just popped out of nowhere. but omg im so excited!,0,0,Altshiftdelete Crtl,v71ce1Dqqns,0.46875,2016-04-21 07:11:06,True,True
2016-04-21T07:12:08,"bring back the trailer guy, makes trailers more interesting",0,0,Michael Perales,v71ce1Dqqns,0.3333333333333333,2016-04-21 07:12:08,True,True
2016-04-21T07:13:16,"modern time Rambo pretty much, still like it though!",0,0,Jonathan Gomez,v71ce1Dqqns,0.2333333333333333,2016-04-21 07:13:16,True,True
2016-04-21T07:13:35,god Alicia is so hot,0,0,Javier Quintero,v71ce1Dqqns,0.25,2016-04-21 07:13:35,True,True
2016-04-21T07:13:55,"I hope Ben Affleck invite Matt Damon, on the next Batman film, to be Jason -Bourne- Todd",0,0,Bart Gatsby,v71ce1Dqqns,0.0,2016-04-21 07:13:55,True,True
2016-04-21T07:17:46,2:15 WAN PAAAAWWWWNNNCH!!!,0,1,Cody Games,v71ce1Dqqns,-0.390625,2016-04-21 07:17:46,True,True
2016-04-21T07:19:16,the summer iz goin 2 b HOOO...T with this Movie!!!,0,0,Bijoyprakash Majhi,v71ce1Dqqns,0.0,2016-04-21 07:19:16,True,True
2016-04-21T07:23:04,James your real name is Ginetta,0,0,FrankValchiria,v71ce1Dqqns,0.2,2016-04-21 07:23:04,True,True
2016-04-21T07:23:41,I  really  like  bourne fight scenes I hope this one has same kind,0,0,John Doe,v71ce1Dqqns,0.26666666666666666,2016-04-21 07:23:41,True,True
2016-04-21T07:23:48,Good ol' classic action movie.,0,0,timmy yong,v71ce1Dqqns,0.3222222222222222,2016-04-21 07:23:48,True,True
2016-04-21T07:23:59,Can't wait to see jimmy kimmel's edition,0,0,Ahmed Alshamsi,v71ce1Dqqns,0.0,2016-04-21 07:23:59,True,True
