timestamp,text,like_count,reply_count,author,trailer_id,sentiment_score,datetime,used_for_model,used_for_visualization
2015-11-26T16:40:34,What is this?   A horror movie pr a love story?   shit,0,0,Holy Nat11,X1U21VBSbSs,0.15,2015-11-26 16:40:34,True,True
2015-11-26T17:35:37,Dead Silence anybody?,0,0,Devang Singh,X1U21VBSbSs,-0.2,2015-11-26 17:35:37,True,True
2015-11-26T18:14:03,i what to which it so bad,0,0,Aaron Wilson,X1U21VBSbSs,-0.6999999999999998,2015-11-26 18:14:03,True,True
2015-11-26T19:02:58,Meio Chuky Mais Foda-se Da Medo Então Ta Bora Assisti 2016,0,0,Potterson,X1U21VBSbSs,0.0,2015-11-26 19:02:58,True,True
2015-11-26T19:47:06,will he married Anabelle,0,0,Emilio Herrera,X1U21VBSbSs,0.25,2015-11-26 19:47:06,True,True
2015-11-26T20:34:05,Okay but how would you feed to doll to begin with?,0,0,soph,X1U21VBSbSs,0.5,2015-11-26 20:34:05,True,True
2015-11-26T20:56:41,maybe he wants the booty,0,0,Yisrine,X1U21VBSbSs,0.2,2015-11-26 20:56:41,True,True
2015-11-26T23:34:03,"annabelle, then the boy...whats next? the children of the dolls...lol.",0,0,Dorz Jaiden,X1U21VBSbSs,0.0,2015-11-26 23:34:03,True,True
2015-11-27T00:29:27,White people are crazy y'all hear me?,0,0,Pedro Becerra,X1U21VBSbSs,-0.3,2015-11-27 00:29:27,True,True
2015-11-27T02:14:47,Excelente película.,0,0,Anime H.c,X1U21VBSbSs,0.0,2015-11-27 02:14:47,True,True
2015-11-27T03:58:02,walking,0,0,Jade Vandaalen,X1U21VBSbSs,0.0,2015-11-27 03:58:02,True,True
2015-11-27T04:00:03,dead,0,0,Jade Vandaalen,X1U21VBSbSs,-0.2,2015-11-27 04:00:03,True,True
2015-11-27T05:52:00,Why are they bring the walking dead cast in horror movies first lori now MAGGIE! 😂,0,0,Tasha Atkinson,X1U21VBSbSs,0.056249999999999994,2015-11-27 05:52:00,True,True
2015-11-27T06:34:54,😌😅😂😓 We're screwed.,0,0,Beanie No-Name,X1U21VBSbSs,0.0,2015-11-27 06:34:54,True,True
2015-11-27T07:47:06,Maggie lookin hot af,0,0,Dame Rey,X1U21VBSbSs,0.25,2015-11-27 07:47:06,True,True
2015-11-27T10:03:49,can't she leave the house? it's common sense,0,0,bashar rafi,X1U21VBSbSs,-0.3,2015-11-27 10:03:49,True,True
2015-11-27T10:41:38,"White People would Investigate that doll, Black People would of FED him to the Wood Chipper!!!! End of movie........*Roll Credits*",0,0,TriL TV,X1U21VBSbSs,-0.2034505208333333,2015-11-27 10:41:38,True,True
2015-11-27T13:20:44,Maggie 💜,0,0,Paula Grein,X1U21VBSbSs,0.0,2015-11-27 13:20:44,True,True
2015-11-27T13:52:39,"Wait so the kid "" the boy"" died in 1991 and became a...doll?A creepy ass doll  Pale skin  Creepy face  Glaring eyes",63,14,Miss Fame,X1U21VBSbSs,-0.4033333333333333,2015-11-27 13:52:39,True,True
2015-11-27T15:49:00,the boy Annabell,0,0,chae monroe,X1U21VBSbSs,0.0,2015-11-27 15:49:00,True,True
2015-11-27T15:55:36,nice movie !!,0,0,Mark Joseph Jaso,X1U21VBSbSs,0.9375,2015-11-27 15:55:36,True,True
2015-11-27T16:56:03,annabelle copy...,0,0,How to Draw,X1U21VBSbSs,0.0,2015-11-27 16:56:03,True,True
2015-11-27T17:30:02,this is why I don't babysit,0,0,Johnathon Parker,X1U21VBSbSs,0.0,2015-11-27 17:30:02,True,True
2015-11-27T17:50:57,yet ANOTHER scary doll film.,0,0,artsytyler,X1U21VBSbSs,-0.5,2015-11-27 17:50:57,True,True
2015-11-27T18:08:51,thats her fault all she had to do was play along with the rules and get paid I would've loved it shidd smoked with him and all,0,0,lloyd braxton,X1U21VBSbSs,0.7,2015-11-27 18:08:51,True,True
2015-11-27T21:10:08,what the heck were you thinking he is scary if you are scared the follow the rules and he won't kill you,0,0,Abigail Forester,X1U21VBSbSs,-0.5,2015-11-27 21:10:08,True,True
2015-11-27T21:46:18,I wanna see it sooo bad. x'D,0,0,DakotaBBkin,X1U21VBSbSs,-0.6999999999999998,2015-11-27 21:46:18,True,True
2015-11-27T22:06:59,maggie!,0,0,Aunix,X1U21VBSbSs,0.0,2015-11-27 22:06:59,True,True
2015-11-27T22:24:00,"So, again, we see Hollywood has yet to come up with an original idea... how many more doll movies are going to be made? I don't see how this qualifies as a ""horror"" movie, when it's probably just a bunch of jump scares!?",0,0,inanimateclock2,X1U21VBSbSs,0.5,2015-11-27 22:24:00,True,True
2015-11-27T23:06:28,this is so good!,0,0,ceiling,X1U21VBSbSs,0.875,2015-11-27 23:06:28,True,True
2015-11-27T23:40:57,i'm just here for the comments......,0,0,Alexis Chang,X1U21VBSbSs,0.0,2015-11-27 23:40:57,True,True
2015-11-28T02:18:48,This looks terrible! I'm still gonna go see it though.,1,0,tabletofgalaxy,X1U21VBSbSs,-1.0,2015-11-28 02:18:48,True,True
2015-11-28T03:40:47,"damn it, the bad job right?",0,0,yolaapa,X1U21VBSbSs,-0.20714285714285707,2015-11-28 03:40:47,True,True
2015-11-28T03:40:56,so like chucky remastered,0,0,Emma Hills,X1U21VBSbSs,0.0,2015-11-28 03:40:56,True,True
2015-11-28T04:44:21,DEAD SCILENCE  BROYHER,0,0,david edward,X1U21VBSbSs,-0.2,2015-11-28 04:44:21,True,True
2015-11-28T04:54:21,I know I probably spelled this wrong but is that old man Dr lipschits from rugrats?,0,0,DJ AJ,X1U21VBSbSs,-0.2,2015-11-28 04:54:21,True,True
2015-11-28T05:07:24,chucky's got some competition,0,0,Killa Ghee,X1U21VBSbSs,0.0,2015-11-28 05:07:24,True,True
2015-11-28T08:32:53,What's with Puppets and Horror movies these days? they're so much of em' they're not even scary anymore,0,0,Lyfeless,X1U21VBSbSs,-0.15,2015-11-28 08:32:53,True,True
2015-11-28T09:07:00,another chucky movie oh well,0,0,Samuel Viveros,X1U21VBSbSs,0.0,2015-11-28 09:07:00,True,True
2015-11-28T10:33:31,"hey look, its BELLA!",0,0,Liz Tan,X1U21VBSbSs,0.0,2015-11-28 10:33:31,True,True
2015-11-28T13:52:15,way to come up with a creative movie title -_____________-,1,0,amanda aarons,X1U21VBSbSs,0.5,2015-11-28 13:52:15,True,True
2015-11-28T14:13:29,Just a boy version of anabelle,0,0,Connor Hoppes,X1U21VBSbSs,0.0,2015-11-28 14:13:29,True,True
2015-11-28T14:52:48,"1. No guests  well, she's already dead obviously",0,0,Maureen Tagsip,X1U21VBSbSs,-0.1,2015-11-28 14:52:48,True,True
2015-11-28T15:11:22,Glenn!!!! Where are u!!!! ur GF makes some stupid problem here!!,0,0,Smiley Killer,X1U21VBSbSs,-1.0,2015-11-28 15:11:22,True,True
2015-11-28T15:51:16,I cant believe Maggie from the walking dead is in a movie,0,0,Sarah Alexander,X1U21VBSbSs,-0.2,2015-11-28 15:51:16,True,True
2015-11-28T16:26:56,Robert the Doll?,0,0,Jaswant D Kadu,X1U21VBSbSs,0.0,2015-11-28 16:26:56,True,True
2015-11-28T17:53:43,Just sell him on ebay.,0,0,Celestialbeast 77,X1U21VBSbSs,0.0,2015-11-28 17:53:43,True,True
2015-11-28T18:18:01,exelente,0,0,Mayrin Guillen,X1U21VBSbSs,0.0,2015-11-28 18:18:01,True,True
2015-11-28T19:01:04,"pretty like ""Dead Silence"".",0,0,Jiangchuan He,X1U21VBSbSs,0.024999999999999994,2015-11-28 19:01:04,True,True
2015-11-28T20:38:04,"can't she just follow the damn instructions, its not like she ain't getting paid",0,0,summer autumns,X1U21VBSbSs,0.0,2015-11-28 20:38:04,True,True
2015-11-28T21:09:32,another jump scare piece of crap.,0,0,jigsawzoubir,X1U21VBSbSs,-0.8,2015-11-28 21:09:32,True,True
2015-11-28T21:38:37,maggie :D,0,0,Gaby Alvarado,X1U21VBSbSs,1.0,2015-11-28 21:38:37,True,True
2015-11-28T23:10:52,Annabello xD,0,0,Ulises Aguilar,X1U21VBSbSs,0.0,2015-11-28 23:10:52,True,True
2015-11-29T01:29:20,So ready for a movie with Maggie in it!!!,0,0,Isabel Giles,X1U21VBSbSs,0.390625,2015-11-29 01:29:20,True,True
2015-11-29T01:41:25,She does the exact opposite of what to do,0,0,Shayla James,X1U21VBSbSs,0.125,2015-11-29 01:41:25,True,True
2015-11-29T01:59:17,Should've hired The nanny. MISTER CHEFIEEEEELD!,0,0,Vedji,X1U21VBSbSs,0.0,2015-11-29 01:59:17,True,True
2015-11-29T02:03:11,Don't Feed Him After Dark or He Will become a gremlin,0,0,Vedji,X1U21VBSbSs,-0.15,2015-11-29 02:03:11,True,True
2015-11-29T02:15:34,that house is creepy tho,0,0,Aiden Forevermore,X1U21VBSbSs,-0.5,2015-11-29 02:15:34,True,True
2015-11-29T02:57:40,Just let him go to school he going to get fried like people going to saying boy your plastic doll looking azz,0,0,Dark Phoenix225,X1U21VBSbSs,0.0,2015-11-29 02:57:40,True,True
2015-11-29T03:16:21,It looks more a suspense thriller than a horror movie.,0,0,darkjoker,X1U21VBSbSs,0.5,2015-11-29 03:16:21,True,True
2015-11-29T03:36:37,:O YES! YES MAGGIE! GET 'EM GOOD OUT THERE!,0,0,cam,X1U21VBSbSs,0.4765625,2015-11-29 03:36:37,True,True
2015-11-29T04:20:59,kawaii,0,0,Moxley,X1U21VBSbSs,0.0,2015-11-29 04:20:59,True,True
2015-11-29T04:52:26,"Just follow the goddamn rules woman! Then your life wouldn't be in danger, you know kids. Always throwing a tantrum when they dont get what they want",0,0,Mya Rowlands,X1U21VBSbSs,0.0,2015-11-29 04:52:26,True,True
2015-11-29T07:00:00,This oppresses women.,0,0,Ira Gershwin,X1U21VBSbSs,0.0,2015-11-29 07:00:00,True,True
2015-11-29T07:32:19,Anyone recognize her as Bela from Supernatural??,0,0,Zaina Khan,X1U21VBSbSs,0.16666666666666666,2015-11-29 07:32:19,True,True
2015-11-29T08:20:54,dolls are scary more a poselan,0,0,Luis Artiles,X1U21VBSbSs,0.0,2015-11-29 08:20:54,True,True
2015-11-29T09:46:27,fnab,0,0,Luke Dope,X1U21VBSbSs,0.0,2015-11-29 09:46:27,True,True
2015-11-29T11:08:50,I bet if you cut the doll open his organs and blood will come out!,0,0,EGGbutt,X1U21VBSbSs,0.0,2015-11-29 11:08:50,True,True
2015-11-29T11:09:59,I like this idea ☺,0,0,EGGbutt,X1U21VBSbSs,0.0,2015-11-29 11:09:59,True,True
2015-11-29T14:53:45,Haunted House 3? confirmed?  Annabelle + Brahms =  CHucky? well shit,0,0,Charmine Begum,X1U21VBSbSs,0.1,2015-11-29 14:53:45,True,True
2015-11-29T16:03:48,Another Annabell story.,0,0,Erza10fairytale Tress Darby,X1U21VBSbSs,0.0,2015-11-29 16:03:48,True,True
2015-11-29T17:08:24,Should just follow the rule,0,0,Moonv Sam,X1U21VBSbSs,0.0,2015-11-29 17:08:24,True,True
2015-11-29T17:19:07,come on you fought walker you can't  just handle a boy,0,0,Abdallah Ali,X1U21VBSbSs,0.0,2015-11-29 17:19:07,True,True
2015-11-29T17:41:35,Where's Glenn when you need him 😂,0,0,Safiya Kirton,X1U21VBSbSs,0.0,2015-11-29 17:41:35,True,True
2015-11-29T19:13:21,I relly want to see this movie,0,0,Freddie Hayes,X1U21VBSbSs,0.0,2015-11-29 19:13:21,True,True
2015-11-30T00:06:04,"OMFG The Winchesters would solve this in like two seconds, just salt and burn the remains.",0,0,Rachel Herschman,X1U21VBSbSs,0.0,2015-11-30 00:06:04,True,True
2015-11-30T00:48:52,N,0,0,Lucifer Morningstar,X1U21VBSbSs,0.0,2015-11-30 00:48:52,True,True
2015-11-30T02:25:15,Moral of the story: Be a good babysitter.  XD Or die.  l=l,0,0,Loopy Kick,X1U21VBSbSs,0.35,2015-11-30 02:25:15,True,True
2015-11-30T02:33:17,is that liam? wtf tho?!?!,0,0,silent gamer,X1U21VBSbSs,-0.78125,2015-11-30 02:33:17,True,True
2015-11-30T02:49:09,Hmm...this one has possibilities... ;),0,0,LairMistress,X1U21VBSbSs,0.25,2015-11-30 02:49:09,True,True
2015-11-30T03:03:06,Just find the bone pour salt on them and burn them,0,0,Amazing Kat,X1U21VBSbSs,0.0,2015-11-30 03:03:06,True,True
2015-11-30T04:52:47,"am i the only one who find the doll is really cute? :"")",0,0,nuryusrina,X1U21VBSbSs,0.25,2015-11-30 04:52:47,True,True
2015-11-30T07:01:18,when is it coming out,0,0,Kids Current News,X1U21VBSbSs,0.0,2015-11-30 07:01:18,True,True
2015-11-30T09:46:36,wazzzzupp boyieeeee....,0,0,Jipsy Jeepies,X1U21VBSbSs,0.0,2015-11-30 09:46:36,True,True
2015-11-30T12:00:24,There could be a reasonable explanation why the doll keeps moving... its a conduit for glen.,0,0,Unknown Source,X1U21VBSbSs,0.2,2015-11-30 12:00:24,True,True
2015-11-30T17:30:46,PIN,0,0,RAS reggae,X1U21VBSbSs,0.0,2015-11-30 17:30:46,True,True
2015-11-30T18:53:50,why didn't you just follow the rules. now there is a dead little boy trapped in a dolls body chasing after you.,0,0,Diamond Daniels,X1U21VBSbSs,-0.19583333333333333,2015-11-30 18:53:50,True,True
2015-11-30T19:34:18,omg this is scary,0,0,houda T-T,X1U21VBSbSs,-0.5,2015-11-30 19:34:18,True,True
2015-11-30T21:06:51,Why didn't she just follow the rules god danm it,0,0,desly gutierrez,X1U21VBSbSs,0.0,2015-11-30 21:06:51,True,True
2015-11-30T21:16:24,Does anyone know the song at the first part?,0,0,SupaDopex3,X1U21VBSbSs,0.25,2015-11-30 21:16:24,True,True
2015-11-30T21:48:37,look up Robert the doll.....creepy shit!,0,0,katie l,X1U21VBSbSs,-0.25,2015-11-30 21:48:37,True,True
2015-11-30T21:50:13,OMFG IT MAGGIE!!!!!!!!!!!!!!!!!!!!!!!!!!!!!!!!!!!!!!!!!!!!! no wait that's just her actor XD,0,0,G-Naran,X1U21VBSbSs,0.0,2015-11-30 21:50:13,True,True
2015-11-30T22:14:01,Old couple who calls a doll their son. That's the first ingredient for Nope,0,0,Dixie Normous,X1U21VBSbSs,0.175,2015-11-30 22:14:01,True,True
2015-11-30T22:28:14,ANABELL!!! lol same and the same movies,0,0,ΘΟΥ ΒΟΥ,X1U21VBSbSs,0.26666666666666666,2015-11-30 22:28:14,True,True
2015-11-30T22:36:39,That lady had one job. Instead she screws up.,0,0,wack,X1U21VBSbSs,0.0,2015-11-30 22:36:39,True,True
2015-11-30T23:26:56,~Sets doll on fire~  My work is done here,0,0,IG,X1U21VBSbSs,0.0,2015-11-30 23:26:56,True,True
2015-11-30T23:58:59,CALL SAM AND DEAN BELLA OMG,1,0,Frosty Canary,X1U21VBSbSs,0.0,2015-11-30 23:58:59,True,True
2015-12-01T00:09:13,it's either the riddler or the joker,0,0,R CoorManz,X1U21VBSbSs,0.0,2015-12-01 00:09:13,True,True
2015-12-01T01:25:59,is she is from walking dead season??,0,0,Shahmeer Shah,X1U21VBSbSs,-0.2,2015-12-01 01:25:59,True,True
2015-12-01T01:34:54,Imagine if that came up in the middle of the night and yelled im a real boy,1,0,Jess Bas,X1U21VBSbSs,0.1,2015-12-01 01:34:54,True,True
2015-12-01T01:38:28,omg Creepy! o_O,0,0,Athena btw,X1U21VBSbSs,-0.2875,2015-12-01 01:38:28,True,True
2015-12-01T02:20:43,Brahms is really really really creepy,1,0,Cecilia Meza,X1U21VBSbSs,-0.5,2015-12-01 02:20:43,True,True
2015-12-01T03:06:49,Glad to see Slappy from Goosebumps got his own flick,3,0,SPPSports,X1U21VBSbSs,0.55,2015-12-01 03:06:49,True,True
2015-12-01T03:34:09,a better looking chucky movie.. ..,0,0,90kaynarcissus,X1U21VBSbSs,0.5,2015-12-01 03:34:09,True,True
2015-12-01T04:32:56,lauren cohan! !!!! ahhhh  la amo,0,0,Nelia Ariana Ortega,X1U21VBSbSs,0.0,2015-12-01 04:32:56,True,True
2015-12-01T05:52:05,"Just go to 1 very far away island, dig a hole, krazy glue his legs to his stomach, krazy glue his hands to his legs, tie him up with a super duper tight knot, put him in the hole, cover the hole, place something very heavy over the hole like a 9 ton brick so he can't climb out, and run away. If he comes back, then smash him to tiny pieces like 1/2 of a centimeter, get all the smashed pieces, and throw them to a wet cement thing or in lava.",0,0,Benny Lam,X1U21VBSbSs,-0.010748299319727891,2015-12-01 05:52:05,True,True
2015-12-01T13:14:08,oh snap it's that lady from walking dead,0,0,"XXX69,420i'm nervous please be nice to me69,420XXX",X1U21VBSbSs,-0.2,2015-12-01 13:14:08,True,True
2015-12-01T13:34:00,So an English actress playing an American who's going to England to work with other English people hmm makes sense to me,0,0,Frank Masselli,X1U21VBSbSs,-0.03125,2015-12-01 13:34:00,True,True
2015-12-01T14:47:49,I saw the thumbnail and i thought this was gonna be a Pinocchio movie,1,0,Vit D Milk,X1U21VBSbSs,0.0,2015-12-01 14:47:49,True,True
2015-12-01T15:48:42,Zdvgfvg Q :-) .bjxjryfjtxy,0,0,Ashu singh,X1U21VBSbSs,0.5,2015-12-01 15:48:42,True,True
2015-12-01T15:48:43,Zdvgfvg Q :-) .bjxjryfjtxy,0,0,Ashu singh,X1U21VBSbSs,0.5,2015-12-01 15:48:43,True,True
2015-12-01T21:20:31,Hmm looks interesting.,0,0,MrTryingtobehappy,X1U21VBSbSs,0.5,2015-12-01 21:20:31,True,True
2015-12-01T21:38:22,anyone know the song in the trailer?,0,1,Peggy Schuyler,X1U21VBSbSs,0.0,2015-12-01 21:38:22,True,True
2015-12-01T22:57:42,really i could of done better and im tottaly gonna wach it,0,0,Miya Tracy,X1U21VBSbSs,0.35,2015-12-01 22:57:42,True,True
2015-12-01T22:57:59,really i could of done better and im totaly gonna wach it,0,0,Miya Tracy,X1U21VBSbSs,0.35,2015-12-01 22:57:59,True,True
2015-12-01T22:58:08,really i could of done better and im totaly gonna wach it,0,0,Miya Tracy,X1U21VBSbSs,0.35,2015-12-01 22:58:08,True,True
2015-12-01T22:58:15,i could of done better and im totaly gonna wach it,0,0,Miya Tracy,X1U21VBSbSs,0.5,2015-12-01 22:58:15,True,True
2015-12-01T22:59:54,I'd only watch this for Lauren. XD,0,0,Desolate Rose,X1U21VBSbSs,0.0,2015-12-01 22:59:54,True,True
2015-12-01T23:00:03,OMG I NEED TO WATCH THIS MOVIE,0,0,Sophia,X1U21VBSbSs,0.0,2015-12-01 23:00:03,True,True
2015-12-01T23:55:46,Cant wait!!,0,0,Vid štimac,X1U21VBSbSs,0.0,2015-12-01 23:55:46,True,True
2015-12-02T00:08:23,IS HE ANNABELLE BOYFRIEND 😂😂😂😂😂😂,0,0,OMER SORGUCU,X1U21VBSbSs,0.0,2015-12-02 00:08:23,True,True
2015-12-02T00:52:07,Oh damn. this is scary....,0,0,Alina Zhang,X1U21VBSbSs,-0.5,2015-12-02 00:52:07,True,True
2015-12-02T02:09:41,anyone release this is just chucky a doll comes to and try to kill  really people come on we seen this before,0,0,Joshua Alanis,X1U21VBSbSs,0.2,2015-12-02 02:09:41,True,True
2015-12-02T03:19:32,Why don't you just smash him with a hammer and ditch those crazy ass people?,0,0,Señor_Troll,X1U21VBSbSs,-0.6,2015-12-02 03:19:32,True,True
2015-12-02T04:14:44,I couldn't put it in full-screen this movie is truly terrifying,0,0,Cynthia Rivera,X1U21VBSbSs,-1.0,2015-12-02 04:14:44,True,True
2015-12-02T04:41:39,Isn't there some sort of Asian movie just like this??,0,0,S.R.A,X1U21VBSbSs,0.0,2015-12-02 04:41:39,True,True
2015-12-02T05:02:03,"Plot Twist: The ""grocery man"" is the actual villain. He killed the young girl and was found out by Brahms, so decided to kill him too. The entire movie is the doll trying to express this to the protagonist.",1,0,S.R.A,X1U21VBSbSs,-0.025,2015-12-02 05:02:03,True,True
2015-12-02T08:04:54,"Any man who marries a doll will say.......""that's my boy!""",0,0,Svagg LAORDE,X1U21VBSbSs,0.0,2015-12-02 08:04:54,True,True
2015-12-02T08:28:07,So Gremlins meets Annabelle,0,0,Kamlesan Pillay,X1U21VBSbSs,0.0,2015-12-02 08:28:07,True,True
2015-12-02T08:48:49,chuck with more jump scares.,0,0,Drain Deimo,X1U21VBSbSs,0.5,2015-12-02 08:48:49,True,True
2015-12-02T10:13:08,it almost reminds me of Robert The Doll,2,0,Passion 32,X1U21VBSbSs,0.0,2015-12-02 10:13:08,True,True
2015-12-02T10:39:41,is that maggie from twd?,0,0,By Jove,X1U21VBSbSs,0.0,2015-12-02 10:39:41,True,True
2015-12-02T10:48:59,actually guys she's had 1 job. that consisted of following 1 list!!!!,0,0,Alex Joseph,X1U21VBSbSs,0.0,2015-12-02 10:48:59,True,True
2015-12-02T11:32:12,"Unfortunately, it's a fake or a fan made",0,2,katia tahenti,X1U21VBSbSs,-0.5,2015-12-02 11:32:12,True,True
2015-12-02T12:07:04,americans are jenious every year like 1000 best movies will out i like yall,0,0,Hasnah Ali,X1U21VBSbSs,1.0,2015-12-02 12:07:04,True,True
2015-12-02T14:39:53,I would have followed the rules not take any chances. That look on their face when they were serious about their son said enough. She has brought this on herself lmao. Looks like a good movie. Is it to late to pick back up the rules? LOL,0,0,JacksonvillesDonatello,X1U21VBSbSs,0.2095238095238095,2015-12-02 14:39:53,True,True
2015-12-02T16:03:48,what is the song of the movie background?????,1,2,Alan Moreno,X1U21VBSbSs,0.0,2015-12-02 16:03:48,True,True
2015-12-02T16:47:52,the boy looks like Lucius :o,0,0,Artificial Astronomers,X1U21VBSbSs,0.05,2015-12-02 16:47:52,True,True
2015-12-02T17:06:27,This is what happens when you don't asks the Winchesters for help Bela,0,0,isa juliusson,X1U21VBSbSs,0.0,2015-12-02 17:06:27,True,True
2015-12-02T18:45:32,You toook the freakin' job lady! Just follow the damn rules. I think I might go see this.,0,0,queendsheena1,X1U21VBSbSs,0.0,2015-12-02 18:45:32,True,True
2015-12-02T19:56:36,A walking dead actor in a movie with dolls(me dying with happiness),0,0,Tommy Doc,X1U21VBSbSs,0.24999999999999997,2015-12-02 19:56:36,True,True
2015-12-02T21:01:46,Lauren Cohan <3333333333333333,0,0,Mahir Navrboc,X1U21VBSbSs,0.0,2015-12-02 21:01:46,True,True
2015-12-02T21:29:12,See what happens when you don't follow rules! Some kids Could learn from this,0,0,TheLoner,X1U21VBSbSs,0.0,2015-12-02 21:29:12,True,True
2015-12-02T22:47:43,"When I heard the laughing I shut up computer down and said ""ohh I ain't watching dat""",0,0,Georgie k,X1U21VBSbSs,-0.15555555555555559,2015-12-02 22:47:43,True,True
2015-12-02T22:54:30,"still Chucky is the best ""doll horror"" movie",0,0,Ashutosh Kumar,X1U21VBSbSs,1.0,2015-12-02 22:54:30,True,True
2015-12-02T23:11:37,omg its the h brothers... need to watch this....the h brothers only do horror movies,0,0,dragonh34t WaiT,X1U21VBSbSs,0.0,2015-12-02 23:11:37,True,True
2015-12-03T03:16:29,"okay this is the most creepiest movie! does anyone else think so,?😦😦😦😦",0,0,Rachel Bennett,X1U21VBSbSs,0.5625,2015-12-03 03:16:29,True,True
2015-12-03T04:00:00,Not sure how I feel about this one. First half of trailer seemed legit.  ,0,0,Julie Casey,X1U21VBSbSs,-0.05555555555555555,2015-12-03 04:00:00,True,True
2015-12-03T11:02:45,this is AWESOME. believe that,0,0,deni wihono,X1U21VBSbSs,1.0,2015-12-03 11:02:45,True,True
2015-12-03T17:22:47,Which ones the scariest dolls Annabelle doll or the boy doll,0,3,PRECISION FTW,X1U21VBSbSs,0.0,2015-12-03 17:22:47,True,True
2015-12-03T17:25:18,"Besides hating Maggie.... and Glen, and esp Carl... I'd still consider seeing this movie. I just hate most of the characters on the walking dead now. Can't take their roles serious.",0,0,OMGVinDiesel,X1U21VBSbSs,-0.20833333333333331,2015-12-03 17:25:18,True,True
2015-12-03T19:37:55,Dolls are literally my worst phobia this is like torture D:,0,0,knockoutroundabout,X1U21VBSbSs,-1.0,2015-12-03 19:37:55,True,True
2015-12-03T20:05:23,bullllllllllllllllllllllllllllllllllschit,0,0,Jackpot,X1U21VBSbSs,0.0,2015-12-03 20:05:23,True,True
2015-12-03T21:48:31,Eoq Soladoo,0,0,Outbreak Co.,X1U21VBSbSs,0.0,2015-12-03 21:48:31,True,True
2015-12-03T22:42:23,Aw come on Bela! Jesus....you know how to do these kind of things. Salt and burn the bones....oh shit wait. He was already burned....,0,0,Enzo Lontoc,X1U21VBSbSs,0.19999999999999998,2015-12-03 22:42:23,True,True
2015-12-03T22:57:40,Chucky with star power,0,0,Zachiary Bochy-Kimber,X1U21VBSbSs,0.0,2015-12-03 22:57:40,True,True
2015-12-04T02:28:58,Africans could have eaten that sandwich,0,0,The Little Midget,X1U21VBSbSs,0.0,2015-12-04 02:28:58,True,True
2015-12-04T02:43:09,Damn you should have listened to the rules,0,0,Theresa Rowe,X1U21VBSbSs,0.0,2015-12-04 02:43:09,True,True
2015-12-04T03:45:49,Where's Rick!!!!!,0,0,Lars R,X1U21VBSbSs,0.0,2015-12-04 03:45:49,True,True
2015-12-04T04:37:38,Look like another scary doll movie were the doll never actually moves on camera....,0,0,Ivan Kosovan,X1U21VBSbSs,-0.25,2015-12-04 04:37:38,True,True
2015-12-04T05:45:42,"Creepy!  I bet they got this idea from Robert the Doll!  Look it up it's a real doll!   It's in a museum till this day, visitors say when taking pictures they come out blurry.  Also any else think the design of this doll, looks like Damien from the Omen movie 1976?",0,0,GalaxyEspeon,X1U21VBSbSs,-0.265625,2015-12-04 05:45:42,True,True
2015-12-04T09:36:05,Today on the walking dead !,0,0,goonsquad192,X1U21VBSbSs,-0.25,2015-12-04 09:36:05,True,True
2015-12-04T11:43:23,"SEEMS SOME NEVER PLAYED WITH DOLLS AS A KID,...C",0,0,Schnaider 978,X1U21VBSbSs,0.0,2015-12-04 11:43:23,True,True
2015-12-04T12:54:12,"OH CMON guys! imagine yourself someone offered you a job, having that list for a creepy looking doll... would you even do it even if nobody is looking or just laugh about it?",0,0,migz cortez,X1U21VBSbSs,-0.1,2015-12-04 12:54:12,True,True
2015-12-04T15:57:34,You're scared of an 8 year old who's also a doll? 😐,208,29,Refinement,X1U21VBSbSs,0.1,2015-12-04 15:57:34,True,True
2015-12-04T16:01:03,Watch my chanel,0,0,LBP :D,X1U21VBSbSs,0.0,2015-12-04 16:01:03,True,True
2015-12-04T19:09:27,this looks like an amazing movie,0,0,haileygale,X1U21VBSbSs,0.6000000000000001,2015-12-04 19:09:27,True,True
2015-12-04T19:10:29,Wait...why don't the old couple just bring the doll? if they care for him that much... and by the way... how do you even feed the darn thing?!,0,0,the FUDGY,X1U21VBSbSs,0.175,2015-12-04 19:10:29,True,True
2015-12-04T20:11:01,"You had one job, with rules on paper and you still fucked up. smh",0,0,"Vuitton, The Ruler",X1U21VBSbSs,-0.6,2015-12-04 20:11:01,True,True
2015-12-04T20:36:37,the walkind dead     yeahhhhh,0,0,lycan monster,X1U21VBSbSs,-0.2,2015-12-04 20:36:37,True,True
2015-12-04T21:47:59,ad to movie list that im never gonna see b.c.o.d (because of dolls),0,0,Oscar Hansen,X1U21VBSbSs,0.0,2015-12-04 21:47:59,True,True
2015-12-04T22:01:59,LAUREN😍😍😍😍😱😱😱,0,0,Itzia uwu,X1U21VBSbSs,0.0,2015-12-04 22:01:59,True,True
2015-12-04T22:23:18,I saw this during the previews of another movie I went to see but I can't remember what the movie was lol.,0,0,Mandie R,X1U21VBSbSs,0.8,2015-12-04 22:23:18,True,True
2015-12-04T22:33:03,stupid plot but scary trailer,0,0,Evelina Richter,X1U21VBSbSs,-0.6499999999999999,2015-12-04 22:33:03,True,True
2015-12-04T22:37:02,that didn't look very PG to me 0.0,0,0,John Citizen,X1U21VBSbSs,0.2,2015-12-04 22:37:02,True,True
2015-12-04T23:21:09,Shouldn't he be 28 if he died 20 years ago?,0,0,Lestat Mindorashvili,X1U21VBSbSs,0.0,2015-12-04 23:21:09,True,True
2015-12-05T02:22:08,If Annabelle was a boy,2,0,Austin Truong,X1U21VBSbSs,0.0,2015-12-05 02:22:08,True,True
2015-12-05T02:41:35,does any body know what is the song called in the beggining it starts at 36 seconds,0,1,ian gomez,X1U21VBSbSs,0.0,2015-12-05 02:41:35,True,True
2015-12-05T02:53:14,I wanna see it,0,0,indigo Rager,X1U21VBSbSs,0.0,2015-12-05 02:53:14,True,True
2015-12-05T05:20:13,"Well, this teach us that need to be so careful to choose a job, you know, maybe we ended take care a porcelain doll.",0,0,Bitchesproofbarbie.,X1U21VBSbSs,-0.1,2015-12-05 05:20:13,True,True
2015-12-05T05:33:10,yep I wanna see this. :),1,0,Chanel Coco,X1U21VBSbSs,0.5,2015-12-05 05:33:10,True,True
2015-12-05T05:34:43,I LOVE YOU MAGGIE! GO MAGGIE!,0,0,Fernando Navarro,X1U21VBSbSs,0.78125,2015-12-05 05:34:43,True,True
2015-12-05T06:39:24,Just put him in front of a computer screen watching VanossGaming And He will never move,0,0,Abran A.,X1U21VBSbSs,0.0,2015-12-05 06:39:24,True,True
