timestamp,text,like_count,reply_count,author,trailer_id,sentiment_score,datetime,used_for_model,used_for_visualization
2016-02-14T11:14:33,I think the young lady in white shirt is the actor for rose in vampire diaries,0,0,GoFoxieGirl,X1U21VBSbSs,0.2333333333333333,2016-02-14 11:14:33,False,True
2016-02-14T12:33:12,"What strikes me odd is that in this HUGE house, there's not a single trunk with a latch key. Done.",0,0,Robbie Smith,X1U21VBSbSs,0.06726190476190479,2016-02-14 12:33:12,False,True
2016-02-14T13:46:30,"I watched this movie in theaters yesterday and loved it, I advise that you all got watch it right now! It is so good but it's more jump-scares than anything. It's more weird and creepy at the end.  Plus it doesn't help that she has a past...",0,0,Hannah's Heart Of Gold,X1U21VBSbSs,0.18839285714285714,2016-02-14 13:46:30,False,True
2016-02-14T16:09:40,"habra la segunda parte, ojala sea lo mas pronto posible",0,0,Daiiana Ariza,X1U21VBSbSs,0.0,2016-02-14 16:09:40,False,True
2016-02-14T16:45:03,so frightening,0,0,Sophia Clifford,X1U21VBSbSs,-0.5,2016-02-14 16:45:03,False,True
2016-02-14T17:25:12,follow the rules ok,0,0,Anaiya Drummer,X1U21VBSbSs,0.5,2016-02-14 17:25:12,False,True
2016-02-14T17:26:06,his name is brahms,0,0,Anaiya Drummer,X1U21VBSbSs,0.0,2016-02-14 17:26:06,False,True
2016-02-14T20:00:14,I'm going to watch it today!!!,0,0,TTPD Detective,X1U21VBSbSs,0.0,2016-02-14 20:00:14,False,True
2016-02-15T00:33:39,esta bien estupida esa pelicula😬😬,0,0,Arely Nery,X1U21VBSbSs,0.0,2016-02-15 00:33:39,False,True
2016-02-15T00:39:16,la vi hoy esta buenísima,0,0,Niky Guia,X1U21VBSbSs,0.0,2016-02-15 00:39:16,False,True
2016-02-15T03:33:35,me encanto,0,0,Kamil Adonais Reyes Mena,X1U21VBSbSs,0.0,2016-02-15 03:33:35,False,True
2016-02-15T06:40:03,Another chucky,0,0,Francis Santiago,X1U21VBSbSs,0.0,2016-02-15 06:40:03,False,True
2016-02-15T11:53:50,"Everyone should go and watch this movie, everything that happens is actually realy. None of these bullshit monsters like the movie mama. and is has this seriously awesome plot twist that is just to sick to think about, somthing that you won't expect after seeing this trailer.",0,0,Marco Jakobs,X1U21VBSbSs,0.09523809523809523,2016-02-15 11:53:50,False,True
2016-02-15T16:57:21,so how did he become a doll? or was he a doll at first place? are those his grandparents or his parents? what happened to him? answers plz,0,0,BuzzGeek,X1U21VBSbSs,0.25,2016-02-15 16:57:21,False,True
2016-02-15T17:39:16,She is very fuckable !,2,0,VincentTG,X1U21VBSbSs,0.25,2016-02-15 17:39:16,False,True
2016-02-16T00:23:57,ITS ROSE OMG FROM SEASON 2 VAMPIRE DIARIES,0,0,Maddie Carson,X1U21VBSbSs,0.6,2016-02-16 00:23:57,False,True
2016-02-16T02:01:12,Yes...this is why i sleep with a night light at 16,0,0,Cleo Goodwin,X1U21VBSbSs,0.4,2016-02-16 02:01:12,False,True
2016-02-16T07:20:22,"Great movie, a twisted finale. Reminded me of The Pact. Probably will have a sequel.",0,0,Baltazar Zuñiga Cervantes,X1U21VBSbSs,0.15000000000000002,2016-02-16 07:20:22,False,True
2016-02-16T09:25:23,It's look so sweet...not too much horror....,0,0,Naomi’s World,X1U21VBSbSs,0.2,2016-02-16 09:25:23,False,True
2016-02-16T10:49:57,How was this movie guys?,0,0,-dethby meth-,X1U21VBSbSs,0.0,2016-02-16 10:49:57,False,True
2016-02-16T14:13:28,αγορακι. ειναι. ιδιο. με. την. αναμπελ,0,0,Aggelosisyourdad,X1U21VBSbSs,0.0,2016-02-16 14:13:28,False,True
2016-02-16T15:59:26,"I find it weird how she still accepted the job lol If it was me and I saw that doll the first moment I laid eyes on it, I'd leave that Jon to someone else",3,4,Rogue Npc,X1U21VBSbSs,0.18333333333333335,2016-02-16 15:59:26,False,True
2016-02-16T21:35:58,waht,0,0,Olga saldaña,X1U21VBSbSs,0.0,2016-02-16 21:35:58,False,True
2016-02-17T00:31:14,I'm watching The Boy right now,0,0,hermit,X1U21VBSbSs,0.2857142857142857,2016-02-17 00:31:14,False,True
2016-02-17T00:48:17,its a twist at the end,0,0,Karisma Hale,X1U21VBSbSs,0.0,2016-02-17 00:48:17,False,True
2016-02-17T01:17:15,Brahms is scary Lol now I want to watch this.. Also she did the opposite of everything on that list Lol ....Worst babysitter especially for a doll??!!!,0,0,Mia Rose,X1U21VBSbSs,0.22000000000000003,2016-02-17 01:17:15,False,True
2016-02-17T03:14:28,putos,0,0,meibis Drácula,X1U21VBSbSs,0.0,2016-02-17 03:14:28,False,True
2016-02-17T03:25:15,this movie was so dumb,0,0,Tianna Vhao,X1U21VBSbSs,-0.375,2016-02-17 03:25:15,False,True
2016-02-17T04:56:02,This movies ending...got me on so many levels.  ... Beware horny dolls,0,0,The Uchiha,X1U21VBSbSs,0.5,2016-02-17 04:56:02,False,True
2016-02-17T09:53:48,*When you watch the trailer and damn toy don't scare the shit out of you*  im outta here 😕,0,0,Jade Renner,X1U21VBSbSs,-0.2,2016-02-17 09:53:48,False,True
2016-02-17T13:56:21,Nem quero assistir inteiro 😝,0,0,Vitoria Maguet,X1U21VBSbSs,0.0,2016-02-17 13:56:21,False,True
2016-02-17T17:33:33,Really wanna watch this 😻so creepy but she literally ignored all his bloody rules but even if she did follow the rules there would of still been a twist to it cause there always is😏😂,0,0,CGPerforms,X1U21VBSbSs,-0.3666666666666667,2016-02-17 17:33:33,False,True
2016-02-17T17:37:41,This shouldve been called CHILDS PLAY 5: THE LOST SON,0,0,jeremy hunt,X1U21VBSbSs,0.0,2016-02-17 17:37:41,False,True
2016-02-17T21:53:37,شكله حماااااس,0,0,O 7,X1U21VBSbSs,0.0,2016-02-17 21:53:37,False,True
2016-02-17T22:21:55,I really want to see this movie,0,0,scarlet Schneider,X1U21VBSbSs,0.2,2016-02-17 22:21:55,False,True
2016-02-17T22:26:41,OMFG PEOPLE IN HORROR MOVIES ARE SO STUPID,2,0,Drew Hersch,X1U21VBSbSs,-0.7999999999999999,2016-02-17 22:26:41,False,True
2016-02-18T12:51:15,If lucius was a doll,0,0,Luna E,X1U21VBSbSs,0.0,2016-02-18 12:51:15,False,True
2016-02-18T14:45:43,OMG! I LOVE IT <3,0,0,Aurora Fox,X1U21VBSbSs,0.75,2016-02-18 14:45:43,False,True
2016-02-18T23:17:44,I love the song thats playing on the record!,0,0,Claudia Hunt,X1U21VBSbSs,0.625,2016-02-18 23:17:44,False,True
2016-02-19T04:29:33,This movie was garbage.,0,0,imgamerful,X1U21VBSbSs,0.0,2016-02-19 04:29:33,False,True
2016-02-19T05:46:06,That boy look like scary and dolly,0,0,Helli Venhovaara,X1U21VBSbSs,-0.5,2016-02-19 05:46:06,False,True
2016-02-19T10:42:43,All cool but we just saw all the movie ffs.,0,0,havocgr1976,X1U21VBSbSs,0.35,2016-02-19 10:42:43,False,True
2016-02-19T13:54:45,http://snip.ly/aa6q1,0,0,Juli Tok,X1U21VBSbSs,0.0,2016-02-19 13:54:45,False,True
2016-02-19T16:28:02,i dont find the movie why ? :c,0,0,Kenda,X1U21VBSbSs,-0.75,2016-02-19 16:28:02,False,True
2016-02-19T16:30:43,omg its amazing,0,0,Kenda,X1U21VBSbSs,0.6000000000000001,2016-02-19 16:30:43,False,True
2016-02-19T17:40:08,It's like Goosebumps the night of the living dummy all over again.😱,0,0,VVGirl,X1U21VBSbSs,0.0,2016-02-19 17:40:08,False,True
2016-02-19T19:00:48,Good movie?,0,0,Tri Pham,X1U21VBSbSs,0.7,2016-02-19 19:00:48,False,True
2016-02-19T19:21:26,totally going to watch this!,0,0,Stupid Fuck With A Fedora,X1U21VBSbSs,0.0,2016-02-19 19:21:26,False,True
2016-02-19T20:10:22,Very good vravo,0,0,engliii gg,X1U21VBSbSs,0.9099999999999999,2016-02-19 20:10:22,False,True
2016-02-19T20:18:00,Chucky was the best :),0,0,tamildharma,X1U21VBSbSs,0.75,2016-02-19 20:18:00,False,True
2016-02-19T23:43:53,al ultimo no me dio miedo :/,0,0,Evelyn Catalan,X1U21VBSbSs,-0.25,2016-02-19 23:43:53,False,True
2016-02-20T02:55:44,OH WEEW SPOOKY BOOKY SCARY DOLL.,0,0,Understandable.,X1U21VBSbSs,-0.5,2016-02-20 02:55:44,False,True
2016-02-20T06:02:15,magiiiiiiii,0,0,Duver Mendoza,X1U21VBSbSs,0.0,2016-02-20 06:02:15,False,True
2016-02-20T10:46:12,when there's a weird creepy ass looking doll in a creepy mansion that has a spirit of a boy what do u do?? u keep him?! God! take him to a priest or something. does his parents know all this happening?,0,0,tm. G,X1U21VBSbSs,-0.59375,2016-02-20 10:46:12,False,True
2016-02-20T13:12:45,Shes a stupid girl hayss,0,0,Ziul Barrion,X1U21VBSbSs,-0.7999999999999999,2016-02-20 13:12:45,False,True
2016-02-20T18:57:18,That doll is creepy as hell I would follow those rules even if the whole thing turns out to be a prank!!!! but how do you feed him though????,0,0,Mwa Mwa,X1U21VBSbSs,-0.005859375,2016-02-20 18:57:18,False,True
2016-02-20T20:32:27,the plot twist in it though.,0,0,It'svivi,X1U21VBSbSs,0.0,2016-02-20 20:32:27,False,True
2016-02-20T20:43:14,I want to bang Lauren Cohan,1,0,Ustaša 1950,X1U21VBSbSs,0.0,2016-02-20 20:43:14,False,True
2016-02-20T22:27:07,Maggie you belong in the walking dead,3,0,James Howlett,X1U21VBSbSs,-0.2,2016-02-20 22:27:07,False,True
2016-02-20T22:56:29,annabell's boyfriend,0,0,lili miami,X1U21VBSbSs,0.0,2016-02-20 22:56:29,False,True
2016-02-20T23:58:17,break his rules,0,0,linzy mj,X1U21VBSbSs,0.0,2016-02-20 23:58:17,False,True
2016-02-21T04:17:05,Ok. What If Theres a episode of Annabelle and The Boy? Twisted Nigthmare for me,0,0,Yuriful Gaming,X1U21VBSbSs,-0.5,2016-02-21 04:17:05,False,True
2016-02-21T04:20:17,um huh its not scary dude why are you afraid of it,0,0,Analyn Timbangcaya,X1U21VBSbSs,-0.175,2016-02-21 04:20:17,False,True
2016-02-21T04:44:49,I guess it won't be called a horror movie if the characters were a little smarter.,0,0,Jen Train,X1U21VBSbSs,-0.1875,2016-02-21 04:44:49,False,True
2016-02-21T04:53:07,This movie kinda sucked.,0,0,CaptainHamsterPants,X1U21VBSbSs,0.0,2016-02-21 04:53:07,False,True
2016-02-21T09:17:40,call the avengers,0,0,Ryan Bennett,X1U21VBSbSs,0.0,2016-02-21 09:17:40,False,True
2016-02-21T09:17:53,We need scarlet witch on this,0,0,Ryan Bennett,X1U21VBSbSs,0.0,2016-02-21 09:17:53,False,True
2016-02-21T09:32:14,haunted...!!!!,0,0,rashmi solanki,X1U21VBSbSs,0.0,2016-02-21 09:32:14,False,True
2016-02-21T09:32:15,haunted...!!!!,0,0,rashmi solanki,X1U21VBSbSs,0.0,2016-02-21 09:32:15,False,True
2016-02-21T12:31:53,is. it released yet ?!!,0,0,Syeda Mahnoor,X1U21VBSbSs,0.0,2016-02-21 12:31:53,False,True
2016-02-21T16:57:56,fair play.... this looks like a complete pile of shit!!!!!!,0,0,Damien Darlington,X1U21VBSbSs,0.012353515624999978,2016-02-21 16:57:56,False,True
2016-02-21T17:08:15,Who directed this movie,0,0,Nikki Brown,X1U21VBSbSs,0.0,2016-02-21 17:08:15,False,True
2016-02-21T17:58:52,cuando se estrena en Colombia?,0,0,andrea bocanegra,X1U21VBSbSs,0.0,2016-02-21 17:58:52,False,True
2016-02-21T20:07:03,A guy would do the chalk thing once. Then he'd hammer it's nuts to the floor. Then he'd call his buddy's over. And they'd be like. Oh shit. Let me try something. Then the beer gets delivered....,0,0,Happily Insane,X1U21VBSbSs,-0.2,2016-02-21 20:07:03,False,True
2016-02-21T20:09:52,I watch this trailer sixth time xd,0,0,Nevo,X1U21VBSbSs,0.0,2016-02-21 20:09:52,False,True
2016-02-21T23:40:09,🚧🚨 Spoiler Alert 🚨🚧    BRAHMS Lived In The House && He Never Died And The Parents Set The Greta Up ,0,0,Dj Taylor,X1U21VBSbSs,0.0,2016-02-21 23:40:09,False,True
2016-02-22T03:54:40,ÉL NIÑO PELÍCULA COMPLETA COMPLETA DÉ TERROR HOY ESTAMOS DOMINGO 21 DÉ FEBRERO DEL 2016,0,0,Graciela Jauregui,X1U21VBSbSs,0.0,2016-02-22 03:54:40,False,True
2016-02-22T03:57:22,LA MALDICIÓN DÉ CHARLIE PELÍCULA DÉ TERROR COMPLETA HOY ESTAMOS DOMINGO 21 DÉ FEBRERO DEL 2016,0,0,Graciela Jauregui,X1U21VBSbSs,0.0,2016-02-22 03:57:22,False,True
2016-02-22T06:52:48,Dislike the movie :/,0,0,jerika626,X1U21VBSbSs,-0.25,2016-02-22 06:52:48,False,True
2016-02-22T07:11:54,Annabele is the very useless and laziest horror doll ever.. hopefully this boy wont fail me when I watch,0,0,Kirinkinkongkoy,X1U21VBSbSs,-0.575,2016-02-22 07:11:54,False,True
2016-02-22T07:22:32,This movie was good.! idk how some people r complaining its awesome.!,0,0,Jenna Kenna,X1U21VBSbSs,0.9375,2016-02-22 07:22:32,False,True
2016-02-22T08:17:37,Damn that's some creepy SHT not that much doe,0,0,Dark Bitch,X1U21VBSbSs,-0.15,2016-02-22 08:17:37,False,True
2016-02-22T10:47:00,why is a horror movie being filmed in wayne manor?,0,0,White berries,X1U21VBSbSs,0.0,2016-02-22 10:47:00,False,True
2016-02-22T14:47:30,Come on Maggie You know you have to stab it in the brain.,0,0,Dodgy Fellow,X1U21VBSbSs,0.0,2016-02-22 14:47:30,False,True
2016-02-22T20:24:39,"I'm so excited to see this, finally a good thriller movie.",0,0,Ellie,X1U21VBSbSs,0.5375,2016-02-22 20:24:39,False,True
2016-02-23T01:40:56,Nope nope nope all aboard the nope train to f***thatville,0,0,Peaceful RAGE,X1U21VBSbSs,0.0,2016-02-23 01:40:56,False,True
2016-02-23T02:42:03,que loco,0,0,Angelo Lopez,X1U21VBSbSs,0.0,2016-02-23 02:42:03,False,True
2016-02-23T07:58:23,It's like annebells brother,0,0,Joanna Choun,X1U21VBSbSs,0.0,2016-02-23 07:58:23,False,True
2016-02-23T12:38:29,what 😕,0,0,Tawana Tayna,X1U21VBSbSs,0.0,2016-02-23 12:38:29,False,True
2016-02-23T13:07:33,Yup I'm staying in the comment section,0,0,ExoticBeauty,X1U21VBSbSs,0.0,2016-02-23 13:07:33,False,True
2016-02-23T13:15:35,GOOD JOB MOVIE MAKER THAT CREATE THIS MOVIE>>>I CANNOT SLEEP AT NIGHT AND EVEN CANNOT SEE DOLLS......HURRRRRRRR>>>>>>>>>BURN THE DOLL ALREADY STEWPID!!!!!!!!!!!!!!!!!!!!!!!!!!!!!,0,0,MUHAMMAD AL HIJAZZI B. MAT TARMIZI -,X1U21VBSbSs,1.0,2016-02-23 13:15:35,False,True
2016-02-23T20:35:30,"I bet I can guess the ending to this movie from this trailer.  The boy, though badly burned, is living in the attic and moves around the house through the walls, moving the doll whenever she turns her back!",0,0,Barn Star,X1U21VBSbSs,-0.3499999999999999,2016-02-23 20:35:30,False,True
2016-02-23T22:33:03,Worst movie ever tbh Very disappointing,0,0,Tech,X1U21VBSbSs,-0.89,2016-02-23 22:33:03,False,True
2016-02-23T22:43:15,Maggie!,0,0,Scythia McQueen,X1U21VBSbSs,0.0,2016-02-23 22:43:15,False,True
2016-02-24T02:42:14,"The only thing scary was a couple of jump scares and the ending, honestly.",0,0,sarah p,X1U21VBSbSs,0.033333333333333326,2016-02-24 02:42:14,False,True
2016-02-24T06:52:07,omg is that MAGIE FROM THE WALKING DEAD TELL ME PLISE IS IT HER,0,0,super saijan god,X1U21VBSbSs,-0.2,2016-02-24 06:52:07,False,True
2016-02-24T07:30:01,"I watched the trailer.. is this a comedy? , cuz i was laughing quite a bit",0,0,Pushing 30,X1U21VBSbSs,0.0,2016-02-24 07:30:01,False,True
2016-02-24T08:18:37,slappys. not.  happy,0,0,martinemargaux uy,X1U21VBSbSs,-0.4,2016-02-24 08:18:37,False,True
2016-02-24T16:44:33,"the boy, doll of brahms is beatiful.the movie is good.♥♥♥♥♥♥♥♥LOVE THE MOVIE ""THE BOY""♥♥♥♥♥lol XD",0,0,Denisse Alexandra Siari Olivas,X1U21VBSbSs,0.0,2016-02-24 16:44:33,False,True
2016-02-24T19:40:19,does anybody know what song is in this?,0,0,belle mason,X1U21VBSbSs,0.0,2016-02-24 19:40:19,False,True
2016-02-24T21:23:24,"SPOILER (Sorry, i couldn't hold it in...Skip it if you want :3)   BRAWNS (The real boy, not the doll) DIDNT DIE! He survived the fire and he's been hiding behind the houses walls, moving the doll to random places...",0,0,Super Creative Team,X1U21VBSbSs,-0.13,2016-02-24 21:23:24,False,True
2016-02-25T13:38:31,Annabelle has a brother?,0,0,Wade,X1U21VBSbSs,0.0,2016-02-25 13:38:31,False,True
2016-02-25T15:06:52,wow this movie reminds me of a couple that have patched doll or something like that for 19 years,0,0,FrostyMarbles,X1U21VBSbSs,0.1,2016-02-25 15:06:52,False,True
2016-02-25T20:23:26,most bored movie i have seen ever.. Trailer is so fascinated but movie is so lame,0,0,Rachana Utekar,X1U21VBSbSs,-0.16666666666666666,2016-02-25 20:23:26,False,True
2016-02-25T20:26:28,wow. I am waiting,0,0,jeen our,X1U21VBSbSs,0.1,2016-02-25 20:26:28,False,True
2016-02-25T20:45:08,wow,0,0,jeen our,X1U21VBSbSs,0.1,2016-02-25 20:45:08,False,True
2016-02-25T22:37:14,shit,0,0,kevin uzcategui,X1U21VBSbSs,-0.2,2016-02-25 22:37:14,False,True
2016-02-25T23:40:37,walking dead much?,0,0,Pero Peric,X1U21VBSbSs,0.0,2016-02-25 23:40:37,False,True
2016-02-26T01:05:31,Does this mean Maggie is gonna die?,0,0,Lily Bird,X1U21VBSbSs,-0.3125,2016-02-26 01:05:31,False,True
2016-02-26T06:03:48,site please ? reply please,0,0,SandY TV,X1U21VBSbSs,0.0,2016-02-26 06:03:48,False,True
2016-02-26T17:14:52,se ve genial😘😘😘😘😘😘😘😋😋😗😙😋😙😋😙😗😙😗,0,0,Karla Garcia Pr,X1U21VBSbSs,0.0,2016-02-26 17:14:52,False,True
2016-02-26T20:11:47,"i'd smash that doll to bits, burn the bits in a hot fire & scatter the ashes to the 4 winds.   all within the first 5 minutes of the film  f**king dolls.  almost as creepy as clowns",0,0,lancsFrogger,X1U21VBSbSs,0.0,2016-02-26 20:11:47,False,True
2016-02-26T20:22:10,ya vi la del niño y esta vien gacha😈😑😕,0,0,Jose.230375 Pulido,X1U21VBSbSs,0.0,2016-02-26 20:22:10,False,True
2016-02-27T02:05:56,okay this is a good movie,0,0,Sol Torres,X1U21VBSbSs,0.6,2016-02-27 02:05:56,False,True
2016-02-27T12:45:02,the boy reminds me of LUCIOS that game of looove,0,0,Berrymilk,X1U21VBSbSs,-0.4,2016-02-27 12:45:02,False,True
2016-02-27T14:43:43,oh shit. sound like a good movie.,0,0,Asia lovelyy,X1U21VBSbSs,0.3,2016-02-27 14:43:43,False,True
2016-02-27T19:24:45,this movie was sooo good,0,0,marina,X1U21VBSbSs,0.7,2016-02-27 19:24:45,False,True
2016-02-27T22:01:20,"So if I break his rules, then Donald Trump will become president",0,0,MajesticOne,X1U21VBSbSs,0.0,2016-02-27 22:01:20,False,True
2016-02-28T05:24:11,Really? Just beat his ass,0,0,John John,X1U21VBSbSs,0.2,2016-02-28 05:24:11,False,True
2016-02-28T07:08:06,when Anabelle and Chucky have a baby...,0,0,Y S,X1U21VBSbSs,0.0,2016-02-28 07:08:06,False,True
2016-02-28T07:22:16,you wont expect the ending,0,0,Juliana Francine Cabalay,X1U21VBSbSs,0.0,2016-02-28 07:22:16,False,True
2016-02-28T11:46:25,Who know scary horror? Tell me pls,0,0,ARMY FOREVER,X1U21VBSbSs,-0.5,2016-02-28 11:46:25,False,True
2016-02-28T11:47:36,omg i can see this horror,0,0,ARMY FOREVER,X1U21VBSbSs,0.0,2016-02-28 11:47:36,False,True
2016-02-28T12:09:42,ridiculous,0,0,Miriam Yori,X1U21VBSbSs,-0.3333333333333333,2016-02-28 12:09:42,False,True
2016-02-28T16:05:22,i never like dolls,0,0,Papa Likes Movies,X1U21VBSbSs,0.0,2016-02-28 16:05:22,False,True
2016-02-29T04:28:58,que película tan chafa,0,0,Arturo Ceballos,X1U21VBSbSs,0.0,2016-02-29 04:28:58,False,True
2016-02-29T13:24:51,can't wait to watch this,0,0,Matthew Trinidad,X1U21VBSbSs,0.0,2016-02-29 13:24:51,False,True
2016-02-29T16:40:57,Nn è molto pauroso,0,0,Giorgia Frassica,X1U21VBSbSs,0.0,2016-02-29 16:40:57,False,True
2016-02-29T18:30:56,I don't like the ending..😂,0,0,Leah Fox,X1U21VBSbSs,0.0,2016-02-29 18:30:56,False,True
2016-03-01T03:46:02,MAGGIE!!!,0,0,Jord,X1U21VBSbSs,0.0,2016-03-01 03:46:02,False,True
2016-03-01T03:48:16,I'm not sure whats weirder. The fact she took the job or those crazy old folks who have a doll as their son?,0,0,Jord,X1U21VBSbSs,-0.25,2016-03-01 03:48:16,False,True
2016-03-01T05:42:59,gay,0,0,Emanuel B.,X1U21VBSbSs,0.4166666666666667,2016-03-01 05:42:59,False,True
2016-03-01T18:53:09,It is a cheap copy of the choky,0,0,711flor711,X1U21VBSbSs,0.4,2016-03-01 18:53:09,False,True
2016-03-01T20:09:55,when is this movie coming out(what date),0,0,Ibby Mirza,X1U21VBSbSs,0.0,2016-03-01 20:09:55,False,True
2016-03-01T21:39:23,"After all that Chucky crap, I don't think I'll ever be able to take this doll thing seriously.",0,0,Fran Carabajal,X1U21VBSbSs,-0.2111111111111111,2016-03-01 21:39:23,False,True
2016-03-02T02:33:39,Omg Lauren looks amazing in this😍,0,0,violet fiona,X1U21VBSbSs,0.6000000000000001,2016-03-02 02:33:39,False,True
2016-03-02T02:43:32,Maggie!,0,0,vampyre4208,X1U21VBSbSs,0.0,2016-03-02 02:43:32,False,True
2016-03-02T13:11:55,This is Annabelles boyfriend 😛,0,0,Queen of Derpness,X1U21VBSbSs,0.0,2016-03-02 13:11:55,False,True
2016-03-03T01:59:09,Bad Horror movie.,0,0,Codilak,X1U21VBSbSs,-0.6999999999999998,2016-03-03 01:59:09,False,True
2016-03-03T14:38:32,Whattss!?? Maggie??,0,0,Franco Edlp,X1U21VBSbSs,0.0,2016-03-03 14:38:32,False,True
2016-03-03T19:34:56,WHERE can i download a good real quality trnt of this movie Someone???,0,0,Maria Ljungström,X1U21VBSbSs,0.44999999999999996,2016-03-03 19:34:56,False,True
2016-03-03T23:19:40,Just ok...CHUCKY still rules!,0,0,gaae2000,X1U21VBSbSs,0.0,2016-03-03 23:19:40,False,True
2016-03-04T13:01:18,"im looking for a ""walking dead"" pun; anyone got anything?",0,0,Spanglehum Banglefink,X1U21VBSbSs,-0.2,2016-03-04 13:01:18,False,True
2016-03-04T18:12:46,when does this come out?,0,0,Justin Soto,X1U21VBSbSs,0.0,2016-03-04 18:12:46,False,True
2016-03-05T01:40:01,This movie had a huge plot twist and I absolutely loved it. 😂,0,0,manicpixieriley :o,X1U21VBSbSs,0.55,2016-03-05 01:40:01,False,True
2016-03-05T04:30:56,Just like gremlins all over,0,0,Felix M,X1U21VBSbSs,0.0,2016-03-05 04:30:56,False,True
2016-03-05T05:32:03,"I'm loving to horror movies and this I did not like , it was not to my liking ...",0,0,Darling Arias,X1U21VBSbSs,0.6,2016-03-05 05:32:03,False,True
2016-03-05T06:48:11,annabello????,0,0,José Cervera,X1U21VBSbSs,0.0,2016-03-05 06:48:11,False,True
2016-03-05T10:33:39,Creepy indeed :P,0,0,Aironas Baronas,X1U21VBSbSs,0.125,2016-03-05 10:33:39,False,True
2016-03-05T11:29:34,"I was worried if this was based on Robert the doll, because of Annebelle, but at least it seems original.",0,0,ナタリーNatalie,X1U21VBSbSs,0.037500000000000006,2016-03-05 11:29:34,False,True
2016-03-05T15:40:40,I like Lauren Cohan. One of my favorite characters from Supernatural.,1,0,octasian,X1U21VBSbSs,0.3333333333333333,2016-03-05 15:40:40,False,True
2016-03-05T15:58:38,wuau que onda,0,0,NaNaNa Tp,X1U21VBSbSs,0.0,2016-03-05 15:58:38,False,True
2016-03-05T18:35:43,You had one job woman! and you covered his entire face with a blanket lol.,0,0,Helix,X1U21VBSbSs,0.4,2016-03-05 18:35:43,False,True
2016-03-05T21:21:23,"Is this one of those 'you idiot, why did you break the rules' kinda movies?",0,0,Austin Thomas Films,X1U21VBSbSs,-0.8,2016-03-05 21:21:23,False,True
2016-03-05T23:25:38,LA Del niño😵😵😵😵😵😵😵😵😵😵,0,0,la furia negra,X1U21VBSbSs,0.0,2016-03-05 23:25:38,False,True
2016-03-06T00:02:05,so FUNNY!!!!!!!,0,0,Sally A,X1U21VBSbSs,1.0,2016-03-06 00:02:05,False,True
2016-03-06T03:21:52,;0,0,0,Lu is,X1U21VBSbSs,0.0,2016-03-06 03:21:52,False,True
2016-03-06T05:40:49,that is basically why I stopped playing with dolls at the age of 4 they where way too creepy,0,0,Persephone Gonzales,X1U21VBSbSs,-0.5,2016-03-06 05:40:49,False,True
2016-03-06T14:32:01,Didn't she play out of the walking dead I can't remember her name but she's the one who is looking after the boy,0,0,Gamer Girl,X1U21VBSbSs,-0.2,2016-03-06 14:32:01,False,True
2016-03-06T14:45:50,Hey its Rose from Vampire Diaries :D,0,0,Sruti Sushe,X1U21VBSbSs,0.8,2016-03-06 14:45:50,False,True
2016-03-06T14:57:02,Guess what I dreamed that I was fighting and trying to kill the balloon girl but it was a dumb dream and it actually happened but I know it happened and it was not a doll it was a little girl that has horror,0,0,derrick shnez,X1U21VBSbSs,-0.1875,2016-03-06 14:57:02,False,True
2016-03-06T14:57:47,why can't they just break the doll in pieces and burn it all.,0,0,Frederick P.,X1U21VBSbSs,0.0,2016-03-06 14:57:47,False,True
2016-03-06T18:45:04,I would throw that shit out of that window,0,0,Ava Dibartolo,X1U21VBSbSs,-0.2,2016-03-06 18:45:04,False,True
2016-03-06T18:49:00,Serves her right,0,0,Jackie deen,X1U21VBSbSs,0.2857142857142857,2016-03-06 18:49:00,False,True
2016-03-06T20:29:48,omg horror,0,0,Marcelo Locks,X1U21VBSbSs,0.0,2016-03-06 20:29:48,False,True
2016-03-06T21:52:54,estos videos estan super geniales😱😈😁😂😃😄,0,0,Jose Perez Angelino,X1U21VBSbSs,0.3333333333333333,2016-03-06 21:52:54,False,True
2016-03-07T01:04:03,que miedo👻👻👻👻👻,0,0,Ariadna Ortega,X1U21VBSbSs,0.0,2016-03-07 01:04:03,False,True
