timestamp,text,like_count,reply_count,author,trailer_id,sentiment_score,datetime,used_for_model,used_for_visualization
2017-01-24T01:10:16,"dolls always dolls the one thing scary,why does this have to happen :/",0,0,Mark Sorensen,X1U21VBSbSs,-0.25,2017-01-24 01:10:16,False,False
2017-01-24T06:14:40,The killer is hidden inside the walls of the house. The parents keep them in there.,0,0,Raz Singh,X1U21VBSbSs,-0.16666666666666666,2017-01-24 06:14:40,False,False
2017-01-24T19:01:52,that was scary,0,0,Nick Weber,X1U21VBSbSs,-0.5,2017-01-24 19:01:52,False,False
2017-01-25T05:21:50,"I think Brahms was adopted, he's twice the size of his father and super strong, like someone who works with chainsaws.",0,0,Valken,X1U21VBSbSs,0.3833333333333333,2017-01-25 05:21:50,False,False
2017-01-25T20:38:56,Because dolls weren't already creepy enough,40,1,Orion's Belt,X1U21VBSbSs,-0.25,2017-01-25 20:38:56,False,False
2017-01-26T07:28:43,"Dang it Maggie, why didn't you follow the rules!? :(",0,0,Dandelions Dandelions,X1U21VBSbSs,-0.75,2017-01-26 07:28:43,False,False
2017-01-27T11:54:06,Best MOVIE TRAILER of a horror movie ever i saw 👌👌👌👌👌👌👌👌 Goosebumps 😭😭😭,0,0,Weloveroshni Fanpage,X1U21VBSbSs,1.0,2017-01-27 11:54:06,False,False
2017-01-27T16:17:09,I watched the movie is so scary,0,0,it's Mark,X1U21VBSbSs,-0.5,2017-01-27 16:17:09,False,False
2017-01-27T22:39:50,Brahms is really creepy I feel bad for that girl,0,0,Eva StJohn,X1U21VBSbSs,-0.5999999999999999,2017-01-27 22:39:50,False,False
2017-01-28T19:20:12,when you break his rules you get your WORES nightmare:3,0,0,Brooklyn Gomez,X1U21VBSbSs,0.0,2017-01-28 19:20:12,False,False
2017-01-29T01:19:49,must see this movie lol 😂😂😈,0,0,PrincessMegan Elsa,X1U21VBSbSs,0.8,2017-01-29 01:19:49,False,False
2017-01-29T01:44:36,Isn't she the girl from supernatural Bella I think?,0,0,Maria Kara,X1U21VBSbSs,0.16666666666666666,2017-01-29 01:44:36,False,False
2017-01-29T20:09:43,The boy? DAT BOIIIII,0,0,Chico Mehdi,X1U21VBSbSs,0.0,2017-01-29 20:09:43,False,False
2017-01-30T04:47:27,So this is what maggie did before the apocalypes,0,0,BlueWater Wings,X1U21VBSbSs,0.0,2017-01-30 04:47:27,False,False
2017-01-30T09:56:20,So its Annabelle's male version 😂😂,1,0,Sunita Gupta,X1U21VBSbSs,0.0,2017-01-30 09:56:20,False,False
2017-01-31T17:55:15,Lauren❤,0,0,Viktøria xx,X1U21VBSbSs,0.0,2017-01-31 17:55:15,False,False
2017-02-01T21:41:52,The BOI,0,0,Jon Wever Jr,X1U21VBSbSs,0.0,2017-02-01 21:41:52,False,False
2017-02-01T22:42:39,"We get it all the dolls like billy, chucky, and now the boy all want to show off to Annabelle what's next?, Robert the doll",1,0,CarJay7,X1U21VBSbSs,0.0,2017-02-01 22:42:39,False,False
2017-02-03T17:03:40,Best movie in the world!!,4,1,Lps Pro,X1U21VBSbSs,1.0,2017-02-03 17:03:40,False,False
2017-02-04T07:23:23,oh my god so scary,0,0,aishah eggsy,X1U21VBSbSs,-0.5,2017-02-04 07:23:23,False,False
2017-02-05T16:31:52,A male version of Annabelle with a different kinda story,0,0,Shabab Ishrak,X1U21VBSbSs,0.0,2017-02-05 16:31:52,False,False
2017-02-05T22:06:04,Brahms I would take care of him like my borjter,0,0,Fabio Segovia,X1U21VBSbSs,0.0,2017-02-05 22:06:04,False,False
2017-02-06T01:39:30,I love this movie this is my favorite movie when I watched it in theaters,0,0,Lexi Wyatt,X1U21VBSbSs,0.5,2017-02-06 01:39:30,False,False
2017-02-06T15:41:02,😓,0,0,yasna yasna.emina,X1U21VBSbSs,0.0,2017-02-06 15:41:02,False,False
2017-02-07T14:37:49,Maggieeeeee💖,0,0,Yara Rostami,X1U21VBSbSs,0.0,2017-02-07 14:37:49,False,False
2017-02-08T01:52:30,the movie is not scary,0,0,Kirsten Adams,X1U21VBSbSs,0.25,2017-02-08 01:52:30,False,False
2017-02-08T04:03:15,Bishop Brennan has a son?,0,0,kikka kamai,X1U21VBSbSs,0.0,2017-02-08 04:03:15,False,False
2017-02-09T12:33:01,this is not a ghost story,0,0,Aastha R.,X1U21VBSbSs,0.0,2017-02-09 12:33:01,False,False
2017-02-10T09:10:12,This is creepy 😱😱😱😱😱😱😱😱😱😱,0,0,Tiara Jaspers,X1U21VBSbSs,-0.5,2017-02-10 09:10:12,False,False
2017-02-10T14:27:09,she had one god damn job..  wat made her think of being a babysitter stupid,0,0,Bhawi's corner,X1U21VBSbSs,-0.7999999999999999,2017-02-10 14:27:09,False,False
2017-02-11T11:19:26,hahaha bullshit movie.. not the horror,0,0,meli ryan,X1U21VBSbSs,0.2,2017-02-11 11:19:26,False,False
2017-02-12T12:44:44,I wasn't ready for this I wasn't ready,0,0,LPS Gang,X1U21VBSbSs,0.2,2017-02-12 12:44:44,False,False
2017-02-12T18:55:38,now  they should make The boy and annabele porn.,2,0,johni bogner,X1U21VBSbSs,0.0,2017-02-12 18:55:38,False,False
2017-02-13T19:48:29,He Is Like My Teacher When We Don't Feed Her( ˘ ³˘)❤,2,0,rolo,X1U21VBSbSs,0.0,2017-02-13 19:48:29,False,False
2017-02-15T11:39:01,ΠΟΛΥ ΜΑΠΑ ΔΕΝ ΕΙΝΑΙ ΚΑΘΟΛΟΥ ΤΡΟΜΑΚΤΙΚΟ!!!,5,2,My life as katerina!!?,X1U21VBSbSs,0.0,2017-02-15 11:39:01,False,False
2017-02-16T06:43:36,مي عربي  يتابعو,0,0,SOSO _SoSo,X1U21VBSbSs,0.0,2017-02-16 06:43:36,False,False
2017-02-17T03:26:38,the trailer tells you the whole story ...,0,0,Paula Acosta,X1U21VBSbSs,0.2,2017-02-17 03:26:38,False,False
2017-02-18T20:06:51,dang i half to wach this movie TODAY and im only 10,0,0,Xiomara Scaduto,X1U21VBSbSs,-0.08333333333333333,2017-02-18 20:06:51,False,False
2017-02-19T05:01:24,I ...I ...I fall in love.,0,0,Frisk The Frisky,X1U21VBSbSs,0.5,2017-02-19 05:01:24,False,False
2017-02-21T06:50:37,ovO this boy is so cute... but when he comes in reality... he turns like devil. ..she even tried to have romance with him... ommggg... but.. that part isn't not here!!!...mhm..,0,0,Chhaya Deo,X1U21VBSbSs,0.5,2017-02-21 06:50:37,False,False
2017-02-21T13:08:52,ending so stupid,0,0,NANiwhat123,X1U21VBSbSs,-0.7999999999999999,2017-02-21 13:08:52,False,False
2017-02-22T22:13:10,this movie is good until the end it's retarded,0,0,DL vlogs,X1U21VBSbSs,-0.050000000000000044,2017-02-22 22:13:10,False,False
2017-02-23T13:21:41,Lauren Cohan is so hot,0,0,bluntly honest,X1U21VBSbSs,0.25,2017-02-23 13:21:41,False,False
2017-02-23T16:47:59,I follow the rules for you,0,0,tillie Jukes,X1U21VBSbSs,0.0,2017-02-23 16:47:59,False,False
2017-02-24T18:26:06,so horrific,0,0,GraceTells you,X1U21VBSbSs,-1.0,2017-02-24 18:26:06,False,False
2017-02-26T06:10:37,I do love that boy thought 😆👦,0,0,Vero Smule,X1U21VBSbSs,0.5,2017-02-26 06:10:37,False,False
2017-02-27T01:04:44,Does anyone else recognize the stairs at 1:46 from The Vampire Diaries?? #Salvatorhouse,0,0,Jleve 14,X1U21VBSbSs,0.0,2017-02-27 01:04:44,False,False
2017-02-27T02:25:38,when you can't even take care of a doll,0,0,Little Angel,X1U21VBSbSs,0.0,2017-02-27 02:25:38,False,False
2017-02-28T07:14:15,Loren cohan ahhh,0,0,Princess Pablo,X1U21VBSbSs,0.0,2017-02-28 07:14:15,False,False
2017-02-28T21:27:35,Movie was shit,0,0,Addison Tharpe,X1U21VBSbSs,-0.2,2017-02-28 21:27:35,False,False
2017-03-02T11:30:01,you should have stayed in the walking dead Maggie.,0,0,TheRebelBeserker,X1U21VBSbSs,-0.2,2017-03-02 11:30:01,False,False
2017-03-02T23:18:23,2017,0,0,Skygirl086,X1U21VBSbSs,0.0,2017-03-02 23:18:23,False,False
2017-03-03T16:52:16,There is actually no ghost in the movie,0,0,Queen of Dark,X1U21VBSbSs,0.0,2017-03-03 16:52:16,False,False
2017-03-03T19:24:18,l o o k s  d u m b,0,0,HP Sauce,X1U21VBSbSs,0.0,2017-03-03 19:24:18,False,False
2017-03-04T01:49:55,Dammit Maggie...,0,0,Amnesian Bro,X1U21VBSbSs,0.0,2017-03-04 01:49:55,False,False
2017-03-04T02:27:37,awww that boy is so cute,0,0,AT A13 lover,X1U21VBSbSs,0.45,2017-03-04 02:27:37,False,False
2017-03-04T05:14:25,the boiii 😂😂,0,0,[A]ЯROW,X1U21VBSbSs,0.0,2017-03-04 05:14:25,False,False
2017-03-04T19:11:29,*amazing movie*,0,0,Emilia Kornaros,X1U21VBSbSs,0.6000000000000001,2017-03-04 19:11:29,False,False
2017-03-05T14:04:01,OMG if i Was in That  Story i Woud follow His Rules Because 1:i Hate Dolls and they are Creepy 2:This is Serious  3:Like If u Had a Jumpscare 👍🏻,0,0,Random Girl,X1U21VBSbSs,-0.5444444444444444,2017-03-05 14:04:01,False,False
2017-03-06T03:30:18,girl that is your fault you shouldve followed the rules omg😐,0,0,Majesty's Island,X1U21VBSbSs,0.0,2017-03-06 03:30:18,False,False
2017-03-09T02:13:37,The biggest mistake in this movie is hiring the girl in the first place Ｏ(≧∇≦)Ｏ,0,0,Stephanie Lumsden,X1U21VBSbSs,0.25,2017-03-09 02:13:37,False,False
2017-03-10T21:13:11,ça ressemble à Annabelle un peu,0,0,art expressif,X1U21VBSbSs,0.0,2017-03-10 21:13:11,False,False
2017-03-11T03:50:09,or u could just follow the rules and be smart and maybe listen next time if there is a next time 😵,0,0,Liviceskater Queen,X1U21VBSbSs,0.07142857142857142,2017-03-11 03:50:09,False,False
2017-03-11T17:02:02,She had one job and she messed it up,0,0,felim mccabe,X1U21VBSbSs,0.0,2017-03-11 17:02:02,False,False
2017-03-12T17:10:15,fraco....,0,0,Cauã Alvarenga,X1U21VBSbSs,0.0,2017-03-12 17:10:15,False,False
2017-03-12T20:49:27,why wouldn't you just follow the rules,0,0,Madelyn Walter,X1U21VBSbSs,0.0,2017-03-12 20:49:27,False,False
2017-03-14T05:10:23,annabelle got a bf,0,0,Anand Bharti,X1U21VBSbSs,0.0,2017-03-14 05:10:23,False,False
2017-03-14T22:56:18,"""this is our son, brahms"" *sees that it's a doll* me: ""LMAO BYEEEE""",5,0,Technickal,X1U21VBSbSs,0.6,2017-03-14 22:56:18,False,False
2017-03-15T13:13:26,Bro just knock em out,0,0,S4iF,X1U21VBSbSs,0.0,2017-03-15 13:13:26,False,False
2017-03-15T16:17:59,OMG,0,0,karla,X1U21VBSbSs,0.0,2017-03-15 16:17:59,False,False
2017-03-16T07:21:30,Lauren Cohan!,0,0,Mia Fazazi,X1U21VBSbSs,0.0,2017-03-16 07:21:30,False,False
2017-03-16T16:38:35,if i had to take care of him i will fallow his rules because  you re  nigthmares will come to life,0,0,Valeria Saldana,X1U21VBSbSs,0.0,2017-03-16 16:38:35,False,False
2017-03-18T03:02:20,This is a american boy dooll,0,0,Dude Normal,X1U21VBSbSs,0.0,2017-03-18 03:02:20,False,False
2017-03-19T15:15:11,Yeah Boiiiiiiiiiiiiiiiiiiiiiiiiiiiiiiiiiiiiiiiiiiiiiiiiiiiiiiiiiiiiiiiiiiiiiiiiiiiiiiiiii,5,0,cherry,X1U21VBSbSs,0.0,2017-03-19 15:15:11,False,False
2017-03-19T17:33:54,I never new Anna belle had a boyfriend,0,0,Usha KUMARI,X1U21VBSbSs,-0.06818181818181818,2017-03-19 17:33:54,False,False
2017-03-19T21:34:37,Guys if you want the boy to die just put on cringy songs and he will die,0,0,De Wey,X1U21VBSbSs,0.0,2017-03-19 21:34:37,False,False
2017-03-21T11:50:01,Hello,0,0,Psychopaths United,X1U21VBSbSs,0.0,2017-03-21 11:50:01,False,False
2017-03-23T15:19:50,This movie was straight dookie....,0,0,Desert Bloomz,X1U21VBSbSs,0.2,2017-03-23 15:19:50,False,False
2017-03-23T21:23:32,this movie sucked so bad and made no sense at all,0,0,Cropsy25,X1U21VBSbSs,-0.6999999999999998,2017-03-23 21:23:32,False,False
2017-03-24T03:39:42,Somebody please set him up with Annabelle ! Who knows Annabelle in person,0,0,mj vishu,X1U21VBSbSs,0.0,2017-03-24 03:39:42,False,False
2017-03-25T03:05:29,just buy him a new iPhone he's probably stuck with a really old Nokia which Is making him mad,247,3,Sapphire Hurcombe,X1U21VBSbSs,-0.12954545454545455,2017-03-25 03:05:29,False,False
2017-03-27T06:27:51,im watch movie its not scary its good movie,0,0,Teodora Vučinić,X1U21VBSbSs,0.475,2017-03-27 06:27:51,False,False
2017-03-27T12:59:26,"this is such a good horror film, you wouldn't expect the ending to be what it is at all. Worth the watch!👏🏻",0,0,Edi D,X1U21VBSbSs,0.3333333333333333,2017-03-27 12:59:26,False,False
2017-03-29T15:10:12,"I thought the movie would be so scary after watching this trailer IDEK why I'd even think that because this movie was not even scary, waste if time...",0,0,Tallia Charmer,X1U21VBSbSs,-0.39999999999999997,2017-03-29 15:10:12,False,False
2017-03-29T21:47:12,"Reminds me of Chuckie, but better looking doll than Chuckie.",0,0,Emmi Shaelyn,X1U21VBSbSs,0.5,2017-03-29 21:47:12,False,False
2017-03-29T23:07:58,I saw the boy reveal himself but how is the man moving the doll so quick when she Turns her back on him?? The man is. In the  walls!,0,0,Smstudios masters 123566,X1U21VBSbSs,0.16666666666666666,2017-03-29 23:07:58,False,False
2017-03-30T11:28:05,There's a Boy in The Wall!!!!!!!!!!!,0,0,GW H,X1U21VBSbSs,0.0,2017-03-30 11:28:05,False,False
2017-03-30T18:20:00,one job ..,0,0,Kelvyn Mendieta-Ortega,X1U21VBSbSs,0.0,2017-03-30 18:20:00,False,False
2017-03-31T08:43:39,Everyone who watched The Walking Dead knows that she is Maggie😍😍😂❤,0,0,angie . yuh on Instagram,X1U21VBSbSs,-0.2,2017-03-31 08:43:39,False,False
2017-03-31T21:14:55,What's the ending? Plz tell meeeee,0,0,pk-a-booP,X1U21VBSbSs,0.0,2017-03-31 21:14:55,False,False
2017-03-31T21:28:30,Does very thing the nice old woman says wrong   Wonders why this is happening to her,0,0,Randy Butternubbs,X1U21VBSbSs,0.1,2017-03-31 21:28:30,False,False
2017-04-01T13:39:59,Who else hears the distorted sleepwalk song,0,0,It’s me God,X1U21VBSbSs,0.0,2017-04-01 13:39:59,False,False
2017-04-01T15:53:02,dont leave a doll with creepy face alone .-.,0,0,Kim Jong Un Donkigong,X1U21VBSbSs,-0.5,2017-04-01 15:53:02,False,False
2017-04-02T17:43:34,This movie is ass terrible trash shit anything that means bad,0,0,drepats fan,X1U21VBSbSs,-0.6333333333333333,2017-04-02 17:43:34,False,False
2017-04-03T22:17:31,Ha! White people Problems...,0,0,KeYBuMp,X1U21VBSbSs,0.0,2017-04-03 22:17:31,False,False
2017-04-03T23:09:04,This makes me think about annabelle,0,0,Mizuism,X1U21VBSbSs,0.0,2017-04-03 23:09:04,False,False
2017-04-04T00:59:11,"THIS WAS  A GOOD MOVIE, AND THE ENDING WAS AWESOME",1,0,sneakymia1,X1U21VBSbSs,0.85,2017-04-04 00:59:11,False,False
2017-04-04T01:04:19,Nope nope nope nope nope nope nope,0,0,Tom Keane,X1U21VBSbSs,0.0,2017-04-04 01:04:19,False,False
2017-04-04T17:50:47,"I fell asleep after the first 45 minutes it never picks up that horror vibe it should have and could have had, I will admit I was just screaming at my TV JUST FOLLOW THE SIMPLE RULES YOU ARE PAID, FOR I WOULD NOT HAVE HIRED YOU!",0,0,Angelreborn Kuroko,X1U21VBSbSs,0.125,2017-04-04 17:50:47,False,False
2017-04-05T20:56:59,its not even scary,0,0,Sheila Jimenez,X1U21VBSbSs,-0.5,2017-04-05 20:56:59,False,False
2017-04-06T04:04:38,YOU HAD ONE JOB,0,0,I Am Frisk The Pacifist,X1U21VBSbSs,0.0,2017-04-06 04:04:38,False,False
2017-04-06T11:34:46,I'm a scaredy cat,0,0,Charlie. Fn,X1U21VBSbSs,0.0,2017-04-06 11:34:46,False,False
2017-04-06T13:21:39,WOW!!! What a great movie!! I'm in love with this movie💗💗,0,0,Ggvhvgvj Cgchcyvh,X1U21VBSbSs,0.5651041666666666,2017-04-06 13:21:39,False,False
2017-04-06T16:00:43,*FOLLOW DEEZ RULES*  DO NOT ASSUME THE KIDS GENDER  Gorl:Ok well heres your snickers little *Boy* The kid:Well you did have one job,0,0,Ducc Succ,X1U21VBSbSs,-0.1875,2017-04-06 16:00:43,False,False
2017-04-08T09:37:42,"loved it , someone has link to its full movie ???",0,0,vanshika,X1U21VBSbSs,0.5249999999999999,2017-04-08 09:37:42,False,False
2017-04-08T14:30:11,I hate people who hate horror movies.,0,0,Sriram,X1U21VBSbSs,-0.8,2017-04-08 14:30:11,False,False
2017-04-08T19:50:58,I started watching the movie after reading comments section​I found it hilarious,0,0,Kapil Jhorar,X1U21VBSbSs,0.5,2017-04-08 19:50:58,False,False
2017-04-09T11:59:22,Hello friends! Online site that really works: (just type in g00gle)-> *www/ppadder/ml*,0,0,J Fairbrass,X1U21VBSbSs,-0.275,2017-04-09 11:59:22,False,False
2017-04-09T17:30:18,ITS DAT BOOOOIIIIIIIIII,0,0,An Kul,X1U21VBSbSs,0.0,2017-04-09 17:30:18,False,False
2017-04-09T18:36:56,This is SCARY someone send me some warmth,0,0,GracieTube,X1U21VBSbSs,-0.5,2017-04-09 18:36:56,False,False
2017-04-11T02:18:15,u had one job girl. ONE FREAKING JOB!,0,1,Syrus Angi,X1U21VBSbSs,0.0,2017-04-11 02:18:15,False,False
2017-04-11T02:21:17,"Chuckie, Annabelle Poltergeist clown: WELCOME TO THE FAMILY BRAHNS!",0,0,Syrus Angi,X1U21VBSbSs,1.0,2017-04-11 02:21:17,False,False
2017-04-11T04:24:19,The Doll looks like Lucius,0,0,Edgar,X1U21VBSbSs,0.0,2017-04-11 04:24:19,False,False
2017-04-12T13:54:04,this had the world's shittest ending ever. the movie was quite impressive right until the end of the movie just because of how they reveal all the secrets.,0,0,talha islam,X1U21VBSbSs,0.6428571428571428,2017-04-12 13:54:04,False,False
2017-04-13T09:54:51,Take care of the doll!! What the heck why she dont take care of it?,0,0,ND55,X1U21VBSbSs,0.0,2017-04-13 09:54:51,False,False
2017-04-14T06:20:46,griepy,0,0,iiDqnii,X1U21VBSbSs,0.0,2017-04-14 06:20:46,False,False
2017-04-14T12:29:38,"miss lady u need to feed him n do what to do in the list..... tommorow...... n why do i need to follow the rules he is just a doll   2 month later,      damn, why did i follow the list i am stupid b*tch........       the end......... XD      plzz subcribe thank u XD ",1,0,cutelittle animiyshouka,X1U21VBSbSs,-0.39999999999999997,2017-04-14 12:29:38,False,False
2017-04-14T15:57:54,super ale nie straszne ale super,0,0,piontek nie 13stego,X1U21VBSbSs,0.3333333333333333,2017-04-14 15:57:54,False,False
2017-04-14T17:48:10,I need to watch this 😂,0,0,Rose Irene,X1U21VBSbSs,0.0,2017-04-14 17:48:10,False,False
2017-04-15T04:56:22,NYC movie,0,0,Muhammad Hisham,X1U21VBSbSs,0.0,2017-04-15 04:56:22,False,False
2017-04-16T08:51:33,The trailer was scerd me,0,0,Elite _Samurai,X1U21VBSbSs,0.0,2017-04-16 08:51:33,False,False
2017-04-16T10:29:13,YOU. ARE. A. TOY!!!!,0,0,old toby,X1U21VBSbSs,0.0,2017-04-16 10:29:13,False,False
2017-04-16T20:04:14,Wait was the lady The voice actor of Doctor Amari from fallout 4?,0,0,TitanFighter,X1U21VBSbSs,0.0,2017-04-16 20:04:14,False,False
2017-04-17T02:20:44,Look like a great syory👍👍,0,0,aashu chaudhary,X1U21VBSbSs,0.8,2017-04-17 02:20:44,False,False
2017-04-17T18:58:19,Da boi.,0,0,SMALL3ST,X1U21VBSbSs,0.0,2017-04-17 18:58:19,False,False
2017-04-18T02:21:06,Whoa chill. On Tinder Annabelle just asked for your profile pic!,4,0,MovieGirl8,X1U21VBSbSs,0.0,2017-04-18 02:21:06,False,False
2017-04-18T02:22:30,Oh so for don't leave him alone you expect him to watch her shower? Perverted minds.,0,0,MovieGirl8,X1U21VBSbSs,0.0,2017-04-18 02:22:30,False,False
2017-04-18T23:26:57,BOI IF I SAW THAT DOLL MOVE I WOULD BURN IT AND LEAVE THE HOUSE!!! THEN MOVE TO THE OTHER SIDE OF THE WORLD.,0,0,エマ,X1U21VBSbSs,-0.125,2017-04-18 23:26:57,False,False
2017-04-19T19:50:52,I want see it!!!!,0,0,kourisaki,X1U21VBSbSs,0.0,2017-04-19 19:50:52,False,False
2017-04-21T17:36:59,Why are all creepy dolls white liEK WTF IK IM BLACK BUT JUST SAYINNM BOIII,0,0,Duehndhd Djdndndjc,X1U21VBSbSs,-0.2916666666666667,2017-04-21 17:36:59,False,False
2017-04-21T21:17:14,"Wow lady, you had one job",0,0,Benjamin Sandsør,X1U21VBSbSs,0.1,2017-04-21 21:17:14,False,False
2017-04-22T07:02:44,horseshit movie,0,0,flawless curl,X1U21VBSbSs,0.0,2017-04-22 07:02:44,False,False
2017-04-22T18:45:04,she should be listened,0,0,Pretty Girl Productions,X1U21VBSbSs,0.0,2017-04-22 18:45:04,False,False
2017-04-23T01:17:12,_+_  I love this movie,0,0,tankura,X1U21VBSbSs,0.5,2017-04-23 01:17:12,False,False
2017-04-23T09:01:57,When You Realized That This Is Thriller,0,0,WhatANigga Know,X1U21VBSbSs,0.0,2017-04-23 09:01:57,False,False
2017-04-23T09:50:56,This film was awful,0,0,GodHimself,X1U21VBSbSs,-1.0,2017-04-23 09:50:56,False,False
2017-04-23T11:30:14,"Bela Talbot, you know better than to mess with creepy supernatural stuff. Just sell the dummy to Crowley, already!",0,0,Anahit Korkotyan,X1U21VBSbSs,0.008333333333333331,2017-04-23 11:30:14,False,False
2017-04-23T20:32:03,hey it's Maggie!,0,0,DexicGhost,X1U21VBSbSs,0.0,2017-04-23 20:32:03,False,False
2017-04-24T17:18:09,this is the most terrifying thing i have ever seen i have DOLLS i don't even say the word DOLLS/DOLL,4,0,Abigail Mills,X1U21VBSbSs,-0.25,2017-04-24 17:18:09,False,False
2017-04-24T19:48:30,"This movie had an okay start, then, when you expected for it to get better, it didn't.  Why didn't they just call the dumb movie, ""Brahms""?",0,0,KingofPepsi,X1U21VBSbSs,0.13125,2017-04-24 19:48:30,False,False
2017-04-25T04:33:48,ce film est nul à aucun moment j'ai eu ne serai ce qu'un seul frisson,0,0,Sophi Tkl,X1U21VBSbSs,0.0,2017-04-25 04:33:48,False,False
2017-04-26T09:42:16,0:48 - 1:06 This Bitch is Dumb AF,0,0,bubbles soo loo,X1U21VBSbSs,-0.375,2017-04-26 09:42:16,False,False
2017-04-26T09:53:26,A gender-swapped and MUCH less violent version of Annabelle.,0,0,Rumble Lane,X1U21VBSbSs,-0.48333333333333334,2017-04-26 09:53:26,False,False
2017-04-26T12:15:20,man i got a one simple tip  how to survive a horror movie first if home looks sketchy never buy or if there died more than 7 people. 2nd cant you juts hit an axe to toy at his head and then burn him problem solved,0,0,FLIIPY,X1U21VBSbSs,0.1875,2017-04-26 12:15:20,False,False
2017-04-26T19:16:09,this kids is why we listen to our elders,1,0,i'm stupid but,X1U21VBSbSs,0.0,2017-04-26 19:16:09,False,False
2017-04-27T04:41:47,"Theres nothing supernatural about it, Its a mentally deranged guy living in the walls & the parents use the doll to communicate with their son..it suck ass, enjoy the movie👍",0,0,Jayson RedHood187,X1U21VBSbSs,0.15555555555555556,2017-04-27 04:41:47,False,False
2017-04-27T06:16:45,"I know if alive dolls are not real but if they are, the doll would turn on their owners.",0,0,Anthony Walker,X1U21VBSbSs,0.0,2017-04-27 06:16:45,False,False
2017-04-27T12:09:28,i was searching for Dat Boi meme and this shit came out,0,0,COMMENT WAR,X1U21VBSbSs,-0.2,2017-04-27 12:09:28,False,False
2017-04-27T19:27:06,And why am I watching this at 12:00 am........,0,0,HaNnAh ThE mEmEr ShiShTer,X1U21VBSbSs,0.0,2017-04-27 19:27:06,False,False
2017-04-28T01:04:21,this movie was not scary at all,0,0,Daniela Ramos-Vargas,X1U21VBSbSs,0.25,2017-04-28 01:04:21,False,False
2017-04-28T01:08:15,spoiler even if iam late but I watched the movie when it came anyway the doll is not haunted it's the kid who grew up and hides in the walls and moves the doll around and if dosent follow the orders the dude will get pissed,0,0,Daniela Ramos-Vargas,X1U21VBSbSs,-0.3,2017-04-28 01:08:15,False,False
2017-04-28T10:25:08,there was a sam&cat episode like this a more daft and fun version,0,0,anthonie marten,X1U21VBSbSs,0.4,2017-04-28 10:25:08,False,False
2017-04-29T02:44:45,Annabelle has a bf i see 😏👀,1540,20,tammy phan,X1U21VBSbSs,0.0,2017-04-29 02:44:45,False,False
2017-04-29T08:21:38,Maggie from The Walking Dead,0,0,Florin Alexandru Luchian,X1U21VBSbSs,-0.2,2017-04-29 08:21:38,False,False
2017-04-29T16:31:16,looks good,0,0,Amanda Martinez,X1U21VBSbSs,0.7,2017-04-29 16:31:16,False,False
2017-04-29T18:33:41,what if negan is the grown version  of the boy (walking dead reference),0,0,Eden,X1U21VBSbSs,-0.2,2017-04-29 18:33:41,False,False
2017-04-29T19:43:40,*Dat boi*,0,0,Zalabit,X1U21VBSbSs,0.0,2017-04-29 19:43:40,False,False
2017-04-30T05:40:15,Not even scary,0,0,Dorito - Agar,X1U21VBSbSs,-0.5,2017-04-30 05:40:15,False,False
2017-04-30T19:47:34,She had one job and she broke all the rules I could do a better job then her,0,0,Catalina Viele,X1U21VBSbSs,0.5,2017-04-30 19:47:34,False,False
2017-05-01T03:00:57,was this a good movie?,0,2,inuyashasmells,X1U21VBSbSs,0.7,2017-05-01 03:00:57,False,False
2017-05-01T09:10:01,täiesti õudne,0,0,sten Kahu,X1U21VBSbSs,0.0,2017-05-01 09:10:01,False,False
2017-05-02T04:49:53,"Or she could've just followed the list, and shit wouldn't have happened",0,0,Tiana Bruh,X1U21VBSbSs,-0.2,2017-05-02 04:49:53,False,False
2017-05-02T08:58:39,The Boy : You Know what happens when u dont follow the rules? U know what happens?? YOU JUST MADE THE LIST !! (Chris Jericho ),38,2,AurezX,X1U21VBSbSs,0.0,2017-05-02 08:58:39,False,False
2017-05-02T15:12:29,i feel bad for brahms,0,0,glenn mosquite,X1U21VBSbSs,-0.6999999999999998,2017-05-02 15:12:29,False,False
2017-05-03T00:10:11,"That bitch had One job, ONE JOB but instead no she decided to be a hypocrite.",0,0,Milf Hunter,X1U21VBSbSs,0.0,2017-05-03 00:10:11,False,False
2017-05-03T10:37:44,be exellent to him and he will be exellent to you,0,0,CollectMyBones,X1U21VBSbSs,0.0,2017-05-03 10:37:44,False,False
2017-05-03T23:40:59,TWD Squad where you at?! 🙌🏾,0,0,Roomy M.,X1U21VBSbSs,0.0,2017-05-03 23:40:59,False,False
2017-05-04T02:28:28,she deserved it,0,0,damn me,X1U21VBSbSs,0.0,2017-05-04 02:28:28,False,False
2017-05-04T08:08:27,who is a walking dead fan because that is maggie,0,0,Saul -Ger1956,X1U21VBSbSs,-0.2,2017-05-04 08:08:27,False,False
2017-05-04T20:44:26,well seems like maggie survives twd,0,0,Victor Gabriel,X1U21VBSbSs,0.0,2017-05-04 20:44:26,False,False
2017-05-06T18:35:32,i got to see this,0,0,SpokenMindRecordzEnt,X1U21VBSbSs,0.0,2017-05-06 18:35:32,False,False
2017-05-06T21:11:19,ITS MAGGIE FROM THE WALKING DEAD,0,0,Olivia Champagne,X1U21VBSbSs,-0.2,2017-05-06 21:11:19,False,False
2017-05-07T13:46:20,at least  he's not a walker,0,0,rowena cojedor,X1U21VBSbSs,-0.3,2017-05-07 13:46:20,False,False
2017-05-07T14:33:34,Dang that doll looks like a Devils son,0,0,Blake Buckley,X1U21VBSbSs,0.0,2017-05-07 14:33:34,False,False
2017-05-08T09:23:08,this is fucken freaky,0,0,str_ker_,X1U21VBSbSs,0.0,2017-05-08 09:23:08,False,False
2017-05-08T19:40:48,im on the boy side,0,0,FOXY SAVAGE NATION,X1U21VBSbSs,0.0,2017-05-08 19:40:48,False,False
2017-05-09T10:09:44,مترجم؟(:,0,0,Rasyah Rasyah.11,X1U21VBSbSs,0.0,2017-05-09 10:09:44,False,False
2017-05-09T23:10:29,This reminds me of fma for some reason,0,0,Pastel gacha w3w,X1U21VBSbSs,0.0,2017-05-09 23:10:29,False,False
2017-05-10T20:12:56,id just chain him to a helicopter,0,0,My nan is dead,X1U21VBSbSs,0.0,2017-05-10 20:12:56,False,False
2017-05-11T00:19:10,isn't this BASED on a true story,0,0,Alexa L,X1U21VBSbSs,0.35,2017-05-11 00:19:10,False,False
2017-05-11T10:09:40,What wrong with the boy?,0,0,Aapeli Steven,X1U21VBSbSs,-0.5,2017-05-11 10:09:40,False,False
2017-05-11T16:07:19,omg! maggie greene! if you dont get this we cant be friends..,0,0,UnsuitableJosh,X1U21VBSbSs,0.0,2017-05-11 16:07:19,False,False
