timestamp,text,like_count,reply_count,author,trailer_id,sentiment_score,datetime,used_for_model,used_for_visualization
2015-10-17T17:01:13,First!!!!!!,0,4,Brayden Heidrich,X1U21VBSbSs,0.95367431640625,2015-10-17 17:01:13,True,True
2015-10-17T17:03:03,"it looks scary, but its so unoriginal",0,1,Haykal Arsya,X1U21VBSbSs,-0.35,2015-10-17 17:03:03,True,True
2015-10-17T17:03:05,Meh,0,0,Mints,X1U21VBSbSs,0.0,2015-10-17 17:03:05,True,True
2015-10-17T17:03:19,Only watching because the nanny is the girl from the walking dead who dates Glenn,0,1,Riddler-Missing,X1U21VBSbSs,-0.1,2015-10-17 17:03:19,True,True
2015-10-17T17:04:37,It's good,0,2,Miss Wintour,X1U21VBSbSs,0.7,2015-10-17 17:04:37,True,True
2015-10-17T17:04:49,that looks creepy af,0,1,a_ youtuber,X1U21VBSbSs,-0.5,2015-10-17 17:04:49,True,True
2015-10-17T17:05:03,She dies in the walking dead I guess,89,12,Joseph Vintuks,X1U21VBSbSs,-0.2,2015-10-17 17:05:03,True,True
2015-10-17T17:06:00,where sam and dean when you need them,556,27,Julian Campos,X1U21VBSbSs,0.0,2015-10-17 17:06:00,True,True
2015-10-17T17:06:04,Is this like another jumpscare compilation called horror movie? Horror movies are not about insta high volume jumpscares. Its about delivering creeps and tension. Rare writers this days can come up with good horror movies.,499,54,Dracula,X1U21VBSbSs,0.38666666666666666,2015-10-17 17:06:04,True,True
2015-10-17T17:06:31,White people...SMH,1,1,Make Way,X1U21VBSbSs,0.0,2015-10-17 17:06:31,True,True
2015-10-17T17:07:00,the worst of this trailer is that they reveald all the spooky moments its like final destination show us all the deaths in the trailers,3,0,Cureless,X1U21VBSbSs,-0.5,2015-10-17 17:07:00,True,True
2015-10-17T17:07:18,annabelle reloaded,0,0,CJxLS,X1U21VBSbSs,0.0,2015-10-17 17:07:18,True,True
2015-10-17T17:07:32,salut cest julien,0,0,Valentin Dubreuil,X1U21VBSbSs,0.0,2015-10-17 17:07:32,True,True
2015-10-17T17:07:34,Boring,0,0,UntouchedOutlaw,X1U21VBSbSs,-1.0,2015-10-17 17:07:34,True,True
2015-10-17T17:07:42,Fodaaah,0,0,breneige,X1U21VBSbSs,0.0,2015-10-17 17:07:42,True,True
2015-10-17T17:07:44,Maggie!,0,0,shooting as CK,X1U21VBSbSs,0.0,2015-10-17 17:07:44,True,True
2015-10-17T17:08:08,The Random guy likes,0,3,Tr33ck0 Rose,X1U21VBSbSs,-0.5,2015-10-17 17:08:08,True,True
2015-10-17T17:08:08,"Well, at least it's not based on a true story. :P",111,11,Salah Al-Bloushi,X1U21VBSbSs,0.26666666666666666,2015-10-17 17:08:08,True,True
2015-10-17T17:08:32,"I'm not scared, actually I feel sorry for to boy :(",0,0,Yixi Lu,X1U21VBSbSs,-0.4166666666666667,2015-10-17 17:08:32,True,True
2015-10-17T17:08:41,MAGGIE!,17,0,Mr. GMAN's Channel,X1U21VBSbSs,0.0,2015-10-17 17:08:41,True,True
2015-10-17T17:08:51,Lauren Cohen 😍😘,1,0,Chetan Marimuthu,X1U21VBSbSs,0.0,2015-10-17 17:08:51,True,True
2015-10-17T17:09:52,The boy is CORAL...,0,0,Jün André,X1U21VBSbSs,0.0,2015-10-17 17:09:52,True,True
2015-10-17T17:10:28,Oh hey Maggie :D,0,0,Mya6,X1U21VBSbSs,1.0,2015-10-17 17:10:28,True,True
2015-10-17T17:10:55,random guy came here...,42,2,Randy Hulsebos,X1U21VBSbSs,-0.5,2015-10-17 17:10:55,True,True
2015-10-17T17:11:24,Random Guy wants -,17,3,Biggy Noob,X1U21VBSbSs,-0.15,2015-10-17 17:11:24,True,True
2015-10-17T17:11:33,Chucky Knockoff,0,0,Ivan G,X1U21VBSbSs,0.0,2015-10-17 17:11:33,True,True
2015-10-17T17:11:42,Maggie,0,0,No,X1U21VBSbSs,0.0,2015-10-17 17:11:42,True,True
2015-10-17T17:12:06,👌👌👌👌👌 looks sick!!,0,0,Oliver Warrick,X1U21VBSbSs,-1.0,2015-10-17 17:12:06,True,True
2015-10-17T17:12:08,lol why not try and have a  convo with the ghost?,0,0,shinlenox,X1U21VBSbSs,0.8,2015-10-17 17:12:08,True,True
2015-10-17T17:12:19,"Damn, why didn't she just feed him.",1806,46,Joe Biden's Shotgun,X1U21VBSbSs,0.0,2015-10-17 17:12:19,True,True
2015-10-17T17:12:43,As soon as I saw PG-13 I stopped watching,0,3,Louis P,X1U21VBSbSs,0.0,2015-10-17 17:12:43,True,True
2015-10-17T17:12:54,The doll is like Lucius.,0,0,Tio Xará,X1U21VBSbSs,0.0,2015-10-17 17:12:54,True,True
2015-10-17T17:13:31,i bet he's based off robert the doll,116,20,Team DC,X1U21VBSbSs,0.0,2015-10-17 17:13:31,True,True
2015-10-17T17:14:02,This movie looks hilarious!   So many horror comedies have been coming out recently.,0,0,AA1891,X1U21VBSbSs,0.375,2015-10-17 17:14:02,True,True
2015-10-17T17:14:40,lmao the dude from Hellboy,0,0,Justin,X1U21VBSbSs,0.6,2015-10-17 17:14:40,True,True
2015-10-17T17:15:00,"This is the first time lauren cohan is in the movie, not game of thrones actor",0,0,Raja's VLOGS,X1U21VBSbSs,0.225,2015-10-17 17:15:00,True,True
2015-10-17T17:15:40,"So who's taking bets that he's either a haunted living doll, or she's going crazy and thinks it's real. Either way, this trailer is bad. I rarely judge movies by trailers these days anyways.",0,0,yanipheonu,X1U21VBSbSs,-0.19999999999999996,2015-10-17 17:15:40,True,True
2015-10-17T17:15:41,lmfao im done with this random guy,3,0,David Obregon,X1U21VBSbSs,-0.5,2015-10-17 17:15:41,True,True
2015-10-17T17:16:24,"Besides our pretty Lauren here, there's nothing else to see.",5,1,Sky Dieme,X1U21VBSbSs,0.25,2015-10-17 17:16:24,True,True
2015-10-17T17:18:06,She's gonna die in the Walking Dead,0,0,Kaysusantayo 24,X1U21VBSbSs,-0.2,2015-10-17 17:18:06,True,True
2015-10-17T17:18:44,The Random Guy get's more attention than the trailer lmao,0,0,nombots,X1U21VBSbSs,0.19999999999999998,2015-10-17 17:18:44,True,True
2015-10-17T17:19:03,Αnnabellle's boyfriend?,1214,60,Jax Teller,X1U21VBSbSs,0.0,2015-10-17 17:19:03,True,True
2015-10-17T17:19:16,random guy likes....,1,0,Annko R,X1U21VBSbSs,-0.5,2015-10-17 17:19:16,True,True
2015-10-17T17:19:38,should've followed the stupid rules. I mean that was her only job man !!!,776,15,Maryem Ben Brahim,X1U21VBSbSs,-0.3708333333333333,2015-10-17 17:19:38,True,True
2015-10-17T17:20:22,the walking boy,2,0,Timothy Ma,X1U21VBSbSs,0.0,2015-10-17 17:20:22,True,True
2015-10-17T17:21:35,So her life before the zombie apocalypse was also fucked,1,0,Nick Dalzell,X1U21VBSbSs,-0.6,2015-10-17 17:21:35,True,True
2015-10-17T17:24:23,BO3 Hype,0,0,Eduardo Ramon,X1U21VBSbSs,0.0,2015-10-17 17:24:23,True,True
2015-10-17T17:24:26,"wow, you know what, yes crazy people I will take this job minding your doll in a big freaky old house, wow this movie looks retarded",0,0,ryan keogh,X1U21VBSbSs,-0.18333333333333335,2015-10-17 17:24:26,True,True
2015-10-17T17:25:32,Why don't you just smash the shit out of it? It's a porcelain doll...lol.,889,66,DavijoMan,X1U21VBSbSs,-0.2,2015-10-17 17:25:32,True,True
2015-10-17T17:26:01,Reminds me of that movie where the girl moves to an old house and discovers that previous owners locked their kid on the attic and now the house is haunted or something like that.,0,0,pz z97,X1U21VBSbSs,-0.033333333333333326,2015-10-17 17:26:01,True,True
2015-10-17T17:27:36,Maggie and the Real Boy,0,0,MalcolmRandall,X1U21VBSbSs,0.2,2015-10-17 17:27:36,True,True
2015-10-17T17:27:54,Damn it Maggie you had one job...,7,0,dandaman12199,X1U21VBSbSs,0.0,2015-10-17 17:27:54,True,True
2015-10-17T17:30:05,"Hola, seria de gran apoyo que visitaran mi blog donde pongo algunas que cosas que escribo, me gustaría que lo leyeran, y comentaran que tal le parece acepto criticas constructivas y también destructivas xd bueno espero que la visiten aquí dejo el link: http://poemassinlea.blogspot.mx/?m=0",0,0,José Andrés,X1U21VBSbSs,0.0,2015-10-17 17:30:05,True,True
2015-10-17T17:30:09,ihate horror movies👻💉,0,0,Yara Hanna,X1U21VBSbSs,0.0,2015-10-17 17:30:09,True,True
2015-10-17T17:30:56,Q Meeeeeeello 😨😱 yo Me Infartaria Carajo,0,0,Maria Arzola,X1U21VBSbSs,0.0,2015-10-17 17:30:56,True,True
2015-10-17T17:31:18,looks interesting its good to see ab elegant creepy horror movie again,0,0,melih narinç,X1U21VBSbSs,0.3,2015-10-17 17:31:18,True,True
2015-10-17T17:31:30,maggie !! where is glenn ????! lolz,0,0,Kikoken,X1U21VBSbSs,0.0,2015-10-17 17:31:30,True,True
2015-10-17T17:32:38,Looks like a good movie,0,0,Max Davila,X1U21VBSbSs,0.7,2015-10-17 17:32:38,True,True
2015-10-17T17:32:52,"Some say he's actually Chucky's second cousin twice removed. And that he eats nothing but souls. All we know is, he's not the Stig. But he is the Stig's satanic cousin.",0,0,Vlad of Wallachia,X1U21VBSbSs,0.0,2015-10-17 17:32:52,True,True
2015-10-17T17:33:01,Man I just like to,0,0,Mike Peso,X1U21VBSbSs,0.0,2015-10-17 17:33:01,True,True
2015-10-17T17:33:13,Pinocchio!,0,0,Alex in bottiglia Mero,X1U21VBSbSs,0.0,2015-10-17 17:33:13,True,True
2015-10-17T17:33:45,"Lauren Cohan is an awful actress and this looks like a generic, Annabelle-style horror film. I'll take a pass on this one.",0,0,A Hole,X1U21VBSbSs,-0.5,2015-10-17 17:33:45,True,True
2015-10-17T17:34:05,I think the correct rule is dont feed after midnight,25,0,Giovanni Gianluca Reina,X1U21VBSbSs,0.0,2015-10-17 17:34:05,True,True
2015-10-17T17:36:13,"The tag line for this movie should be  ""I want to be a real BOY !"" Who's with me, Pinnochio anyone?",4,0,Nathan Leonard,X1U21VBSbSs,0.25,2015-10-17 17:36:13,True,True
2015-10-17T17:36:24,I guess gremlins is old enough to steal its material now,0,0,LASH,X1U21VBSbSs,0.05,2015-10-17 17:36:24,True,True
2015-10-17T17:36:26,This is scary and freeky man i wanna watch it so bad ,0,0,vanessa soto,X1U21VBSbSs,-0.5999999999999999,2015-10-17 17:36:26,True,True
2015-10-17T17:36:38,Just put him in front of a computer screen with minecraft and he'll never move.,4432,92,theninjacowboy,X1U21VBSbSs,0.0,2015-10-17 17:36:38,True,True
2015-10-17T17:37:14,Lash you have no idea what your talking about ,0,0,vanessa soto,X1U21VBSbSs,0.0,2015-10-17 17:37:14,True,True
2015-10-17T17:37:25,His middle name is Chucky =)),1,0,Tardisius,X1U21VBSbSs,0.25,2015-10-17 17:37:25,True,True
2015-10-17T17:38:01,It started good but then you showed too much. These trailer makers won't learn.,0,0,Estivel Garcia,X1U21VBSbSs,0.44999999999999996,2015-10-17 17:38:01,True,True
2015-10-17T17:38:22,From the walking dead to the walking doll haha,0,0,boombsixoty,X1U21VBSbSs,0.0,2015-10-17 17:38:22,True,True
2015-10-17T17:38:40,"Or you can just get out of the house. Or call the police and army. You could even earn millions off of him, jeez.",0,0,TadejVig,X1U21VBSbSs,0.0,2015-10-17 17:38:40,True,True
2015-10-17T17:39:00,this is proof guys Maggie dies season 6 of twd because she used a lot of time making this movie,35,18,Delfina Alvarez,X1U21VBSbSs,0.0,2015-10-17 17:39:00,True,True
2015-10-17T17:39:45,"Goddammit, why dolls!?!?",78,26,Jason Hoang,X1U21VBSbSs,0.0,2015-10-17 17:39:45,True,True
2015-10-17T17:39:54,did anyone notice the first rule is no guest,0,0,King Jay,X1U21VBSbSs,0.25,2015-10-17 17:39:54,True,True
2015-10-17T17:40:33,"Her fault for not following the rules that they pay her to follow lol Looks like an okay movie. Since it's PG-13, I'm not expecting much horror but I'll still watch it cause MAGGIE! xD (and Bela :P)",0,0,Jocie,X1U21VBSbSs,0.45999999999999996,2015-10-17 17:40:33,True,True
2015-10-17T17:40:38,"You could always you know, break or melt the doll but w/e",0,0,G wp,X1U21VBSbSs,0.0,2015-10-17 17:40:38,True,True
2015-10-17T17:41:09,"Seriously as soon as she went in and they said that was there son.. I would've just said ""Nope"" and walked out.",1,0,Joe Robinson,X1U21VBSbSs,-0.3333333333333333,2015-10-17 17:41:09,True,True
2015-10-17T17:43:37,This is the Slappy origin.,5,0,MetalGamerGuy,X1U21VBSbSs,0.0,2015-10-17 17:43:37,True,True
2015-10-17T17:45:13,MAGGIE NOOOOO,2,0,AyyItsTaco,X1U21VBSbSs,0.0,2015-10-17 17:45:13,True,True
2015-10-17T17:45:16,"Could be creepy, but generic title though",0,0,Andrew Colmer,X1U21VBSbSs,-0.25,2015-10-17 17:45:16,True,True
2015-10-17T17:45:26,When we gonna see a real horror movie! ?! Not such bullshit,0,0,Malika Turdybakieva,X1U21VBSbSs,0.15625,2015-10-17 17:45:26,True,True
2015-10-17T17:46:46,it was creepy till the last part with the painting grabbing her. would of been better for the boy in the painting to blink.,0,0,rcVastoLord,X1U21VBSbSs,0.0,2015-10-17 17:46:46,True,True
2015-10-17T17:47:33,poor boy just hungry and didnt wanna be alone,0,0,Paul Kim,X1U21VBSbSs,-0.4,2015-10-17 17:47:33,True,True
2015-10-17T17:49:22,jumpscare at 2:34,0,0,Paul Kim,X1U21VBSbSs,0.0,2015-10-17 17:49:22,True,True
2015-10-17T17:49:27,"Okay, now that the sun's up, I think i can watch this again without shitting my pants, almost throwing up, and tearing up from fear......and PG-13 my ass!!!!! This is R-rated at the very least! This is like Dead Silence, Child's Play, and Slappy from Goosebumps all wrapped into a big budget. FOH!.....still gonna watch it though. Just not alone",1,0,Corey Boyd,X1U21VBSbSs,0.07812499999999999,2015-10-17 17:49:27,True,True
2015-10-17T17:49:35,looks like this is loosley based on Robert the doll.,2,0,Tape Flip,X1U21VBSbSs,0.0,2015-10-17 17:49:35,True,True
2015-10-17T17:50:07,Dude I would chill with that kid. He seems pretty legit.,0,0,jdhdbdkfnfbv,X1U21VBSbSs,0.25,2015-10-17 17:50:07,True,True
2015-10-17T17:51:16,Reminds me of the Robert doll.,0,0,Justin Carson,X1U21VBSbSs,0.0,2015-10-17 17:51:16,True,True
2015-10-17T17:52:45,she's always fighting zombies.  lol,3,1,tahir patan,X1U21VBSbSs,0.8,2015-10-17 17:52:45,True,True
2015-10-17T17:56:32,Chucky is that you??????,0,0,Kelvin Martinez,X1U21VBSbSs,0.0,2015-10-17 17:56:32,True,True
2015-10-17T17:58:56,funny not scary lol!!,0,0,Adriana C,X1U21VBSbSs,0.5,2015-10-17 17:58:56,True,True
2015-10-17T17:59:01,He looks like a Webbing Angels from Doctor who,0,0,QuilwantsPizza,X1U21VBSbSs,0.0,2015-10-17 17:59:01,True,True
2015-10-17T17:59:21,Slappy????,0,0,GreshTooFresh,X1U21VBSbSs,0.0,2015-10-17 17:59:21,True,True
2015-10-17T17:59:30,What type of adult would be scared of moving doll.,0,0,Urban81 -,X1U21VBSbSs,0.1,2015-10-17 17:59:30,True,True
2015-10-17T18:01:32,Ventriloquist creeps me out but a doll that looks like the Ju On or the Grudge ghost will definitely scare the living daylights outta me,0,0,Mitsurugi Ryoma Masaki,X1U21VBSbSs,0.0,2015-10-17 18:01:32,True,True
2015-10-17T18:01:33,This looks bloody brilliant,0,0,tom higgins,X1U21VBSbSs,0.04999999999999999,2015-10-17 18:01:33,True,True
2015-10-17T18:02:17,This looks ridiculous.,0,0,bones22j,X1U21VBSbSs,-0.3333333333333333,2015-10-17 18:02:17,True,True
2015-10-17T18:02:59,Am I the only one who  watches this and wants there to be another Chucky movie?,0,0,Joshua Wilkes,X1U21VBSbSs,0.1,2015-10-17 18:02:59,True,True
2015-10-17T18:03:32,"Hello Random guy, I want you to...",0,0,Javier Rucal,X1U21VBSbSs,-0.5,2015-10-17 18:03:32,True,True
2015-10-17T18:05:15,looks pretty good for a PG 13 Movie,0,0,Aceson Brown,X1U21VBSbSs,0.475,2015-10-17 18:05:15,True,True
2015-10-17T18:05:54,Wait feed a kid/doll thing an apple,0,0,Carl Bertoni,X1U21VBSbSs,0.0,2015-10-17 18:05:54,True,True
2015-10-17T18:06:18,But this girl is stupid,0,0,Carl Bertoni,X1U21VBSbSs,-0.7999999999999999,2015-10-17 18:06:18,True,True
2015-10-17T18:09:43,Wow another creepy doll movie with all the creepy doll horror cliques.,0,0,Eddy Yim,X1U21VBSbSs,-0.3,2015-10-17 18:09:43,True,True
2015-10-17T18:12:20,its maggy! from walking dead!,0,0,Boy Einstein,X1U21VBSbSs,-0.25,2015-10-17 18:12:20,True,True
2015-10-17T18:14:04,"0:28 black people be like ""nope"" and get the fuk outta there lol",0,0,Jon Jonstone,X1U21VBSbSs,0.3166666666666667,2015-10-17 18:14:04,True,True
2015-10-17T18:15:55,Reminds me of Lori and Carl from twd xD,0,0,Mateusz Nowak,X1U21VBSbSs,0.0,2015-10-17 18:15:55,True,True
2015-10-17T18:18:13,"Anything with Maggie, i know her names Lauren, I'll watch. Plus I like the story. Yes",0,0,Mariana Kucerija 1-3,X1U21VBSbSs,0.0,2015-10-17 18:18:13,True,True
2015-10-17T18:21:35,IS maggie from the walking dead!! ohhh I have a crush on her! :) <3,0,0,DavidsNoMotoVlogg,X1U21VBSbSs,0.3697916666666667,2015-10-17 18:21:35,True,True
2015-10-17T18:21:55,childs play + The gremlins =The boy,0,0,josiah .rodriguez,X1U21VBSbSs,0.0,2015-10-17 18:21:55,True,True
2015-10-17T18:22:17,im pretty sure the trailer is better than the movie itself,0,0,SS3 Goku,X1U21VBSbSs,0.4166666666666667,2015-10-17 18:22:17,True,True
2015-10-17T18:22:21,im pretty sure the trailer is better than the movie itself,0,0,SS3 Goku,X1U21VBSbSs,0.4166666666666667,2015-10-17 18:22:21,True,True
2015-10-17T18:27:04,"If they'd have given her the correct list, none of this would've happened.  1.Don't get him wet 2.Don't feed him after midnight 3.Don't expose him to bright light",1770,57,populousmass,X1U21VBSbSs,0.3333333333333333,2015-10-17 18:27:04,True,True
2015-10-17T18:31:53,Chucky???? Maybe!,0,0,Giancarlo,X1U21VBSbSs,0.0,2015-10-17 18:31:53,True,True
2015-10-17T18:33:08,Is this a boy version of ANNABELLE!!!???ohhhh so scary!!!!!!,0,0,Mr. Boo,X1U21VBSbSs,-1.0,2015-10-17 18:33:08,True,True
2015-10-17T18:35:00,well Annabelle's brother,0,1,Naseel Basheer,X1U21VBSbSs,0.0,2015-10-17 18:35:00,True,True
2015-10-17T18:37:52,Maggie Greene is so hot.,6,0,TheJohn Cena,X1U21VBSbSs,0.25,2015-10-17 18:37:52,True,True
2015-10-17T18:38:03,Is every horror trailer starting with image of a house lmao,43,6,4treasure,X1U21VBSbSs,0.3,2015-10-17 18:38:03,True,True
2015-10-17T18:39:41,"Probably was only hired on her looks.  Obviously not for ability to follow contractual care obligations, follow the parents wishes, and do what she agreed to.  All simple tasks and she was not even able to care for a wooden doll...",0,0,ultimaetsolder,X1U21VBSbSs,0.1,2015-10-17 18:39:41,True,True
2015-10-17T18:42:39,This movie is dumb as hell its like the chuckee movie combined with the Annabelle movie ..except you have rules to follow for this one.wow,0,0,Tyson Battles,X1U21VBSbSs,-0.375,2015-10-17 18:42:39,True,True
2015-10-17T18:46:00,You Is this a joke 😂,0,0,mustapha muhammad,X1U21VBSbSs,0.0,2015-10-17 18:46:00,True,True
2015-10-17T18:46:03,horror movies had died long time ago,0,0,متعب البقمي,X1U21VBSbSs,-0.05,2015-10-17 18:46:03,True,True
2015-10-17T18:52:09,Where's Rick and Glenn when you need them ey? Literally the most unscary thing I've ever seen in my life.,0,0,beansontoast,X1U21VBSbSs,0.5,2015-10-17 18:52:09,True,True
2015-10-17T18:52:10,so it's like chucky but you don't get to see him move. . .,0,0,The Oana Fam,X1U21VBSbSs,0.0,2015-10-17 18:52:10,True,True
2015-10-17T18:52:40,Cuky bunu beğendi,0,0,Berat Göktuğ Şalcı,X1U21VBSbSs,0.0,2015-10-17 18:52:40,True,True
2015-10-17T18:53:06,I would just leave the house and never come back lol.,0,0,HIareUmad,X1U21VBSbSs,0.4,2015-10-17 18:53:06,True,True
2015-10-17T18:53:35,"Anyone notice they use the same song from ""The Conjuring"" ??? Lol",0,0,bianca28928,X1U21VBSbSs,0.4,2015-10-17 18:53:35,True,True
2015-10-17T18:54:03,Yup this looks like shit we've seen before a million times.......,0,0,Nikolas M.,X1U21VBSbSs,-0.2,2015-10-17 18:54:03,True,True
2015-10-17T18:56:52,just kinda wish they left it vague in the trailer   it was creepy enough just the doll    should have ended with the laughter and the smash in the kitchen,0,0,jordandan96,X1U21VBSbSs,-0.25,2015-10-17 18:56:52,True,True
2015-10-17T18:57:08,Well I would've left that job already.,0,0,NØVA,X1U21VBSbSs,0.0,2015-10-17 18:57:08,True,True
2015-10-17T18:59:03,anabells brother,0,1,Wargasmbeast,X1U21VBSbSs,0.0,2015-10-17 18:59:03,True,True
2015-10-17T18:59:09,anabells brother,0,0,Wargasmbeast,X1U21VBSbSs,0.0,2015-10-17 18:59:09,True,True
2015-10-17T19:00:13,The first time it moved she should have bailed. End movie right there.,0,0,Pulse,X1U21VBSbSs,0.26785714285714285,2015-10-17 19:00:13,True,True
2015-10-17T19:00:57,more or less ...,2,2,King Monkey,X1U21VBSbSs,0.16666666666666669,2015-10-17 19:00:57,True,True
2015-10-17T19:02:56,"Damn it lady, You had One job",2938,76,Superthepower,X1U21VBSbSs,0.0,2015-10-17 19:02:56,True,True
2015-10-17T19:02:59,Would a wood chipper or a a hammer not be an excitable solution. i mean for god sake its a doll it cant be that hard to kill.,0,0,King Ramesses II,X1U21VBSbSs,-0.30208333333333337,2015-10-17 19:02:59,True,True
2015-10-17T19:05:20,Chucky would pwn this priss.,0,0,Sea Pig,X1U21VBSbSs,0.0,2015-10-17 19:05:20,True,True
2015-10-17T19:07:31,"So... it's like Annabelle... but it's a boy? ._. thumbs up for originality, Hollywood.",0,0,Walrus is in the Matrix,X1U21VBSbSs,0.0,2015-10-17 19:07:31,True,True
2015-10-17T19:11:30,Terrible !!!,0,0,Jessica Allen,X1U21VBSbSs,-1.0,2015-10-17 19:11:30,True,True
2015-10-17T19:14:36,"Yup, cozy chalk is definitely gonna hold him...",0,0,VFS,X1U21VBSbSs,-0.09999999999999999,2015-10-17 19:14:36,True,True
2015-10-17T19:17:36,"The kids paint Look like the cartoon ""mad""",0,0,Michelle Alva,X1U21VBSbSs,-0.625,2015-10-17 19:17:36,True,True
2015-10-17T19:18:16,HA!,0,0,Broken EoD,X1U21VBSbSs,0.0,2015-10-17 19:18:16,True,True
2015-10-17T19:22:18,(•_•) <)   )╯ 'Cause I just wanna feel my face for ya  /    \   (•_•) <(   (>   for ya   /    \    (•_•)         (•_•) <)   (>  uh    <)   (>     huh  /    \             /    \ Show less,1,1,Derp Rollin,X1U21VBSbSs,-0.16666666666666666,2015-10-17 19:22:18,True,True
2015-10-17T19:23:06,Yeea this movie going to suck. I like the trailer doe.,0,0,Ray_999,X1U21VBSbSs,0.0,2015-10-17 19:23:06,True,True
2015-10-17T19:29:03,"Looks like a better version of the Annabelle movie, maybe.",0,0,Gangrel Aussie,X1U21VBSbSs,0.5,2015-10-17 19:29:03,True,True
2015-10-17T19:33:31,Maggie kill zombies butt toys no?,0,0,Luis Escamilla,X1U21VBSbSs,0.0,2015-10-17 19:33:31,True,True
2015-10-17T19:36:50,Amazing :v,0,0,David soto,X1U21VBSbSs,0.6000000000000001,2015-10-17 19:36:50,True,True
2015-10-17T19:43:15,Sam and dean where are you ?,0,0,devan moran,X1U21VBSbSs,0.0,2015-10-17 19:43:15,True,True
2015-10-17T19:43:51,Chucky's Japanese Version:),0,0,Kaan,X1U21VBSbSs,0.25,2015-10-17 19:43:51,True,True
2015-10-17T19:44:09,Would anyone really take a job from people who says that a doll is their son?? Is she really desperate for money??,0,5,Absolute Justice,X1U21VBSbSs,-0.19999999999999998,2015-10-17 19:44:09,True,True
2015-10-17T19:45:03,Hm 66 dislikes,0,0,devan moran,X1U21VBSbSs,0.0,2015-10-17 19:45:03,True,True
2015-10-17T19:51:16,"ONLY reason why soo many people gave this trailer a thumbs up, is because the main character is Maggie from The Walking Dead lol",0,0,Kanube,X1U21VBSbSs,0.2533333333333333,2015-10-17 19:51:16,True,True
2015-10-17T20:00:17,That looks so scary,0,0,Luke talbot,X1U21VBSbSs,-0.5,2015-10-17 20:00:17,True,True
2015-10-17T20:04:53,If its in a word or in a book...,0,0,47chromeAKs,X1U21VBSbSs,0.0,2015-10-17 20:04:53,True,True
2015-10-17T20:05:41,ANNABELLE  2   ?,0,0,Ramses Amon RA,X1U21VBSbSs,0.0,2015-10-17 20:05:41,True,True
2015-10-17T20:06:22,MAGGIE!!!,0,0,RoCk'In RoLl AlIeN from Japan,X1U21VBSbSs,0.0,2015-10-17 20:06:22,True,True
2015-10-17T20:06:51,Why can't she called the police instead or blow up the house!!!!!!!!!!!!!!!???,0,0,openscader/phoenixtube,X1U21VBSbSs,0.0,2015-10-17 20:06:51,True,True
2015-10-17T20:09:14,xD,0,0,LIRIC MC,X1U21VBSbSs,0.0,2015-10-17 20:09:14,True,True
2015-10-17T20:13:03,Looks better than Annabelle. That movie sucked,0,0,Mr. Nevz,X1U21VBSbSs,0.5,2015-10-17 20:13:03,True,True
2015-10-17T20:16:00,Give that boy an iPad,0,0,AZMATIK,X1U21VBSbSs,0.0,2015-10-17 20:16:00,True,True
2015-10-17T20:19:04,I am interested but really you couldn't just pretend and listen to the rules but maybe that won't have changed anything,0,0,Chris Mercado,X1U21VBSbSs,0.225,2015-10-17 20:19:04,True,True
2015-10-17T20:19:08,Maggie is going to die in the walking dead because she is filming a movie,0,0,Ricky Le,X1U21VBSbSs,-0.2,2015-10-17 20:19:08,True,True
2015-10-17T20:30:40,If that were me and I saw that doll I would be like nope sorry. Bye,0,0,GamerGirl _,X1U21VBSbSs,-0.5,2015-10-17 20:30:40,True,True
2015-10-17T20:32:08,creepy but not scary. theirs a difference,0,0,MoFi,X1U21VBSbSs,-0.125,2015-10-17 20:32:08,True,True
2015-10-17T20:34:03,Reminds me of dead silence but worse lol,0,0,Jon snow,X1U21VBSbSs,0.06666666666666665,2015-10-17 20:34:03,True,True
2015-10-17T20:35:06,They better show that ass in the shower scene !,0,0,Jon snow,X1U21VBSbSs,0.625,2015-10-17 20:35:06,True,True
2015-10-17T20:36:23,oh Shit Annabelle has a fck partner besides Marlon Wayans now lol!  P.s. Chucky would murder this fool.,0,0,EPIC MELL,X1U21VBSbSs,0.4,2015-10-17 20:36:23,True,True
2015-10-17T20:41:56,"When movies go cheap, the main character is a £2 toy off Amazon",0,0,James Cartwright,X1U21VBSbSs,0.2833333333333333,2015-10-17 20:41:56,True,True
2015-10-17T20:42:20,what is this chucky's cousin?  evil Charlie,0,0,MrTimetravler,X1U21VBSbSs,-1.0,2015-10-17 20:42:20,True,True
2015-10-17T20:48:10,"""Never leave him alone""? So is she supposed to take him in the bathroom with her when she poops? Like wtf, kid? Gimme 2 minutes.",0,0,jice,X1U21VBSbSs,-0.5,2015-10-17 20:48:10,True,True
2015-10-17T20:50:27,Maggie!,0,0,Jay Large,X1U21VBSbSs,0.0,2015-10-17 20:50:27,True,True
2015-10-17T20:52:06,Looks like a purfect job for Homer Simpson.,0,0,poeciloteria,X1U21VBSbSs,0.0,2015-10-17 20:52:06,True,True
2015-10-17T20:52:57,that looks... cool?,0,0,Jay Large,X1U21VBSbSs,0.35,2015-10-17 20:52:57,True,True
2015-10-17T20:53:55,Oh Maggie Greene... So hot. Want to touch the hiney... Hawoooooooooo oooo!!!!,0,0,Jared Boyes,X1U21VBSbSs,0.6103515625,2015-10-17 20:53:55,True,True
2015-10-17T21:05:44,one. job.,0,0,Elisa Rios,X1U21VBSbSs,0.0,2015-10-17 21:05:44,True,True
2015-10-17T21:07:08,Rule#1 - Never put him in Sunlight Rule#2 - Never put him in water Rule#3 - Never feed him after midnight.,0,0,Koko Blu,X1U21VBSbSs,0.0,2015-10-17 21:07:08,True,True
2015-10-17T21:07:53,Annabelle to Annaboy,0,0,Cirenio Pizano,X1U21VBSbSs,0.0,2015-10-17 21:07:53,True,True
2015-10-17T21:08:00,So it's kinda like Annabelle?,0,0,Crystal,X1U21VBSbSs,0.0,2015-10-17 21:08:00,True,True
2015-10-17T21:14:34,This movie looks freakin good,0,0,Ashley Juarez,X1U21VBSbSs,0.7,2015-10-17 21:14:34,True,True
2015-10-17T21:16:25,"She could had done her job, but women can't do there job right, that's why the man is there in the first place!!! XD",0,0,Ash Williams,X1U21VBSbSs,0.38699776785714285,2015-10-17 21:16:25,True,True
