timestamp,text,like_count,reply_count,author,trailer_id,sentiment_score,datetime,used_for_model,used_for_visualization
2018-10-06T03:45:57,This comes out on my birthday        In Japan,4,0,Moifaàmoimoi,ynuFEc_Zg5I,0.0,2018-10-06 03:45:57,True,True
2018-10-06T03:46:27,It's on my birthday !!,10,9,werthy is my name,ynuFEc_Zg5I,0.0,2018-10-06 03:46:27,True,True
2018-10-06T03:48:35,"1:00 Enter ""canon Ginie""",1,0,ßoss,ynuFEc_Zg5I,0.0,2018-10-06 03:48:35,True,True
2018-10-06T03:48:36,"This seems AMAZING, but I'm moderately disappointed that it may very well decanonize Bardock: Father of Goku",1,3,Pppgggr,ynuFEc_Zg5I,0.0166666666666667,2018-10-06 03:48:36,True,True
2018-10-06T03:50:32,KAAAAAAKAAAROOOOOOTT!...Oh wait..Vegeta is his new target now . Wonder what he'll say,0,1,Scorpion,ynuFEc_Zg5I,0.13636363636363635,2018-10-06 03:50:32,True,True
2018-10-06T03:50:43,"Casually retcons Goku's arrival to Earth... :) Then again, this entire movie is a reboot of Broly :)",0,0,The Better Youtuber Named Logan,ynuFEc_Zg5I,0.12499999999999997,2018-10-06 03:50:43,True,True
2018-10-06T03:50:55,I wonder if they’ll mention Beerus being involved in this flashback,0,0,Corey Castle,ynuFEc_Zg5I,0.0,2018-10-06 03:50:55,True,True
2018-10-06T03:52:59,sooo bardock and gine basically canon now,0,0,DarkSoobin,ynuFEc_Zg5I,0.0,2018-10-06 03:52:59,True,True
2018-10-06T03:53:00,Clearly a reboot.,0,2,Addy Negrido,ynuFEc_Zg5I,0.10000000000000002,2018-10-06 03:53:00,True,True
2018-10-06T03:53:10,".....you know, from watching the trailers I feel bad for Broly already. With all the crap he’s been through, I feel like the guy needs someone to hug him and tell him everything is gonna be okay.",0,0,KitsuKame,ynuFEc_Zg5I,-0.3333333333333333,2018-10-06 03:53:10,True,True
2018-10-06T03:53:34,So sad 😥,0,0,andick trian,ynuFEc_Zg5I,-0.5,2018-10-06 03:53:34,True,True
2018-10-06T03:55:01,Wait? Broly  is goku's  brother?,0,0,ligering spirit,ynuFEc_Zg5I,0.0,2018-10-06 03:55:01,True,True
2018-10-06T03:56:23,So vegeta is a lot younger than bulma?,0,0,Geee,ynuFEc_Zg5I,0.0,2018-10-06 03:56:23,True,True
2018-10-06T03:57:43,Well frieza gonna get the whoops he will never forget.,0,0,Hide the pain Harold,ynuFEc_Zg5I,0.0,2018-10-06 03:57:43,True,True
2018-10-06T03:58:13,"If toriyama is talking DBZ movie reboots....  COOLER, BOJACK, OR JANEMBA  P L E A S E",0,0,LunaSalt,ynuFEc_Zg5I,0.0,2018-10-06 03:58:13,True,True
2018-10-06T03:59:17,Goku’s so grownup when he’s sent to earth in this movie. I thought he would be closer to be a baby.,0,1,Smanuelle,ynuFEc_Zg5I,0.0,2018-10-06 03:59:17,True,True
2018-10-06T03:59:30,It looks great but also damn butchering the original story,1,2,gottfer,ynuFEc_Zg5I,0.5875,2018-10-06 03:59:30,True,True
2018-10-06T04:01:42,Let's break into Million views Guys,1,0,Kiranj Deep Yonghang,ynuFEc_Zg5I,0.0,2018-10-06 04:01:42,True,True
2018-10-06T04:03:44,Is that really Chris Ares?,0,0,Hydra Tower,ynuFEc_Zg5I,0.2,2018-10-06 04:03:44,True,True
2018-10-06T04:04:04,Goku's parents are legends. This film is going to have a clash of ideals.,0,0,Rafael Nguyen Alvarez,ynuFEc_Zg5I,0.0,2018-10-06 04:04:04,True,True
2018-10-06T04:04:25,"Gonna be honest, I'm actually kinda hoping that Broly becomes a main character. Then again, this is Dragon Ball, so they're most likely gonna kill him off.",0,0,APersonNamedJune,ynuFEc_Zg5I,0.2533333333333333,2018-10-06 04:04:25,True,True
2018-10-06T04:04:28,The fact that they show us broly as a baby leads me to believe that he is going to be a very sympathetic character this time around,0,0,Judah,ynuFEc_Zg5I,0.65,2018-10-06 04:04:28,True,True
2018-10-06T04:05:00,I THINK I JUST CLIMAXED MY PANTS😩😩😩😩😩,0,0,Yorri Amo,ynuFEc_Zg5I,0.0,2018-10-06 04:05:00,True,True
2018-10-06T04:05:10,Why cant bardock be resetructed back and fight broly,0,0,reborn jaws,ynuFEc_Zg5I,0.0,2018-10-06 04:05:10,True,True
2018-10-06T04:06:38,Ok suggestions on Gine English dub voice Here are my top choices 1. Colleen Clickenbread 2. Luci Christian 3. Cherami Leigh Kuehn What do you think? What are your choices?,0,0,Anime Freak,ynuFEc_Zg5I,0.25,2018-10-06 04:06:38,True,True
2018-10-06T04:07:05,Wasn't that always frieza's color without the   armor?,0,0,Mrmooncreations,ynuFEc_Zg5I,0.0,2018-10-06 04:07:05,True,True
2018-10-06T04:08:04,i’m more excited to see Bardock and Gine than anyone else in this movie lmao,0,0,J L,ynuFEc_Zg5I,0.4916666666666667,2018-10-06 04:08:04,True,True
2018-10-06T04:08:48,Yey,0,0,SansTheGamer,ynuFEc_Zg5I,0.0,2018-10-06 04:08:48,True,True
2018-10-06T04:10:19,Hate the new frieza voice the old guy was better,0,0,Russell Chey,ynuFEc_Zg5I,-0.01590909090909093,2018-10-06 04:10:19,True,True
2018-10-06T04:10:51,"So is all of Db and DBZ now non canon I mean i like the trailer and all because im a diehard Dragon Ball fan,just confused with how to will playout in the actual movie",0,0,GothamInRed,ynuFEc_Zg5I,-0.23750000000000002,2018-10-06 04:10:51,True,True
2018-10-06T04:14:20,"Goku left planet Vegeta as a baby, why does he look like a toddler?",1,2,Light Rider,ynuFEc_Zg5I,0.0,2018-10-06 04:14:20,True,True
2018-10-06T04:14:35,1:00,0,0,Dusk Maiden,ynuFEc_Zg5I,0.0,2018-10-06 04:14:35,True,True
2018-10-06T04:15:40,Raditz just faded away from Toriyama's mind,0,0,Javier Duran,ynuFEc_Zg5I,0.0,2018-10-06 04:15:40,True,True
2018-10-06T04:16:03,Broly is gonna kill frizea first I bet,0,0,Camron Ghebrehiwet,ynuFEc_Zg5I,0.25,2018-10-06 04:16:03,True,True
2018-10-06T04:16:05,"0:13 Frieza: ""Oh, wait. Allow me to greet you in your tongue,"" *clears throat* ""OOGA BOOGA OOGA BOOGA OOGA BOOGA!!!!""",0,0,Scott Clam,ynuFEc_Zg5I,0.0,2018-10-06 04:16:05,True,True
2018-10-06T04:16:26,Say whaaaaaaaaaaat,0,0,DRAKE Wills,ynuFEc_Zg5I,0.0,2018-10-06 04:16:26,True,True
2018-10-06T04:17:17,Holy popsicles,0,0,Ghillie Man Reviews,ynuFEc_Zg5I,0.0,2018-10-06 04:17:17,True,True
2018-10-06T04:17:44,I  see all Dragon ball  Movie  and now new Dragon ball Super  movie looks like it's going to be  exciting and  Awesome  more  Dragon ball z please  and  please  make  pen and Bulla   a new Season  Dragon ball  AF  please  is perfect   please  make  Pan and Bulla turn  Super Saiyan please I would like to see that,1,0,Tanequa Woodson,ynuFEc_Zg5I,0.4674242424242424,2018-10-06 04:17:44,True,True
2018-10-06T04:18:15,Finally a Dragonball project that doesn't feel completely rigid in it's animation,0,0,42nd Blaze,ynuFEc_Zg5I,0.05,2018-10-06 04:18:15,True,True
2018-10-06T04:18:41,Wait isnt vegeta older the goku by like...6 years or something?,0,0,Beefaroni Bert,ynuFEc_Zg5I,0.16666666666666666,2018-10-06 04:18:41,True,True
2018-10-06T04:19:45,Also goku looks like hes like 4 in that capsule lmao,0,0,Beefaroni Bert,ynuFEc_Zg5I,0.6,2018-10-06 04:19:45,True,True
2018-10-06T04:20:14,Nappa: See this what happens when you don't stab the baby,0,0,Mr.PerfectCell,ynuFEc_Zg5I,0.0,2018-10-06 04:20:14,True,True
2018-10-06T04:21:23,I always thought vegeta was some years older than goku?,0,0,Kendon Chumbley,ynuFEc_Zg5I,0.16666666666666666,2018-10-06 04:21:23,True,True
2018-10-06T04:21:30,"I'm sure, present Goku, Vegeta will protect Frieza from Broly.",0,0,Bharath,ynuFEc_Zg5I,0.25,2018-10-06 04:21:30,True,True
2018-10-06T04:22:38,"If baby goku, vegeta, and baby broly would have a fight, that'll be cute af",0,0,hellplays,ynuFEc_Zg5I,0.5,2018-10-06 04:22:38,True,True
2018-10-06T04:24:16,"Basically Freeza politelly said "" Nice to meet you"" and the dub translated it to "" Hello Monkeys "".  lol.",0,0,Davie J,ynuFEc_Zg5I,0.7,2018-10-06 04:24:16,True,True
2018-10-06T04:24:45,I'd love to see cameos from Napa and Raditz.,1,0,Ham,ynuFEc_Zg5I,0.5,2018-10-06 04:24:45,True,True
2018-10-06T04:24:50,"Holy moly. So this is gonna begin with the Bardock movie, then transition to Broly!? TOTALLY WICKED!!!!",0,0,Mimikhue Izayoi,ynuFEc_Zg5I,0.0,2018-10-06 04:24:50,True,True
2018-10-06T04:26:59,"Ah, crap, that Baby Goku part is changin some things...",0,0,Sean,ynuFEc_Zg5I,-0.8,2018-10-06 04:26:59,True,True
2018-10-06T04:28:07,Why does Broly's dad hate Vegeta,0,0,goku black ss4,ynuFEc_Zg5I,-0.8,2018-10-06 04:28:07,True,True
2018-10-06T04:29:03,I bet king vegeta has broly exiled because his battle power put baby vegeta’s to shame.,0,0,Michael Miller,ynuFEc_Zg5I,0.0,2018-10-06 04:29:03,True,True
2018-10-06T04:29:26,I know Broly haters are upset because the best Dragon ball movie is gonna be a Broly movie,0,0,T. H.,ynuFEc_Zg5I,1.0,2018-10-06 04:29:26,True,True
2018-10-06T04:29:50,first the second trailer...and then a remake of Mewtwo Strikes back!!!!,0,0,BlueAshes,ynuFEc_Zg5I,0.08333333333333333,2018-10-06 04:29:50,True,True
2018-10-06T04:29:55,Yamoshi???????? Anyone??,0,0,Firstfef LafeFst,ynuFEc_Zg5I,0.0,2018-10-06 04:29:55,True,True
2018-10-06T04:30:05,1:12 Yo where Saitama at,0,0,Jun Wei Lee,ynuFEc_Zg5I,0.0,2018-10-06 04:30:05,True,True
2018-10-06T04:31:43,Bro...ssj vegeta looks absolutely insane,0,0,Mohamed Omar,ynuFEc_Zg5I,-1.0,2018-10-06 04:31:43,True,True
2018-10-06T04:32:32,Raditz and Nappa will definitely be shown but what about...     *Tarble*,0,0,My Neighbor Piccolo,ynuFEc_Zg5I,0.0,2018-10-06 04:32:32,True,True
2018-10-06T04:33:38,I felt like i was gonna cry when bardock and gine was sending goku to earth.,0,0,Bigkeymaster 10,ynuFEc_Zg5I,0.0,2018-10-06 04:33:38,True,True
2018-10-06T04:34:11,I think Goku Voice is more realistic in English dub,0,0,AaYe e,ynuFEc_Zg5I,0.2222222222222222,2018-10-06 04:34:11,True,True
2018-10-06T04:34:13,Mind is blowing,0,0,Christopher Sainduc,ynuFEc_Zg5I,0.0,2018-10-06 04:34:13,True,True
2018-10-06T04:34:26,CHILLS!,0,0,Raiden3,ynuFEc_Zg5I,0.0,2018-10-06 04:34:26,True,True
2018-10-06T04:35:08,So kid Vegeta doesn't have bangs anymore now too?  Also wish we could've heard Gine's voice,0,0,Ninten,ynuFEc_Zg5I,0.0,2018-10-06 04:35:08,True,True
2018-10-06T04:35:30,Best thing to happen to dragon ball since dragon ball omg,0,0,Malo Son,ynuFEc_Zg5I,1.0,2018-10-06 04:35:30,True,True
2018-10-06T04:36:23,lol,0,0,Ernst Jung,ynuFEc_Zg5I,0.8,2018-10-06 04:36:23,True,True
2018-10-06T04:36:38,What about Raditz? 😂😂😂,0,0,Ethan Uehlinger,ynuFEc_Zg5I,0.0,2018-10-06 04:36:38,True,True
2018-10-06T04:38:07,Wouldve been nice to see Raditz...,0,0,Woebegone Kenobi,ynuFEc_Zg5I,0.6,2018-10-06 04:38:07,True,True
2018-10-06T04:38:33,Kamehameha!!!!,0,0,micheal cameron,ynuFEc_Zg5I,0.0,2018-10-06 04:38:33,True,True
2018-10-06T04:39:40,The Ginyu Force!,0,0,Temo Harri,ynuFEc_Zg5I,0.0,2018-10-06 04:39:40,True,True
2018-10-06T04:42:31,"i think even if Vegeta knew Beerus gave the order to destroy the planet he wouldnt really care anymore. i mean maybe he'll feel a bit annoyed, but that was all in the past and it seems his moved on.",0,0,FistHound 00,ynuFEc_Zg5I,-0.1925,2018-10-06 04:42:31,True,True
2018-10-06T04:42:47,OMG I AM HYPED,0,0,Bubba Gaming,ynuFEc_Zg5I,0.0,2018-10-06 04:42:47,True,True
2018-10-06T04:42:53,:D,0,0,Bubba Gaming,ynuFEc_Zg5I,1.0,2018-10-06 04:42:53,True,True
2018-10-06T04:43:55,"When King Vegeta talks, all I here is All might",0,0,Patrick Herschberger,ynuFEc_Zg5I,0.0,2018-10-06 04:43:55,True,True
2018-10-06T04:44:18,I'm already missing Bardocks red bloodied bandana. I NEED IT!!!!,422,37,Justin Nunez,ynuFEc_Zg5I,-0.1,2018-10-06 04:44:18,True,True
2018-10-06T04:44:40,"This looks awesome but so many redcons. XD  Top ones being Vegeta is like five or six years older than Goku, Goku was sent to earth as a baby and both their parents tried to fight Frieza in space. King Vegeta on the ship and Bardock outside it.",0,1,IStheanimeking777,ynuFEc_Zg5I,0.4333333333333333,2018-10-06 04:44:40,True,True
2018-10-06T04:46:49,I guess in this movie goku vegeta and broly realise that it was beerus who wanted planet vegeta to be destroyed and I hope freeza reveals this cause now broly would be after beerus and not freeza I also hope that broly says something else than kakarot!!,0,0,King Hamatronus,ynuFEc_Zg5I,0.0,2018-10-06 04:46:49,True,True
2018-10-06T04:48:00,That vegeta shot is so badass it looked better than goku and brolys shot,0,0,Redwave -,ynuFEc_Zg5I,0.5,2018-10-06 04:48:00,True,True
2018-10-06T04:50:55,Is king vegeta piccolo?,0,0,will kelly,ynuFEc_Zg5I,0.0,2018-10-06 04:50:55,True,True
2018-10-06T04:51:15,It looks great but um... where is Raditz? Did Toriyama forget he exists? lol,143,28,CJ P.,ynuFEc_Zg5I,0.8,2018-10-06 04:51:15,True,True
2018-10-06T04:53:11,"Wow, I love that they’re putting gine and a lot of more Saipan things (and king cold omg) in here!",1,0,KumaPaws376,ynuFEc_Zg5I,0.08750000000000002,2018-10-06 04:53:11,True,True
2018-10-06T04:55:00,"Im confused, i thought Vegeta was older than goku by a few years?",0,0,dabi senju,ynuFEc_Zg5I,-0.14444444444444446,2018-10-06 04:55:00,True,True
2018-10-06T04:55:44,Wait so they're retconning both the Bardock storyline and OG Dragonball storyline?,0,0,Glute Brute,ynuFEc_Zg5I,0.0,2018-10-06 04:55:44,True,True
2018-10-06T04:57:56,I like how literally no one brings up how Goku was an infant when he landed on Earth,0,0,Prankster Gangster,ynuFEc_Zg5I,0.0,2018-10-06 04:57:56,True,True
2018-10-06T04:58:14,This movie is going to crack the earth into oblivion when it comes out,0,0,Trevell Billings,ynuFEc_Zg5I,0.0,2018-10-06 04:58:14,True,True
2018-10-06T04:59:46,The movie we always wanted and finally deserve/,0,0,The Video Game Show,ynuFEc_Zg5I,0.0,2018-10-06 04:59:46,True,True
2018-10-06T05:00:01,King vegeta to price vegeta my boy you bring honor to our names I really hope vegeta gets the spotlight of the movie 30 years of vegeta he deserves the spotlight,1,0,Chris Puig,ynuFEc_Zg5I,0.2,2018-10-06 05:00:01,True,True
2018-10-06T05:01:29,*h E l L o  MoN K eYs*,0,0,X-event Swarnav,ynuFEc_Zg5I,0.0,2018-10-06 05:01:29,True,True
2018-10-06T05:02:03,vegeta looks badass,0,0,L DJ,ynuFEc_Zg5I,0.0,2018-10-06 05:02:03,True,True
2018-10-06T05:02:11,I dont like it,0,0,Arhum Ali,ynuFEc_Zg5I,0.0,2018-10-06 05:02:11,True,True
2018-10-06T05:02:37,nice video,0,0,PUBG Gamer,ynuFEc_Zg5I,0.6,2018-10-06 05:02:37,True,True
2018-10-06T05:03:35,That sounded so much like tfs frieza,0,0,STG,ynuFEc_Zg5I,0.2,2018-10-06 05:03:35,True,True
2018-10-06T05:03:56,Isn’t vegeta older than goku tho?? Like he was a young boy when the planet got destroyed,0,0,jc,ynuFEc_Zg5I,0.13333333333333333,2018-10-06 05:03:56,True,True
2018-10-06T05:05:09,I'm so glad Chris Ayres is doing Frieza,0,0,sniperXOF,ynuFEc_Zg5I,0.5,2018-10-06 05:05:09,True,True
2018-10-06T05:05:19,So they're retconning the beginning of Dragonball...,0,0,KungFu Kenny,ynuFEc_Zg5I,0.0,2018-10-06 05:05:19,True,True
2018-10-06T05:06:55,Alright Pink Frieza,0,0,Salvador,ynuFEc_Zg5I,-0.1,2018-10-06 05:06:55,True,True
2018-10-06T05:09:08,All repetitive things aside I'm just glad to see goku's mother for the first time,0,0,VergilTheDevil666,ynuFEc_Zg5I,0.16666666666666666,2018-10-06 05:09:08,True,True
2018-10-06T05:10:04,I know many may not like this but I love how they're redoing the story. This adds so much more depth and frankly I'm perfecting fine with how bardock is portrayed and i feel like this will be so much more impactful. I don't mind it and the vibes this trailer gives me make me so excited.,0,0,Professor Mineta,ynuFEc_Zg5I,0.46527777777777785,2018-10-06 05:10:04,True,True
2018-10-06T05:10:30,Brings a subtle tear to eye,0,0,Zack Engelhart,ynuFEc_Zg5I,-0.3333333333333333,2018-10-06 05:10:30,True,True
2018-10-06T05:14:40,The animation looks to be way more better than the previous 2 movies *batle of gods & resurrection f*  Dbz vegeta is back *badass*,0,0,Jerome Charles,ynuFEc_Zg5I,0.20833333333333334,2018-10-06 05:14:40,True,True
2018-10-06T05:14:59,That last shot of Vegeta tho. The animation is 🔥🔥🔥,0,0,Dylan Wilson,ynuFEc_Zg5I,0.0,2018-10-06 05:14:59,True,True
2018-10-06T05:15:50,How do we know what theatres it will be at.,0,2,TheDirkiestDigg,ynuFEc_Zg5I,0.0,2018-10-06 05:15:50,True,True
2018-10-06T05:16:18,I’m not fond of this animation. It looks worse than the first trailer. 😕,0,1,detonio mccolley,ynuFEc_Zg5I,-0.07500000000000001,2018-10-06 05:16:18,True,True
2018-10-06T05:16:29,The manga is the canon one after all!!!!,0,0,Randy Harry,ynuFEc_Zg5I,0.0,2018-10-06 05:16:29,True,True
2018-10-06T05:16:50,Will prince of percia return?,1,0,Dilip Tambekar,ynuFEc_Zg5I,0.0,2018-10-06 05:16:50,True,True
2018-10-06T05:16:52,They forget Raditz LOL,0,0,Ciroid Nightcore,ynuFEc_Zg5I,0.8,2018-10-06 05:16:52,True,True
2018-10-06T05:22:05,20 FOX IS BEHIND THIS!!!?,0,0,Death to all honkeys!,ynuFEc_Zg5I,-0.78125,2018-10-06 05:22:05,True,True
2018-10-06T05:22:26,Vegeta was like 10 or something when goku wad born did toryama forget that too,1,5,Alucard,ynuFEc_Zg5I,0.0,2018-10-06 05:22:26,True,True
2018-10-06T05:22:29,having goku already a kid here doesnt make sense unless it was raditz.,0,0,najibnk,ynuFEc_Zg5I,0.0,2018-10-06 05:22:29,True,True
2018-10-06T05:22:45,😍😍,0,0,Achu Prakash,ynuFEc_Zg5I,0.0,2018-10-06 05:22:45,True,True
2018-10-06T05:23:40,wtf Goku was a kid when they sent him in the pod isn't he supposed to be a newborn.,0,0,Rafael Iñigo,ynuFEc_Zg5I,-0.5,2018-10-06 05:23:40,True,True
2018-10-06T05:24:13,I thought beerus put the hit on planet vegeta,0,0,jackerietheNUTTGOD,ynuFEc_Zg5I,0.0,2018-10-06 05:24:13,True,True
2018-10-06T05:26:44,"wait wait, so those noncanon stories becomes canon now?",0,0,Revo Ambadar,ynuFEc_Zg5I,0.0,2018-10-06 05:26:44,True,True
2018-10-06T05:26:52,Would love to see Raditz in this movie,0,0,MT,ynuFEc_Zg5I,0.5,2018-10-06 05:26:52,True,True
2018-10-06T05:27:15,The entire fall of the Saiyan race in one movie...**shudders**,0,0,legionaireb,ynuFEc_Zg5I,0.0,2018-10-06 05:27:15,True,True
2018-10-06T05:30:18,Little Raditz is going to be in this scene with little Vegeta😆 1:06,0,0,My RedEyeX,ynuFEc_Zg5I,-0.1875,2018-10-06 05:30:18,True,True
2018-10-06T05:30:26,im actually in love with that shot of vegeta  at the end,0,0,myles james,ynuFEc_Zg5I,0.5,2018-10-06 05:30:26,True,True
2018-10-06T05:32:09,"Lame, same story over again? Probably gonna be a part 2 if not I’m done, i need ultra instinct, and I thought they went blue? This is gonna be a mess",0,0,D. A,ynuFEc_Zg5I,-0.16875,2018-10-06 05:32:09,True,True
2018-10-06T05:32:21,King vegeta is same guy who voices all might in MHA BTW,0,0,Sir Romero,ynuFEc_Zg5I,0.0,2018-10-06 05:32:21,True,True
2018-10-06T05:33:29,feral broly ♡~♡,0,0,Sara,ynuFEc_Zg5I,0.0,2018-10-06 05:33:29,True,True
2018-10-06T05:39:28,Am I only one thinking that for 1 time dub is more badass than original especially king vegeta and pragus,1,0,Mohd Asif,ynuFEc_Zg5I,0.21875,2018-10-06 05:39:28,True,True
2018-10-06T05:39:50,Vegeta is his own father lol     I want to see how many people don’t get the joke,0,0,Ethan Tiongson,ynuFEc_Zg5I,0.6333333333333333,2018-10-06 05:39:50,True,True
2018-10-06T05:41:01,So how much of the original story got changed?,0,0,Kareem Mirtyl,ynuFEc_Zg5I,0.2875,2018-10-06 05:41:01,True,True
2018-10-06T05:41:16,Finally  the origin story sayins  Omg I’m excited,0,0,Sam Lazarus,ynuFEc_Zg5I,0.1875,2018-10-06 05:41:16,True,True
2018-10-06T05:48:09,Where is Radish?,0,0,Daniel Scutaru,ynuFEc_Zg5I,0.0,2018-10-06 05:48:09,True,True
2018-10-06T05:48:11,I love the music,0,0,Johnny hercules,ynuFEc_Zg5I,0.5,2018-10-06 05:48:11,True,True
2018-10-06T05:49:23,Sadly Vegeta is the weakest amongst the three....I wonder if they will remind us it was Beerus who ordered the destruction of planet Vegeta....,0,0,jackystone,ynuFEc_Zg5I,-0.5,2018-10-06 05:49:23,True,True
2018-10-06T05:53:26,why does baby broly look so cute,0,0,Universal zen,ynuFEc_Zg5I,0.5,2018-10-06 05:53:26,True,True
2018-10-06T05:53:35,We want Vegeta to get his real moment and true form please Akira Toriyama,0,0,The Sole Warrior 19,ynuFEc_Zg5I,0.275,2018-10-06 05:53:35,True,True
2018-10-06T05:54:13,So Non-canon,0,1,Gledus pavihi,ynuFEc_Zg5I,0.0,2018-10-06 05:54:13,True,True
2018-10-06T05:54:24,I thought goku was a baby when vegeta was like 10,0,0,MrRASHEED1998,ynuFEc_Zg5I,0.0,2018-10-06 05:54:24,True,True
2018-10-06T05:54:32,I can’t fckn wait. The first DBZ I ever watched was on a bootleg VHS way back in the day. It happened to be the first Broly movie.,22,5,d0f1x3rr,ynuFEc_Zg5I,0.024999999999999994,2018-10-06 05:54:32,True,True
2018-10-06T05:57:50,And i bet aftet this we will have bardock super saiyan become canon !,0,0,voulis1821,ynuFEc_Zg5I,0.41666666666666663,2018-10-06 05:57:50,True,True
2018-10-06T05:57:57,Noooooo,0,0,Ronan Ja,ynuFEc_Zg5I,0.0,2018-10-06 05:57:57,True,True
2018-10-06T05:58:59,Can't wait to see Broly jobbing to Goku... again,0,0,sandro ilpelato,ynuFEc_Zg5I,0.0,2018-10-06 05:58:59,True,True
2018-10-06T05:59:18,As in goku sending away to earth like superman,0,0,Ronan Ja,ynuFEc_Zg5I,0.0,2018-10-06 05:59:18,True,True
2018-10-06T06:00:05,I want to bardock voice by Sean just masako voice him as well,0,0,Ronan Ja,ynuFEc_Zg5I,0.0,2018-10-06 06:00:05,True,True
2018-10-06T06:00:13,Damn it,0,0,Ronan Ja,ynuFEc_Zg5I,0.0,2018-10-06 06:00:13,True,True
2018-10-06T06:01:07,"Akira basically retconned Vegeta's age because during the events of Bardock I think he was probably 5 years old, probably the same age as Raditz",0,0,Clee Montrell,ynuFEc_Zg5I,0.05,2018-10-06 06:01:07,True,True
2018-10-06T06:04:00,love it how its just like Dragon ball minus,0,0,VDeathsoul,ynuFEc_Zg5I,0.2,2018-10-06 06:04:00,True,True
2018-10-06T06:05:24,What it's over 9000000000,0,0,RECT The Art King,ynuFEc_Zg5I,0.0,2018-10-06 06:05:24,True,True
2018-10-06T06:06:49,Wait.. what?  So did king vegeta send him away instead of killing him? And would broly be anti hero bc he fights frieza? wtf is going on?,0,0,Michael Price,ynuFEc_Zg5I,-0.5,2018-10-06 06:06:49,True,True
2018-10-06T06:07:20,Me too don’t next January is long way,0,0,Ronan Ja,ynuFEc_Zg5I,-0.025,2018-10-06 06:07:20,True,True
2018-10-06T06:10:49,this looks like a refeshed version of dbz! i love iiit!!,0,0,keyp,ynuFEc_Zg5I,0.78125,2018-10-06 06:10:49,True,True
2018-10-06T06:10:57,I saw bardocks wife,0,0,Ronan Ja,ynuFEc_Zg5I,0.0,2018-10-06 06:10:57,True,True
2018-10-06T06:11:09,I thought saiyans dont show affection to their young?  Bardock and his wife showed affection to goku yet forgot his elder brother Lol,0,0,Watersports,ynuFEc_Zg5I,0.45,2018-10-06 06:11:09,True,True
2018-10-06T06:11:37,I hope she’s voice by Laura bailey,0,0,Ronan Ja,ynuFEc_Zg5I,0.0,2018-10-06 06:11:37,True,True
2018-10-06T06:12:46,Is this a remake of the old movies or a new one ..,0,1,baluk05,ynuFEc_Zg5I,0.11818181818181818,2018-10-06 06:12:46,True,True
2018-10-06T06:12:59,this trailer gave me goosebumps,0,0,Nagraj Naik,ynuFEc_Zg5I,0.0,2018-10-06 06:12:59,True,True
2018-10-06T06:13:07,Fox? So does this make Vegeta an official Disney prince?!,0,0,Chris,ynuFEc_Zg5I,0.0,2018-10-06 06:13:07,True,True
2018-10-06T06:13:15,This is more like it,0,0,MPT1983,ynuFEc_Zg5I,0.5,2018-10-06 06:13:15,True,True
2018-10-06T06:14:08,"Huh, and I didn't think Goku's past couldn't be more ""Superman-like"" already.",0,0,BrPis Whaler,ynuFEc_Zg5I,0.125,2018-10-06 06:14:08,True,True
2018-10-06T06:16:18,What about Raditz?,0,0,oblivion85,ynuFEc_Zg5I,0.0,2018-10-06 06:16:18,True,True
2018-10-06T06:18:03,that movie will be awesome!,0,0,alejandro bothon sanchez,ynuFEc_Zg5I,1.0,2018-10-06 06:18:03,True,True
2018-10-06T06:18:17,To all of you worried about canon ask yourself these questions:  Did Trunks go Super Saiyan Rage or did he have Kaioshin healing powers?  Did Goku use the Kaioken as SSB or did he use mastered SSB?  Is there a SSJ4 yes or no?  How did Goku learn Ultra Instict by watching Master Roshi or getting detonated by the Genki-dama and “breaking through his shell?”  Is Future Trunks SSJ2 more powerful than Goku’s SSJ3 or did Goku one shot him in that form?  My point is right now Dragon Ball doesn’t exactly have canon. Its a multiverse with a myriad of timelines with slight and not so slight variations. If this were DC comics it would be called Hypertime. It all happened and did not happen people. Lets not be so serious about this and lets enjoy it. My two cents.,0,0,Alejandro Rodriguez III,ynuFEc_Zg5I,0.14023809523809522,2018-10-06 06:18:17,True,True
2018-10-06T06:19:21,Im so fired up🤯... I cant wait any longer😬😔,0,0,NaughtyMe,ynuFEc_Zg5I,0.0,2018-10-06 06:19:21,True,True
2018-10-06T06:20:06,"This movie is literally about 4 fathers and the path each of their sons took. Bardock, King Vegeta, Paragus and King Cold... Can't believe we get to see all four of them onscreen together",1128,14,Sweet Karma,ynuFEc_Zg5I,-0.6,2018-10-06 06:20:06,True,True
2018-10-06T06:24:06,"Basically, Asparagus and Broccoli were exiled just before Freezer killed King Vegetable and his planet. Years later, after Karrot and Prince Vegetable have their many adventures, they come across Freezer once again with Broccoli and Asparagus vowing revenge against Prince Vegetable for his father's actions.",0,1,ChocolateAsylum,ynuFEc_Zg5I,0.09999999999999999,2018-10-06 06:24:06,True,True
2018-10-06T06:25:31,Did they change some bits of story or I’m going crazy I thought goku was a baby when vegeta was a kid,0,1,Quack Goose,ynuFEc_Zg5I,-0.6,2018-10-06 06:25:31,True,True
2018-10-06T06:26:29,"Hello Monkeys 😂 although in the original Japanese trailer Frieza say greetings, but the DUB version is way better",132,3,Baker Saba,ynuFEc_Zg5I,0.2916666666666667,2018-10-06 06:26:29,True,True
2018-10-06T06:26:52,"Man, I haven't followed DB for almost a decade. But I'll be damned this gave me goosebumps.  This is not Canon, right?",0,4,Emad Ahsan,ynuFEc_Zg5I,0.2857142857142857,2018-10-06 06:26:52,True,True
2018-10-06T06:28:42,*Freeza the only being to blow up all the planets the saiyans have ever lived in*,0,0,NoFrame Drops,ynuFEc_Zg5I,0.0,2018-10-06 06:28:42,True,True
2018-10-06T06:28:44,Frieza is so annoying,0,0,khuzaini 999,ynuFEc_Zg5I,-0.8,2018-10-06 06:28:44,True,True
2018-10-06T06:28:49,If only I could grow out a cool goatee like papa vegeta.,0,0,MR Sneak Attack,ynuFEc_Zg5I,0.175,2018-10-06 06:28:49,True,True
2018-10-06T06:31:09,Yessss,0,0,Xiao-Fury: The Channel,ynuFEc_Zg5I,0.0,2018-10-06 06:31:09,True,True
