timestamp,text,like_count,reply_count,author,trailer_id,sentiment_score,datetime,used_for_model,used_for_visualization
2018-10-11T21:19:04,I didn’t know the saiyans lived on earth,0,0,Hobo assistant,ynuFEc_Zg5I,0.0,2018-10-11 21:19:04,True,True
2018-10-11T21:28:09,What’s the run time on this? I hope 2 hrs.,0,0,THE CATCH,ynuFEc_Zg5I,0.0,2018-10-11 21:28:09,True,True
2018-10-11T21:33:08,I'm upset they took out the part where they try to kill Baby Broly and switched it to them sending him to a remote planet also this movie is not cannon if Goku is wearing saiyan armor and also seeing his parents,0,0,scopersz,ynuFEc_Zg5I,-0.1,2018-10-11 21:33:08,True,True
2018-10-11T21:36:07,Bardock dont protect the planet?,0,0,TheKingmco,ynuFEc_Zg5I,0.0,2018-10-11 21:36:07,True,True
2018-10-11T21:38:27,Why is frieza pink?,0,0,Frank 5599,ynuFEc_Zg5I,-0.1,2018-10-11 21:38:27,True,True
2018-10-11T21:43:45,الرسم سيء وليس مثل الماضي كان ممتاز ويبذلون مجهود كبير في رسم الانمي.,0,0,ARABIC ANIME OP / ED,ynuFEc_Zg5I,0.0,2018-10-11 21:43:45,True,True
2018-10-11T21:55:04,I love it,0,0,Brolyrules- Ningen,ynuFEc_Zg5I,0.5,2018-10-11 21:55:04,True,True
2018-10-11T22:00:49,I’m tired of seeing freeza,0,0,Allen Edwards,ynuFEc_Zg5I,-0.4,2018-10-11 22:00:49,True,True
2018-10-11T22:05:32,Super's art style looks better than z's art style and this is not z's art style it's just in z's art style.,0,1,Brolyrules- Ningen,ynuFEc_Zg5I,0.41666666666666663,2018-10-11 22:05:32,True,True
2018-10-11T22:08:37,Isn't​ this just a superman thing now...,0,0,Vivid.Imagination,ynuFEc_Zg5I,0.0,2018-10-11 22:08:37,True,True
2018-10-11T22:13:29,"I'snt goku a little bit older at the 1:00 mark...if i remember corectly he was a bit smaller when he arrived at earth and granda gohan found him, more like a baby than a toddler..",0,0,Radu Remus,ynuFEc_Zg5I,0.11979166666666666,2018-10-11 22:13:29,True,True
2018-10-11T22:17:56,We have waited all of those just for this?????????? Excuuuuuuuuuuuuse me but NO!!,0,0,Look at me I know what I'm doing,ynuFEc_Zg5I,0.0,2018-10-11 22:17:56,True,True
2018-10-11T22:19:31,THIS AINT KAKKOROT BROLY :0,0,0,Can we get 5k subs with no Videos,ynuFEc_Zg5I,0.0,2018-10-11 22:19:31,True,True
2018-10-11T22:23:12,duuuude wtf the guy at 0:38,0,0,Vicente Esteban,ynuFEc_Zg5I,-0.5,2018-10-11 22:23:12,True,True
2018-10-11T22:23:51,"PLEASE don't change Bardock's personality He is a mighty, overconfident, coldhearted low class warrior  who does care about his crew and race He is not a family man",0,0,ersLamboy 32,ynuFEc_Zg5I,0.2,2018-10-11 22:23:51,True,True
2018-10-11T22:30:16,Why does a Goku look 5 when he was sent away,0,0,payton willis,ynuFEc_Zg5I,0.0,2018-10-11 22:30:16,True,True
2018-10-11T22:33:41,I AM READY! ULTRA INSTINCT VEGETA!,0,0,yurushii,ynuFEc_Zg5I,0.3125,2018-10-11 22:33:41,True,True
2018-10-11T22:40:47,So they’re finally bringing super Saiyan back into the mix. I’m glad tho it’s always straight to blue form it kinda makes it played out,0,0,donald moore,ynuFEc_Zg5I,0.1722222222222222,2018-10-11 22:40:47,True,True
2018-10-11T22:43:31,FINNALY ANIMATION LIKE DBZ GG,0,0,Sid -,ynuFEc_Zg5I,0.0,2018-10-11 22:43:31,True,True
2018-10-11T22:44:26,Goku - Superman Vegita - General Zod’s Son Broly - Doomsday  My mind blown assumption of The animation Sorry guys who are DC fans 🙇🙇🙇🙇🙇🙇🙇🙇🙇🙇🙇🙇🙇🙇🙇🙇🙇🙇,2,0,Limely -,ynuFEc_Zg5I,-0.22499999999999998,2018-10-11 22:44:26,True,True
2018-10-11T22:51:21,"New roundy and cute characters, nothing related to old Z Retcon on the amazing original Bardock Movie, to make it just Super Man The same old story again, but with less gore, less action and more powercreep GREAT!",0,0,Ziliock,ynuFEc_Zg5I,0.24366883116883117,2018-10-11 22:51:21,True,True
2018-10-11T22:59:39,"I think how it's amazing Goku was the weakest Saiyan out of the 3 and showed his true power as a Teen, Adult? I don't know Saiyans apparently aren't adult until age 50 or something :/",0,0,Rano,ynuFEc_Zg5I,0.13571428571428573,2018-10-11 22:59:39,True,True
2018-10-11T23:06:04,Is always sad when kal'el is sended to earth before the destruction of kripton.,0,0,kataokasaga,ynuFEc_Zg5I,-0.5,2018-10-11 23:06:04,True,True
2018-10-11T23:12:19,"Broly Saiyan, what happened to planet Vegeta, Frieza?",0,0,xKnightofSeven,ynuFEc_Zg5I,0.0,2018-10-11 23:12:19,True,True
2018-10-11T23:36:37,Is this a trailer for Superman and 2 of his other siblings? Gotta love all this remake origin stories.,0,0,MAR 13th,ynuFEc_Zg5I,0.1875,2018-10-11 23:36:37,True,True
2018-10-11T23:50:37,Im 33 and im excited!!,0,0,biyo lazaro,ynuFEc_Zg5I,0.5859375,2018-10-11 23:50:37,True,True
2018-10-11T23:52:06,20th century fox nice  should get sega since its japanese,0,0,Reece Batty,ynuFEc_Zg5I,0.19999999999999998,2018-10-11 23:52:06,True,True
2018-10-12T00:09:55,so reditz has his mother hair. while goku has his dad hair.,0,0,tengtx,ynuFEc_Zg5I,0.0,2018-10-12 00:09:55,True,True
2018-10-12T00:11:31,is this gonna change dragon ball because goku saw his parents,0,0,nostradomis,ynuFEc_Zg5I,0.0,2018-10-12 00:11:31,True,True
2018-10-12T00:21:02,Why does goku look 4828383929. Years old 😭. Isn’t he supposed to be a baby,0,0,Jorge Delgado,ynuFEc_Zg5I,0.1,2018-10-12 00:21:02,True,True
2018-10-12T00:36:11,JANUARY. I CANT WAIT FOR JANUARY END ME,0,0,Yeng Thao,ynuFEc_Zg5I,0.0,2018-10-12 00:36:11,True,True
2018-10-12T00:41:32,THE HYPE FOR THIS S**t OMG,0,0,María Ayala,ynuFEc_Zg5I,0.0,2018-10-12 00:41:32,True,True
2018-10-12T01:02:52,"THE ART😍, one question why frezia so red though",0,0,Pulg,ynuFEc_Zg5I,0.0,2018-10-12 01:02:52,True,True
2018-10-12T01:04:49,My question is are they going to retcon goku both being a baby when being found and vegeta being around 6 to 10 years older than goku or is this movie non canon I hope its the second one,0,0,Seyyed Dibaj,ynuFEc_Zg5I,0.08333333333333333,2018-10-12 01:04:49,True,True
2018-10-12T01:05:05,😍😍😍😍😍😍,0,0,Dylan Taylor,ynuFEc_Zg5I,0.0,2018-10-12 01:05:05,True,True
2018-10-12T01:10:48,Wait. So how old is Vegeta compared to Goku again?,0,0,Lone Star24,ynuFEc_Zg5I,0.1,2018-10-12 01:10:48,True,True
2018-10-12T01:26:36,any showing in Australia?? my son and I are super excited !!!!,0,0,RedLooseefer Man,ynuFEc_Zg5I,0.6244303385416666,2018-10-12 01:26:36,True,True
2018-10-12T01:29:14,Subscribe if you think Goku will go ultra instinct,0,0,Tek Playz,ynuFEc_Zg5I,0.0,2018-10-12 01:29:14,True,True
2018-10-12T01:29:41,NOOOOOOOO WHY I HAVE TO WAIT SO LONG 😭😭😔,5,0,Gloxinia,ynuFEc_Zg5I,-0.05,2018-10-12 01:29:41,True,True
2018-10-12T01:45:29,I'm really excited now,0,0,DokuseiToxic Wolf,ynuFEc_Zg5I,0.375,2018-10-12 01:45:29,True,True
2018-10-12T01:54:01,When is this movie out,0,0,Professional griefer vdoizy On top,ynuFEc_Zg5I,0.0,2018-10-12 01:54:01,True,True
2018-10-12T02:09:11,Hoping that if dragon ball super series resume they will stick to this art design.. This is way much better than the recent dbs series graphics,0,0,Likemike Dela Cruz,ynuFEc_Zg5I,0.27777777777777773,2018-10-12 02:09:11,True,True
2018-10-12T02:10:01,I've got to see this at the cinemas.,0,0,xxdudeyy Dude,ynuFEc_Zg5I,0.0,2018-10-12 02:10:01,True,True
2018-10-12T02:16:56,Goku A low class sayajin 🤣🤣🤣😂😂😂,0,0,Cut Screenes,ynuFEc_Zg5I,0.0,2018-10-12 02:16:56,True,True
2018-10-12T02:22:30,"Meu Deus! Tá muito bem feito, com certeza sera o melhor filme vindo de Dragon Ball",0,0,Murillo Kaique,ynuFEc_Zg5I,0.0,2018-10-12 02:22:30,True,True
2018-10-12T02:30:25,This movie isn't going to make any goddam sense just like the show did.,0,0,Johnathan Rivera,ynuFEc_Zg5I,0.0,2018-10-12 02:30:25,True,True
2018-10-12T03:20:15,Dope😍😍,0,0,karthik kotian,ynuFEc_Zg5I,0.0,2018-10-12 03:20:15,True,True
2018-10-12T03:24:21,COOL 😎 AS F I AM SOOOO EXCITED ❤️,0,0,Fnaf Tube,ynuFEc_Zg5I,0.3625,2018-10-12 03:24:21,True,True
2018-10-12T03:51:36,How many times earth gone get destroyed...,0,0,Jayy Thrash,ynuFEc_Zg5I,0.5,2018-10-12 03:51:36,True,True
2018-10-12T04:02:21,Releases date? ??,0,0,RK Rakib,ynuFEc_Zg5I,0.0,2018-10-12 04:02:21,True,True
2018-10-12T04:21:13,i love that their redoing broly cause the only thing we knew him by is hating kakarot aka goku so this really excites me,0,0,MaxAnthony239,ynuFEc_Zg5I,0.2333333333333333,2018-10-12 04:21:13,True,True
2018-10-12T04:21:45,still looks like a  bad reboot to me,0,0,Death the Kid,ynuFEc_Zg5I,-0.6999999999999998,2018-10-12 04:21:45,True,True
2018-10-12T04:48:48,*You Do What It Takes To Survive Son*,26,0,XeleratedGamerz,ynuFEc_Zg5I,0.0,2018-10-12 04:48:48,True,True
2018-10-12T05:00:23,I’m sorry but this sort of disrupts the origins story that already has been established,1,0,Savage X Man,ynuFEc_Zg5I,-0.5,2018-10-12 05:00:23,True,True
2018-10-12T05:03:34,The disrespect of frezia calling sayians monkeys😡 he’ll get his later on,1,0,E W,ynuFEc_Zg5I,0.0,2018-10-12 05:03:34,True,True
2018-10-12T05:05:43,Follow me on instagram @jovan.xj if your excited for this movie,0,0,Jonah Hamilton,ynuFEc_Zg5I,0.375,2018-10-12 05:05:43,True,True
2018-10-12T05:05:59,1:22 vegeta looks epic with the face like a boss but we all know what will happen if vegeta thinks he was the strongest,89,11,Halilcan Demiroglu,ynuFEc_Zg5I,0.1,2018-10-12 05:05:59,True,True
2018-10-12T05:09:22,Not a fan of the re-design of Broly. He just looks like an average Saiyan now.,0,0,Joshua Davis,ynuFEc_Zg5I,-0.15,2018-10-12 05:09:22,True,True
2018-10-12T05:11:58,Wdf he do to my childhood,0,0,NFG President Kay,ynuFEc_Zg5I,0.0,2018-10-12 05:11:58,True,True
2018-10-12T05:12:13,Dragon ball z waaaaaaaaay better hands down,0,0,NFG President Kay,ynuFEc_Zg5I,0.17222222222222222,2018-10-12 05:12:13,True,True
2018-10-12T05:24:02,Am I the only one like furious that they show goku leaving as like a 5 year old when Dbz definitely had gohan finding him as a baby,0,0,Camden Reed,ynuFEc_Zg5I,0.03333333333333333,2018-10-12 05:24:02,True,True
2018-10-12T05:26:27,Love the music throughout the whole trailer!,0,0,S7VAN Gaming And Unboxing,ynuFEc_Zg5I,0.375,2018-10-12 05:26:27,True,True
2018-10-12T05:31:31,I'm just happy we got the gorgeous old art style back.  Looks dope yo! :],601,18,SeNniN,ynuFEc_Zg5I,0.42000000000000004,2018-10-12 05:31:31,True,True
2018-10-12T05:34:11,Don't know how I feel about all pink Freeza,0,0,Tyler Tobeck,ynuFEc_Zg5I,-0.1,2018-10-12 05:34:11,True,True
2018-10-12T05:50:33,that was baby raditz getting sent away because goku was sent as a baby,0,0,KID HAZEL BEATZ,ynuFEc_Zg5I,0.0,2018-10-12 05:50:33,True,True
2018-10-12T06:09:28,Broly again...so boring.,0,0,HammerBann,ynuFEc_Zg5I,-1.0,2018-10-12 06:09:28,True,True
2018-10-12T06:12:36,We're gonna see the soft side of King Vegeta,0,0,Nonchalant T,ynuFEc_Zg5I,0.1,2018-10-12 06:12:36,True,True
2018-10-12T06:37:03,Okay they fuckedup bardock,0,0,Anthropos Kardiá,ynuFEc_Zg5I,0.5,2018-10-12 06:37:03,True,True
2018-10-12T06:38:10,...he can keep it. I’ll keep the original,0,0,Naveen Evans,ynuFEc_Zg5I,0.375,2018-10-12 06:38:10,True,True
2018-10-12T06:50:09,RUNTHEGAUNTLET. ORG,0,0,doomz spooky,ynuFEc_Zg5I,0.0,2018-10-12 06:50:09,True,True
2018-10-12T06:58:07,Sooooo goku and vegeta are the same age now?,0,0,Sean,ynuFEc_Zg5I,0.0,2018-10-12 06:58:07,True,True
2018-10-12T06:58:07,Soooo goku being sent away in a ship to earth by his parents before the destruction of the planet seems a bit like Superman,0,0,Diverse Gaming,ynuFEc_Zg5I,0.0,2018-10-12 06:58:07,True,True
2018-10-12T07:01:03,They made Broly better.,0,0,Wasi Noor Azam,ynuFEc_Zg5I,0.5,2018-10-12 07:01:03,True,True
2018-10-12T07:07:21,WHY ISN'T ANYONE ELSE SCREAMING IN EXCITEMENT TO SEE THAT GINE WAS THERE OR DID I NOT SCROLL DOWN FAR ENOUGH?!,0,0,Marie Montano,ynuFEc_Zg5I,-0.018518518518518528,2018-10-12 07:07:21,True,True
2018-10-12T07:10:24,DRAGONBALL FOR LIFE,0,0,Scorpio Danny T,ynuFEc_Zg5I,0.0,2018-10-12 07:10:24,True,True
2018-10-12T07:32:05,im so hyped XD,0,0,Someone,ynuFEc_Zg5I,0.0,2018-10-12 07:32:05,True,True
2018-10-12T07:48:17,Man I love that 90s style,0,0,Fernando Garcia,ynuFEc_Zg5I,0.5,2018-10-12 07:48:17,True,True
2018-10-12T08:01:02,so... dragon ball minus is canon now?,0,0,Marcos Gonzalez,ynuFEc_Zg5I,-0.1,2018-10-12 08:01:02,True,True
2018-10-12T08:01:22,I LOVE BROLY 🏆🏆🏆🏆🏆🏆😍😍😍😍😍😍😎😎😎😎😎😎👑👑👑👑👑👑🥇🥇🥇🥇🥇🥇💪💪💪💪💪💪🤓🤓🤓🤓🤓🤓,0,0,Himnos Jenner Bruno Aldana,ynuFEc_Zg5I,0.5,2018-10-12 08:01:22,True,True
2018-10-12T08:15:58,Boooooo! Why couldn't they do a movie about the other universes,0,0,mauricej007,ynuFEc_Zg5I,-0.125,2018-10-12 08:15:58,True,True
2018-10-12T08:16:19,0:13 when you walk into KFC,0,0,Maribor Forest,ynuFEc_Zg5I,0.0,2018-10-12 08:16:19,True,True
2018-10-12T08:23:25,❤️,0,0,77 Hrs,ynuFEc_Zg5I,0.0,2018-10-12 08:23:25,True,True
2018-10-12T08:33:36,Waiting for death battle to make goku vs superman 3rd rematch!!,0,0,Yang Guo,ynuFEc_Zg5I,0.0,2018-10-12 08:33:36,True,True
2018-10-12T08:57:26,Who else going high af to movies,0,0,Im just the weed man,ynuFEc_Zg5I,0.16,2018-10-12 08:57:26,True,True
2018-10-12T09:03:30,Recon over 9000 still looks hella dope though feeling this art style,0,0,Rey Sekai,ynuFEc_Zg5I,0.0,2018-10-12 09:03:30,True,True
2018-10-12T09:36:10,"Hm. So... The Bardock goodbye is now canon. Kinda doesn't really make sense since originally Goku shows up no clothing at all if I remember right, and as a literal baby. In this he looks like at least 3 or 4 when leaving the planet. ALSO how long is this movie gonna be if they're gonna re-show all of the Saiyan stuff cuz I feel like that's gonna take at least an hour on it's own.",0,0,Ridikis,ynuFEc_Zg5I,0.11581632653061225,2018-10-12 09:36:10,True,True
2018-10-12T09:41:10,lol Frieza voice is so ridiculous,0,0,Peter Marlow,ynuFEc_Zg5I,0.23333333333333336,2018-10-12 09:41:10,True,True
2018-10-12T09:52:43,gokus mum!!!,0,0,animegod,ynuFEc_Zg5I,0.0,2018-10-12 09:52:43,True,True
2018-10-12T10:05:47,Its January  now wtf,0,0,Nasa •,ynuFEc_Zg5I,-0.5,2018-10-12 10:05:47,True,True
2018-10-12T10:11:22,*BETTER ANIMATION THAT DBZ SUPER SERIES*,2,0,2kGamer PH,ynuFEc_Zg5I,0.41666666666666663,2018-10-12 10:11:22,True,True
2018-10-12T10:25:42,This gonna be top tier,0,0,BigMan JohnnyOsborne,ynuFEc_Zg5I,0.5,2018-10-12 10:25:42,True,True
2018-10-12T10:28:40,"Remember when Goku met missed his parents? Yeah, me neither.",0,0,jdudeoes,ynuFEc_Zg5I,0.0,2018-10-12 10:28:40,True,True
2018-10-12T10:29:22,3 besties?,3,1,Dheeraj Kumar,ynuFEc_Zg5I,0.0,2018-10-12 10:29:22,True,True
2018-10-12T10:33:04,Yay! goku’s mom revealed!,0,0,HARITH AIMAN BIN HALIMI -,ynuFEc_Zg5I,0.0,2018-10-12 10:33:04,True,True
2018-10-12T10:40:58,Can't wait🤤,0,0,Bilal Qureshi,ynuFEc_Zg5I,0.0,2018-10-12 10:40:58,True,True
2018-10-12T10:51:51,CANT WAIT TO WATCH,0,0,Wisal Salar,ynuFEc_Zg5I,0.0,2018-10-12 10:51:51,True,True
2018-10-12T11:13:53,I wish my country put this movir,0,0,Nx Falco,ynuFEc_Zg5I,0.0,2018-10-12 11:13:53,True,True
2018-10-12T11:38:24,So is this like an alternate universe or something??,0,0,sonic5577,ynuFEc_Zg5I,0.0,2018-10-12 11:38:24,True,True
2018-10-12T11:39:32,This trailer is terrible... I actually thought it was a really bad fan-made trailer....,0,0,Ernest Hobbs,ynuFEc_Zg5I,-0.5666666666666665,2018-10-12 11:39:32,True,True
2018-10-12T11:42:52,Soooooooooo Chris Sabat voices King Vegeta too? sweet.,0,0,OriVoicesStuff,ynuFEc_Zg5I,0.35,2018-10-12 11:42:52,True,True
2018-10-12T12:04:20,I hope they keep broly and don't kill him off cuz he has SO MUCH potential,306,14,Isaac Jr.,ynuFEc_Zg5I,0.0,2018-10-12 12:04:20,True,True
2018-10-12T12:05:30,Wow that was dope,0,0,Ambareesh Ajith,ynuFEc_Zg5I,0.1,2018-10-12 12:05:30,True,True
2018-10-12T12:14:10,"Wtf, this is so inconsistent. How many things will toriyama forget",0,0,Sreekar Gunda,ynuFEc_Zg5I,0.0,2018-10-12 12:14:10,True,True
2018-10-12T12:17:44,this retcon changes everything....how could Goku grow up knowing his father? that changes the entire Granpa Gohan meeting baby Goku and raising him,0,2,Kenneth N Webb,ynuFEc_Zg5I,0.0,2018-10-12 12:17:44,True,True
2018-10-12T12:21:54,Wird der Film auch in deutschen Kinos geben ?,0,0,prototype,ynuFEc_Zg5I,0.0,2018-10-12 12:21:54,True,True
2018-10-12T12:46:10,So is this Canon or just another fanservice jerkoff? Asking for a friend.,0,0,Explicitnice,ynuFEc_Zg5I,0.0,2018-10-12 12:46:10,True,True
2018-10-12T12:56:32,Wait! Goku was sent as a baby to Earth 🤔 Not a grown kid.,0,0,reijavmanga,ynuFEc_Zg5I,0.0,2018-10-12 12:56:32,True,True
2018-10-12T12:58:25,The only form that Goku has transformed and defeated someone is super Saiyan,0,0,Beach lasagna,ynuFEc_Zg5I,0.16666666666666666,2018-10-12 12:58:25,True,True
2018-10-12T13:11:30,Holy somkin hell..  That's some entertainment,0,0,Dilan Patel,ynuFEc_Zg5I,0.0,2018-10-12 13:11:30,True,True
2018-10-12T13:32:56,Dragon ball super is such a cash grab. An insult to all true DBZ fans. Dragon Ball ended at the end of DBZ. Hell GT did better than Super. Their power scaling made sense. Only fools like cheap crap or they are little kiddies who never seen the originals. You people are in denial. You are so in denial of how crappy Super is you need therapy.,1,0,Luigi,ynuFEc_Zg5I,0.12624999999999997,2018-10-12 13:32:56,True,True
2018-10-12T13:35:48,Stop blocking people for posting the trailer you jackasses,0,0,Jake Bryant,ynuFEc_Zg5I,-0.5,2018-10-12 13:35:48,True,True
2018-10-12T13:40:18,So I'm guessing they are rebooting the Broly story with this?,0,0,Furlow Torent,ynuFEc_Zg5I,0.0,2018-10-12 13:40:18,True,True
2018-10-12T13:42:42,I haven't watched dragon ball in ages so i might start actually watching super.,0,0,BinBot,ynuFEc_Zg5I,0.16666666666666666,2018-10-12 13:42:42,True,True
2018-10-12T13:53:50,This movie is going to be EPIC!!!!,0,0,Raydell Gomez,ynuFEc_Zg5I,0.244140625,2018-10-12 13:53:50,True,True
2018-10-12T14:29:23,Why does everyone care so much about the age difference🤦‍♂️ as long as this movie is an upgrade from super I'll be happy even if they slightly change some canonical facts,0,0,Andrew Belmont,ynuFEc_Zg5I,0.22333333333333333,2018-10-12 14:29:23,True,True
2018-10-12T14:42:47,My body is ready.,0,0,Tee Khing Hua,ynuFEc_Zg5I,0.2,2018-10-12 14:42:47,True,True
2018-10-12T15:06:20,"well, this whole story of the trailer took place when the Saiyans were small...which means Beerus wasn't even known to the people there",0,0,Mohammad Salman,ynuFEc_Zg5I,0.2,2018-10-12 15:06:20,True,True
2018-10-12T15:24:44,Vegeta is Older than Goku Ithink but in this movie they are at the same age lol,0,0,Francis,ynuFEc_Zg5I,0.32222222222222224,2018-10-12 15:24:44,True,True
2018-10-12T15:24:45,Did King Vegeta fuse with Piccolo listen to his voice lol.,0,0,benj305,ynuFEc_Zg5I,0.8,2018-10-12 15:24:45,True,True
2018-10-12T15:27:22,"Oh hey, Goku is no longer a dude who became a kind man because of dumb luck, but his parents are *special*. Damn it, Toriyama. Damn you Toei. Why does this movie have to adapt Minus.",0,0,paperbackwriter1111,ynuFEc_Zg5I,0.12053571428571427,2018-10-12 15:27:22,True,True
2018-10-12T15:36:19,"Can someone please tell me (no spoilers), if i watch this movie when it comes out, will it ruin any of the dragon ball super that I've been watching each week, Im ONLY watching the english dubbed version of DBS as me and my bro grew up on goku and vegeta's voice/sound etc, we don't care too much for subs and the japanese audio, so will the new movie reveal anything that will wreck our experience for the rest of DBS Eng Dub. ? we are currently up to episode 80 or so, as well :) TIA",0,0,Benjamyn Hazelton,ynuFEc_Zg5I,0.1462121212121212,2018-10-12 15:36:19,True,True
2018-10-12T15:43:00,"""Hello monkeys"" ain't that a way to start off a trailer lmao",0,0,unknownviper99,ynuFEc_Zg5I,0.6,2018-10-12 15:43:00,True,True
2018-10-12T15:45:44,It's actually nice to hear bardocks voice in a movie it's been a long time since he showed up on screen,0,0,unknownviper99,ynuFEc_Zg5I,0.27499999999999997,2018-10-12 15:45:44,True,True
2018-10-12T15:57:55,chitch,0,0,Ninto: Nukka,ynuFEc_Zg5I,0.0,2018-10-12 15:57:55,True,True
2018-10-12T16:02:24,"i get a superman vibe into this, am i only the one?",0,0,Aviate with Mike,ynuFEc_Zg5I,0.0,2018-10-12 16:02:24,True,True
2018-10-12T16:06:34,I waiting for dragon ball super broly movie,0,0,Janata solutions,ynuFEc_Zg5I,0.3333333333333333,2018-10-12 16:06:34,True,True
2018-10-12T16:08:31,"Born at around the same time lol, they could have just said Born in the same Era and it would have been more accurate and more appealing",0,0,James Hall,ynuFEc_Zg5I,0.38571428571428573,2018-10-12 16:08:31,True,True
2018-10-12T16:21:11,Caaaannntt waiittt😣😣,0,0,Tahmeed Rahman,ynuFEc_Zg5I,0.0,2018-10-12 16:21:11,True,True
2018-10-12T16:22:58,Man super excited,0,0,K Love,ynuFEc_Zg5I,0.35416666666666663,2018-10-12 16:22:58,True,True
2018-10-12T16:36:32,They need to stop making this movie so sexy,0,0,Nightmare Potato,ynuFEc_Zg5I,0.5,2018-10-12 16:36:32,True,True
2018-10-12T16:38:16,"So it's a mash-up of the Bardock episode, clips of old Broly movie, and finished with a battle?",0,0,Rebe L'doll,ynuFEc_Zg5I,0.1,2018-10-12 16:38:16,True,True
2018-10-12T16:46:09,come on...Really They were babies when they were sent to earth... and Now They are kids when they were sent   Dragon ball timeline is messed up!,0,0,Just some Gurl With Red hair,ynuFEc_Zg5I,0.0,2018-10-12 16:46:09,True,True
2018-10-12T16:49:18,the entire legend begins here,0,0,Tanzeem Saad,ynuFEc_Zg5I,0.0,2018-10-12 16:49:18,True,True
2018-10-12T16:52:45,WHAT ABOUT GOTEN BIRTH THIS MOVIE WILL BE ABOUT THE BEGINNING INTO NOW WE WANT TO SEE IT ALL,0,0,billy Luxa,ynuFEc_Zg5I,0.0,2018-10-12 16:52:45,True,True
2018-10-12T17:07:30,Hate to say but this Trailer was Boring i thought it would be better.,0,0,Chris Florida,ynuFEc_Zg5I,-0.43333333333333335,2018-10-12 17:07:30,True,True
2018-10-12T17:08:00,While I'm thrilled they're making a legit broly movie... it just feels like too much of a safe move. It's a movie idea that's been done 4 or 5 times now. A continuation of beerus vs goku or after tourney events with jiren and vegetas promise seems like would have been a better fit.,0,0,Joshua,ynuFEc_Zg5I,0.5,2018-10-12 17:08:00,True,True
2018-10-12T17:26:26,Where is grand Vizir Nappa ?,0,0,Nicolas Kenji,ynuFEc_Zg5I,0.5,2018-10-12 17:26:26,True,True
2018-10-12T17:46:22,why vegeta looks the same in the nursing pod as in supper lmfao!!!!!,0,0,Daniel Rios,ynuFEc_Zg5I,0.0,2018-10-12 17:46:22,True,True
2018-10-12T17:50:02,Isn't that goku was an infant when he was sent to earth?.. In this trailer he's like 5 years old.. And where is nappa and raditz? I hope this movie would not ruin my childhood.. Lol,0,0,raymel brabante,ynuFEc_Zg5I,0.45,2018-10-12 17:50:02,True,True
2018-10-12T17:57:35,"Hey guys, is this canon? cuz didnt goku leave planet vegeta when he was a kid, but he left in the pod when he was around 10, or did toriyama forget????",0,0,rmc.,ynuFEc_Zg5I,0.0,2018-10-12 17:57:35,True,True
2018-10-12T17:58:37,Damn I love that Hand drawn Look,0,0,Michael William,ynuFEc_Zg5I,0.5,2018-10-12 17:58:37,True,True
2018-10-12T18:00:34,So emotional trailer. I really badly want to see the movie,0,0,Nikhilesh Gupta,ynuFEc_Zg5I,-0.3499999999999999,2018-10-12 18:00:34,True,True
2018-10-12T18:06:03,"I’m sure quite a lot of people like these new graphics, but I can’t stand it...I miss the old style!! Of course these are great, and lot of effort has been put in, but it’s just my ‘2 cents’",0,0,AmirRider786,ynuFEc_Zg5I,0.3981534090909091,2018-10-12 18:06:03,True,True
2018-10-12T18:07:07,fox in too,0,0,Bảo Trần,ynuFEc_Zg5I,0.0,2018-10-12 18:07:07,True,True
2018-10-12T18:17:02,Wasn't Vegeta years older than Goku?,0,0,Gary Madafaka-Oak,ynuFEc_Zg5I,0.16666666666666666,2018-10-12 18:17:02,True,True
2018-10-12T18:18:56,"Wait... so Freeza doesn't have any armor ? And I thought that Vegeta was much older than goku, from like 5 or 6 years...",0,0,Titouan Prévost,ynuFEc_Zg5I,0.16666666666666666,2018-10-12 18:18:56,True,True
2018-10-12T18:19:38,1:04 gives me chills~~,0,0,potato o,ynuFEc_Zg5I,0.0,2018-10-12 18:19:38,True,True
2018-10-12T18:20:15,😱😱😱😱😱😍😍😍😍😍😍👍👍👍👍👍👌👌👌👌,1,0,Dragon Ball Z S AMVs 731Q,ynuFEc_Zg5I,0.0,2018-10-12 18:20:15,True,True
2018-10-12T18:28:13,0:19 Imagine if one Saiyin didn't bow and it was Future Trunks and he kills Freiza & Co in ANOTHER timeline and tells King Vegeta who he is. lol,99,14,Fruit Farm Factory,ynuFEc_Zg5I,0.4,2018-10-12 18:28:13,True,True
2018-10-12T18:32:01,They're canonizing Bardock's movie  in this one too?,0,0,asdfghjkl zxcvbnm,ynuFEc_Zg5I,0.0,2018-10-12 18:32:01,True,True
2018-10-12T18:42:17,My dream of being a saiyan when I was a kid..,1,0,epsilon,ynuFEc_Zg5I,0.0,2018-10-12 18:42:17,True,True
2018-10-12T18:46:19,Superman story in a nutshell .. smh :/,0,0,magicodabola10,ynuFEc_Zg5I,-0.25,2018-10-12 18:46:19,True,True
2018-10-12T18:49:26,I cant wait who wanna see it with me :3,0,0,Pickles,ynuFEc_Zg5I,0.5,2018-10-12 18:49:26,True,True
2018-10-12T18:52:22,Just wow 😮😮🤤,0,0,Alejandro Escobedo,ynuFEc_Zg5I,0.1,2018-10-12 18:52:22,True,True
2018-10-12T19:03:25,0:31 Sounds like Almight,0,0,Hamdi Ali,ynuFEc_Zg5I,0.0,2018-10-12 19:03:25,True,True
2018-10-12T19:03:37,It makes more sense though right?? Why would you send a baby to a foreign planet.,0,0,mystelblade,ynuFEc_Zg5I,0.22023809523809523,2018-10-12 19:03:37,True,True
2018-10-12T19:08:54,what about bardocks red headband?,0,0,KISS OF DEATH,ynuFEc_Zg5I,0.0,2018-10-12 19:08:54,True,True
2018-10-12T19:08:55,Fusion?,0,0,Slat Leaks,ynuFEc_Zg5I,0.0,2018-10-12 19:08:55,True,True
2018-10-12T19:09:31,i cant wait to see this! A BROLY MOVIE ! HELL YEA!,0,0,the mouth of Sauron,ynuFEc_Zg5I,0.0,2018-10-12 19:09:31,True,True
2018-10-12T19:10:36,*The animation looks nice!!*         Aside from the crappy space ships lol,0,0,beans,ynuFEc_Zg5I,0.86875,2018-10-12 19:10:36,True,True
