timestamp,text,like_count,reply_count,author,trailer_id,sentiment_score,datetime,used_for_model,used_for_visualization
2018-10-05T22:31:25,Already seen!!!!!,7,4,Alessio Choquez Alarcon,ynuFEc_Zg5I,0.0,2018-10-05 22:31:25,True,True
2018-10-05T22:33:06,Yes! English Dub!!!,39,0,SUPERRAGO1,ynuFEc_Zg5I,0.0,2018-10-05 22:33:06,True,True
2018-10-05T22:34:22,Vamos a tener sexo!!!!,0,0,Claudio Monteda,ynuFEc_Zg5I,0.0,2018-10-05 22:34:22,True,True
2018-10-05T22:34:53,Finally!,2,0,MMA POP OFF!,ynuFEc_Zg5I,0.0,2018-10-05 22:34:53,True,True
2018-10-05T22:34:56,Early,0,0,Eitzer,ynuFEc_Zg5I,0.1,2018-10-05 22:34:56,True,True
2018-10-05T22:38:41,Can’t wait to break the internet again!,61,3,SuperExclusive,ynuFEc_Zg5I,0.0,2018-10-05 22:38:41,True,True
2018-10-05T22:42:55,Waiting to hear king colds voice,34,10,Ritiman Das,ynuFEc_Zg5I,0.0,2018-10-05 22:42:55,True,True
2018-10-05T22:44:42,Seen it already ... there is an early leak Gine is now canon...,0,3,Petra Art,ynuFEc_Zg5I,0.1,2018-10-05 22:44:42,True,True
2018-10-05T22:45:09,no u,0,0,Own A Hole,ynuFEc_Zg5I,0.0,2018-10-05 22:45:09,True,True
2018-10-05T22:45:44,Lets try to break 10 mil views again !!!,11,0,TheChosenGamer,ynuFEc_Zg5I,0.0,2018-10-05 22:45:44,True,True
2018-10-05T22:48:02,I seen the sub but the dub gonna be lit,76,9,William Lilley,ynuFEc_Zg5I,0.0,2018-10-05 22:48:02,True,True
2018-10-05T22:56:52,LETS GOOOOOOOOOO,7,0,Kalio - Release The Snyder Cut!,ynuFEc_Zg5I,0.0,2018-10-05 22:56:52,True,True
2018-10-05T22:57:25,Wait i saw this yesterday,0,0,Andrew,ynuFEc_Zg5I,0.0,2018-10-05 22:57:25,True,True
2018-10-05T22:57:30,ITS TIME TO SEE THAT LORE IN ENGLISH!!!!,161,3,Kalio - Release The Snyder Cut!,ynuFEc_Zg5I,0.0,2018-10-05 22:57:30,True,True
2018-10-05T22:58:53,お前ら！！！！くるぞ！！！！,0,0,ツイキャス用,ynuFEc_Zg5I,0.0,2018-10-05 22:58:53,True,True
2018-10-05T22:59:21,SO EXCITED REEEEEEEEEEEEEEEE,5,1,-AlphaNerd-Ger-,ynuFEc_Zg5I,0.375,2018-10-05 22:59:21,True,True
2018-10-05T22:59:27,LETS GOOOO,0,0,CruDe Gaming,ynuFEc_Zg5I,0.0,2018-10-05 22:59:27,True,True
2018-10-05T23:00:03,4 mofos with dislikes already lol,0,0,SM Punk,ynuFEc_Zg5I,0.8,2018-10-05 23:00:03,True,True
2018-10-05T23:00:19,Can't wait to see ssg horse,0,0,Rosé Hokage,ynuFEc_Zg5I,0.0,2018-10-05 23:00:19,True,True
2018-10-05T23:00:19,Ima beat my meat,9,3,Tony Cordova,ynuFEc_Zg5I,0.0,2018-10-05 23:00:19,True,True
2018-10-05T23:00:27,And.........play........Play......PLAY!,18,0,Kasea VP,ynuFEc_Zg5I,0.0,2018-10-05 23:00:27,True,True
2018-10-05T23:00:38,sean really knows how to spill the beans huh,0,0,j,ynuFEc_Zg5I,0.2,2018-10-05 23:00:38,True,True
2018-10-05T23:00:38,Here before a million views,147,17,Xiverson P.,ynuFEc_Zg5I,0.0,2018-10-05 23:00:38,True,True
2018-10-05T23:01:39,"Yeah, lots and lots of love for Raditz. They freaking wiped him off of the main canon.",14,9,tawab ahmed,ynuFEc_Zg5I,0.3333333333333333,2018-10-05 23:01:39,True,True
2018-10-05T23:01:42,Loo,0,0,Iconic,ynuFEc_Zg5I,0.0,2018-10-05 23:01:42,True,True
2018-10-05T23:01:47,Aaaaaany second now,0,0,xwry1,ynuFEc_Zg5I,0.0,2018-10-05 23:01:47,True,True
2018-10-05T23:02:27,Over 300 likes before it even starts the dragon ball fandom is def one of he strongest out there!,38,0,TheChosenGamer,ynuFEc_Zg5I,0.0,2018-10-05 23:02:27,True,True
2018-10-05T23:04:03,WWWWWWWWWAAAAAAAAAAAAA,0,0,Cota KnG,ynuFEc_Zg5I,0.0,2018-10-05 23:04:03,True,True
2018-10-05T23:04:08,Beautiful,1,0,At Bz,ynuFEc_Zg5I,0.85,2018-10-05 23:04:08,True,True
2018-10-05T23:04:10,IWLLNOTLETYOUDESTROYMYWOOOOOOOOOOOOOOOOOOOOOOOOOOOOOOOOOOOOOOOOOOOOOOOORLLLLLLLLLLLLD,2,1,Corky316rulz,ynuFEc_Zg5I,0.0,2018-10-05 23:04:10,True,True
2018-10-05T23:04:17,Baby Broly>,8,0,Henry V,ynuFEc_Zg5I,0.0,2018-10-05 23:04:17,True,True
2018-10-05T23:04:21,I mean... it was cool and all but I'm just whelmed...,1,0,xwry1,ynuFEc_Zg5I,0.01874999999999999,2018-10-05 23:04:21,True,True
2018-10-05T23:04:22,Let’s break 11m views,3,0,Lightdtrex,ynuFEc_Zg5I,0.0,2018-10-05 23:04:22,True,True
2018-10-05T23:04:25,Sooooooo awesome!!!,0,0,ItsKillacam,ynuFEc_Zg5I,1.0,2018-10-05 23:04:25,True,True
2018-10-05T23:04:27,Bardocks voice is perfect,2,0,Sean,ynuFEc_Zg5I,1.0,2018-10-05 23:04:27,True,True
2018-10-05T23:04:34,Hype,2,0,Tommy Faust,ynuFEc_Zg5I,0.0,2018-10-05 23:04:34,True,True
2018-10-05T23:04:35,"Absolutely awesome, making me care about broly is no easy feat",0,0,Wolfsbaine101,ynuFEc_Zg5I,0.39166666666666666,2018-10-05 23:04:35,True,True
2018-10-05T23:04:37,This one hits right in the feels.....,0,0,king_of_kings54,ynuFEc_Zg5I,0.2857142857142857,2018-10-05 23:04:37,True,True
2018-10-05T23:04:39,So your telling me that vegeta is the same age as goku now?,56,48,Edwin Ruiz,ynuFEc_Zg5I,0.0,2018-10-05 23:04:39,True,True
2018-10-05T23:04:44,Let go for 15M views ladies and Gentlemen!,1,1,SHAD,ynuFEc_Zg5I,0.0,2018-10-05 23:04:44,True,True
2018-10-05T23:04:44,Nice,1,0,#AMc21光闇,ynuFEc_Zg5I,0.6,2018-10-05 23:04:44,True,True
2018-10-05T23:04:47,That was lit!,0,0,Marlon Vinza,ynuFEc_Zg5I,0.0,2018-10-05 23:04:47,True,True
2018-10-05T23:04:54,AYYYYYEEEE that was dope,2752,32,Rhymestyle,ynuFEc_Zg5I,0.0,2018-10-05 23:04:54,True,True
2018-10-05T23:05:02,"*Frieza's original pink design revealed for the movie* Frieza: ""Well what do you think of this color? Is it not beautiful?""",15,3,Some Guy Down the Street,ynuFEc_Zg5I,-0.04999999999999999,2018-10-05 23:05:02,True,True
2018-10-05T23:05:02,*MY BOY BARDOCK IS NOW A BRILLIANT SCIENTIST*,1074,53,C. Who Dat,ynuFEc_Zg5I,0.9,2018-10-05 23:05:02,True,True
2018-10-05T23:05:13,oh boy....now the real DB community civil war began. non-stop theories and discussions left and right~ (as if there weren't enough) this is gonna be a bloodshed. welp....i'm crying blood now.. :'D,59,8,RedoLane,ynuFEc_Zg5I,0.05714285714285714,2018-10-05 23:05:13,True,True
2018-10-05T23:05:17,That was crazy!,2,0,Hector Morones,ynuFEc_Zg5I,-0.75,2018-10-05 23:05:17,True,True
2018-10-05T23:05:25,so that was ummm....... HYPE!!!,0,0,CGZ [FGC],ynuFEc_Zg5I,0.0,2018-10-05 23:05:25,True,True
2018-10-05T23:05:26,they changed Freeza voice huh?,1,5,Pao Azul,ynuFEc_Zg5I,0.0,2018-10-05 23:05:26,True,True
2018-10-05T23:05:39,YAY GINE AND BARDOCK!!!,6,0,AlexFlame116,ynuFEc_Zg5I,0.0,2018-10-05 23:05:39,True,True
2018-10-05T23:05:44,Super Saiyan Blue Gogeta 💙,25,6,David Munoz,ynuFEc_Zg5I,0.16666666666666666,2018-10-05 23:05:44,True,True
2018-10-05T23:06:05,0:59 Goosebumps!! I'm so excited!,73,0,Noren,ynuFEc_Zg5I,0.46875,2018-10-05 23:06:05,True,True
2018-10-05T23:06:13,First lawl,64,5,Totally Not Mark,ynuFEc_Zg5I,0.25,2018-10-05 23:06:13,True,True
2018-10-05T23:06:20,This looks to be the emotional story Dragon Ball needs.  I love DBS but it lacks the heart of DB and Z.  This movie seems to bring that back.,447,23,Ade117,ynuFEc_Zg5I,0.16666666666666666,2018-10-05 23:06:20,True,True
2018-10-05T23:06:27,"Is any one else confused? I though Goku was supposed to be sent to earth to destroy earth, not to save him from the destruction of planet Vegeta. This conflicts with the reason his brother came to earth in the first place!!!",12,11,Tata's Vids,ynuFEc_Zg5I,-0.03723958333333336,2018-10-05 23:06:27,True,True
2018-10-05T23:06:59,Here before it becomes one of top 15 most watched IGN videos.,1,0,Super Saiyan Blue SSD,ynuFEc_Zg5I,0.5,2018-10-05 23:06:59,True,True
2018-10-05T23:07:08,Even Bardocks voice makes him sound like a loving dad...,48,1,Future Trunks,ynuFEc_Zg5I,0.5,2018-10-05 23:07:08,True,True
2018-10-05T23:07:14,At the end of the day the day is over.,1,0,Jack InTheBox,ynuFEc_Zg5I,0.0,2018-10-05 23:07:14,True,True
2018-10-05T23:07:18,Wtf They turned Bardock into Jor-El?,0,0,Spider-Zero,ynuFEc_Zg5I,-0.5,2018-10-05 23:07:18,True,True
2018-10-05T23:07:22,I'm rock hard for the English dub.,530,16,Jstacks Awesome,ynuFEc_Zg5I,-0.14583333333333334,2018-10-05 23:07:22,True,True
2018-10-05T23:07:33,Hopefully Minus can actually be made into an interesting story this time around.,0,0,Gokou Blacc,ynuFEc_Zg5I,0.13333333333333333,2018-10-05 23:07:33,True,True
2018-10-05T23:07:43,0:13  amazing delivery by Chris Ayres 😂,12,4,Kʏᴇʟᴇɪ Aɴᴅᴇʀsᴏɴ,ynuFEc_Zg5I,0.6000000000000001,2018-10-05 23:07:43,True,True
2018-10-05T23:07:45,One word = SUBARASHII! (Let's smash 20 mil views this time),788,12,Kame,ynuFEc_Zg5I,0.0,2018-10-05 23:07:45,True,True
2018-10-05T23:08:23,Yup,0,0,GuatemalanLaser,ynuFEc_Zg5I,0.0,2018-10-05 23:08:23,True,True
2018-10-05T23:08:25,Day 1 buy on blu ray,15,0,{LWA}fortyX battousai,ynuFEc_Zg5I,0.0,2018-10-05 23:08:25,True,True
2018-10-05T23:08:26,Kool,0,0,Johnnyblack3 Reviews,ynuFEc_Zg5I,0.0,2018-10-05 23:08:26,True,True
2018-10-05T23:08:27,either frieza drank to much  rosè or he’s young and hasn’t aged enough to turn white yet,4,5,Lightdtrex,ynuFEc_Zg5I,0.04000000000000001,2018-10-05 23:08:27,True,True
2018-10-05T23:08:30,Hype levels are MAXIMUMERRRRR,1,0,Mr. Ultimate,ynuFEc_Zg5I,0.0,2018-10-05 23:08:30,True,True
2018-10-05T23:08:37,CAN WE GET THIS ON TRENDING GUYS!?,1,1,Some Guy Down the Street,ynuFEc_Zg5I,0.0,2018-10-05 23:08:37,True,True
2018-10-05T23:08:37,"""THREE SAIYANS BORN AROUND THE SAME TIME""  GOKU, VEGETA, & BROLY ARE *TRIPLETS*?!?!?!",3,3,Joshua Lowe,ynuFEc_Zg5I,0.0,2018-10-05 23:08:37,True,True
2018-10-05T23:08:50,Frieza has once again been showcased. How will Broly fight against the Z-fighters? And will Yamcha die once again? The answers to these questions will be revealed…     *Next time on Dragon Ball Super: Broly*,330,7,Mr.banana 2000,ynuFEc_Zg5I,0.16666666666666666,2018-10-05 23:08:50,True,True
2018-10-05T23:09:03,PARAGUS GIVIN ME GOOSEBUMPS GODDAYUM.,0,0,a K n,ynuFEc_Zg5I,0.0,2018-10-05 23:09:03,True,True
2018-10-05T23:10:08,Ayyyy huge muscles are back,0,0,General Grievous,ynuFEc_Zg5I,0.20000000000000004,2018-10-05 23:10:08,True,True
2018-10-05T23:10:12,0:30-0:33 King Vegeta sounds amazing!!,0,0,Joshua Lowe,ynuFEc_Zg5I,0.9375000000000001,2018-10-05 23:10:12,True,True
2018-10-05T23:10:13,Sins of the father come to the son.,0,0,Final Phantasma,ynuFEc_Zg5I,0.0,2018-10-05 23:10:13,True,True
2018-10-05T23:10:34,Dragon ball super IT's My life <3,7,3,info yassine,ynuFEc_Zg5I,0.6666666666666666,2018-10-05 23:10:34,True,True
2018-10-05T23:10:43,Who you got bros? Broly here. Now's his time to shine.,2,2,Throneintheocean,ynuFEc_Zg5I,0.0,2018-10-05 23:10:43,True,True
2018-10-05T23:11:02,Dragon Ball: the most popular and transcended anime in the entire world.,14,7,Michael Everett,ynuFEc_Zg5I,0.3666666666666667,2018-10-05 23:11:02,True,True
2018-10-05T23:11:30,sweeeeeeeeeeeeeeeeeeeeeeeeeeeeeeet,0,0,Killingglorie,ynuFEc_Zg5I,0.0,2018-10-05 23:11:30,True,True
2018-10-05T23:11:35,0:37-0:40 Paragus sounds PHENOMENAL!!!!  Oh wait......we ALREADY heard Paragus' voice!😄😄,389,14,Joshua Lowe,ynuFEc_Zg5I,1.0,2018-10-05 23:11:35,True,True
2018-10-05T23:11:41,I can't wait to see who they cast as Gine.,0,0,CometX-ing,ynuFEc_Zg5I,0.0,2018-10-05 23:11:41,True,True
2018-10-05T23:12:01,great video keep up the stuff,7,0,LispyLeaf,ynuFEc_Zg5I,0.8,2018-10-05 23:12:01,True,True
2018-10-05T23:12:07,So goku wasn’t sent to Earth as a baby anymore?,0,3,Miguel,ynuFEc_Zg5I,0.0,2018-10-05 23:12:07,True,True
2018-10-05T23:12:18,0:43-0:45 Paragus sounds the same as his old 90s NON CANON counterpart.....,6,4,Joshua Lowe,ynuFEc_Zg5I,0.05,2018-10-05 23:12:18,True,True
2018-10-05T23:12:19,I still can't get used to this new art style,3,5,Coop,ynuFEc_Zg5I,0.13636363636363635,2018-10-05 23:12:19,True,True
2018-10-05T23:12:58,Hell yeah,1,0,M R B A T S - H E N T A I,ynuFEc_Zg5I,0.0,2018-10-05 23:12:58,True,True
2018-10-05T23:13:23,This is dumb.,0,1,Mr. Nunuisance,ynuFEc_Zg5I,-0.375,2018-10-05 23:13:23,True,True
2018-10-05T23:14:01,Dope AF!!!!!!!!!!!,1,0,•A L E X •,ynuFEc_Zg5I,0.0,2018-10-05 23:14:01,True,True
2018-10-05T23:14:01,Want cooler canon too :(,5,8,ZERO CASH,ynuFEc_Zg5I,-0.75,2018-10-05 23:14:01,True,True
2018-10-05T23:14:12,I'm getting turn on,0,0,SpikeTheWolf,ynuFEc_Zg5I,0.0,2018-10-05 23:14:12,True,True
2018-10-05T23:14:47,Freeza gave himself one job...,0,0,David Wilson,ynuFEc_Zg5I,0.0,2018-10-05 23:14:47,True,True
2018-10-05T23:14:48,Lol put playback .25 at 0:11,0,0,Jose Gonzalez,ynuFEc_Zg5I,0.8,2018-10-05 23:14:48,True,True
2018-10-05T23:14:54,King vegeta was very proud of his son.,3,0,Jonathan Pr,ynuFEc_Zg5I,1.0,2018-10-05 23:14:54,True,True
2018-10-05T23:15:01,My theater better play this movie🙄,0,1,Ghetto Lisa,ynuFEc_Zg5I,0.5,2018-10-05 23:15:01,True,True
2018-10-05T23:15:36,im so excited,0,0,Reframed,ynuFEc_Zg5I,0.375,2018-10-05 23:15:36,True,True
2018-10-05T23:15:58,"Welp, time to break the replay button.",0,0,Some Guy Down the Street,ynuFEc_Zg5I,0.0,2018-10-05 23:15:58,True,True
2018-10-05T23:16:02,Is no one going to talk about Goku's mom (Gine) being finally animated?!,1,2,Anime Hero,ynuFEc_Zg5I,0.0,2018-10-05 23:16:02,True,True
2018-10-05T23:16:12,I prefer the Japanese.,0,0,Jeremy Cook,ynuFEc_Zg5I,0.0,2018-10-05 23:16:12,True,True
2018-10-05T23:17:38,Amazing trailer!,0,0,Andrew Leonard,ynuFEc_Zg5I,0.7500000000000001,2018-10-05 23:17:38,True,True
2018-10-05T23:17:42,Idgaf that they retconned some stuff this is all worth it!,1,1,Harak Mapping,ynuFEc_Zg5I,0.375,2018-10-05 23:17:42,True,True
2018-10-05T23:17:51,Let’s go ahhh,0,0,T Holton Art,ynuFEc_Zg5I,0.0,2018-10-05 23:17:51,True,True
2018-10-05T23:17:54,Can't for it I'm glad it's going to the past but man that sad in beginning,0,0,Anthony Garland,ynuFEc_Zg5I,-0.08333333333333333,2018-10-05 23:17:54,True,True
2018-10-05T23:17:55,I can't wait.,0,0,HALO20601,ynuFEc_Zg5I,0.0,2018-10-05 23:17:55,True,True
2018-10-05T23:17:59,"Wait, we've seen Frieza without his battle armor in his first form before, and his torso was white. Maybe this is an early stage of his Bio-Suit?",1,1,Jimmy Campbell,ynuFEc_Zg5I,0.11666666666666665,2018-10-05 23:17:59,True,True
2018-10-05T23:18:08,That was dope I just want to see it 😮,0,0,Zachary Morales,ynuFEc_Zg5I,0.0,2018-10-05 23:18:08,True,True
2018-10-05T23:18:33,"OMG BABY GOKU, VEGETA, AND BROLY ARE TOO CUTE!!!",42,0,321GameTime,ynuFEc_Zg5I,0.9765625,2018-10-05 23:18:33,True,True
2018-10-05T23:19:49,This movie will literally change the Dragon ball universe as we know it...and I love it,0,0,-MuttyBX -,ynuFEc_Zg5I,0.5,2018-10-05 23:19:49,True,True
2018-10-05T23:20:15,LIT,0,0,Farhan,ynuFEc_Zg5I,0.0,2018-10-05 23:20:15,True,True
2018-10-05T23:20:52,"Vegeta, what does the scouter say about its hype level!?",1,0,Mr. GameCrazy,ynuFEc_Zg5I,0.0,2018-10-05 23:20:52,True,True
2018-10-05T23:21:19,They should have at least given Bardock his iconic armor and have him charge freeza but what can you do? Still going to prefer the Bardock special,0,1,Mr Poofey,ynuFEc_Zg5I,0.18571428571428572,2018-10-05 23:21:19,True,True
2018-10-05T23:21:58,Seeing Captain Ginyu and King Cold again makes me happy inside.,1,0,Ade117,ynuFEc_Zg5I,0.10000000000000003,2018-10-05 23:21:58,True,True
2018-10-05T23:22:11,😎😎😎😍😍😍😍😍😎,0,0,celestial anjos,ynuFEc_Zg5I,0.0,2018-10-05 23:22:11,True,True
2018-10-05T23:22:26,"My son,the planet,or me?",0,0,PokemonTheFan 321456,ynuFEc_Zg5I,0.0,2018-10-05 23:22:26,True,True
2018-10-05T23:22:35,"It's awesome how the Saiyan homeworld, it's destruction and sending away of Goku, Vegeta and Broly parallel Superman, Supergirl and Krypton. Vegetas father reminds me of Zod ha. This looks awesome.",0,2,John Mooney,ynuFEc_Zg5I,0.6666666666666666,2018-10-05 23:22:35,True,True
2018-10-05T23:22:43,"So...Goku technically isn’t a baby in the official OG Dragon Ball canon when he gets sent to Earth from Planet Vegeta, and Grandpa Gohan finds him? Plus, Vegeta isn’t older than Goku anymore?! 🤯   All of that aside, the animation style for this movie is absolutely 🔥",0,1,PHXNTXM,ynuFEc_Zg5I,0.1361111111111111,2018-10-05 23:22:43,True,True
2018-10-05T23:22:57,"1:01  db is very inconsistent. Why are they changing the origins of goku? Didn't he not come to earth as a baby why's he a little kid in the trailer crying after his parents? Also isn't vegeta a few years older then goku, I remember the old dbz episodes vegeta was already a kid whilst goku was a baby inside those contaminants? I Also assume this is in continuity with the db series, so why change the origins?",0,5,Huey Freeman,ynuFEc_Zg5I,-0.02013888888888889,2018-10-05 23:22:57,True,True
2018-10-05T23:23:03,DRAGON BALL IS AN AWSOME ANIME!!!,0,0,HyperGamer,ynuFEc_Zg5I,0.0,2018-10-05 23:23:03,True,True
2018-10-05T23:23:07,Can't wait till this movie drops. Still don't like the fact that the ORIGINAL OG BARDOCK has been retconned. I hate that DB minus crap.,2,1,Instantkill,ynuFEc_Zg5I,-0.33125000000000004,2018-10-05 23:23:07,True,True
2018-10-05T23:23:35,I need Dragon Ball Super: Bardock revived  i want to see Goku meet Bardock real canon not fanfic,0,2,Dr Frank,ynuFEc_Zg5I,0.26666666666666666,2018-10-05 23:23:35,True,True
2018-10-05T23:23:41,Who's voicing King Cold and King Vegeta? It sounds like Christopher Sabat but I'm not sure.,0,1,Dawson Eccles,ynuFEc_Zg5I,-0.425,2018-10-05 23:23:41,True,True
2018-10-05T23:23:42,So no knife through baby Brolly's belly interesting.,0,0,strongforce79,ynuFEc_Zg5I,0.5,2018-10-05 23:23:42,True,True
2018-10-05T23:24:17,NOW THIS IS EPIC,0,0,noone,ynuFEc_Zg5I,0.1,2018-10-05 23:24:17,True,True
2018-10-05T23:24:24,did anyone else get a super man feel with the baby goku scene?,0,1,walkingemp,ynuFEc_Zg5I,0.3333333333333333,2018-10-05 23:24:24,True,True
2018-10-05T23:24:32,Vegeta Supposed to be 5 years older than Goku wtf,0,3,Qwency Valentino,ynuFEc_Zg5I,-0.16666666666666669,2018-10-05 23:24:32,True,True
2018-10-05T23:24:59,That shot of Super Saiyan Vegeta is the first time this century that Super Saiyan has looked as cool as it did back in the Z era.,550,18,Gflipnitz Blruiken,ynuFEc_Zg5I,0.2533333333333333,2018-10-05 23:24:59,True,True
2018-10-05T23:25:06,Finally after 9000 Years.....,2,1,The CVR123,ynuFEc_Zg5I,0.0,2018-10-05 23:25:06,True,True
2018-10-05T23:25:32,Is Chris Ayres back?,2,1,joshuaha12,ynuFEc_Zg5I,0.0,2018-10-05 23:25:32,True,True
2018-10-05T23:25:34,I wish broly was more utilised in the tv episode would of been a great ally,0,0,big-bro-LITTLE-BRO,ynuFEc_Zg5I,0.65,2018-10-05 23:25:34,True,True
2018-10-05T23:25:48,jaxblade where ya at,0,0,glayshur,ynuFEc_Zg5I,0.0,2018-10-05 23:25:48,True,True
2018-10-05T23:25:50,"this is gunna be so fire, but so many questions are now raised from how things were protrayed prior to this for example, wasnt vegeta like 6-8 years older than goku lmao but now they're both infants",0,1,Rushmeed,ynuFEc_Zg5I,0.31666666666666665,2018-10-05 23:25:50,True,True
2018-10-05T23:25:59,What a throw back! Thank you Funimation!,0,0,UltraGamer,ynuFEc_Zg5I,0.0,2018-10-05 23:25:59,True,True
2018-10-05T23:26:01,I love this art style,0,0,The Otaku Padawan,ynuFEc_Zg5I,0.5,2018-10-05 23:26:01,True,True
2018-10-05T23:26:16,I felt the hair on my back raise,0,0,Collin,ynuFEc_Zg5I,0.0,2018-10-05 23:26:16,True,True
2018-10-05T23:26:20,Paragus sounded so godly while angry Damn Great voice actor,0,0,geo 23,ynuFEc_Zg5I,0.15000000000000002,2018-10-05 23:26:20,True,True
2018-10-05T23:26:25,Maybe the older saiyan in the pod is a young raditz since goku was a baby at the time,0,0,Heavily Armed Easily Pissed,ynuFEc_Zg5I,0.13333333333333333,2018-10-05 23:26:25,True,True
2018-10-05T23:26:33,January?! That's bad movie month.,0,1,TheHardMode,ynuFEc_Zg5I,-0.6999999999999998,2018-10-05 23:26:33,True,True
2018-10-05T23:26:34,0:33 so GT is canon now?,1,2,Lyserg1260,ynuFEc_Zg5I,0.0,2018-10-05 23:26:34,True,True
2018-10-05T23:26:58,Beautiful trailer!! I am so hyped for the movie!!,0,0,Saiyan TCG,ynuFEc_Zg5I,1.0,2018-10-05 23:26:58,True,True
2018-10-05T23:27:03,"I saw Battle of Gods and Resurrection F in theaters, there is no way I am missing this.",4,1,keybladeoverlord,ynuFEc_Zg5I,-0.2,2018-10-05 23:27:03,True,True
2018-10-05T23:27:06,"Damn, King Vegeta sounds like a Knock off All Might",0,0,float,ynuFEc_Zg5I,0.0,2018-10-05 23:27:06,True,True
2018-10-05T23:27:18,Aww I was expecting Martin Piers Billany aka Littlekuriboh to voice a young frieza but I guess Chris Ayres will do,1,2,John Wills,ynuFEc_Zg5I,0.2,2018-10-05 23:27:18,True,True
2018-10-05T23:27:19,Sub to me if you like dbz and fortnite,0,0,WydJordan,ynuFEc_Zg5I,0.0,2018-10-05 23:27:19,True,True
2018-10-05T23:27:29,Get hyped!!!,0,0,Steve,ynuFEc_Zg5I,0.0,2018-10-05 23:27:29,True,True
2018-10-05T23:27:34,Frieza bought that Buu dlc skin pack,2,0,Saturday2015,ynuFEc_Zg5I,0.0,2018-10-05 23:27:34,True,True
2018-10-05T23:27:35,If you read Minus you clearly know Vegeta is older.,47,9,joshuaha12,ynuFEc_Zg5I,0.05555555555555556,2018-10-05 23:27:35,True,True
2018-10-05T23:27:52,"It occurs to me that a lot to you guys only watched the anime and don't know anything about the actual story of dragon ball so allow me to educate you.   1. Goku was NEVER shown as a toddler or infant, so this isn't changing anything. You not realizing that filler was never canon doesn't make Akira wrong. We get an explanation from master Roshi, but we don't see goku as an infant at all.   2. Akira wrote a manga explaining the actual story of Bardock, Gine, and the saiyans and how goku was sent off, called dragon ball minus. In minus, we see everything thay we saw in the trailer, besides vegeta being in a pod. The only thing “retcon” the movies and Bardock special, both of which aren't even canon to begin with so it doesn't even matter. Since the movies and oneshots weren't even canonical to begin with, this doesn't actually contradict anything, since the things you're claiming this contradicts weren't even his work and were never part of the canon from the start. And yes, you could argue that goku was a baby when he was that age.   3. If you read the minus, Bardock and Gine decide to tell raditz the real reason for sending off Goku but as we know, freeza destroyed planet Vegeta soon after while raditz was away. So raditz didn't know and believed what freeza and his henchmen told him, which was that planet vegeta was destroyed by a meteor. That's why he comes to earth not knowing the real reason in the first place. That's why in the start of dbz he asks Goku why he didn't complete the mission simply because he was still loyal to the freeza force and believed their version of the story. They show him with vegeta while off planet when the attack begins. So once again, not retconned  Only takes a little bit of research guys.",199,47,Goku Black,ynuFEc_Zg5I,0.02516534391534391,2018-10-05 23:27:52,True,True
2018-10-05T23:27:54,"1:00 it sounds like bardock says ""you do what it takes to survives) with an S at the end id that an error or is it just me?",1,1,Depressed Spartan,ynuFEc_Zg5I,0.0,2018-10-05 23:27:54,True,True
2018-10-05T23:27:54,( ͡° ͜ʖ ͡°),0,0,Mr Popo,ynuFEc_Zg5I,0.0,2018-10-05 23:27:54,True,True
2018-10-05T23:27:56,00:44 Baby Broly :D 😍😍😍,5,1,Aurang,ynuFEc_Zg5I,1.0,2018-10-05 23:27:56,True,True
2018-10-05T23:28:04,😂😂😂😂😂😂😂😂,0,0,Tomisin Olusodo,ynuFEc_Zg5I,0.0,2018-10-05 23:28:04,True,True
2018-10-05T23:28:05,I wonder if Bardock and Gine care this much about Raditz?,465,32,Skyrogue19,ynuFEc_Zg5I,0.2,2018-10-05 23:28:05,True,True
2018-10-05T23:28:20,I can't wait!! That Vegeta Scene look freaking Amazing!,0,0,Francisco Valenzuela,ynuFEc_Zg5I,0.7500000000000001,2018-10-05 23:28:20,True,True
2018-10-05T23:28:35,Is this Chris Aryes,0,0,Bryan Rivero,ynuFEc_Zg5I,0.0,2018-10-05 23:28:35,True,True
2018-10-05T23:28:40,"Canon, the movie!",6,2,lenguy45,ynuFEc_Zg5I,0.0,2018-10-05 23:28:40,True,True
2018-10-05T23:28:45,Your gonna enjoy this ....WHAT YOUR SEEING NOW IS MY NORMAL STATE @_@,0,0,xDa831Reaperx,ynuFEc_Zg5I,0.275,2018-10-05 23:28:45,True,True
2018-10-05T23:28:59,I wanna see Tarble,5,0,Frosted Skittles,ynuFEc_Zg5I,0.0,2018-10-05 23:28:59,True,True
2018-10-05T23:29:01,Doooope,0,0,Retard Toad,ynuFEc_Zg5I,0.0,2018-10-05 23:29:01,True,True
2018-10-05T23:29:10,When Broly,0,0,Mr Drake,ynuFEc_Zg5I,0.0,2018-10-05 23:29:10,True,True
2018-10-05T23:29:13,"Vegeta is like 5 years older than Goku... but I suppose that's ""around the same time""?",0,2,StuBaloo,ynuFEc_Zg5I,0.08333333333333333,2018-10-05 23:29:13,True,True
2018-10-05T23:29:14,Kal L leaving Krypton. Dragon Ball version.,0,0,Flores William,ynuFEc_Zg5I,0.0,2018-10-05 23:29:14,True,True
2018-10-05T23:29:15,I still don't like the back story.. toriyama has ruined it badly in my opinion.. the BARDOCK special should of been kept in and retold not re written..  and goku being sent to earth at that age isn't right also as he was a baby when he landed on earth and was found by grandpa gohan,1,4,J R,ynuFEc_Zg5I,-0.014285714285714249,2018-10-05 23:29:15,True,True
2018-10-05T23:29:22,Goku's mom is hella cute.,0,0,N14,ynuFEc_Zg5I,0.5,2018-10-05 23:29:22,True,True
2018-10-05T23:29:28,Back in my day every DBZ episode had that animation quality.,1,4,Aurang,ynuFEc_Zg5I,0.0,2018-10-05 23:29:28,True,True
2018-10-05T23:29:29,Imagine if in the next trailer : Paragus : No one in this world can defeat Broly! *movie logo appears* Gogeta Blue : I’m not so sure about that.,21,9,That Man Was The Ryback,ynuFEc_Zg5I,0.16666666666666666,2018-10-05 23:29:29,True,True
2018-10-05T23:29:39,Yesss an english,0,0,Calum Smith,ynuFEc_Zg5I,0.0,2018-10-05 23:29:39,True,True
2018-10-05T23:31:01,"Looks great, but they’re retconning a lot of DBZ",0,2,Impossibilities Films,ynuFEc_Zg5I,0.8,2018-10-05 23:31:01,True,True
2018-10-05T23:31:05,Dragon Ball Super Movie Hype! Let's get this on the fuckin trending page!,1,0,Tatsuo Static,ynuFEc_Zg5I,0.5208333333333333,2018-10-05 23:31:05,True,True
2018-10-05T23:31:09,"Every time I see this trailer, sometimes i think FRIEZA is actually the big bad of this movie and not BROLY.",409,16,Joshua Lowe,ynuFEc_Zg5I,-0.23333333333333328,2018-10-05 23:31:09,True,True
2018-10-05T23:31:16,Is Chris Ayres going to voice Frieza this time or no?,0,1,Downyfabricsoftener,ynuFEc_Zg5I,0.0,2018-10-05 23:31:16,True,True
