timestamp,text,like_count,reply_count,author,trailer_id,sentiment_score,datetime,used_for_model,used_for_visualization
2018-10-07T15:31:38,I hope this movie doesn't completely cut off everything we already knew from Bardock the Father of Goku or even worse just completely cut out raditz or not even mention him,0,0,Hopp4_Top,ynuFEc_Zg5I,-0.06666666666666668,2018-10-07 15:31:38,True,True
2018-10-07T15:32:13,Is this going to be the greatest db movie ever made???yes it will that trailer already is better than dbs,0,0,Marlin,ynuFEc_Zg5I,0.75,2018-10-07 15:32:13,True,True
2018-10-07T15:33:49,"Hang on... Vegeta's supposed to be older than Goku. He was old enough to have already been going on missions to conquer planets by the time Frieza blew up the planet. How can he possibly have been a baby as the same time as Goku? Toriyama, why must you keep retconning things?",0,0,mdudegamer,ynuFEc_Zg5I,0.05333333333333333,2018-10-07 15:33:49,True,True
2018-10-07T15:36:07,Toriyama is most likely to forget a few characters and plot points from the original series. This movie might be missing a few points bc he has bad memory. Toriyama has said it in an interview that he has some symptom. Hopefully his editors help him out. Like that time where he forgot to give Gotenks a SSJ2 bc he forgot there was a SSJ2. And Vegeta becoming SSJ Blue without getting to SSJ3 or SSJRed.,8,5,Mista _Mask,ynuFEc_Zg5I,0.0027777777777777987,2018-10-07 15:36:07,True,True
2018-10-07T15:38:33,Well......that baby grandpa Gohan found.....,0,0,DaAngeleeze,ynuFEc_Zg5I,0.0,2018-10-07 15:38:33,True,True
2018-10-07T15:39:46,Fuckin right,0,0,Mental Alchemist,ynuFEc_Zg5I,0.2857142857142857,2018-10-07 15:39:46,True,True
2018-10-07T15:51:17,I prefer the Japanese version,0,0,Colin Talukdar,ynuFEc_Zg5I,0.0,2018-10-07 15:51:17,True,True
2018-10-07T15:52:53,"i hope broly keeps on saying ""KAKAROOOOOOOOOOOOOOOOOOOOOOOOTTTTTTTTTTTT",0,0,Ronald Castro,ynuFEc_Zg5I,0.0,2018-10-07 15:52:53,True,True
2018-10-07T15:53:40,T-the likes     They are over 9000!,0,0,Meem Ain,ynuFEc_Zg5I,0.0,2018-10-07 15:53:40,True,True
2018-10-07T15:54:35,340 naruto fans pissed off,0,0,Meem Ain,ynuFEc_Zg5I,0.0,2018-10-07 15:54:35,True,True
2018-10-07T15:57:04,"Bardock looks to be a combination of db minus and the special, nice!",0,0,Jammy Nugget,ynuFEc_Zg5I,0.3357142857142857,2018-10-07 15:57:04,True,True
2018-10-07T15:57:08,Neat,0,0,Jammy Nugget,ynuFEc_Zg5I,0.0,2018-10-07 15:57:08,True,True
2018-10-07T15:59:56,It’s going to be epic!,0,0,TheBoyWhoHad7 Talks Comic Books,ynuFEc_Zg5I,0.125,2018-10-07 15:59:56,True,True
2018-10-07T16:07:35,Why goku isnt a baby?  In the original Dragon ball anime and manga he has. Retcon?,0,2,Osiris Ruiz,ynuFEc_Zg5I,0.375,2018-10-07 16:07:35,True,True
2018-10-07T16:12:07,"I am so disappointed yet excited for this... disappointed because it changes so many things about the things we already knew about Goku and Vegeta’s past and the entire series as a whole. Thing is, this movie is even canon which makes things so much more complicated...",0,0,AeroClan17,ynuFEc_Zg5I,-0.07500000000000001,2018-10-07 16:12:07,True,True
2018-10-07T16:19:52,Finally they are using the RIGHT ANIMATION! It looks like old days DBZ! Thank you!,0,0,Oravankarva,ynuFEc_Zg5I,0.17113095238095236,2018-10-07 16:19:52,True,True
2018-10-07T16:22:39,Paragus' voice😍😍,0,0,Isaac Rivera,ynuFEc_Zg5I,0.0,2018-10-07 16:22:39,True,True
2018-10-07T16:23:32,Raditz will most likely just be older so he doesn’t need that much screen time just a small appearance of him would be fine even with Nappa.,0,0,Mina Hokage,ynuFEc_Zg5I,0.17222222222222225,2018-10-07 16:23:32,True,True
2018-10-07T16:24:16,LOL 😂🤣😅              *THREE SAIYANS* BORN AT AROUND THE SAME TIME,69,3,OH YEAH YEAH,ynuFEc_Zg5I,0.4,2018-10-07 16:24:16,True,True
2018-10-07T16:24:34,Why goku so old? He supposed to be a baby at this point.,0,0,Oravankarva,ynuFEc_Zg5I,0.1,2018-10-07 16:24:34,True,True
2018-10-07T16:29:52,The music and goku forced to leave his parents made me cry 😭,0,0,Excalibur Stone,ynuFEc_Zg5I,-0.30000000000000004,2018-10-07 16:29:52,True,True
2018-10-07T16:35:07,Goodbye pre established timeline,0,0,sabergx,ynuFEc_Zg5I,0.0,2018-10-07 16:35:07,True,True
2018-10-07T16:38:41,Am I the only one that didn’t know Goku was Vegeta we’re born at the same time 🤔,0,0,Demond Smith,ynuFEc_Zg5I,0.0,2018-10-07 16:38:41,True,True
2018-10-07T16:42:03,"Bruh if Broly was so strong, why didn’t King Vegeta keep him to destroy Frieza?",35,11,Step,ynuFEc_Zg5I,0.11666666666666664,2018-10-07 16:42:03,True,True
2018-10-07T16:45:58,I call it broly isn't going to die in this movie,3,0,Timothy Abdool,ynuFEc_Zg5I,0.0,2018-10-07 16:45:58,True,True
2018-10-07T16:46:08,wtf vegeta is actually older than Goku so how are they born around the same time,0,0,Jonathan Jimenez,ynuFEc_Zg5I,-0.11111111111111112,2018-10-07 16:46:08,True,True
2018-10-07T16:50:21,"I don't get it can s.o please explain, isn't vegeta older than both goku and broly, I do remember that while vegeta was a toddler goku was still a baby so and I do remember they said broly and Goku were born on the same day so, shouldn't broly and Goku be the same age and broly be older than the both of them????",0,0,Jonathan Jimenez,ynuFEc_Zg5I,0.08333333333333333,2018-10-07 16:50:21,True,True
2018-10-07T17:02:04,Isn't Vegeta like 5 years older than Goku?,0,0,link55555555,ynuFEc_Zg5I,0.16666666666666666,2018-10-07 17:02:04,True,True
2018-10-07T17:04:33,I can’t wait,0,0,Babacar Mbaye,ynuFEc_Zg5I,0.0,2018-10-07 17:04:33,True,True
2018-10-07T17:22:35,please likr this comment to built toilet in INDIA.... 1 like=1 toilet😂😂😂😃😃,0,0,al mahamud,ynuFEc_Zg5I,-0.03333333333333333,2018-10-07 17:22:35,True,True
2018-10-07T17:25:00,"If they're humanizing Broly this time around, I hope they don't kill him like a generic villain, he doesn't necessarily need to be an ally but he can live on his own elsewhere.",1,0,Leonel Guadarrama Flores,ynuFEc_Zg5I,0.18409090909090908,2018-10-07 17:25:00,True,True
2018-10-07T17:28:18,One word wtf ? That didn't happened man don't make this like super man story -_- bardoc died trying killong freezia he didn't send yet goku down to earth and his mother was all so dead if i remeber correctly in the movie is this trailer fake pls tell me it is,0,0,Son Goku,ynuFEc_Zg5I,-0.20444444444444448,2018-10-07 17:28:18,True,True
2018-10-07T17:50:03,The most dbz ish dbs can get,0,0,chris chandler,ynuFEc_Zg5I,0.5,2018-10-07 17:50:03,True,True
2018-10-07T17:59:44,Finally i saw gokus mother.,0,0,Hasan Siam,ynuFEc_Zg5I,0.0,2018-10-07 17:59:44,True,True
2018-10-07T17:59:56,They flipping the lore on it’s head...,0,0,Dakeous Woods,ynuFEc_Zg5I,0.0,2018-10-07 17:59:56,True,True
2018-10-07T18:02:21,YOYOYOOYOYOOYOYOYOYOYOYOYOOYOYOYOYOYOYOYOOYO THIS MOVIE GONNA BE SOOO LIIIT,0,0,Rae愛,ynuFEc_Zg5I,0.0,2018-10-07 18:02:21,True,True
2018-10-07T18:03:59,"When Frieza meets the saiyans for the first time, the line in the sub trailer is ""pleased to meet you"". This line suggests that Frieza was only recently manipulaed into destroying planet Vegeta and ruling over them and that Cold was the one who hated the saiyans, not Frieza. ""Hello monkeys"" makes it sound like it was Frieza who chose to rule the saiyans and destroy planet Vegeta on his own.",0,0,Zukka 88,ynuFEc_Zg5I,-0.015000000000000003,2018-10-07 18:03:59,True,True
2018-10-07T18:05:11,It's hard to accept that this is cannon(which it is). It's gonna a badass movie just small things eating at me that hopefully the movie will answer lol,0,0,Syd Carter,ynuFEc_Zg5I,0.0861111111111111,2018-10-07 18:05:11,True,True
2018-10-07T18:06:29,Man Of Steel Trailer looks great!,22,2,DCEU TV,ynuFEc_Zg5I,1.0,2018-10-07 18:06:29,True,True
2018-10-07T18:06:41,I wish we can get a movie about the history of the sayians,1,0,Yung activist,ynuFEc_Zg5I,0.0,2018-10-07 18:06:41,True,True
2018-10-07T18:10:45,Gine's animated debut is finally here! Really looking forward to watching this.,0,0,Cristian Garcia,ynuFEc_Zg5I,0.1,2018-10-07 18:10:45,True,True
2018-10-07T18:11:41,"1 Corinthians 15 Authorized (King James) Version (AKJV)  15 Moreover, brethren, I declare unto you the gospel which I preached unto you, which also ye have received, and wherein ye stand; 2 by which also ye are saved, if ye keep in memory what I preached unto you, unless ye have believed in vain. 3 For I delivered unto you first of all that which I also received, how that Christ died for our sins according to the scriptures; 4 and that he was buried, and that he rose again the third day according to the scriptures:",0,0,Taylor Hoge,ynuFEc_Zg5I,0.2833333333333333,2018-10-07 18:11:41,True,True
2018-10-07T18:13:10,0:59 DBS: Broly OST: Bardock's Legacy. (OST prediction),0,0,Domino TV,ynuFEc_Zg5I,0.0,2018-10-07 18:13:10,True,True
2018-10-07T18:16:36,Vegeta and goku where not born on the same time. Why do you guys change the story. The new creator has little knowledge of the original essence of dragon ball,0,0,sooraj viswam A K,ynuFEc_Zg5I,0.08096590909090909,2018-10-07 18:16:36,True,True
2018-10-07T18:18:53,I can finally die my life is COMPLETE,1,0,Zer0 Mort4l,ynuFEc_Zg5I,0.05,2018-10-07 18:18:53,True,True
2018-10-07T18:22:55,What if Broly after beerus maybe he knew who destroy planet saiyan,0,0,Jouseph Custodio,ynuFEc_Zg5I,-0.2,2018-10-07 18:22:55,True,True
2018-10-07T18:29:39,Did they just give Goku the Superman treatment??,0,0,FrozenHawaiian,ynuFEc_Zg5I,0.0,2018-10-07 18:29:39,True,True
2018-10-07T18:34:09,Bardock looks kindve lame I liked his old costume better and wtf vegeta was already like 5 when Goku was born,0,0,E Fig,ynuFEc_Zg5I,0.039999999999999994,2018-10-07 18:34:09,True,True
2018-10-07T18:36:57,Amazing,0,0,The Raul movie Fernandez,ynuFEc_Zg5I,0.6000000000000001,2018-10-07 18:36:57,True,True
2018-10-07T18:39:24,Wow a new back story for goku,0,0,The Great RB Ent,ynuFEc_Zg5I,0.07878787878787878,2018-10-07 18:39:24,True,True
2018-10-07T18:41:57,Why bardock aint out there when freza destroy his planet,0,0,Anthonie,ynuFEc_Zg5I,-0.2,2018-10-07 18:41:57,True,True
2018-10-07T18:47:08,So noooobody is going to say anything bout Goku and Vegeta born on the same day..... don't get me wrong this movie trailer looks fantastic.... but if you are real Dragon Ball Z fan you know damn well Vegeta is like 7 or 8 years older than Goku and it's in Canon when Planet Vegeta blew up Goku was shipped off as a baby and Vegeta was on another planet and was surrounded by all the dead aliens he killed when he heard about planet Vegeta blowing up,0,1,MrEricDash,ynuFEc_Zg5I,-0.019047619047619042,2018-10-07 18:47:08,True,True
2018-10-07T18:54:20,"The three last remaining saiyans, who will stand a top?",0,1,Darrius Jardine-Ramoutar,ynuFEc_Zg5I,0.25,2018-10-07 18:54:20,True,True
2018-10-07T18:57:08,So Vegeta hates Goku und Broly hates Vegata^^,0,0,SeZo PSN,ynuFEc_Zg5I,0.0,2018-10-07 18:57:08,True,True
2018-10-07T19:03:16,Anybody get the old feeling?,0,0,Only Harris,ynuFEc_Zg5I,0.1,2018-10-07 19:03:16,True,True
2018-10-07T19:07:24,I love the dragonball minus story this gonna be amazing,0,0,Wazzy,ynuFEc_Zg5I,0.3333333333333333,2018-10-07 19:07:24,True,True
2018-10-07T19:17:07,0:39 t pose.,0,0,Alesio K.C,ynuFEc_Zg5I,0.0,2018-10-07 19:17:07,True,True
2018-10-07T19:19:24,So Gine is canon now?,0,0,Alesio K.C,ynuFEc_Zg5I,0.0,2018-10-07 19:19:24,True,True
2018-10-07T19:24:32,No Sonny Straight as Bardock? :(,0,0,Paul F,ynuFEc_Zg5I,-0.275,2018-10-07 19:24:32,True,True
2018-10-07T19:28:36,Wait a minute how old is Frieza? It never struck me that he was that much older than Goku!,0,0,SmartestManAlyve,ynuFEc_Zg5I,0.15416666666666667,2018-10-07 19:28:36,True,True
2018-10-07T19:30:44,How long is the movie going to be,1,0,Mark Lezzy,ynuFEc_Zg5I,-0.05,2018-10-07 19:30:44,True,True
2018-10-07T19:30:51,Yyyeessss,0,0,Nano Pharaoh,ynuFEc_Zg5I,0.0,2018-10-07 19:30:51,True,True
2018-10-07T19:36:52,Origin of super goku man,0,0,yer da man,ynuFEc_Zg5I,0.3333333333333333,2018-10-07 19:36:52,True,True
2018-10-07T19:38:22,"Vegeta is around 4 years older, is this movie not-cannon?? And goku was sent as a baby, not a 3 years old child, am I right???",1,0,Hamza,ynuFEc_Zg5I,0.18412698412698414,2018-10-07 19:38:22,True,True
2018-10-07T19:44:54,Is it me or did King Vegeta's voice stay exactly the same?,0,0,Elijah Frederick,ynuFEc_Zg5I,0.125,2018-10-07 19:44:54,True,True
2018-10-07T19:52:38,Wow. Never seen anything like this. Epic,0,0,reiko brown,ynuFEc_Zg5I,0.1,2018-10-07 19:52:38,True,True
2018-10-07T19:54:36,Damn I didn't know Frieza and them had them saiyans bitched like that,0,0,YungGrey,ynuFEc_Zg5I,0.0,2018-10-07 19:54:36,True,True
2018-10-07T19:54:36,Long of Broly says Kakarot it's perfect,0,0,EXC x flames,ynuFEc_Zg5I,0.475,2018-10-07 19:54:36,True,True
2018-10-07T20:00:32,Vegeta isn't supposed to be older?,0,0,20 years old and still virgin as fuck,ynuFEc_Zg5I,0.16666666666666666,2018-10-07 20:00:32,True,True
2018-10-07T20:12:34,I’m gonna miss our bloodied bandana future vision berserker,1,0,Mike-Daddy,ynuFEc_Zg5I,0.0,2018-10-07 20:12:34,True,True
2018-10-07T20:12:58,I'm Fuckin hyped,0,0,Tony Gonzalez,ynuFEc_Zg5I,0.0,2018-10-07 20:12:58,True,True
2018-10-07T20:13:03,"Ign is losing subs You had 10,842,332 yesterday now you have 10,842,332 i took ss also didnt you guys have 11m?",0,0,Seeds,ynuFEc_Zg5I,0.0,2018-10-07 20:13:03,True,True
2018-10-07T20:18:44,U know a don't think I really like this version of bardock his older one is more BA,0,0,Matthew Buchanan,ynuFEc_Zg5I,0.2888888888888889,2018-10-07 20:18:44,True,True
2018-10-07T20:20:28,I would feel bad about frieza destroying their planet but Saiyans were just as cruel as freiza. I like how Goku's back story is now resembling Supermans. Now the real question is.................where is Frieza's home planet.,0,0,Black Spiderman,ynuFEc_Zg5I,-0.33999999999999997,2018-10-07 20:20:28,True,True
2018-10-07T20:22:10,1:00 how is Goku a kid like that if he arrived on Earth as a baby Wtf toryama,0,0,Tao,ynuFEc_Zg5I,-0.5,2018-10-07 20:22:10,True,True
2018-10-07T20:22:57,"Where is nappa , raditz and turtles, vegeta's mom??.",0,0,Ayush Saxena,ynuFEc_Zg5I,0.0,2018-10-07 20:22:57,True,True
2018-10-07T20:29:00,I have stopped myself from watching any trailers cuz I really hate spoilers. I know its going to be amazing.,0,0,Jose Barrera,ynuFEc_Zg5I,-0.09999999999999998,2018-10-07 20:29:00,True,True
2018-10-07T20:35:37,now we will all see this battle fight of legendary super saiyan broly vs goku and vegeta. but goku will come again in ultra instinct and vegeta will surpass in beyond power level we will see the battle to the finish the fight start in the beginning the fight also end.,0,0,shlok Chaturvedi,ynuFEc_Zg5I,0.6666666666666666,2018-10-07 20:35:37,True,True
2018-10-07T20:46:19,The theaters gonna *GO BEYOND* ultra instinct,0,0,Yamoshi,ynuFEc_Zg5I,0.0,2018-10-07 20:46:19,True,True
2018-10-07T20:47:53,Burdock was the Saiyan Elon musk,0,0,Freedom Talk,ynuFEc_Zg5I,0.0,2018-10-07 20:47:53,True,True
2018-10-07T20:48:23,Does this mean goku will remember where he came from?,0,0,devon ray,ynuFEc_Zg5I,-0.3125,2018-10-07 20:48:23,True,True
2018-10-07T21:02:12,Hopefully it’s in my theater anime movies are never in my theater,0,1,carls adventures,ynuFEc_Zg5I,0.0,2018-10-07 21:02:12,True,True
2018-10-07T21:08:58,I loved broly already from GT  No more “he aint canon” No more “bardock aint canon” This saiyan origin story must be the most wanted saiyan movie we all been waiting for,0,0,RAGE,ynuFEc_Zg5I,0.175,2018-10-07 21:08:58,True,True
2018-10-07T21:12:14,Video Out Now On My Channel🔥🔥🔥🔥,1,0,Bradzbaby,ynuFEc_Zg5I,0.0,2018-10-07 21:12:14,True,True
2018-10-07T21:14:03,I hope Toriyama didn’t forget Goku in this,0,0,The Need 80g,ynuFEc_Zg5I,0.0,2018-10-07 21:14:03,True,True
2018-10-07T21:19:11,Boy if they forget Raditz and Nappa im pissed...,0,0,Toner C.,ynuFEc_Zg5I,0.0,2018-10-07 21:19:11,True,True
2018-10-07T21:27:54,I hope this doesn’t reckon the bardock special 🤦🏾‍♂️,0,0,zmanzuesshnk123,ynuFEc_Zg5I,0.35714285714285715,2018-10-07 21:27:54,True,True
2018-10-07T21:30:19,1:19 strong Super Vegeta vibes from DBZ!,0,0,Daymon Rondino,ynuFEc_Zg5I,0.42499999999999993,2018-10-07 21:30:19,True,True
2018-10-07T21:55:53,Mfw they ruin the backstory of all the characters,0,0,Tommy Nava,ynuFEc_Zg5I,0.0,2018-10-07 21:55:53,True,True
2018-10-07T22:12:58,Everyone is  talking about Goku’s Mom but what about Vegeta’s?,0,0,Mr Drake,ynuFEc_Zg5I,0.0,2018-10-07 22:12:58,True,True
2018-10-07T22:43:23,"Hey look, it's George Tak..... I mean Zarbon",0,0,hydra dbz,ynuFEc_Zg5I,-0.3125,2018-10-07 22:43:23,True,True
2018-10-07T22:48:01,Whoa their finally gonna do the backstory proper.... GODSPEED Toriyama-san!,0,1,Gabriel Griffin,ynuFEc_Zg5I,0.0,2018-10-07 22:48:01,True,True
2018-10-07T23:04:44,Isn’t Vegeta older than Goku?,0,1,Nxmikazee,ynuFEc_Zg5I,0.16666666666666666,2018-10-07 23:04:44,True,True
2018-10-07T23:09:06,I'm a little confused. Paragus wants revenge because they sent his son away to another planet? Don't they send all Saiyan children away to conquer different planets?,0,1,Erik Schmunzeler,ynuFEc_Zg5I,-0.096875,2018-10-07 23:09:06,True,True
2018-10-07T23:14:46,My fellow dragonball enthusiasts I bring news! According to a japanese girl named rie who was in the latest buzzfeed worth it video GOHAN means RICE in japanese  So...RICE is PAN's dad  And I just blew your mind,0,0,Quirkless Weeb,ynuFEc_Zg5I,0.2,2018-10-07 23:14:46,True,True
2018-10-07T23:16:25,Bardock still better be as awesome and ruthless as he was in the special!!,0,1,Owain Davies,ynuFEc_Zg5I,0.2645089285714286,2018-10-07 23:16:25,True,True
2018-10-07T23:16:59,Movies gonna be epic af,0,0,Shamy Cartoons,ynuFEc_Zg5I,0.1,2018-10-07 23:16:59,True,True
2018-10-07T23:17:11,WAIT. BARDOCK IS CANON.,0,0,Levi Brennan,ynuFEc_Zg5I,0.0,2018-10-07 23:17:11,True,True
2018-10-07T23:24:23,Wait this is all wrong Vegeta was born 5-6 years before Goku,0,1,Desert Chrome,ynuFEc_Zg5I,-0.5,2018-10-07 23:24:23,True,True
2018-10-07T23:26:57,Isnt this the same as the other broly movie???,0,1,Red Khamelejoon,ynuFEc_Zg5I,-0.0625,2018-10-07 23:26:57,True,True
2018-10-07T23:26:58,Por qué Freezer es rojo,1,0,vegeta,ynuFEc_Zg5I,0.0,2018-10-07 23:26:58,True,True
2018-10-07T23:28:41,In super whis said Beerus order the hit on the planet wonder if they would show that,0,2,Az Finney,ynuFEc_Zg5I,0.3333333333333333,2018-10-07 23:28:41,True,True
2018-10-07T23:31:35,That's it I'm definetly gonna cry when I see this,1,1,J.C Events,ynuFEc_Zg5I,0.0,2018-10-07 23:31:35,True,True
2018-10-07T23:36:20,#brolydidnothingwrong,1,0,Tze_GhostRider 210,ynuFEc_Zg5I,0.0,2018-10-07 23:36:20,True,True
2018-10-07T23:37:19,Hold up why is Goku and Vegeta in a capsule?!,0,1,Tze_GhostRider 210,ynuFEc_Zg5I,0.0,2018-10-07 23:37:19,True,True
2018-10-07T23:38:15,the use of colour in this movie reminds me of saiyan saga dbz i love it,0,0,Rhys Clark Film & Media,ynuFEc_Zg5I,0.5,2018-10-07 23:38:15,True,True
2018-10-07T23:42:53,Will this include beer us and frieza discussing the destruction of the saiyan race? Will Goku and Vegeta learn the truth in this film? Will beer is finally become a villain in their eyes?,0,2,Ramon paz,ynuFEc_Zg5I,0.0,2018-10-07 23:42:53,True,True
2018-10-07T23:48:56,Stop milking dbz ffs,0,1,papi,ynuFEc_Zg5I,0.0,2018-10-07 23:48:56,True,True
2018-10-07T23:49:47,This movie looks amazing!,0,0,MuiGreatApes,ynuFEc_Zg5I,0.7500000000000001,2018-10-07 23:49:47,True,True
2018-10-08T00:18:11,At this point they might as well just reboot the entire series with all kinds of radical changes.,0,0,MolemanNineThousand,ynuFEc_Zg5I,0.0,2018-10-08 00:18:11,True,True
2018-10-08T00:32:37,"Wait, is this canon or not?",0,1,Kakaka kakaka,ynuFEc_Zg5I,0.0,2018-10-08 00:32:37,True,True
2018-10-08T00:37:50,When people saying the new paragus wears a skirt. Well king Vegeta is also wearing a skirt.,0,0,DaAngeleeze,ynuFEc_Zg5I,0.13636363636363635,2018-10-08 00:37:50,True,True
2018-10-08T00:38:54,Let's hope Toriyama didn't forget Gokus uncle Turles this time,0,0,Canon Theory,ynuFEc_Zg5I,0.0,2018-10-08 00:38:54,True,True
2018-10-08T00:52:39,What is this music? It's amazing!,1,0,Tyre Blackshire,ynuFEc_Zg5I,0.7500000000000001,2018-10-08 00:52:39,True,True
2018-10-08T00:52:50,At 0:57. The moment the music came in I was already in tears. Who's with me on this one.,0,1,J universe,ynuFEc_Zg5I,0.0,2018-10-08 00:52:50,True,True
2018-10-08T01:00:13,Vegeta's dad sounds like......................... ALL MIGHTUO!!!!!!! 😁😂😁,1,2,Dandre Skeet,ynuFEc_Zg5I,0.0,2018-10-08 01:00:13,True,True
2018-10-08T01:22:17,This might be the greatest anime movie ever,0,0,ArtOfWaveTv,ynuFEc_Zg5I,1.0,2018-10-08 01:22:17,True,True
2018-10-08T01:24:33,I thought vegeta was an adolescent by the time goku was born???,0,1,JP Prophete,ynuFEc_Zg5I,0.0,2018-10-08 01:24:33,True,True
2018-10-08T01:34:38,I miss bardock's old look. Y'know the red headband and green armour made him different from the other saiyans who mostly had the same design,0,0,Will Tanner,ynuFEc_Zg5I,0.03928571428571429,2018-10-08 01:34:38,True,True
2018-10-08T01:40:57,Is this a remake of the 1st movie?,0,0,ironkobe,ynuFEc_Zg5I,0.0,2018-10-08 01:40:57,True,True
2018-10-08T01:58:51,"You know, I think the Bardock Special can still be canon to an extent. In Dragon Ball Minus, if I remember correctly, Bardock sent Goku away 1 month before Frieza destroyed Planet Vegeta.   That's one whole month where Bardock can do his final stand. If they implement some story from Bardock Special, this new history will be better in my opinion.",0,0,Loxul,ynuFEc_Zg5I,0.20723562152133582,2018-10-08 01:58:51,True,True
2018-10-08T02:00:51,So in this movie are they making goku and vegeta the same age?,0,2,Sarcastic Shinigami,ynuFEc_Zg5I,0.0,2018-10-08 02:00:51,True,True
2018-10-08T02:08:57,i pray broly squares up with beerus,0,0,Earl Teller,ynuFEc_Zg5I,0.0,2018-10-08 02:08:57,True,True
2018-10-08T02:15:31,*_0:13_*,0,0,Joverly,ynuFEc_Zg5I,0.0,2018-10-08 02:15:31,True,True
2018-10-08T02:16:25,"I can't wait to see the movie and all, but it is just me or the history we all know is about to be s***ting on? Come on, wasn't any other way to continue the story we all known? More plot holes coming",0,0,Filipe Camarinha,ynuFEc_Zg5I,0.1875,2018-10-08 02:16:25,True,True
2018-10-08T02:31:07,Waitttt bardock aint even care 4 Goku why is he sending him off planet,0,1,Alllan Muc,ynuFEc_Zg5I,0.0,2018-10-08 02:31:07,True,True
2018-10-08T02:47:57,Why does King Cold sound so straight?,0,0,Assinine Syndrome,ynuFEc_Zg5I,1.850371707708594e-17,2018-10-08 02:47:57,True,True
2018-10-08T02:53:07,Are they retconning Goku's origin story too 1:00?,0,0,Jonah B,ynuFEc_Zg5I,0.0,2018-10-08 02:53:07,True,True
2018-10-08T03:00:44,Idk bout this. If u know anything about dbz u would know vegeta was fighting saibamen before goku even said a word,0,0,Errol Nicholson,ynuFEc_Zg5I,0.0,2018-10-08 03:00:44,True,True
2018-10-08T03:02:01,And im not fuckin with this broly 😞,0,0,Errol Nicholson,ynuFEc_Zg5I,0.0,2018-10-08 03:02:01,True,True
2018-10-08T03:24:51,"So, he's rewriting bardock's story?",0,0,采Sai,ynuFEc_Zg5I,0.0,2018-10-08 03:24:51,True,True
2018-10-08T03:32:35,Does bardock still try to stop frieza in here,0,0,BigPepe,ynuFEc_Zg5I,0.0,2018-10-08 03:32:35,True,True
2018-10-08T03:42:23,I watch too much MHA. All I hear is All Might 💀!,0,0,Fear x Scythe,ynuFEc_Zg5I,0.25,2018-10-08 03:42:23,True,True
2018-10-08T03:45:22,But Vegeta is a few years older than Goku and broly,0,0,nigel diaz,ynuFEc_Zg5I,-0.016666666666666677,2018-10-08 03:45:22,True,True
2018-10-08T03:57:25,"Geez, does Goku's origin story have to be retconned to be like Superman's anymore than it already was from Bardock the Father of Goku?  Though I appreciate the Broly story being fixed up, the fact that this is over-riding Bardock the Father of Goku kind of pisses me off.",0,0,Yellow Money,ynuFEc_Zg5I,0.35,2018-10-08 03:57:25,True,True
2018-10-08T04:25:51,Holy crap we get to see Goku’s mother!!!,0,0,Cameron Vidos,ynuFEc_Zg5I,-1.0,2018-10-08 04:25:51,True,True
2018-10-08T04:40:45,We get to see Goku's mom. Yes.....,0,0,Rey Parker,ynuFEc_Zg5I,0.0,2018-10-08 04:40:45,True,True
2018-10-08T04:54:42,My boy Vegeta looking sinister in that Super Saiyan form in trailer,0,0,Jay Hiryu,ynuFEc_Zg5I,-0.08333333333333334,2018-10-08 04:54:42,True,True
2018-10-08T04:55:16,"Guys, in the DragonBall minus manga (which this back story is based on) it shows Raditz as a kid with Vegeta in that scene where Vegeta has an alien arm behind him 1:07 . As for Tarble...yeah pretty sure Toriyama forgot about him 😭",0,0,Rhiannon Kitsune,ynuFEc_Zg5I,0.0,2018-10-08 04:55:16,True,True
2018-10-08T05:00:13,"WAY to kill Dragonball and Goku coming to Earth as a baby, not a child. Vegeta is actually about 4 years older than Goku...   Why change what has been rooted?!?!",0,0,LOTEK,ynuFEc_Zg5I,0.13020833333333331,2018-10-08 05:00:13,True,True
2018-10-08T05:06:24,Is this fr,0,0,Gene Noisyhawk,ynuFEc_Zg5I,0.0,2018-10-08 05:06:24,True,True
2018-10-08T05:10:05,"Does the text, ""Three Saiyans born at around the same time"" really appear in an official movie trailer? Are they sure they wouldn't have rather said, ""that were born, you know, kinda close to each other but not like EXACTLY at once.""",0,1,Luigiweegy,ynuFEc_Zg5I,0.16499999999999998,2018-10-08 05:10:05,True,True
2018-10-08T05:26:10,I don't wanna argue about cannon or non canon. I am just gonna imagine this as a fully fleshed out rewrite of the history of the saiyans. Also so many manga designs.,0,0,Little Duck,ynuFEc_Zg5I,0.5,2018-10-08 05:26:10,True,True
2018-10-08T05:31:17,You can see the Superman influence with Goku being sent off by his parents in a ship. Great stories always borrow from each other,0,0,HotPocketsBoy,ynuFEc_Zg5I,0.3375,2018-10-08 05:31:17,True,True
2018-10-08T05:32:14,"January, wtf.",0,0,Tesseract,ynuFEc_Zg5I,-0.5,2018-10-08 05:32:14,True,True
