timestamp,text,like_count,reply_count,author,trailer_id,sentiment_score,datetime,used_for_model,used_for_visualization
2018-04-07T12:23:18,Lmao in a world were guns are banned..,0,1,UFOs,YsiF8uxqJFU,0.6,2018-04-07 12:23:18,False,True
2018-04-10T08:14:18,LEAVE US ALONE BUT WEVE JUST STARTED AHHHHHHHHHHHHHHH! (Im dyinggg HAHAHA),0,0,Venzie Alfs28,YsiF8uxqJFU,0.2,2018-04-10 08:14:18,False,True
2018-04-10T23:43:25,Pwede po ba manood bata dito??,0,0,James Vlog,YsiF8uxqJFU,0.0,2018-04-10 23:43:25,False,True
2018-04-10T23:43:40,Pwede po ba manood 13 years old to this film,0,0,James Vlog,YsiF8uxqJFU,0.1,2018-04-10 23:43:40,False,True
2018-04-11T13:42:07,"the music/car scene! ""I think we're alone now"" ahhahahahahahahahaha!! dead! (plus this better be good i've been waiting for this for ages!)",0,0,Joey,YsiF8uxqJFU,0.375,2018-04-11 13:42:07,False,True
2018-04-11T22:15:10,Best comedy movie,0,0,αvα тαr,YsiF8uxqJFU,1.0,2018-04-11 22:15:10,False,True
2018-04-12T22:50:55,Da strange uhs 2 is tamara home yet?,0,0,Bryan Henne,YsiF8uxqJFU,-0.05,2018-04-12 22:50:55,False,True
2018-04-16T02:56:53,This came out on my birthday... does that mean I’m cursed?,0,0,Hannah Johnson,YsiF8uxqJFU,-0.3125,2018-04-16 02:56:53,False,True
2018-04-18T09:01:48,Show sucked. I was really anticipating the relesse of this move and I was horribly let down. It was actually a disappointment. Not scary In the slightest. You can literally guess what's going to happen next because it's so cliche.. Rating 1 star...,0,0,Nobody Business,YsiF8uxqJFU,-0.2175925925925926,2018-04-18 09:01:48,False,True
2018-04-22T00:04:30,Damn I thought that song was in the movie smh,0,0,Vcorr,YsiF8uxqJFU,0.0,2018-04-22 00:04:30,False,True
2018-04-23T04:36:10,I have a theory regarding both The Man In The Mask and Pin-Up Girl. I think these two are brother and sister (possibly twins) and were the original killers. Then they meet Dollface and invite her to join their group which she does. It's possible that Dollface and Pin-Up Girl are in a relationship and maybe how they met. It's just an idea I've been toying around in my head.,0,0,Creepy Cody,YsiF8uxqJFU,0.125,2018-04-23 04:36:10,False,True
2018-04-26T19:32:00,It was an awful sequel,0,0,Robadubdub G,YsiF8uxqJFU,-1.0,2018-04-26 19:32:00,False,True
2018-04-28T13:53:48,I think we're alone now...,0,0,Dalaxsis Ager,YsiF8uxqJFU,0.0,2018-04-28 13:53:48,False,True
2018-05-01T04:24:16,anyone else bingeing on horror movie trailers before going to bed...oh its just me oh okay,0,0,Cleo Goodwin,YsiF8uxqJFU,0.5,2018-05-01 04:24:16,False,True
2018-05-04T08:20:06,Where can i watch online in HD?,1,0,PacketSODMG,YsiF8uxqJFU,0.0,2018-05-04 08:20:06,False,True
2018-05-04T12:59:22,"What a piece of garbage. At least that's what I call a ""horror movie""  where people kill people. This movie was highly rated and described as one of the best horror movies. Another thing I learned is that critics are a bunch of uneducated kids, or corupred adults.",0,0,~ Bright Romeo ~,YsiF8uxqJFU,0.2866666666666667,2018-05-04 12:59:22,False,True
2018-05-07T22:17:14,It was amazing,0,0,John T,YsiF8uxqJFU,0.6000000000000001,2018-05-07 22:17:14,False,True
2018-05-08T20:10:34,80s vibes,0,0,A. Dee,YsiF8uxqJFU,0.0,2018-05-08 20:10:34,False,True
2018-05-11T03:16:30,This movie was TRASH,0,0,Jamal East,YsiF8uxqJFU,0.0,2018-05-11 03:16:30,False,True
2018-05-12T22:57:49,Just seen the film and it’s beast 100% would recommend it,0,0,Sam Evans,YsiF8uxqJFU,0.0,2018-05-12 22:57:49,False,True
2018-05-12T23:06:45,PLEASE don't watch this. Do yourself a favour,0,0,Xtra Fast,YsiF8uxqJFU,0.0,2018-05-12 23:06:45,False,True
2018-05-15T04:11:24,Where can I watch online in HD,1,1,PacketSODMG,YsiF8uxqJFU,0.0,2018-05-15 04:11:24,False,True
2018-05-15T21:35:38,Musik on #1:25,0,0,Mr X3NX,YsiF8uxqJFU,0.0,2018-05-15 21:35:38,False,True
2018-05-22T00:38:50,Wait til Tamara get home. I'ma kick her ass,1,0,Sari Chanchez,YsiF8uxqJFU,0.0,2018-05-22 00:38:50,False,True
2018-05-27T09:48:07,BUT  IN  THE   FULL   LENGTH   IT   DIDNT   PLAY   MAKING  LOVE   OUT   OF   NOTHING   AT   ALL,0,0,barret tongs,YsiF8uxqJFU,0.425,2018-05-27 09:48:07,False,True
2018-05-27T12:03:25,Sorry to say but this movie sucked so bad such a disgrace to the 1st strangers 1. Unrealistic and corny aff my gawd im raging with angers rn the fact how I loved the 1st one!!! 😠,1,0,Jairee Lauganas,YsiF8uxqJFU,-0.13999999999999996,2018-05-27 12:03:25,False,True
2018-05-27T15:51:55,"Wow,  I found myself singing along while people were being butchered. .. I'm a monster",0,0,Jen,YsiF8uxqJFU,0.1,2018-05-27 15:51:55,False,True
2018-05-28T17:32:24,"Just watched this I preferred the first one as that one messed with your head a bit more, BUT it was definitely good and worth seeing.",0,0,Julie Wellington,YsiF8uxqJFU,0.4375,2018-05-28 17:32:24,False,True
2018-05-29T07:02:52,The ending blew my shit.Why did dude get all burnt up in a fire and fully dead but was still hell bent on killing the daughter .I was like C'mon Now🙅I was also waiting for the daughter to accidentally kill a nurse after hearing those knocks on the door.That shit wldve been ok rather than them just cutting it off.Thats what's up girl for going back for big bro.I wldve went and got bro too 👍🤞👫 Oh the movie was good too.,0,0,brenda tatum,YsiF8uxqJFU,0.028571428571428564,2018-05-29 07:02:52,False,True
2018-06-02T02:04:14,Nice!,0,0,I have to wait 90 days to change my name,YsiF8uxqJFU,0.75,2018-06-02 02:04:14,False,True
2018-06-11T00:51:36,"This film was a real let down compared to the first. So bad and the acting was horse shit. Seems rushed and why would you show the pin up girl in the trailer. You kept her out of the movie for about 40 minutes and when I was wondering where she was and you finally revealed her, I was like ""oh, I've seen this part in the trailer""...you had years to create something as great as the first but you rushed and you ruined it.",1,0,Jehoash,YsiF8uxqJFU,0.04938271604938274,2018-06-11 00:51:36,False,False
2018-06-11T01:12:30,Just came back again to say trash. Movie was trash,0,0,Jehoash,YsiF8uxqJFU,0.0,2018-06-11 01:12:30,False,False
2018-06-11T19:59:22,So the guy has a pistol and dont shoot the killer? Stupid movie.,1,0,Cristiano Santos,YsiF8uxqJFU,-0.7999999999999999,2018-06-11 19:59:22,False,False
2018-06-13T00:11:08,Nothing fkn true about any of this! Trying to base this of off killing that noone wore masks and a family was slained and has nothing to do with this movie or its circumstances so quit with the bullshit it was a good horror movie as far as slash em up movies go.. No cheap sex scenes so thankful for that,0,0,kitkatcoco67,YsiF8uxqJFU,0.04749999999999997,2018-06-13 00:11:08,False,False
2018-06-14T21:08:11,I love it so much!!,0,0,alice abalo,YsiF8uxqJFU,0.40625,2018-06-14 21:08:11,False,False
2018-06-15T03:33:02,Movie was WACK!!!!,0,0,Snappa 87,YsiF8uxqJFU,0.0,2018-06-15 03:33:02,False,False
2018-06-15T03:33:58,Sucked! Such a disappointment i had high hopes for this movie,1,0,Snappa 87,YsiF8uxqJFU,-0.14666666666666664,2018-06-15 03:33:58,False,False
2018-06-16T19:51:48,Worst movie ever ! do not  see. !  You’ve been warned.,0,0,bill bass,YsiF8uxqJFU,-1.0,2018-06-16 19:51:48,False,False
2018-06-17T21:54:04,I was actually very pleased with this sequel!,0,0,Amber,YsiF8uxqJFU,0.8125,2018-06-17 21:54:04,False,False
2018-06-25T07:27:58,"so when brother has the gun, these freaks have killed his mom and dad, he has the drop on the chick in the mask. all he has to do is pull that trigger, but he just can't do it. really? I know liberals are weak and soft, and make 99% of the movies we see, but this is a little hard to believe...",1,0,reignman2112,YsiF8uxqJFU,-0.12569444444444444,2018-06-25 07:27:58,False,False
2018-06-26T23:50:17,This movie was absolute shit.,0,0,hassan plassan,YsiF8uxqJFU,0.0,2018-06-26 23:50:17,False,False
2018-06-29T06:56:03,Just watch this movie and TBH is was ass Cheeks dont waste your money!!!!!!! #suckedass,1,0,Sierra Pack,YsiF8uxqJFU,-0.95367431640625,2018-06-29 06:56:03,False,False
2018-06-29T14:48:47,I actually really liked the movie! :),2,0,V Rose,YsiF8uxqJFU,0.625,2018-06-29 14:48:47,False,False
2018-06-30T05:17:42,The first movie was suspenseful and kept you on the edge of your seat.  This movie went right into the gore.  No suspense.  You could predict what was going to happen next.  It would be hard to top the first one but I don't think they tried very hard.  It was just a slasher movie. Sucked!  One and a half hours of my life wasted.,0,0,Robin Creamer,YsiF8uxqJFU,0.015342261904761905,2018-06-30 05:17:42,False,False
2018-06-30T16:04:10,No strangers 3💔!,0,0,Hiba Liala,YsiF8uxqJFU,0.0,2018-06-30 16:04:10,False,False
2018-07-01T02:12:14,Dumbest movie ever,0,0,Pedro Flores,YsiF8uxqJFU,0.0,2018-07-01 02:12:14,False,False
2018-07-01T07:10:47,A knock at the door  Lady: is Tamara home  Me: (grabs hard bat) I’LL ANSWER THAT IF YOU SHOW ME YOUR FACE!!!!!!!!!!!!!!!!!!!!,0,0,SAO fan Daniel,YsiF8uxqJFU,-0.875,2018-07-01 07:10:47,False,False
2018-07-03T03:40:51,"Pathetic!! These so called ""actors"" portraying the killers are a joke worst acting I've ever seen! Everyone else was good but those douche bags def don't need to quit their day job!!!!!",0,1,Kyle Cameron,YsiF8uxqJFU,-0.25,2018-07-03 03:40:51,False,False
2018-07-03T13:45:18,love this film.,0,0,Georgia Simpson,YsiF8uxqJFU,0.5,2018-07-03 13:45:18,False,False
2018-07-03T13:46:05,Tamara where you at?,0,0,Georgia Simpson,YsiF8uxqJFU,0.0,2018-07-03 13:46:05,False,False
2018-07-05T11:20:13,I watched this movie last night and i liked it. The end is amazing. But i thought that in this movie we would know something more about this killers: any history behing them. But no... we still don't know who they are and why they are killing people. Sad.,1,0,Diogo Martins,YsiF8uxqJFU,0.24000000000000005,2018-07-05 11:20:13,False,False
2018-07-25T00:23:56,"💢💢 Don’t read if you didn’t watch the movie, i have mentioned some parts of it 💢💢   The killers are not Monsters, but the director is! I mean how the hell a car survived an explosion! Okay the problem isn’t here, but that scarecrow(whatever) how the hell did he survive!! He has exploded and has stabbed with a piece of glass, after, he came back with his full energy carrying his 11 Tones Hammer to revenge!! And the ending, if this will not be the brother’s doctor, the director must see a real one!  This is not a tom and jerry, or a legend, at least make it real since uve mentioned “inspired by true events” !!  BTW the movie was pretty good, and i like it 👌",0,0,Z2,YsiF8uxqJFU,0.2584375,2018-07-25 00:23:56,False,False
2018-08-03T16:00:22,Triple H omGGG,0,0,baby peach,YsiF8uxqJFU,0.0,2018-08-03 16:00:22,False,False
2018-08-03T16:00:31,Love it 💗,1,0,baby peach,YsiF8uxqJFU,0.5,2018-08-03 16:00:31,False,False
2018-08-10T11:15:08,Scary movie,0,0,graces room,YsiF8uxqJFU,-0.5,2018-08-10 11:15:08,False,False
2018-08-17T21:03:26,Roses are red violets are blue  I got click baited  And so did you,0,0,Paige Fellbaum,YsiF8uxqJFU,0.0,2018-08-17 21:03:26,False,False
2018-08-26T07:48:40,"it's shit as there's no Liv Tyler, Yet she didn't die in the first movie.",0,0,UrbanCarnage,YsiF8uxqJFU,0.024999999999999994,2018-08-26 07:48:40,False,False
2018-09-09T04:49:36,The first part was/is one of my favorite movies,0,0,skamseries,YsiF8uxqJFU,0.375,2018-09-09 04:49:36,False,False
2018-09-23T17:01:05,Get ready for the adventure of an AFTERlifetime!!!,0,0,Corey Million,YsiF8uxqJFU,0.390625,2018-09-23 17:01:05,False,False
2018-10-15T16:00:33,"this movie was complete ass, do yourself a favor and dont watch it. My taste of a good horror movie is No country for Old Men, Mother.",0,0,Ricky Atapattu,YsiF8uxqJFU,0.3,2018-10-15 16:00:33,False,False
2018-10-16T23:11:06,"When you have a gun , You point and pull the trigger. Wtf Stupid movie",0,0,K VS,YsiF8uxqJFU,-0.6499999999999999,2018-10-16 23:11:06,False,False
2019-02-07T15:29:55,SPOILER ALERT! :  I really loved this movie I didnt expect it to be like the first one. You could easily tell it was going for a different look and feel. I had been following it so I knew the direction. I loved the 80s feel and nostalgia of the film. BUT I was so pissed because I loved pin up stranger from the first I found her to be the scariest. She literally was In like two scenes maybe three and then she was killed. And I felt super bummed. I wanted to see her stalk and be creepy. It seemed dollface was doing most of the stalking and killing.,0,0,Andre Taylor,YsiF8uxqJFU,0.2638888888888889,2019-02-07 15:29:55,False,False
2019-02-07T15:30:09,SPOILER ALERT! :  I really loved this movie I didnt expect it to be like the first one. You could easily tell it was going for a different look and feel. I had been following it so I knew the direction. I loved the 80s feel and nostalgia of the film. BUT I was so pissed because I loved pin up stranger from the first I found her to be the scariest. She literally was In like two scenes maybe three and then she was killed. And I felt super bummed. I wanted to see her stalk and be creepy. It seemed dollface was doing most of the stalking and killing.,0,0,Andre Taylor,YsiF8uxqJFU,0.2638888888888889,2019-02-07 15:30:09,False,False
2019-03-17T10:15:32,"Worst horror movie of 2018!!! Terrible acting, terrible plot ridiculous sequel",0,0,Troy Gartney,YsiF8uxqJFU,-0.6666666666666667,2019-03-17 10:15:32,False,False
2019-04-14T01:09:15,This movie was awful,0,0,Justin Archer,YsiF8uxqJFU,-1.0,2019-04-14 01:09:15,False,False
2019-07-13T22:37:04,What if Tamara was in the house,0,0,MadxJuice,YsiF8uxqJFU,0.0,2019-07-13 22:37:04,False,False
2019-08-05T17:59:40,!!!,0,0,ximena X,YsiF8uxqJFU,0.0,2019-08-05 17:59:40,False,False
2019-10-07T01:40:44,Yankee people are really that stupid as they show in those movies? Jajajaja,0,0,emmcx,YsiF8uxqJFU,-0.29999999999999993,2019-10-07 01:40:44,False,False
2019-10-11T03:34:30,"I gotta say, this movie really started pissing me off near the end. They kept playing with my feelings. Like was the girl gonna make it out of this alive or not?! That and how the last guy had powers similar to Jason and Michael Myers in the way that regular fatal attacks didn't kill him. The guy got blown up and fatally stabbed yet he still was able to chase after that last kid. What does it take to kill that dude?!",0,0,Riri Pari,YsiF8uxqJFU,0.115625,2019-10-11 03:34:30,False,False
2019-11-07T07:16:05,"Concealed carry...Like all these movies, over in two minutes",0,0,R Waits,YsiF8uxqJFU,0.0,2019-11-07 07:16:05,False,False
2019-11-25T20:53:41,i hate this movie the characters in this movie are so dum,0,0,phoenix boy,YsiF8uxqJFU,-0.8,2019-11-25 20:53:41,False,False
2019-12-04T20:45:26,I cried when the two girls killers die and the man killer to bring them back make the strangers horror part 3-4-5-6-7 it's that good,0,0,DEVIL EYES,YsiF8uxqJFU,0.35,2019-12-04 20:45:26,False,False
2020-02-28T04:33:34,🔥🔥🔥   It was an honor having you with us.   1:32 🔥❤💙     👇 👇 👇 👇 👇💘,0,0,Caden Carney,YsiF8uxqJFU,0.0,2020-02-28 04:33:34,False,False
2020-03-27T00:20:24,This is one of the BEST TRAILER I've ever watch,1,0,Dave Macababbad,YsiF8uxqJFU,1.0,2020-03-27 00:20:24,False,False
2020-04-07T19:19:57,🔥🔥   Love this movie. LOVE THIS MOVIE.   0:53 💕🎥💖    👇 👇 👇🧡,0,0,Scott Pearce,YsiF8uxqJFU,0.5,2020-04-07 19:19:57,False,False
2020-04-10T22:24:49,The face at the end when it says March 9th is creepy 1:59,0,0,Rayzur Vybezz,YsiF8uxqJFU,-0.5,2020-04-10 22:24:49,False,False
2020-05-13T03:43:20,This is movie is horrible,1,0,Splitbottin 4337,YsiF8uxqJFU,-1.0,2020-05-13 03:43:20,False,False
