timestamp,text,like_count,reply_count,author,trailer_id,sentiment_score,datetime,used_for_model,used_for_visualization
2018-01-05T16:43:29,Looks good,1,0,Darnell f,YsiF8uxqJFU,0.7,2018-01-05 16:43:29,True,True
2018-01-05T16:44:15,Releasing date ?,2,8,17 LeGenD,YsiF8uxqJFU,0.0,2018-01-05 16:44:15,True,True
2018-01-05T16:45:03,Release date?,0,2,Spunky- Monkey,YsiF8uxqJFU,0.0,2018-01-05 16:45:03,True,True
2018-01-05T16:48:00,360p,0,0,Angelin,YsiF8uxqJFU,0.0,2018-01-05 16:48:00,True,True
2018-01-05T16:52:40,.,1,0,RaphaCool Johnson,YsiF8uxqJFU,0.0,2018-01-05 16:52:40,True,True
2018-01-05T16:55:21,This is actually looking like an exceptional sequel! #TheStrangers2 #Trailer,208,5,JoBlo Movie Trailers,YsiF8uxqJFU,0.41666666666666663,2018-01-05 16:55:21,True,True
2018-01-05T16:58:02,SOOOOO HYPEDDDD,5,0,Max Petruzziello,YsiF8uxqJFU,0.0,2018-01-05 16:58:02,True,True
2018-01-05T17:06:49,God damnit Tamara is never home 🙄🙄🙄,584,29,coconut wig,YsiF8uxqJFU,0.0,2018-01-05 17:06:49,True,True
2018-01-05T17:11:26,thats coooooooooooooool,1,0,areon,YsiF8uxqJFU,0.0,2018-01-05 17:11:26,True,True
2018-01-05T17:19:55,Just imagine if this was actually god,3,1,The Samm’s Club,YsiF8uxqJFU,0.0,2018-01-05 17:19:55,True,True
2018-01-05T17:32:41,Amazing Short 3D CGI Animated Mystery Film - *Geist* https://www.youtube.com/watch?v=P93WTD6odVc,0,0,Adam,YsiF8uxqJFU,0.30000000000000004,2018-01-05 17:32:41,True,True
2018-01-05T17:39:23,"Why is this even getting a sequel, the original was abysmal!",10,4,RoxMeNot,YsiF8uxqJFU,0.46875,2018-01-05 17:39:23,True,True
2018-01-05T17:55:07,Amazing,2,0,Maru,YsiF8uxqJFU,0.6000000000000001,2018-01-05 17:55:07,True,True
2018-01-05T19:05:41,This better be rated r,171,11,AUGIE Productions,YsiF8uxqJFU,0.5,2018-01-05 19:05:41,True,True
2018-01-05T19:20:34,I can't wait screw all the comments saying it looks bad. Im so hyped. Ive been waiting years for this EDIT- Thanks for all the likes and comments I hope it's good.,344,18,Jon nni,YsiF8uxqJFU,0.06666666666666671,2018-01-05 19:20:34,True,True
2018-01-05T19:56:39,Yessss! OMG it's here!!!!!!! I can't wait!,8,0,Minerva Medina,YsiF8uxqJFU,0.0,2018-01-05 19:56:39,True,True
2018-01-05T19:59:21,"l find this crap so stupid. Like, to me I’d be like “look how precious you are with your little axe and mask🤗”   Then I’d blow there head off with a .45 haha",21,16,TheTyler701,YsiF8uxqJFU,-0.21750000000000003,2018-01-05 19:59:21,True,True
2018-01-05T20:04:59,They sure took a loooooong time to do a Part 2!,333,15,Panther1,YsiF8uxqJFU,0.625,2018-01-05 20:04:59,True,True
2018-01-05T20:26:49,"this year looks  better then 2017. (polaroid,slender man, truth or dare now the strangers <3 waiitng the nun official trailer",0,0,alexi864,YsiF8uxqJFU,0.75,2018-01-05 20:26:49,True,True
2018-01-05T20:30:28,It's not going to be as good as the first one,0,0,Eagan Shannacappo,YsiF8uxqJFU,0.475,2018-01-05 20:30:28,True,True
2018-01-05T20:54:30,"Guys, remember Tamara? One who was nerdy, had an abusive father, and was killed in a prank by some mean school boys and girls? She was back, but now she's back again! 🌚",31,6,Kitty S,YsiF8uxqJFU,-0.128125,2018-01-05 20:54:30,True,True
2018-01-05T21:12:57,"1:17 ""sup, homie""",59,4,OldEarthChaos,YsiF8uxqJFU,0.0,2018-01-05 21:12:57,True,True
2018-01-05T21:18:20,"My thought is, what if someone named Tamara actually lived there?",486,15,Boyd Crowder,YsiF8uxqJFU,0.0,2018-01-05 21:18:20,True,True
2018-01-05T21:19:32,This looks better than number 1 😂😂💜,56,7,Lexi Anderson,YsiF8uxqJFU,0.5,2018-01-05 21:19:32,True,True
2018-01-05T21:32:36,They finally did it! ive been waiting since 2009 lol,24,1,THICCisSICC,YsiF8uxqJFU,0.4,2018-01-05 21:32:36,True,True
2018-01-05T21:40:39,A Dream Come True,9,0,Atomic_ Fox,YsiF8uxqJFU,0.35,2018-01-05 21:40:39,True,True
2018-01-05T22:07:41,Ive waited everyday for the trailer sice the teaser one was released and now this makes me hella hyped for it❤,11,0,payr0lljayvanni,YsiF8uxqJFU,-0.2,2018-01-05 22:07:41,True,True
2018-01-05T22:45:13,Looks like a rinse and repeat but with Christina Hendricks in it I have 2 big reasons to watch this!!!!!,0,0,Thelonius,YsiF8uxqJFU,0.0,2018-01-05 22:45:13,True,True
2018-01-05T23:10:15,"not so sure about this sequel, it looks terrible. I like the first movie though",0,0,mutant messiah,YsiF8uxqJFU,-0.08333333333333333,2018-01-05 23:10:15,True,True
2018-01-05T23:11:07,who else here for Bailee Madison ?,66,7,palomaa aguilar,YsiF8uxqJFU,0.0,2018-01-05 23:11:07,True,True
2018-01-05T23:51:27,This looks solid.,11,0,aceinthehole1222,YsiF8uxqJFU,0.0,2018-01-05 23:51:27,True,True
2018-01-06T00:48:46,"Ehhh idk. I liked the first one. It was more subtle and suspenseful and realistic. It messed with you cause it totally could and has happened. And the first one was inspired by real events. This one is a bit more over the top. Its personal preference, but the more realistic (especially true horror stories) are the ones that fuck me up the most.",72,13,Ryan Carty,YsiF8uxqJFU,0.24117647058823527,2018-01-06 00:48:46,True,True
2018-01-06T01:06:52,I actually really enjoyed the first one and I don’t think this looks all that good which sucks,0,0,Owen Jones,YsiF8uxqJFU,0.2875,2018-01-06 01:06:52,True,True
2018-01-06T01:26:01,does anyone else notice notice on 0:10 there’s a mailbox with a smilelyy,31,3,Ska Pilgrim,YsiF8uxqJFU,0.0,2018-01-06 01:26:01,True,True
2018-01-06T01:27:42,Wtf...should've just left it at one movie.,1,1,con_artist,YsiF8uxqJFU,0.0,2018-01-06 01:27:42,True,True
2018-01-06T01:54:52,The same song they used for this trailer is the same one for the 10 cloverfield lane trailer.. just a different version,3,1,anitabonghit 2.0,YsiF8uxqJFU,0.0,2018-01-06 01:54:52,True,True
2018-01-06T03:23:02,I like it,2,0,Cyber Horror Genocide,YsiF8uxqJFU,0.0,2018-01-06 03:23:02,True,True
2018-01-06T03:46:11,Christina Hendricks is bae,32,0,Echo Light Entertainment,YsiF8uxqJFU,0.0,2018-01-06 03:46:11,True,True
2018-01-06T03:47:58,This movie didn't need a sequel.,0,4,tn 420 animations,YsiF8uxqJFU,0.0,2018-01-06 03:47:58,True,True
2018-01-06T03:49:52,#ilovethestrangers2 im so exited for this movie i wanna look now,1,0,Alda Duran,YsiF8uxqJFU,0.0,2018-01-06 03:49:52,True,True
2018-01-06T05:08:55,I swear trailers are so stupid when they reveal everything ! Like why would you revel all the suspenseful parts or parts that would potentially make people jump! Now we all know what to somewhat expect and it loses its effect,0,0,Mr. President,YsiF8uxqJFU,-0.32499999999999996,2018-01-06 05:08:55,True,True
2018-01-06T05:10:00,Can they stop using I think we're alone now for horror movie trailers.  I get the tone of the song is ironic given the situation and the lyrics as well but it almost makes the horror seem laughable,10,6,Joshua Berkowitz,YsiF8uxqJFU,-0.15,2018-01-06 05:10:00,True,True
2018-01-06T06:05:38,No one asked for this.,0,0,Panquake 321,YsiF8uxqJFU,0.0,2018-01-06 06:05:38,True,True
2018-01-06T06:39:56,10 years later and this bitch still asking for Tamara,286,11,dflowers30,YsiF8uxqJFU,0.0,2018-01-06 06:39:56,True,True
2018-01-06T10:46:14,Let me guess. The entire family dies at the end.,0,2,Lord Jesus,YsiF8uxqJFU,0.0,2018-01-06 10:46:14,True,True
2018-01-06T10:49:10,The original left us in a cliff hanger and deserved a sequel.   It wasn’t forced so I don’t know why people are complaining. In fact I’m surprised it took so long!,90,6,Miguel Velasco,YsiF8uxqJFU,0.022499999999999992,2018-01-06 10:49:10,True,True
2018-01-06T16:34:47,When the CIA is looking for you,1,0,Crosswitch,YsiF8uxqJFU,0.0,2018-01-06 16:34:47,True,True
2018-01-06T18:00:03,Bruh how is this a true story?,0,4,Weston Stogner,YsiF8uxqJFU,0.35,2018-01-06 18:00:03,True,True
2018-01-06T18:16:45,Not gonna be the same. The Strangers are played by different people.,0,8,Jonathan Calderon,YsiF8uxqJFU,0.0,2018-01-06 18:16:45,True,True
2018-01-06T19:35:32,"The single most horribly robotic delivery of a line ever in a film, ""this place seems empty?or.""",0,0,CABLE 715,YsiF8uxqJFU,0.10952380952380954,2018-01-06 19:35:32,True,True
2018-01-06T19:42:52,"Oh look, another tween wearing the shirt of a band she never heard of.",0,0,CABLE 715,YsiF8uxqJFU,0.0,2018-01-06 19:42:52,True,True
2018-01-06T21:26:17,The child has to live. You can't kill a child in a horror film. Hate the way it looks so far.,0,3,Pokemon Master Kobe,YsiF8uxqJFU,-0.1878787878787879,2018-01-06 21:26:17,True,True
2018-01-06T23:22:42,Where tf is Tamara?!!,0,0,Jasmine Verdez,YsiF8uxqJFU,0.0,2018-01-06 23:22:42,True,True
2018-01-07T00:12:37,Tamara has to get some new friends 😏 lol,0,0,manny smith,YsiF8uxqJFU,0.4681818181818182,2018-01-07 00:12:37,True,True
2018-01-07T04:00:26,"play 1:41 in 0.50 speed, you can see the boy killing the brown mask guy  EDIT: Or he could be doing something else, but either way, if you have your brightness high enough, you can see blood on his face",8,10,Oreo Kid,YsiF8uxqJFU,0.08,2018-01-07 04:00:26,True,True
2018-01-07T05:14:40,Gotta see it,0,0,Tra vis,YsiF8uxqJFU,0.0,2018-01-07 05:14:40,True,True
2018-01-07T07:23:07,I agree I loved the strangers 1 probably the most creepiest horror movie I have ever seen I wouldn’t call it scary and I am so fucking excited for the strangers 2 it’ll be awesome,0,0,thanos hazidimitriou,YsiF8uxqJFU,0.41500000000000004,2018-01-07 07:23:07,True,True
2018-01-07T07:53:56,"WTF? Where the heck is Liv Tyler, she said in an interview personally that her character would return...",0,1,SoulReaperSlayer19,YsiF8uxqJFU,-0.25,2018-01-07 07:53:56,True,True
2018-01-07T10:41:22,Just because you found a couple dead bodies doesn’t mean they died like this   Based on a true story my ass,0,4,will_caruso_,YsiF8uxqJFU,-0.05416666666666666,2018-01-07 10:41:22,True,True
2018-01-07T15:04:10,When you have a cousin name Tamara 😩 “Yeah She here.” 👀,249,7,Ebony Smallwood,YsiF8uxqJFU,0.0,2018-01-07 15:04:10,True,True
2018-01-07T16:38:05,Oh my god theres a bang at the door.,0,0,Chris Kelly,YsiF8uxqJFU,0.0,2018-01-07 16:38:05,True,True
2018-01-07T18:49:21,10/9 years later never found Tamara lol,0,0,Emperor Rafiki124,YsiF8uxqJFU,0.4,2018-01-07 18:49:21,True,True
2018-01-07T21:24:44,I honestly hope they don't die or get caught 😂they need to keep these kinds of movies alive..,0,0,isaiah terry,YsiF8uxqJFU,0.35,2018-01-07 21:24:44,True,True
2018-01-08T01:11:33,"I’m pretty sure when Pinup girl shows up, that’s going to be her first appearance in the film. (Like in the first one where she appeared in the middle of the film) To once again add to the fear of, “there’s another one?!”",0,0,Dehydrated Mango,YsiF8uxqJFU,0.25,2018-01-08 01:11:33,True,True
2018-01-08T01:58:51,Omg this looks better than the first one :),0,0,Vinesh Chand,YsiF8uxqJFU,0.4166666666666667,2018-01-08 01:58:51,True,True
2018-01-08T02:52:46,Just imagine the strangers asking for Tamara again and then the person says yes 😂 I wonder what would happen,0,0,Idk But i like skittle,YsiF8uxqJFU,0.0,2018-01-08 02:52:46,True,True
2018-01-08T11:46:45,1:17 made me laugh,0,0,splint,YsiF8uxqJFU,0.3,2018-01-08 11:46:45,True,True
2018-01-08T13:21:36,I think we're alone nowwwww there doesn't seem to be anyoneeee aroundddd 🔪 Because you were home.,0,0,inject Drano,YsiF8uxqJFU,0.0,2018-01-08 13:21:36,True,True
2018-01-08T18:23:48,One of the best horror movies of the 2000s be grateful for a sequel,0,0,Matthew Martinez,YsiF8uxqJFU,1.0,2018-01-08 18:23:48,True,True
2018-01-08T21:21:01,This looks like it could be a great horror sequel and that's almost impossible!,0,0,Nikel Nuts,YsiF8uxqJFU,-0.016666666666666607,2018-01-08 21:21:01,True,True
2018-01-08T22:44:14,See it looks good and the sound mixing in the trailer alone is incredible; however... that song makes me think fun 80's beach movie as opposed to creepy slasher flick!,0,0,Zachary Wright,YsiF8uxqJFU,0.33499999999999996,2018-01-08 22:44:14,True,True
2018-01-09T00:25:39,I love it 😍 can’t wait 😊,0,0,Johana Bonilla,YsiF8uxqJFU,0.5,2018-01-09 00:25:39,True,True
2018-01-09T04:11:36,So many years and the still haven't found tamera,0,0,Reich Fu,YsiF8uxqJFU,0.5,2018-01-09 04:11:36,True,True
2018-01-09T20:32:37,This tottaallly doesn't seem exactly like the first one at all.,0,0,Spooky Ghost,YsiF8uxqJFU,0.25,2018-01-09 20:32:37,True,True
2018-01-09T20:48:27,I bet Donny from ted would be in this movie,0,0,Ken 10,YsiF8uxqJFU,0.0,2018-01-09 20:48:27,True,True
2018-01-09T20:55:07,"i think the first stranger’s cast should have been in the mask ’s they should have never replace the original mask killer’s they gave spine chilling  terror to the movie god if they ever make part 3 they need the fist movie killer’s cast i hostly give the fist movies /mask killers a 10/10 for being original i hope the next movie tell’s the mask killers’ how they became to be .,😡🔪",0,0,King Jann Lee Inferno8,YsiF8uxqJFU,0.1,2018-01-09 20:55:07,True,True
2018-01-09T22:13:39,“Is Tamara home ?”  There’s a song called “ there’s a stranger in my house” by a woman name Tamara,26,3,Zion,YsiF8uxqJFU,0.0,2018-01-09 22:13:39,True,True
2018-01-09T22:53:07,"""Is Tamara home?"" ""Uh yeah, hold on let me get her"" ""Wait you weren't supposed to say...damn it.""",126,5,Lord Krythic,YsiF8uxqJFU,0.0,2018-01-09 22:53:07,True,True
2018-01-09T23:41:24,I am so ready for this! My family and I love this! That dam Tiffany song is so we'll put together! We are ready!! It's gonna be good!!,15,3,Lou moon,YsiF8uxqJFU,0.5859375,2018-01-09 23:41:24,True,True
2018-01-10T00:55:45,Love the song it's called I think we're alone,0,0,Juan r Hurtado,YsiF8uxqJFU,0.5,2018-01-10 00:55:45,True,True
2018-01-10T00:56:36,1:08,0,0,Juan r Hurtado,YsiF8uxqJFU,0.0,2018-01-10 00:56:36,True,True
2018-01-10T00:57:40,1:30 the girl is jumping while running,0,0,Juan r Hurtado,YsiF8uxqJFU,0.0,2018-01-10 00:57:40,True,True
2018-01-10T11:05:44,This song was spookier in the 10 Cloverfield lane trailer and in Ted... all joking aside this looks decent. It’s sad that it took this long for a sequel because I’m sure casual movie goers probably don’t remember the first.,0,0,Chris V,YsiF8uxqJFU,-0.022222222222222244,2018-01-10 11:05:44,True,True
2018-01-10T16:08:12,"I do find it funny that this movie can get away with saying it's ""Based on true events"" when the ""true event"" was literally a childhood experience the director had where someone mistakenly knocked on his families' door looking for someone who didn't live there. That's it. That's all that happened. Imagine if Texas Chainsaw Massacre wasn't based on Ed Gein's crimes (as loosely as TCM is already based around that) but rather, when Tobe Hooper came up with the idea to use a chainsaw as the main weapon. Like ""Based on a true story"". Oh, so what true story was the inspiration? ""Oh, I was at the mall and I saw a chainsaw."" That's it? ""Well, yeah but then I imagined what would have happened if I grabbed it and just started slashing people to pieces with it"". So eseentially, 99% of the ""truth"" in the story is the director's imagination lol.",0,1,Pearl Skakler,YsiF8uxqJFU,0.29734524734524737,2018-01-10 16:08:12,True,True
2018-01-10T19:53:12,I hope they'll give us a scene as iconic as the one where the guy with the scarecrow mask is silently looking at Liv Tyler's character inside the house. I still remember that watching the trailer and the movie in the theater that scene had the whole theater so excited.,11,0,djChives95,YsiF8uxqJFU,0.26875,2018-01-10 19:53:12,True,True
2018-01-10T23:21:33,This movie was out 2 years ago,0,0,Daniella,YsiF8uxqJFU,0.0,2018-01-10 23:21:33,True,True
2018-01-11T00:27:26,This reminds me of hotline Miami for some reason,0,0,Marshal Monsanto,YsiF8uxqJFU,0.0,2018-01-11 00:27:26,True,True
2018-01-11T00:56:23,Did yoy see the smiley on the mail box?,2,1,Minerva Medina,YsiF8uxqJFU,0.0,2018-01-11 00:56:23,True,True
2018-01-11T04:51:41,I need to watch this,0,0,Venus X,YsiF8uxqJFU,0.0,2018-01-11 04:51:41,True,True
2018-01-11T06:13:18,Esta genial este trailer!!!  La espero tanto desde hace 3 años imaginense,0,0,Fractrull xw *,YsiF8uxqJFU,0.0,2018-01-11 06:13:18,True,True
2018-01-11T18:09:51,IVE WAITIED 10 MF YEARS AND NOW THE TIME HAS COME!!!!!!!!!!!!!!!!!,10,0,Ignacio Rodriguez,YsiF8uxqJFU,0.0,2018-01-11 18:09:51,True,True
2018-01-11T18:10:21,Anyone know if this is gonna pick up months after the events of part 1 or if its a reebot?,0,0,Ignacio Rodriguez,YsiF8uxqJFU,0.0,2018-01-11 18:10:21,True,True
2018-01-11T18:25:06,I GOT A THEORY WHAT IF THE THREE STRANGERS ARE SIBLINGS AND TAMRA IS THE MOTHER?!?!?,10,1,Ignacio Rodriguez,YsiF8uxqJFU,0.0,2018-01-11 18:25:06,True,True
2018-01-11T22:53:42,Yall were too cheap to get Liv Tyler in the sequel????    Keep this sequel,0,0,E MM,YsiF8uxqJFU,0.4,2018-01-11 22:53:42,True,True
2018-01-12T01:21:17,*OH MY GOD THERE'S A BANGING AT THE DOOR*,0,0,ThePotatoKing,YsiF8uxqJFU,0.0,2018-01-12 01:21:17,True,True
2018-01-12T06:03:43,We gonna ignore how good this remix is,0,0,JustCallMeDJ,YsiF8uxqJFU,0.7,2018-01-12 06:03:43,True,True
2018-01-12T07:18:15,"Strangers sequel? Nah, I think I'll skip it. *See's that Christina Hendricks is in it.* - Ok, maybe I'll see it.",4,0,BackpackFilmmaker,YsiF8uxqJFU,0.5,2018-01-12 07:18:15,True,True
2018-01-13T01:54:16,you can run  you can hide or you can fight like hell,0,0,MALENA Barriga,YsiF8uxqJFU,0.0,2018-01-13 01:54:16,True,True
2018-01-13T02:43:18,"honestly,      FUCK ME UP I AM HERE FOR THIS",0,0,jordanohTV,YsiF8uxqJFU,-0.4,2018-01-13 02:43:18,True,True
2018-01-13T16:47:14,I love it when people judge the movie even with it NOT being out yet. Totally makes sense. How about watch the movie first. MIND BLOWN!!! 😆😆😆♻,0,0,Anthony Bonifas,YsiF8uxqJFU,0.3294270833333333,2018-01-13 16:47:14,True,True
2018-01-14T01:08:43,Man I had to wait 10 years,0,0,Phevos_ Athena2004,YsiF8uxqJFU,0.0,2018-01-14 01:08:43,True,True
2018-01-14T06:30:09,Was pretty good till the stupid music kicked in -_-,0,0,JuuzouSenpaii,YsiF8uxqJFU,0.05000000000000001,2018-01-14 06:30:09,True,True
2018-01-14T15:12:41,Can’t wait to see this,0,0,PeruvianKing,YsiF8uxqJFU,0.0,2018-01-14 15:12:41,True,True
2018-01-14T19:26:44,Ted,0,0,Andrea Sauceda,YsiF8uxqJFU,0.0,2018-01-14 19:26:44,True,True
2018-01-14T23:03:25,I forgot about this movie!!,0,0,Mayeila Gandy,YsiF8uxqJFU,0.0,2018-01-14 23:03:25,True,True
2018-01-15T00:43:22,but we just started : ),30,1,Rukia Kamishiro,YsiF8uxqJFU,0.5,2018-01-15 00:43:22,True,True
2018-01-15T12:05:31,"""I think we're alone now""  such a classic song.",2,0,Jennifer Bullett,YsiF8uxqJFU,0.08333333333333333,2018-01-15 12:05:31,True,True
2018-01-15T15:58:29,This is my favorite scary movie finally they make one,0,0,Tanya Zamora,YsiF8uxqJFU,0.0,2018-01-15 15:58:29,True,True
2018-01-15T19:34:40,I only waited 10 years for the second one. No big deal ._.,0,0,Alysia Lucero,YsiF8uxqJFU,0.0,2018-01-15 19:34:40,True,True
2018-01-16T01:14:43,Dude if I see that shit....,0,1,Crazy Shippings,YsiF8uxqJFU,-0.2,2018-01-16 01:14:43,True,True
2018-01-16T03:37:23,"So hyped, only film I'm excited for in 2018, this trailer was epic with the tiffany song",0,0,Keenan _ Kemp,YsiF8uxqJFU,0.15833333333333333,2018-01-16 03:37:23,True,True
2018-01-16T04:33:10,Oh yea I can’t wait,0,0,Tilly Mac,YsiF8uxqJFU,0.0,2018-01-16 04:33:10,True,True
2018-01-16T04:35:19,I fucking loved the first one because it was so creepy... hoping the sequel doesn’t disappoint...,0,0,S Wise,YsiF8uxqJFU,0.15,2018-01-16 04:35:19,True,True
2018-01-16T19:45:22,wheres tamera？,0,0,Jocelyn Ding,YsiF8uxqJFU,0.0,2018-01-16 19:45:22,True,True
2018-01-16T23:54:02,Shouldn't Tamara be sleeping at that time? Like she should be doing. It was 4:05am in the morning in part 1 when she came looking for Tamara. Tamara shouldn't be up till at least 6am to get ready for school or work.🤣,0,0,CJ Smith,YsiF8uxqJFU,-0.04999999999999999,2018-01-16 23:54:02,True,True
2018-01-17T13:07:06,This looks so awesome,0,0,Groovy Shape,YsiF8uxqJFU,1.0,2018-01-17 13:07:06,True,True
2018-01-17T14:22:49,Part 1 was so good the sequel looks dope af CAN'T WAIT,0,0,Breezy Twins,YsiF8uxqJFU,0.7,2018-01-17 14:22:49,True,True
2018-01-19T02:56:25,100% savage at 1:51 when she said leave us alone then dollface says we just did,0,0,Dee Famous,YsiF8uxqJFU,0.0,2018-01-19 02:56:25,True,True
2018-01-19T03:25:42,This looks sicker than hell ..,0,0,Ed Ancel,YsiF8uxqJFU,0.0,2018-01-19 03:25:42,True,True
2018-01-19T10:44:34,Omg is that riggs from greys anatomy lol,0,0,Jackie,YsiF8uxqJFU,0.8,2018-01-19 10:44:34,True,True
2018-01-21T04:05:51,On my b-day,0,0,Remember those 9/11 jokes,YsiF8uxqJFU,0.0,2018-01-21 04:05:51,True,True
2018-01-21T06:27:31,"10 years ago the strangers was my first  horror and rated r film I watched, I'm looking forward to this!",2,0,Zom baygal,YsiF8uxqJFU,0.3125,2018-01-21 06:27:31,True,True
2018-01-21T12:27:22,"So it's the purge without the you know, purge. Just a couple of weirdos doing their own version.",0,0,Hayley M,YsiF8uxqJFU,0.6,2018-01-21 12:27:22,True,True
2018-01-21T16:49:11,the trailer looks great hope the people beat the strangers,4,1,Parascondola,YsiF8uxqJFU,0.8,2018-01-21 16:49:11,True,True
2018-01-24T03:40:21,Who shit there pants watching this but laughed at the end,1,0,skating pigs dylan,YsiF8uxqJFU,0.24999999999999997,2018-01-24 03:40:21,True,True
2018-01-24T05:22:05,"Why are the views for this trailer so low? This movie deserves ""The  Conjuring"" and ""IT"" promotion.",0,0,All Melanin,YsiF8uxqJFU,0.0,2018-01-24 05:22:05,True,True
2018-01-24T16:23:04,Was this sort of based of the Charles Manson killings?,0,1,Serenity Joy,YsiF8uxqJFU,0.0,2018-01-24 16:23:04,True,True
2018-01-25T07:01:30,I'll watch it just to see Joan kick some ass.,0,0,Unownshipper,YsiF8uxqJFU,0.0,2018-01-25 07:01:30,True,True
2018-01-25T19:41:01,This mix everything,0,0,lynie blue,YsiF8uxqJFU,0.0,2018-01-25 19:41:01,True,True
2018-01-25T21:28:47,"I'd be fine with the movie if they didn't consistently lie about  it's ""Based On True Events"" Lol specially since the first one was painfully boring.",0,0,Angel Urbano,YsiF8uxqJFU,0.20340136054421767,2018-01-25 21:28:47,True,True
2018-01-26T01:31:27,It does have a 80s sequel feeling. Almost Halloween 4  with a young girl being chased.,0,0,Carlos Rocha,YsiF8uxqJFU,0.1,2018-01-26 01:31:27,True,True
2018-01-27T03:28:03,After 10 years its gon hold up seems promising,0,0,BAKED PRUNES,YsiF8uxqJFU,0.2,2018-01-27 03:28:03,True,True
2018-01-28T18:30:34,When does it come out,0,1,Jennifer Lemus,YsiF8uxqJFU,0.0,2018-01-28 18:30:34,True,True
2018-01-29T00:45:29,This film is going be good then two people.   I like this one cause it’s a family,0,0,Montrell Wallace,YsiF8uxqJFU,0.7,2018-01-29 00:45:29,True,True
2018-01-29T01:48:22,1 Eternity Later      Is Tamara home?,0,0,Peter Productions,YsiF8uxqJFU,0.0,2018-01-29 01:48:22,True,True
2018-01-29T03:51:58,Duuuuude i watched the first movie on high school ( im glad i took english 😂) im soooo hyped ive been waiting since 2009 and honestly looks pretty good.,1,0,Annapaula Vejares,YsiF8uxqJFU,0.3514285714285714,2018-01-29 03:51:58,True,True
2018-01-29T21:50:19,"""This movie looks so bad!"" Me: 0:28",2,1,Technickal,YsiF8uxqJFU,-0.8749999999999998,2018-01-29 21:50:19,True,True
2018-01-30T01:33:08,Why would you answer the door?,0,1,karen daley,YsiF8uxqJFU,0.0,2018-01-30 01:33:08,True,True
2018-01-30T01:34:07,These people should be grabbing cleaning stuff like sprays that they can spray into peoples eyes,4,0,karen daley,YsiF8uxqJFU,0.0,2018-01-30 01:34:07,True,True
2018-01-30T10:06:21,"Damn, this looks pretty good",0,0,Rust T,YsiF8uxqJFU,0.475,2018-01-30 10:06:21,True,True
2018-01-30T21:55:13,Super hyped about this waited years for it,0,0,Haise,YsiF8uxqJFU,0.3333333333333333,2018-01-30 21:55:13,True,True
2018-01-31T05:48:03,Yeeeeeeeeeesssssss!!!!!!!!!!!,0,0,Kris Hilton,YsiF8uxqJFU,0.0,2018-01-31 05:48:03,True,True
2018-01-31T05:56:46,who else came to find out the music XD,0,0,leaned Angle,YsiF8uxqJFU,0.0,2018-01-31 05:56:46,True,True
2018-01-31T07:38:17,It took 10 years to make a sequel,0,0,seahawkfan1995,YsiF8uxqJFU,0.0,2018-01-31 07:38:17,True,True
2018-01-31T23:53:10,I always wondered why doll face asked for Someone named Tamara when she’s not even in the movie . It’s so useless,0,0,Sandra Islas,YsiF8uxqJFU,-0.5,2018-01-31 23:53:10,True,True
2018-02-01T03:40:41,Hmmm i really hope this isnt like The Hangover series where its the same exact things happening in different locations 😑,0,0,OLED FYR,YsiF8uxqJFU,0.1125,2018-02-01 03:40:41,True,True
2018-02-01T20:50:02,"Wait...WHAT!!!! This movie is going to be out 2 days before my 11th birthday,can you extend the time to March 11th please because my birthday is In March 11th",0,0,Luis Lazo The OOF,YsiF8uxqJFU,0.0,2018-02-01 20:50:02,True,True
2018-02-02T02:56:34,Can someone please explain to me who Tamara is,5,7,Keaton Chesnut,YsiF8uxqJFU,0.0,2018-02-02 02:56:34,True,True
2018-02-02T03:28:06,I love the music soundtrack tiffany- i think we're alone now,1,0,Monamour,YsiF8uxqJFU,0.5,2018-02-02 03:28:06,True,True
2018-02-02T13:59:37,I thought this time it was gonna be easier,0,0,Mental Ward,YsiF8uxqJFU,0.0,2018-02-02 13:59:37,True,True
2018-02-02T21:02:27,Finallllllllllllllyyy been years ..,0,0,Denise Johnson,YsiF8uxqJFU,0.0,2018-02-02 21:02:27,True,True
2018-02-03T06:33:16,That song is perfect. EOS.,0,1,Hannah Flo,YsiF8uxqJFU,1.0,2018-02-03 06:33:16,True,True
2018-02-03T09:23:40,stupid,0,0,Bratislav Metulski,YsiF8uxqJFU,-0.7999999999999999,2018-02-03 09:23:40,True,True
2018-02-03T12:00:09,"The acting in this trailer bothers me. I'm also dreading the notion that they are going to turn this into a Friday the 13th esque slasher romp, because the first film was a gritty down to earth home invasion thriller grounded in reality. They'd better not turn the killers into supernatural beings, in which case this movie is not worth my time.",0,0,Twitch-102,YsiF8uxqJFU,0.07638888888888888,2018-02-03 12:00:09,True,True
