timestamp,text,like_count,reply_count,author,trailer_id,sentiment_score,datetime,used_for_model,used_for_visualization
2018-02-03T19:06:40,How am I just seeing this trailer now?!,0,0,FlawlessKevin,YsiF8uxqJFU,0.0,2018-02-03 19:06:40,True,True
2018-02-04T00:38:05,*cool*,0,0,DoubleM2016,YsiF8uxqJFU,0.35,2018-02-04 00:38:05,True,True
2018-02-04T07:07:58,"Can't people just work, go home, & eat a TV dinner these days?  Doggone!  Life gets all so creepy!  I love it!",1,0,Thomas Outt,YsiF8uxqJFU,0.0,2018-02-04 07:07:58,True,True
2018-02-04T23:04:58,"""Based on a true story"". That phrase was a load of cap for the first movie, and the same applies to this one.",0,0,Aaron Jensen,YsiF8uxqJFU,0.19999999999999998,2018-02-04 23:04:58,True,True
2018-02-04T23:05:02,"""Based on a true story"". That phrase was a load of cap for the first movie, and the same applies to this one.",0,0,Aaron Jensen,YsiF8uxqJFU,0.19999999999999998,2018-02-04 23:05:02,True,True
2018-02-05T15:08:13,I don’t understand why people in these types of movies can’t carry a handgun.so easy to shoot these crazy people,2,0,Mr. Lucky,YsiF8uxqJFU,-0.08333333333333331,2018-02-05 15:08:13,True,True
2018-02-05T15:49:46,This trailer has a completely different tone than the first movie had. Not sure how I feel about it.,0,0,Steven Laudisi,YsiF8uxqJFU,0.0,2018-02-05 15:49:46,True,True
2018-02-06T08:58:25,I'm actually looking forward to this. I didn't like the 1st one I honestly thought it was terrible but I'm so hyped about this.,0,0,Eleanor Lopez,YsiF8uxqJFU,-0.13333333333333333,2018-02-06 08:58:25,True,True
2018-02-07T14:25:23,best part 1:06,4,0,Matti,YsiF8uxqJFU,1.0,2018-02-07 14:25:23,True,True
2018-02-07T16:26:57,She's always looking for Tamara!!!,2,1,The Greek Pianist,YsiF8uxqJFU,0.0,2018-02-07 16:26:57,True,True
2018-02-07T17:34:33,Wizards of Waverly place fam where y’all at,13,0,Wilson Neal,YsiF8uxqJFU,0.0,2018-02-07 17:34:33,True,True
2018-02-08T21:53:25,"My Friend Dahmer was phenomenal in my opinion, this comes out next month, and Halloween comes out in October!! So stoked.. not gonna lie I was disappointed in IT remake",0,2,Killer Kontext 23,YsiF8uxqJFU,-0.08333333333333333,2018-02-08 21:53:25,True,True
2018-02-10T10:42:37,Tamara is a girl they tried to kill many years ago but got away.  She may actually show up in this film.,19,1,Ron Miles,YsiF8uxqJFU,0.25,2018-02-10 10:42:37,True,True
2018-02-12T06:50:24,I watched the first one back in 2008 and it scared the hell out of me. I’m definitely looking forward to this one!,0,0,RiotnRespect,YsiF8uxqJFU,0.08333333333333333,2018-02-12 06:50:24,True,True
2018-02-12T13:36:14,#1 horror in ph... :),0,0,Prince Christian,YsiF8uxqJFU,0.5,2018-02-12 13:36:14,True,True
2018-02-13T10:24:48,What is this film about I couldn't really tell lol,0,2,HOPE Venom,YsiF8uxqJFU,0.5,2018-02-13 10:24:48,True,True
2018-02-13T18:53:55,The mother dies in the restroom I bet 💀,0,0,Lalo Ceja,YsiF8uxqJFU,0.0,2018-02-13 18:53:55,True,True
2018-02-14T23:50:21,Honey noooooooo😑😲😨😨😨💀💀💀💀💀,0,0,Johana Ruiz,YsiF8uxqJFU,0.0,2018-02-14 23:50:21,True,True
2018-02-15T03:40:17,I hope its as good as the first😭,0,0,LIT EDITZ,YsiF8uxqJFU,0.7,2018-02-15 03:40:17,True,True
2018-02-15T04:04:07,Movie is gonna be lit af!,0,0,E Smith,YsiF8uxqJFU,0.0,2018-02-15 04:04:07,True,True
2018-02-15T06:05:02,Nice. Several years later they release what looks to be a near identical movie with a few slight alterations.,0,0,Michael McKinney,YsiF8uxqJFU,0.055555555555555546,2018-02-15 06:05:02,True,True
2018-02-15T22:46:27,Loved the original but...a trailer? Really? Something about that doesn't seem scary at all.,0,0,Aunty Ro Knows,YsiF8uxqJFU,0.19374999999999998,2018-02-15 22:46:27,True,True
2018-02-16T02:56:44,a total fail by casting that chick straght up[,1,0,ricardo flores,YsiF8uxqJFU,-0.25,2018-02-16 02:56:44,True,True
2018-02-16T14:46:43,Based on True Events?!,0,1,LoganHex,YsiF8uxqJFU,0.4375,2018-02-16 14:46:43,True,True
2018-02-17T03:26:00,They look like a fun bunch,0,0,The guy with no second to last middle name,YsiF8uxqJFU,0.3,2018-02-17 03:26:00,True,True
2018-02-17T23:38:14,I cant believe its been 10 long years before they pulled this one out.,0,0,SP,YsiF8uxqJFU,-0.05,2018-02-17 23:38:14,True,True
2018-02-19T17:39:14,It might be boring because it took them a while to make this movie just like with jeeper creepers 3,1,0,Jake mIKe,YsiF8uxqJFU,-1.0,2018-02-19 17:39:14,True,True
2018-02-20T04:53:38,BUT WHYYYY DID THEY TAKE SO LOOONG !!,0,0,Nicki Minaj,YsiF8uxqJFU,0.0,2018-02-20 04:53:38,True,True
2018-02-20T22:40:47,So F$$king Hype,0,0,Kenshin,YsiF8uxqJFU,0.0,2018-02-20 22:40:47,True,True
2018-02-21T04:16:01,Looks epic. Loved the first one.,0,0,RetroLightz,YsiF8uxqJFU,0.3499999999999999,2018-02-21 04:16:01,True,True
2018-02-22T00:12:22,Finally,0,0,Erika Xx,YsiF8uxqJFU,0.0,2018-02-22 00:12:22,True,True
2018-02-22T19:32:38,O H M Y G O D T H E R E S A B A N G A T T H E D O O R,0,0,J3 Omega,YsiF8uxqJFU,0.0,2018-02-22 19:32:38,True,True
2018-02-23T06:25:40,"Finally!!! Sequel i hope, since the first one left us with a cliffhanger. But at least, it isn't PG-13.",0,0,Ashley B,YsiF8uxqJFU,-0.012499999999999997,2018-02-23 06:25:40,True,True
2018-02-23T10:18:21,If the strangers die ima be pist...,0,0,uneasy easysleep,YsiF8uxqJFU,0.0,2018-02-23 10:18:21,True,True
2018-02-23T19:52:05,The audio on this trailer is fucking perfect. Looove when they go in the pool.,2,0,Chris Bailey,YsiF8uxqJFU,1.0,2018-02-23 19:52:05,True,True
2018-02-23T20:13:50,Can’t wait !,0,0,Andrew bell,YsiF8uxqJFU,0.0,2018-02-23 20:13:50,True,True
2018-02-24T01:23:29,Why couldn't he space his words when he says what the hell?,0,0,Frozen Carbone,YsiF8uxqJFU,0.0,2018-02-24 01:23:29,True,True
2018-02-24T01:32:57,"My name is Tamara 😵 geehz the first one scared me silly, NOW this one literally says my name lol",0,0,XxTamaraXx,YsiF8uxqJFU,0.18333333333333335,2018-02-24 01:32:57,True,True
2018-02-24T04:29:24,Bailee Madison might be a final girl !!!!!!,1,0,Larry_16 B3N,YsiF8uxqJFU,0.0,2018-02-24 04:29:24,True,True
2018-02-24T10:50:17,"I can't wait for this movie. I've waited for a sequel ever since I've watched ""The Strangers"" in 2008",0,0,Yvan Flores,YsiF8uxqJFU,0.0,2018-02-24 10:50:17,True,True
2018-02-24T10:55:59,I am waiting for this since 9 years,1,1,mohamed ali,YsiF8uxqJFU,0.0,2018-02-24 10:55:59,True,True
2018-02-24T21:43:28,Looks really terrible. First was phenomenal.,1,3,J,YsiF8uxqJFU,-0.08333333333333333,2018-02-24 21:43:28,True,True
2018-02-25T04:38:35,Love the strangers,0,0,Monica Jennings,YsiF8uxqJFU,0.5,2018-02-25 04:38:35,True,True
2018-02-25T04:39:55,㊗️💔,0,0,Monica Jennings,YsiF8uxqJFU,0.0,2018-02-25 04:39:55,True,True
2018-02-25T05:29:05,Song: I think we're alone now,3,0,Cow Potato milk,YsiF8uxqJFU,0.0,2018-02-25 05:29:05,True,True
2018-02-25T05:38:44,🇰🇷🇯🇵🇯🇵🎌,0,0,Monica Jennings,YsiF8uxqJFU,0.0,2018-02-25 05:38:44,True,True
2018-02-25T15:59:49,I think we’re alone now NOPE!!!,1,0,Monica Jennings,YsiF8uxqJFU,0.0,2018-02-25 15:59:49,True,True
2018-02-25T19:46:23,Finally after 10 Years!,0,0,julian mujica,YsiF8uxqJFU,0.0,2018-02-25 19:46:23,True,True
2018-02-26T01:32:03,"""Oh my god, there's a bang at the door!""",0,0,Puck,YsiF8uxqJFU,0.0,2018-02-26 01:32:03,True,True
2018-02-26T03:15:39,I just hope the people actually put up more of a fight this time,1,0,Carr Buckets,YsiF8uxqJFU,0.25,2018-02-26 03:15:39,True,True
2018-02-26T13:11:35,"I already saw this movie, it was terrifying and so scary  with lots of jumpscares.",2,0,Kawhi MVPLeonard,YsiF8uxqJFU,-0.75,2018-02-26 13:11:35,True,True
2018-02-26T20:46:44,Is this a spin off of the purge?,0,0,Zoft,YsiF8uxqJFU,0.0,2018-02-26 20:46:44,True,True
2018-02-27T01:53:09,Plz say that that u r joking about the true events,0,2,David Alfaro,YsiF8uxqJFU,0.35,2018-02-27 01:53:09,True,True
2018-02-28T01:29:00,I can't wait for this movie!!!!!!!!,0,0,gloria lopez,YsiF8uxqJFU,0.0,2018-02-28 01:29:00,True,True
2018-02-28T07:53:42,Who is the teen actor who plays one of the killers?????,0,0,Done With you,YsiF8uxqJFU,0.0,2018-02-28 07:53:42,True,True
2018-02-28T17:46:09,"wow, looks like proper shit. waited 10 years for an over the top, cheap, campy teen flick spinoff sequel. pass",1,1,Necro,YsiF8uxqJFU,0.13333333333333333,2018-02-28 17:46:09,True,True
2018-03-01T00:55:36,I think we're allon know,0,0,Juan r Hurtado,YsiF8uxqJFU,0.0,2018-03-01 00:55:36,True,True
2018-03-02T03:23:17,Oh my god there's a bang at the door!,0,0,Not Big Boss,YsiF8uxqJFU,0.0,2018-03-02 03:23:17,False,True
2018-03-03T03:22:44,My teacher told me about this,0,0,Liz,YsiF8uxqJFU,0.0,2018-03-03 03:22:44,False,True
2018-03-03T06:03:55,"The first one was absolutely perfect. Hopefully, the sequel doesn't ruin it, but it looks good",0,1,jase276,YsiF8uxqJFU,0.65,2018-03-03 06:03:55,False,True
2018-03-03T16:12:43,Omg my great great grandmother had that happen to her and her family.......,2,0,Molly Mc,YsiF8uxqJFU,0.8,2018-03-03 16:12:43,False,True
2018-03-03T16:38:28,"""Oh my god there's a bang at the door!"" Part 2",0,0,mtrupert,YsiF8uxqJFU,0.0,2018-03-03 16:38:28,False,True
2018-03-03T19:42:54,another movie of senseless killing where probably the bad guys win again... same boring stuff,0,0,Noel Robles,YsiF8uxqJFU,-0.22499999999999995,2018-03-03 19:42:54,False,True
2018-03-03T20:57:24,1:06 totally copying fast and furious,0,0,Jonny games,YsiF8uxqJFU,0.1,2018-03-03 20:57:24,False,True
2018-03-04T00:18:32,My theatre doesn't have showtimes for this,0,1,Vinsmoke Gaming,YsiF8uxqJFU,0.0,2018-03-04 00:18:32,False,True
2018-03-04T01:05:49,............popcorn time..............,0,0,webnet15,YsiF8uxqJFU,0.0,2018-03-04 01:05:49,False,True
2018-03-04T01:23:58,"DAMN, I CAN'T WAIT FOR IT ANYMOOORE",0,0,Not a Short Girl,YsiF8uxqJFU,0.0,2018-03-04 01:23:58,False,True
2018-03-04T03:32:30,Just watched it! Soo good.,2,0,Lucifer Morningstar,YsiF8uxqJFU,0.7,2018-03-04 03:32:30,False,True
2018-03-04T05:56:44,1:21 It's based on true events! 🐙,1,2,That one Fan,YsiF8uxqJFU,0.4375,2018-03-04 05:56:44,False,True
2018-03-04T17:23:50,Sorry 😐 No barefoot Liv Tyler here. I think I’ll pass.,0,0,jim68,YsiF8uxqJFU,-0.5,2018-03-04 17:23:50,False,True
2018-03-05T19:06:29,Just be a home once Tamara!,0,0,HittingBongs,YsiF8uxqJFU,0.0,2018-03-05 19:06:29,False,True
2018-03-06T01:34:32,Reminds of courage the cowardly dog,0,0,i like cheese,YsiF8uxqJFU,0.0,2018-03-06 01:34:32,False,True
2018-03-06T02:14:20,Anyone watching Monday night Raw too ??,0,0,Emre Türkmen,YsiF8uxqJFU,-0.23076923076923078,2018-03-06 02:14:20,False,True
2018-03-06T18:18:17,this movie looks nothing compared to the first one,1,0,nikeairjordanfly,YsiF8uxqJFU,0.25,2018-03-06 18:18:17,False,True
2018-03-06T19:15:57,Tamara hurry home ffs,0,0,Rev,YsiF8uxqJFU,0.0,2018-03-06 19:15:57,False,True
2018-03-07T00:20:22,Tamara must owe her money ...,0,0,Charles Bracewell,YsiF8uxqJFU,0.0,2018-03-07 00:20:22,False,True
2018-03-07T03:03:02,Can't wait,0,0,Ama Leota,YsiF8uxqJFU,0.0,2018-03-07 03:03:02,False,True
2018-03-07T09:54:28,doom copyright: fight like hell,0,0,Ante Mitrović,YsiF8uxqJFU,0.0,2018-03-07 09:54:28,False,True
2018-03-07T14:05:20,This looks good,0,0,Jamarious #Branch,YsiF8uxqJFU,0.7,2018-03-07 14:05:20,False,True
2018-03-08T02:35:38,Tamara is the smartest woman in horror history by never coming home lmao 😂 Strangers number 1 rule buy a house but don't live in it lol.,16,0,FREE Will Dummies!,YsiF8uxqJFU,0.5121212121212121,2018-03-08 02:35:38,False,True
2018-03-08T04:31:05,The Strangers has been my hands down favorite movie since I watched it in theaters. and I'm a horror movie fanatic so that should say something lol but GOD DAMN I know this is going to be as great as the first one. still freaking out over this lol I'm always worried about sequels for certain movies but this actually looks GOOD. can't say that about a lot of any movies,0,0,Catsoverhumans,YsiF8uxqJFU,0.3608730158730159,2018-03-08 04:31:05,False,True
2018-03-08T04:32:37,that beginning looks a lot like Silent Hill. love it.,0,0,Catsoverhumans,YsiF8uxqJFU,0.25,2018-03-08 04:32:37,False,True
2018-03-08T14:38:09,Umm excuse me where is liv Tyler?,0,0,Anna O'Brien,YsiF8uxqJFU,-0.05,2018-03-08 14:38:09,False,True
2018-03-08T17:34:58,I can’t stop watching this trailer lol,0,0,Ivan Alcorchas,YsiF8uxqJFU,0.8,2018-03-08 17:34:58,False,True
2018-03-08T18:55:53,Based on True events?,0,0,jrs,YsiF8uxqJFU,0.35,2018-03-08 18:55:53,False,True
2018-03-08T20:40:15,OH MY GOD THERE'S A BANG AT THE DOOR,0,0,Big Frog,YsiF8uxqJFU,0.0,2018-03-08 20:40:15,False,True
2018-03-08T20:42:16,"It’s REALLY bad guys, avoid at all costs. It’s really not worth your time.",0,0,Kix Musaid,YsiF8uxqJFU,-0.42499999999999993,2018-03-08 20:42:16,False,True
2018-03-08T22:11:24,How is this based on a true event,0,0,Chris Sloan,YsiF8uxqJFU,0.35,2018-03-08 22:11:24,False,True
2018-03-08T23:51:53,This isn’t how I thought The Wizards Of Waverly Place reunion would go!,0,0,Wilson Neal,YsiF8uxqJFU,0.0,2018-03-08 23:51:53,False,True
2018-03-09T01:05:14,Christina Hendricks was killed off so quickly. Like literally within the first half hour,0,0,RajaMCool,YsiF8uxqJFU,0.05416666666666666,2018-03-09 01:05:14,False,True
2018-03-09T01:05:29,Christina Hendricks was killed off so quickly. Like literally within the first half hour,0,8,RajaMCool,YsiF8uxqJFU,0.05416666666666666,2018-03-09 01:05:29,False,True
2018-03-09T01:40:26,Going to see it tomorrow after school. SO EXCITED,0,0,Anna Massey,YsiF8uxqJFU,0.375,2018-03-09 01:40:26,False,True
2018-03-09T02:38:51,I just saw this tonight. There were a few solid jumpy moments but for the most part I was sorely disappointed. The first film had such an isolated and ominous feel to it and you really did feel a sense of hopelessness and terror. This one hardly captured any of that. Nothing about it felt like this could be me just minding my own business by myself one night. I think I'll just continue enjoying the first one and pretend like this never happened.,0,0,Broncster33,YsiF8uxqJFU,0.09621212121212121,2018-03-09 02:38:51,False,True
2018-03-09T09:38:25,I hope they will killed the mask killers this time!! For revenge!,3,1,Elwin C,YsiF8uxqJFU,-0.390625,2018-03-09 09:38:25,False,True
2018-03-09T14:20:54,"the legacy of the killers is over , they got killed LOL , hopefully they make one between the first one and this one , they had to be more victims imo or perhaps make one with copycats",0,0,Villanelle,YsiF8uxqJFU,0.3375,2018-03-09 14:20:54,False,True
2018-03-09T23:14:34,"When the trailer ended I ran out of my room because I heard the floor creek, it was just my dad",0,0,Dante Corrado,YsiF8uxqJFU,0.0,2018-03-09 23:14:34,False,True
2018-03-10T00:45:11,I don't know how many times their gonna try to make a remake of the same movie. It's getting old now,0,0,Rabbit PackCheese,YsiF8uxqJFU,0.19999999999999998,2018-03-10 00:45:11,False,True
2018-03-10T02:15:32,"i was hoping this movie would be good but it was pretty generic and disappointing overall, wait for the blu-ray or redbox instead",0,0,Shoe3003,YsiF8uxqJFU,0.06999999999999999,2018-03-10 02:15:32,False,True
2018-03-10T03:12:14,Seen it today hella trash,0,0,Jaylene Barraza,YsiF8uxqJFU,0.0,2018-03-10 03:12:14,False,True
2018-03-10T03:34:34,goood movie!!!!! 🎥 🍿,1,0,Anastasia Rose,YsiF8uxqJFU,0.0,2018-03-10 03:34:34,False,True
2018-03-10T03:46:58,I just watched it it was amazing,1,0,A_Dumpster_Bin _,YsiF8uxqJFU,0.6000000000000001,2018-03-10 03:46:58,False,True
2018-03-10T04:37:17,Good movie,1,0,CAS R4E,YsiF8uxqJFU,0.7,2018-03-10 04:37:17,False,True
2018-03-10T05:24:51,"I just watched it , and it was good but the ending was not making the cut",1,1,칠ᴄʜɪᴍᴄʜɪᴍ,YsiF8uxqJFU,0.7,2018-03-10 05:24:51,False,True
2018-03-10T05:53:05,I went to see it today it was garbage😂😂😂don't waste your money guys,1,0,Yvñg HonchØ,YsiF8uxqJFU,-0.2,2018-03-10 05:53:05,False,True
2018-03-10T07:20:54,"This movie was a waste of $17.55 and my time.  I recommend not seeing it, it was irritating to watch how people react so poorly to a crisis.  Even people with the littlest knowledge of self defense tactics could’ve at least fought off these predators.",0,1,Luke,YsiF8uxqJFU,-0.325,2018-03-10 07:20:54,False,True
2018-03-10T08:27:32,"Just came back from seeing it. Awesome movie, crowd was chanting every time a “Stranger” died",17,3,Alon,YsiF8uxqJFU,0.5,2018-03-10 08:27:32,False,True
2018-03-10T18:13:18,Saw this movie last night. It was so amazing,2,0,Madison Martin,YsiF8uxqJFU,0.30000000000000004,2018-03-10 18:13:18,False,True
2018-03-10T19:10:00,That teenage girl was in haunting hour I'm never gonna drop that lol,0,0,Strong Cat 04,YsiF8uxqJFU,0.4,2018-03-10 19:10:00,False,True
2018-03-10T20:35:57,"You know, it’s sad that the trailer is better than the movie itself.",2,0,Thejetlifejd,YsiF8uxqJFU,0.0,2018-03-10 20:35:57,False,True
2018-03-10T20:54:58,my mom wants me to go see the moive with her but am haveing 2nd thoughts O-O,0,0,xx_theynothing _xx,YsiF8uxqJFU,0.1,2018-03-10 20:54:58,False,True
2018-03-11T00:03:17,I watched this on Friday love the pool scene,16,0,Mactav 141,YsiF8uxqJFU,0.5,2018-03-11 00:03:17,False,True
2018-03-11T00:29:30,THIS MOVIE WAS SPAGHETTI I JUST WACHED IT ITS THE MOST SPAGHETTI THING EVER,1,0,"More than, just a dream",YsiF8uxqJFU,0.5,2018-03-11 00:29:30,False,True
2018-03-11T05:33:38,ITS OUT OMFG,0,0,Smooch,YsiF8uxqJFU,0.0,2018-03-11 05:33:38,False,True
2018-03-11T13:55:58,what a bored movie...........omg,0,0,Miki PL Mikinski,YsiF8uxqJFU,-0.5,2018-03-11 13:55:58,False,True
2018-03-11T16:14:21,Why is Tamara never home,0,0,Slothers,YsiF8uxqJFU,0.0,2018-03-11 16:14:21,False,True
2018-03-11T18:44:44,One of the worst stupid movies I ever saw ...,0,0,Adrian Echim,YsiF8uxqJFU,-0.8999999999999999,2018-03-11 18:44:44,False,True
2018-03-11T18:50:31,THIS SHITS SCARY,1,0,qxeenofcorpus adams,YsiF8uxqJFU,-0.5,2018-03-11 18:50:31,False,True
2018-03-11T19:33:04,What's queef?,0,0,MegaBubba22,YsiF8uxqJFU,0.0,2018-03-11 19:33:04,False,True
2018-03-11T19:56:46,What does it mean by based on true events,0,2,Joey Gomez,YsiF8uxqJFU,0.01874999999999999,2018-03-11 19:56:46,False,True
2018-03-11T19:57:18,Like did this actually happen in real life,0,0,Joey Gomez,YsiF8uxqJFU,0.1,2018-03-11 19:57:18,False,True
2018-03-11T22:35:11,This movie sucked,0,0,Spicy Garlic,YsiF8uxqJFU,0.0,2018-03-11 22:35:11,False,True
2018-03-12T04:42:58,I’m sorry but whoever thinks this movie sucked must don’t know REAL horror films! THIS MOVIE WAS GOOD ASF!!! 🙌🏽🙌🏽🙌🏽 it gave me old horror movie vibes how they used to make it. It was so SCARY 😩🔥🔥🔥🔥 being the fact how realistic the movie really is. Things like this really happens to people out there. it’s a 10 for me 👏🏽👏🏽👏🏽👏🏽,65,9,Val Maciej,YsiF8uxqJFU,0.11458333333333331,2018-03-12 04:42:58,False,True
2018-03-12T12:43:20,Lets hope this movie isn't just filled with 4th wall scares like the last one,0,0,CowQueen,YsiF8uxqJFU,0.2,2018-03-12 12:43:20,False,True
2018-03-12T14:50:05,"She's always asking if Tamara is home, but Tamara never asks if Dollface is home ;(",0,0,Saladnoodle,YsiF8uxqJFU,0.0,2018-03-12 14:50:05,False,True
2018-03-12T23:35:42,I heard of all the bad reviews and I am a huge horror fan so I was excited to see this! Just saw it and I really enjoyed it! Would change a few things but overall it was so badass. 8/10,0,0,Alexis Garcia,YsiF8uxqJFU,0.09895833333333337,2018-03-12 23:35:42,False,True
2018-03-13T00:40:12,This is my favorite movie,0,0,Lxtinadolll,YsiF8uxqJFU,0.5,2018-03-13 00:40:12,False,True
2018-03-13T01:50:27,"Did anyone catch this movie and if so, is it good? Skeptical about seeing it since being throughly disappointed with insidious even though one has nothing to do with the other lol",0,0,Gigi Chesley,YsiF8uxqJFU,0.025,2018-03-13 01:50:27,False,True
2018-03-13T03:44:36,Who knew a Tiffany song would be used in a horror slasher film in 2018,0,0,Gerson Monroy,YsiF8uxqJFU,0.0,2018-03-13 03:44:36,False,True
2018-03-14T00:33:59,Anyone know a website i can watch this online no download,0,0,Kate Montesinos,YsiF8uxqJFU,0.0,2018-03-14 00:33:59,False,True
2018-03-14T02:42:28,"If you like movies where people don't know how to defend themselves, they run and don't fight, loud crying and useless screaming to give away position, but stays silent when you need to get attention, then this is the movie for u... Thumbs down..",0,0,ᏢᏓᏥ ᎤᏍᏗ,YsiF8uxqJFU,-0.1511111111111111,2018-03-14 02:42:28,False,True
2018-03-14T13:15:01,"First one was stupid, this one will be stupid. I mean, if they would've stayed holed-up in that backroom they could've just blown anyone away if they came in the room. But after he killed his friend, they went retarded and sentimental 😂.",0,0,Jayce Dylan,YsiF8uxqJFU,-0.41607142857142854,2018-03-14 13:15:01,False,True
2018-03-14T14:34:52,"Movie was awesome,",0,0,Alex 252525,YsiF8uxqJFU,1.0,2018-03-14 14:34:52,False,True
2018-03-14T21:06:59,George Ezra's new album has a new meaning now,0,0,kain,YsiF8uxqJFU,0.13636363636363635,2018-03-14 21:06:59,False,True
2018-03-15T04:40:19,So this is base off true events?,0,0,Theemikebell,YsiF8uxqJFU,-0.22500000000000003,2018-03-15 04:40:19,False,True
2018-03-15T07:09:47,This film was so good :D I really loved it,2,0,Máté Kárpáti,YsiF8uxqJFU,0.7999999999999999,2018-03-15 07:09:47,False,True
2018-03-15T08:21:53,"almost shat my pants when i saw ""based on true events""",1,0,Hansini Jhowry,YsiF8uxqJFU,0.35,2018-03-15 08:21:53,False,True
2018-03-15T12:09:50,"oh yeah, this is why I saw the everything wrong with strangers",0,0,ciscoisaboss,YsiF8uxqJFU,-0.5,2018-03-15 12:09:50,False,True
2018-03-15T15:49:25,I watched this movie at the cineplex yesterday✨😍,0,0,xo. kaifa,YsiF8uxqJFU,0.0,2018-03-15 15:49:25,False,True
2018-03-16T19:46:31,https://www.amazon.com/NO-LIVES-MATTER-Slasher-Story/dp/1549871404,0,0,Zuko Sabello,YsiF8uxqJFU,0.0,2018-03-16 19:46:31,False,True
2018-03-16T22:43:15,Yes go to a house in the middle of nowhere Seems about white,0,0,Jason Lifeshow,YsiF8uxqJFU,0.0,2018-03-16 22:43:15,False,True
2018-03-17T01:14:24,Is this the purge or wat,1,0,Ashlee Quinonez,YsiF8uxqJFU,0.0,2018-03-17 01:14:24,False,True
2018-03-17T11:27:59,"Just saw it, was as good as the first one, maybe better. They did a great job with it.",1,0,jmgmarcus,YsiF8uxqJFU,0.5625,2018-03-17 11:27:59,False,True
2018-03-17T20:10:24,Wow looks creepy... Tiffany’s I Think We’re Alone Now,1,0,Jose Cardenas,YsiF8uxqJFU,-0.2,2018-03-17 20:10:24,False,True
2018-03-18T01:35:41,This is based on true events...,0,0,The Secret Life of Becca,YsiF8uxqJFU,0.35,2018-03-18 01:35:41,False,True
2018-03-18T02:19:35,"I watched (I’m 10) it was awesome, and scary!",0,0,Weird Alien,YsiF8uxqJFU,0.1875,2018-03-18 02:19:35,False,True
2018-03-18T03:57:52,Fuckn sucks,0,0,cris Noname,YsiF8uxqJFU,-0.3,2018-03-18 03:57:52,False,True
2018-03-18T04:01:20,Super amazing...just went to see it...they will come out with a 3rd one ...,0,0,Nermin Besic,YsiF8uxqJFU,0.16666666666666666,2018-03-18 04:01:20,False,True
2018-03-18T15:43:39,I would like to say my name is Tamra😂😂😂,0,0,Tamra Kojic,YsiF8uxqJFU,0.0,2018-03-18 15:43:39,False,True
2018-03-18T22:30:44,Is TAMARA home .....?,0,0,"Marilyn Monroe Official Channel, by Peter Sneyder",YsiF8uxqJFU,0.0,2018-03-18 22:30:44,False,True
2018-03-19T02:11:46,That movie was so damn good.,0,0,Timothy Roberson,YsiF8uxqJFU,0.7,2018-03-19 02:11:46,False,True
2018-03-20T07:19:14,Pure kino,0,0,X,YsiF8uxqJFU,0.21428571428571427,2018-03-20 07:19:14,False,True
2018-03-20T13:55:18,Who da F is tamara?,0,0,fluffy onija,YsiF8uxqJFU,0.0,2018-03-20 13:55:18,False,True
2018-03-21T00:55:08,Looks uninteresting. IMO,0,0,Carlos Garcia,YsiF8uxqJFU,0.0,2018-03-21 00:55:08,False,True
2018-03-21T05:33:36,The movie was WACK ASF,0,0,Ihateboys,YsiF8uxqJFU,0.0,2018-03-21 05:33:36,False,True
2018-03-22T02:35:19,I love the way the trailer was edited an I cannot wait to see this .👍,0,0,Breanna Calvin,YsiF8uxqJFU,0.5,2018-03-22 02:35:19,False,True
2018-03-22T05:39:24,Did this movie remind anyone else of the Call of Duty Zombies with the clowns?,0,0,no_ricers allowed,YsiF8uxqJFU,0.0,2018-03-22 05:39:24,False,True
2018-03-22T15:15:32,We’re can I watch this,0,0,Chloe May,YsiF8uxqJFU,0.0,2018-03-22 15:15:32,False,True
2018-03-24T19:50:19,It's so good I just saw it,0,0,Fluffykins Gaming,YsiF8uxqJFU,0.7,2018-03-24 19:50:19,False,True
2018-03-25T08:38:05,Tamara is,0,0,SIRAPORN APAISILA,YsiF8uxqJFU,0.0,2018-03-25 08:38:05,False,True
2018-03-25T15:36:45,yall this came out on my birthday 💀😭,0,0,Kristin Taylor,YsiF8uxqJFU,0.0,2018-03-25 15:36:45,False,True
2018-03-25T15:46:58,Saw this last night and genuinely enjoyed it,0,0,Cuchullain O'connor,YsiF8uxqJFU,0.25,2018-03-25 15:46:58,False,True
2018-03-26T21:01:32,So is this movie any good? I don’t wanna waste my money but it also looks really good.,0,2,___ dee,YsiF8uxqJFU,0.39999999999999997,2018-03-26 21:01:32,False,True
2018-03-28T19:05:09,Great Song choice,0,0,Dee Jaaye,YsiF8uxqJFU,0.8,2018-03-28 19:05:09,False,True
2018-03-31T00:59:21,"very atmospheric movie, like Lewis Pullham very much also.",0,0,derek222888,YsiF8uxqJFU,0.13,2018-03-31 00:59:21,False,True
2018-04-01T03:03:59,Leave us alone   But this is my hobbie 🔪🔪🔪🔪🔪,1,0,I have to wait 90 days to change my name,YsiF8uxqJFU,0.0,2018-04-01 03:03:59,False,True
2018-04-01T20:13:23,Is that a remake?! It’s looks the same as first chapter!,0,0,Robert Semjonov,YsiF8uxqJFU,0.15625,2018-04-01 20:13:23,False,True
2018-04-02T19:09:42,"Saw it today, it was AMAZING!!!!",0,0,Gxd,YsiF8uxqJFU,1.0,2018-04-02 19:09:42,False,True
2018-04-03T22:20:45,Is this movie rated r?,0,0,Shinigami :3,YsiF8uxqJFU,0.0,2018-04-03 22:20:45,False,True
2018-04-05T00:03:31,"""Based on true events"" hahahahahahahhahahhahahhahaahhhahahahahahahahhahahahaha",0,0,Ratata!,YsiF8uxqJFU,0.35,2018-04-05 00:03:31,False,True
