timestamp,text,like_count,reply_count,author,trailer_id,sentiment_score,datetime,used_for_model,used_for_visualization
2019-04-25T07:03:04,"2 things. 1 this movie is great, one of the best ones ive seen. 2. Be careful, things happened to me and my family after watching it. The movie has the doors’ break on through to the other side as the soundtrack. A few days after watching it, me and my older brother were hanging out in the living room next to my parents room. Out of nowhere, the stereo from their room turned on with that song full volume. Mind you this had never happened before and it was nightime. Me and mu brother just looked at each other without knowing what to say. Then my brother went in to the room, super scared of course and turned it on. So yeah it was pretty frightening experience. Have read about 2 other people whove had paranormal experiences as well after watching this movie",0,1,B Gomez,YWDM_p68HAQ,0.1326923076923077,2019-04-25 07:03:04,False,False
2019-04-28T22:48:57,انه فلم خايس زي وجيهكم  😂😂😂🐐.,1,3,F .19,YWDM_p68HAQ,0.0,2019-04-28 22:48:57,False,False
2019-05-27T05:29:47,2019 ?,2,0,Rita Wati Marbun,YWDM_p68HAQ,0.0,2019-05-27 05:29:47,False,False
2019-06-23T01:25:44,iactually thought that this was inspired by the game evil within,1,0,Serah Oerba,YWDM_p68HAQ,-0.7,2019-06-23 01:25:44,False,False
2019-07-01T11:27:38,Ima like it... now its a hunt down....,0,0,HansumRob100,YWDM_p68HAQ,-0.15555555555555559,2019-07-01 11:27:38,False,False
2019-07-11T05:04:23,Its 1am...Thought i was about to actually watch this whole trailer... dumb me...,1,0,chris lloyd,YWDM_p68HAQ,-0.05833333333333333,2019-07-11 05:04:23,False,False
2019-07-14T01:21:57,Amazing Actor Eric,0,0,AGM 95,YWDM_p68HAQ,0.6000000000000001,2019-07-14 01:21:57,False,False
2019-08-21T19:21:14,It is by far the  best horror movie ever with the best story line and the exorcism sence was the best I hv ever seen in any movie,1,0,positivity forever,YWDM_p68HAQ,0.775,2019-08-21 19:21:14,False,False
2019-08-28T00:00:42,Yo it's him the real hulk,0,0,KING RUHUL,YWDM_p68HAQ,0.2,2019-08-28 00:00:42,False,False
2019-08-29T21:20:31,"Ugh....if I had bones, they'd be chillin'",1,0,William afton. exe,YWDM_p68HAQ,0.0,2019-08-29 21:20:31,False,False
2019-09-14T23:49:49,The second film isn't as good.,0,0,Ben L,YWDM_p68HAQ,0.35,2019-09-14 23:49:49,False,False
2019-10-04T22:19:57,"This is a terrible trailer. Doesn't explain anything. Has a generic, cliché, creepy ""monster in the bedroom"" moment. No context, no hinting at what the movie is really about.",0,0,John Jay,YWDM_p68HAQ,-0.325,2019-10-04 22:19:57,False,False
2019-10-25T13:54:43,Hulk.,0,0,Nafiz A.,YWDM_p68HAQ,0.0,2019-10-25 13:54:43,False,False
2019-10-27T05:41:17,Great movie one of my favourites far too underrated dough!!!!!!!!,2,0,Eoin Whitehead,YWDM_p68HAQ,0.6980232238769531,2019-10-27 05:41:17,False,False
2019-10-30T15:46:28,HA HA HOO!!,0,0,JW Studio,YWDM_p68HAQ,0.0,2019-10-30 15:46:28,False,False
2019-11-03T23:02:28,Pleaaaaaaase subsribe me,0,0,وصفات وافكار مريومة,YWDM_p68HAQ,0.0,2019-11-03 23:02:28,False,False
2019-11-04T16:31:38,شفته قبل سنتين رائع الفلم  ونصح بلمشاهده💙👍,2,0,roba Turk,YWDM_p68HAQ,0.0,2019-11-04 16:31:38,False,False
2019-11-07T16:17:57,Ralph sarchie now has his own paranormal show on destination unknown called the demon files.. highly recommended!!,1,0,Shannon james,YWDM_p68HAQ,0.25,2019-11-07 16:17:57,False,False
2019-11-07T22:17:26,Is this worth watching?,0,1,Samantha Fernando,YWDM_p68HAQ,0.3,2019-11-07 22:17:26,False,False
2019-11-09T05:45:20,How did anyone like this movie lol it's 2 out of 10 for me,0,0,A,YWDM_p68HAQ,0.8,2019-11-09 05:45:20,False,False
2019-12-22T13:32:00,"Super underrated, great as hell. Intense af, the exorcism is crazy. Ps. Will and always will remember the fallen soldier, Butler.",16,0,S.cat.Y Yong,YWDM_p68HAQ,0.18333333333333332,2019-12-22 13:32:00,False,False
2019-12-29T14:38:38,i love horor,0,0,Sul sul,YWDM_p68HAQ,0.5,2019-12-29 14:38:38,False,False
2020-01-05T13:55:44,Another boring exorcist movie... Good horror movies are rare these days. Hereditary was one of them,0,0,MrPhantom95,YWDM_p68HAQ,-1.850371707708594e-17,2020-01-05 13:55:44,False,False
2020-01-18T16:48:12,Amazing movie watch it!!!,0,1,Paokara paok,YWDM_p68HAQ,1.0,2020-01-18 16:48:12,False,False
2020-01-30T05:15:09,Delivery me a blunt,0,0,Rigo Valero,YWDM_p68HAQ,0.0,2020-01-30 05:15:09,False,False
2020-02-02T23:13:11,If you think About watching this movie: Save two Hours of your life and spend them on something fun. Maybe 5 minutes of actual good Scenes in a puddle of garbage acting.,0,0,LichtdesMorgens,YWDM_p68HAQ,0.25,2020-02-02 23:13:11,False,False
2020-02-05T10:45:10,"The critics, as usual, did not like this film. This is usually a good sign the film is very good. Thank you critics! You bums!",3,0,ashika1009,YWDM_p68HAQ,0.48333333333333334,2020-02-05 10:45:10,False,False
2020-02-05T10:45:33,Plus Olivia Mun is hot!,0,0,ashika1009,YWDM_p68HAQ,0.3125,2020-02-05 10:45:33,False,False
2020-02-05T10:46:47,"Olivia Munn, that is.",0,0,ashika1009,YWDM_p68HAQ,0.0,2020-02-05 10:46:47,False,False
2020-02-10T16:11:42,"I live for the scene where the crazy lady goes ""specalist"" really creepily like oml yes",1,2,Tae's Winter Bear,YWDM_p68HAQ,-0.3212121212121212,2020-02-10 16:11:42,False,False
2020-02-15T12:04:27,"Was this not promoted properly or something? Right up my street, and I've never heard of it until I saw it was on the Horror Channel tonight. Have taken a chance and bought the blu ray. Looking forward to seeing it.",0,0,metaldaduk,YWDM_p68HAQ,0.14285714285714285,2020-02-15 12:04:27,False,False
2020-02-15T20:08:46,Wow this was best horor movie i ever seen.,0,0,Mr Tm,YWDM_p68HAQ,0.55,2020-02-15 20:08:46,False,False
2020-02-15T22:36:21,Im watching this now on horror channel now not bad but live every possession movies ive watched even though its dated they are not a patch on the exorcist,0,0,Dawn Finch,YWDM_p68HAQ,0.24318181818181814,2020-02-15 22:36:21,False,False
2020-03-13T09:51:06,The Father is lit!,0,0,Jr Beauty,YWDM_p68HAQ,0.0,2020-03-13 09:51:06,False,False
2020-03-13T10:20:16,"Its as if 150,000 alter boys where had by 3000 priests and 221,740 parishes all came in delight.",0,0,way2jaded1,YWDM_p68HAQ,0.0,2020-03-13 10:20:16,False,False
2020-03-23T20:34:53,Devil. Deliver Us From Evil. My brain Dufe,2,0,N1KK3L,YWDM_p68HAQ,-1.0,2020-03-23 20:34:53,False,False
2020-03-24T19:48:56,do we die from this?,1,0,The Unforgiven,YWDM_p68HAQ,0.0,2020-03-24 19:48:56,False,False
2020-03-30T08:31:41,Good movie.  Worth a Bo Peep.,0,0,CMT Combat Muay Thai,YWDM_p68HAQ,0.5,2020-03-30 08:31:41,False,False
2020-04-01T19:50:23,Finally! A real trailer!,0,0,dee hernandez,YWDM_p68HAQ,0.25,2020-04-01 19:50:23,False,False
2020-04-11T23:24:00,For kids: The Babadook (2014) 👎🏻💩  For real horror lovers... Deliver Us From Evil (2014) 😈,0,0,DJ M1NDHACK3R,YWDM_p68HAQ,-0.4,2020-04-11 23:24:00,False,False
2020-04-12T13:39:20,Best horror movie ever made. Eric Bana deserved an Oscar for this.,0,0,SealAngel,YWDM_p68HAQ,1.0,2020-04-12 13:39:20,False,False
2020-04-30T19:44:24,Just watched it because eric bana was in it. this movie is so underrated. I dont  blink watching the entire movie. My heart was pounding in few scenes where sarchie seems as if he will be possessed. worth of my two hours of  sleeping,0,0,NUR AMIRA ZULKIFLLI,YWDM_p68HAQ,0.033333333333333326,2020-04-30 19:44:24,False,False
2020-05-02T18:05:22,"Half-Copycat!! This movie violated the  Copyrights from  the best  ever  number 1 movie.:""The Exorcist""   Shame on you! And the situation happened in  South America by a Jesuit Priest (real).  Iraq the same beginning, flash scenes similar in the Kitchen  (The Exorcist). The stairs.....etc...a compilation of stolen ideas..Similar faces from Lady Gaga,  chair shivering from The exorcist original.",0,1,Fernando António,YWDM_p68HAQ,0.315,2020-05-02 18:05:22,False,False
2020-05-03T07:03:02,I highly recommend this. Deep and scary. Not your typical horror movie.,0,0,rhoda torio,YWDM_p68HAQ,-0.12666666666666665,2020-05-03 07:03:02,False,False
2020-05-03T07:27:19,"This is the kind of movie that would make you finish it until the very end. Truly engaging. Suspense, deep and scary in a good way. Love it.👌",1,0,rhoda torio,YWDM_p68HAQ,0.27142857142857146,2020-05-03 07:27:19,False,False
2020-05-17T00:25:26,"Just came across this movie again on Netflix. Really enjoyed it its a solid 9/10 for a horror movie. I thought Eric and his cop partner the priest and possessed lady all preformed brilliantly. Very creepy, the new york cop attending a domestic and walking into something supernatural was a great story line. Loved the bit at the zoo that was pretty creepy",1,0,mythic marshadow,YWDM_p68HAQ,0.1403030303030303,2020-05-17 00:25:26,False,False
2020-05-27T17:41:44,Deliver us from Corona.,0,0,A I,YWDM_p68HAQ,0.0,2020-05-27 17:41:44,False,False
2020-06-03T02:11:12,Who else came here from tiktok,0,0,PG channel,YWDM_p68HAQ,0.0,2020-06-03 02:11:12,False,False
2020-06-14T18:11:38,"Second time watching this, it’s soooooo good!",0,0,Jeraldene Cooke,YWDM_p68HAQ,0.4375,2020-06-14 18:11:38,False,False
