timestamp,text,like_count,reply_count,author,trailer_id,sentiment_score,datetime,used_for_model,used_for_visualization
2014-03-07T17:29:05,from the director of sinister...then i must see this...,0,0,khadkazz,YWDM_p68HAQ,0.0,2014-03-07 17:29:05,True,True
2014-03-07T17:29:44,"First, lol xD",1,0,Frink77,YWDM_p68HAQ,0.525,2014-03-07 17:29:44,True,True
2014-03-07T17:31:02,First lol . Looks great . ,8,0,Daniel Hursey,YWDM_p68HAQ,0.6166666666666667,2014-03-07 17:31:02,True,True
2014-03-07T17:31:33,Is that Olivia Munn?,0,1,Ada Repli,YWDM_p68HAQ,0.0,2014-03-07 17:31:33,True,True
2014-03-07T17:32:23,"Sometimes trailers give away too much,this one did not give anything.",196,1,Thomas Parg,YWDM_p68HAQ,0.0,2014-03-07 17:32:23,True,True
2014-03-07T17:34:08,"im a fan of eric banner, ill keep an open mind about this one",3,1,SomeTotalRandom,YWDM_p68HAQ,-0.25,2014-03-07 17:34:08,True,True
2014-03-07T17:39:35,I mean when they buy her stuffed animals are they just like let's get her the creepiest stuff we can find?,7,0,Kalan Tackett,YWDM_p68HAQ,-0.3125,2014-03-07 17:39:35,True,True
2014-03-07T17:39:43,"as soon as i saw the title 'sinister' in it, my mind was already set. This is a must see",16,0,Jack Richard,YWDM_p68HAQ,-0.5,2014-03-07 17:39:43,True,True
2014-03-07T17:40:50,"You see the light above the little girl that goes out ? Shaped like a pentagon, that is NOT an accident.",0,0,organicsuperman,YWDM_p68HAQ,0.07083333333333335,2014-03-07 17:40:50,True,True
2014-03-07T17:41:21,"It looks like a awesome movie, but the trailer... not so much.",5,3,Kex A.,YWDM_p68HAQ,0.6,2014-03-07 17:41:21,True,True
2014-03-07T17:42:34,"You know why they keep making these scare movies, because they are really cheap (they don't do anything other than skew your perceptions) and make a fortune.",0,0,organicsuperman,YWDM_p68HAQ,0.1375,2014-03-07 17:42:34,True,True
2014-03-07T17:42:49,Great trailer. Doesnt give us the whole plot of the movie in the trailer. Now i wanna see it,2,0,Corey Boyd,YWDM_p68HAQ,0.5,2014-03-07 17:42:49,True,True
2014-03-07T17:43:39,Anyway they're messing with the hulk and that's something you just don't do. :-D,0,0,organicsuperman,YWDM_p68HAQ,1.0,2014-03-07 17:43:39,True,True
2014-03-07T17:44:17,i shit an actual brick guys. am i gonna be all right?,0,0,OPENFLESH,YWDM_p68HAQ,0.028571428571428564,2014-03-07 17:44:17,True,True
2014-03-07T17:50:00,It looks CREEPY!!! :-O ,0,0,Melissa,YWDM_p68HAQ,-0.46328125,2014-03-07 17:50:00,True,True
2014-03-07T17:53:52,"Olivia Munn is getting there, wish u stayed on attack of the show but life is life",6,1,Phinoxboi,YWDM_p68HAQ,0.0,2014-03-07 17:53:52,True,True
2014-03-07T17:54:08,"the story looks great. the trailer, not so much. still looking forward to it",0,0,Hanif Halimi,YWDM_p68HAQ,0.5,2014-03-07 17:54:08,True,True
2014-03-07T17:57:02,HECTORRRRRRRRRRRRRRRRR..... HECTORRRRRRRRRRRRRRRRRRRRRR.. HECTORRRRRRRRRRRRRRRRRRRRRR,90,4,Noakesunderscorey,YWDM_p68HAQ,0.0,2014-03-07 17:57:02,True,True
2014-03-07T17:59:01,great trailer and looks like a great movie.,49,0,Lirianus,YWDM_p68HAQ,0.8,2014-03-07 17:59:01,True,True
2014-03-07T18:05:45,"""inspired by the actual accounts"" ""based on a true story"" how much of the story is actually true? kinda tired of seeing that on trailers some are overly exaggerated why cant they just out right say these events in the movie are fake with that said hope the movie is entertaining",2,0,Good_Playlists,YWDM_p68HAQ,0.031746031746031744,2014-03-07 18:05:45,True,True
2014-03-07T18:06:25,Damn you know its gonna be good when its horror/thriller and you slap screengem at the start.,0,0,Elevator Doors,YWDM_p68HAQ,0.7,2014-03-07 18:06:25,True,True
2014-03-07T18:07:40,there is always something under the bed.  too many horror movies are made these days.,0,1,Vik Tik,YWDM_p68HAQ,0.5,2014-03-07 18:07:40,True,True
2014-03-07T18:11:57,He still cant do a good american accent haha. movie looks good though.,0,0,Mabbio,YWDM_p68HAQ,0.39999999999999997,2014-03-07 18:11:57,True,True
2014-03-07T18:12:35,So Jerry Buckheimer went from producing big ol box offices to horror? :O,0,1,EniPlays,YWDM_p68HAQ,0.025,2014-03-07 18:12:35,True,True
2014-03-07T18:20:06,"omg , i can wait to see that ",1,0,Raul Villalba,YWDM_p68HAQ,0.0,2014-03-07 18:20:06,True,True
2014-03-07T18:23:37,"Looks very interesting, I'm definitely gonna check this out. I love Horror movies, even the cheesy ones.",4,0,Michael Forte,YWDM_p68HAQ,0.16249999999999998,2014-03-07 18:23:37,True,True
2014-03-07T18:25:12,woah gonna watch this,1,0,matty sta teresa,YWDM_p68HAQ,0.0,2014-03-07 18:25:12,True,True
2014-03-07T18:29:36,Screen Gems + Horror Movies = some good shit,0,0,Setsuni,YWDM_p68HAQ,0.24999999999999997,2014-03-07 18:29:36,True,True
2014-03-07T18:30:17,This looks like a good movie. I always think why evil entities love slamming doors every where. All horror/scary/mystery movies have that.,45,2,Estivel Garcia,YWDM_p68HAQ,0.06666666666666665,2014-03-07 18:30:17,True,True
2014-03-07T18:39:22,"Honestly, Id go watch this, just to support Olivia Munn.",0,1,Vic Phan,YWDM_p68HAQ,0.6,2014-03-07 18:39:22,True,True
2014-03-07T18:41:47,Only Jesus can protect you from this,1,0,Say what ?,YWDM_p68HAQ,0.0,2014-03-07 18:41:47,True,True
2014-03-07T18:47:13,Good ,0,0,enigma307,YWDM_p68HAQ,0.7,2014-03-07 18:47:13,True,True
2014-03-07T19:00:14,JA JA JUUU!!! lol,1,0,markmgc,YWDM_p68HAQ,0.8,2014-03-07 19:00:14,True,True
2014-03-07T19:06:59,I bet he's going to turn into Hulk... lol jk,0,0,Redfield7492,YWDM_p68HAQ,0.8,2014-03-07 19:06:59,True,True
2014-03-07T19:08:53,"Wasn't fussed until i saw, ""from the director of sinister"".",1,0,sycliox vantage,YWDM_p68HAQ,-0.5,2014-03-07 19:08:53,True,True
2014-03-07T19:30:11,It was the owl all along!!!,0,0,Inari Fox,YWDM_p68HAQ,0.0,2014-03-07 19:30:11,True,True
2014-03-07T19:35:27,"sinister was one of best horror movies i have seen, waiting for this one eagerly..",7,0,Swapnil Jain,YWDM_p68HAQ,0.25,2014-03-07 19:35:27,True,True
2014-03-07T19:40:46,Deliver us from bad screenplays.,175,5,Tom J. McCoy,YWDM_p68HAQ,-0.6999999999999998,2014-03-07 19:40:46,True,True
2014-03-07T19:56:15,Kill it with FIRE..!!,4,0,Tijuana,YWDM_p68HAQ,0.0,2014-03-07 19:56:15,True,True
2014-03-07T19:58:10,Olivia Munn is a smoke,0,0,Flursh,YWDM_p68HAQ,0.0,2014-03-07 19:58:10,True,True
2014-03-07T20:02:18,that was a creepy ass trailer! ,1,0,Kacey M.,YWDM_p68HAQ,-0.625,2014-03-07 20:02:18,True,True
2014-03-07T20:03:47,shit freaked me out!,4,0,WIL SUPER,YWDM_p68HAQ,-0.25,2014-03-07 20:03:47,True,True
2014-03-07T20:07:34,"Very cool trailer, but a little revealing.",0,0,Dan Saillant,YWDM_p68HAQ,0.13374999999999998,2014-03-07 20:07:34,True,True
2014-03-07T20:19:32,Must see movie for me!,0,0,Spanky Man,YWDM_p68HAQ,0.0,2014-03-07 20:19:32,True,True
2014-03-07T20:21:33,"If this movie is anything like Sinister, then it's gonna be one of the better horror movies of the year for sure.",0,2,Aldo Raine,YWDM_p68HAQ,0.16666666666666666,2014-03-07 20:21:33,True,True
2014-03-07T20:34:57,Coming soon to people who have seen 90% of what their local Redbox offers!,0,0,TheGmoney4980,YWDM_p68HAQ,0.0625,2014-03-07 20:34:57,True,True
2014-03-07T20:37:49,Instant reaction 1 it time to move instant reac 2 sliding below over drop,0,0,Christopher Peoples,YWDM_p68HAQ,0.0,2014-03-07 20:37:49,True,True
2014-03-07T21:34:40,"Ah man, NO",0,0,EmLee Gee,YWDM_p68HAQ,0.0,2014-03-07 21:34:40,True,True
2014-03-07T21:51:21,"""inspired by the actual accounts of ..."". LOL, seriously? and what happened to bana's career? so sad.",14,4,beatniece,YWDM_p68HAQ,-0.008333333333333318,2014-03-07 21:51:21,True,True
2014-03-07T22:10:02,"Did you guys know that there are 2 ways to kill a ghost? #1 is use a vacuum, that mother F will not know what absorbed him..!! & #2 my all time FAV :), If the ghost does not want to live your house you can kill him by catching your house on fire then he will die. Or as I like to put it  KILL IT WITH FIRE..!!",9,4,Tijuana,YWDM_p68HAQ,0.4068560606060606,2014-03-07 22:10:02,True,True
2014-03-07T22:40:32,"From the true story of... bla bla bla. Should be from the point of view of one guy you dont know, but that sounds cool enough to make another good vs evil movie. I got a friend that while drunk, think he saw something strange in the dark... should we make a move out of it ?",0,0,Guillaume Parola,YWDM_p68HAQ,-0.037500000000000006,2014-03-07 22:40:32,True,True
2014-03-07T22:58:04,ooohhh shit!!!,0,0,FourSixEleven,YWDM_p68HAQ,-0.390625,2014-03-07 22:58:04,True,True
2014-03-07T23:38:33,looks good,0,0,ZigMatador,YWDM_p68HAQ,0.7,2014-03-07 23:38:33,True,True
2014-03-08T00:33:10,director of sinister makes me think this is gonna be good,40,2,Dan Mcgill,YWDM_p68HAQ,0.09999999999999998,2014-03-08 00:33:10,True,True
2014-03-08T01:01:08,uau !!!,0,0,Luis Couto,YWDM_p68HAQ,0.0,2014-03-08 01:01:08,True,True
2014-03-08T01:25:32,Toto asi nebude pohádka na dobrou noc ;),2,0,Přemysl Vaculík,YWDM_p68HAQ,0.25,2014-03-08 01:25:32,True,True
2014-03-08T02:15:31,That is an incredibly boring trailer!,0,0,Jeff Hollis,YWDM_p68HAQ,-1.0,2014-03-08 02:15:31,True,True
2014-03-08T02:47:56,"If Eric Bananna is in it, it must be sweet..",2,2,Michael P. Shipley,YWDM_p68HAQ,0.35,2014-03-08 02:47:56,True,True
2014-03-08T03:17:28,finally....a trailer that doesn't reveal everything about the movie!!!,250,2,Tim Summers,YWDM_p68HAQ,0.0,2014-03-08 03:17:28,True,True
2014-03-08T04:33:38,Dat was creepy,0,0,_Chri$_,YWDM_p68HAQ,-0.5,2014-03-08 04:33:38,True,True
2014-03-08T05:05:15,"Love the Sinister, hope this will Deliver us the scares.",0,0,Gee - an,YWDM_p68HAQ,0.0,2014-03-08 05:05:15,True,True
2014-03-08T05:44:36,"This trailer was garbage, I expect more... ",10,2,bibby42,YWDM_p68HAQ,0.5,2014-03-08 05:44:36,True,True
2014-03-08T06:46:12,"Hm, trailer wasn't the typical generic garbage for a horror movie and genuinely made me more interested, since it didn't give away the entire movie.",0,0,bud389,YWDM_p68HAQ,0.1638888888888889,2014-03-08 06:46:12,True,True
2014-03-08T09:07:35,let see.looks good.,2,0,Satyajit Mukherjee,YWDM_p68HAQ,0.7,2014-03-08 09:07:35,True,True
2014-03-08T09:52:40,Hmm...,0,0,FAREEZ,YWDM_p68HAQ,0.0,2014-03-08 09:52:40,True,True
2014-03-08T10:38:03,"holy fuk, i'm out",0,0,Quan Le,YWDM_p68HAQ,0.0,2014-03-08 10:38:03,True,True
2014-03-08T11:25:18,"The ""Creepy / suspense / ghost / demon / completely bloodless / long waits for tiny payoff / loud soundtrack noises that the characters can't actually hear but the audience can, to remind them they should be scared"" genre continues. Hooray.",5,0,MainlineDnB,YWDM_p68HAQ,-0.05833333333333333,2014-03-08 11:25:18,True,True
2014-03-08T12:37:59,"If this was inspired by a true story from a NYPD cop, then I'd like to say that there should be more psychological testing before actually letting people like this carry guns for a living.",13,3,JackDagnaIs,YWDM_p68HAQ,0.2125,2014-03-08 12:37:59,True,True
2014-03-08T14:19:39,Banana! Long time no see...,14,0,Polina T,YWDM_p68HAQ,-0.05,2014-03-08 14:19:39,True,True
2014-03-08T16:28:28,HA HA HOO,0,0,Sidy Baldé,YWDM_p68HAQ,0.0,2014-03-08 16:28:28,True,True
2014-03-08T16:43:19,"this is gonna be good guys, Scott Derrickson is a genius",0,0,Julian Schreiner,YWDM_p68HAQ,0.7,2014-03-08 16:43:19,True,True
2014-03-08T17:37:53,C-R-A-P!!!!!!!!,0,0,ebuz218,YWDM_p68HAQ,0.0,2014-03-08 17:37:53,True,True
2014-03-09T01:40:58,they couldn't of added anything else to the trailer???? Kind of lame tbh.,0,0,KateBushStan,YWDM_p68HAQ,0.04999999999999999,2014-03-09 01:40:58,True,True
2014-03-09T08:19:37,Deliver me a pizza,452,5,Nick MF,YWDM_p68HAQ,0.0,2014-03-09 08:19:37,True,True
2014-03-09T16:08:17,This is a movie trailer calm down with the comments,0,0,BigJ361,YWDM_p68HAQ,0.07222222222222223,2014-03-09 16:08:17,True,True
2014-03-09T17:45:04,Cliche? Yes.  Still scary? Yes.,0,0,DaLeadBull,YWDM_p68HAQ,-0.5,2014-03-09 17:45:04,True,True
2014-03-10T03:44:04,"Note to self: When you see a mutilated corpse slithering on your daughter's bed, it's probably time to move to a new house.",475,0,KuzuRanger,YWDM_p68HAQ,0.13636363636363635,2014-03-10 03:44:04,True,True
2014-03-10T05:11:04,Creepy...,0,0,Mar78 Andres,YWDM_p68HAQ,-0.5,2014-03-10 05:11:04,True,True
2014-03-10T07:21:04,HA HA HOOO ! HA HA HOOO !,0,0,Maisur,YWDM_p68HAQ,0.0,2014-03-10 07:21:04,True,True
2014-03-10T12:52:59,For once the ghost isn't a female with a tight black dress and dark dingy hair slithering in fast motion over the ceiling! ,115,1,Mountain Man,YWDM_p68HAQ,-0.04904761904761905,2014-03-10 12:52:59,True,True
2014-03-11T01:25:34,"c'mon, more like 'the conjuring 2'.",0,0,samir rashid,YWDM_p68HAQ,0.5,2014-03-11 01:25:34,True,True
2014-03-11T22:47:32,This little girl is such an impressive actress. But this movie looks way too scary. (I'm a baby ahh can't handle this crud I don't understand the appeal.) ,0,0,shaylen sanders,YWDM_p68HAQ,0.078125,2014-03-11 22:47:32,True,True
2014-03-13T01:18:27,Whoever doesn't want to watch this movie because of Olivia Munn likes pee pees.,0,0,China Teves,YWDM_p68HAQ,0.0,2014-03-13 01:18:27,True,True
2014-03-17T21:12:14,Neat: Olivia Munn. I'm glad she's still getting work; they rode her pretty hard for her less than ladylike behavior on The Man Show and The Daily Show.,1,0,Allen Harris,YWDM_p68HAQ,0.05833333333333333,2014-03-17 21:12:14,True,True
2014-03-21T16:14:58,Scaring us with loud noises? Classy!,1,0,WhiteScorpio2,YWDM_p68HAQ,0.1125,2014-03-21 16:14:58,True,True
2014-03-23T06:31:42,1:37 hahahahah that was funny ,0,1,Roberto Sá,YWDM_p68HAQ,0.25,2014-03-23 06:31:42,True,True
2014-03-27T00:36:58,Why did I wear headphones?!,0,0,Bryn Dawes,YWDM_p68HAQ,0.0,2014-03-27 00:36:58,True,True
2014-04-23T17:19:41,i hope this is real scary cause horror movies this days sucks..,28,0,mac edades,YWDM_p68HAQ,-0.525,2014-04-23 17:19:41,True,True
2014-04-24T22:47:29,"Ha ha hoo, you guys! Ha ha hoo, ha ha hoo!",0,0,oziumshift,YWDM_p68HAQ,0.0,2014-04-24 22:47:29,True,True
2014-04-27T21:43:29,"Holy crap, that loud boom and the thing in the mirror just about gave me a heart attack. (thanks headphones) ",0,0,Kelly Keaton,YWDM_p68HAQ,-0.16666666666666666,2014-04-27 21:43:29,True,True
2014-05-11T03:29:56,"The ""inspired by the actual accounts of NYPD sergeant Ralph Sarchie"" might not be that crazy and cliched. Possibly the movie is going to create a dilemma in Sarchie's character. Where he has to wonder if what he is seeing are just effects from some sort of Post Tramautic Stress Disorder (rolling up on brutal murder 0:15) OR if something Supernatural is truly going on...",0,0,Brian DelGiudice,YWDM_p68HAQ,-0.26166666666666666,2014-05-11 03:29:56,True,True
2014-05-11T19:28:25,Bodil ?,0,0,Christopher Scott,YWDM_p68HAQ,0.0,2014-05-11 19:28:25,True,True
2014-05-14T18:05:14,"i miss this kind of trailer. Half of all trailers i see now a days, let you see basically the entire movies in 5 minutes time.",46,0,Nillerzen,YWDM_p68HAQ,0.14444444444444446,2014-05-14 18:05:14,True,True
2014-05-15T00:35:24,ooohh... promising..,0,0,eunhaelova,YWDM_p68HAQ,0.2,2014-05-15 00:35:24,True,True
2014-05-18T02:38:48,"Schlock. Bana, wtf happened to you man? Surely can't need the money THAT bad.",0,0,joope zixzixzix,YWDM_p68HAQ,-0.23333333333333328,2014-05-18 02:38:48,True,True
2014-05-29T23:26:36,"What is ""true evil"" anyway?",0,1,Ted Arbury,YWDM_p68HAQ,-0.325,2014-05-29 23:26:36,True,True
2014-06-04T14:40:39,This looks creepy as hell!,9,0,Goku Super Saiyan,YWDM_p68HAQ,-0.625,2014-06-04 14:40:39,True,True
2014-06-11T23:33:08,GODDAMIT! - I'm counting each day to finally see this movie!...,1,0,2serveand2protect,YWDM_p68HAQ,0.0,2014-06-11 23:33:08,True,True
2014-06-21T22:34:08,HHAHAHAH oooooooOOOOOOOOooooooOOOOO HAHAHA OOOOOO,2,1,vvvortic wanna be gg,YWDM_p68HAQ,0.2,2014-06-21 22:34:08,True,True
2014-06-22T02:14:00,1:31 screw that owl toy,167,18,Senthuren Sivarupan,YWDM_p68HAQ,0.0,2014-06-22 02:14:00,True,True
2014-07-07T16:57:13,can anyone hear the monster's name at 2:48??? please tell me?,0,1,Lily Han,YWDM_p68HAQ,0.0,2014-07-07 16:57:13,False,True
2014-07-31T21:54:33,310714,0,0,R S Y Philadelphia,YWDM_p68HAQ,0.0,2014-07-31 21:54:33,False,True
2014-08-01T12:27:46,if you see a creepy guy stroking your daughter its probably time to get a gun license with a big arse gun.....,0,0,Harry Hughes,YWDM_p68HAQ,-0.25,2014-08-01 12:27:46,False,True
2014-08-16T05:09:51,this movie was pretty disappointing.  not scary... and didn't have a very logical or interesting plot.  not worth the money.  eric banna was quite distracting through out this movie with his european good looks !!,1,0,MiSenigmatic,YWDM_p68HAQ,0.19687500000000002,2014-08-16 05:09:51,False,True
2014-09-01T20:23:30,"the movie was geniussssss . this trailer is piece of cake , the movie is so scaryy will make u cry ",0,0,Gabi,YWDM_p68HAQ,0.0,2014-09-01 20:23:30,False,True
2014-09-18T06:40:54,"Here in Germany wh have many JIGSAWS, they are called as “Mr.EnglishPiggy”, “NorwichDiver”, "",""Long Island Crocodile"", ""Chihuahua Dwarf"", ""boxer from Cologne""or ""GermanMarlboroman""!! Their survival Parcours begins at the “Breitenauer Sea Heilbronn”, follows open prison system in Winnenden and ends up at “Lake of Fire in Stuttgart”, where the actuaries are waiting with the big insurance sums!!!! German woman love bounty hunters and have funny swimming parties with them!!",0,0,van Faircom Africa,YWDM_p68HAQ,0.1875,2014-09-18 06:40:54,False,True
2014-10-04T16:12:12,wow!!!,0,0,Bozenna Kwidzinska,YWDM_p68HAQ,0.1953125,2014-10-04 16:12:12,False,False
2014-10-14T21:54:28,hahhaou hahahou ,0,0,Saber boy,YWDM_p68HAQ,0.0,2014-10-14 21:54:28,False,False
2014-10-23T22:09:16,"No, I don't wanna watch it. Could you stop playing an ad without a skip option in every single video I watch? Thanks!",0,0,Alen Viana,YWDM_p68HAQ,0.08928571428571429,2014-10-23 22:09:16,False,False
2015-01-18T18:26:17,Best Hulk EVER !,18,0,FeeDie,YWDM_p68HAQ,1.0,2015-01-18 18:26:17,False,False
2015-11-13T19:28:01,te amo desde que bi tu vídeo me enamore de ti como te encuentro,0,0,Kering Olivares,YWDM_p68HAQ,0.0,2015-11-13 19:28:01,False,False
2015-11-14T12:31:06,that owl toy was scary at,0,0,Laura Bokrugji,YWDM_p68HAQ,-0.5,2015-11-14 12:31:06,False,False
2015-12-06T06:46:22,It's hard for me to not think of Eric Bana as anyone except Nero.,0,0,Kathy Odom,YWDM_p68HAQ,-0.2916666666666667,2015-12-06 06:46:22,False,False
2015-12-29T04:04:06,Dr.Strange is gonna be trippy as fuck:o,2,0,Mark Asher,YWDM_p68HAQ,0.0,2015-12-29 04:04:06,False,False
2016-05-19T06:23:26,is it good yea or no ????,0,3,Aaron from England,YWDM_p68HAQ,0.7,2016-05-19 06:23:26,False,False
2016-05-30T23:42:45,LOL 1:30 though.,3,0,JPG,YWDM_p68HAQ,0.8,2016-05-30 23:42:45,False,False
2016-10-11T06:05:37,Ha ha ho 8>,0,1,Konuz Benissa,YWDM_p68HAQ,0.0,2016-10-11 06:05:37,False,False
2016-11-15T11:27:11,"I'm curious why they chose to name this film after a 2006 documentary about the Catholic Church willingly covering up the rape & molestation of over 25 young children by one of their own priests (Oliver O'Grady). I certainly wouldn't want my film associated with such repugnance. I wonder how many unfortunate souls have tried to google this flick, only to end up face to face with that O'Grady monster.  (Not that I don't recommend watching the documentary. You should just know what you're getting into beforehand.)",4,0,PsyintZ,YWDM_p68HAQ,0.0886904761904762,2016-11-15 11:27:11,False,False
2016-11-21T20:13:28,"*They could of have someone better than Olivia Munn, someone hotter*",0,0,USA,YWDM_p68HAQ,0.5,2016-11-21 20:13:28,False,False
2017-02-03T03:01:53,"As he did with his earlier, better  ""Sinistre' film , the director rehashes some elements of ""Seven"", and the Exorcist, and  as with the latter film, even having the beginning scene take place in ( occupied) Iraq!. Kind of silly movie where demons hate electrical lights, dogs inexplicably come out of nowhere  and  we know that  because this is a mainstream jerry bruckheimer  film , the mom and daughter will survive at the end. In between Nautilus Plus workouts, the Corey Feldman lookalike protagonist barely manages the tough Irish Bronx, Gerald S. O'Loughlin accent.",0,0,End Wildlife Services'Needless Killing Of Wildlife,YWDM_p68HAQ,-0.11388888888888889,2017-02-03 03:01:53,False,False
2017-06-28T19:36:08,The movie is too long.,0,0,F dL,YWDM_p68HAQ,-0.05,2017-06-28 19:36:08,False,False
2017-08-11T20:44:33,It's the little girl from Ouija: Origin of Evil and Annabelle: Creation.,0,2,Daniel Selk,YWDM_p68HAQ,-0.59375,2017-08-11 20:44:33,False,False
2017-10-12T18:02:42,"The movie is ok, its more like a police thriller with horror elements.  If you expect to see a film loaded with jumpscares and a quick rythm this one will kinda dissappint you, the movie takes its time to develop the elements for the plot.",3,0,Chris Monvel,YWDM_p68HAQ,0.4444444444444444,2017-10-12 18:02:42,False,False
2018-02-01T19:30:35,last i checked the owl say Hoo Hoo not *haha hoo haha hoo*😂😂😂,0,0,ramin rastkhane,YWDM_p68HAQ,0.03333333333333333,2018-02-01 19:30:35,False,False
2018-02-12T13:54:38,Eric banner will always be Chopper to me,0,0,Icky Sludge,YWDM_p68HAQ,0.0,2018-02-12 13:54:38,False,False
2018-02-14T22:34:15,This film was great which is probably why it did badly on rotten tomatoes,136,3,Noggsy Joggsy,YWDM_p68HAQ,0.0500000000000001,2018-02-14 22:34:15,False,False
2018-03-13T21:46:51,The owl was really distracting,0,0,PsychoSam Productions,YWDM_p68HAQ,0.2,2018-03-13 21:46:51,False,False
2018-03-22T00:43:33,Underrated movies imo,1,0,max gee,YWDM_p68HAQ,0.0,2018-03-22 00:43:33,False,False
2018-04-21T04:07:48,Movie was film in the Bronx near my area I see Eric bana the whole crew and. Oliver munn,0,0,Nichole Ramnarine,YWDM_p68HAQ,0.15000000000000002,2018-04-21 04:07:48,False,False
2018-04-21T04:09:38,The house was night time filming is in my area the house them flim in,0,0,Nichole Ramnarine,YWDM_p68HAQ,0.0,2018-04-21 04:09:38,False,False
2018-05-06T00:48:14,WHY DORIS IS ALWAYS BEING HAUNTED,10,0,Sid Gabayno Jr,YWDM_p68HAQ,0.0,2018-05-06 00:48:14,False,False
2018-05-18T19:09:53,He's so gorgeous! I'm in love with him,7,0,Nerdy Witch,YWDM_p68HAQ,0.6875,2018-05-18 19:09:53,False,False
2018-06-21T08:41:20,Gonna watch this movie I know I’m really late,0,0,Nobody,YWDM_p68HAQ,-0.3,2018-06-21 08:41:20,False,False
2018-07-11T03:09:54,So curious... here it is four years later. How did this movie turn out? Was it good? Anyone see it?,0,0,2mwillis,YWDM_p68HAQ,0.19999999999999998,2018-07-11 03:09:54,False,False
2018-08-03T13:36:24,"Honestly, this is one of the best horror movies I've seen so far.",190,29,Julie Tearjerky,YWDM_p68HAQ,0.5666666666666668,2018-08-03 13:36:24,False,False
2018-09-25T21:20:33,I love so much 2.20!!!🇮🇹,1,0,Fred is aus the venision,YWDM_p68HAQ,0.35,2018-09-25 21:20:33,False,False
2018-10-22T10:54:12,ha ha hoo!,0,0,dante,YWDM_p68HAQ,0.0,2018-10-22 10:54:12,False,False
2018-10-26T16:55:42,Hahahoo... hahahoo..hahahoo...,0,0,Abhi,YWDM_p68HAQ,0.0,2018-10-26 16:55:42,False,False
2018-11-06T02:42:05,I watched this home alone it's middle of the night and I'm so terrified now,1,3,MMaya,YWDM_p68HAQ,0.0,2018-11-06 02:42:05,False,False
2018-11-07T20:55:19,That owl toy tho XD genious! Also there is a webkinz signature australian shepherd between all the stuffed animals :) never seen a webkinz in a horrormovie before LOL,0,0,TimberKinz94,YWDM_p68HAQ,0.43333333333333335,2018-11-07 20:55:19,False,False
2018-11-13T15:22:54,"Oops wrong video, was looking for bfmv",0,0,ÀẞẞHÔLË,YWDM_p68HAQ,-0.5,2018-11-13 15:22:54,False,False
2018-11-15T14:45:57,I've never understood the logic behind demons like if they truly wanted to dam a soul ... wouldn't they start killing everyone or get them to sin ... not scare the family ?,1,1,Callum Reid,YWDM_p68HAQ,-0.4,2018-11-15 14:45:57,False,False
2018-12-01T18:28:40,One of the scariest movies I've ever watched.,4,0,Boss Killa,YWDM_p68HAQ,0.0,2018-12-01 18:28:40,False,False
2019-01-29T23:27:35,That stuffed animal!!! I’m scared,1,0,The Great SteveO,YWDM_p68HAQ,0.0,2019-01-29 23:27:35,False,False
2019-02-22T19:41:32,This scared the hell out of me!!!,7,0,lynngroll1,YWDM_p68HAQ,0.0,2019-02-22 19:41:32,False,False
2019-03-10T18:29:44,Trailers great. Movie awful unfortunately,0,0,stirling,YWDM_p68HAQ,-0.2333333333333333,2019-03-10 18:29:44,False,False
2019-03-12T23:08:01,when I like a movie I always see it a second time. I have seen this movie 10 times ! its awesome!,7,2,Ναυσικα Δεληγιαννιδου,YWDM_p68HAQ,0.5,2019-03-12 23:08:01,False,False
2019-03-18T17:18:03,"Every horror movie blames women for evil.  Women bring men, evil, and also evil men into the world.",0,0,Jesus is Muslim,YWDM_p68HAQ,-1.0,2019-03-18 17:18:03,False,False
2019-03-29T04:42:18,Should I watch this at 1am? I dont think so,1,0,Arc Official,YWDM_p68HAQ,0.0,2019-03-29 04:42:18,False,False
2019-04-11T07:19:45,That small girl is from Annabelle 😅,0,0,Suman Bbxr,YWDM_p68HAQ,-0.25,2019-04-11 07:19:45,False,False
2019-04-16T00:39:48,"Hulk, that girl from ouija prequal and anabelle prequal, the host from attack the show, and the host from the soup in one movie...damm",1,0,MrFlipperInvader792,YWDM_p68HAQ,0.0,2019-04-16 00:39:48,False,False
